[32m[I 2023-05-02 01:36:24,456][0m Trial 11 finished with value: 100.0 and parameters: {'lr': 0.00014079593587714063, 'dropout': 0.5426283654901487, 'd_model_multiplier': 4, 'num_layers': 11, 'n_heads': 16, 'dim_feedforward': 510, 'batch_size': 190, 'pos_encoding': 'fixed', 'activation': 'relu', 'norm': 'LayerNorm', 'optimizer_name': 'AdamW', 'weight_decay': 0, 'top_n_features': 180}. Best is trial 0 with value: 0.23786523179607208.[0m
[FileBasedDataset] Initializing dataset...
	Examples: 8264
	Features: 163
	Max length: 315
Standard scalar turned ON, loading params from cache
[FileBasedDataset] Dataset initialization complete
  epoch    auprc    auroc    train_loss    valid_acc    valid_loss    cp      dur
-------  -------  -------  ------------  -----------  ------------  ----  -------
      1   [36m0.2084[0m   [32m0.7744[0m        [35m0.2834[0m       [31m0.9347[0m        [94m0.2083[0m     +  13.5689
      2   [36m0.2441[0m   [32m0.7807[0m        [35m0.2659[0m       0.9299        [94m0.2047[0m     +  13.8309
      3   0.2410   0.7787        [35m0.2577[0m       0.9347        0.2050        13.7485
      4   [36m0.2890[0m   0.7769        [35m0.2525[0m       0.9347        0.2147        13.6476
      5   [36m0.2961[0m   0.7640        [35m0.2504[0m       [31m0.9359[0m        0.2199        14.0498
      6   0.2877   0.7671        [35m0.2456[0m       0.9299        0.2309        13.7098
      7   0.2767   0.7748        0.2460       0.9323        0.2206        14.0188
      8   0.2902   0.7776        0.2473       0.9311        0.2179        13.6441
      9   [36m0.3318[0m   0.7770        [35m0.2418[0m       0.9347        0.2148        13.8344
     10   0.3090   0.7778        0.2426       0.9359        0.2246        13.3430
     11   0.2810   [32m0.7818[0m        0.2432       0.9347        0.2295        13.8615
Stopping since valid_loss has not improved in the last 10 epochs.
[32m[I 2023-05-02 01:39:10,103][0m Trial 12 finished with value: 0.20472501771481755 and parameters: {'lr': 0.0006421562791202884, 'dropout': 0.5404054976182464, 'd_model_multiplier': 8, 'num_layers': 4, 'n_heads': 16, 'dim_feedforward': 433, 'batch_size': 57, 'pos_encoding': 'fixed', 'activation': 'relu', 'norm': 'LayerNorm', 'optimizer_name': 'AdamW', 'weight_decay': 0.01, 'top_n_features': 163}. Best is trial 12 with value: 0.20472501771481755.[0m
[FileBasedDataset] Initializing dataset...
	Examples: 8264
	Features: 203
	Max length: 315
Standard scalar turned ON, loading params from cache
[FileBasedDataset] Dataset initialization complete
  epoch    auprc    auroc    train_loss    valid_acc    valid_loss    cp      dur
-------  -------  -------  ------------  -----------  ------------  ----  -------
      1   [36m0.1807[0m   [32m0.7099[0m        [35m0.3424[0m       [31m0.9166[0m        [94m0.2476[0m     +  16.4277
      2   [36m0.1869[0m   0.7043        [35m0.2686[0m       0.9117        0.2496        17.3551
      3   [36m0.2000[0m   [32m0.7108[0m        [35m0.2619[0m       0.8863        0.2748        17.4788
      4   0.1849   0.6958        0.2684       0.8972        0.2665        16.9023
      5   0.1880   0.6960        [35m0.2591[0m       [31m0.9226[0m        0.2544        17.1736
      6   0.1895   0.6963        [35m0.2591[0m       0.9214        0.2623        17.1750
      7   0.1942   0.6978        0.2597       0.9226        0.2575        18.2060
      8   0.1911   0.6928        0.2597       0.9214        0.2638        17.3117
      9   0.1828   0.6889        [35m0.2583[0m       [31m0.9287[0m        0.2742        17.3130
     10   0.1897   0.6931        [35m0.2561[0m       0.9287        0.2770        18.0364
Stopping since valid_loss has not improved in the last 10 epochs.
[32m[I 2023-05-02 01:42:21,650][0m Trial 13 finished with value: 0.2476065330919072 and parameters: {'lr': 0.0030907563506036456, 'dropout': 0.6138464349326367, 'd_model_multiplier': 8, 'num_layers': 4, 'n_heads': 16, 'dim_feedforward': 426, 'batch_size': 188, 'pos_encoding': 'fixed', 'activation': 'relu', 'norm': 'LayerNorm', 'optimizer_name': 'AdamW', 'weight_decay': 0.001, 'top_n_features': 203}. Best is trial 12 with value: 0.20472501771481755.[0m
[FileBasedDataset] Initializing dataset...
	Examples: 8264
	Features: 152
	Max length: 315
Standard scalar turned ON, loading params from cache
[FileBasedDataset] Dataset initialization complete
  epoch    auprc    auroc    train_loss    valid_acc    valid_loss    cp      dur
-------  -------  -------  ------------  -----------  ------------  ----  -------
      1   [36m0.0588[0m   [32m0.2871[0m        [35m0.5306[0m       [31m0.9202[0m        [94m0.3700[0m     +  14.0911
      2   [36m0.0824[0m   [32m0.4846[0m        [35m0.3366[0m       0.9202        [94m0.2985[0m     +  14.1702
      3   [36m0.1168[0m   [32m0.5877[0m        [35m0.2840[0m       0.9202        [94m0.2801[0m     +  14.2843
      4   [36m0.1476[0m   [32m0.6324[0m        [35m0.2693[0m       0.9202        [94m0.2721[0m     +  14.4005
      5   [36m0.1637[0m   [32m0.6550[0m        [35m0.2591[0m       0.9202        [94m0.2673[0m     +  14.4480
      6   [36m0.1712[0m   [32m0.6661[0m        [35m0.2578[0m       0.9202        [94m0.2649[0m     +  14.7128
      7   [36m0.1805[0m   [32m0.6750[0m        [35m0.2541[0m       0.9202        [94m0.2627[0m     +  14.7877
      8   [36m0.1877[0m   [32m0.6839[0m        [35m0.2513[0m       0.9202        [94m0.2609[0m     +  14.9232
      9   [36m0.1967[0m   [32m0.6930[0m        [35m0.2508[0m       0.9202        [94m0.2597[0m     +  14.8913
     10   [36m0.2038[0m   [32m0.7022[0m        [35m0.2483[0m       0.9202        [94m0.2582[0m     +  15.0810
     11   [36m0.2132[0m   [32m0.7074[0m        0.2495       0.9202        [94m0.2572[0m     +  14.6346
     12   [36m0.2190[0m   [32m0.7135[0m        0.2484       0.9202        [94m0.2559[0m     +  14.4052
     13   [36m0.2241[0m   [32m0.7186[0m        [35m0.2455[0m       0.9202        [94m0.2546[0m     +  14.4204
     14   [36m0.2318[0m   [32m0.7243[0m        0.2464       0.9202        [94m0.2539[0m     +  14.8783
     15   [36m0.2368[0m   [32m0.7292[0m        0.2464       0.9190        [94m0.2530[0m     +  14.8109
     16   [36m0.2412[0m   [32m0.7328[0m        [35m0.2446[0m       0.9190        [94m0.2517[0m     +  14.8159
     17   [36m0.2502[0m   [32m0.7376[0m        [35m0.2445[0m       0.9190        [94m0.2507[0m     +  14.1390
     18   [36m0.2517[0m   [32m0.7411[0m        [35m0.2435[0m       0.9190        [94m0.2502[0m     +  14.3283
     19   [36m0.2557[0m   [32m0.7451[0m        0.2441       0.9166        [94m0.2490[0m     +  14.5270
     20   [36m0.2590[0m   [32m0.7488[0m        [35m0.2428[0m       0.9166        [94m0.2489[0m     +  14.4807
     21   [36m0.2592[0m   [32m0.7513[0m        [35m0.2420[0m       0.9166        [94m0.2483[0m     +  15.0650
     22   [36m0.2615[0m   [32m0.7532[0m        [35m0.2412[0m       0.9154        [94m0.2482[0m     +  14.6316
     23   [36m0.2642[0m   [32m0.7567[0m        [35m0.2386[0m       0.9154        0.2486        15.1155
     24   [36m0.2650[0m   [32m0.7592[0m        0.2388       0.9154        [94m0.2469[0m     +  14.7558
     25   [36m0.2660[0m   [32m0.7603[0m        [35m0.2382[0m       0.9141        0.2478        14.6398
     26   [36m0.2683[0m   [32m0.7627[0m        [35m0.2381[0m       0.9154        0.2471        14.8285
     27   [36m0.2697[0m   [32m0.7646[0m        0.2381       0.9178        0.2473        14.5636
     28   [36m0.2709[0m   [32m0.7666[0m        0.2384       0.9166        0.2471        14.9440
     29   [36m0.2724[0m   [32m0.7687[0m        [35m0.2378[0m       0.9154        0.2473        15.0873
     30   [36m0.2735[0m   [32m0.7692[0m        [35m0.2357[0m       0.9141        0.2482        15.0074
     31   [36m0.2737[0m   [32m0.7708[0m        [35m0.2356[0m       0.9141        0.2480        14.8793
     32   [36m0.2750[0m   [32m0.7718[0m        [35m0.2343[0m       0.9141        0.2490        15.0392
     33   0.2726   [32m0.7724[0m        0.2346       0.9166        0.2493        14.4513
Stopping since valid_loss has not improved in the last 10 epochs.
[32m[I 2023-05-02 01:50:41,186][0m Trial 14 finished with value: 0.24686951351497308 and parameters: {'lr': 2.016117105172039e-05, 'dropout': 0.5470647742171013, 'd_model_multiplier': 8, 'num_layers': 3, 'n_heads': 16, 'dim_feedforward': 271, 'batch_size': 176, 'pos_encoding': 'fixed', 'activation': 'relu', 'norm': 'LayerNorm', 'optimizer_name': 'AdamW', 'weight_decay': 0.01, 'top_n_features': 152}. Best is trial 12 with value: 0.20472501771481755.[0m
[FileBasedDataset] Initializing dataset...
	Examples: 8264
	Features: 72
	Max length: 315
Standard scalar turned ON, loading params from cache
[FileBasedDataset] Dataset initialization complete
  epoch    auprc    auroc    train_loss    valid_acc    valid_loss    cp      dur
-------  -------  -------  ------------  -----------  ------------  ----  -------
      1   [36m0.2656[0m   [32m0.7368[0m        [35m0.3105[0m       [31m0.9045[0m        [94m0.3994[0m     +  17.5142
      2   [36m0.2663[0m   0.7323        [35m0.2710[0m       0.9045        0.4172        17.3284
      3   0.2647   [32m0.7433[0m        [35m0.2665[0m       0.9045        [94m0.3649[0m     +  17.5422
      4   0.2602   0.7346        [35m0.2596[0m       0.9033        0.3990        17.6325
      5   [36m0.2669[0m   0.7372        [35m0.2578[0m       0.9033        0.3910        17.7616
      6   [36m0.2674[0m   0.7379        0.2627       0.9045        [94m0.3579[0m     +  17.8001
      7   0.2647   0.7331        [35m0.2540[0m       0.9033        0.3650        17.8075
      8   0.2606   0.7380        0.2557       0.9033        0.3731        17.5172
      9   0.2534   0.7375        0.2561       0.9033        0.3802        17.6418
     10   0.2595   [32m0.7435[0m        0.2574       0.9033        0.3697        17.4950
     11   0.2669   0.7402        0.2555       0.9045        0.3721        17.5207
     12   0.2528   0.7361        0.2561       0.9045        0.3857        17.5620
     13   0.2605   0.7398        0.2542       0.9045        [94m0.3574[0m     +  17.4585
     14   0.2496   0.7326        0.2541       0.9045        [94m0.3417[0m     +  17.7319
     15   0.2443   0.7368        [35m0.2538[0m       0.9045        0.3514        17.7157
     16   0.2585   0.7393        0.2540       0.9045        [94m0.3301[0m     +  17.8089
     17   0.2553   0.7372        [35m0.2519[0m       0.9045        [94m0.3066[0m     +  17.8309
     18   0.2527   0.7324        [35m0.2511[0m       0.9045        [94m0.3044[0m     +  17.6361
     19   0.2461   0.7402        0.2517       0.9045        [94m0.2923[0m     +  17.5368
     20   0.2352   0.7195        0.2515       0.9045        0.2964        17.6134
     21   0.2492   0.7342        [35m0.2507[0m       0.9045        0.3001        17.5754
     22   0.2567   0.7375        [35m0.2506[0m       0.9045        [94m0.2897[0m     +  17.5025
     23   0.2391   0.7362        0.2519       0.9045        0.3020        18.0050
     24   0.2644   0.7407        0.2513       0.9045        0.2987        18.0410
     25   0.2646   0.7390        0.2509       0.9045        [94m0.2885[0m     +  18.0221
     26   0.2594   0.7296        0.2510       0.9045        [94m0.2870[0m     +  17.8992
     27   0.2244   0.7293        0.2537       0.9045        0.2874        17.8801
     28   0.2318   0.7327        0.2528       0.9045        0.2896        18.0397
     29   [36m0.2752[0m   0.7400        0.2511       0.9045        0.2969        18.0926
     30   0.2536   0.7314        [35m0.2499[0m       0.9045        0.2890        17.9419
     31   0.2486   [32m0.7461[0m        0.2506       0.9045        [94m0.2848[0m     +  18.0620
     32   0.2529   0.7422        [35m0.2469[0m       0.9045        0.2863        17.9639
     33   0.2503   0.7422        0.2485       0.9045        0.2860        17.8501
     34   0.2702   [32m0.7493[0m        0.2490       0.9045        0.2872        17.7610
     35   0.2579   0.7419        0.2476       0.9045        [94m0.2830[0m     +  17.6717
     36   0.2648   [32m0.7496[0m        0.2496       0.9045        0.2900        18.0723
     37   0.2472   0.7435        0.2483       0.9045        0.2883        17.7073
     38   0.2520   0.7365        0.2498       0.9045        0.2838        17.6466
     39   0.2611   0.7373        0.2496       0.9045        0.2875        17.5666
     40   0.2371   0.7276        0.2497       0.9045        0.2913        17.7260
     41   0.2447   0.7226        0.2501       0.9045        0.2914        17.7762
     42   0.2539   0.7353        0.2481       0.9045        0.2884        17.5457
     43   0.2545   0.7414        0.2501       0.9045        0.2873        17.4688
     44   0.2480   0.7423        0.2517       0.9045        0.2945        18.0733
Stopping since valid_loss has not improved in the last 10 epochs.
[32m[I 2023-05-02 02:04:01,341][0m Trial 15 finished with value: 0.2829510908677471 and parameters: {'lr': 0.002217444069562466, 'dropout': 0.6822588247467288, 'd_model_multiplier': 8, 'num_layers': 6, 'n_heads': 16, 'dim_feedforward': 354, 'batch_size': 52, 'pos_encoding': 'fixed', 'activation': 'relu', 'norm': 'LayerNorm', 'optimizer_name': 'AdamW', 'weight_decay': 0, 'top_n_features': 72}. Best is trial 12 with value: 0.20472501771481755.[0m
[FileBasedDataset] Initializing dataset...
	Examples: 8264
	Features: 159
	Max length: 315
Standard scalar turned ON, loading params from cache
[FileBasedDataset] Dataset initialization complete
  epoch    auprc    auroc    train_loss    valid_acc    valid_loss    cp      dur
-------  -------  -------  ------------  -----------  ------------  ----  -------
      1   [36m0.0888[0m   [32m0.4989[0m        [35m0.8225[0m       [31m0.9117[0m        [94m0.3180[0m     +  11.3168
      2   [36m0.1689[0m   [32m0.6815[0m        [35m0.2794[0m       0.8851        0.3421        11.6834
      3   [36m0.1852[0m   [32m0.7051[0m        [35m0.2656[0m       0.9093        [94m0.3070[0m     +  11.8314
      4   0.1738   [32m0.7069[0m        [35m0.2556[0m       0.9093        [94m0.2925[0m     +  12.0395
      5   0.1734   [32m0.7079[0m        [35m0.2517[0m       0.9021        0.3011        11.7735
      6   0.1717   0.7024        0.2530       0.8851        0.3067        11.9581
      7   0.1706   0.6986        0.2520       0.8839        0.3130        11.9779
      8   0.1733   0.6955        [35m0.2495[0m       0.9057        0.3101        11.5480
      9   0.1740   0.7028        0.2518       0.9069        0.3043        11.5663
     10   0.1724   0.7031        0.2495       0.9081        0.3039        11.4408
     11   0.1739   0.7051        0.2496       0.9117        0.3005        11.7911
     12   0.1798   0.7059        [35m0.2486[0m       0.9081        0.3069        11.4468
     13   0.1796   0.7051        0.2492       0.9117        0.2975        11.5724
Stopping since valid_loss has not improved in the last 10 epochs.
[32m[I 2023-05-02 02:06:45,506][0m Trial 16 finished with value: 0.29251852894636565 and parameters: {'lr': 0.08881251249820135, 'dropout': 0.5000101853581926, 'd_model_multiplier': 8, 'num_layers': 2, 'n_heads': 4, 'dim_feedforward': 429, 'batch_size': 222, 'pos_encoding': 'fixed', 'activation': 'relu', 'norm': 'LayerNorm', 'optimizer_name': 'AdamW', 'weight_decay': 0, 'top_n_features': 159}. Best is trial 12 with value: 0.20472501771481755.[0m
[FileBasedDataset] Initializing dataset...
	Examples: 8264
	Features: 207
	Max length: 315
Standard scalar turned ON, loading params from cache
[FileBasedDataset] Dataset initialization complete
  epoch    auprc    auroc    train_loss    valid_acc    valid_loss    cp      dur
-------  -------  -------  ------------  -----------  ------------  ----  -------
      1   [36m0.1706[0m   [32m0.5827[0m        [35m0.3262[0m       [31m0.9117[0m        [94m0.3654[0m     +  24.1529
      2   0.1611   [32m0.6021[0m        [35m0.2744[0m       0.9117        [94m0.3479[0m     +  23.7286
      3   [36m0.2120[0m   [32m0.6271[0m        [35m0.2632[0m       0.9117        [94m0.3422[0m     +  24.0900
      4   0.1893   0.6163        [35m0.2618[0m       0.9117        0.3478        24.1915
      5   0.1779   0.6172        0.2624       0.9117        [94m0.3314[0m     +  24.0494
      6   0.1895   0.6087        0.2623       0.9117        0.4278        24.3552
      7   0.2056   [32m0.6565[0m        [35m0.2604[0m       0.9117        0.3764        24.1429
      8   0.2037   [32m0.6657[0m        [35m0.2575[0m       0.9117        0.3831        24.0848
      9   0.2044   0.6442        0.2588       0.9117        0.3983        24.0395
     10   0.2074   [32m0.6682[0m        [35m0.2563[0m       0.9117        0.4242        24.0821
     11   [36m0.2162[0m   [32m0.6927[0m        [35m0.2549[0m       0.9117        0.3845        24.2661
     12   0.2037   0.6586        [35m0.2503[0m       0.9117        0.3988        24.0715
     13   [36m0.2244[0m   [32m0.6961[0m        0.2524       0.9117        0.4007        25.2124
     14   0.2115   0.6709        [35m0.2486[0m       0.9117        0.3923        24.0620
Stopping since valid_loss has not improved in the last 10 epochs.
[32m[I 2023-05-02 02:12:49,544][0m Trial 17 finished with value: 0.33138255463257665 and parameters: {'lr': 0.0007861778115561296, 'dropout': 0.6221736444427615, 'd_model_multiplier': 64, 'num_layers': 6, 'n_heads': 8, 'dim_feedforward': 387, 'batch_size': 163, 'pos_encoding': 'fixed', 'activation': 'relu', 'norm': 'LayerNorm', 'optimizer_name': 'AdamW', 'weight_decay': 0.01, 'top_n_features': 207}. Best is trial 12 with value: 0.20472501771481755.[0m
[FileBasedDataset] Initializing dataset...
	Examples: 8264
	Features: 235
	Max length: 315
Standard scalar turned ON, loading params from cache
[FileBasedDataset] Dataset initialization complete
  epoch    auprc    auroc    train_loss    valid_acc    valid_loss    cp      dur
-------  -------  -------  ------------  -----------  ------------  ----  -------
      1   [36m0.1747[0m   [32m0.7203[0m        [35m0.2954[0m       [31m0.9105[0m        [94m0.2984[0m     +  14.6478
      2   0.1679   0.6397        [35m0.2519[0m       [31m0.9274[0m        [94m0.2806[0m     +  15.0559
      3   [36m0.2106[0m   [32m0.7515[0m        0.2520       0.8573        0.4553        14.9830
      4   0.2080   0.6653        0.2584       0.9274        [94m0.2726[0m     +  15.5074
      5   [36m0.2404[0m   0.7457        0.2542       0.9129        [94m0.2596[0m     +  15.4247
      6   0.2131   [32m0.7519[0m        [35m0.2502[0m       0.9202        [94m0.2394[0m     +  15.5312
      7   [36m0.2436[0m   [32m0.7645[0m        [35m0.2486[0m       0.8670        0.3446        15.6398
      8   [36m0.2510[0m   0.7526        [35m0.2470[0m       0.9226        [94m0.2305[0m     +  15.8179
      9   0.2331   [32m0.7649[0m        [35m0.2394[0m       0.9154        0.2546        15.4973
     10   0.2350   [32m0.7677[0m        [35m0.2358[0m       0.9166        0.2521        15.5412
     11   [36m0.2542[0m   [32m0.7726[0m        [35m0.2322[0m       0.9202        0.2366        15.8619
     12   0.2431   0.7645        [35m0.2321[0m       0.9045        0.2724        15.7249
     13   [36m0.2784[0m   [32m0.7746[0m        0.2336       0.9166        0.2567        16.0309
     14   0.2684   0.7651        0.2327       0.9154        0.2695        16.1057
     15   0.2652   0.7718        [35m0.2320[0m       0.9262        0.2366        16.1191
     16   0.2578   0.7716        [35m0.2305[0m       0.9033        0.2710        15.8238
     17   0.2507   [32m0.7777[0m        [35m0.2271[0m       0.8755        0.3217        15.2681
Stopping since valid_loss has not improved in the last 10 epochs.
