[32m[I 2023-05-04 22:23:17,753][0m Trial 503 finished with value: 0.22906589244538525 and parameters: {'lr': 0.020815793196103983, 'dropout': 0.486129175291392, 'd_model_multiplier': 4, 'num_layers': 3, 'n_heads': 4, 'dim_feedforward': 326, 'batch_size': 49, 'pos_encoding': 'fixed', 'activation': 'relu', 'norm': 'LayerNorm', 'optimizer_name': 'PlainRAdam', 'weight_decay': 0.1, 'top_n_features': 68}. Best is trial 246 with value: 0.16447311791139763.[0m
[FileBasedDataset] Initializing dataset...
	Examples: 8264
	Features: 51
	Max length: 315
Standard scalar turned ON, loading params from cache
[FileBasedDataset] Dataset initialization complete
  epoch    auprc    auroc    train_loss    valid_acc    valid_loss    cp      dur
-------  -------  -------  ------------  -----------  ------------  ----  -------
      1   [36m0.0596[0m   [32m0.3115[0m        [35m0.5531[0m       [31m0.9141[0m        [94m0.4367[0m     +  27.4675
      2   [36m0.0613[0m   [32m0.3386[0m        [35m0.3937[0m       0.9141        [94m0.3509[0m     +  27.5272
      3   [36m0.0695[0m   [32m0.4221[0m        [35m0.3318[0m       0.9141        [94m0.3193[0m     +  27.6551
      4   [36m0.0828[0m   [32m0.5023[0m        [35m0.3011[0m       0.9141        [94m0.3037[0m     +  27.5807
      5   [36m0.1211[0m   [32m0.5569[0m        [35m0.2847[0m       0.9141        [94m0.2943[0m     +  27.6541
      6   [36m0.1533[0m   [32m0.5915[0m        [35m0.2733[0m       0.9141        [94m0.2886[0m     +  27.5205
      7   [36m0.1771[0m   [32m0.6156[0m        [35m0.2667[0m       0.9141        [94m0.2846[0m     +  27.5692
      8   [36m0.1942[0m   [32m0.6307[0m        [35m0.2628[0m       0.9141        [94m0.2817[0m     +  27.4636
      9   [36m0.2052[0m   [32m0.6434[0m        [35m0.2588[0m       0.9141        [94m0.2795[0m     +  27.6450
     10   [36m0.2243[0m   [32m0.6537[0m        [35m0.2557[0m       0.9141        [94m0.2776[0m     +  27.6021
     11   [36m0.2327[0m   [32m0.6639[0m        [35m0.2531[0m       0.9141        [94m0.2758[0m     +  27.5924
     12   [36m0.2490[0m   [32m0.6741[0m        [35m0.2516[0m       0.9141        [94m0.2739[0m     +  27.6120
     13   [36m0.2597[0m   [32m0.6864[0m        [35m0.2503[0m       0.9141        [94m0.2718[0m     +  27.5440
     14   [36m0.2718[0m   [32m0.6978[0m        [35m0.2477[0m       0.9141        [94m0.2697[0m     +  27.5667
     15   [36m0.2825[0m   [32m0.7104[0m        [35m0.2464[0m       0.9141        [94m0.2671[0m     +  27.7367
     16   [36m0.2886[0m   [32m0.7228[0m        [35m0.2441[0m       0.9141        [94m0.2641[0m     +  27.6149
     17   [36m0.2960[0m   [32m0.7333[0m        [35m0.2432[0m       0.9141        [94m0.2609[0m     +  27.5553
     18   [36m0.3040[0m   [32m0.7430[0m        [35m0.2421[0m       0.9141        [94m0.2583[0m     +  27.6114
     19   0.3037   [32m0.7504[0m        [35m0.2385[0m       [31m0.9154[0m        [94m0.2557[0m     +  27.6713
     20   [36m0.3043[0m   [32m0.7580[0m        [35m0.2376[0m       0.9154        [94m0.2537[0m     +  27.5528
     21   [36m0.3085[0m   [32m0.7643[0m        [35m0.2354[0m       0.9154        [94m0.2519[0m     +  27.6831
     22   [36m0.3086[0m   [32m0.7664[0m        0.2359       0.9129        [94m0.2511[0m     +  27.6915
     23   0.3042   [32m0.7686[0m        [35m0.2346[0m       0.9117        [94m0.2502[0m     +  27.4407
     24   0.3067   [32m0.7713[0m        [35m0.2344[0m       0.9117        [94m0.2499[0m     +  27.8414
     25   [36m0.3175[0m   [32m0.7735[0m        0.2352       0.9093        [94m0.2498[0m     +  27.5963
     26   [36m0.3179[0m   [32m0.7751[0m        [35m0.2339[0m       0.9081        [94m0.2493[0m     +  27.7876
     27   0.3179   [32m0.7760[0m        [35m0.2321[0m       0.9081        0.2495        27.6993
     28   [36m0.3188[0m   [32m0.7774[0m        0.2327       0.9081        0.2494        27.6643
     29   [36m0.3190[0m   [32m0.7783[0m        [35m0.2315[0m       0.9081        [94m0.2491[0m     +  27.6673
     30   0.3080   [32m0.7791[0m        [35m0.2314[0m       0.9081        0.2493        27.6576
     31   0.3059   [32m0.7797[0m        0.2328       0.9081        0.2492        27.6480
     32   0.3081   [32m0.7805[0m        0.2315       0.9081        [94m0.2491[0m     +  27.5614
     33   0.3055   [32m0.7814[0m        [35m0.2301[0m       0.9081        [94m0.2489[0m     +  27.5400
     34   0.3045   [32m0.7819[0m        0.2309       0.9081        0.2490        27.4661
     35   0.3051   [32m0.7823[0m        [35m0.2293[0m       0.9081        0.2490        27.4763
     36   0.3057   [32m0.7832[0m        0.2302       0.9105        0.2489        27.7901
     37   0.3061   [32m0.7840[0m        0.2312       0.9105        [94m0.2488[0m     +  27.6432
     38   0.3065   [32m0.7853[0m        [35m0.2292[0m       0.9105        [94m0.2485[0m     +  27.6217
     39   0.3076   [32m0.7860[0m        [35m0.2288[0m       0.9105        [94m0.2484[0m     +  27.5444
     40   0.3084   [32m0.7870[0m        0.2297       0.9105        [94m0.2481[0m     +  27.5673
     41   0.3066   0.7868        [35m0.2285[0m       0.9105        0.2482        27.6845
     42   0.3025   [32m0.7874[0m        [35m0.2279[0m       0.9117        0.2482        27.7160
     43   0.3029   [32m0.7876[0m        0.2303       0.9117        0.2482        27.6699
     44   0.3028   [32m0.7880[0m        0.2288       0.9105        [94m0.2480[0m     +  27.5116
     45   0.3036   [32m0.7891[0m        0.2285       0.9105        [94m0.2476[0m     +  27.6403
     46   0.3040   [32m0.7897[0m        [35m0.2271[0m       0.9105        0.2477        27.5675
     47   0.3029   [32m0.7902[0m        0.2280       0.9105        0.2477        27.7030
     48   0.3030   [32m0.7905[0m        0.2287       0.9105        0.2476        27.7693
     49   0.3012   [32m0.7907[0m        0.2284       0.9105        0.2477        27.6788
     50   0.3009   [32m0.7910[0m        0.2273       0.9105        0.2478        27.8357
[32m[I 2023-05-04 22:46:23,760][0m Trial 504 finished with value: 0.24760272219650978 and parameters: {'lr': 1.63959810369693e-06, 'dropout': 0.42165213929224954, 'd_model_multiplier': 4, 'num_layers': 6, 'n_heads': 32, 'dim_feedforward': 348, 'batch_size': 31, 'pos_encoding': 'fixed', 'activation': 'relu', 'norm': 'LayerNorm', 'optimizer_name': 'AdamW', 'weight_decay': 0.1, 'top_n_features': 51}. Best is trial 246 with value: 0.16447311791139763.[0m
[FileBasedDataset] Initializing dataset...
	Examples: 8264
	Features: 90
	Max length: 315
Standard scalar turned ON, loading params from cache
[FileBasedDataset] Dataset initialization complete
  epoch    auprc    auroc    train_loss    valid_acc    valid_loss    cp      dur
-------  -------  -------  ------------  -----------  ------------  ----  -------
      1   [36m0.2754[0m   [32m0.7435[0m        [35m0.3166[0m       [31m0.9250[0m        [94m0.2465[0m     +  41.5645
      2   0.2528   [32m0.7942[0m        [35m0.2735[0m       [31m0.9262[0m        [94m0.2371[0m     +  41.2272
      3   0.2583   [32m0.7956[0m        [35m0.2653[0m       0.9262        0.2392        41.9482
      4   0.2414   [32m0.8003[0m        0.2678       0.9262        [94m0.2327[0m     +  41.8801
      5   0.2579   0.7952        0.2692       0.9250        0.2368        41.8626
      6   0.2349   0.7991        [35m0.2622[0m       0.9250        0.2340        42.0047
      7   0.2480   0.7944        [35m0.2607[0m       0.9250        0.2439        41.5346
      8   0.2403   0.7909        [35m0.2574[0m       0.9250        0.2501        41.6396
      9   0.2470   0.7974        0.2587       0.9250        0.2525        41.7180
     10   0.2386   0.7912        [35m0.2557[0m       0.9250        0.2364        41.5265
     11   0.2356   0.7906        0.2565       0.9250        0.2374        41.5962
     12   0.2262   0.7899        [35m0.2552[0m       0.9250        0.2382        41.6962
     13   0.2333   0.7917        0.2556       0.9250        0.2452        41.7825
Stopping since valid_loss has not improved in the last 10 epochs.
[32m[I 2023-05-04 22:56:07,913][0m Trial 505 finished with value: 0.23272360873914255 and parameters: {'lr': 0.012749471605500282, 'dropout': 0.4453132868965452, 'd_model_multiplier': 8, 'num_layers': 9, 'n_heads': 32, 'dim_feedforward': 384, 'batch_size': 66, 'pos_encoding': 'fixed', 'activation': 'relu', 'norm': 'LayerNorm', 'optimizer_name': 'RAdam', 'weight_decay': 0.1, 'top_n_features': 90}. Best is trial 246 with value: 0.16447311791139763.[0m
[FileBasedDataset] Initializing dataset...
	Examples: 8264
	Features: 64
	Max length: 315
Standard scalar turned ON, loading params from cache
[FileBasedDataset] Dataset initialization complete
  epoch    auprc    auroc    train_loss    valid_acc    valid_loss    cp      dur
-------  -------  -------  ------------  -----------  ------------  ----  -------
      1   [36m0.0569[0m   [32m0.2998[0m        [35m0.6150[0m       [31m0.9166[0m        [94m0.5296[0m     +  24.0450
      2   [36m0.0573[0m   [32m0.3022[0m        [35m0.4721[0m       0.9166        [94m0.4026[0m     +  24.4220
      3   [36m0.0626[0m   [32m0.3705[0m        [35m0.3840[0m       0.9166        [94m0.3453[0m     +  24.2792
      4   [36m0.0725[0m   [32m0.4596[0m        [35m0.3336[0m       0.9166        [94m0.3127[0m     +  24.3046
      5   [36m0.1239[0m   [32m0.5402[0m        [35m0.3040[0m       0.9166        [94m0.2940[0m     +  24.2190
      6   [36m0.1713[0m   [32m0.5884[0m        [35m0.2858[0m       0.9166        [94m0.2831[0m     +  24.1870
      7   [36m0.1911[0m   [32m0.6175[0m        [35m0.2737[0m       0.9166        [94m0.2771[0m     +  24.3666
      8   [36m0.2017[0m   [32m0.6347[0m        [35m0.2658[0m       0.9166        [94m0.2739[0m     +  24.3236
      9   [36m0.2125[0m   [32m0.6460[0m        [35m0.2618[0m       0.9166        [94m0.2722[0m     +  24.2645
     10   [36m0.2191[0m   [32m0.6566[0m        [35m0.2584[0m       0.9166        [94m0.2710[0m     +  24.4560
     11   [36m0.2255[0m   [32m0.6621[0m        0.2587       0.9166        [94m0.2703[0m     +  24.4143
     12   [36m0.2319[0m   [32m0.6681[0m        [35m0.2543[0m       0.9166        [94m0.2699[0m     +  24.2112
     13   [36m0.2329[0m   [32m0.6731[0m        0.2551       0.9166        [94m0.2697[0m     +  24.3247
     14   [36m0.2351[0m   [32m0.6778[0m        [35m0.2538[0m       0.9166        [94m0.2690[0m     +  24.3215
     15   0.2348   [32m0.6853[0m        [35m0.2518[0m       0.9166        [94m0.2683[0m     +  24.2379
     16   [36m0.2364[0m   [32m0.6935[0m        0.2539       0.9166        [94m0.2673[0m     +  24.1552
     17   [36m0.2438[0m   [32m0.7031[0m        [35m0.2510[0m       0.9166        [94m0.2659[0m     +  24.1704
     18   [36m0.2536[0m   [32m0.7221[0m        [35m0.2488[0m       0.9166        [94m0.2614[0m     +  24.2002
     19   [36m0.2766[0m   [32m0.7443[0m        [35m0.2477[0m       0.9166        [94m0.2532[0m     +  24.4537
     20   [36m0.2915[0m   [32m0.7481[0m        [35m0.2417[0m       0.9166        [94m0.2492[0m     +  24.2038
     21   [36m0.2967[0m   [32m0.7492[0m        [35m0.2384[0m       0.9141        [94m0.2482[0m     +  24.4136
     22   [36m0.3166[0m   [32m0.7521[0m        [35m0.2371[0m       0.9166        [94m0.2477[0m     +  24.1739
     23   0.3130   [32m0.7540[0m        0.2381       [31m0.9178[0m        [94m0.2473[0m     +  24.2353
     24   0.3138   [32m0.7569[0m        0.2387       [31m0.9190[0m        [94m0.2466[0m     +  24.3493
     25   [36m0.3169[0m   [32m0.7571[0m        [35m0.2348[0m       0.9190        0.2470        24.3691
     26   0.3120   [32m0.7612[0m        0.2350       0.9178        [94m0.2461[0m     +  24.1588
     27   0.3121   [32m0.7628[0m        0.2358       0.9178        0.2461        24.2879
     28   0.3124   [32m0.7650[0m        [35m0.2335[0m       0.9190        [94m0.2457[0m     +  24.2926
     29   [36m0.3177[0m   [32m0.7655[0m        [35m0.2320[0m       0.9190        0.2460        24.4921
     30   0.3176   [32m0.7662[0m        0.2338       [31m0.9214[0m        0.2458        24.2805
     31   [36m0.3181[0m   [32m0.7676[0m        0.2340       [31m0.9226[0m        0.2459        24.2441
     32   [36m0.3183[0m   [32m0.7702[0m        [35m0.2319[0m       0.9214        [94m0.2445[0m     +  24.2660
     33   [36m0.3210[0m   [32m0.7714[0m        0.2331       [31m0.9250[0m        0.2446        24.3053
     34   [36m0.3212[0m   [32m0.7718[0m        0.2326       0.9250        0.2448        24.3276
     35   [36m0.3213[0m   [32m0.7721[0m        0.2331       0.9250        0.2450        24.2046
     36   [36m0.3231[0m   [32m0.7740[0m        0.2330       0.9250        [94m0.2442[0m     +  24.2130
     37   [36m0.3240[0m   [32m0.7750[0m        0.2322       0.9238        [94m0.2435[0m     +  24.3056
     38   [36m0.3266[0m   [32m0.7764[0m        0.2330       0.9238        [94m0.2434[0m     +  24.2857
     39   [36m0.3277[0m   [32m0.7764[0m        0.2329       0.9238        0.2438        24.3059
     40   [36m0.3285[0m   [32m0.7777[0m        0.2321       0.9226        [94m0.2431[0m     +  24.4681
     41   0.3276   0.7775        [35m0.2315[0m       0.9226        0.2438        24.1596
     42   0.3283   [32m0.7796[0m        0.2315       0.9226        [94m0.2430[0m     +  24.2333
     43   0.3282   0.7793        [35m0.2305[0m       0.9226        0.2433        24.1454
     44   [36m0.3296[0m   [32m0.7800[0m        0.2306       0.9238        0.2434        24.1994
     45   [36m0.3324[0m   [32m0.7808[0m        [35m0.2300[0m       0.9238        0.2433        24.2879
     46   0.3318   [32m0.7821[0m        0.2309       0.9250        [94m0.2428[0m     +  24.2702
     47   [36m0.3356[0m   [32m0.7830[0m        [35m0.2291[0m       0.9238        [94m0.2427[0m     +  24.1419
     48   0.3352   [32m0.7838[0m        0.2308       0.9238        [94m0.2425[0m     +  24.2456
     49   0.3350   [32m0.7847[0m        0.2304       0.9238        [94m0.2421[0m     +  24.1228
     50   0.3346   0.7843        0.2297       0.9238        0.2429        24.1874
[32m[I 2023-05-04 23:16:24,856][0m Trial 506 finished with value: 0.24214823586368503 and parameters: {'lr': 1.7938938228581815e-05, 'dropout': 0.5430414139363801, 'd_model_multiplier': 1, 'num_layers': 7, 'n_heads': 32, 'dim_feedforward': 368, 'batch_size': 42, 'pos_encoding': 'fixed', 'activation': 'relu', 'norm': 'LayerNorm', 'optimizer_name': 'RAdam', 'weight_decay': 0.001, 'top_n_features': 64}. Best is trial 246 with value: 0.16447311791139763.[0m
[FileBasedDataset] Initializing dataset...
	Examples: 8264
	Features: 56
	Max length: 315
Standard scalar turned ON, loading params from cache
[FileBasedDataset] Dataset initialization complete
  epoch    auprc    auroc    train_loss    valid_acc    valid_loss    cp      dur
-------  -------  -------  ------------  -----------  ------------  ----  -------
      1   [36m0.0654[0m   [32m0.3729[0m        [35m0.5266[0m       [31m0.9262[0m        [94m0.5992[0m     +  20.5868
      2   [36m0.0923[0m   [32m0.5068[0m        [35m0.3919[0m       0.9262        [94m0.5294[0m     +  20.5812
      3   [36m0.1756[0m   [32m0.6348[0m        [35m0.3316[0m       0.9226        [94m0.4947[0m     +  20.5941
      4   [36m0.2159[0m   [32m0.6875[0m        [35m0.3032[0m       0.9202        [94m0.4886[0m     +  20.9490
      5   [36m0.2507[0m   [32m0.7112[0m        [35m0.2870[0m       0.9141        [94m0.4594[0m     +  20.6079
      6   [36m0.2560[0m   [32m0.7279[0m        [35m0.2817[0m       0.9190        [94m0.4464[0m     +  20.8304
      7   [36m0.2694[0m   [32m0.7341[0m        [35m0.2752[0m       0.9166        [94m0.4134[0m     +  20.6202
      8   [36m0.2861[0m   [32m0.7376[0m        [35m0.2713[0m       0.9190        0.4188        20.5831
      9   [36m0.3059[0m   [32m0.7423[0m        [35m0.2659[0m       0.9202        [94m0.4003[0m     +  20.7092
     10   [36m0.3178[0m   [32m0.7433[0m        0.2661       0.9226        0.4109        21.0072
     11   [36m0.3200[0m   0.7401        [35m0.2653[0m       0.9226        0.4042        20.8214
     12   [36m0.3226[0m   [32m0.7471[0m        [35m0.2609[0m       0.9226        0.4063        20.6517
     13   [36m0.3379[0m   [32m0.7505[0m        0.2628       0.9250        [94m0.3868[0m     +  21.0719
     14   [36m0.3383[0m   0.7433        [35m0.2603[0m       0.9250        0.3958        20.9605
     15   [36m0.3400[0m   0.7471        [35m0.2597[0m       0.9238        [94m0.3810[0m     +  20.9016
     16   0.3358   0.7493        0.2609       0.9250        0.4035        20.7650
     17   [36m0.3540[0m   [32m0.7506[0m        [35m0.2588[0m       0.9250        [94m0.3806[0m     +  20.4097
     18   [36m0.3556[0m   0.7480        [35m0.2563[0m       0.9250        [94m0.3673[0m     +  20.5331
     19   [36m0.3633[0m   0.7501        0.2577       [31m0.9299[0m        0.3770        20.6668
     20   0.3570   [32m0.7521[0m        0.2583       0.9262        0.3771        20.5336
     21   [36m0.3665[0m   [32m0.7538[0m        [35m0.2548[0m       0.9274        [94m0.3634[0m     +  20.6637
     22   0.3664   0.7534        0.2557       [31m0.9311[0m        [94m0.3476[0m     +  20.6160
     23   [36m0.3782[0m   0.7467        0.2561       0.9311        0.3585        20.7290
     24   [36m0.3808[0m   0.7490        0.2561       0.9311        [94m0.3414[0m     +  20.7133
     25   0.3754   0.7538        [35m0.2546[0m       0.9274        0.3659        20.6978
     26   0.3770   0.7502        [35m0.2531[0m       [31m0.9323[0m        0.3451        20.6925
     27   0.3748   0.7513        0.2533       0.9299        0.3559        20.8056
     28   0.3729   [32m0.7575[0m        [35m0.2511[0m       0.9311        [94m0.3365[0m     +  20.9696
     29   0.3756   0.7530        0.2541       [31m0.9335[0m        0.3422        20.7346
     30   0.3767   0.7517        [35m0.2510[0m       0.9323        0.3413        20.6109
     31   0.3754   0.7529        0.2513       0.9323        0.3481        20.6882
     32   0.3791   0.7497        0.2518       [31m0.9347[0m        [94m0.3207[0m     +  20.5271
     33   [36m0.3869[0m   0.7533        [35m0.2505[0m       0.9347        0.3256        20.9963
     34   0.3802   0.7512        0.2515       0.9323        0.3401        20.8454
     35   0.3778   0.7479        [35m0.2500[0m       0.9347        0.3287        20.8090
     36   0.3712   0.7512        0.2501       0.9323        0.3382        20.6715
     37   0.3805   0.7526        [35m0.2494[0m       0.9347        [94m0.3187[0m     +  21.0906
     38   0.3773   0.7506        [35m0.2486[0m       [31m0.9359[0m        [94m0.3126[0m     +  20.5626
     39   0.3799   0.7529        [35m0.2482[0m       0.9335        [94m0.3098[0m     +  20.6352
     40   0.3825   0.7475        0.2484       0.9347        0.3161        20.7846
     41   0.3810   0.7507        0.2494       0.9359        0.3201        20.5615
     42   0.3848   0.7488        [35m0.2469[0m       0.9359        0.3185        20.6260
     43   0.3700   0.7487        0.2476       0.9335        0.3120        20.4928
     44   0.3706   0.7479        [35m0.2469[0m       0.9347        [94m0.3080[0m     +  20.7271
     45   [36m0.3888[0m   0.7530        [35m0.2445[0m       [31m0.9371[0m        [94m0.2973[0m     +  20.6384
     46   0.3834   0.7502        0.2481       0.9359        0.3123        20.5829
     47   0.3806   0.7546        0.2475       0.9359        0.3102        20.7287
     48   0.3824   0.7541        0.2465       0.9359        [94m0.2948[0m     +  20.5507
     49   0.3820   0.7521        0.2483       0.9359        0.3016        20.6307
     50   0.3806   0.7519        0.2471       0.9359        0.3051        20.8594
[32m[I 2023-05-04 23:33:43,186][0m Trial 507 finished with value: 0.29475177952427384 and parameters: {'lr': 3.94052927512233e-06, 'dropout': 0.37970019951573253, 'd_model_multiplier': 4, 'num_layers': 4, 'n_heads': 32, 'dim_feedforward': 336, 'batch_size': 56, 'pos_encoding': 'fixed', 'activation': 'gelu', 'norm': 'BatchNorm', 'optimizer_name': 'AdamW', 'weight_decay': 0.1, 'top_n_features': 56}. Best is trial 246 with value: 0.16447311791139763.[0m
[FileBasedDataset] Initializing dataset...
	Examples: 8264
	Features: 72
	Max length: 315
Standard scalar turned ON, loading params from cache
[FileBasedDataset] Dataset initialization complete
Warning, assumed runtime error: CUDA out of memory. Tried to allocate 3.34 GiB (GPU 0; 23.70 GiB total capacity; 19.63 GiB already allocated; 569.25 MiB free; 22.05 GiB reserved in total by PyTorch) If reserved memory is >> allocated memory try setting max_split_size_mb to avoid fragmentation.  See documentation for Memory Management and PYTORCH_CUDA_ALLOC_CONF
