[32m[I 2023-05-04 05:56:39,204][0m Trial 411 finished with value: 0.24335347339420826 and parameters: {'lr': 5.499823815920271e-06, 'dropout': 0.2698486828433612, 'd_model_multiplier': 4, 'num_layers': 8, 'n_heads': 32, 'dim_feedforward': 337, 'batch_size': 34, 'pos_encoding': 'fixed', 'activation': 'relu', 'norm': 'LayerNorm', 'optimizer_name': 'RAdam', 'weight_decay': 0.001, 'top_n_features': 115}. Best is trial 246 with value: 0.16447311791139763.[0m
[FileBasedDataset] Initializing dataset...
	Examples: 8264
	Features: 70
	Max length: 315
Standard scalar turned ON, loading params from cache
[FileBasedDataset] Dataset initialization complete
  epoch    auprc    auroc    train_loss    valid_acc    valid_loss    cp      dur
-------  -------  -------  ------------  -----------  ------------  ----  -------
      1   [36m0.0850[0m   [32m0.4001[0m        [35m0.6680[0m       [31m0.9287[0m        [94m0.5727[0m     +  27.2360
      2   0.0733   0.3946        [35m0.5789[0m       0.9287        [94m0.4679[0m     +  27.0614
      3   0.0670   0.3944        [35m0.4865[0m       0.9287        [94m0.3827[0m     +  27.4794
      4   0.0684   [32m0.4095[0m        [35m0.4129[0m       0.9287        [94m0.3259[0m     +  27.9843
      5   0.0736   [32m0.4548[0m        [35m0.3628[0m       0.9287        [94m0.2914[0m     +  27.4417
      6   [36m0.0857[0m   [32m0.5183[0m        [35m0.3284[0m       0.9287        [94m0.2708[0m     +  27.3244
      7   [36m0.0967[0m   [32m0.5747[0m        [35m0.3056[0m       0.9287        [94m0.2590[0m     +  27.5271
      8   [36m0.1467[0m   [32m0.6117[0m        [35m0.2911[0m       0.9287        [94m0.2519[0m     +  27.4562
      9   [36m0.1807[0m   [32m0.6385[0m        [35m0.2814[0m       0.9287        [94m0.2476[0m     +  27.4737
     10   [36m0.1839[0m   [32m0.6501[0m        [35m0.2747[0m       0.9287        [94m0.2456[0m     +  27.2302
     11   0.1789   [32m0.6576[0m        [35m0.2707[0m       0.9287        [94m0.2446[0m     +  27.2751
     12   0.1761   [32m0.6630[0m        [35m0.2659[0m       0.9287        [94m0.2443[0m     +  27.1987
     13   0.1740   [32m0.6666[0m        [35m0.2614[0m       0.9287        0.2444        27.2011
     14   0.1757   [32m0.6693[0m        [35m0.2588[0m       0.9287        0.2450        27.3679
     15   0.1720   [32m0.6708[0m        [35m0.2578[0m       0.9287        0.2452        27.4116
     16   0.1716   [32m0.6732[0m        [35m0.2574[0m       0.9287        0.2456        27.4871
     17   0.1716   [32m0.6734[0m        [35m0.2535[0m       0.9287        0.2462        27.1623
     18   0.1745   [32m0.6758[0m        [35m0.2525[0m       0.9287        0.2464        27.2733
     19   0.1744   [32m0.6769[0m        [35m0.2522[0m       0.9287        0.2470        27.2466
     20   0.1757   [32m0.6777[0m        0.2526       0.9287        0.2473        27.5532
     21   0.1741   [32m0.6799[0m        [35m0.2500[0m       0.9287        0.2477        27.3648
Stopping since valid_loss has not improved in the last 10 epochs.
[32m[I 2023-05-04 06:06:43,004][0m Trial 412 finished with value: 0.24430120711134884 and parameters: {'lr': 4.771818833206851e-06, 'dropout': 0.627990306878206, 'd_model_multiplier': 4, 'num_layers': 6, 'n_heads': 32, 'dim_feedforward': 331, 'batch_size': 53, 'pos_encoding': 'fixed', 'activation': 'relu', 'norm': 'LayerNorm', 'optimizer_name': 'RAdam', 'weight_decay': 0.001, 'top_n_features': 70}. Best is trial 246 with value: 0.16447311791139763.[0m
[FileBasedDataset] Initializing dataset...
	Examples: 8264
	Features: 65
	Max length: 315
Standard scalar turned ON, loading params from cache
[FileBasedDataset] Dataset initialization complete
  epoch    auprc    auroc    train_loss    valid_acc    valid_loss    cp      dur
-------  -------  -------  ------------  -----------  ------------  ----  -------
      1   [36m0.0538[0m   [32m0.3137[0m        [35m0.6754[0m       [31m0.9214[0m        [94m0.6192[0m     +  30.9333
      2   0.0518   0.2978        [35m0.6215[0m       [31m0.9226[0m        [94m0.5501[0m     +  30.9488
      3   0.0519   0.2962        [35m0.5519[0m       0.9226        [94m0.4814[0m     +  30.9045
      4   0.0525   0.2982        [35m0.4901[0m       0.9226        [94m0.4235[0m     +  31.1165
      5   0.0529   0.3024        [35m0.4338[0m       0.9226        [94m0.3790[0m     +  31.4314
      6   [36m0.0539[0m   [32m0.3187[0m        [35m0.3883[0m       0.9226        [94m0.3461[0m     +  31.0821
      7   [36m0.0566[0m   [32m0.3564[0m        [35m0.3571[0m       0.9226        [94m0.3228[0m     +  30.9923
      8   [36m0.0621[0m   [32m0.4126[0m        [35m0.3314[0m       0.9226        [94m0.3055[0m     +  30.9235
      9   [36m0.0865[0m   [32m0.4620[0m        [35m0.3132[0m       0.9226        [94m0.2927[0m     +  30.8287
     10   [36m0.1125[0m   [32m0.5024[0m        [35m0.2996[0m       0.9226        [94m0.2836[0m     +  31.2188
     11   [36m0.1292[0m   [32m0.5360[0m        [35m0.2904[0m       0.9226        [94m0.2769[0m     +  30.9159
     12   [36m0.1436[0m   [32m0.5608[0m        [35m0.2816[0m       0.9226        [94m0.2724[0m     +  30.9574
     13   [36m0.1586[0m   [32m0.5827[0m        [35m0.2761[0m       0.9226        [94m0.2690[0m     +  31.0691
     14   [36m0.1671[0m   [32m0.5967[0m        [35m0.2724[0m       0.9226        [94m0.2666[0m     +  31.0361
     15   [36m0.1715[0m   [32m0.6093[0m        [35m0.2688[0m       0.9226        [94m0.2648[0m     +  31.0405
     16   0.1684   [32m0.6197[0m        [35m0.2648[0m       0.9226        [94m0.2634[0m     +  31.3980
     17   [36m0.1751[0m   [32m0.6285[0m        [35m0.2629[0m       0.9226        [94m0.2626[0m     +  30.8383
     18   [36m0.1785[0m   [32m0.6356[0m        [35m0.2598[0m       0.9226        [94m0.2619[0m     +  30.8334
     19   [36m0.1835[0m   [32m0.6428[0m        [35m0.2582[0m       0.9226        [94m0.2613[0m     +  31.2022
     20   [36m0.1862[0m   [32m0.6483[0m        [35m0.2579[0m       0.9226        [94m0.2608[0m     +  31.0366
     21   [36m0.1880[0m   [32m0.6512[0m        0.2590       0.9226        [94m0.2606[0m     +  31.3327
     22   [36m0.1911[0m   [32m0.6549[0m        [35m0.2554[0m       0.9226        [94m0.2603[0m     +  31.1571
     23   [36m0.1939[0m   [32m0.6593[0m        [35m0.2532[0m       0.9226        [94m0.2599[0m     +  31.2608
     24   [36m0.1995[0m   [32m0.6617[0m        0.2544       0.9226        [94m0.2596[0m     +  30.9925
     25   [36m0.2002[0m   [32m0.6658[0m        [35m0.2515[0m       0.9226        [94m0.2588[0m     +  30.9945
     26   [36m0.2023[0m   [32m0.6690[0m        0.2519       0.9214        [94m0.2585[0m     +  31.4132
     27   [36m0.2042[0m   [32m0.6738[0m        [35m0.2499[0m       0.9202        [94m0.2579[0m     +  31.5913
     28   [36m0.2077[0m   [32m0.6766[0m        0.2527       0.9202        0.2582        31.4706
     29   [36m0.2115[0m   [32m0.6817[0m        [35m0.2494[0m       0.9202        [94m0.2574[0m     +  31.1227
     30   [36m0.2133[0m   [32m0.6849[0m        [35m0.2482[0m       0.9202        [94m0.2571[0m     +  31.2416
     31   [36m0.2151[0m   [32m0.6890[0m        0.2495       0.9214        [94m0.2567[0m     +  31.3451
     32   [36m0.2189[0m   [32m0.6930[0m        [35m0.2479[0m       0.9226        [94m0.2567[0m     +  31.3721
     33   [36m0.2211[0m   [32m0.6956[0m        [35m0.2471[0m       [31m0.9238[0m        0.2568        31.2628
     34   [36m0.2239[0m   [32m0.7013[0m        [35m0.2435[0m       [31m0.9250[0m        [94m0.2560[0m     +  31.0932
     35   [36m0.2252[0m   [32m0.7058[0m        0.2453       0.9250        [94m0.2553[0m     +  31.1483
     36   [36m0.2290[0m   [32m0.7084[0m        0.2449       0.9250        0.2559        31.1733
     37   0.2284   [32m0.7100[0m        0.2443       0.9238        0.2566        30.8955
     38   0.2274   [32m0.7117[0m        [35m0.2419[0m       0.9238        0.2573        31.1102
     39   [36m0.2301[0m   [32m0.7158[0m        [35m0.2401[0m       0.9202        0.2570        31.1092
     40   0.2297   [32m0.7163[0m        0.2412       0.9214        0.2576        31.1399
     41   [36m0.2309[0m   [32m0.7181[0m        0.2411       0.9178        0.2580        31.2719
     42   [36m0.2324[0m   [32m0.7192[0m        0.2411       0.9154        0.2585        31.6461
     43   0.2324   [32m0.7196[0m        0.2411       0.9154        0.2589        31.2247
     44   0.2321   [32m0.7206[0m        [35m0.2388[0m       0.9166        0.2595        31.0081
Stopping since valid_loss has not improved in the last 10 epochs.
[32m[I 2023-05-04 06:30:08,658][0m Trial 413 finished with value: 0.25534220239848004 and parameters: {'lr': 4.406933521205439e-06, 'dropout': 0.6530322712993666, 'd_model_multiplier': 4, 'num_layers': 7, 'n_heads': 32, 'dim_feedforward': 316, 'batch_size': 73, 'pos_encoding': 'fixed', 'activation': 'relu', 'norm': 'LayerNorm', 'optimizer_name': 'RAdam', 'weight_decay': 0.001, 'top_n_features': 65}. Best is trial 246 with value: 0.16447311791139763.[0m
[FileBasedDataset] Initializing dataset...
	Examples: 8264
	Features: 76
	Max length: 315
Standard scalar turned ON, loading params from cache
[FileBasedDataset] Dataset initialization complete
  epoch    auprc    auroc    train_loss    valid_acc    valid_loss    cp      dur
-------  -------  -------  ------------  -----------  ------------  ----  -------
      1   [36m0.2153[0m   [32m0.7000[0m        [35m0.3772[0m       [31m0.9238[0m        [94m0.2457[0m     +  23.7049
      2   [36m0.2474[0m   [32m0.7385[0m        [35m0.2391[0m       [31m0.9250[0m        [94m0.2428[0m     +  23.6330
      3   [36m0.2680[0m   [32m0.7527[0m        [35m0.2345[0m       0.9238        [94m0.2396[0m     +  23.7537
      4   [36m0.2741[0m   [32m0.7555[0m        [35m0.2305[0m       0.9202        0.2417        23.6909
      5   [36m0.2750[0m   [32m0.7673[0m        0.2306       0.9190        [94m0.2383[0m     +  23.8910
      6   0.2678   [32m0.7722[0m        [35m0.2274[0m       0.9190        [94m0.2376[0m     +  23.7254
      7   0.2716   [32m0.7759[0m        [35m0.2260[0m       0.9129        0.2413        23.5880
      8   [36m0.2787[0m   0.7719        [35m0.2245[0m       0.9141        0.2402        23.6426
      9   [36m0.2832[0m   0.7732        [35m0.2219[0m       0.9154        0.2383        23.6773
     10   [36m0.2901[0m   [32m0.7826[0m        [35m0.2195[0m       0.9166        [94m0.2369[0m     +  23.7590
     11   [36m0.3119[0m   0.7799        [35m0.2189[0m       0.9154        [94m0.2363[0m     +  23.6705
     12   [36m0.3145[0m   [32m0.7847[0m        [35m0.2180[0m       0.9166        [94m0.2326[0m     +  23.8257
     13   [36m0.3236[0m   [32m0.7864[0m        [35m0.2143[0m       0.9214        [94m0.2323[0m     +  23.8806
     14   0.3196   [32m0.7943[0m        [35m0.2132[0m       0.9238        [94m0.2319[0m     +  23.9629
     15   0.3066   0.7928        [35m0.2104[0m       0.9190        0.2326        23.8200
     16   0.2973   [32m0.7965[0m        [35m0.2075[0m       0.9178        0.2321        23.6572
     17   0.3129   [32m0.7987[0m        [35m0.2066[0m       0.9214        [94m0.2293[0m     +  23.5936
     18   0.3074   0.7949        [35m0.2048[0m       0.9238        0.2318        23.8011
     19   0.2999   0.7938        [35m0.2038[0m       0.9166        0.2349        23.6501
     20   0.2979   [32m0.8033[0m        [35m0.1983[0m       0.9117        0.2353        23.8576
     21   0.2903   0.7940        [35m0.1973[0m       0.9202        0.2327        23.8214
     22   0.3030   0.7991        [35m0.1952[0m       0.9141        0.2337        23.9546
     23   0.2938   0.7915        [35m0.1938[0m       0.9190        0.2349        23.8972
     24   [36m0.3320[0m   0.7941        [35m0.1914[0m       0.9214        0.2325        24.0436
     25   0.3085   0.7853        [35m0.1888[0m       0.9214        0.2395        24.0714
     26   0.2923   0.7819        [35m0.1868[0m       0.9238        0.2417        23.9687
Stopping since valid_loss has not improved in the last 10 epochs.
[32m[I 2023-05-04 06:40:52,362][0m Trial 414 finished with value: 0.22930717707905546 and parameters: {'lr': 7.195830762082294e-05, 'dropout': 0.30920770567196504, 'd_model_multiplier': 4, 'num_layers': 5, 'n_heads': 32, 'dim_feedforward': 339, 'batch_size': 28, 'pos_encoding': 'learnable', 'activation': 'relu', 'norm': 'LayerNorm', 'optimizer_name': 'RAdam', 'weight_decay': 0.001, 'top_n_features': 76}. Best is trial 246 with value: 0.16447311791139763.[0m
[FileBasedDataset] Initializing dataset...
	Examples: 8264
	Features: 53
	Max length: 315
Standard scalar turned ON, loading params from cache
[FileBasedDataset] Dataset initialization complete
Warning, assumed runtime error: CUDA out of memory. Tried to allocate 1.18 GiB (GPU 0; 23.70 GiB total capacity; 17.16 GiB already allocated; 595.25 MiB free; 22.03 GiB reserved in total by PyTorch) If reserved memory is >> allocated memory try setting max_split_size_mb to avoid fragmentation.  See documentation for Memory Management and PYTORCH_CUDA_ALLOC_CONF
[32m[I 2023-05-04 06:40:56,615][0m Trial 415 finished with value: 100.0 and parameters: {'lr': 0.020954600559132543, 'dropout': 0.6967331885334803, 'd_model_multiplier': 4, 'num_layers': 6, 'n_heads': 32, 'dim_feedforward': 325, 'batch_size': 100, 'pos_encoding': 'fixed', 'activation': 'relu', 'norm': 'LayerNorm', 'optimizer_name': 'RAdam', 'weight_decay': 0, 'top_n_features': 53}. Best is trial 246 with value: 0.16447311791139763.[0m
[FileBasedDataset] Initializing dataset...
	Examples: 8264
	Features: 60
	Max length: 315
Standard scalar turned ON, loading params from cache
[FileBasedDataset] Dataset initialization complete
  epoch    auprc    auroc    train_loss    valid_acc    valid_loss    cp      dur
-------  -------  -------  ------------  -----------  ------------  ----  -------
      1   [36m0.0711[0m   [32m0.3651[0m        [35m0.5987[0m       [31m0.9166[0m        [94m0.5075[0m     +  23.9340
      2   0.0677   [32m0.3732[0m        [35m0.4590[0m       0.9166        [94m0.4009[0m     +  23.4695
      3   [36m0.0754[0m   [32m0.4594[0m        [35m0.3745[0m       0.9166        [94m0.3375[0m     +  24.2763
      4   [36m0.1225[0m   [32m0.5640[0m        [35m0.3257[0m       0.9166        [94m0.3040[0m     +  24.7057
      5   [36m0.1564[0m   [32m0.6265[0m        [35m0.2977[0m       0.9166        [94m0.2866[0m     +  24.3090
      6   [36m0.1958[0m   [32m0.6651[0m        [35m0.2817[0m       0.9166        [94m0.2763[0m     +  24.1339
      7   [36m0.2287[0m   [32m0.6849[0m        [35m0.2707[0m       0.9166        [94m0.2693[0m     +  24.0382
      8   [36m0.2418[0m   [32m0.6964[0m        [35m0.2634[0m       0.9166        [94m0.2643[0m     +  23.7494
      9   [36m0.2495[0m   [32m0.7083[0m        [35m0.2577[0m       0.9154        [94m0.2603[0m     +  24.1021
     10   [36m0.2606[0m   [32m0.7197[0m        [35m0.2525[0m       0.9166        [94m0.2570[0m     +  24.2168
     11   [36m0.2684[0m   [32m0.7294[0m        [35m0.2493[0m       [31m0.9178[0m        [94m0.2544[0m     +  24.4658
     12   [36m0.2767[0m   [32m0.7375[0m        [35m0.2452[0m       0.9178        [94m0.2522[0m     +  24.0328
     13   [36m0.2804[0m   [32m0.7466[0m        [35m0.2425[0m       [31m0.9190[0m        [94m0.2502[0m     +  24.4674
     14   [36m0.2897[0m   [32m0.7535[0m        [35m0.2408[0m       0.9190        [94m0.2486[0m     +  24.3267
     15   [36m0.2926[0m   [32m0.7590[0m        [35m0.2389[0m       0.9190        [94m0.2472[0m     +  24.4298
     16   [36m0.2986[0m   [32m0.7632[0m        [35m0.2376[0m       0.9178        [94m0.2463[0m     +  24.4598
     17   [36m0.3025[0m   [32m0.7663[0m        [35m0.2360[0m       0.9190        [94m0.2455[0m     +  24.5746
     18   [36m0.3082[0m   [32m0.7691[0m        [35m0.2351[0m       0.9190        [94m0.2449[0m     +  24.2805
     19   [36m0.3107[0m   [32m0.7720[0m        [35m0.2344[0m       [31m0.9202[0m        [94m0.2444[0m     +  24.1265
     20   [36m0.3133[0m   [32m0.7740[0m        [35m0.2336[0m       0.9202        [94m0.2438[0m     +  24.1938
     21   0.3128   [32m0.7752[0m        [35m0.2330[0m       0.9202        [94m0.2434[0m     +  24.3756
     22   [36m0.3143[0m   [32m0.7763[0m        [35m0.2325[0m       [31m0.9214[0m        [94m0.2432[0m     +  24.0459
     23   0.3121   [32m0.7773[0m        [35m0.2313[0m       0.9214        [94m0.2429[0m     +  24.2268
     24   0.3137   [32m0.7785[0m        0.2318       0.9214        [94m0.2428[0m     +  24.7464
     25   [36m0.3144[0m   [32m0.7794[0m        0.2315       0.9214        [94m0.2427[0m     +  23.9963
     26   [36m0.3146[0m   [32m0.7799[0m        [35m0.2310[0m       0.9202        [94m0.2425[0m     +  24.1086
     27   0.3138   [32m0.7811[0m        [35m0.2295[0m       0.9202        [94m0.2423[0m     +  24.5749
     28   0.3138   [32m0.7813[0m        [35m0.2292[0m       0.9202        0.2424        24.2766
     29   [36m0.3148[0m   [32m0.7821[0m        0.2300       0.9202        [94m0.2423[0m     +  24.5823
     30   [36m0.3154[0m   [32m0.7829[0m        0.2296       0.9202        [94m0.2421[0m     +  24.5599
     31   [36m0.3162[0m   [32m0.7834[0m        [35m0.2284[0m       0.9202        [94m0.2420[0m     +  24.1822
     32   [36m0.3170[0m   [32m0.7839[0m        [35m0.2280[0m       0.9202        [94m0.2419[0m     +  24.1365
     33   0.3159   [32m0.7846[0m        [35m0.2272[0m       0.9202        [94m0.2417[0m     +  24.4667
     34   0.3157   [32m0.7849[0m        0.2275       0.9202        [94m0.2417[0m     +  24.3668
     35   0.3164   [32m0.7858[0m        0.2284       0.9190        [94m0.2414[0m     +  24.2556
     36   [36m0.3171[0m   [32m0.7863[0m        0.2276       0.9190        0.2415        24.1858
     37   0.3164   [32m0.7866[0m        0.2276       0.9190        0.2414        24.3303
     38   0.3163   [32m0.7874[0m        0.2276       0.9202        [94m0.2412[0m     +  24.3854
     39   0.3158   [32m0.7877[0m        [35m0.2267[0m       0.9202        0.2413        24.6353
     40   0.3152   [32m0.7877[0m        0.2281       0.9202        0.2414        24.2983
     41   [36m0.3172[0m   [32m0.7882[0m        [35m0.2258[0m       0.9202        [94m0.2412[0m     +  24.5190
     42   [36m0.3179[0m   [32m0.7891[0m        [35m0.2258[0m       0.9202        [94m0.2411[0m     +  24.2820
     43   [36m0.3185[0m   [32m0.7894[0m        0.2266       0.9202        [94m0.2410[0m     +  24.3579
     44   [36m0.3210[0m   [32m0.7899[0m        [35m0.2258[0m       0.9202        [94m0.2409[0m     +  24.6743
     45   [36m0.3220[0m   [32m0.7901[0m        [35m0.2254[0m       0.9202        0.2409        24.2625
     46   [36m0.3224[0m   [32m0.7907[0m        [35m0.2249[0m       0.9202        [94m0.2408[0m     +  24.3352
     47   [36m0.3277[0m   0.7904        0.2256       0.9190        [94m0.2408[0m     +  24.2538
     48   [36m0.3292[0m   [32m0.7913[0m        0.2257       0.9190        [94m0.2406[0m     +  24.3057
     49   0.3281   [32m0.7915[0m        0.2253       0.9178        0.2406        24.3409
     50   0.3276   [32m0.7918[0m        0.2253       0.9178        [94m0.2404[0m     +  24.2393
