[32m[I 2023-05-02 17:55:17,351][0m Trial 184 finished with value: 0.25960992904607444 and parameters: {'lr': 0.0012361427648773524, 'dropout': 0.5332641725439985, 'd_model_multiplier': 8, 'num_layers': 2, 'n_heads': 16, 'dim_feedforward': 473, 'batch_size': 35, 'pos_encoding': 'fixed', 'activation': 'gelu', 'norm': 'BatchNorm', 'optimizer_name': 'PlainRAdam', 'weight_decay': 0.1, 'top_n_features': 138}. Best is trial 117 with value: 0.191397856754288.[0m
[FileBasedDataset] Initializing dataset...
	Examples: 8264
	Features: 29
	Max length: 315
Standard scalar turned ON, loading params from cache
[FileBasedDataset] Dataset initialization complete
  epoch    auprc    auroc    train_loss    valid_acc    valid_loss    cp     dur
-------  -------  -------  ------------  -----------  ------------  ----  ------
      1   [36m0.3042[0m   [32m0.7228[0m        [35m0.3576[0m       [31m0.9226[0m        [94m0.2707[0m     +  7.9043
      2   [36m0.3547[0m   [32m0.7404[0m        [35m0.2635[0m       [31m0.9250[0m        [94m0.2525[0m     +  8.7109
      3   [36m0.3584[0m   [32m0.7413[0m        [35m0.2550[0m       [31m0.9262[0m        [94m0.2440[0m     +  8.3058
      4   [36m0.3697[0m   [32m0.7476[0m        [35m0.2548[0m       0.9262        0.2639        8.6331
      5   0.3591   0.7384        [35m0.2499[0m       [31m0.9274[0m        0.2465        9.2729
      6   0.3459   0.7364        [35m0.2452[0m       [31m0.9299[0m        [94m0.2432[0m     +  9.1983
      7   0.3603   0.7411        [35m0.2429[0m       0.9262        0.2496        9.0094
      8   0.3563   0.7377        [35m0.2419[0m       0.9287        [94m0.2372[0m     +  9.0151
      9   [36m0.3706[0m   [32m0.7512[0m        [35m0.2383[0m       0.9299        [94m0.2362[0m     +  8.8838
     10   0.3689   [32m0.7572[0m        [35m0.2336[0m       [31m0.9311[0m        [94m0.2314[0m     +  9.0423
     11   [36m0.3751[0m   [32m0.7690[0m        [35m0.2330[0m       0.9274        0.2357        8.8743
     12   [36m0.3752[0m   0.7646        [35m0.2330[0m       0.9250        [94m0.2293[0m     +  9.0974
     13   [36m0.3778[0m   [32m0.7695[0m        [35m0.2319[0m       0.9299        [94m0.2274[0m     +  8.9674
     14   0.3672   [32m0.7713[0m        [35m0.2268[0m       0.9274        [94m0.2270[0m     +  9.2150
     15   0.3646   0.7689        [35m0.2265[0m       0.9311        0.2289        9.0512
     16   [36m0.3788[0m   [32m0.7743[0m        0.2273       0.9238        [94m0.2265[0m     +  9.4052
     17   0.3666   [32m0.7745[0m        [35m0.2257[0m       0.9274        [94m0.2255[0m     +  9.1962
     18   0.3699   [32m0.7815[0m        [35m0.2235[0m       0.9262        [94m0.2253[0m     +  8.9944
     19   0.3366   0.7805        0.2235       0.9250        0.2254        8.8443
     20   0.3583   [32m0.7821[0m        [35m0.2233[0m       0.9250        [94m0.2253[0m     +  8.8058
     21   0.3666   [32m0.7848[0m        [35m0.2209[0m       0.9274        [94m0.2234[0m     +  9.0983
     22   0.3555   0.7758        0.2212       0.9262        0.2247        9.0082
     23   0.3294   0.7813        0.2221       0.9262        0.2266        9.0079
     24   0.3649   0.7815        [35m0.2198[0m       0.9262        0.2245        9.3258
     25   0.3550   0.7840        0.2203       0.9262        0.2237        9.3788
     26   0.3559   0.7813        0.2199       0.9250        0.2241        9.2818
     27   0.3609   [32m0.7856[0m        0.2211       0.9262        0.2239        9.1484
     28   0.3659   0.7854        [35m0.2174[0m       0.9262        0.2239        9.0027
     29   0.3596   [32m0.7858[0m        0.2180       0.9262        [94m0.2231[0m     +  8.9952
     30   0.3716   0.7814        [35m0.2170[0m       0.9311        [94m0.2231[0m     +  8.9584
     31   0.3625   0.7831        0.2210       0.9299        [94m0.2230[0m     +  8.8424
     32   0.3635   0.7834        0.2190       0.9274        0.2245        9.2930
     33   0.3387   0.7831        0.2182       0.9238        0.2258        9.2317
     34   0.3440   0.7795        [35m0.2170[0m       0.9262        0.2253        9.3752
     35   0.3521   0.7829        0.2172       0.9250        0.2244        9.3665
     36   0.3525   [32m0.7874[0m        [35m0.2147[0m       0.9250        [94m0.2229[0m     +  9.2440
     37   0.3484   0.7847        0.2170       0.9238        0.2241        8.7506
     38   0.3514   0.7872        [35m0.2142[0m       0.9262        0.2234        8.9812
     39   0.3502   0.7847        0.2157       0.9262        0.2254        8.9703
     40   0.3456   0.7865        0.2159       0.9238        0.2245        8.8246
     41   0.3436   0.7803        [35m0.2140[0m       0.9238        0.2256        9.0170
     42   0.3412   0.7784        0.2147       0.9299        0.2277        9.1530
     43   0.3746   0.7863        0.2155       0.9250        [94m0.2229[0m     +  9.2689
     44   0.3620   0.7834        0.2180       0.9250        0.2230        9.3583
     45   0.3488   0.7845        0.2149       0.9274        0.2251        9.0770
Stopping since valid_loss has not improved in the last 10 epochs.
[32m[I 2023-05-02 18:02:13,975][0m Trial 185 finished with value: 0.22292784103243066 and parameters: {'lr': 0.0029021281851671654, 'dropout': 0.3847640504987417, 'd_model_multiplier': 1, 'num_layers': 1, 'n_heads': 4, 'dim_feedforward': 138, 'batch_size': 56, 'pos_encoding': 'learnable', 'activation': 'gelu', 'norm': 'BatchNorm', 'optimizer_name': 'PlainRAdam', 'weight_decay': 0.01, 'top_n_features': 29}. Best is trial 117 with value: 0.191397856754288.[0m
[FileBasedDataset] Initializing dataset...
	Examples: 8264
	Features: 10
	Max length: 315
Standard scalar turned ON, loading params from cache
[FileBasedDataset] Dataset initialization complete
  epoch    auprc    auroc    train_loss    valid_acc    valid_loss    cp     dur
-------  -------  -------  ------------  -----------  ------------  ----  ------
      1   [36m0.2029[0m   [32m0.6373[0m        [35m0.2994[0m       [31m0.9202[0m        [94m0.2811[0m     +  9.4400
      2   [36m0.2040[0m   [32m0.6771[0m        [35m0.2670[0m       0.9202        [94m0.2772[0m     +  9.5376
      3   [36m0.2142[0m   [32m0.7023[0m        [35m0.2611[0m       0.9202        0.2804        9.4323
      4   [36m0.2187[0m   0.6996        [35m0.2575[0m       0.9202        0.2820        9.5961
      5   [36m0.2191[0m   [32m0.7202[0m        0.2587       0.9202        0.2841        9.8284
      6   [36m0.2192[0m   0.7148        0.2580       0.9202        0.2853        10.3199
      7   [36m0.2466[0m   [32m0.7494[0m        [35m0.2567[0m       0.9202        0.2846        9.2953
      8   [36m0.2561[0m   [32m0.7547[0m        [35m0.2548[0m       0.9202        0.2774        9.7089
      9   0.2559   [32m0.7584[0m        [35m0.2543[0m       0.9202        [94m0.2730[0m     +  9.4162
     10   0.2119   0.6840        0.2557       0.9202        0.2945        9.6356
     11   [36m0.2709[0m   [32m0.7611[0m        0.2552       0.9202        [94m0.2637[0m     +  9.6001
     12   [36m0.2767[0m   [32m0.7643[0m        0.2554       0.9202        [94m0.2608[0m     +  9.5808
     13   0.2602   0.7626        0.2546       0.9202        0.2629        9.5749
     14   0.2505   0.7581        0.2547       0.9202        0.2612        9.8126
     15   0.2674   0.7627        [35m0.2535[0m       0.9202        [94m0.2537[0m     +  9.4822
     16   [36m0.2817[0m   0.7630        0.2558       0.9202        [94m0.2487[0m     +  9.7239
     17   0.2612   0.7540        [35m0.2507[0m       0.9202        0.2500        9.6181
     18   0.2468   0.7516        [35m0.2502[0m       0.9202        0.2580        9.8451
     19   0.2551   0.7623        0.2520       0.9202        [94m0.2481[0m     +  9.7220
     20   0.2531   0.7539        0.2521       0.9202        0.2494        9.5727
     21   0.2454   0.7562        0.2532       0.9202        [94m0.2451[0m     +  9.6596
     22   0.2555   0.7554        0.2538       0.9202        [94m0.2433[0m     +  9.4304
     23   0.2366   0.7411        0.2519       0.9202        0.2484        9.5073
     24   0.2609   0.7575        0.2525       0.9202        0.2437        9.5474
     25   0.2737   0.7579        0.2525       0.9202        [94m0.2414[0m     +  9.9500
     26   0.2207   0.7180        0.2514       0.9202        0.2527        9.7003
     27   0.2572   0.7531        0.2507       0.9202        0.2436        9.8126
     28   0.2787   0.7566        0.2525       0.9202        [94m0.2393[0m     +  10.0052
     29   0.2700   0.7564        0.2509       0.9202        0.2403        9.5766
     30   0.2390   0.7494        0.2524       0.9202        0.2455        9.6995
     31   0.2576   0.7581        0.2513       0.9202        0.2433        9.4213
     32   0.2654   0.7581        0.2521       0.9202        0.2433        9.5613
     33   0.2772   0.7560        0.2523       0.9202        0.2447        9.8239
     34   0.2614   0.7562        [35m0.2496[0m       0.9202        0.2467        9.7025
     35   0.2708   0.7574        0.2509       0.9202        0.2485        9.4292
     36   [36m0.2872[0m   0.7630        [35m0.2496[0m       0.9202        0.2440        9.6399
     37   0.2653   0.7529        0.2497       0.9202        0.2465        9.7062
Stopping since valid_loss has not improved in the last 10 epochs.
[32m[I 2023-05-02 18:08:22,460][0m Trial 186 finished with value: 0.23928272250269458 and parameters: {'lr': 0.0008645977745934663, 'dropout': 0.3541616972018524, 'd_model_multiplier': 8, 'num_layers': 2, 'n_heads': 16, 'dim_feedforward': 459, 'batch_size': 20, 'pos_encoding': 'fixed', 'activation': 'relu', 'norm': 'LayerNorm', 'optimizer_name': 'AdamW', 'weight_decay': 0, 'top_n_features': 10}. Best is trial 117 with value: 0.191397856754288.[0m
[FileBasedDataset] Initializing dataset...
	Examples: 8264
	Features: 47
	Max length: 315
Standard scalar turned ON, loading params from cache
[FileBasedDataset] Dataset initialization complete
  epoch    auprc    auroc    train_loss    valid_acc    valid_loss    cp      dur
-------  -------  -------  ------------  -----------  ------------  ----  -------
      1   [36m0.3465[0m   [32m0.8004[0m        [35m0.3467[0m       [31m0.9359[0m        [94m0.3258[0m     +  16.4619
      2   0.3304   [32m0.8015[0m        [35m0.2727[0m       0.9335        [94m0.2748[0m     +  16.9278
      3   0.3454   [32m0.8090[0m        [35m0.2628[0m       0.9335        [94m0.2580[0m     +  16.9417
      4   [36m0.3966[0m   [32m0.8352[0m        [35m0.2551[0m       0.9287        0.2626        16.7243
      5   0.3840   0.8234        [35m0.2467[0m       0.9359        [94m0.2324[0m     +  17.2233
      6   [36m0.4184[0m   [32m0.8376[0m        [35m0.2447[0m       0.9335        [94m0.2317[0m     +  16.9610
      7   [36m0.4326[0m   [32m0.8380[0m        [35m0.2381[0m       [31m0.9371[0m        [94m0.2169[0m     +  17.0678
      8   0.4185   0.8340        [35m0.2341[0m       0.9347        0.2228        16.9971
      9   0.4232   0.8336        0.2348       [31m0.9395[0m        [94m0.2138[0m     +  16.9980
     10   [36m0.4408[0m   0.8345        [35m0.2333[0m       0.9395        0.2259        16.9106
     11   0.4072   0.8294        [35m0.2272[0m       0.9383        [94m0.2118[0m     +  16.8047
     12   0.4211   0.8280        0.2283       0.9395        0.2126        17.0056
     13   0.4225   0.8298        [35m0.2261[0m       0.9371        0.2198        16.9008
     14   0.4082   0.8301        [35m0.2218[0m       0.9335        0.2178        16.8038
     15   0.3963   0.8252        0.2248       0.9299        0.2273        16.8983
     16   0.4052   0.8220        0.2270       0.9323        0.2207        16.8748
     17   0.4193   0.8245        0.2227       0.9335        0.2207        17.1336
     18   [36m0.4421[0m   0.8344        [35m0.2197[0m       0.9395        [94m0.2087[0m     +  17.0265
     19   0.4181   0.8315        [35m0.2183[0m       0.9323        0.2170        17.0329
     20   0.4108   0.8302        0.2204       0.9347        0.2227        16.9141
     21   [36m0.4429[0m   0.8252        0.2202       0.9383        0.2168        16.9995
     22   0.4278   0.8140        [35m0.2179[0m       0.9395        0.2123        16.8703
     23   [36m0.4696[0m   0.8294        [35m0.2106[0m       0.9395        0.2171        16.8620
     24   0.4491   0.8274        0.2158       0.9323        0.2214        16.8877
     25   0.4388   0.8271        0.2134       0.9323        0.2142        17.1067
     26   0.4398   0.8258        0.2177       0.9311        0.2151        17.0584
     27   0.4236   0.8281        0.2126       0.9359        0.2102        16.9236
Stopping since valid_loss has not improved in the last 10 epochs.
[32m[I 2023-05-02 18:16:17,891][0m Trial 187 finished with value: 0.20869648737659477 and parameters: {'lr': 0.0005649340249787225, 'dropout': 0.4678630705316008, 'd_model_multiplier': 4, 'num_layers': 3, 'n_heads': 32, 'dim_feedforward': 433, 'batch_size': 63, 'pos_encoding': 'learnable', 'activation': 'gelu', 'norm': 'BatchNorm', 'optimizer_name': 'PlainRAdam', 'weight_decay': 0.1, 'top_n_features': 47}. Best is trial 117 with value: 0.191397856754288.[0m
[FileBasedDataset] Initializing dataset...
	Examples: 8264
	Features: 49
	Max length: 315
Standard scalar turned ON, loading params from cache
[FileBasedDataset] Dataset initialization complete
  epoch    auprc    auroc    train_loss    valid_acc    valid_loss    cp      dur
-------  -------  -------  ------------  -----------  ------------  ----  -------
      1   [36m0.2992[0m   [32m0.7832[0m        [35m0.3492[0m       [31m0.9202[0m        [94m0.3477[0m     +  34.1321
      2   [36m0.3196[0m   [32m0.8112[0m        [35m0.2688[0m       [31m0.9250[0m        [94m0.2774[0m     +  33.9986
      3   [36m0.3240[0m   [32m0.8189[0m        [35m0.2611[0m       [31m0.9335[0m        [94m0.2495[0m     +  34.3362
      4   0.3183   0.8165        [35m0.2567[0m       0.9287        0.2554        34.0056
      5   0.3127   0.8123        [35m0.2551[0m       0.9299        [94m0.2267[0m     +  34.2383
      6   0.3076   [32m0.8241[0m        [35m0.2496[0m       0.9335        [94m0.2139[0m     +  33.9735
      7   0.3002   0.8071        [35m0.2469[0m       0.9311        [94m0.2108[0m     +  34.0918
      8   [36m0.3345[0m   [32m0.8281[0m        [35m0.2426[0m       0.9299        0.2161        34.2327
      9   [36m0.3400[0m   [32m0.8286[0m        [35m0.2403[0m       0.9262        0.2220        34.1850
     10   0.3390   0.8063        [35m0.2390[0m       0.9299        0.2184        34.1924
     11   0.3114   0.7976        [35m0.2358[0m       0.9335        0.2165        34.1242
     12   0.3014   0.7985        [35m0.2337[0m       [31m0.9371[0m        0.2112        34.1743
     13   0.3041   0.7982        0.2345       0.9371        [94m0.2096[0m     +  34.3143
     14   0.3097   0.7942        0.2361       0.9323        0.2161        34.3372
     15   0.3156   0.7963        [35m0.2277[0m       0.9299        0.2219        34.1388
     16   0.2953   0.7900        0.2302       0.9359        0.2189        34.0682
     17   0.2961   0.7891        0.2310       0.9371        0.2119        34.1399
     18   0.3204   0.8139        0.2292       0.9214        0.2197        34.2844
     19   0.3116   0.8015        [35m0.2242[0m       0.9347        0.2103        34.3268
     20   0.2811   0.7781        [35m0.2227[0m       0.9335        0.2156        34.2756
     21   0.2995   0.7997        [35m0.2197[0m       0.9214        0.2350        34.2544
     22   0.3063   0.8030        0.2229       0.9238        0.2322        34.2280
     23   0.3133   0.8041        0.2215       [31m0.9383[0m        [94m0.2062[0m     +  34.2018
     24   0.2903   0.7904        0.2216       0.9323        0.2234        34.7667
     25   0.3118   0.8042        [35m0.2175[0m       0.9311        0.2155        34.0465
     26   0.2948   0.8118        0.2182       0.9262        0.2208        34.1525
     27   0.3230   0.8227        0.2209       0.9311        0.2111        34.2055
     28   0.2969   0.8071        [35m0.2148[0m       0.9274        0.2170        34.3269
     29   0.2898   0.8027        0.2158       0.9129        0.2369        34.2850
     30   0.3248   0.8169        [35m0.2134[0m       0.9311        0.2172        34.2372
     31   0.3083   0.8153        [35m0.2127[0m       0.9154        0.2250        34.1782
     32   0.3158   0.8154        0.2138       0.9214        0.2219        34.1368
Stopping since valid_loss has not improved in the last 10 epochs.
[32m[I 2023-05-02 18:35:07,678][0m Trial 188 finished with value: 0.20621031728159847 and parameters: {'lr': 0.0006255674029442698, 'dropout': 0.4742317768395718, 'd_model_multiplier': 2, 'num_layers': 4, 'n_heads': 64, 'dim_feedforward': 414, 'batch_size': 63, 'pos_encoding': 'fixed', 'activation': 'gelu', 'norm': 'BatchNorm', 'optimizer_name': 'PlainRAdam', 'weight_decay': 0.1, 'top_n_features': 49}. Best is trial 117 with value: 0.191397856754288.[0m
[FileBasedDataset] Initializing dataset...
	Examples: 8264
	Features: 50
	Max length: 315
Standard scalar turned ON, loading params from cache
[FileBasedDataset] Dataset initialization complete
  epoch    auprc    auroc    train_loss    valid_acc    valid_loss    cp      dur
-------  -------  -------  ------------  -----------  ------------  ----  -------
      1   [36m0.2397[0m   [32m0.7455[0m        [35m0.2856[0m       [31m0.9371[0m        [94m0.2400[0m     +  34.1671
      2   0.2386   [32m0.7623[0m        [35m0.2602[0m       0.9335        [94m0.2343[0m     +  34.3608
      3   0.2338   0.7512        [35m0.2560[0m       0.9371        [94m0.2245[0m     +  34.5617
      4   [36m0.2429[0m   0.7530        [35m0.2430[0m       0.9347        0.2272        34.3109
      5   0.2126   0.7540        [35m0.2424[0m       0.9287        0.2482        34.4327
      6   [36m0.2561[0m   [32m0.7714[0m        [35m0.2422[0m       0.9371        0.2248        34.4935
      7   [36m0.2664[0m   0.7560        [35m0.2367[0m       0.9371        0.2358        34.6260
      8   0.2586   0.7417        0.2382       0.9371        0.2401        34.9546
      9   0.2515   0.7621        [35m0.2334[0m       0.9347        0.2399        34.7682
     10   0.2651   0.7655        [35m0.2313[0m       0.9347        0.2444        34.6414
     11   [36m0.2954[0m   [32m0.7800[0m        0.2317       [31m0.9383[0m        0.2349        34.4946
     12   0.2925   0.7697        [35m0.2287[0m       [31m0.9407[0m        0.2436        34.9224
Stopping since valid_loss has not improved in the last 10 epochs.
