[32m[I 2023-05-05 04:46:13,073][0m Trial 546 finished with value: 0.23886770462254658 and parameters: {'lr': 0.0013832409674248342, 'dropout': 0.5206581455260998, 'd_model_multiplier': 4, 'num_layers': 5, 'n_heads': 64, 'dim_feedforward': 371, 'batch_size': 29, 'pos_encoding': 'fixed', 'activation': 'relu', 'norm': 'LayerNorm', 'optimizer_name': 'AdamW', 'weight_decay': 0.001, 'top_n_features': 46}. Best is trial 246 with value: 0.16447311791139763.[0m
[FileBasedDataset] Initializing dataset...
	Examples: 8264
	Features: 110
	Max length: 315
Standard scalar turned ON, loading params from cache
[FileBasedDataset] Dataset initialization complete
  epoch    auprc    auroc    train_loss    valid_acc    valid_loss    cp     dur
-------  -------  -------  ------------  -----------  ------------  ----  ------
      1   [36m0.1456[0m   [32m0.6787[0m        [35m0.2779[0m       [31m0.9250[0m        [94m0.2655[0m     +  8.7949
      2   [36m0.1493[0m   [32m0.6866[0m        [35m0.2623[0m       0.9226        [94m0.2646[0m     +  8.8353
      3   0.1485   [32m0.6911[0m        [35m0.2586[0m       0.9226        [94m0.2640[0m     +  9.5682
      4   [36m0.1908[0m   [32m0.7662[0m        [35m0.2545[0m       0.9250        [94m0.2440[0m     +  9.4435
      5   [36m0.1949[0m   0.7374        [35m0.2460[0m       0.9238        [94m0.2439[0m     +  9.6400
      6   [36m0.2200[0m   0.7414        [35m0.2406[0m       0.9250        [94m0.2437[0m     +  9.5616
      7   0.1914   0.7170        [35m0.2368[0m       0.9250        0.2483        9.4847
      8   0.1485   0.6902        0.2402       0.9250        0.2496        9.4365
      9   [36m0.2481[0m   [32m0.7925[0m        0.2393       0.9226        [94m0.2273[0m     +  9.5734
     10   0.2248   0.7835        0.2379       0.9238        0.2302        9.4205
     11   0.2448   0.7860        0.2377       0.9214        0.2290        9.5292
     12   [36m0.2589[0m   0.7921        [35m0.2349[0m       0.9214        0.2358        9.5704
     13   [36m0.2797[0m   [32m0.7959[0m        0.2359       0.9214        [94m0.2272[0m     +  9.8068
     14   0.1926   0.7568        [35m0.2348[0m       0.9093        0.2545        9.3176
     15   0.2258   0.7546        0.2371       0.9238        0.2371        9.6036
     16   0.2450   0.7535        0.2379       0.9250        0.2528        9.5417
     17   0.2118   0.7637        0.2383       0.9214        0.2367        9.5004
     18   0.1749   0.7255        0.2364       0.8960        0.2570        9.6136
     19   0.2642   0.7692        0.2361       0.9202        0.2396        9.3052
     20   0.2259   0.7092        0.2395       [31m0.9262[0m        0.2533        9.5458
     21   0.1790   0.7301        0.2357       0.8960        0.2715        9.5932
     22   0.2461   0.7606        0.2350       0.9226        0.2417        9.4407
Stopping since valid_loss has not improved in the last 10 epochs.
[32m[I 2023-05-05 04:49:51,346][0m Trial 547 finished with value: 0.22723334033082734 and parameters: {'lr': 0.0018127505436266401, 'dropout': 0.31184575807554343, 'd_model_multiplier': 4, 'num_layers': 3, 'n_heads': 8, 'dim_feedforward': 305, 'batch_size': 33, 'pos_encoding': 'fixed', 'activation': 'relu', 'norm': 'LayerNorm', 'optimizer_name': 'AdamW', 'weight_decay': 0.001, 'top_n_features': 110}. Best is trial 246 with value: 0.16447311791139763.[0m
[FileBasedDataset] Initializing dataset...
	Examples: 8264
	Features: 42
	Max length: 315
Standard scalar turned ON, loading params from cache
[FileBasedDataset] Dataset initialization complete
  epoch    auprc    auroc    train_loss    valid_acc    valid_loss    cp      dur
-------  -------  -------  ------------  -----------  ------------  ----  -------
      1   [36m0.2190[0m   [32m0.7198[0m        [35m0.3095[0m       [31m0.9129[0m        [94m0.2859[0m     +  31.1111
      2   [36m0.2363[0m   [32m0.7214[0m        [35m0.2623[0m       0.9021        0.2868        31.2726
      3   0.2314   0.7194        [35m0.2582[0m       0.9105        [94m0.2813[0m     +  31.5565
      4   0.2348   0.7214        0.2586       0.9105        [94m0.2786[0m     +  31.4938
      5   0.2343   [32m0.7251[0m        [35m0.2573[0m       0.9129        [94m0.2725[0m     +  31.3889
      6   0.2261   0.7152        [35m0.2559[0m       [31m0.9141[0m        0.2737        31.5201
      7   0.2359   0.7249        [35m0.2552[0m       0.9105        [94m0.2696[0m     +  31.4243
      8   [36m0.2366[0m   [32m0.7362[0m        0.2577       0.9081        0.2763        31.3073
      9   0.2355   0.7236        [35m0.2536[0m       0.9105        0.2903        31.4809
     10   [36m0.2436[0m   0.7346        [35m0.2532[0m       0.9105        0.2996        31.5001
     11   0.2361   0.7289        0.2553       0.9141        0.2960        31.4546
     12   0.2377   0.7263        [35m0.2527[0m       0.9105        0.3108        31.3894
     13   0.2296   0.7243        0.2548       0.9129        0.3488        31.2489
     14   0.2260   0.7166        0.2543       0.9141        0.3803        31.4714
     15   [36m0.2624[0m   0.7330        0.2556       0.9129        0.3849        31.5259
     16   0.2288   0.7121        0.2559       0.9129        0.3327        31.6411
Stopping since valid_loss has not improved in the last 10 epochs.
[32m[I 2023-05-05 04:58:46,713][0m Trial 548 finished with value: 0.26959631007340396 and parameters: {'lr': 0.002313858826025731, 'dropout': 0.49397709230802156, 'd_model_multiplier': 4, 'num_layers': 7, 'n_heads': 32, 'dim_feedforward': 334, 'batch_size': 26, 'pos_encoding': 'learnable', 'activation': 'relu', 'norm': 'LayerNorm', 'optimizer_name': 'AdamW', 'weight_decay': 0.001, 'top_n_features': 42}. Best is trial 246 with value: 0.16447311791139763.[0m
[FileBasedDataset] Initializing dataset...
	Examples: 8264
	Features: 50
	Max length: 315
Standard scalar turned ON, loading params from cache
[FileBasedDataset] Dataset initialization complete
  epoch    auprc    auroc    train_loss    valid_acc    valid_loss    cp     dur
-------  -------  -------  ------------  -----------  ------------  ----  ------
      1   [36m0.0693[0m   [32m0.3355[0m        [35m0.6300[0m       [31m0.9214[0m        [94m0.5669[0m     +  9.0102
      2   0.0633   0.3229        [35m0.5256[0m       0.9214        [94m0.4806[0m     +  9.1797
      3   0.0599   0.3262        [35m0.4541[0m       0.9214        [94m0.4213[0m     +  9.8369
      4   0.0599   [32m0.3432[0m        [35m0.4058[0m       0.9214        [94m0.3802[0m     +  9.3370
      5   0.0613   [32m0.3686[0m        [35m0.3714[0m       0.9214        [94m0.3511[0m     +  9.1079
      6   0.0636   [32m0.3974[0m        [35m0.3452[0m       0.9214        [94m0.3301[0m     +  9.6116
      7   0.0659   [32m0.4232[0m        [35m0.3264[0m       0.9214        [94m0.3147[0m     +  9.3117
      8   0.0689   [32m0.4525[0m        [35m0.3125[0m       0.9214        [94m0.3031[0m     +  9.9281
      9   [36m0.0734[0m   [32m0.4852[0m        [35m0.3023[0m       0.9214        [94m0.2942[0m     +  9.5712
     10   [36m0.0796[0m   [32m0.5209[0m        [35m0.2947[0m       0.9214        [94m0.2870[0m     +  9.3460
     11   [36m0.0873[0m   [32m0.5541[0m        [35m0.2877[0m       0.9214        [94m0.2812[0m     +  9.4408
     12   [36m0.0953[0m   [32m0.5802[0m        [35m0.2818[0m       0.9214        [94m0.2764[0m     +  9.7005
     13   [36m0.1167[0m   [32m0.6059[0m        [35m0.2773[0m       0.9214        [94m0.2722[0m     +  9.2182
     14   [36m0.1303[0m   [32m0.6268[0m        [35m0.2729[0m       0.9214        [94m0.2686[0m     +  9.4286
     15   [36m0.1565[0m   [32m0.6464[0m        [35m0.2708[0m       0.9214        [94m0.2654[0m     +  9.4575
     16   [36m0.1749[0m   [32m0.6619[0m        [35m0.2676[0m       0.9214        [94m0.2627[0m     +  9.4696
     17   [36m0.1849[0m   [32m0.6746[0m        [35m0.2651[0m       0.9214        [94m0.2603[0m     +  9.4505
     18   [36m0.2005[0m   [32m0.6889[0m        [35m0.2625[0m       0.9214        [94m0.2582[0m     +  9.0706
     19   [36m0.2128[0m   [32m0.6992[0m        [35m0.2604[0m       0.9214        [94m0.2564[0m     +  9.5071
     20   [36m0.2216[0m   [32m0.7063[0m        [35m0.2586[0m       0.9214        [94m0.2547[0m     +  9.2295
     21   [36m0.2265[0m   [32m0.7133[0m        [35m0.2563[0m       0.9214        [94m0.2532[0m     +  9.1334
     22   [36m0.2296[0m   [32m0.7187[0m        [35m0.2547[0m       0.9214        [94m0.2519[0m     +  9.3592
     23   [36m0.2339[0m   [32m0.7253[0m        [35m0.2544[0m       0.9214        [94m0.2508[0m     +  9.2884
     24   [36m0.2368[0m   [32m0.7302[0m        [35m0.2533[0m       0.9214        [94m0.2497[0m     +  9.3313
     25   [36m0.2392[0m   [32m0.7346[0m        [35m0.2518[0m       0.9214        [94m0.2488[0m     +  9.3140
     26   [36m0.2409[0m   [32m0.7391[0m        [35m0.2516[0m       0.9214        [94m0.2480[0m     +  9.4205
     27   0.2399   [32m0.7422[0m        [35m0.2511[0m       0.9214        [94m0.2473[0m     +  9.3999
     28   [36m0.2444[0m   [32m0.7452[0m        [35m0.2498[0m       0.9214        [94m0.2467[0m     +  9.3183
     29   [36m0.2467[0m   [32m0.7485[0m        [35m0.2490[0m       0.9214        [94m0.2462[0m     +  9.3948
     30   [36m0.2483[0m   [32m0.7514[0m        [35m0.2484[0m       0.9214        [94m0.2455[0m     +  9.3382
     31   [36m0.2491[0m   [32m0.7545[0m        [35m0.2474[0m       0.9214        [94m0.2451[0m     +  9.4156
     32   [36m0.2514[0m   [32m0.7574[0m        [35m0.2470[0m       0.9214        [94m0.2445[0m     +  9.1957
     33   0.2509   [32m0.7596[0m        [35m0.2467[0m       0.9214        [94m0.2441[0m     +  9.5339
     34   [36m0.2532[0m   [32m0.7616[0m        [35m0.2459[0m       0.9214        [94m0.2437[0m     +  9.3122
     35   0.2529   [32m0.7625[0m        [35m0.2450[0m       0.9214        [94m0.2433[0m     +  9.1585
     36   [36m0.2535[0m   [32m0.7646[0m        [35m0.2448[0m       0.9214        [94m0.2429[0m     +  9.0936
     37   [36m0.2544[0m   [32m0.7664[0m        [35m0.2445[0m       0.9214        [94m0.2426[0m     +  9.2915
     38   [36m0.2559[0m   [32m0.7672[0m        [35m0.2439[0m       0.9214        [94m0.2423[0m     +  9.5046
     39   [36m0.2565[0m   [32m0.7691[0m        [35m0.2432[0m       0.9214        [94m0.2420[0m     +  9.3090
     40   [36m0.2586[0m   [32m0.7709[0m        [35m0.2427[0m       0.9214        [94m0.2418[0m     +  9.2752
     41   [36m0.2587[0m   [32m0.7722[0m        [35m0.2425[0m       0.9214        [94m0.2416[0m     +  9.2075
     42   [36m0.2601[0m   [32m0.7737[0m        0.2428       0.9214        [94m0.2413[0m     +  9.4480
     43   [36m0.2635[0m   [32m0.7749[0m        [35m0.2419[0m       0.9214        [94m0.2412[0m     +  9.4539
     44   [36m0.2646[0m   [32m0.7758[0m        [35m0.2413[0m       0.9214        [94m0.2410[0m     +  9.3269
     45   [36m0.2658[0m   [32m0.7767[0m        [35m0.2410[0m       0.9214        [94m0.2409[0m     +  9.2400
     46   [36m0.2665[0m   [32m0.7773[0m        0.2416       0.9214        [94m0.2407[0m     +  9.0861
     47   0.2649   [32m0.7787[0m        [35m0.2404[0m       0.9214        [94m0.2405[0m     +  9.2217
     48   0.2659   [32m0.7790[0m        0.2404       0.9214        [94m0.2404[0m     +  9.3679
     49   [36m0.2666[0m   [32m0.7801[0m        0.2405       0.9202        [94m0.2402[0m     +  9.4246
     50   [36m0.2676[0m   [32m0.7810[0m        [35m0.2403[0m       0.9202        [94m0.2401[0m     +  9.4228
[32m[I 2023-05-05 05:06:40,645][0m Trial 549 finished with value: 0.2400809368197474 and parameters: {'lr': 5.471493623090236e-07, 'dropout': 0.28306509124872403, 'd_model_multiplier': 4, 'num_layers': 1, 'n_heads': 32, 'dim_feedforward': 413, 'batch_size': 17, 'pos_encoding': 'fixed', 'activation': 'relu', 'norm': 'LayerNorm', 'optimizer_name': 'AdamW', 'weight_decay': 0.001, 'top_n_features': 50}. Best is trial 246 with value: 0.16447311791139763.[0m
[FileBasedDataset] Initializing dataset...
	Examples: 8264
	Features: 99
	Max length: 315
Standard scalar turned ON, loading params from cache
[FileBasedDataset] Dataset initialization complete
  epoch    auprc    auroc    train_loss    valid_acc    valid_loss    cp      dur
-------  -------  -------  ------------  -----------  ------------  ----  -------
      1   [36m0.1586[0m   [32m0.6929[0m        [35m0.3022[0m       [31m0.9383[0m        [94m0.2430[0m     +  23.8099
      2   [36m0.1626[0m   [32m0.6956[0m        [35m0.2742[0m       0.9383        0.2616        23.9564
      3   [36m0.1742[0m   0.6898        [35m0.2681[0m       0.9383        0.2636        24.0231
      4   0.1705   [32m0.6995[0m        [35m0.2677[0m       0.9383        0.2628        23.9627
      5   [36m0.1931[0m   [32m0.7048[0m        [35m0.2613[0m       [31m0.9395[0m        0.2650        24.0248
      6   0.1784   0.6967        0.2634       0.9383        0.2568        24.0313
      7   0.1795   0.6819        [35m0.2600[0m       0.9383        0.2611        24.0476
      8   0.1801   0.6886        0.2618       0.9383        0.2490        24.0874
      9   0.1846   0.6887        [35m0.2596[0m       0.9383        0.2437        23.9476
     10   0.1860   0.7000        [35m0.2577[0m       0.9383        0.2467        24.1552
Stopping since valid_loss has not improved in the last 10 epochs.
[32m[I 2023-05-05 05:11:05,182][0m Trial 550 finished with value: 0.24296800335902977 and parameters: {'lr': 0.0012127622649995948, 'dropout': 0.5350265700489737, 'd_model_multiplier': 4, 'num_layers': 5, 'n_heads': 32, 'dim_feedforward': 353, 'batch_size': 22, 'pos_encoding': 'fixed', 'activation': 'relu', 'norm': 'LayerNorm', 'optimizer_name': 'AdamW', 'weight_decay': 0.001, 'top_n_features': 99}. Best is trial 246 with value: 0.16447311791139763.[0m
[FileBasedDataset] Initializing dataset...
	Examples: 8264
	Features: 67
	Max length: 315
Standard scalar turned ON, loading params from cache
[FileBasedDataset] Dataset initialization complete
  epoch    auprc    auroc    train_loss    valid_acc    valid_loss    cp      dur
-------  -------  -------  ------------  -----------  ------------  ----  -------
      1   [36m0.0942[0m   [32m0.4856[0m        [35m0.6483[0m       [31m0.9190[0m        [94m0.6211[0m     +  12.3910
      2   0.0673   0.3862        [35m0.5979[0m       [31m0.9226[0m        [94m0.5684[0m     +  12.4152
      3   0.0607   0.3670        [35m0.5548[0m       0.9226        [94m0.5198[0m     +  12.4578
      4   0.0588   0.3585        [35m0.5175[0m       0.9226        [94m0.4767[0m     +  12.3006
      5   0.0589   0.3570        [35m0.4839[0m       0.9226        [94m0.4408[0m     +  12.0891
      6   0.0589   0.3548        [35m0.4562[0m       0.9226        [94m0.4114[0m     +  11.9559
      7   0.0592   0.3566        [35m0.4330[0m       0.9226        [94m0.3885[0m     +  11.9712
      8   0.0594   0.3589        [35m0.4100[0m       0.9226        [94m0.3704[0m     +  11.9533
      9   0.0598   0.3621        [35m0.3935[0m       0.9226        [94m0.3559[0m     +  12.0115
     10   0.0603   0.3658        [35m0.3778[0m       0.9226        [94m0.3440[0m     +  12.1320
     11   0.0608   0.3725        [35m0.3663[0m       0.9226        [94m0.3340[0m     +  11.8407
     12   0.0614   0.3856        [35m0.3539[0m       0.9226        [94m0.3253[0m     +  11.9638
     13   0.0630   0.4049        [35m0.3452[0m       0.9226        [94m0.3178[0m     +  11.8699
     14   0.0648   0.4227        [35m0.3354[0m       0.9226        [94m0.3112[0m     +  12.1293
     15   0.0668   0.4403        [35m0.3277[0m       0.9226        [94m0.3055[0m     +  12.0390
     16   0.0692   0.4567        [35m0.3218[0m       0.9226        [94m0.3003[0m     +  11.7889
     17   0.0723   0.4732        [35m0.3167[0m       0.9226        [94m0.2959[0m     +  12.0487
     18   0.0752   [32m0.4870[0m        [35m0.3118[0m       0.9226        [94m0.2920[0m     +  12.0643
     19   0.0791   [32m0.4989[0m        [35m0.3074[0m       0.9226        [94m0.2886[0m     +  12.0766
     20   0.0837   [32m0.5106[0m        [35m0.3025[0m       0.9226        [94m0.2855[0m     +  11.9764
     21   [36m0.1049[0m   [32m0.5242[0m        [35m0.2976[0m       0.9226        [94m0.2828[0m     +  12.0517
     22   [36m0.1096[0m   [32m0.5324[0m        [35m0.2967[0m       0.9226        [94m0.2804[0m     +  11.9689
     23   [36m0.1282[0m   [32m0.5412[0m        [35m0.2919[0m       0.9226        [94m0.2783[0m     +  12.2680
     24   [36m0.1519[0m   [32m0.5483[0m        [35m0.2890[0m       0.9226        [94m0.2764[0m     +  11.8511
     25   [36m0.1524[0m   [32m0.5509[0m        [35m0.2865[0m       0.9226        [94m0.2748[0m     +  11.9848
     26   [36m0.1693[0m   [32m0.5582[0m        [35m0.2852[0m       0.9226        [94m0.2733[0m     +  11.9859
     27   [36m0.1713[0m   [32m0.5618[0m        [35m0.2814[0m       0.9226        [94m0.2720[0m     +  11.7681
     28   [36m0.1756[0m   [32m0.5644[0m        [35m0.2806[0m       0.9226        [94m0.2708[0m     +  11.9765
     29   [36m0.1790[0m   [32m0.5670[0m        [35m0.2785[0m       0.9226        [94m0.2698[0m     +  12.0936
     30   [36m0.1829[0m   [32m0.5705[0m        [35m0.2758[0m       0.9226        [94m0.2689[0m     +  12.3998
     31   [36m0.1846[0m   [32m0.5731[0m        0.2760       0.9226        [94m0.2681[0m     +  11.9645
     32   [36m0.1899[0m   [32m0.5738[0m        [35m0.2755[0m       0.9226        [94m0.2674[0m     +  12.0374
     33   [36m0.1927[0m   [32m0.5769[0m        [35m0.2712[0m       0.9226        [94m0.2668[0m     +  11.8582
     34   [36m0.1940[0m   [32m0.5787[0m        [35m0.2708[0m       0.9226        [94m0.2662[0m     +  12.0588
     35   [36m0.1950[0m   [32m0.5799[0m        0.2716       0.9226        [94m0.2657[0m     +  12.3002
     36   [36m0.1956[0m   [32m0.5816[0m        [35m0.2696[0m       0.9226        [94m0.2652[0m     +  12.5267
     37   [36m0.1956[0m   [32m0.5837[0m        0.2696       0.9226        [94m0.2648[0m     +  12.2069
     38   0.1954   [32m0.5859[0m        [35m0.2668[0m       0.9226        [94m0.2643[0m     +  11.9372
     39   [36m0.1968[0m   [32m0.5895[0m        0.2672       0.9226        [94m0.2638[0m     +  12.0384
     40   [36m0.2031[0m   [32m0.5921[0m        [35m0.2661[0m       0.9226        [94m0.2635[0m     +  12.0295
     41   0.2004   [32m0.5946[0m        [35m0.2622[0m       0.9226        [94m0.2631[0m     +  12.0086
     42   0.2018   [32m0.5981[0m        0.2633       0.9226        [94m0.2627[0m     +  12.0968
     43   [36m0.2038[0m   [32m0.6019[0m        0.2629       0.9226        [94m0.2622[0m     +  11.8930
     44   [36m0.2051[0m   [32m0.6050[0m        [35m0.2612[0m       0.9226        [94m0.2617[0m     +  11.8568
     45   [36m0.2082[0m   [32m0.6098[0m        0.2642       0.9226        [94m0.2611[0m     +  11.8266
     46   0.2014   [32m0.6131[0m        0.2622       [31m0.9238[0m        [94m0.2608[0m     +  12.1080
     47   0.2035   [32m0.6178[0m        0.2620       0.9238        [94m0.2603[0m     +  11.7260
     48   0.2043   [32m0.6222[0m        [35m0.2592[0m       0.9238        [94m0.2596[0m     +  12.3067
     49   0.2061   [32m0.6276[0m        [35m0.2577[0m       0.9238        [94m0.2590[0m     +  11.9793
     50   0.2071   [32m0.6327[0m        0.2588       0.9238        [94m0.2584[0m     +  11.8479
