[32m[I 2023-05-02 19:35:22,103][0m Trial 193 finished with value: 0.19645712939975052 and parameters: {'lr': 0.0009585082678445079, 'dropout': 0.45314243457968195, 'd_model_multiplier': 2, 'num_layers': 5, 'n_heads': 4, 'dim_feedforward': 329, 'batch_size': 52, 'pos_encoding': 'fixed', 'activation': 'gelu', 'norm': 'BatchNorm', 'optimizer_name': 'PlainRAdam', 'weight_decay': 0.1, 'top_n_features': 33}. Best is trial 117 with value: 0.191397856754288.[0m
[FileBasedDataset] Initializing dataset...
	Examples: 8264
	Features: 54
	Max length: 315
Standard scalar turned ON, loading params from cache
[FileBasedDataset] Dataset initialization complete
  epoch    auprc    auroc    train_loss    valid_acc    valid_loss    cp     dur
-------  -------  -------  ------------  -----------  ------------  ----  ------
      1   [36m0.1292[0m   [32m0.6337[0m        [35m0.4938[0m       [31m0.9202[0m        [94m0.3254[0m     +  8.9236
      2   [36m0.2015[0m   [32m0.7452[0m        [35m0.2830[0m       0.9202        [94m0.2546[0m     +  10.0656
      3   0.1934   [32m0.7525[0m        [35m0.2729[0m       0.9190        [94m0.2545[0m     +  9.6192
      4   [36m0.2454[0m   [32m0.7798[0m        [35m0.2578[0m       0.9166        [94m0.2471[0m     +  9.2996
      5   0.2408   [32m0.7828[0m        [35m0.2551[0m       0.9166        [94m0.2433[0m     +  9.4639
      6   0.2338   0.7801        [35m0.2511[0m       0.9178        [94m0.2427[0m     +  9.5198
      7   [36m0.2564[0m   [32m0.7889[0m        [35m0.2496[0m       0.9166        [94m0.2401[0m     +  9.4656
      8   [36m0.2653[0m   0.7856        [35m0.2419[0m       0.9178        [94m0.2392[0m     +  9.6281
      9   [36m0.3005[0m   [32m0.7983[0m        [35m0.2418[0m       0.9178        [94m0.2321[0m     +  9.5780
     10   0.2807   0.7944        [35m0.2384[0m       0.9178        0.2391        9.6820
     11   [36m0.3013[0m   [32m0.7993[0m        [35m0.2374[0m       0.9190        0.2335        9.7528
     12   [36m0.3027[0m   0.7947        [35m0.2345[0m       [31m0.9226[0m        0.2344        9.5441
     13   0.2966   0.7966        0.2354       0.9202        0.2348        9.5031
     14   0.2999   [32m0.8024[0m        [35m0.2317[0m       0.9202        [94m0.2307[0m     +  9.7419
     15   0.3006   [32m0.8037[0m        0.2318       0.9178        0.2312        9.4934
     16   [36m0.3036[0m   [32m0.8086[0m        [35m0.2306[0m       0.9190        0.2309        9.6094
     17   0.2990   0.8048        [35m0.2301[0m       0.9202        [94m0.2307[0m     +  9.8707
     18   0.2927   0.8084        [35m0.2281[0m       0.9178        0.2316        9.8880
     19   [36m0.3267[0m   [32m0.8101[0m        [35m0.2260[0m       0.9202        0.2310        9.8766
     20   [36m0.3339[0m   [32m0.8195[0m        0.2296       [31m0.9238[0m        [94m0.2256[0m     +  9.6718
     21   0.3038   0.8154        0.2276       0.9202        0.2318        9.6782
     22   0.3086   [32m0.8212[0m        0.2273       0.9190        0.2276        9.5225
     23   0.3232   0.8195        0.2269       0.9238        0.2257        9.5857
     24   [36m0.3403[0m   [32m0.8318[0m        [35m0.2241[0m       0.9226        [94m0.2244[0m     +  10.0987
     25   0.3195   0.8225        [35m0.2227[0m       0.9178        0.2266        9.8590
     26   0.3149   0.8272        [35m0.2221[0m       0.9214        0.2256        9.5728
     27   0.3309   [32m0.8361[0m        0.2255       0.9202        [94m0.2225[0m     +  9.7959
     28   0.3344   0.8356        [35m0.2185[0m       0.9190        [94m0.2209[0m     +  9.6024
     29   0.3268   0.8234        0.2204       0.9166        0.2266        9.4405
     30   0.3382   0.8342        0.2200       0.9190        [94m0.2207[0m     +  9.7351
     31   0.3385   0.8321        0.2206       0.9190        0.2213        9.6769
     32   0.3223   0.8309        0.2190       0.9190        0.2222        9.5126
     33   0.3266   0.8277        0.2201       0.9141        0.2243        9.4584
     34   [36m0.3492[0m   [32m0.8363[0m        [35m0.2185[0m       0.9178        0.2212        9.7619
     35   0.3308   [32m0.8388[0m        0.2186       0.9226        [94m0.2202[0m     +  9.6816
     36   [36m0.3609[0m   [32m0.8424[0m        [35m0.2180[0m       0.9190        0.2234        9.8308
     37   0.3554   0.8389        [35m0.2169[0m       0.9178        [94m0.2171[0m     +  9.6675
     38   0.3268   0.8336        0.2178       0.9190        0.2246        9.8724
     39   0.3034   0.8251        0.2188       0.9178        0.2295        9.7365
     40   [36m0.3710[0m   0.8416        0.2186       0.9190        0.2185        9.5999
     41   0.3526   0.8364        0.2173       0.9214        0.2410        9.6268
     42   0.3493   0.8402        0.2181       0.9202        0.2293        10.1304
     43   0.3584   0.8376        [35m0.2159[0m       0.9214        0.2272        9.5114
     44   0.3240   0.8298        [35m0.2154[0m       0.9129        0.2495        9.7623
     45   [36m0.3922[0m   [32m0.8431[0m        0.2166       0.9178        0.2376        9.7521
     46   0.3767   0.8390        [35m0.2144[0m       0.9202        0.2210        9.9260
Stopping since valid_loss has not improved in the last 10 epochs.
[32m[I 2023-05-02 19:42:58,140][0m Trial 194 finished with value: 0.2170962120216011 and parameters: {'lr': 0.000902881619289035, 'dropout': 0.4446932502999547, 'd_model_multiplier': 2, 'num_layers': 6, 'n_heads': 4, 'dim_feedforward': 314, 'batch_size': 49, 'pos_encoding': 'fixed', 'activation': 'gelu', 'norm': 'BatchNorm', 'optimizer_name': 'PlainRAdam', 'weight_decay': 0.1, 'top_n_features': 54}. Best is trial 117 with value: 0.191397856754288.[0m
[FileBasedDataset] Initializing dataset...
	Examples: 8264
	Features: 30
	Max length: 315
Standard scalar turned ON, loading params from cache
[FileBasedDataset] Dataset initialization complete
  epoch    auprc    auroc    train_loss    valid_acc    valid_loss    cp     dur
-------  -------  -------  ------------  -----------  ------------  ----  ------
      1   [36m0.2333[0m   [32m0.7463[0m        [35m0.3901[0m       [31m0.9105[0m        [94m0.2683[0m     +  8.5914
      2   [36m0.2798[0m   [32m0.7922[0m        [35m0.2628[0m       0.9105        [94m0.2574[0m     +  8.9040
      3   [36m0.3189[0m   [32m0.8049[0m        [35m0.2581[0m       0.9105        0.2685        9.1513
      4   [36m0.3686[0m   [32m0.8148[0m        [35m0.2515[0m       0.9105        0.2667        8.9800
      5   0.3551   0.8101        [35m0.2417[0m       0.9105        0.2911        9.2342
      6   0.3658   [32m0.8230[0m        [35m0.2384[0m       0.9105        0.2688        8.9054
      7   [36m0.3893[0m   [32m0.8249[0m        [35m0.2352[0m       0.9105        0.2679        9.3334
      8   0.3869   0.8241        0.2372       0.9105        0.2663        9.1711
      9   [36m0.3953[0m   [32m0.8292[0m        0.2360       0.9105        [94m0.2535[0m     +  9.1388
     10   0.3853   0.8267        [35m0.2333[0m       0.9105        0.2572        9.0012
     11   [36m0.3975[0m   0.8264        [35m0.2318[0m       0.9105        0.2685        8.9608
     12   [36m0.4032[0m   [32m0.8339[0m        [35m0.2313[0m       0.9105        0.2561        9.1491
     13   [36m0.4160[0m   0.8333        [35m0.2311[0m       0.9105        [94m0.2506[0m     +  8.9547
     14   [36m0.4198[0m   [32m0.8392[0m        [35m0.2300[0m       0.9105        [94m0.2505[0m     +  9.0355
     15   [36m0.4249[0m   0.8390        [35m0.2279[0m       0.9105        [94m0.2450[0m     +  9.3640
     16   0.4017   [32m0.8396[0m        [35m0.2274[0m       0.9105        0.2471        9.4704
     17   0.4005   0.8385        0.2276       [31m0.9117[0m        0.2492        9.3247
     18   0.4108   0.8369        [35m0.2265[0m       0.9105        0.2462        9.2891
     19   0.4194   [32m0.8399[0m        [35m0.2256[0m       0.9105        0.2511        9.1552
     20   [36m0.4347[0m   [32m0.8453[0m        0.2270       [31m0.9129[0m        [94m0.2349[0m     +  8.8491
     21   0.4208   0.8436        [35m0.2253[0m       0.9129        0.2375        9.2887
     22   [36m0.4402[0m   [32m0.8501[0m        0.2255       0.9129        0.2359        9.4247
     23   0.4338   0.8481        [35m0.2225[0m       [31m0.9141[0m        [94m0.2307[0m     +  9.4039
     24   [36m0.4528[0m   [32m0.8515[0m        0.2246       0.9141        [94m0.2288[0m     +  8.9812
     25   0.4373   [32m0.8524[0m        [35m0.2216[0m       0.9141        0.2320        9.3297
     26   0.4148   0.8458        0.2223       0.9117        0.2394        9.3142
     27   0.4288   0.8485        0.2237       0.9141        0.2328        9.2904
     28   0.4190   0.8486        [35m0.2209[0m       0.9141        0.2321        9.1029
     29   0.4427   0.8512        0.2219       0.9141        [94m0.2283[0m     +  9.3269
     30   0.4505   [32m0.8531[0m        0.2212       [31m0.9166[0m        [94m0.2255[0m     +  8.8482
     31   0.4389   [32m0.8546[0m        [35m0.2201[0m       0.9129        0.2293        9.3479
     32   0.4413   0.8530        0.2208       0.9129        [94m0.2255[0m     +  9.0788
     33   0.4340   [32m0.8551[0m        0.2213       0.9129        0.2316        9.3518
     34   0.4236   0.8518        [35m0.2177[0m       0.9129        0.2303        9.3738
     35   0.4238   0.8524        0.2179       0.9129        0.2263        9.3046
     36   0.4132   [32m0.8552[0m        [35m0.2175[0m       0.9141        0.2322        9.6366
     37   0.4384   0.8527        0.2197       0.9141        0.2294        9.3125
     38   0.4420   [32m0.8564[0m        0.2177       0.9141        0.2261        9.1294
     39   0.4432   [32m0.8577[0m        [35m0.2174[0m       0.9141        0.2272        9.2734
Stopping since valid_loss has not improved in the last 10 epochs.
[32m[I 2023-05-02 19:49:06,536][0m Trial 195 finished with value: 0.22550833133356746 and parameters: {'lr': 0.0011838044060671809, 'dropout': 0.4519361144843358, 'd_model_multiplier': 2, 'num_layers': 4, 'n_heads': 4, 'dim_feedforward': 376, 'batch_size': 53, 'pos_encoding': 'fixed', 'activation': 'gelu', 'norm': 'BatchNorm', 'optimizer_name': 'PlainRAdam', 'weight_decay': 0.1, 'top_n_features': 30}. Best is trial 117 with value: 0.191397856754288.[0m
[FileBasedDataset] Initializing dataset...
	Examples: 8264
	Features: 33
	Max length: 315
Standard scalar turned ON, loading params from cache
[FileBasedDataset] Dataset initialization complete
  epoch    auprc    auroc    train_loss    valid_acc    valid_loss    cp     dur
-------  -------  -------  ------------  -----------  ------------  ----  ------
      1   [36m0.0679[0m   [32m0.3309[0m        [35m0.6253[0m       [31m0.9190[0m        [94m0.6313[0m     +  8.7756
      2   [36m0.0799[0m   [32m0.4749[0m        [35m0.3770[0m       [31m0.9226[0m        [94m0.3850[0m     +  9.0438
      3   [36m0.1529[0m   [32m0.6931[0m        [35m0.2999[0m       0.9214        [94m0.3033[0m     +  9.2729
      4   [36m0.2037[0m   [32m0.7543[0m        [35m0.2760[0m       0.9226        [94m0.2665[0m     +  9.2146
      5   [36m0.2158[0m   [32m0.7735[0m        0.2760       0.9226        [94m0.2491[0m     +  9.5160
      6   [36m0.2374[0m   [32m0.7950[0m        [35m0.2640[0m       0.9226        [94m0.2427[0m     +  9.6466
      7   [36m0.2525[0m   [32m0.7989[0m        [35m0.2593[0m       [31m0.9238[0m        [94m0.2370[0m     +  9.5844
      8   [36m0.2631[0m   [32m0.8062[0m        [35m0.2566[0m       0.9238        [94m0.2361[0m     +  9.6422
      9   [36m0.2683[0m   [32m0.8091[0m        [35m0.2543[0m       0.9238        [94m0.2334[0m     +  9.2426
     10   [36m0.2714[0m   [32m0.8131[0m        [35m0.2497[0m       0.9238        [94m0.2314[0m     +  9.0315
     11   [36m0.2755[0m   [32m0.8171[0m        [35m0.2476[0m       0.9214        [94m0.2313[0m     +  8.8865
     12   0.2744   0.8124        [35m0.2457[0m       0.9226        [94m0.2303[0m     +  9.1836
     13   [36m0.2764[0m   [32m0.8193[0m        [35m0.2449[0m       0.9226        [94m0.2294[0m     +  9.4380
     14   0.2764   [32m0.8221[0m        [35m0.2429[0m       0.9226        [94m0.2292[0m     +  9.2819
     15   0.2687   [32m0.8251[0m        [35m0.2413[0m       0.9214        0.2293        9.4793
     16   [36m0.2875[0m   [32m0.8277[0m        [35m0.2390[0m       0.9238        [94m0.2264[0m     +  9.4565
     17   0.2797   0.8254        0.2395       0.9202        0.2276        9.5190
     18   0.2799   0.8264        0.2390       0.9202        [94m0.2262[0m     +  9.4488
     19   0.2791   [32m0.8315[0m        [35m0.2349[0m       0.9202        [94m0.2251[0m     +  9.5818
     20   0.2803   [32m0.8362[0m        [35m0.2333[0m       0.9154        0.2252        9.8344
     21   0.2861   0.8324        0.2349       0.9190        [94m0.2249[0m     +  9.8090
     22   [36m0.2927[0m   0.8326        [35m0.2326[0m       0.9214        [94m0.2244[0m     +  9.2139
     23   [36m0.2949[0m   0.8296        [35m0.2310[0m       0.9190        0.2245        9.1630
     24   [36m0.2965[0m   0.8313        0.2331       0.9214        [94m0.2233[0m     +  9.2443
     25   0.2907   0.8321        0.2320       0.9202        0.2234        9.2593
     26   0.2926   0.8343        [35m0.2300[0m       0.9226        0.2243        9.5015
     27   0.2928   0.8323        [35m0.2272[0m       0.9178        0.2240        9.5171
     28   [36m0.2984[0m   0.8347        0.2317       0.9190        0.2239        9.2043
     29   [36m0.2986[0m   0.8356        0.2292       0.9166        0.2235        9.5446
     30   [36m0.3035[0m   [32m0.8371[0m        0.2299       0.9214        [94m0.2230[0m     +  10.0209
     31   [36m0.3074[0m   [32m0.8375[0m        0.2300       0.9190        [94m0.2225[0m     +  9.5831
     32   [36m0.3099[0m   [32m0.8388[0m        [35m0.2253[0m       0.9214        [94m0.2220[0m     +  9.4431
     33   0.3050   [32m0.8402[0m        0.2269       0.9178        0.2231        9.0902
     34   0.3028   [32m0.8407[0m        0.2256       0.9202        0.2236        9.3267
     35   0.2947   0.8394        0.2269       0.9190        0.2262        9.7273
     36   0.3003   [32m0.8419[0m        [35m0.2251[0m       0.9202        0.2262        9.5760
     37   0.3022   0.8410        0.2263       0.9166        0.2250        9.5916
     38   0.3070   0.8417        0.2264       0.9178        0.2237        9.4792
     39   0.3037   [32m0.8424[0m        0.2256       0.9202        0.2234        9.5710
     40   0.3093   [32m0.8466[0m        0.2266       0.9178        0.2231        9.4361
     41   0.3058   0.8440        [35m0.2235[0m       0.9178        0.2231        9.4303
Stopping since valid_loss has not improved in the last 10 epochs.
[32m[I 2023-05-02 19:55:43,861][0m Trial 196 finished with value: 0.2219839455354891 and parameters: {'lr': 0.00047603452054154933, 'dropout': 0.4773640085696296, 'd_model_multiplier': 2, 'num_layers': 5, 'n_heads': 4, 'dim_feedforward': 133, 'batch_size': 64, 'pos_encoding': 'fixed', 'activation': 'gelu', 'norm': 'BatchNorm', 'optimizer_name': 'PlainRAdam', 'weight_decay': 0.1, 'top_n_features': 33}. Best is trial 117 with value: 0.191397856754288.[0m
[FileBasedDataset] Initializing dataset...
	Examples: 8264
	Features: 42
	Max length: 315
Standard scalar turned ON, loading params from cache
[FileBasedDataset] Dataset initialization complete
  epoch    auprc    auroc    train_loss    valid_acc    valid_loss    cp     dur
-------  -------  -------  ------------  -----------  ------------  ----  ------
      1   [36m0.2368[0m   [32m0.7543[0m        [35m0.3091[0m       [31m0.9299[0m        [94m0.2253[0m     +  9.3633
      2   [36m0.2389[0m   [32m0.7621[0m        [35m0.2600[0m       0.9287        [94m0.2221[0m     +  8.9344
      3   [36m0.2954[0m   [32m0.7794[0m        [35m0.2525[0m       0.9274        [94m0.2177[0m     +  9.1730
      4   0.2710   [32m0.7844[0m        [35m0.2400[0m       0.9226        0.2204        9.2581
      5   0.2880   [32m0.7858[0m        [35m0.2399[0m       0.9250        0.2197        9.3191
      6   0.2827   [32m0.7885[0m        [35m0.2369[0m       0.9214        0.2278        9.3965
      7   0.2775   [32m0.7975[0m        [35m0.2349[0m       0.9202        0.2260        9.6511
      8   0.2825   0.7959        0.2362       0.9214        0.2275        9.2167
      9   [36m0.2975[0m   0.7903        [35m0.2338[0m       0.9250        0.2203        9.5739
     10   [36m0.3010[0m   [32m0.8046[0m        0.2352       0.9250        [94m0.2164[0m     +  9.3655
     11   [36m0.3047[0m   0.7927        0.2349       0.9238        0.2182        9.4774
     12   [36m0.3319[0m   0.7967        0.2360       0.9250        0.2164        9.6266
     13   0.2935   0.8040        0.2346       [31m0.9335[0m        [94m0.2143[0m     +  9.3623
     14   0.3012   0.7949        [35m0.2331[0m       0.9274        0.2221        9.6403
     15   0.3149   0.7982        [35m0.2293[0m       0.9226        0.2216        9.6352
     16   0.3096   0.7879        0.2322       0.9335        0.2191        9.8502
     17   [36m0.3372[0m   0.7925        0.2315       0.9299        0.2159        9.5860
     18   0.3203   0.7940        0.2322       0.9262        0.2175        9.3028
     19   0.2998   0.7847        0.2302       0.9250        0.2225        9.6020
     20   0.3055   0.7958        [35m0.2292[0m       0.9274        0.2193        9.6622
     21   0.3229   0.7900        [35m0.2287[0m       0.9214        0.2269        9.9251
     22   0.3011   0.7946        0.2291       0.9226        0.2227        9.7683
Stopping since valid_loss has not improved in the last 10 epochs.
[32m[I 2023-05-02 19:59:22,929][0m Trial 197 finished with value: 0.21428996263276853 and parameters: {'lr': 0.0006967179773445828, 'dropout': 0.43392033997106644, 'd_model_multiplier': 2, 'num_layers': 5, 'n_heads': 4, 'dim_feedforward': 329, 'batch_size': 56, 'pos_encoding': 'fixed', 'activation': 'relu', 'norm': 'LayerNorm', 'optimizer_name': 'AdamW', 'weight_decay': 0.1, 'top_n_features': 42}. Best is trial 117 with value: 0.191397856754288.[0m
[FileBasedDataset] Initializing dataset...
	Examples: 8264
	Features: 39
	Max length: 315
Standard scalar turned ON, loading params from cache
[FileBasedDataset] Dataset initialization complete
  epoch    auprc    auroc    train_loss    valid_acc    valid_loss    cp     dur
-------  -------  -------  ------------  -----------  ------------  ----  ------
      1   [36m0.2837[0m   [32m0.7783[0m        [35m0.3400[0m       [31m0.9178[0m        [94m0.2490[0m     +  9.0558
      2   [36m0.3155[0m   [32m0.7945[0m        [35m0.2745[0m       [31m0.9190[0m        [94m0.2380[0m     +  9.2870
      3   0.3146   0.7932        [35m0.2621[0m       0.9178        0.2402        9.9070
      4   [36m0.3357[0m   [32m0.8037[0m        [35m0.2567[0m       0.9166        [94m0.2363[0m     +  9.4895
      5   0.3269   [32m0.8059[0m        [35m0.2495[0m       0.9166        [94m0.2351[0m     +  9.9561
      6   0.3329   [32m0.8075[0m        [35m0.2447[0m       0.9190        [94m0.2340[0m     +  9.8898
      7   [36m0.3371[0m   [32m0.8126[0m        [35m0.2370[0m       0.9117        0.2376        9.7668
      8   0.3343   [32m0.8157[0m        0.2392       0.9129        0.2376        9.8922
      9   [36m0.3449[0m   0.8154        [35m0.2354[0m       0.9154        [94m0.2340[0m     +  9.8989
     10   0.3368   0.8148        [35m0.2346[0m       0.9141        [94m0.2329[0m     +  9.7739
     11   0.3335   [32m0.8158[0m        0.2356       0.9117        0.2360        9.7008
     12   0.3280   0.8126        [35m0.2333[0m       0.8948        0.2570        9.6788
     13   [36m0.3459[0m   0.8122        0.2357       0.9105        0.2422        9.8022
     14   0.3404   [32m0.8202[0m        [35m0.2303[0m       0.9117        0.2340        9.9501
     15   0.3447   0.8181        0.2330       0.9117        [94m0.2327[0m     +  9.6085
     16   0.3373   0.8153        0.2325       0.9069        0.2370        9.7177
     17   0.3456   0.8171        0.2305       0.9057        0.2378        9.7931
     18   0.3373   0.8192        [35m0.2292[0m       0.9093        0.2363        9.5534
     19   0.3412   0.8177        0.2317       0.9178        [94m0.2302[0m     +  9.9027
     20   [36m0.3475[0m   [32m0.8221[0m        0.2302       0.9093        0.2379        9.7546
     21   [36m0.3492[0m   0.8202        0.2303       0.9057        0.2413        9.9531
     22   0.3416   0.8215        0.2304       0.9081        0.2421        9.7844
     23   0.3316   0.8156        [35m0.2291[0m       0.9129        0.2396        10.2084
     24   0.3291   0.8153        [35m0.2264[0m       0.9008        0.2450        9.7471
     25   0.3391   0.8204        0.2276       0.8972        0.2483        9.7108
     26   0.3362   0.8178        0.2284       0.8996        0.2444        9.7031
     27   0.3375   [32m0.8222[0m        0.2269       0.9190        0.2315        9.8534
     28   0.3389   0.8173        0.2266       0.8996        0.2414        9.7532
Stopping since valid_loss has not improved in the last 10 epochs.
