[32m[I 2023-05-02 09:34:45,430][0m Trial 92 finished with value: 0.22758288382402786 and parameters: {'lr': 0.0037212478206439777, 'dropout': 0.4763174090658809, 'd_model_multiplier': 2, 'num_layers': 3, 'n_heads': 4, 'dim_feedforward': 169, 'batch_size': 65, 'pos_encoding': 'fixed', 'activation': 'gelu', 'norm': 'BatchNorm', 'optimizer_name': 'AdamW', 'weight_decay': 0.01, 'top_n_features': 111}. Best is trial 12 with value: 0.20472501771481755.[0m
[FileBasedDataset] Initializing dataset...
	Examples: 8264
	Features: 139
	Max length: 315
Standard scalar turned ON, loading params from cache
[FileBasedDataset] Dataset initialization complete
  epoch    auprc    auroc    train_loss    valid_acc    valid_loss    cp     dur
-------  -------  -------  ------------  -----------  ------------  ----  ------
      1   [36m0.1528[0m   [32m0.6165[0m        [35m0.3929[0m       [31m0.9190[0m        [94m0.2733[0m     +  8.9995
      2   [36m0.1938[0m   [32m0.7129[0m        [35m0.2655[0m       0.9190        [94m0.2571[0m     +  8.6820
      3   [36m0.2106[0m   [32m0.7444[0m        [35m0.2605[0m       0.9190        [94m0.2531[0m     +  9.0971
      4   [36m0.2152[0m   [32m0.7486[0m        [35m0.2600[0m       0.9190        0.2533        9.2991
      5   [36m0.2386[0m   [32m0.7509[0m        [35m0.2579[0m       0.9190        0.2544        9.3961
      6   0.2198   [32m0.7641[0m        [35m0.2579[0m       0.9154        0.2552        9.3277
      7   0.2324   0.7636        [35m0.2522[0m       0.9081        0.2605        9.5292
      8   0.2182   0.7473        [35m0.2486[0m       0.9129        0.2567        9.4795
      9   [36m0.2464[0m   0.7641        [35m0.2483[0m       0.9008        0.2698        9.5805
     10   [36m0.2616[0m   [32m0.7816[0m        [35m0.2452[0m       0.9178        [94m0.2480[0m     +  9.3465
     11   [36m0.2773[0m   0.7801        [35m0.2411[0m       0.9178        0.2554        9.3612
     12   0.2644   [32m0.7845[0m        0.2461       0.9154        0.2482        9.3779
     13   [36m0.2998[0m   [32m0.7851[0m        [35m0.2403[0m       0.9190        [94m0.2433[0m     +  9.5101
     14   [36m0.3032[0m   0.7842        [35m0.2397[0m       [31m0.9238[0m        0.2439        9.3551
     15   0.2984   0.7770        0.2408       0.9178        0.2511        9.9443
     16   [36m0.3166[0m   [32m0.7925[0m        [35m0.2359[0m       0.9226        [94m0.2419[0m     +  9.2774
     17   0.2822   0.7681        0.2386       0.9129        0.2535        9.5446
     18   0.2988   0.7771        [35m0.2349[0m       0.9166        0.2461        9.4435
     19   0.3017   0.7793        [35m0.2343[0m       0.9178        0.2464        9.4376
     20   0.3057   0.7815        [35m0.2323[0m       0.9190        0.2448        9.1527
     21   0.2921   0.7798        0.2353       0.9141        0.2439        9.0794
     22   [36m0.3176[0m   0.7775        [35m0.2316[0m       0.9202        0.2442        9.2159
     23   [36m0.3402[0m   0.7854        [35m0.2306[0m       0.9238        0.2443        9.1607
     24   0.3100   0.7751        [35m0.2286[0m       0.9202        0.2505        8.9213
     25   0.3116   0.7847        0.2302       0.9166        0.2435        9.2864
Stopping since valid_loss has not improved in the last 10 epochs.
[32m[I 2023-05-02 09:38:48,010][0m Trial 93 finished with value: 0.24186051857658858 and parameters: {'lr': 0.0024934024210643054, 'dropout': 0.5048927973219371, 'd_model_multiplier': 2, 'num_layers': 2, 'n_heads': 4, 'dim_feedforward': 130, 'batch_size': 58, 'pos_encoding': 'fixed', 'activation': 'relu', 'norm': 'LayerNorm', 'optimizer_name': 'PlainRAdam', 'weight_decay': 0.01, 'top_n_features': 139}. Best is trial 12 with value: 0.20472501771481755.[0m
[FileBasedDataset] Initializing dataset...
	Examples: 8264
	Features: 122
	Max length: 315
Standard scalar turned ON, loading params from cache
[FileBasedDataset] Dataset initialization complete
  epoch    auprc    auroc    train_loss    valid_acc    valid_loss    cp     dur
-------  -------  -------  ------------  -----------  ------------  ----  ------
      1   [36m0.1225[0m   [32m0.6394[0m        [35m0.3494[0m       [31m0.9287[0m        [94m0.2746[0m     +  8.9087
      2   [36m0.1295[0m   [32m0.6711[0m        [35m0.2769[0m       0.9287        [94m0.2605[0m     +  8.7149
      3   [36m0.1320[0m   [32m0.6806[0m        [35m0.2649[0m       0.9274        [94m0.2539[0m     +  9.2943
      4   [36m0.1357[0m   [32m0.6894[0m        0.2653       0.9274        [94m0.2531[0m     +  9.2949
      5   [36m0.1460[0m   [32m0.7004[0m        [35m0.2572[0m       0.9287        0.2542        9.6650
      6   [36m0.1521[0m   [32m0.7065[0m        [35m0.2539[0m       0.9274        [94m0.2514[0m     +  9.5741
      7   [36m0.1551[0m   0.7049        [35m0.2514[0m       0.9274        [94m0.2484[0m     +  9.4214
      8   [36m0.1604[0m   [32m0.7079[0m        [35m0.2469[0m       0.9287        [94m0.2455[0m     +  9.6744
      9   [36m0.1667[0m   [32m0.7084[0m        [35m0.2466[0m       0.9287        [94m0.2445[0m     +  9.5357
     10   [36m0.1686[0m   [32m0.7111[0m        [35m0.2461[0m       0.9274        0.2446        9.6862
     11   0.1658   [32m0.7130[0m        [35m0.2412[0m       0.9274        [94m0.2438[0m     +  9.6235
     12   [36m0.1721[0m   [32m0.7184[0m        0.2419       0.9274        [94m0.2413[0m     +  9.5009
     13   [36m0.1831[0m   [32m0.7220[0m        [35m0.2396[0m       0.9287        [94m0.2391[0m     +  9.5443
     14   0.1812   0.7219        [35m0.2362[0m       0.9238        0.2401        9.7078
     15   0.1810   [32m0.7244[0m        0.2375       0.9287        [94m0.2382[0m     +  9.7257
     16   0.1825   0.7242        [35m0.2346[0m       0.9274        0.2394        9.5601
     17   [36m0.1967[0m   0.7241        0.2357       0.9274        [94m0.2381[0m     +  9.8708
     18   [36m0.1991[0m   [32m0.7293[0m        [35m0.2342[0m       0.9202        0.2383        9.5739
     19   [36m0.2004[0m   [32m0.7368[0m        0.2351       0.9202        [94m0.2372[0m     +  9.5648
     20   [36m0.2207[0m   [32m0.7403[0m        [35m0.2304[0m       0.9226        [94m0.2336[0m     +  9.6770
     21   0.2005   0.7385        0.2318       0.9202        0.2374        9.4725
     22   [36m0.2252[0m   [32m0.7425[0m        [35m0.2284[0m       0.9214        0.2337        9.5929
     23   0.2251   0.7413        [35m0.2280[0m       0.9226        [94m0.2329[0m     +  9.5852
     24   [36m0.2352[0m   [32m0.7478[0m        [35m0.2259[0m       0.9262        [94m0.2308[0m     +  9.6144
     25   [36m0.2382[0m   [32m0.7530[0m        [35m0.2249[0m       0.9250        [94m0.2301[0m     +  9.4575
     26   0.2321   [32m0.7532[0m        [35m0.2234[0m       0.9262        [94m0.2300[0m     +  9.6317
     27   0.2223   0.7449        0.2249       0.9250        0.2341        9.4514
     28   0.2379   0.7512        [35m0.2223[0m       0.9214        0.2330        9.3083
     29   [36m0.2399[0m   [32m0.7537[0m        0.2235       0.9262        0.2312        9.5986
     30   [36m0.2436[0m   0.7513        [35m0.2213[0m       0.9274        0.2312        9.5561
     31   0.2414   [32m0.7546[0m        0.2227       0.9262        [94m0.2292[0m     +  9.5366
     32   [36m0.2477[0m   [32m0.7581[0m        [35m0.2206[0m       0.9274        [94m0.2264[0m     +  9.6627
     33   [36m0.2503[0m   0.7568        0.2227       0.9262        0.2278        9.4087
     34   0.2427   0.7575        [35m0.2200[0m       0.9262        0.2289        9.4725
     35   0.2440   [32m0.7593[0m        0.2203       0.9250        0.2283        9.4030
     36   0.2428   [32m0.7611[0m        0.2201       0.9238        0.2285        9.5019
     37   [36m0.2539[0m   0.7607        [35m0.2195[0m       0.9238        0.2291        9.7728
     38   [36m0.2610[0m   0.7598        [35m0.2184[0m       0.9262        [94m0.2264[0m     +  9.3065
     39   0.2562   0.7580        [35m0.2178[0m       0.9274        0.2265        9.6201
     40   0.2457   0.7542        0.2207       0.9274        0.2289        9.6106
     41   0.2428   0.7519        0.2182       0.9274        0.2292        9.6343
Stopping since valid_loss has not improved in the last 10 epochs.
[32m[I 2023-05-02 09:45:29,530][0m Trial 94 finished with value: 0.2264311472370662 and parameters: {'lr': 0.0004919267744855441, 'dropout': 0.5090385266495, 'd_model_multiplier': 2, 'num_layers': 4, 'n_heads': 4, 'dim_feedforward': 149, 'batch_size': 73, 'pos_encoding': 'learnable', 'activation': 'gelu', 'norm': 'BatchNorm', 'optimizer_name': 'AdamW', 'weight_decay': 0.01, 'top_n_features': 122}. Best is trial 12 with value: 0.20472501771481755.[0m
[FileBasedDataset] Initializing dataset...
	Examples: 8264
	Features: 131
	Max length: 315
Standard scalar turned ON, loading params from cache
[FileBasedDataset] Dataset initialization complete
  epoch    auprc    auroc    train_loss    valid_acc    valid_loss    cp     dur
-------  -------  -------  ------------  -----------  ------------  ----  ------
      1   [36m0.1994[0m   [32m0.7186[0m        [35m0.2842[0m       [31m0.9117[0m        [94m0.2569[0m     +  7.8564
      2   0.1974   0.7109        [35m0.2621[0m       0.8984        0.2822        8.9475
      3   [36m0.2384[0m   0.6877        0.2702       [31m0.9190[0m        0.2607        9.0502
      4   0.2172   [32m0.7309[0m        0.2729       0.8972        0.2972        8.7969
      5   [36m0.2628[0m   [32m0.7516[0m        0.2626       0.9166        [94m0.2447[0m     +  9.1312
      6   [36m0.2874[0m   [32m0.7854[0m        [35m0.2532[0m       0.9129        [94m0.2403[0m     +  8.8603
      7   0.2755   0.7852        [35m0.2495[0m       [31m0.9226[0m        0.2482        9.1915
      8   0.2854   [32m0.7915[0m        0.2514       0.9226        0.2646        8.9607
      9   [36m0.3001[0m   [32m0.7995[0m        [35m0.2487[0m       [31m0.9250[0m        0.2670        9.1464
     10   0.2960   [32m0.8005[0m        [35m0.2453[0m       0.9190        0.2507        9.2624
     11   [36m0.3109[0m   [32m0.8036[0m        0.2459       0.9226        0.2736        9.1270
     12   0.2809   [32m0.8059[0m        [35m0.2425[0m       0.9190        0.2496        8.9948
     13   0.2879   0.7983        0.2459       0.9238        0.2541        9.1269
     14   0.2226   0.7408        0.2462       0.8791        0.3089        9.2434
     15   0.2302   0.6869        0.2446       0.8960        0.2710        9.5558
Stopping since valid_loss has not improved in the last 10 epochs.
[32m[I 2023-05-02 09:47:54,675][0m Trial 95 finished with value: 0.24031668284315585 and parameters: {'lr': 0.0010301024172583168, 'dropout': 0.5597171757935968, 'd_model_multiplier': 64, 'num_layers': 2, 'n_heads': 4, 'dim_feedforward': 369, 'batch_size': 49, 'pos_encoding': 'fixed', 'activation': 'relu', 'norm': 'LayerNorm', 'optimizer_name': 'RAdam', 'weight_decay': 0.01, 'top_n_features': 131}. Best is trial 12 with value: 0.20472501771481755.[0m
[FileBasedDataset] Initializing dataset...
	Examples: 8264
	Features: 139
	Max length: 315
Standard scalar turned ON, loading params from cache
[FileBasedDataset] Dataset initialization complete
  epoch    auprc    auroc    train_loss    valid_acc    valid_loss    cp      dur
-------  -------  -------  ------------  -----------  ------------  ----  -------
      1   [36m0.0699[0m   [32m0.3938[0m        [35m0.4941[0m       [31m0.9117[0m        [94m0.4714[0m     +  13.4054
      2   [36m0.1927[0m   [32m0.7025[0m        [35m0.2924[0m       0.9057        [94m0.3803[0m     +  14.4088
      3   [36m0.2239[0m   [32m0.7392[0m        [35m0.2622[0m       0.9033        [94m0.3597[0m     +  14.2376
      4   [36m0.2490[0m   [32m0.7448[0m        [35m0.2533[0m       0.9033        [94m0.3506[0m     +  14.2207
      5   0.2437   [32m0.7457[0m        0.2556       0.9057        [94m0.3201[0m     +  14.4188
      6   [36m0.2552[0m   [32m0.7480[0m        [35m0.2478[0m       0.9045        [94m0.3090[0m     +  14.7544
      7   0.2522   0.7395        [35m0.2435[0m       0.9069        [94m0.2956[0m     +  14.6906
      8   [36m0.2689[0m   [32m0.7537[0m        [35m0.2420[0m       0.9021        0.3321        14.9252
      9   0.2655   0.7396        0.2425       0.9045        0.3076        14.7839
     10   [36m0.2847[0m   0.7517        [35m0.2390[0m       0.9045        [94m0.2915[0m     +  14.4453
     11   [36m0.2902[0m   0.7510        [35m0.2367[0m       0.9045        0.2985        14.6535
     12   0.2875   0.7523        [35m0.2339[0m       0.9069        [94m0.2867[0m     +  14.5502
     13   [36m0.2996[0m   [32m0.7591[0m        0.2347       0.9033        [94m0.2838[0m     +  14.5900
     14   0.2979   0.7532        [35m0.2325[0m       0.9093        [94m0.2828[0m     +  15.8036
     15   0.2958   [32m0.7617[0m        0.2342       0.9069        0.2926        15.5494
     16   [36m0.3016[0m   [32m0.7640[0m        [35m0.2322[0m       0.9081        0.2829        14.8313
     17   [36m0.3124[0m   0.7597        [35m0.2268[0m       0.9081        0.2836        15.2890
     18   [36m0.3198[0m   [32m0.7680[0m        [35m0.2240[0m       0.9105        0.2929        15.4168
     19   [36m0.3303[0m   [32m0.7746[0m        0.2265       0.9033        0.2895        14.7250
     20   0.3205   0.7684        0.2279       0.9057        0.3047        14.8338
     21   0.3182   0.7611        0.2256       0.9081        0.2938        14.9076
     22   0.3297   0.7707        0.2276       [31m0.9129[0m        0.3441        15.0070
     23   0.3267   [32m0.7756[0m        0.2262       0.9129        0.2858        14.6155
Stopping since valid_loss has not improved in the last 10 epochs.
[32m[I 2023-05-02 09:53:49,828][0m Trial 96 finished with value: 0.282786247411691 and parameters: {'lr': 0.00165469613745949, 'dropout': 0.5268593980486902, 'd_model_multiplier': 2, 'num_layers': 3, 'n_heads': 16, 'dim_feedforward': 157, 'batch_size': 196, 'pos_encoding': 'fixed', 'activation': 'gelu', 'norm': 'BatchNorm', 'optimizer_name': 'PlainRAdam', 'weight_decay': 0.1, 'top_n_features': 139}. Best is trial 12 with value: 0.20472501771481755.[0m
[FileBasedDataset] Initializing dataset...
	Examples: 8264
	Features: 151
	Max length: 315
Standard scalar turned ON, loading params from cache
[FileBasedDataset] Dataset initialization complete
  epoch    auprc    auroc    train_loss    valid_acc    valid_loss    cp     dur
-------  -------  -------  ------------  -----------  ------------  ----  ------
      1   [36m0.2251[0m   [32m0.6895[0m        [35m0.2958[0m       [31m0.9178[0m        [94m0.2693[0m     +  8.1025
      2   0.2175   [32m0.7197[0m        [35m0.2594[0m       0.9178        [94m0.2660[0m     +  8.9978
      3   0.2128   [32m0.7349[0m        [35m0.2584[0m       0.9178        [94m0.2653[0m     +  9.8522
      4   [36m0.2411[0m   [32m0.7460[0m        [35m0.2534[0m       0.9178        [94m0.2613[0m     +  9.8432
      5   [36m0.2509[0m   [32m0.7672[0m        [35m0.2475[0m       0.9045        [94m0.2599[0m     +  9.2776
      6   [36m0.2534[0m   0.7580        [35m0.2450[0m       0.9093        0.2653        9.2212
      7   [36m0.2586[0m   0.7645        [35m0.2411[0m       0.9069        [94m0.2567[0m     +  9.0258
      8   0.2480   0.7636        [35m0.2382[0m       0.9154        0.2586        9.1863
      9   [36m0.2707[0m   0.7646        [35m0.2369[0m       0.9166        0.2578        9.4039
     10   0.2579   0.7469        0.2379       [31m0.9190[0m        0.2770        9.1589
     11   0.2544   0.7404        [35m0.2340[0m       0.9057        0.2774        9.0138
     12   0.2578   0.7353        0.2379       0.9129        0.2826        9.0283
     13   0.2511   0.7307        [35m0.2306[0m       0.9117        0.2794        8.9317
     14   [36m0.2715[0m   0.7330        0.2334       0.9178        0.2826        9.5564
     15   [36m0.2794[0m   0.7470        [35m0.2294[0m       0.9141        0.2681        9.2561
     16   0.2590   0.7322        0.2323       0.9105        0.2743        9.1327
Stopping since valid_loss has not improved in the last 10 epochs.
