[32m[I 2023-05-05 10:30:00,677][0m Trial 599 finished with value: 0.23263148259835492 and parameters: {'lr': 0.0012219456520828052, 'dropout': 0.42630745869930864, 'd_model_multiplier': 1, 'num_layers': 8, 'n_heads': 32, 'dim_feedforward': 368, 'batch_size': 47, 'pos_encoding': 'fixed', 'activation': 'relu', 'norm': 'LayerNorm', 'optimizer_name': 'RAdam', 'weight_decay': 0.1, 'top_n_features': 79}. Best is trial 246 with value: 0.16447311791139763.[0m
[FileBasedDataset] Initializing dataset...
	Examples: 8264
	Features: 104
	Max length: 315
Standard scalar turned ON, loading params from cache
[FileBasedDataset] Dataset initialization complete
  epoch    auprc    auroc    train_loss    valid_acc    valid_loss    cp      dur
-------  -------  -------  ------------  -----------  ------------  ----  -------
      1   [36m0.0770[0m   [32m0.3847[0m        [35m0.6800[0m       [31m0.7570[0m        [94m0.6696[0m     +  19.9650
      2   0.0768   0.3837        0.6801       [31m0.7594[0m        [94m0.6689[0m     +  20.2765
      3   0.0765   0.3824        [35m0.6781[0m       [31m0.7630[0m        [94m0.6681[0m     +  20.5223
      4   0.0762   0.3804        0.6787       [31m0.7703[0m        [94m0.6671[0m     +  20.3824
      5   0.0759   0.3789        [35m0.6770[0m       [31m0.7787[0m        [94m0.6659[0m     +  20.3466
      6   0.0755   0.3767        [35m0.6765[0m       [31m0.7823[0m        [94m0.6647[0m     +  20.1949
      7   0.0751   0.3742        [35m0.6737[0m       [31m0.7896[0m        [94m0.6634[0m     +  20.2263
      8   0.0749   0.3723        0.6751       [31m0.7969[0m        [94m0.6621[0m     +  20.3021
      9   [36m0.0770[0m   0.3697        [35m0.6710[0m       [31m0.8114[0m        [94m0.6607[0m     +  20.2442
     10   0.0769   0.3675        [35m0.6692[0m       [31m0.8235[0m        [94m0.6593[0m     +  20.3633
     11   0.0766   0.3653        0.6695       [31m0.8343[0m        [94m0.6578[0m     +  20.3520
     12   0.0762   0.3627        [35m0.6677[0m       [31m0.8404[0m        [94m0.6563[0m     +  20.2583
     13   0.0760   0.3607        [35m0.6669[0m       [31m0.8464[0m        [94m0.6548[0m     +  20.2306
     14   0.0758   0.3582        [35m0.6654[0m       [31m0.8501[0m        [94m0.6532[0m     +  20.3896
     15   0.0758   0.3563        [35m0.6633[0m       [31m0.8634[0m        [94m0.6517[0m     +  20.2239
     16   0.0757   0.3541        [35m0.6631[0m       [31m0.8694[0m        [94m0.6501[0m     +  20.3362
     17   0.0757   0.3524        [35m0.6600[0m       [31m0.8779[0m        [94m0.6485[0m     +  20.4098
     18   0.0755   0.3505        [35m0.6575[0m       [31m0.8827[0m        [94m0.6469[0m     +  20.4187
     19   0.0755   0.3494        0.6578       [31m0.8900[0m        [94m0.6453[0m     +  20.3714
     20   0.0753   0.3479        [35m0.6557[0m       [31m0.8960[0m        [94m0.6437[0m     +  20.2831
     21   0.0756   0.3470        [35m0.6543[0m       0.8960        [94m0.6421[0m     +  20.3549
     22   0.0754   0.3455        [35m0.6515[0m       [31m0.8984[0m        [94m0.6405[0m     +  20.1657
     23   0.0752   0.3445        0.6519       [31m0.8996[0m        [94m0.6388[0m     +  20.1353
     24   0.0758   0.3435        [35m0.6479[0m       [31m0.9033[0m        [94m0.6372[0m     +  20.2158
     25   0.0758   0.3420        0.6479       [31m0.9069[0m        [94m0.6356[0m     +  20.4134
     26   0.0769   0.3413        [35m0.6469[0m       [31m0.9081[0m        [94m0.6340[0m     +  20.2304
     27   0.0748   0.3404        [35m0.6443[0m       [31m0.9105[0m        [94m0.6324[0m     +  20.4885
     28   0.0735   0.3395        [35m0.6442[0m       [31m0.9117[0m        [94m0.6308[0m     +  20.3524
     29   0.0733   0.3386        [35m0.6418[0m       0.9117        [94m0.6292[0m     +  20.4440
     30   0.0736   0.3377        [35m0.6397[0m       0.9117        [94m0.6277[0m     +  20.2426
     31   0.0732   0.3374        [35m0.6390[0m       0.9117        [94m0.6261[0m     +  20.2986
     32   0.0738   0.3367        [35m0.6366[0m       0.9117        [94m0.6245[0m     +  20.3505
     33   0.0743   0.3356        [35m0.6361[0m       0.9117        [94m0.6229[0m     +  20.4731
     34   0.0753   0.3349        [35m0.6334[0m       [31m0.9129[0m        [94m0.6214[0m     +  20.2822
     35   0.0752   0.3341        0.6339       0.9129        [94m0.6198[0m     +  20.4677
     36   0.0741   0.3337        [35m0.6301[0m       0.9129        [94m0.6183[0m     +  20.1918
     37   0.0727   0.3331        [35m0.6288[0m       0.9129        [94m0.6167[0m     +  20.3305
     38   0.0724   0.3331        [35m0.6275[0m       0.9129        [94m0.6152[0m     +  20.3628
     39   0.0722   0.3330        [35m0.6265[0m       0.9129        [94m0.6136[0m     +  20.1901
     40   0.0721   0.3328        [35m0.6244[0m       0.9129        [94m0.6121[0m     +  20.1952
     41   0.0744   0.3325        [35m0.6227[0m       0.9129        [94m0.6106[0m     +  20.0885
     42   0.0742   0.3320        [35m0.6218[0m       0.9129        [94m0.6091[0m     +  20.3380
     43   [36m0.0810[0m   0.3318        [35m0.6192[0m       0.9129        [94m0.6076[0m     +  20.2961
     44   0.0810   0.3318        0.6195       0.9129        [94m0.6061[0m     +  20.2273
     45   0.0808   0.3315        [35m0.6169[0m       0.9129        [94m0.6046[0m     +  20.3643
     46   [36m0.0814[0m   0.3317        [35m0.6154[0m       0.9129        [94m0.6031[0m     +  20.5357
     47   0.0814   0.3317        [35m0.6140[0m       0.9129        [94m0.6016[0m     +  20.4015
     48   0.0813   0.3314        [35m0.6126[0m       0.9129        [94m0.6002[0m     +  20.4094
     49   0.0813   0.3313        [35m0.6109[0m       0.9129        [94m0.5987[0m     +  20.4112
     50   0.0811   0.3312        [35m0.6106[0m       0.9129        [94m0.5972[0m     +  20.4157
[32m[I 2023-05-05 10:47:02,629][0m Trial 600 finished with value: 0.597247504986183 and parameters: {'lr': 1.1630096819397061e-08, 'dropout': 0.3919047133069007, 'd_model_multiplier': 4, 'num_layers': 4, 'n_heads': 32, 'dim_feedforward': 398, 'batch_size': 36, 'pos_encoding': 'learnable', 'activation': 'relu', 'norm': 'LayerNorm', 'optimizer_name': 'RAdam', 'weight_decay': 0.1, 'top_n_features': 104}. Best is trial 246 with value: 0.16447311791139763.[0m
[FileBasedDataset] Initializing dataset...
	Examples: 8264
	Features: 62
	Max length: 315
Standard scalar turned ON, loading params from cache
[FileBasedDataset] Dataset initialization complete
Warning, assumed runtime error: CUDA out of memory. Tried to allocate 2.72 GiB (GPU 0; 23.70 GiB total capacity; 19.77 GiB already allocated; 143.25 MiB free; 22.47 GiB reserved in total by PyTorch) If reserved memory is >> allocated memory try setting max_split_size_mb to avoid fragmentation.  See documentation for Memory Management and PYTORCH_CUDA_ALLOC_CONF
[32m[I 2023-05-05 10:47:08,026][0m Trial 601 finished with value: 100.0 and parameters: {'lr': 0.050389457319440896, 'dropout': 0.6037021630548183, 'd_model_multiplier': 4, 'num_layers': 5, 'n_heads': 64, 'dim_feedforward': 332, 'batch_size': 115, 'pos_encoding': 'fixed', 'activation': 'relu', 'norm': 'LayerNorm', 'optimizer_name': 'RAdam', 'weight_decay': 0.1, 'top_n_features': 62}. Best is trial 246 with value: 0.16447311791139763.[0m
[FileBasedDataset] Initializing dataset...
	Examples: 8264
	Features: 73
	Max length: 315
Standard scalar turned ON, loading params from cache
[FileBasedDataset] Dataset initialization complete
  epoch    auprc    auroc    train_loss    valid_acc    valid_loss    cp     dur
-------  -------  -------  ------------  -----------  ------------  ----  ------
      1   [36m0.1367[0m   [32m0.5550[0m        [35m0.4630[0m       [31m0.9202[0m        [94m0.2868[0m     +  8.8446
      2   [36m0.2057[0m   [32m0.7090[0m        [35m0.2620[0m       0.9202        [94m0.2553[0m     +  8.6025
      3   [36m0.2143[0m   [32m0.7272[0m        [35m0.2429[0m       0.9154        [94m0.2550[0m     +  8.9130
      4   [36m0.2200[0m   [32m0.7312[0m        [35m0.2358[0m       0.9141        0.2588        8.7744
      5   0.2169   0.7309        [35m0.2334[0m       0.9117        0.2616        9.5458
      6   [36m0.2226[0m   [32m0.7338[0m        [35m0.2295[0m       0.9117        0.2624        9.2265
      7   [36m0.2245[0m   [32m0.7355[0m        [35m0.2281[0m       0.9129        0.2635        9.2458
      8   [36m0.2299[0m   [32m0.7381[0m        [35m0.2261[0m       0.9117        0.2637        9.2689
      9   [36m0.2325[0m   [32m0.7406[0m        [35m0.2249[0m       0.9141        0.2630        9.2226
     10   [36m0.2326[0m   [32m0.7445[0m        [35m0.2233[0m       0.9154        0.2633        9.3493
     11   [36m0.2347[0m   [32m0.7467[0m        [35m0.2215[0m       0.9154        0.2637        9.1235
     12   0.2335   [32m0.7494[0m        [35m0.2210[0m       0.9166        0.2634        9.2848
Stopping since valid_loss has not improved in the last 10 epochs.
[32m[I 2023-05-05 10:49:07,203][0m Trial 602 finished with value: 0.25495936079209774 and parameters: {'lr': 1.4708292625136608e-05, 'dropout': 0.32546494150881417, 'd_model_multiplier': 64, 'num_layers': 2, 'n_heads': 4, 'dim_feedforward': 410, 'batch_size': 28, 'pos_encoding': 'fixed', 'activation': 'relu', 'norm': 'LayerNorm', 'optimizer_name': 'RAdam', 'weight_decay': 0.1, 'top_n_features': 73}. Best is trial 246 with value: 0.16447311791139763.[0m
[FileBasedDataset] Initializing dataset...
	Examples: 8264
	Features: 57
	Max length: 315
Standard scalar turned ON, loading params from cache
[FileBasedDataset] Dataset initialization complete
  epoch    auprc    auroc    train_loss    valid_acc    valid_loss    cp      dur
-------  -------  -------  ------------  -----------  ------------  ----  -------
      1   [36m0.1450[0m   [32m0.5654[0m        [35m0.6820[0m       [31m0.7896[0m        [94m0.6698[0m     +  16.2708
      2   0.1014   0.4207        [35m0.6395[0m       [31m0.9323[0m        [94m0.6095[0m     +  16.3098
      3   0.0675   0.3368        [35m0.5864[0m       [31m0.9335[0m        [94m0.5449[0m     +  16.3896
      4   0.0658   0.3187        [35m0.5311[0m       0.9335        [94m0.4842[0m     +  16.4453
      5   0.0657   0.3190        [35m0.4853[0m       0.9335        [94m0.4317[0m     +  16.6443
      6   0.0661   0.3230        [35m0.4423[0m       0.9335        [94m0.3883[0m     +  16.5368
      7   0.0498   0.3332        [35m0.4082[0m       0.9335        [94m0.3536[0m     +  16.4172
      8   0.0506   0.3522        [35m0.3799[0m       0.9335        [94m0.3265[0m     +  16.2684
      9   0.0526   0.3821        [35m0.3574[0m       0.9335        [94m0.3056[0m     +  16.2085
     10   0.0554   0.4199        [35m0.3404[0m       0.9335        [94m0.2897[0m     +  16.3844
     11   0.0591   0.4587        [35m0.3264[0m       0.9335        [94m0.2775[0m     +  16.3531
     12   0.0637   0.4954        [35m0.3145[0m       0.9335        [94m0.2679[0m     +  16.4024
     13   0.0684   0.5258        [35m0.3069[0m       0.9335        [94m0.2605[0m     +  16.2952
     14   0.0742   0.5562        [35m0.2997[0m       0.9335        [94m0.2546[0m     +  16.3721
     15   0.0820   [32m0.5813[0m        [35m0.2928[0m       0.9335        [94m0.2498[0m     +  16.4339
     16   0.1155   [32m0.6067[0m        [35m0.2883[0m       0.9335        [94m0.2458[0m     +  16.3399
     17   0.1261   [32m0.6238[0m        [35m0.2843[0m       0.9335        [94m0.2425[0m     +  16.4200
     18   0.1395   [32m0.6386[0m        [35m0.2801[0m       0.9335        [94m0.2397[0m     +  16.2118
     19   [36m0.1475[0m   [32m0.6533[0m        [35m0.2761[0m       0.9335        [94m0.2374[0m     +  16.4100
     20   [36m0.1520[0m   [32m0.6645[0m        [35m0.2738[0m       0.9335        [94m0.2353[0m     +  16.4753
     21   [36m0.1592[0m   [32m0.6756[0m        [35m0.2703[0m       0.9335        [94m0.2336[0m     +  16.4054
     22   [36m0.1621[0m   [32m0.6844[0m        [35m0.2686[0m       0.9335        [94m0.2321[0m     +  16.3274
     23   [36m0.1639[0m   [32m0.6924[0m        [35m0.2669[0m       0.9335        [94m0.2309[0m     +  16.3614
     24   [36m0.1667[0m   [32m0.6994[0m        [35m0.2637[0m       0.9335        [94m0.2298[0m     +  16.2796
     25   [36m0.1696[0m   [32m0.7052[0m        [35m0.2636[0m       0.9335        [94m0.2288[0m     +  16.5076
     26   [36m0.1708[0m   [32m0.7102[0m        [35m0.2625[0m       0.9335        [94m0.2279[0m     +  16.2410
     27   [36m0.1730[0m   [32m0.7150[0m        [35m0.2614[0m       0.9335        [94m0.2272[0m     +  16.3968
     28   [36m0.1742[0m   [32m0.7193[0m        [35m0.2596[0m       0.9335        [94m0.2265[0m     +  16.2756
     29   [36m0.1746[0m   [32m0.7227[0m        [35m0.2585[0m       0.9335        [94m0.2259[0m     +  16.2881
     30   0.1733   [32m0.7264[0m        [35m0.2577[0m       0.9335        [94m0.2253[0m     +  16.3050
     31   [36m0.1772[0m   [32m0.7302[0m        [35m0.2559[0m       0.9335        [94m0.2248[0m     +  16.3113
     32   [36m0.1781[0m   [32m0.7330[0m        [35m0.2555[0m       0.9335        [94m0.2243[0m     +  16.3975
     33   [36m0.1782[0m   [32m0.7362[0m        [35m0.2538[0m       0.9335        [94m0.2238[0m     +  16.4293
     34   [36m0.1806[0m   [32m0.7395[0m        0.2549       0.9335        [94m0.2234[0m     +  16.3690
     35   [36m0.1819[0m   [32m0.7419[0m        0.2538       0.9335        [94m0.2230[0m     +  16.3484
     36   [36m0.1837[0m   [32m0.7443[0m        [35m0.2522[0m       0.9335        [94m0.2226[0m     +  16.2069
     37   [36m0.1878[0m   [32m0.7465[0m        [35m0.2512[0m       0.9335        [94m0.2222[0m     +  16.4453
     38   [36m0.1908[0m   [32m0.7495[0m        0.2521       0.9335        [94m0.2219[0m     +  16.3212
     39   [36m0.1920[0m   [32m0.7515[0m        [35m0.2509[0m       0.9323        [94m0.2216[0m     +  16.5246
     40   0.1900   [32m0.7530[0m        [35m0.2508[0m       0.9323        [94m0.2212[0m     +  16.5667
     41   0.1908   [32m0.7545[0m        0.2517       0.9323        [94m0.2209[0m     +  16.4115
     42   [36m0.1920[0m   [32m0.7568[0m        [35m0.2505[0m       0.9323        [94m0.2207[0m     +  16.4335
     43   [36m0.1924[0m   [32m0.7584[0m        [35m0.2490[0m       0.9323        [94m0.2203[0m     +  16.4577
     44   [36m0.1941[0m   [32m0.7599[0m        0.2494       0.9323        [94m0.2200[0m     +  16.3156
     45   [36m0.1974[0m   [32m0.7618[0m        0.2494       0.9323        [94m0.2197[0m     +  16.5018
     46   [36m0.1984[0m   [32m0.7630[0m        [35m0.2471[0m       0.9323        [94m0.2194[0m     +  16.4793
     47   0.1979   [32m0.7642[0m        0.2486       0.9323        [94m0.2191[0m     +  16.5232
     48   [36m0.2009[0m   [32m0.7658[0m        [35m0.2471[0m       0.9323        [94m0.2188[0m     +  16.4263
     49   [36m0.2013[0m   [32m0.7669[0m        0.2486       0.9323        [94m0.2185[0m     +  16.3721
     50   0.2012   [32m0.7676[0m        0.2481       0.9323        [94m0.2183[0m     +  17.0546
[32m[I 2023-05-05 11:02:53,576][0m Trial 603 finished with value: 0.21829421328157728 and parameters: {'lr': 6.610729528903615e-07, 'dropout': 0.4624335693705424, 'd_model_multiplier': 4, 'num_layers': 3, 'n_heads': 32, 'dim_feedforward': 389, 'batch_size': 26, 'pos_encoding': 'fixed', 'activation': 'relu', 'norm': 'LayerNorm', 'optimizer_name': 'RAdam', 'weight_decay': 0, 'top_n_features': 57}. Best is trial 246 with value: 0.16447311791139763.[0m
[FileBasedDataset] Initializing dataset...
	Examples: 8264
	Features: 65
	Max length: 315
Standard scalar turned ON, loading params from cache
[FileBasedDataset] Dataset initialization complete
  epoch    auprc    auroc    train_loss    valid_acc    valid_loss    cp      dur
-------  -------  -------  ------------  -----------  ------------  ----  -------
      1   [36m0.2154[0m   [32m0.7010[0m        [35m0.6916[0m       [31m0.7690[0m        [94m0.6811[0m     +  19.2693
      2   0.2135   0.6996        [35m0.6908[0m       [31m0.7944[0m        [94m0.6784[0m     +  19.2757
      3   0.2119   0.6977        [35m0.6869[0m       [31m0.8174[0m        [94m0.6749[0m     +  19.4236
      4   0.2091   0.6955        [35m0.6842[0m       [31m0.8368[0m        [94m0.6710[0m     +  19.3251
      5   0.2060   0.6930        [35m0.6786[0m       [31m0.8489[0m        [94m0.6665[0m     +  19.6602
      6   0.2017   0.6872        [35m0.6768[0m       [31m0.8609[0m        [94m0.6618[0m     +  19.3816
      7   0.1978   0.6807        [35m0.6686[0m       [31m0.8682[0m        [94m0.6567[0m     +  19.3406
      8   0.1921   0.6700        [35m0.6633[0m       [31m0.8767[0m        [94m0.6515[0m     +  19.5982
      9   0.1862   0.6581        [35m0.6588[0m       [31m0.8815[0m        [94m0.6460[0m     +  19.7486
     10   0.1799   0.6467        [35m0.6548[0m       [31m0.8863[0m        [94m0.6404[0m     +  19.3678
     11   0.1734   0.6357        [35m0.6495[0m       [31m0.8924[0m        [94m0.6347[0m     +  19.4027
     12   0.1603   0.6219        [35m0.6427[0m       0.8900        [94m0.6289[0m     +  19.5003
     13   0.1440   0.6040        [35m0.6411[0m       0.8912        [94m0.6231[0m     +  19.5577
     14   0.1246   0.5778        [35m0.6327[0m       [31m0.8960[0m        [94m0.6172[0m     +  19.3992
     15   0.1065   0.5439        [35m0.6269[0m       [31m0.9021[0m        [94m0.6114[0m     +  19.5161
     16   0.0920   0.5030        [35m0.6218[0m       0.9021        [94m0.6055[0m     +  19.3813
     17   0.0825   0.4646        [35m0.6165[0m       [31m0.9033[0m        [94m0.5997[0m     +  19.4219
     18   0.0769   0.4317        [35m0.6096[0m       [31m0.9057[0m        [94m0.5938[0m     +  19.2962
     19   0.0737   0.4061        [35m0.6052[0m       [31m0.9069[0m        [94m0.5880[0m     +  19.4293
     20   0.0713   0.3877        [35m0.6014[0m       0.9069        [94m0.5823[0m     +  19.1668
     21   0.0702   0.3753        [35m0.5937[0m       [31m0.9081[0m        [94m0.5766[0m     +  19.6242
     22   0.0692   0.3654        [35m0.5895[0m       [31m0.9093[0m        [94m0.5710[0m     +  19.3696
     23   0.0675   0.3576        [35m0.5845[0m       0.9093        [94m0.5655[0m     +  19.3425
     24   0.0668   0.3511        [35m0.5798[0m       [31m0.9105[0m        [94m0.5601[0m     +  19.4346
     25   0.0663   0.3451        [35m0.5726[0m       0.9105        [94m0.5548[0m     +  19.3492
     26   0.0660   0.3406        [35m0.5676[0m       [31m0.9117[0m        [94m0.5495[0m     +  19.4179
     27   0.0660   0.3365        [35m0.5637[0m       0.9117        [94m0.5444[0m     +  19.2597
     28   0.0661   0.3327        [35m0.5585[0m       0.9117        [94m0.5393[0m     +  19.4233
     29   0.0660   0.3300        [35m0.5530[0m       0.9117        [94m0.5344[0m     +  19.3994
     30   0.0661   0.3273        [35m0.5488[0m       0.9117        [94m0.5295[0m     +  19.4706
     31   0.0661   0.3255        [35m0.5450[0m       0.9117        [94m0.5247[0m     +  19.3876
     32   0.0663   0.3237        [35m0.5395[0m       0.9117        [94m0.5201[0m     +  19.3557
     33   0.0662   0.3224        [35m0.5344[0m       0.9117        [94m0.5155[0m     +  19.6072
     34   0.0668   0.3212        [35m0.5300[0m       0.9117        [94m0.5110[0m     +  19.5308
     35   0.0669   0.3204        [35m0.5245[0m       0.9117        [94m0.5067[0m     +  19.4426
     36   0.0669   0.3197        [35m0.5211[0m       0.9117        [94m0.5024[0m     +  19.5922
     37   0.0668   0.3186        [35m0.5161[0m       0.9117        [94m0.4982[0m     +  19.4585
     38   0.0668   0.3178        [35m0.5126[0m       0.9117        [94m0.4941[0m     +  19.6449
     39   0.0668   0.3171        [35m0.5086[0m       0.9117        [94m0.4901[0m     +  19.4784
     40   0.0667   0.3166        [35m0.5038[0m       0.9117        [94m0.4862[0m     +  19.5353
     41   0.0667   0.3161        [35m0.5015[0m       0.9117        [94m0.4824[0m     +  19.4433
     42   0.0666   0.3157        [35m0.4950[0m       0.9117        [94m0.4786[0m     +  19.7388
     43   0.0666   0.3154        [35m0.4935[0m       0.9117        [94m0.4750[0m     +  19.6150
     44   0.0666   0.3151        [35m0.4887[0m       0.9117        [94m0.4714[0m     +  19.1875
     45   0.0666   0.3147        [35m0.4848[0m       0.9117        [94m0.4679[0m     +  19.2621
     46   0.0662   0.3143        [35m0.4825[0m       0.9117        [94m0.4645[0m     +  19.6248
     47   0.0660   0.3141        [35m0.4797[0m       0.9117        [94m0.4612[0m     +  19.7134
     48   0.0659   0.3137        [35m0.4760[0m       0.9117        [94m0.4579[0m     +  19.6276
     49   0.0659   0.3134        [35m0.4714[0m       0.9117        [94m0.4547[0m     +  19.2378
     50   0.0657   0.3133        [35m0.4682[0m       0.9117        [94m0.4516[0m     +  19.5179
