[32m[I 2023-01-09 01:02:57,691][0m Trial 77 finished with value: 0.27742750087675516 and parameters: {'lr': 4.111429148777827e-09, 'dropout': 0.5892969562781998, 'd_model_multiplier': 4, 'num_layers': 2, 'n_heads': 8, 'dim_feedforward': 471, 'batch_size': 60, 'pos_encoding': 'fixed', 'activation': 'gelu', 'norm': 'BatchNorm', 'optimizer_name': 'PlainRAdam', 'weight_decay': 0}. Best is trial 48 with value: 0.3954917461755389.[0m
[EnsembleDataset] Initializing dataset...
	Examples: 27964
	Features: 621
	Max length: 316
[EnsembleDataset] Dataset initialization complete
  epoch    auprc    auroc    train_loss    valid_loss    cp      dur
-------  -------  -------  ------------  ------------  ----  -------
      1   [36m0.2901[0m   [32m0.7462[0m        [35m0.1062[0m        [31m0.0885[0m     +  28.8673
      2   0.2901   0.7462        [35m0.1048[0m        [31m0.0885[0m     +  29.3518
      3   0.2901   0.7462        [35m0.1039[0m        [31m0.0884[0m     +  29.7860
      4   0.2901   0.7462        0.1046        [31m0.0884[0m     +  30.1501
      5   [36m0.2901[0m   0.7462        0.1053        [31m0.0883[0m     +  29.9500
      6   0.2900   0.7461        0.1052        [31m0.0882[0m     +  29.7658
      7   0.2900   0.7461        0.1052        [31m0.0882[0m     +  29.0505
      8   0.2900   0.7461        0.1049        [31m0.0881[0m     +  29.2702
      9   0.2900   0.7461        0.1066        [31m0.0880[0m     +  29.1381
     10   0.2900   0.7460        0.1056        [31m0.0880[0m     +  29.3032
     11   0.2900   0.7460        0.1047        [31m0.0879[0m     +  29.4413
     12   0.2900   0.7460        [35m0.1039[0m        [31m0.0879[0m     +  29.1484
     13   0.2900   0.7459        [35m0.1038[0m        [31m0.0878[0m     +  29.9132
     14   0.2900   0.7459        0.1050        [31m0.0877[0m     +  29.3276
     15   0.2899   0.7459        0.1051        [31m0.0876[0m     +  29.3856
     16   0.2900   0.7459        0.1049        [31m0.0876[0m     +  30.0198
     17   0.2900   0.7459        0.1051        [31m0.0875[0m     +  30.2920
     18   0.2901   0.7458        0.1047        [31m0.0875[0m     +  29.2724
     19   0.2901   0.7458        0.1056        [31m0.0874[0m     +  28.8809
     20   0.2901   0.7458        0.1042        [31m0.0873[0m     +  28.6540
     21   0.2901   0.7458        0.1049        [31m0.0873[0m     +  29.2668
     22   0.2901   0.7457        0.1042        [31m0.0872[0m     +  29.3986
     23   0.2901   0.7457        0.1061        [31m0.0871[0m     +  29.1741
     24   0.2900   0.7457        0.1075        [31m0.0871[0m     +  29.3186
     25   0.2900   0.7456        0.1041        [31m0.0870[0m     +  29.1910
[32m[I 2023-01-09 01:54:48,560][0m Trial 78 finished with value: 0.2901498792810214 and parameters: {'lr': 2.576439188308504e-09, 'dropout': 0.6307282772134843, 'd_model_multiplier': 4, 'num_layers': 2, 'n_heads': 8, 'dim_feedforward': 403, 'batch_size': 38, 'pos_encoding': 'fixed', 'activation': 'gelu', 'norm': 'LayerNorm', 'optimizer_name': 'PlainRAdam', 'weight_decay': 0}. Best is trial 48 with value: 0.3954917461755389.[0m
[EnsembleDataset] Initializing dataset...
	Examples: 27964
	Features: 621
	Max length: 316
[EnsembleDataset] Dataset initialization complete
  epoch    auprc    auroc    train_loss    valid_loss    cp      dur
-------  -------  -------  ------------  ------------  ----  -------
      1   [36m0.3301[0m   [32m0.8422[0m        [35m0.1270[0m        [31m0.0530[0m     +  29.9586
      2   [36m0.3304[0m   [32m0.8423[0m        [35m0.1258[0m        [31m0.0530[0m     +  30.1263
      3   0.3303   0.8421        0.1296        [31m0.0530[0m     +  30.0917
      4   [36m0.3305[0m   [32m0.8424[0m        0.1270        [31m0.0530[0m     +  30.1412
      5   0.3304   0.8423        0.1342        0.0530        29.3115
      6   0.3303   0.8422        0.1410        [31m0.0530[0m     +  29.6820
Stopping since valid_loss has not improved in the last 3 epochs.
[32m[I 2023-01-09 02:07:46,291][0m Trial 79 finished with value: 0.33051947341881227 and parameters: {'lr': 6.126109344120714e-09, 'dropout': 0.660187302043367, 'd_model_multiplier': 4, 'num_layers': 4, 'n_heads': 8, 'dim_feedforward': 391, 'batch_size': 67, 'pos_encoding': 'fixed', 'activation': 'gelu', 'norm': 'BatchNorm', 'optimizer_name': 'PlainRAdam', 'weight_decay': 0}. Best is trial 48 with value: 0.3954917461755389.[0m
[EnsembleDataset] Initializing dataset...
	Examples: 27964
	Features: 621
	Max length: 316
[EnsembleDataset] Dataset initialization complete
  epoch    auprc    auroc    train_loss    valid_loss    cp       dur
-------  -------  -------  ------------  ------------  ----  --------
      1   [36m0.3744[0m   [32m0.8385[0m        [35m0.1208[0m        [31m0.0956[0m     +  140.1860
      2   0.3738   [32m0.8385[0m        [35m0.1132[0m        [31m0.0864[0m     +  140.0838
      3   0.3736   0.8382        [35m0.1037[0m        [31m0.0849[0m     +  139.7752
      4   0.3676   [32m0.8422[0m        [35m0.0910[0m        [31m0.0798[0m     +  140.3512
      5   0.3740   [32m0.8429[0m        [35m0.0856[0m        [31m0.0789[0m     +  139.9790
      6   0.3708   0.8422        [35m0.0831[0m        [31m0.0734[0m     +  139.9350
      7   0.3692   0.8427        [35m0.0792[0m        0.0754        140.0303
      8   0.3694   0.8424        0.0804        [31m0.0719[0m     +  140.0813
      9   0.3685   0.8422        0.0796        [31m0.0698[0m     +  140.3492
     10   [36m0.3745[0m   0.8423        [35m0.0751[0m        [31m0.0688[0m     +  139.7462
     11   0.3657   0.8422        0.0766        0.0716        140.0273
     12   [36m0.3754[0m   0.8424        [35m0.0740[0m        0.0702        139.6487
     13   0.3704   0.8420        0.0781        [31m0.0682[0m     +  139.7318
     14   0.3654   0.8416        0.0740        0.0686        139.7248
     15   0.3662   0.8418        0.0746        0.0685        140.1378
     16   0.3654   0.8416        [35m0.0724[0m        [31m0.0674[0m     +  140.4369
     17   0.3683   0.8415        [35m0.0717[0m        0.0676        139.6395
     18   0.3708   0.8418        [35m0.0710[0m        0.0675        139.6597
Stopping since valid_loss has not improved in the last 3 epochs.
[32m[I 2023-01-09 03:20:56,753][0m Trial 80 finished with value: 0.37544863211409335 and parameters: {'lr': 1.4097485242835073e-08, 'dropout': 0.01873006774833036, 'd_model_multiplier': 16, 'num_layers': 3, 'n_heads': 64, 'dim_feedforward': 499, 'batch_size': 75, 'pos_encoding': 'fixed', 'activation': 'gelu', 'norm': 'BatchNorm', 'optimizer_name': 'PlainRAdam', 'weight_decay': 0}. Best is trial 48 with value: 0.3954917461755389.[0m
[EnsembleDataset] Initializing dataset...
	Examples: 27964
	Features: 621
	Max length: 316
[EnsembleDataset] Dataset initialization complete
  epoch    auprc    auroc    train_loss    valid_loss    cp       dur
-------  -------  -------  ------------  ------------  ----  --------
      1   [36m0.2679[0m   [32m0.8347[0m        [35m0.1019[0m        [31m0.0999[0m     +  138.3133
      2   0.2674   [32m0.8348[0m        [35m0.0970[0m        [31m0.0955[0m     +  137.6079
      3   0.2664   0.8344        [35m0.0914[0m        [31m0.0822[0m     +  137.6978
      4   0.2606   0.8342        [35m0.0859[0m        [31m0.0777[0m     +  137.5309
      5   0.2614   0.8346        [35m0.0824[0m        [31m0.0738[0m     +  137.5839
      6   0.2610   0.8344        [35m0.0784[0m        0.0770        137.3184
      7   0.2607   0.8341        [35m0.0769[0m        [31m0.0701[0m     +  137.6149
      8   0.2601   0.8343        [35m0.0768[0m        [31m0.0674[0m     +  137.2422
      9   0.2584   0.8345        [35m0.0763[0m        0.0684        137.4034
     10   0.2574   0.8342        [35m0.0733[0m        0.0698        137.3074
Stopping since valid_loss has not improved in the last 3 epochs.
[32m[I 2023-01-09 04:01:59,466][0m Trial 81 finished with value: 0.2679304943836299 and parameters: {'lr': 2.587402661926083e-08, 'dropout': 0.06279676007113227, 'd_model_multiplier': 16, 'num_layers': 3, 'n_heads': 64, 'dim_feedforward': 501, 'batch_size': 56, 'pos_encoding': 'fixed', 'activation': 'gelu', 'norm': 'BatchNorm', 'optimizer_name': 'PlainRAdam', 'weight_decay': 0}. Best is trial 48 with value: 0.3954917461755389.[0m
[EnsembleDataset] Initializing dataset...
	Examples: 27964
	Features: 621
	Max length: 316
[EnsembleDataset] Dataset initialization complete
Warning, assumed runtime error: CUDA out of memory. Tried to allocate 1.83 GiB (GPU 0; 23.70 GiB total capacity; 16.32 GiB already allocated; 1.74 GiB free; 20.88 GiB reserved in total by PyTorch) If reserved memory is >> allocated memory try setting max_split_size_mb to avoid fragmentation.  See documentation for Memory Management and PYTORCH_CUDA_ALLOC_CONF
[32m[I 2023-01-09 04:02:02,980][0m Trial 82 finished with value: 0.0 and parameters: {'lr': 9.440137973816865e-09, 'dropout': 0.22527303718153022, 'd_model_multiplier': 16, 'num_layers': 3, 'n_heads': 64, 'dim_feedforward': 481, 'batch_size': 77, 'pos_encoding': 'fixed', 'activation': 'gelu', 'norm': 'BatchNorm', 'optimizer_name': 'PlainRAdam', 'weight_decay': 0}. Best is trial 48 with value: 0.3954917461755389.[0m
[EnsembleDataset] Initializing dataset...
	Examples: 27964
	Features: 621
	Max length: 316
[EnsembleDataset] Dataset initialization complete
Warning, assumed runtime error: CUDA out of memory. Tried to allocate 1.29 GiB (GPU 0; 23.70 GiB total capacity; 19.60 GiB already allocated; 1.14 GiB free; 21.48 GiB reserved in total by PyTorch) If reserved memory is >> allocated memory try setting max_split_size_mb to avoid fragmentation.  See documentation for Memory Management and PYTORCH_CUDA_ALLOC_CONF
[32m[I 2023-01-09 04:02:05,236][0m Trial 83 finished with value: 0.0 and parameters: {'lr': 1.566707022717609e-09, 'dropout': 0.15793566567489925, 'd_model_multiplier': 16, 'num_layers': 14, 'n_heads': 64, 'dim_feedforward': 451, 'batch_size': 54, 'pos_encoding': 'fixed', 'activation': 'gelu', 'norm': 'BatchNorm', 'optimizer_name': 'PlainRAdam', 'weight_decay': 0}. Best is trial 48 with value: 0.3954917461755389.[0m
[EnsembleDataset] Initializing dataset...
	Examples: 27964
	Features: 621
	Max length: 316
[EnsembleDataset] Dataset initialization complete
Warning, assumed runtime error: CUDA out of memory. Tried to allocate 2.38 GiB (GPU 0; 23.70 GiB total capacity; 16.27 GiB already allocated; 2.03 GiB free; 20.60 GiB reserved in total by PyTorch) If reserved memory is >> allocated memory try setting max_split_size_mb to avoid fragmentation.  See documentation for Memory Management and PYTORCH_CUDA_ALLOC_CONF
[32m[I 2023-01-09 04:02:09,476][0m Trial 84 finished with value: 0.0 and parameters: {'lr': 1.2225327626151484e-08, 'dropout': 0.23839760109223268, 'd_model_multiplier': 64, 'num_layers': 2, 'n_heads': 64, 'dim_feedforward': 469, 'batch_size': 100, 'pos_encoding': 'fixed', 'activation': 'gelu', 'norm': 'BatchNorm', 'optimizer_name': 'PlainRAdam', 'weight_decay': 0}. Best is trial 48 with value: 0.3954917461755389.[0m
[EnsembleDataset] Initializing dataset...
	Examples: 27964
	Features: 621
	Max length: 316
[EnsembleDataset] Dataset initialization complete
  epoch    auprc    auroc    train_loss    valid_loss    cp      dur
-------  -------  -------  ------------  ------------  ----  -------
      1   [36m0.2299[0m   [32m0.8054[0m        [35m0.1186[0m        [31m0.0568[0m     +  29.9169
      2   [36m0.2313[0m   [32m0.8055[0m        [35m0.1137[0m        [31m0.0566[0m     +  29.6817
      3   0.2310   0.8053        [35m0.1070[0m        0.0567        30.0092
      4   0.2290   0.8048        0.1173        0.0574        29.3224
Stopping since valid_loss has not improved in the last 3 epochs.
[32m[I 2023-01-09 04:10:36,432][0m Trial 85 finished with value: 0.2313392475558735 and parameters: {'lr': 1.0040820711154789e-07, 'dropout': 0.6090801601965679, 'd_model_multiplier': 16, 'num_layers': 4, 'n_heads': 8, 'dim_feedforward': 496, 'batch_size': 67, 'pos_encoding': 'fixed', 'activation': 'gelu', 'norm': 'BatchNorm', 'optimizer_name': 'RAdam', 'weight_decay': 0}. Best is trial 48 with value: 0.3954917461755389.[0m
[EnsembleDataset] Initializing dataset...
	Examples: 27964
	Features: 621
	Max length: 316
[EnsembleDataset] Dataset initialization complete
  epoch    auprc    auroc    train_loss    valid_loss    cp      dur
-------  -------  -------  ------------  ------------  ----  -------
      1   [36m0.3000[0m   [32m0.8383[0m        [35m0.1168[0m        [31m0.0527[0m     +  29.2021
      2   0.2996   [32m0.8384[0m        [35m0.1147[0m        0.0528        29.6837
      3   0.2993   [32m0.8386[0m        0.1226        0.0528        28.9296
Stopping since valid_loss has not improved in the last 3 epochs.
[32m[I 2023-01-09 04:17:05,634][0m Trial 86 finished with value: 0.3000339436331865 and parameters: {'lr': 4.356015304945907e-10, 'dropout': 0.540633693034704, 'd_model_multiplier': 4, 'num_layers': 3, 'n_heads': 8, 'dim_feedforward': 442, 'batch_size': 76, 'pos_encoding': 'fixed', 'activation': 'gelu', 'norm': 'BatchNorm', 'optimizer_name': 'PlainRAdam', 'weight_decay': 0}. Best is trial 48 with value: 0.3954917461755389.[0m
[EnsembleDataset] Initializing dataset...
	Examples: 27964
	Features: 621
	Max length: 316
[EnsembleDataset] Dataset initialization complete
  epoch    auprc    auroc    train_loss    valid_loss    cp      dur
-------  -------  -------  ------------  ------------  ----  -------
      1   [36m0.1679[0m   [32m0.6088[0m        [35m0.6427[0m        [31m0.1698[0m     +  28.8101
      2   0.0993   0.4929        1.1279        0.2906        29.3637
      3   0.1488   [32m0.6669[0m        2.2138        1.0330        28.8962
Stopping since valid_loss has not improved in the last 3 epochs.
[32m[I 2023-01-09 04:23:32,356][0m Trial 87 finished with value: 0.16794794988520614 and parameters: {'lr': 0.09934746790677167, 'dropout': 0.6924229712888664, 'd_model_multiplier': 4, 'num_layers': 2, 'n_heads': 8, 'dim_feedforward': 487, 'batch_size': 40, 'pos_encoding': 'fixed', 'activation': 'gelu', 'norm': 'BatchNorm', 'optimizer_name': 'RAdam', 'weight_decay': 0}. Best is trial 48 with value: 0.3954917461755389.[0m
[EnsembleDataset] Initializing dataset...
	Examples: 27964
	Features: 621
	Max length: 316
[EnsembleDataset] Dataset initialization complete
  epoch    auprc    auroc    train_loss    valid_loss    cp      dur
-------  -------  -------  ------------  ------------  ----  -------
      1   [36m0.2923[0m   [32m0.8322[0m        [35m0.1216[0m        [31m0.0948[0m     +  28.5965
      2   [36m0.2924[0m   0.8319        [35m0.1185[0m        0.0962        29.0867
      3   [36m0.2932[0m   [32m0.8325[0m        [35m0.1173[0m        [31m0.0895[0m     +  29.1547
      4   0.2898   0.8316        0.1183        0.0959        29.2452
      5   0.2911   0.8324        0.1177        0.0950        28.6674
Stopping since valid_loss has not improved in the last 3 epochs.
[32m[I 2023-01-09 04:33:51,497][0m Trial 88 finished with value: 0.29317828486750297 and parameters: {'lr': 2.892089585888033e-09, 'dropout': 0.02884755098330677, 'd_model_multiplier': 4, 'num_layers': 1, 'n_heads': 8, 'dim_feedforward': 455, 'batch_size': 97, 'pos_encoding': 'fixed', 'activation': 'gelu', 'norm': 'BatchNorm', 'optimizer_name': 'PlainRAdam', 'weight_decay': 0.001}. Best is trial 48 with value: 0.3954917461755389.[0m
[EnsembleDataset] Initializing dataset...
	Examples: 27964
	Features: 621
	Max length: 316
[EnsembleDataset] Dataset initialization complete
  epoch    auprc    auroc    train_loss    valid_loss    cp       dur
-------  -------  -------  ------------  ------------  ----  --------
      1   [36m0.3373[0m   [32m0.8598[0m        [35m0.1219[0m        [31m0.0521[0m     +  182.4876
      2   0.3371   [32m0.8598[0m        [35m0.1182[0m        0.0521        181.0912
      3   0.3369   [32m0.8599[0m        0.1301        0.0521        181.1489
Stopping since valid_loss has not improved in the last 3 epochs.
[32m[I 2023-01-09 04:50:30,982][0m Trial 89 finished with value: 0.3372549947069327 and parameters: {'lr': 2.3949399943433624e-08, 'dropout': 0.6707947621438594, 'd_model_multiplier': 16, 'num_layers': 4, 'n_heads': 64, 'dim_feedforward': 425, 'batch_size': 64, 'pos_encoding': 'fixed', 'activation': 'gelu', 'norm': 'BatchNorm', 'optimizer_name': 'PlainRAdam', 'weight_decay': 0}. Best is trial 48 with value: 0.3954917461755389.[0m
[EnsembleDataset] Initializing dataset...
	Examples: 27964
	Features: 621
	Max length: 316
[EnsembleDataset] Dataset initialization complete
  epoch    auprc    auroc    train_loss    valid_loss    cp      dur
-------  -------  -------  ------------  ------------  ----  -------
      1   [36m0.2208[0m   [32m0.6986[0m        [35m0.0904[0m        [31m0.0603[0m     +  30.7742
      2   [36m0.2228[0m   [32m0.7015[0m        [35m0.0902[0m        [31m0.0598[0m     +  31.0539
      3   [36m0.2251[0m   [32m0.7045[0m        [35m0.0900[0m        [31m0.0593[0m     +  31.0544
      4   [36m0.2270[0m   [32m0.7082[0m        [35m0.0890[0m        [31m0.0587[0m     +  30.8295
      5   [36m0.2301[0m   [32m0.7118[0m        0.0893        [31m0.0582[0m     +  30.7565
      6   [36m0.2313[0m   [32m0.7152[0m        0.0893        [31m0.0577[0m     +  31.0336
      7   [36m0.2333[0m   [32m0.7181[0m        [35m0.0861[0m        [31m0.0572[0m     +  31.4280
      8   [36m0.2351[0m   [32m0.7214[0m        0.0895        [31m0.0570[0m     +  31.0583
      9   0.2350   [32m0.7237[0m        0.0873        [31m0.0566[0m     +  31.0320
     10   [36m0.2361[0m   [32m0.7258[0m        0.0872        [31m0.0563[0m     +  30.2571
     11   [36m0.2382[0m   [32m0.7281[0m        0.0866        [31m0.0561[0m     +  31.5429
     12   [36m0.2402[0m   [32m0.7299[0m        [35m0.0847[0m        [31m0.0559[0m     +  31.1587
     13   [36m0.2415[0m   [32m0.7315[0m        0.0848        [31m0.0556[0m     +  31.3552
     14   [36m0.2420[0m   [32m0.7328[0m        0.0862        [31m0.0554[0m     +  31.0505
     15   [36m0.2429[0m   [32m0.7340[0m        0.0855        [31m0.0553[0m     +  31.0043
     16   [36m0.2433[0m   [32m0.7355[0m        [35m0.0843[0m        [31m0.0552[0m     +  31.0739
     17   [36m0.2435[0m   [32m0.7363[0m        0.0864        [31m0.0550[0m     +  31.0638
     18   [36m0.2442[0m   [32m0.7373[0m        0.0853        [31m0.0550[0m     +  30.9440
     19   [36m0.2449[0m   [32m0.7379[0m        0.0859        [31m0.0548[0m     +  30.9132
     20   [36m0.2455[0m   [32m0.7385[0m        0.0849        [31m0.0547[0m     +  30.8469
     21   [36m0.2460[0m   [32m0.7393[0m        0.0849        0.0547        30.4388
     22   [36m0.2464[0m   [32m0.7402[0m        0.0865        [31m0.0546[0m     +  30.6148
     23   [36m0.2473[0m   [32m0.7413[0m        0.0860        [31m0.0545[0m     +  31.2164
     24   [36m0.2478[0m   [32m0.7421[0m        0.0860        [31m0.0545[0m     +  30.6287
     25   [36m0.2486[0m   [32m0.7429[0m        0.0851        0.0545        31.1167
[32m[I 2023-01-09 05:41:24,941][0m Trial 90 finished with value: 0.24857478931649402 and parameters: {'lr': 7.64111237148569e-08, 'dropout': 0.5675772590437763, 'd_model_multiplier': 32, 'num_layers': 4, 'n_heads': 8, 'dim_feedforward': 501, 'batch_size': 85, 'pos_encoding': 'fixed', 'activation': 'gelu', 'norm': 'LayerNorm', 'optimizer_name': 'RAdam', 'weight_decay': 0}. Best is trial 48 with value: 0.3954917461755389.[0m
[EnsembleDataset] Initializing dataset...
	Examples: 27964
	Features: 621
	Max length: 316
[EnsembleDataset] Dataset initialization complete
Warning, assumed runtime error: CUDA out of memory. Tried to allocate 1.74 GiB (GPU 0; 23.70 GiB total capacity; 20.28 GiB already allocated; 247.31 MiB free; 22.38 GiB reserved in total by PyTorch) If reserved memory is >> allocated memory try setting max_split_size_mb to avoid fragmentation.  See documentation for Memory Management and PYTORCH_CUDA_ALLOC_CONF
[32m[I 2023-01-09 05:41:28,174][0m Trial 91 finished with value: 0.0 and parameters: {'lr': 1.9904878225476484e-08, 'dropout': 0.6670602527931397, 'd_model_multiplier': 16, 'num_layers': 4, 'n_heads': 64, 'dim_feedforward': 429, 'batch_size': 73, 'pos_encoding': 'fixed', 'activation': 'gelu', 'norm': 'BatchNorm', 'optimizer_name': 'PlainRAdam', 'weight_decay': 0}. Best is trial 48 with value: 0.3954917461755389.[0m
[EnsembleDataset] Initializing dataset...
	Examples: 27964
	Features: 621
	Max length: 316
[EnsembleDataset] Dataset initialization complete
  epoch    auprc    auroc    train_loss    valid_loss    cp       dur
-------  -------  -------  ------------  ------------  ----  --------
      1   [36m0.2739[0m   [32m0.8194[0m        [35m0.1323[0m        [31m0.0502[0m     +  134.9223
      2   0.2728   0.8194        [35m0.1261[0m        0.0503        134.9594
      3   0.2733   [32m0.8195[0m        [35m0.1259[0m        0.0503        135.3082
Stopping since valid_loss has not improved in the last 3 epochs.
