[32m[I 2023-05-03 06:01:31,828][0m Trial 291 finished with value: 0.24115959986449728 and parameters: {'lr': 0.0056410651947194764, 'dropout': 0.6180509968447379, 'd_model_multiplier': 1, 'num_layers': 1, 'n_heads': 64, 'dim_feedforward': 416, 'batch_size': 46, 'pos_encoding': 'fixed', 'activation': 'relu', 'norm': 'LayerNorm', 'optimizer_name': 'RAdam', 'weight_decay': 0.1, 'top_n_features': 57}. Best is trial 246 with value: 0.16447311791139763.[0m
[FileBasedDataset] Initializing dataset...
	Examples: 8264
	Features: 62
	Max length: 315
Standard scalar turned ON, loading params from cache
[FileBasedDataset] Dataset initialization complete
  epoch    auprc    auroc    train_loss    valid_acc    valid_loss    cp      dur
-------  -------  -------  ------------  -----------  ------------  ----  -------
      1   [36m0.2211[0m   [32m0.7148[0m        [35m0.2768[0m       [31m0.9093[0m        [94m0.2953[0m     +  10.3627
      2   [36m0.2372[0m   0.7134        [35m0.2480[0m       0.9069        0.3103        10.6782
      3   [36m0.2514[0m   [32m0.7243[0m        [35m0.2454[0m       0.9033        0.3086        10.8321
      4   [36m0.2688[0m   [32m0.7313[0m        [35m0.2428[0m       [31m0.9105[0m        0.3071        10.6354
      5   [36m0.2733[0m   [32m0.7355[0m        [35m0.2387[0m       0.9105        0.3044        10.5273
      6   0.2657   0.7320        [35m0.2366[0m       0.9081        0.3017        10.7611
      7   [36m0.2828[0m   0.7296        [35m0.2339[0m       [31m0.9117[0m        0.3093        10.5990
      8   [36m0.2920[0m   [32m0.7393[0m        0.2355       [31m0.9129[0m        0.3025        10.6222
      9   0.2903   [32m0.7430[0m        [35m0.2322[0m       0.9105        0.2988        10.5958
     10   [36m0.2933[0m   [32m0.7456[0m        0.2327       0.9105        [94m0.2915[0m     +  10.8028
     11   0.2492   0.7319        0.2355       0.9008        0.2927        10.5081
     12   0.2772   [32m0.7475[0m        0.2331       0.9045        [94m0.2861[0m     +  10.6185
     13   0.2790   0.7430        [35m0.2314[0m       0.9057        0.2866        10.3952
     14   0.2756   0.7293        0.2325       0.9093        0.2890        10.8472
     15   0.2745   0.7345        0.2344       0.9069        [94m0.2821[0m     +  10.4000
     16   0.2843   0.7429        0.2346       0.9105        [94m0.2796[0m     +  10.7736
     17   0.2649   0.7381        0.2321       0.9057        0.2823        10.6862
     18   0.2832   0.7395        [35m0.2302[0m       0.9117        0.2821        10.9238
     19   0.2766   0.7442        0.2319       0.9105        0.2811        10.6211
     20   0.2764   0.7415        0.2354       [31m0.9141[0m        [94m0.2769[0m     +  10.7602
     21   0.2787   0.7446        0.2319       0.9093        [94m0.2736[0m     +  10.7909
     22   0.2658   0.7298        0.2326       0.9093        0.2843        10.5226
     23   0.2527   0.7327        0.2331       0.8924        0.2974        10.9686
     24   0.2637   0.7371        0.2341       0.9033        0.2859        10.8231
     25   0.2785   0.7463        0.2306       0.8912        0.3106        10.6783
     26   0.2793   0.7446        0.2331       0.9081        0.2775        10.6841
     27   0.2765   0.7472        0.2333       0.9141        [94m0.2733[0m     +  10.8635
     28   0.2589   0.7379        0.2321       0.9069        0.2833        10.8162
     29   0.2538   0.7318        0.2307       0.8924        0.2965        10.8137
     30   0.2734   0.7450        0.2303       0.9081        0.2749        10.5047
     31   0.2738   0.7388        0.2306       0.9069        0.2789        10.7452
     32   0.2550   0.7367        [35m0.2292[0m       0.8984        0.2985        10.9360
     33   0.2584   0.7352        0.2311       0.8972        0.2952        10.5067
     34   0.2717   0.7407        0.2317       0.8960        0.2952        10.8433
     35   0.2481   0.7249        0.2297       0.8888        0.3013        10.9265
     36   0.2511   0.7292        0.2305       0.8984        0.3014        10.9342
Stopping since valid_loss has not improved in the last 10 epochs.
[32m[I 2023-05-03 06:08:08,695][0m Trial 292 finished with value: 0.2732868107010981 and parameters: {'lr': 0.002991049906145737, 'dropout': 0.5871402904231904, 'd_model_multiplier': 1, 'num_layers': 1, 'n_heads': 64, 'dim_feedforward': 426, 'batch_size': 50, 'pos_encoding': 'fixed', 'activation': 'relu', 'norm': 'LayerNorm', 'optimizer_name': 'RAdam', 'weight_decay': 0.1, 'top_n_features': 62}. Best is trial 246 with value: 0.16447311791139763.[0m
[FileBasedDataset] Initializing dataset...
	Examples: 8264
	Features: 60
	Max length: 315
Standard scalar turned ON, loading params from cache
[FileBasedDataset] Dataset initialization complete
  epoch    auprc    auroc    train_loss    valid_acc    valid_loss    cp      dur
-------  -------  -------  ------------  -----------  ------------  ----  -------
      1   [36m0.2091[0m   [32m0.6935[0m        [35m0.3377[0m       [31m0.9154[0m        [94m0.2552[0m     +  12.7914
      2   [36m0.2671[0m   [32m0.7669[0m        [35m0.2495[0m       [31m0.9178[0m        [94m0.2430[0m     +  13.1639
      3   [36m0.2759[0m   [32m0.7832[0m        [35m0.2435[0m       0.9105        0.2567        13.1355
      4   0.2637   [32m0.7886[0m        [35m0.2430[0m       0.9105        0.2609        13.3699
      5   0.2627   0.7874        [35m0.2429[0m       0.9069        0.2682        13.5283
      6   0.2592   [32m0.7900[0m        [35m0.2406[0m       0.9033        0.2743        13.3181
      7   0.2657   [32m0.7982[0m        [35m0.2399[0m       0.9129        0.2551        13.5460
      8   0.2742   0.7972        [35m0.2399[0m       0.9178        0.2500        13.7149
      9   0.2572   0.7971        0.2405       0.9069        0.2809        13.4341
     10   0.2630   [32m0.8020[0m        [35m0.2334[0m       0.9093        0.2694        13.3567
     11   0.2632   0.7973        [35m0.2332[0m       0.9093        0.2720        13.7579
Stopping since valid_loss has not improved in the last 10 epochs.
[32m[I 2023-05-03 06:10:49,298][0m Trial 293 finished with value: 0.24296481413665388 and parameters: {'lr': 0.0027614928522033183, 'dropout': 0.5930539796597271, 'd_model_multiplier': 1, 'num_layers': 1, 'n_heads': 64, 'dim_feedforward': 416, 'batch_size': 163, 'pos_encoding': 'fixed', 'activation': 'relu', 'norm': 'LayerNorm', 'optimizer_name': 'RAdam', 'weight_decay': 0.1, 'top_n_features': 60}. Best is trial 246 with value: 0.16447311791139763.[0m
[FileBasedDataset] Initializing dataset...
	Examples: 8264
	Features: 50
	Max length: 315
Standard scalar turned ON, loading params from cache
[FileBasedDataset] Dataset initialization complete
  epoch    auprc    auroc    train_loss    valid_acc    valid_loss    cp      dur
-------  -------  -------  ------------  -----------  ------------  ----  -------
      1   [36m0.2701[0m   [32m0.7373[0m        [35m0.2941[0m       [31m0.8996[0m        [94m0.3016[0m     +  10.3765
      2   0.2677   0.7299        [35m0.2343[0m       [31m0.9008[0m        0.3191        10.8175
      3   [36m0.2762[0m   0.7352        0.2364       0.8996        0.3159        10.5134
      4   [36m0.2765[0m   0.7234        [35m0.2341[0m       0.9008        0.3234        10.9639
      5   0.2625   0.7056        0.2351       [31m0.9021[0m        0.3237        11.0027
      6   [36m0.2803[0m   [32m0.7452[0m        0.2364       0.9008        0.3174        11.0143
      7   0.2781   [32m0.7502[0m        [35m0.2314[0m       0.8996        0.3263        10.9555
      8   [36m0.2829[0m   0.7479        0.2328       0.9008        0.3230        10.7400
      9   [36m0.2860[0m   [32m0.7505[0m        [35m0.2288[0m       0.8960        0.3310        11.1367
     10   [36m0.2938[0m   [32m0.7658[0m        [35m0.2279[0m       0.9008        0.3167        10.9194
Stopping since valid_loss has not improved in the last 10 epochs.
[32m[I 2023-05-03 06:12:48,683][0m Trial 294 finished with value: 0.3016202369617003 and parameters: {'lr': 0.001962627972527803, 'dropout': 0.5790463897226619, 'd_model_multiplier': 1, 'num_layers': 1, 'n_heads': 64, 'dim_feedforward': 397, 'batch_size': 67, 'pos_encoding': 'fixed', 'activation': 'relu', 'norm': 'LayerNorm', 'optimizer_name': 'RAdam', 'weight_decay': 0.1, 'top_n_features': 50}. Best is trial 246 with value: 0.16447311791139763.[0m
[FileBasedDataset] Initializing dataset...
	Examples: 8264
	Features: 45
	Max length: 315
Standard scalar turned ON, loading params from cache
[FileBasedDataset] Dataset initialization complete
  epoch    auprc    auroc    train_loss    valid_acc    valid_loss    cp      dur
-------  -------  -------  ------------  -----------  ------------  ----  -------
      1   [36m0.3140[0m   [32m0.7324[0m        [35m0.2783[0m       [31m0.9154[0m        [94m0.2594[0m     +  10.6512
      2   0.3041   0.7206        [35m0.2528[0m       0.9033        0.2753        10.8629
      3   0.3064   0.7142        [35m0.2465[0m       0.8984        0.2952        10.8329
      4   0.3117   0.7216        [35m0.2462[0m       0.8888        0.3119        10.6898
      5   0.3030   0.7240        [35m0.2425[0m       0.9033        0.2984        10.7569
      6   0.3053   0.7239        [35m0.2399[0m       0.8924        0.3289        10.7878
      7   0.3046   0.7281        [35m0.2378[0m       0.8888        0.3144        11.0047
      8   0.3124   [32m0.7392[0m        [35m0.2362[0m       0.8912        0.3048        10.7574
      9   0.3114   0.7360        [35m0.2355[0m       0.8996        0.2865        10.8588
     10   0.3045   0.7364        [35m0.2339[0m       0.9045        0.2948        10.9222
Stopping since valid_loss has not improved in the last 10 epochs.
[32m[I 2023-05-03 06:14:47,724][0m Trial 295 finished with value: 0.2593883417609813 and parameters: {'lr': 0.003932348582983592, 'dropout': 0.629145419721175, 'd_model_multiplier': 1, 'num_layers': 1, 'n_heads': 64, 'dim_feedforward': 408, 'batch_size': 57, 'pos_encoding': 'fixed', 'activation': 'relu', 'norm': 'LayerNorm', 'optimizer_name': 'RAdam', 'weight_decay': 0.1, 'top_n_features': 45}. Best is trial 246 with value: 0.16447311791139763.[0m
[FileBasedDataset] Initializing dataset...
	Examples: 8264
	Features: 36
	Max length: 315
Standard scalar turned ON, loading params from cache
[FileBasedDataset] Dataset initialization complete
  epoch    auprc    auroc    train_loss    valid_acc    valid_loss    cp      dur
-------  -------  -------  ------------  -----------  ------------  ----  -------
      1   [36m0.3197[0m   [32m0.7767[0m        [35m0.2715[0m       [31m0.9141[0m        [94m0.3075[0m     +  10.6450
      2   [36m0.3215[0m   [32m0.7979[0m        [35m0.2566[0m       0.9081        [94m0.2752[0m     +  11.1748
      3   [36m0.3433[0m   [32m0.8012[0m        [35m0.2473[0m       0.9129        0.2946        11.0725
      4   [36m0.3613[0m   [32m0.8103[0m        [35m0.2415[0m       0.9117        0.2966        11.1008
      5   0.3548   0.7989        0.2420       0.9129        0.3080        11.0976
      6   0.3416   0.7863        [35m0.2390[0m       [31m0.9202[0m        0.3084        11.1115
      7   0.3515   0.8034        0.2394       0.9154        0.2869        11.0619
      8   0.3487   0.7952        [35m0.2350[0m       0.9141        0.2846        11.3268
      9   0.3395   0.7955        0.2358       0.9154        0.2764        11.1874
     10   0.3434   0.7981        [35m0.2348[0m       0.9154        0.2789        10.8925
     11   0.3360   0.7694        0.2361       0.9154        0.2773        11.3187
Stopping since valid_loss has not improved in the last 10 epochs.
[32m[I 2023-05-03 06:17:00,987][0m Trial 296 finished with value: 0.2751615298810576 and parameters: {'lr': 0.006633909042653335, 'dropout': 0.5976192436314506, 'd_model_multiplier': 1, 'num_layers': 1, 'n_heads': 64, 'dim_feedforward': 422, 'batch_size': 76, 'pos_encoding': 'fixed', 'activation': 'relu', 'norm': 'LayerNorm', 'optimizer_name': 'RAdam', 'weight_decay': 0.1, 'top_n_features': 36}. Best is trial 246 with value: 0.16447311791139763.[0m
[FileBasedDataset] Initializing dataset...
	Examples: 8264
	Features: 48
	Max length: 315
Standard scalar turned ON, loading params from cache
[FileBasedDataset] Dataset initialization complete
  epoch    auprc    auroc    train_loss    valid_acc    valid_loss    cp      dur
-------  -------  -------  ------------  -----------  ------------  ----  -------
      1   [36m0.2209[0m   [32m0.7524[0m        [35m0.3165[0m       [31m0.9335[0m        [94m0.2189[0m     +  10.4073
      2   [36m0.2308[0m   0.7414        [35m0.2494[0m       [31m0.9347[0m        0.2268        10.3233
      3   [36m0.2518[0m   0.7429        [35m0.2475[0m       0.9214        0.2326        10.6079
      4   0.2482   0.7425        [35m0.2429[0m       0.9141        0.2391        10.8234
      5   0.2475   0.7507        0.2468       0.9202        0.2412        10.4603
      6   [36m0.2703[0m   0.7449        0.2451       0.9262        0.2362        10.5768
      7   0.2577   0.7360        0.2465       [31m0.9383[0m        0.2361        10.7222
      8   0.2532   0.7421        0.2452       0.9323        0.2267        10.5814
      9   0.2665   0.7487        [35m0.2422[0m       0.9347        0.2286        10.6202
     10   0.2598   0.7500        [35m0.2408[0m       0.9299        0.2320        10.6374
Stopping since valid_loss has not improved in the last 10 epochs.
[32m[I 2023-05-03 06:18:57,961][0m Trial 297 finished with value: 0.21892620969063714 and parameters: {'lr': 0.0014175053224523464, 'dropout': 0.6084141172988501, 'd_model_multiplier': 1, 'num_layers': 1, 'n_heads': 64, 'dim_feedforward': 439, 'batch_size': 53, 'pos_encoding': 'fixed', 'activation': 'relu', 'norm': 'LayerNorm', 'optimizer_name': 'RAdam', 'weight_decay': 0.001, 'top_n_features': 48}. Best is trial 246 with value: 0.16447311791139763.[0m
[FileBasedDataset] Initializing dataset...
	Examples: 8264
	Features: 51
	Max length: 315
Standard scalar turned ON, loading params from cache
[FileBasedDataset] Dataset initialization complete
  epoch    auprc    auroc    train_loss    valid_acc    valid_loss    cp      dur
-------  -------  -------  ------------  -----------  ------------  ----  -------
      1   [36m0.0512[0m   [32m0.3047[0m        [35m0.6846[0m       [31m0.9274[0m        [94m0.5569[0m     +  26.2692
      2   [36m0.0534[0m   [32m0.3303[0m        [35m0.4781[0m       0.9274        [94m0.3587[0m     +  26.7600
      3   [36m0.0929[0m   [32m0.5248[0m        [35m0.3501[0m       0.9274        [94m0.2831[0m     +  26.1782
      4   [36m0.1695[0m   [32m0.6397[0m        [35m0.2984[0m       0.9274        [94m0.2536[0m     +  26.2170
      5   [36m0.2097[0m   [32m0.6772[0m        [35m0.2748[0m       0.9274        [94m0.2429[0m     +  26.5879
      6   [36m0.2313[0m   [32m0.6935[0m        [35m0.2657[0m       0.9274        [94m0.2390[0m     +  26.5172
      7   [36m0.2454[0m   [32m0.7000[0m        [35m0.2583[0m       0.9274        [94m0.2376[0m     +  27.0958
      8   [36m0.2656[0m   [32m0.7027[0m        [35m0.2539[0m       0.9274        [94m0.2369[0m     +  26.4616
      9   [36m0.2701[0m   [32m0.7058[0m        [35m0.2526[0m       0.9274        [94m0.2358[0m     +  26.9464
     10   [36m0.2749[0m   [32m0.7116[0m        0.2528       0.9274        [94m0.2349[0m     +  26.5982
     11   [36m0.2840[0m   [32m0.7194[0m        [35m0.2491[0m       0.9274        [94m0.2338[0m     +  26.8240
     12   [36m0.2935[0m   [32m0.7307[0m        [35m0.2487[0m       [31m0.9287[0m        [94m0.2312[0m     +  26.7427
     13   [36m0.2999[0m   [32m0.7411[0m        [35m0.2469[0m       [31m0.9299[0m        [94m0.2291[0m     +  26.5657
     14   [36m0.3076[0m   [32m0.7526[0m        [35m0.2450[0m       0.9287        [94m0.2274[0m     +  26.3263
     15   [36m0.3129[0m   [32m0.7617[0m        [35m0.2441[0m       0.9299        [94m0.2270[0m     +  26.5605
     16   0.3123   [32m0.7658[0m        [35m0.2428[0m       0.9250        0.2275        26.4539
     17   0.3129   [32m0.7692[0m        [35m0.2401[0m       0.9178        0.2284        26.5598
     18   0.3108   [32m0.7722[0m        [35m0.2399[0m       0.9166        0.2292        26.2707
     19   0.3097   [32m0.7745[0m        [35m0.2380[0m       0.9214        0.2281        26.4012
     20   [36m0.3132[0m   [32m0.7760[0m        0.2390       0.9190        0.2286        26.8577
     21   [36m0.3166[0m   [32m0.7774[0m        0.2389       0.9190        0.2292        26.7877
     22   [36m0.3171[0m   0.7769        0.2394       0.9226        0.2280        26.7006
     23   0.3116   [32m0.7794[0m        [35m0.2379[0m       0.9226        0.2282        26.6378
     24   [36m0.3206[0m   [32m0.7795[0m        [35m0.2351[0m       0.9226        0.2280        26.5121
Stopping since valid_loss has not improved in the last 10 epochs.
[32m[I 2023-05-03 06:30:03,263][0m Trial 298 finished with value: 0.22697269603015433 and parameters: {'lr': 3.275030602152801e-05, 'dropout': 0.5700680874045432, 'd_model_multiplier': 1, 'num_layers': 4, 'n_heads': 64, 'dim_feedforward': 414, 'batch_size': 63, 'pos_encoding': 'fixed', 'activation': 'relu', 'norm': 'LayerNorm', 'optimizer_name': 'RAdam', 'weight_decay': 0.1, 'top_n_features': 51}. Best is trial 246 with value: 0.16447311791139763.[0m
[FileBasedDataset] Initializing dataset...
	Examples: 8264
	Features: 60
	Max length: 315
Standard scalar turned ON, loading params from cache
[FileBasedDataset] Dataset initialization complete
  epoch    auprc    auroc    train_loss    valid_acc    valid_loss    cp     dur
-------  -------  -------  ------------  -----------  ------------  ----  ------
      1   [36m0.3089[0m   [32m0.8105[0m        [35m0.3020[0m       [31m0.9274[0m        [94m0.2136[0m     +  8.4736
      2   [36m0.3102[0m   0.8017        [35m0.2469[0m       [31m0.9287[0m        0.2328        9.2096
      3   [36m0.3269[0m   0.8044        [35m0.2465[0m       [31m0.9311[0m        0.2324        8.9021
      4   [36m0.3323[0m   0.7999        [35m0.2397[0m       [31m0.9347[0m        0.2414        9.4372
      5   0.3179   [32m0.8179[0m        0.2407       0.9323        0.2354        9.3970
      6   0.3261   0.7968        0.2442       0.9323        0.2501        9.8511
      7   0.3250   0.7856        0.2398       0.9299        0.2499        9.3473
      8   0.3302   0.8043        [35m0.2378[0m       0.9323        0.2375        9.6470
      9   [36m0.3624[0m   [32m0.8197[0m        [35m0.2349[0m       0.9323        0.2337        9.3629
     10   0.3479   0.7967        0.2353       0.9311        0.2470        9.1036
Stopping since valid_loss has not improved in the last 10 epochs.
[32m[I 2023-05-03 06:31:45,484][0m Trial 299 finished with value: 0.21362408660487367 and parameters: {'lr': 0.002713498096883307, 'dropout': 0.5806897853962472, 'd_model_multiplier': 1, 'num_layers': 1, 'n_heads': 32, 'dim_feedforward': 425, 'batch_size': 47, 'pos_encoding': 'fixed', 'activation': 'relu', 'norm': 'LayerNorm', 'optimizer_name': 'RAdam', 'weight_decay': 0.1, 'top_n_features': 60}. Best is trial 246 with value: 0.16447311791139763.[0m
[FileBasedDataset] Initializing dataset...
	Examples: 8264
	Features: 71
	Max length: 315
Standard scalar turned ON, loading params from cache
[FileBasedDataset] Dataset initialization complete
Warning, assumed runtime error: CUDA out of memory. Tried to allocate 860.00 MiB (GPU 0; 23.70 GiB total capacity; 21.91 GiB already allocated; 169.25 MiB free; 22.44 GiB reserved in total by PyTorch) If reserved memory is >> allocated memory try setting max_split_size_mb to avoid fragmentation.  See documentation for Memory Management and PYTORCH_CUDA_ALLOC_CONF
