[32m[I 2023-01-10 03:09:13,196][0m Trial 186 finished with value: 0.34284381233921374 and parameters: {'lr': 0.0008449007340561675, 'dropout': 0.6512462185570937, 'd_model_multiplier': 32, 'num_layers': 2, 'n_heads': 8, 'dim_feedforward': 453, 'batch_size': 112, 'pos_encoding': 'fixed', 'activation': 'gelu', 'norm': 'LayerNorm', 'optimizer_name': 'RAdam', 'weight_decay': 0.1}. Best is trial 122 with value: 0.40157405369010674.[0m
[EnsembleDataset] Initializing dataset...
	Examples: 27964
	Features: 621
	Max length: 316
[EnsembleDataset] Dataset initialization complete
  epoch    auprc    auroc    train_loss    valid_loss    cp      dur
-------  -------  -------  ------------  ------------  ----  -------
      1   [36m0.2119[0m   [32m0.6939[0m        [35m0.3572[0m        [31m0.1744[0m     +  30.4930
      2   [36m0.2448[0m   [32m0.7692[0m        0.7796        [31m0.0694[0m     +  31.0730
      3   [36m0.2776[0m   [32m0.7857[0m        [35m0.0807[0m        [31m0.0553[0m     +  30.6320
      4   [36m0.2780[0m   [32m0.7951[0m        [35m0.0654[0m        [31m0.0536[0m     +  30.7130
      5   [36m0.2888[0m   [32m0.8076[0m        [35m0.0626[0m        0.0555        29.7082
      6   0.2850   0.8061        [35m0.0606[0m        [31m0.0521[0m     +  30.3352
      7   0.2448   0.7610        [35m0.0599[0m        0.0546        29.8306
      8   0.2361   0.7305        [35m0.0595[0m        0.0556        31.1091
Stopping since valid_loss has not improved in the last 3 epochs.
[32m[I 2023-01-10 03:24:59,494][0m Trial 187 finished with value: 0.28879341329397945 and parameters: {'lr': 0.0012344006163268423, 'dropout': 0.6535056066787648, 'd_model_multiplier': 32, 'num_layers': 1, 'n_heads': 16, 'dim_feedforward': 442, 'batch_size': 111, 'pos_encoding': 'fixed', 'activation': 'gelu', 'norm': 'LayerNorm', 'optimizer_name': 'PlainRAdam', 'weight_decay': 0.01}. Best is trial 122 with value: 0.40157405369010674.[0m
[EnsembleDataset] Initializing dataset...
	Examples: 27964
	Features: 621
	Max length: 316
[EnsembleDataset] Dataset initialization complete
  epoch    auprc    auroc    train_loss    valid_loss    cp      dur
-------  -------  -------  ------------  ------------  ----  -------
      1   [36m0.2007[0m   [32m0.6987[0m        [35m0.0913[0m        [31m0.0624[0m     +  30.7987
      2   [36m0.2007[0m   [32m0.6988[0m        0.0913        [31m0.0624[0m     +  30.3148
      3   [36m0.2008[0m   [32m0.6989[0m        0.0914        [31m0.0624[0m     +  30.3748
      4   [36m0.2008[0m   [32m0.6990[0m        0.0918        [31m0.0624[0m     +  30.1033
      5   [36m0.2009[0m   [32m0.6991[0m        [35m0.0896[0m        [31m0.0623[0m     +  30.7136
      6   [36m0.2009[0m   [32m0.6992[0m        0.0914        [31m0.0623[0m     +  31.0803
      7   [36m0.2010[0m   [32m0.6994[0m        0.0905        [31m0.0623[0m     +  31.0323
      8   [36m0.2011[0m   [32m0.6996[0m        0.0934        [31m0.0623[0m     +  30.9741
      9   [36m0.2012[0m   [32m0.6997[0m        0.0915        [31m0.0623[0m     +  30.6693
     10   [36m0.2013[0m   [32m0.6998[0m        0.0923        [31m0.0622[0m     +  30.6660
     11   [36m0.2014[0m   [32m0.7000[0m        0.0918        [31m0.0622[0m     +  30.9167
     12   [36m0.2014[0m   [32m0.7002[0m        0.0934        [31m0.0622[0m     +  29.9931
     13   [36m0.2017[0m   [32m0.7003[0m        0.0910        [31m0.0621[0m     +  31.2154
     14   0.2017   [32m0.7004[0m        0.0918        [31m0.0621[0m     +  30.9217
     15   [36m0.2019[0m   [32m0.7006[0m        0.0916        [31m0.0621[0m     +  30.4116
     16   [36m0.2020[0m   [32m0.7008[0m        0.0921        [31m0.0621[0m     +  30.3346
     17   0.2020   [32m0.7009[0m        0.0908        [31m0.0620[0m     +  30.6824
     18   [36m0.2020[0m   [32m0.7012[0m        0.0915        [31m0.0620[0m     +  30.6919
     19   [36m0.2021[0m   [32m0.7013[0m        0.0914        [31m0.0620[0m     +  30.7317
     20   [36m0.2023[0m   [32m0.7015[0m        0.0924        [31m0.0620[0m     +  30.8335
     21   [36m0.2024[0m   [32m0.7017[0m        0.0908        [31m0.0619[0m     +  31.0829
     22   [36m0.2025[0m   [32m0.7018[0m        0.0912        [31m0.0619[0m     +  31.7573
     23   [36m0.2025[0m   [32m0.7020[0m        0.0912        [31m0.0619[0m     +  31.6316
     24   [36m0.2026[0m   [32m0.7022[0m        0.0917        [31m0.0619[0m     +  31.0519
     25   [36m0.2028[0m   [32m0.7023[0m        0.0914        [31m0.0618[0m     +  31.4327
[32m[I 2023-01-10 04:13:15,333][0m Trial 188 finished with value: 0.20278123022749908 and parameters: {'lr': 1.7989112793275808e-09, 'dropout': 0.5986302965264303, 'd_model_multiplier': 32, 'num_layers': 3, 'n_heads': 8, 'dim_feedforward': 453, 'batch_size': 123, 'pos_encoding': 'fixed', 'activation': 'gelu', 'norm': 'LayerNorm', 'optimizer_name': 'RAdam', 'weight_decay': 0.001}. Best is trial 122 with value: 0.40157405369010674.[0m
[EnsembleDataset] Initializing dataset...
	Examples: 27964
	Features: 621
	Max length: 316
[EnsembleDataset] Dataset initialization complete
  epoch    auprc    auroc    train_loss    valid_loss    cp      dur
-------  -------  -------  ------------  ------------  ----  -------
      1   [36m0.2430[0m   [32m0.7958[0m        [35m0.4641[0m        [31m0.0772[0m     +  30.4828
      2   [36m0.2727[0m   [32m0.8025[0m        [35m0.0645[0m        [31m0.0591[0m     +  30.8965
      3   [36m0.2846[0m   [32m0.8154[0m        [35m0.0577[0m        [31m0.0569[0m     +  30.6404
      4   [36m0.3099[0m   [32m0.8239[0m        [35m0.0566[0m        [31m0.0535[0m     +  30.6670
      5   [36m0.3157[0m   [32m0.8319[0m        [35m0.0550[0m        [31m0.0534[0m     +  30.9191
      6   0.2357   0.7557        0.0565        0.3044        30.4194
      7   0.2580   0.8047        [35m0.0540[0m        0.0877        30.7118
Stopping since valid_loss has not improved in the last 3 epochs.
[32m[I 2023-01-10 04:27:18,798][0m Trial 189 finished with value: 0.31572820309086025 and parameters: {'lr': 0.004370179906953816, 'dropout': 0.6410249459843511, 'd_model_multiplier': 32, 'num_layers': 2, 'n_heads': 8, 'dim_feedforward': 416, 'batch_size': 117, 'pos_encoding': 'fixed', 'activation': 'gelu', 'norm': 'LayerNorm', 'optimizer_name': 'RAdam', 'weight_decay': 0.1}. Best is trial 122 with value: 0.40157405369010674.[0m
[EnsembleDataset] Initializing dataset...
	Examples: 27964
	Features: 621
	Max length: 316
[EnsembleDataset] Dataset initialization complete
Warning, assumed runtime error: CUDA out of memory. Tried to allocate 1.81 GiB (GPU 0; 23.70 GiB total capacity; 18.13 GiB already allocated; 1003.31 MiB free; 21.64 GiB reserved in total by PyTorch) If reserved memory is >> allocated memory try setting max_split_size_mb to avoid fragmentation.  See documentation for Memory Management and PYTORCH_CUDA_ALLOC_CONF
[32m[I 2023-01-10 04:27:22,264][0m Trial 190 finished with value: 0.0 and parameters: {'lr': 0.002121938452298609, 'dropout': 0.6859128763406147, 'd_model_multiplier': 32, 'num_layers': 3, 'n_heads': 64, 'dim_feedforward': 447, 'batch_size': 76, 'pos_encoding': 'fixed', 'activation': 'gelu', 'norm': 'LayerNorm', 'optimizer_name': 'PlainRAdam', 'weight_decay': 0}. Best is trial 122 with value: 0.40157405369010674.[0m
[EnsembleDataset] Initializing dataset...
	Examples: 27964
	Features: 621
	Max length: 316
[EnsembleDataset] Dataset initialization complete
  epoch    auprc    auroc    train_loss    valid_loss    cp      dur
-------  -------  -------  ------------  ------------  ----  -------
      1   [36m0.2054[0m   [32m0.6655[0m        [35m0.0978[0m        [31m0.0643[0m     +  32.1482
      2   [36m0.2485[0m   [32m0.7814[0m        [35m0.0874[0m        [31m0.0515[0m     +  31.0506
      3   0.2396   0.7483        [35m0.0798[0m        0.0553        31.8141
      4   [36m0.2714[0m   0.7710        [35m0.0764[0m        0.0559        30.8853
Stopping since valid_loss has not improved in the last 3 epochs.
[32m[I 2023-01-10 04:35:42,321][0m Trial 191 finished with value: 0.2714450835947274 and parameters: {'lr': 0.00019907785143327084, 'dropout': 0.6673420893953562, 'd_model_multiplier': 32, 'num_layers': 2, 'n_heads': 8, 'dim_feedforward': 465, 'batch_size': 154, 'pos_encoding': 'fixed', 'activation': 'gelu', 'norm': 'LayerNorm', 'optimizer_name': 'RAdam', 'weight_decay': 0.1}. Best is trial 122 with value: 0.40157405369010674.[0m
[EnsembleDataset] Initializing dataset...
	Examples: 27964
	Features: 621
	Max length: 316
[EnsembleDataset] Dataset initialization complete
  epoch    auprc    auroc    train_loss    valid_loss    cp      dur
-------  -------  -------  ------------  ------------  ----  -------
      1   [36m0.2876[0m   [32m0.8115[0m        [35m0.1232[0m        [31m0.0465[0m     +  29.5535
      2   [36m0.2911[0m   [32m0.8163[0m        [35m0.0876[0m        [31m0.0462[0m     +  29.8423
      3   [36m0.2929[0m   [32m0.8184[0m        [35m0.0729[0m        0.0462        29.2582
      4   0.2927   [32m0.8187[0m        [35m0.0624[0m        [31m0.0461[0m     +  29.6545
      5   0.2912   0.8171        [35m0.0550[0m        0.0461        29.2072
      6   0.2898   0.8168        [35m0.0524[0m        0.0461        29.8683
Stopping since valid_loss has not improved in the last 3 epochs.
[32m[I 2023-01-10 04:47:27,125][0m Trial 192 finished with value: 0.29290367858061683 and parameters: {'lr': 0.0007975371191347074, 'dropout': 0.6791640689355031, 'd_model_multiplier': 4, 'num_layers': 2, 'n_heads': 8, 'dim_feedforward': 471, 'batch_size': 92, 'pos_encoding': 'fixed', 'activation': 'relu', 'norm': 'BatchNorm', 'optimizer_name': 'RAdam', 'weight_decay': 0.1}. Best is trial 122 with value: 0.40157405369010674.[0m
[EnsembleDataset] Initializing dataset...
	Examples: 27964
	Features: 621
	Max length: 316
[EnsembleDataset] Dataset initialization complete
  epoch    auprc    auroc    train_loss    valid_loss    cp      dur
-------  -------  -------  ------------  ------------  ----  -------
      1   [36m0.3430[0m   [32m0.8391[0m        [35m0.1276[0m        [31m0.0542[0m     +  29.7667
      2   0.3381   0.8383        [35m0.0966[0m        0.0544        30.4005
      3   0.3424   0.8371        [35m0.0733[0m        0.0542        29.9494
      4   [36m0.3464[0m   [32m0.8408[0m        [35m0.0679[0m        [31m0.0540[0m     +  29.5802
      5   [36m0.3480[0m   0.8394        [35m0.0598[0m        [31m0.0539[0m     +  29.7510
      6   [36m0.3503[0m   0.8399        [35m0.0561[0m        [31m0.0538[0m     +  30.1679
      7   0.3495   0.8400        [35m0.0531[0m        0.0539        29.6640
      8   0.3491   0.8406        0.0536        0.0538        30.0418
Stopping since valid_loss has not improved in the last 3 epochs.
[32m[I 2023-01-10 05:03:10,778][0m Trial 193 finished with value: 0.3503381322288675 and parameters: {'lr': 0.00042655582436987446, 'dropout': 0.6574876036666889, 'd_model_multiplier': 4, 'num_layers': 2, 'n_heads': 8, 'dim_feedforward': 457, 'batch_size': 111, 'pos_encoding': 'fixed', 'activation': 'gelu', 'norm': 'BatchNorm', 'optimizer_name': 'RAdam', 'weight_decay': 0.1}. Best is trial 122 with value: 0.40157405369010674.[0m
[EnsembleDataset] Initializing dataset...
	Examples: 27964
	Features: 621
	Max length: 316
[EnsembleDataset] Dataset initialization complete
  epoch    auprc    auroc    train_loss    valid_loss    cp      dur
-------  -------  -------  ------------  ------------  ----  -------
      1   [36m0.3152[0m   [32m0.8260[0m        [35m0.1102[0m        [31m0.0511[0m     +  29.9541
      2   0.3063   0.8209        [35m0.0958[0m        0.0514        29.9561
      3   [36m0.3211[0m   [32m0.8279[0m        [35m0.0782[0m        [31m0.0507[0m     +  29.9555
      4   0.3204   [32m0.8294[0m        [35m0.0623[0m        [31m0.0506[0m     +  29.5536
      5   0.3198   0.8283        [35m0.0581[0m        [31m0.0506[0m     +  29.5506
      6   [36m0.3212[0m   0.8283        [35m0.0556[0m        [31m0.0505[0m     +  30.2700
      7   0.3177   0.8277        [35m0.0539[0m        0.0507        31.2023
      8   0.3168   0.8268        [35m0.0519[0m        0.0507        30.2616
Stopping since valid_loss has not improved in the last 3 epochs.
[32m[I 2023-01-10 05:18:59,903][0m Trial 194 finished with value: 0.32120907292017836 and parameters: {'lr': 0.0006261187537923601, 'dropout': 0.6532259570510143, 'd_model_multiplier': 4, 'num_layers': 1, 'n_heads': 8, 'dim_feedforward': 457, 'batch_size': 111, 'pos_encoding': 'fixed', 'activation': 'gelu', 'norm': 'BatchNorm', 'optimizer_name': 'RAdam', 'weight_decay': 0.1}. Best is trial 122 with value: 0.40157405369010674.[0m
[EnsembleDataset] Initializing dataset...
	Examples: 27964
	Features: 621
	Max length: 316
[EnsembleDataset] Dataset initialization complete
  epoch    auprc    auroc    train_loss    valid_loss    cp      dur
-------  -------  -------  ------------  ------------  ----  -------
      1   [36m0.3936[0m   [32m0.8377[0m        [35m0.1348[0m        [31m0.0509[0m     +  30.6304
      2   [36m0.3936[0m   [32m0.8378[0m        0.1356        [31m0.0509[0m     +  30.5817
      3   0.3935   [32m0.8380[0m        0.1365        0.0509        30.4118
      4   [36m0.3939[0m   [32m0.8380[0m        0.1367        [31m0.0509[0m     +  31.3237
      5   0.3938   0.8376        [35m0.1321[0m        0.0509        31.1697
      6   0.3937   0.8378        [35m0.1305[0m        0.0509        30.5165
Stopping since valid_loss has not improved in the last 3 epochs.
[32m[I 2023-01-10 05:31:00,825][0m Trial 195 finished with value: 0.39391317918262336 and parameters: {'lr': 1.1016754391120037e-08, 'dropout': 0.6433117112555695, 'd_model_multiplier': 4, 'num_layers': 5, 'n_heads': 8, 'dim_feedforward': 431, 'batch_size': 99, 'pos_encoding': 'fixed', 'activation': 'gelu', 'norm': 'BatchNorm', 'optimizer_name': 'RAdam', 'weight_decay': 0.1}. Best is trial 122 with value: 0.40157405369010674.[0m
[EnsembleDataset] Initializing dataset...
	Examples: 27964
	Features: 621
	Max length: 316
[EnsembleDataset] Dataset initialization complete
  epoch    auprc    auroc    train_loss    valid_loss    cp      dur
-------  -------  -------  ------------  ------------  ----  -------
      1   [36m0.2968[0m   [32m0.8108[0m        [35m0.1324[0m        [31m0.0461[0m     +  31.0145
      2   0.2953   0.8105        0.1642        0.0462        30.6562
      3   0.2953   0.8107        0.1493        0.0462        30.6726
Stopping since valid_loss has not improved in the last 3 epochs.
[32m[I 2023-01-10 05:37:14,208][0m Trial 196 finished with value: 0.296814977874158 and parameters: {'lr': 1.366776500834214e-08, 'dropout': 0.6193192071150273, 'd_model_multiplier': 4, 'num_layers': 4, 'n_heads': 8, 'dim_feedforward': 434, 'batch_size': 97, 'pos_encoding': 'fixed', 'activation': 'gelu', 'norm': 'BatchNorm', 'optimizer_name': 'RAdam', 'weight_decay': 0.1}. Best is trial 122 with value: 0.40157405369010674.[0m
[EnsembleDataset] Initializing dataset...
	Examples: 27964
	Features: 621
	Max length: 316
[EnsembleDataset] Dataset initialization complete
  epoch    auprc    auroc    train_loss    valid_loss    cp      dur
-------  -------  -------  ------------  ------------  ----  -------
      1   [36m0.3049[0m   [32m0.8250[0m        [35m0.1483[0m        [31m0.0510[0m     +  60.0359
      2   0.3047   0.8250        [35m0.1387[0m        0.0510        59.8296
      3   [36m0.3049[0m   [32m0.8251[0m        0.1559        [31m0.0510[0m     +  60.1297
      4   [36m0.3050[0m   [32m0.8255[0m        0.1513        0.0510        60.1907
      5   0.3048   0.8249        [35m0.1306[0m        0.0511        59.8308
Stopping since valid_loss has not improved in the last 3 epochs.
[32m[I 2023-01-10 05:50:15,653][0m Trial 197 finished with value: 0.3049722646447037 and parameters: {'lr': 5.269000714088527e-09, 'dropout': 0.6354639797558022, 'd_model_multiplier': 4, 'num_layers': 8, 'n_heads': 16, 'dim_feedforward': 425, 'batch_size': 105, 'pos_encoding': 'learnable', 'activation': 'gelu', 'norm': 'BatchNorm', 'optimizer_name': 'RAdam', 'weight_decay': 0.1}. Best is trial 122 with value: 0.40157405369010674.[0m
[EnsembleDataset] Initializing dataset...
	Examples: 27964
	Features: 621
	Max length: 316
[EnsembleDataset] Dataset initialization complete
  epoch    auprc    auroc    train_loss    valid_loss    cp      dur
-------  -------  -------  ------------  ------------  ----  -------
      1   [36m0.1980[0m   [32m0.6649[0m        [35m0.0991[0m        [31m0.0669[0m     +  36.3661
      2   [36m0.1984[0m   [32m0.6654[0m        0.1009        [31m0.0668[0m     +  35.7503
      3   [36m0.1990[0m   [32m0.6660[0m        [35m0.0985[0m        [31m0.0667[0m     +  35.3746
      4   [36m0.1995[0m   [32m0.6668[0m        0.0990        [31m0.0667[0m     +  35.5793
      5   [36m0.1998[0m   [32m0.6676[0m        0.0996        [31m0.0666[0m     +  35.7329
      6   [36m0.2011[0m   [32m0.6684[0m        0.0994        [31m0.0665[0m     +  35.8813
      7   [36m0.2016[0m   [32m0.6692[0m        0.0996        [31m0.0664[0m     +  35.8911
      8   [36m0.2020[0m   [32m0.6700[0m        0.1013        [31m0.0663[0m     +  35.6134
      9   [36m0.2024[0m   [32m0.6709[0m        [35m0.0985[0m        [31m0.0662[0m     +  35.9451
     10   [36m0.2031[0m   [32m0.6717[0m        0.0994        [31m0.0661[0m     +  35.8793
     11   [36m0.2037[0m   [32m0.6726[0m        0.1002        [31m0.0661[0m     +  35.6084
     12   [36m0.2039[0m   [32m0.6735[0m        0.0998        [31m0.0660[0m     +  35.6942
     13   [36m0.2050[0m   [32m0.6744[0m        [35m0.0976[0m        [31m0.0659[0m     +  35.8374
     14   [36m0.2059[0m   [32m0.6753[0m        0.0983        [31m0.0658[0m     +  35.3923
     15   [36m0.2069[0m   [32m0.6763[0m        0.0976        [31m0.0657[0m     +  35.7543
     16   [36m0.2076[0m   [32m0.6772[0m        0.0989        [31m0.0656[0m     +  35.7267
     17   [36m0.2079[0m   [32m0.6781[0m        0.0993        [31m0.0656[0m     +  35.6778
     18   [36m0.2084[0m   [32m0.6790[0m        0.0996        [31m0.0655[0m     +  35.8534
     19   [36m0.2085[0m   [32m0.6798[0m        0.0988        [31m0.0654[0m     +  35.7149
     20   [36m0.2091[0m   [32m0.6808[0m        0.0998        [31m0.0654[0m     +  35.6496
     21   [36m0.2097[0m   [32m0.6816[0m        0.0984        [31m0.0653[0m     +  35.8142
     22   [36m0.2101[0m   [32m0.6825[0m        0.0989        [31m0.0652[0m     +  35.8361
     23   [36m0.2107[0m   [32m0.6834[0m        0.0989        [31m0.0652[0m     +  35.5509
     24   [36m0.2113[0m   [32m0.6842[0m        [35m0.0970[0m        [31m0.0651[0m     +  35.7445
     25   [36m0.2120[0m   [32m0.6850[0m        [35m0.0970[0m        [31m0.0651[0m     +  35.6166
[32m[I 2023-01-10 06:40:22,440][0m Trial 198 finished with value: 0.21199177627865518 and parameters: {'lr': 8.008363680514146e-09, 'dropout': 0.6481082184535308, 'd_model_multiplier': 32, 'num_layers': 5, 'n_heads': 8, 'dim_feedforward': 450, 'batch_size': 88, 'pos_encoding': 'fixed', 'activation': 'gelu', 'norm': 'LayerNorm', 'optimizer_name': 'RAdam', 'weight_decay': 0.1}. Best is trial 122 with value: 0.40157405369010674.[0m
[EnsembleDataset] Initializing dataset...
	Examples: 27964
	Features: 621
	Max length: 316
[EnsembleDataset] Dataset initialization complete
  epoch    auprc    auroc    train_loss    valid_loss    cp      dur
-------  -------  -------  ------------  ------------  ----  -------
      1   [36m0.2962[0m   [32m0.8493[0m        [35m0.1262[0m        [31m0.0482[0m     +  29.7806
      2   [36m0.2974[0m   [32m0.8513[0m        [35m0.1254[0m        [31m0.0481[0m     +  30.3522
      3   [36m0.2983[0m   [32m0.8520[0m        [35m0.1154[0m        [31m0.0480[0m     +  30.5077
      4   0.2982   [32m0.8529[0m        [35m0.1151[0m        [31m0.0480[0m     +  30.4872
      5   [36m0.2994[0m   [32m0.8538[0m        [35m0.1144[0m        [31m0.0479[0m     +  31.1203
      6   [36m0.2994[0m   [32m0.8544[0m        0.1148        [31m0.0479[0m     +  29.7294
      7   0.2989   [32m0.8547[0m        [35m0.1125[0m        0.0479        30.5080
      8   0.2989   [32m0.8551[0m        [35m0.0969[0m        [31m0.0479[0m     +  30.6020
      9   [36m0.2999[0m   [32m0.8557[0m        0.1127        [31m0.0478[0m     +  29.8964
     10   [36m0.3003[0m   [32m0.8564[0m        0.1056        [31m0.0478[0m     +  30.2793
     11   [36m0.3005[0m   [32m0.8575[0m        0.1007        [31m0.0478[0m     +  30.7810
     12   0.3004   [32m0.8577[0m        0.0970        0.0478        30.6170
     13   0.2996   [32m0.8579[0m        [35m0.0908[0m        0.0478        30.0214
Stopping since valid_loss has not improved in the last 3 epochs.
