[32m[I 2023-05-05 00:06:12,543][0m Trial 516 finished with value: 100.0 and parameters: {'lr': 0.0012617427941270572, 'dropout': 0.2785633838625376, 'd_model_multiplier': 2, 'num_layers': 6, 'n_heads': 64, 'dim_feedforward': 338, 'batch_size': 49, 'pos_encoding': 'learnable', 'activation': 'relu', 'norm': 'LayerNorm', 'optimizer_name': 'PlainRAdam', 'weight_decay': 0.001, 'top_n_features': 75}. Best is trial 246 with value: 0.16447311791139763.[0m
[FileBasedDataset] Initializing dataset...
	Examples: 8264
	Features: 206
	Max length: 315
Standard scalar turned ON, loading params from cache
[FileBasedDataset] Dataset initialization complete
  epoch    auprc    auroc    train_loss    valid_acc    valid_loss    cp      dur
-------  -------  -------  ------------  -----------  ------------  ----  -------
      1   [36m0.0734[0m   [32m0.3026[0m        [35m0.5489[0m       [31m0.9190[0m        [94m0.5276[0m     +  69.5168
      2   [36m0.2491[0m   [32m0.7092[0m        [35m0.3146[0m       0.9141        [94m0.4418[0m     +  69.6088
      3   [36m0.3070[0m   [32m0.7991[0m        [35m0.2705[0m       0.9117        [94m0.4153[0m     +  69.8697
      4   [36m0.3133[0m   [32m0.8187[0m        [35m0.2607[0m       0.9129        [94m0.4020[0m     +  69.8974
      5   [36m0.3134[0m   [32m0.8216[0m        [35m0.2528[0m       0.9154        [94m0.3918[0m     +  69.6562
      6   0.3070   0.8204        [35m0.2508[0m       0.9117        [94m0.3866[0m     +  69.8895
      7   0.3021   0.8057        [35m0.2463[0m       0.9093        [94m0.3763[0m     +  70.0088
      8   0.3075   0.8047        [35m0.2438[0m       0.9105        [94m0.3729[0m     +  70.0746
      9   0.3042   0.8044        [35m0.2404[0m       0.9081        [94m0.3715[0m     +  70.0948
     10   0.2942   0.7948        [35m0.2397[0m       0.9069        [94m0.3661[0m     +  69.7854
     11   0.2847   0.7791        [35m0.2356[0m       0.9105        [94m0.3571[0m     +  69.8753
     12   0.2901   0.7705        [35m0.2342[0m       0.9105        [94m0.3541[0m     +  69.9740
     13   0.2984   0.7791        [35m0.2324[0m       0.9081        [94m0.3393[0m     +  69.7868
     14   0.2993   0.7770        [35m0.2296[0m       0.9069        0.3457        70.2079
     15   0.2815   0.7723        [35m0.2275[0m       0.9081        [94m0.3229[0m     +  70.1646
     16   0.2760   0.7700        0.2276       0.9033        [94m0.3161[0m     +  70.3065
     17   0.2779   0.7699        [35m0.2253[0m       0.9069        0.3197        69.9429
     18   0.2813   0.7690        [35m0.2222[0m       0.9057        [94m0.3108[0m     +  69.9947
     19   0.2795   0.7544        [35m0.2209[0m       0.9069        0.3134        70.0382
     20   0.2723   0.7510        0.2213       0.9081        0.3131        70.2305
     21   0.2762   0.7569        [35m0.2170[0m       0.9081        [94m0.3072[0m     +  70.0143
     22   0.2718   0.7548        [35m0.2163[0m       0.9069        0.3152        69.8202
     23   0.2658   0.7393        [35m0.2159[0m       0.9069        0.3273        70.5135
     24   0.2685   0.7500        [35m0.2147[0m       0.9093        0.3172        70.0581
     25   0.2636   0.7428        [35m0.2111[0m       0.9093        0.3113        69.9298
     26   0.2777   0.7401        [35m0.2093[0m       0.9081        [94m0.3060[0m     +  70.0164
     27   0.2725   0.7441        [35m0.2088[0m       0.9069        0.3129        69.9387
     28   0.2529   0.7226        [35m0.2050[0m       0.9069        [94m0.3050[0m     +  69.7875
     29   0.2666   0.7402        [35m0.2022[0m       0.9045        [94m0.2988[0m     +  70.1807
     30   0.2625   0.7271        0.2059       0.9008        0.3108        70.0529
     31   0.2544   0.7200        [35m0.2011[0m       0.8984        0.3164        70.0684
     32   0.2499   0.7229        [35m0.1979[0m       0.8996        0.3288        69.8215
     33   0.2600   0.7356        0.1991       0.8996        0.3141        70.1829
     34   0.2502   0.7202        0.1984       0.9045        0.3149        69.9687
     35   0.2486   0.7210        0.1994       0.9081        0.3133        70.2610
     36   0.2300   0.6978        [35m0.1938[0m       0.9033        0.3209        70.1024
     37   0.2272   0.7016        [35m0.1924[0m       0.8984        0.3241        69.6969
     38   0.2285   0.6947        [35m0.1881[0m       0.9021        0.3292        69.7904
Stopping since valid_loss has not improved in the last 10 epochs.
[32m[I 2023-05-05 00:52:03,338][0m Trial 517 finished with value: 0.298805949117137 and parameters: {'lr': 9.65361027513458e-06, 'dropout': 0.45836752109441764, 'd_model_multiplier': 32, 'num_layers': 7, 'n_heads': 32, 'dim_feedforward': 317, 'batch_size': 58, 'pos_encoding': 'fixed', 'activation': 'gelu', 'norm': 'BatchNorm', 'optimizer_name': 'RAdam', 'weight_decay': 0.1, 'top_n_features': 206}. Best is trial 246 with value: 0.16447311791139763.[0m
[FileBasedDataset] Initializing dataset...
	Examples: 8264
	Features: 59
	Max length: 315
Standard scalar turned ON, loading params from cache
[FileBasedDataset] Dataset initialization complete
  epoch    auprc    auroc    train_loss    valid_acc    valid_loss    cp      dur
-------  -------  -------  ------------  -----------  ------------  ----  -------
      1   [36m0.2069[0m   [32m0.6272[0m        [35m0.3369[0m       [31m0.9069[0m        [94m0.3019[0m     +  25.2951
      2   [36m0.2503[0m   [32m0.6858[0m        [35m0.2540[0m       0.9069        [94m0.2979[0m     +  25.0856
      3   [36m0.2772[0m   [32m0.7141[0m        [35m0.2464[0m       [31m0.9081[0m        [94m0.2942[0m     +  25.6616
      4   [36m0.2806[0m   [32m0.7247[0m        [35m0.2426[0m       [31m0.9105[0m        [94m0.2930[0m     +  25.5844
      5   [36m0.2839[0m   [32m0.7312[0m        [35m0.2391[0m       0.9069        0.2961        25.4428
      6   [36m0.2907[0m   [32m0.7325[0m        [35m0.2364[0m       0.9021        0.3038        25.7351
      7   [36m0.2920[0m   0.7317        [35m0.2330[0m       0.8912        0.3151        25.6050
      8   [36m0.2992[0m   0.7319        [35m0.2321[0m       0.8888        0.3206        25.5184
      9   [36m0.3001[0m   0.7324        [35m0.2318[0m       0.8827        0.3290        25.3208
     10   0.2952   0.7311        [35m0.2294[0m       0.8851        0.3308        25.6186
     11   0.2962   0.7318        [35m0.2286[0m       0.8839        0.3352        25.7034
     12   0.2966   [32m0.7333[0m        [35m0.2286[0m       0.8791        0.3404        25.6576
     13   0.2963   [32m0.7339[0m        [35m0.2260[0m       0.8815        0.3408        25.7614
Stopping since valid_loss has not improved in the last 10 epochs.
[32m[I 2023-05-05 00:58:01,841][0m Trial 518 finished with value: 0.293017566852731 and parameters: {'lr': 2.10208756135477e-05, 'dropout': 0.6637871445509704, 'd_model_multiplier': 8, 'num_layers': 5, 'n_heads': 32, 'dim_feedforward': 269, 'batch_size': 73, 'pos_encoding': 'fixed', 'activation': 'relu', 'norm': 'LayerNorm', 'optimizer_name': 'AdamW', 'weight_decay': 0.1, 'top_n_features': 59}. Best is trial 246 with value: 0.16447311791139763.[0m
[FileBasedDataset] Initializing dataset...
	Examples: 8264
	Features: 49
	Max length: 315
Standard scalar turned ON, loading params from cache
[FileBasedDataset] Dataset initialization complete
  epoch    auprc    auroc    train_loss    valid_acc    valid_loss    cp      dur
-------  -------  -------  ------------  -----------  ------------  ----  -------
      1   [36m0.0656[0m   [32m0.4586[0m        [35m0.4483[0m       [31m0.9250[0m        [94m0.2849[0m     +  19.5790
      2   [36m0.2815[0m   [32m0.7182[0m        [35m0.2738[0m       0.9250        [94m0.2388[0m     +  20.0583
      3   [36m0.3076[0m   [32m0.7542[0m        [35m0.2553[0m       [31m0.9262[0m        [94m0.2287[0m     +  20.0225
      4   [36m0.3110[0m   [32m0.7693[0m        [35m0.2523[0m       0.9141        0.2310        20.0947
      5   0.2899   0.7412        [35m0.2434[0m       0.9057        0.2708        20.2500
      6   0.2827   0.7280        [35m0.2410[0m       0.8948        0.2947        20.1492
      7   0.3045   0.7384        [35m0.2407[0m       0.9021        0.2989        19.9587
      8   0.2959   0.7435        [35m0.2381[0m       0.8996        0.2913        20.1475
      9   0.2936   0.7468        0.2385       0.8996        0.2985        20.0216
     10   0.2868   0.7509        [35m0.2360[0m       0.8984        0.2992        19.9898
     11   0.2790   0.7569        0.2365       0.9045        0.2866        20.0305
     12   0.2849   0.7541        [35m0.2345[0m       0.9081        0.2752        19.9944
Stopping since valid_loss has not improved in the last 10 epochs.
[32m[I 2023-05-05 01:02:22,804][0m Trial 519 finished with value: 0.22868363528614896 and parameters: {'lr': 0.0001402552812537478, 'dropout': 0.6827869734520424, 'd_model_multiplier': 4, 'num_layers': 4, 'n_heads': 32, 'dim_feedforward': 374, 'batch_size': 64, 'pos_encoding': 'fixed', 'activation': 'relu', 'norm': 'LayerNorm', 'optimizer_name': 'RAdam', 'weight_decay': 0.1, 'top_n_features': 49}. Best is trial 246 with value: 0.16447311791139763.[0m
[FileBasedDataset] Initializing dataset...
	Examples: 8264
	Features: 69
	Max length: 315
Standard scalar turned ON, loading params from cache
[FileBasedDataset] Dataset initialization complete
Warning, assumed runtime error: CUDA out of memory. Tried to allocate 1.01 GiB (GPU 0; 23.70 GiB total capacity; 21.31 GiB already allocated; 559.25 MiB free; 22.06 GiB reserved in total by PyTorch) If reserved memory is >> allocated memory try setting max_split_size_mb to avoid fragmentation.  See documentation for Memory Management and PYTORCH_CUDA_ALLOC_CONF
[32m[I 2023-05-05 01:02:26,403][0m Trial 520 finished with value: 100.0 and parameters: {'lr': 6.391738211071683e-06, 'dropout': 0.6334131773253149, 'd_model_multiplier': 1, 'num_layers': 11, 'n_heads': 32, 'dim_feedforward': 328, 'batch_size': 85, 'pos_encoding': 'fixed', 'activation': 'relu', 'norm': 'LayerNorm', 'optimizer_name': 'AdamW', 'weight_decay': 0.001, 'top_n_features': 69}. Best is trial 246 with value: 0.16447311791139763.[0m
[FileBasedDataset] Initializing dataset...
	Examples: 8264
	Features: 63
	Max length: 315
Standard scalar turned ON, loading params from cache
[FileBasedDataset] Dataset initialization complete
  epoch    auprc    auroc    train_loss    valid_acc    valid_loss    cp      dur
-------  -------  -------  ------------  -----------  ------------  ----  -------
      1   [36m0.1130[0m   [32m0.5325[0m        [35m0.6657[0m       [31m0.8972[0m        [94m0.6435[0m     +  10.6870
      2   0.0846   0.4471        [35m0.6437[0m       [31m0.9166[0m        [94m0.6130[0m     +  10.4623
      3   0.0683   0.3862        [35m0.6110[0m       [31m0.9190[0m        [94m0.5777[0m     +  10.7981
      4   0.0653   0.3582        [35m0.5769[0m       0.9190        [94m0.5411[0m     +  10.6932
      5   0.0649   0.3491        [35m0.5430[0m       0.9190        [94m0.5057[0m     +  10.7430
      6   0.0663   0.3461        [35m0.5059[0m       0.9190        [94m0.4717[0m     +  10.6967
      7   0.0662   0.3475        [35m0.4746[0m       0.9190        [94m0.4401[0m     +  10.7403
      8   0.0662   0.3523        [35m0.4471[0m       0.9190        [94m0.4123[0m     +  10.4899
      9   0.0667   0.3633        [35m0.4196[0m       0.9190        [94m0.3881[0m     +  10.8094
     10   0.0664   0.3756        [35m0.3983[0m       0.9190        [94m0.3681[0m     +  10.5851
     11   0.0671   0.3906        [35m0.3801[0m       0.9190        [94m0.3521[0m     +  10.8468
     12   0.0684   0.4079        [35m0.3660[0m       0.9190        [94m0.3390[0m     +  10.8470
     13   0.0702   0.4318        [35m0.3521[0m       0.9190        [94m0.3279[0m     +  10.8575
     14   0.0743   0.4569        [35m0.3395[0m       0.9190        [94m0.3181[0m     +  10.7851
     15   0.0787   0.4850        [35m0.3303[0m       0.9190        [94m0.3094[0m     +  10.9581
     16   0.0835   0.5134        [35m0.3215[0m       0.9190        [94m0.3019[0m     +  11.2566
     17   0.0911   [32m0.5420[0m        [35m0.3129[0m       0.9190        [94m0.2952[0m     +  10.8855
     18   0.1007   [32m0.5670[0m        [35m0.3047[0m       0.9190        [94m0.2896[0m     +  10.9858
     19   [36m0.1293[0m   [32m0.5907[0m        [35m0.2994[0m       0.9190        [94m0.2846[0m     +  11.0990
     20   [36m0.1662[0m   [32m0.6074[0m        [35m0.2943[0m       0.9190        [94m0.2804[0m     +  11.1774
     21   [36m0.1852[0m   [32m0.6203[0m        [35m0.2895[0m       0.9190        [94m0.2768[0m     +  11.0701
     22   [36m0.2009[0m   [32m0.6335[0m        [35m0.2867[0m       0.9190        [94m0.2736[0m     +  10.8960
     23   [36m0.2127[0m   [32m0.6449[0m        [35m0.2808[0m       0.9190        [94m0.2709[0m     +  11.2113
     24   [36m0.2204[0m   [32m0.6540[0m        [35m0.2785[0m       0.9190        [94m0.2685[0m     +  10.8277
     25   [36m0.2325[0m   [32m0.6651[0m        [35m0.2763[0m       0.9190        [94m0.2662[0m     +  11.1802
     26   [36m0.2389[0m   [32m0.6713[0m        [35m0.2732[0m       0.9190        [94m0.2644[0m     +  10.8757
     27   [36m0.2430[0m   [32m0.6784[0m        [35m0.2701[0m       0.9190        [94m0.2626[0m     +  10.9253
     28   [36m0.2451[0m   [32m0.6845[0m        [35m0.2682[0m       0.9190        [94m0.2609[0m     +  10.8521
     29   [36m0.2534[0m   [32m0.6925[0m        [35m0.2660[0m       0.9190        [94m0.2592[0m     +  10.6386
     30   [36m0.2545[0m   [32m0.6990[0m        0.2665       0.9190        [94m0.2577[0m     +  10.7445
     31   [36m0.2591[0m   [32m0.7034[0m        [35m0.2631[0m       0.9190        [94m0.2564[0m     +  10.8686
     32   [36m0.2644[0m   [32m0.7085[0m        [35m0.2618[0m       0.9190        [94m0.2552[0m     +  10.9415
     33   [36m0.2670[0m   [32m0.7132[0m        0.2618       0.9190        [94m0.2538[0m     +  10.6941
     34   [36m0.2692[0m   [32m0.7178[0m        [35m0.2585[0m       0.9190        [94m0.2527[0m     +  10.7120
     35   [36m0.2725[0m   [32m0.7226[0m        [35m0.2582[0m       0.9190        [94m0.2513[0m     +  10.6869
     36   [36m0.2792[0m   [32m0.7299[0m        [35m0.2569[0m       0.9190        [94m0.2499[0m     +  10.6687
     37   [36m0.2825[0m   [32m0.7343[0m        [35m0.2563[0m       0.9190        [94m0.2486[0m     +  10.6187
     38   [36m0.2916[0m   [32m0.7395[0m        [35m0.2538[0m       0.9190        [94m0.2472[0m     +  10.7777
     39   [36m0.3024[0m   [32m0.7448[0m        0.2542       0.9190        [94m0.2457[0m     +  10.5254
     40   [36m0.3030[0m   [32m0.7484[0m        [35m0.2511[0m       0.9190        [94m0.2445[0m     +  10.7893
     41   [36m0.3129[0m   [32m0.7543[0m        [35m0.2502[0m       0.9178        [94m0.2432[0m     +  11.0409
     42   [36m0.3174[0m   [32m0.7577[0m        [35m0.2487[0m       0.9178        [94m0.2421[0m     +  10.6818
     43   [36m0.3177[0m   [32m0.7602[0m        [35m0.2481[0m       0.9178        [94m0.2413[0m     +  10.6760
     44   [36m0.3216[0m   [32m0.7628[0m        [35m0.2481[0m       0.9178        [94m0.2402[0m     +  10.7151
     45   [36m0.3274[0m   [32m0.7644[0m        0.2483       0.9178        [94m0.2395[0m     +  10.7720
     46   [36m0.3287[0m   [32m0.7662[0m        [35m0.2470[0m       0.9178        [94m0.2387[0m     +  10.6140
     47   [36m0.3297[0m   [32m0.7678[0m        [35m0.2467[0m       0.9178        [94m0.2384[0m     +  10.7234
     48   [36m0.3318[0m   [32m0.7702[0m        [35m0.2448[0m       0.9190        [94m0.2376[0m     +  10.8890
     49   0.3317   [32m0.7719[0m        0.2458       0.9190        [94m0.2370[0m     +  11.0403
     50   [36m0.3351[0m   [32m0.7742[0m        [35m0.2428[0m       0.9190        [94m0.2365[0m     +  10.7972
