[32m[I 2023-05-02 07:56:54,305][0m Trial 70 finished with value: 0.25867271085045646 and parameters: {'lr': 0.0009348282911888275, 'dropout': 0.6186693177422892, 'd_model_multiplier': 1, 'num_layers': 2, 'n_heads': 8, 'dim_feedforward': 421, 'batch_size': 16, 'pos_encoding': 'fixed', 'activation': 'relu', 'norm': 'LayerNorm', 'optimizer_name': 'AdamW', 'weight_decay': 0.1, 'top_n_features': 214}. Best is trial 12 with value: 0.20472501771481755.[0m
[FileBasedDataset] Initializing dataset...
	Examples: 8264
	Features: 208
	Max length: 315
Standard scalar turned ON, loading params from cache
[FileBasedDataset] Dataset initialization complete
  epoch    auprc    auroc    train_loss    valid_acc    valid_loss    cp     dur
-------  -------  -------  ------------  -----------  ------------  ----  ------
      1   [36m0.1841[0m   [32m0.6016[0m        [35m0.3910[0m       [31m0.9117[0m        [94m0.4241[0m     +  9.5345
      2   [36m0.2113[0m   [32m0.6787[0m        [35m0.2790[0m       0.9117        [94m0.3544[0m     +  9.8398
      3   [36m0.2513[0m   [32m0.7209[0m        [35m0.2690[0m       0.9117        [94m0.3395[0m     +  10.3259
      4   [36m0.2669[0m   0.7087        [35m0.2618[0m       0.9117        [94m0.3371[0m     +  9.9878
      5   0.2557   0.7006        [35m0.2604[0m       0.9117        [94m0.3098[0m     +  9.7494
      6   0.2633   0.7133        [35m0.2572[0m       0.9105        [94m0.2830[0m     +  10.1710
      7   0.2577   0.7163        [35m0.2546[0m       0.9117        [94m0.2802[0m     +  10.0387
      8   0.2653   0.7157        0.2557       0.9105        [94m0.2677[0m     +  9.6628
      9   [36m0.3030[0m   0.7119        0.2569       0.9117        [94m0.2671[0m     +  9.5579
     10   0.2518   0.7171        0.2547       0.9105        0.2681        9.8002
     11   0.2439   0.7159        0.2556       0.9081        0.2850        9.8662
     12   0.2866   0.7169        [35m0.2538[0m       0.9105        0.2787        9.7180
     13   0.2710   0.7172        [35m0.2532[0m       0.9117        0.2922        9.5702
     14   0.2738   0.7150        0.2543       0.9117        0.3355        9.8113
     15   0.2717   0.7017        [35m0.2515[0m       [31m0.9141[0m        0.2973        10.2265
     16   0.2796   0.7131        0.2532       0.9117        0.3228        10.1573
     17   0.2816   0.7170        0.2517       0.9117        0.3339        10.1301
     18   0.2751   [32m0.7220[0m        0.2516       0.9117        0.3424        9.8426
Stopping since valid_loss has not improved in the last 10 epochs.
[32m[I 2023-05-02 08:00:03,110][0m Trial 71 finished with value: 0.267074747270079 and parameters: {'lr': 0.002382209901729479, 'dropout': 0.5601367629823852, 'd_model_multiplier': 8, 'num_layers': 1, 'n_heads': 32, 'dim_feedforward': 308, 'batch_size': 31, 'pos_encoding': 'learnable', 'activation': 'relu', 'norm': 'LayerNorm', 'optimizer_name': 'AdamW', 'weight_decay': 0.01, 'top_n_features': 208}. Best is trial 12 with value: 0.20472501771481755.[0m
[FileBasedDataset] Initializing dataset...
	Examples: 8264
	Features: 221
	Max length: 315
Standard scalar turned ON, loading params from cache
[FileBasedDataset] Dataset initialization complete
  epoch    auprc    auroc    train_loss    valid_acc    valid_loss    cp     dur
-------  -------  -------  ------------  -----------  ------------  ----  ------
      1   [36m0.2272[0m   [32m0.6984[0m        [35m0.2930[0m       [31m0.9226[0m        [94m0.2671[0m     +  8.5293
      2   0.2086   0.6973        [35m0.2637[0m       0.9226        0.2847        8.9988
      3   0.2126   [32m0.7014[0m        0.2654       0.9226        0.2720        8.7333
      4   0.1977   0.6989        [35m0.2595[0m       0.9226        0.2790        9.2987
      5   0.1909   0.6943        0.2602       0.9226        0.2801        9.0714
      6   0.1906   [32m0.7031[0m        [35m0.2576[0m       0.9214        0.2762        9.1379
      7   0.1912   0.6941        [35m0.2568[0m       0.9226        0.2965        9.2158
      8   0.1823   0.6899        0.2584       0.9226        0.2926        9.1871
      9   0.1834   0.6954        0.2572       0.9226        0.2908        9.1146
     10   0.1917   0.6993        0.2588       0.9226        0.2885        9.3322
Stopping since valid_loss has not improved in the last 10 epochs.
[32m[I 2023-05-02 08:01:43,218][0m Trial 72 finished with value: 0.26705948067006924 and parameters: {'lr': 0.00342106468710189, 'dropout': 0.547482156342165, 'd_model_multiplier': 8, 'num_layers': 1, 'n_heads': 4, 'dim_feedforward': 460, 'batch_size': 45, 'pos_encoding': 'learnable', 'activation': 'relu', 'norm': 'LayerNorm', 'optimizer_name': 'PlainRAdam', 'weight_decay': 0, 'top_n_features': 221}. Best is trial 12 with value: 0.20472501771481755.[0m
[FileBasedDataset] Initializing dataset...
	Examples: 8264
	Features: 182
	Max length: 315
Standard scalar turned ON, loading params from cache
[FileBasedDataset] Dataset initialization complete
  epoch    auprc    auroc    train_loss    valid_acc    valid_loss    cp      dur
-------  -------  -------  ------------  -----------  ------------  ----  -------
      1   [36m0.2341[0m   [32m0.7888[0m        [35m0.2884[0m       [31m0.9274[0m        [94m0.2228[0m     +  12.4841
      2   [36m0.2437[0m   0.7871        [35m0.2712[0m       0.8912        0.2437        12.7471
      3   0.2435   [32m0.7897[0m        [35m0.2648[0m       0.8851        0.2421        12.7642
      4   [36m0.2553[0m   [32m0.7951[0m        [35m0.2585[0m       0.8755        0.2815        12.6860
      5   [36m0.2810[0m   [32m0.8106[0m        [35m0.2571[0m       0.9045        0.2399        13.6762
      6   [36m0.2899[0m   [32m0.8121[0m        [35m0.2531[0m       0.9081        0.2377        12.6839
      7   0.2816   0.8082        [35m0.2469[0m       0.8863        0.2818        12.9133
      8   0.2844   0.7936        [35m0.2461[0m       0.9057        0.2348        12.5017
      9   0.2879   0.8027        [35m0.2439[0m       0.8827        0.2911        14.0914
     10   [36m0.3113[0m   0.8080        [35m0.2411[0m       0.9093        0.2350        12.8831
Stopping since valid_loss has not improved in the last 10 epochs.
[32m[I 2023-05-02 08:04:05,680][0m Trial 73 finished with value: 0.22284145740636746 and parameters: {'lr': 0.0005929258380783476, 'dropout': 0.5828601107843165, 'd_model_multiplier': 2, 'num_layers': 2, 'n_heads': 16, 'dim_feedforward': 322, 'batch_size': 8, 'pos_encoding': 'fixed', 'activation': 'relu', 'norm': 'LayerNorm', 'optimizer_name': 'AdamW', 'weight_decay': 0.1, 'top_n_features': 182}. Best is trial 12 with value: 0.20472501771481755.[0m
[FileBasedDataset] Initializing dataset...
	Examples: 8264
	Features: 171
	Max length: 315
Standard scalar turned ON, loading params from cache
[FileBasedDataset] Dataset initialization complete
  epoch    auprc    auroc    train_loss    valid_acc    valid_loss    cp      dur
-------  -------  -------  ------------  -----------  ------------  ----  -------
      1   [36m0.2410[0m   [32m0.7020[0m        [35m0.3307[0m       [31m0.9057[0m        [94m0.3080[0m     +  16.8260
      2   [36m0.3036[0m   [32m0.7119[0m        [35m0.2554[0m       [31m0.9081[0m        0.3222        18.0535
      3   [36m0.3104[0m   [32m0.7330[0m        [35m0.2490[0m       [31m0.9105[0m        [94m0.2861[0m     +  17.2570
      4   [36m0.3185[0m   [32m0.7642[0m        0.2517       0.8924        0.3094        17.5021
      5   0.2647   0.6825        [35m0.2475[0m       0.8755        0.3409        17.3876
      6   0.2472   0.6726        0.2873       0.9093        0.3205        17.8058
      7   0.2386   0.6193        0.2944       0.9093        0.3889        17.6898
      8   [36m0.3292[0m   [32m0.7748[0m        0.2855       0.8960        0.2984        17.8149
      9   0.0674   0.3556        0.3252       0.9081        0.5439        17.7060
     10   0.2718   0.6825        0.2874       0.9069        0.3345        17.5786
     11   [36m0.3295[0m   0.7635        0.2716       0.9069        [94m0.2815[0m     +  18.1535
     12   [36m0.3423[0m   [32m0.7842[0m        0.2664       0.9105        [94m0.2655[0m     +  17.7282
     13   0.0677   0.3541        0.2865       0.9081        0.6235        17.6252
     14   0.3107   0.7641        0.2561       0.9081        0.2871        17.7931
     15   0.3339   0.7644        0.2720       0.9081        0.3080        17.0639
     16   0.3170   0.7597        [35m0.2444[0m       0.9081        0.3060        17.8699
     17   [36m0.3538[0m   [32m0.7955[0m        0.2483       [31m0.9117[0m        [94m0.2578[0m     +  17.7328
     18   0.3513   0.7925        0.2537       0.9105        0.3054        17.7707
     19   [36m0.3561[0m   0.7952        [35m0.2372[0m       0.9069        0.2633        17.8634
     20   0.2212   0.6413        0.2822       0.9081        0.4113        18.2872
     21   0.3130   0.7607        0.2500       0.9105        0.3146        17.9856
     22   0.3511   0.7826        [35m0.2369[0m       0.9093        0.2972        17.5994
     23   0.3016   0.7403        0.2400       [31m0.9129[0m        0.3172        18.3466
     24   [36m0.3790[0m   [32m0.8052[0m        0.2393       0.9117        0.2738        17.6588
     25   [36m0.3820[0m   0.7989        0.2420       0.9081        0.2892        17.7712
     26   0.3478   0.7920        [35m0.2353[0m       [31m0.9141[0m        0.2910        18.0446
Stopping since valid_loss has not improved in the last 10 epochs.
[32m[I 2023-05-02 08:12:05,410][0m Trial 74 finished with value: 0.25783540672445815 and parameters: {'lr': 0.001292817439769928, 'dropout': 0.5446785766769426, 'd_model_multiplier': 64, 'num_layers': 1, 'n_heads': 16, 'dim_feedforward': 499, 'batch_size': 245, 'pos_encoding': 'learnable', 'activation': 'relu', 'norm': 'LayerNorm', 'optimizer_name': 'PlainRAdam', 'weight_decay': 0.01, 'top_n_features': 171}. Best is trial 12 with value: 0.20472501771481755.[0m
[FileBasedDataset] Initializing dataset...
	Examples: 8264
	Features: 192
	Max length: 315
Standard scalar turned ON, loading params from cache
[FileBasedDataset] Dataset initialization complete
Warning, assumed runtime error: CUDA out of memory. Tried to allocate 5.42 GiB (GPU 0; 23.70 GiB total capacity; 19.90 GiB already allocated; 575.25 MiB free; 22.04 GiB reserved in total by PyTorch) If reserved memory is >> allocated memory try setting max_split_size_mb to avoid fragmentation.  See documentation for Memory Management and PYTORCH_CUDA_ALLOC_CONF
[32m[I 2023-05-02 08:12:12,939][0m Trial 75 finished with value: 100.0 and parameters: {'lr': 0.0002371647997190961, 'dropout': 0.5642163960127589, 'd_model_multiplier': 8, 'num_layers': 2, 'n_heads': 64, 'dim_feedforward': 208, 'batch_size': 229, 'pos_encoding': 'fixed', 'activation': 'gelu', 'norm': 'BatchNorm', 'optimizer_name': 'RAdam', 'weight_decay': 0.001, 'top_n_features': 192}. Best is trial 12 with value: 0.20472501771481755.[0m
[FileBasedDataset] Initializing dataset...
	Examples: 8264
	Features: 146
	Max length: 315
Standard scalar turned ON, loading params from cache
[FileBasedDataset] Dataset initialization complete
  epoch    auprc    auroc    train_loss    valid_acc    valid_loss    cp     dur
-------  -------  -------  ------------  -----------  ------------  ----  ------
      1   [36m0.2222[0m   [32m0.7255[0m        [35m0.3034[0m       [31m0.9238[0m        [94m0.3276[0m     +  9.1134
      2   [36m0.2914[0m   0.7042        [35m0.2692[0m       [31m0.9250[0m        [94m0.2466[0m     +  9.0195
      3   [36m0.3332[0m   [32m0.7545[0m        [35m0.2605[0m       [31m0.9274[0m        [94m0.2369[0m     +  9.1143
      4   0.3217   [32m0.7640[0m        [35m0.2509[0m       0.9262        [94m0.2291[0m     +  9.0312
      5   0.3172   0.7584        [35m0.2452[0m       0.9262        0.2322        9.3954
      6   [36m0.3368[0m   [32m0.7747[0m        [35m0.2417[0m       [31m0.9287[0m        [94m0.2281[0m     +  8.9467
      7   0.3350   0.7671        [35m0.2375[0m       [31m0.9311[0m        [94m0.2270[0m     +  9.3097
      8   0.3219   [32m0.7759[0m        [35m0.2332[0m       0.9287        0.2315        9.1582
      9   [36m0.3596[0m   [32m0.7857[0m        0.2342       0.9299        [94m0.2206[0m     +  9.2838
     10   0.3350   0.7843        0.2338       0.9299        0.2246        9.5016
     11   0.3290   0.7700        0.2365       0.9299        0.2261        9.4969
     12   0.3248   0.7689        0.2346       0.9008        0.2886        9.3375
     13   0.3500   0.7794        0.2341       0.9287        0.2229        9.1007
     14   0.3316   0.7777        [35m0.2283[0m       0.9238        0.2283        9.0182
     15   0.3362   0.7844        [35m0.2275[0m       0.9287        0.2211        9.0824
     16   0.3476   [32m0.7954[0m        [35m0.2259[0m       0.9226        0.2237        9.4715
     17   0.3327   0.7846        [35m0.2259[0m       0.9250        0.2289        9.4880
     18   0.3206   0.7833        0.2294       0.9129        0.2398        9.1435
Stopping since valid_loss has not improved in the last 10 epochs.
[32m[I 2023-05-02 08:15:08,802][0m Trial 76 finished with value: 0.22059940673780268 and parameters: {'lr': 0.008886941823250097, 'dropout': 0.5182677363890442, 'd_model_multiplier': 2, 'num_layers': 3, 'n_heads': 4, 'dim_feedforward': 187, 'batch_size': 54, 'pos_encoding': 'learnable', 'activation': 'gelu', 'norm': 'BatchNorm', 'optimizer_name': 'PlainRAdam', 'weight_decay': 0.01, 'top_n_features': 146}. Best is trial 12 with value: 0.20472501771481755.[0m
[FileBasedDataset] Initializing dataset...
	Examples: 8264
	Features: 145
	Max length: 315
Standard scalar turned ON, loading params from cache
[FileBasedDataset] Dataset initialization complete
  epoch    auprc    auroc    train_loss    valid_acc    valid_loss    cp     dur
-------  -------  -------  ------------  -----------  ------------  ----  ------
      1   [36m0.2271[0m   [32m0.6790[0m        [35m0.3544[0m       [31m0.9226[0m        [94m0.2520[0m     +  9.1423
      2   0.1884   [32m0.7132[0m        [35m0.2656[0m       0.9226        [94m0.2422[0m     +  8.8488
      3   0.2085   [32m0.7494[0m        [35m0.2578[0m       0.9226        [94m0.2374[0m     +  9.2604
      4   [36m0.2716[0m   [32m0.7932[0m        [35m0.2527[0m       0.9202        [94m0.2301[0m     +  8.9042
      5   [36m0.2931[0m   [32m0.7977[0m        [35m0.2455[0m       0.9214        [94m0.2264[0m     +  9.3951
      6   [36m0.3139[0m   [32m0.8053[0m        [35m0.2375[0m       0.9226        [94m0.2237[0m     +  9.1263
      7   [36m0.3301[0m   [32m0.8126[0m        0.2392       0.9226        [94m0.2231[0m     +  9.1805
      8   [36m0.3338[0m   [32m0.8133[0m        [35m0.2357[0m       [31m0.9238[0m        [94m0.2223[0m     +  9.4093
      9   [36m0.3444[0m   0.8127        [35m0.2352[0m       [31m0.9250[0m        0.2264        9.4679
     10   [36m0.3572[0m   [32m0.8158[0m        [35m0.2331[0m       [31m0.9262[0m        0.2236        9.3070
     11   [36m0.3648[0m   0.8142        [35m0.2328[0m       0.9250        [94m0.2204[0m     +  9.2684
     12   [36m0.3653[0m   0.8118        [35m0.2315[0m       0.9250        0.2213        11.0325
     13   [36m0.3749[0m   [32m0.8165[0m        [35m0.2291[0m       0.9202        0.2248        10.4330
     14   0.3727   0.8157        [35m0.2271[0m       0.9214        0.2234        9.6385
     15   0.3726   0.8148        [35m0.2264[0m       0.9226        0.2247        9.4751
     16   0.3609   [32m0.8174[0m        [35m0.2249[0m       0.9250        0.2209        9.5581
     17   0.3691   0.8069        [35m0.2248[0m       0.9226        0.2300        9.4708
     18   0.3515   0.8131        [35m0.2220[0m       0.9238        0.2263        9.3831
     19   0.3512   0.8144        0.2241       0.9238        0.2292        9.6185
     20   0.3540   [32m0.8259[0m        0.2241       0.9250        0.2237        9.4211
Stopping since valid_loss has not improved in the last 10 epochs.
[32m[I 2023-05-02 08:18:28,022][0m Trial 77 finished with value: 0.2203884096467077 and parameters: {'lr': 0.0003637563724270303, 'dropout': 0.45624459652883975, 'd_model_multiplier': 2, 'num_layers': 3, 'n_heads': 4, 'dim_feedforward': 136, 'batch_size': 55, 'pos_encoding': 'fixed', 'activation': 'relu', 'norm': 'LayerNorm', 'optimizer_name': 'AdamW', 'weight_decay': 0.01, 'top_n_features': 145}. Best is trial 12 with value: 0.20472501771481755.[0m
[FileBasedDataset] Initializing dataset...
	Examples: 8264
	Features: 141
	Max length: 315
Standard scalar turned ON, loading params from cache
[FileBasedDataset] Dataset initialization complete
  epoch    auprc    auroc    train_loss    valid_acc    valid_loss    cp     dur
-------  -------  -------  ------------  -----------  ------------  ----  ------
      1   [36m0.1948[0m   [32m0.6999[0m        [35m0.3906[0m       [31m0.9250[0m        [94m0.2771[0m     +  8.9218
      2   [36m0.2172[0m   [32m0.7397[0m        [35m0.2715[0m       0.9250        [94m0.2499[0m     +  9.7074
      3   [36m0.2279[0m   [32m0.7517[0m        [35m0.2590[0m       0.9250        [94m0.2459[0m     +  9.5870
      4   0.2255   [32m0.7564[0m        [35m0.2585[0m       0.9250        0.2478        9.4957
      5   [36m0.2373[0m   0.7542        [35m0.2537[0m       0.9250        0.2468        9.2861
      6   [36m0.2656[0m   [32m0.7593[0m        [35m0.2515[0m       0.9250        [94m0.2360[0m     +  9.6652
      7   [36m0.2671[0m   [32m0.7635[0m        [35m0.2506[0m       0.9250        [94m0.2358[0m     +  9.6678
      8   0.2540   0.7620        [35m0.2453[0m       0.9250        [94m0.2335[0m     +  9.7446
      9   0.2470   [32m0.7684[0m        [35m0.2437[0m       0.9250        [94m0.2332[0m     +  9.5655
     10   0.2627   [32m0.7713[0m        [35m0.2374[0m       0.9202        [94m0.2307[0m     +  9.9051
     11   0.2602   [32m0.7738[0m        [35m0.2369[0m       0.9250        0.2307        9.7229
     12   0.2645   [32m0.7794[0m        0.2380       0.9226        0.2327        9.7977
     13   0.2619   [32m0.7841[0m        [35m0.2361[0m       0.9250        0.2315        9.7526
     14   [36m0.2754[0m   0.7803        [35m0.2336[0m       0.9238        [94m0.2299[0m     +  9.9291
     15   [36m0.2933[0m   [32m0.7908[0m        [35m0.2306[0m       0.9238        [94m0.2256[0m     +  9.9735
     16   0.2889   [32m0.7920[0m        [35m0.2290[0m       0.9226        0.2351        9.9571
     17   [36m0.3008[0m   0.7890        [35m0.2279[0m       [31m0.9262[0m        0.2282        9.9547
     18   [36m0.3137[0m   [32m0.7974[0m        0.2285       0.9238        [94m0.2237[0m     +  9.8002
     19   [36m0.3154[0m   0.7945        0.2280       0.9250        0.2242        9.7537
     20   [36m0.3251[0m   [32m0.8016[0m        [35m0.2274[0m       0.9117        0.2506        9.4969
     21   [36m0.3264[0m   0.7938        [35m0.2231[0m       0.9178        0.2337        9.7622
     22   0.3247   0.7962        0.2262       0.9226        0.2280        9.6688
     23   0.3164   0.7977        0.2236       0.9154        0.2372        9.8480
     24   [36m0.3311[0m   0.7871        0.2251       [31m0.9299[0m        [94m0.2214[0m     +  10.0160
     25   0.3280   0.7847        [35m0.2219[0m       0.9262        0.2242        9.8750
     26   [36m0.3371[0m   0.7967        [35m0.2217[0m       [31m0.9311[0m        0.2275        10.0128
     27   0.3347   0.7923        0.2218       0.9274        0.2224        10.1117
     28   0.3316   0.7940        [35m0.2200[0m       0.9274        0.2248        10.0753
     29   0.3094   0.7861        [35m0.2192[0m       0.9202        0.2309        10.0800
     30   0.3179   0.7864        [35m0.2174[0m       0.9250        0.2310        9.5320
     31   [36m0.3371[0m   0.7992        0.2193       0.9287        0.2224        9.9003
     32   [36m0.3404[0m   0.7930        [35m0.2169[0m       0.9274        0.2260        9.8712
     33   0.3259   0.7902        0.2176       0.9274        0.2228        9.8137
Stopping since valid_loss has not improved in the last 10 epochs.
