[32m[I 2023-05-03 11:15:50,894][0m Trial 339 finished with value: 0.23005077977098318 and parameters: {'lr': 5.2634919330828e-05, 'dropout': 0.44519995857509087, 'd_model_multiplier': 4, 'num_layers': 5, 'n_heads': 32, 'dim_feedforward': 354, 'batch_size': 67, 'pos_encoding': 'fixed', 'activation': 'relu', 'norm': 'LayerNorm', 'optimizer_name': 'RAdam', 'weight_decay': 0.1, 'top_n_features': 61}. Best is trial 246 with value: 0.16447311791139763.[0m
[FileBasedDataset] Initializing dataset...
	Examples: 8264
	Features: 57
	Max length: 315
Standard scalar turned ON, loading params from cache
[FileBasedDataset] Dataset initialization complete
  epoch    auprc    auroc    train_loss    valid_acc    valid_loss    cp      dur
-------  -------  -------  ------------  -----------  ------------  ----  -------
      1   [36m0.0633[0m   [32m0.3409[0m        [35m0.6149[0m       [31m0.9250[0m        [94m0.4911[0m     +  19.6694
      2   0.0588   [32m0.3571[0m        [35m0.4402[0m       0.9250        [94m0.3452[0m     +  19.7898
      3   [36m0.0746[0m   [32m0.5032[0m        [35m0.3404[0m       0.9250        [94m0.2845[0m     +  19.9239
      4   [36m0.1594[0m   [32m0.6219[0m        [35m0.2955[0m       0.9250        [94m0.2601[0m     +  20.0614
      5   [36m0.2072[0m   [32m0.6670[0m        [35m0.2736[0m       0.9250        [94m0.2498[0m     +  20.0096
      6   [36m0.2361[0m   [32m0.6920[0m        [35m0.2653[0m       0.9250        [94m0.2447[0m     +  20.6254
      7   [36m0.2543[0m   [32m0.7089[0m        [35m0.2586[0m       0.9250        [94m0.2422[0m     +  20.0675
      8   [36m0.2752[0m   [32m0.7269[0m        [35m0.2550[0m       0.9250        [94m0.2398[0m     +  20.0214
      9   [36m0.2879[0m   [32m0.7372[0m        [35m0.2523[0m       0.9250        [94m0.2388[0m     +  19.9870
     10   [36m0.2990[0m   [32m0.7503[0m        [35m0.2496[0m       0.9250        [94m0.2370[0m     +  20.0164
     11   [36m0.3002[0m   [32m0.7590[0m        [35m0.2476[0m       0.9250        [94m0.2350[0m     +  19.9094
     12   [36m0.3049[0m   [32m0.7673[0m        [35m0.2467[0m       0.9250        [94m0.2326[0m     +  19.9106
     13   [36m0.3157[0m   [32m0.7726[0m        [35m0.2457[0m       [31m0.9262[0m        [94m0.2303[0m     +  20.0052
     14   [36m0.3227[0m   [32m0.7790[0m        [35m0.2423[0m       0.9250        [94m0.2275[0m     +  20.1274
     15   [36m0.3238[0m   [32m0.7850[0m        0.2425       [31m0.9274[0m        [94m0.2250[0m     +  20.1812
     16   [36m0.3307[0m   [32m0.7904[0m        [35m0.2406[0m       0.9274        [94m0.2236[0m     +  20.1643
     17   [36m0.3346[0m   [32m0.7948[0m        [35m0.2384[0m       [31m0.9299[0m        [94m0.2226[0m     +  19.9873
     18   [36m0.3466[0m   [32m0.7964[0m        [35m0.2381[0m       [31m0.9311[0m        [94m0.2224[0m     +  20.1086
     19   [36m0.3514[0m   [32m0.7989[0m        [35m0.2370[0m       [31m0.9335[0m        [94m0.2221[0m     +  19.9475
     20   0.3503   [32m0.7999[0m        0.2374       0.9335        [94m0.2218[0m     +  19.9587
     21   0.3508   [32m0.8003[0m        [35m0.2356[0m       [31m0.9347[0m        [94m0.2217[0m     +  20.1680
     22   [36m0.3521[0m   [32m0.8013[0m        0.2360       0.9347        [94m0.2214[0m     +  20.1320
     23   [36m0.3567[0m   [32m0.8014[0m        0.2366       0.9347        [94m0.2211[0m     +  19.9260
     24   [36m0.3567[0m   [32m0.8021[0m        [35m0.2348[0m       0.9347        [94m0.2210[0m     +  19.9931
     25   [36m0.3602[0m   [32m0.8028[0m        0.2360       0.9347        [94m0.2207[0m     +  20.0081
     26   0.3588   [32m0.8031[0m        [35m0.2335[0m       0.9347        [94m0.2207[0m     +  20.0714
     27   [36m0.3615[0m   [32m0.8038[0m        0.2346       0.9347        [94m0.2203[0m     +  20.1267
     28   [36m0.3644[0m   [32m0.8047[0m        0.2339       0.9311        [94m0.2201[0m     +  19.9746
     29   [36m0.3663[0m   [32m0.8049[0m        0.2350       0.9311        [94m0.2200[0m     +  20.0524
     30   [36m0.3680[0m   [32m0.8055[0m        [35m0.2325[0m       0.9311        [94m0.2199[0m     +  19.9231
     31   [36m0.3690[0m   [32m0.8061[0m        0.2331       0.9311        [94m0.2197[0m     +  20.1050
     32   0.3677   [32m0.8067[0m        0.2332       0.9311        [94m0.2195[0m     +  20.1189
     33   0.3655   [32m0.8078[0m        0.2330       0.9299        [94m0.2194[0m     +  20.0073
     34   0.3653   [32m0.8086[0m        [35m0.2317[0m       0.9287        0.2196        20.1270
     35   [36m0.3700[0m   [32m0.8091[0m        0.2321       0.9299        [94m0.2191[0m     +  20.0376
     36   [36m0.3726[0m   [32m0.8095[0m        0.2323       0.9287        0.2194        20.0657
     37   [36m0.3743[0m   [32m0.8098[0m        0.2317       0.9287        0.2192        20.0321
     38   0.3724   [32m0.8103[0m        [35m0.2310[0m       0.9287        [94m0.2190[0m     +  19.9378
     39   [36m0.3752[0m   [32m0.8107[0m        0.2331       0.9287        [94m0.2184[0m     +  19.9558
     40   0.3748   [32m0.8109[0m        0.2331       0.9287        0.2185        20.0991
     41   [36m0.3763[0m   [32m0.8116[0m        [35m0.2310[0m       0.9274        0.2187        19.9488
     42   0.3725   [32m0.8122[0m        0.2318       0.9274        0.2187        20.1276
     43   0.3684   [32m0.8130[0m        0.2318       0.9262        0.2185        20.1785
     44   0.3698   [32m0.8135[0m        0.2312       0.9262        [94m0.2182[0m     +  20.1110
     45   0.3733   [32m0.8142[0m        [35m0.2302[0m       0.9262        0.2185        20.1176
     46   0.3732   [32m0.8147[0m        0.2322       0.9262        0.2184        20.1052
     47   0.3740   [32m0.8154[0m        0.2315       0.9262        [94m0.2181[0m     +  19.9804
     48   0.3730   [32m0.8157[0m        0.2304       0.9262        [94m0.2179[0m     +  19.9684
     49   0.3741   [32m0.8164[0m        0.2306       0.9262        [94m0.2177[0m     +  19.8903
     50   0.3752   [32m0.8168[0m        [35m0.2301[0m       0.9262        0.2182        20.0481
[32m[I 2023-05-03 11:32:37,377][0m Trial 340 finished with value: 0.21770191897143765 and parameters: {'lr': 5.383265826859601e-06, 'dropout': 0.48555593816820053, 'd_model_multiplier': 4, 'num_layers': 4, 'n_heads': 32, 'dim_feedforward': 376, 'batch_size': 30, 'pos_encoding': 'fixed', 'activation': 'relu', 'norm': 'LayerNorm', 'optimizer_name': 'RAdam', 'weight_decay': 0.1, 'top_n_features': 57}. Best is trial 246 with value: 0.16447311791139763.[0m
[FileBasedDataset] Initializing dataset...
	Examples: 8264
	Features: 121
	Max length: 315
Standard scalar turned ON, loading params from cache
[FileBasedDataset] Dataset initialization complete
  epoch    auprc    auroc    train_loss    valid_acc    valid_loss    cp      dur
-------  -------  -------  ------------  -----------  ------------  ----  -------
      1   [36m0.0509[0m   [32m0.3044[0m        [35m0.5684[0m       [31m0.9311[0m        [94m0.4742[0m     +  21.3056
      2   [36m0.0526[0m   [32m0.3158[0m        [35m0.4440[0m       0.9311        [94m0.3473[0m     +  21.1031
      3   [36m0.0724[0m   [32m0.4879[0m        [35m0.3465[0m       0.9311        [94m0.2779[0m     +  21.4982
      4   [36m0.1158[0m   [32m0.6306[0m        [35m0.2979[0m       0.9311        [94m0.2495[0m     +  21.5189
      5   [36m0.1748[0m   [32m0.6780[0m        [35m0.2753[0m       0.9311        [94m0.2367[0m     +  21.2960
      6   [36m0.1862[0m   [32m0.6876[0m        [35m0.2647[0m       0.9311        [94m0.2305[0m     +  21.5713
      7   [36m0.1904[0m   [32m0.6927[0m        [35m0.2581[0m       0.9311        [94m0.2275[0m     +  21.6577
      8   [36m0.2112[0m   [32m0.6995[0m        [35m0.2547[0m       0.9311        [94m0.2259[0m     +  21.4703
      9   [36m0.2283[0m   [32m0.7056[0m        [35m0.2530[0m       0.9311        [94m0.2249[0m     +  21.2940
     10   [36m0.2309[0m   [32m0.7135[0m        [35m0.2498[0m       0.9311        [94m0.2240[0m     +  21.0642
     11   [36m0.2418[0m   [32m0.7197[0m        [35m0.2493[0m       0.9311        [94m0.2230[0m     +  21.5078
     12   [36m0.2499[0m   [32m0.7237[0m        [35m0.2486[0m       0.9311        [94m0.2222[0m     +  21.6073
     13   [36m0.2555[0m   [32m0.7287[0m        [35m0.2462[0m       [31m0.9323[0m        [94m0.2215[0m     +  21.4987
     14   [36m0.2705[0m   [32m0.7340[0m        [35m0.2431[0m       [31m0.9335[0m        [94m0.2211[0m     +  21.5561
     15   [36m0.2705[0m   [32m0.7352[0m        [35m0.2414[0m       [31m0.9347[0m        0.2216        21.2313
     16   [36m0.2774[0m   [32m0.7384[0m        0.2414       0.9335        0.2225        21.4027
     17   [36m0.2784[0m   [32m0.7409[0m        [35m0.2399[0m       0.9323        0.2235        21.5989
     18   0.2773   [32m0.7437[0m        [35m0.2385[0m       0.9262        0.2245        21.3021
     19   0.2750   [32m0.7467[0m        0.2393       0.9238        0.2248        21.3536
     20   0.2775   [32m0.7490[0m        0.2388       0.9250        0.2264        21.1818
     21   0.2770   [32m0.7528[0m        [35m0.2363[0m       0.9250        0.2268        21.5108
     22   0.2777   [32m0.7548[0m        [35m0.2355[0m       0.9238        0.2276        21.7837
     23   [36m0.2793[0m   [32m0.7594[0m        0.2365       0.9226        0.2281        21.6158
Stopping since valid_loss has not improved in the last 10 epochs.
[32m[I 2023-05-03 11:41:13,103][0m Trial 341 finished with value: 0.22107779513030992 and parameters: {'lr': 2.8714617190710076e-05, 'dropout': 0.466467132049762, 'd_model_multiplier': 4, 'num_layers': 4, 'n_heads': 32, 'dim_feedforward': 366, 'batch_size': 117, 'pos_encoding': 'fixed', 'activation': 'relu', 'norm': 'LayerNorm', 'optimizer_name': 'RAdam', 'weight_decay': 0.1, 'top_n_features': 121}. Best is trial 246 with value: 0.16447311791139763.[0m
[FileBasedDataset] Initializing dataset...
	Examples: 8264
	Features: 66
	Max length: 315
Standard scalar turned ON, loading params from cache
[FileBasedDataset] Dataset initialization complete
  epoch    auprc    auroc    train_loss    valid_acc    valid_loss    cp      dur
-------  -------  -------  ------------  -----------  ------------  ----  -------
      1   [36m0.0562[0m   [32m0.4011[0m        [35m0.4934[0m       [31m0.9323[0m        [94m0.3257[0m     +  23.4291
      2   [36m0.2247[0m   [32m0.6301[0m        [35m0.3028[0m       0.9323        [94m0.2404[0m     +  23.5586
      3   [36m0.2403[0m   [32m0.7155[0m        [35m0.2586[0m       [31m0.9347[0m        [94m0.2260[0m     +  23.8158
      4   [36m0.2638[0m   [32m0.7486[0m        [35m0.2444[0m       0.9262        [94m0.2201[0m     +  24.1721
      5   [36m0.2737[0m   [32m0.7612[0m        [35m0.2385[0m       0.9262        [94m0.2173[0m     +  23.8907
      6   0.2732   [32m0.7669[0m        [35m0.2355[0m       0.9250        [94m0.2156[0m     +  23.6974
      7   0.2689   [32m0.7696[0m        [35m0.2339[0m       0.9238        [94m0.2149[0m     +  23.7371
      8   0.2720   [32m0.7714[0m        [35m0.2323[0m       0.9238        [94m0.2145[0m     +  23.8792
      9   0.2714   [32m0.7731[0m        [35m0.2300[0m       0.9262        0.2148        24.0090
     10   0.2710   [32m0.7775[0m        0.2304       0.9250        [94m0.2143[0m     +  23.9537
     11   0.2692   [32m0.7812[0m        [35m0.2281[0m       0.9250        [94m0.2139[0m     +  23.8102
     12   0.2716   [32m0.7842[0m        [35m0.2276[0m       0.9250        [94m0.2136[0m     +  23.8339
     13   0.2722   [32m0.7881[0m        [35m0.2261[0m       0.9274        [94m0.2116[0m     +  24.0711
     14   [36m0.2778[0m   [32m0.7956[0m        0.2262       0.9299        [94m0.2103[0m     +  24.0215
     15   0.2722   [32m0.7975[0m        [35m0.2249[0m       0.9311        [94m0.2100[0m     +  23.9930
     16   0.2735   [32m0.8038[0m        [35m0.2234[0m       0.9299        [94m0.2093[0m     +  24.0565
     17   [36m0.2791[0m   [32m0.8104[0m        [35m0.2222[0m       0.9299        [94m0.2080[0m     +  24.0167
     18   [36m0.2837[0m   [32m0.8121[0m        [35m0.2216[0m       0.9299        [94m0.2075[0m     +  24.0786
     19   [36m0.2909[0m   [32m0.8169[0m        [35m0.2200[0m       0.9299        [94m0.2059[0m     +  23.8981
     20   [36m0.2931[0m   [32m0.8231[0m        [35m0.2189[0m       0.9311        0.2062        23.6718
     21   [36m0.3016[0m   [32m0.8258[0m        [35m0.2174[0m       0.9299        [94m0.2043[0m     +  23.8519
     22   [36m0.3037[0m   0.8251        0.2176       0.9311        0.2056        23.8864
     23   [36m0.3092[0m   0.8246        [35m0.2148[0m       0.9299        0.2045        24.2160
     24   [36m0.3138[0m   [32m0.8258[0m        0.2159       0.9299        0.2043        23.9959
     25   [36m0.3189[0m   0.8238        [35m0.2139[0m       0.9311        [94m0.2029[0m     +  24.0511
     26   [36m0.3228[0m   [32m0.8289[0m        [35m0.2124[0m       0.9311        0.2051        23.8491
     27   0.3037   0.8184        [35m0.2108[0m       0.9311        0.2086        24.0381
     28   0.3092   0.8163        [35m0.2103[0m       0.9335        0.2052        24.0734
     29   [36m0.3255[0m   0.8215        [35m0.2095[0m       0.9335        0.2051        23.8648
     30   [36m0.3329[0m   0.8231        [35m0.2078[0m       0.9335        0.2033        23.9204
     31   0.3112   0.8220        [35m0.2062[0m       0.9323        0.2057        23.7112
     32   0.3037   0.8157        [35m0.2062[0m       0.9323        0.2073        23.7934
     33   0.3245   0.8144        [35m0.2047[0m       0.9335        0.2066        24.2132
     34   0.3178   0.8179        [35m0.2036[0m       0.9311        0.2064        24.0225
Stopping since valid_loss has not improved in the last 10 epochs.
[32m[I 2023-05-03 11:55:12,419][0m Trial 342 finished with value: 0.20293092021342488 and parameters: {'lr': 4.0993108452000126e-05, 'dropout': 0.28008113926190453, 'd_model_multiplier': 4, 'num_layers': 5, 'n_heads': 32, 'dim_feedforward': 328, 'batch_size': 70, 'pos_encoding': 'fixed', 'activation': 'relu', 'norm': 'LayerNorm', 'optimizer_name': 'RAdam', 'weight_decay': 0.1, 'top_n_features': 66}. Best is trial 246 with value: 0.16447311791139763.[0m
[FileBasedDataset] Initializing dataset...
	Examples: 8264
	Features: 94
	Max length: 315
Standard scalar turned ON, loading params from cache
[FileBasedDataset] Dataset initialization complete
  epoch    auprc    auroc    train_loss    valid_acc    valid_loss    cp      dur
-------  -------  -------  ------------  -----------  ------------  ----  -------
      1   [36m0.0386[0m   [32m0.2677[0m        [35m0.6189[0m       [31m0.9444[0m        [94m0.4550[0m     +  31.0011
      2   [36m0.0458[0m   [32m0.4157[0m        [35m0.3930[0m       0.9444        [94m0.2618[0m     +  30.8966
      3   [36m0.1602[0m   [32m0.6079[0m        [35m0.2965[0m       0.9444        [94m0.2161[0m     +  31.3675
      4   [36m0.2179[0m   [32m0.6665[0m        [35m0.2697[0m       0.9444        [94m0.2018[0m     +  31.2874
      5   [36m0.2453[0m   [32m0.7013[0m        [35m0.2575[0m       [31m0.9456[0m        [94m0.1930[0m     +  31.4673
      6   [36m0.2744[0m   [32m0.7245[0m        [35m0.2519[0m       0.9444        [94m0.1877[0m     +  31.3292
      7   [36m0.2835[0m   [32m0.7340[0m        [35m0.2464[0m       0.9444        [94m0.1855[0m     +  31.3468
      8   0.2810   [32m0.7358[0m        [35m0.2443[0m       0.9456        [94m0.1843[0m     +  31.5986
      9   0.2820   [32m0.7404[0m        [35m0.2410[0m       0.9456        [94m0.1835[0m     +  31.4497
     10   0.2778   [32m0.7422[0m        [35m0.2403[0m       0.9444        [94m0.1828[0m     +  31.5352
     11   [36m0.2842[0m   [32m0.7469[0m        [35m0.2374[0m       0.9456        [94m0.1820[0m     +  31.4900
     12   0.2820   [32m0.7474[0m        0.2384       0.9456        [94m0.1816[0m     +  31.5349
     13   [36m0.2913[0m   [32m0.7511[0m        [35m0.2355[0m       0.9456        [94m0.1813[0m     +  31.3365
     14   [36m0.2919[0m   [32m0.7525[0m        0.2365       0.9456        [94m0.1807[0m     +  31.3534
     15   [36m0.2937[0m   [32m0.7554[0m        [35m0.2328[0m       0.9456        0.1807        31.2617
     16   [36m0.3029[0m   [32m0.7593[0m        0.2338       0.9456        [94m0.1803[0m     +  31.5786
     17   0.2980   [32m0.7611[0m        0.2330       0.9456        [94m0.1800[0m     +  31.2288
     18   0.2983   [32m0.7630[0m        [35m0.2318[0m       [31m0.9468[0m        0.1803        31.3907
     19   0.3019   [32m0.7687[0m        [35m0.2295[0m       0.9444        [94m0.1799[0m     +  31.3962
     20   0.3009   [32m0.7717[0m        0.2297       0.9444        [94m0.1795[0m     +  31.4222
     21   0.3006   0.7694        [35m0.2288[0m       0.9456        0.1807        31.5257
     22   [36m0.3065[0m   0.7710        0.2294       0.9432        0.1795        31.5161
     23   [36m0.3109[0m   [32m0.7760[0m        [35m0.2266[0m       0.9456        0.1817        31.2834
     24   0.3079   0.7752        [35m0.2260[0m       0.9468        0.1816        31.4302
     25   0.3100   0.7728        [35m0.2260[0m       0.9456        0.1808        31.4838
     26   0.3051   0.7731        [35m0.2257[0m       0.9456        0.1806        31.5220
     27   [36m0.3239[0m   0.7691        [35m0.2247[0m       [31m0.9480[0m        0.1816        31.3753
     28   [36m0.3345[0m   [32m0.7792[0m        [35m0.2244[0m       0.9480        0.1797        31.4602
     29   0.3248   0.7720        0.2252       [31m0.9492[0m        0.1821        31.2330
Stopping since valid_loss has not improved in the last 10 epochs.
[32m[I 2023-05-03 12:10:56,035][0m Trial 343 finished with value: 0.1795279707268619 and parameters: {'lr': 2.2008095673154024e-05, 'dropout': 0.40960719043999105, 'd_model_multiplier': 4, 'num_layers': 7, 'n_heads': 32, 'dim_feedforward': 330, 'batch_size': 74, 'pos_encoding': 'fixed', 'activation': 'relu', 'norm': 'LayerNorm', 'optimizer_name': 'RAdam', 'weight_decay': 0.001, 'top_n_features': 94}. Best is trial 246 with value: 0.16447311791139763.[0m
[FileBasedDataset] Initializing dataset...
	Examples: 8264
	Features: 96
	Max length: 315
Standard scalar turned ON, loading params from cache
[FileBasedDataset] Dataset initialization complete
  epoch    auprc    auroc    train_loss    valid_acc    valid_loss    cp      dur
-------  -------  -------  ------------  -----------  ------------  ----  -------
      1   [36m0.0683[0m   [32m0.3081[0m        [35m0.5681[0m       [31m0.9033[0m        [94m0.4349[0m     +  27.1709
      2   [36m0.1467[0m   [32m0.5792[0m        [35m0.3305[0m       0.9033        [94m0.3167[0m     +  27.8308
      3   [36m0.2203[0m   [32m0.6706[0m        [35m0.2609[0m       0.9033        [94m0.2998[0m     +  27.2901
      4   [36m0.2421[0m   [32m0.7033[0m        [35m0.2464[0m       0.9033        [94m0.2930[0m     +  27.6375
      5   [36m0.2611[0m   [32m0.7336[0m        [35m0.2380[0m       0.8996        [94m0.2867[0m     +  27.4796
      6   [36m0.2784[0m   [32m0.7452[0m        [35m0.2322[0m       0.8936        [94m0.2846[0m     +  27.8171
      7   [36m0.2911[0m   [32m0.7494[0m        [35m0.2300[0m       0.8900        [94m0.2832[0m     +  27.7763
      8   [36m0.2945[0m   [32m0.7532[0m        [35m0.2275[0m       0.8912        0.2838        27.9034
      9   [36m0.3019[0m   [32m0.7569[0m        [35m0.2274[0m       0.8924        0.2836        27.7848
     10   [36m0.3054[0m   [32m0.7580[0m        [35m0.2253[0m       0.8875        [94m0.2830[0m     +  27.4809
     11   0.3040   [32m0.7601[0m        [35m0.2237[0m       0.8888        [94m0.2828[0m     +  28.0206
     12   0.3037   [32m0.7615[0m        [35m0.2223[0m       0.8936        [94m0.2826[0m     +  27.8782
     13   [36m0.3056[0m   [32m0.7638[0m        [35m0.2210[0m       0.8972        [94m0.2821[0m     +  27.6229
     14   0.3029   [32m0.7661[0m        [35m0.2191[0m       0.8924        0.2822        27.4761
     15   0.3053   [32m0.7683[0m        0.2193       0.8936        0.2835        27.6184
     16   [36m0.3071[0m   [32m0.7697[0m        [35m0.2191[0m       0.8984        [94m0.2821[0m     +  27.7037
     17   [36m0.3109[0m   0.7695        [35m0.2186[0m       0.8996        0.2846        27.7411
     18   0.3054   [32m0.7702[0m        [35m0.2159[0m       0.9008        0.2848        28.2663
     19   0.3029   0.7685        [35m0.2149[0m       0.9021        0.2849        27.9764
     20   0.2970   0.7672        [35m0.2132[0m       0.9033        0.2869        27.8146
     21   0.2917   0.7652        [35m0.2121[0m       0.8984        0.2876        28.0891
     22   0.2911   0.7662        [35m0.2120[0m       0.8996        0.2894        27.7799
     23   0.2872   0.7654        [35m0.2107[0m       0.8984        0.2932        27.3256
     24   0.2820   0.7598        0.2113       0.9008        0.2948        27.6925
     25   0.2825   0.7602        0.2119       0.8996        0.2937        27.7406
Stopping since valid_loss has not improved in the last 10 epochs.
