[32m[I 2023-05-05 07:09:19,864][0m Trial 565 finished with value: 100.0 and parameters: {'lr': 5.1140612156846543e-05, 'dropout': 0.5018573239393297, 'd_model_multiplier': 64, 'num_layers': 5, 'n_heads': 32, 'dim_feedforward': 331, 'batch_size': 166, 'pos_encoding': 'fixed', 'activation': 'relu', 'norm': 'LayerNorm', 'optimizer_name': 'AdamW', 'weight_decay': 0, 'top_n_features': 41}. Best is trial 246 with value: 0.16447311791139763.[0m
[FileBasedDataset] Initializing dataset...
	Examples: 8264
	Features: 69
	Max length: 315
Standard scalar turned ON, loading params from cache
[FileBasedDataset] Dataset initialization complete
  epoch    auprc    auroc    train_loss    valid_acc    valid_loss    cp      dur
-------  -------  -------  ------------  -----------  ------------  ----  -------
      1   [36m0.1908[0m   [32m0.7117[0m        [35m0.2708[0m       [31m0.8912[0m        [94m0.2768[0m     +  15.7648
      2   0.1843   [32m0.7189[0m        [35m0.2605[0m       [31m0.9117[0m        [94m0.2702[0m     +  16.1631
      3   0.1862   0.7060        0.2606       [31m0.9129[0m        0.2707        15.8588
      4   0.1845   0.7088        [35m0.2598[0m       [31m0.9166[0m        [94m0.2695[0m     +  16.1832
      5   0.1871   0.7054        [35m0.2575[0m       0.9166        [94m0.2679[0m     +  15.9437
      6   0.1862   0.7037        0.2576       0.9166        [94m0.2677[0m     +  16.2149
      7   0.1882   0.7000        [35m0.2574[0m       0.9166        0.2696        16.0844
      8   0.1830   0.7072        0.2592       0.9166        [94m0.2671[0m     +  16.0907
      9   [36m0.1945[0m   0.7100        [35m0.2573[0m       0.9166        [94m0.2666[0m     +  16.2657
     10   0.1922   0.7075        0.2591       0.9166        0.2684        16.2317
     11   0.1864   0.6994        0.2576       0.9166        0.2678        16.1525
     12   0.1921   0.7029        0.2579       0.9166        0.2692        16.5169
     13   0.1894   0.7073        0.2578       0.9166        0.2677        16.2426
     14   0.1792   0.7091        [35m0.2562[0m       0.9166        0.2681        16.1162
     15   0.1775   0.7068        0.2585       0.9166        0.2694        15.9361
     16   0.1784   0.7047        0.2574       0.9166        0.2681        16.0983
     17   0.1777   0.7052        0.2564       0.9166        0.2692        16.0587
     18   0.1843   0.7071        0.2589       0.9166        0.2677        16.3888
Stopping since valid_loss has not improved in the last 10 epochs.
[32m[I 2023-05-05 07:14:26,963][0m Trial 566 finished with value: 0.2666189911738128 and parameters: {'lr': 0.03259961583373089, 'dropout': 0.2652552889910674, 'd_model_multiplier': 1, 'num_layers': 4, 'n_heads': 32, 'dim_feedforward': 363, 'batch_size': 45, 'pos_encoding': 'fixed', 'activation': 'relu', 'norm': 'LayerNorm', 'optimizer_name': 'RAdam', 'weight_decay': 0.1, 'top_n_features': 69}. Best is trial 246 with value: 0.16447311791139763.[0m
[FileBasedDataset] Initializing dataset...
	Examples: 8264
	Features: 92
	Max length: 315
Standard scalar turned ON, loading params from cache
[FileBasedDataset] Dataset initialization complete
  epoch    auprc    auroc    train_loss    valid_acc    valid_loss    cp      dur
-------  -------  -------  ------------  -----------  ------------  ----  -------
      1   [36m0.2177[0m   [32m0.6974[0m        [35m0.2640[0m       [31m0.9226[0m        [94m0.2585[0m     +  17.8192
      2   0.2161   [32m0.7303[0m        [35m0.2515[0m       [31m0.9262[0m        0.2817        17.4113
      3   [36m0.2275[0m   0.7299        [35m0.2508[0m       [31m0.9274[0m        0.2639        17.9922
      4   0.2214   [32m0.7365[0m        [35m0.2474[0m       0.9226        0.2847        18.0478
      5   0.2128   0.7263        [35m0.2458[0m       0.9250        0.2783        18.1451
      6   0.1811   [32m0.7384[0m        0.2504       0.9250        0.2968        17.7724
      7   0.1693   0.6899        0.2518       0.9238        0.2743        18.1321
      8   0.1689   0.6942        0.2578       0.9178        0.2896        17.7012
      9   0.1553   0.6881        0.2545       0.9262        [94m0.2567[0m     +  17.9793
     10   0.1556   0.6875        0.2564       0.9262        [94m0.2492[0m     +  18.0152
     11   0.1645   0.6882        0.2542       0.9262        [94m0.2477[0m     +  17.8711
     12   0.1603   0.6942        0.2535       0.9262        [94m0.2469[0m     +  18.1789
     13   0.1618   0.6874        0.2551       0.9214        0.2496        17.9652
     14   0.1665   0.6934        0.2549       0.9141        0.2611        17.7487
     15   0.1603   0.6905        0.2535       0.9190        0.2628        18.0850
     16   0.1695   0.6814        0.2562       0.9190        0.2554        18.1322
     17   0.1654   0.6916        0.2509       0.9178        0.2689        17.9087
     18   0.1669   0.6923        0.2524       0.9202        0.2774        18.0739
     19   0.1558   0.6904        0.2542       0.9166        0.2778        17.5961
     20   0.1559   0.6960        0.2540       0.9262        0.2930        17.7090
     21   0.1625   0.6953        0.2544       0.9202        0.3199        17.9848
Stopping since valid_loss has not improved in the last 10 epochs.
[32m[I 2023-05-05 07:21:01,419][0m Trial 567 finished with value: 0.2468721246236469 and parameters: {'lr': 0.013124108886476953, 'dropout': 0.458832898808635, 'd_model_multiplier': 2, 'num_layers': 3, 'n_heads': 32, 'dim_feedforward': 408, 'batch_size': 125, 'pos_encoding': 'fixed', 'activation': 'relu', 'norm': 'LayerNorm', 'optimizer_name': 'RAdam', 'weight_decay': 0.001, 'top_n_features': 92}. Best is trial 246 with value: 0.16447311791139763.[0m
[FileBasedDataset] Initializing dataset...
	Examples: 8264
	Features: 56
	Max length: 315
Standard scalar turned ON, loading params from cache
[FileBasedDataset] Dataset initialization complete
  epoch    auprc    auroc    train_loss    valid_acc    valid_loss    cp      dur
-------  -------  -------  ------------  -----------  ------------  ----  -------
      1   [36m0.1831[0m   [32m0.6889[0m        [35m0.5121[0m       [31m0.8863[0m        [94m0.4646[0m     +  34.0622
      2   [36m0.2057[0m   [32m0.6974[0m        [35m0.2866[0m       [31m0.9141[0m        [94m0.2405[0m     +  34.2642
      3   0.1936   0.6924        [35m0.2734[0m       [31m0.9323[0m        [94m0.2313[0m     +  34.3329
      4   0.1936   0.6843        [35m0.2651[0m       0.9323        0.2634        34.5541
      5   [36m0.2107[0m   [32m0.7017[0m        [35m0.2633[0m       0.9323        0.2943        34.4489
      6   0.1838   0.6948        [35m0.2620[0m       0.9323        0.3101        34.6681
      7   0.1731   0.6933        [35m0.2582[0m       0.9323        0.3654        34.5331
      8   0.1647   0.6949        0.2610       0.9323        0.2782        34.4771
      9   0.2082   0.7000        0.2588       0.9323        0.3239        34.6325
     10   0.1707   0.6919        [35m0.2572[0m       0.9323        0.3104        34.6087
     11   0.2053   0.6949        0.2576       0.9323        0.3057        34.4746
     12   [36m0.2167[0m   0.6937        0.2687       0.9323        0.3129        34.3392
Stopping since valid_loss has not improved in the last 10 epochs.
[32m[I 2023-05-05 07:28:29,989][0m Trial 568 finished with value: 0.2312627976541796 and parameters: {'lr': 0.0051884250201862945, 'dropout': 0.4831323383986042, 'd_model_multiplier': 4, 'num_layers': 4, 'n_heads': 64, 'dim_feedforward': 395, 'batch_size': 34, 'pos_encoding': 'fixed', 'activation': 'relu', 'norm': 'LayerNorm', 'optimizer_name': 'AdamW', 'weight_decay': 0.01, 'top_n_features': 56}. Best is trial 246 with value: 0.16447311791139763.[0m
[FileBasedDataset] Initializing dataset...
	Examples: 8264
	Features: 156
	Max length: 315
Standard scalar turned ON, loading params from cache
[FileBasedDataset] Dataset initialization complete
  epoch    auprc    auroc    train_loss    valid_acc    valid_loss    cp      dur
-------  -------  -------  ------------  -----------  ------------  ----  -------
      1   [36m0.2416[0m   [32m0.7918[0m        [35m0.2771[0m       [31m0.9021[0m        [94m0.2547[0m     +  16.9878
      2   0.2409   0.7765        [35m0.2460[0m       [31m0.9178[0m        0.2621        17.1926
      3   0.2348   0.7714        [35m0.2459[0m       0.9117        0.2580        17.1507
      4   0.2321   0.7697        [35m0.2429[0m       0.9105        0.2666        17.3416
      5   0.2015   0.7220        [35m0.2400[0m       0.9129        0.2808        17.3376
      6   0.2043   0.7284        0.2537       0.9141        0.2782        17.3616
      7   0.2023   0.7297        0.2497       0.9117        0.2771        17.2766
      8   0.2067   0.7260        0.2510       0.9129        0.2754        16.8898
      9   0.2051   0.7287        0.2505       0.9141        0.2746        17.1094
     10   0.2089   0.7306        0.2502       0.9141        0.2714        17.3817
Stopping since valid_loss has not improved in the last 10 epochs.
[32m[I 2023-05-05 07:31:39,649][0m Trial 569 finished with value: 0.25465711828731136 and parameters: {'lr': 0.0018999537230217813, 'dropout': 0.30801311181509294, 'd_model_multiplier': 4, 'num_layers': 6, 'n_heads': 16, 'dim_feedforward': 425, 'batch_size': 50, 'pos_encoding': 'fixed', 'activation': 'relu', 'norm': 'LayerNorm', 'optimizer_name': 'RAdam', 'weight_decay': 0.1, 'top_n_features': 156}. Best is trial 246 with value: 0.16447311791139763.[0m
[FileBasedDataset] Initializing dataset...
	Examples: 8264
	Features: 78
	Max length: 315
Standard scalar turned ON, loading params from cache
[FileBasedDataset] Dataset initialization complete
Warning, assumed runtime error: CUDA out of memory. Tried to allocate 1.57 GiB (GPU 0; 23.70 GiB total capacity; 20.91 GiB already allocated; 141.25 MiB free; 22.47 GiB reserved in total by PyTorch) If reserved memory is >> allocated memory try setting max_split_size_mb to avoid fragmentation.  See documentation for Memory Management and PYTORCH_CUDA_ALLOC_CONF
[32m[I 2023-05-05 07:31:45,751][0m Trial 570 finished with value: 100.0 and parameters: {'lr': 3.561501113807288e-05, 'dropout': 0.4400342487531184, 'd_model_multiplier': 32, 'num_layers': 5, 'n_heads': 32, 'dim_feedforward': 252, 'batch_size': 133, 'pos_encoding': 'fixed', 'activation': 'relu', 'norm': 'LayerNorm', 'optimizer_name': 'AdamW', 'weight_decay': 0.1, 'top_n_features': 78}. Best is trial 246 with value: 0.16447311791139763.[0m
[FileBasedDataset] Initializing dataset...
	Examples: 8264
	Features: 60
	Max length: 315
Standard scalar turned ON, loading params from cache
[FileBasedDataset] Dataset initialization complete
  epoch    auprc    auroc    train_loss    valid_acc    valid_loss    cp     dur
-------  -------  -------  ------------  -----------  ------------  ----  ------
      1   [36m0.0604[0m   [32m0.3672[0m        [35m0.6867[0m       [31m0.9287[0m        [94m0.6077[0m     +  9.5416
      2   0.0554   0.3023        [35m0.5322[0m       [31m0.9299[0m        [94m0.4291[0m     +  10.0675
      3   0.0604   [32m0.3756[0m        [35m0.3954[0m       0.9299        [94m0.3236[0m     +  10.1159
      4   [36m0.0973[0m   [32m0.5041[0m        [35m0.3255[0m       0.9299        [94m0.2811[0m     +  9.7216
      5   [36m0.1755[0m   [32m0.5804[0m        [35m0.2918[0m       0.9299        [94m0.2589[0m     +  10.3309
      6   [36m0.2163[0m   [32m0.6285[0m        [35m0.2733[0m       [31m0.9311[0m        [94m0.2460[0m     +  10.0452
      7   [36m0.2271[0m   [32m0.6537[0m        [35m0.2612[0m       0.9311        [94m0.2386[0m     +  10.1135
      8   [36m0.2438[0m   [32m0.6717[0m        [35m0.2526[0m       0.9299        [94m0.2343[0m     +  10.1207
      9   [36m0.2515[0m   [32m0.6834[0m        [35m0.2486[0m       0.9274        [94m0.2317[0m     +  10.2636
     10   [36m0.2593[0m   [32m0.6916[0m        [35m0.2423[0m       0.9274        [94m0.2302[0m     +  10.3167
     11   [36m0.2656[0m   [32m0.6989[0m        [35m0.2406[0m       0.9299        [94m0.2290[0m     +  10.2693
     12   [36m0.2761[0m   [32m0.7042[0m        [35m0.2382[0m       0.9287        [94m0.2282[0m     +  10.4544
     13   [36m0.2796[0m   [32m0.7081[0m        [35m0.2379[0m       0.9287        [94m0.2275[0m     +  10.3418
     14   [36m0.2848[0m   [32m0.7137[0m        [35m0.2359[0m       0.9299        [94m0.2269[0m     +  10.5820
     15   [36m0.2880[0m   [32m0.7179[0m        0.2368       0.9299        [94m0.2268[0m     +  10.4720
     16   [36m0.2889[0m   [32m0.7194[0m        [35m0.2333[0m       0.9299        [94m0.2264[0m     +  10.1818
     17   [36m0.2920[0m   [32m0.7248[0m        0.2339       0.9287        [94m0.2260[0m     +  10.2236
     18   0.2919   [32m0.7267[0m        [35m0.2327[0m       0.9299        [94m0.2257[0m     +  10.4409
     19   0.2916   [32m0.7279[0m        [35m0.2324[0m       0.9299        [94m0.2255[0m     +  9.9192
     20   0.2905   [32m0.7303[0m        [35m0.2317[0m       0.9274        [94m0.2254[0m     +  9.9054
     21   0.2906   [32m0.7311[0m        0.2321       0.9299        [94m0.2252[0m     +  10.1138
     22   [36m0.2925[0m   [32m0.7342[0m        [35m0.2308[0m       0.9311        [94m0.2249[0m     +  10.3999
     23   0.2917   [32m0.7351[0m        0.2322       0.9311        [94m0.2249[0m     +  10.5388
     24   0.2898   [32m0.7358[0m        0.2315       [31m0.9323[0m        [94m0.2247[0m     +  10.4524
     25   0.2920   [32m0.7376[0m        0.2309       0.9311        [94m0.2246[0m     +  10.1025
     26   0.2912   [32m0.7379[0m        [35m0.2299[0m       0.9323        0.2248        10.3470
     27   0.2913   [32m0.7379[0m        [35m0.2291[0m       0.9311        0.2251        10.1401
     28   0.2918   [32m0.7391[0m        [35m0.2287[0m       0.9323        0.2248        10.3366
     29   [36m0.2951[0m   [32m0.7411[0m        0.2290       0.9299        [94m0.2246[0m     +  10.1456
     30   0.2931   0.7410        0.2301       0.9323        0.2246        10.1244
     31   0.2948   [32m0.7426[0m        0.2293       [31m0.9335[0m        [94m0.2242[0m     +  9.9435
     32   0.2933   [32m0.7427[0m        [35m0.2283[0m       0.9323        0.2244        10.4878
     33   0.2912   0.7424        0.2288       0.9335        0.2250        10.3016
     34   0.2916   [32m0.7436[0m        [35m0.2264[0m       0.9311        0.2255        10.0821
     35   0.2912   [32m0.7440[0m        0.2273       0.9311        0.2252        10.3497
     36   0.2893   [32m0.7449[0m        0.2268       0.9311        0.2256        10.0611
     37   0.2850   0.7442        0.2268       0.9311        0.2255        10.3595
     38   0.2851   0.7444        [35m0.2252[0m       0.9311        0.2259        10.2033
     39   0.2830   0.7448        0.2255       0.9299        0.2261        10.1564
     40   0.2828   [32m0.7458[0m        0.2252       0.9311        0.2257        10.0432
Stopping since valid_loss has not improved in the last 10 epochs.
[32m[I 2023-05-05 07:38:46,509][0m Trial 571 finished with value: 0.2242016032644454 and parameters: {'lr': 1.484478399814391e-05, 'dropout': 0.38847539062581604, 'd_model_multiplier': 16, 'num_layers': 6, 'n_heads': 4, 'dim_feedforward': 348, 'batch_size': 62, 'pos_encoding': 'fixed', 'activation': 'relu', 'norm': 'LayerNorm', 'optimizer_name': 'RAdam', 'weight_decay': 0.001, 'top_n_features': 60}. Best is trial 246 with value: 0.16447311791139763.[0m
[FileBasedDataset] Initializing dataset...
	Examples: 8264
	Features: 192
	Max length: 315
Standard scalar turned ON, loading params from cache
[FileBasedDataset] Dataset initialization complete
  epoch    auprc    auroc    train_loss    valid_acc    valid_loss    cp     dur
-------  -------  -------  ------------  -----------  ------------  ----  ------
      1   [36m0.1783[0m   [32m0.7562[0m        [35m0.3857[0m       [31m0.9407[0m        [94m0.2019[0m     +  9.1448
      2   [36m0.2344[0m   [32m0.8002[0m        [35m0.2565[0m       [31m0.9432[0m        [94m0.1943[0m     +  9.9340
      3   [36m0.2713[0m   [32m0.8008[0m        [35m0.2511[0m       0.9420        [94m0.1925[0m     +  10.1420
      4   [36m0.2759[0m   0.7896        [35m0.2440[0m       0.9420        0.1943        10.1866
      5   0.2668   0.7734        [35m0.2432[0m       [31m0.9444[0m        0.1963        9.8773
      6   0.2748   0.7797        [35m0.2393[0m       [31m0.9456[0m        0.1960        10.2498
      7   0.2635   0.7704        [35m0.2384[0m       0.9444        0.1977        10.0499
      8   0.2658   0.7811        [35m0.2353[0m       0.9444        0.1957        10.0358
      9   0.2617   0.7763        [35m0.2339[0m       0.9444        0.1985        10.7079
     10   0.2636   0.7762        0.2358       0.9432        0.1998        10.2080
     11   0.2438   0.7589        [35m0.2292[0m       0.9444        0.2062        10.2815
     12   0.2483   0.7593        0.2326       0.9432        0.2027        10.3772
Stopping since valid_loss has not improved in the last 10 epochs.
[32m[I 2023-05-05 07:40:58,345][0m Trial 572 finished with value: 0.19252316889768645 and parameters: {'lr': 0.0002826451816789614, 'dropout': 0.42630210991504847, 'd_model_multiplier': 4, 'num_layers': 1, 'n_heads': 32, 'dim_feedforward': 337, 'batch_size': 60, 'pos_encoding': 'learnable', 'activation': 'relu', 'norm': 'LayerNorm', 'optimizer_name': 'RAdam', 'weight_decay': 0.1, 'top_n_features': 192}. Best is trial 246 with value: 0.16447311791139763.[0m
[FileBasedDataset] Initializing dataset...
	Examples: 8264
	Features: 200
	Max length: 315
Standard scalar turned ON, loading params from cache
[FileBasedDataset] Dataset initialization complete
  epoch    auprc    auroc    train_loss    valid_acc    valid_loss    cp     dur
-------  -------  -------  ------------  -----------  ------------  ----  ------
      1   [36m0.2558[0m   [32m0.7236[0m        [35m0.2949[0m       [31m0.9274[0m        [94m0.2344[0m     +  8.7451
      2   [36m0.2566[0m   [32m0.7508[0m        [35m0.2526[0m       0.9274        [94m0.2309[0m     +  9.1542
      3   [36m0.3234[0m   [32m0.7632[0m        [35m0.2499[0m       [31m0.9323[0m        [94m0.2270[0m     +  9.3422
      4   [36m0.3375[0m   [32m0.7714[0m        [35m0.2440[0m       0.9299        [94m0.2221[0m     +  9.6438
      5   0.3292   [32m0.7769[0m        [35m0.2409[0m       0.9311        [94m0.2198[0m     +  9.8919
      6   [36m0.3481[0m   [32m0.7853[0m        [35m0.2401[0m       0.9299        [94m0.2174[0m     +  10.0062
      7   0.3449   [32m0.7855[0m        [35m0.2379[0m       0.9311        [94m0.2160[0m     +  9.7801
      8   0.3469   [32m0.7868[0m        [35m0.2369[0m       0.9311        0.2163        9.6179
      9   0.3473   [32m0.7924[0m        [35m0.2367[0m       [31m0.9335[0m        [94m0.2153[0m     +  9.3333
     10   [36m0.3638[0m   [32m0.7942[0m        [35m0.2342[0m       [31m0.9371[0m        [94m0.2134[0m     +  9.6690
     11   [36m0.3665[0m   [32m0.7953[0m        [35m0.2336[0m       0.9311        0.2147        9.3451
     12   0.3555   [32m0.7984[0m        [35m0.2329[0m       0.9335        0.2147        9.8139
     13   0.3304   0.7945        0.2341       0.9299        0.2179        9.7666
     14   0.3575   0.7952        [35m0.2307[0m       0.9274        0.2165        9.4396
     15   0.3571   [32m0.7998[0m        0.2310       0.9347        0.2134        9.6312
     16   0.3551   [32m0.8037[0m        [35m0.2298[0m       0.9323        0.2155        9.5763
     17   [36m0.3811[0m   0.8023        [35m0.2286[0m       0.9311        [94m0.2103[0m     +  9.6927
     18   0.3752   0.8013        [35m0.2263[0m       0.9347        0.2150        9.9191
     19   0.3640   0.8001        [35m0.2262[0m       0.9323        0.2148        9.7056
     20   0.3694   [32m0.8055[0m        0.2273       0.9311        0.2153        9.6390
     21   0.3738   0.8018        [35m0.2237[0m       0.9262        0.2198        9.5980
     22   0.3588   [32m0.8060[0m        0.2249       0.9226        0.2228        9.7840
     23   0.3301   0.7998        [35m0.2232[0m       0.9238        0.2224        9.6757
     24   0.3422   0.8026        [35m0.2220[0m       0.9238        0.2219        9.4161
     25   0.3390   0.8028        [35m0.2216[0m       0.9262        0.2173        9.7895
     26   0.3335   0.8031        [35m0.2178[0m       0.9226        0.2219        9.3425
Stopping since valid_loss has not improved in the last 10 epochs.
