[32m[I 2023-05-04 13:04:19,440][0m Trial 441 finished with value: 0.24225193404445047 and parameters: {'lr': 4.062679624327049e-05, 'dropout': 0.5399498779931504, 'd_model_multiplier': 4, 'num_layers': 6, 'n_heads': 32, 'dim_feedforward': 346, 'batch_size': 65, 'pos_encoding': 'fixed', 'activation': 'relu', 'norm': 'LayerNorm', 'optimizer_name': 'RAdam', 'weight_decay': 0.001, 'top_n_features': 58}. Best is trial 246 with value: 0.16447311791139763.[0m
[FileBasedDataset] Initializing dataset...
	Examples: 8264
	Features: 66
	Max length: 315
Standard scalar turned ON, loading params from cache
[FileBasedDataset] Dataset initialization complete
  epoch    auprc    auroc    train_loss    valid_acc    valid_loss    cp      dur
-------  -------  -------  ------------  -----------  ------------  ----  -------
      1   [36m0.0576[0m   [32m0.3094[0m        [35m0.5164[0m       [31m0.9166[0m        [94m0.3867[0m     +  23.6078
      2   [36m0.1147[0m   [32m0.5678[0m        [35m0.3297[0m       0.9166        [94m0.2905[0m     +  24.9422
      3   [36m0.2088[0m   [32m0.6637[0m        [35m0.2698[0m       0.9166        [94m0.2709[0m     +  23.9683
      4   [36m0.2400[0m   [32m0.6967[0m        [35m0.2533[0m       0.9166        [94m0.2652[0m     +  23.8639
      5   [36m0.2508[0m   [32m0.7292[0m        [35m0.2453[0m       0.9141        [94m0.2592[0m     +  23.8456
      6   [36m0.2640[0m   [32m0.7560[0m        [35m0.2404[0m       [31m0.9178[0m        [94m0.2544[0m     +  23.7627
      7   [36m0.2786[0m   [32m0.7635[0m        [35m0.2356[0m       0.9178        [94m0.2528[0m     +  24.0086
      8   [36m0.2940[0m   [32m0.7639[0m        [35m0.2332[0m       0.9166        [94m0.2527[0m     +  23.7710
      9   [36m0.3036[0m   [32m0.7669[0m        [35m0.2313[0m       0.9141        [94m0.2516[0m     +  23.5933
     10   [36m0.3087[0m   [32m0.7679[0m        [35m0.2287[0m       0.9117        [94m0.2510[0m     +  24.0978
     11   [36m0.3118[0m   [32m0.7701[0m        [35m0.2286[0m       0.9081        [94m0.2496[0m     +  23.5965
     12   [36m0.3159[0m   [32m0.7721[0m        [35m0.2267[0m       0.9081        [94m0.2488[0m     +  24.2987
     13   [36m0.3181[0m   [32m0.7723[0m        0.2275       0.9093        [94m0.2479[0m     +  23.6769
     14   0.3174   [32m0.7754[0m        [35m0.2266[0m       0.9069        [94m0.2474[0m     +  23.8878
     15   [36m0.3204[0m   [32m0.7771[0m        [35m0.2240[0m       0.9081        [94m0.2469[0m     +  23.9332
     16   [36m0.3224[0m   [32m0.7783[0m        [35m0.2239[0m       0.9093        [94m0.2464[0m     +  23.9947
     17   [36m0.3256[0m   [32m0.7788[0m        0.2256       0.9093        [94m0.2457[0m     +  23.7990
     18   [36m0.3331[0m   [32m0.7789[0m        0.2258       0.9093        [94m0.2451[0m     +  24.0969
     19   [36m0.3349[0m   [32m0.7822[0m        [35m0.2231[0m       0.9069        [94m0.2436[0m     +  23.5615
     20   [36m0.3357[0m   0.7810        [35m0.2230[0m       0.9069        0.2451        23.6469
     21   0.3330   0.7810        [35m0.2207[0m       0.9081        0.2461        24.0141
     22   [36m0.3396[0m   [32m0.7846[0m        0.2227       0.9081        0.2449        23.9243
     23   [36m0.3428[0m   [32m0.7863[0m        0.2215       0.9117        0.2438        23.7380
     24   0.3427   [32m0.7867[0m        [35m0.2204[0m       0.9117        0.2443        24.1884
     25   0.3400   0.7862        [35m0.2192[0m       0.9129        0.2448        23.9345
     26   [36m0.3445[0m   [32m0.7896[0m        [35m0.2191[0m       0.9141        [94m0.2430[0m     +  24.0092
     27   0.3432   [32m0.7898[0m        [35m0.2190[0m       0.9129        0.2433        24.0483
     28   [36m0.3486[0m   [32m0.7904[0m        [35m0.2177[0m       0.9141        [94m0.2423[0m     +  23.8179
     29   0.3449   0.7885        [35m0.2161[0m       0.9129        0.2445        23.7345
     30   0.3447   [32m0.7912[0m        0.2173       0.9129        0.2427        24.0586
     31   0.3476   [32m0.7917[0m        [35m0.2151[0m       0.9105        0.2428        23.6243
     32   0.3445   0.7914        0.2165       0.9117        0.2445        23.9850
     33   0.3411   [32m0.7920[0m        0.2162       0.9129        0.2425        23.8085
     34   [36m0.3496[0m   0.7907        0.2156       0.9141        [94m0.2419[0m     +  23.8660
     35   0.3449   0.7894        [35m0.2136[0m       0.9129        0.2431        23.9308
     36   0.3427   0.7879        [35m0.2134[0m       0.9129        0.2453        23.7640
     37   0.3476   0.7906        [35m0.2127[0m       0.9129        0.2439        23.9536
     38   0.3441   0.7908        [35m0.2113[0m       0.9141        0.2439        24.6922
     39   0.3487   0.7881        0.2118       0.9166        0.2442        23.7226
     40   0.3346   0.7842        0.2127       [31m0.9190[0m        0.2463        23.8470
     41   0.3461   0.7866        [35m0.2101[0m       0.9166        0.2451        23.8261
     42   0.3431   0.7853        0.2118       0.9178        0.2463        24.0310
     43   0.3396   0.7848        [35m0.2090[0m       0.9190        0.2455        23.6991
Stopping since valid_loss has not improved in the last 10 epochs.
[32m[I 2023-05-04 13:21:54,120][0m Trial 442 finished with value: 0.24192791324032262 and parameters: {'lr': 2.6142420549080384e-05, 'dropout': 0.40629838063516993, 'd_model_multiplier': 4, 'num_layers': 5, 'n_heads': 32, 'dim_feedforward': 369, 'batch_size': 61, 'pos_encoding': 'fixed', 'activation': 'relu', 'norm': 'LayerNorm', 'optimizer_name': 'RAdam', 'weight_decay': 0.1, 'top_n_features': 66}. Best is trial 246 with value: 0.16447311791139763.[0m
[FileBasedDataset] Initializing dataset...
	Examples: 8264
	Features: 54
	Max length: 315
Standard scalar turned ON, loading params from cache
[FileBasedDataset] Dataset initialization complete
  epoch    auprc    auroc    train_loss    valid_acc    valid_loss    cp      dur
-------  -------  -------  ------------  -----------  ------------  ----  -------
      1   [36m0.0635[0m   [32m0.3681[0m        [35m0.5452[0m       [31m0.9190[0m        [94m0.3608[0m     +  20.1098
      2   [36m0.2372[0m   [32m0.6806[0m        [35m0.3095[0m       0.9190        [94m0.2631[0m     +  20.3044
      3   [36m0.3222[0m   [32m0.7363[0m        [35m0.2597[0m       [31m0.9202[0m        [94m0.2486[0m     +  20.4477
      4   [36m0.3562[0m   [32m0.7497[0m        [35m0.2458[0m       0.9190        [94m0.2407[0m     +  20.3763
      5   [36m0.3712[0m   [32m0.7543[0m        [35m0.2387[0m       [31m0.9226[0m        [94m0.2374[0m     +  20.6166
      6   0.3657   [32m0.7556[0m        [35m0.2353[0m       [31m0.9250[0m        0.2375        20.5879
      7   [36m0.3749[0m   [32m0.7591[0m        [35m0.2350[0m       0.9226        0.2379        20.4110
      8   [36m0.3776[0m   [32m0.7619[0m        [35m0.2318[0m       0.9214        0.2379        20.1901
      9   0.3734   [32m0.7633[0m        [35m0.2312[0m       0.9202        0.2383        20.3498
     10   0.3743   [32m0.7636[0m        [35m0.2307[0m       0.9202        0.2411        20.2120
     11   0.3678   [32m0.7647[0m        [35m0.2298[0m       0.9214        0.2413        20.4413
     12   0.3690   [32m0.7655[0m        [35m0.2287[0m       0.9202        0.2403        20.4260
     13   0.3698   0.7653        [35m0.2277[0m       0.9214        0.2412        20.3970
     14   0.3656   0.7650        [35m0.2267[0m       0.9214        0.2416        20.4465
Stopping since valid_loss has not improved in the last 10 epochs.
[32m[I 2023-05-04 13:27:00,653][0m Trial 443 finished with value: 0.23737364293874536 and parameters: {'lr': 4.605403724500836e-05, 'dropout': 0.4438111270405422, 'd_model_multiplier': 4, 'num_layers': 4, 'n_heads': 32, 'dim_feedforward': 354, 'batch_size': 68, 'pos_encoding': 'fixed', 'activation': 'relu', 'norm': 'LayerNorm', 'optimizer_name': 'RAdam', 'weight_decay': 0.1, 'top_n_features': 54}. Best is trial 246 with value: 0.16447311791139763.[0m
[FileBasedDataset] Initializing dataset...
	Examples: 8264
	Features: 75
	Max length: 315
Standard scalar turned ON, loading params from cache
[FileBasedDataset] Dataset initialization complete
Warning, assumed runtime error: CUDA out of memory. Tried to allocate 1.29 GiB (GPU 0; 23.70 GiB total capacity; 21.91 GiB already allocated; 473.25 MiB free; 22.14 GiB reserved in total by PyTorch) If reserved memory is >> allocated memory try setting max_split_size_mb to avoid fragmentation.  See documentation for Memory Management and PYTORCH_CUDA_ALLOC_CONF
[32m[I 2023-05-04 13:27:05,739][0m Trial 444 finished with value: 100.0 and parameters: {'lr': 8.592523887356206e-05, 'dropout': 0.5676466303844685, 'd_model_multiplier': 4, 'num_layers': 7, 'n_heads': 32, 'dim_feedforward': 365, 'batch_size': 109, 'pos_encoding': 'fixed', 'activation': 'relu', 'norm': 'LayerNorm', 'optimizer_name': 'RAdam', 'weight_decay': 0.1, 'top_n_features': 75}. Best is trial 246 with value: 0.16447311791139763.[0m
[FileBasedDataset] Initializing dataset...
	Examples: 8264
	Features: 61
	Max length: 315
Standard scalar turned ON, loading params from cache
[FileBasedDataset] Dataset initialization complete
Warning, assumed runtime error: CUDA out of memory. Tried to allocate 922.00 MiB (GPU 0; 23.70 GiB total capacity; 18.50 GiB already allocated; 509.25 MiB free; 22.11 GiB reserved in total by PyTorch) If reserved memory is >> allocated memory try setting max_split_size_mb to avoid fragmentation.  See documentation for Memory Management and PYTORCH_CUDA_ALLOC_CONF
[32m[I 2023-05-04 13:27:09,260][0m Trial 445 finished with value: 100.0 and parameters: {'lr': 5.5006530920667423e-05, 'dropout': 0.5535407729209102, 'd_model_multiplier': 4, 'num_layers': 9, 'n_heads': 32, 'dim_feedforward': 345, 'batch_size': 76, 'pos_encoding': 'fixed', 'activation': 'relu', 'norm': 'LayerNorm', 'optimizer_name': 'RAdam', 'weight_decay': 0.001, 'top_n_features': 61}. Best is trial 246 with value: 0.16447311791139763.[0m
[FileBasedDataset] Initializing dataset...
	Examples: 8264
	Features: 50
	Max length: 315
Standard scalar turned ON, loading params from cache
[FileBasedDataset] Dataset initialization complete
  epoch    auprc    auroc    train_loss    valid_acc    valid_loss    cp      dur
-------  -------  -------  ------------  -----------  ------------  ----  -------
      1   [36m0.0543[0m   [32m0.3081[0m        [35m0.5431[0m       [31m0.9226[0m        [94m0.3706[0m     +  26.7982
      2   [36m0.1890[0m   [32m0.6621[0m        [35m0.3174[0m       0.9226        [94m0.2600[0m     +  27.3496
      3   [36m0.2692[0m   [32m0.7174[0m        [35m0.2637[0m       0.9226        [94m0.2432[0m     +  27.0630
      4   [36m0.3146[0m   [32m0.7499[0m        [35m0.2497[0m       0.9226        [94m0.2359[0m     +  27.0611
      5   [36m0.3279[0m   [32m0.7725[0m        [35m0.2414[0m       [31m0.9274[0m        [94m0.2316[0m     +  27.5051
      6   0.3193   [32m0.7817[0m        [35m0.2372[0m       0.9202        [94m0.2308[0m     +  27.1863
      7   0.3187   [32m0.7842[0m        [35m0.2349[0m       0.9178        [94m0.2307[0m     +  27.5869
      8   0.3099   [32m0.7870[0m        [35m0.2323[0m       0.9190        [94m0.2306[0m     +  27.6951
      9   0.3045   [32m0.7882[0m        [35m0.2300[0m       0.9190        0.2312        27.7025
     10   0.2973   [32m0.7901[0m        [35m0.2300[0m       0.9190        0.2311        27.6023
     11   0.2931   [32m0.7901[0m        [35m0.2287[0m       0.9190        0.2317        27.3051
     12   0.2913   [32m0.7915[0m        0.2292       0.9190        0.2319        27.4258
     13   0.2953   [32m0.7943[0m        [35m0.2283[0m       0.9178        0.2313        27.6672
     14   0.2960   0.7928        [35m0.2247[0m       0.9190        0.2322        27.5308
     15   0.2974   0.7909        0.2249       0.9202        0.2326        27.5688
     16   0.3002   0.7935        0.2253       0.9190        0.2320        27.4994
     17   0.3070   [32m0.7956[0m        [35m0.2244[0m       0.9214        [94m0.2302[0m     +  27.6278
     18   0.3143   0.7947        [35m0.2235[0m       0.9214        [94m0.2294[0m     +  27.3995
     19   0.3080   0.7933        [35m0.2221[0m       0.9202        0.2318        27.1596
     20   0.3126   0.7948        [35m0.2220[0m       0.9190        0.2311        27.2584
     21   0.3167   0.7918        0.2225       0.9262        0.2317        27.8753
     22   0.3263   0.7935        [35m0.2210[0m       0.9238        0.2309        27.3568
     23   0.3135   0.7939        0.2219       0.9214        0.2320        27.4180
     24   0.3176   [32m0.7973[0m        [35m0.2205[0m       0.9226        [94m0.2288[0m     +  27.8656
     25   0.3238   0.7963        [35m0.2198[0m       0.9202        0.2324        27.5331
     26   [36m0.3280[0m   [32m0.7998[0m        [35m0.2191[0m       0.9202        0.2309        27.4164
     27   0.3228   0.7973        [35m0.2170[0m       0.9202        0.2322        28.2380
     28   [36m0.3356[0m   0.7980        [35m0.2167[0m       0.9202        0.2330        27.5665
     29   [36m0.3370[0m   0.7990        0.2173       0.9214        0.2332        27.5151
     30   0.3344   [32m0.8001[0m        [35m0.2165[0m       0.9214        0.2343        27.2621
     31   0.3350   0.7980        0.2172       0.9154        0.2323        27.4775
     32   0.3285   0.7981        [35m0.2163[0m       0.9202        0.2321        27.5981
     33   0.3263   0.7969        [35m0.2148[0m       0.9202        0.2346        27.3177
Stopping since valid_loss has not improved in the last 10 epochs.
[32m[I 2023-05-04 13:42:44,651][0m Trial 446 finished with value: 0.2288224682698371 and parameters: {'lr': 3.159881097626248e-05, 'dropout': 0.41569780599896455, 'd_model_multiplier': 4, 'num_layers': 6, 'n_heads': 32, 'dim_feedforward': 325, 'batch_size': 61, 'pos_encoding': 'fixed', 'activation': 'relu', 'norm': 'LayerNorm', 'optimizer_name': 'RAdam', 'weight_decay': 0.1, 'top_n_features': 50}. Best is trial 246 with value: 0.16447311791139763.[0m
[FileBasedDataset] Initializing dataset...
	Examples: 8264
	Features: 70
	Max length: 315
Standard scalar turned ON, loading params from cache
[FileBasedDataset] Dataset initialization complete
  epoch    auprc    auroc    train_loss    valid_acc    valid_loss    cp     dur
-------  -------  -------  ------------  -----------  ------------  ----  ------
      1   [36m0.0545[0m   [32m0.3798[0m        [35m0.7264[0m       [31m0.1802[0m        [94m0.7261[0m     +  8.6369
      2   0.0485   0.2951        [35m0.6855[0m       [31m0.7703[0m        [94m0.6662[0m     +  9.7668
      3   0.0469   0.2860        [35m0.6271[0m       [31m0.9335[0m        [94m0.5962[0m     +  9.4149
      4   0.0455   0.2753        [35m0.5671[0m       0.9335        [94m0.5287[0m     +  9.9475
      5   0.0462   0.2760        [35m0.5137[0m       0.9335        [94m0.4682[0m     +  9.9786
      6   0.0459   0.2777        [35m0.4665[0m       0.9335        [94m0.4146[0m     +  10.0398
      7   0.0483   0.2825        [35m0.4269[0m       0.9335        [94m0.3715[0m     +  10.7189
      8   0.0495   0.3051        [35m0.3911[0m       0.9335        [94m0.3375[0m     +  9.7554
      9   0.0519   0.3447        [35m0.3649[0m       0.9335        [94m0.3115[0m     +  9.7530
     10   [36m0.0577[0m   [32m0.4082[0m        [35m0.3442[0m       0.9335        [94m0.2916[0m     +  9.9494
     11   [36m0.0668[0m   [32m0.4766[0m        [35m0.3272[0m       0.9335        [94m0.2767[0m     +  9.6252
     12   [36m0.0905[0m   [32m0.5333[0m        [35m0.3156[0m       0.9335        [94m0.2654[0m     +  9.6964
     13   [36m0.1230[0m   [32m0.5659[0m        [35m0.3053[0m       0.9335        [94m0.2568[0m     +  9.4661
     14   [36m0.1428[0m   [32m0.5937[0m        [35m0.2990[0m       0.9335        [94m0.2503[0m     +  9.5767
     15   [36m0.1516[0m   [32m0.6142[0m        [35m0.2923[0m       0.9335        [94m0.2451[0m     +  9.4211
     16   [36m0.1535[0m   [32m0.6324[0m        [35m0.2886[0m       0.9335        [94m0.2407[0m     +  9.7369
     17   [36m0.1578[0m   [32m0.6481[0m        [35m0.2833[0m       0.9335        [94m0.2371[0m     +  10.0101
     18   [36m0.1604[0m   [32m0.6591[0m        [35m0.2801[0m       0.9335        [94m0.2342[0m     +  9.7483
     19   [36m0.1641[0m   [32m0.6681[0m        [35m0.2742[0m       0.9335        [94m0.2318[0m     +  9.9799
     20   [36m0.1678[0m   [32m0.6759[0m        [35m0.2731[0m       0.9335        [94m0.2298[0m     +  10.1664
     21   [36m0.1716[0m   [32m0.6825[0m        [35m0.2700[0m       0.9335        [94m0.2284[0m     +  10.0501
     22   [36m0.1729[0m   [32m0.6868[0m        [35m0.2685[0m       0.9335        [94m0.2272[0m     +  10.0698
     23   0.1715   [32m0.6902[0m        [35m0.2658[0m       0.9335        [94m0.2263[0m     +  10.2991
     24   [36m0.1739[0m   [32m0.6919[0m        0.2679       0.9335        [94m0.2256[0m     +  9.8197
     25   [36m0.1752[0m   [32m0.6952[0m        [35m0.2628[0m       0.9335        [94m0.2250[0m     +  9.8645
     26   [36m0.1758[0m   [32m0.6965[0m        0.2644       0.9335        [94m0.2245[0m     +  9.8883
     27   [36m0.1774[0m   [32m0.6984[0m        [35m0.2625[0m       0.9335        [94m0.2239[0m     +  9.4973
     28   [36m0.1788[0m   0.6984        0.2628       0.9335        [94m0.2235[0m     +  9.8679
     29   0.1780   [32m0.6988[0m        0.2626       0.9335        [94m0.2232[0m     +  9.8918
     30   0.1772   [32m0.6995[0m        [35m0.2604[0m       0.9335        [94m0.2229[0m     +  9.9074
     31   0.1727   0.6988        0.2605       0.9335        [94m0.2226[0m     +  9.8787
     32   0.1757   [32m0.7012[0m        0.2605       0.9335        [94m0.2224[0m     +  10.1206
     33   0.1731   [32m0.7021[0m        [35m0.2589[0m       0.9335        [94m0.2222[0m     +  10.2259
     34   0.1752   [32m0.7053[0m        [35m0.2585[0m       0.9335        [94m0.2219[0m     +  10.6487
     35   0.1779   [32m0.7072[0m        [35m0.2575[0m       0.9335        [94m0.2216[0m     +  10.2323
     36   [36m0.1849[0m   [32m0.7113[0m        [35m0.2571[0m       0.9335        [94m0.2212[0m     +  10.6110
     37   [36m0.1889[0m   [32m0.7138[0m        0.2583       0.9335        [94m0.2208[0m     +  10.7307
     38   [36m0.1924[0m   [32m0.7179[0m        0.2579       0.9335        [94m0.2202[0m     +  10.3468
     39   [36m0.1989[0m   [32m0.7206[0m        [35m0.2557[0m       0.9335        [94m0.2199[0m     +  10.1113
     40   [36m0.2018[0m   [32m0.7226[0m        [35m0.2547[0m       0.9335        [94m0.2196[0m     +  10.2140
     41   [36m0.2023[0m   [32m0.7232[0m        0.2548       0.9335        [94m0.2194[0m     +  10.0867
     42   [36m0.2046[0m   [32m0.7270[0m        0.2550       0.9335        [94m0.2189[0m     +  10.1089
     43   [36m0.2064[0m   0.7268        [35m0.2521[0m       0.9335        [94m0.2189[0m     +  10.0717
     44   [36m0.2278[0m   [32m0.7293[0m        [35m0.2497[0m       0.9323        [94m0.2188[0m     +  9.8617
     45   [36m0.2377[0m   [32m0.7335[0m        0.2524       0.9335        [94m0.2185[0m     +  9.6855
     46   [36m0.2479[0m   [32m0.7411[0m        [35m0.2488[0m       0.9323        [94m0.2180[0m     +  9.7322
     47   [36m0.2489[0m   0.7393        [35m0.2481[0m       0.9323        0.2181        10.5590
     48   [36m0.2600[0m   [32m0.7451[0m        [35m0.2463[0m       0.9299        [94m0.2173[0m     +  10.6471
     49   [36m0.2626[0m   [32m0.7475[0m        [35m0.2453[0m       0.9299        [94m0.2166[0m     +  9.5212
     50   [36m0.2669[0m   0.7471        0.2457       0.9299        [94m0.2163[0m     +  9.4287
