[32m[I 2023-05-02 12:29:30,286][0m Trial 122 finished with value: 0.26318440329567266 and parameters: {'lr': 0.0019904352119823458, 'dropout': 0.31744134376442557, 'd_model_multiplier': 1, 'num_layers': 2, 'n_heads': 32, 'dim_feedforward': 432, 'batch_size': 23, 'pos_encoding': 'learnable', 'activation': 'gelu', 'norm': 'BatchNorm', 'optimizer_name': 'PlainRAdam', 'weight_decay': 0, 'top_n_features': 131}. Best is trial 117 with value: 0.191397856754288.[0m
[FileBasedDataset] Initializing dataset...
	Examples: 8264
	Features: 138
	Max length: 315
Standard scalar turned ON, loading params from cache
[FileBasedDataset] Dataset initialization complete
  epoch    auprc    auroc    train_loss    valid_acc    valid_loss    cp     dur
-------  -------  -------  ------------  -----------  ------------  ----  ------
      1   [36m0.2113[0m   [32m0.6595[0m        [35m0.2986[0m       [31m0.9202[0m        [94m0.2616[0m     +  9.3763
      2   [36m0.2254[0m   0.6592        [35m0.2638[0m       0.9202        0.2643        9.4925
      3   [36m0.2294[0m   0.6382        [35m0.2530[0m       0.9202        0.2662        9.6408
      4   [36m0.2294[0m   0.6584        0.2548       [31m0.9226[0m        0.2654        9.2393
      5   0.1859   0.6246        [35m0.2486[0m       0.9202        0.2806        9.2991
      6   [36m0.2312[0m   0.6353        [35m0.2423[0m       0.9202        0.2716        9.4279
      7   0.2116   0.6038        0.2462       [31m0.9238[0m        0.2731        9.7216
      8   [36m0.2578[0m   [32m0.6896[0m        0.2436       0.9214        [94m0.2578[0m     +  9.3738
      9   0.2292   0.6545        [35m0.2371[0m       [31m0.9250[0m        0.2642        9.6034
     10   0.2253   0.6356        0.2403       0.9226        0.2697        9.6888
     11   0.2427   0.6612        [35m0.2345[0m       0.9250        0.2668        9.6756
     12   [36m0.2606[0m   0.6680        [35m0.2319[0m       0.9226        0.2585        9.5473
     13   [36m0.2726[0m   [32m0.7015[0m        0.2339       0.9250        [94m0.2512[0m     +  10.4290
     14   0.2608   [32m0.7133[0m        [35m0.2290[0m       0.9202        0.2598        9.6452
     15   0.2634   0.6901        [35m0.2281[0m       0.9238        0.2573        9.7500
     16   0.2694   0.6915        [35m0.2278[0m       0.9250        0.2717        9.9016
     17   0.2489   0.6770        [35m0.2266[0m       0.9214        0.2701        9.7745
     18   [36m0.2755[0m   0.7056        0.2269       0.9238        0.2651        9.3697
     19   [36m0.2937[0m   0.7124        [35m0.2218[0m       0.9226        0.2517        10.0854
     20   0.2750   0.6975        [35m0.2203[0m       0.9214        0.2582        9.5567
     21   0.2666   0.6833        [35m0.2202[0m       0.9214        0.2625        9.4394
     22   0.2784   0.6662        [35m0.2166[0m       0.9226        0.2654        9.3858
Stopping since valid_loss has not improved in the last 10 epochs.
[32m[I 2023-05-02 12:33:11,938][0m Trial 123 finished with value: 0.2511733742261884 and parameters: {'lr': 0.00046577787561240404, 'dropout': 0.349092674715513, 'd_model_multiplier': 1, 'num_layers': 1, 'n_heads': 32, 'dim_feedforward': 397, 'batch_size': 12, 'pos_encoding': 'learnable', 'activation': 'gelu', 'norm': 'BatchNorm', 'optimizer_name': 'PlainRAdam', 'weight_decay': 0, 'top_n_features': 138}. Best is trial 117 with value: 0.191397856754288.[0m
[FileBasedDataset] Initializing dataset...
	Examples: 8264
	Features: 127
	Max length: 315
Standard scalar turned ON, loading params from cache
[FileBasedDataset] Dataset initialization complete
  epoch    auprc    auroc    train_loss    valid_acc    valid_loss    cp      dur
-------  -------  -------  ------------  -----------  ------------  ----  -------
      1   [36m0.2596[0m   [32m0.7649[0m        [35m0.2772[0m       [31m0.9033[0m        [94m0.2743[0m     +  10.9315
      2   [36m0.2599[0m   [32m0.7758[0m        [35m0.2507[0m       [31m0.9045[0m        0.2763        11.1661
      3   [36m0.2887[0m   [32m0.8058[0m        [35m0.2475[0m       [31m0.9093[0m        [94m0.2647[0m     +  11.3223
      4   0.2694   0.7967        [35m0.2368[0m       0.9033        0.2724        11.1805
      5   [36m0.2889[0m   [32m0.8178[0m        0.2378       0.9057        [94m0.2608[0m     +  11.2347
      6   [36m0.2927[0m   [32m0.8187[0m        [35m0.2322[0m       0.9033        0.2733        11.0502
      7   [36m0.2948[0m   [32m0.8222[0m        [35m0.2300[0m       0.9033        0.2976        11.1001
      8   [36m0.3254[0m   [32m0.8300[0m        [35m0.2273[0m       0.9069        [94m0.2474[0m     +  11.2232
      9   0.2982   0.8231        [35m0.2245[0m       0.9021        0.2804        11.3121
     10   0.3135   0.8213        [35m0.2235[0m       0.9069        0.2522        11.3183
     11   0.3015   0.8251        [35m0.2232[0m       0.9069        0.3117        11.4070
     12   0.3111   0.8212        0.2240       0.9033        0.3341        11.3946
     13   [36m0.3268[0m   [32m0.8346[0m        [35m0.2197[0m       0.9045        0.3742        11.4618
     14   [36m0.3294[0m   [32m0.8417[0m        0.2216       0.9081        0.3909        11.8566
     15   [36m0.3317[0m   0.8380        0.2218       0.9057        0.4579        11.3943
     16   0.3315   0.8407        [35m0.2187[0m       0.9081        0.5156        11.4540
     17   0.3196   0.8361        0.2196       0.9057        0.7506        11.4347
Stopping since valid_loss has not improved in the last 10 epochs.
[32m[I 2023-05-02 12:36:36,363][0m Trial 124 finished with value: 0.24742402787688567 and parameters: {'lr': 0.0011068350231987717, 'dropout': 0.29969723347618127, 'd_model_multiplier': 1, 'num_layers': 2, 'n_heads': 32, 'dim_feedforward': 405, 'batch_size': 18, 'pos_encoding': 'learnable', 'activation': 'gelu', 'norm': 'BatchNorm', 'optimizer_name': 'PlainRAdam', 'weight_decay': 0, 'top_n_features': 127}. Best is trial 117 with value: 0.191397856754288.[0m
[FileBasedDataset] Initializing dataset...
	Examples: 8264
	Features: 142
	Max length: 315
Standard scalar turned ON, loading params from cache
[FileBasedDataset] Dataset initialization complete
  epoch    auprc    auroc    train_loss    valid_acc    valid_loss    cp      dur
-------  -------  -------  ------------  -----------  ------------  ----  -------
      1   [36m0.2568[0m   [32m0.7522[0m        [35m0.3260[0m       [31m0.9178[0m        [94m0.2591[0m     +  13.8764
      2   [36m0.2716[0m   [32m0.7849[0m        [35m0.2555[0m       0.9154        [94m0.2447[0m     +  14.0411
      3   [36m0.2792[0m   [32m0.7897[0m        [35m0.2477[0m       0.9166        [94m0.2434[0m     +  14.0653
      4   [36m0.3266[0m   [32m0.8042[0m        [35m0.2448[0m       [31m0.9214[0m        [94m0.2367[0m     +  14.0359
      5   0.2992   0.7985        [35m0.2396[0m       0.9129        0.2459        14.0350
      6   0.3134   0.7722        [35m0.2374[0m       0.9166        0.2475        14.0332
      7   [36m0.3336[0m   0.7872        [35m0.2348[0m       0.9190        0.2405        14.0976
      8   0.3302   0.7939        [35m0.2341[0m       0.9154        0.2372        13.9892
      9   0.3082   [32m0.8049[0m        [35m0.2298[0m       0.9117        [94m0.2360[0m     +  13.8206
     10   [36m0.3378[0m   [32m0.8070[0m        [35m0.2243[0m       0.9154        [94m0.2341[0m     +  13.9289
     11   0.2959   0.7949        0.2266       0.9117        0.2471        14.1480
     12   0.3233   0.8023        [35m0.2217[0m       0.9154        0.2376        14.0974
     13   [36m0.3418[0m   0.8015        [35m0.2201[0m       0.9166        0.2384        13.9740
     14   0.3279   [32m0.8103[0m        [35m0.2159[0m       0.9141        0.2380        13.9367
     15   0.3127   0.7990        [35m0.2145[0m       0.9105        0.2413        13.6888
     16   0.2962   0.7879        [35m0.2141[0m       0.9141        0.2454        14.0306
     17   0.2916   0.7824        [35m0.2099[0m       0.9141        0.2543        13.7952
     18   0.2974   0.7777        0.2104       0.9129        0.2588        13.8897
     19   0.2810   0.7809        [35m0.2067[0m       0.9129        0.2563        13.9664
Stopping since valid_loss has not improved in the last 10 epochs.
[32m[I 2023-05-02 12:41:16,293][0m Trial 125 finished with value: 0.2341121744450087 and parameters: {'lr': 0.00037924058627114034, 'dropout': 0.3289496742984887, 'd_model_multiplier': 1, 'num_layers': 3, 'n_heads': 32, 'dim_feedforward': 411, 'batch_size': 27, 'pos_encoding': 'learnable', 'activation': 'gelu', 'norm': 'BatchNorm', 'optimizer_name': 'PlainRAdam', 'weight_decay': 0, 'top_n_features': 142}. Best is trial 117 with value: 0.191397856754288.[0m
[FileBasedDataset] Initializing dataset...
	Examples: 8264
	Features: 135
	Max length: 315
Standard scalar turned ON, loading params from cache
[FileBasedDataset] Dataset initialization complete
  epoch    auprc    auroc    train_loss    valid_acc    valid_loss    cp      dur
-------  -------  -------  ------------  -----------  ------------  ----  -------
      1   [36m0.2238[0m   [32m0.7615[0m        [35m0.3187[0m       [31m0.9081[0m        [94m0.2805[0m     +  13.4671
      2   [36m0.2526[0m   [32m0.7804[0m        [35m0.2500[0m       [31m0.9166[0m        [94m0.2520[0m     +  13.6851
      3   0.2472   0.7795        [35m0.2418[0m       0.9129        [94m0.2517[0m     +  13.7514
      4   0.2493   0.7673        [35m0.2407[0m       [31m0.9178[0m        0.2548        13.7769
      5   [36m0.2812[0m   0.7751        [35m0.2353[0m       0.9166        [94m0.2450[0m     +  13.8058
      6   0.2789   [32m0.7909[0m        [35m0.2339[0m       0.9178        0.2454        13.8214
      7   0.2769   0.7735        [35m0.2297[0m       0.9166        0.2454        13.8966
      8   0.2712   0.7716        0.2320       [31m0.9190[0m        [94m0.2435[0m     +  13.9925
      9   [36m0.2868[0m   0.7728        [35m0.2246[0m       0.9154        [94m0.2425[0m     +  13.9850
     10   [36m0.2982[0m   [32m0.7942[0m        0.2250       [31m0.9202[0m        0.2452        13.7478
     11   0.2938   0.7681        [35m0.2216[0m       0.9202        0.2450        13.9808
     12   0.2699   0.7742        0.2223       0.9190        0.2440        13.7976
     13   0.2898   0.7739        [35m0.2201[0m       0.9178        0.2448        13.8797
     14   0.2859   0.7808        [35m0.2167[0m       0.9154        0.2498        13.7130
     15   [36m0.3086[0m   0.7860        0.2196       [31m0.9226[0m        [94m0.2411[0m     +  13.6826
     16   [36m0.3171[0m   [32m0.7946[0m        [35m0.2158[0m       0.9214        [94m0.2390[0m     +  13.5536
     17   0.3130   0.7913        0.2164       0.9202        0.2398        13.8235
     18   0.3090   0.7816        [35m0.2133[0m       0.9093        0.2475        13.8728
     19   0.2809   0.7839        [35m0.2120[0m       0.8839        0.2719        14.0863
     20   0.3061   0.7655        0.2123       0.9069        0.2575        13.9786
     21   0.3012   0.7741        [35m0.2119[0m       0.8996        0.2638        13.7257
     22   0.2988   0.7635        [35m0.2083[0m       0.9202        0.2507        13.7648
     23   0.2960   0.7728        0.2161       0.9202        0.2544        13.7652
     24   0.2923   0.7741        0.2140       0.9178        0.2620        13.9143
     25   0.2939   0.7776        0.2106       0.9178        0.2453        13.9036
Stopping since valid_loss has not improved in the last 10 epochs.
[32m[I 2023-05-02 12:47:16,215][0m Trial 126 finished with value: 0.23895787498142296 and parameters: {'lr': 0.0009126895304410177, 'dropout': 0.3679526930480695, 'd_model_multiplier': 1, 'num_layers': 3, 'n_heads': 32, 'dim_feedforward': 389, 'batch_size': 39, 'pos_encoding': 'learnable', 'activation': 'gelu', 'norm': 'BatchNorm', 'optimizer_name': 'PlainRAdam', 'weight_decay': 0, 'top_n_features': 135}. Best is trial 117 with value: 0.191397856754288.[0m
[FileBasedDataset] Initializing dataset...
	Examples: 8264
	Features: 148
	Max length: 315
Standard scalar turned ON, loading params from cache
[FileBasedDataset] Dataset initialization complete
  epoch    auprc    auroc    train_loss    valid_acc    valid_loss    cp     dur
-------  -------  -------  ------------  -----------  ------------  ----  ------
      1   [36m0.2156[0m   [32m0.7328[0m        [35m0.2764[0m       [31m0.9117[0m        [94m0.2704[0m     +  8.9147
      2   [36m0.2458[0m   0.7288        [35m0.2527[0m       0.9081        [94m0.2675[0m     +  9.3360
      3   [36m0.2615[0m   [32m0.7419[0m        [35m0.2465[0m       0.9117        0.2691        8.9665
      4   0.2355   0.7172        0.2493       0.9105        0.2679        8.9325
      5   0.2400   0.7072        [35m0.2420[0m       0.9117        0.2848        9.2965
      6   [36m0.3013[0m   0.7237        [35m0.2406[0m       [31m0.9190[0m        0.2845        9.4286
      7   0.2292   0.6996        [35m0.2384[0m       0.9129        0.2739        9.3215
      8   [36m0.3103[0m   [32m0.7943[0m        [35m0.2325[0m       0.9178        [94m0.2590[0m     +  9.2968
      9   0.2700   0.7512        [35m0.2316[0m       0.9081        0.2696        8.9835
     10   0.2931   0.7615        [35m0.2294[0m       0.9117        0.2615        9.2538
     11   [36m0.3188[0m   [32m0.8002[0m        [35m0.2281[0m       0.9154        [94m0.2505[0m     +  9.3082
     12   [36m0.3239[0m   0.7821        0.2294       0.9166        0.2559        9.0690
     13   0.2961   0.7649        0.2295       0.9117        0.2604        9.3715
     14   0.3154   0.7917        0.2287       0.9081        0.2613        9.3551
     15   [36m0.3301[0m   0.7903        [35m0.2250[0m       [31m0.9202[0m        0.2551        9.5018
     16   0.3085   0.7854        0.2270       0.9154        0.2520        9.3654
     17   0.3180   0.7863        [35m0.2248[0m       0.9021        0.2580        9.2264
     18   0.2826   0.7518        0.2260       0.9129        0.2658        9.1474
     19   0.2603   0.7418        [35m0.2226[0m       0.9154        0.2748        9.4929
     20   0.3262   0.7933        [35m0.2212[0m       0.9166        0.2517        9.4459
Stopping since valid_loss has not improved in the last 10 epochs.
[32m[I 2023-05-02 12:50:30,889][0m Trial 127 finished with value: 0.25049476367855017 and parameters: {'lr': 0.0015804165613920542, 'dropout': 0.29527807112745735, 'd_model_multiplier': 1, 'num_layers': 1, 'n_heads': 32, 'dim_feedforward': 422, 'batch_size': 33, 'pos_encoding': 'learnable', 'activation': 'gelu', 'norm': 'BatchNorm', 'optimizer_name': 'PlainRAdam', 'weight_decay': 0, 'top_n_features': 148}. Best is trial 117 with value: 0.191397856754288.[0m
[FileBasedDataset] Initializing dataset...
	Examples: 8264
	Features: 151
	Max length: 315
Standard scalar turned ON, loading params from cache
[FileBasedDataset] Dataset initialization complete
  epoch    auprc    auroc    train_loss    valid_acc    valid_loss    cp      dur
-------  -------  -------  ------------  -----------  ------------  ----  -------
      1   [36m0.3090[0m   [32m0.7988[0m        [35m0.2794[0m       [31m0.9238[0m        [94m0.3026[0m     +  11.0678
      2   [36m0.3701[0m   [32m0.8397[0m        [35m0.2699[0m       [31m0.9250[0m        [94m0.2359[0m     +  11.2258
      3   0.3483   [32m0.8548[0m        [35m0.2563[0m       0.9202        [94m0.2207[0m     +  11.2033
      4   0.3382   0.8455        [35m0.2545[0m       0.9214        [94m0.2168[0m     +  11.1605
      5   0.3572   0.8415        [35m0.2480[0m       0.9093        0.2314        11.1721
      6   0.3581   0.8413        [35m0.2465[0m       0.9166        0.2284        11.3118
      7   0.3488   0.8363        [35m0.2457[0m       0.9202        0.2211        11.0846
      8   0.3461   0.8409        [35m0.2419[0m       0.9214        0.2200        11.0090
      9   0.3532   0.8493        0.2452       0.9190        0.2205        11.0472
     10   0.3590   0.8462        [35m0.2411[0m       0.9190        0.2270        11.2573
     11   [36m0.3889[0m   0.8460        0.2417       0.9166        0.2195        11.1908
     12   0.3860   0.8495        [35m0.2392[0m       0.9202        0.2169        11.2747
     13   0.3240   0.8466        0.2419       0.9202        0.2255        11.0983
Stopping since valid_loss has not improved in the last 10 epochs.
[32m[I 2023-05-02 12:53:07,575][0m Trial 128 finished with value: 0.2168140946251161 and parameters: {'lr': 0.003068203851564654, 'dropout': 0.3788934763752146, 'd_model_multiplier': 1, 'num_layers': 2, 'n_heads': 32, 'dim_feedforward': 444, 'batch_size': 22, 'pos_encoding': 'learnable', 'activation': 'gelu', 'norm': 'BatchNorm', 'optimizer_name': 'PlainRAdam', 'weight_decay': 0, 'top_n_features': 151}. Best is trial 117 with value: 0.191397856754288.[0m
[FileBasedDataset] Initializing dataset...
	Examples: 8264
	Features: 112
	Max length: 315
Standard scalar turned ON, loading params from cache
[FileBasedDataset] Dataset initialization complete
  epoch    auprc    auroc    train_loss    valid_acc    valid_loss    cp      dur
-------  -------  -------  ------------  -----------  ------------  ----  -------
      1   [36m0.2667[0m   [32m0.7851[0m        [35m0.2684[0m       [31m0.9274[0m        [94m0.2235[0m     +  11.2578
      2   [36m0.2843[0m   [32m0.7897[0m        [35m0.2485[0m       0.9262        [94m0.2206[0m     +  11.4367
      3   [36m0.3203[0m   [32m0.7982[0m        [35m0.2440[0m       [31m0.9287[0m        [94m0.2174[0m     +  11.3986
      4   [36m0.3380[0m   [32m0.7992[0m        [35m0.2375[0m       [31m0.9359[0m        0.2236        11.4401
      5   [36m0.3383[0m   [32m0.8086[0m        [35m0.2362[0m       0.9299        0.2231        11.5866
      6   0.2846   0.7979        [35m0.2343[0m       0.9238        0.2261        11.4520
      7   0.2890   0.7957        [35m0.2329[0m       0.9262        0.2282        11.2676
      8   0.2865   0.7882        [35m0.2324[0m       0.9166        0.2486        11.6367
      9   0.2964   0.8079        [35m0.2316[0m       0.9299        0.2267        11.5859
     10   0.2716   0.7851        0.2319       0.9238        0.2470        11.4700
     11   0.2668   0.7824        [35m0.2294[0m       0.9154        0.2546        11.4675
     12   0.2801   0.7975        0.2306       0.9202        0.2567        11.5149
Stopping since valid_loss has not improved in the last 10 epochs.
[32m[I 2023-05-02 12:55:37,289][0m Trial 129 finished with value: 0.21735880580903036 and parameters: {'lr': 0.0006853213937095384, 'dropout': 0.4106621225402725, 'd_model_multiplier': 1, 'num_layers': 2, 'n_heads': 32, 'dim_feedforward': 452, 'batch_size': 13, 'pos_encoding': 'learnable', 'activation': 'relu', 'norm': 'LayerNorm', 'optimizer_name': 'AdamW', 'weight_decay': 0, 'top_n_features': 112}. Best is trial 117 with value: 0.191397856754288.[0m
[FileBasedDataset] Initializing dataset...
	Examples: 8264
	Features: 143
	Max length: 315
Standard scalar turned ON, loading params from cache
[FileBasedDataset] Dataset initialization complete
  epoch    auprc    auroc    train_loss    valid_acc    valid_loss    cp      dur
-------  -------  -------  ------------  -----------  ------------  ----  -------
      1   [36m0.1837[0m   [32m0.6833[0m        [35m0.3232[0m       [31m0.9287[0m        [94m0.2378[0m     +  10.9908
      2   [36m0.2275[0m   [32m0.6939[0m        [35m0.2779[0m       0.9274        [94m0.2344[0m     +  10.8510
      3   0.2169   0.6625        [35m0.2682[0m       0.9274        0.2427        10.4580
      4   [36m0.2381[0m   0.6556        [35m0.2659[0m       [31m0.9299[0m        0.2446        10.4623
      5   0.2300   0.6774        [35m0.2606[0m       0.9287        0.2402        10.6015
      6   0.2159   0.6588        [35m0.2591[0m       [31m0.9311[0m        0.2453        10.3989
      7   0.2344   0.6807        [35m0.2546[0m       0.9274        0.2438        10.5508
      8   [36m0.2393[0m   0.6525        [35m0.2516[0m       0.9274        0.2522        10.4177
      9   0.2354   0.6687        0.2548       0.9274        0.2458        10.7509
     10   [36m0.2423[0m   0.6828        [35m0.2475[0m       0.9311        0.2485        10.8816
     11   0.2253   0.6624        [35m0.2446[0m       0.9311        0.2488        10.9609
Stopping since valid_loss has not improved in the last 10 epochs.
