[32m[I 2023-05-02 21:21:42,891][0m Trial 213 finished with value: 0.22391220927238464 and parameters: {'lr': 0.000822865536250981, 'dropout': 0.4526375206830447, 'd_model_multiplier': 4, 'num_layers': 4, 'n_heads': 32, 'dim_feedforward': 204, 'batch_size': 90, 'pos_encoding': 'fixed', 'activation': 'relu', 'norm': 'LayerNorm', 'optimizer_name': 'AdamW', 'weight_decay': 0.1, 'top_n_features': 46}. Best is trial 117 with value: 0.191397856754288.[0m
[FileBasedDataset] Initializing dataset...
	Examples: 8264
	Features: 53
	Max length: 315
Standard scalar turned ON, loading params from cache
[FileBasedDataset] Dataset initialization complete
  epoch    auprc    auroc    train_loss    valid_acc    valid_loss    cp      dur
-------  -------  -------  ------------  -----------  ------------  ----  -------
      1   [36m0.2595[0m   [32m0.7090[0m        [35m0.2656[0m       [31m0.9141[0m        [94m0.3169[0m     +  19.6367
      2   0.2381   [32m0.7207[0m        [35m0.2355[0m       0.9117        0.3388        19.9180
      3   0.2486   [32m0.7224[0m        [35m0.2335[0m       0.9129        0.3274        19.8473
      4   0.2429   [32m0.7268[0m        [35m0.2273[0m       0.9129        0.3320        20.0629
      5   0.2515   [32m0.7445[0m        0.2273       0.9129        0.3189        20.0054
      6   [36m0.2599[0m   [32m0.7452[0m        [35m0.2263[0m       0.9105        0.3286        19.9783
      7   0.2525   [32m0.7479[0m        [35m0.2256[0m       0.9117        0.3192        20.1066
      8   0.2479   0.7391        [35m0.2237[0m       0.9081        0.3271        20.0531
      9   0.2445   [32m0.7515[0m        [35m0.2225[0m       0.9117        [94m0.3168[0m     +  20.2250
     10   [36m0.2653[0m   0.7486        0.2227       0.9141        0.3356        20.2790
     11   [36m0.2769[0m   [32m0.7599[0m        [35m0.2175[0m       0.9141        [94m0.2990[0m     +  19.9643
     12   0.2709   0.7566        [35m0.2169[0m       [31m0.9154[0m        0.3117        19.9657
     13   0.2746   [32m0.7677[0m        0.2184       0.9154        0.3004        20.1804
     14   [36m0.2839[0m   0.7597        [35m0.2159[0m       0.9141        0.3106        20.2844
     15   0.2826   [32m0.7729[0m        [35m0.2151[0m       0.9105        [94m0.2926[0m     +  19.9895
     16   [36m0.2886[0m   0.7592        [35m0.2144[0m       0.9141        0.3177        19.9977
     17   0.2780   0.7682        [35m0.2124[0m       0.9105        0.3151        20.4167
     18   [36m0.3053[0m   [32m0.7814[0m        0.2146       [31m0.9178[0m        [94m0.2817[0m     +  19.9014
     19   0.2993   [32m0.7849[0m        0.2137       0.9105        0.2955        20.1408
     20   [36m0.3109[0m   [32m0.7875[0m        0.2126       0.9093        0.3054        20.0371
     21   0.3042   0.7831        0.2135       0.9093        0.2957        20.1189
     22   0.3074   [32m0.7894[0m        0.2127       0.9093        0.3008        20.2716
     23   0.3077   [32m0.7899[0m        0.2128       0.9141        0.2895        19.9111
     24   [36m0.3209[0m   0.7847        0.2159       0.9129        0.3020        19.9435
     25   0.2995   0.7795        [35m0.2090[0m       0.9105        0.3234        19.9805
     26   0.3055   0.7670        0.2102       0.9178        0.3240        20.0758
     27   0.3044   0.7801        [35m0.2081[0m       0.9117        0.3255        20.1425
Stopping since valid_loss has not improved in the last 10 epochs.
[32m[I 2023-05-02 21:31:05,035][0m Trial 214 finished with value: 0.2816870144806001 and parameters: {'lr': 0.0004892629990425124, 'dropout': 0.46803238903995387, 'd_model_multiplier': 4, 'num_layers': 4, 'n_heads': 32, 'dim_feedforward': 219, 'batch_size': 74, 'pos_encoding': 'fixed', 'activation': 'relu', 'norm': 'LayerNorm', 'optimizer_name': 'AdamW', 'weight_decay': 0.1, 'top_n_features': 53}. Best is trial 117 with value: 0.191397856754288.[0m
[FileBasedDataset] Initializing dataset...
	Examples: 8264
	Features: 43
	Max length: 315
Standard scalar turned ON, loading params from cache
[FileBasedDataset] Dataset initialization complete
  epoch    auprc    auroc    train_loss    valid_acc    valid_loss    cp      dur
-------  -------  -------  ------------  -----------  ------------  ----  -------
      1   [36m0.1884[0m   [32m0.7828[0m        [35m0.2719[0m       [31m0.8960[0m        [94m0.2448[0m     +  21.3163
      2   [36m0.2168[0m   [32m0.7887[0m        [35m0.2414[0m       [31m0.9154[0m        [94m0.2367[0m     +  21.7758
      3   0.2078   [32m0.7919[0m        [35m0.2385[0m       [31m0.9190[0m        [94m0.2292[0m     +  21.5473
      4   0.2114   [32m0.7971[0m        [35m0.2352[0m       0.9190        [94m0.2289[0m     +  21.8890
      5   0.1998   0.7891        [35m0.2328[0m       0.9154        0.2325        21.6305
      6   0.1903   0.7814        [35m0.2326[0m       0.9154        0.2353        21.7438
      7   0.2107   [32m0.8045[0m        0.2335       0.9154        0.2332        21.9177
      8   [36m0.2171[0m   0.7978        [35m0.2284[0m       0.9057        0.2359        22.2988
      9   [36m0.2262[0m   0.7965        [35m0.2270[0m       0.9154        [94m0.2271[0m     +  21.9574
     10   0.2171   [32m0.8101[0m        [35m0.2226[0m       0.9129        0.2274        21.7182
     11   0.2165   0.7989        0.2241       0.9129        0.2327        21.9990
     12   [36m0.2288[0m   [32m0.8119[0m        0.2233       0.9117        0.2278        22.1631
     13   0.2271   0.8030        0.2236       0.9117        0.2338        22.2448
     14   0.2181   0.8083        0.2249       0.9057        0.2344        21.8592
     15   0.2269   [32m0.8260[0m        0.2275       0.9141        0.2321        22.1690
     16   [36m0.2324[0m   0.8177        [35m0.2205[0m       0.9141        0.2296        22.0983
     17   [36m0.2468[0m   0.8222        0.2215       0.9129        0.2328        21.9288
     18   0.2444   0.8241        0.2212       0.9129        [94m0.2229[0m     +  22.1006
     19   0.2354   [32m0.8339[0m        [35m0.2188[0m       0.9166        [94m0.2219[0m     +  22.3586
     20   0.2319   0.8258        [35m0.2178[0m       0.9129        0.2223        21.9177
     21   [36m0.2544[0m   0.8282        0.2183       0.9105        0.2328        22.1734
     22   0.2439   0.8338        [35m0.2162[0m       0.9105        0.2296        22.0446
     23   0.2416   0.8307        [35m0.2136[0m       0.9166        0.2261        22.0167
     24   0.2394   0.8332        0.2144       0.9141        0.2295        21.9335
     25   0.2475   0.8297        0.2172       0.9129        0.2266        21.9077
     26   0.2355   0.8337        0.2150       0.9141        0.2262        21.8745
     27   0.2338   0.8143        0.2170       0.9105        0.2411        22.0680
     28   0.2309   0.8211        0.2153       0.9105        0.2313        21.8947
Stopping since valid_loss has not improved in the last 10 epochs.
[32m[I 2023-05-02 21:41:42,190][0m Trial 215 finished with value: 0.22191024723912092 and parameters: {'lr': 0.000904139466386563, 'dropout': 0.43068552570121166, 'd_model_multiplier': 4, 'num_layers': 4, 'n_heads': 32, 'dim_feedforward': 233, 'batch_size': 146, 'pos_encoding': 'fixed', 'activation': 'relu', 'norm': 'LayerNorm', 'optimizer_name': 'AdamW', 'weight_decay': 0.1, 'top_n_features': 43}. Best is trial 117 with value: 0.191397856754288.[0m
[FileBasedDataset] Initializing dataset...
	Examples: 8264
	Features: 34
	Max length: 315
Standard scalar turned ON, loading params from cache
[FileBasedDataset] Dataset initialization complete
  epoch    auprc    auroc    train_loss    valid_acc    valid_loss    cp      dur
-------  -------  -------  ------------  -----------  ------------  ----  -------
      1   [36m0.2526[0m   [32m0.7313[0m        [35m0.2660[0m       [31m0.9202[0m        [94m0.2611[0m     +  23.1974
      2   [36m0.3175[0m   [32m0.7552[0m        [35m0.2468[0m       0.9178        [94m0.2421[0m     +  23.8328
      3   [36m0.3304[0m   [32m0.7679[0m        [35m0.2418[0m       0.9190        [94m0.2414[0m     +  23.8404
      4   0.3236   [32m0.7790[0m        [35m0.2381[0m       0.9202        [94m0.2359[0m     +  23.7283
      5   0.3100   0.7750        [35m0.2368[0m       0.9190        0.2472        23.8362
      6   0.3240   0.7751        [35m0.2318[0m       0.9190        [94m0.2346[0m     +  23.5115
      7   0.3146   0.7764        [35m0.2313[0m       0.9202        0.2370        23.8096
      8   [36m0.3381[0m   [32m0.7865[0m        [35m0.2298[0m       0.9202        0.2365        23.4910
      9   [36m0.3436[0m   [32m0.7879[0m        [35m0.2285[0m       [31m0.9226[0m        0.2347        23.6069
     10   0.3399   0.7813        [35m0.2284[0m       0.9202        0.2383        23.5898
     11   0.3079   0.7808        0.2285       0.9190        0.2382        23.7113
     12   [36m0.3453[0m   0.7818        [35m0.2259[0m       [31m0.9238[0m        0.2361        23.4014
     13   0.3450   0.7702        0.2269       0.9226        0.2356        23.5830
     14   0.2864   0.7746        0.2283       0.9202        0.2403        23.3414
     15   [36m0.3499[0m   0.7860        [35m0.2232[0m       0.9202        0.2348        23.5027
Stopping since valid_loss has not improved in the last 10 epochs.
[32m[I 2023-05-02 21:48:00,546][0m Trial 216 finished with value: 0.23457465110912 and parameters: {'lr': 0.0005829061826180158, 'dropout': 0.46100556136276055, 'd_model_multiplier': 4, 'num_layers': 5, 'n_heads': 32, 'dim_feedforward': 219, 'batch_size': 70, 'pos_encoding': 'fixed', 'activation': 'relu', 'norm': 'LayerNorm', 'optimizer_name': 'AdamW', 'weight_decay': 0.1, 'top_n_features': 34}. Best is trial 117 with value: 0.191397856754288.[0m
[FileBasedDataset] Initializing dataset...
	Examples: 8264
	Features: 55
	Max length: 315
Standard scalar turned ON, loading params from cache
[FileBasedDataset] Dataset initialization complete
  epoch    auprc    auroc    train_loss    valid_acc    valid_loss    cp      dur
-------  -------  -------  ------------  -----------  ------------  ----  -------
      1   [36m0.2490[0m   [32m0.7395[0m        [35m0.2799[0m       [31m0.9069[0m        [94m0.2701[0m     +  19.5739
      2   [36m0.2839[0m   [32m0.8029[0m        [35m0.2554[0m       [31m0.9105[0m        [94m0.2674[0m     +  19.9685
      3   0.2713   0.7937        [35m0.2485[0m       0.9093        [94m0.2546[0m     +  19.7595
      4   0.2713   0.7804        [35m0.2466[0m       0.9105        0.2659        19.7174
      5   0.2363   0.7297        0.2515       0.9093        0.2768        20.1837
      6   0.2292   0.7352        0.2542       0.9093        0.2700        20.2727
      7   0.2384   0.7311        0.2522       0.9069        0.2782        19.7891
      8   0.2335   0.7329        0.2520       0.9093        0.2843        19.8084
      9   0.2366   0.7308        0.2512       0.9069        0.2770        19.9953
     10   0.2296   0.7309        0.2528       0.9105        0.2861        19.8382
     11   0.2258   0.7319        0.2494       0.9093        0.2823        19.8572
     12   0.2538   0.7798        0.2501       0.9069        0.2754        19.9308
Stopping since valid_loss has not improved in the last 10 epochs.
[32m[I 2023-05-02 21:52:19,483][0m Trial 217 finished with value: 0.2545783437220909 and parameters: {'lr': 0.0014358561251839148, 'dropout': 0.44231160865813673, 'd_model_multiplier': 4, 'num_layers': 4, 'n_heads': 32, 'dim_feedforward': 238, 'batch_size': 56, 'pos_encoding': 'fixed', 'activation': 'relu', 'norm': 'LayerNorm', 'optimizer_name': 'AdamW', 'weight_decay': 0.1, 'top_n_features': 55}. Best is trial 117 with value: 0.191397856754288.[0m
[FileBasedDataset] Initializing dataset...
	Examples: 8264
	Features: 30
	Max length: 315
Standard scalar turned ON, loading params from cache
[FileBasedDataset] Dataset initialization complete
  epoch    auprc    auroc    train_loss    valid_acc    valid_loss    cp      dur
-------  -------  -------  ------------  -----------  ------------  ----  -------
      1   [36m0.1570[0m   [32m0.7058[0m        [35m0.2825[0m       [31m0.9311[0m        [94m0.2403[0m     +  23.6556
      2   [36m0.1726[0m   [32m0.7208[0m        [35m0.2645[0m       0.9311        0.2463        23.3427
      3   [36m0.2255[0m   [32m0.7211[0m        [35m0.2588[0m       0.9311        [94m0.2362[0m     +  23.6324
      4   0.1892   0.7194        [35m0.2545[0m       0.9311        0.2392        23.7147
      5   0.2009   [32m0.7264[0m        0.2552       0.9311        0.2365        23.5462
      6   [36m0.2422[0m   [32m0.7274[0m        [35m0.2544[0m       [31m0.9323[0m        0.2379        23.3802
      7   0.2212   0.7256        [35m0.2529[0m       0.9311        0.2377        23.4305
      8   0.2114   0.7249        [35m0.2523[0m       0.9323        0.2389        23.5702
      9   0.2172   0.7246        0.2531       0.9311        0.2378        23.3109
     10   0.1975   0.7239        0.2533       0.9311        0.2381        23.3379
     11   0.1967   0.7258        0.2523       0.9311        0.2374        23.5228
     12   0.2074   [32m0.7297[0m        [35m0.2523[0m       0.9311        0.2378        23.4349
Stopping since valid_loss has not improved in the last 10 epochs.
[32m[I 2023-05-02 21:57:25,273][0m Trial 218 finished with value: 0.23617248963271836 and parameters: {'lr': 0.0010897223924425702, 'dropout': 0.40599224355632485, 'd_model_multiplier': 4, 'num_layers': 5, 'n_heads': 32, 'dim_feedforward': 216, 'batch_size': 66, 'pos_encoding': 'learnable', 'activation': 'relu', 'norm': 'LayerNorm', 'optimizer_name': 'AdamW', 'weight_decay': 0.1, 'top_n_features': 30}. Best is trial 117 with value: 0.191397856754288.[0m
[FileBasedDataset] Initializing dataset...
	Examples: 8264
	Features: 41
	Max length: 315
Standard scalar turned ON, loading params from cache
[FileBasedDataset] Dataset initialization complete
  epoch    auprc    auroc    train_loss    valid_acc    valid_loss    cp      dur
-------  -------  -------  ------------  -----------  ------------  ----  -------
      1   [36m0.2008[0m   [32m0.7310[0m        [35m0.3118[0m       [31m0.9238[0m        [94m0.2465[0m     +  19.5412
      2   [36m0.2023[0m   0.7202        [35m0.2722[0m       [31m0.9335[0m        0.2700        19.7803
      3   0.1984   0.7174        [35m0.2617[0m       0.9335        0.2797        19.7044
      4   0.1991   0.7157        [35m0.2604[0m       0.9335        0.2779        19.8826
      5   0.2001   0.7240        [35m0.2597[0m       [31m0.9347[0m        0.2655        19.6695
      6   0.1994   0.7277        [35m0.2584[0m       0.9335        0.2699        19.9391
      7   [36m0.2045[0m   0.7227        0.2586       0.9335        0.2674        19.7634
      8   0.2022   0.7198        [35m0.2578[0m       0.9335        0.2685        20.0159
      9   0.2031   [32m0.7362[0m        0.2588       0.9335        0.2529        19.8813
     10   [36m0.2049[0m   0.7342        0.2582       0.9347        0.2476        19.8504
     11   0.2036   [32m0.7377[0m        [35m0.2569[0m       0.9347        [94m0.2346[0m     +  19.9590
     12   0.2019   0.7350        0.2580       0.9335        0.2352        19.8421
     13   [36m0.2103[0m   [32m0.7561[0m        [35m0.2563[0m       0.9335        0.2365        19.9877
     14   0.2023   0.7327        0.2568       0.9335        [94m0.2309[0m     +  19.7091
     15   0.2016   0.7388        [35m0.2563[0m       0.9335        [94m0.2254[0m     +  19.6899
     16   0.1938   0.7348        0.2565       0.9335        [94m0.2239[0m     +  19.7413
     17   0.1931   0.7336        [35m0.2553[0m       0.9335        [94m0.2226[0m     +  19.9134
     18   0.1982   0.7393        0.2553       0.9335        [94m0.2201[0m     +  19.6145
     19   0.2032   0.7385        0.2558       [31m0.9359[0m        0.2208        19.8645
     20   0.1991   0.7340        [35m0.2545[0m       0.9335        0.2208        19.7602
     21   0.2026   0.7382        0.2561       0.9359        0.2219        19.7632
     22   0.2017   0.7349        0.2556       0.9359        0.2209        19.7272
     23   0.2030   0.7385        0.2557       0.9347        0.2263        19.9229
     24   0.2015   0.7306        0.2552       0.9335        0.2220        19.6439
     25   0.2017   0.7387        0.2553       0.9347        0.2278        19.7892
     26   0.2034   0.7382        [35m0.2539[0m       0.9335        0.2232        19.9266
     27   0.2045   0.7448        0.2541       0.9335        0.2221        19.7058
Stopping since valid_loss has not improved in the last 10 epochs.
[32m[I 2023-05-02 22:06:40,634][0m Trial 219 finished with value: 0.22012465294932512 and parameters: {'lr': 0.002205244274796743, 'dropout': 0.48591025464914145, 'd_model_multiplier': 4, 'num_layers': 4, 'n_heads': 32, 'dim_feedforward': 236, 'batch_size': 52, 'pos_encoding': 'fixed', 'activation': 'relu', 'norm': 'LayerNorm', 'optimizer_name': 'AdamW', 'weight_decay': 0.1, 'top_n_features': 41}. Best is trial 117 with value: 0.191397856754288.[0m
[FileBasedDataset] Initializing dataset...
	Examples: 8264
	Features: 219
	Max length: 315
Standard scalar turned ON, loading params from cache
[FileBasedDataset] Dataset initialization complete
  epoch    auprc    auroc    train_loss    valid_acc    valid_loss    cp      dur
-------  -------  -------  ------------  -----------  ------------  ----  -------
      1   [36m0.1639[0m   [32m0.7345[0m        [35m0.2648[0m       [31m0.9166[0m        [94m0.2356[0m     +  10.9909
      2   [36m0.1862[0m   [32m0.7449[0m        [35m0.2527[0m       [31m0.9190[0m        [94m0.2340[0m     +  10.9298
      3   [36m0.1937[0m   [32m0.7481[0m        [35m0.2480[0m       0.9117        0.2345        11.0301
      4   [36m0.1972[0m   [32m0.7546[0m        [35m0.2460[0m       0.9045        0.2492        11.0791
      5   [36m0.2066[0m   [32m0.7554[0m        [35m0.2423[0m       0.9154        0.2370        11.2160
      6   [36m0.2273[0m   [32m0.7668[0m        [35m0.2404[0m       [31m0.9287[0m        [94m0.2268[0m     +  11.1387
      7   [36m0.2511[0m   [32m0.7735[0m        [35m0.2346[0m       0.9202        0.2280        11.2791
      8   [36m0.2587[0m   [32m0.7782[0m        [35m0.2346[0m       0.9178        [94m0.2249[0m     +  11.2064
      9   0.2573   [32m0.7857[0m        [35m0.2329[0m       0.9250        [94m0.2137[0m     +  11.3312
     10   0.2566   [32m0.7869[0m        [35m0.2320[0m       0.9081        0.2340        10.9947
     11   0.2493   0.7791        [35m0.2314[0m       0.9141        0.2292        10.9800
     12   0.2535   [32m0.7895[0m        [35m0.2303[0m       0.9238        0.2221        11.3125
     13   [36m0.2597[0m   [32m0.7932[0m        0.2306       0.9190        0.2228        11.2643
     14   [36m0.2605[0m   0.7882        [35m0.2302[0m       0.9166        0.2286        11.2462
     15   [36m0.2717[0m   0.7923        [35m0.2280[0m       0.9202        0.2257        11.3851
     16   0.2429   0.7824        [35m0.2278[0m       0.9021        0.2642        11.0856
     17   0.2578   0.7910        [35m0.2272[0m       0.9057        0.2458        11.5304
     18   0.1870   0.7482        [35m0.2258[0m       0.8924        0.2743        11.3991
Stopping since valid_loss has not improved in the last 10 epochs.
[32m[I 2023-05-02 22:10:14,072][0m Trial 220 finished with value: 0.21372676134433827 and parameters: {'lr': 0.0005253114968894962, 'dropout': 0.47185208818076413, 'd_model_multiplier': 4, 'num_layers': 3, 'n_heads': 8, 'dim_feedforward': 328, 'batch_size': 14, 'pos_encoding': 'fixed', 'activation': 'relu', 'norm': 'LayerNorm', 'optimizer_name': 'AdamW', 'weight_decay': 0.1, 'top_n_features': 219}. Best is trial 117 with value: 0.191397856754288.[0m
[FileBasedDataset] Initializing dataset...
	Examples: 8264
	Features: 219
	Max length: 315
Standard scalar turned ON, loading params from cache
[FileBasedDataset] Dataset initialization complete
  epoch    auprc    auroc    train_loss    valid_acc    valid_loss    cp      dur
-------  -------  -------  ------------  -----------  ------------  ----  -------
      1   [36m0.2335[0m   [32m0.7515[0m        [35m0.2658[0m       [31m0.9262[0m        [94m0.2462[0m     +  11.4862
      2   0.2057   0.6875        [35m0.2513[0m       0.9250        0.2961        11.6413
      3   [36m0.2776[0m   [32m0.7810[0m        [35m0.2490[0m       0.9250        0.2532        11.4819
      4   0.2678   0.7790        [35m0.2448[0m       0.9214        0.2487        11.6492
      5   [36m0.2815[0m   [32m0.7952[0m        [35m0.2398[0m       0.9238        0.2500        11.6105
      6   0.2625   0.7925        [35m0.2389[0m       0.9238        0.2488        11.6467
      7   0.2771   [32m0.7973[0m        [35m0.2359[0m       0.9238        0.2561        11.5720
      8   0.2765   [32m0.8039[0m        [35m0.2338[0m       0.9226        0.2590        11.4236
      9   0.2712   [32m0.8107[0m        [35m0.2320[0m       0.9238        0.2485        11.4679
     10   0.2670   0.7893        0.2321       0.9202        0.2860        11.4932
Stopping since valid_loss has not improved in the last 10 epochs.
