[32m[I 2023-05-05 11:19:10,057][0m Trial 604 finished with value: 0.45164072491958324 and parameters: {'lr': 1.4833627284959717e-07, 'dropout': 0.5859311399157043, 'd_model_multiplier': 2, 'num_layers': 4, 'n_heads': 32, 'dim_feedforward': 348, 'batch_size': 50, 'pos_encoding': 'fixed', 'activation': 'relu', 'norm': 'LayerNorm', 'optimizer_name': 'RAdam', 'weight_decay': 0.1, 'top_n_features': 65}. Best is trial 246 with value: 0.16447311791139763.[0m
[FileBasedDataset] Initializing dataset...
	Examples: 8264
	Features: 49
	Max length: 315
Standard scalar turned ON, loading params from cache
[FileBasedDataset] Dataset initialization complete
Warning, assumed runtime error: CUDA out of memory. Tried to allocate 1.04 GiB (GPU 0; 23.70 GiB total capacity; 20.64 GiB already allocated; 133.25 MiB free; 22.48 GiB reserved in total by PyTorch) If reserved memory is >> allocated memory try setting max_split_size_mb to avoid fragmentation.  See documentation for Memory Management and PYTORCH_CUDA_ALLOC_CONF
[32m[I 2023-05-05 11:19:14,017][0m Trial 605 finished with value: 100.0 and parameters: {'lr': 1.183605190684293e-06, 'dropout': 0.4919704258894233, 'd_model_multiplier': 1, 'num_layers': 14, 'n_heads': 32, 'dim_feedforward': 322, 'batch_size': 88, 'pos_encoding': 'fixed', 'activation': 'relu', 'norm': 'LayerNorm', 'optimizer_name': 'RAdam', 'weight_decay': 0.1, 'top_n_features': 49}. Best is trial 246 with value: 0.16447311791139763.[0m
[FileBasedDataset] Initializing dataset...
	Examples: 8264
	Features: 159
	Max length: 315
Standard scalar turned ON, loading params from cache
[FileBasedDataset] Dataset initialization complete
  epoch    auprc    auroc    train_loss    valid_acc    valid_loss    cp      dur
-------  -------  -------  ------------  -----------  ------------  ----  -------
      1   [36m0.0815[0m   [32m0.3537[0m        [35m0.6412[0m       [31m0.9154[0m        [94m0.4857[0m     +  24.2498
      2   [36m0.1086[0m   [32m0.5009[0m        [35m0.4105[0m       0.9154        [94m0.3136[0m     +  24.3491
      3   [36m0.2268[0m   [32m0.6742[0m        [35m0.2940[0m       0.9154        [94m0.2730[0m     +  24.9752
      4   [36m0.2627[0m   [32m0.7008[0m        [35m0.2636[0m       0.9154        [94m0.2648[0m     +  24.6329
      5   [36m0.2787[0m   [32m0.7112[0m        [35m0.2527[0m       0.9154        [94m0.2624[0m     +  25.1427
      6   [36m0.2924[0m   [32m0.7221[0m        [35m0.2468[0m       0.9154        [94m0.2596[0m     +  24.9095
      7   [36m0.3017[0m   [32m0.7324[0m        [35m0.2434[0m       [31m0.9166[0m        [94m0.2578[0m     +  25.2043
      8   [36m0.3110[0m   [32m0.7386[0m        [35m0.2391[0m       0.9166        [94m0.2568[0m     +  25.3598
      9   [36m0.3188[0m   [32m0.7420[0m        0.2396       0.9166        [94m0.2567[0m     +  24.9402
     10   [36m0.3244[0m   [32m0.7429[0m        [35m0.2363[0m       0.9166        0.2581        25.3410
     11   [36m0.3284[0m   [32m0.7473[0m        [35m0.2349[0m       [31m0.9202[0m        [94m0.2545[0m     +  24.8762
     12   [36m0.3324[0m   [32m0.7479[0m        [35m0.2329[0m       0.9202        0.2557        25.0280
     13   [36m0.3383[0m   [32m0.7488[0m        [35m0.2327[0m       0.9190        0.2559        25.1534
     14   [36m0.3441[0m   [32m0.7494[0m        0.2333       0.9190        0.2565        24.8693
     15   [36m0.3442[0m   [32m0.7496[0m        [35m0.2305[0m       [31m0.9238[0m        0.2562        25.2240
     16   0.3434   [32m0.7496[0m        0.2320       [31m0.9250[0m        0.2556        25.0554
     17   [36m0.3472[0m   [32m0.7511[0m        [35m0.2294[0m       0.9226        0.2569        24.9868
     18   0.3414   [32m0.7521[0m        0.2301       0.9202        0.2578        24.8480
     19   0.3438   [32m0.7535[0m        [35m0.2279[0m       0.9214        0.2580        24.9997
     20   0.3429   [32m0.7539[0m        [35m0.2267[0m       0.9202        0.2587        24.8516
Stopping since valid_loss has not improved in the last 10 epochs.
[32m[I 2023-05-05 11:27:59,127][0m Trial 606 finished with value: 0.2544971544840604 and parameters: {'lr': 4.504849296111599e-05, 'dropout': 0.4452983009531783, 'd_model_multiplier': 4, 'num_layers': 5, 'n_heads': 32, 'dim_feedforward': 335, 'batch_size': 110, 'pos_encoding': 'fixed', 'activation': 'relu', 'norm': 'LayerNorm', 'optimizer_name': 'RAdam', 'weight_decay': 0.1, 'top_n_features': 159}. Best is trial 246 with value: 0.16447311791139763.[0m
[FileBasedDataset] Initializing dataset...
	Examples: 8264
	Features: 60
	Max length: 315
Standard scalar turned ON, loading params from cache
[FileBasedDataset] Dataset initialization complete
  epoch    auprc    auroc    train_loss    valid_acc    valid_loss    cp      dur
-------  -------  -------  ------------  -----------  ------------  ----  -------
      1   [36m0.0417[0m   [32m0.2556[0m        [35m0.7051[0m       [31m0.8162[0m        [94m0.6670[0m     +  13.5201
      2   [36m0.0432[0m   [32m0.2666[0m        [35m0.6058[0m       [31m0.9347[0m        [94m0.5357[0m     +  13.4840
      3   [36m0.0444[0m   [32m0.2791[0m        [35m0.5022[0m       0.9347        [94m0.4272[0m     +  13.8723
      4   [36m0.0448[0m   [32m0.2923[0m        [35m0.4240[0m       0.9347        [94m0.3515[0m     +  13.8613
      5   [36m0.0485[0m   [32m0.3536[0m        [35m0.3667[0m       0.9347        [94m0.3032[0m     +  13.8443
      6   [36m0.0563[0m   [32m0.4466[0m        [35m0.3300[0m       0.9347        [94m0.2732[0m     +  13.7648
      7   [36m0.0789[0m   [32m0.5310[0m        [35m0.3067[0m       0.9347        [94m0.2548[0m     +  13.8073
      8   [36m0.1043[0m   [32m0.5930[0m        [35m0.2890[0m       0.9347        [94m0.2431[0m     +  13.8214
      9   [36m0.1381[0m   [32m0.6327[0m        [35m0.2772[0m       0.9347        [94m0.2359[0m     +  13.7373
     10   [36m0.1520[0m   [32m0.6603[0m        [35m0.2701[0m       0.9347        [94m0.2311[0m     +  13.9169
     11   [36m0.1603[0m   [32m0.6792[0m        [35m0.2640[0m       0.9347        [94m0.2279[0m     +  13.5830
     12   [36m0.1683[0m   [32m0.6932[0m        [35m0.2592[0m       0.9347        [94m0.2257[0m     +  13.7361
     13   [36m0.1715[0m   [32m0.7036[0m        [35m0.2560[0m       0.9347        [94m0.2242[0m     +  13.7924
     14   [36m0.1778[0m   [32m0.7132[0m        [35m0.2530[0m       0.9347        [94m0.2232[0m     +  13.6365
     15   [36m0.1800[0m   [32m0.7201[0m        [35m0.2518[0m       [31m0.9359[0m        [94m0.2224[0m     +  13.7037
     16   [36m0.1818[0m   [32m0.7250[0m        [35m0.2491[0m       0.9359        [94m0.2220[0m     +  13.7808
     17   [36m0.1839[0m   [32m0.7304[0m        [35m0.2487[0m       0.9359        [94m0.2216[0m     +  13.7667
     18   [36m0.1866[0m   [32m0.7344[0m        [35m0.2484[0m       0.9359        [94m0.2214[0m     +  13.6469
     19   [36m0.1893[0m   [32m0.7386[0m        [35m0.2473[0m       0.9359        [94m0.2212[0m     +  13.6611
     20   [36m0.1900[0m   [32m0.7407[0m        [35m0.2461[0m       0.9359        [94m0.2211[0m     +  13.7466
     21   [36m0.1921[0m   [32m0.7440[0m        [35m0.2439[0m       0.9359        [94m0.2210[0m     +  13.8056
     22   0.1920   [32m0.7461[0m        [35m0.2434[0m       0.9347        0.2211        13.8005
     23   0.1920   [32m0.7484[0m        [35m0.2433[0m       0.9347        0.2212        13.7550
     24   [36m0.1948[0m   [32m0.7505[0m        [35m0.2427[0m       0.9347        0.2211        13.8322
     25   [36m0.1957[0m   [32m0.7526[0m        [35m0.2423[0m       0.9335        0.2212        13.6631
     26   [36m0.1963[0m   [32m0.7545[0m        [35m0.2420[0m       0.9323        0.2212        13.6619
     27   [36m0.1965[0m   [32m0.7553[0m        [35m0.2394[0m       0.9323        0.2214        13.8532
     28   [36m0.1967[0m   [32m0.7559[0m        0.2412       0.9323        0.2215        14.0171
     29   [36m0.1974[0m   [32m0.7569[0m        [35m0.2389[0m       0.9311        0.2217        13.5265
     30   0.1971   0.7561        0.2398       0.9311        0.2218        13.6278
Stopping since valid_loss has not improved in the last 10 epochs.
[32m[I 2023-05-05 11:35:09,987][0m Trial 607 finished with value: 0.22101243854722205 and parameters: {'lr': 4.768929644452972e-07, 'dropout': 0.4301722742020925, 'd_model_multiplier': 32, 'num_layers': 1, 'n_heads': 32, 'dim_feedforward': 372, 'batch_size': 44, 'pos_encoding': 'learnable', 'activation': 'relu', 'norm': 'LayerNorm', 'optimizer_name': 'PlainRAdam', 'weight_decay': 0.1, 'top_n_features': 60}. Best is trial 246 with value: 0.16447311791139763.[0m
[FileBasedDataset] Initializing dataset...
	Examples: 8264
	Features: 44
	Max length: 315
Standard scalar turned ON, loading params from cache
[FileBasedDataset] Dataset initialization complete
Warning, assumed runtime error: CUDA out of memory. Tried to allocate 3.43 GiB (GPU 0; 23.70 GiB total capacity; 13.81 GiB already allocated; 259.25 MiB free; 22.35 GiB reserved in total by PyTorch) If reserved memory is >> allocated memory try setting max_split_size_mb to avoid fragmentation.  See documentation for Memory Management and PYTORCH_CUDA_ALLOC_CONF
[32m[I 2023-05-05 11:35:14,977][0m Trial 608 finished with value: 100.0 and parameters: {'lr': 7.456154797443086e-07, 'dropout': 0.1992005360185679, 'd_model_multiplier': 16, 'num_layers': 5, 'n_heads': 64, 'dim_feedforward': 378, 'batch_size': 145, 'pos_encoding': 'fixed', 'activation': 'relu', 'norm': 'LayerNorm', 'optimizer_name': 'RAdam', 'weight_decay': 0.1, 'top_n_features': 44}. Best is trial 246 with value: 0.16447311791139763.[0m
[FileBasedDataset] Initializing dataset...
	Examples: 8264
	Features: 69
	Max length: 315
Standard scalar turned ON, loading params from cache
[FileBasedDataset] Dataset initialization complete
  epoch    auprc    auroc    train_loss    valid_acc    valid_loss    cp     dur
-------  -------  -------  ------------  -----------  ------------  ----  ------
      1   [36m0.0653[0m   [32m0.4042[0m        [35m0.6797[0m       [31m0.3664[0m        [94m0.7000[0m     +  9.5683
      2   [36m0.0659[0m   0.4015        [35m0.6778[0m       0.3253        0.7011        10.2160
      3   [36m0.0662[0m   [32m0.4069[0m        0.6778       0.3579        [94m0.6995[0m     +  9.6907
      4   0.0658   0.4045        0.6788       0.3591        0.6998        10.4834
      5   0.0634   0.3958        0.6801       [31m0.3881[0m        [94m0.6986[0m     +  10.7325
      6   0.0656   0.4032        0.6814       0.3543        0.6999        10.3798
      7   0.0641   0.4023        0.6803       0.3712        0.6997        10.0899
      8   0.0614   0.3899        0.6779       0.3857        [94m0.6983[0m     +  10.4466
      9   0.0662   [32m0.4080[0m        0.6780       0.3446        0.7002        10.3305
     10   0.0660   0.4046        [35m0.6768[0m       0.3652        0.6996        10.2929
     11   0.0627   0.3945        [35m0.6760[0m       0.3821        0.6988        10.3937
     12   0.0626   0.3931        [35m0.6744[0m       [31m0.3942[0m        [94m0.6977[0m     +  10.3074
     13   0.0640   0.3955        0.6745       0.3736        0.6996        10.4183
     14   0.0622   0.3915        [35m0.6732[0m       0.3821        0.6984        10.3658
     15   0.0630   0.3936        0.6753       [31m0.4015[0m        0.6978        10.3692
     16   0.0617   0.3889        [35m0.6704[0m       0.3954        [94m0.6975[0m     +  10.3597
     17   0.0611   0.3868        0.6726       0.3954        0.6979        10.3763
     18   0.0614   0.3869        0.6713       [31m0.4027[0m        0.6976        10.4339
     19   0.0620   0.3821        0.6705       [31m0.4111[0m        [94m0.6972[0m     +  10.5794
     20   0.0633   0.3931        0.6712       0.3966        0.6979        10.3770
     21   0.0624   0.3897        [35m0.6684[0m       0.3507        0.6997        10.5216
     22   0.0622   0.3870        0.6698       0.3978        0.6975        10.5968
     23   0.0626   0.3794        0.6697       [31m0.4389[0m        [94m0.6954[0m     +  10.2614
     24   0.0614   0.3782        [35m0.6683[0m       0.4184        0.6966        10.6800
     25   0.0618   0.3816        0.6684       0.4220        0.6963        10.3858
     26   0.0622   0.3759        [35m0.6639[0m       0.4281        0.6959        10.4637
     27   0.0632   0.3834        [35m0.6632[0m       0.4075        0.6977        10.5382
     28   0.0622   0.3835        0.6634       0.4256        0.6967        10.4343
     29   0.0605   0.3749        0.6641       [31m0.4498[0m        [94m0.6943[0m     +  10.3293
     30   0.0618   0.3777        0.6642       0.4220        0.6967        10.3883
     31   0.0606   0.3719        0.6636       0.4389        0.6953        10.7562
     32   0.0610   0.3772        [35m0.6606[0m       0.4426        0.6948        10.4233
     33   0.0610   0.3756        0.6610       0.4377        0.6954        10.5960
     34   0.0611   0.3754        [35m0.6592[0m       0.4401        0.6952        10.5237
     35   0.0602   0.3728        [35m0.6591[0m       [31m0.4607[0m        [94m0.6942[0m     +  10.5800
     36   0.0598   0.3687        0.6598       [31m0.4643[0m        [94m0.6936[0m     +  10.3458
     37   0.0596   0.3677        [35m0.6573[0m       0.4619        0.6942        10.4631
     38   0.0606   0.3680        0.6587       0.4643        [94m0.6936[0m     +  10.7405
     39   0.0594   0.3663        0.6581       [31m0.4776[0m        [94m0.6931[0m     +  10.8278
     40   0.0598   0.3668        [35m0.6557[0m       0.4571        0.6947        10.8854
     41   0.0626   0.3700        [35m0.6552[0m       0.4498        0.6950        10.4127
     42   0.0584   0.3611        [35m0.6543[0m       [31m0.5006[0m        [94m0.6920[0m     +  10.2779
     43   0.0614   0.3689        0.6545       0.4595        0.6942        10.7093
     44   0.0638   0.3643        [35m0.6528[0m       0.4800        0.6933        10.6628
     45   0.0605   0.3634        [35m0.6523[0m       0.4982        0.6923        10.5732
     46   0.0604   0.3616        [35m0.6505[0m       0.4728        0.6942        10.5434
     47   0.0603   0.3597        0.6539       [31m0.5030[0m        [94m0.6920[0m     +  10.2686
     48   0.0606   0.3623        0.6508       0.4982        0.6930        10.4984
     49   0.0600   0.3556        [35m0.6497[0m       0.4909        0.6930        10.3097
     50   0.0609   0.3604        0.6505       [31m0.5127[0m        [94m0.6906[0m     +  10.4275
[32m[I 2023-05-05 11:43:58,060][0m Trial 609 finished with value: 0.6906050790322015 and parameters: {'lr': 5.808925823005522e-08, 'dropout': 0.4047100680543312, 'd_model_multiplier': 4, 'num_layers': 4, 'n_heads': 8, 'dim_feedforward': 361, 'batch_size': 76, 'pos_encoding': 'fixed', 'activation': 'gelu', 'norm': 'BatchNorm', 'optimizer_name': 'RAdam', 'weight_decay': 0.1, 'top_n_features': 69}. Best is trial 246 with value: 0.16447311791139763.[0m
[FileBasedDataset] Initializing dataset...
	Examples: 8264
	Features: 83
	Max length: 315
Standard scalar turned ON, loading params from cache
[FileBasedDataset] Dataset initialization complete
  epoch    auprc    auroc    train_loss    valid_acc    valid_loss    cp      dur
-------  -------  -------  ------------  -----------  ------------  ----  -------
      1   [36m0.1958[0m   [32m0.6951[0m        [35m0.2957[0m       [31m0.9129[0m        [94m0.3287[0m     +  16.2570
      2   [36m0.2402[0m   [32m0.7537[0m        [35m0.2699[0m       [31m0.9190[0m        0.3308        16.2996
      3   0.2011   0.6867        [35m0.2663[0m       0.9190        [94m0.3181[0m     +  16.3208
      4   0.1867   0.6849        0.2665       0.9166        [94m0.2942[0m     +  16.4284
      5   0.1931   0.6912        [35m0.2661[0m       0.9154        [94m0.2765[0m     +  16.6948
      6   0.1958   0.6937        [35m0.2643[0m       0.8767        0.2965        16.3470
      7   0.1952   0.6905        [35m0.2607[0m       0.8839        0.2889        16.4864
      8   0.2037   0.6884        [35m0.2597[0m       0.8803        0.3020        16.4930
      9   0.1908   0.6906        [35m0.2589[0m       0.9093        0.2810        16.4296
     10   0.1943   0.6923        [35m0.2560[0m       0.9045        0.2913        16.5561
     11   0.2176   0.6921        [35m0.2547[0m       0.8960        0.2822        16.6521
     12   0.1928   0.6864        [35m0.2536[0m       0.9117        [94m0.2747[0m     +  16.8294
     13   0.1842   0.6858        [35m0.2500[0m       0.9141        0.2763        16.3952
     14   0.2110   0.6869        0.2550       0.9166        [94m0.2690[0m     +  16.2630
     15   0.2036   0.6891        0.2526       [31m0.9202[0m        [94m0.2667[0m     +  16.7652
     16   0.1837   0.6801        0.2528       0.9166        [94m0.2664[0m     +  16.3915
     17   0.1926   0.6842        [35m0.2498[0m       0.9202        [94m0.2608[0m     +  16.3589
     18   0.1958   0.6893        0.2510       0.9190        [94m0.2590[0m     +  16.3679
     19   0.1894   0.6854        [35m0.2489[0m       0.9141        0.2659        16.5926
     20   0.2039   0.6879        0.2494       0.9166        0.2599        16.7313
     21   0.1908   0.6886        0.2492       0.9202        0.2612        16.3582
     22   0.1939   0.6933        0.2504       0.9117        0.2665        16.6407
     23   0.1928   0.6846        [35m0.2477[0m       0.9202        0.2648        16.5965
     24   0.1880   0.6888        0.2503       0.9166        0.2620        16.4885
     25   0.1940   0.6837        [35m0.2471[0m       0.9154        0.2642        16.5334
     26   0.1909   0.6802        0.2495       0.9190        0.2610        16.4763
     27   0.1879   0.6830        0.2493       0.9154        0.2627        16.7837
Stopping since valid_loss has not improved in the last 10 epochs.
[32m[I 2023-05-05 11:51:41,074][0m Trial 610 finished with value: 0.2590332809732067 and parameters: {'lr': 0.00973516822301833, 'dropout': 0.3583189471848149, 'd_model_multiplier': 4, 'num_layers': 3, 'n_heads': 32, 'dim_feedforward': 341, 'batch_size': 55, 'pos_encoding': 'fixed', 'activation': 'relu', 'norm': 'LayerNorm', 'optimizer_name': 'PlainRAdam', 'weight_decay': 0, 'top_n_features': 83}. Best is trial 246 with value: 0.16447311791139763.[0m
[FileBasedDataset] Initializing dataset...
	Examples: 8264
	Features: 168
	Max length: 315
Standard scalar turned ON, loading params from cache
[FileBasedDataset] Dataset initialization complete
  epoch    auprc    auroc    train_loss    valid_acc    valid_loss    cp     dur
-------  -------  -------  ------------  -----------  ------------  ----  ------
      1   [36m0.1663[0m   [32m0.6776[0m        [35m0.2706[0m       [31m0.9262[0m        [94m0.2477[0m     +  8.7606
      2   0.1035   0.5414        [35m0.2637[0m       [31m0.9299[0m        0.2720        9.7044
      3   [36m0.1797[0m   [32m0.7180[0m        [35m0.2547[0m       0.9287        [94m0.2362[0m     +  9.6287
      4   [36m0.2155[0m   [32m0.7556[0m        [35m0.2528[0m       0.9238        [94m0.2316[0m     +  9.6751
      5   0.2149   [32m0.7605[0m        [35m0.2430[0m       0.9154        0.2387        9.7848
      6   0.2065   0.7529        [35m0.2423[0m       0.9166        0.2392        10.2892
      7   0.2006   [32m0.7613[0m        [35m0.2420[0m       0.9226        0.2326        9.8674
      8   0.1882   0.7555        [35m0.2415[0m       0.9226        0.2397        9.8833
      9   0.2122   [32m0.7914[0m        [35m0.2395[0m       0.9238        [94m0.2248[0m     +  9.8302
     10   0.2040   0.7763        0.2400       0.9202        0.2300        9.4651
     11   0.2089   0.7816        0.2396       0.9226        0.2294        9.9350
     12   0.2110   0.7847        0.2431       0.9262        [94m0.2232[0m     +  10.0715
     13   0.2149   [32m0.7932[0m        [35m0.2387[0m       0.9226        0.2303        9.7944
     14   [36m0.2207[0m   0.7893        [35m0.2343[0m       0.9154        0.2407        10.1420
     15   [36m0.2301[0m   [32m0.7976[0m        0.2362       0.9262        [94m0.2206[0m     +  10.1301
     16   [36m0.2356[0m   [32m0.7977[0m        0.2361       0.9202        0.2267        9.8310
     17   0.2010   0.7962        0.2373       0.9202        0.2370        9.9412
     18   0.2192   0.7955        [35m0.2336[0m       0.9226        0.2262        10.0992
     19   0.2266   [32m0.8001[0m        [35m0.2326[0m       0.9226        0.2278        10.0197
     20   0.2105   0.7951        [35m0.2306[0m       0.9141        0.2448        9.8668
     21   0.2274   [32m0.8035[0m        0.2332       0.9226        0.2257        9.9614
     22   0.2078   0.7878        [35m0.2296[0m       0.9190        0.2461        9.9736
     23   0.2170   0.7992        0.2318       0.9190        0.2312        9.9984
     24   0.2131   0.7988        0.2317       0.9226        0.2281        9.9966
Stopping since valid_loss has not improved in the last 10 epochs.
