[32m[I 2023-05-02 03:08:13,034][0m Trial 23 finished with value: 0.24000221161124496 and parameters: {'lr': 0.0007632216352060004, 'dropout': 0.5852676063820843, 'd_model_multiplier': 2, 'num_layers': 4, 'n_heads': 16, 'dim_feedforward': 462, 'batch_size': 255, 'pos_encoding': 'fixed', 'activation': 'gelu', 'norm': 'BatchNorm', 'optimizer_name': 'PlainRAdam', 'weight_decay': 0.01, 'top_n_features': 179}. Best is trial 12 with value: 0.20472501771481755.[0m
[FileBasedDataset] Initializing dataset...
	Examples: 8264
	Features: 193
	Max length: 315
Standard scalar turned ON, loading params from cache
[FileBasedDataset] Dataset initialization complete
  epoch    auprc    auroc    train_loss    valid_acc    valid_loss    cp      dur
-------  -------  -------  ------------  -----------  ------------  ----  -------
      1   [36m0.2226[0m   [32m0.6893[0m        [35m0.3459[0m       [31m0.9105[0m        [94m0.3570[0m     +  11.6406
      2   [36m0.2387[0m   [32m0.7013[0m        [35m0.2670[0m       0.9105        0.3631        11.1327
      3   0.2385   [32m0.7073[0m        [35m0.2610[0m       0.9105        [94m0.3000[0m     +  13.2167
      4   [36m0.2453[0m   [32m0.7121[0m        [35m0.2592[0m       0.9105        [94m0.2778[0m     +  11.2603
      5   [36m0.2698[0m   [32m0.7215[0m        [35m0.2546[0m       0.9105        [94m0.2714[0m     +  12.5275
      6   0.2527   [32m0.7239[0m        0.2554       0.9105        0.2738        11.9123
      7   0.2657   [32m0.7330[0m        0.2561       0.9105        0.2792        12.0733
      8   0.2553   [32m0.7387[0m        [35m0.2537[0m       0.9105        0.2885        12.1306
      9   [36m0.2810[0m   0.7371        [35m0.2490[0m       0.9105        0.2715        12.3605
     10   [36m0.2856[0m   [32m0.7457[0m        [35m0.2450[0m       0.9105        0.2742        12.9630
     11   [36m0.2911[0m   0.7437        0.2458       [31m0.9117[0m        [94m0.2662[0m     +  12.6057
     12   [36m0.2938[0m   0.7453        0.2467       0.9105        [94m0.2641[0m     +  12.1718
     13   0.2837   0.7301        [35m0.2432[0m       0.9105        0.2788        12.4156
     14   0.2543   0.7074        [35m0.2420[0m       0.9105        0.2795        13.2930
     15   0.2568   0.7164        0.2429       0.9105        0.2921        12.2968
     16   0.2873   0.7339        [35m0.2410[0m       0.9105        0.2741        12.4017
     17   [36m0.3008[0m   0.7446        [35m0.2404[0m       [31m0.9129[0m        0.2698        12.5751
     18   0.2954   0.7369        [35m0.2362[0m       0.9105        0.2828        12.0865
     19   [36m0.3124[0m   [32m0.7595[0m        [35m0.2360[0m       0.9093        [94m0.2632[0m     +  12.3519
     20   0.3029   0.7513        0.2381       0.9117        0.2830        12.2432
     21   [36m0.3150[0m   0.7571        [35m0.2357[0m       0.9093        [94m0.2625[0m     +  12.2697
     22   0.2998   0.7536        0.2361       0.9129        0.2714        12.3550
     23   [36m0.3176[0m   0.7560        0.2369       0.9093        0.2678        12.7246
     24   0.2955   0.7355        0.2361       0.9117        0.2847        12.6558
     25   0.2997   [32m0.7610[0m        0.2384       0.9093        0.2637        13.0893
     26   0.2927   0.7437        [35m0.2342[0m       0.9105        0.2765        12.8502
     27   0.2502   0.7143        [35m0.2311[0m       0.9105        0.3050        12.4795
     28   0.2669   0.7314        0.2350       0.9105        0.2803        12.5881
     29   0.2720   0.7220        0.2379       0.9105        0.3060        12.2690
     30   0.2861   0.7360        0.2373       0.9117        0.2792        12.6722
Stopping since valid_loss has not improved in the last 10 epochs.
[32m[I 2023-05-02 03:14:37,828][0m Trial 24 finished with value: 0.2625477636703701 and parameters: {'lr': 0.02350766774629553, 'dropout': 0.6466654847694363, 'd_model_multiplier': 2, 'num_layers': 2, 'n_heads': 8, 'dim_feedforward': 206, 'batch_size': 231, 'pos_encoding': 'fixed', 'activation': 'gelu', 'norm': 'BatchNorm', 'optimizer_name': 'PlainRAdam', 'weight_decay': 0.01, 'top_n_features': 193}. Best is trial 12 with value: 0.20472501771481755.[0m
[FileBasedDataset] Initializing dataset...
	Examples: 8264
	Features: 216
	Max length: 315
Standard scalar turned ON, loading params from cache
[FileBasedDataset] Dataset initialization complete
  epoch    auprc    auroc    train_loss    valid_acc    valid_loss    cp      dur
-------  -------  -------  ------------  -----------  ------------  ----  -------
      1   [36m0.2143[0m   [32m0.6897[0m        [35m0.4201[0m       [31m0.9057[0m        [94m0.5087[0m     +  10.4494
      2   [36m0.2550[0m   [32m0.7103[0m        [35m0.2735[0m       0.9057        [94m0.2854[0m     +  10.7855
      3   [36m0.2814[0m   [32m0.7203[0m        [35m0.2671[0m       0.9057        0.2984        11.2033
      4   0.2629   [32m0.7209[0m        [35m0.2596[0m       0.9057        0.2883        11.4491
      5   0.2649   0.7093        [35m0.2594[0m       0.9057        0.2922        11.3174
      6   0.2636   0.7162        [35m0.2525[0m       0.9057        [94m0.2819[0m     +  11.4178
      7   0.2632   [32m0.7273[0m        0.2559       0.9057        0.2828        11.5488
      8   0.2702   0.7236        0.2555       0.9057        [94m0.2802[0m     +  11.0104
      9   0.2782   0.7227        0.2590       0.9057        0.2818        10.8967
     10   0.2567   0.7263        0.2531       0.9057        0.2819        11.0284
     11   0.2750   [32m0.7273[0m        0.2601       0.9057        0.2872        11.1290
     12   0.2726   [32m0.7328[0m        0.2541       0.9057        0.2806        12.1404
     13   0.2735   [32m0.7383[0m        0.2541       0.9057        0.2806        11.4444
     14   0.2701   [32m0.7396[0m        0.2537       0.9057        [94m0.2798[0m     +  11.3671
     15   0.2766   0.7386        0.2539       0.9057        0.2892        11.4539
     16   [36m0.2868[0m   [32m0.7411[0m        0.2549       0.9057        0.2944        11.0358
     17   [36m0.2919[0m   [32m0.7433[0m        0.2593       0.9057        0.2801        11.4416
     18   0.2738   0.7329        0.2547       0.9057        0.2909        11.2788
     19   0.2797   0.7301        0.2551       0.9057        0.2911        11.2241
     20   0.2723   0.7289        0.2567       0.9057        0.2906        11.4611
     21   0.2736   0.7386        0.2562       0.9057        0.2870        11.2291
     22   0.2736   [32m0.7444[0m        0.2525       0.9057        0.2845        11.4514
     23   0.2603   0.7366        0.2563       0.9057        0.2920        11.9125
Stopping since valid_loss has not improved in the last 10 epochs.
[32m[I 2023-05-02 03:19:09,111][0m Trial 25 finished with value: 0.27979212087616234 and parameters: {'lr': 0.08843718230229852, 'dropout': 0.6873505274799138, 'd_model_multiplier': 2, 'num_layers': 5, 'n_heads': 4, 'dim_feedforward': 462, 'batch_size': 155, 'pos_encoding': 'fixed', 'activation': 'gelu', 'norm': 'BatchNorm', 'optimizer_name': 'PlainRAdam', 'weight_decay': 0.01, 'top_n_features': 216}. Best is trial 12 with value: 0.20472501771481755.[0m
[FileBasedDataset] Initializing dataset...
	Examples: 8264
	Features: 166
	Max length: 315
Standard scalar turned ON, loading params from cache
[FileBasedDataset] Dataset initialization complete
  epoch    auprc    auroc    train_loss    valid_acc    valid_loss    cp      dur
-------  -------  -------  ------------  -----------  ------------  ----  -------
      1   [36m0.1648[0m   [32m0.6676[0m        [35m0.3068[0m       [31m0.9250[0m        [94m0.2822[0m     +  10.1623
      2   [36m0.2000[0m   [32m0.7115[0m        [35m0.2575[0m       0.9250        [94m0.2764[0m     +  11.3449
      3   0.1974   [32m0.7407[0m        0.2584       0.9202        0.2937        10.9603
      4   [36m0.2279[0m   [32m0.7614[0m        [35m0.2533[0m       0.9226        0.3004        11.6661
      5   0.2107   0.7251        0.2575       0.9202        0.2991        11.5513
      6   0.2272   [32m0.7662[0m        [35m0.2486[0m       0.9178        0.3002        11.3376
      7   [36m0.2363[0m   0.7177        0.2533       [31m0.9262[0m        [94m0.2614[0m     +  11.6656
      8   [36m0.2664[0m   0.7625        0.2565       0.9262        [94m0.2434[0m     +  11.7114
      9   0.2520   [32m0.7788[0m        0.2538       0.9262        [94m0.2362[0m     +  11.5608
     10   [36m0.2668[0m   0.7701        [35m0.2461[0m       0.9250        [94m0.2344[0m     +  11.6579
     11   [36m0.2767[0m   [32m0.7867[0m        0.2514       0.9262        0.2372        11.4517
     12   0.2670   0.7753        0.2491       0.9250        [94m0.2331[0m     +  11.3846
     13   0.2500   0.7572        [35m0.2459[0m       0.9250        0.2380        12.0304
     14   0.2620   [32m0.7874[0m        0.2465       0.9250        [94m0.2318[0m     +  11.5002
     15   0.2638   [32m0.7964[0m        [35m0.2450[0m       0.9262        [94m0.2291[0m     +  11.7101
     16   0.2526   [32m0.7975[0m        0.2455       0.9250        [94m0.2274[0m     +  11.2681
     17   0.2539   [32m0.8063[0m        0.2479       0.9250        [94m0.2267[0m     +  11.5088
     18   0.2671   [32m0.8098[0m        0.2495       0.9262        0.2274        11.0645
     19   0.2591   0.8075        [35m0.2429[0m       0.9250        0.2294        11.3383
     20   0.2703   [32m0.8175[0m        [35m0.2426[0m       0.9250        0.2369        11.5220
     21   0.2766   0.8174        0.2441       0.9250        0.2392        11.4776
     22   [36m0.2779[0m   [32m0.8245[0m        0.2437       0.9238        [94m0.2247[0m     +  11.6201
     23   0.2776   [32m0.8325[0m        [35m0.2425[0m       0.9238        [94m0.2216[0m     +  11.2575
     24   0.2732   [32m0.8346[0m        [35m0.2420[0m       0.9262        0.2224        11.5783
     25   0.2762   0.8235        [35m0.2416[0m       0.9250        0.2227        12.0270
     26   [36m0.2873[0m   0.8315        [35m0.2411[0m       0.9262        0.2220        11.7543
     27   0.2841   0.8329        [35m0.2396[0m       0.9190        [94m0.2193[0m     +  11.8229
     28   0.2857   0.8327        [35m0.2370[0m       0.9178        [94m0.2179[0m     +  11.9360
     29   0.2783   0.8337        0.2383       0.9238        0.2208        11.2760
     30   [36m0.2949[0m   [32m0.8362[0m        0.2396       0.9262        0.2188        11.4552
     31   0.2900   0.8217        0.2399       0.9262        0.2287        11.8153
     32   [36m0.2958[0m   0.8252        0.2386       0.9262        0.2313        11.7375
     33   [36m0.3111[0m   0.8306        0.2399       0.9262        0.2311        11.1313
     34   0.2981   0.8326        0.2424       0.9250        0.2201        11.6228
     35   0.2932   0.8302        0.2412       0.9250        0.2193        11.4703
     36   0.2994   0.8312        0.2385       0.9250        0.2216        11.7635
     37   0.2948   0.8303        [35m0.2363[0m       0.9214        0.2202        12.2285
Stopping since valid_loss has not improved in the last 10 epochs.
[32m[I 2023-05-02 03:26:27,809][0m Trial 26 finished with value: 0.21785039462806813 and parameters: {'lr': 0.006739523547877635, 'dropout': 0.5653890116508902, 'd_model_multiplier': 2, 'num_layers': 1, 'n_heads': 16, 'dim_feedforward': 302, 'batch_size': 202, 'pos_encoding': 'learnable', 'activation': 'gelu', 'norm': 'BatchNorm', 'optimizer_name': 'PlainRAdam', 'weight_decay': 0.001, 'top_n_features': 166}. Best is trial 12 with value: 0.20472501771481755.[0m
[FileBasedDataset] Initializing dataset...
	Examples: 8264
	Features: 163
	Max length: 315
Standard scalar turned ON, loading params from cache
[FileBasedDataset] Dataset initialization complete
  epoch    auprc    auroc    train_loss    valid_acc    valid_loss    cp      dur
-------  -------  -------  ------------  -----------  ------------  ----  -------
      1   [36m0.1568[0m   [32m0.5720[0m        [35m0.6990[0m       [31m0.9117[0m        [94m0.6678[0m     +  12.4443
      2   0.1291   0.4964        [35m0.6448[0m       [31m0.9335[0m        [94m0.6558[0m     +  13.0675
      3   0.1037   0.4430        [35m0.5869[0m       [31m0.9371[0m        [94m0.6394[0m     +  12.9590
      4   0.0778   0.4225        [35m0.5229[0m       0.9371        [94m0.6228[0m     +  12.7049
      5   0.0739   0.4287        [35m0.4647[0m       0.9371        [94m0.6001[0m     +  13.2377
      6   0.0703   0.4475        [35m0.4177[0m       0.9371        [94m0.5780[0m     +  13.1648
      7   0.0795   0.4821        [35m0.3829[0m       0.9371        [94m0.5615[0m     +  12.8377
      8   0.0875   0.5153        [35m0.3565[0m       0.9371        [94m0.5357[0m     +  13.6005
      9   0.0996   0.5574        [35m0.3365[0m       0.9371        [94m0.5158[0m     +  13.8209
     10   0.1121   [32m0.5972[0m        [35m0.3210[0m       0.9359        [94m0.4986[0m     +  13.4915
     11   0.1283   [32m0.6267[0m        [35m0.3114[0m       0.9359        [94m0.4909[0m     +  13.5907
     12   0.1438   [32m0.6494[0m        [35m0.3035[0m       0.9359        [94m0.4846[0m     +  13.1949
     13   [36m0.1590[0m   [32m0.6718[0m        [35m0.2977[0m       0.9347        [94m0.4654[0m     +  13.2643
     14   [36m0.1698[0m   [32m0.6877[0m        0.2985       0.9359        [94m0.4589[0m     +  13.2136
     15   [36m0.1825[0m   [32m0.6980[0m        [35m0.2864[0m       0.9359        [94m0.4477[0m     +  13.9213
     16   [36m0.1968[0m   [32m0.7082[0m        [35m0.2844[0m       0.9359        [94m0.4297[0m     +  13.4272
     17   [36m0.2059[0m   [32m0.7172[0m        [35m0.2816[0m       0.9359        [94m0.4250[0m     +  13.2555
     18   [36m0.2110[0m   [32m0.7218[0m        [35m0.2801[0m       0.9371        [94m0.4243[0m     +  13.3884
     19   [36m0.2139[0m   [32m0.7251[0m        [35m0.2795[0m       0.9371        [94m0.4129[0m     +  13.2411
     20   [36m0.2191[0m   [32m0.7299[0m        [35m0.2792[0m       0.9371        [94m0.4112[0m     +  13.0700
     21   [36m0.2236[0m   [32m0.7343[0m        [35m0.2756[0m       0.9371        [94m0.4015[0m     +  13.0035
     22   [36m0.2251[0m   [32m0.7380[0m        [35m0.2731[0m       0.9371        0.4025        13.1949
     23   0.2204   [32m0.7400[0m        0.2779       0.9371        0.4037        13.8693
     24   [36m0.2289[0m   [32m0.7436[0m        0.2769       0.9371        [94m0.3993[0m     +  13.5581
     25   0.2287   0.7433        0.2754       0.9371        [94m0.3889[0m     +  13.7489
     26   [36m0.2326[0m   [32m0.7458[0m        [35m0.2720[0m       0.9371        [94m0.3856[0m     +  13.0724
     27   [36m0.2330[0m   [32m0.7472[0m        [35m0.2704[0m       0.9371        [94m0.3843[0m     +  13.4876
     28   [36m0.2346[0m   [32m0.7501[0m        0.2733       0.9371        0.3849        13.5514
     29   [36m0.2351[0m   0.7498        [35m0.2686[0m       0.9371        [94m0.3780[0m     +  13.3507
     30   0.2277   [32m0.7509[0m        [35m0.2668[0m       0.9371        0.3783        13.4201
     31   0.2287   [32m0.7535[0m        [35m0.2667[0m       0.9371        [94m0.3759[0m     +  13.1952
     32   0.2305   [32m0.7539[0m        [35m0.2648[0m       0.9371        [94m0.3660[0m     +  13.0066
     33   0.2295   [32m0.7543[0m        0.2679       0.9371        0.3716        13.1001
     34   0.2314   0.7515        [35m0.2639[0m       0.9371        0.3715        13.0094
     35   0.2301   [32m0.7547[0m        0.2669       0.9371        [94m0.3631[0m     +  13.0712
     36   [36m0.2429[0m   0.7538        0.2672       0.9371        0.3737        13.1739
     37   [36m0.2449[0m   [32m0.7553[0m        0.2639       0.9371        [94m0.3595[0m     +  13.1428
     38   [36m0.2464[0m   0.7548        0.2647       0.9371        0.3603        13.3244
     39   [36m0.2476[0m   [32m0.7575[0m        [35m0.2628[0m       0.9371        [94m0.3561[0m     +  13.5535
     40   0.2409   0.7567        [35m0.2618[0m       0.9371        0.3646        13.5566
     41   0.2461   [32m0.7589[0m        0.2649       0.9371        [94m0.3522[0m     +  13.3354
     42   [36m0.2478[0m   [32m0.7597[0m        [35m0.2573[0m       0.9371        [94m0.3477[0m     +  13.3627
     43   0.2318   [32m0.7600[0m        0.2615       0.9371        0.3536        13.3674
     44   0.2421   0.7577        0.2638       0.9371        [94m0.3445[0m     +  13.1531
     45   0.2404   0.7560        0.2591       [31m0.9383[0m        [94m0.3413[0m     +  13.2881
     46   0.2393   0.7587        0.2593       0.9371        0.3440        13.5874
     47   0.2415   0.7596        0.2586       0.9371        [94m0.3343[0m     +  13.0528
     48   0.2454   0.7598        0.2632       0.9383        [94m0.3326[0m     +  13.4399
     49   0.2343   0.7595        [35m0.2557[0m       0.9371        0.3334        13.4819
     50   [36m0.2490[0m   [32m0.7600[0m        0.2573       0.9383        [94m0.3291[0m     +  13.2665
[32m[I 2023-05-02 03:37:33,969][0m Trial 27 finished with value: 0.3291066536519951 and parameters: {'lr': 5.843309885011662e-05, 'dropout': 0.5797566478272832, 'd_model_multiplier': 2, 'num_layers': 2, 'n_heads': 16, 'dim_feedforward': 313, 'batch_size': 205, 'pos_encoding': 'learnable', 'activation': 'gelu', 'norm': 'BatchNorm', 'optimizer_name': 'PlainRAdam', 'weight_decay': 0.01, 'top_n_features': 163}. Best is trial 12 with value: 0.20472501771481755.[0m
[FileBasedDataset] Initializing dataset...
	Examples: 8264
	Features: 145
	Max length: 315
Standard scalar turned ON, loading params from cache
[FileBasedDataset] Dataset initialization complete
  epoch    auprc    auroc    train_loss    valid_acc    valid_loss    cp      dur
-------  -------  -------  ------------  -----------  ------------  ----  -------
      1   [36m0.1820[0m   [32m0.6696[0m        [35m0.3131[0m       [31m0.9190[0m        [94m0.3437[0m     +  12.3774
      2   [36m0.2020[0m   [32m0.6820[0m        [35m0.2600[0m       0.9190        0.3543        13.0367
      3   [36m0.2652[0m   [32m0.7177[0m        [35m0.2567[0m       [31m0.9214[0m        0.3616        13.0952
      4   [36m0.2697[0m   [32m0.7183[0m        [35m0.2537[0m       0.9214        0.3698        12.8507
      5   [36m0.2844[0m   0.7086        [35m0.2523[0m       0.9202        0.3481        12.7854
      6   0.2779   0.7170        0.2572       0.9190        [94m0.3277[0m     +  11.4387
      7   [36m0.2925[0m   [32m0.7309[0m        0.2529       0.9166        [94m0.3105[0m     +  11.8040
      8   0.2886   [32m0.7493[0m        [35m0.2498[0m       0.9154        [94m0.2948[0m     +  11.8551
      9   [36m0.2958[0m   [32m0.7535[0m        [35m0.2495[0m       0.9166        0.3022        12.2835
     10   [36m0.3131[0m   0.7526        0.2516       0.9190        [94m0.2577[0m     +  12.3055
     11   [36m0.3305[0m   [32m0.7747[0m        [35m0.2483[0m       0.9178        0.2661        12.8254
     12   0.2930   0.7559        0.2506       0.9190        [94m0.2567[0m     +  12.7430
     13   0.2909   0.7511        [35m0.2460[0m       0.9178        [94m0.2484[0m     +  12.5226
     14   0.2857   0.7426        0.2469       0.9166        0.2489        12.3041
     15   0.2986   0.7584        0.2524       0.9166        [94m0.2419[0m     +  12.1283
     16   0.3002   0.7576        0.2469       0.9190        [94m0.2419[0m     +  12.1506
     17   0.2902   0.7644        [35m0.2454[0m       0.9166        [94m0.2405[0m     +  12.2154
     18   0.2908   0.7668        0.2458       0.9178        [94m0.2399[0m     +  12.3651
     19   0.2908   0.7655        [35m0.2415[0m       0.9166        0.2401        12.2932
     20   0.2904   0.7704        [35m0.2403[0m       0.9154        0.2437        12.4805
     21   0.3028   0.7724        0.2420       0.9166        [94m0.2371[0m     +  12.4597
     22   0.2817   0.7710        [35m0.2381[0m       0.9190        0.2500        12.3040
     23   0.2958   0.7732        0.2414       0.9202        0.2454        12.4519
     24   0.3031   [32m0.7767[0m        0.2398       0.9166        [94m0.2365[0m     +  12.2114
     25   0.3165   [32m0.7818[0m        [35m0.2378[0m       0.9166        [94m0.2341[0m     +  12.1819
     26   0.3040   0.7791        [35m0.2366[0m       0.9166        0.2358        12.2239
     27   0.3099   0.7800        0.2390       0.9178        0.2411        12.4613
     28   0.3150   [32m0.7831[0m        0.2382       0.9190        0.2351        12.5954
     29   0.3086   0.7760        0.2405       0.9178        0.2465        12.9341
     30   0.2999   0.7817        0.2418       0.9154        0.2388        12.5528
     31   0.2884   0.7713        [35m0.2365[0m       0.9057        0.2654        12.6713
     32   0.3012   0.7751        0.2404       0.9166        0.2428        12.5729
     33   0.3182   0.7813        0.2384       [31m0.9226[0m        0.2362        12.2924
     34   0.3038   0.7739        0.2382       0.9141        0.2405        12.4169
Stopping since valid_loss has not improved in the last 10 epochs.
