[32m[I 2023-01-09 23:15:16,321][0m Trial 171 finished with value: 0.33772217987267855 and parameters: {'lr': 0.0006104122344649901, 'dropout': 0.6727671502189417, 'd_model_multiplier': 4, 'num_layers': 2, 'n_heads': 8, 'dim_feedforward': 508, 'batch_size': 112, 'pos_encoding': 'fixed', 'activation': 'relu', 'norm': 'BatchNorm', 'optimizer_name': 'RAdam', 'weight_decay': 0.001}. Best is trial 122 with value: 0.40157405369010674.[0m
[EnsembleDataset] Initializing dataset...
	Examples: 27964
	Features: 621
	Max length: 316
[EnsembleDataset] Dataset initialization complete
  epoch    auprc    auroc    train_loss    valid_loss    cp      dur
-------  -------  -------  ------------  ------------  ----  -------
      1   [36m0.2866[0m   [32m0.8319[0m        [35m0.1305[0m        [31m0.0519[0m     +  29.8691
      2   [36m0.2953[0m   [32m0.8326[0m        [35m0.0911[0m        [31m0.0514[0m     +  29.6644
      3   [36m0.2956[0m   [32m0.8327[0m        [35m0.0834[0m        [31m0.0514[0m     +  29.3072
      4   [36m0.3020[0m   [32m0.8357[0m        [35m0.0695[0m        [31m0.0511[0m     +  30.1838
      5   0.3005   [32m0.8358[0m        [35m0.0620[0m        0.0512        30.1100
      6   0.3004   [32m0.8364[0m        [35m0.0569[0m        0.0512        30.9541
      7   0.3018   [32m0.8365[0m        [35m0.0546[0m        [31m0.0511[0m     +  30.3522
      8   [36m0.3021[0m   [32m0.8370[0m        [35m0.0538[0m        [31m0.0510[0m     +  29.5931
      9   0.3000   0.8359        [35m0.0527[0m        0.0511        29.6644
     10   [36m0.3027[0m   [32m0.8373[0m        [35m0.0521[0m        [31m0.0510[0m     +  29.8078
     11   [36m0.3034[0m   0.8371        [35m0.0512[0m        [31m0.0510[0m     +  30.3444
     12   [36m0.3039[0m   0.8368        0.0512        [31m0.0510[0m     +  30.1931
     13   [36m0.3041[0m   0.8372        0.0513        [31m0.0509[0m     +  30.6758
     14   [36m0.3048[0m   0.8371        [35m0.0508[0m        [31m0.0509[0m     +  30.6748
     15   [36m0.3050[0m   [32m0.8374[0m        [35m0.0507[0m        [31m0.0509[0m     +  29.7578
     16   [36m0.3051[0m   0.8372        [35m0.0506[0m        [31m0.0509[0m     +  29.0611
     17   [36m0.3053[0m   0.8372        [35m0.0504[0m        0.0509        29.2607
     18   0.3050   0.8373        0.0504        0.0509        30.2754
Stopping since valid_loss has not improved in the last 3 epochs.
[32m[I 2023-01-09 23:50:01,293][0m Trial 172 finished with value: 0.30533078393666424 and parameters: {'lr': 0.0003412245845121921, 'dropout': 0.6482872036084419, 'd_model_multiplier': 4, 'num_layers': 2, 'n_heads': 8, 'dim_feedforward': 484, 'batch_size': 109, 'pos_encoding': 'fixed', 'activation': 'gelu', 'norm': 'BatchNorm', 'optimizer_name': 'RAdam', 'weight_decay': 0.001}. Best is trial 122 with value: 0.40157405369010674.[0m
[EnsembleDataset] Initializing dataset...
	Examples: 27964
	Features: 621
	Max length: 316
[EnsembleDataset] Dataset initialization complete
  epoch    auprc    auroc    train_loss    valid_loss    cp      dur
-------  -------  -------  ------------  ------------  ----  -------
      1   [36m0.2625[0m   [32m0.8151[0m        [35m0.1125[0m        [31m0.0510[0m     +  29.3817
      2   [36m0.2650[0m   [32m0.8208[0m        [35m0.0603[0m        [31m0.0508[0m     +  30.1471
      3   0.2603   0.8149        [35m0.0513[0m        0.0510        29.6586
      4   0.2611   0.8159        [35m0.0505[0m        0.0510        30.4021
      5   [36m0.2680[0m   [32m0.8231[0m        0.0505        [31m0.0507[0m     +  30.2604
      6   [36m0.2685[0m   0.8226        [35m0.0504[0m        [31m0.0507[0m     +  29.2852
      7   [36m0.2706[0m   0.8226        [35m0.0503[0m        [31m0.0506[0m     +  29.7100
      8   0.2703   0.8224        0.0503        0.0506        29.5308
      9   0.2689   0.8218        [35m0.0503[0m        0.0507        29.5700
Stopping since valid_loss has not improved in the last 3 epochs.
[32m[I 2023-01-10 00:07:47,970][0m Trial 173 finished with value: 0.2705800395870823 and parameters: {'lr': 0.0032030850216728645, 'dropout': 0.6737860992629807, 'd_model_multiplier': 4, 'num_layers': 3, 'n_heads': 8, 'dim_feedforward': 492, 'batch_size': 115, 'pos_encoding': 'fixed', 'activation': 'relu', 'norm': 'BatchNorm', 'optimizer_name': 'RAdam', 'weight_decay': 0.001}. Best is trial 122 with value: 0.40157405369010674.[0m
[EnsembleDataset] Initializing dataset...
	Examples: 27964
	Features: 621
	Max length: 316
[EnsembleDataset] Dataset initialization complete
  epoch    auprc    auroc    train_loss    valid_loss    cp      dur
-------  -------  -------  ------------  ------------  ----  -------
      1   [36m0.2934[0m   [32m0.8294[0m        [35m0.1529[0m        [31m0.0541[0m     +  30.5171
      2   0.2932   [32m0.8294[0m        [35m0.1373[0m        0.0543        30.0067
      3   0.2934   [32m0.8295[0m        0.1426        [31m0.0541[0m     +  29.8217
      4   0.2926   0.8288        0.1467        0.0545        29.7094
      5   0.2929   0.8290        [35m0.1355[0m        0.0544        30.2551
Stopping since valid_loss has not improved in the last 3 epochs.
[32m[I 2023-01-10 00:17:50,793][0m Trial 174 finished with value: 0.2934295994392806 and parameters: {'lr': 4.25730817630362e-09, 'dropout': 0.6665958696112434, 'd_model_multiplier': 4, 'num_layers': 1, 'n_heads': 8, 'dim_feedforward': 501, 'batch_size': 103, 'pos_encoding': 'fixed', 'activation': 'gelu', 'norm': 'BatchNorm', 'optimizer_name': 'RAdam', 'weight_decay': 0.001}. Best is trial 122 with value: 0.40157405369010674.[0m
[EnsembleDataset] Initializing dataset...
	Examples: 27964
	Features: 621
	Max length: 316
[EnsembleDataset] Dataset initialization complete
  epoch    auprc    auroc    train_loss    valid_loss    cp      dur
-------  -------  -------  ------------  ------------  ----  -------
      1   [36m0.2777[0m   [32m0.8137[0m        [35m0.1231[0m        [31m0.0497[0m     +  30.0632
      2   [36m0.2783[0m   [32m0.8175[0m        [35m0.0950[0m        [31m0.0497[0m     +  30.0016
      3   [36m0.2809[0m   [32m0.8205[0m        [35m0.0742[0m        [31m0.0496[0m     +  31.0353
      4   0.2796   0.8191        [35m0.0596[0m        0.0496        30.4262
      5   [36m0.2810[0m   [32m0.8212[0m        [35m0.0549[0m        0.0496        30.6107
Stopping since valid_loss has not improved in the last 3 epochs.
[32m[I 2023-01-10 00:27:51,893][0m Trial 175 finished with value: 0.2810443694390417 and parameters: {'lr': 0.00143169381305903, 'dropout': 0.6877490901176899, 'd_model_multiplier': 4, 'num_layers': 2, 'n_heads': 8, 'dim_feedforward': 475, 'batch_size': 134, 'pos_encoding': 'fixed', 'activation': 'relu', 'norm': 'BatchNorm', 'optimizer_name': 'RAdam', 'weight_decay': 0.001}. Best is trial 122 with value: 0.40157405369010674.[0m
[EnsembleDataset] Initializing dataset...
	Examples: 27964
	Features: 621
	Max length: 316
[EnsembleDataset] Dataset initialization complete
  epoch    auprc    auroc    train_loss    valid_loss    cp      dur
-------  -------  -------  ------------  ------------  ----  -------
      1   [36m0.2758[0m   [32m0.8230[0m        [35m0.0799[0m        [31m0.0637[0m     +  30.9674
      2   0.2746   0.8230        [35m0.0666[0m        [31m0.0586[0m     +  31.3893
      3   0.2693   0.8216        [35m0.0641[0m        0.0647        30.9825
      4   0.2742   0.8229        [35m0.0625[0m        [31m0.0579[0m     +  31.6178
      5   0.2733   0.8223        [35m0.0604[0m        0.0583        31.3236
      6   0.2736   0.8227        [35m0.0597[0m        0.0595        31.0269
      7   [36m0.2802[0m   [32m0.8234[0m        [35m0.0576[0m        [31m0.0512[0m     +  31.6849
      8   [36m0.2840[0m   [32m0.8237[0m        [35m0.0574[0m        [31m0.0509[0m     +  31.1895
      9   0.2796   [32m0.8252[0m        0.0577        0.0527        29.9004
     10   0.2778   0.8242        [35m0.0552[0m        0.0549        30.9825
Stopping since valid_loss has not improved in the last 3 epochs.
[32m[I 2023-01-10 00:47:45,791][0m Trial 176 finished with value: 0.2839544897343832 and parameters: {'lr': 2.3897948231275592e-05, 'dropout': 0.013493864990966723, 'd_model_multiplier': 8, 'num_layers': 3, 'n_heads': 8, 'dim_feedforward': 482, 'batch_size': 149, 'pos_encoding': 'fixed', 'activation': 'gelu', 'norm': 'BatchNorm', 'optimizer_name': 'RAdam', 'weight_decay': 0.1}. Best is trial 122 with value: 0.40157405369010674.[0m
[EnsembleDataset] Initializing dataset...
	Examples: 27964
	Features: 621
	Max length: 316
[EnsembleDataset] Dataset initialization complete
  epoch    auprc    auroc    train_loss    valid_loss    cp      dur
-------  -------  -------  ------------  ------------  ----  -------
      1   [36m0.2927[0m   [32m0.8398[0m        [35m0.1693[0m        [31m0.0513[0m     +  29.6229
      2   [36m0.3026[0m   0.8274        0.1799        0.0532        29.7631
      3   0.3013   0.8162        [35m0.0884[0m        0.0519        30.3350
      4   [36m0.3261[0m   [32m0.8466[0m        [35m0.0607[0m        [31m0.0489[0m     +  30.5058
      5   0.3244   0.8435        [35m0.0531[0m        0.0492        29.8809
      6   0.3246   0.8409        [35m0.0521[0m        0.0496        30.4285
Stopping since valid_loss has not improved in the last 3 epochs.
[32m[I 2023-01-10 00:59:43,077][0m Trial 177 finished with value: 0.3260757542852418 and parameters: {'lr': 0.0004935279355240485, 'dropout': 0.6153834108193768, 'd_model_multiplier': 32, 'num_layers': 2, 'n_heads': 8, 'dim_feedforward': 512, 'batch_size': 68, 'pos_encoding': 'fixed', 'activation': 'gelu', 'norm': 'BatchNorm', 'optimizer_name': 'RAdam', 'weight_decay': 0.1}. Best is trial 122 with value: 0.40157405369010674.[0m
[EnsembleDataset] Initializing dataset...
	Examples: 27964
	Features: 621
	Max length: 316
[EnsembleDataset] Dataset initialization complete
  epoch    auprc    auroc    train_loss    valid_loss    cp      dur
-------  -------  -------  ------------  ------------  ----  -------
      1   [36m0.2362[0m   [32m0.8221[0m        [35m0.1382[0m        [31m0.0483[0m     +  29.9090
      2   0.2341   [32m0.8258[0m        [35m0.1222[0m        [31m0.0481[0m     +  29.6682
      3   0.2342   [32m0.8283[0m        [35m0.1009[0m        0.0482        30.4087
      4   [36m0.2368[0m   [32m0.8312[0m        [35m0.0873[0m        0.0481        29.8431
      5   [36m0.2370[0m   [32m0.8329[0m        [35m0.0767[0m        [31m0.0480[0m     +  30.3504
      6   0.2367   [32m0.8343[0m        [35m0.0686[0m        0.0483        30.9659
      7   0.2360   0.8329        [35m0.0663[0m        0.0481        30.4824
Stopping since valid_loss has not improved in the last 3 epochs.
[32m[I 2023-01-10 01:13:42,368][0m Trial 178 finished with value: 0.23700659563064178 and parameters: {'lr': 9.254259520863614e-05, 'dropout': 0.6460859622751699, 'd_model_multiplier': 4, 'num_layers': 3, 'n_heads': 8, 'dim_feedforward': 493, 'batch_size': 79, 'pos_encoding': 'fixed', 'activation': 'relu', 'norm': 'BatchNorm', 'optimizer_name': 'RAdam', 'weight_decay': 0}. Best is trial 122 with value: 0.40157405369010674.[0m
[EnsembleDataset] Initializing dataset...
	Examples: 27964
	Features: 621
	Max length: 316
[EnsembleDataset] Dataset initialization complete
  epoch    auprc    auroc    train_loss    valid_loss    cp      dur
-------  -------  -------  ------------  ------------  ----  -------
      1   [36m0.2871[0m   [32m0.8262[0m        [35m0.1672[0m        [31m0.0450[0m     +  87.7185
      2   [36m0.2872[0m   [32m0.8263[0m        0.1877        0.0450        87.4294
      3   0.2871   0.8259        0.1698        [31m0.0450[0m     +  87.4580
      4   0.2871   0.8258        [35m0.1457[0m        0.0450        87.5599
      5   0.2870   0.8258        0.1752        0.0450        88.3542
      6   [36m0.2877[0m   [32m0.8263[0m        0.1656        [31m0.0449[0m     +  87.5632
      7   0.2873   0.8261        0.1538        [31m0.0449[0m     +  87.4017
      8   0.2872   0.8263        0.1490        [31m0.0449[0m     +  88.0386
      9   0.2868   0.8253        0.2504        0.0449        87.5013
     10   0.2876   0.8261        0.2359        0.0449        87.3730
Stopping since valid_loss has not improved in the last 3 epochs.
[32m[I 2023-01-10 01:43:59,487][0m Trial 179 finished with value: 0.2876528812584414 and parameters: {'lr': 0.00025580327167164794, 'dropout': 0.6984714656690038, 'd_model_multiplier': 32, 'num_layers': 15, 'n_heads': 8, 'dim_feedforward': 136, 'batch_size': 119, 'pos_encoding': 'fixed', 'activation': 'gelu', 'norm': 'BatchNorm', 'optimizer_name': 'RAdam', 'weight_decay': 0.1}. Best is trial 122 with value: 0.40157405369010674.[0m
[EnsembleDataset] Initializing dataset...
	Examples: 27964
	Features: 621
	Max length: 316
[EnsembleDataset] Dataset initialization complete
  epoch    auprc    auroc    train_loss    valid_loss    cp      dur
-------  -------  -------  ------------  ------------  ----  -------
      1   [36m0.2773[0m   [32m0.8290[0m        [35m0.1146[0m        [31m0.0527[0m     +  58.7310
      2   [36m0.2786[0m   [32m0.8291[0m        [35m0.1111[0m        [31m0.0520[0m     +  58.7184
      3   0.2773   0.8286        [35m0.1034[0m        0.0525        58.7334
      4   [36m0.2787[0m   0.8290        0.1106        [31m0.0512[0m     +  58.9272
      5   0.2782   [32m0.8293[0m        0.1125        0.0528        58.6646
      6   0.2772   0.8289        0.1161        0.0523        58.8040
Stopping since valid_loss has not improved in the last 3 epochs.
[32m[I 2023-01-10 01:59:16,888][0m Trial 180 finished with value: 0.27869323167018056 and parameters: {'lr': 7.044116721863319e-09, 'dropout': 0.4769864638225205, 'd_model_multiplier': 4, 'num_layers': 2, 'n_heads': 64, 'dim_feedforward': 471, 'batch_size': 98, 'pos_encoding': 'fixed', 'activation': 'relu', 'norm': 'BatchNorm', 'optimizer_name': 'PlainRAdam', 'weight_decay': 0}. Best is trial 122 with value: 0.40157405369010674.[0m
[EnsembleDataset] Initializing dataset...
	Examples: 27964
	Features: 621
	Max length: 316
[EnsembleDataset] Dataset initialization complete
  epoch    auprc    auroc    train_loss    valid_loss    cp      dur
-------  -------  -------  ------------  ------------  ----  -------
      1   [36m0.3038[0m   [32m0.8476[0m        [35m0.1419[0m        [31m0.0470[0m     +  29.3662
      2   [36m0.3046[0m   0.8471        [35m0.1277[0m        [31m0.0469[0m     +  30.4619
      3   [36m0.3053[0m   [32m0.8482[0m        [35m0.1171[0m        0.0470        29.7027
      4   0.3048   0.8479        [35m0.0934[0m        [31m0.0469[0m     +  30.3623
      5   0.3050   [32m0.8485[0m        [35m0.0835[0m        0.0469        30.2164
      6   0.3047   0.8480        [35m0.0736[0m        0.0469        29.8917
Stopping since valid_loss has not improved in the last 3 epochs.
[32m[I 2023-01-10 02:11:08,047][0m Trial 181 finished with value: 0.3053234618515253 and parameters: {'lr': 0.00018437223994010154, 'dropout': 0.6723282843911544, 'd_model_multiplier': 4, 'num_layers': 2, 'n_heads': 8, 'dim_feedforward': 478, 'batch_size': 140, 'pos_encoding': 'fixed', 'activation': 'relu', 'norm': 'BatchNorm', 'optimizer_name': 'RAdam', 'weight_decay': 0.1}. Best is trial 122 with value: 0.40157405369010674.[0m
[EnsembleDataset] Initializing dataset...
	Examples: 27964
	Features: 621
	Max length: 316
[EnsembleDataset] Dataset initialization complete
  epoch    auprc    auroc    train_loss    valid_loss    cp      dur
-------  -------  -------  ------------  ------------  ----  -------
      1   [36m0.2650[0m   [32m0.8470[0m        [35m0.1383[0m        [31m0.0407[0m     +  31.8771
      2   [36m0.2674[0m   [32m0.8501[0m        0.1528        [31m0.0404[0m     +  31.5494
      3   [36m0.2713[0m   0.8499        0.1413        [31m0.0404[0m     +  31.3776
      4   0.2694   [32m0.8506[0m        0.1595        [31m0.0404[0m     +  31.7052
      5   [36m0.2739[0m   [32m0.8529[0m        0.1597        [31m0.0402[0m     +  31.4220
      6   0.2714   0.8523        0.1448        0.0403        32.3267
      7   0.2696   0.8519        0.1554        0.0405        31.7527
Stopping since valid_loss has not improved in the last 3 epochs.
[32m[I 2023-01-10 02:25:06,262][0m Trial 182 finished with value: 0.2738657557155711 and parameters: {'lr': 5.223127268800987e-05, 'dropout': 0.6607078014455914, 'd_model_multiplier': 64, 'num_layers': 2, 'n_heads': 8, 'dim_feedforward': 479, 'batch_size': 130, 'pos_encoding': 'fixed', 'activation': 'relu', 'norm': 'BatchNorm', 'optimizer_name': 'RAdam', 'weight_decay': 0.1}. Best is trial 122 with value: 0.40157405369010674.[0m
[EnsembleDataset] Initializing dataset...
	Examples: 27964
	Features: 621
	Max length: 316
[EnsembleDataset] Dataset initialization complete
  epoch    auprc    auroc    train_loss    valid_loss    cp      dur
-------  -------  -------  ------------  ------------  ----  -------
      1   [36m0.2712[0m   [32m0.8041[0m        [35m0.1359[0m        [31m0.0598[0m     +  28.2020
      2   [36m0.2791[0m   [32m0.8056[0m        0.1369        0.0602        28.4765
      3   0.2789   0.8051        [35m0.1129[0m        [31m0.0578[0m     +  29.6297
      4   [36m0.2794[0m   0.8047        0.1182        [31m0.0575[0m     +  29.4852
      5   0.2760   [32m0.8094[0m        [35m0.0919[0m        0.0585        29.9433
      6   0.2750   0.8081        0.1014        0.0578        29.7233
Stopping since valid_loss has not improved in the last 3 epochs.
[32m[I 2023-01-10 02:37:03,042][0m Trial 183 finished with value: 0.27939249071641276 and parameters: {'lr': 0.00013070104383030827, 'dropout': 0.6749959562854524, 'd_model_multiplier': 8, 'num_layers': 1, 'n_heads': 8, 'dim_feedforward': 463, 'batch_size': 145, 'pos_encoding': 'fixed', 'activation': 'relu', 'norm': 'BatchNorm', 'optimizer_name': 'RAdam', 'weight_decay': 0.1}. Best is trial 122 with value: 0.40157405369010674.[0m
[EnsembleDataset] Initializing dataset...
	Examples: 27964
	Features: 621
	Max length: 316
[EnsembleDataset] Dataset initialization complete
  epoch    auprc    auroc    train_loss    valid_loss    cp      dur
-------  -------  -------  ------------  ------------  ----  -------
      1   [36m0.2792[0m   [32m0.8263[0m        [35m0.2000[0m        [31m0.0467[0m     +  30.6369
      2   0.2666   0.8257        0.3398        0.0545        30.7027
      3   0.2755   [32m0.8396[0m        0.3317        0.0471        31.1196
Stopping since valid_loss has not improved in the last 3 epochs.
[32m[I 2023-01-10 02:43:21,532][0m Trial 184 finished with value: 0.27924895405695027 and parameters: {'lr': 0.00031394186479112053, 'dropout': 0.6998187568738167, 'd_model_multiplier': 64, 'num_layers': 2, 'n_heads': 8, 'dim_feedforward': 503, 'batch_size': 105, 'pos_encoding': 'fixed', 'activation': 'relu', 'norm': 'BatchNorm', 'optimizer_name': 'RAdam', 'weight_decay': 0.1}. Best is trial 122 with value: 0.40157405369010674.[0m
[EnsembleDataset] Initializing dataset...
	Examples: 27964
	Features: 621
	Max length: 316
[EnsembleDataset] Dataset initialization complete
  epoch    auprc    auroc    train_loss    valid_loss    cp      dur
-------  -------  -------  ------------  ------------  ----  -------
      1   [36m0.3156[0m   [32m0.8222[0m        [35m0.1142[0m        [31m0.0535[0m     +  29.8312
      2   [36m0.3157[0m   [32m0.8223[0m        0.1213        [31m0.0535[0m     +  30.0134
      3   [36m0.3158[0m   [32m0.8225[0m        0.1218        [31m0.0535[0m     +  30.3155
      4   0.3158   0.8225        [35m0.1140[0m        0.0535        30.4368
      5   0.3156   0.8223        [35m0.1123[0m        0.0535        31.2955
Stopping since valid_loss has not improved in the last 3 epochs.
[32m[I 2023-01-10 02:53:23,462][0m Trial 185 finished with value: 0.31577125057154737 and parameters: {'lr': 2.871729664160006e-09, 'dropout': 0.6319987863774537, 'd_model_multiplier': 16, 'num_layers': 3, 'n_heads': 8, 'dim_feedforward': 487, 'batch_size': 135, 'pos_encoding': 'fixed', 'activation': 'relu', 'norm': 'BatchNorm', 'optimizer_name': 'RAdam', 'weight_decay': 0.1}. Best is trial 122 with value: 0.40157405369010674.[0m
[EnsembleDataset] Initializing dataset...
	Examples: 27964
	Features: 621
	Max length: 316
[EnsembleDataset] Dataset initialization complete
  epoch    auprc    auroc    train_loss    valid_loss    cp      dur
-------  -------  -------  ------------  ------------  ----  -------
      1   [36m0.1651[0m   [32m0.6490[0m        [35m0.1063[0m        [31m0.0791[0m     +  30.2845
      2   [36m0.2770[0m   [32m0.8171[0m        0.1342        [31m0.0686[0m     +  30.3588
      3   [36m0.3310[0m   [32m0.8442[0m        [35m0.0675[0m        [31m0.0502[0m     +  30.5528
      4   [36m0.3354[0m   [32m0.8549[0m        [35m0.0579[0m        [31m0.0468[0m     +  29.8654
      5   0.3351   0.8525        [35m0.0550[0m        [31m0.0466[0m     +  30.3496
      6   [36m0.3428[0m   0.8475        [35m0.0545[0m        [31m0.0458[0m     +  29.6182
      7   0.3360   0.8480        [35m0.0536[0m        0.0462        29.7175
      8   0.3246   0.8469        [35m0.0531[0m        0.0477        29.9110
Stopping since valid_loss has not improved in the last 3 epochs.
