[32m[I 2023-05-02 18:42:37,415][0m Trial 189 finished with value: 0.22445629099260075 and parameters: {'lr': 0.0005809389825392102, 'dropout': 0.46736973741133203, 'd_model_multiplier': 4, 'num_layers': 4, 'n_heads': 64, 'dim_feedforward': 409, 'batch_size': 65, 'pos_encoding': 'fixed', 'activation': 'relu', 'norm': 'LayerNorm', 'optimizer_name': 'AdamW', 'weight_decay': 0.1, 'top_n_features': 50}. Best is trial 117 with value: 0.191397856754288.[0m
[FileBasedDataset] Initializing dataset...
	Examples: 8264
	Features: 50
	Max length: 315
Standard scalar turned ON, loading params from cache
[FileBasedDataset] Dataset initialization complete
  epoch    auprc    auroc    train_loss    valid_acc    valid_loss    cp      dur
-------  -------  -------  ------------  -----------  ------------  ----  -------
      1   [36m0.3248[0m   [32m0.7719[0m        [35m0.3397[0m       [31m0.9129[0m        [94m0.3622[0m     +  35.4858
      2   [36m0.3383[0m   [32m0.7935[0m        [35m0.2595[0m       [31m0.9154[0m        [94m0.3166[0m     +  35.6950
      3   [36m0.3558[0m   [32m0.8037[0m        [35m0.2542[0m       [31m0.9178[0m        [94m0.2979[0m     +  35.8855
      4   0.3470   0.8017        [35m0.2503[0m       0.9129        [94m0.2795[0m     +  35.5632
      5   0.3385   [32m0.8094[0m        [35m0.2446[0m       0.9166        [94m0.2768[0m     +  35.9828
      6   0.3414   0.8054        [35m0.2408[0m       0.9141        [94m0.2669[0m     +  35.6478
      7   0.3315   0.7986        [35m0.2407[0m       [31m0.9190[0m        [94m0.2511[0m     +  36.0550
      8   0.3235   0.8082        [35m0.2372[0m       0.9117        0.2533        35.7389
      9   0.3135   0.7934        [35m0.2306[0m       0.9093        0.2551        36.1767
     10   0.3318   0.7920        0.2311       0.9154        [94m0.2494[0m     +  35.7480
     11   0.3168   0.7901        [35m0.2306[0m       0.9141        0.2500        35.9570
     12   0.3396   0.8000        [35m0.2290[0m       0.9166        [94m0.2430[0m     +  35.7933
     13   0.3274   0.7957        [35m0.2273[0m       0.9190        [94m0.2426[0m     +  35.7689
     14   0.3343   0.8022        [35m0.2245[0m       0.9166        [94m0.2422[0m     +  35.6172
     15   0.3266   0.7955        [35m0.2232[0m       0.9105        0.2534        35.6884
     16   0.3193   0.7884        [35m0.2194[0m       0.9093        0.2517        35.8835
     17   0.3107   0.7810        0.2207       0.9129        0.2492        35.7874
     18   0.2982   0.7979        0.2194       0.9117        0.2557        35.8242
     19   0.3102   0.7619        [35m0.2164[0m       0.9129        0.2544        36.0421
     20   0.3107   0.7717        [35m0.2126[0m       0.9141        0.2606        35.9450
     21   0.2832   0.7575        0.2139       0.9081        0.2659        35.8132
     22   0.3028   0.7852        0.2168       0.9105        0.2526        35.7544
     23   0.3244   0.7877        [35m0.2115[0m       0.9081        0.2512        35.4991
Stopping since valid_loss has not improved in the last 10 epochs.
[32m[I 2023-05-02 18:56:58,095][0m Trial 190 finished with value: 0.24215590474539253 and parameters: {'lr': 0.0002703106330515357, 'dropout': 0.4780679205945861, 'd_model_multiplier': 4, 'num_layers': 4, 'n_heads': 64, 'dim_feedforward': 414, 'batch_size': 59, 'pos_encoding': 'fixed', 'activation': 'gelu', 'norm': 'BatchNorm', 'optimizer_name': 'PlainRAdam', 'weight_decay': 0.1, 'top_n_features': 50}. Best is trial 117 with value: 0.191397856754288.[0m
[FileBasedDataset] Initializing dataset...
	Examples: 8264
	Features: 44
	Max length: 315
Standard scalar turned ON, loading params from cache
[FileBasedDataset] Dataset initialization complete
  epoch    auprc    auroc    train_loss    valid_acc    valid_loss    cp      dur
-------  -------  -------  ------------  -----------  ------------  ----  -------
      1   [36m0.2627[0m   [32m0.7423[0m        [35m0.3257[0m       [31m0.9021[0m        [94m0.3524[0m     +  27.9674
      2   0.2530   [32m0.7487[0m        [35m0.2547[0m       [31m0.9129[0m        [94m0.3112[0m     +  28.0602
      3   0.2517   [32m0.7664[0m        [35m0.2481[0m       0.9105        [94m0.2990[0m     +  28.3393
      4   0.2571   [32m0.7705[0m        [35m0.2420[0m       [31m0.9141[0m        [94m0.2778[0m     +  28.3143
      5   0.2526   [32m0.7867[0m        [35m0.2369[0m       0.9081        [94m0.2768[0m     +  28.1630
      6   0.2379   0.7847        [35m0.2351[0m       0.9093        [94m0.2672[0m     +  28.1933
      7   0.2365   [32m0.7871[0m        [35m0.2296[0m       0.9105        0.2752        28.4870
      8   0.2402   0.7821        0.2311       0.9141        [94m0.2633[0m     +  28.2756
      9   0.2191   0.7565        0.2299       0.9117        0.2678        28.2588
     10   0.2598   0.7665        0.2308       0.9141        [94m0.2621[0m     +  28.1477
     11   0.2336   0.7839        [35m0.2292[0m       0.9081        0.2651        28.2175
     12   0.2353   0.7735        [35m0.2201[0m       [31m0.9154[0m        0.2669        28.2082
     13   0.2341   0.7836        0.2212       0.9093        0.2741        28.3887
     14   0.2412   [32m0.7940[0m        [35m0.2201[0m       0.9117        0.2703        28.4477
     15   0.2570   0.7939        0.2251       [31m0.9166[0m        0.2656        28.4324
     16   0.2511   0.7931        [35m0.2182[0m       0.9105        [94m0.2549[0m     +  28.5188
     17   0.2593   0.7908        0.2214       0.9154        0.2654        28.1292
     18   0.2499   0.7874        [35m0.2149[0m       0.9154        0.2684        28.2630
     19   0.2569   0.7853        0.2166       [31m0.9178[0m        0.2729        28.1976
     20   0.2248   0.7810        [35m0.2147[0m       0.9093        0.2856        28.1955
     21   0.2467   0.7862        0.2148       0.9069        0.2786        28.2487
     22   [36m0.2844[0m   0.7910        [35m0.2108[0m       [31m0.9190[0m        0.2648        28.6720
     23   0.2550   0.7899        0.2122       0.9141        0.2777        28.3303
     24   0.2542   0.7875        [35m0.2082[0m       0.9117        0.2703        28.3228
     25   0.2575   0.7918        0.2093       0.9129        0.2640        28.2021
Stopping since valid_loss has not improved in the last 10 epochs.
[32m[I 2023-05-02 19:09:14,849][0m Trial 191 finished with value: 0.2548786903739408 and parameters: {'lr': 0.0003768387756067129, 'dropout': 0.4621680175841575, 'd_model_multiplier': 4, 'num_layers': 3, 'n_heads': 64, 'dim_feedforward': 430, 'batch_size': 61, 'pos_encoding': 'fixed', 'activation': 'gelu', 'norm': 'BatchNorm', 'optimizer_name': 'PlainRAdam', 'weight_decay': 0.1, 'top_n_features': 44}. Best is trial 117 with value: 0.191397856754288.[0m
[FileBasedDataset] Initializing dataset...
	Examples: 8264
	Features: 38
	Max length: 315
Standard scalar turned ON, loading params from cache
[FileBasedDataset] Dataset initialization complete
  epoch    auprc    auroc    train_loss    valid_acc    valid_loss    cp      dur
-------  -------  -------  ------------  -----------  ------------  ----  -------
      1   [36m0.2748[0m   [32m0.7146[0m        [35m0.3638[0m       [31m0.9105[0m        [94m0.3856[0m     +  26.9714
      2   0.2728   [32m0.7466[0m        [35m0.2599[0m       [31m0.9141[0m        [94m0.3280[0m     +  26.9436
      3   [36m0.2877[0m   [32m0.7693[0m        [35m0.2523[0m       0.9129        [94m0.3065[0m     +  27.3301
      4   [36m0.2926[0m   [32m0.7903[0m        [35m0.2507[0m       0.9117        [94m0.2851[0m     +  27.2196
      5   0.2900   0.7832        [35m0.2465[0m       [31m0.9154[0m        [94m0.2731[0m     +  27.1577
      6   0.2914   0.7867        [35m0.2423[0m       [31m0.9166[0m        [94m0.2704[0m     +  27.1618
      7   [36m0.2989[0m   0.7849        [35m0.2361[0m       0.9166        [94m0.2614[0m     +  27.3054
      8   [36m0.3069[0m   0.7901        [35m0.2353[0m       0.9081        0.2683        27.4036
      9   0.3046   0.7894        [35m0.2311[0m       [31m0.9190[0m        [94m0.2608[0m     +  27.6958
     10   0.2945   [32m0.7989[0m        0.2314       0.9190        [94m0.2581[0m     +  27.4152
     11   0.2799   0.7970        [35m0.2270[0m       0.9141        0.2626        27.1557
     12   0.2764   0.7950        [35m0.2254[0m       0.9141        0.2631        27.0160
     13   0.3051   [32m0.8023[0m        0.2275       [31m0.9202[0m        [94m0.2537[0m     +  27.2992
     14   0.2899   0.7986        [35m0.2213[0m       0.9178        0.2545        27.1849
     15   0.3040   [32m0.8082[0m        0.2233       0.9129        0.2554        27.1422
     16   0.2948   [32m0.8100[0m        0.2235       0.9117        [94m0.2501[0m     +  27.1615
     17   [36m0.3122[0m   0.7996        [35m0.2179[0m       0.9154        [94m0.2471[0m     +  27.6107
     18   0.3116   0.8026        0.2190       0.9190        [94m0.2462[0m     +  27.2677
     19   0.3106   0.8025        [35m0.2162[0m       0.9129        0.2481        27.1031
     20   [36m0.3204[0m   [32m0.8157[0m        0.2175       0.9129        [94m0.2450[0m     +  27.0878
     21   [36m0.3266[0m   0.8152        [35m0.2146[0m       0.9154        [94m0.2434[0m     +  27.2639
     22   0.3147   0.8099        [35m0.2124[0m       0.9141        0.2470        27.1693
     23   0.3228   0.8123        0.2145       0.9117        0.2515        27.2688
     24   0.2995   [32m0.8190[0m        0.2138       0.9105        0.2458        27.2740
     25   [36m0.3387[0m   0.8113        [35m0.2102[0m       0.9141        0.2482        27.3000
     26   [36m0.3506[0m   0.8158        0.2139       0.9178        0.2463        27.3979
     27   0.3381   0.8096        [35m0.2076[0m       0.9154        0.2462        27.1196
     28   0.3382   [32m0.8234[0m        0.2111       0.9154        0.2445        27.2835
     29   0.3095   0.8167        0.2116       0.9129        0.2488        27.0170
     30   [36m0.3587[0m   0.8206        [35m0.2065[0m       0.9117        [94m0.2424[0m     +  27.1098
     31   0.3468   0.8143        0.2096       0.9141        0.2430        27.4789
     32   0.3430   0.8132        0.2091       0.9129        0.2452        27.2913
     33   0.3249   0.8110        0.2086       0.9129        0.2524        27.1580
     34   0.3498   0.8156        [35m0.2042[0m       0.9129        0.2433        27.1816
     35   0.3274   0.8118        0.2065       0.9129        0.2452        27.0587
     36   0.3249   0.8089        [35m0.2031[0m       0.9154        0.2509        27.2322
     37   0.3047   0.8016        0.2064       0.9093        0.2577        27.1590
     38   0.3015   0.7969        0.2032       0.9129        0.2601        27.3238
     39   0.2911   0.7961        [35m0.2010[0m       0.9117        0.2590        27.2177
Stopping since valid_loss has not improved in the last 10 epochs.
[32m[I 2023-05-02 19:27:26,153][0m Trial 192 finished with value: 0.24243191605323458 and parameters: {'lr': 0.0005807392501049608, 'dropout': 0.49273801870109835, 'd_model_multiplier': 2, 'num_layers': 3, 'n_heads': 64, 'dim_feedforward': 421, 'batch_size': 71, 'pos_encoding': 'fixed', 'activation': 'gelu', 'norm': 'BatchNorm', 'optimizer_name': 'PlainRAdam', 'weight_decay': 0.1, 'top_n_features': 38}. Best is trial 117 with value: 0.191397856754288.[0m
[FileBasedDataset] Initializing dataset...
	Examples: 8264
	Features: 33
	Max length: 315
Standard scalar turned ON, loading params from cache
[FileBasedDataset] Dataset initialization complete
  epoch    auprc    auroc    train_loss    valid_acc    valid_loss    cp     dur
-------  -------  -------  ------------  -----------  ------------  ----  ------
      1   [36m0.2006[0m   [32m0.6628[0m        [35m0.4239[0m       [31m0.9214[0m        [94m0.3016[0m     +  9.0608
      2   [36m0.3203[0m   [32m0.7439[0m        [35m0.2707[0m       0.9214        [94m0.2502[0m     +  9.8499
      3   [36m0.3387[0m   [32m0.7599[0m        [35m0.2600[0m       [31m0.9238[0m        [94m0.2377[0m     +  10.0668
      4   [36m0.3421[0m   0.7471        [35m0.2523[0m       0.9226        0.2424        9.5693
      5   [36m0.3812[0m   [32m0.7784[0m        0.2529       [31m0.9250[0m        0.2425        9.5900
      6   [36m0.3891[0m   0.7722        [35m0.2488[0m       0.9226        [94m0.2352[0m     +  9.3680
      7   [36m0.3986[0m   [32m0.7799[0m        [35m0.2417[0m       [31m0.9299[0m        [94m0.2251[0m     +  9.5704
      8   [36m0.4055[0m   [32m0.7897[0m        0.2423       0.9250        [94m0.2248[0m     +  9.6072
      9   0.4016   [32m0.7947[0m        [35m0.2414[0m       0.9238        [94m0.2229[0m     +  9.7829
     10   [36m0.4137[0m   0.7946        [35m0.2405[0m       [31m0.9311[0m        [94m0.2221[0m     +  9.7652
     11   [36m0.4321[0m   [32m0.8059[0m        [35m0.2363[0m       0.9311        [94m0.2175[0m     +  9.7877
     12   [36m0.4326[0m   [32m0.8093[0m        0.2386       0.9311        [94m0.2156[0m     +  9.6547
     13   [36m0.4408[0m   [32m0.8111[0m        0.2389       0.9287        0.2168        9.6626
     14   0.4391   [32m0.8222[0m        [35m0.2326[0m       0.9299        [94m0.2136[0m     +  9.4325
     15   0.4387   0.8168        0.2343       [31m0.9335[0m        0.2142        9.5225
     16   0.4267   0.8187        [35m0.2325[0m       0.9299        0.2152        9.5119
     17   0.4289   0.8206        [35m0.2309[0m       0.9299        0.2146        10.0268
     18   0.4235   0.8199        0.2314       0.9311        0.2150        9.2830
     19   [36m0.4430[0m   [32m0.8289[0m        [35m0.2298[0m       0.9311        [94m0.2118[0m     +  9.3640
     20   0.4308   0.8163        0.2304       0.9287        0.2194        9.2467
     21   0.4204   0.8230        0.2309       0.9274        0.2170        9.6042
     22   0.4345   [32m0.8441[0m        [35m0.2273[0m       0.9287        [94m0.2088[0m     +  9.3739
     23   [36m0.4446[0m   0.8365        [35m0.2245[0m       0.9311        0.2116        9.5403
     24   0.4241   0.8237        0.2257       0.9262        0.2132        9.3174
     25   0.4377   [32m0.8470[0m        0.2272       0.9250        [94m0.2064[0m     +  8.8240
     26   [36m0.4457[0m   [32m0.8513[0m        0.2265       0.9323        0.2066        9.2698
     27   [36m0.4480[0m   [32m0.8549[0m        0.2249       0.9287        [94m0.2036[0m     +  9.2908
     28   0.4480   0.8506        0.2248       0.9274        0.2048        9.5962
     29   [36m0.4500[0m   0.8441        0.2259       0.9299        0.2055        9.4713
     30   [36m0.4599[0m   0.8487        [35m0.2232[0m       0.9299        0.2054        9.3284
     31   0.4548   0.8459        0.2244       0.9287        0.2080        9.6343
     32   0.4470   [32m0.8611[0m        0.2246       0.9287        0.2123        9.6927
     33   0.4463   0.8512        [35m0.2223[0m       0.9299        0.2056        9.3573
     34   [36m0.4642[0m   0.8575        0.2230       0.9299        [94m0.2011[0m     +  9.2428
     35   0.4582   0.8553        [35m0.2200[0m       0.9311        0.2024        9.4851
     36   [36m0.4643[0m   0.8570        0.2206       [31m0.9347[0m        0.2083        9.1915
     37   0.4594   0.8572        [35m0.2200[0m       0.9311        0.2076        9.3002
     38   [36m0.4669[0m   0.8589        0.2224       0.9262        0.2039        9.3624
     39   [36m0.4776[0m   [32m0.8612[0m        0.2211       0.9335        0.2042        9.5138
     40   0.4660   0.8608        [35m0.2189[0m       0.9287        [94m0.2010[0m     +  9.3952
     41   0.4556   [32m0.8654[0m        0.2201       0.9323        0.2012        9.2606
     42   0.4620   0.8623        0.2192       0.9323        0.2031        9.4626
     43   0.4326   0.8589        0.2202       0.9262        0.2085        9.5420
     44   0.4584   0.8633        [35m0.2184[0m       0.9311        0.2035        9.1400
     45   0.4683   [32m0.8667[0m        0.2196       0.9299        [94m0.1994[0m     +  9.5819
     46   0.4678   [32m0.8682[0m        0.2188       0.9274        0.1998        9.8974
     47   [36m0.4796[0m   0.8669        0.2186       0.9311        [94m0.1975[0m     +  9.6158
     48   [36m0.4841[0m   [32m0.8692[0m        [35m0.2178[0m       0.9299        [94m0.1965[0m     +  9.4929
     49   [36m0.4963[0m   0.8686        0.2201       0.9311        0.2051        9.4369
     50   0.4645   0.8680        0.2184       0.9311        0.2028        9.2607
