[32m[I 2023-05-04 19:10:34,756][0m Trial 483 finished with value: 0.22253391319635846 and parameters: {'lr': 0.0031929823809267125, 'dropout': 0.5273310411881164, 'd_model_multiplier': 16, 'num_layers': 3, 'n_heads': 4, 'dim_feedforward': 172, 'batch_size': 24, 'pos_encoding': 'fixed', 'activation': 'relu', 'norm': 'LayerNorm', 'optimizer_name': 'RAdam', 'weight_decay': 0.1, 'top_n_features': 62}. Best is trial 246 with value: 0.16447311791139763.[0m
[FileBasedDataset] Initializing dataset...
	Examples: 8264
	Features: 48
	Max length: 315
Standard scalar turned ON, loading params from cache
[FileBasedDataset] Dataset initialization complete
  epoch    auprc    auroc    train_loss    valid_acc    valid_loss    cp      dur
-------  -------  -------  ------------  -----------  ------------  ----  -------
      1   [36m0.0824[0m   [32m0.3508[0m        [35m0.6100[0m       [31m0.9202[0m        [94m0.4865[0m     +  33.0439
      2   [36m0.0899[0m   [32m0.3912[0m        [35m0.4093[0m       0.9202        [94m0.3270[0m     +  33.3778
      3   [36m0.1434[0m   [32m0.5478[0m        [35m0.3030[0m       0.9202        [94m0.2803[0m     +  33.3613
      4   [36m0.1671[0m   [32m0.6191[0m        [35m0.2682[0m       0.9202        [94m0.2686[0m     +  33.5125
      5   [36m0.1742[0m   [32m0.6572[0m        [35m0.2533[0m       0.9190        [94m0.2652[0m     +  33.5343
      6   [36m0.1791[0m   [32m0.6839[0m        [35m0.2450[0m       0.9166        [94m0.2646[0m     +  33.6929
      7   [36m0.1840[0m   [32m0.7022[0m        [35m0.2393[0m       0.9105        0.2658        33.4464
      8   [36m0.1880[0m   [32m0.7083[0m        [35m0.2347[0m       0.9069        0.2675        33.4243
      9   [36m0.1924[0m   [32m0.7129[0m        [35m0.2331[0m       0.9069        0.2679        33.4501
     10   [36m0.1966[0m   [32m0.7165[0m        [35m0.2314[0m       0.9117        0.2677        33.6329
     11   [36m0.2059[0m   [32m0.7218[0m        [35m0.2299[0m       0.9117        0.2670        33.4920
     12   [36m0.2089[0m   [32m0.7253[0m        [35m0.2295[0m       0.9129        0.2654        33.4028
     13   [36m0.2119[0m   [32m0.7289[0m        [35m0.2277[0m       0.9141        [94m0.2645[0m     +  33.3542
     14   [36m0.2169[0m   [32m0.7323[0m        0.2285       0.9129        [94m0.2634[0m     +  33.3730
     15   [36m0.2172[0m   [32m0.7344[0m        [35m0.2269[0m       0.9141        0.2636        33.5132
     16   [36m0.2215[0m   [32m0.7366[0m        [35m0.2265[0m       0.9129        [94m0.2626[0m     +  33.3929
     17   0.2210   [32m0.7394[0m        [35m0.2259[0m       0.9129        [94m0.2619[0m     +  33.5118
     18   [36m0.2251[0m   [32m0.7417[0m        0.2265       0.9105        [94m0.2619[0m     +  33.3632
     19   [36m0.2281[0m   [32m0.7447[0m        [35m0.2253[0m       0.9093        [94m0.2610[0m     +  33.5774
     20   [36m0.2289[0m   [32m0.7462[0m        0.2266       0.9105        [94m0.2605[0m     +  33.5591
     21   0.2284   [32m0.7474[0m        [35m0.2251[0m       0.9105        [94m0.2601[0m     +  33.3519
     22   0.2274   [32m0.7486[0m        [35m0.2243[0m       0.9093        0.2603        33.6103
     23   0.2287   [32m0.7498[0m        0.2246       0.9105        [94m0.2598[0m     +  33.4026
     24   [36m0.2299[0m   [32m0.7506[0m        [35m0.2239[0m       0.9093        [94m0.2589[0m     +  33.4274
     25   0.2282   [32m0.7517[0m        [35m0.2227[0m       0.9081        0.2601        33.4081
     26   0.2271   [32m0.7521[0m        0.2232       0.9057        0.2607        33.4847
     27   0.2289   [32m0.7545[0m        0.2230       0.9057        0.2597        33.5727
     28   0.2298   [32m0.7548[0m        0.2232       0.9069        0.2597        33.5872
     29   [36m0.2299[0m   [32m0.7554[0m        [35m0.2221[0m       0.9069        0.2593        33.5536
     30   [36m0.2306[0m   0.7553        [35m0.2216[0m       0.9069        0.2599        33.5841
     31   [36m0.2332[0m   [32m0.7560[0m        0.2222       0.9069        0.2591        33.4693
     32   0.2317   0.7558        [35m0.2211[0m       0.9069        0.2597        33.3912
     33   [36m0.2340[0m   [32m0.7574[0m        0.2228       0.9069        0.2600        33.6269
     34   [36m0.2346[0m   [32m0.7588[0m        [35m0.2205[0m       0.9057        [94m0.2586[0m     +  33.6545
     35   [36m0.2352[0m   [32m0.7594[0m        0.2221       0.9057        0.2588        33.4881
     36   [36m0.2425[0m   [32m0.7596[0m        [35m0.2204[0m       0.9045        0.2591        33.5084
     37   [36m0.2427[0m   [32m0.7604[0m        [35m0.2203[0m       0.9069        [94m0.2582[0m     +  33.4151
     38   0.2422   0.7600        [35m0.2200[0m       0.9069        0.2597        33.6682
     39   [36m0.2436[0m   [32m0.7611[0m        [35m0.2200[0m       0.9069        0.2588        33.5487
     40   0.2433   [32m0.7618[0m        [35m0.2194[0m       0.9069        0.2590        33.5957
     41   0.2433   [32m0.7622[0m        [35m0.2180[0m       0.9093        0.2595        33.4901
     42   0.2354   0.7619        0.2191       0.9069        0.2600        33.7244
     43   0.2351   [32m0.7625[0m        0.2182       0.9081        0.2610        33.4988
     44   [36m0.2450[0m   [32m0.7637[0m        0.2186       0.9081        0.2598        33.7104
     45   [36m0.2462[0m   [32m0.7645[0m        [35m0.2173[0m       0.9081        0.2590        33.4065
     46   0.2454   0.7639        [35m0.2165[0m       0.9069        0.2604        33.4386
Stopping since valid_loss has not improved in the last 10 epochs.
[32m[I 2023-05-04 19:36:52,661][0m Trial 484 finished with value: 0.25820248454196565 and parameters: {'lr': 4.503585466871234e-06, 'dropout': 0.41979423681567396, 'd_model_multiplier': 8, 'num_layers': 7, 'n_heads': 32, 'dim_feedforward': 364, 'batch_size': 44, 'pos_encoding': 'fixed', 'activation': 'relu', 'norm': 'LayerNorm', 'optimizer_name': 'RAdam', 'weight_decay': 0.1, 'top_n_features': 48}. Best is trial 246 with value: 0.16447311791139763.[0m
[FileBasedDataset] Initializing dataset...
	Examples: 8264
	Features: 76
	Max length: 315
Standard scalar turned ON, loading params from cache
[FileBasedDataset] Dataset initialization complete
  epoch    auprc    auroc    train_loss    valid_acc    valid_loss    cp      dur
-------  -------  -------  ------------  -----------  ------------  ----  -------
      1   [36m0.2121[0m   [32m0.6596[0m        [35m0.2938[0m       [31m0.9154[0m        [94m0.3788[0m     +  14.5467
      2   [36m0.2240[0m   [32m0.6710[0m        [35m0.2672[0m       0.9141        [94m0.3229[0m     +  14.6231
      3   0.2192   [32m0.6738[0m        0.2675       0.8815        0.3297        14.8502
      4   0.1991   0.6719        [35m0.2643[0m       0.9154        [94m0.2780[0m     +  14.8204
      5   0.1863   0.6665        0.2659       0.9154        0.2922        14.6943
      6   0.2153   0.6650        0.2647       0.9141        [94m0.2711[0m     +  14.8894
      7   0.2008   0.6678        [35m0.2643[0m       0.9154        0.2726        14.8541
      8   0.2081   0.6674        0.2654       0.9154        [94m0.2704[0m     +  14.6658
      9   0.1973   0.6654        [35m0.2613[0m       0.9154        0.2778        14.7103
     10   0.2203   0.6732        [35m0.2613[0m       0.9154        0.2826        14.9071
     11   0.1988   0.6604        [35m0.2594[0m       0.9154        0.2752        14.6936
     12   0.1928   0.6672        0.2602       0.9154        0.2806        14.8825
     13   0.2227   0.6723        0.2596       0.9154        0.2753        14.7217
     14   [36m0.2260[0m   [32m0.6787[0m        [35m0.2590[0m       0.9154        0.2737        14.8120
     15   0.1970   0.6683        0.2643       0.9154        0.2768        14.6742
     16   0.1956   0.6626        0.2608       0.9154        0.2811        14.7944
     17   0.0846   0.5000        0.2642       0.9154        0.2914        14.8215
Stopping since valid_loss has not improved in the last 10 epochs.
[32m[I 2023-05-04 19:41:19,156][0m Trial 485 finished with value: 0.2703958765356976 and parameters: {'lr': 0.028873545837393322, 'dropout': 0.6469690742823837, 'd_model_multiplier': 4, 'num_layers': 5, 'n_heads': 16, 'dim_feedforward': 261, 'batch_size': 35, 'pos_encoding': 'fixed', 'activation': 'relu', 'norm': 'LayerNorm', 'optimizer_name': 'PlainRAdam', 'weight_decay': 0.1, 'top_n_features': 76}. Best is trial 246 with value: 0.16447311791139763.[0m
[FileBasedDataset] Initializing dataset...
	Examples: 8264
	Features: 55
	Max length: 315
Standard scalar turned ON, loading params from cache
[FileBasedDataset] Dataset initialization complete
  epoch    auprc    auroc    train_loss    valid_acc    valid_loss    cp      dur
-------  -------  -------  ------------  -----------  ------------  ----  -------
      1   [36m0.0584[0m   [32m0.3284[0m        [35m0.6314[0m       [31m0.9202[0m        [94m0.5579[0m     +  20.1838
      2   0.0564   0.3127        [35m0.5260[0m       0.9202        [94m0.4663[0m     +  20.1184
      3   0.0565   0.3230        [35m0.4504[0m       0.9202        [94m0.4045[0m     +  20.2963
      4   [36m0.0599[0m   [32m0.3676[0m        [35m0.3981[0m       0.9202        [94m0.3617[0m     +  20.3608
      5   [36m0.0654[0m   [32m0.4268[0m        [35m0.3591[0m       0.9202        [94m0.3320[0m     +  20.4732
      6   [36m0.0732[0m   [32m0.4875[0m        [35m0.3326[0m       0.9202        [94m0.3119[0m     +  20.7755
      7   [36m0.0922[0m   [32m0.5359[0m        [35m0.3134[0m       0.9202        [94m0.2983[0m     +  20.4641
      8   [36m0.1033[0m   [32m0.5656[0m        [35m0.3009[0m       0.9202        [94m0.2888[0m     +  20.5544
      9   [36m0.1190[0m   [32m0.5948[0m        [35m0.2914[0m       0.9202        [94m0.2818[0m     +  20.3678
     10   [36m0.1407[0m   [32m0.6201[0m        [35m0.2836[0m       0.9202        [94m0.2764[0m     +  20.5279
     11   [36m0.1579[0m   [32m0.6374[0m        [35m0.2787[0m       0.9202        [94m0.2723[0m     +  20.5613
     12   [36m0.1713[0m   [32m0.6494[0m        [35m0.2728[0m       0.9202        [94m0.2690[0m     +  20.7198
     13   [36m0.1774[0m   [32m0.6592[0m        [35m0.2700[0m       0.9202        [94m0.2661[0m     +  20.6205
     14   [36m0.1824[0m   [32m0.6658[0m        [35m0.2664[0m       0.9202        [94m0.2638[0m     +  20.7961
     15   [36m0.1865[0m   [32m0.6728[0m        [35m0.2632[0m       0.9202        [94m0.2618[0m     +  20.4256
     16   [36m0.1943[0m   [32m0.6784[0m        [35m0.2604[0m       0.9202        [94m0.2600[0m     +  20.5568
     17   [36m0.1989[0m   [32m0.6831[0m        [35m0.2594[0m       0.9202        [94m0.2585[0m     +  20.6612
     18   [36m0.2026[0m   [32m0.6878[0m        [35m0.2568[0m       0.9202        [94m0.2570[0m     +  20.6336
     19   [36m0.2037[0m   [32m0.6921[0m        [35m0.2558[0m       0.9202        [94m0.2558[0m     +  20.3652
     20   [36m0.2096[0m   [32m0.6967[0m        [35m0.2535[0m       0.9202        [94m0.2547[0m     +  20.6256
     21   [36m0.2143[0m   [32m0.7017[0m        [35m0.2530[0m       0.9202        [94m0.2536[0m     +  20.4199
     22   [36m0.2189[0m   [32m0.7059[0m        [35m0.2518[0m       0.9202        [94m0.2526[0m     +  20.5732
     23   [36m0.2218[0m   [32m0.7105[0m        [35m0.2506[0m       0.9190        [94m0.2516[0m     +  20.4884
     24   [36m0.2253[0m   [32m0.7147[0m        [35m0.2498[0m       0.9190        [94m0.2508[0m     +  20.3611
     25   [36m0.2284[0m   [32m0.7185[0m        [35m0.2478[0m       0.9190        [94m0.2501[0m     +  20.5395
     26   [36m0.2341[0m   [32m0.7232[0m        [35m0.2465[0m       0.9190        [94m0.2493[0m     +  20.5169
     27   [36m0.2369[0m   [32m0.7263[0m        [35m0.2459[0m       0.9190        [94m0.2486[0m     +  20.6037
     28   [36m0.2383[0m   [32m0.7288[0m        [35m0.2450[0m       0.9190        [94m0.2478[0m     +  20.6583
     29   0.2368   [32m0.7320[0m        [35m0.2437[0m       0.9190        [94m0.2471[0m     +  20.5332
     30   [36m0.2385[0m   [32m0.7347[0m        [35m0.2426[0m       0.9178        [94m0.2466[0m     +  20.5809
     31   [36m0.2417[0m   [32m0.7384[0m        [35m0.2425[0m       0.9154        [94m0.2460[0m     +  20.2933
     32   [36m0.2445[0m   [32m0.7414[0m        [35m0.2418[0m       0.9166        [94m0.2456[0m     +  20.3838
     33   [36m0.2467[0m   [32m0.7450[0m        [35m0.2415[0m       0.9190        [94m0.2452[0m     +  20.3485
     34   [36m0.2491[0m   [32m0.7478[0m        [35m0.2402[0m       0.9166        [94m0.2448[0m     +  20.5223
     35   [36m0.2495[0m   [32m0.7507[0m        [35m0.2390[0m       0.9166        [94m0.2446[0m     +  20.7671
     36   [36m0.2500[0m   [32m0.7536[0m        [35m0.2380[0m       0.9166        [94m0.2443[0m     +  20.7967
     37   [36m0.2519[0m   [32m0.7559[0m        0.2388       0.9166        [94m0.2442[0m     +  20.3075
     38   [36m0.2538[0m   [32m0.7584[0m        [35m0.2380[0m       0.9166        [94m0.2440[0m     +  20.9216
     39   [36m0.2542[0m   [32m0.7598[0m        [35m0.2379[0m       0.9166        [94m0.2439[0m     +  20.5759
     40   [36m0.2547[0m   [32m0.7619[0m        0.2380       0.9154        [94m0.2437[0m     +  20.5008
     41   [36m0.2555[0m   [32m0.7635[0m        [35m0.2365[0m       0.9154        [94m0.2437[0m     +  20.6890
     42   0.2543   [32m0.7648[0m        0.2368       0.9141        0.2437        20.7881
     43   0.2551   [32m0.7666[0m        [35m0.2353[0m       0.9166        0.2438        20.4111
     44   [36m0.2567[0m   [32m0.7675[0m        0.2356       0.9166        0.2439        20.7106
     45   0.2564   [32m0.7687[0m        [35m0.2349[0m       0.9178        0.2438        20.7607
     46   [36m0.2572[0m   [32m0.7698[0m        0.2353       0.9166        0.2438        20.6617
     47   [36m0.2576[0m   [32m0.7706[0m        [35m0.2329[0m       0.9166        0.2439        20.6816
     48   0.2574   [32m0.7714[0m        0.2334       0.9154        0.2439        20.6029
     49   [36m0.2576[0m   [32m0.7718[0m        0.2330       0.9154        0.2440        20.8059
     50   [36m0.2581[0m   [32m0.7725[0m        0.2339       0.9154        0.2440        20.3057
[32m[I 2023-05-04 19:58:30,434][0m Trial 486 finished with value: 0.24367160643783128 and parameters: {'lr': 1.8528136813438114e-06, 'dropout': 0.4365268719918299, 'd_model_multiplier': 4, 'num_layers': 4, 'n_heads': 32, 'dim_feedforward': 340, 'batch_size': 75, 'pos_encoding': 'fixed', 'activation': 'relu', 'norm': 'LayerNorm', 'optimizer_name': 'AdamW', 'weight_decay': 0.001, 'top_n_features': 55}. Best is trial 246 with value: 0.16447311791139763.[0m
[FileBasedDataset] Initializing dataset...
	Examples: 8264
	Features: 112
	Max length: 315
Standard scalar turned ON, loading params from cache
[FileBasedDataset] Dataset initialization complete
  epoch    auprc    auroc    train_loss    valid_acc    valid_loss    cp      dur
-------  -------  -------  ------------  -----------  ------------  ----  -------
      1   [36m0.0682[0m   [32m0.4057[0m        [35m0.4596[0m       [31m0.9250[0m        [94m0.3022[0m     +  39.5651
      2   [36m0.1868[0m   [32m0.6884[0m        [35m0.2838[0m       0.9250        [94m0.2473[0m     +  39.9560
      3   [36m0.2251[0m   [32m0.7247[0m        [35m0.2559[0m       0.9250        [94m0.2409[0m     +  40.6573
      4   [36m0.2651[0m   [32m0.7555[0m        [35m0.2497[0m       0.9250        [94m0.2352[0m     +  39.8321
      5   [36m0.3100[0m   [32m0.7778[0m        [35m0.2445[0m       [31m0.9262[0m        [94m0.2311[0m     +  39.7823
      6   [36m0.3222[0m   [32m0.7859[0m        [35m0.2390[0m       [31m0.9299[0m        [94m0.2281[0m     +  39.7500
      7   0.3188   0.7853        [35m0.2380[0m       0.9274        0.2290        40.0905
      8   0.3207   [32m0.7908[0m        [35m0.2359[0m       0.9299        [94m0.2275[0m     +  39.9169
      9   [36m0.3242[0m   0.7898        [35m0.2337[0m       0.9287        0.2281        40.0801
     10   [36m0.3297[0m   [32m0.7943[0m        [35m0.2326[0m       0.9262        0.2278        39.9344
     11   0.3254   [32m0.7977[0m        [35m0.2311[0m       0.9299        0.2280        39.9890
     12   0.3179   0.7921        [35m0.2301[0m       0.9262        0.2281        39.9950
     13   0.3221   0.7926        0.2306       0.9250        0.2277        40.0146
     14   0.3153   0.7887        [35m0.2289[0m       0.9287        0.2306        39.7518
     15   0.3137   0.7869        [35m0.2277[0m       0.9287        0.2322        40.0563
     16   0.3129   0.7900        [35m0.2270[0m       0.9274        0.2307        39.9675
     17   0.3255   0.7918        [35m0.2252[0m       0.9274        0.2295        39.8339
Stopping since valid_loss has not improved in the last 10 epochs.
[32m[I 2023-05-04 20:10:30,365][0m Trial 487 finished with value: 0.22751419190339917 and parameters: {'lr': 5.137767337789533e-05, 'dropout': 0.4771877554816742, 'd_model_multiplier': 2, 'num_layers': 5, 'n_heads': 64, 'dim_feedforward': 315, 'batch_size': 56, 'pos_encoding': 'fixed', 'activation': 'relu', 'norm': 'LayerNorm', 'optimizer_name': 'RAdam', 'weight_decay': 0.1, 'top_n_features': 112}. Best is trial 246 with value: 0.16447311791139763.[0m
[FileBasedDataset] Initializing dataset...
	Examples: 8264
	Features: 66
	Max length: 315
Standard scalar turned ON, loading params from cache
[FileBasedDataset] Dataset initialization complete
  epoch    auprc    auroc    train_loss    valid_acc    valid_loss    cp      dur
-------  -------  -------  ------------  -----------  ------------  ----  -------
      1   [36m0.2387[0m   [32m0.7187[0m        [35m0.2782[0m       [31m0.9105[0m        [94m0.3144[0m     +  26.9671
      2   0.2216   [32m0.7190[0m        [35m0.2704[0m       [31m0.9129[0m        [94m0.3032[0m     +  27.6094
      3   0.1953   0.6774        [35m0.2654[0m       0.9105        [94m0.2904[0m     +  27.4156
      4   [36m0.2496[0m   0.7176        [35m0.2572[0m       [31m0.9154[0m        [94m0.2878[0m     +  27.4449
      5   0.2273   0.6730        [35m0.2555[0m       0.9105        0.2985        27.2256
      6   0.2073   0.6761        0.2561       0.9105        0.2976        27.7382
      7   0.1998   0.6741        [35m0.2547[0m       0.9117        0.2997        27.5815
      8   0.1988   0.6734        0.2548       0.9129        0.3080        27.6343
      9   0.2099   0.6802        [35m0.2531[0m       0.9129        0.2940        27.6069
     10   0.2085   0.6781        0.2546       0.9129        0.2945        27.5266
     11   0.2086   0.6778        [35m0.2522[0m       0.9129        [94m0.2849[0m     +  27.4728
     12   0.2055   0.6750        [35m0.2503[0m       0.9129        [94m0.2845[0m     +  27.5265
     13   0.2213   0.6786        0.2518       0.9129        [94m0.2752[0m     +  27.5316
     14   0.2114   0.6792        0.2520       0.9129        [94m0.2745[0m     +  27.2630
     15   0.2164   0.6885        0.2530       0.9129        0.2778        27.4453
     16   0.2130   0.6829        0.2516       0.9129        0.2752        27.6095
     17   0.2232   0.6803        0.2514       0.9129        [94m0.2723[0m     +  27.4575
     18   0.2147   0.6770        0.2525       0.9129        0.2800        27.8747
     19   0.2004   0.6739        [35m0.2497[0m       0.9129        0.2746        27.9212
     20   0.1979   0.6719        0.2508       0.9129        0.2839        27.5526
     21   0.2174   0.6757        0.2529       0.9129        0.2796        27.9571
     22   0.1994   0.6748        [35m0.2494[0m       0.9129        0.2810        27.4781
     23   0.2193   0.6783        0.2496       0.9129        0.2776        27.5038
     24   0.2071   0.6786        0.2514       0.9129        0.2775        27.4490
     25   0.2045   0.6766        0.2511       0.9129        0.2754        27.6892
     26   0.2048   0.6784        0.2509       0.9129        0.2740        27.5009
Stopping since valid_loss has not improved in the last 10 epochs.
