[32m[I 2023-01-08 15:17:26,823][0m Trial 27 finished with value: 0.27975736779161114 and parameters: {'lr': 1.0669770457370566e-10, 'dropout': 0.361986260313208, 'd_model_multiplier': 32, 'num_layers': 8, 'n_heads': 4, 'dim_feedforward': 256, 'batch_size': 153, 'pos_encoding': 'fixed', 'activation': 'relu', 'norm': 'BatchNorm', 'optimizer_name': 'PlainRAdam', 'weight_decay': 0.001}. Best is trial 21 with value: 0.33272641858731333.[0m
[EnsembleDataset] Initializing dataset...
	Examples: 27964
	Features: 621
	Max length: 316
[EnsembleDataset] Dataset initialization complete
  epoch    auprc    auroc    train_loss    valid_loss    cp      dur
-------  -------  -------  ------------  ------------  ----  -------
      1   [36m0.2525[0m   [32m0.7402[0m        [35m0.0825[0m        [31m0.0578[0m     +  32.7399
      2   [36m0.2525[0m   [32m0.7402[0m        0.0826        [31m0.0578[0m     +  32.5343
      3   [36m0.2525[0m   [32m0.7402[0m        [35m0.0816[0m        [31m0.0578[0m     +  33.1173
Stopping since valid_loss has not improved in the last 3 epochs.
[32m[I 2023-01-08 15:24:16,385][0m Trial 28 finished with value: 0.2524868783728109 and parameters: {'lr': 2.4792395048273012e-09, 'dropout': 0.5613152052068953, 'd_model_multiplier': 2, 'num_layers': 10, 'n_heads': 4, 'dim_feedforward': 299, 'batch_size': 37, 'pos_encoding': 'learnable', 'activation': 'gelu', 'norm': 'LayerNorm', 'optimizer_name': 'AdamW', 'weight_decay': 0.01}. Best is trial 21 with value: 0.33272641858731333.[0m
[EnsembleDataset] Initializing dataset...
	Examples: 27964
	Features: 621
	Max length: 316
[EnsembleDataset] Dataset initialization complete
  epoch    auprc    auroc    train_loss    valid_loss    cp      dur
-------  -------  -------  ------------  ------------  ----  -------
      1   [36m0.3276[0m   [32m0.8394[0m        [35m0.1501[0m        [31m0.0552[0m     +  43.9846
      2   0.3275   [32m0.8397[0m        [35m0.1133[0m        [31m0.0552[0m     +  44.4337
      3   0.3272   [32m0.8402[0m        0.1226        [31m0.0552[0m     +  43.9832
      4   0.3269   [32m0.8408[0m        0.1245        [31m0.0551[0m     +  44.7621
      5   0.3270   [32m0.8408[0m        0.1149        [31m0.0551[0m     +  43.9778
      6   0.3269   [32m0.8414[0m        0.1284        0.0551        44.3702
      7   0.3266   [32m0.8416[0m        0.1260        0.0552        44.5264
Stopping since valid_loss has not improved in the last 3 epochs.
[32m[I 2023-01-08 15:41:15,187][0m Trial 29 finished with value: 0.3275895921523166 and parameters: {'lr': 1.1349440114724585e-06, 'dropout': 0.6071611160529392, 'd_model_multiplier': 8, 'num_layers': 5, 'n_heads': 16, 'dim_feedforward': 344, 'batch_size': 197, 'pos_encoding': 'learnable', 'activation': 'gelu', 'norm': 'BatchNorm', 'optimizer_name': 'RAdam', 'weight_decay': 0.1}. Best is trial 21 with value: 0.33272641858731333.[0m
[EnsembleDataset] Initializing dataset...
	Examples: 27964
	Features: 621
	Max length: 316
[EnsembleDataset] Dataset initialization complete
  epoch    auprc    auroc    train_loss    valid_loss    cp      dur
-------  -------  -------  ------------  ------------  ----  -------
      1   [36m0.2712[0m   [32m0.7956[0m        [35m0.2138[0m        [31m0.0547[0m     +  44.0991
      2   0.2710   [32m0.7969[0m        [35m0.1540[0m        [31m0.0537[0m     +  43.9761
      3   [36m0.2713[0m   [32m0.8037[0m        0.1542        0.0549        44.3128
      4   0.2705   0.8027        0.1724        0.0546        44.4676
Stopping since valid_loss has not improved in the last 3 epochs.
[32m[I 2023-01-08 15:51:09,773][0m Trial 30 finished with value: 0.2713171486531237 and parameters: {'lr': 0.00013738696226836243, 'dropout': 0.6406425371386363, 'd_model_multiplier': 8, 'num_layers': 5, 'n_heads': 16, 'dim_feedforward': 334, 'batch_size': 196, 'pos_encoding': 'learnable', 'activation': 'gelu', 'norm': 'BatchNorm', 'optimizer_name': 'AdamW', 'weight_decay': 0.1}. Best is trial 21 with value: 0.33272641858731333.[0m
[EnsembleDataset] Initializing dataset...
	Examples: 27964
	Features: 621
	Max length: 316
[EnsembleDataset] Dataset initialization complete
Warning, assumed runtime error: CUDA out of memory. Tried to allocate 1.42 GiB (GPU 0; 23.70 GiB total capacity; 20.71 GiB already allocated; 95.31 MiB free; 22.53 GiB reserved in total by PyTorch) If reserved memory is >> allocated memory try setting max_split_size_mb to avoid fragmentation.  See documentation for Memory Management and PYTORCH_CUDA_ALLOC_CONF
[32m[I 2023-01-08 15:51:17,781][0m Trial 31 finished with value: 0.0 and parameters: {'lr': 1.2837780140565917e-06, 'dropout': 0.5984214009885762, 'd_model_multiplier': 8, 'num_layers': 6, 'n_heads': 16, 'dim_feedforward': 396, 'batch_size': 238, 'pos_encoding': 'learnable', 'activation': 'gelu', 'norm': 'BatchNorm', 'optimizer_name': 'RAdam', 'weight_decay': 0.1}. Best is trial 21 with value: 0.33272641858731333.[0m
[EnsembleDataset] Initializing dataset...
	Examples: 27964
	Features: 621
	Max length: 316
[EnsembleDataset] Dataset initialization complete
Warning, assumed runtime error: CUDA out of memory. Tried to allocate 1.27 GiB (GPU 0; 23.70 GiB total capacity; 21.72 GiB already allocated; 95.31 MiB free; 22.53 GiB reserved in total by PyTorch) If reserved memory is >> allocated memory try setting max_split_size_mb to avoid fragmentation.  See documentation for Memory Management and PYTORCH_CUDA_ALLOC_CONF
[32m[I 2023-01-08 15:51:24,739][0m Trial 32 finished with value: 0.0 and parameters: {'lr': 1.0258084767731737e-07, 'dropout': 0.5381671996463538, 'd_model_multiplier': 8, 'num_layers': 8, 'n_heads': 16, 'dim_feedforward': 348, 'batch_size': 213, 'pos_encoding': 'learnable', 'activation': 'gelu', 'norm': 'BatchNorm', 'optimizer_name': 'RAdam', 'weight_decay': 0.1}. Best is trial 21 with value: 0.33272641858731333.[0m
[EnsembleDataset] Initializing dataset...
	Examples: 27964
	Features: 621
	Max length: 316
[EnsembleDataset] Dataset initialization complete
Warning, assumed runtime error: CUDA out of memory. Tried to allocate 1.53 GiB (GPU 0; 23.70 GiB total capacity; 20.60 GiB already allocated; 97.31 MiB free; 22.53 GiB reserved in total by PyTorch) If reserved memory is >> allocated memory try setting max_split_size_mb to avoid fragmentation.  See documentation for Memory Management and PYTORCH_CUDA_ALLOC_CONF
[32m[I 2023-01-08 15:51:33,544][0m Trial 33 finished with value: 0.0 and parameters: {'lr': 4.9205214180611886e-05, 'dropout': 0.6196811422177282, 'd_model_multiplier': 8, 'num_layers': 5, 'n_heads': 16, 'dim_feedforward': 225, 'batch_size': 256, 'pos_encoding': 'learnable', 'activation': 'gelu', 'norm': 'BatchNorm', 'optimizer_name': 'RAdam', 'weight_decay': 0.1}. Best is trial 21 with value: 0.33272641858731333.[0m
[EnsembleDataset] Initializing dataset...
	Examples: 27964
	Features: 621
	Max length: 316
[EnsembleDataset] Dataset initialization complete
  epoch    auprc    auroc    train_loss    valid_loss    cp      dur
-------  -------  -------  ------------  ------------  ----  -------
      1   [36m0.3589[0m   [32m0.8576[0m        [35m0.1532[0m        [31m0.0463[0m     +  29.8023
      2   [36m0.3589[0m   [32m0.8577[0m        [35m0.1307[0m        [31m0.0463[0m     +  30.2584
      3   0.3589   [32m0.8578[0m        0.1308        [31m0.0463[0m     +  29.8833
      4   [36m0.3590[0m   [32m0.8579[0m        0.1556        [31m0.0463[0m     +  30.3629
Stopping since valid_loss has not improved in the last 3 epochs.
[32m[I 2023-01-08 16:00:08,960][0m Trial 34 finished with value: 0.3590221978612867 and parameters: {'lr': 1.886092491210773e-08, 'dropout': 0.6698385580618793, 'd_model_multiplier': 4, 'num_layers': 3, 'n_heads': 8, 'dim_feedforward': 435, 'batch_size': 145, 'pos_encoding': 'fixed', 'activation': 'relu', 'norm': 'BatchNorm', 'optimizer_name': 'RAdam', 'weight_decay': 0}. Best is trial 34 with value: 0.3590221978612867.[0m
[EnsembleDataset] Initializing dataset...
	Examples: 27964
	Features: 621
	Max length: 316
[EnsembleDataset] Dataset initialization complete
  epoch    auprc    auroc    train_loss    valid_loss    cp      dur
-------  -------  -------  ------------  ------------  ----  -------
      1   [36m0.2874[0m   [32m0.8206[0m        [35m0.1375[0m        [31m0.0516[0m     +  30.0751
      2   0.2873   0.8205        [35m0.1274[0m        [31m0.0516[0m     +  30.3298
      3   [36m0.2875[0m   [32m0.8207[0m        0.1339        [31m0.0515[0m     +  30.4036
      4   0.2875   0.8206        0.1285        [31m0.0515[0m     +  29.6084
      5   [36m0.2876[0m   [32m0.8208[0m        [35m0.1190[0m        [31m0.0515[0m     +  29.5057
      6   [36m0.2879[0m   [32m0.8213[0m        0.1328        [31m0.0515[0m     +  29.9419
      7   [36m0.2880[0m   0.8212        [35m0.1148[0m        0.0515        29.5567
      8   [36m0.2881[0m   0.8212        0.1241        [31m0.0515[0m     +  29.3580
      9   0.2880   0.8212        0.1261        0.0515        28.9954
     10   [36m0.2883[0m   [32m0.8216[0m        0.1289        [31m0.0515[0m     +  29.3407
     11   0.2880   0.8213        0.1260        0.0515        29.7862
     12   0.2879   0.8213        0.1344        [31m0.0515[0m     +  29.3729
     13   0.2881   0.8212        0.1151        0.0515        29.2918
     14   0.2882   0.8214        0.1229        [31m0.0515[0m     +  29.5689
     15   [36m0.2883[0m   0.8216        [35m0.1075[0m        [31m0.0515[0m     +  29.9864
     16   0.2881   0.8215        0.1192        0.0515        28.8517
     17   [36m0.2885[0m   [32m0.8219[0m        0.1204        [31m0.0515[0m     +  29.6322
     18   0.2885   0.8218        0.1177        [31m0.0515[0m     +  29.6422
     19   0.2884   0.8218        0.1247        [31m0.0514[0m     +  30.2324
     20   0.2879   [32m0.8221[0m        [35m0.1014[0m        [31m0.0514[0m     +  29.7629
     21   0.2878   0.8219        0.1215        0.0514        29.5128
     22   0.2880   0.8220        0.1176        0.0514        28.8065
     23   0.2878   0.8220        0.1141        [31m0.0514[0m     +  28.6309
     24   0.2880   0.8220        0.1082        [31m0.0514[0m     +  29.2071
     25   0.2883   0.8221        0.1068        [31m0.0514[0m     +  28.5838
[32m[I 2023-01-08 16:48:55,647][0m Trial 35 finished with value: 0.2885491052127335 and parameters: {'lr': 5.74988047402504e-06, 'dropout': 0.6725259009872256, 'd_model_multiplier': 4, 'num_layers': 3, 'n_heads': 8, 'dim_feedforward': 448, 'batch_size': 120, 'pos_encoding': 'fixed', 'activation': 'relu', 'norm': 'BatchNorm', 'optimizer_name': 'RAdam', 'weight_decay': 0}. Best is trial 34 with value: 0.3590221978612867.[0m
[EnsembleDataset] Initializing dataset...
	Examples: 27964
	Features: 621
	Max length: 316
[EnsembleDataset] Dataset initialization complete
  epoch    auprc    auroc    train_loss    valid_loss    cp      dur
-------  -------  -------  ------------  ------------  ----  -------
      1   [36m0.2843[0m   [32m0.8223[0m        [35m0.1529[0m        [31m0.0520[0m     +  28.6237
      2   [36m0.2860[0m   [32m0.8225[0m        [35m0.1507[0m        0.0520        29.0014
      3   [36m0.2875[0m   0.8224        [35m0.1453[0m        0.0520        29.5997
Stopping since valid_loss has not improved in the last 3 epochs.
[32m[I 2023-01-08 16:55:06,210][0m Trial 36 finished with value: 0.2874700168887663 and parameters: {'lr': 4.764999156294883e-10, 'dropout': 0.6362397648231185, 'd_model_multiplier': 4, 'num_layers': 2, 'n_heads': 8, 'dim_feedforward': 413, 'batch_size': 144, 'pos_encoding': 'fixed', 'activation': 'relu', 'norm': 'BatchNorm', 'optimizer_name': 'AdamW', 'weight_decay': 0}. Best is trial 34 with value: 0.3590221978612867.[0m
[EnsembleDataset] Initializing dataset...
	Examples: 27964
	Features: 621
	Max length: 316
[EnsembleDataset] Dataset initialization complete
  epoch    auprc    auroc    train_loss    valid_loss    cp      dur
-------  -------  -------  ------------  ------------  ----  -------
      1   [36m0.2903[0m   [32m0.8567[0m        [35m0.1200[0m        [31m0.0455[0m     +  29.9170
      2   [36m0.3058[0m   0.8443        [35m0.0919[0m        [31m0.0437[0m     +  29.6491
      3   0.3049   [32m0.8572[0m        [35m0.0604[0m        [31m0.0436[0m     +  29.6712
      4   0.2999   0.8530        [35m0.0531[0m        0.0438        29.4582
      5   0.2958   0.8466        [35m0.0519[0m        0.0438        29.9315
Stopping since valid_loss has not improved in the last 3 epochs.
[32m[I 2023-01-08 17:05:03,167][0m Trial 37 finished with value: 0.3058093534402503 and parameters: {'lr': 0.0027164293687588167, 'dropout': 0.5912955299353779, 'd_model_multiplier': 4, 'num_layers': 2, 'n_heads': 8, 'dim_feedforward': 499, 'batch_size': 162, 'pos_encoding': 'fixed', 'activation': 'relu', 'norm': 'BatchNorm', 'optimizer_name': 'RAdam', 'weight_decay': 0}. Best is trial 34 with value: 0.3590221978612867.[0m
[EnsembleDataset] Initializing dataset...
	Examples: 27964
	Features: 621
	Max length: 316
[EnsembleDataset] Dataset initialization complete
  epoch    auprc    auroc    train_loss    valid_loss    cp      dur
-------  -------  -------  ------------  ------------  ----  -------
      1   [36m0.2969[0m   [32m0.8168[0m        [35m0.1561[0m        [31m0.0532[0m     +  51.1380
      2   0.2967   [32m0.8182[0m        [35m0.1513[0m        [31m0.0532[0m     +  51.4898
      3   [36m0.2981[0m   [32m0.8207[0m        [35m0.1423[0m        [31m0.0531[0m     +  51.3622
      4   [36m0.2993[0m   [32m0.8222[0m        [35m0.1311[0m        [31m0.0530[0m     +  50.9769
      5   0.2985   0.8214        0.1497        0.0531        51.6794
      6   [36m0.2996[0m   [32m0.8226[0m        0.1420        [31m0.0530[0m     +  51.6396
      7   [36m0.2997[0m   0.8226        0.1367        [31m0.0530[0m     +  51.4896
      8   [36m0.2998[0m   0.8224        0.1355        [31m0.0530[0m     +  51.4843
      9   0.2989   0.8222        [35m0.1240[0m        0.0530        51.3171
     10   0.2991   0.8220        0.1317        0.0530        51.0468
     11   [36m0.2998[0m   0.8226        0.1578        [31m0.0530[0m     +  51.2094
     12   [36m0.2998[0m   [32m0.8228[0m        0.1755        0.0530        51.1851
     13   0.2991   0.8226        0.1348        0.0530        51.6311
Stopping since valid_loss has not improved in the last 3 epochs.
[32m[I 2023-01-08 17:35:26,266][0m Trial 38 finished with value: 0.29983060705709486 and parameters: {'lr': 5.241202228242293e-07, 'dropout': 0.6992503758181943, 'd_model_multiplier': 64, 'num_layers': 4, 'n_heads': 8, 'dim_feedforward': 436, 'batch_size': 130, 'pos_encoding': 'fixed', 'activation': 'relu', 'norm': 'BatchNorm', 'optimizer_name': 'AdamW', 'weight_decay': 0}. Best is trial 34 with value: 0.3590221978612867.[0m
[EnsembleDataset] Initializing dataset...
	Examples: 27964
	Features: 621
	Max length: 316
[EnsembleDataset] Dataset initialization complete
Warning, assumed runtime error: CUDA out of memory. Tried to allocate 2.20 GiB (GPU 0; 23.70 GiB total capacity; 19.69 GiB already allocated; 141.31 MiB free; 22.49 GiB reserved in total by PyTorch) If reserved memory is >> allocated memory try setting max_split_size_mb to avoid fragmentation.  See documentation for Memory Management and PYTORCH_CUDA_ALLOC_CONF
[32m[I 2023-01-08 17:35:32,380][0m Trial 39 finished with value: 0.0 and parameters: {'lr': 2.012132562115909e-06, 'dropout': 0.16789853164356575, 'd_model_multiplier': 16, 'num_layers': 3, 'n_heads': 32, 'dim_feedforward': 484, 'batch_size': 185, 'pos_encoding': 'fixed', 'activation': 'relu', 'norm': 'BatchNorm', 'optimizer_name': 'RAdam', 'weight_decay': 0.1}. Best is trial 34 with value: 0.3590221978612867.[0m
[EnsembleDataset] Initializing dataset...
	Examples: 27964
	Features: 621
	Max length: 316
[EnsembleDataset] Dataset initialization complete
Warning, assumed runtime error: CUDA out of memory. Tried to allocate 4.83 GiB (GPU 0; 23.70 GiB total capacity; 14.97 GiB already allocated; 1.94 GiB free; 20.69 GiB reserved in total by PyTorch) If reserved memory is >> allocated memory try setting max_split_size_mb to avoid fragmentation.  See documentation for Memory Management and PYTORCH_CUDA_ALLOC_CONF
[32m[I 2023-01-08 17:35:39,140][0m Trial 40 finished with value: 0.0 and parameters: {'lr': 2.6200621590885048e-08, 'dropout': 0.5763470409067117, 'd_model_multiplier': 4, 'num_layers': 1, 'n_heads': 64, 'dim_feedforward': 473, 'batch_size': 203, 'pos_encoding': 'fixed', 'activation': 'relu', 'norm': 'BatchNorm', 'optimizer_name': 'AdamW', 'weight_decay': 0}. Best is trial 34 with value: 0.3590221978612867.[0m
[EnsembleDataset] Initializing dataset...
	Examples: 27964
	Features: 621
	Max length: 316
[EnsembleDataset] Dataset initialization complete
Warning, assumed runtime error: CUDA out of memory. Tried to allocate 1.35 GiB (GPU 0; 23.70 GiB total capacity; 21.60 GiB already allocated; 343.31 MiB free; 22.29 GiB reserved in total by PyTorch) If reserved memory is >> allocated memory try setting max_split_size_mb to avoid fragmentation.  See documentation for Memory Management and PYTORCH_CUDA_ALLOC_CONF
[32m[I 2023-01-08 17:35:46,193][0m Trial 41 finished with value: 0.0 and parameters: {'lr': 1.4892933708354588e-07, 'dropout': 0.3872900351767988, 'd_model_multiplier': 8, 'num_layers': 7, 'n_heads': 16, 'dim_feedforward': 319, 'batch_size': 226, 'pos_encoding': 'learnable', 'activation': 'gelu', 'norm': 'BatchNorm', 'optimizer_name': 'RAdam', 'weight_decay': 0.001}. Best is trial 34 with value: 0.3590221978612867.[0m
[EnsembleDataset] Initializing dataset...
	Examples: 27964
	Features: 621
	Max length: 316
[EnsembleDataset] Dataset initialization complete
  epoch    auprc    auroc    train_loss    valid_loss    cp      dur
-------  -------  -------  ------------  ------------  ----  -------
      1   [36m0.3199[0m   [32m0.8473[0m        [35m0.1166[0m        [31m0.0498[0m     +  29.5238
      2   [36m0.3211[0m   [32m0.8475[0m        [35m0.1011[0m        [31m0.0497[0m     +  30.3225
      3   0.3209   0.8475        0.1182        0.0500        29.7780
      4   [36m0.3218[0m   [32m0.8476[0m        0.1081        [31m0.0497[0m     +  30.0778
      5   0.3204   [32m0.8484[0m        0.1054        [31m0.0496[0m     +  30.0520
      6   0.3165   0.8476        [35m0.1001[0m        0.0502        30.0277
      7   [36m0.3219[0m   0.8477        0.1064        0.0499        30.3594
Stopping since valid_loss has not improved in the last 3 epochs.
[32m[I 2023-01-08 17:49:36,625][0m Trial 42 finished with value: 0.32185987834772917 and parameters: {'lr': 1.5869492634371538e-08, 'dropout': 0.5254051015019184, 'd_model_multiplier': 4, 'num_layers': 5, 'n_heads': 8, 'dim_feedforward': 375, 'batch_size': 106, 'pos_encoding': 'fixed', 'activation': 'gelu', 'norm': 'BatchNorm', 'optimizer_name': 'RAdam', 'weight_decay': 0.1}. Best is trial 34 with value: 0.3590221978612867.[0m
[EnsembleDataset] Initializing dataset...
	Examples: 27964
	Features: 621
	Max length: 316
[EnsembleDataset] Dataset initialization complete
  epoch    auprc    auroc    train_loss    valid_loss    cp      dur
-------  -------  -------  ------------  ------------  ----  -------
      1   [36m0.2892[0m   [32m0.8159[0m        [35m0.1084[0m        [31m0.0532[0m     +  29.4483
      2   [36m0.2893[0m   [32m0.8160[0m        [35m0.1015[0m        0.0532        29.6101
      3   0.2888   0.8158        0.1034        0.0538        29.1434
      4   [36m0.2895[0m   [32m0.8161[0m        0.1057        [31m0.0525[0m     +  29.2777
      5   [36m0.2899[0m   [32m0.8204[0m        0.1072        0.0527        30.0362
      6   0.2887   0.8159        [35m0.0985[0m        0.0541        30.5390
Stopping since valid_loss has not improved in the last 3 epochs.
[32m[I 2023-01-08 18:01:45,280][0m Trial 43 finished with value: 0.28991358495174807 and parameters: {'lr': 1.5397193917604113e-08, 'dropout': 0.4781909346883074, 'd_model_multiplier': 4, 'num_layers': 4, 'n_heads': 8, 'dim_feedforward': 365, 'batch_size': 107, 'pos_encoding': 'fixed', 'activation': 'relu', 'norm': 'BatchNorm', 'optimizer_name': 'RAdam', 'weight_decay': 0.1}. Best is trial 34 with value: 0.3590221978612867.[0m
[EnsembleDataset] Initializing dataset...
	Examples: 27964
	Features: 621
	Max length: 316
[EnsembleDataset] Dataset initialization complete
  epoch    auprc    auroc    train_loss    valid_loss    cp      dur
-------  -------  -------  ------------  ------------  ----  -------
      1   [36m0.3536[0m   [32m0.8107[0m        [35m0.1244[0m        [31m0.0568[0m     +  30.0483
      2   [36m0.3544[0m   [32m0.8108[0m        0.1322        0.0569        30.2062
      3   0.3537   [32m0.8112[0m        0.1319        0.0570        29.6014
Stopping since valid_loss has not improved in the last 3 epochs.
