[32m[I 2023-05-04 04:39:10,199][0m Trial 407 finished with value: 0.20520897483522976 and parameters: {'lr': 4.030131061228686e-06, 'dropout': 0.29208908865018673, 'd_model_multiplier': 4, 'num_layers': 6, 'n_heads': 32, 'dim_feedforward': 324, 'batch_size': 66, 'pos_encoding': 'fixed', 'activation': 'relu', 'norm': 'LayerNorm', 'optimizer_name': 'RAdam', 'weight_decay': 0.001, 'top_n_features': 60}. Best is trial 246 with value: 0.16447311791139763.[0m
[FileBasedDataset] Initializing dataset...
	Examples: 8264
	Features: 67
	Max length: 315
Standard scalar turned ON, loading params from cache
[FileBasedDataset] Dataset initialization complete
  epoch    auprc    auroc    train_loss    valid_acc    valid_loss    cp      dur
-------  -------  -------  ------------  -----------  ------------  ----  -------
      1   [36m0.0966[0m   [32m0.5537[0m        [35m0.6482[0m       [31m0.9141[0m        [94m0.6013[0m     +  27.1827
      2   0.0716   0.4096        [35m0.5772[0m       [31m0.9250[0m        [94m0.5160[0m     +  27.0132
      3   0.0696   0.3771        [35m0.4963[0m       0.9250        [94m0.4327[0m     +  27.6668
      4   0.0687   0.3919        [35m0.4248[0m       0.9250        [94m0.3706[0m     +  27.3798
      5   0.0747   0.4631        [35m0.3730[0m       0.9250        [94m0.3289[0m     +  27.2384
      6   0.0857   0.5390        [35m0.3363[0m       0.9250        [94m0.3007[0m     +  27.2527
      7   [36m0.1098[0m   [32m0.6053[0m        [35m0.3115[0m       0.9250        [94m0.2814[0m     +  27.3260
      8   [36m0.1467[0m   [32m0.6533[0m        [35m0.2945[0m       0.9250        [94m0.2685[0m     +  27.7332
      9   [36m0.1716[0m   [32m0.6807[0m        [35m0.2823[0m       0.9250        [94m0.2597[0m     +  27.6026
     10   [36m0.1940[0m   [32m0.6973[0m        [35m0.2732[0m       0.9250        [94m0.2535[0m     +  27.6615
     11   [36m0.2017[0m   [32m0.7115[0m        [35m0.2681[0m       0.9250        [94m0.2489[0m     +  27.3293
     12   [36m0.2077[0m   [32m0.7203[0m        [35m0.2634[0m       0.9250        [94m0.2453[0m     +  27.5955
     13   [36m0.2155[0m   [32m0.7282[0m        [35m0.2579[0m       0.9250        [94m0.2422[0m     +  27.6094
     14   [36m0.2255[0m   [32m0.7369[0m        [35m0.2541[0m       0.9250        [94m0.2394[0m     +  27.4121
     15   [36m0.2350[0m   [32m0.7486[0m        [35m0.2510[0m       0.9238        [94m0.2368[0m     +  27.5035
     16   [36m0.2442[0m   [32m0.7563[0m        [35m0.2479[0m       0.9226        [94m0.2347[0m     +  27.7280
     17   [36m0.2487[0m   [32m0.7634[0m        [35m0.2458[0m       0.9226        [94m0.2330[0m     +  27.1514
     18   [36m0.2496[0m   [32m0.7682[0m        [35m0.2433[0m       0.9226        [94m0.2318[0m     +  27.4077
     19   [36m0.2535[0m   [32m0.7712[0m        [35m0.2406[0m       0.9226        [94m0.2310[0m     +  27.4997
     20   [36m0.2636[0m   [32m0.7730[0m        [35m0.2383[0m       0.9238        [94m0.2305[0m     +  27.3488
     21   [36m0.2652[0m   [32m0.7740[0m        [35m0.2380[0m       0.9238        [94m0.2303[0m     +  27.5804
     22   [36m0.2672[0m   [32m0.7742[0m        [35m0.2368[0m       [31m0.9262[0m        [94m0.2301[0m     +  27.6152
     23   [36m0.2685[0m   [32m0.7756[0m        0.2369       0.9262        [94m0.2297[0m     +  27.5712
     24   [36m0.2689[0m   0.7752        [35m0.2354[0m       0.9262        0.2297        27.4354
     25   [36m0.2706[0m   0.7755        [35m0.2349[0m       0.9262        [94m0.2295[0m     +  28.0008
     26   0.2705   0.7756        [35m0.2346[0m       0.9250        [94m0.2293[0m     +  27.3253
     27   [36m0.2710[0m   0.7756        [35m0.2331[0m       0.9250        [94m0.2293[0m     +  27.2400
     28   0.2710   0.7748        [35m0.2323[0m       0.9250        0.2294        27.6777
     29   [36m0.2713[0m   0.7744        0.2332       0.9250        0.2294        27.3665
     30   [36m0.2720[0m   0.7741        [35m0.2323[0m       0.9250        [94m0.2292[0m     +  27.6585
     31   [36m0.2727[0m   0.7740        [35m0.2311[0m       0.9250        0.2293        27.3444
     32   [36m0.2738[0m   0.7729        [35m0.2309[0m       0.9262        0.2294        27.4824
     33   0.2732   0.7733        0.2318       0.9238        [94m0.2292[0m     +  27.7601
     34   0.2735   0.7732        [35m0.2303[0m       0.9238        [94m0.2292[0m     +  27.5927
     35   [36m0.2744[0m   0.7728        [35m0.2294[0m       0.9250        0.2293        27.5084
     36   [36m0.2756[0m   0.7722        0.2305       0.9250        0.2293        27.2853
     37   0.2750   0.7727        [35m0.2291[0m       0.9238        [94m0.2291[0m     +  27.1806
     38   0.2752   0.7725        0.2295       0.9238        0.2291        27.3369
     39   0.2753   0.7707        0.2300       0.9250        0.2292        27.8616
     40   0.2753   0.7696        [35m0.2291[0m       0.9250        0.2294        27.7047
     41   [36m0.2775[0m   0.7694        [35m0.2282[0m       0.9238        0.2293        27.4481
     42   [36m0.2780[0m   0.7688        0.2283       0.9238        0.2295        27.5561
     43   [36m0.2790[0m   0.7686        [35m0.2276[0m       0.9238        0.2294        27.9277
     44   [36m0.2819[0m   0.7692        0.2281       0.9238        0.2293        27.3983
     45   [36m0.2828[0m   0.7679        [35m0.2276[0m       0.9238        0.2297        27.6821
     46   [36m0.2833[0m   0.7674        0.2283       0.9238        0.2295        27.8616
Stopping since valid_loss has not improved in the last 10 epochs.
[32m[I 2023-05-04 05:00:45,873][0m Trial 408 finished with value: 0.22908015853692715 and parameters: {'lr': 3.3755132681560145e-06, 'dropout': 0.2908050052865012, 'd_model_multiplier': 4, 'num_layers': 6, 'n_heads': 32, 'dim_feedforward': 320, 'batch_size': 67, 'pos_encoding': 'fixed', 'activation': 'relu', 'norm': 'LayerNorm', 'optimizer_name': 'RAdam', 'weight_decay': 0.001, 'top_n_features': 67}. Best is trial 246 with value: 0.16447311791139763.[0m
[FileBasedDataset] Initializing dataset...
	Examples: 8264
	Features: 62
	Max length: 315
Standard scalar turned ON, loading params from cache
[FileBasedDataset] Dataset initialization complete
  epoch    auprc    auroc    train_loss    valid_acc    valid_loss    cp      dur
-------  -------  -------  ------------  -----------  ------------  ----  -------
      1   [36m0.1164[0m   [32m0.5774[0m        [35m0.4233[0m       [31m0.9166[0m        [94m0.2879[0m     +  27.7481
      2   [36m0.3070[0m   [32m0.7609[0m        [35m0.2578[0m       0.9166        [94m0.2489[0m     +  28.1721
      3   [36m0.3077[0m   [32m0.7687[0m        [35m0.2395[0m       [31m0.9178[0m        [94m0.2451[0m     +  27.8530
      4   0.2999   [32m0.7714[0m        [35m0.2324[0m       0.9141        0.2460        27.5046
      5   0.2910   [32m0.7738[0m        [35m0.2289[0m       0.9117        0.2473        27.8364
      6   0.2902   [32m0.7745[0m        0.2293       0.9129        0.2480        27.3623
      7   0.2904   [32m0.7772[0m        [35m0.2268[0m       0.9129        0.2493        27.5537
      8   0.2829   [32m0.7791[0m        [35m0.2253[0m       0.9117        0.2497        27.5997
      9   0.2805   0.7772        0.2257       0.9141        0.2518        27.6775
     10   0.2815   0.7766        [35m0.2236[0m       0.9154        0.2513        27.8278
     11   0.2800   0.7748        [35m0.2227[0m       0.9154        0.2526        27.6108
     12   0.2774   [32m0.7803[0m        [35m0.2212[0m       0.9129        0.2507        27.6285
Stopping since valid_loss has not improved in the last 10 epochs.
[32m[I 2023-05-04 05:06:46,489][0m Trial 409 finished with value: 0.24512295108716461 and parameters: {'lr': 1.7059393607309852e-05, 'dropout': 0.2988914558960807, 'd_model_multiplier': 4, 'num_layers': 6, 'n_heads': 32, 'dim_feedforward': 327, 'batch_size': 22, 'pos_encoding': 'fixed', 'activation': 'relu', 'norm': 'LayerNorm', 'optimizer_name': 'RAdam', 'weight_decay': 0.001, 'top_n_features': 62}. Best is trial 246 with value: 0.16447311791139763.[0m
[FileBasedDataset] Initializing dataset...
	Examples: 8264
	Features: 59
	Max length: 315
Standard scalar turned ON, loading params from cache
[FileBasedDataset] Dataset initialization complete
  epoch    auprc    auroc    train_loss    valid_acc    valid_loss    cp      dur
-------  -------  -------  ------------  -----------  ------------  ----  -------
      1   [36m0.0721[0m   [32m0.3985[0m        [35m0.6125[0m       [31m0.9262[0m        [94m0.5270[0m     +  27.0031
      2   0.0597   0.3426        [35m0.4908[0m       0.9262        [94m0.4076[0m     +  27.0270
      3   0.0618   0.3959        [35m0.3892[0m       0.9262        [94m0.3294[0m     +  27.3315
      4   [36m0.1071[0m   [32m0.5204[0m        [35m0.3267[0m       0.9262        [94m0.2853[0m     +  27.3225
      5   [36m0.1551[0m   [32m0.6069[0m        [35m0.2894[0m       0.9262        [94m0.2625[0m     +  27.6063
      6   [36m0.1929[0m   [32m0.6561[0m        [35m0.2719[0m       0.9262        [94m0.2508[0m     +  27.2942
      7   [36m0.2107[0m   [32m0.6899[0m        [35m0.2607[0m       0.9262        [94m0.2435[0m     +  27.3093
      8   [36m0.2280[0m   [32m0.7124[0m        [35m0.2536[0m       0.9262        [94m0.2383[0m     +  27.4138
      9   [36m0.2447[0m   [32m0.7299[0m        [35m0.2480[0m       [31m0.9274[0m        [94m0.2340[0m     +  27.3280
     10   [36m0.2652[0m   [32m0.7423[0m        [35m0.2444[0m       0.9262        [94m0.2307[0m     +  27.4853
     11   [36m0.2849[0m   [32m0.7496[0m        [35m0.2414[0m       0.9274        [94m0.2282[0m     +  27.6470
     12   [36m0.3038[0m   [32m0.7556[0m        [35m0.2384[0m       [31m0.9299[0m        [94m0.2267[0m     +  27.1033
     13   [36m0.3137[0m   [32m0.7615[0m        [35m0.2365[0m       0.9287        [94m0.2252[0m     +  27.1268
     14   [36m0.3228[0m   [32m0.7656[0m        0.2367       0.9299        [94m0.2240[0m     +  27.4983
     15   [36m0.3392[0m   [32m0.7675[0m        [35m0.2346[0m       [31m0.9335[0m        [94m0.2230[0m     +  27.3396
     16   [36m0.3428[0m   [32m0.7696[0m        [35m0.2333[0m       0.9335        [94m0.2222[0m     +  27.3025
     17   [36m0.3516[0m   [32m0.7698[0m        [35m0.2333[0m       0.9335        [94m0.2218[0m     +  27.3716
     18   [36m0.3526[0m   [32m0.7715[0m        [35m0.2317[0m       [31m0.9347[0m        [94m0.2212[0m     +  27.4013
     19   [36m0.3575[0m   [32m0.7745[0m        [35m0.2314[0m       0.9347        [94m0.2207[0m     +  27.5780
     20   [36m0.3579[0m   [32m0.7753[0m        0.2319       0.9335        [94m0.2203[0m     +  27.3528
     21   [36m0.3588[0m   [32m0.7761[0m        [35m0.2297[0m       0.9347        [94m0.2201[0m     +  27.3965
     22   0.3565   [32m0.7772[0m        0.2304       0.9347        [94m0.2197[0m     +  27.4131
     23   0.3558   [32m0.7773[0m        0.2303       0.9311        [94m0.2196[0m     +  27.8530
     24   0.3559   [32m0.7778[0m        [35m0.2293[0m       0.9335        [94m0.2195[0m     +  27.5612
     25   0.3560   [32m0.7787[0m        [35m0.2290[0m       0.9323        [94m0.2193[0m     +  27.3010
     26   0.3569   [32m0.7799[0m        [35m0.2282[0m       0.9311        [94m0.2190[0m     +  27.2777
     27   0.3577   [32m0.7808[0m        0.2291       0.9335        [94m0.2187[0m     +  27.4086
     28   0.3577   [32m0.7812[0m        [35m0.2274[0m       0.9311        [94m0.2187[0m     +  27.2462
     29   0.3562   [32m0.7825[0m        0.2275       0.9311        [94m0.2184[0m     +  27.2653
     30   0.3548   [32m0.7831[0m        0.2283       0.9311        [94m0.2182[0m     +  27.5257
     31   0.3554   [32m0.7842[0m        0.2278       0.9311        [94m0.2179[0m     +  27.3527
     32   0.3563   [32m0.7848[0m        [35m0.2258[0m       0.9299        0.2179        27.4660
     33   0.3573   [32m0.7856[0m        0.2272       0.9299        [94m0.2179[0m     +  27.4611
     34   0.3580   [32m0.7868[0m        0.2266       0.9299        [94m0.2176[0m     +  27.3990
     35   0.3572   [32m0.7878[0m        [35m0.2251[0m       0.9287        [94m0.2175[0m     +  27.2462
     36   0.3573   [32m0.7884[0m        0.2253       0.9287        [94m0.2174[0m     +  27.4309
     37   0.3583   [32m0.7894[0m        0.2264       0.9287        [94m0.2172[0m     +  27.7020
     38   0.3574   [32m0.7902[0m        [35m0.2251[0m       0.9274        [94m0.2171[0m     +  27.2704
     39   [36m0.3617[0m   [32m0.7916[0m        [35m0.2248[0m       0.9287        [94m0.2169[0m     +  27.4286
     40   [36m0.3628[0m   [32m0.7918[0m        [35m0.2247[0m       0.9287        [94m0.2167[0m     +  27.4559
     41   0.3603   [32m0.7923[0m        0.2259       0.9274        0.2167        27.2809
     42   0.3602   [32m0.7929[0m        [35m0.2238[0m       0.9274        0.2167        27.3374
     43   0.3604   [32m0.7943[0m        [35m0.2233[0m       0.9287        [94m0.2164[0m     +  27.4058
     44   0.3591   [32m0.7949[0m        [35m0.2232[0m       0.9287        [94m0.2163[0m     +  27.5802
     45   0.3585   [32m0.7953[0m        0.2234       0.9274        0.2165        27.1950
     46   0.3587   [32m0.7962[0m        0.2236       0.9274        [94m0.2162[0m     +  27.3931
     47   0.3590   [32m0.7968[0m        0.2233       0.9274        [94m0.2160[0m     +  27.5215
     48   0.3598   [32m0.7974[0m        [35m0.2229[0m       0.9274        [94m0.2159[0m     +  27.3658
     49   0.3576   [32m0.7979[0m        0.2229       0.9287        [94m0.2158[0m     +  27.2282
     50   0.3586   [32m0.7990[0m        [35m0.2215[0m       0.9274        [94m0.2157[0m     +  27.6479
[32m[I 2023-05-04 05:29:41,117][0m Trial 410 finished with value: 0.21570423879675305 and parameters: {'lr': 7.1871088918259236e-06, 'dropout': 0.32131775720721, 'd_model_multiplier': 4, 'num_layers': 6, 'n_heads': 32, 'dim_feedforward': 318, 'batch_size': 63, 'pos_encoding': 'fixed', 'activation': 'relu', 'norm': 'LayerNorm', 'optimizer_name': 'RAdam', 'weight_decay': 0.001, 'top_n_features': 59}. Best is trial 246 with value: 0.16447311791139763.[0m
[FileBasedDataset] Initializing dataset...
	Examples: 8264
	Features: 115
	Max length: 315
Standard scalar turned ON, loading params from cache
[FileBasedDataset] Dataset initialization complete
  epoch    auprc    auroc    train_loss    valid_acc    valid_loss    cp      dur
-------  -------  -------  ------------  -----------  ------------  ----  -------
      1   [36m0.0969[0m   [32m0.3469[0m        [35m0.6358[0m       [31m0.9166[0m        [94m0.4929[0m     +  34.5977
      2   0.0919   [32m0.3727[0m        [35m0.4152[0m       0.9166        [94m0.3462[0m     +  34.9050
      3   [36m0.1006[0m   [32m0.4921[0m        [35m0.3142[0m       0.9166        [94m0.3009[0m     +  34.9526
      4   [36m0.1400[0m   [32m0.5687[0m        [35m0.2749[0m       0.9166        [94m0.2861[0m     +  34.8371
      5   [36m0.1588[0m   [32m0.6120[0m        [35m0.2591[0m       0.9166        [94m0.2797[0m     +  35.0286
      6   [36m0.2048[0m   [32m0.6471[0m        [35m0.2511[0m       0.9166        [94m0.2745[0m     +  35.0466
      7   [36m0.2352[0m   [32m0.6835[0m        [35m0.2458[0m       0.9166        [94m0.2675[0m     +  35.1346
      8   [36m0.2624[0m   [32m0.7161[0m        [35m0.2396[0m       [31m0.9190[0m        [94m0.2607[0m     +  34.9657
      9   [36m0.2741[0m   [32m0.7313[0m        [35m0.2351[0m       [31m0.9214[0m        [94m0.2577[0m     +  34.9945
     10   [36m0.2816[0m   [32m0.7401[0m        [35m0.2324[0m       0.9202        [94m0.2566[0m     +  35.1147
     11   [36m0.2907[0m   [32m0.7474[0m        [35m0.2314[0m       0.9214        [94m0.2551[0m     +  34.8432
     12   0.2869   [32m0.7538[0m        [35m0.2306[0m       [31m0.9238[0m        [94m0.2531[0m     +  35.0175
     13   0.2864   [32m0.7563[0m        [35m0.2285[0m       0.9202        [94m0.2523[0m     +  35.0545
     14   0.2895   [32m0.7608[0m        [35m0.2277[0m       0.9190        [94m0.2510[0m     +  35.2069
     15   [36m0.2913[0m   [32m0.7615[0m        [35m0.2269[0m       0.9190        [94m0.2509[0m     +  35.1590
     16   [36m0.2995[0m   [32m0.7679[0m        [35m0.2267[0m       0.9214        [94m0.2488[0m     +  35.0293
     17   [36m0.3032[0m   [32m0.7705[0m        [35m0.2253[0m       0.9238        [94m0.2480[0m     +  35.0809
     18   [36m0.3066[0m   [32m0.7727[0m        [35m0.2241[0m       0.9238        [94m0.2475[0m     +  35.2478
     19   [36m0.3071[0m   [32m0.7756[0m        0.2255       0.9238        [94m0.2464[0m     +  35.2041
     20   [36m0.3080[0m   [32m0.7770[0m        [35m0.2241[0m       0.9226        0.2465        35.3067
     21   0.3072   [32m0.7770[0m        [35m0.2238[0m       0.9214        0.2467        35.1073
     22   [36m0.3088[0m   [32m0.7794[0m        [35m0.2218[0m       0.9226        [94m0.2457[0m     +  35.1220
     23   [36m0.3122[0m   [32m0.7801[0m        [35m0.2214[0m       0.9214        [94m0.2451[0m     +  35.1563
     24   [36m0.3164[0m   [32m0.7806[0m        0.2225       0.9214        [94m0.2449[0m     +  35.1241
     25   0.3137   [32m0.7812[0m        0.2216       0.9214        [94m0.2449[0m     +  35.0086
     26   0.3163   [32m0.7823[0m        [35m0.2194[0m       0.9214        [94m0.2444[0m     +  35.1611
     27   [36m0.3196[0m   [32m0.7837[0m        0.2207       0.9214        [94m0.2439[0m     +  35.1874
     28   0.3187   0.7832        0.2197       0.9214        0.2441        34.9457
     29   [36m0.3210[0m   [32m0.7845[0m        [35m0.2183[0m       0.9214        0.2439        35.2918
     30   0.3177   0.7844        0.2184       0.9214        [94m0.2438[0m     +  35.0464
     31   0.3164   0.7841        0.2192       0.9214        0.2442        35.1372
     32   [36m0.3225[0m   0.7844        0.2187       0.9226        0.2439        35.1182
     33   [36m0.3229[0m   [32m0.7847[0m        [35m0.2175[0m       0.9214        0.2445        34.9427
     34   0.3218   [32m0.7868[0m        0.2187       0.9214        [94m0.2435[0m     +  35.1702
     35   [36m0.3266[0m   0.7850        0.2188       0.9214        0.2443        35.1728
     36   0.3260   [32m0.7871[0m        [35m0.2164[0m       0.9214        [94m0.2434[0m     +  35.2214
     37   0.3252   0.7867        0.2166       0.9214        0.2442        35.1013
     38   0.3243   0.7850        0.2165       0.9226        0.2446        35.2430
     39   0.3245   0.7859        0.2167       0.9214        0.2439        34.9789
     40   0.3254   0.7857        [35m0.2149[0m       0.9226        0.2439        35.2797
     41   0.3252   0.7865        [35m0.2144[0m       0.9226        0.2443        35.1931
     42   0.3204   [32m0.7872[0m        0.2151       0.9214        0.2443        35.1993
     43   0.3213   [32m0.7873[0m        [35m0.2144[0m       0.9226        0.2447        34.9257
     44   0.3201   [32m0.7881[0m        [35m0.2143[0m       0.9202        0.2445        35.2532
     45   0.3190   0.7879        [35m0.2142[0m       0.9214        0.2450        35.1750
Stopping since valid_loss has not improved in the last 10 epochs.
