[32m[I 2023-05-04 08:47:56,528][0m Trial 419 finished with value: 0.24030651775568254 and parameters: {'lr': 7.117156976940228e-07, 'dropout': 0.36102896676540136, 'd_model_multiplier': 4, 'num_layers': 7, 'n_heads': 32, 'dim_feedforward': 334, 'batch_size': 42, 'pos_encoding': 'fixed', 'activation': 'relu', 'norm': 'LayerNorm', 'optimizer_name': 'RAdam', 'weight_decay': 0.001, 'top_n_features': 69}. Best is trial 246 with value: 0.16447311791139763.[0m
[FileBasedDataset] Initializing dataset...
	Examples: 8264
	Features: 90
	Max length: 315
Standard scalar turned ON, loading params from cache
[FileBasedDataset] Dataset initialization complete
  epoch    auprc    auroc    train_loss    valid_acc    valid_loss    cp      dur
-------  -------  -------  ------------  -----------  ------------  ----  -------
      1   [36m0.0623[0m   [32m0.3160[0m        [35m0.5968[0m       [31m0.9141[0m        [94m0.5024[0m     +  27.6165
      2   [36m0.0645[0m   [32m0.3294[0m        [35m0.4587[0m       0.9141        [94m0.3986[0m     +  27.4732
      3   [36m0.0735[0m   [32m0.4185[0m        [35m0.3772[0m       0.9141        [94m0.3431[0m     +  27.2715
      4   [36m0.0920[0m   [32m0.5207[0m        [35m0.3290[0m       0.9141        [94m0.3134[0m     +  27.5891
      5   [36m0.1308[0m   [32m0.5869[0m        [35m0.3049[0m       0.9141        [94m0.2967[0m     +  27.5697
      6   [36m0.1878[0m   [32m0.6229[0m        [35m0.2887[0m       0.9141        [94m0.2865[0m     +  27.5783
      7   [36m0.2165[0m   [32m0.6426[0m        [35m0.2795[0m       0.9141        [94m0.2798[0m     +  28.1713
      8   [36m0.2328[0m   [32m0.6562[0m        [35m0.2722[0m       0.9141        [94m0.2752[0m     +  27.7786
      9   [36m0.2546[0m   [32m0.6663[0m        [35m0.2663[0m       0.9141        [94m0.2718[0m     +  27.3733
     10   [36m0.2660[0m   [32m0.6761[0m        [35m0.2613[0m       0.9141        [94m0.2691[0m     +  27.4387
     11   [36m0.2776[0m   [32m0.6828[0m        [35m0.2584[0m       0.9141        [94m0.2671[0m     +  27.5735
     12   [36m0.2862[0m   [32m0.6893[0m        [35m0.2559[0m       0.9141        [94m0.2654[0m     +  27.5470
     13   [36m0.2959[0m   [32m0.6957[0m        [35m0.2522[0m       0.9141        [94m0.2638[0m     +  27.5754
     14   [36m0.3051[0m   [32m0.7012[0m        [35m0.2510[0m       0.9141        [94m0.2622[0m     +  27.5827
     15   [36m0.3182[0m   [32m0.7076[0m        [35m0.2495[0m       0.9141        [94m0.2611[0m     +  27.4903
     16   0.3168   [32m0.7137[0m        [35m0.2474[0m       0.9141        [94m0.2596[0m     +  27.5095
     17   [36m0.3208[0m   [32m0.7192[0m        [35m0.2472[0m       0.9141        [94m0.2583[0m     +  27.6352
     18   [36m0.3390[0m   [32m0.7248[0m        [35m0.2443[0m       0.9141        [94m0.2568[0m     +  27.7567
     19   [36m0.3431[0m   [32m0.7292[0m        [35m0.2441[0m       0.9141        [94m0.2560[0m     +  27.4184
     20   [36m0.3461[0m   [32m0.7339[0m        [35m0.2428[0m       0.9141        [94m0.2548[0m     +  27.4648
     21   [36m0.3474[0m   [32m0.7380[0m        [35m0.2419[0m       0.9141        [94m0.2538[0m     +  27.3237
     22   [36m0.3486[0m   [32m0.7417[0m        [35m0.2410[0m       [31m0.9154[0m        [94m0.2529[0m     +  27.4067
     23   [36m0.3517[0m   [32m0.7460[0m        [35m0.2386[0m       0.9154        [94m0.2519[0m     +  27.5392
     24   0.3510   [32m0.7483[0m        0.2386       0.9154        [94m0.2512[0m     +  27.5370
     25   [36m0.3536[0m   [32m0.7511[0m        0.2388       0.9141        [94m0.2505[0m     +  27.8156
     26   [36m0.3561[0m   [32m0.7539[0m        [35m0.2378[0m       [31m0.9178[0m        [94m0.2499[0m     +  27.3554
     27   0.3558   [32m0.7562[0m        [35m0.2375[0m       0.9166        [94m0.2493[0m     +  27.7346
     28   0.3561   [32m0.7576[0m        0.2377       0.9166        [94m0.2492[0m     +  27.6373
     29   [36m0.3585[0m   [32m0.7596[0m        [35m0.2366[0m       0.9166        [94m0.2488[0m     +  27.3878
     30   0.3513   [32m0.7611[0m        [35m0.2358[0m       [31m0.9190[0m        [94m0.2483[0m     +  27.4505
     31   0.3503   [32m0.7622[0m        [35m0.2352[0m       0.9190        [94m0.2479[0m     +  27.6585
     32   0.3536   [32m0.7642[0m        [35m0.2350[0m       [31m0.9214[0m        [94m0.2476[0m     +  27.4989
     33   0.3509   [32m0.7652[0m        0.2360       0.9214        [94m0.2475[0m     +  27.4613
     34   0.3498   [32m0.7667[0m        [35m0.2332[0m       0.9214        [94m0.2474[0m     +  27.6872
     35   0.3566   [32m0.7669[0m        0.2344       0.9214        [94m0.2473[0m     +  27.5409
     36   0.3572   [32m0.7671[0m        0.2341       0.9214        0.2474        27.4961
     37   [36m0.3602[0m   [32m0.7681[0m        0.2336       0.9214        [94m0.2471[0m     +  27.6138
     38   0.3601   [32m0.7681[0m        [35m0.2329[0m       0.9214        [94m0.2470[0m     +  27.7381
     39   [36m0.3608[0m   [32m0.7689[0m        [35m0.2322[0m       0.9214        [94m0.2470[0m     +  27.6648
     40   0.3602   0.7685        0.2327       0.9214        0.2474        27.5751
     41   0.3537   [32m0.7694[0m        [35m0.2320[0m       0.9214        0.2472        27.7524
     42   0.3547   [32m0.7708[0m        0.2326       [31m0.9226[0m        [94m0.2466[0m     +  27.5077
     43   0.3543   [32m0.7710[0m        0.2320       0.9226        0.2469        27.2417
     44   0.3551   [32m0.7720[0m        [35m0.2312[0m       0.9226        [94m0.2466[0m     +  27.6711
     45   0.3554   0.7718        [35m0.2311[0m       0.9226        0.2470        27.9004
     46   0.3550   [32m0.7723[0m        0.2317       0.9214        0.2470        27.5257
     47   0.3548   [32m0.7734[0m        0.2314       0.9214        0.2466        27.4741
     48   0.3554   [32m0.7737[0m        [35m0.2302[0m       0.9214        0.2468        27.6119
     49   0.3568   [32m0.7741[0m        0.2309       0.9214        0.2467        27.3979
     50   0.3582   [32m0.7746[0m        0.2307       0.9214        0.2467        27.8844
[32m[I 2023-05-04 09:10:59,607][0m Trial 420 finished with value: 0.2466259626164906 and parameters: {'lr': 1.9981693823896037e-06, 'dropout': 0.3878474146529713, 'd_model_multiplier': 4, 'num_layers': 6, 'n_heads': 32, 'dim_feedforward': 300, 'batch_size': 58, 'pos_encoding': 'learnable', 'activation': 'relu', 'norm': 'LayerNorm', 'optimizer_name': 'AdamW', 'weight_decay': 0.1, 'top_n_features': 90}. Best is trial 246 with value: 0.16447311791139763.[0m
[FileBasedDataset] Initializing dataset...
	Examples: 8264
	Features: 56
	Max length: 315
Standard scalar turned ON, loading params from cache
[FileBasedDataset] Dataset initialization complete
  epoch    auprc    auroc    train_loss    valid_acc    valid_loss    cp      dur
-------  -------  -------  ------------  -----------  ------------  ----  -------
      1   [36m0.0595[0m   [32m0.2857[0m        [35m0.5986[0m       [31m0.9093[0m        [94m0.4645[0m     +  23.6370
      2   [36m0.0669[0m   [32m0.3722[0m        [35m0.3897[0m       0.9093        [94m0.3405[0m     +  23.7051
      3   [36m0.1478[0m   [32m0.5916[0m        [35m0.2939[0m       0.9093        [94m0.3013[0m     +  24.1830
      4   [36m0.2173[0m   [32m0.6691[0m        [35m0.2645[0m       0.9081        [94m0.2888[0m     +  24.2631
      5   [36m0.2509[0m   [32m0.7068[0m        [35m0.2515[0m       0.9093        [94m0.2811[0m     +  23.9383
      6   [36m0.2831[0m   [32m0.7361[0m        [35m0.2444[0m       [31m0.9105[0m        [94m0.2740[0m     +  24.0079
      7   [36m0.2955[0m   [32m0.7555[0m        [35m0.2394[0m       0.9069        [94m0.2693[0m     +  24.0975
      8   [36m0.3045[0m   [32m0.7649[0m        [35m0.2371[0m       0.9081        [94m0.2663[0m     +  24.0948
      9   [36m0.3075[0m   [32m0.7707[0m        [35m0.2347[0m       0.9081        [94m0.2649[0m     +  24.0140
     10   [36m0.3180[0m   [32m0.7745[0m        [35m0.2326[0m       0.9081        [94m0.2639[0m     +  24.1632
     11   [36m0.3254[0m   [32m0.7765[0m        [35m0.2326[0m       0.9081        [94m0.2635[0m     +  24.2279
     12   [36m0.3274[0m   [32m0.7801[0m        [35m0.2318[0m       0.9081        [94m0.2620[0m     +  24.1334
     13   [36m0.3323[0m   [32m0.7825[0m        [35m0.2299[0m       0.9093        [94m0.2612[0m     +  23.8501
     14   [36m0.3353[0m   [32m0.7835[0m        [35m0.2296[0m       0.9093        [94m0.2605[0m     +  24.0004
     15   [36m0.3362[0m   [32m0.7850[0m        0.2296       0.9093        [94m0.2602[0m     +  24.1224
     16   [36m0.3404[0m   [32m0.7867[0m        [35m0.2286[0m       0.9105        [94m0.2600[0m     +  24.2306
     17   0.3384   [32m0.7873[0m        0.2300       0.9105        0.2602        24.2241
     18   0.3372   [32m0.7882[0m        [35m0.2273[0m       0.9105        0.2608        24.0813
     19   0.3375   [32m0.7891[0m        [35m0.2264[0m       0.9105        [94m0.2597[0m     +  24.0786
     20   0.3390   [32m0.7909[0m        0.2276       0.9093        0.2598        24.2561
     21   0.3403   [32m0.7915[0m        0.2280       0.9093        0.2598        23.9121
     22   [36m0.3560[0m   [32m0.7933[0m        [35m0.2256[0m       0.9105        0.2598        23.8626
     23   [36m0.3592[0m   [32m0.7948[0m        0.2278       0.9093        [94m0.2582[0m     +  24.0097
     24   [36m0.3592[0m   [32m0.7963[0m        0.2262       0.9105        0.2585        23.7916
     25   [36m0.3615[0m   [32m0.7980[0m        0.2277       0.9093        [94m0.2568[0m     +  23.9770
     26   [36m0.3622[0m   [32m0.7997[0m        [35m0.2251[0m       0.9093        [94m0.2565[0m     +  23.9784
     27   [36m0.3689[0m   [32m0.8016[0m        0.2272       0.9093        [94m0.2556[0m     +  23.9839
     28   [36m0.3712[0m   [32m0.8030[0m        0.2252       0.9093        0.2573        24.0682
     29   [36m0.3718[0m   [32m0.8031[0m        0.2251       0.9081        0.2562        23.8611
     30   0.3711   [32m0.8035[0m        0.2252       0.9093        0.2559        24.4089
     31   0.3716   [32m0.8052[0m        [35m0.2245[0m       0.9081        [94m0.2549[0m     +  24.1418
     32   [36m0.3774[0m   [32m0.8065[0m        [35m0.2238[0m       0.9093        0.2559        24.2605
     33   [36m0.3795[0m   [32m0.8070[0m        [35m0.2226[0m       0.9069        0.2575        24.0490
     34   [36m0.3797[0m   [32m0.8074[0m        0.2239       0.9045        0.2575        24.2806
     35   0.3759   [32m0.8089[0m        0.2246       0.9081        0.2560        24.3200
     36   [36m0.3808[0m   [32m0.8106[0m        0.2244       0.9057        0.2561        24.0695
     37   [36m0.3818[0m   [32m0.8107[0m        [35m0.2219[0m       0.9057        0.2558        23.9459
     38   0.3808   0.8105        0.2225       0.9057        0.2550        24.1215
     39   [36m0.3831[0m   [32m0.8114[0m        0.2240       0.9057        0.2557        24.0570
     40   [36m0.3850[0m   [32m0.8119[0m        [35m0.2208[0m       0.9045        0.2564        24.1805
Stopping since valid_loss has not improved in the last 10 epochs.
[32m[I 2023-05-04 09:27:29,088][0m Trial 421 finished with value: 0.2549315859105307 and parameters: {'lr': 2.505801496528287e-05, 'dropout': 0.5469997760564393, 'd_model_multiplier': 4, 'num_layers': 5, 'n_heads': 32, 'dim_feedforward': 306, 'batch_size': 68, 'pos_encoding': 'fixed', 'activation': 'relu', 'norm': 'LayerNorm', 'optimizer_name': 'RAdam', 'weight_decay': 0.1, 'top_n_features': 56}. Best is trial 246 with value: 0.16447311791139763.[0m
[FileBasedDataset] Initializing dataset...
	Examples: 8264
	Features: 64
	Max length: 315
Standard scalar turned ON, loading params from cache
[FileBasedDataset] Dataset initialization complete
  epoch    auprc    auroc    train_loss    valid_acc    valid_loss    cp      dur
-------  -------  -------  ------------  -----------  ------------  ----  -------
      1   [36m0.0733[0m   [32m0.4314[0m        [35m0.4763[0m       [31m0.9154[0m        [94m0.3160[0m     +  23.9213
      2   [36m0.1923[0m   [32m0.6695[0m        [35m0.2751[0m       0.9154        [94m0.2758[0m     +  23.3129
      3   [36m0.2119[0m   [32m0.7333[0m        [35m0.2475[0m       [31m0.9166[0m        [94m0.2721[0m     +  23.9611
      4   [36m0.2137[0m   [32m0.7545[0m        [35m0.2354[0m       0.9093        0.2723        24.1823
      5   [36m0.2200[0m   [32m0.7663[0m        [35m0.2323[0m       0.9033        [94m0.2686[0m     +  24.0521
      6   [36m0.2275[0m   [32m0.7732[0m        [35m0.2282[0m       0.8984        [94m0.2668[0m     +  23.9591
      7   0.2217   [32m0.7763[0m        [35m0.2277[0m       0.8972        [94m0.2645[0m     +  24.1422
      8   0.2259   [32m0.7810[0m        [35m0.2259[0m       0.8984        [94m0.2627[0m     +  23.7491
      9   [36m0.2299[0m   [32m0.7852[0m        0.2260       0.8900        0.2643        23.6596
     10   0.2261   [32m0.7859[0m        [35m0.2249[0m       0.8960        [94m0.2626[0m     +  23.9652
     11   0.2217   [32m0.7860[0m        [35m0.2245[0m       0.8936        [94m0.2623[0m     +  23.9888
     12   0.2282   [32m0.7923[0m        0.2245       0.8960        [94m0.2610[0m     +  23.8031
     13   0.2239   [32m0.7928[0m        [35m0.2240[0m       0.8948        0.2620        23.7075
     14   [36m0.2301[0m   [32m0.7939[0m        [35m0.2219[0m       0.8960        [94m0.2596[0m     +  23.7779
     15   0.2267   [32m0.7958[0m        0.2223       0.8960        [94m0.2595[0m     +  23.8192
     16   0.2273   [32m0.7967[0m        [35m0.2215[0m       0.8984        0.2604        23.9063
     17   0.2264   0.7960        [35m0.2189[0m       0.8948        0.2608        23.8311
     18   0.2259   [32m0.7975[0m        0.2194       0.8960        0.2632        24.0090
     19   0.2270   [32m0.7995[0m        [35m0.2177[0m       0.8948        0.2631        24.1817
     20   0.2207   0.7934        0.2177       0.8948        0.2649        24.5023
     21   0.2225   0.7936        [35m0.2175[0m       0.8972        0.2628        23.9951
     22   0.2220   0.7900        [35m0.2162[0m       0.9008        0.2642        23.8893
     23   0.2180   0.7877        0.2164       0.9008        0.2628        23.8490
     24   0.2217   0.7912        [35m0.2144[0m       0.9008        0.2643        23.8664
Stopping since valid_loss has not improved in the last 10 epochs.
[32m[I 2023-05-04 09:37:28,419][0m Trial 422 finished with value: 0.25948905572745645 and parameters: {'lr': 5.4958073804327814e-05, 'dropout': 0.41799130334644014, 'd_model_multiplier': 4, 'num_layers': 5, 'n_heads': 32, 'dim_feedforward': 351, 'batch_size': 59, 'pos_encoding': 'fixed', 'activation': 'relu', 'norm': 'LayerNorm', 'optimizer_name': 'RAdam', 'weight_decay': 0, 'top_n_features': 64}. Best is trial 246 with value: 0.16447311791139763.[0m
[FileBasedDataset] Initializing dataset...
	Examples: 8264
	Features: 73
	Max length: 315
Standard scalar turned ON, loading params from cache
[FileBasedDataset] Dataset initialization complete
Warning, assumed runtime error: CUDA out of memory. Tried to allocate 158.00 MiB (GPU 0; 23.70 GiB total capacity; 22.33 GiB already allocated; 125.25 MiB free; 22.48 GiB reserved in total by PyTorch) If reserved memory is >> allocated memory try setting max_split_size_mb to avoid fragmentation.  See documentation for Memory Management and PYTORCH_CUDA_ALLOC_CONF
[32m[I 2023-05-04 09:37:32,388][0m Trial 423 finished with value: 100.0 and parameters: {'lr': 1.2051234622898379e-05, 'dropout': 0.34859570948596735, 'd_model_multiplier': 64, 'num_layers': 7, 'n_heads': 32, 'dim_feedforward': 313, 'batch_size': 64, 'pos_encoding': 'fixed', 'activation': 'relu', 'norm': 'LayerNorm', 'optimizer_name': 'AdamW', 'weight_decay': 0.1, 'top_n_features': 73}. Best is trial 246 with value: 0.16447311791139763.[0m
[FileBasedDataset] Initializing dataset...
	Examples: 8264
	Features: 61
	Max length: 315
Standard scalar turned ON, loading params from cache
[FileBasedDataset] Dataset initialization complete
  epoch    auprc    auroc    train_loss    valid_acc    valid_loss    cp      dur
-------  -------  -------  ------------  -----------  ------------  ----  -------
      1   [36m0.0748[0m   [32m0.3596[0m        [35m0.5761[0m       [31m0.9154[0m        [94m0.3970[0m     +  34.3862
      2   [36m0.1714[0m   [32m0.6384[0m        [35m0.3113[0m       0.9154        [94m0.2813[0m     +  34.5237
      3   [36m0.1997[0m   [32m0.6928[0m        [35m0.2542[0m       0.9105        [94m0.2703[0m     +  34.3103
      4   [36m0.2016[0m   [32m0.6988[0m        [35m0.2379[0m       0.9093        0.2756        34.2924
      5   [36m0.2030[0m   [32m0.7098[0m        [35m0.2295[0m       0.9057        0.2778        34.6828
      6   [36m0.2077[0m   [32m0.7108[0m        [35m0.2258[0m       0.9057        0.2795        34.5795
      7   [36m0.2122[0m   [32m0.7174[0m        [35m0.2256[0m       0.9069        0.2777        34.8098
      8   [36m0.2146[0m   [32m0.7192[0m        [35m0.2233[0m       0.9105        0.2782        35.0640
      9   [36m0.2195[0m   [32m0.7241[0m        [35m0.2232[0m       0.9081        0.2787        34.8811
     10   [36m0.2209[0m   [32m0.7251[0m        [35m0.2215[0m       0.9117        0.2766        35.2080
     11   [36m0.2235[0m   [32m0.7279[0m        [35m0.2208[0m       0.9093        0.2752        34.7694
     12   [36m0.2249[0m   [32m0.7308[0m        [35m0.2199[0m       0.9069        0.2754        34.9525
Stopping since valid_loss has not improved in the last 10 epochs.
