[32m[I 2023-05-05 08:53:02,821][0m Trial 587 finished with value: 0.25336404648826805 and parameters: {'lr': 4.190986333096888e-05, 'dropout': 0.570852355323844, 'd_model_multiplier': 4, 'num_layers': 1, 'n_heads': 32, 'dim_feedforward': 201, 'batch_size': 31, 'pos_encoding': 'fixed', 'activation': 'relu', 'norm': 'LayerNorm', 'optimizer_name': 'RAdam', 'weight_decay': 0.1, 'top_n_features': 70}. Best is trial 246 with value: 0.16447311791139763.[0m
[FileBasedDataset] Initializing dataset...
	Examples: 8264
	Features: 164
	Max length: 315
Standard scalar turned ON, loading params from cache
[FileBasedDataset] Dataset initialization complete
  epoch    auprc    auroc    train_loss    valid_acc    valid_loss    cp      dur
-------  -------  -------  ------------  -----------  ------------  ----  -------
      1   [36m0.2690[0m   [32m0.7877[0m        [35m0.3155[0m       [31m0.9395[0m        [94m0.1920[0m     +  16.2063
      2   0.2386   [32m0.8189[0m        [35m0.2555[0m       0.9335        0.2128        16.0971
      3   [36m0.2742[0m   0.8158        [35m0.2494[0m       0.9383        0.2092        16.2261
      4   0.2448   0.8188        [35m0.2454[0m       0.9359        0.2346        16.2331
      5   0.2429   0.8162        0.2469       0.9335        0.2370        16.2681
      6   0.2663   [32m0.8235[0m        0.2454       0.9262        0.2055        16.2063
      7   0.2701   0.8219        [35m0.2432[0m       0.9335        0.1922        16.4555
      8   [36m0.3198[0m   [32m0.8363[0m        0.2437       0.9250        0.1972        16.2315
      9   0.2224   0.7993        [35m0.2421[0m       0.9093        0.2398        16.1458
     10   0.2591   0.8147        [35m0.2391[0m       0.9129        0.2399        16.6290
Stopping since valid_loss has not improved in the last 10 epochs.
[32m[I 2023-05-05 08:56:02,106][0m Trial 588 finished with value: 0.1919541134889786 and parameters: {'lr': 0.0012240052972142335, 'dropout': 0.42846862619391746, 'd_model_multiplier': 1, 'num_layers': 4, 'n_heads': 32, 'dim_feedforward': 399, 'batch_size': 41, 'pos_encoding': 'fixed', 'activation': 'relu', 'norm': 'LayerNorm', 'optimizer_name': 'RAdam', 'weight_decay': 0, 'top_n_features': 164}. Best is trial 246 with value: 0.16447311791139763.[0m
[FileBasedDataset] Initializing dataset...
	Examples: 8264
	Features: 164
	Max length: 315
Standard scalar turned ON, loading params from cache
[FileBasedDataset] Dataset initialization complete
  epoch    auprc    auroc    train_loss    valid_acc    valid_loss    cp      dur
-------  -------  -------  ------------  -----------  ------------  ----  -------
      1   [36m0.1575[0m   [32m0.6599[0m        [35m0.2899[0m       [31m0.9250[0m        [94m0.2566[0m     +  18.7140
      2   [36m0.1680[0m   [32m0.6767[0m        [35m0.2549[0m       0.9250        0.2606        19.0207
      3   [36m0.2540[0m   [32m0.7049[0m        [35m0.2516[0m       0.9250        0.2731        18.9873
      4   0.2480   [32m0.7365[0m        [35m0.2470[0m       0.9250        [94m0.2511[0m     +  19.0193
      5   [36m0.2657[0m   [32m0.7572[0m        [35m0.2434[0m       0.9214        [94m0.2504[0m     +  19.0284
      6   0.2532   [32m0.7692[0m        [35m0.2428[0m       0.9214        0.2518        18.9645
      7   [36m0.2701[0m   0.7592        [35m0.2390[0m       0.9238        0.2589        19.2702
      8   0.2583   0.7441        0.2406       0.9250        0.2812        19.2094
      9   0.2660   [32m0.7851[0m        0.2397       0.9238        [94m0.2429[0m     +  19.1649
     10   0.2206   0.7013        [35m0.2386[0m       [31m0.9299[0m        0.3070        18.8391
     11   0.1628   0.7037        0.2422       0.9250        0.2520        18.9526
     12   0.2464   0.7682        0.2394       0.9226        0.2538        19.0631
     13   0.1545   0.6787        0.2434       0.9250        0.2665        19.0956
     14   0.2099   0.7593        0.2420       0.9057        0.2496        18.9581
     15   0.2410   0.7186        [35m0.2379[0m       0.9299        0.2980        18.9859
     16   0.2636   [32m0.8009[0m        [35m0.2367[0m       0.9141        [94m0.2419[0m     +  18.9443
     17   [36m0.2714[0m   0.7430        0.2372       [31m0.9335[0m        0.2537        19.0587
     18   0.2516   0.7327        [35m0.2361[0m       0.9299        0.2940        19.2061
     19   0.1739   0.7253        0.2371       0.8839        0.2820        19.3222
     20   0.1510   0.6743        0.2369       0.9214        0.2834        19.0340
     21   0.1538   0.6725        0.2434       0.9250        0.2911        18.8495
     22   0.1588   0.6705        0.2474       0.9250        0.2796        19.0428
     23   0.1676   0.6701        0.2499       0.9250        0.2755        18.8892
     24   0.1659   0.6768        0.2468       0.9250        0.2728        19.1640
     25   0.1553   0.6751        0.2501       0.9250        0.2811        19.0087
Stopping since valid_loss has not improved in the last 10 epochs.
[32m[I 2023-05-05 09:04:17,499][0m Trial 589 finished with value: 0.24186122257987705 and parameters: {'lr': 0.0014498720783712887, 'dropout': 0.4244834123408211, 'd_model_multiplier': 1, 'num_layers': 5, 'n_heads': 32, 'dim_feedforward': 395, 'batch_size': 39, 'pos_encoding': 'fixed', 'activation': 'relu', 'norm': 'LayerNorm', 'optimizer_name': 'RAdam', 'weight_decay': 0, 'top_n_features': 164}. Best is trial 246 with value: 0.16447311791139763.[0m
[FileBasedDataset] Initializing dataset...
	Examples: 8264
	Features: 65
	Max length: 315
Standard scalar turned ON, loading params from cache
[FileBasedDataset] Dataset initialization complete
  epoch    auprc    auroc    train_loss    valid_acc    valid_loss    cp      dur
-------  -------  -------  ------------  -----------  ------------  ----  -------
      1   [36m0.2441[0m   [32m0.7452[0m        [35m0.2692[0m       [31m0.9093[0m        [94m0.2629[0m     +  10.4386
      2   0.2165   [32m0.7546[0m        [35m0.2488[0m       0.9069        [94m0.2624[0m     +  10.4408
      3   0.2387   0.7518        [35m0.2446[0m       0.9093        0.2733        10.6848
      4   0.2438   [32m0.7640[0m        [35m0.2419[0m       0.8972        0.2785        10.7643
      5   [36m0.2605[0m   0.7602        0.2436       0.9008        0.2731        10.5925
      6   0.2446   0.7562        [35m0.2398[0m       0.8912        0.2864        10.7318
      7   0.2481   0.7634        [35m0.2388[0m       0.8875        0.2814        10.5505
      8   0.2522   [32m0.7649[0m        [35m0.2378[0m       0.8670        0.3127        10.6980
      9   [36m0.2618[0m   [32m0.7676[0m        0.2419       0.8875        0.2835        10.7563
     10   [36m0.2990[0m   0.7635        [35m0.2350[0m       0.9093        [94m0.2564[0m     +  10.7100
     11   0.2563   0.7657        0.2405       0.8996        0.2682        10.6739
     12   0.2389   0.7542        0.2386       0.8779        0.3096        10.7381
     13   0.2312   0.7654        0.2364       0.8779        0.2981        10.7445
     14   0.2818   0.7434        0.2373       [31m0.9166[0m        0.2593        10.6635
     15   0.2723   0.7596        0.2371       0.9069        0.2631        10.7603
     16   0.2389   0.7116        0.2365       0.9045        0.2770        10.6228
     17   0.2582   0.7461        0.2396       0.8984        0.2790        10.7825
     18   0.2576   0.7249        0.2377       0.8658        0.2988        10.6239
     19   0.2248   0.7226        0.2393       0.9008        0.2764        10.8579
Stopping since valid_loss has not improved in the last 10 epochs.
[32m[I 2023-05-05 09:07:52,023][0m Trial 590 finished with value: 0.2563927589837989 and parameters: {'lr': 0.00403462183369198, 'dropout': 0.4340606862277074, 'd_model_multiplier': 1, 'num_layers': 2, 'n_heads': 32, 'dim_feedforward': 387, 'batch_size': 36, 'pos_encoding': 'fixed', 'activation': 'relu', 'norm': 'LayerNorm', 'optimizer_name': 'RAdam', 'weight_decay': 0, 'top_n_features': 65}. Best is trial 246 with value: 0.16447311791139763.[0m
[FileBasedDataset] Initializing dataset...
	Examples: 8264
	Features: 73
	Max length: 315
Standard scalar turned ON, loading params from cache
[FileBasedDataset] Dataset initialization complete
  epoch    auprc    auroc    train_loss    valid_acc    valid_loss    cp      dur
-------  -------  -------  ------------  -----------  ------------  ----  -------
      1   [36m0.2294[0m   [32m0.7576[0m        [35m0.2824[0m       [31m0.9299[0m        [94m0.2227[0m     +  15.8296
      2   [36m0.2596[0m   [32m0.7653[0m        [35m0.2463[0m       [31m0.9311[0m        [94m0.2202[0m     +  16.1326
      3   [36m0.2808[0m   [32m0.7769[0m        [35m0.2462[0m       [31m0.9323[0m        [94m0.2169[0m     +  16.0586
      4   0.2776   0.7744        [35m0.2420[0m       0.9311        0.2235        16.1483
      5   [36m0.2825[0m   [32m0.7853[0m        [35m0.2414[0m       0.9287        0.2277        16.1091
      6   0.2495   0.7705        [35m0.2373[0m       0.9274        0.2385        16.1030
      7   [36m0.2928[0m   0.7748        0.2373       0.9287        0.2225        16.1237
      8   0.2786   [32m0.7888[0m        [35m0.2358[0m       0.9287        0.2197        16.0881
      9   0.2580   0.7041        0.2424       0.9299        0.2668        16.1799
     10   0.1960   0.6697        0.2425       0.9299        0.2884        16.0767
     11   0.1957   0.6683        0.2541       0.9299        0.2685        15.9418
     12   0.2040   0.6658        0.2545       0.9299        0.2619        16.0725
Stopping since valid_loss has not improved in the last 10 epochs.
[32m[I 2023-05-05 09:11:21,449][0m Trial 591 finished with value: 0.21689640066643867 and parameters: {'lr': 0.002821477238192501, 'dropout': 0.4056643872014219, 'd_model_multiplier': 1, 'num_layers': 4, 'n_heads': 32, 'dim_feedforward': 397, 'batch_size': 40, 'pos_encoding': 'fixed', 'activation': 'relu', 'norm': 'LayerNorm', 'optimizer_name': 'RAdam', 'weight_decay': 0, 'top_n_features': 73}. Best is trial 246 with value: 0.16447311791139763.[0m
[FileBasedDataset] Initializing dataset...
	Examples: 8264
	Features: 46
	Max length: 315
Standard scalar turned ON, loading params from cache
[FileBasedDataset] Dataset initialization complete
  epoch    auprc    auroc    train_loss    valid_acc    valid_loss    cp      dur
-------  -------  -------  ------------  -----------  ------------  ----  -------
      1   [36m0.3230[0m   [32m0.8248[0m        [35m0.2898[0m       [31m0.9262[0m        [94m0.2079[0m     +  18.7136
      2   [36m0.3304[0m   [32m0.8293[0m        [35m0.2467[0m       0.9226        0.2108        18.9394
      3   0.3184   0.8216        [35m0.2416[0m       0.9226        0.2135        18.9901
      4   0.3277   0.8238        [35m0.2404[0m       0.9226        0.2144        18.9377
      5   0.3260   0.8216        [35m0.2387[0m       0.9250        0.2198        18.8945
      6   [36m0.3375[0m   0.8216        [35m0.2365[0m       [31m0.9287[0m        0.2320        18.7518
      7   0.3206   0.8203        0.2393       0.9238        0.2322        18.8722
      8   [36m0.3448[0m   0.8200        0.2387       0.9287        0.2256        18.9920
      9   0.2771   0.8118        0.2402       0.9250        0.2368        19.0078
     10   0.3156   0.8204        0.2407       0.9274        0.2525        18.8751
Stopping since valid_loss has not improved in the last 10 epochs.
[32m[I 2023-05-05 09:14:49,669][0m Trial 592 finished with value: 0.2078768191239746 and parameters: {'lr': 0.001329527494995536, 'dropout': 0.4536060784725318, 'd_model_multiplier': 1, 'num_layers': 5, 'n_heads': 32, 'dim_feedforward': 400, 'batch_size': 30, 'pos_encoding': 'fixed', 'activation': 'relu', 'norm': 'LayerNorm', 'optimizer_name': 'RAdam', 'weight_decay': 0, 'top_n_features': 46}. Best is trial 246 with value: 0.16447311791139763.[0m
[FileBasedDataset] Initializing dataset...
	Examples: 8264
	Features: 200
	Max length: 315
Standard scalar turned ON, loading params from cache
[FileBasedDataset] Dataset initialization complete
  epoch    auprc    auroc    train_loss    valid_acc    valid_loss    cp      dur
-------  -------  -------  ------------  -----------  ------------  ----  -------
      1   [36m0.2829[0m   [32m0.7695[0m        [35m0.3091[0m       [31m0.9287[0m        [94m0.2165[0m     +  13.5361
      2   [36m0.3124[0m   [32m0.8034[0m        [35m0.2588[0m       0.9287        [94m0.2097[0m     +  13.7094
      3   [36m0.3182[0m   [32m0.8158[0m        [35m0.2514[0m       [31m0.9299[0m        [94m0.2068[0m     +  13.7448
      4   [36m0.3253[0m   [32m0.8183[0m        [35m0.2486[0m       0.9287        [94m0.2051[0m     +  13.7576
      5   0.3172   0.8013        [35m0.2470[0m       [31m0.9311[0m        0.2161        13.8076
      6   0.3094   0.7956        [35m0.2435[0m       0.9299        0.2285        14.1646
      7   0.2917   0.7948        0.2447       0.9311        0.2309        13.4497
      8   0.3099   0.8099        [35m0.2406[0m       0.9262        0.2256        13.7473
      9   [36m0.3553[0m   0.8058        0.2437       0.9287        0.2199        13.5705
     10   0.3543   0.7956        0.2410       0.9274        0.2287        13.5651
     11   0.3400   0.7762        0.2423       0.9129        0.2472        13.7009
     12   [36m0.3563[0m   0.7888        0.2444       0.9093        0.2565        13.7514
     13   0.3547   0.8149        0.2447       0.9226        0.2207        13.7410
Stopping since valid_loss has not improved in the last 10 epochs.
[32m[I 2023-05-05 09:18:01,985][0m Trial 593 finished with value: 0.20513906132569482 and parameters: {'lr': 0.0017494936614377734, 'dropout': 0.43837775394163037, 'd_model_multiplier': 1, 'num_layers': 3, 'n_heads': 32, 'dim_feedforward': 410, 'batch_size': 42, 'pos_encoding': 'learnable', 'activation': 'relu', 'norm': 'LayerNorm', 'optimizer_name': 'RAdam', 'weight_decay': 0, 'top_n_features': 200}. Best is trial 246 with value: 0.16447311791139763.[0m
[FileBasedDataset] Initializing dataset...
	Examples: 8264
	Features: 54
	Max length: 315
Standard scalar turned ON, loading params from cache
[FileBasedDataset] Dataset initialization complete
  epoch    auprc    auroc    train_loss    valid_acc    valid_loss    cp      dur
-------  -------  -------  ------------  -----------  ------------  ----  -------
      1   [36m0.1320[0m   [32m0.6727[0m        [35m0.2872[0m       [31m0.9347[0m        [94m0.2336[0m     +  38.1543
      2   [36m0.1337[0m   [32m0.6784[0m        [35m0.2644[0m       0.9347        0.2439        38.1140
      3   [36m0.1355[0m   0.6763        [35m0.2644[0m       0.9335        0.2359        38.2513
      4   [36m0.1563[0m   [32m0.6818[0m        [35m0.2598[0m       0.9347        0.2370        38.4599
      5   0.1423   0.6737        [35m0.2592[0m       0.9347        0.2397        38.3439
      6   0.1399   0.6779        [35m0.2570[0m       0.9347        0.2377        38.4621
      7   0.1376   0.6742        0.2594       0.9347        0.2374        38.4198
      8   0.1449   [32m0.6820[0m        [35m0.2568[0m       0.9347        0.2408        38.4050
      9   0.1341   [32m0.6857[0m        0.2582       0.9287        0.2441        38.4570
     10   0.1343   0.6812        0.2570       0.9335        0.2456        38.4824
Stopping since valid_loss has not improved in the last 10 epochs.
[32m[I 2023-05-05 09:25:04,313][0m Trial 594 finished with value: 0.23362014040422988 and parameters: {'lr': 0.0023641730555649066, 'dropout': 0.4166022037057309, 'd_model_multiplier': 1, 'num_layers': 12, 'n_heads': 32, 'dim_feedforward': 404, 'batch_size': 33, 'pos_encoding': 'fixed', 'activation': 'relu', 'norm': 'LayerNorm', 'optimizer_name': 'RAdam', 'weight_decay': 0, 'top_n_features': 54}. Best is trial 246 with value: 0.16447311791139763.[0m
[FileBasedDataset] Initializing dataset...
	Examples: 8264
	Features: 38
	Max length: 315
Standard scalar turned ON, loading params from cache
[FileBasedDataset] Dataset initialization complete
  epoch    auprc    auroc    train_loss    valid_acc    valid_loss    cp      dur
-------  -------  -------  ------------  -----------  ------------  ----  -------
      1   [36m0.0733[0m   [32m0.3635[0m        [35m0.5140[0m       [31m0.9141[0m        [94m0.3495[0m     +  16.0038
      2   [36m0.2211[0m   [32m0.7058[0m        [35m0.2940[0m       0.9141        [94m0.2704[0m     +  15.8238
      3   [36m0.3551[0m   [32m0.7862[0m        [35m0.2510[0m       [31m0.9154[0m        [94m0.2415[0m     +  16.2368
      4   [36m0.3910[0m   [32m0.7995[0m        [35m0.2398[0m       [31m0.9166[0m        [94m0.2352[0m     +  16.1374
      5   [36m0.3990[0m   [32m0.8034[0m        [35m0.2342[0m       0.9154        [94m0.2342[0m     +  16.2647
      6   [36m0.4095[0m   [32m0.8075[0m        [35m0.2321[0m       [31m0.9178[0m        [94m0.2328[0m     +  16.3554
      7   [36m0.4151[0m   [32m0.8085[0m        0.2334       0.9178        [94m0.2324[0m     +  16.1987
      8   [36m0.4166[0m   [32m0.8088[0m        [35m0.2318[0m       [31m0.9190[0m        [94m0.2322[0m     +  16.0825
      9   [36m0.4317[0m   [32m0.8141[0m        [35m0.2308[0m       0.9178        [94m0.2319[0m     +  16.0679
     10   [36m0.4391[0m   [32m0.8179[0m        [35m0.2297[0m       [31m0.9202[0m        [94m0.2281[0m     +  16.0529
     11   [36m0.4394[0m   [32m0.8193[0m        0.2308       [31m0.9214[0m        [94m0.2271[0m     +  16.2360
     12   [36m0.4464[0m   [32m0.8214[0m        0.2304       0.9190        0.2292        16.0855
     13   0.4360   [32m0.8227[0m        [35m0.2270[0m       0.9214        [94m0.2270[0m     +  16.1872
     14   0.4441   [32m0.8255[0m        0.2293       0.9214        [94m0.2237[0m     +  16.1043
     15   0.4413   0.8243        0.2278       0.9214        0.2265        16.1119
     16   0.4425   0.8244        [35m0.2263[0m       0.9202        0.2259        16.2693
     17   0.4394   [32m0.8261[0m        [35m0.2261[0m       [31m0.9226[0m        0.2248        16.2343
     18   0.4400   [32m0.8264[0m        0.2269       0.9226        0.2245        16.1983
     19   0.4388   [32m0.8274[0m        [35m0.2257[0m       0.9226        [94m0.2236[0m     +  16.3495
     20   0.4423   [32m0.8297[0m        [35m0.2236[0m       [31m0.9250[0m        [94m0.2221[0m     +  16.1537
     21   [36m0.4647[0m   [32m0.8325[0m        0.2252       0.9238        [94m0.2216[0m     +  16.1441
     22   0.4396   0.8321        0.2248       0.9202        0.2233        16.2147
     23   0.4340   0.8320        [35m0.2211[0m       0.9214        0.2242        15.9675
     24   0.4376   [32m0.8346[0m        0.2230       0.9214        0.2226        16.0888
     25   0.4460   [32m0.8355[0m        [35m0.2200[0m       0.9214        0.2225        16.1714
     26   0.4482   [32m0.8397[0m        0.2210       0.9226        [94m0.2205[0m     +  16.2336
     27   0.4473   [32m0.8402[0m        0.2207       0.9214        [94m0.2202[0m     +  16.2824
     28   0.4494   0.8401        0.2214       0.9250        [94m0.2185[0m     +  16.1493
     29   0.4594   0.8388        0.2204       [31m0.9262[0m        [94m0.2183[0m     +  16.0075
     30   0.4562   [32m0.8412[0m        0.2203       0.9262        [94m0.2173[0m     +  16.2012
     31   0.4622   [32m0.8428[0m        [35m0.2188[0m       0.9250        [94m0.2169[0m     +  16.0872
     32   0.4571   0.8421        [35m0.2161[0m       [31m0.9287[0m        0.2183        16.0026
     33   0.4504   [32m0.8438[0m        0.2170       0.9262        0.2178        16.3052
     34   0.4540   0.8425        0.2180       0.9238        0.2191        16.2584
     35   0.4612   0.8429        0.2169       0.9238        0.2187        16.0901
     36   0.4409   [32m0.8444[0m        [35m0.2155[0m       0.9274        0.2179        16.0675
     37   0.4515   [32m0.8471[0m        0.2159       0.9274        [94m0.2158[0m     +  16.1669
     38   0.4545   0.8458        0.2168       0.9262        0.2171        16.1767
     39   [36m0.4664[0m   0.8441        0.2160       0.9274        0.2187        16.2406
     40   0.4557   0.8459        [35m0.2136[0m       0.9262        0.2171        16.0779
     41   0.4528   0.8456        0.2146       0.9238        0.2185        16.2603
     42   0.4466   0.8452        [35m0.2127[0m       0.9250        0.2190        16.2496
     43   0.4595   [32m0.8476[0m        0.2141       0.9262        0.2171        16.3348
     44   [36m0.4718[0m   0.8473        0.2134       0.9274        [94m0.2154[0m     +  16.1850
     45   0.4605   [32m0.8478[0m        [35m0.2099[0m       0.9274        0.2164        16.1484
     46   0.4486   0.8456        [35m0.2097[0m       0.9250        0.2187        15.9705
     47   0.4432   0.8461        0.2104       0.9238        0.2191        16.4438
     48   0.4422   0.8468        [35m0.2094[0m       0.9250        0.2190        16.0089
     49   0.4298   0.8451        [35m0.2094[0m       0.9214        0.2205        16.1605
     50   0.4495   [32m0.8481[0m        [35m0.2065[0m       0.9238        0.2183        16.2172
