[32m[I 2023-05-02 05:21:29,519][0m Trial 41 finished with value: 0.23083136867655232 and parameters: {'lr': 0.011448969054469637, 'dropout': 0.5638170287072277, 'd_model_multiplier': 2, 'num_layers': 3, 'n_heads': 16, 'dim_feedforward': 239, 'batch_size': 220, 'pos_encoding': 'fixed', 'activation': 'gelu', 'norm': 'BatchNorm', 'optimizer_name': 'PlainRAdam', 'weight_decay': 0.001, 'top_n_features': 232}. Best is trial 12 with value: 0.20472501771481755.[0m
[FileBasedDataset] Initializing dataset...
	Examples: 8264
	Features: 216
	Max length: 315
Standard scalar turned ON, loading params from cache
[FileBasedDataset] Dataset initialization complete
  epoch    auprc    auroc    train_loss    valid_acc    valid_loss    cp      dur
-------  -------  -------  ------------  -----------  ------------  ----  -------
      1   [36m0.1646[0m   [32m0.6596[0m        [35m0.3009[0m       [31m0.9190[0m        [94m0.2697[0m     +  11.9568
      2   [36m0.2976[0m   [32m0.7651[0m        [35m0.2524[0m       0.9166        0.2973        12.3711
      3   0.1445   0.5500        0.2604       0.9190        0.3660        12.6834
      4   0.2442   0.7207        0.2626       0.9178        [94m0.2592[0m     +  12.8891
      5   0.2330   0.7101        0.2613       0.9190        0.2645        12.6779
      6   0.2848   [32m0.7654[0m        0.2616       [31m0.9202[0m        [94m0.2500[0m     +  12.4707
      7   [36m0.3077[0m   [32m0.7706[0m        0.2527       0.9202        [94m0.2443[0m     +  12.6334
      8   0.2923   0.7449        0.2534       [31m0.9214[0m        0.2478        12.6662
      9   0.2882   0.7689        [35m0.2504[0m       0.9202        [94m0.2429[0m     +  12.2615
     10   0.2890   [32m0.7737[0m        [35m0.2472[0m       0.9117        [94m0.2410[0m     +  12.6815
     11   0.2842   [32m0.7818[0m        0.2475       0.9069        0.2796        12.5883
     12   0.2802   0.7622        0.2492       0.9178        0.2457        13.2955
     13   [36m0.3143[0m   [32m0.7925[0m        [35m0.2429[0m       0.9178        [94m0.2345[0m     +  13.2833
     14   0.3035   0.7894        0.2430       0.9202        [94m0.2342[0m     +  12.8911
     15   [36m0.3175[0m   0.7902        0.2461       0.9141        0.2402        12.9148
     16   [36m0.3213[0m   0.7852        [35m0.2428[0m       0.9190        0.2358        12.9884
     17   [36m0.3306[0m   [32m0.7947[0m        [35m0.2417[0m       0.9129        0.2367        12.7157
     18   0.3102   0.7875        0.2435       0.9154        0.2458        12.8300
     19   0.3031   0.7836        0.2421       0.9141        0.2364        12.7623
     20   0.3054   0.7901        [35m0.2400[0m       0.9178        0.2393        12.7639
     21   0.3134   0.7935        0.2413       0.9117        0.2426        12.8831
     22   0.3031   0.7923        0.2429       0.9154        0.2348        12.9419
     23   0.3050   [32m0.7973[0m        0.2425       0.9141        [94m0.2340[0m     +  13.0130
     24   0.3136   [32m0.8012[0m        [35m0.2399[0m       0.9105        0.2396        12.7806
     25   0.3166   [32m0.8051[0m        0.2426       0.9166        0.2362        12.6602
     26   0.2937   0.7927        0.2418       0.9154        0.2382        13.2205
     27   0.3128   0.7915        [35m0.2393[0m       0.9190        0.2387        12.9066
     28   0.3107   0.7906        0.2396       0.9154        0.2454        12.7273
     29   0.3141   0.7919        [35m0.2386[0m       0.9117        0.2367        13.2918
     30   0.3145   0.7888        0.2406       0.9141        0.2542        12.8281
     31   0.3256   0.7833        [35m0.2363[0m       0.9141        0.2432        13.1560
     32   [36m0.3336[0m   0.7924        [35m0.2360[0m       0.9178        0.2346        13.3685
Stopping since valid_loss has not improved in the last 10 epochs.
[32m[I 2023-05-02 05:28:32,897][0m Trial 42 finished with value: 0.23403713826040548 and parameters: {'lr': 0.022840697163858666, 'dropout': 0.41995972214396793, 'd_model_multiplier': 2, 'num_layers': 1, 'n_heads': 16, 'dim_feedforward': 216, 'batch_size': 236, 'pos_encoding': 'fixed', 'activation': 'gelu', 'norm': 'BatchNorm', 'optimizer_name': 'PlainRAdam', 'weight_decay': 0.001, 'top_n_features': 216}. Best is trial 12 with value: 0.20472501771481755.[0m
[FileBasedDataset] Initializing dataset...
	Examples: 8264
	Features: 238
	Max length: 315
Standard scalar turned ON, loading params from cache
[FileBasedDataset] Dataset initialization complete
Warning, assumed runtime error: CUDA out of memory. Tried to allocate 6.06 GiB (GPU 0; 23.70 GiB total capacity; 14.55 GiB already allocated; 4.04 GiB free; 18.56 GiB reserved in total by PyTorch) If reserved memory is >> allocated memory try setting max_split_size_mb to avoid fragmentation.  See documentation for Memory Management and PYTORCH_CUDA_ALLOC_CONF
[32m[I 2023-05-02 05:28:39,953][0m Trial 43 finished with value: 100.0 and parameters: {'lr': 0.005876432316600084, 'dropout': 0.5241791757416588, 'd_model_multiplier': 2, 'num_layers': 3, 'n_heads': 64, 'dim_feedforward': 273, 'batch_size': 256, 'pos_encoding': 'fixed', 'activation': 'gelu', 'norm': 'BatchNorm', 'optimizer_name': 'PlainRAdam', 'weight_decay': 0.001, 'top_n_features': 238}. Best is trial 12 with value: 0.20472501771481755.[0m
[FileBasedDataset] Initializing dataset...
	Examples: 8264
	Features: 204
	Max length: 315
Standard scalar turned ON, loading params from cache
[FileBasedDataset] Dataset initialization complete
  epoch    auprc    auroc    train_loss    valid_acc    valid_loss    cp      dur
-------  -------  -------  ------------  -----------  ------------  ----  -------
      1   [36m0.2563[0m   [32m0.7632[0m        [35m0.3480[0m       [31m0.9323[0m        [94m0.2733[0m     +  11.3347
      2   [36m0.2895[0m   [32m0.7647[0m        [35m0.2608[0m       [31m0.9335[0m        [94m0.2693[0m     +  11.6189
      3   [36m0.2897[0m   0.7619        [35m0.2535[0m       0.9323        0.2888        12.4049
      4   0.2737   0.7601        [35m0.2475[0m       0.9335        0.2802        12.0660
      5   0.2747   0.7594        [35m0.2443[0m       [31m0.9347[0m        0.3099        12.3249
      6   0.2623   0.7561        0.2451       0.9299        0.3123        11.8138
      7   0.2469   0.7265        [35m0.2402[0m       0.9323        0.2814        11.7059
      8   0.2382   0.7260        0.2434       0.9323        0.3340        12.2749
      9   0.2347   0.7260        [35m0.2381[0m       0.9166        0.3486        12.3949
     10   0.2779   0.7400        0.2389       0.9238        0.3253        12.5197
     11   [36m0.3077[0m   0.7562        [35m0.2370[0m       0.9311        0.3110        11.8704
Stopping since valid_loss has not improved in the last 10 epochs.
[32m[I 2023-05-02 05:31:04,458][0m Trial 44 finished with value: 0.2692508073715085 and parameters: {'lr': 0.0015622491107921048, 'dropout': 0.48190631367216336, 'd_model_multiplier': 4, 'num_layers': 2, 'n_heads': 16, 'dim_feedforward': 197, 'batch_size': 150, 'pos_encoding': 'fixed', 'activation': 'gelu', 'norm': 'BatchNorm', 'optimizer_name': 'PlainRAdam', 'weight_decay': 0.001, 'top_n_features': 204}. Best is trial 12 with value: 0.20472501771481755.[0m
[FileBasedDataset] Initializing dataset...
	Examples: 8264
	Features: 176
	Max length: 315
Standard scalar turned ON, loading params from cache
[FileBasedDataset] Dataset initialization complete
Warning, assumed runtime error: CUDA out of memory. Tried to allocate 1.42 GiB (GPU 0; 23.70 GiB total capacity; 20.93 GiB already allocated; 1.21 GiB free; 21.40 GiB reserved in total by PyTorch) If reserved memory is >> allocated memory try setting max_split_size_mb to avoid fragmentation.  See documentation for Memory Management and PYTORCH_CUDA_ALLOC_CONF
[32m[I 2023-05-02 05:31:11,089][0m Trial 45 finished with value: 100.0 and parameters: {'lr': 0.04126989767826542, 'dropout': 0.6635973577272782, 'd_model_multiplier': 2, 'num_layers': 13, 'n_heads': 16, 'dim_feedforward': 301, 'batch_size': 240, 'pos_encoding': 'learnable', 'activation': 'gelu', 'norm': 'BatchNorm', 'optimizer_name': 'PlainRAdam', 'weight_decay': 0.001, 'top_n_features': 176}. Best is trial 12 with value: 0.20472501771481755.[0m
[FileBasedDataset] Initializing dataset...
	Examples: 8264
	Features: 26
	Max length: 315
Standard scalar turned ON, loading params from cache
[FileBasedDataset] Dataset initialization complete
Warning, assumed runtime error: CUDA out of memory. Tried to allocate 2.14 GiB (GPU 0; 23.70 GiB total capacity; 16.80 GiB already allocated; 1.19 GiB free; 21.41 GiB reserved in total by PyTorch) If reserved memory is >> allocated memory try setting max_split_size_mb to avoid fragmentation.  See documentation for Memory Management and PYTORCH_CUDA_ALLOC_CONF
[32m[I 2023-05-02 05:31:16,985][0m Trial 46 finished with value: 100.0 and parameters: {'lr': 0.010793061592010562, 'dropout': 0.5532711986680964, 'd_model_multiplier': 8, 'num_layers': 5, 'n_heads': 32, 'dim_feedforward': 451, 'batch_size': 181, 'pos_encoding': 'fixed', 'activation': 'relu', 'norm': 'LayerNorm', 'optimizer_name': 'RAdam', 'weight_decay': 0.01, 'top_n_features': 26}. Best is trial 12 with value: 0.20472501771481755.[0m
[FileBasedDataset] Initializing dataset...
	Examples: 8264
	Features: 218
	Max length: 315
Standard scalar turned ON, loading params from cache
[FileBasedDataset] Dataset initialization complete
  epoch    auprc    auroc    train_loss    valid_acc    valid_loss    cp      dur
-------  -------  -------  ------------  -----------  ------------  ----  -------
      1   [36m0.1653[0m   [32m0.6444[0m        [35m1.1712[0m       [31m0.9274[0m        [94m0.2800[0m     +  38.5404
      2   0.0916   0.5835        [35m0.9821[0m       0.9262        [94m0.2798[0m     +  38.4720
      3   [36m0.2185[0m   [32m0.7405[0m        [35m0.7577[0m       0.9250        [94m0.2363[0m     +  38.8164
      4   0.2097   0.7372        0.7980       0.9274        0.2381        39.1310
      5   0.2130   [32m0.7610[0m        [35m0.7372[0m       0.9238        0.2438        39.1425
      6   [36m0.2217[0m   [32m0.7671[0m        0.9006       0.9093        0.2484        38.8376
      7   [36m0.2325[0m   0.7391        0.7537       0.9274        0.2388        39.2213
      8   0.0547   0.3284        0.9934       0.9274        0.3709        39.3100
      9   [36m0.2548[0m   0.7631        0.8920       0.9178        [94m0.2302[0m     +  39.2031
     10   0.2420   0.7390        0.7395       0.9274        0.2357        39.2614
     11   0.1975   0.6853        0.7784       0.9238        0.3129        39.1288
     12   0.2246   0.6966        0.7677       0.9250        0.2455        38.8100
     13   0.1814   0.6639        1.1023       0.9129        0.3800        39.4894
     14   0.1165   0.6027        1.1951       0.0726        4.9445        39.1192
     15   0.1772   0.7278        1.7481       0.8767        0.3336        38.9035
     16   0.1634   0.6643        1.0250       0.9274        0.2722        39.5561
     17   0.2545   0.7173        1.1007       0.6675        0.6609        39.3468
     18   0.1904   0.6775        0.9509       0.9033        0.4606        39.4351
Stopping since valid_loss has not improved in the last 10 epochs.
[32m[I 2023-05-02 05:43:41,559][0m Trial 47 finished with value: 0.2301832255800373 and parameters: {'lr': 0.004777946938609365, 'dropout': 0.6016193669895465, 'd_model_multiplier': 32, 'num_layers': 9, 'n_heads': 16, 'dim_feedforward': 257, 'batch_size': 81, 'pos_encoding': 'fixed', 'activation': 'gelu', 'norm': 'BatchNorm', 'optimizer_name': 'AdamW', 'weight_decay': 0.1, 'top_n_features': 218}. Best is trial 12 with value: 0.20472501771481755.[0m
[FileBasedDataset] Initializing dataset...
	Examples: 8264
	Features: 189
	Max length: 315
Standard scalar turned ON, loading params from cache
[FileBasedDataset] Dataset initialization complete
  epoch    auprc    auroc    train_loss    valid_acc    valid_loss    cp      dur
-------  -------  -------  ------------  -----------  ------------  ----  -------
      1   [36m0.0936[0m   [32m0.4139[0m        [35m0.5014[0m       [31m0.9178[0m        [94m0.4443[0m     +  35.6519
      2   [36m0.2226[0m   [32m0.6895[0m        [35m0.3151[0m       0.9178        [94m0.3521[0m     +  35.6385
      3   0.1862   0.6895        [35m0.2865[0m       0.9178        0.3682        36.1400
      4   [36m0.2349[0m   [32m0.7123[0m        [35m0.2733[0m       0.9178        [94m0.3062[0m     +  35.8423
      5   0.2263   [32m0.7221[0m        [35m0.2650[0m       0.9178        0.3106        35.9583
      6   0.1964   0.7040        [35m0.2640[0m       0.9166        0.3818        36.0784
      7   0.2012   0.7089        [35m0.2570[0m       0.9178        0.3567        35.9004
      8   0.2288   0.7065        0.2577       0.9178        0.3464        36.1327
      9   [36m0.2524[0m   0.7217        0.2598       0.9178        0.3335        35.7282
     10   0.2146   0.7048        0.2572       0.9166        0.3250        35.7423
     11   0.1539   0.6641        [35m0.2564[0m       0.9166        0.3884        35.6185
     12   [36m0.2563[0m   0.7064        [35m0.2552[0m       0.9166        0.3231        35.9525
     13   [36m0.2684[0m   0.7148        0.2576       0.9178        0.3145        35.9759
     14   0.2605   0.7117        [35m0.2526[0m       0.9178        [94m0.2945[0m     +  36.1573
     15   0.2531   0.7061        0.2550       0.9166        0.3164        36.0097
     16   0.2612   0.7175        [35m0.2515[0m       0.9178        [94m0.2800[0m     +  36.0139
     17   0.2651   0.7147        0.2521       0.9178        [94m0.2712[0m     +  35.9530
     18   0.2629   0.7114        0.2550       0.9166        0.2959        35.9163
     19   0.2645   0.7136        0.2558       0.9178        0.2808        36.1569
     20   0.2636   0.7015        0.2519       0.9178        [94m0.2682[0m     +  35.8679
     21   [36m0.2765[0m   0.7186        0.2527       0.9178        [94m0.2597[0m     +  35.5865
     22   0.2636   0.7066        0.2548       0.9166        0.2649        36.0381
     23   0.2510   0.7142        0.2524       0.9178        0.2604        36.0024
     24   0.2534   [32m0.7287[0m        [35m0.2512[0m       0.9178        [94m0.2597[0m     +  35.7153
     25   0.2371   0.7199        [35m0.2511[0m       0.9178        0.2643        35.7655
     26   0.2448   0.7176        0.2520       0.9166        0.2608        35.9210
     27   0.2523   0.7248        0.2516       0.9166        0.2634        35.9908
     28   0.2439   0.7217        0.2516       0.9166        0.2651        35.9374
     29   0.2635   0.7261        [35m0.2504[0m       0.9178        0.2724        35.6989
     30   0.2447   0.7164        0.2516       0.9166        0.2753        35.9883
     31   0.2560   0.7122        0.2516       0.9166        0.2745        35.6062
     32   0.1800   0.6773        0.2505       0.9166        0.2959        35.5890
     33   0.2163   0.7086        [35m0.2481[0m       0.9166        0.2801        35.9094
Stopping since valid_loss has not improved in the last 10 epochs.
[32m[I 2023-05-02 06:04:05,680][0m Trial 48 finished with value: 0.25968308586451566 and parameters: {'lr': 0.0022164731513471423, 'dropout': 0.5960538789021466, 'd_model_multiplier': 32, 'num_layers': 9, 'n_heads': 16, 'dim_feedforward': 278, 'batch_size': 69, 'pos_encoding': 'learnable', 'activation': 'relu', 'norm': 'LayerNorm', 'optimizer_name': 'AdamW', 'weight_decay': 0.1, 'top_n_features': 189}. Best is trial 12 with value: 0.20472501771481755.[0m
[FileBasedDataset] Initializing dataset...
	Examples: 8264
	Features: 128
	Max length: 315
Standard scalar turned ON, loading params from cache
[FileBasedDataset] Dataset initialization complete
  epoch    auprc    auroc    train_loss    valid_acc    valid_loss    cp      dur
-------  -------  -------  ------------  -----------  ------------  ----  -------
      1   [36m0.2869[0m   [32m0.7495[0m        [35m0.3415[0m       [31m0.9214[0m        [94m0.3639[0m     +  20.9874
      2   [36m0.3211[0m   [32m0.7804[0m        [35m0.3135[0m       0.9178        [94m0.3120[0m     +  21.6326
      3   0.2951   0.7763        [35m0.3005[0m       0.9178        [94m0.2751[0m     +  21.2153
      4   [36m0.3400[0m   [32m0.7831[0m        [35m0.2972[0m       0.9214        [94m0.2719[0m     +  20.8749
      5   [36m0.3562[0m   [32m0.7955[0m        [35m0.2880[0m       [31m0.9226[0m        [94m0.2566[0m     +  21.1098
      6   0.3417   0.7903        0.2887       0.9190        [94m0.2524[0m     +  21.3145
      7   [36m0.3564[0m   [32m0.7986[0m        0.2895       0.9105        0.3284        21.8128
      8   0.3446   0.7552        [35m0.2772[0m       0.9190        0.2789        21.4066
      9   [36m0.3793[0m   0.7809        [35m0.2680[0m       0.9202        0.2909        21.4082
     10   [36m0.3995[0m   0.7907        0.2775       0.9166        0.3792        21.1417
     11   0.3727   0.7859        0.2695       0.9202        0.3704        21.4889
     12   [36m0.4063[0m   0.7909        0.2725       0.9202        0.3051        21.4345
     13   [36m0.4227[0m   [32m0.8048[0m        [35m0.2627[0m       [31m0.9250[0m        0.2735        21.2742
     14   0.4213   0.8030        0.2750       0.9214        0.2898        21.1418
     15   [36m0.4278[0m   [32m0.8075[0m        0.2660       0.9250        0.2664        20.9882
Stopping since valid_loss has not improved in the last 10 epochs.
[32m[I 2023-05-02 06:09:47,545][0m Trial 49 finished with value: 0.2524306776301604 and parameters: {'lr': 0.0003357178107347635, 'dropout': 0.616951143286173, 'd_model_multiplier': 32, 'num_layers': 9, 'n_heads': 8, 'dim_feedforward': 333, 'batch_size': 80, 'pos_encoding': 'fixed', 'activation': 'relu', 'norm': 'BatchNorm', 'optimizer_name': 'AdamW', 'weight_decay': 0.1, 'top_n_features': 128}. Best is trial 12 with value: 0.20472501771481755.[0m
[FileBasedDataset] Initializing dataset...
	Examples: 8264
	Features: 203
	Max length: 315
Standard scalar turned ON, loading params from cache
[FileBasedDataset] Dataset initialization complete
Warning, assumed runtime error: CUDA out of memory. Tried to allocate 656.00 MiB (GPU 0; 23.70 GiB total capacity; 21.73 GiB already allocated; 577.25 MiB free; 22.04 GiB reserved in total by PyTorch) If reserved memory is >> allocated memory try setting max_split_size_mb to avoid fragmentation.  See documentation for Memory Management and PYTORCH_CUDA_ALLOC_CONF
[32m[I 2023-05-02 06:09:50,543][0m Trial 50 finished with value: 100.0 and parameters: {'lr': 0.0031385300850930086, 'dropout': 0.6574838285546138, 'd_model_multiplier': 32, 'num_layers': 11, 'n_heads': 64, 'dim_feedforward': 170, 'batch_size': 27, 'pos_encoding': 'fixed', 'activation': 'gelu', 'norm': 'LayerNorm', 'optimizer_name': 'AdamW', 'weight_decay': 0.1, 'top_n_features': 203}. Best is trial 12 with value: 0.20472501771481755.[0m
[FileBasedDataset] Initializing dataset...
	Examples: 8264
	Features: 221
	Max length: 315
Standard scalar turned ON, loading params from cache
[FileBasedDataset] Dataset initialization complete
  epoch    auprc    auroc    train_loss    valid_acc    valid_loss    cp      dur
-------  -------  -------  ------------  -----------  ------------  ----  -------
      1   [36m0.0733[0m   [32m0.3628[0m        [35m9.1465[0m       [31m0.9202[0m        [94m8.5719[0m     +  72.8723
      2   0.0721   [32m0.3655[0m        [35m6.5106[0m       0.9202        8.8407        72.7737
      3   0.0659   0.3300        [35m3.8284[0m       0.9202        [94m1.9159[0m     +  73.0172
      4   [36m0.1217[0m   [32m0.4954[0m        [35m1.6777[0m       0.9129        [94m0.6293[0m     +  73.2174
      5   0.0935   0.4480        2.7627       0.9154        2.3936        72.8557
      6   [36m0.1240[0m   [32m0.5311[0m        2.2665       0.9129        1.6187        73.1693
      7   0.0933   0.5089        1.8499       0.9202        1.1144        72.9755
      8   [36m0.1663[0m   [32m0.5666[0m        [35m1.5619[0m       0.9202        0.8145        73.3597
      9   0.1618   [32m0.5928[0m        [35m1.4560[0m       0.9190        0.7430        73.0661
     10   0.0858   0.4197        2.1400       0.9202        [94m0.4498[0m     +  72.8019
     11   0.1076   0.5479        2.4103       0.9202        0.6919        72.9825
     12   [36m0.1894[0m   [32m0.6762[0m        2.1309       0.8984        1.2093        73.1937
     13   0.1266   0.5087        2.7154       0.5429        0.9112        72.7758
     14   0.0571   0.2906        3.5729       0.8924        1.1270        73.1661
     15   0.1349   0.5598        3.9740       0.9117        0.6457        72.6043
     16   0.0725   0.3832        5.9639       0.9141        1.0590        72.5640
     17   0.1106   0.5391        6.8417       0.1608        7.5210        72.7265
     18   0.0837   0.4977        7.2329       0.9141        2.1776        73.1531
     19   0.0645   0.3332        7.2866       0.9154        2.7413        72.5734
Stopping since valid_loss has not improved in the last 10 epochs.
