[32m[I 2023-05-03 21:43:39,801][0m Trial 380 finished with value: 0.2373172324038186 and parameters: {'lr': 3.516872937672117e-05, 'dropout': 0.26296832062180014, 'd_model_multiplier': 4, 'num_layers': 5, 'n_heads': 32, 'dim_feedforward': 359, 'batch_size': 48, 'pos_encoding': 'fixed', 'activation': 'relu', 'norm': 'LayerNorm', 'optimizer_name': 'RAdam', 'weight_decay': 0, 'top_n_features': 63}. Best is trial 246 with value: 0.16447311791139763.[0m
[FileBasedDataset] Initializing dataset...
	Examples: 8264
	Features: 52
	Max length: 315
Standard scalar turned ON, loading params from cache
[FileBasedDataset] Dataset initialization complete
  epoch    auprc    auroc    train_loss    valid_acc    valid_loss    cp       dur
-------  -------  -------  ------------  -----------  ------------  ----  --------
      1   [36m0.3274[0m   [32m0.7497[0m        [35m0.2697[0m       [31m0.9238[0m        [94m0.2434[0m     +  101.5516
      2   [36m0.3378[0m   [32m0.7561[0m        [35m0.2340[0m       0.9238        [94m0.2416[0m     +  101.8432
      3   [36m0.3442[0m   [32m0.7613[0m        [35m0.2310[0m       0.9214        [94m0.2407[0m     +  101.9964
      4   0.3311   [32m0.7632[0m        [35m0.2290[0m       0.9226        0.2416        102.1425
      5   0.3350   [32m0.7650[0m        [35m0.2263[0m       0.9190        0.2422        101.8295
      6   0.3370   [32m0.7675[0m        [35m0.2256[0m       0.9202        0.2425        101.8207
      7   0.3370   [32m0.7723[0m        [35m0.2227[0m       0.9226        0.2423        101.8939
      8   0.3323   [32m0.7760[0m        [35m0.2225[0m       0.9238        0.2425        101.8478
      9   0.3344   [32m0.7761[0m        [35m0.2204[0m       0.9214        0.2430        101.9567
     10   0.3401   [32m0.7811[0m        [35m0.2183[0m       0.9202        0.2430        101.9374
     11   [36m0.3447[0m   [32m0.7859[0m        [35m0.2170[0m       0.9202        0.2408        102.0794
     12   0.3447   [32m0.7885[0m        [35m0.2156[0m       0.9214        [94m0.2401[0m     +  101.9679
     13   [36m0.3473[0m   0.7880        [35m0.2143[0m       0.9214        0.2416        101.9783
     14   0.3465   [32m0.7890[0m        [35m0.2131[0m       0.9202        0.2425        102.1400
     15   0.3461   0.7864        [35m0.2112[0m       0.9238        0.2414        101.8080
     16   0.3406   0.7845        [35m0.2104[0m       0.9226        0.2428        102.1240
     17   0.3398   0.7852        [35m0.2087[0m       0.9190        0.2444        102.0497
     18   0.3353   0.7832        [35m0.2076[0m       0.9190        0.2469        101.7165
     19   0.3359   0.7833        [35m0.2067[0m       0.9190        0.2487        101.8107
     20   0.3309   0.7811        [35m0.2052[0m       0.9214        0.2503        101.9091
     21   0.3396   0.7863        [35m0.2049[0m       0.9202        0.2502        101.8261
Stopping since valid_loss has not improved in the last 10 epochs.
[32m[I 2023-05-03 22:21:11,797][0m Trial 381 finished with value: 0.24006040814133336 and parameters: {'lr': 5.0137890361558e-06, 'dropout': 0.3419376703063544, 'd_model_multiplier': 64, 'num_layers': 5, 'n_heads': 32, 'dim_feedforward': 317, 'batch_size': 60, 'pos_encoding': 'fixed', 'activation': 'relu', 'norm': 'LayerNorm', 'optimizer_name': 'AdamW', 'weight_decay': 0.1, 'top_n_features': 52}. Best is trial 246 with value: 0.16447311791139763.[0m
[FileBasedDataset] Initializing dataset...
	Examples: 8264
	Features: 71
	Max length: 315
Standard scalar turned ON, loading params from cache
[FileBasedDataset] Dataset initialization complete
  epoch    auprc    auroc    train_loss    valid_acc    valid_loss    cp      dur
-------  -------  -------  ------------  -----------  ------------  ----  -------
      1   [36m0.0818[0m   [32m0.3411[0m        [35m0.5396[0m       [31m0.9105[0m        [94m0.3962[0m     +  34.4115
      2   [36m0.1385[0m   [32m0.5704[0m        [35m0.3235[0m       0.9105        [94m0.3012[0m     +  34.3927
      3   [36m0.2416[0m   [32m0.6740[0m        [35m0.2640[0m       0.9105        [94m0.2823[0m     +  34.5761
      4   [36m0.2948[0m   [32m0.7002[0m        [35m0.2476[0m       0.9105        [94m0.2744[0m     +  34.6532
      5   [36m0.3182[0m   [32m0.7107[0m        [35m0.2397[0m       0.9093        [94m0.2698[0m     +  34.4730
      6   [36m0.3347[0m   [32m0.7182[0m        [35m0.2360[0m       [31m0.9129[0m        [94m0.2666[0m     +  34.4722
      7   [36m0.3381[0m   [32m0.7227[0m        [35m0.2341[0m       0.9117        [94m0.2658[0m     +  34.4322
      8   0.3371   [32m0.7256[0m        [35m0.2319[0m       [31m0.9166[0m        [94m0.2649[0m     +  34.2420
      9   0.3379   [32m0.7292[0m        [35m0.2317[0m       0.9154        0.2649        34.4968
     10   [36m0.3401[0m   [32m0.7316[0m        [35m0.2307[0m       0.9154        [94m0.2647[0m     +  34.6971
     11   [36m0.3407[0m   [32m0.7344[0m        [35m0.2296[0m       0.9166        [94m0.2646[0m     +  34.8303
     12   [36m0.3411[0m   [32m0.7369[0m        [35m0.2286[0m       [31m0.9178[0m        [94m0.2645[0m     +  34.4132
     13   0.3394   [32m0.7390[0m        [35m0.2264[0m       [31m0.9190[0m        [94m0.2644[0m     +  34.6408
     14   0.3375   [32m0.7410[0m        0.2266       [31m0.9202[0m        0.2645        34.8517
     15   0.3367   [32m0.7438[0m        0.2266       0.9178        [94m0.2641[0m     +  34.5808
     16   0.3371   [32m0.7459[0m        [35m0.2252[0m       0.9166        0.2642        34.5711
     17   0.3400   [32m0.7485[0m        [35m0.2246[0m       0.9166        0.2641        34.4980
     18   0.3378   [32m0.7501[0m        0.2252       0.9166        0.2642        34.4583
     19   [36m0.3419[0m   [32m0.7513[0m        [35m0.2240[0m       0.9166        0.2642        34.7658
     20   [36m0.3434[0m   [32m0.7529[0m        [35m0.2224[0m       0.9166        0.2644        34.5888
     21   0.3417   [32m0.7540[0m        0.2231       0.9166        0.2645        34.3765
     22   0.3370   [32m0.7550[0m        [35m0.2224[0m       0.9141        0.2645        34.4576
     23   0.3420   [32m0.7555[0m        [35m0.2224[0m       0.9141        0.2650        34.5844
     24   0.3412   [32m0.7570[0m        [35m0.2217[0m       0.9129        0.2644        34.5338
Stopping since valid_loss has not improved in the last 10 epochs.
[32m[I 2023-05-03 22:35:37,736][0m Trial 382 finished with value: 0.2640528954552011 and parameters: {'lr': 3.024804308562991e-06, 'dropout': 0.31836801475115, 'd_model_multiplier': 4, 'num_layers': 4, 'n_heads': 64, 'dim_feedforward': 323, 'batch_size': 19, 'pos_encoding': 'fixed', 'activation': 'relu', 'norm': 'LayerNorm', 'optimizer_name': 'RAdam', 'weight_decay': 0.1, 'top_n_features': 71}. Best is trial 246 with value: 0.16447311791139763.[0m
[FileBasedDataset] Initializing dataset...
	Examples: 8264
	Features: 58
	Max length: 315
Standard scalar turned ON, loading params from cache
[FileBasedDataset] Dataset initialization complete
  epoch    auprc    auroc    train_loss    valid_acc    valid_loss    cp      dur
-------  -------  -------  ------------  -----------  ------------  ----  -------
      1   [36m0.0690[0m   [32m0.3325[0m        [35m0.5981[0m       [31m0.9178[0m        [94m0.5234[0m     +  27.6757
      2   0.0676   0.3234        [35m0.4797[0m       0.9178        [94m0.4257[0m     +  27.4404
      3   [36m0.0696[0m   [32m0.3450[0m        [35m0.4033[0m       0.9178        [94m0.3665[0m     +  27.1698
      4   [36m0.0767[0m   [32m0.4096[0m        [35m0.3559[0m       0.9178        [94m0.3300[0m     +  27.3682
      5   [36m0.0842[0m   [32m0.4818[0m        [35m0.3267[0m       0.9178        [94m0.3073[0m     +  27.6329
      6   [36m0.1063[0m   [32m0.5517[0m        [35m0.3067[0m       0.9178        [94m0.2927[0m     +  27.6152
      7   [36m0.1622[0m   [32m0.6084[0m        [35m0.2938[0m       0.9178        [94m0.2820[0m     +  27.3862
      8   [36m0.1872[0m   [32m0.6455[0m        [35m0.2850[0m       0.9178        [94m0.2742[0m     +  27.4384
      9   [36m0.2161[0m   [32m0.6775[0m        [35m0.2767[0m       0.9178        [94m0.2679[0m     +  27.2555
     10   [36m0.2437[0m   [32m0.7030[0m        [35m0.2711[0m       0.9178        [94m0.2629[0m     +  27.3740
     11   [36m0.2742[0m   [32m0.7221[0m        [35m0.2658[0m       0.9178        [94m0.2585[0m     +  27.6397
     12   [36m0.2986[0m   [32m0.7390[0m        [35m0.2631[0m       0.9178        [94m0.2547[0m     +  27.1815
     13   [36m0.3202[0m   [32m0.7499[0m        [35m0.2599[0m       0.9178        [94m0.2517[0m     +  27.6393
     14   [36m0.3432[0m   [32m0.7599[0m        [35m0.2563[0m       0.9178        [94m0.2488[0m     +  27.6166
     15   [36m0.3637[0m   [32m0.7671[0m        [35m0.2551[0m       0.9178        [94m0.2461[0m     +  27.1440
     16   [36m0.3733[0m   [32m0.7748[0m        [35m0.2527[0m       0.9178        [94m0.2432[0m     +  27.4308
     17   [36m0.3913[0m   [32m0.7824[0m        [35m0.2497[0m       [31m0.9190[0m        [94m0.2406[0m     +  27.5735
     18   [36m0.4001[0m   [32m0.7870[0m        [35m0.2492[0m       [31m0.9202[0m        [94m0.2387[0m     +  27.5765
     19   [36m0.4051[0m   [32m0.7921[0m        [35m0.2471[0m       0.9190        [94m0.2367[0m     +  27.6838
     20   [36m0.4072[0m   [32m0.7958[0m        [35m0.2468[0m       0.9202        [94m0.2349[0m     +  27.2881
     21   [36m0.4111[0m   [32m0.7993[0m        [35m0.2431[0m       [31m0.9214[0m        [94m0.2335[0m     +  27.5963
     22   [36m0.4115[0m   [32m0.8013[0m        0.2431       [31m0.9226[0m        [94m0.2322[0m     +  27.5666
     23   [36m0.4156[0m   [32m0.8031[0m        [35m0.2407[0m       0.9226        [94m0.2312[0m     +  27.3376
     24   [36m0.4197[0m   [32m0.8049[0m        0.2409       0.9226        [94m0.2299[0m     +  27.5509
     25   0.4191   [32m0.8054[0m        [35m0.2399[0m       [31m0.9238[0m        [94m0.2290[0m     +  27.5181
     26   0.4178   0.8054        [35m0.2395[0m       0.9238        [94m0.2283[0m     +  27.0693
     27   0.4180   [32m0.8062[0m        [35m0.2380[0m       0.9238        [94m0.2277[0m     +  27.5879
     28   0.4186   [32m0.8066[0m        0.2393       0.9226        [94m0.2272[0m     +  27.2635
     29   0.4189   [32m0.8067[0m        [35m0.2374[0m       0.9226        [94m0.2268[0m     +  27.4096
     30   [36m0.4223[0m   [32m0.8071[0m        0.2382       0.9226        [94m0.2265[0m     +  27.4926
     31   0.4206   [32m0.8076[0m        [35m0.2368[0m       0.9238        [94m0.2260[0m     +  27.6168
     32   0.4193   [32m0.8077[0m        [35m0.2356[0m       [31m0.9250[0m        [94m0.2256[0m     +  27.7548
     33   [36m0.4255[0m   [32m0.8080[0m        0.2363       0.9250        [94m0.2256[0m     +  27.6432
     34   0.4250   0.8079        [35m0.2356[0m       [31m0.9262[0m        [94m0.2253[0m     +  27.7526
     35   [36m0.4258[0m   [32m0.8082[0m        [35m0.2348[0m       0.9262        [94m0.2250[0m     +  27.6864
     36   [36m0.4269[0m   0.8082        [35m0.2344[0m       [31m0.9274[0m        [94m0.2247[0m     +  27.3268
     37   [36m0.4280[0m   [32m0.8088[0m        0.2354       0.9274        [94m0.2244[0m     +  27.4140
     38   [36m0.4285[0m   [32m0.8090[0m        [35m0.2341[0m       [31m0.9287[0m        [94m0.2243[0m     +  27.4784
     39   0.4281   [32m0.8093[0m        [35m0.2334[0m       0.9287        [94m0.2242[0m     +  27.9467
     40   0.4262   [32m0.8095[0m        0.2345       0.9287        [94m0.2239[0m     +  27.6348
     41   0.4269   [32m0.8098[0m        0.2353       0.9274        [94m0.2239[0m     +  27.6337
     42   0.4265   [32m0.8102[0m        [35m0.2314[0m       0.9274        [94m0.2236[0m     +  27.4939
     43   0.4282   [32m0.8106[0m        0.2350       0.9274        [94m0.2234[0m     +  27.7743
     44   0.4262   [32m0.8110[0m        0.2324       0.9274        [94m0.2233[0m     +  27.3836
     45   0.4268   [32m0.8117[0m        0.2332       0.9274        [94m0.2233[0m     +  27.4674
     46   0.4271   [32m0.8121[0m        0.2341       0.9274        [94m0.2232[0m     +  27.6335
     47   0.4278   [32m0.8125[0m        0.2321       0.9274        [94m0.2232[0m     +  27.8024
     48   0.4281   [32m0.8128[0m        0.2323       0.9274        [94m0.2229[0m     +  27.9424
     49   [36m0.4290[0m   [32m0.8132[0m        0.2330       0.9274        [94m0.2229[0m     +  27.6595
     50   [36m0.4295[0m   [32m0.8135[0m        0.2324       0.9274        [94m0.2226[0m     +  27.8734
[32m[I 2023-05-03 22:58:40,092][0m Trial 383 finished with value: 0.2225827102649601 and parameters: {'lr': 1.7437070525952137e-06, 'dropout': 0.42447429927238084, 'd_model_multiplier': 4, 'num_layers': 6, 'n_heads': 32, 'dim_feedforward': 336, 'batch_size': 65, 'pos_encoding': 'fixed', 'activation': 'relu', 'norm': 'LayerNorm', 'optimizer_name': 'AdamW', 'weight_decay': 0.1, 'top_n_features': 58}. Best is trial 246 with value: 0.16447311791139763.[0m
[FileBasedDataset] Initializing dataset...
	Examples: 8264
	Features: 66
	Max length: 315
Standard scalar turned ON, loading params from cache
[FileBasedDataset] Dataset initialization complete
  epoch    auprc    auroc    train_loss    valid_acc    valid_loss    cp      dur
-------  -------  -------  ------------  -----------  ------------  ----  -------
      1   [36m0.0810[0m   [32m0.3567[0m        [35m0.6163[0m       [31m0.9105[0m        [94m0.5387[0m     +  19.9987
      2   0.0805   0.3525        [35m0.4627[0m       0.9105        [94m0.3963[0m     +  19.9477
      3   [36m0.0972[0m   [32m0.4847[0m        [35m0.3477[0m       0.9105        [94m0.3233[0m     +  19.9819
      4   [36m0.1922[0m   [32m0.6039[0m        [35m0.2929[0m       0.9105        [94m0.2945[0m     +  20.0425
      5   [36m0.2293[0m   [32m0.6586[0m        [35m0.2680[0m       [31m0.9117[0m        [94m0.2828[0m     +  20.2266
      6   [36m0.2552[0m   [32m0.6914[0m        [35m0.2544[0m       [31m0.9129[0m        [94m0.2764[0m     +  19.9189
      7   [36m0.2744[0m   [32m0.7078[0m        [35m0.2464[0m       0.9105        [94m0.2730[0m     +  19.9590
      8   [36m0.2836[0m   [32m0.7153[0m        [35m0.2410[0m       0.9117        [94m0.2716[0m     +  20.0233
      9   [36m0.2908[0m   [32m0.7210[0m        [35m0.2378[0m       0.9105        [94m0.2713[0m     +  19.9647
     10   [36m0.2960[0m   [32m0.7235[0m        [35m0.2354[0m       0.9105        [94m0.2712[0m     +  20.3555
     11   [36m0.2998[0m   [32m0.7276[0m        [35m0.2334[0m       0.9117        [94m0.2708[0m     +  20.2511
     12   [36m0.3067[0m   [32m0.7323[0m        [35m0.2318[0m       0.9129        [94m0.2705[0m     +  20.3692
     13   [36m0.3111[0m   [32m0.7355[0m        [35m0.2308[0m       0.9117        [94m0.2702[0m     +  20.2580
     14   [36m0.3116[0m   [32m0.7384[0m        0.2311       0.9129        [94m0.2702[0m     +  19.8588
     15   [36m0.3122[0m   [32m0.7421[0m        [35m0.2296[0m       [31m0.9141[0m        [94m0.2697[0m     +  20.0898
     16   [36m0.3248[0m   [32m0.7447[0m        [35m0.2284[0m       0.9141        [94m0.2691[0m     +  20.3091
     17   [36m0.3257[0m   [32m0.7474[0m        [35m0.2279[0m       0.9129        [94m0.2688[0m     +  20.1269
     18   0.3224   [32m0.7496[0m        [35m0.2270[0m       0.9117        [94m0.2688[0m     +  19.8166
     19   0.3223   [32m0.7507[0m        [35m0.2254[0m       0.9117        0.2688        20.3589
     20   0.3227   [32m0.7521[0m        0.2270       0.9129        [94m0.2687[0m     +  20.1950
     21   0.3220   [32m0.7530[0m        [35m0.2250[0m       0.9141        [94m0.2683[0m     +  20.3708
     22   0.3214   [32m0.7539[0m        [35m0.2237[0m       0.9129        0.2684        20.4907
     23   0.3252   [32m0.7562[0m        [35m0.2233[0m       0.9129        [94m0.2679[0m     +  20.3253
     24   0.3247   [32m0.7568[0m        0.2246       0.9129        [94m0.2676[0m     +  20.4174
     25   [36m0.3276[0m   [32m0.7573[0m        0.2243       0.9129        [94m0.2676[0m     +  20.4112
     26   [36m0.3276[0m   [32m0.7581[0m        [35m0.2223[0m       0.9129        0.2678        20.2222
     27   0.3260   [32m0.7591[0m        0.2227       0.9141        0.2681        20.1942
     28   0.3245   [32m0.7603[0m        [35m0.2220[0m       [31m0.9154[0m        0.2680        20.4742
     29   0.3265   [32m0.7612[0m        [35m0.2212[0m       0.9154        0.2676        19.9506
     30   0.3260   [32m0.7617[0m        [35m0.2206[0m       0.9141        0.2677        19.9991
     31   0.3263   [32m0.7624[0m        0.2213       0.9141        [94m0.2672[0m     +  20.3121
     32   0.3272   [32m0.7627[0m        0.2209       0.9141        0.2673        20.1949
     33   0.3274   [32m0.7638[0m        0.2213       0.9154        [94m0.2671[0m     +  20.1522
     34   [36m0.3301[0m   [32m0.7640[0m        0.2208       0.9154        [94m0.2670[0m     +  20.1338
     35   0.3294   [32m0.7644[0m        0.2209       0.9154        0.2672        20.1778
     36   [36m0.3315[0m   [32m0.7652[0m        [35m0.2190[0m       [31m0.9166[0m        [94m0.2669[0m     +  20.1326
     37   0.3293   [32m0.7661[0m        0.2201       0.9154        [94m0.2666[0m     +  20.3585
     38   0.3302   [32m0.7664[0m        [35m0.2188[0m       0.9154        [94m0.2665[0m     +  20.3881
     39   [36m0.3336[0m   0.7664        0.2195       0.9166        [94m0.2664[0m     +  20.6189
     40   0.3308   [32m0.7677[0m        0.2198       0.9141        0.2667        20.3765
     41   0.3323   0.7663        [35m0.2175[0m       0.9154        0.2668        20.2302
     42   [36m0.3342[0m   [32m0.7680[0m        [35m0.2175[0m       0.9166        0.2668        20.4531
     43   0.3312   [32m0.7702[0m        [35m0.2172[0m       0.9141        [94m0.2660[0m     +  20.5099
     44   0.3257   [32m0.7703[0m        [35m0.2166[0m       0.9166        0.2664        20.4146
     45   0.3270   [32m0.7715[0m        [35m0.2152[0m       0.9166        0.2660        20.4890
     46   0.3286   [32m0.7730[0m        0.2171       0.9154        [94m0.2657[0m     +  20.3221
     47   0.3283   [32m0.7735[0m        0.2175       0.9154        [94m0.2656[0m     +  20.2703
     48   0.3280   0.7730        0.2163       0.9141        [94m0.2651[0m     +  20.3748
     49   0.3276   [32m0.7744[0m        0.2154       0.9141        0.2653        20.2833
     50   0.3280   0.7744        0.2164       0.9129        0.2654        20.3304
