[32m[I 2023-01-09 12:35:33,071][0m Trial 125 finished with value: 0.25311433349974405 and parameters: {'lr': 3.0030040733737944e-10, 'dropout': 0.6999600025268544, 'd_model_multiplier': 4, 'num_layers': 1, 'n_heads': 32, 'dim_feedforward': 506, 'batch_size': 73, 'pos_encoding': 'fixed', 'activation': 'gelu', 'norm': 'BatchNorm', 'optimizer_name': 'PlainRAdam', 'weight_decay': 0.1}. Best is trial 122 with value: 0.40157405369010674.[0m
[EnsembleDataset] Initializing dataset...
	Examples: 27964
	Features: 621
	Max length: 316
[EnsembleDataset] Dataset initialization complete
  epoch    auprc    auroc    train_loss    valid_loss    cp      dur
-------  -------  -------  ------------  ------------  ----  -------
      1   [36m0.3165[0m   [32m0.8345[0m        [35m0.1517[0m        [31m0.0592[0m     +  29.3202
      2   0.3156   0.8344        [35m0.1365[0m        0.0594        30.0077
      3   0.3146   0.8343        0.1417        0.0594        29.5808
Stopping since valid_loss has not improved in the last 3 epochs.
[32m[I 2023-01-09 12:41:44,311][0m Trial 126 finished with value: 0.3165430757630194 and parameters: {'lr': 1.8509865746171333e-10, 'dropout': 0.6416275086259661, 'd_model_multiplier': 4, 'num_layers': 4, 'n_heads': 8, 'dim_feedforward': 476, 'batch_size': 60, 'pos_encoding': 'fixed', 'activation': 'relu', 'norm': 'BatchNorm', 'optimizer_name': 'RAdam', 'weight_decay': 0.01}. Best is trial 122 with value: 0.40157405369010674.[0m
[EnsembleDataset] Initializing dataset...
	Examples: 27964
	Features: 621
	Max length: 316
[EnsembleDataset] Dataset initialization complete
  epoch    auprc    auroc    train_loss    valid_loss    cp      dur
-------  -------  -------  ------------  ------------  ----  -------
      1   [36m0.3056[0m   [32m0.8326[0m        [35m0.1250[0m        [31m0.0500[0m     +  29.5378
      2   [36m0.3056[0m   0.8324        [35m0.1069[0m        [31m0.0499[0m     +  30.0047
      3   0.3054   0.8319        0.1133        0.0500        30.8464
      4   [36m0.3057[0m   [32m0.8330[0m        0.1147        0.0503        30.4756
Stopping since valid_loss has not improved in the last 3 epochs.
[32m[I 2023-01-09 12:49:50,288][0m Trial 127 finished with value: 0.30568855020467206 and parameters: {'lr': 2.4741001668507676e-06, 'dropout': 0.6095242976003915, 'd_model_multiplier': 32, 'num_layers': 3, 'n_heads': 4, 'dim_feedforward': 493, 'batch_size': 80, 'pos_encoding': 'fixed', 'activation': 'gelu', 'norm': 'BatchNorm', 'optimizer_name': 'PlainRAdam', 'weight_decay': 0.1}. Best is trial 122 with value: 0.40157405369010674.[0m
[EnsembleDataset] Initializing dataset...
	Examples: 27964
	Features: 621
	Max length: 316
[EnsembleDataset] Dataset initialization complete
  epoch    auprc    auroc    train_loss    valid_loss    cp      dur
-------  -------  -------  ------------  ------------  ----  -------
      1   [36m0.2947[0m   [32m0.8348[0m        [35m0.1339[0m        [31m0.0537[0m     +  29.8410
      2   [36m0.2957[0m   0.8346        0.1339        [31m0.0536[0m     +  29.1348
      3   0.2948   0.8345        [35m0.1320[0m        0.0536        30.3468
      4   0.2952   0.8344        [35m0.1239[0m        0.0536        29.7082
Stopping since valid_loss has not improved in the last 3 epochs.
[32m[I 2023-01-09 12:57:55,165][0m Trial 128 finished with value: 0.2956981050492449 and parameters: {'lr': 1.0281571298751984e-10, 'dropout': 0.629704836310485, 'd_model_multiplier': 2, 'num_layers': 2, 'n_heads': 8, 'dim_feedforward': 444, 'batch_size': 86, 'pos_encoding': 'fixed', 'activation': 'gelu', 'norm': 'BatchNorm', 'optimizer_name': 'PlainRAdam', 'weight_decay': 0.1}. Best is trial 122 with value: 0.40157405369010674.[0m
[EnsembleDataset] Initializing dataset...
	Examples: 27964
	Features: 621
	Max length: 316
[EnsembleDataset] Dataset initialization complete
  epoch    auprc    auroc    train_loss    valid_loss    cp      dur
-------  -------  -------  ------------  ------------  ----  -------
      1   [36m0.2317[0m   [32m0.6444[0m        [35m0.1101[0m        [31m0.0661[0m     +  80.2138
      2   [36m0.2321[0m   [32m0.6454[0m        0.1104        [31m0.0660[0m     +  80.1536
      3   [36m0.2345[0m   [32m0.6464[0m        [35m0.1097[0m        [31m0.0658[0m     +  80.0539
      4   [36m0.2350[0m   [32m0.6478[0m        [35m0.1083[0m        [31m0.0656[0m     +  79.8197
      5   [36m0.2361[0m   [32m0.6496[0m        0.1108        [31m0.0654[0m     +  79.9749
      6   [36m0.2368[0m   [32m0.6512[0m        0.1086        [31m0.0652[0m     +  80.3565
      7   [36m0.2375[0m   [32m0.6529[0m        0.1104        [31m0.0649[0m     +  80.0964
      8   [36m0.2380[0m   [32m0.6543[0m        [35m0.1074[0m        [31m0.0648[0m     +  79.9519
      9   [36m0.2386[0m   [32m0.6558[0m        [35m0.1073[0m        [31m0.0646[0m     +  80.0760
     10   [36m0.2401[0m   [32m0.6572[0m        0.1084        [31m0.0644[0m     +  79.9360
     11   [36m0.2403[0m   [32m0.6586[0m        0.1079        [31m0.0642[0m     +  80.2396
     12   [36m0.2412[0m   [32m0.6600[0m        0.1082        [31m0.0641[0m     +  79.8247
     13   [36m0.2418[0m   [32m0.6614[0m        [35m0.1066[0m        [31m0.0639[0m     +  80.3314
     14   [36m0.2418[0m   [32m0.6630[0m        0.1067        [31m0.0637[0m     +  80.2874
     15   [36m0.2426[0m   [32m0.6642[0m        0.1096        [31m0.0636[0m     +  80.0357
     16   0.2420   [32m0.6653[0m        0.1068        [31m0.0635[0m     +  80.0841
     17   [36m0.2432[0m   [32m0.6669[0m        0.1085        [31m0.0633[0m     +  80.1019
     18   [36m0.2435[0m   [32m0.6683[0m        0.1075        [31m0.0631[0m     +  80.0244
     19   [36m0.2445[0m   [32m0.6700[0m        0.1085        [31m0.0630[0m     +  80.2296
     20   [36m0.2448[0m   [32m0.6710[0m        0.1087        [31m0.0629[0m     +  79.9893
     21   [36m0.2455[0m   [32m0.6723[0m        [35m0.1057[0m        [31m0.0628[0m     +  80.0829
     22   [36m0.2461[0m   [32m0.6736[0m        0.1078        [31m0.0627[0m     +  80.1489
     23   [36m0.2467[0m   [32m0.6745[0m        0.1072        [31m0.0626[0m     +  80.2728
     24   [36m0.2475[0m   [32m0.6757[0m        0.1071        [31m0.0625[0m     +  79.8237
     25   0.2468   [32m0.6767[0m        0.1062        [31m0.0624[0m     +  79.9503
[32m[I 2023-01-09 14:06:52,897][0m Trial 129 finished with value: 0.2474800740211833 and parameters: {'lr': 5.790391657626686e-09, 'dropout': 0.6741263800611709, 'd_model_multiplier': 4, 'num_layers': 3, 'n_heads': 64, 'dim_feedforward': 465, 'batch_size': 67, 'pos_encoding': 'fixed', 'activation': 'relu', 'norm': 'LayerNorm', 'optimizer_name': 'RAdam', 'weight_decay': 0.1}. Best is trial 122 with value: 0.40157405369010674.[0m
[EnsembleDataset] Initializing dataset...
	Examples: 27964
	Features: 621
	Max length: 316
[EnsembleDataset] Dataset initialization complete
  epoch    auprc    auroc    train_loss    valid_loss    cp      dur
-------  -------  -------  ------------  ------------  ----  -------
      1   [36m0.2836[0m   [32m0.8216[0m        [35m0.1380[0m        [31m0.0522[0m     +  28.7422
      2   [36m0.2843[0m   [32m0.8226[0m        0.1416        0.0535        29.2651
      3   [36m0.2876[0m   [32m0.8318[0m        [35m0.1379[0m        [31m0.0514[0m     +  29.5965
      4   0.2854   [32m0.8361[0m        [35m0.1338[0m        0.0514        30.0742
      5   [36m0.2903[0m   0.8359        0.1414        [31m0.0512[0m     +  29.6854
      6   0.2877   0.8322        [35m0.1325[0m        0.0513        29.3481
      7   [36m0.2934[0m   0.8333        0.1343        0.0527        30.0421
Stopping since valid_loss has not improved in the last 3 epochs.
[32m[I 2023-01-09 14:20:36,271][0m Trial 130 finished with value: 0.2934240900289732 and parameters: {'lr': 0.00011173131935009748, 'dropout': 0.651911877355628, 'd_model_multiplier': 32, 'num_layers': 1, 'n_heads': 8, 'dim_feedforward': 488, 'batch_size': 106, 'pos_encoding': 'fixed', 'activation': 'gelu', 'norm': 'BatchNorm', 'optimizer_name': 'PlainRAdam', 'weight_decay': 0}. Best is trial 122 with value: 0.40157405369010674.[0m
[EnsembleDataset] Initializing dataset...
	Examples: 27964
	Features: 621
	Max length: 316
[EnsembleDataset] Dataset initialization complete
  epoch    auprc    auroc    train_loss    valid_loss    cp      dur
-------  -------  -------  ------------  ------------  ----  -------
      1   [36m0.3395[0m   [32m0.8470[0m        [35m0.1035[0m        [31m0.0572[0m     +  30.2247
      2   [36m0.3473[0m   0.8469        [35m0.0942[0m        0.0661        29.8494
      3   [36m0.3476[0m   [32m0.8474[0m        0.0948        0.0577        29.9086
      4   [36m0.3549[0m   [32m0.8483[0m        [35m0.0891[0m        [31m0.0539[0m     +  29.3169
      5   [36m0.3599[0m   [32m0.8491[0m        [35m0.0865[0m        [31m0.0537[0m     +  29.5880
      6   0.3419   0.8433        0.0915        0.0551        29.1474
      7   0.3509   0.8443        [35m0.0865[0m        0.0550        29.7633
      8   [36m0.3645[0m   [32m0.8526[0m        [35m0.0751[0m        [31m0.0512[0m     +  29.6930
      9   0.3476   [32m0.8532[0m        0.0782        0.0542        30.5758
     10   0.3537   0.8512        [35m0.0737[0m        0.0546        29.5477
Stopping since valid_loss has not improved in the last 3 epochs.
[32m[I 2023-01-09 14:40:02,752][0m Trial 131 finished with value: 0.36453263444141076 and parameters: {'lr': 5.0199997721884404e-05, 'dropout': 0.3940595492092534, 'd_model_multiplier': 8, 'num_layers': 2, 'n_heads': 8, 'dim_feedforward': 472, 'batch_size': 119, 'pos_encoding': 'fixed', 'activation': 'relu', 'norm': 'BatchNorm', 'optimizer_name': 'RAdam', 'weight_decay': 0.1}. Best is trial 122 with value: 0.40157405369010674.[0m
[EnsembleDataset] Initializing dataset...
	Examples: 27964
	Features: 621
	Max length: 316
[EnsembleDataset] Dataset initialization complete
  epoch    auprc    auroc    train_loss    valid_loss    cp      dur
-------  -------  -------  ------------  ------------  ----  -------
      1   [36m0.3555[0m   [32m0.8442[0m        [35m0.1435[0m        [31m0.0497[0m     +  30.0206
      2   0.3554   [32m0.8443[0m        [35m0.1341[0m        [31m0.0495[0m     +  31.1417
      3   [36m0.3556[0m   [32m0.8445[0m        [35m0.1330[0m        0.0496        30.6874
      4   [36m0.3571[0m   0.8432        [35m0.1294[0m        [31m0.0494[0m     +  30.3850
      5   [36m0.3572[0m   0.8430        [35m0.1067[0m        [31m0.0494[0m     +  30.4980
      6   [36m0.3580[0m   0.8439        0.1084        [31m0.0493[0m     +  31.2015
      7   0.3533   [32m0.8451[0m        [35m0.1020[0m        0.0494        31.1250
      8   0.3569   [32m0.8460[0m        [35m0.0995[0m        0.0493        30.8900
      9   0.3574   0.8454        [35m0.0882[0m        [31m0.0492[0m     +  30.6086
     10   [36m0.3612[0m   [32m0.8461[0m        [35m0.0812[0m        [31m0.0492[0m     +  31.1045
     11   0.3600   [32m0.8470[0m        [35m0.0777[0m        [31m0.0491[0m     +  30.6844
     12   [36m0.3625[0m   [32m0.8475[0m        0.0778        0.0492        30.2143
     13   0.3618   [32m0.8484[0m        [35m0.0748[0m        [31m0.0491[0m     +  30.6205
     14   0.3622   0.8484        [35m0.0723[0m        [31m0.0490[0m     +  30.8696
     15   [36m0.3637[0m   0.8475        [35m0.0675[0m        [31m0.0490[0m     +  30.3093
     16   [36m0.3647[0m   0.8482        [35m0.0652[0m        [31m0.0489[0m     +  29.3456
     17   [36m0.3647[0m   0.8480        [35m0.0622[0m        [31m0.0489[0m     +  30.3519
     18   [36m0.3650[0m   0.8480        [35m0.0621[0m        [31m0.0488[0m     +  31.0747
     19   [36m0.3661[0m   [32m0.8489[0m        0.0623        [31m0.0488[0m     +  30.5278
     20   0.3658   [32m0.8492[0m        0.0622        [31m0.0488[0m     +  30.5502
     21   [36m0.3665[0m   0.8488        [35m0.0573[0m        [31m0.0488[0m     +  30.4837
     22   0.3661   0.8488        [35m0.0556[0m        0.0489        30.1992
     23   [36m0.3667[0m   0.8492        [35m0.0550[0m        [31m0.0488[0m     +  30.5465
     24   0.3667   0.8492        0.0557        [31m0.0488[0m     +  30.1255
     25   0.3665   [32m0.8498[0m        [35m0.0539[0m        [31m0.0488[0m     +  30.0541
[32m[I 2023-01-09 15:27:36,132][0m Trial 132 finished with value: 0.3667067448022696 and parameters: {'lr': 5.2894786695999264e-05, 'dropout': 0.6785533092966406, 'd_model_multiplier': 4, 'num_layers': 2, 'n_heads': 8, 'dim_feedforward': 478, 'batch_size': 141, 'pos_encoding': 'fixed', 'activation': 'relu', 'norm': 'BatchNorm', 'optimizer_name': 'RAdam', 'weight_decay': 0.1}. Best is trial 122 with value: 0.40157405369010674.[0m
[EnsembleDataset] Initializing dataset...
	Examples: 27964
	Features: 621
	Max length: 316
[EnsembleDataset] Dataset initialization complete
  epoch    auprc    auroc    train_loss    valid_loss    cp      dur
-------  -------  -------  ------------  ------------  ----  -------
      1   [36m0.2865[0m   [32m0.8154[0m        [35m0.0881[0m        [31m0.0502[0m     +  28.6516
      2   [36m0.2905[0m   [32m0.8176[0m        0.0894        0.0507        29.6876
      3   0.2703   0.8152        0.0890        0.0503        29.5735
      4   0.2831   0.8166        [35m0.0838[0m        [31m0.0493[0m     +  30.4378
      5   0.2784   [32m0.8198[0m        [35m0.0810[0m        0.0496        30.1783
      6   [36m0.2937[0m   [32m0.8220[0m        [35m0.0729[0m        [31m0.0490[0m     +  30.0799
      7   0.2774   0.8192        [35m0.0721[0m        0.0496        30.2155
      8   0.2894   [32m0.8220[0m        [35m0.0682[0m        [31m0.0483[0m     +  30.1039
      9   0.2922   [32m0.8239[0m        [35m0.0676[0m        [31m0.0481[0m     +  30.2271
     10   0.2818   0.8207        [35m0.0642[0m        0.0484        30.9257
     11   0.2864   0.8210        [35m0.0615[0m        [31m0.0480[0m     +  30.1469
     12   0.2860   [32m0.8249[0m        [35m0.0603[0m        0.0484        29.5834
     13   0.2927   0.8217        [35m0.0594[0m        0.0483        30.3478
Stopping since valid_loss has not improved in the last 3 epochs.
[32m[I 2023-01-09 15:52:41,936][0m Trial 133 finished with value: 0.2937354959897957 and parameters: {'lr': 5.771011536843161e-05, 'dropout': 0.2647138840379101, 'd_model_multiplier': 4, 'num_layers': 2, 'n_heads': 8, 'dim_feedforward': 482, 'batch_size': 125, 'pos_encoding': 'fixed', 'activation': 'relu', 'norm': 'BatchNorm', 'optimizer_name': 'RAdam', 'weight_decay': 0.1}. Best is trial 122 with value: 0.40157405369010674.[0m
[EnsembleDataset] Initializing dataset...
	Examples: 27964
	Features: 621
	Max length: 316
[EnsembleDataset] Dataset initialization complete
  epoch    auprc    auroc    train_loss    valid_loss    cp      dur
-------  -------  -------  ------------  ------------  ----  -------
      1   [36m0.3137[0m   [32m0.8336[0m        [35m0.1552[0m        [31m0.0531[0m     +  43.5416
      2   0.3135   0.8336        [35m0.1409[0m        [31m0.0531[0m     +  43.8595
      3   [36m0.3141[0m   [32m0.8345[0m        [35m0.1277[0m        [31m0.0531[0m     +  44.5720
      4   [36m0.3143[0m   [32m0.8348[0m        0.1699        [31m0.0530[0m     +  43.8107
      5   0.3140   0.8344        0.1322        0.0530        44.2835
      6   0.3135   0.8334        0.1433        0.0531        44.1933
Stopping since valid_loss has not improved in the last 3 epochs.
[32m[I 2023-01-09 16:06:14,620][0m Trial 134 finished with value: 0.3142608903422909 and parameters: {'lr': 7.424270837847129e-05, 'dropout': 0.6821884925904865, 'd_model_multiplier': 4, 'num_layers': 10, 'n_heads': 8, 'dim_feedforward': 498, 'batch_size': 160, 'pos_encoding': 'fixed', 'activation': 'relu', 'norm': 'BatchNorm', 'optimizer_name': 'RAdam', 'weight_decay': 0.1}. Best is trial 122 with value: 0.40157405369010674.[0m
[EnsembleDataset] Initializing dataset...
	Examples: 27964
	Features: 621
	Max length: 316
[EnsembleDataset] Dataset initialization complete
  epoch    auprc    auroc    train_loss    valid_loss    cp      dur
-------  -------  -------  ------------  ------------  ----  -------
      1   [36m0.3159[0m   [32m0.8363[0m        [35m0.1327[0m        [31m0.0475[0m     +  30.7219
      2   0.3159   [32m0.8364[0m        [35m0.1288[0m        [31m0.0475[0m     +  30.7401
      3   [36m0.3163[0m   [32m0.8368[0m        0.1301        [31m0.0475[0m     +  31.7401
      4   0.3161   0.8367        [35m0.1193[0m        0.0475        31.1140
      5   0.3157   0.8354        0.1238        0.0476        29.9881
Stopping since valid_loss has not improved in the last 3 epochs.
[32m[I 2023-01-09 16:16:14,633][0m Trial 135 finished with value: 0.31634406124550746 and parameters: {'lr': 3.559136545977622e-05, 'dropout': 0.6876537410648429, 'd_model_multiplier': 4, 'num_layers': 2, 'n_heads': 8, 'dim_feedforward': 505, 'batch_size': 142, 'pos_encoding': 'fixed', 'activation': 'relu', 'norm': 'BatchNorm', 'optimizer_name': 'RAdam', 'weight_decay': 0.1}. Best is trial 122 with value: 0.40157405369010674.[0m
[EnsembleDataset] Initializing dataset...
	Examples: 27964
	Features: 621
	Max length: 316
[EnsembleDataset] Dataset initialization complete
Warning, assumed runtime error: CUDA out of memory. Tried to allocate 1.44 GiB (GPU 0; 23.70 GiB total capacity; 18.79 GiB already allocated; 1019.31 MiB free; 21.63 GiB reserved in total by PyTorch) If reserved memory is >> allocated memory try setting max_split_size_mb to avoid fragmentation.  See documentation for Memory Management and PYTORCH_CUDA_ALLOC_CONF
[32m[I 2023-01-09 16:16:19,162][0m Trial 136 finished with value: 0.0 and parameters: {'lr': 1.0243662028780705e-05, 'dropout': 0.661761657253348, 'd_model_multiplier': 1, 'num_layers': 11, 'n_heads': 32, 'dim_feedforward': 456, 'batch_size': 121, 'pos_encoding': 'fixed', 'activation': 'relu', 'norm': 'BatchNorm', 'optimizer_name': 'RAdam', 'weight_decay': 0.1}. Best is trial 122 with value: 0.40157405369010674.[0m
[EnsembleDataset] Initializing dataset...
	Examples: 27964
	Features: 621
	Max length: 316
[EnsembleDataset] Dataset initialization complete
  epoch    auprc    auroc    train_loss    valid_loss    cp      dur
-------  -------  -------  ------------  ------------  ----  -------
      1   [36m0.2932[0m   [32m0.8306[0m        [35m0.1760[0m        [31m0.0552[0m     +  30.0988
      2   [36m0.2962[0m   0.8289        [35m0.1308[0m        [31m0.0549[0m     +  30.5640
      3   0.2955   [32m0.8321[0m        0.1436        0.0608        31.3019
      4   [36m0.2994[0m   0.8315        0.1488        [31m0.0516[0m     +  31.2759
      5   [36m0.3030[0m   0.8310        [35m0.1119[0m        [31m0.0500[0m     +  30.3978
      6   0.3003   [32m0.8324[0m        0.1153        0.0515        29.7006
      7   [36m0.3165[0m   [32m0.8329[0m        [35m0.1082[0m        [31m0.0480[0m     +  29.9802
      8   [36m0.3167[0m   [32m0.8334[0m        [35m0.0965[0m        [31m0.0476[0m     +  29.5210
      9   [36m0.3176[0m   [32m0.8334[0m        [35m0.0897[0m        0.0476        29.9163
     10   [36m0.3179[0m   [32m0.8335[0m        [35m0.0839[0m        [31m0.0472[0m     +  30.5603
     11   [36m0.3194[0m   0.8332        [35m0.0736[0m        [31m0.0471[0m     +  30.4006
     12   0.3183   0.8327        0.0742        [31m0.0469[0m     +  30.4076
     13   0.3157   0.8329        [35m0.0704[0m        [31m0.0467[0m     +  29.8896
     14   0.3133   0.8333        [35m0.0695[0m        0.0472        29.9695
     15   0.3192   0.8334        0.0764        [31m0.0466[0m     +  31.3611
     16   [36m0.3318[0m   [32m0.8342[0m        [35m0.0636[0m        [31m0.0463[0m     +  30.0065
     17   0.3235   0.8333        [35m0.0616[0m        0.0468        31.5476
     18   [36m0.3332[0m   [32m0.8342[0m        [35m0.0592[0m        0.0464        30.9194
     19   [36m0.3341[0m   0.8339        [35m0.0589[0m        [31m0.0463[0m     +  30.4143
     20   0.3326   0.8332        0.0591        [31m0.0462[0m     +  30.8573
     21   [36m0.3361[0m   0.8334        0.0594        [31m0.0461[0m     +  29.9235
     22   [36m0.3364[0m   0.8332        [35m0.0588[0m        [31m0.0461[0m     +  29.8112
     23   0.3362   0.8333        [35m0.0573[0m        [31m0.0461[0m     +  30.2531
     24   [36m0.3382[0m   0.8335        [35m0.0556[0m        [31m0.0460[0m     +  30.3827
     25   [36m0.3388[0m   0.8331        0.0573        0.0460        30.1377
[32m[I 2023-01-09 17:03:35,314][0m Trial 137 finished with value: 0.3388111786713076 and parameters: {'lr': 9.861990004528663e-05, 'dropout': 0.6999897181269447, 'd_model_multiplier': 4, 'num_layers': 1, 'n_heads': 8, 'dim_feedforward': 300, 'batch_size': 151, 'pos_encoding': 'fixed', 'activation': 'relu', 'norm': 'BatchNorm', 'optimizer_name': 'RAdam', 'weight_decay': 0}. Best is trial 122 with value: 0.40157405369010674.[0m
[EnsembleDataset] Initializing dataset...
	Examples: 27964
	Features: 621
	Max length: 316
[EnsembleDataset] Dataset initialization complete
  epoch    auprc    auroc    train_loss    valid_loss    cp      dur
-------  -------  -------  ------------  ------------  ----  -------
      1   [36m0.3391[0m   [32m0.8325[0m        [35m0.1401[0m        [31m0.0545[0m     +  32.0000
      2   [36m0.3410[0m   0.8276        0.1893        0.0547        32.3128
      3   0.3159   0.8200        0.1981        0.0560        31.7897
Stopping since valid_loss has not improved in the last 3 epochs.
