[32m[I 2023-05-05 13:26:24,701][0m Trial 623 finished with value: 0.22689976822472252 and parameters: {'lr': 1.803708247732462e-05, 'dropout': 0.43259889882215574, 'd_model_multiplier': 4, 'num_layers': 4, 'n_heads': 64, 'dim_feedforward': 207, 'batch_size': 29, 'pos_encoding': 'fixed', 'activation': 'relu', 'norm': 'LayerNorm', 'optimizer_name': 'RAdam', 'weight_decay': 0.1, 'top_n_features': 99}. Best is trial 246 with value: 0.16447311791139763.[0m
[FileBasedDataset] Initializing dataset...
	Examples: 8264
	Features: 92
	Max length: 315
Standard scalar turned ON, loading params from cache
[FileBasedDataset] Dataset initialization complete
  epoch    auprc    auroc    train_loss    valid_acc    valid_loss    cp      dur
-------  -------  -------  ------------  -----------  ------------  ----  -------
      1   [36m0.0728[0m   [32m0.4257[0m        [35m0.5175[0m       [31m0.9250[0m        [94m0.3187[0m     +  20.5910
      2   [36m0.1432[0m   [32m0.6951[0m        [35m0.2946[0m       0.9250        [94m0.2528[0m     +  19.8269
      3   [36m0.1823[0m   [32m0.7424[0m        [35m0.2575[0m       0.9250        [94m0.2442[0m     +  20.6470
      4   [36m0.2020[0m   [32m0.7713[0m        [35m0.2458[0m       0.9178        0.2447        20.3874
      5   [36m0.2139[0m   [32m0.7776[0m        [35m0.2407[0m       0.9166        0.2472        20.3273
      6   [36m0.2194[0m   [32m0.7802[0m        [35m0.2361[0m       0.9129        0.2470        20.6511
      7   0.2190   [32m0.7831[0m        [35m0.2359[0m       0.9117        0.2478        20.6032
      8   0.2189   [32m0.7854[0m        [35m0.2338[0m       0.9129        0.2477        20.4114
      9   [36m0.2213[0m   [32m0.7863[0m        0.2343       0.9129        0.2480        20.3957
     10   0.2213   [32m0.7887[0m        [35m0.2313[0m       0.9129        0.2483        20.6949
     11   0.2178   0.7885        [35m0.2296[0m       0.9057        0.2541        20.3070
     12   0.2197   0.7877        [35m0.2292[0m       0.9081        0.2523        20.4425
Stopping since valid_loss has not improved in the last 10 epochs.
[32m[I 2023-05-05 13:30:50,923][0m Trial 624 finished with value: 0.24422834633411492 and parameters: {'lr': 6.041012384242411e-05, 'dropout': 0.5026120359567511, 'd_model_multiplier': 4, 'num_layers': 4, 'n_heads': 32, 'dim_feedforward': 416, 'batch_size': 68, 'pos_encoding': 'fixed', 'activation': 'relu', 'norm': 'LayerNorm', 'optimizer_name': 'RAdam', 'weight_decay': 0.1, 'top_n_features': 92}. Best is trial 246 with value: 0.16447311791139763.[0m
[FileBasedDataset] Initializing dataset...
	Examples: 8264
	Features: 211
	Max length: 315
Standard scalar turned ON, loading params from cache
[FileBasedDataset] Dataset initialization complete
  epoch    auprc    auroc    train_loss    valid_acc    valid_loss    cp      dur
-------  -------  -------  ------------  -----------  ------------  ----  -------
      1   [36m0.1959[0m   [32m0.6319[0m        [35m0.3883[0m       [31m0.9021[0m        [94m0.3171[0m     +  24.3500
      2   [36m0.2517[0m   [32m0.7146[0m        [35m0.2466[0m       0.9021        [94m0.3138[0m     +  24.2977
      3   [36m0.2881[0m   [32m0.7371[0m        [35m0.2423[0m       0.9021        0.3210        24.3371
      4   [36m0.3080[0m   [32m0.7519[0m        [35m0.2373[0m       0.9021        0.3300        24.2996
      5   [36m0.3210[0m   [32m0.7595[0m        [35m0.2356[0m       0.9021        0.3206        24.4221
      6   [36m0.3440[0m   [32m0.7665[0m        [35m0.2341[0m       [31m0.9033[0m        [94m0.3084[0m     +  24.5123
      7   0.3429   [32m0.7676[0m        [35m0.2329[0m       0.9033        0.3195        24.5147
      8   [36m0.3491[0m   0.7674        [35m0.2279[0m       0.9021        0.3267        24.2564
      9   [36m0.3559[0m   [32m0.7680[0m        0.2297       0.9033        0.3158        24.4478
     10   [36m0.3840[0m   [32m0.7742[0m        [35m0.2261[0m       0.9021        0.3107        24.4849
     11   0.3771   0.7729        [35m0.2259[0m       0.9021        0.3174        24.3458
     12   0.3775   0.7671        [35m0.2219[0m       0.9033        0.3213        24.2377
     13   0.3747   0.7721        0.2245       0.9008        0.3171        24.6100
     14   [36m0.3919[0m   0.7684        0.2230       0.9021        0.3106        24.3777
     15   0.3731   0.7685        [35m0.2197[0m       0.9021        0.3257        24.6049
Stopping since valid_loss has not improved in the last 10 epochs.
[32m[I 2023-05-05 13:37:21,920][0m Trial 625 finished with value: 0.3084299602200071 and parameters: {'lr': 0.0003091120029892647, 'dropout': 0.45960444298359426, 'd_model_multiplier': 4, 'num_layers': 5, 'n_heads': 32, 'dim_feedforward': 212, 'batch_size': 98, 'pos_encoding': 'fixed', 'activation': 'relu', 'norm': 'LayerNorm', 'optimizer_name': 'PlainRAdam', 'weight_decay': 0.1, 'top_n_features': 211}. Best is trial 246 with value: 0.16447311791139763.[0m
[FileBasedDataset] Initializing dataset...
	Examples: 8264
	Features: 51
	Max length: 315
Standard scalar turned ON, loading params from cache
[FileBasedDataset] Dataset initialization complete
  epoch    auprc    auroc    train_loss    valid_acc    valid_loss    cp      dur
-------  -------  -------  ------------  -----------  ------------  ----  -------
      1   [36m0.0539[0m   [32m0.3440[0m        [35m0.5515[0m       [31m0.9287[0m        [94m0.3492[0m     +  19.6260
      2   [36m0.1663[0m   [32m0.6640[0m        [35m0.3192[0m       0.9287        [94m0.2485[0m     +  19.6225
      3   [36m0.2524[0m   [32m0.7437[0m        [35m0.2659[0m       0.9287        [94m0.2277[0m     +  19.6976
      4   [36m0.3161[0m   [32m0.7728[0m        [35m0.2516[0m       0.9287        [94m0.2190[0m     +  19.7715
      5   [36m0.3273[0m   [32m0.7892[0m        [35m0.2448[0m       [31m0.9311[0m        [94m0.2139[0m     +  19.7104
      6   0.3259   [32m0.7997[0m        [35m0.2386[0m       0.9299        [94m0.2128[0m     +  19.7142
      7   0.3249   [32m0.8038[0m        [35m0.2371[0m       0.9287        0.2130        19.6505
      8   0.3216   [32m0.8057[0m        [35m0.2360[0m       0.9274        0.2138        19.8989
      9   0.3183   [32m0.8070[0m        [35m0.2341[0m       0.9250        0.2136        19.7410
     10   0.3214   [32m0.8089[0m        0.2342       0.9274        0.2135        19.6760
     11   0.3205   [32m0.8101[0m        [35m0.2328[0m       0.9274        0.2136        19.7051
     12   0.3171   [32m0.8108[0m        [35m0.2328[0m       0.9262        0.2138        19.9681
     13   0.3142   [32m0.8111[0m        [35m0.2326[0m       0.9262        0.2139        19.8357
     14   0.3160   [32m0.8124[0m        [35m0.2308[0m       0.9262        0.2134        19.9138
     15   0.3149   [32m0.8130[0m        [35m0.2308[0m       0.9262        0.2131        20.1603
Stopping since valid_loss has not improved in the last 10 epochs.
[32m[I 2023-05-05 13:42:39,245][0m Trial 626 finished with value: 0.212809831908529 and parameters: {'lr': 1.0302516067004354e-05, 'dropout': 0.42528128066743276, 'd_model_multiplier': 4, 'num_layers': 4, 'n_heads': 32, 'dim_feedforward': 194, 'batch_size': 23, 'pos_encoding': 'learnable', 'activation': 'relu', 'norm': 'LayerNorm', 'optimizer_name': 'RAdam', 'weight_decay': 0.1, 'top_n_features': 51}. Best is trial 246 with value: 0.16447311791139763.[0m
[FileBasedDataset] Initializing dataset...
	Examples: 8264
	Features: 91
	Max length: 315
Standard scalar turned ON, loading params from cache
[FileBasedDataset] Dataset initialization complete
  epoch    auprc    auroc    train_loss    valid_acc    valid_loss    cp      dur
-------  -------  -------  ------------  -----------  ------------  ----  -------
      1   [36m0.0698[0m   [32m0.3901[0m        [35m0.6358[0m       [31m0.9287[0m        [94m0.5828[0m     +  33.4706
      2   [36m0.0826[0m   [32m0.4766[0m        [35m0.4542[0m       0.9287        [94m0.4056[0m     +  33.5053
      3   [36m0.1251[0m   [32m0.6377[0m        [35m0.3287[0m       0.9287        [94m0.3007[0m     +  33.4361
      4   [36m0.1634[0m   [32m0.7017[0m        [35m0.2889[0m       0.9287        [94m0.2729[0m     +  33.7096
      5   [36m0.1774[0m   [32m0.7223[0m        [35m0.2797[0m       0.9287        [94m0.2518[0m     +  33.6565
      6   [36m0.1948[0m   [32m0.7396[0m        [35m0.2719[0m       0.9287        [94m0.2422[0m     +  33.4191
      7   [36m0.2035[0m   [32m0.7479[0m        [35m0.2706[0m       0.9287        [94m0.2394[0m     +  33.7272
      8   [36m0.2183[0m   [32m0.7546[0m        [35m0.2661[0m       0.9287        [94m0.2345[0m     +  33.2852
      9   [36m0.2383[0m   [32m0.7592[0m        [35m0.2641[0m       0.9287        [94m0.2267[0m     +  33.5024
     10   [36m0.2475[0m   0.7592        [35m0.2594[0m       [31m0.9299[0m        0.2267        33.4425
     11   0.2346   [32m0.7600[0m        [35m0.2574[0m       0.9299        0.2270        33.2565
     12   [36m0.2545[0m   [32m0.7686[0m        0.2575       0.9299        [94m0.2237[0m     +  33.1985
     13   0.2443   0.7673        [35m0.2504[0m       0.9287        0.2249        33.2819
     14   [36m0.2598[0m   [32m0.7730[0m        0.2522       0.9299        [94m0.2227[0m     +  33.2329
     15   [36m0.2667[0m   [32m0.7766[0m        0.2535       0.9287        [94m0.2214[0m     +  33.1388
     16   0.2645   0.7752        [35m0.2489[0m       [31m0.9311[0m        0.2225        33.3939
     17   [36m0.2858[0m   [32m0.7821[0m        0.2501       0.9299        [94m0.2191[0m     +  32.9977
     18   0.2822   [32m0.7852[0m        [35m0.2467[0m       0.9287        [94m0.2188[0m     +  33.2148
     19   0.2802   0.7814        0.2469       0.9299        [94m0.2185[0m     +  33.5327
     20   [36m0.3007[0m   [32m0.7899[0m        0.2467       0.9287        [94m0.2169[0m     +  33.4336
     21   0.2815   0.7878        [35m0.2423[0m       0.9299        0.2178        33.4816
     22   0.2920   [32m0.7926[0m        [35m0.2393[0m       0.9287        [94m0.2162[0m     +  33.4768
     23   0.2896   [32m0.7948[0m        [35m0.2389[0m       0.9287        0.2168        33.5595
     24   0.2927   0.7940        0.2404       0.9287        0.2171        33.3396
     25   0.2859   [32m0.7959[0m        0.2432       0.9274        0.2170        33.4141
     26   0.2773   0.7950        [35m0.2379[0m       0.9274        0.2163        33.4460
     27   0.2727   0.7935        [35m0.2350[0m       0.9274        0.2176        33.3067
     28   0.2875   [32m0.8030[0m        [35m0.2349[0m       0.9262        [94m0.2149[0m     +  33.2967
     29   0.2809   0.7974        [35m0.2344[0m       0.9274        0.2165        33.3753
     30   0.2725   0.7983        0.2357       0.9250        0.2163        33.1763
     31   0.2771   0.7974        [35m0.2335[0m       0.9250        0.2162        33.0914
     32   0.2767   0.8015        [35m0.2315[0m       0.9274        0.2155        33.5217
     33   0.2718   [32m0.8047[0m        0.2319       0.9238        0.2154        33.3437
     34   0.2797   [32m0.8087[0m        0.2335       0.9262        [94m0.2144[0m     +  33.5671
     35   0.2606   0.7983        [35m0.2313[0m       0.9238        0.2190        33.3443
     36   0.2666   0.8006        [35m0.2286[0m       0.9250        0.2169        33.3026
     37   0.2568   0.7982        [35m0.2278[0m       0.9238        0.2190        33.1827
     38   0.2511   0.7946        [35m0.2243[0m       0.9250        0.2203        33.1897
     39   0.2486   0.7912        0.2284       0.9226        0.2220        33.3603
     40   0.2532   0.7936        0.2303       0.9250        0.2209        33.1120
     41   0.2400   0.7922        0.2261       0.9238        0.2230        33.4182
     42   0.2324   0.7866        [35m0.2238[0m       0.9226        0.2255        32.9839
     43   0.2457   0.7873        [35m0.2223[0m       0.9238        0.2234        33.3667
Stopping since valid_loss has not improved in the last 10 epochs.
[32m[I 2023-05-05 14:07:09,256][0m Trial 627 finished with value: 0.21435253561768308 and parameters: {'lr': 0.00010576372980923381, 'dropout': 0.44998637697121197, 'd_model_multiplier': 1, 'num_layers': 10, 'n_heads': 32, 'dim_feedforward': 279, 'batch_size': 62, 'pos_encoding': 'fixed', 'activation': 'gelu', 'norm': 'BatchNorm', 'optimizer_name': 'RAdam', 'weight_decay': 0.1, 'top_n_features': 91}. Best is trial 246 with value: 0.16447311791139763.[0m
[FileBasedDataset] Initializing dataset...
	Examples: 8264
	Features: 109
	Max length: 315
Standard scalar turned ON, loading params from cache
[FileBasedDataset] Dataset initialization complete
  epoch    auprc    auroc    train_loss    valid_acc    valid_loss    cp     dur
-------  -------  -------  ------------  -----------  ------------  ----  ------
      1   [36m0.3315[0m   [32m0.7572[0m        [35m0.2730[0m       [31m0.8924[0m        [94m0.3026[0m     +  9.4664
      2   [36m0.3347[0m   [32m0.7652[0m        [35m0.2497[0m       [31m0.9081[0m        [94m0.2804[0m     +  9.8418
      3   [36m0.3350[0m   [32m0.7659[0m        [35m0.2446[0m       0.9033        [94m0.2738[0m     +  9.8618
      4   0.3148   0.7607        [35m0.2377[0m       0.9081        0.2784        9.9097
      5   0.3307   [32m0.7705[0m        [35m0.2344[0m       [31m0.9105[0m        0.2738        9.8347
      6   0.3177   0.7633        0.2350       0.9045        0.2873        10.0844
      7   [36m0.3538[0m   [32m0.7761[0m        [35m0.2303[0m       0.9105        0.2757        9.8879
      8   [36m0.3556[0m   [32m0.7907[0m        [35m0.2274[0m       0.8984        0.2859        9.8221
      9   0.3487   0.7731        [35m0.2263[0m       [31m0.9117[0m        [94m0.2733[0m     +  9.9891
     10   0.3138   0.7656        0.2300       0.9021        0.2915        10.1558
     11   0.3257   0.7720        0.2285       0.9069        0.2799        9.9177
     12   [36m0.3635[0m   [32m0.7918[0m        [35m0.2262[0m       0.9057        0.2862        9.8983
     13   0.2764   0.7441        0.2342       0.9008        0.3004        10.0589
     14   0.2903   0.7633        0.2299       0.9008        0.2915        9.9340
     15   0.2592   0.7398        0.2264       0.9021        0.2952        10.0314
     16   0.3062   0.7511        0.2263       0.9033        0.2903        10.1876
     17   0.2718   0.7433        0.2285       0.8984        0.3002        10.0752
     18   0.2707   0.7344        0.2292       0.8984        0.3047        9.8788
Stopping since valid_loss has not improved in the last 10 epochs.
[32m[I 2023-05-05 14:10:18,477][0m Trial 628 finished with value: 0.2732597738053951 and parameters: {'lr': 0.00239614983226298, 'dropout': 0.25876562335352865, 'd_model_multiplier': 4, 'num_layers': 1, 'n_heads': 32, 'dim_feedforward': 393, 'batch_size': 72, 'pos_encoding': 'fixed', 'activation': 'relu', 'norm': 'LayerNorm', 'optimizer_name': 'RAdam', 'weight_decay': 0.1, 'top_n_features': 109}. Best is trial 246 with value: 0.16447311791139763.[0m
[FileBasedDataset] Initializing dataset...
	Examples: 8264
	Features: 197
	Max length: 315
Standard scalar turned ON, loading params from cache
[FileBasedDataset] Dataset initialization complete
  epoch    auprc    auroc    train_loss    valid_acc    valid_loss    cp     dur
-------  -------  -------  ------------  -----------  ------------  ----  ------
      1   [36m0.0576[0m   [32m0.3773[0m        [35m0.4595[0m       [31m0.9238[0m        [94m0.3259[0m     +  8.4487
      2   [36m0.2474[0m   [32m0.7038[0m        [35m0.2988[0m       0.9238        [94m0.2507[0m     +  9.5265
      3   [36m0.2686[0m   [32m0.7355[0m        [35m0.2661[0m       0.9238        [94m0.2388[0m     +  9.2770
      4   0.2593   [32m0.7531[0m        [35m0.2586[0m       0.9238        [94m0.2365[0m     +  9.6192
      5   0.2436   [32m0.7534[0m        [35m0.2562[0m       0.9238        0.2367        9.5025
      6   0.2606   [32m0.7544[0m        [35m0.2550[0m       0.9238        [94m0.2347[0m     +  9.5415
      7   0.2410   0.7490        [35m0.2549[0m       0.9238        0.2353        9.6211
      8   0.2333   0.7461        [35m0.2532[0m       0.9238        0.2358        9.6257
      9   0.2391   0.7472        0.2534       0.9238        0.2364        9.6436
     10   0.2290   0.7501        0.2533       0.9238        0.2417        9.6250
     11   [36m0.2902[0m   [32m0.7762[0m        [35m0.2471[0m       0.9238        0.2354        9.9129
     12   0.2784   0.7726        [35m0.2380[0m       0.9238        0.2370        9.7061
     13   0.2744   0.7705        0.2385       0.9238        0.2365        9.7650
     14   0.2736   0.7759        [35m0.2331[0m       0.9214        [94m0.2343[0m     +  9.4944
     15   0.2830   0.7733        [35m0.2316[0m       0.9238        0.2404        9.6916
     16   0.2838   0.7736        [35m0.2273[0m       0.9226        0.2399        9.8101
     17   0.2747   [32m0.7777[0m        0.2281       0.9226        0.2440        9.8833
     18   0.2691   0.7620        [35m0.2248[0m       [31m0.9274[0m        0.2483        9.8083
     19   0.2855   [32m0.7788[0m        0.2268       0.9274        0.2474        9.8986
     20   0.2705   0.7695        [35m0.2218[0m       0.9262        0.2446        10.0539
     21   0.2833   0.7705        0.2222       0.9262        0.2524        9.9020
     22   0.2664   0.7589        [35m0.2186[0m       0.9250        0.2516        9.7578
     23   [36m0.2987[0m   0.7730        0.2207       [31m0.9287[0m        0.2548        9.8500
Stopping since valid_loss has not improved in the last 10 epochs.
[32m[I 2023-05-05 14:14:10,886][0m Trial 629 finished with value: 0.23425529208011753 and parameters: {'lr': 0.0012300334682868745, 'dropout': 0.3613087133330714, 'd_model_multiplier': 2, 'num_layers': 3, 'n_heads': 4, 'dim_feedforward': 332, 'batch_size': 82, 'pos_encoding': 'fixed', 'activation': 'relu', 'norm': 'LayerNorm', 'optimizer_name': 'PlainRAdam', 'weight_decay': 0, 'top_n_features': 197}. Best is trial 246 with value: 0.16447311791139763.[0m
[FileBasedDataset] Initializing dataset...
	Examples: 8264
	Features: 134
	Max length: 315
Standard scalar turned ON, loading params from cache
[FileBasedDataset] Dataset initialization complete
Warning, assumed runtime error: CUDA out of memory. Tried to allocate 3.24 GiB (GPU 0; 23.70 GiB total capacity; 11.27 GiB already allocated; 2.29 GiB free; 20.31 GiB reserved in total by PyTorch) If reserved memory is >> allocated memory try setting max_split_size_mb to avoid fragmentation.  See documentation for Memory Management and PYTORCH_CUDA_ALLOC_CONF
