[32m[I 2023-01-08 10:03:15,365][0m Trial 15 finished with value: 0.32081171073831666 and parameters: {'lr': 6.542411993122489e-09, 'dropout': 0.527127825841834, 'd_model_multiplier': 1, 'num_layers': 8, 'n_heads': 4, 'dim_feedforward': 233, 'batch_size': 256, 'pos_encoding': 'learnable', 'activation': 'gelu', 'norm': 'LayerNorm', 'optimizer_name': 'RAdam', 'weight_decay': 0.01}. Best is trial 12 with value: 0.3218802073112433.[0m
[EnsembleDataset] Initializing dataset...
	Examples: 27964
	Features: 621
	Max length: 316
[EnsembleDataset] Dataset initialization complete
  epoch    auprc    auroc    train_loss    valid_loss    cp      dur
-------  -------  -------  ------------  ------------  ----  -------
      1   [36m0.2951[0m   [32m0.7629[0m        [35m0.0801[0m        [31m0.0586[0m     +  97.3915
      2   [36m0.2952[0m   [32m0.7630[0m        [35m0.0800[0m        [31m0.0585[0m     +  95.6287
      3   0.2950   [32m0.7630[0m        [35m0.0788[0m        [31m0.0583[0m     +  97.4981
      4   0.2949   [32m0.7631[0m        [35m0.0785[0m        [31m0.0582[0m     +  99.9653
      5   0.2949   0.7631        0.0797        [31m0.0581[0m     +  101.7288
      6   0.2947   [32m0.7631[0m        0.0796        [31m0.0580[0m     +  97.2915
      7   0.2947   [32m0.7632[0m        [35m0.0781[0m        [31m0.0579[0m     +  99.8929
      8   0.2948   0.7632        0.0789        [31m0.0577[0m     +  101.2078
      9   0.2948   0.7631        0.0783        [31m0.0576[0m     +  101.0043
     10   0.2949   0.7631        0.0782        [31m0.0575[0m     +  99.3748
     11   0.2949   0.7631        0.0782        [31m0.0574[0m     +  101.1212
     12   [36m0.2952[0m   0.7632        [35m0.0777[0m        [31m0.0573[0m     +  98.5842
     13   [36m0.2953[0m   [32m0.7632[0m        0.0782        [31m0.0572[0m     +  98.7061
     14   [36m0.2955[0m   [32m0.7633[0m        [35m0.0773[0m        [31m0.0571[0m     +  96.0439
     15   0.2950   [32m0.7634[0m        0.0790        [31m0.0570[0m     +  99.8341
     16   0.2950   [32m0.7635[0m        0.0779        [31m0.0569[0m     +  98.0288
     17   0.2949   0.7635        0.0779        [31m0.0568[0m     +  98.8949
     18   0.2948   [32m0.7635[0m        0.0781        [31m0.0567[0m     +  98.4790
     19   0.2950   0.7635        0.0781        [31m0.0567[0m     +  98.4793
     20   0.2949   [32m0.7636[0m        0.0778        [31m0.0566[0m     +  97.9236
     21   0.2949   [32m0.7636[0m        0.0781        [31m0.0565[0m     +  98.2143
     22   0.2950   [32m0.7637[0m        [35m0.0771[0m        [31m0.0564[0m     +  100.3022
     23   0.2948   [32m0.7638[0m        [35m0.0770[0m        [31m0.0563[0m     +  100.9759
     24   0.2948   [32m0.7638[0m        0.0777        [31m0.0563[0m     +  100.8322
     25   0.2948   [32m0.7638[0m        0.0773        [31m0.0562[0m     +  101.0628
[32m[I 2023-01-08 11:23:57,109][0m Trial 16 finished with value: 0.29545217845052585 and parameters: {'lr': 6.9059043212101865e-09, 'dropout': 0.49772451357804876, 'd_model_multiplier': 1, 'num_layers': 12, 'n_heads': 16, 'dim_feedforward': 156, 'batch_size': 10, 'pos_encoding': 'learnable', 'activation': 'gelu', 'norm': 'LayerNorm', 'optimizer_name': 'RAdam', 'weight_decay': 0.01}. Best is trial 12 with value: 0.3218802073112433.[0m
[EnsembleDataset] Initializing dataset...
	Examples: 27964
	Features: 621
	Max length: 316
[EnsembleDataset] Dataset initialization complete
  epoch    auprc    auroc    train_loss    valid_loss    cp      dur
-------  -------  -------  ------------  ------------  ----  -------
      1   [36m0.2031[0m   [32m0.6750[0m        [35m0.0773[0m        [31m0.0740[0m     +  27.6592
      2   [36m0.2035[0m   [32m0.6753[0m        [35m0.0770[0m        [31m0.0739[0m     +  29.1863
      3   [36m0.2037[0m   [32m0.6757[0m        [35m0.0770[0m        [31m0.0737[0m     +  29.1006
      4   [36m0.2041[0m   [32m0.6761[0m        [35m0.0768[0m        [31m0.0735[0m     +  28.9722
      5   [36m0.2044[0m   [32m0.6766[0m        0.0773        [31m0.0733[0m     +  28.8753
      6   [36m0.2047[0m   [32m0.6770[0m        [35m0.0767[0m        [31m0.0731[0m     +  28.6251
      7   [36m0.2052[0m   [32m0.6775[0m        [35m0.0763[0m        [31m0.0729[0m     +  28.4697
      8   [36m0.2053[0m   [32m0.6779[0m        0.0769        [31m0.0727[0m     +  29.2115
      9   [36m0.2056[0m   [32m0.6783[0m        [35m0.0759[0m        [31m0.0724[0m     +  28.5121
     10   [36m0.2060[0m   [32m0.6788[0m        [35m0.0756[0m        [31m0.0722[0m     +  28.9552
     11   0.2057   [32m0.6793[0m        0.0760        [31m0.0720[0m     +  28.1416
     12   0.2060   [32m0.6797[0m        0.0759        [31m0.0718[0m     +  28.9308
     13   [36m0.2062[0m   [32m0.6802[0m        0.0762        [31m0.0716[0m     +  28.5010
     14   [36m0.2068[0m   [32m0.6806[0m        [35m0.0750[0m        [31m0.0714[0m     +  28.7589
     15   [36m0.2071[0m   [32m0.6811[0m        0.0752        [31m0.0712[0m     +  28.6458
     16   [36m0.2076[0m   [32m0.6815[0m        0.0752        [31m0.0710[0m     +  29.8745
     17   [36m0.2078[0m   [32m0.6820[0m        [35m0.0748[0m        [31m0.0708[0m     +  29.4161
     18   [36m0.2083[0m   [32m0.6826[0m        0.0755        [31m0.0706[0m     +  28.5068
     19   [36m0.2085[0m   [32m0.6831[0m        0.0752        [31m0.0704[0m     +  28.7009
     20   [36m0.2087[0m   [32m0.6835[0m        0.0749        [31m0.0702[0m     +  28.7121
     21   [36m0.2090[0m   [32m0.6840[0m        0.0748        [31m0.0699[0m     +  28.8365
     22   [36m0.2095[0m   [32m0.6844[0m        [35m0.0743[0m        [31m0.0697[0m     +  28.7874
     23   [36m0.2100[0m   [32m0.6849[0m        [35m0.0738[0m        [31m0.0696[0m     +  28.7732
     24   [36m0.2103[0m   [32m0.6854[0m        [35m0.0736[0m        [31m0.0694[0m     +  29.0216
     25   [36m0.2106[0m   [32m0.6858[0m        0.0741        [31m0.0692[0m     +  28.9847
[32m[I 2023-01-08 12:15:16,103][0m Trial 17 finished with value: 0.2105903708960766 and parameters: {'lr': 3.986255261318819e-08, 'dropout': 0.23949789945574623, 'd_model_multiplier': 1, 'num_layers': 6, 'n_heads': 4, 'dim_feedforward': 197, 'batch_size': 45, 'pos_encoding': 'learnable', 'activation': 'gelu', 'norm': 'LayerNorm', 'optimizer_name': 'RAdam', 'weight_decay': 0.001}. Best is trial 12 with value: 0.3218802073112433.[0m
[EnsembleDataset] Initializing dataset...
	Examples: 27964
	Features: 621
	Max length: 316
[EnsembleDataset] Dataset initialization complete
  epoch    auprc    auroc    train_loss    valid_loss    cp      dur
-------  -------  -------  ------------  ------------  ----  -------
      1   [36m0.2581[0m   [32m0.7567[0m        [35m0.0775[0m        [31m0.0575[0m     +  28.6491
      2   0.2581   [32m0.7567[0m        0.0794        [31m0.0575[0m     +  29.0691
      3   0.2581   0.7567        0.0779        0.0575        28.5008
Stopping since valid_loss has not improved in the last 3 epochs.
[32m[I 2023-01-08 12:21:50,040][0m Trial 18 finished with value: 0.2580842843163583 and parameters: {'lr': 1.4425209558706352e-10, 'dropout': 0.4313301775614255, 'd_model_multiplier': 1, 'num_layers': 1, 'n_heads': 16, 'dim_feedforward': 275, 'batch_size': 100, 'pos_encoding': 'learnable', 'activation': 'relu', 'norm': 'LayerNorm', 'optimizer_name': 'RAdam', 'weight_decay': 0.01}. Best is trial 12 with value: 0.3218802073112433.[0m
[EnsembleDataset] Initializing dataset...
	Examples: 27964
	Features: 621
	Max length: 316
[EnsembleDataset] Dataset initialization complete
  epoch    auprc    auroc    train_loss    valid_loss    cp      dur
-------  -------  -------  ------------  ------------  ----  -------
      1   [36m0.2693[0m   [32m0.8014[0m        [35m0.0780[0m        [31m0.0604[0m     +  48.2481
      2   0.2511   0.7889        [35m0.0636[0m        [31m0.0600[0m     +  47.9031
      3   0.2596   [32m0.8230[0m        [35m0.0580[0m        [31m0.0592[0m     +  48.3121
      4   [36m0.2738[0m   [32m0.8273[0m        [35m0.0555[0m        [31m0.0574[0m     +  48.4778
      5   [36m0.2748[0m   [32m0.8284[0m        [35m0.0542[0m        [31m0.0564[0m     +  48.2717
      6   [36m0.2767[0m   0.8267        [35m0.0538[0m        0.0571        49.0039
      7   0.2726   0.8262        [35m0.0532[0m        0.0574        48.9781
Stopping since valid_loss has not improved in the last 3 epochs.
[32m[I 2023-01-08 12:39:15,239][0m Trial 19 finished with value: 0.27668578819236267 and parameters: {'lr': 0.00028467505341420353, 'dropout': 0.5504875177394223, 'd_model_multiplier': 64, 'num_layers': 10, 'n_heads': 4, 'dim_feedforward': 379, 'batch_size': 221, 'pos_encoding': 'learnable', 'activation': 'gelu', 'norm': 'LayerNorm', 'optimizer_name': 'RAdam', 'weight_decay': 0.001}. Best is trial 12 with value: 0.3218802073112433.[0m
[EnsembleDataset] Initializing dataset...
	Examples: 27964
	Features: 621
	Max length: 316
[EnsembleDataset] Dataset initialization complete
Warning, assumed runtime error: CUDA out of memory. Tried to allocate 2.07 GiB (GPU 0; 23.70 GiB total capacity; 21.49 GiB already allocated; 343.31 MiB free; 22.29 GiB reserved in total by PyTorch) If reserved memory is >> allocated memory try setting max_split_size_mb to avoid fragmentation.  See documentation for Memory Management and PYTORCH_CUDA_ALLOC_CONF
[32m[I 2023-01-08 12:39:20,529][0m Trial 20 finished with value: 0.0 and parameters: {'lr': 1.2427711071664165e-07, 'dropout': 0.2762299846803433, 'd_model_multiplier': 1, 'num_layers': 12, 'n_heads': 32, 'dim_feedforward': 137, 'batch_size': 174, 'pos_encoding': 'learnable', 'activation': 'gelu', 'norm': 'LayerNorm', 'optimizer_name': 'RAdam', 'weight_decay': 0.001}. Best is trial 12 with value: 0.3218802073112433.[0m
[EnsembleDataset] Initializing dataset...
	Examples: 27964
	Features: 621
	Max length: 316
[EnsembleDataset] Dataset initialization complete
  epoch    auprc    auroc    train_loss    valid_loss    cp      dur
-------  -------  -------  ------------  ------------  ----  -------
      1   [36m0.3326[0m   [32m0.8144[0m        [35m0.1179[0m        [31m0.0553[0m     +  30.7294
      2   [36m0.3326[0m   [32m0.8146[0m        0.1497        [31m0.0553[0m     +  31.3862
      3   0.3326   0.8144        0.1616        0.0553        31.3172
      4   0.3326   0.8146        0.1251        0.0553        31.0754
      5   [36m0.3327[0m   [32m0.8148[0m        0.1398        [31m0.0552[0m     +  30.7349
      6   0.3326   0.8146        0.1421        0.0553        31.0793
      7   0.3325   0.8145        0.1374        0.0553        31.0097
Stopping since valid_loss has not improved in the last 3 epochs.
[32m[I 2023-01-08 12:54:22,064][0m Trial 21 finished with value: 0.33272641858731333 and parameters: {'lr': 2.2702270213653314e-09, 'dropout': 0.6459764128794125, 'd_model_multiplier': 1, 'num_layers': 7, 'n_heads': 4, 'dim_feedforward': 247, 'batch_size': 256, 'pos_encoding': 'learnable', 'activation': 'gelu', 'norm': 'BatchNorm', 'optimizer_name': 'AdamW', 'weight_decay': 0.01}. Best is trial 21 with value: 0.33272641858731333.[0m
[EnsembleDataset] Initializing dataset...
	Examples: 27964
	Features: 621
	Max length: 316
[EnsembleDataset] Dataset initialization complete
  epoch    auprc    auroc    train_loss    valid_loss    cp      dur
-------  -------  -------  ------------  ------------  ----  -------
      1   [36m0.3028[0m   [32m0.8308[0m        [35m0.1177[0m        [31m0.0499[0m     +  30.8661
      2   0.3026   0.8289        0.1224        0.0501        31.5843
      3   [36m0.3031[0m   0.8290        0.1303        0.0501        31.3193
Stopping since valid_loss has not improved in the last 3 epochs.
[32m[I 2023-01-08 13:01:31,912][0m Trial 22 finished with value: 0.3030667078690889 and parameters: {'lr': 3.768423212229989e-09, 'dropout': 0.5554401954310291, 'd_model_multiplier': 1, 'num_layers': 7, 'n_heads': 4, 'dim_feedforward': 200, 'batch_size': 254, 'pos_encoding': 'learnable', 'activation': 'gelu', 'norm': 'BatchNorm', 'optimizer_name': 'AdamW', 'weight_decay': 0.01}. Best is trial 21 with value: 0.33272641858731333.[0m
[EnsembleDataset] Initializing dataset...
	Examples: 27964
	Features: 621
	Max length: 316
[EnsembleDataset] Dataset initialization complete
  epoch    auprc    auroc    train_loss    valid_loss    cp      dur
-------  -------  -------  ------------  ------------  ----  -------
      1   [36m0.2412[0m   [32m0.7646[0m        [35m0.0882[0m        [31m0.0795[0m     +  30.4497
      2   [36m0.2412[0m   [32m0.7646[0m        [35m0.0881[0m        [31m0.0795[0m     +  30.5424
      3   [36m0.2412[0m   [32m0.7646[0m        0.0887        [31m0.0795[0m     +  31.5780
      4   0.2412   0.7646        0.0896        [31m0.0795[0m     +  31.0065
      5   0.2412   [32m0.7646[0m        0.0881        [31m0.0795[0m     +  31.0168
      6   0.2412   [32m0.7646[0m        [35m0.0877[0m        [31m0.0794[0m     +  31.2456
      7   0.2412   [32m0.7646[0m        0.0878        [31m0.0794[0m     +  30.6656
      8   0.2412   [32m0.7647[0m        [35m0.0875[0m        [31m0.0794[0m     +  31.2775
      9   [36m0.2413[0m   [32m0.7647[0m        0.0881        [31m0.0793[0m     +  31.0346
     10   [36m0.2413[0m   [32m0.7647[0m        0.0876        [31m0.0793[0m     +  30.6940
     11   [36m0.2414[0m   [32m0.7648[0m        0.0876        [31m0.0793[0m     +  30.1801
     12   [36m0.2414[0m   [32m0.7648[0m        0.0884        [31m0.0793[0m     +  29.9797
     13   0.2414   [32m0.7648[0m        0.0881        [31m0.0792[0m     +  31.9567
     14   0.2411   [32m0.7649[0m        [35m0.0866[0m        [31m0.0792[0m     +  30.3843
     15   0.2411   [32m0.7649[0m        0.0878        [31m0.0791[0m     +  31.1360
     16   0.2411   [32m0.7649[0m        0.0882        [31m0.0791[0m     +  30.9135
     17   0.2410   [32m0.7649[0m        0.0874        [31m0.0791[0m     +  30.6772
     18   0.2411   [32m0.7650[0m        0.0877        [31m0.0790[0m     +  30.9216
     19   0.2412   [32m0.7651[0m        0.0866        [31m0.0790[0m     +  30.9807
     20   0.2412   [32m0.7651[0m        0.0878        [31m0.0789[0m     +  30.0135
     21   0.2411   [32m0.7652[0m        0.0878        [31m0.0789[0m     +  30.6957
     22   0.2412   [32m0.7652[0m        0.0866        [31m0.0789[0m     +  30.7199
     23   0.2412   [32m0.7653[0m        0.0875        [31m0.0788[0m     +  30.2568
     24   0.2412   [32m0.7653[0m        0.0876        [31m0.0788[0m     +  30.7114
     25   0.2412   [32m0.7654[0m        0.0872        [31m0.0787[0m     +  31.1305
[32m[I 2023-01-08 13:53:16,453][0m Trial 23 finished with value: 0.2414283647767267 and parameters: {'lr': 2.4777658100230992e-08, 'dropout': 0.42341748132446355, 'd_model_multiplier': 1, 'num_layers': 9, 'n_heads': 4, 'dim_feedforward': 272, 'batch_size': 223, 'pos_encoding': 'learnable', 'activation': 'gelu', 'norm': 'LayerNorm', 'optimizer_name': 'PlainRAdam', 'weight_decay': 0.01}. Best is trial 21 with value: 0.33272641858731333.[0m
[EnsembleDataset] Initializing dataset...
	Examples: 27964
	Features: 621
	Max length: 316
[EnsembleDataset] Dataset initialization complete
  epoch    auprc    auroc    train_loss    valid_loss    cp      dur
-------  -------  -------  ------------  ------------  ----  -------
      1   [36m0.2653[0m   [32m0.8064[0m        [35m0.1269[0m        [31m0.0559[0m     +  29.6916
      2   0.2650   0.8063        [35m0.1205[0m        0.0567        30.2350
      3   0.2652   [32m0.8065[0m        0.1459        0.0564        29.8211
Stopping since valid_loss has not improved in the last 3 epochs.
[32m[I 2023-01-08 13:59:55,486][0m Trial 24 finished with value: 0.26530892872488065 and parameters: {'lr': 1.4107009067772605e-09, 'dropout': 0.5160490360529233, 'd_model_multiplier': 1, 'num_layers': 6, 'n_heads': 4, 'dim_feedforward': 355, 'batch_size': 190, 'pos_encoding': 'learnable', 'activation': 'gelu', 'norm': 'BatchNorm', 'optimizer_name': 'RAdam', 'weight_decay': 0.01}. Best is trial 21 with value: 0.33272641858731333.[0m
[EnsembleDataset] Initializing dataset...
	Examples: 27964
	Features: 621
	Max length: 316
[EnsembleDataset] Dataset initialization complete
Warning, assumed runtime error: CUDA out of memory. Tried to allocate 5.50 GiB (GPU 0; 23.70 GiB total capacity; 18.61 GiB already allocated; 99.31 MiB free; 22.53 GiB reserved in total by PyTorch) If reserved memory is >> allocated memory try setting max_split_size_mb to avoid fragmentation.  See documentation for Memory Management and PYTORCH_CUDA_ALLOC_CONF
[32m[I 2023-01-08 14:00:03,172][0m Trial 25 finished with value: 0.0 and parameters: {'lr': 4.210210021415635e-07, 'dropout': 0.6347025562868064, 'd_model_multiplier': 1, 'num_layers': 2, 'n_heads': 64, 'dim_feedforward': 198, 'batch_size': 231, 'pos_encoding': 'learnable', 'activation': 'gelu', 'norm': 'BatchNorm', 'optimizer_name': 'AdamW', 'weight_decay': 0.01}. Best is trial 21 with value: 0.33272641858731333.[0m
[EnsembleDataset] Initializing dataset...
	Examples: 27964
	Features: 621
	Max length: 316
[EnsembleDataset] Dataset initialization complete
  epoch    auprc    auroc    train_loss    valid_loss    cp      dur
-------  -------  -------  ------------  ------------  ----  -------
      1   [36m0.2146[0m   [32m0.7575[0m        [35m0.0738[0m        [31m0.0522[0m     +  71.2096
      2   [36m0.2146[0m   [32m0.7575[0m        [35m0.0731[0m        [31m0.0522[0m     +  71.2706
      3   [36m0.2146[0m   [32m0.7576[0m        0.0737        [31m0.0522[0m     +  71.3367
      4   [36m0.2146[0m   [32m0.7576[0m        0.0747        [31m0.0522[0m     +  71.4684
      5   [36m0.2146[0m   [32m0.7576[0m        0.0751        [31m0.0522[0m     +  71.4055
      6   0.2146   [32m0.7576[0m        0.0739        [31m0.0522[0m     +  71.3433
      7   [36m0.2146[0m   [32m0.7577[0m        0.0744        [31m0.0522[0m     +  71.2581
      8   [36m0.2147[0m   [32m0.7577[0m        0.0739        [31m0.0522[0m     +  71.3337
      9   [36m0.2147[0m   [32m0.7577[0m        0.0737        [31m0.0522[0m     +  71.1623
     10   [36m0.2147[0m   [32m0.7577[0m        0.0738        [31m0.0522[0m     +  71.4312
     11   [36m0.2147[0m   [32m0.7578[0m        0.0750        [31m0.0522[0m     +  70.8541
     12   [36m0.2147[0m   [32m0.7578[0m        0.0740        [31m0.0522[0m     +  71.4075
     13   [36m0.2148[0m   [32m0.7579[0m        [35m0.0731[0m        [31m0.0522[0m     +  71.0670
     14   [36m0.2148[0m   [32m0.7579[0m        0.0736        [31m0.0522[0m     +  70.9000
     15   [36m0.2149[0m   [32m0.7579[0m        [35m0.0726[0m        [31m0.0522[0m     +  71.5231
     16   [36m0.2149[0m   [32m0.7580[0m        0.0739        [31m0.0522[0m     +  71.0220
     17   [36m0.2149[0m   [32m0.7580[0m        0.0741        [31m0.0522[0m     +  71.5496
     18   [36m0.2149[0m   [32m0.7581[0m        0.0732        [31m0.0522[0m     +  71.6684
     19   [36m0.2149[0m   [32m0.7581[0m        [35m0.0725[0m        [31m0.0521[0m     +  71.3321
     20   [36m0.2149[0m   [32m0.7581[0m        0.0734        [31m0.0521[0m     +  71.6229
     21   [36m0.2149[0m   [32m0.7582[0m        0.0737        [31m0.0521[0m     +  71.5284
     22   [36m0.2150[0m   [32m0.7582[0m        0.0740        [31m0.0521[0m     +  71.2487
     23   0.2150   [32m0.7582[0m        0.0732        [31m0.0521[0m     +  71.4576
     24   0.2150   [32m0.7582[0m        0.0737        [31m0.0521[0m     +  71.5814
     25   0.2150   [32m0.7583[0m        0.0742        [31m0.0521[0m     +  71.4321
[32m[I 2023-01-08 15:08:35,389][0m Trial 26 finished with value: 0.21498108484775197 and parameters: {'lr': 7.461685890703205e-09, 'dropout': 0.4533310473841587, 'd_model_multiplier': 1, 'num_layers': 13, 'n_heads': 16, 'dim_feedforward': 408, 'batch_size': 57, 'pos_encoding': 'learnable', 'activation': 'gelu', 'norm': 'LayerNorm', 'optimizer_name': 'RAdam', 'weight_decay': 0.01}. Best is trial 21 with value: 0.33272641858731333.[0m
[EnsembleDataset] Initializing dataset...
	Examples: 27964
	Features: 621
	Max length: 316
[EnsembleDataset] Dataset initialization complete
  epoch    auprc    auroc    train_loss    valid_loss    cp      dur
-------  -------  -------  ------------  ------------  ----  -------
      1   [36m0.2793[0m   [32m0.8059[0m        [35m0.0962[0m        [31m0.0672[0m     +  31.2098
      2   [36m0.2794[0m   [32m0.8066[0m        0.1005        [31m0.0639[0m     +  31.6458
      3   [36m0.2795[0m   [32m0.8070[0m        0.0974        0.0669        32.0501
      4   [36m0.2798[0m   [32m0.8072[0m        0.1039        0.0686        32.0969
Stopping since valid_loss has not improved in the last 3 epochs.
