[32m[I 2023-05-04 09:45:04,381][0m Trial 424 finished with value: 0.270277843834267 and parameters: {'lr': 4.135307241362399e-05, 'dropout': 0.302094602453015, 'd_model_multiplier': 4, 'num_layers': 8, 'n_heads': 32, 'dim_feedforward': 325, 'batch_size': 76, 'pos_encoding': 'fixed', 'activation': 'relu', 'norm': 'LayerNorm', 'optimizer_name': 'RAdam', 'weight_decay': 0.001, 'top_n_features': 61}. Best is trial 246 with value: 0.16447311791139763.[0m
[FileBasedDataset] Initializing dataset...
	Examples: 8264
	Features: 56
	Max length: 315
Standard scalar turned ON, loading params from cache
[FileBasedDataset] Dataset initialization complete
  epoch    auprc    auroc    train_loss    valid_acc    valid_loss    cp     dur
-------  -------  -------  ------------  -----------  ------------  ----  ------
      1   [36m0.0696[0m   [32m0.4059[0m        [35m0.6578[0m       [31m0.8791[0m        [94m0.6228[0m     +  9.5011
      2   0.0629   0.3608        [35m0.6167[0m       [31m0.9287[0m        [94m0.5763[0m     +  9.0522
      3   0.0618   0.3439        [35m0.5807[0m       0.9287        [94m0.5373[0m     +  9.6884
      4   0.0694   0.3315        [35m0.5522[0m       0.9287        [94m0.5041[0m     +  9.7717
      5   0.0689   0.3248        [35m0.5237[0m       0.9287        [94m0.4759[0m     +  9.7703
      6   0.0688   0.3233        [35m0.4990[0m       0.9287        [94m0.4522[0m     +  9.5548
      7   0.0689   0.3231        [35m0.4807[0m       0.9287        [94m0.4318[0m     +  9.8739
      8   0.0688   0.3223        [35m0.4595[0m       0.9287        [94m0.4144[0m     +  9.9733
      9   0.0688   0.3225        [35m0.4442[0m       0.9287        [94m0.3985[0m     +  9.5287
     10   0.0688   0.3232        [35m0.4300[0m       0.9287        [94m0.3839[0m     +  9.3705
     11   0.0689   0.3249        [35m0.4166[0m       0.9287        [94m0.3708[0m     +  9.5071
     12   0.0689   0.3268        [35m0.4058[0m       0.9287        [94m0.3592[0m     +  9.8870
     13   0.0691   0.3303        [35m0.3962[0m       0.9287        [94m0.3483[0m     +  9.4488
     14   0.0695   0.3360        [35m0.3847[0m       0.9287        [94m0.3392[0m     +  10.3515
     15   [36m0.0700[0m   0.3451        [35m0.3762[0m       0.9287        [94m0.3310[0m     +  9.9524
     16   [36m0.0708[0m   0.3572        [35m0.3696[0m       0.9287        [94m0.3236[0m     +  9.9548
     17   [36m0.0716[0m   0.3693        [35m0.3620[0m       0.9287        [94m0.3168[0m     +  9.8763
     18   [36m0.0729[0m   0.3858        [35m0.3558[0m       0.9287        [94m0.3106[0m     +  9.7183
     19   [36m0.0740[0m   0.3991        [35m0.3486[0m       0.9287        [94m0.3050[0m     +  9.4782
     20   [36m0.0754[0m   [32m0.4148[0m        [35m0.3436[0m       0.9287        [94m0.3001[0m     +  9.6757
     21   [36m0.0765[0m   [32m0.4271[0m        [35m0.3370[0m       0.9287        [94m0.2955[0m     +  9.9565
     22   [36m0.0778[0m   [32m0.4389[0m        [35m0.3324[0m       0.9287        [94m0.2913[0m     +  10.2022
     23   [36m0.0793[0m   [32m0.4505[0m        [35m0.3275[0m       0.9287        [94m0.2876[0m     +  9.8165
     24   [36m0.0806[0m   [32m0.4604[0m        [35m0.3257[0m       0.9287        [94m0.2841[0m     +  9.8168
     25   [36m0.0826[0m   [32m0.4725[0m        [35m0.3201[0m       0.9287        [94m0.2809[0m     +  9.7961
     26   [36m0.0849[0m   [32m0.4849[0m        [35m0.3157[0m       0.9287        [94m0.2780[0m     +  9.5237
     27   [36m0.0874[0m   [32m0.4955[0m        [35m0.3128[0m       0.9287        [94m0.2754[0m     +  10.0187
     28   [36m0.0899[0m   [32m0.5069[0m        [35m0.3080[0m       0.9287        [94m0.2730[0m     +  9.9402
     29   0.0856   [32m0.5176[0m        [35m0.3070[0m       0.9287        [94m0.2708[0m     +  9.9518
     30   [36m0.0912[0m   [32m0.5246[0m        [35m0.3053[0m       0.9287        [94m0.2687[0m     +  9.7198
     31   0.0909   [32m0.5333[0m        [35m0.2997[0m       0.9287        [94m0.2669[0m     +  9.8027
     32   [36m0.0940[0m   [32m0.5415[0m        [35m0.2991[0m       0.9287        [94m0.2653[0m     +  10.1678
     33   [36m0.0994[0m   [32m0.5474[0m        [35m0.2959[0m       0.9287        [94m0.2637[0m     +  10.0126
     34   [36m0.1038[0m   [32m0.5557[0m        [35m0.2948[0m       0.9287        [94m0.2622[0m     +  9.7979
     35   [36m0.1132[0m   [32m0.5618[0m        [35m0.2933[0m       0.9287        [94m0.2609[0m     +  9.7882
     36   [36m0.1158[0m   [32m0.5671[0m        [35m0.2877[0m       0.9287        [94m0.2596[0m     +  9.6962
     37   [36m0.1208[0m   [32m0.5709[0m        0.2904       0.9287        [94m0.2585[0m     +  9.7613
     38   [36m0.1225[0m   [32m0.5745[0m        0.2886       0.9287        [94m0.2576[0m     +  9.7958
     39   [36m0.1246[0m   [32m0.5790[0m        [35m0.2852[0m       0.9287        [94m0.2567[0m     +  9.6883
     40   [36m0.1257[0m   [32m0.5822[0m        [35m0.2838[0m       0.9287        [94m0.2558[0m     +  9.6554
     41   [36m0.1273[0m   [32m0.5876[0m        [35m0.2823[0m       0.9287        [94m0.2551[0m     +  9.6544
     42   [36m0.1297[0m   [32m0.5928[0m        0.2833       0.9287        [94m0.2543[0m     +  9.7201
     43   [36m0.1306[0m   [32m0.5958[0m        [35m0.2799[0m       0.9287        [94m0.2537[0m     +  9.8133
     44   [36m0.1325[0m   [32m0.6013[0m        0.2801       0.9287        [94m0.2531[0m     +  9.6199
     45   [36m0.1349[0m   [32m0.6056[0m        [35m0.2790[0m       0.9287        [94m0.2526[0m     +  9.9743
     46   [36m0.1353[0m   [32m0.6079[0m        [35m0.2783[0m       0.9287        [94m0.2521[0m     +  10.1150
     47   [36m0.1369[0m   [32m0.6104[0m        [35m0.2740[0m       0.9287        [94m0.2516[0m     +  9.7878
     48   [36m0.1384[0m   [32m0.6135[0m        0.2747       0.9287        [94m0.2511[0m     +  9.7003
     49   [36m0.1385[0m   [32m0.6150[0m        [35m0.2722[0m       0.9287        [94m0.2507[0m     +  10.1463
     50   [36m0.1397[0m   [32m0.6165[0m        0.2765       0.9287        [94m0.2504[0m     +  9.3089
[32m[I 2023-05-04 09:53:17,331][0m Trial 425 finished with value: 0.2503787665892541 and parameters: {'lr': 3.5457502697731885e-06, 'dropout': 0.6376777843437504, 'd_model_multiplier': 4, 'num_layers': 6, 'n_heads': 4, 'dim_feedforward': 372, 'batch_size': 45, 'pos_encoding': 'fixed', 'activation': 'relu', 'norm': 'LayerNorm', 'optimizer_name': 'AdamW', 'weight_decay': 0.1, 'top_n_features': 56}. Best is trial 246 with value: 0.16447311791139763.[0m
[FileBasedDataset] Initializing dataset...
	Examples: 8264
	Features: 86
	Max length: 315
Standard scalar turned ON, loading params from cache
[FileBasedDataset] Dataset initialization complete
Warning, assumed runtime error: CUDA out of memory. Tried to allocate 1.52 GiB (GPU 0; 23.70 GiB total capacity; 18.31 GiB already allocated; 121.25 MiB free; 22.49 GiB reserved in total by PyTorch) If reserved memory is >> allocated memory try setting max_split_size_mb to avoid fragmentation.  See documentation for Memory Management and PYTORCH_CUDA_ALLOC_CONF
[32m[I 2023-05-04 09:53:22,491][0m Trial 426 finished with value: 100.0 and parameters: {'lr': 2.005823205396406e-05, 'dropout': 0.4313018532003105, 'd_model_multiplier': 4, 'num_layers': 5, 'n_heads': 32, 'dim_feedforward': 341, 'batch_size': 128, 'pos_encoding': 'learnable', 'activation': 'relu', 'norm': 'LayerNorm', 'optimizer_name': 'RAdam', 'weight_decay': 0.1, 'top_n_features': 86}. Best is trial 246 with value: 0.16447311791139763.[0m
[FileBasedDataset] Initializing dataset...
	Examples: 8264
	Features: 68
	Max length: 315
Standard scalar turned ON, loading params from cache
[FileBasedDataset] Dataset initialization complete
  epoch    auprc    auroc    train_loss    valid_acc    valid_loss    cp      dur
-------  -------  -------  ------------  -----------  ------------  ----  -------
      1   [36m0.2673[0m   [32m0.7837[0m        [35m0.2581[0m       [31m0.9045[0m        [94m0.2500[0m     +  27.4325
      2   [36m0.2844[0m   [32m0.8064[0m        [35m0.2437[0m       [31m0.9117[0m        [94m0.2367[0m     +  27.6621
      3   [36m0.2956[0m   0.8015        [35m0.2384[0m       [31m0.9166[0m        [94m0.2312[0m     +  27.5706
      4   [36m0.3199[0m   [32m0.8104[0m        [35m0.2359[0m       [31m0.9190[0m        [94m0.2282[0m     +  27.6784
      5   0.3121   0.8057        [35m0.2307[0m       [31m0.9202[0m        0.2299        28.0184
      6   0.2890   0.8029        [35m0.2295[0m       0.9154        0.2358        27.7549
      7   0.2619   0.7923        0.2308       0.9117        0.2351        27.5121
      8   0.2689   0.8020        [35m0.2270[0m       0.9154        0.2329        27.7123
      9   0.3053   [32m0.8210[0m        [35m0.2237[0m       0.9202        [94m0.2261[0m     +  27.6863
     10   0.3143   0.8176        [35m0.2224[0m       0.9178        [94m0.2246[0m     +  27.5797
     11   0.3186   0.8165        [35m0.2185[0m       0.9166        0.2279        27.7549
     12   0.3005   0.8148        0.2222       0.9178        0.2286        27.8155
     13   0.3143   0.8164        [35m0.2178[0m       0.9190        [94m0.2226[0m     +  27.6334
     14   0.3101   0.8160        [35m0.2141[0m       0.9166        0.2323        27.7184
     15   [36m0.3247[0m   [32m0.8234[0m        0.2157       0.9202        0.2286        27.9119
     16   0.2665   0.8105        [35m0.2109[0m       0.9081        0.2427        27.6166
     17   0.2771   0.8158        [35m0.2095[0m       0.9129        0.2445        27.5211
     18   0.2664   0.8078        [35m0.2085[0m       0.9117        0.2613        27.8122
     19   0.2582   0.8141        [35m0.2068[0m       0.9129        0.2514        27.7717
     20   0.2586   0.8163        [35m0.2062[0m       0.9129        0.2539        27.7708
     21   0.2585   0.8133        [35m0.2037[0m       0.9117        0.2609        27.6254
     22   0.2521   0.8216        [35m0.1999[0m       0.9178        0.2441        27.5706
Stopping since valid_loss has not improved in the last 10 epochs.
[32m[I 2023-05-04 10:04:00,657][0m Trial 427 finished with value: 0.22262495775519 and parameters: {'lr': 0.0002079272006000459, 'dropout': 0.3366733258046219, 'd_model_multiplier': 4, 'num_layers': 6, 'n_heads': 32, 'dim_feedforward': 362, 'batch_size': 27, 'pos_encoding': 'fixed', 'activation': 'relu', 'norm': 'LayerNorm', 'optimizer_name': 'AdamW', 'weight_decay': 0.1, 'top_n_features': 68}. Best is trial 246 with value: 0.16447311791139763.[0m
[FileBasedDataset] Initializing dataset...
	Examples: 8264
	Features: 127
	Max length: 315
Standard scalar turned ON, loading params from cache
[FileBasedDataset] Dataset initialization complete
  epoch    auprc    auroc    train_loss    valid_acc    valid_loss    cp      dur
-------  -------  -------  ------------  -----------  ------------  ----  -------
      1   [36m0.1545[0m   [32m0.6962[0m        [35m0.3148[0m       [31m0.9274[0m        [94m0.2488[0m     +  30.7608
      2   [36m0.1751[0m   [32m0.7182[0m        [35m0.2394[0m       0.9214        0.2549        30.6593
      3   [36m0.1873[0m   [32m0.7254[0m        [35m0.2365[0m       0.9154        0.2516        30.5341
      4   0.1803   [32m0.7292[0m        [35m0.2351[0m       0.9178        0.2506        30.6635
      5   [36m0.1928[0m   [32m0.7408[0m        [35m0.2325[0m       0.9178        [94m0.2475[0m     +  30.9815
      6   [36m0.2020[0m   [32m0.7472[0m        [35m0.2274[0m       0.9190        0.2504        30.8161
      7   [36m0.2169[0m   0.7331        [35m0.2239[0m       0.9202        0.2489        30.7108
      8   0.1784   0.7238        [35m0.2223[0m       0.9250        0.2518        30.8436
      9   [36m0.2262[0m   0.7068        [35m0.2191[0m       0.9250        0.2496        30.8565
     10   [36m0.2302[0m   0.7166        0.2194       0.9238        [94m0.2452[0m     +  30.8971
     11   0.1940   0.7072        [35m0.2157[0m       0.9178        0.2644        30.5647
     12   0.1789   0.7253        [35m0.2126[0m       0.9214        0.2544        30.8133
     13   0.2129   0.7162        [35m0.2077[0m       0.9105        0.2632        30.6243
     14   0.1970   0.7066        [35m0.2039[0m       0.9081        0.2678        30.7009
     15   0.1935   0.7227        [35m0.1997[0m       0.9129        0.2702        30.6613
     16   0.2103   0.7352        0.2027       0.9190        0.2648        30.8191
     17   0.2149   0.7263        [35m0.1909[0m       0.9190        0.2616        31.1580
     18   0.1915   0.7168        0.1983       0.9033        0.2814        31.1118
     19   0.1665   0.6997        0.1921       0.9008        0.2884        31.0920
Stopping since valid_loss has not improved in the last 10 epochs.
[32m[I 2023-05-04 10:14:18,419][0m Trial 428 finished with value: 0.24520914831357538 and parameters: {'lr': 0.0001120470927284956, 'dropout': 0.2792925470605569, 'd_model_multiplier': 16, 'num_layers': 5, 'n_heads': 32, 'dim_feedforward': 388, 'batch_size': 52, 'pos_encoding': 'fixed', 'activation': 'relu', 'norm': 'LayerNorm', 'optimizer_name': 'RAdam', 'weight_decay': 0.001, 'top_n_features': 127}. Best is trial 246 with value: 0.16447311791139763.[0m
[FileBasedDataset] Initializing dataset...
	Examples: 8264
	Features: 50
	Max length: 315
Standard scalar turned ON, loading params from cache
[FileBasedDataset] Dataset initialization complete
  epoch    auprc    auroc    train_loss    valid_acc    valid_loss    cp      dur
-------  -------  -------  ------------  -----------  ------------  ----  -------
      1   [36m0.2499[0m   [32m0.7428[0m        [35m0.3340[0m       [31m0.9214[0m        [94m0.2408[0m     +  20.4236
      2   [36m0.3158[0m   [32m0.7572[0m        [35m0.2406[0m       [31m0.9274[0m        [94m0.2370[0m     +  20.3085
      3   [36m0.3461[0m   [32m0.7584[0m        [35m0.2346[0m       0.9262        0.2381        20.5570
      4   [36m0.3529[0m   0.7570        [35m0.2313[0m       0.9250        0.2397        20.5382
      5   0.3519   0.7546        [35m0.2302[0m       0.9262        0.2406        20.3953
      6   [36m0.3530[0m   0.7526        [35m0.2296[0m       0.9250        0.2408        20.3277
      7   0.3524   0.7521        [35m0.2277[0m       0.9238        0.2417        20.4408
      8   0.3468   0.7525        [35m0.2260[0m       0.9202        0.2441        20.4017
      9   0.3497   0.7529        [35m0.2252[0m       0.9202        0.2429        20.2328
     10   0.3504   0.7529        0.2256       0.9214        0.2430        20.4556
     11   [36m0.3531[0m   0.7545        [35m0.2247[0m       0.9214        0.2443        20.3355
Stopping since valid_loss has not improved in the last 10 epochs.
[32m[I 2023-05-04 10:18:23,671][0m Trial 429 finished with value: 0.23703233883271338 and parameters: {'lr': 1.0476936351704473e-05, 'dropout': 0.2582922950626735, 'd_model_multiplier': 4, 'num_layers': 4, 'n_heads': 32, 'dim_feedforward': 329, 'batch_size': 20, 'pos_encoding': 'fixed', 'activation': 'relu', 'norm': 'LayerNorm', 'optimizer_name': 'AdamW', 'weight_decay': 0.1, 'top_n_features': 50}. Best is trial 246 with value: 0.16447311791139763.[0m
[FileBasedDataset] Initializing dataset...
	Examples: 8264
	Features: 63
	Max length: 315
Standard scalar turned ON, loading params from cache
[FileBasedDataset] Dataset initialization complete
  epoch    auprc    auroc    train_loss    valid_acc    valid_loss    cp      dur
-------  -------  -------  ------------  -----------  ------------  ----  -------
      1   [36m0.2244[0m   [32m0.7158[0m        [35m0.3741[0m       [31m0.9335[0m        [94m0.2207[0m     +  54.1043
      2   [36m0.3124[0m   [32m0.7454[0m        [35m0.2413[0m       0.9274        [94m0.2169[0m     +  53.9296
      3   0.3057   [32m0.7551[0m        [35m0.2363[0m       0.9311        [94m0.2157[0m     +  54.2237
      4   [36m0.3144[0m   [32m0.7614[0m        [35m0.2334[0m       0.9274        [94m0.2133[0m     +  54.5807
      5   [36m0.3270[0m   [32m0.7641[0m        [35m0.2323[0m       0.9311        [94m0.2128[0m     +  54.0938
      6   0.3239   [32m0.7713[0m        [35m0.2308[0m       0.9323        [94m0.2109[0m     +  55.1826
      7   [36m0.3281[0m   [32m0.7774[0m        [35m0.2290[0m       0.9335        [94m0.2091[0m     +  54.3527
      8   [36m0.3336[0m   [32m0.7818[0m        [35m0.2260[0m       0.9335        [94m0.2080[0m     +  54.3395
      9   [36m0.3451[0m   [32m0.7869[0m        [35m0.2259[0m       0.9335        [94m0.2053[0m     +  54.2480
     10   [36m0.3555[0m   [32m0.7918[0m        [35m0.2247[0m       0.9335        0.2064        54.2432
     11   0.3426   [32m0.7944[0m        [35m0.2236[0m       [31m0.9371[0m        0.2088        54.3322
     12   [36m0.3679[0m   [32m0.7977[0m        [35m0.2216[0m       0.9347        0.2062        54.2913
     13   0.3622   [32m0.8032[0m        [35m0.2201[0m       0.9359        [94m0.2022[0m     +  54.4036
     14   0.3493   [32m0.8063[0m        [35m0.2178[0m       0.9347        0.2044        54.1130
     15   0.3517   [32m0.8147[0m        [35m0.2161[0m       [31m0.9383[0m        [94m0.1977[0m     +  54.2569
     16   0.3514   0.8137        [35m0.2156[0m       0.9371        0.1990        54.5675
     17   0.3470   [32m0.8155[0m        [35m0.2138[0m       0.9323        0.2017        54.5379
     18   0.3428   [32m0.8181[0m        [35m0.2135[0m       0.9335        0.2003        54.1524
     19   0.3525   [32m0.8200[0m        [35m0.2107[0m       0.9335        0.2018        54.1415
     20   0.3385   0.8190        [35m0.2083[0m       0.9323        0.2021        54.3274
     21   0.3273   0.8182        [35m0.2064[0m       0.9335        0.2054        54.2404
     22   0.3388   [32m0.8201[0m        [35m0.2063[0m       0.9359        0.2003        54.3519
     23   0.3428   0.8180        [35m0.2040[0m       0.9347        0.2033        54.3739
     24   0.3471   [32m0.8209[0m        [35m0.2026[0m       0.9347        0.2053        54.2698
Stopping since valid_loss has not improved in the last 10 epochs.
[32m[I 2023-05-04 10:41:11,524][0m Trial 430 finished with value: 0.19771506832833735 and parameters: {'lr': 2.9464918152635055e-05, 'dropout': 0.4505212528424989, 'd_model_multiplier': 32, 'num_layers': 6, 'n_heads': 32, 'dim_feedforward': 335, 'batch_size': 69, 'pos_encoding': 'fixed', 'activation': 'relu', 'norm': 'LayerNorm', 'optimizer_name': 'RAdam', 'weight_decay': 0.1, 'top_n_features': 63}. Best is trial 246 with value: 0.16447311791139763.[0m
[FileBasedDataset] Initializing dataset...
	Examples: 8264
	Features: 62
	Max length: 315
Standard scalar turned ON, loading params from cache
[FileBasedDataset] Dataset initialization complete
Warning, assumed runtime error: CUDA out of memory. Tried to allocate 848.00 MiB (GPU 0; 23.70 GiB total capacity; 20.59 GiB already allocated; 565.25 MiB free; 22.05 GiB reserved in total by PyTorch) If reserved memory is >> allocated memory try setting max_split_size_mb to avoid fragmentation.  See documentation for Memory Management and PYTORCH_CUDA_ALLOC_CONF
