[32m[I 2023-01-09 20:19:36,896][0m Trial 155 finished with value: 0.32218705289311556 and parameters: {'lr': 0.01100306867463171, 'dropout': 0.6294250362740931, 'd_model_multiplier': 4, 'num_layers': 4, 'n_heads': 16, 'dim_feedforward': 484, 'batch_size': 126, 'pos_encoding': 'fixed', 'activation': 'gelu', 'norm': 'BatchNorm', 'optimizer_name': 'RAdam', 'weight_decay': 0.001}. Best is trial 122 with value: 0.40157405369010674.[0m
[EnsembleDataset] Initializing dataset...
	Examples: 27964
	Features: 621
	Max length: 316
[EnsembleDataset] Dataset initialization complete
  epoch    auprc    auroc    train_loss    valid_loss    cp      dur
-------  -------  -------  ------------  ------------  ----  -------
      1   [36m0.3276[0m   [32m0.8406[0m        [35m0.3505[0m        [31m0.0427[0m     +  32.4203
      2   0.3204   0.8267        [35m0.2863[0m        0.0444        32.1277
      3   0.2592   0.7396        [35m0.1037[0m        0.0489        31.7298
Stopping since valid_loss has not improved in the last 3 epochs.
[32m[I 2023-01-09 20:25:53,070][0m Trial 156 finished with value: 0.3276101465427008 and parameters: {'lr': 0.0006340297053344544, 'dropout': 0.6586131029937067, 'd_model_multiplier': 8, 'num_layers': 3, 'n_heads': 16, 'dim_feedforward': 467, 'batch_size': 120, 'pos_encoding': 'fixed', 'activation': 'gelu', 'norm': 'BatchNorm', 'optimizer_name': 'AdamW', 'weight_decay': 0}. Best is trial 122 with value: 0.40157405369010674.[0m
[EnsembleDataset] Initializing dataset...
	Examples: 27964
	Features: 621
	Max length: 316
[EnsembleDataset] Dataset initialization complete
  epoch    auprc    auroc    train_loss    valid_loss    cp      dur
-------  -------  -------  ------------  ------------  ----  -------
      1   [36m0.2112[0m   [32m0.6292[0m        [35m0.1691[0m        [31m0.0932[0m     +  33.3023
      2   0.1899   [32m0.7798[0m        [35m0.0762[0m        0.0969        33.3060
      3   0.1798   0.7164        0.1085        0.1254        33.5331
Stopping since valid_loss has not improved in the last 3 epochs.
[32m[I 2023-01-09 20:32:20,799][0m Trial 157 finished with value: 0.2111961086371847 and parameters: {'lr': 0.0344022197632523, 'dropout': 0.6874319333520893, 'd_model_multiplier': 4, 'num_layers': 4, 'n_heads': 16, 'dim_feedforward': 358, 'batch_size': 98, 'pos_encoding': 'fixed', 'activation': 'gelu', 'norm': 'LayerNorm', 'optimizer_name': 'RAdam', 'weight_decay': 0.001}. Best is trial 122 with value: 0.40157405369010674.[0m
[EnsembleDataset] Initializing dataset...
	Examples: 27964
	Features: 621
	Max length: 316
[EnsembleDataset] Dataset initialization complete
  epoch    auprc    auroc    train_loss    valid_loss    cp      dur
-------  -------  -------  ------------  ------------  ----  -------
      1   [36m0.2546[0m   [32m0.8241[0m        [35m0.1162[0m        [31m0.0516[0m     +  30.7554
      2   [36m0.2564[0m   [32m0.8247[0m        [35m0.1149[0m        [31m0.0514[0m     +  30.6384
      3   [36m0.2573[0m   [32m0.8250[0m        [35m0.0989[0m        [31m0.0513[0m     +  31.2856
      4   [36m0.2580[0m   [32m0.8252[0m        0.1051        0.0513        30.5266
      5   0.2564   0.8251        [35m0.0977[0m        0.0514        30.1890
Stopping since valid_loss has not improved in the last 3 epochs.
[32m[I 2023-01-09 20:42:29,164][0m Trial 158 finished with value: 0.2580097948188303 and parameters: {'lr': 4.8976893816567255e-05, 'dropout': 0.6430831584503603, 'd_model_multiplier': 4, 'num_layers': 3, 'n_heads': 16, 'dim_feedforward': 490, 'batch_size': 94, 'pos_encoding': 'fixed', 'activation': 'gelu', 'norm': 'BatchNorm', 'optimizer_name': 'RAdam', 'weight_decay': 0.01}. Best is trial 122 with value: 0.40157405369010674.[0m
[EnsembleDataset] Initializing dataset...
	Examples: 27964
	Features: 621
	Max length: 316
[EnsembleDataset] Dataset initialization complete
  epoch    auprc    auroc    train_loss    valid_loss    cp      dur
-------  -------  -------  ------------  ------------  ----  -------
      1   [36m0.2454[0m   [32m0.8045[0m        [35m0.1050[0m        [31m0.0569[0m     +  31.1484
      2   [36m0.2464[0m   0.8043        0.1098        [31m0.0566[0m     +  30.8625
      3   0.2457   [32m0.8052[0m        [35m0.1044[0m        0.0569        30.4762
      4   [36m0.2496[0m   [32m0.8062[0m        [35m0.1008[0m        0.0568        31.5844
Stopping since valid_loss has not improved in the last 3 epochs.
[32m[I 2023-01-09 20:50:43,466][0m Trial 159 finished with value: 0.2495767252969587 and parameters: {'lr': 3.7749371222399275e-09, 'dropout': 0.33916589449766255, 'd_model_multiplier': 4, 'num_layers': 3, 'n_heads': 16, 'dim_feedforward': 461, 'batch_size': 123, 'pos_encoding': 'fixed', 'activation': 'gelu', 'norm': 'BatchNorm', 'optimizer_name': 'RAdam', 'weight_decay': 0}. Best is trial 122 with value: 0.40157405369010674.[0m
[EnsembleDataset] Initializing dataset...
	Examples: 27964
	Features: 621
	Max length: 316
[EnsembleDataset] Dataset initialization complete
  epoch    auprc    auroc    train_loss    valid_loss    cp      dur
-------  -------  -------  ------------  ------------  ----  -------
      1   [36m0.3326[0m   [32m0.8496[0m        [35m0.2477[0m        [31m0.0639[0m     +  30.4876
      2   [36m0.3516[0m   0.8398        [35m0.1897[0m        [31m0.0520[0m     +  30.6022
      3   [36m0.3576[0m   [32m0.8535[0m        [35m0.0624[0m        [31m0.0512[0m     +  30.8517
      4   [36m0.3638[0m   [32m0.8537[0m        [35m0.0557[0m        [31m0.0507[0m     +  31.1690
      5   0.3588   [32m0.8541[0m        [35m0.0545[0m        0.0511        30.2916
      6   0.3610   0.8497        [35m0.0536[0m        0.0525        30.7488
Stopping since valid_loss has not improved in the last 3 epochs.
[32m[I 2023-01-09 21:02:42,184][0m Trial 160 finished with value: 0.36381329196844014 and parameters: {'lr': 0.0016715536589871165, 'dropout': 0.6991574606864863, 'd_model_multiplier': 8, 'num_layers': 2, 'n_heads': 16, 'dim_feedforward': 473, 'batch_size': 77, 'pos_encoding': 'fixed', 'activation': 'gelu', 'norm': 'BatchNorm', 'optimizer_name': 'RAdam', 'weight_decay': 0}. Best is trial 122 with value: 0.40157405369010674.[0m
[EnsembleDataset] Initializing dataset...
	Examples: 27964
	Features: 621
	Max length: 316
[EnsembleDataset] Dataset initialization complete
  epoch    auprc    auroc    train_loss    valid_loss    cp      dur
-------  -------  -------  ------------  ------------  ----  -------
      1   [36m0.2759[0m   [32m0.7880[0m        [35m0.2884[0m        [31m0.0476[0m     +  29.8862
      2   [36m0.2896[0m   [32m0.8317[0m        [35m0.0842[0m        [31m0.0472[0m     +  29.3712
      3   [36m0.3033[0m   0.8253        [35m0.0581[0m        [31m0.0466[0m     +  30.2602
      4   [36m0.3072[0m   [32m0.8395[0m        [35m0.0575[0m        [31m0.0459[0m     +  30.2333
      5   0.3068   0.8300        [35m0.0566[0m        0.0474        30.0179
      6   0.3057   0.8256        [35m0.0556[0m        0.0483        29.1091
Stopping since valid_loss has not improved in the last 3 epochs.
[32m[I 2023-01-09 21:14:30,779][0m Trial 161 finished with value: 0.30717458522575336 and parameters: {'lr': 0.0024195631094107227, 'dropout': 0.6949588741896323, 'd_model_multiplier': 8, 'num_layers': 2, 'n_heads': 16, 'dim_feedforward': 472, 'batch_size': 70, 'pos_encoding': 'fixed', 'activation': 'gelu', 'norm': 'BatchNorm', 'optimizer_name': 'RAdam', 'weight_decay': 0}. Best is trial 122 with value: 0.40157405369010674.[0m
[EnsembleDataset] Initializing dataset...
	Examples: 27964
	Features: 621
	Max length: 316
[EnsembleDataset] Dataset initialization complete
  epoch    auprc    auroc    train_loss    valid_loss    cp      dur
-------  -------  -------  ------------  ------------  ----  -------
      1   [36m0.2840[0m   [32m0.8257[0m        [35m0.4276[0m        [31m0.0522[0m     +  30.4649
      2   0.2814   [32m0.8272[0m        [35m0.0657[0m        [31m0.0511[0m     +  30.8538
      3   [36m0.2881[0m   [32m0.8306[0m        [35m0.0608[0m        0.0528        31.1290
      4   0.2847   0.8261        0.0615        0.0520        31.2456
Stopping since valid_loss has not improved in the last 3 epochs.
[32m[I 2023-01-09 21:22:43,014][0m Trial 162 finished with value: 0.2880601335986476 and parameters: {'lr': 0.005855927994610945, 'dropout': 0.6788052302872795, 'd_model_multiplier': 8, 'num_layers': 3, 'n_heads': 16, 'dim_feedforward': 478, 'batch_size': 80, 'pos_encoding': 'fixed', 'activation': 'gelu', 'norm': 'BatchNorm', 'optimizer_name': 'RAdam', 'weight_decay': 0}. Best is trial 122 with value: 0.40157405369010674.[0m
[EnsembleDataset] Initializing dataset...
	Examples: 27964
	Features: 621
	Max length: 316
[EnsembleDataset] Dataset initialization complete
  epoch    auprc    auroc    train_loss    valid_loss    cp      dur
-------  -------  -------  ------------  ------------  ----  -------
      1   [36m0.2830[0m   [32m0.8241[0m        [35m0.2210[0m        [31m0.0484[0m     +  30.2865
      2   0.2747   0.8204        0.2789        0.0490        29.9656
      3   [36m0.2885[0m   [32m0.8269[0m        [35m0.0779[0m        [31m0.0483[0m     +  30.2232
      4   [36m0.2909[0m   [32m0.8283[0m        [35m0.0562[0m        [31m0.0482[0m     +  31.0426
      5   0.2905   0.8242        [35m0.0547[0m        0.0484        30.4989
      6   0.2833   0.8215        [35m0.0542[0m        0.0492        30.1775
Stopping since valid_loss has not improved in the last 3 epochs.
[32m[I 2023-01-09 21:34:34,592][0m Trial 163 finished with value: 0.290882634857634 and parameters: {'lr': 0.0016146748823723512, 'dropout': 0.6998553381193812, 'd_model_multiplier': 8, 'num_layers': 2, 'n_heads': 16, 'dim_feedforward': 450, 'batch_size': 88, 'pos_encoding': 'fixed', 'activation': 'gelu', 'norm': 'BatchNorm', 'optimizer_name': 'RAdam', 'weight_decay': 0}. Best is trial 122 with value: 0.40157405369010674.[0m
[EnsembleDataset] Initializing dataset...
	Examples: 27964
	Features: 621
	Max length: 316
[EnsembleDataset] Dataset initialization complete
  epoch    auprc    auroc    train_loss    valid_loss    cp      dur
-------  -------  -------  ------------  ------------  ----  -------
      1   [36m0.3151[0m   [32m0.8350[0m        [35m0.1022[0m        [31m0.9904[0m     +  30.6174
      2   [36m0.3175[0m   [32m0.8352[0m        [35m0.0979[0m        [31m0.9857[0m     +  31.6561
      3   [36m0.3227[0m   [32m0.8366[0m        0.0985        0.9952        30.0697
      4   0.3176   0.8356        0.0989        1.0854        29.9268
Stopping since valid_loss has not improved in the last 3 epochs.
[32m[I 2023-01-09 21:42:44,780][0m Trial 164 finished with value: 0.32267589575365285 and parameters: {'lr': 2.5227769065053484e-09, 'dropout': 0.06429349947819749, 'd_model_multiplier': 8, 'num_layers': 2, 'n_heads': 16, 'dim_feedforward': 494, 'batch_size': 76, 'pos_encoding': 'fixed', 'activation': 'gelu', 'norm': 'BatchNorm', 'optimizer_name': 'RAdam', 'weight_decay': 0}. Best is trial 122 with value: 0.40157405369010674.[0m
[EnsembleDataset] Initializing dataset...
	Examples: 27964
	Features: 621
	Max length: 316
[EnsembleDataset] Dataset initialization complete
  epoch    auprc    auroc    train_loss    valid_loss    cp      dur
-------  -------  -------  ------------  ------------  ----  -------
      1   [36m0.2717[0m   [32m0.8158[0m        [35m0.1468[0m        [31m0.0611[0m     +  29.4366
      2   [36m0.2735[0m   [32m0.8158[0m        [35m0.1377[0m        [31m0.0600[0m     +  30.2601
      3   0.2725   [32m0.8160[0m        [35m0.1367[0m        [31m0.0600[0m     +  29.1059
      4   0.2734   [32m0.8161[0m        [35m0.1358[0m        0.0615        28.9602
      5   0.2715   0.8159        0.1402        0.0604        29.9030
      6   0.2717   0.8160        [35m0.1330[0m        [31m0.0598[0m     +  28.6761
      7   [36m0.2751[0m   [32m0.8162[0m        0.1498        0.0606        28.5905
      8   0.2730   0.8160        0.1393        0.0615        29.2003
Stopping since valid_loss has not improved in the last 3 epochs.
[32m[I 2023-01-09 21:58:14,943][0m Trial 165 finished with value: 0.27514863981236154 and parameters: {'lr': 8.64884244994661e-09, 'dropout': 0.661982616330317, 'd_model_multiplier': 2, 'num_layers': 1, 'n_heads': 16, 'dim_feedforward': 485, 'batch_size': 63, 'pos_encoding': 'fixed', 'activation': 'gelu', 'norm': 'BatchNorm', 'optimizer_name': 'RAdam', 'weight_decay': 0}. Best is trial 122 with value: 0.40157405369010674.[0m
[EnsembleDataset] Initializing dataset...
	Examples: 27964
	Features: 621
	Max length: 316
[EnsembleDataset] Dataset initialization complete
  epoch    auprc    auroc    train_loss    valid_loss    cp      dur
-------  -------  -------  ------------  ------------  ----  -------
      1   [36m0.2714[0m   [32m0.8172[0m        [35m0.1419[0m        [31m0.0495[0m     +  67.8319
      2   [36m0.2724[0m   0.8165        [35m0.1418[0m        [31m0.0494[0m     +  67.4886
      3   0.2722   [32m0.8174[0m        [35m0.1339[0m        0.0494        67.5424
      4   0.2717   [32m0.8175[0m        0.1464        0.0494        67.2654
      5   0.2723   0.8171        0.1384        [31m0.0494[0m     +  67.4643
      6   0.2715   0.8173        0.1359        0.0495        67.5103
      7   0.2717   0.8171        0.1393        0.0495        67.0429
Stopping since valid_loss has not improved in the last 3 epochs.
[32m[I 2023-01-09 22:17:10,498][0m Trial 166 finished with value: 0.2723866001094907 and parameters: {'lr': 1.9102108716942873e-09, 'dropout': 0.6778946800873547, 'd_model_multiplier': 8, 'num_layers': 2, 'n_heads': 64, 'dim_feedforward': 467, 'batch_size': 91, 'pos_encoding': 'fixed', 'activation': 'gelu', 'norm': 'BatchNorm', 'optimizer_name': 'RAdam', 'weight_decay': 0}. Best is trial 122 with value: 0.40157405369010674.[0m
[EnsembleDataset] Initializing dataset...
	Examples: 27964
	Features: 621
	Max length: 316
[EnsembleDataset] Dataset initialization complete
  epoch    auprc    auroc    train_loss    valid_loss    cp      dur
-------  -------  -------  ------------  ------------  ----  -------
      1   [36m0.3229[0m   [32m0.8641[0m        [35m0.1002[0m        [31m0.0529[0m     +  30.7117
      2   [36m0.3270[0m   [32m0.8646[0m        0.1045        [31m0.0518[0m     +  30.5226
      3   0.3238   0.8636        0.1024        [31m0.0505[0m     +  30.7408
      4   0.3210   0.8640        0.1018        0.0521        30.4849
      5   0.3231   [32m0.8646[0m        0.1017        [31m0.0487[0m     +  31.5705
      6   0.3221   0.8637        0.1015        0.0503        31.2885
      7   0.3231   [32m0.8649[0m        0.1045        0.0505        31.6206
Stopping since valid_loss has not improved in the last 3 epochs.
[32m[I 2023-01-09 22:31:00,765][0m Trial 167 finished with value: 0.32704828659683877 and parameters: {'lr': 1.199446532098193e-09, 'dropout': 0.4037807486981174, 'd_model_multiplier': 4, 'num_layers': 3, 'n_heads': 16, 'dim_feedforward': 216, 'batch_size': 72, 'pos_encoding': 'learnable', 'activation': 'gelu', 'norm': 'BatchNorm', 'optimizer_name': 'RAdam', 'weight_decay': 0.1}. Best is trial 122 with value: 0.40157405369010674.[0m
[EnsembleDataset] Initializing dataset...
	Examples: 27964
	Features: 621
	Max length: 316
[EnsembleDataset] Dataset initialization complete
  epoch    auprc    auroc    train_loss    valid_loss    cp      dur
-------  -------  -------  ------------  ------------  ----  -------
      1   [36m0.2501[0m   [32m0.8057[0m        [35m0.1308[0m        [31m0.0497[0m     +  29.1898
      2   [36m0.2502[0m   0.8054        0.1420        [31m0.0497[0m     +  30.2470
      3   [36m0.2505[0m   [32m0.8059[0m        [35m0.1267[0m        [31m0.0497[0m     +  30.2253
      4   0.2498   0.8052        0.1370        0.0497        30.2451
      5   0.2501   0.8056        0.1346        0.0497        29.9672
Stopping since valid_loss has not improved in the last 3 epochs.
[32m[I 2023-01-09 22:41:03,426][0m Trial 168 finished with value: 0.25046543880198013 and parameters: {'lr': 1.659994838897365e-08, 'dropout': 0.6623624949124359, 'd_model_multiplier': 16, 'num_layers': 4, 'n_heads': 4, 'dim_feedforward': 437, 'batch_size': 84, 'pos_encoding': 'fixed', 'activation': 'gelu', 'norm': 'BatchNorm', 'optimizer_name': 'RAdam', 'weight_decay': 0.001}. Best is trial 122 with value: 0.40157405369010674.[0m
[EnsembleDataset] Initializing dataset...
	Examples: 27964
	Features: 621
	Max length: 316
[EnsembleDataset] Dataset initialization complete
  epoch    auprc    auroc    train_loss    valid_loss    cp      dur
-------  -------  -------  ------------  ------------  ----  -------
      1   [36m0.3393[0m   [32m0.8267[0m        [35m0.1747[0m        [31m0.0525[0m     +  62.4390
      2   0.3270   0.8114        [35m0.0566[0m        0.0550        62.2566
      3   0.2992   0.8191        0.0820        0.0551        62.4165
Stopping since valid_loss has not improved in the last 3 epochs.
[32m[I 2023-01-09 22:49:31,551][0m Trial 169 finished with value: 0.3392810179602017 and parameters: {'lr': 0.013886970402315901, 'dropout': 0.6281388373450809, 'd_model_multiplier': 1, 'num_layers': 3, 'n_heads': 64, 'dim_feedforward': 502, 'batch_size': 57, 'pos_encoding': 'fixed', 'activation': 'gelu', 'norm': 'BatchNorm', 'optimizer_name': 'RAdam', 'weight_decay': 0.1}. Best is trial 122 with value: 0.40157405369010674.[0m
[EnsembleDataset] Initializing dataset...
	Examples: 27964
	Features: 621
	Max length: 316
[EnsembleDataset] Dataset initialization complete
  epoch    auprc    auroc    train_loss    valid_loss    cp      dur
-------  -------  -------  ------------  ------------  ----  -------
      1   [36m0.2927[0m   [32m0.8423[0m        [35m0.1547[0m        [31m0.0541[0m     +  28.6993
      2   0.2912   [32m0.8432[0m        [35m0.0861[0m        0.0543        30.1658
      3   [36m0.2938[0m   [32m0.8434[0m        [35m0.0653[0m        [31m0.0528[0m     +  29.9109
      4   0.2921   0.8427        [35m0.0571[0m        0.0528        29.4873
      5   0.2911   0.8421        [35m0.0528[0m        0.0529        29.7970
Stopping since valid_loss has not improved in the last 3 epochs.
[32m[I 2023-01-09 22:59:37,307][0m Trial 170 finished with value: 0.2938343148833276 and parameters: {'lr': 0.0006625590573060705, 'dropout': 0.6865893149749679, 'd_model_multiplier': 4, 'num_layers': 2, 'n_heads': 8, 'dim_feedforward': 459, 'batch_size': 128, 'pos_encoding': 'fixed', 'activation': 'gelu', 'norm': 'BatchNorm', 'optimizer_name': 'AdamW', 'weight_decay': 0}. Best is trial 122 with value: 0.40157405369010674.[0m
[EnsembleDataset] Initializing dataset...
	Examples: 27964
	Features: 621
	Max length: 316
[EnsembleDataset] Dataset initialization complete
  epoch    auprc    auroc    train_loss    valid_loss    cp      dur
-------  -------  -------  ------------  ------------  ----  -------
      1   [36m0.3078[0m   [32m0.8365[0m        [35m0.1163[0m        [31m0.0483[0m     +  29.3494
      2   [36m0.3193[0m   [32m0.8440[0m        [35m0.0957[0m        [31m0.0478[0m     +  29.5368
      3   0.3140   0.8390        [35m0.0749[0m        0.0480        29.3719
      4   [36m0.3274[0m   [32m0.8446[0m        [35m0.0658[0m        [31m0.0474[0m     +  30.5352
      5   [36m0.3287[0m   [32m0.8474[0m        [35m0.0589[0m        0.0474        29.4804
      6   [36m0.3377[0m   0.8464        [35m0.0565[0m        [31m0.0472[0m     +  29.7411
      7   0.3205   0.8402        [35m0.0545[0m        0.0477        29.7578
      8   0.3194   0.8407        [35m0.0528[0m        0.0478        29.1828
Stopping since valid_loss has not improved in the last 3 epochs.
