[32m[I 2023-05-05 02:07:45,389][0m Trial 527 finished with value: 0.25034270989635404 and parameters: {'lr': 1.48978802506906e-05, 'dropout': 0.49711884341633805, 'd_model_multiplier': 64, 'num_layers': 4, 'n_heads': 16, 'dim_feedforward': 189, 'batch_size': 67, 'pos_encoding': 'fixed', 'activation': 'gelu', 'norm': 'BatchNorm', 'optimizer_name': 'RAdam', 'weight_decay': 0.01, 'top_n_features': 94}. Best is trial 246 with value: 0.16447311791139763.[0m
[FileBasedDataset] Initializing dataset...
	Examples: 8264
	Features: 61
	Max length: 315
Standard scalar turned ON, loading params from cache
[FileBasedDataset] Dataset initialization complete
  epoch    auprc    auroc    train_loss    valid_acc    valid_loss    cp      dur
-------  -------  -------  ------------  -----------  ------------  ----  -------
      1   [36m0.1916[0m   [32m0.6968[0m        [35m0.2870[0m       [31m0.9129[0m        [94m0.3113[0m     +  27.7166
      2   [36m0.2061[0m   [32m0.7105[0m        [35m0.2620[0m       0.9129        0.3342        27.4230
      3   0.2003   0.7066        [35m0.2571[0m       0.9129        [94m0.3019[0m     +  27.6723
      4   0.1994   0.7016        [35m0.2545[0m       0.9129        [94m0.2940[0m     +  27.7966
      5   0.2003   0.6983        [35m0.2529[0m       0.9129        0.2956        27.6396
      6   0.2015   0.6898        [35m0.2510[0m       0.9129        0.2978        27.9690
      7   0.2008   0.6947        [35m0.2500[0m       0.9117        [94m0.2922[0m     +  27.8249
      8   0.1999   0.6960        [35m0.2480[0m       0.9093        [94m0.2903[0m     +  27.8452
      9   0.2010   0.6918        0.2487       0.9117        [94m0.2889[0m     +  27.5969
     10   0.2045   0.6965        0.2492       0.9129        [94m0.2884[0m     +  27.5985
     11   0.2041   0.6982        [35m0.2480[0m       0.9117        0.2917        27.5504
     12   0.2023   0.7002        0.2489       0.9129        0.2898        27.7393
     13   0.2037   0.6986        [35m0.2470[0m       0.9117        0.2906        27.5680
     14   0.2024   0.6977        [35m0.2469[0m       0.9129        [94m0.2848[0m     +  27.8696
     15   0.2000   0.6914        [35m0.2466[0m       0.9129        0.2848        27.8108
     16   0.1989   0.6840        0.2467       0.9105        [94m0.2820[0m     +  27.5396
     17   0.2013   0.6888        0.2470       0.9105        0.2838        27.8746
     18   0.2024   0.6893        0.2467       0.9093        0.2832        27.6832
     19   0.2031   0.6956        [35m0.2460[0m       0.9129        0.2893        27.6973
     20   0.2037   0.6922        0.2465       0.9093        0.2873        27.7055
     21   0.2030   0.6893        0.2472       0.9105        0.2874        28.0550
     22   0.2023   0.6907        [35m0.2455[0m       0.9105        [94m0.2790[0m     +  27.6943
     23   0.2044   0.6939        0.2457       0.9129        0.2811        27.8764
     24   0.2017   0.6880        0.2467       0.9129        0.2800        27.5744
     25   0.2030   0.6876        0.2461       0.9093        [94m0.2783[0m     +  27.6618
     26   0.2033   0.6866        0.2455       0.9117        [94m0.2763[0m     +  27.5546
     27   0.2051   0.6920        0.2455       0.9105        0.2769        27.8440
     28   0.2060   0.6958        [35m0.2453[0m       0.9117        [94m0.2763[0m     +  27.5092
     29   0.2053   0.6847        [35m0.2446[0m       0.9129        [94m0.2755[0m     +  27.8883
     30   0.2058   0.6901        0.2466       0.9105        0.2773        27.6202
     31   0.2040   0.6870        0.2464       0.9129        [94m0.2748[0m     +  27.6664
     32   0.2022   0.6856        0.2454       0.9105        0.2754        27.8484
     33   0.2044   0.6912        [35m0.2444[0m       0.9129        0.2752        27.7430
     34   0.2052   0.6923        0.2460       0.9105        [94m0.2744[0m     +  27.7316
     35   0.2038   0.6897        0.2452       0.9093        0.2756        27.6400
     36   0.2060   0.6972        0.2458       0.9117        0.2749        27.9634
     37   0.2036   0.6943        0.2468       0.9105        [94m0.2739[0m     +  27.6825
     38   [36m0.2097[0m   0.6884        [35m0.2442[0m       0.9129        [94m0.2727[0m     +  27.7236
     39   0.2064   0.6934        0.2484       0.9129        0.2765        27.6319
     40   0.2058   0.6959        0.2460       0.9129        0.2779        27.6345
     41   0.2043   0.6912        0.2453       0.9129        0.2760        27.5646
     42   0.2033   0.6921        0.2465       0.9129        0.2759        27.8408
     43   0.2036   0.6951        0.2449       0.9105        0.2760        27.6455
     44   0.2047   0.6960        0.2454       0.9117        0.2731        27.6399
     45   0.2041   0.6954        0.2453       0.9129        [94m0.2719[0m     +  27.7518
     46   0.2033   0.6925        0.2446       0.9093        0.2740        27.6474
     47   0.2020   0.6875        0.2445       0.9117        0.2737        27.7192
     48   0.2045   0.6899        0.2451       0.9117        0.2722        27.5603
     49   0.2041   0.6885        0.2445       0.9117        0.2725        27.6376
     50   0.2009   0.6895        0.2448       0.9081        0.2733        27.6497
[32m[I 2023-05-05 02:30:53,561][0m Trial 528 finished with value: 0.271927000389422 and parameters: {'lr': 0.0016491987607830274, 'dropout': 0.38347250419888673, 'd_model_multiplier': 4, 'num_layers': 6, 'n_heads': 32, 'dim_feedforward': 428, 'batch_size': 73, 'pos_encoding': 'fixed', 'activation': 'relu', 'norm': 'LayerNorm', 'optimizer_name': 'AdamW', 'weight_decay': 0.1, 'top_n_features': 61}. Best is trial 246 with value: 0.16447311791139763.[0m
[FileBasedDataset] Initializing dataset...
	Examples: 8264
	Features: 49
	Max length: 315
Standard scalar turned ON, loading params from cache
[FileBasedDataset] Dataset initialization complete
Warning, assumed runtime error: CUDA out of memory. Tried to allocate 2.05 GiB (GPU 0; 23.70 GiB total capacity; 16.73 GiB already allocated; 369.25 MiB free; 22.25 GiB reserved in total by PyTorch) If reserved memory is >> allocated memory try setting max_split_size_mb to avoid fragmentation.  See documentation for Memory Management and PYTORCH_CUDA_ALLOC_CONF
[32m[I 2023-05-05 02:30:59,952][0m Trial 529 finished with value: 100.0 and parameters: {'lr': 0.000747048706949581, 'dropout': 0.2599352613984931, 'd_model_multiplier': 2, 'num_layers': 5, 'n_heads': 32, 'dim_feedforward': 322, 'batch_size': 173, 'pos_encoding': 'fixed', 'activation': 'relu', 'norm': 'LayerNorm', 'optimizer_name': 'RAdam', 'weight_decay': 0.1, 'top_n_features': 49}. Best is trial 246 with value: 0.16447311791139763.[0m
[FileBasedDataset] Initializing dataset...
	Examples: 8264
	Features: 70
	Max length: 315
Standard scalar turned ON, loading params from cache
[FileBasedDataset] Dataset initialization complete
  epoch    auprc    auroc    train_loss    valid_acc    valid_loss    cp      dur
-------  -------  -------  ------------  -----------  ------------  ----  -------
      1   [36m0.2308[0m   [32m0.6838[0m        [35m0.3852[0m       [31m0.9214[0m        [94m0.2564[0m     +  32.4282
      2   [36m0.2951[0m   [32m0.7503[0m        [35m0.2460[0m       0.9178        [94m0.2393[0m     +  32.3166
      3   [36m0.3019[0m   [32m0.7569[0m        [35m0.2371[0m       0.9202        [94m0.2389[0m     +  32.6285
      4   [36m0.3041[0m   [32m0.7607[0m        [35m0.2329[0m       0.9178        [94m0.2376[0m     +  32.7453
      5   [36m0.3127[0m   0.7600        [35m0.2305[0m       [31m0.9238[0m        0.2410        32.8284
      6   0.3083   0.7598        [35m0.2280[0m       0.9214        0.2430        32.7848
      7   0.3007   0.7594        [35m0.2265[0m       0.9166        0.2483        32.8813
      8   0.2965   [32m0.7673[0m        [35m0.2254[0m       0.9178        0.2470        33.0330
      9   0.2957   0.7554        [35m0.2252[0m       0.9166        0.2559        32.6590
     10   0.2902   0.7645        [35m0.2223[0m       0.9166        0.2481        32.9444
     11   0.2889   0.7595        [35m0.2215[0m       0.9214        0.2515        32.8040
     12   0.2882   0.7587        [35m0.2190[0m       0.9178        0.2538        32.7748
     13   0.2795   0.7661        [35m0.2184[0m       0.9166        0.2483        32.8911
Stopping since valid_loss has not improved in the last 10 epochs.
[32m[I 2023-05-05 02:38:39,355][0m Trial 530 finished with value: 0.23755438065442383 and parameters: {'lr': 7.296384823003803e-05, 'dropout': 0.46821083551315135, 'd_model_multiplier': 8, 'num_layers': 7, 'n_heads': 32, 'dim_feedforward': 207, 'batch_size': 60, 'pos_encoding': 'fixed', 'activation': 'relu', 'norm': 'LayerNorm', 'optimizer_name': 'PlainRAdam', 'weight_decay': 0.001, 'top_n_features': 70}. Best is trial 246 with value: 0.16447311791139763.[0m
[FileBasedDataset] Initializing dataset...
	Examples: 8264
	Features: 54
	Max length: 315
Standard scalar turned ON, loading params from cache
[FileBasedDataset] Dataset initialization complete
Warning, assumed runtime error: CUDA out of memory. Tried to allocate 5.89 GiB (GPU 0; 23.70 GiB total capacity; 20.47 GiB already allocated; 1.96 GiB free; 20.64 GiB reserved in total by PyTorch) If reserved memory is >> allocated memory try setting max_split_size_mb to avoid fragmentation.  See documentation for Memory Management and PYTORCH_CUDA_ALLOC_CONF
[32m[I 2023-05-05 02:38:46,119][0m Trial 531 finished with value: 100.0 and parameters: {'lr': 0.0001061235930204272, 'dropout': 0.41860064543465714, 'd_model_multiplier': 4, 'num_layers': 4, 'n_heads': 64, 'dim_feedforward': 352, 'batch_size': 249, 'pos_encoding': 'fixed', 'activation': 'relu', 'norm': 'LayerNorm', 'optimizer_name': 'RAdam', 'weight_decay': 0.1, 'top_n_features': 54}. Best is trial 246 with value: 0.16447311791139763.[0m
[FileBasedDataset] Initializing dataset...
	Examples: 8264
	Features: 80
	Max length: 315
Standard scalar turned ON, loading params from cache
[FileBasedDataset] Dataset initialization complete
  epoch    auprc    auroc    train_loss    valid_acc    valid_loss    cp      dur
-------  -------  -------  ------------  -----------  ------------  ----  -------
      1   [36m0.2791[0m   [32m0.7323[0m        [35m0.3137[0m       [31m0.9129[0m        [94m0.3373[0m     +  10.4992
      2   [36m0.3286[0m   [32m0.7428[0m        [35m0.2564[0m       [31m0.9214[0m        [94m0.3057[0m     +  10.7214
      3   [36m0.3454[0m   [32m0.7456[0m        [35m0.2515[0m       0.9214        [94m0.2867[0m     +  10.8038
      4   [36m0.3651[0m   [32m0.7493[0m        [35m0.2453[0m       0.9214        [94m0.2684[0m     +  10.9547
      5   [36m0.3766[0m   [32m0.7564[0m        [35m0.2408[0m       0.9214        [94m0.2557[0m     +  10.8660
      6   0.3690   0.7551        [35m0.2380[0m       0.9214        [94m0.2525[0m     +  11.6649
      7   0.3662   [32m0.7574[0m        [35m0.2343[0m       [31m0.9226[0m        0.2525        11.0289
      8   [36m0.3794[0m   [32m0.7625[0m        0.2353       0.9214        [94m0.2470[0m     +  10.8292
      9   0.3763   [32m0.7659[0m        [35m0.2302[0m       0.9214        [94m0.2446[0m     +  11.1017
     10   0.3655   0.7631        [35m0.2285[0m       0.9226        0.2463        10.8433
     11   0.3602   0.7653        [35m0.2226[0m       0.9202        0.2474        11.0446
     12   0.3619   0.7626        [35m0.2222[0m       0.9214        0.2459        10.9999
     13   0.3720   [32m0.7693[0m        0.2224       0.9190        [94m0.2420[0m     +  11.1428
     14   0.3602   0.7677        [35m0.2201[0m       0.9202        0.2428        11.1928
     15   0.3722   [32m0.7734[0m        [35m0.2158[0m       0.9226        [94m0.2411[0m     +  10.9819
     16   0.3577   0.7705        0.2174       0.9214        0.2437        10.8084
     17   0.3528   [32m0.7741[0m        [35m0.2149[0m       0.9202        0.2424        11.5373
     18   0.3528   0.7732        [35m0.2147[0m       0.9226        0.2428        11.2938
     19   0.3478   [32m0.7746[0m        [35m0.2100[0m       0.9214        0.2431        11.4305
     20   0.3386   0.7730        [35m0.2088[0m       0.9202        0.2448        10.8293
     21   0.3448   0.7714        0.2112       0.9226        0.2450        10.9560
     22   0.3343   0.7701        [35m0.2070[0m       0.9202        0.2471        11.2838
     23   0.3417   0.7699        [35m0.2060[0m       0.9226        0.2467        11.0948
     24   0.3319   0.7694        [35m0.2051[0m       0.9226        0.2475        11.0530
Stopping since valid_loss has not improved in the last 10 epochs.
[32m[I 2023-05-05 02:43:24,102][0m Trial 532 finished with value: 0.24114386382385494 and parameters: {'lr': 4.3363640590740356e-05, 'dropout': 0.40042439091519305, 'd_model_multiplier': 32, 'num_layers': 6, 'n_heads': 4, 'dim_feedforward': 314, 'batch_size': 36, 'pos_encoding': 'learnable', 'activation': 'gelu', 'norm': 'BatchNorm', 'optimizer_name': 'AdamW', 'weight_decay': 0.1, 'top_n_features': 80}. Best is trial 246 with value: 0.16447311791139763.[0m
[FileBasedDataset] Initializing dataset...
	Examples: 8264
	Features: 63
	Max length: 315
Standard scalar turned ON, loading params from cache
[FileBasedDataset] Dataset initialization complete
  epoch    auprc    auroc    train_loss    valid_acc    valid_loss    cp      dur
-------  -------  -------  ------------  -----------  ------------  ----  -------
      1   [36m0.0556[0m   [32m0.3013[0m        [35m0.6314[0m       [31m0.9274[0m        [94m0.4518[0m     +  19.8015
      2   [36m0.0978[0m   [32m0.5561[0m        [35m0.3682[0m       0.9274        [94m0.2776[0m     +  19.9681
      3   [36m0.1871[0m   [32m0.6832[0m        [35m0.2750[0m       0.9250        [94m0.2445[0m     +  20.0899
      4   [36m0.2075[0m   [32m0.7118[0m        [35m0.2516[0m       0.9214        [94m0.2377[0m     +  20.0074
      5   [36m0.2129[0m   [32m0.7254[0m        [35m0.2428[0m       0.9154        0.2381        20.2407
      6   [36m0.2179[0m   [32m0.7304[0m        [35m0.2374[0m       0.9178        0.2382        20.0488
      7   [36m0.2270[0m   [32m0.7358[0m        [35m0.2355[0m       0.9190        0.2387        20.1535
      8   [36m0.2333[0m   [32m0.7395[0m        [35m0.2331[0m       0.9202        [94m0.2366[0m     +  20.1341
      9   [36m0.2376[0m   [32m0.7435[0m        [35m0.2319[0m       0.9190        [94m0.2363[0m     +  19.9454
     10   [36m0.2399[0m   [32m0.7458[0m        [35m0.2307[0m       0.9190        0.2374        20.5440
     11   [36m0.2483[0m   [32m0.7485[0m        [35m0.2305[0m       0.9202        [94m0.2362[0m     +  20.2144
     12   [36m0.2525[0m   [32m0.7511[0m        [35m0.2301[0m       0.9214        [94m0.2355[0m     +  19.9687
     13   0.2506   [32m0.7522[0m        [35m0.2275[0m       0.9226        [94m0.2352[0m     +  20.0586
     14   0.2511   [32m0.7534[0m        [35m0.2269[0m       0.9238        0.2355        20.1961
     15   0.2466   [32m0.7572[0m        0.2271       0.9226        [94m0.2350[0m     +  20.0681
     16   0.2492   [32m0.7585[0m        0.2273       0.9226        0.2351        20.0287
     17   0.2521   [32m0.7592[0m        0.2270       0.9226        0.2353        19.9777
     18   0.2481   [32m0.7600[0m        [35m0.2253[0m       0.9226        0.2363        20.1210
     19   [36m0.2542[0m   [32m0.7625[0m        0.2255       0.9202        0.2361        20.1846
     20   0.2525   [32m0.7632[0m        [35m0.2246[0m       0.9202        0.2358        20.1022
     21   0.2530   [32m0.7642[0m        [35m0.2243[0m       0.9202        0.2373        20.0949
     22   0.2535   [32m0.7667[0m        [35m0.2228[0m       0.9214        0.2351        20.1939
     23   0.2527   [32m0.7673[0m        [35m0.2223[0m       0.9214        0.2377        20.0289
     24   [36m0.2572[0m   [32m0.7708[0m        [35m0.2213[0m       0.9202        0.2352        19.9486
Stopping since valid_loss has not improved in the last 10 epochs.
[32m[I 2023-05-05 02:51:47,274][0m Trial 533 finished with value: 0.2350248522344783 and parameters: {'lr': 1.7577620935507155e-05, 'dropout': 0.35322250876783007, 'd_model_multiplier': 4, 'num_layers': 4, 'n_heads': 32, 'dim_feedforward': 442, 'batch_size': 50, 'pos_encoding': 'fixed', 'activation': 'relu', 'norm': 'LayerNorm', 'optimizer_name': 'RAdam', 'weight_decay': 0.1, 'top_n_features': 63}. Best is trial 246 with value: 0.16447311791139763.[0m
[FileBasedDataset] Initializing dataset...
	Examples: 8264
	Features: 43
	Max length: 315
Standard scalar turned ON, loading params from cache
[FileBasedDataset] Dataset initialization complete
  epoch    auprc    auroc    train_loss    valid_acc    valid_loss    cp      dur
-------  -------  -------  ------------  -----------  ------------  ----  -------
      1   [36m0.1906[0m   [32m0.7291[0m        [35m0.2675[0m       [31m0.9081[0m        [94m0.2627[0m     +  23.6444
      2   [36m0.2022[0m   [32m0.7367[0m        [35m0.2382[0m       [31m0.9129[0m        [94m0.2557[0m     +  23.9401
      3   [36m0.2069[0m   [32m0.7406[0m        [35m0.2345[0m       0.9129        0.2593        23.8794
      4   [36m0.2117[0m   [32m0.7458[0m        [35m0.2343[0m       [31m0.9154[0m        [94m0.2548[0m     +  24.0427
      5   [36m0.2129[0m   [32m0.7464[0m        [35m0.2323[0m       0.9154        [94m0.2540[0m     +  24.2292
      6   [36m0.2173[0m   0.7462        [35m0.2299[0m       0.9105        [94m0.2539[0m     +  24.1400
      7   [36m0.2202[0m   0.7460        [35m0.2292[0m       0.9093        0.2585        24.2713
      8   0.2129   0.7457        [35m0.2260[0m       0.9081        0.2622        24.1626
      9   [36m0.2272[0m   [32m0.7578[0m        0.2263       0.9141        [94m0.2532[0m     +  24.3772
     10   0.2185   0.7552        [35m0.2238[0m       0.9129        0.2630        24.3780
     11   0.2191   0.7553        [35m0.2228[0m       0.9093        0.2683        24.0769
     12   0.2231   0.7538        [35m0.2211[0m       0.9141        0.2741        24.0584
     13   0.2268   [32m0.7619[0m        [35m0.2203[0m       0.9129        0.2708        24.2185
     14   0.2238   [32m0.7625[0m        0.2209       0.9081        0.2700        24.1103
     15   [36m0.2283[0m   0.7599        [35m0.2153[0m       0.9129        0.2728        24.3739
     16   0.2234   0.7558        0.2175       0.9129        0.2764        23.8823
     17   0.2120   0.7605        [35m0.2153[0m       0.9069        0.2790        23.8804
     18   0.2183   0.7586        0.2154       0.9045        0.2851        24.0623
Stopping since valid_loss has not improved in the last 10 epochs.
[32m[I 2023-05-05 02:59:26,378][0m Trial 534 finished with value: 0.25323859770684315 and parameters: {'lr': 0.0002590101776087858, 'dropout': 0.43572326941159634, 'd_model_multiplier': 4, 'num_layers': 5, 'n_heads': 32, 'dim_feedforward': 392, 'batch_size': 77, 'pos_encoding': 'fixed', 'activation': 'relu', 'norm': 'LayerNorm', 'optimizer_name': 'AdamW', 'weight_decay': 0.1, 'top_n_features': 43}. Best is trial 246 with value: 0.16447311791139763.[0m
[FileBasedDataset] Initializing dataset...
	Examples: 8264
	Features: 87
	Max length: 315
Standard scalar turned ON, loading params from cache
[FileBasedDataset] Dataset initialization complete
Warning, assumed runtime error: CUDA out of memory. Tried to allocate 2.83 GiB (GPU 0; 23.70 GiB total capacity; 16.38 GiB already allocated; 2.05 GiB free; 20.55 GiB reserved in total by PyTorch) If reserved memory is >> allocated memory try setting max_split_size_mb to avoid fragmentation.  See documentation for Memory Management and PYTORCH_CUDA_ALLOC_CONF
