[32m[I 2023-05-03 02:44:47,801][0m Trial 253 finished with value: 0.2771705156766518 and parameters: {'lr': 0.0004036953111734069, 'dropout': 0.4963650490250687, 'd_model_multiplier': 8, 'num_layers': 4, 'n_heads': 32, 'dim_feedforward': 211, 'batch_size': 32, 'pos_encoding': 'fixed', 'activation': 'gelu', 'norm': 'BatchNorm', 'optimizer_name': 'PlainRAdam', 'weight_decay': 0.1, 'top_n_features': 117}. Best is trial 246 with value: 0.16447311791139763.[0m
[FileBasedDataset] Initializing dataset...
	Examples: 8264
	Features: 77
	Max length: 315
Standard scalar turned ON, loading params from cache
[FileBasedDataset] Dataset initialization complete
  epoch    auprc    auroc    train_loss    valid_acc    valid_loss    cp     dur
-------  -------  -------  ------------  -----------  ------------  ----  ------
      1   [36m0.0793[0m   [32m0.4937[0m        [35m0.4671[0m       [31m0.9190[0m        [94m0.4118[0m     +  9.3686
      2   [36m0.2885[0m   [32m0.7644[0m        [35m0.2833[0m       0.9190        [94m0.3224[0m     +  9.5890
      3   [36m0.3052[0m   [32m0.7787[0m        [35m0.2630[0m       [31m0.9202[0m        [94m0.2773[0m     +  9.4958
      4   0.2828   [32m0.7791[0m        [35m0.2555[0m       0.9190        [94m0.2601[0m     +  9.7267
      5   0.2940   [32m0.7901[0m        [35m0.2526[0m       0.9190        [94m0.2537[0m     +  9.9230
      6   0.3017   [32m0.7960[0m        [35m0.2493[0m       0.9190        [94m0.2519[0m     +  9.9292
      7   0.3041   [32m0.8001[0m        [35m0.2452[0m       0.9190        [94m0.2465[0m     +  9.8089
      8   0.3046   [32m0.8030[0m        [35m0.2435[0m       0.9202        [94m0.2380[0m     +  9.6126
      9   [36m0.3116[0m   0.8027        [35m0.2375[0m       [31m0.9214[0m        [94m0.2378[0m     +  9.6277
     10   0.3102   0.7995        0.2401       0.9214        0.2383        9.7618
     11   [36m0.3131[0m   [32m0.8051[0m        [35m0.2363[0m       0.9214        [94m0.2345[0m     +  9.5631
     12   [36m0.3164[0m   0.7951        0.2370       0.9202        0.2360        9.4937
     13   0.3142   0.8035        0.2364       0.9190        0.2350        9.7262
     14   [36m0.3323[0m   [32m0.8134[0m        [35m0.2361[0m       0.9214        [94m0.2324[0m     +  9.6386
     15   [36m0.3330[0m   [32m0.8136[0m        [35m0.2356[0m       0.9202        0.2334        9.8631
     16   [36m0.3340[0m   [32m0.8184[0m        0.2358       0.9202        [94m0.2307[0m     +  9.8601
     17   [36m0.3412[0m   0.8138        [35m0.2334[0m       0.9178        [94m0.2297[0m     +  9.5546
     18   0.3331   0.8176        [35m0.2331[0m       0.9190        0.2309        10.1128
     19   0.3376   [32m0.8222[0m        [35m0.2297[0m       0.9178        [94m0.2286[0m     +  10.0065
     20   [36m0.3625[0m   [32m0.8256[0m        [35m0.2294[0m       0.9190        [94m0.2253[0m     +  10.0715
     21   0.3524   0.8213        [35m0.2279[0m       0.9129        0.2273        9.9336
     22   0.3513   0.8241        0.2301       0.9154        0.2262        9.7789
     23   0.3571   [32m0.8278[0m        0.2290       0.9178        [94m0.2248[0m     +  9.8419
     24   0.3611   0.8272        [35m0.2253[0m       0.9154        0.2257        9.9538
     25   [36m0.3655[0m   [32m0.8303[0m        0.2257       0.9154        [94m0.2245[0m     +  9.5419
     26   0.3610   0.8283        [35m0.2238[0m       0.9178        [94m0.2243[0m     +  9.8455
     27   [36m0.3681[0m   0.8296        0.2264       0.9214        0.2258        9.6654
     28   [36m0.3811[0m   [32m0.8337[0m        [35m0.2236[0m       [31m0.9238[0m        [94m0.2226[0m     +  9.9706
     29   0.3733   0.8294        [35m0.2233[0m       0.9226        0.2244        9.7152
     30   0.3761   0.8323        [35m0.2192[0m       0.9190        [94m0.2225[0m     +  9.5496
     31   0.3795   0.8324        0.2214       0.9178        [94m0.2220[0m     +  9.9165
     32   0.3797   0.8328        [35m0.2188[0m       0.9190        [94m0.2215[0m     +  9.8641
     33   0.3657   [32m0.8343[0m        0.2221       0.9178        0.2237        9.7519
     34   0.3765   0.8307        0.2205       0.9190        0.2232        9.5954
     35   [36m0.3901[0m   [32m0.8347[0m        0.2194       0.9214        [94m0.2214[0m     +  9.7942
     36   0.3676   0.8332        [35m0.2162[0m       0.9190        0.2231        9.9244
     37   0.3728   [32m0.8370[0m        0.2200       0.9202        0.2229        9.6384
     38   0.3782   0.8368        0.2181       0.9190        0.2228        9.7710
     39   0.3785   0.8357        0.2164       0.9214        [94m0.2203[0m     +  9.8977
     40   0.3856   [32m0.8381[0m        [35m0.2148[0m       0.9202        0.2215        9.6166
     41   0.3824   0.8364        0.2161       [31m0.9262[0m        0.2204        9.8537
     42   0.3800   0.8370        [35m0.2143[0m       0.9214        0.2205        9.9485
     43   0.3861   [32m0.8408[0m        0.2148       0.9226        0.2213        9.7604
     44   0.3840   [32m0.8426[0m        [35m0.2136[0m       0.9214        0.2211        10.1962
     45   0.3871   [32m0.8438[0m        [35m0.2133[0m       0.9190        [94m0.2203[0m     +  9.8381
     46   0.3831   0.8432        [35m0.2131[0m       0.9238        0.2211        9.6572
     47   0.3846   [32m0.8448[0m        [35m0.2129[0m       0.9214        0.2225        9.7440
     48   0.3850   0.8446        [35m0.2110[0m       0.9238        0.2215        9.8177
     49   0.3859   [32m0.8453[0m        0.2122       0.9214        0.2209        9.7401
     50   0.3852   [32m0.8472[0m        0.2123       0.9238        0.2213        9.7274
[32m[I 2023-05-03 02:52:57,780][0m Trial 254 finished with value: 0.22025385014307397 and parameters: {'lr': 0.0005517159302421032, 'dropout': 0.48184390954548084, 'd_model_multiplier': 4, 'num_layers': 2, 'n_heads': 8, 'dim_feedforward': 402, 'batch_size': 101, 'pos_encoding': 'fixed', 'activation': 'gelu', 'norm': 'BatchNorm', 'optimizer_name': 'PlainRAdam', 'weight_decay': 0.01, 'top_n_features': 77}. Best is trial 246 with value: 0.16447311791139763.[0m
[FileBasedDataset] Initializing dataset...
	Examples: 8264
	Features: 85
	Max length: 315
Standard scalar turned ON, loading params from cache
[FileBasedDataset] Dataset initialization complete
  epoch    auprc    auroc    train_loss    valid_acc    valid_loss    cp      dur
-------  -------  -------  ------------  -----------  ------------  ----  -------
      1   [36m0.3490[0m   [32m0.7156[0m        [35m0.3027[0m       [31m0.9287[0m        [94m0.2477[0m     +  31.0532
      2   0.3429   0.7090        [35m0.2710[0m       0.9250        0.2557        31.2611
      3   0.3194   0.7136        [35m0.2639[0m       [31m0.9335[0m        0.2743        31.2326
      4   0.3207   0.6967        0.2651       0.9299        0.2749        31.1712
      5   0.3016   0.6686        [35m0.2624[0m       0.9287        0.3154        31.3684
      6   [36m0.3575[0m   0.6766        [35m0.2591[0m       0.9299        0.3223        31.3216
      7   0.2896   0.7000        0.2600       0.9081        0.3538        31.2338
      8   0.2874   0.6918        [35m0.2587[0m       0.9262        0.3069        31.2498
      9   0.2923   0.6955        [35m0.2568[0m       0.9287        0.2922        31.1851
     10   0.2451   0.6105        0.2592       0.9214        0.3617        31.2392
Stopping since valid_loss has not improved in the last 10 epochs.
[32m[I 2023-05-03 02:58:41,867][0m Trial 255 finished with value: 0.247683584527929 and parameters: {'lr': 0.0002010870482035013, 'dropout': 0.4492969628351782, 'd_model_multiplier': 8, 'num_layers': 3, 'n_heads': 64, 'dim_feedforward': 255, 'batch_size': 15, 'pos_encoding': 'learnable', 'activation': 'gelu', 'norm': 'BatchNorm', 'optimizer_name': 'RAdam', 'weight_decay': 0.1, 'top_n_features': 85}. Best is trial 246 with value: 0.16447311791139763.[0m
[FileBasedDataset] Initializing dataset...
	Examples: 8264
	Features: 57
	Max length: 315
Standard scalar turned ON, loading params from cache
[FileBasedDataset] Dataset initialization complete
  epoch    auprc    auroc    train_loss    valid_acc    valid_loss    cp     dur
-------  -------  -------  ------------  -----------  ------------  ----  ------
      1   [36m0.3045[0m   [32m0.7623[0m        [35m0.2844[0m       [31m0.9287[0m        [94m0.2414[0m     +  9.9269
      2   [36m0.3183[0m   [32m0.7794[0m        [35m0.2556[0m       0.9262        0.2539        10.5146
      3   0.3086   0.7689        [35m0.2468[0m       0.9262        0.2840        10.3731
      4   0.2633   0.6882        [35m0.2451[0m       [31m0.9347[0m        0.3100        10.7627
      5   0.2757   0.7090        [35m0.2404[0m       0.9299        0.3821        10.6460
      6   0.2722   0.7002        0.2466       0.9178        0.3515        10.6375
      7   0.2792   0.7565        0.2461       0.9117        0.3526        10.7669
      8   0.2530   0.6959        0.2516       0.9323        0.3045        10.6460
      9   0.3054   0.7711        0.2415       0.8767        0.3926        10.6084
     10   0.3099   [32m0.7919[0m        0.2405       0.9069        0.2801        10.4709
Stopping since valid_loss has not improved in the last 10 epochs.
[32m[I 2023-05-03 03:00:37,976][0m Trial 256 finished with value: 0.241392141349947 and parameters: {'lr': 0.00171045840645196, 'dropout': 0.3966971677356514, 'd_model_multiplier': 8, 'num_layers': 1, 'n_heads': 32, 'dim_feedforward': 243, 'batch_size': 85, 'pos_encoding': 'fixed', 'activation': 'gelu', 'norm': 'BatchNorm', 'optimizer_name': 'PlainRAdam', 'weight_decay': 0.1, 'top_n_features': 57}. Best is trial 246 with value: 0.16447311791139763.[0m
[FileBasedDataset] Initializing dataset...
	Examples: 8264
	Features: 145
	Max length: 315
Standard scalar turned ON, loading params from cache
[FileBasedDataset] Dataset initialization complete
  epoch    auprc    auroc    train_loss    valid_acc    valid_loss    cp      dur
-------  -------  -------  ------------  -----------  ------------  ----  -------
      1   [36m0.2269[0m   [32m0.7708[0m        [35m0.3205[0m       [31m0.9105[0m        [94m0.3128[0m     +  16.8918
      2   [36m0.2474[0m   0.7592        [35m0.2503[0m       [31m0.9154[0m        [94m0.3040[0m     +  16.9365
      3   [36m0.2528[0m   0.7459        [35m0.2439[0m       [31m0.9178[0m        [94m0.2903[0m     +  17.1295
      4   0.2389   0.7402        [35m0.2401[0m       0.9141        0.3076        17.3068
      5   0.2450   0.7284        0.2404       [31m0.9190[0m        [94m0.2782[0m     +  17.2479
      6   0.2286   0.7223        [35m0.2336[0m       0.9190        0.2906        17.3028
      7   0.2512   0.7304        0.2346       0.9154        0.3059        17.4385
      8   0.2424   0.7339        [35m0.2328[0m       0.9154        [94m0.2744[0m     +  17.1227
      9   0.2339   0.7095        [35m0.2321[0m       0.9190        0.2912        17.3119
     10   0.2227   0.6903        [35m0.2318[0m       0.9166        0.3032        17.3449
     11   0.2395   0.6920        0.2325       0.9154        0.3117        17.2302
     12   0.2447   0.7044        0.2333       0.9129        0.3444        17.3429
     13   0.2345   0.7057        [35m0.2259[0m       0.9105        0.3247        17.2218
     14   0.2319   0.7014        0.2283       0.9178        0.3076        17.3665
     15   0.2370   0.6707        0.2274       0.9141        0.2980        17.3928
     16   0.2235   0.6549        0.2277       0.9166        0.3293        17.3519
     17   [36m0.2574[0m   0.7060        [35m0.2223[0m       0.9154        0.2841        16.9838
Stopping since valid_loss has not improved in the last 10 epochs.
[32m[I 2023-05-03 03:05:48,786][0m Trial 257 finished with value: 0.2743919920063653 and parameters: {'lr': 0.0007249270205383035, 'dropout': 0.4660797812671483, 'd_model_multiplier': 4, 'num_layers': 3, 'n_heads': 32, 'dim_feedforward': 349, 'batch_size': 65, 'pos_encoding': 'fixed', 'activation': 'gelu', 'norm': 'BatchNorm', 'optimizer_name': 'PlainRAdam', 'weight_decay': 0.01, 'top_n_features': 145}. Best is trial 246 with value: 0.16447311791139763.[0m
[FileBasedDataset] Initializing dataset...
	Examples: 8264
	Features: 217
	Max length: 315
Standard scalar turned ON, loading params from cache
[FileBasedDataset] Dataset initialization complete
Warning, assumed runtime error: CUDA out of memory. Tried to allocate 2.44 GiB (GPU 0; 23.70 GiB total capacity; 21.52 GiB already allocated; 985.25 MiB free; 21.64 GiB reserved in total by PyTorch) If reserved memory is >> allocated memory try setting max_split_size_mb to avoid fragmentation.  See documentation for Memory Management and PYTORCH_CUDA_ALLOC_CONF
[32m[I 2023-05-03 03:05:55,581][0m Trial 258 finished with value: 100.0 and parameters: {'lr': 0.0011313698288816561, 'dropout': 0.2118780780134212, 'd_model_multiplier': 8, 'num_layers': 4, 'n_heads': 32, 'dim_feedforward': 338, 'batch_size': 206, 'pos_encoding': 'learnable', 'activation': 'gelu', 'norm': 'BatchNorm', 'optimizer_name': 'PlainRAdam', 'weight_decay': 0.1, 'top_n_features': 217}. Best is trial 246 with value: 0.16447311791139763.[0m
[FileBasedDataset] Initializing dataset...
	Examples: 8264
	Features: 49
	Max length: 315
Standard scalar turned ON, loading params from cache
[FileBasedDataset] Dataset initialization complete
  epoch    auprc    auroc    train_loss    valid_acc    valid_loss    cp     dur
-------  -------  -------  ------------  -----------  ------------  ----  ------
      1   [36m0.3137[0m   [32m0.7901[0m        [35m0.2821[0m       [31m0.9166[0m        [94m0.2392[0m     +  8.1206
      2   [36m0.3315[0m   [32m0.8040[0m        [35m0.2434[0m       0.9166        [94m0.2369[0m     +  8.2988
      3   [36m0.3500[0m   [32m0.8071[0m        [35m0.2387[0m       0.9117        0.2385        8.2548
      4   [36m0.3576[0m   [32m0.8115[0m        [35m0.2378[0m       [31m0.9214[0m        [94m0.2320[0m     +  8.3519
      5   [36m0.3628[0m   [32m0.8163[0m        [35m0.2339[0m       [31m0.9250[0m        0.2344        8.8965
      6   [36m0.3735[0m   [32m0.8203[0m        [35m0.2337[0m       [31m0.9274[0m        [94m0.2300[0m     +  8.8184
      7   0.3727   [32m0.8208[0m        0.2347       0.9274        0.2307        9.1260
      8   [36m0.3765[0m   [32m0.8223[0m        0.2367       0.9238        0.2316        9.0569
      9   0.3736   0.8193        0.2339       [31m0.9287[0m        0.2327        9.2314
     10   0.3726   0.8214        [35m0.2317[0m       0.9262        0.2335        9.4786
     11   0.3746   [32m0.8250[0m        [35m0.2292[0m       0.9226        0.2340        9.3298
     12   0.3666   [32m0.8252[0m        [35m0.2282[0m       0.9226        0.2344        9.6154
     13   0.3672   [32m0.8278[0m        0.2301       0.9238        0.2322        9.5726
     14   [36m0.3807[0m   [32m0.8292[0m        0.2290       0.9154        0.2358        9.7494
     15   [36m0.3879[0m   0.8290        [35m0.2273[0m       0.9238        [94m0.2270[0m     +  9.3643
     16   [36m0.3986[0m   [32m0.8350[0m        [35m0.2254[0m       0.9250        0.2305        9.4749
     17   [36m0.4079[0m   0.8334        0.2270       0.9238        0.2295        9.4695
     18   0.4063   [32m0.8369[0m        [35m0.2239[0m       0.9226        0.2294        9.8143
     19   0.4063   0.8330        0.2239       0.9214        0.2342        9.2889
     20   0.3969   0.8311        [35m0.2213[0m       0.9238        0.2318        9.6039
     21   0.3969   0.8326        0.2226       0.9262        0.2284        9.3047
     22   0.3980   0.8321        [35m0.2211[0m       0.9226        0.2308        9.3824
     23   0.3881   0.8342        0.2217       0.9214        0.2380        9.3357
     24   0.3987   [32m0.8443[0m        [35m0.2200[0m       0.9238        0.2287        9.7299
Stopping since valid_loss has not improved in the last 10 epochs.
[32m[I 2023-05-03 03:09:46,148][0m Trial 259 finished with value: 0.22703737207883215 and parameters: {'lr': 0.0003162004671996509, 'dropout': 0.524497476639575, 'd_model_multiplier': 8, 'num_layers': 2, 'n_heads': 8, 'dim_feedforward': 146, 'batch_size': 73, 'pos_encoding': 'fixed', 'activation': 'relu', 'norm': 'LayerNorm', 'optimizer_name': 'AdamW', 'weight_decay': 0.001, 'top_n_features': 49}. Best is trial 246 with value: 0.16447311791139763.[0m
[FileBasedDataset] Initializing dataset...
	Examples: 8264
	Features: 124
	Max length: 315
Standard scalar turned ON, loading params from cache
[FileBasedDataset] Dataset initialization complete
  epoch    auprc    auroc    train_loss    valid_acc    valid_loss    cp     dur
-------  -------  -------  ------------  -----------  ------------  ----  ------
      1   [36m0.1330[0m   [32m0.6717[0m        [35m0.3547[0m       [31m0.9299[0m        [94m0.3224[0m     +  9.1983
      2   [36m0.1615[0m   [32m0.7183[0m        [35m0.2592[0m       0.9238        [94m0.3002[0m     +  9.3767
      3   [36m0.1794[0m   [32m0.7338[0m        [35m0.2501[0m       0.9214        [94m0.2883[0m     +  9.3490
      4   [36m0.1952[0m   [32m0.7376[0m        [35m0.2474[0m       0.9262        [94m0.2769[0m     +  9.3176
      5   [36m0.2066[0m   0.7369        [35m0.2440[0m       0.9214        0.2815        9.2990
      6   [36m0.2087[0m   0.7356        [35m0.2414[0m       0.9250        [94m0.2740[0m     +  9.3464
      7   [36m0.2136[0m   0.7372        [35m0.2393[0m       0.9226        0.2757        9.4272
      8   [36m0.2142[0m   0.7292        0.2393       0.9250        [94m0.2722[0m     +  9.5799
      9   0.2106   0.7299        [35m0.2381[0m       0.9287        0.2776        9.5545
     10   [36m0.2207[0m   0.7323        [35m0.2337[0m       0.9262        0.2785        9.7681
     11   0.2191   0.7321        [35m0.2337[0m       0.9274        0.2780        9.6348
     12   [36m0.2267[0m   0.7289        [35m0.2325[0m       [31m0.9323[0m        [94m0.2716[0m     +  9.6345
     13   0.2258   0.7270        [35m0.2313[0m       0.9250        0.2751        9.6759
     14   0.2230   0.7229        [35m0.2299[0m       0.9238        0.2800        9.3815
     15   0.2196   0.7184        0.2311       0.9287        0.2777        9.5539
     16   0.2221   0.7225        [35m0.2270[0m       0.9262        0.2822        9.4537
     17   [36m0.2366[0m   0.7295        [35m0.2261[0m       0.9250        0.2834        9.3644
     18   [36m0.2396[0m   0.7244        0.2279       0.9274        0.2860        9.3573
     19   0.2291   0.7192        0.2272       0.9287        0.2757        9.2678
     20   0.2348   0.7197        [35m0.2229[0m       0.9287        0.2716        9.6109
     21   0.2314   0.7215        0.2244       0.9226        0.2848        9.3753
Stopping since valid_loss has not improved in the last 10 epochs.
[32m[I 2023-05-03 03:13:14,919][0m Trial 260 finished with value: 0.2715612587574171 and parameters: {'lr': 9.527861051784062e-05, 'dropout': 0.48188153850170334, 'd_model_multiplier': 4, 'num_layers': 1, 'n_heads': 32, 'dim_feedforward': 512, 'batch_size': 24, 'pos_encoding': 'fixed', 'activation': 'gelu', 'norm': 'BatchNorm', 'optimizer_name': 'PlainRAdam', 'weight_decay': 0.1, 'top_n_features': 124}. Best is trial 246 with value: 0.16447311791139763.[0m
[FileBasedDataset] Initializing dataset...
	Examples: 8264
	Features: 236
	Max length: 315
Standard scalar turned ON, loading params from cache
[FileBasedDataset] Dataset initialization complete
  epoch    auprc    auroc    train_loss    valid_acc    valid_loss    cp      dur
-------  -------  -------  ------------  -----------  ------------  ----  -------
      1   [36m0.1720[0m   [32m0.6078[0m        [35m0.3396[0m       [31m0.8960[0m        [94m0.2957[0m     +  16.6710
      2   [36m0.1859[0m   [32m0.7016[0m        [35m0.2857[0m       [31m0.8984[0m        [94m0.2806[0m     +  16.8721
      3   0.1793   0.6629        0.5155       0.8888        0.2960        16.8709
      4   0.1744   0.6522        0.6176       0.8948        0.2903        16.9656
      5   0.1669   0.6569        0.6164       0.8561        0.3348        16.8759
      6   0.1678   0.6543        0.5643       [31m0.9081[0m        [94m0.2790[0m     +  16.7273
      7   [36m0.1917[0m   0.6289        0.5099       [31m0.9214[0m        [94m0.2701[0m     +  16.8907
      8   0.1772   0.6544        0.5192       0.9166        0.2745        17.0005
      9   0.1793   0.6522        0.5065       0.8730        0.3299        17.0269
     10   0.1798   0.6561        0.4589       0.9105        0.2805        16.8853
     11   0.1857   0.6522        0.4506       0.9057        0.2979        16.7859
     12   0.1747   0.6523        0.4789       0.9105        0.2831        16.9456
     13   0.1482   0.5783        0.4771       0.9202        0.3072        16.8850
     14   0.1809   0.6198        0.4941       0.8996        0.3231        16.8701
     15   0.1769   0.6433        0.5075       0.9190        0.2748        16.8484
     16   0.1873   0.6446        0.4766       0.8996        0.2921        16.8572
Stopping since valid_loss has not improved in the last 10 epochs.
