[32m[I 2023-05-05 01:11:31,072][0m Trial 521 finished with value: 0.23646133375931824 and parameters: {'lr': 3.1298397162183098e-06, 'dropout': 0.41259927480800057, 'd_model_multiplier': 4, 'num_layers': 5, 'n_heads': 8, 'dim_feedforward': 387, 'batch_size': 54, 'pos_encoding': 'fixed', 'activation': 'relu', 'norm': 'LayerNorm', 'optimizer_name': 'RAdam', 'weight_decay': 0.1, 'top_n_features': 63}. Best is trial 246 with value: 0.16447311791139763.[0m
[FileBasedDataset] Initializing dataset...
	Examples: 8264
	Features: 55
	Max length: 315
Standard scalar turned ON, loading params from cache
[FileBasedDataset] Dataset initialization complete
  epoch    auprc    auroc    train_loss    valid_acc    valid_loss    cp     dur
-------  -------  -------  ------------  -----------  ------------  ----  ------
      1   [36m0.0714[0m   [32m0.4098[0m        [35m0.6542[0m       [31m0.7896[0m        [94m0.6747[0m     +  8.5053
      2   0.0558   0.3113        [35m0.5832[0m       [31m0.9141[0m        [94m0.6531[0m     +  9.2403
      3   0.0558   0.3108        [35m0.4964[0m       [31m0.9202[0m        [94m0.6115[0m     +  9.4546
      4   0.0578   0.3439        [35m0.4153[0m       [31m0.9214[0m        [94m0.5558[0m     +  9.0506
      5   0.0653   [32m0.4154[0m        [35m0.3583[0m       0.9214        [94m0.5049[0m     +  9.3036
      6   [36m0.1084[0m   [32m0.5290[0m        [35m0.3232[0m       0.9214        [94m0.4664[0m     +  9.1898
      7   [36m0.1793[0m   [32m0.5883[0m        [35m0.3004[0m       0.9214        [94m0.4547[0m     +  9.3410
      8   [36m0.2040[0m   [32m0.6462[0m        [35m0.2862[0m       0.9214        [94m0.4272[0m     +  9.6553
      9   [36m0.2083[0m   [32m0.6692[0m        [35m0.2762[0m       0.9214        [94m0.3975[0m     +  9.6297
     10   0.2057   [32m0.6853[0m        [35m0.2699[0m       0.9214        [94m0.3791[0m     +  9.5613
     11   [36m0.2163[0m   [32m0.7081[0m        0.2714       0.9214        0.4040        9.5319
     12   0.2154   [32m0.7100[0m        [35m0.2651[0m       0.9214        [94m0.3604[0m     +  9.4220
     13   [36m0.2204[0m   [32m0.7291[0m        [35m0.2618[0m       0.9214        [94m0.3141[0m     +  9.8287
     14   0.2109   [32m0.7340[0m        [35m0.2613[0m       0.9214        0.3180        9.5377
     15   0.2202   [32m0.7378[0m        [35m0.2563[0m       0.9214        [94m0.2880[0m     +  9.6145
     16   [36m0.2233[0m   [32m0.7410[0m        0.2587       0.9214        0.3139        9.3638
     17   [36m0.2297[0m   [32m0.7525[0m        [35m0.2525[0m       0.9214        0.3017        9.2847
     18   [36m0.2329[0m   0.7487        0.2559       0.9214        0.3055        9.5485
     19   0.2272   [32m0.7573[0m        0.2564       0.9214        0.2913        9.3608
     20   0.2199   0.7488        0.2569       0.9214        0.3056        9.2622
     21   [36m0.2366[0m   [32m0.7608[0m        [35m0.2520[0m       0.9214        [94m0.2839[0m     +  9.5611
     22   [36m0.2407[0m   0.7596        [35m0.2518[0m       0.9214        [94m0.2808[0m     +  9.7413
     23   [36m0.2413[0m   [32m0.7642[0m        [35m0.2512[0m       0.9202        [94m0.2672[0m     +  9.6550
     24   [36m0.2481[0m   [32m0.7669[0m        [35m0.2502[0m       0.9190        0.2712        9.6530
     25   0.2393   0.7622        [35m0.2483[0m       0.9214        0.2673        9.9546
     26   0.2470   0.7663        [35m0.2472[0m       [31m0.9226[0m        0.2711        9.4819
     27   0.2434   [32m0.7685[0m        0.2477       0.9226        0.2684        9.3555
     28   0.2449   [32m0.7688[0m        [35m0.2452[0m       0.9226        [94m0.2548[0m     +  9.4256
     29   [36m0.2511[0m   [32m0.7705[0m        [35m0.2431[0m       0.9214        0.2594        9.2238
     30   0.2448   0.7675        0.2466       0.9226        0.2599        9.1921
     31   [36m0.2522[0m   [32m0.7730[0m        0.2435       0.9190        0.2601        9.1024
     32   0.2481   0.7706        [35m0.2419[0m       0.9214        0.2565        9.0623
     33   0.2482   0.7719        0.2428       0.9214        [94m0.2495[0m     +  9.2978
     34   0.2498   [32m0.7746[0m        0.2435       0.9214        0.2523        9.6477
     35   0.2414   0.7702        [35m0.2417[0m       0.9226        0.2505        9.3637
     36   0.2480   0.7746        0.2419       0.9202        0.2511        9.5731
     37   0.2498   0.7738        [35m0.2409[0m       0.9226        0.2503        9.8109
     38   [36m0.2582[0m   [32m0.7805[0m        0.2450       0.9190        0.2568        9.5598
     39   0.2563   0.7775        [35m0.2403[0m       0.9214        [94m0.2463[0m     +  10.0343
     40   0.2505   0.7754        0.2412       0.9226        0.2479        9.5245
     41   0.2504   0.7754        [35m0.2373[0m       0.9226        0.2470        9.6981
     42   0.2521   0.7780        0.2373       0.9226        [94m0.2424[0m     +  9.6132
     43   0.2524   0.7785        0.2394       0.9226        0.2461        9.5165
     44   0.2503   0.7771        0.2389       0.9226        0.2449        9.4391
     45   0.2568   0.7797        0.2374       0.9226        0.2457        9.5202
     46   [36m0.2595[0m   [32m0.7834[0m        0.2380       0.9226        0.2430        9.4509
     47   [36m0.2643[0m   [32m0.7865[0m        [35m0.2367[0m       0.9190        0.2428        9.5449
     48   0.2614   0.7854        0.2376       0.9178        [94m0.2415[0m     +  9.3747
     49   [36m0.2658[0m   [32m0.7877[0m        [35m0.2346[0m       0.9202        [94m0.2390[0m     +  9.3013
     50   0.2653   0.7862        0.2353       0.9226        0.2409        9.2205
[32m[I 2023-05-05 01:19:25,034][0m Trial 522 finished with value: 0.23902177098944802 and parameters: {'lr': 5.623417353081057e-05, 'dropout': 0.43053194444258236, 'd_model_multiplier': 4, 'num_layers': 3, 'n_heads': 4, 'dim_feedforward': 362, 'batch_size': 93, 'pos_encoding': 'fixed', 'activation': 'gelu', 'norm': 'BatchNorm', 'optimizer_name': 'PlainRAdam', 'weight_decay': 0.1, 'top_n_features': 55}. Best is trial 246 with value: 0.16447311791139763.[0m
[FileBasedDataset] Initializing dataset...
	Examples: 8264
	Features: 57
	Max length: 315
Standard scalar turned ON, loading params from cache
[FileBasedDataset] Dataset initialization complete
  epoch    auprc    auroc    train_loss    valid_acc    valid_loss    cp      dur
-------  -------  -------  ------------  -----------  ------------  ----  -------
      1   [36m0.1174[0m   [32m0.5676[0m        [35m0.3108[0m       [31m0.9214[0m        [94m0.2863[0m     +  25.6248
      2   [36m0.1785[0m   [32m0.6914[0m        [35m0.2820[0m       [31m0.9238[0m        0.3140        25.7756
      3   0.1697   [32m0.7008[0m        [35m0.2663[0m       0.9238        0.2940        25.8737
      4   [36m0.1905[0m   [32m0.7146[0m        [35m0.2630[0m       0.9238        [94m0.2569[0m     +  25.8099
      5   0.1791   0.7129        [35m0.2592[0m       0.9202        [94m0.2534[0m     +  25.8842
      6   0.1693   [32m0.7165[0m        0.2596       0.9238        0.2556        25.8681
      7   0.1814   0.7126        [35m0.2581[0m       0.9226        0.3033        25.8185
      8   0.1675   0.7148        [35m0.2549[0m       0.9238        0.3087        25.8507
      9   0.1745   0.7141        0.2582       0.9238        0.3308        25.7925
     10   0.1589   0.7015        [35m0.2548[0m       0.9238        0.2957        25.8165
     11   0.1725   0.7136        [35m0.2546[0m       0.9238        0.2842        25.7100
     12   0.1674   0.7079        [35m0.2537[0m       0.9238        0.2910        25.8437
     13   0.1703   0.7139        [35m0.2537[0m       0.9238        0.2741        25.7981
     14   0.1699   0.7147        0.2547       0.9238        0.2931        25.9429
Stopping since valid_loss has not improved in the last 10 epochs.
[32m[I 2023-05-05 01:25:53,153][0m Trial 523 finished with value: 0.253411483163737 and parameters: {'lr': 0.0032598088187686864, 'dropout': 0.5230173422844056, 'd_model_multiplier': 8, 'num_layers': 5, 'n_heads': 32, 'dim_feedforward': 348, 'batch_size': 19, 'pos_encoding': 'fixed', 'activation': 'relu', 'norm': 'LayerNorm', 'optimizer_name': 'RAdam', 'weight_decay': 0.1, 'top_n_features': 57}. Best is trial 246 with value: 0.16447311791139763.[0m
[FileBasedDataset] Initializing dataset...
	Examples: 8264
	Features: 103
	Max length: 315
Standard scalar turned ON, loading params from cache
[FileBasedDataset] Dataset initialization complete
  epoch    auprc    auroc    train_loss    valid_acc    valid_loss    cp      dur
-------  -------  -------  ------------  -----------  ------------  ----  -------
      1   [36m0.2366[0m   [32m0.7715[0m        [35m0.2793[0m       [31m0.9093[0m        [94m0.2640[0m     +  51.1260
      2   [36m0.2651[0m   [32m0.7826[0m        [35m0.2601[0m       0.9093        0.2662        51.3441
      3   [36m0.2863[0m   0.7825        [35m0.2551[0m       [31m0.9129[0m        0.2730        51.1402
      4   [36m0.2914[0m   [32m0.7960[0m        [35m0.2510[0m       0.9129        0.2687        51.3338
      5   0.2832   0.7932        [35m0.2494[0m       0.9105        0.2757        51.3374
      6   0.2853   [32m0.7999[0m        [35m0.2482[0m       [31m0.9141[0m        0.2748        51.4025
      7   0.2845   0.7811        [35m0.2464[0m       0.9141        0.2840        51.2659
      8   0.2807   0.7875        [35m0.2453[0m       0.9129        0.2832        51.4000
      9   0.2861   0.7866        0.2456       [31m0.9154[0m        0.2797        51.2195
     10   [36m0.2970[0m   0.7976        [35m0.2434[0m       0.9154        0.2802        51.1072
Stopping since valid_loss has not improved in the last 10 epochs.
[32m[I 2023-05-05 01:35:18,063][0m Trial 524 finished with value: 0.26402778583415476 and parameters: {'lr': 4.2397211832439665e-05, 'dropout': 0.4805699733652126, 'd_model_multiplier': 4, 'num_layers': 6, 'n_heads': 64, 'dim_feedforward': 340, 'batch_size': 10, 'pos_encoding': 'fixed', 'activation': 'relu', 'norm': 'LayerNorm', 'optimizer_name': 'AdamW', 'weight_decay': 0.001, 'top_n_features': 103}. Best is trial 246 with value: 0.16447311791139763.[0m
[FileBasedDataset] Initializing dataset...
	Examples: 8264
	Features: 74
	Max length: 315
Standard scalar turned ON, loading params from cache
[FileBasedDataset] Dataset initialization complete
  epoch    auprc    auroc    train_loss    valid_acc    valid_loss    cp      dur
-------  -------  -------  ------------  -----------  ------------  ----  -------
      1   [36m0.1285[0m   [32m0.6512[0m        [35m0.3553[0m       [31m0.9262[0m        [94m0.2672[0m     +  35.2561
      2   0.1137   0.6057        [35m0.2782[0m       0.9262        [94m0.2664[0m     +  35.1410
      3   [36m0.1658[0m   [32m0.6809[0m        [35m0.2656[0m       0.9262        [94m0.2579[0m     +  35.2518
      4   0.1611   0.6737        [35m0.2560[0m       0.9262        [94m0.2509[0m     +  35.1356
      5   0.0738   0.5000        0.2726       0.9262        0.2664        34.9753
      6   0.0738   0.5000        0.2750       0.9262        0.2662        35.2900
      7   0.0738   0.5000        0.2766       0.9262        0.2644        35.0557
      8   0.0738   0.5000        0.2760       0.9262        0.2673        35.3148
      9   [36m0.1778[0m   0.5973        0.2756       0.9262        0.2664        35.0679
     10   0.0738   0.5000        0.2773       0.9262        0.2677        35.0669
     11   0.0738   0.5000        0.2774       0.9262        0.2656        35.0840
     12   0.0738   0.5000        0.2772       0.9262        0.2680        35.2600
     13   0.0738   0.5000        0.2771       0.9262        0.2679        35.2169
Stopping since valid_loss has not improved in the last 10 epochs.
[32m[I 2023-05-05 01:43:31,331][0m Trial 525 finished with value: 0.25093181908779305 and parameters: {'lr': 0.05637891332627354, 'dropout': 0.45159910896415434, 'd_model_multiplier': 4, 'num_layers': 8, 'n_heads': 32, 'dim_feedforward': 420, 'batch_size': 30, 'pos_encoding': 'learnable', 'activation': 'relu', 'norm': 'LayerNorm', 'optimizer_name': 'RAdam', 'weight_decay': 0, 'top_n_features': 74}. Best is trial 246 with value: 0.16447311791139763.[0m
[FileBasedDataset] Initializing dataset...
	Examples: 8264
	Features: 66
	Max length: 315
Standard scalar turned ON, loading params from cache
[FileBasedDataset] Dataset initialization complete
  epoch    auprc    auroc    train_loss    valid_acc    valid_loss    cp      dur
-------  -------  -------  ------------  -----------  ------------  ----  -------
      1   [36m0.0663[0m   [32m0.4068[0m        [35m0.6105[0m       [31m0.9299[0m        [94m0.4890[0m     +  13.0721
      2   [36m0.0743[0m   [32m0.4090[0m        [35m0.4907[0m       0.9299        [94m0.3730[0m     +  13.3352
      3   0.0601   [32m0.4289[0m        [35m0.3997[0m       0.9299        [94m0.3144[0m     +  13.0398
      4   0.0631   [32m0.4670[0m        [35m0.3485[0m       0.9299        [94m0.2855[0m     +  13.3188
      5   [36m0.0780[0m   [32m0.5046[0m        [35m0.3178[0m       0.9299        [94m0.2703[0m     +  13.3044
      6   [36m0.0879[0m   [32m0.5336[0m        [35m0.2983[0m       0.9299        [94m0.2619[0m     +  13.2986
      7   [36m0.0991[0m   [32m0.5519[0m        [35m0.2853[0m       0.9299        [94m0.2577[0m     +  13.1531
      8   [36m0.1062[0m   [32m0.5638[0m        [35m0.2786[0m       0.9299        [94m0.2560[0m     +  13.2381
      9   [36m0.1084[0m   [32m0.5704[0m        [35m0.2695[0m       0.9299        [94m0.2554[0m     +  13.3958
     10   [36m0.1122[0m   [32m0.5773[0m        [35m0.2667[0m       0.9299        [94m0.2553[0m     +  13.3373
     11   [36m0.1160[0m   [32m0.5816[0m        [35m0.2631[0m       0.9299        [94m0.2552[0m     +  13.1483
     12   [36m0.1172[0m   [32m0.5852[0m        [35m0.2616[0m       0.9299        [94m0.2551[0m     +  13.2219
     13   [36m0.1201[0m   [32m0.5882[0m        [35m0.2586[0m       0.9299        0.2556        13.0968
     14   [36m0.1239[0m   [32m0.5923[0m        0.2602       0.9287        0.2564        13.2013
     15   [36m0.1257[0m   [32m0.5945[0m        [35m0.2564[0m       0.9287        0.2565        13.2904
     16   [36m0.1281[0m   [32m0.5959[0m        [35m0.2529[0m       0.9287        0.2566        13.2010
     17   [36m0.1302[0m   [32m0.5998[0m        0.2535       0.9287        0.2567        13.1290
     18   [36m0.1327[0m   [32m0.6045[0m        0.2542       0.9274        0.2567        13.3307
     19   [36m0.1353[0m   [32m0.6080[0m        [35m0.2511[0m       0.9214        0.2571        13.0690
     20   [36m0.1390[0m   [32m0.6122[0m        0.2512       0.9226        0.2575        13.4641
     21   [36m0.1421[0m   [32m0.6158[0m        [35m0.2483[0m       0.9238        0.2577        13.1629
Stopping since valid_loss has not improved in the last 10 epochs.
[32m[I 2023-05-05 01:48:23,280][0m Trial 526 finished with value: 0.25514743023945025 and parameters: {'lr': 2.8687451347399405e-05, 'dropout': 0.6987987386551427, 'd_model_multiplier': 1, 'num_layers': 3, 'n_heads': 32, 'dim_feedforward': 335, 'batch_size': 42, 'pos_encoding': 'fixed', 'activation': 'relu', 'norm': 'LayerNorm', 'optimizer_name': 'PlainRAdam', 'weight_decay': 0.1, 'top_n_features': 66}. Best is trial 246 with value: 0.16447311791139763.[0m
[FileBasedDataset] Initializing dataset...
	Examples: 8264
	Features: 94
	Max length: 315
Standard scalar turned ON, loading params from cache
[FileBasedDataset] Dataset initialization complete
  epoch    auprc    auroc    train_loss    valid_acc    valid_loss    cp      dur
-------  -------  -------  ------------  -----------  ------------  ----  -------
      1   [36m0.1017[0m   [32m0.4487[0m        [35m0.4851[0m       [31m0.9141[0m        [94m0.4873[0m     +  35.4064
      2   [36m0.2559[0m   [32m0.7244[0m        [35m0.2925[0m       0.9081        [94m0.4133[0m     +  35.5789
      3   [36m0.2827[0m   [32m0.7555[0m        [35m0.2670[0m       0.9117        [94m0.3858[0m     +  35.7595
      4   [36m0.3006[0m   [32m0.7616[0m        [35m0.2570[0m       0.9033        [94m0.3655[0m     +  35.8114
      5   [36m0.3055[0m   0.7595        [35m0.2536[0m       0.9045        [94m0.3459[0m     +  35.7786
      6   [36m0.3085[0m   0.7582        [35m0.2510[0m       0.9081        [94m0.3315[0m     +  35.7507
      7   [36m0.3366[0m   0.7563        [35m0.2463[0m       0.9081        [94m0.3220[0m     +  35.9317
      8   [36m0.3416[0m   0.7549        [35m0.2442[0m       0.9081        [94m0.3073[0m     +  35.8178
      9   0.3366   0.7520        [35m0.2418[0m       0.9105        [94m0.2967[0m     +  36.0327
     10   0.3368   0.7506        [35m0.2408[0m       [31m0.9154[0m        [94m0.2865[0m     +  35.8426
     11   0.3395   0.7486        [35m0.2384[0m       0.9154        [94m0.2795[0m     +  35.8095
     12   0.3326   0.7451        [35m0.2342[0m       [31m0.9166[0m        [94m0.2726[0m     +  35.8648
     13   0.3380   0.7443        [35m0.2332[0m       0.9166        [94m0.2668[0m     +  35.9401
     14   0.3383   0.7463        0.2357       [31m0.9178[0m        [94m0.2668[0m     +  35.7408
     15   0.3402   0.7477        [35m0.2307[0m       [31m0.9190[0m        [94m0.2620[0m     +  36.0320
     16   [36m0.3449[0m   0.7515        [35m0.2292[0m       0.9190        [94m0.2567[0m     +  35.9364
     17   [36m0.3467[0m   0.7500        0.2292       0.9166        [94m0.2548[0m     +  36.0526
     18   0.3361   0.7507        [35m0.2259[0m       0.9166        [94m0.2539[0m     +  35.8987
     19   0.3380   0.7550        0.2278       0.9166        [94m0.2513[0m     +  35.7832
     20   0.3407   0.7518        [35m0.2255[0m       0.9166        0.2523        35.8408
     21   0.3384   0.7549        [35m0.2229[0m       0.9154        [94m0.2510[0m     +  36.0257
     22   0.3430   0.7592        [35m0.2204[0m       0.9154        [94m0.2503[0m     +  36.0247
     23   0.3351   0.7565        0.2205       0.9154        0.2519        35.8775
     24   0.3290   0.7528        [35m0.2182[0m       0.9154        0.2533        35.7949
     25   0.3452   0.7577        [35m0.2181[0m       0.9166        0.2518        35.9801
     26   0.3424   0.7585        [35m0.2155[0m       0.9154        0.2539        36.0476
     27   0.3392   0.7606        [35m0.2135[0m       0.9166        0.2546        36.0165
     28   0.3440   [32m0.7637[0m        [35m0.2130[0m       0.9154        0.2535        36.1902
     29   0.3426   [32m0.7678[0m        [35m0.2125[0m       0.9166        0.2528        35.9824
     30   0.3396   [32m0.7702[0m        [35m0.2097[0m       0.9166        0.2547        36.3062
     31   0.3387   0.7684        [35m0.2066[0m       0.9166        0.2582        36.0746
Stopping since valid_loss has not improved in the last 10 epochs.
