[32m[I 2023-05-02 03:44:49,193][0m Trial 28 finished with value: 0.23410637092921868 and parameters: {'lr': 0.005512298729874975, 'dropout': 0.6316133532377362, 'd_model_multiplier': 4, 'num_layers': 1, 'n_heads': 16, 'dim_feedforward': 435, 'batch_size': 241, 'pos_encoding': 'learnable', 'activation': 'gelu', 'norm': 'BatchNorm', 'optimizer_name': 'PlainRAdam', 'weight_decay': 0.01, 'top_n_features': 145}. Best is trial 12 with value: 0.20472501771481755.[0m
[FileBasedDataset] Initializing dataset...
	Examples: 8264
	Features: 180
	Max length: 315
Standard scalar turned ON, loading params from cache
[FileBasedDataset] Dataset initialization complete
  epoch    auprc    auroc    train_loss    valid_acc    valid_loss    cp      dur
-------  -------  -------  ------------  -----------  ------------  ----  -------
      1   [36m0.1997[0m   [32m0.6750[0m        [35m0.3345[0m       [31m0.9287[0m        [94m0.3291[0m     +  11.5181
      2   [36m0.2060[0m   [32m0.6911[0m        [35m0.2511[0m       0.9262        0.3408        11.8144
      3   [36m0.2136[0m   [32m0.6964[0m        [35m0.2466[0m       0.9214        0.3416        11.8946
      4   0.2041   0.6927        [35m0.2408[0m       0.9214        0.3533        12.2367
      5   0.1756   0.6518        0.2424       0.9274        [94m0.3230[0m     +  12.3814
      6   0.1772   0.6570        0.2417       0.9262        0.3262        12.7529
      7   0.1940   0.6915        [35m0.2373[0m       0.9202        0.4282        12.4867
      8   0.1819   0.6787        0.2399       0.9250        0.3861        12.4814
      9   0.1552   0.6278        [35m0.2361[0m       0.9250        0.3519        12.4323
     10   0.1841   0.6720        0.2372       0.9238        0.3617        12.5880
     11   0.1569   0.6519        0.2368       0.9226        0.3491        12.0424
     12   0.1396   0.5819        [35m0.2359[0m       0.9274        0.3434        12.4879
     13   0.1259   0.5659        0.2417       0.9262        0.3632        12.9426
     14   0.1472   0.5760        0.2437       0.9045        0.4330        11.9414
Stopping since valid_loss has not improved in the last 10 epochs.
[32m[I 2023-05-02 03:47:53,306][0m Trial 29 finished with value: 0.3229550559979108 and parameters: {'lr': 0.0014017585834250946, 'dropout': 0.5385033503757009, 'd_model_multiplier': 16, 'num_layers': 1, 'n_heads': 16, 'dim_feedforward': 353, 'batch_size': 194, 'pos_encoding': 'learnable', 'activation': 'gelu', 'norm': 'BatchNorm', 'optimizer_name': 'PlainRAdam', 'weight_decay': 0.001, 'top_n_features': 180}. Best is trial 12 with value: 0.20472501771481755.[0m
[FileBasedDataset] Initializing dataset...
	Examples: 8264
	Features: 115
	Max length: 315
Standard scalar turned ON, loading params from cache
[FileBasedDataset] Dataset initialization complete
  epoch    auprc    auroc    train_loss    valid_acc    valid_loss    cp      dur
-------  -------  -------  ------------  -----------  ------------  ----  -------
      1   [36m0.2048[0m   [32m0.7402[0m        [35m0.3117[0m       [31m0.9093[0m        [94m0.4246[0m     +  29.2607
      2   [36m0.2388[0m   [32m0.7512[0m        [35m0.2534[0m       [31m0.9117[0m        [94m0.3297[0m     +  29.6622
      3   [36m0.2396[0m   0.7489        [35m0.2502[0m       [31m0.9166[0m        0.3542        30.0211
      4   0.2299   0.7447        [35m0.2477[0m       0.9166        0.3615        29.7619
      5   0.2186   0.7208        0.2566       0.9105        0.3977        29.8256
      6   0.1713   0.7013        0.2620       [31m0.9190[0m        0.3381        29.8959
      7   0.2078   0.7222        0.2742       [31m0.9202[0m        [94m0.2580[0m     +  29.7500
      8   0.0545   0.3420        0.2676       0.3954        1.1220        29.6332
      9   [36m0.2462[0m   [32m0.7799[0m        0.2537       0.9081        [94m0.2483[0m     +  29.6313
     10   0.2432   0.7667        0.2550       0.9190        [94m0.2390[0m     +  29.8105
     11   [36m0.2547[0m   [32m0.7908[0m        0.2560       [31m0.9214[0m        [94m0.2349[0m     +  30.1212
     12   0.2481   0.7655        0.2812       0.8924        0.2777        29.7957
     13   0.2531   0.7651        0.3098       0.8888        0.2862        29.5608
     14   0.2297   0.7503        0.3257       0.8900        0.2937        30.0628
     15   0.2139   0.7404        0.3425       0.9033        0.2639        29.8355
     16   0.2058   0.7402        0.3623       0.8936        0.2833        29.6071
     17   0.2011   0.6876        0.4195       0.8791        0.3289        29.5139
     18   0.1739   0.6242        0.4069       [31m0.9250[0m        0.2732        29.5303
     19   0.1831   0.6867        0.4014       0.8924        0.2970        30.0314
     20   0.1966   0.6931        0.4211       0.9202        0.2569        29.5599
Stopping since valid_loss has not improved in the last 10 epochs.
[32m[I 2023-05-02 03:58:20,957][0m Trial 30 finished with value: 0.23490162386571337 and parameters: {'lr': 0.0005301343531487531, 'dropout': 0.5997027049272217, 'd_model_multiplier': 64, 'num_layers': 3, 'n_heads': 16, 'dim_feedforward': 401, 'batch_size': 72, 'pos_encoding': 'learnable', 'activation': 'gelu', 'norm': 'BatchNorm', 'optimizer_name': 'PlainRAdam', 'weight_decay': 0.01, 'top_n_features': 115}. Best is trial 12 with value: 0.20472501771481755.[0m
[FileBasedDataset] Initializing dataset...
	Examples: 8264
	Features: 187
	Max length: 315
Standard scalar turned ON, loading params from cache
[FileBasedDataset] Dataset initialization complete
  epoch    auprc    auroc    train_loss    valid_acc    valid_loss    cp      dur
-------  -------  -------  ------------  -----------  ------------  ----  -------
      1   [36m0.1978[0m   [32m0.7154[0m        [35m0.3110[0m       [31m0.9190[0m        [94m0.2934[0m     +  15.0919
      2   [36m0.2125[0m   [32m0.7297[0m        [35m0.2573[0m       0.9141        0.3007        14.6050
      3   [36m0.2538[0m   0.7194        [35m0.2463[0m       [31m0.9214[0m        [94m0.2586[0m     +  15.2934
      4   [36m0.2569[0m   [32m0.7399[0m        [35m0.2463[0m       0.9178        0.2786        15.6563
      5   0.2545   [32m0.7507[0m        0.2485       0.9141        0.2991        15.3015
      6   0.2408   0.7485        [35m0.2462[0m       0.9081        0.3128        15.5379
      7   [36m0.2668[0m   0.7297        0.2488       0.9214        [94m0.2584[0m     +  15.7191
      8   0.2645   0.7302        [35m0.2413[0m       [31m0.9226[0m        [94m0.2502[0m     +  15.5721
      9   [36m0.2711[0m   0.7340        0.2432       0.9214        [94m0.2461[0m     +  15.6268
     10   [36m0.2744[0m   0.7486        [35m0.2374[0m       0.9202        0.2504        16.0601
     11   0.2608   0.7438        [35m0.2364[0m       0.9154        0.2506        15.6448
     12   0.2351   [32m0.7585[0m        0.2371       0.8888        0.3092        15.8144
     13   0.2558   0.7550        [35m0.2346[0m       0.9129        0.2565        15.9797
     14   0.2728   0.7483        [35m0.2287[0m       0.9202        0.2477        15.8957
     15   0.2583   0.7535        [35m0.2282[0m       0.9178        0.2498        15.4176
     16   [36m0.2752[0m   0.7553        0.2320       0.9190        0.2468        15.7437
     17   0.2693   [32m0.7614[0m        [35m0.2259[0m       0.9190        0.2465        15.7781
     18   [36m0.2826[0m   0.7569        [35m0.2241[0m       0.9190        0.2481        15.6830
Stopping since valid_loss has not improved in the last 10 epochs.
[32m[I 2023-05-02 04:03:17,655][0m Trial 31 finished with value: 0.24605336507834144 and parameters: {'lr': 0.0074130575915819065, 'dropout': 0.4808325438282488, 'd_model_multiplier': 2, 'num_layers': 3, 'n_heads': 16, 'dim_feedforward': 253, 'batch_size': 221, 'pos_encoding': 'fixed', 'activation': 'gelu', 'norm': 'BatchNorm', 'optimizer_name': 'PlainRAdam', 'weight_decay': 0.001, 'top_n_features': 187}. Best is trial 12 with value: 0.20472501771481755.[0m
[FileBasedDataset] Initializing dataset...
	Examples: 8264
	Features: 205
	Max length: 315
Standard scalar turned ON, loading params from cache
[FileBasedDataset] Dataset initialization complete
  epoch    auprc    auroc    train_loss    valid_acc    valid_loss    cp      dur
-------  -------  -------  ------------  -----------  ------------  ----  -------
      1   [36m0.2124[0m   [32m0.7276[0m        [35m0.3162[0m       [31m0.9214[0m        [94m0.3118[0m     +  12.6143
      2   [36m0.2555[0m   [32m0.7285[0m        [35m0.2623[0m       [31m0.9238[0m        0.3302        13.1361
      3   [36m0.2719[0m   [32m0.7652[0m        [35m0.2603[0m       0.9214        0.3432        11.8291
      4   [36m0.2881[0m   [32m0.7861[0m        [35m0.2575[0m       0.9166        0.3484        12.6365
      5   [36m0.2926[0m   [32m0.7938[0m        [35m0.2565[0m       0.9166        0.3297        12.5090
      6   [36m0.2997[0m   0.7793        [35m0.2549[0m       0.9154        [94m0.3101[0m     +  13.0988
      7   [36m0.3261[0m   0.7678        [35m0.2522[0m       0.9238        0.3203        12.5631
      8   0.3244   0.7736        0.2577       0.9178        0.3252        13.1449
      9   0.3075   0.7526        0.2534       0.9226        [94m0.3053[0m     +  12.9847
     10   0.3032   0.7798        [35m0.2510[0m       0.9117        0.3222        13.2227
     11   0.2813   0.7433        [35m0.2503[0m       0.9214        [94m0.2724[0m     +  13.2591
     12   [36m0.3330[0m   0.7583        [35m0.2480[0m       [31m0.9250[0m        [94m0.2483[0m     +  12.8529
     13   0.3328   [32m0.7993[0m        [35m0.2436[0m       0.9190        0.2670        13.2923
     14   0.3215   0.7897        0.2473       0.9226        [94m0.2393[0m     +  12.6939
     15   [36m0.3390[0m   0.7612        [35m0.2433[0m       0.9226        [94m0.2341[0m     +  12.9895
     16   [36m0.3606[0m   0.7876        0.2492       0.9214        [94m0.2299[0m     +  12.9043
     17   0.3605   [32m0.8043[0m        0.2511       0.9202        [94m0.2276[0m     +  13.0519
     18   0.3507   0.7974        0.2511       0.9238        [94m0.2239[0m     +  12.9392
     19   0.3497   0.7948        0.2456       0.9226        [94m0.2233[0m     +  12.9481
     20   0.3493   0.8005        0.2460       0.9190        [94m0.2219[0m     +  13.5395
     21   0.3487   0.7840        0.2484       0.9190        0.2255        12.8984
     22   [36m0.3626[0m   0.7911        0.2472       0.9214        0.2235        13.1502
     23   0.3262   0.7997        0.2451       0.9129        0.2364        12.7431
     24   0.3429   0.7921        0.2464       0.9190        0.2248        12.8540
     25   0.3509   0.7926        0.2434       0.9190        0.2250        12.8116
     26   0.3504   0.8018        0.2458       0.9190        0.2262        12.7896
     27   0.3595   0.7800        [35m0.2407[0m       0.9250        0.2266        12.9114
     28   0.3403   0.8025        0.2435       0.9166        0.2219        12.6503
     29   0.3493   0.7870        0.2439       0.9238        0.2252        12.6098
Stopping since valid_loss has not improved in the last 10 epochs.
[32m[I 2023-05-02 04:09:44,472][0m Trial 32 finished with value: 0.22186393590763373 and parameters: {'lr': 0.005621324583450517, 'dropout': 0.5533402793785837, 'd_model_multiplier': 2, 'num_layers': 1, 'n_heads': 16, 'dim_feedforward': 289, 'batch_size': 256, 'pos_encoding': 'learnable', 'activation': 'gelu', 'norm': 'BatchNorm', 'optimizer_name': 'PlainRAdam', 'weight_decay': 0.001, 'top_n_features': 205}. Best is trial 12 with value: 0.20472501771481755.[0m
[FileBasedDataset] Initializing dataset...
	Examples: 8264
	Features: 209
	Max length: 315
Standard scalar turned ON, loading params from cache
[FileBasedDataset] Dataset initialization complete
  epoch    auprc    auroc    train_loss    valid_acc    valid_loss    cp      dur
-------  -------  -------  ------------  -----------  ------------  ----  -------
      1   [36m0.0812[0m   [32m0.4515[0m        [35m0.5241[0m       [31m0.9287[0m        [94m0.5092[0m     +  11.7133
      2   [36m0.1304[0m   [32m0.5825[0m        [35m0.3522[0m       0.9287        [94m0.3935[0m     +  12.5788
      3   [36m0.1596[0m   [32m0.6706[0m        [35m0.2871[0m       0.9287        [94m0.3497[0m     +  12.6278
      4   [36m0.1639[0m   [32m0.6953[0m        [35m0.2720[0m       0.9287        [94m0.3412[0m     +  12.7900
      5   [36m0.1783[0m   [32m0.7095[0m        [35m0.2623[0m       0.9287        [94m0.3293[0m     +  12.8238
      6   [36m0.1818[0m   [32m0.7183[0m        0.2631       0.9287        [94m0.3280[0m     +  12.5476
      7   [36m0.1847[0m   [32m0.7218[0m        [35m0.2573[0m       0.9287        [94m0.3250[0m     +  12.9428
      8   0.1824   [32m0.7224[0m        [35m0.2566[0m       0.9287        [94m0.3197[0m     +  13.0682
      9   [36m0.1936[0m   0.7224        [35m0.2551[0m       0.9274        0.3230        13.1304
     10   [36m0.1953[0m   [32m0.7242[0m        [35m0.2500[0m       0.9287        [94m0.3167[0m     +  13.2304
     11   0.1939   0.7242        0.2535       [31m0.9299[0m        0.3177        12.5643
     12   [36m0.1976[0m   0.7226        0.2512       0.9287        0.3177        12.1907
     13   [36m0.2011[0m   0.7207        0.2505       0.9287        0.3181        12.6088
     14   0.1989   0.7158        [35m0.2497[0m       0.9274        [94m0.3084[0m     +  13.0753
     15   [36m0.2092[0m   0.7112        0.2500       0.9274        0.3103        12.0746
     16   0.2070   0.7036        [35m0.2478[0m       0.9274        [94m0.3022[0m     +  12.7088
     17   0.2009   0.7064        [35m0.2469[0m       0.9274        [94m0.2998[0m     +  12.2846
     18   0.1959   0.7016        [35m0.2453[0m       0.9238        0.3054        13.0673
     19   0.2034   0.6911        [35m0.2453[0m       0.9274        [94m0.2992[0m     +  13.0466
     20   0.2044   0.6860        [35m0.2430[0m       0.9274        0.2997        12.8312
     21   0.1931   0.6915        0.2448       0.9262        0.3014        12.4760
     22   0.1913   0.6862        0.2439       0.9262        0.3037        12.6227
     23   0.1987   0.6852        [35m0.2416[0m       0.9226        0.3171        12.7850
     24   0.1972   0.6884        [35m0.2385[0m       0.9226        0.3081        12.4644
     25   0.1837   0.6816        [35m0.2367[0m       0.9238        0.3064        13.3347
     26   0.1879   0.6629        [35m0.2361[0m       0.9274        [94m0.2924[0m     +  12.4691
     27   0.1896   0.6689        0.2368       0.9238        0.2947        12.5088
     28   0.1913   0.6662        0.2384       0.9226        0.3027        12.7009
     29   0.1966   0.6808        0.2372       0.9226        0.3031        12.7181
     30   0.1958   0.6622        [35m0.2355[0m       0.9262        0.2954        12.9339
     31   0.2022   0.6627        [35m0.2352[0m       0.9250        0.2972        12.7593
     32   0.1973   0.6656        [35m0.2330[0m       0.9226        0.3012        13.0089
     33   0.2060   0.6715        0.2343       0.9238        0.2988        12.5043
     34   0.2038   0.6695        0.2343       0.9226        [94m0.2831[0m     +  12.8272
     35   0.2063   0.6759        0.2349       0.9238        [94m0.2806[0m     +  12.4912
     36   [36m0.2119[0m   0.6699        [35m0.2305[0m       0.9226        0.2823        12.4137
     37   [36m0.2215[0m   0.6738        0.2333       0.9226        0.2824        12.3853
     38   0.2079   0.6677        0.2320       0.9226        0.2936        12.3429
     39   0.2077   0.6695        0.2318       0.9226        0.2847        12.2997
     40   0.2020   0.6804        [35m0.2297[0m       0.9250        0.2935        12.7403
     41   0.2067   0.6769        0.2300       0.9238        0.2870        12.4699
     42   0.2011   0.6662        0.2334       0.9250        0.2905        12.5713
     43   0.2146   0.6648        0.2301       0.9250        [94m0.2754[0m     +  12.4064
     44   0.2120   0.6641        0.2315       0.9262        0.2922        12.7818
     45   0.2075   0.6719        [35m0.2280[0m       0.9250        0.2870        12.7849
     46   0.2116   0.6599        [35m0.2272[0m       0.9250        0.2806        12.7220
     47   0.2152   0.6669        0.2311       0.9238        0.2812        13.2959
     48   0.2115   0.6558        [35m0.2267[0m       0.9250        0.2780        12.6583
     49   0.2137   0.6660        [35m0.2260[0m       0.9226        0.2817        13.0179
     50   0.2101   0.6606        0.2270       0.9238        0.2909        13.2049
[32m[I 2023-05-02 04:20:19,835][0m Trial 33 finished with value: 0.2753639612549594 and parameters: {'lr': 0.0005659612070197857, 'dropout': 0.5518594629815186, 'd_model_multiplier': 2, 'num_layers': 1, 'n_heads': 16, 'dim_feedforward': 289, 'batch_size': 250, 'pos_encoding': 'learnable', 'activation': 'gelu', 'norm': 'BatchNorm', 'optimizer_name': 'PlainRAdam', 'weight_decay': 0.001, 'top_n_features': 209}. Best is trial 12 with value: 0.20472501771481755.[0m
[FileBasedDataset] Initializing dataset...
	Examples: 8264
	Features: 169
	Max length: 315
Standard scalar turned ON, loading params from cache
[FileBasedDataset] Dataset initialization complete
  epoch    auprc    auroc    train_loss    valid_acc    valid_loss    cp      dur
-------  -------  -------  ------------  -----------  ------------  ----  -------
      1   [36m0.1879[0m   [32m0.7134[0m        [35m0.3030[0m       [31m0.9190[0m        [94m0.5211[0m     +  12.8242
      2   [36m0.2211[0m   [32m0.7541[0m        [35m0.2814[0m       0.9154        [94m0.4384[0m     +  12.4462
      3   [36m0.2251[0m   [32m0.7797[0m        [35m0.2741[0m       0.5780        0.7227        12.8472
      4   [36m0.2329[0m   [32m0.7810[0m        0.2762       0.9166        [94m0.2713[0m     +  12.7465
      5   0.1946   0.7512        [35m0.2718[0m       0.9190        0.3134        12.4595
      6   0.2228   0.7751        [35m0.2715[0m       0.9057        0.3450        12.6445
      7   0.2228   0.7772        [35m0.2657[0m       0.9045        [94m0.2693[0m     +  12.6556
      8   0.2221   0.7714        0.2670       0.9190        [94m0.2365[0m     +  12.6816
      9   0.2025   0.7762        [35m0.2559[0m       0.9154        0.2478        12.8728
     10   0.2087   0.7700        0.2594       0.9105        0.2509        12.6611
     11   0.2141   [32m0.7829[0m        0.2611       0.8138        0.4922        12.7782
     12   0.2137   [32m0.7868[0m        0.2652       0.9021        0.3390        12.6762
     13   0.2284   [32m0.7893[0m        0.2590       0.8742        0.4205        12.8197
     14   0.2098   0.7754        0.2649       0.9105        0.2894        12.4844
     15   0.2115   0.7767        [35m0.2518[0m       0.9093        0.3147        12.5921
     16   [36m0.2361[0m   0.7794        0.2542       [31m0.9202[0m        0.2805        12.5297
     17   0.2084   0.7722        0.2533       0.9129        0.2754        12.5989
Stopping since valid_loss has not improved in the last 10 epochs.
[32m[I 2023-05-02 04:24:08,217][0m Trial 34 finished with value: 0.23649444840983583 and parameters: {'lr': 0.0031973536451836196, 'dropout': 0.639587354494216, 'd_model_multiplier': 2, 'num_layers': 2, 'n_heads': 32, 'dim_feedforward': 482, 'batch_size': 37, 'pos_encoding': 'learnable', 'activation': 'gelu', 'norm': 'BatchNorm', 'optimizer_name': 'PlainRAdam', 'weight_decay': 0.001, 'top_n_features': 169}. Best is trial 12 with value: 0.20472501771481755.[0m
[FileBasedDataset] Initializing dataset...
	Examples: 8264
	Features: 223
	Max length: 315
Standard scalar turned ON, loading params from cache
[FileBasedDataset] Dataset initialization complete
  epoch    auprc    auroc    train_loss    valid_acc    valid_loss    cp      dur
-------  -------  -------  ------------  -----------  ------------  ----  -------
      1   [36m0.2083[0m   [32m0.7001[0m        [35m0.3356[0m       [31m0.9166[0m        [94m0.3417[0m     +  34.8526
      2   [36m0.2287[0m   [32m0.7363[0m        [35m0.2511[0m       0.9057        0.3761        34.6948
      3   [36m0.2289[0m   0.7331        [35m0.2454[0m       0.8996        0.3959        34.7706
      4   [36m0.2443[0m   [32m0.7379[0m        [35m0.2424[0m       0.8815        0.4470        34.8454
      5   [36m0.2464[0m   [32m0.7443[0m        [35m0.2382[0m       0.8489        0.4973        34.6571
      6   [36m0.2477[0m   0.7327        0.2387       0.8138        0.5278        35.1672
      7   0.2459   0.7283        0.2418       0.7811        0.5536        34.6145
      8   [36m0.2547[0m   0.7352        [35m0.2381[0m       0.7594        0.5712        35.5324
      9   0.2520   0.7342        [35m0.2378[0m       0.7170        0.6204        35.2510
     10   0.2534   0.7180        [35m0.2352[0m       0.7751        0.5566        34.4886
Stopping since valid_loss has not improved in the last 10 epochs.
