[32m[I 2023-05-02 11:58:20,672][0m Trial 116 finished with value: 0.25036641913933505 and parameters: {'lr': 0.0028044390849305736, 'dropout': 0.3509669462588617, 'd_model_multiplier': 1, 'num_layers': 1, 'n_heads': 8, 'dim_feedforward': 445, 'batch_size': 42, 'pos_encoding': 'fixed', 'activation': 'gelu', 'norm': 'BatchNorm', 'optimizer_name': 'PlainRAdam', 'weight_decay': 0, 'top_n_features': 180}. Best is trial 12 with value: 0.20472501771481755.[0m
[FileBasedDataset] Initializing dataset...
	Examples: 8264
	Features: 149
	Max length: 315
Standard scalar turned ON, loading params from cache
[FileBasedDataset] Dataset initialization complete
  epoch    auprc    auroc    train_loss    valid_acc    valid_loss    cp      dur
-------  -------  -------  ------------  -----------  ------------  ----  -------
      1   [36m0.2343[0m   [32m0.8058[0m        [35m0.2916[0m       [31m0.9274[0m        [94m0.2209[0m     +  10.9006
      2   0.1890   0.7905        [35m0.2581[0m       0.9202        0.3184        11.0039
      3   0.2056   [32m0.8110[0m        [35m0.2512[0m       0.9190        0.2559        11.0315
      4   [36m0.2432[0m   [32m0.8213[0m        [35m0.2490[0m       [31m0.9287[0m        0.2928        11.0355
      5   0.2376   0.7818        0.2494       [31m0.9323[0m        0.2576        11.0208
      6   [36m0.2943[0m   0.8162        [35m0.2479[0m       0.9287        [94m0.2175[0m     +  11.0710
      7   [36m0.3277[0m   0.8082        [35m0.2439[0m       [31m0.9347[0m        [94m0.2003[0m     +  10.8629
      8   0.2838   0.7800        [35m0.2431[0m       [31m0.9383[0m        0.2068        10.8929
      9   0.3046   0.8055        [35m0.2401[0m       0.9335        [94m0.1937[0m     +  11.1852
     10   0.2605   0.7892        [35m0.2380[0m       0.9287        0.2007        11.0142
     11   0.2503   0.7706        [35m0.2363[0m       0.9250        0.2057        11.0755
     12   0.2438   0.7622        0.2370       0.9214        0.2117        11.1096
     13   0.2780   0.8065        [35m0.2335[0m       0.9359        0.1958        11.2489
     14   0.2605   0.8181        0.2359       0.9262        0.2012        11.1983
     15   0.2903   [32m0.8292[0m        [35m0.2280[0m       0.9262        0.2033        11.1224
     16   0.2946   0.8177        0.2293       0.9262        0.2054        11.0094
     17   [36m0.3381[0m   0.8260        0.2300       0.9323        [94m0.1914[0m     +  11.1391
     18   [36m0.3483[0m   0.8283        0.2313       0.9323        0.1944        11.6407
     19   0.3428   0.8227        [35m0.2260[0m       0.9250        0.1961        11.0611
     20   0.2578   0.8069        [35m0.2260[0m       0.9238        0.2063        11.0701
     21   0.3333   0.8192        0.2286       0.9274        0.2036        11.0552
     22   0.3297   0.8275        0.2293       0.9214        0.2020        11.1076
     23   0.3194   0.8205        0.2269       0.9154        0.2129        11.2532
     24   0.2895   0.8085        [35m0.2259[0m       0.9129        0.2099        11.3347
     25   0.3078   0.8087        [35m0.2255[0m       0.9190        0.2103        11.2625
     26   0.3226   0.8138        0.2262       0.9141        0.2228        11.0353
Stopping since valid_loss has not improved in the last 10 epochs.
[32m[I 2023-05-02 12:03:20,950][0m Trial 117 finished with value: 0.191397856754288 and parameters: {'lr': 0.001629696511034259, 'dropout': 0.33317572685232183, 'd_model_multiplier': 1, 'num_layers': 2, 'n_heads': 32, 'dim_feedforward': 437, 'batch_size': 32, 'pos_encoding': 'learnable', 'activation': 'gelu', 'norm': 'BatchNorm', 'optimizer_name': 'PlainRAdam', 'weight_decay': 0, 'top_n_features': 149}. Best is trial 117 with value: 0.191397856754288.[0m
[FileBasedDataset] Initializing dataset...
	Examples: 8264
	Features: 218
	Max length: 315
Standard scalar turned ON, loading params from cache
[FileBasedDataset] Dataset initialization complete
  epoch    auprc    auroc    train_loss    valid_acc    valid_loss    cp      dur
-------  -------  -------  ------------  -----------  ------------  ----  -------
      1   [36m0.2735[0m   [32m0.7389[0m        [35m0.3146[0m       [31m0.9262[0m        [94m0.2623[0m     +  11.2794
      2   [36m0.2893[0m   [32m0.7551[0m        [35m0.2549[0m       0.9262        0.2715        11.0934
      3   0.2608   0.7471        [35m0.2502[0m       0.9226        [94m0.2573[0m     +  11.3121
      4   0.2658   0.7472        [35m0.2422[0m       0.9250        0.2608        11.4697
      5   [36m0.3136[0m   0.7528        [35m0.2417[0m       0.9262        [94m0.2452[0m     +  11.4049
      6   0.2694   0.7467        [35m0.2377[0m       0.9250        0.2483        11.4199
      7   0.2779   0.7328        [35m0.2356[0m       0.9262        0.2794        11.2754
      8   0.2664   0.7282        [35m0.2351[0m       [31m0.9274[0m        0.2458        11.3303
      9   0.2964   0.7204        [35m0.2343[0m       [31m0.9287[0m        0.2541        11.3063
     10   0.2746   0.7336        [35m0.2313[0m       0.9250        0.2630        11.2181
     11   0.2678   [32m0.7567[0m        [35m0.2278[0m       0.9262        0.2719        11.3662
     12   0.2691   0.7161        [35m0.2273[0m       0.9262        0.2475        11.4523
     13   0.2530   [32m0.7703[0m        [35m0.2225[0m       0.9262        [94m0.2442[0m     +  11.4027
     14   0.2524   0.7570        0.2270       0.9250        0.2463        11.4434
     15   0.2935   0.7661        0.2265       0.9274        [94m0.2425[0m     +  11.4029
     16   0.2469   [32m0.7745[0m        0.2240       0.9262        0.2454        11.4207
     17   0.2589   [32m0.7765[0m        0.2231       0.9287        [94m0.2366[0m     +  11.3590
     18   0.2687   0.7713        [35m0.2215[0m       0.9262        0.2367        11.4523
     19   0.2805   [32m0.7908[0m        [35m0.2179[0m       0.9274        [94m0.2314[0m     +  11.3864
     20   0.2680   0.7828        0.2203       [31m0.9299[0m        0.2322        11.6141
     21   0.2685   0.7827        0.2183       0.9226        0.2348        11.3543
     22   0.2805   0.7749        [35m0.2170[0m       0.9226        0.2404        11.2597
     23   0.2692   0.7683        [35m0.2156[0m       0.9226        0.2421        11.2791
     24   0.2676   0.7840        [35m0.2153[0m       0.9214        0.2397        11.5969
     25   0.2506   0.7717        [35m0.2144[0m       0.9202        0.2389        11.9110
     26   0.2588   0.7826        [35m0.2130[0m       0.9190        0.2383        11.5007
     27   0.2573   0.7780        [35m0.2127[0m       0.9226        0.2454        11.3560
     28   0.2775   0.7631        0.2127       0.9287        0.2349        11.3601
Stopping since valid_loss has not improved in the last 10 epochs.
[32m[I 2023-05-02 12:08:52,202][0m Trial 118 finished with value: 0.23137791775968805 and parameters: {'lr': 0.0008366330406028387, 'dropout': 0.3411969729267832, 'd_model_multiplier': 1, 'num_layers': 2, 'n_heads': 32, 'dim_feedforward': 438, 'batch_size': 48, 'pos_encoding': 'learnable', 'activation': 'gelu', 'norm': 'BatchNorm', 'optimizer_name': 'PlainRAdam', 'weight_decay': 0, 'top_n_features': 218}. Best is trial 117 with value: 0.191397856754288.[0m
[FileBasedDataset] Initializing dataset...
	Examples: 8264
	Features: 145
	Max length: 315
Standard scalar turned ON, loading params from cache
[FileBasedDataset] Dataset initialization complete
  epoch    auprc    auroc    train_loss    valid_acc    valid_loss    cp      dur
-------  -------  -------  ------------  -----------  ------------  ----  -------
      1   [36m0.1789[0m   [32m0.6678[0m        [35m0.2725[0m       [31m0.9250[0m        [94m0.2663[0m     +  11.1801
      2   [36m0.2315[0m   0.6486        [35m0.2545[0m       0.9250        [94m0.2620[0m     +  11.3259
      3   [36m0.2532[0m   [32m0.6771[0m        [35m0.2480[0m       0.9250        [94m0.2521[0m     +  11.1431
      4   [36m0.2888[0m   [32m0.7136[0m        [35m0.2412[0m       [31m0.9287[0m        [94m0.2422[0m     +  11.2750
      5   [36m0.3054[0m   [32m0.7173[0m        0.2429       0.9262        0.2435        11.4085
      6   [36m0.3180[0m   [32m0.7630[0m        [35m0.2383[0m       0.9250        [94m0.2362[0m     +  11.2141
      7   [36m0.3290[0m   [32m0.7787[0m        [35m0.2381[0m       0.9274        [94m0.2265[0m     +  11.1582
      8   [36m0.3386[0m   0.7714        0.2389       0.9262        0.2318        11.1235
      9   0.3333   0.7771        [35m0.2339[0m       0.9262        0.2270        11.3305
     10   [36m0.3457[0m   0.7637        [35m0.2311[0m       0.9287        [94m0.2249[0m     +  11.0921
     11   0.3370   0.7521        0.2312       [31m0.9311[0m        0.2285        11.1736
     12   [36m0.3652[0m   [32m0.7951[0m        [35m0.2285[0m       0.9274        [94m0.2184[0m     +  11.2186
     13   [36m0.3799[0m   [32m0.7964[0m        0.2288       0.9287        0.2199        11.3753
     14   0.3656   0.7954        [35m0.2259[0m       0.9299        0.2216        11.2434
     15   0.3496   0.7753        0.2261       0.9287        0.2287        11.1901
     16   0.3737   [32m0.7965[0m        0.2262       0.9287        [94m0.2179[0m     +  11.2443
     17   0.3768   [32m0.7977[0m        0.2261       0.9287        0.2236        11.3287
     18   [36m0.3826[0m   [32m0.8010[0m        [35m0.2223[0m       0.9311        [94m0.2157[0m     +  11.3944
     19   0.3630   0.7938        [35m0.2211[0m       0.9299        0.2217        11.3724
     20   0.3654   0.7954        0.2233       0.9299        0.2193        11.4319
     21   0.3789   0.7848        0.2212       0.9287        0.2263        11.1060
     22   [36m0.3992[0m   0.7932        [35m0.2206[0m       0.9299        0.2169        11.2684
     23   0.3922   [32m0.8025[0m        0.2230       0.9311        0.2212        11.2930
     24   0.3898   [32m0.8127[0m        [35m0.2201[0m       0.9299        [94m0.2152[0m     +  11.2776
     25   0.3664   0.8004        [35m0.2184[0m       0.9299        0.2187        11.3143
     26   0.3805   0.7868        [35m0.2177[0m       0.9299        0.2269        11.2860
     27   0.3973   0.8117        0.2178       0.9299        [94m0.2106[0m     +  11.2712
     28   0.3860   0.7996        0.2178       0.9299        0.2168        11.2833
     29   0.3813   0.7999        [35m0.2167[0m       0.9299        0.2230        11.3079
     30   0.3809   0.7996        [35m0.2162[0m       0.9311        0.2182        11.2034
     31   0.3666   0.7835        0.2184       0.9311        0.2260        11.3014
     32   0.3818   0.8061        [35m0.2153[0m       0.9287        0.2125        11.1197
     33   0.3869   0.8026        [35m0.2140[0m       [31m0.9323[0m        0.2163        11.0135
     34   0.3875   0.8001        0.2142       0.9323        0.2183        11.3416
     35   0.3893   0.8089        [35m0.2132[0m       0.9287        0.2134        11.2285
     36   0.3915   0.8036        0.2143       0.9311        0.2153        11.3014
Stopping since valid_loss has not improved in the last 10 epochs.
[32m[I 2023-05-02 12:15:50,104][0m Trial 119 finished with value: 0.2106102122153812 and parameters: {'lr': 0.0014131523918753702, 'dropout': 0.32127069195274566, 'd_model_multiplier': 1, 'num_layers': 2, 'n_heads': 32, 'dim_feedforward': 418, 'batch_size': 21, 'pos_encoding': 'learnable', 'activation': 'gelu', 'norm': 'BatchNorm', 'optimizer_name': 'PlainRAdam', 'weight_decay': 0, 'top_n_features': 145}. Best is trial 117 with value: 0.191397856754288.[0m
[FileBasedDataset] Initializing dataset...
	Examples: 8264
	Features: 146
	Max length: 315
Standard scalar turned ON, loading params from cache
[FileBasedDataset] Dataset initialization complete
  epoch    auprc    auroc    train_loss    valid_acc    valid_loss    cp      dur
-------  -------  -------  ------------  -----------  ------------  ----  -------
      1   [36m0.2338[0m   [32m0.7623[0m        [35m0.3659[0m       [31m0.9093[0m        [94m0.2547[0m     +  15.9210
      2   [36m0.2611[0m   [32m0.7892[0m        [35m0.2530[0m       [31m0.9154[0m        [94m0.2512[0m     +  16.5138
      3   [36m0.2781[0m   0.7825        [35m0.2455[0m       [31m0.9190[0m        [94m0.2479[0m     +  16.6665
      4   [36m0.2907[0m   0.7832        [35m0.2451[0m       0.9190        [94m0.2431[0m     +  16.3395
      5   [36m0.3360[0m   [32m0.7934[0m        [35m0.2392[0m       [31m0.9214[0m        0.2491        15.8411
      6   0.3032   0.7872        [35m0.2356[0m       0.9214        [94m0.2381[0m     +  15.8608
      7   [36m0.3597[0m   0.7915        [35m0.2328[0m       [31m0.9226[0m        [94m0.2345[0m     +  16.1499
      8   [36m0.3618[0m   [32m0.7979[0m        [35m0.2265[0m       0.9226        [94m0.2305[0m     +  16.4112
      9   [36m0.3874[0m   [32m0.8029[0m        0.2274       [31m0.9262[0m        [94m0.2254[0m     +  16.2848
     10   [36m0.3881[0m   [32m0.8079[0m        [35m0.2243[0m       0.9250        [94m0.2236[0m     +  16.1101
     11   [36m0.3989[0m   [32m0.8101[0m        [35m0.2239[0m       [31m0.9299[0m        [94m0.2214[0m     +  16.2363
     12   0.3826   [32m0.8123[0m        [35m0.2197[0m       0.9226        0.2240        16.5659
     13   0.3762   0.8091        [35m0.2188[0m       0.9202        0.2247        16.3760
     14   0.3635   0.7986        [35m0.2183[0m       0.9202        0.2280        15.6799
     15   0.3683   0.8085        [35m0.2147[0m       0.9190        0.2244        16.4421
     16   0.3917   0.8111        [35m0.2129[0m       0.9238        0.2221        16.1824
     17   0.3901   [32m0.8127[0m        0.2133       0.9226        0.2229        16.3408
     18   0.3648   0.8027        [35m0.2094[0m       0.9190        0.2264        16.3949
     19   0.3497   0.7571        [35m0.2065[0m       0.9226        0.2406        16.2632
     20   0.3698   0.7938        [35m0.2062[0m       0.9202        0.2283        16.3159
Stopping since valid_loss has not improved in the last 10 epochs.
[32m[I 2023-05-02 12:21:31,659][0m Trial 120 finished with value: 0.22137135858259005 and parameters: {'lr': 0.0014562308185067587, 'dropout': 0.31645137748759444, 'd_model_multiplier': 1, 'num_layers': 3, 'n_heads': 32, 'dim_feedforward': 419, 'batch_size': 144, 'pos_encoding': 'learnable', 'activation': 'gelu', 'norm': 'BatchNorm', 'optimizer_name': 'RAdam', 'weight_decay': 0, 'top_n_features': 146}. Best is trial 117 with value: 0.191397856754288.[0m
[FileBasedDataset] Initializing dataset...
	Examples: 8264
	Features: 137
	Max length: 315
Standard scalar turned ON, loading params from cache
[FileBasedDataset] Dataset initialization complete
  epoch    auprc    auroc    train_loss    valid_acc    valid_loss    cp      dur
-------  -------  -------  ------------  -----------  ------------  ----  -------
      1   [36m0.2648[0m   [32m0.7141[0m        [35m0.3020[0m       [31m0.9371[0m        [94m0.2270[0m     +  11.0601
      2   [36m0.2879[0m   [32m0.7287[0m        [35m0.2598[0m       [31m0.9420[0m        [94m0.2214[0m     +  11.7879
      3   [36m0.3006[0m   0.7221        [35m0.2505[0m       0.9371        [94m0.2173[0m     +  11.1093
      4   [36m0.3013[0m   [32m0.7360[0m        [35m0.2462[0m       0.9395        0.2206        11.2604
      5   [36m0.3023[0m   [32m0.7456[0m        [35m0.2446[0m       [31m0.9432[0m        0.2183        11.1246
      6   0.2927   0.7421        [35m0.2424[0m       0.9407        0.2178        11.4930
      7   0.2820   0.7450        [35m0.2347[0m       0.9407        [94m0.2108[0m     +  11.4138
      8   0.2837   [32m0.7491[0m        0.2349       0.9407        0.2115        11.3088
      9   0.2782   [32m0.7513[0m        [35m0.2294[0m       0.9420        0.2195        11.8093
     10   0.2782   [32m0.7616[0m        [35m0.2275[0m       0.9359        0.2173        11.4023
     11   0.2609   [32m0.7779[0m        [35m0.2256[0m       0.9359        0.2137        11.6600
     12   0.2408   [32m0.7820[0m        [35m0.2223[0m       0.9299        0.2206        11.3501
     13   0.2706   [32m0.7938[0m        0.2252       0.9335        0.2154        11.6212
     14   0.2549   0.7720        [35m0.2215[0m       0.9359        0.2203        11.5290
     15   0.2908   0.7702        [35m0.2186[0m       0.9395        0.2108        11.4287
     16   [36m0.3066[0m   0.7512        [35m0.2160[0m       0.9407        [94m0.2054[0m     +  11.8063
     17   0.2543   0.7432        [35m0.2153[0m       0.9359        0.2189        11.3513
     18   0.2666   0.7350        [35m0.2122[0m       0.9383        0.2207        11.2576
     19   0.2961   0.7560        [35m0.2053[0m       0.9335        0.2170        11.4684
     20   0.2978   0.7378        0.2088       0.9432        0.2153        11.5102
     21   0.2739   0.7489        0.2062       0.9347        0.2272        11.4223
     22   0.2867   0.7487        0.2072       0.9323        0.2255        11.5286
     23   0.2943   0.7285        [35m0.2022[0m       0.9359        0.2286        11.3159
     24   0.2367   0.7460        0.2025       0.9335        0.2222        11.3817
     25   0.2564   0.7169        [35m0.2015[0m       0.9335        0.2296        11.5360
Stopping since valid_loss has not improved in the last 10 epochs.
[32m[I 2023-05-02 12:26:29,833][0m Trial 121 finished with value: 0.20536984351014284 and parameters: {'lr': 0.0004061803683819846, 'dropout': 0.3216638493285997, 'd_model_multiplier': 1, 'num_layers': 2, 'n_heads': 32, 'dim_feedforward': 410, 'batch_size': 22, 'pos_encoding': 'learnable', 'activation': 'gelu', 'norm': 'BatchNorm', 'optimizer_name': 'PlainRAdam', 'weight_decay': 0, 'top_n_features': 137}. Best is trial 117 with value: 0.191397856754288.[0m
[FileBasedDataset] Initializing dataset...
	Examples: 8264
	Features: 131
	Max length: 315
Standard scalar turned ON, loading params from cache
[FileBasedDataset] Dataset initialization complete
  epoch    auprc    auroc    train_loss    valid_acc    valid_loss    cp      dur
-------  -------  -------  ------------  -----------  ------------  ----  -------
      1   [36m0.2891[0m   [32m0.7081[0m        [35m0.2736[0m       [31m0.8984[0m        [94m0.3220[0m     +  11.2235
      2   0.2767   [32m0.7101[0m        [35m0.2555[0m       [31m0.9141[0m        [94m0.3063[0m     +  11.4391
      3   [36m0.3150[0m   [32m0.7543[0m        [35m0.2494[0m       0.9105        [94m0.2672[0m     +  11.3422
      4   [36m0.3244[0m   0.7243        [35m0.2433[0m       0.9008        0.2700        11.2030
      5   [36m0.3254[0m   0.7461        [35m0.2366[0m       0.9033        0.2692        11.3575
      6   [36m0.3404[0m   0.7503        [35m0.2320[0m       [31m0.9166[0m        [94m0.2632[0m     +  11.2403
      7   0.3280   0.7518        0.2324       0.9117        0.2705        11.2866
      8   [36m0.3657[0m   0.7409        [35m0.2287[0m       0.9105        0.2713        11.1839
      9   0.3620   0.7338        [35m0.2273[0m       0.9093        0.2738        11.2849
     10   0.3141   0.7490        [35m0.2247[0m       0.9105        0.2652        11.1600
     11   0.3629   [32m0.7635[0m        0.2284       0.9045        0.2691        11.2462
     12   0.3194   [32m0.7675[0m        0.2249       0.9093        0.3006        11.2524
     13   0.3072   0.7348        0.2263       0.9069        0.2887        11.2809
     14   0.3227   0.7643        [35m0.2221[0m       0.9081        0.3188        11.2778
     15   0.3415   0.7348        0.2234       0.9093        0.2693        11.0594
Stopping since valid_loss has not improved in the last 10 epochs.
