[32m[I 2023-05-04 13:51:05,259][0m Trial 447 finished with value: 0.21629390632226936 and parameters: {'lr': 2.039518069998004e-05, 'dropout': 0.535420232460989, 'd_model_multiplier': 4, 'num_layers': 5, 'n_heads': 4, 'dim_feedforward': 310, 'batch_size': 72, 'pos_encoding': 'fixed', 'activation': 'relu', 'norm': 'LayerNorm', 'optimizer_name': 'RAdam', 'weight_decay': 0.1, 'top_n_features': 70}. Best is trial 246 with value: 0.16447311791139763.[0m
[FileBasedDataset] Initializing dataset...
	Examples: 8264
	Features: 65
	Max length: 315
Standard scalar turned ON, loading params from cache
[FileBasedDataset] Dataset initialization complete
  epoch    auprc    auroc    train_loss    valid_acc    valid_loss    cp      dur
-------  -------  -------  ------------  -----------  ------------  ----  -------
      1   [36m0.2383[0m   [32m0.7269[0m        [35m0.3039[0m       [31m0.9335[0m        [94m0.2912[0m     +  20.2081
      2   [36m0.2458[0m   [32m0.7388[0m        [35m0.2815[0m       0.9335        [94m0.2415[0m     +  20.4646
      3   0.1997   [32m0.7471[0m        [35m0.2734[0m       0.9335        [94m0.2192[0m     +  20.3849
      4   0.2302   [32m0.7700[0m        [35m0.2711[0m       0.9335        [94m0.2144[0m     +  20.7858
      5   0.2202   0.7680        [35m0.2675[0m       0.9335        0.2275        20.8039
      6   0.2307   [32m0.8230[0m        [35m0.2662[0m       0.9335        0.2200        21.0911
      7   0.2351   0.8019        [35m0.2640[0m       0.9335        0.2332        20.6926
      8   0.2435   [32m0.8256[0m        [35m0.2632[0m       0.9335        0.2243        20.8255
      9   0.2441   0.8252        0.2645       0.9335        0.2338        20.6584
     10   [36m0.2477[0m   0.8242        [35m0.2622[0m       0.9335        0.2470        20.3423
     11   [36m0.2887[0m   [32m0.8337[0m        [35m0.2618[0m       0.9335        0.2453        20.7361
     12   0.2402   0.8014        0.2649       0.9335        0.2517        20.7453
     13   0.2484   0.8292        0.2669       0.9335        0.2362        21.0959
Stopping since valid_loss has not improved in the last 10 epochs.
[32m[I 2023-05-04 13:55:55,442][0m Trial 448 finished with value: 0.2144207387189623 and parameters: {'lr': 0.039127799567798105, 'dropout': 0.43336042183011086, 'd_model_multiplier': 4, 'num_layers': 4, 'n_heads': 32, 'dim_feedforward': 377, 'batch_size': 84, 'pos_encoding': 'fixed', 'activation': 'relu', 'norm': 'LayerNorm', 'optimizer_name': 'RAdam', 'weight_decay': 0.1, 'top_n_features': 65}. Best is trial 246 with value: 0.16447311791139763.[0m
[FileBasedDataset] Initializing dataset...
	Examples: 8264
	Features: 81
	Max length: 315
Standard scalar turned ON, loading params from cache
[FileBasedDataset] Dataset initialization complete
  epoch    auprc    auroc    train_loss    valid_acc    valid_loss    cp      dur
-------  -------  -------  ------------  -----------  ------------  ----  -------
      1   [36m0.1888[0m   [32m0.6482[0m        [35m0.3772[0m       [31m0.9250[0m        [94m0.2536[0m     +  23.6585
      2   [36m0.2865[0m   [32m0.7327[0m        [35m0.2458[0m       [31m0.9299[0m        [94m0.2347[0m     +  23.7014
      3   [36m0.3038[0m   [32m0.7464[0m        [35m0.2357[0m       0.9299        [94m0.2315[0m     +  23.8163
      4   [36m0.3087[0m   [32m0.7513[0m        [35m0.2305[0m       0.9262        [94m0.2313[0m     +  23.8839
      5   [36m0.3195[0m   [32m0.7518[0m        [35m0.2265[0m       0.9250        0.2330        23.9155
      6   0.3166   0.7437        [35m0.2222[0m       0.9250        0.2393        24.3808
      7   0.3044   0.7230        [35m0.2194[0m       0.9287        0.2406        23.9177
      8   0.3078   0.7342        [35m0.2143[0m       0.9274        0.2408        23.9366
      9   0.3020   0.7193        [35m0.2110[0m       0.9287        0.2465        24.0198
     10   0.3145   0.7276        [35m0.2053[0m       0.9262        0.2469        24.0448
     11   0.3096   0.7263        [35m0.2017[0m       0.9299        0.2508        23.9577
     12   0.3115   0.7335        [35m0.1978[0m       0.9299        0.2536        23.8147
     13   0.3142   0.7372        [35m0.1928[0m       0.9250        0.2595        23.9405
Stopping since valid_loss has not improved in the last 10 epochs.
[32m[I 2023-05-04 14:01:31,135][0m Trial 449 finished with value: 0.23132154842818375 and parameters: {'lr': 0.00012891309440203616, 'dropout': 0.10814598275579052, 'd_model_multiplier': 4, 'num_layers': 5, 'n_heads': 32, 'dim_feedforward': 358, 'batch_size': 65, 'pos_encoding': 'fixed', 'activation': 'relu', 'norm': 'LayerNorm', 'optimizer_name': 'RAdam', 'weight_decay': 0.001, 'top_n_features': 81}. Best is trial 246 with value: 0.16447311791139763.[0m
[FileBasedDataset] Initializing dataset...
	Examples: 8264
	Features: 57
	Max length: 315
Standard scalar turned ON, loading params from cache
[FileBasedDataset] Dataset initialization complete
Warning, assumed runtime error: CUDA out of memory. Tried to allocate 2.69 GiB (GPU 0; 23.70 GiB total capacity; 19.84 GiB already allocated; 2.31 GiB free; 20.29 GiB reserved in total by PyTorch) If reserved memory is >> allocated memory try setting max_split_size_mb to avoid fragmentation.  See documentation for Memory Management and PYTORCH_CUDA_ALLOC_CONF
[32m[I 2023-05-04 14:01:38,422][0m Trial 450 finished with value: 100.0 and parameters: {'lr': 0.00018000485220051555, 'dropout': 0.5218397660033426, 'd_model_multiplier': 4, 'num_layers': 6, 'n_heads': 32, 'dim_feedforward': 343, 'batch_size': 227, 'pos_encoding': 'fixed', 'activation': 'relu', 'norm': 'LayerNorm', 'optimizer_name': 'RAdam', 'weight_decay': 0.1, 'top_n_features': 57}. Best is trial 246 with value: 0.16447311791139763.[0m
[FileBasedDataset] Initializing dataset...
	Examples: 8264
	Features: 61
	Max length: 315
Standard scalar turned ON, loading params from cache
[FileBasedDataset] Dataset initialization complete
  epoch    auprc    auroc    train_loss    valid_acc    valid_loss    cp      dur
-------  -------  -------  ------------  -----------  ------------  ----  -------
      1   [36m0.0622[0m   [32m0.3315[0m        [35m0.5530[0m       [31m0.9190[0m        [94m0.3909[0m     +  20.2207
      2   [36m0.1508[0m   [32m0.6057[0m        [35m0.3295[0m       0.9190        [94m0.2768[0m     +  20.3311
      3   [36m0.2308[0m   [32m0.6944[0m        [35m0.2651[0m       0.9190        [94m0.2592[0m     +  19.7037
      4   [36m0.2603[0m   [32m0.7323[0m        [35m0.2492[0m       0.9190        [94m0.2517[0m     +  20.0521
      5   [36m0.2791[0m   [32m0.7544[0m        [35m0.2437[0m       0.9166        [94m0.2468[0m     +  19.9637
      6   [36m0.2869[0m   [32m0.7648[0m        [35m0.2365[0m       0.9178        [94m0.2457[0m     +  20.4136
      7   [36m0.2926[0m   [32m0.7714[0m        [35m0.2347[0m       0.9166        [94m0.2446[0m     +  20.1989
      8   [36m0.2955[0m   [32m0.7747[0m        [35m0.2332[0m       0.9190        [94m0.2439[0m     +  20.2192
      9   [36m0.2958[0m   [32m0.7770[0m        [35m0.2312[0m       0.9166        0.2443        20.5000
     10   [36m0.2975[0m   [32m0.7795[0m        [35m0.2308[0m       0.9178        [94m0.2438[0m     +  20.4208
     11   [36m0.3001[0m   [32m0.7832[0m        [35m0.2296[0m       0.9166        [94m0.2430[0m     +  20.5862
     12   0.2964   [32m0.7846[0m        [35m0.2284[0m       0.9166        0.2436        20.5235
     13   [36m0.3020[0m   [32m0.7869[0m        [35m0.2280[0m       0.9166        [94m0.2428[0m     +  20.2635
     14   0.2994   [32m0.7891[0m        [35m0.2270[0m       0.9178        [94m0.2421[0m     +  20.2756
     15   [36m0.3075[0m   0.7886        [35m0.2268[0m       0.9166        [94m0.2414[0m     +  20.3745
     16   [36m0.3077[0m   [32m0.7903[0m        [35m0.2256[0m       0.9166        [94m0.2413[0m     +  20.2367
     17   [36m0.3079[0m   [32m0.7915[0m        [35m0.2245[0m       0.9166        [94m0.2394[0m     +  20.3108
     18   0.3076   [32m0.7936[0m        [35m0.2230[0m       0.9129        0.2406        20.4956
     19   0.3078   [32m0.7952[0m        0.2232       0.9141        [94m0.2389[0m     +  20.3979
     20   [36m0.3150[0m   0.7950        0.2239       0.9141        0.2394        20.0756
     21   [36m0.3151[0m   0.7952        [35m0.2216[0m       0.9154        [94m0.2387[0m     +  20.1796
     22   0.3111   0.7951        [35m0.2211[0m       0.9141        0.2393        20.2897
     23   0.3129   [32m0.7953[0m        [35m0.2188[0m       0.9129        0.2411        20.4766
     24   0.3141   [32m0.7964[0m        [35m0.2176[0m       0.9129        0.2405        20.2801
     25   0.3124   [32m0.7971[0m        0.2185       0.9117        0.2425        21.3069
     26   0.3069   [32m0.7997[0m        [35m0.2169[0m       0.9141        0.2400        20.5435
     27   0.2971   [32m0.8010[0m        [35m0.2155[0m       0.9166        [94m0.2382[0m     +  20.5398
     28   0.2985   0.8008        0.2171       0.9129        [94m0.2378[0m     +  20.4518
     29   0.2889   0.7993        0.2170       0.9129        0.2389        20.2947
     30   0.2931   0.7985        0.2160       0.9141        0.2396        20.6516
     31   0.2905   0.8004        0.2157       0.9154        0.2388        20.9022
     32   0.2892   0.7992        [35m0.2132[0m       0.9178        0.2387        19.9904
     33   0.2950   [32m0.8022[0m        0.2147       0.9141        0.2408        20.3187
     34   0.2912   0.8006        0.2132       0.9166        0.2408        20.1951
     35   0.2911   0.7980        [35m0.2127[0m       0.9190        0.2417        20.2823
     36   0.2907   0.7972        0.2146       0.9178        0.2436        20.2539
     37   0.2890   0.7976        [35m0.2122[0m       0.9178        0.2439        20.4768
Stopping since valid_loss has not improved in the last 10 epochs.
[32m[I 2023-05-04 14:14:33,645][0m Trial 451 finished with value: 0.23778662957620447 and parameters: {'lr': 3.208408223851665e-05, 'dropout': 0.45967489389115507, 'd_model_multiplier': 4, 'num_layers': 4, 'n_heads': 32, 'dim_feedforward': 447, 'batch_size': 57, 'pos_encoding': 'fixed', 'activation': 'relu', 'norm': 'LayerNorm', 'optimizer_name': 'RAdam', 'weight_decay': 0.1, 'top_n_features': 61}. Best is trial 246 with value: 0.16447311791139763.[0m
[FileBasedDataset] Initializing dataset...
	Examples: 8264
	Features: 196
	Max length: 315
Standard scalar turned ON, loading params from cache
[FileBasedDataset] Dataset initialization complete
Warning, assumed runtime error: CUDA out of memory. Tried to allocate 1.66 GiB (GPU 0; 23.70 GiB total capacity; 17.68 GiB already allocated; 291.25 MiB free; 22.32 GiB reserved in total by PyTorch) If reserved memory is >> allocated memory try setting max_split_size_mb to avoid fragmentation.  See documentation for Memory Management and PYTORCH_CUDA_ALLOC_CONF
[32m[I 2023-05-04 14:14:37,785][0m Trial 452 finished with value: 100.0 and parameters: {'lr': 1.6262758900763565e-05, 'dropout': 0.27204080831261396, 'd_model_multiplier': 4, 'num_layers': 6, 'n_heads': 64, 'dim_feedforward': 327, 'batch_size': 70, 'pos_encoding': 'fixed', 'activation': 'relu', 'norm': 'LayerNorm', 'optimizer_name': 'RAdam', 'weight_decay': 0.1, 'top_n_features': 196}. Best is trial 246 with value: 0.16447311791139763.[0m
[FileBasedDataset] Initializing dataset...
	Examples: 8264
	Features: 101
	Max length: 315
Standard scalar turned ON, loading params from cache
[FileBasedDataset] Dataset initialization complete
Warning, assumed runtime error: CUDA out of memory. Tried to allocate 1.40 GiB (GPU 0; 23.70 GiB total capacity; 13.72 GiB already allocated; 299.25 MiB free; 22.31 GiB reserved in total by PyTorch) If reserved memory is >> allocated memory try setting max_split_size_mb to avoid fragmentation.  See documentation for Memory Management and PYTORCH_CUDA_ALLOC_CONF
[32m[I 2023-05-04 14:14:43,112][0m Trial 453 finished with value: 100.0 and parameters: {'lr': 0.008500720109820408, 'dropout': 0.39252620868093, 'd_model_multiplier': 4, 'num_layers': 5, 'n_heads': 32, 'dim_feedforward': 338, 'batch_size': 118, 'pos_encoding': 'fixed', 'activation': 'relu', 'norm': 'LayerNorm', 'optimizer_name': 'RAdam', 'weight_decay': 0.001, 'top_n_features': 101}. Best is trial 246 with value: 0.16447311791139763.[0m
[FileBasedDataset] Initializing dataset...
	Examples: 8264
	Features: 189
	Max length: 315
Standard scalar turned ON, loading params from cache
[FileBasedDataset] Dataset initialization complete
  epoch    auprc    auroc    train_loss    valid_acc    valid_loss    cp      dur
-------  -------  -------  ------------  -----------  ------------  ----  -------
      1   [36m0.3037[0m   [32m0.7378[0m        [35m0.3386[0m       [31m0.9166[0m        [94m0.2867[0m     +  38.1899
      2   [36m0.3242[0m   [32m0.7522[0m        [35m0.2443[0m       [31m0.9178[0m        [94m0.2698[0m     +  37.9060
      3   0.3128   0.7500        [35m0.2394[0m       0.9166        [94m0.2698[0m     +  38.5970
      4   0.3105   0.7448        [35m0.2376[0m       0.9178        0.2748        38.5477
      5   0.3060   0.7450        [35m0.2351[0m       0.9178        [94m0.2628[0m     +  38.9039
      6   [36m0.3242[0m   0.7476        [35m0.2333[0m       [31m0.9190[0m        0.2763        38.6088
      7   [36m0.3386[0m   0.7522        [35m0.2304[0m       0.9190        [94m0.2572[0m     +  38.4189
      8   0.3201   0.7510        [35m0.2242[0m       [31m0.9202[0m        0.2587        38.5609
      9   0.2949   0.7353        0.2249       0.9166        0.2668        38.6294
     10   0.2740   0.7391        [35m0.2214[0m       0.9154        0.2705        38.5110
     11   0.2852   [32m0.7597[0m        0.2242       0.9141        0.2607        38.8507
     12   0.2634   0.7527        0.2217       0.9141        0.2724        38.8697
     13   0.2519   0.7493        [35m0.2209[0m       0.9166        0.2876        38.8660
     14   0.2452   0.7446        [35m0.2160[0m       0.9141        0.2720        39.6850
     15   0.2585   0.7512        [35m0.2120[0m       0.9129        0.2663        39.1893
     16   0.2693   0.7537        0.2122       0.9141        0.2750        38.5525
Stopping since valid_loss has not improved in the last 10 epochs.
[32m[I 2023-05-04 14:25:44,021][0m Trial 454 finished with value: 0.25720177008854866 and parameters: {'lr': 8.34731052824902e-05, 'dropout': 0.44779212652409933, 'd_model_multiplier': 32, 'num_layers': 4, 'n_heads': 32, 'dim_feedforward': 353, 'batch_size': 80, 'pos_encoding': 'fixed', 'activation': 'relu', 'norm': 'LayerNorm', 'optimizer_name': 'RAdam', 'weight_decay': 0.1, 'top_n_features': 189}. Best is trial 246 with value: 0.16447311791139763.[0m
[FileBasedDataset] Initializing dataset...
	Examples: 8264
	Features: 71
	Max length: 315
Standard scalar turned ON, loading params from cache
[FileBasedDataset] Dataset initialization complete
  epoch    auprc    auroc    train_loss    valid_acc    valid_loss    cp      dur
-------  -------  -------  ------------  -----------  ------------  ----  -------
      1   [36m0.1612[0m   [32m0.6179[0m        [35m0.7457[0m       [31m0.1245[0m        [94m0.7589[0m     +  23.9320
      2   0.1533   0.6055        [35m0.7404[0m       [31m0.1378[0m        [94m0.7542[0m     +  23.7826
      3   0.1475   0.5898        [35m0.7374[0m       [31m0.1644[0m        [94m0.7481[0m     +  24.2765
      4   0.1404   0.5728        [35m0.7298[0m       [31m0.1959[0m        [94m0.7411[0m     +  24.1297
      5   0.1297   0.5528        [35m0.7242[0m       [31m0.2249[0m        [94m0.7333[0m     +  23.8575
      6   0.1139   0.5307        [35m0.7173[0m       [31m0.2684[0m        [94m0.7249[0m     +  23.6630
      7   0.0959   0.5063        [35m0.7075[0m       [31m0.3265[0m        [94m0.7159[0m     +  24.1661
      8   0.0890   0.4820        [35m0.6999[0m       [31m0.3930[0m        [94m0.7066[0m     +  23.8758
      9   0.0792   0.4588        [35m0.6903[0m       [31m0.4607[0m        [94m0.6969[0m     +  24.0032
     10   0.0760   0.4377        [35m0.6815[0m       [31m0.5224[0m        [94m0.6869[0m     +  23.8113
     11   0.0738   0.4176        [35m0.6724[0m       [31m0.5586[0m        [94m0.6767[0m     +  23.7244
     12   0.0564   0.4008        [35m0.6626[0m       [31m0.6034[0m        [94m0.6663[0m     +  23.8354
     13   0.0545   0.3855        [35m0.6541[0m       [31m0.6723[0m        [94m0.6558[0m     +  23.4446
     14   0.0532   0.3728        [35m0.6441[0m       [31m0.7291[0m        [94m0.6453[0m     +  23.8656
     15   0.0523   0.3624        [35m0.6337[0m       [31m0.7811[0m        [94m0.6348[0m     +  23.8137
     16   0.0516   0.3527        [35m0.6241[0m       [31m0.8186[0m        [94m0.6242[0m     +  23.8251
     17   0.0510   0.3449        [35m0.6149[0m       [31m0.8464[0m        [94m0.6136[0m     +  23.9249
     18   0.0508   0.3400        [35m0.6044[0m       [31m0.8767[0m        [94m0.6032[0m     +  23.7227
     19   0.0505   0.3349        [35m0.5965[0m       [31m0.8984[0m        [94m0.5928[0m     +  23.6646
     20   0.0502   0.3309        [35m0.5875[0m       [31m0.9190[0m        [94m0.5825[0m     +  23.9075
     21   0.0500   0.3267        [35m0.5774[0m       [31m0.9274[0m        [94m0.5723[0m     +  23.9558
     22   0.0498   0.3235        [35m0.5685[0m       0.9274        [94m0.5623[0m     +  23.8609
     23   0.0497   0.3214        [35m0.5601[0m       [31m0.9287[0m        [94m0.5524[0m     +  23.8298
     24   0.0497   0.3204        [35m0.5504[0m       0.9287        [94m0.5427[0m     +  23.9619
     25   0.0496   0.3193        [35m0.5422[0m       0.9287        [94m0.5331[0m     +  23.8870
     26   0.0496   0.3180        [35m0.5344[0m       0.9287        [94m0.5238[0m     +  24.0295
     27   0.0495   0.3168        [35m0.5251[0m       0.9287        [94m0.5146[0m     +  23.9512
     28   0.0496   0.3169        [35m0.5171[0m       0.9287        [94m0.5057[0m     +  24.1094
     29   0.0496   0.3167        [35m0.5099[0m       0.9287        [94m0.4970[0m     +  24.0215
     30   0.0497   0.3168        [35m0.5027[0m       0.9287        [94m0.4885[0m     +  23.6865
     31   0.0497   0.3169        [35m0.4947[0m       0.9287        [94m0.4802[0m     +  23.6760
     32   0.0498   0.3169        [35m0.4868[0m       0.9287        [94m0.4722[0m     +  24.2961
     33   0.0499   0.3180        [35m0.4789[0m       0.9287        [94m0.4644[0m     +  23.7196
     34   0.0500   0.3184        [35m0.4736[0m       0.9287        [94m0.4568[0m     +  23.7401
     35   0.0502   0.3198        [35m0.4660[0m       0.9287        [94m0.4495[0m     +  23.8839
     36   0.0503   0.3209        [35m0.4606[0m       0.9287        [94m0.4424[0m     +  23.7342
     37   0.0504   0.3221        [35m0.4546[0m       0.9287        [94m0.4355[0m     +  24.0491
     38   0.0505   0.3231        [35m0.4489[0m       0.9287        [94m0.4289[0m     +  23.9587
     39   0.0507   0.3254        [35m0.4426[0m       0.9287        [94m0.4226[0m     +  23.9514
     40   0.0509   0.3268        [35m0.4376[0m       0.9287        [94m0.4164[0m     +  23.7112
     41   0.0510   0.3287        [35m0.4318[0m       0.9287        [94m0.4105[0m     +  23.8769
     42   0.0511   0.3306        [35m0.4265[0m       0.9287        [94m0.4047[0m     +  23.8504
     43   0.0513   0.3327        [35m0.4219[0m       0.9287        [94m0.3992[0m     +  24.1012
     44   0.0514   0.3347        [35m0.4159[0m       0.9287        [94m0.3939[0m     +  24.3485
     45   0.0515   0.3369        [35m0.4117[0m       0.9287        [94m0.3888[0m     +  24.2324
     46   0.0517   0.3392        [35m0.4070[0m       0.9287        [94m0.3838[0m     +  23.9732
     47   0.0519   0.3415        [35m0.4017[0m       0.9287        [94m0.3790[0m     +  23.6620
     48   0.0521   0.3444        [35m0.3981[0m       0.9287        [94m0.3744[0m     +  23.8772
     49   0.0523   0.3474        [35m0.3934[0m       0.9287        [94m0.3700[0m     +  23.8943
     50   0.0526   0.3506        [35m0.3888[0m       0.9287        [94m0.3657[0m     +  23.6191
