[32m[I 2023-05-02 15:49:02,922][0m Trial 163 finished with value: 0.22896853438888237 and parameters: {'lr': 0.0003499147752657581, 'dropout': 0.4327951084662699, 'd_model_multiplier': 8, 'num_layers': 2, 'n_heads': 32, 'dim_feedforward': 144, 'batch_size': 119, 'pos_encoding': 'learnable', 'activation': 'gelu', 'norm': 'BatchNorm', 'optimizer_name': 'PlainRAdam', 'weight_decay': 0.01, 'top_n_features': 36}. Best is trial 117 with value: 0.191397856754288.[0m
[FileBasedDataset] Initializing dataset...
	Examples: 8264
	Features: 22
	Max length: 315
Standard scalar turned ON, loading params from cache
[FileBasedDataset] Dataset initialization complete
  epoch    auprc    auroc    train_loss    valid_acc    valid_loss    cp     dur
-------  -------  -------  ------------  -----------  ------------  ----  ------
      1   [36m0.1241[0m   [32m0.5900[0m        [35m0.4440[0m       [31m0.9335[0m        [94m0.4116[0m     +  9.2928
      2   [36m0.1761[0m   [32m0.6809[0m        [35m0.2656[0m       0.9274        [94m0.3500[0m     +  9.3039
      3   [36m0.1913[0m   [32m0.6978[0m        [35m0.2551[0m       0.9262        [94m0.3323[0m     +  9.2932
      4   0.1910   0.6961        [35m0.2451[0m       0.9250        [94m0.3257[0m     +  9.5736
      5   [36m0.1933[0m   0.6966        0.2480       0.9238        [94m0.3195[0m     +  9.4065
      6   [36m0.1970[0m   [32m0.6983[0m        [35m0.2445[0m       0.9250        [94m0.3099[0m     +  9.8907
      7   [36m0.2009[0m   [32m0.7014[0m        [35m0.2440[0m       0.9262        [94m0.3038[0m     +  9.6473
      8   [36m0.2022[0m   0.6992        [35m0.2439[0m       0.9262        [94m0.3020[0m     +  9.6525
      9   [36m0.2026[0m   [32m0.7021[0m        [35m0.2414[0m       0.9274        [94m0.2904[0m     +  9.9180
     10   [36m0.2103[0m   [32m0.7060[0m        [35m0.2410[0m       0.9274        0.2911        9.8324
     11   0.2078   0.7023        [35m0.2405[0m       0.9311        [94m0.2833[0m     +  9.6036
     12   0.2056   0.7030        [35m0.2379[0m       0.9299        [94m0.2820[0m     +  9.8488
     13   0.2082   0.6998        0.2409       0.9274        [94m0.2803[0m     +  9.7274
     14   0.2086   0.6955        0.2397       0.9323        [94m0.2759[0m     +  9.6194
     15   [36m0.2112[0m   0.7011        [35m0.2372[0m       0.9299        [94m0.2725[0m     +  9.7004
     16   [36m0.2130[0m   0.7040        0.2372       0.9323        [94m0.2699[0m     +  9.7710
     17   [36m0.2140[0m   0.7056        [35m0.2369[0m       0.9335        0.2727        9.8581
     18   0.2134   0.7033        0.2373       0.9323        [94m0.2632[0m     +  9.5922
     19   [36m0.2143[0m   0.6994        0.2395       0.9335        0.2633        9.7872
     20   [36m0.2181[0m   [32m0.7107[0m        0.2385       0.9335        [94m0.2632[0m     +  9.6280
     21   0.2163   [32m0.7129[0m        0.2370       0.9299        0.2648        9.7522
     22   [36m0.2183[0m   0.7110        [35m0.2344[0m       0.9335        [94m0.2613[0m     +  9.8902
     23   [36m0.2187[0m   0.7100        [35m0.2325[0m       0.9311        0.2635        9.6908
     24   0.2135   0.7074        [35m0.2322[0m       0.9323        [94m0.2603[0m     +  9.8414
     25   [36m0.2193[0m   [32m0.7133[0m        0.2340       0.9323        [94m0.2589[0m     +  9.8263
     26   0.2181   [32m0.7147[0m        0.2342       0.9323        [94m0.2577[0m     +  9.4969
     27   [36m0.2216[0m   [32m0.7170[0m        0.2335       0.9299        0.2594        10.0105
     28   0.2185   0.7157        0.2343       0.9323        [94m0.2561[0m     +  9.8904
     29   0.2182   0.7112        0.2327       0.9323        [94m0.2544[0m     +  9.5096
     30   [36m0.2218[0m   [32m0.7198[0m        [35m0.2310[0m       0.9311        0.2587        10.0715
     31   0.2179   0.7184        [35m0.2282[0m       0.9335        [94m0.2497[0m     +  9.8721
     32   0.2213   [32m0.7226[0m        0.2316       0.9323        0.2507        9.6950
     33   0.2180   0.7200        0.2304       0.9311        [94m0.2496[0m     +  9.9551
     34   0.2126   0.7166        [35m0.2272[0m       0.9335        [94m0.2480[0m     +  9.9279
     35   0.2124   0.7172        0.2342       0.9335        [94m0.2477[0m     +  9.6204
     36   0.2204   [32m0.7313[0m        0.2274       0.9323        0.2477        10.0251
     37   0.2171   0.7281        0.2302       0.9323        [94m0.2468[0m     +  10.0233
     38   0.2150   0.7254        0.2295       0.9323        [94m0.2456[0m     +  9.6857
     39   0.2171   0.7268        0.2274       0.9311        [94m0.2456[0m     +  9.4355
     40   0.2139   0.7258        0.2286       0.9323        0.2482        9.7021
     41   0.2130   0.7258        [35m0.2270[0m       0.9323        0.2465        9.8297
     42   0.2121   0.7253        0.2292       0.9311        0.2469        9.8298
     43   0.2132   0.7300        0.2287       0.9299        0.2479        9.9691
     44   0.2129   0.7298        [35m0.2268[0m       0.9323        0.2461        9.9187
     45   0.2137   [32m0.7343[0m        [35m0.2242[0m       0.9311        [94m0.2451[0m     +  9.7732
     46   0.2155   [32m0.7353[0m        0.2263       0.9299        0.2491        9.5867
     47   0.2129   0.7329        0.2279       0.9311        0.2467        9.4854
     48   0.2118   0.7326        0.2273       0.9299        0.2469        9.6685
     49   0.2097   0.7281        0.2282       0.9311        0.2462        9.9067
     50   0.2107   0.7310        [35m0.2240[0m       0.9311        0.2455        9.7976
[32m[I 2023-05-02 15:57:12,227][0m Trial 164 finished with value: 0.24507393447418743 and parameters: {'lr': 6.090191694780922e-05, 'dropout': 0.5310945783237468, 'd_model_multiplier': 8, 'num_layers': 1, 'n_heads': 32, 'dim_feedforward': 164, 'batch_size': 47, 'pos_encoding': 'learnable', 'activation': 'gelu', 'norm': 'BatchNorm', 'optimizer_name': 'PlainRAdam', 'weight_decay': 0.01, 'top_n_features': 22}. Best is trial 117 with value: 0.191397856754288.[0m
[FileBasedDataset] Initializing dataset...
	Examples: 8264
	Features: 69
	Max length: 315
Standard scalar turned ON, loading params from cache
[FileBasedDataset] Dataset initialization complete
  epoch    auprc    auroc    train_loss    valid_acc    valid_loss    cp     dur
-------  -------  -------  ------------  -----------  ------------  ----  ------
      1   [36m0.2644[0m   [32m0.7103[0m        [35m0.3986[0m       [31m0.9226[0m        [94m0.5097[0m     +  8.6694
      2   [36m0.3131[0m   [32m0.7347[0m        [35m0.2687[0m       0.9214        [94m0.4469[0m     +  9.0948
      3   0.3002   [32m0.7351[0m        [35m0.2590[0m       0.9226        [94m0.4008[0m     +  9.2163
      4   0.2563   0.7067        [35m0.2553[0m       0.9202        [94m0.3911[0m     +  8.8459
      5   0.2558   0.7076        [35m0.2520[0m       0.9202        [94m0.3704[0m     +  9.1158
      6   0.2442   0.7023        [35m0.2467[0m       0.9214        [94m0.3537[0m     +  9.1360
      7   0.2397   0.7046        [35m0.2441[0m       0.9202        0.3667        9.0256
      8   0.2306   0.6865        [35m0.2402[0m       0.9214        [94m0.3486[0m     +  9.2281
      9   0.2134   0.6800        [35m0.2388[0m       0.9202        [94m0.3314[0m     +  9.0658
     10   0.2228   0.6938        [35m0.2347[0m       0.9214        [94m0.3046[0m     +  9.1011
     11   0.2160   0.6923        0.2357       0.9166        [94m0.3032[0m     +  9.3782
     12   0.1990   0.6529        [35m0.2333[0m       0.9190        [94m0.2974[0m     +  9.1778
     13   0.1969   0.6656        0.2338       0.9178        [94m0.2905[0m     +  8.9846
     14   0.1973   0.6773        [35m0.2321[0m       0.9190        [94m0.2815[0m     +  9.0655
     15   0.2050   0.6881        [35m0.2293[0m       0.9202        0.2829        9.2013
     16   0.2176   0.6940        [35m0.2272[0m       0.9202        [94m0.2716[0m     +  9.1115
     17   0.2178   0.6984        0.2301       0.9190        0.2768        9.0118
     18   0.2263   0.6902        0.2299       0.9190        0.2737        9.3513
     19   0.2243   0.7053        [35m0.2267[0m       0.9214        0.2741        9.1437
     20   0.2152   0.6892        0.2278       0.9178        [94m0.2689[0m     +  9.0982
     21   0.2203   0.7022        [35m0.2224[0m       0.9190        [94m0.2666[0m     +  9.2919
     22   0.2191   0.7002        0.2242       0.9214        0.2670        9.0048
     23   0.2365   0.7150        [35m0.2217[0m       0.9166        0.2685        9.1495
     24   0.2251   0.7107        0.2219       0.9178        [94m0.2630[0m     +  9.1481
     25   0.2223   0.7038        0.2247       0.9166        [94m0.2629[0m     +  9.2932
     26   0.2322   0.7137        0.2223       0.9178        [94m0.2623[0m     +  9.2872
     27   0.2264   0.7043        0.2236       0.9166        0.2623        9.1955
     28   0.2233   0.6979        [35m0.2213[0m       0.9202        [94m0.2591[0m     +  8.9662
     29   0.2148   0.6998        [35m0.2161[0m       0.9190        0.2600        9.0717
     30   0.2149   0.6988        0.2187       0.9190        0.2600        9.3630
     31   0.2218   0.7010        0.2223       0.9190        0.2623        9.2930
     32   0.2209   0.6933        0.2194       0.9202        0.2615        9.3677
     33   0.2156   0.7026        0.2204       0.9141        0.2624        9.0757
     34   0.2182   0.6941        [35m0.2156[0m       0.9178        0.2651        9.2224
     35   0.2270   0.6912        0.2208       0.9178        0.2681        8.8572
     36   0.2122   0.6777        0.2184       0.9166        0.2647        9.2267
     37   0.2321   0.7096        [35m0.2137[0m       0.9178        0.2631        9.3646
Stopping since valid_loss has not improved in the last 10 epochs.
[32m[I 2023-05-02 16:03:01,806][0m Trial 165 finished with value: 0.259074751274185 and parameters: {'lr': 0.0001238369631831607, 'dropout': 0.5554027838963232, 'd_model_multiplier': 64, 'num_layers': 2, 'n_heads': 4, 'dim_feedforward': 144, 'batch_size': 56, 'pos_encoding': 'learnable', 'activation': 'gelu', 'norm': 'BatchNorm', 'optimizer_name': 'PlainRAdam', 'weight_decay': 0.01, 'top_n_features': 69}. Best is trial 117 with value: 0.191397856754288.[0m
[FileBasedDataset] Initializing dataset...
	Examples: 8264
	Features: 145
	Max length: 315
Standard scalar turned ON, loading params from cache
[FileBasedDataset] Dataset initialization complete
  epoch    auprc    auroc    train_loss    valid_acc    valid_loss    cp      dur
-------  -------  -------  ------------  -----------  ------------  ----  -------
      1   [36m0.2899[0m   [32m0.7723[0m        [35m0.2855[0m       [31m0.8912[0m        [94m0.4038[0m     +  19.9776
      2   0.2876   [32m0.7760[0m        [35m0.2441[0m       0.8875        [94m0.4023[0m     +  19.9131
      3   0.2882   [32m0.7828[0m        [35m0.2396[0m       [31m0.8972[0m        [94m0.3831[0m     +  20.5924
      4   [36m0.3061[0m   0.7721        [35m0.2356[0m       0.8742        0.4240        20.6751
      5   0.3019   0.7792        [35m0.2312[0m       [31m0.9057[0m        [94m0.3675[0m     +  20.5590
      6   0.3000   0.7768        0.2326       0.9057        [94m0.3614[0m     +  20.4423
      7   [36m0.3132[0m   0.7733        [35m0.2294[0m       0.8730        0.4078        20.3880
      8   0.3076   [32m0.7833[0m        [35m0.2267[0m       0.9045        [94m0.3357[0m     +  20.6446
      9   0.3119   [32m0.7885[0m        [35m0.2264[0m       [31m0.9081[0m        [94m0.3188[0m     +  20.0557
     10   0.3110   0.7749        0.2273       [31m0.9141[0m        0.3333        20.9599
     11   [36m0.3162[0m   0.7791        [35m0.2212[0m       0.9093        0.3482        20.6698
     12   0.2967   0.7780        0.2233       0.9033        0.3322        20.7541
     13   0.2878   0.7602        [35m0.2201[0m       0.9117        0.3420        20.5464
     14   0.2901   0.7451        [35m0.2179[0m       0.9141        0.3491        20.7639
     15   0.3007   0.7357        [35m0.2152[0m       0.8996        0.3752        20.8966
     16   0.2967   0.7544        0.2174       0.9069        0.3429        20.3108
     17   0.3020   0.7472        0.2186       [31m0.9154[0m        0.3219        20.3419
     18   0.3010   0.7513        0.2166       0.9129        0.3357        20.4488
Stopping since valid_loss has not improved in the last 10 epochs.
[32m[I 2023-05-02 16:09:31,904][0m Trial 166 finished with value: 0.3187749431239939 and parameters: {'lr': 0.00023362610611762862, 'dropout': 0.4884821854555869, 'd_model_multiplier': 8, 'num_layers': 3, 'n_heads': 32, 'dim_feedforward': 138, 'batch_size': 162, 'pos_encoding': 'fixed', 'activation': 'gelu', 'norm': 'BatchNorm', 'optimizer_name': 'AdamW', 'weight_decay': 0.1, 'top_n_features': 145}. Best is trial 117 with value: 0.191397856754288.[0m
[FileBasedDataset] Initializing dataset...
	Examples: 8264
	Features: 13
	Max length: 315
Standard scalar turned ON, loading params from cache
[FileBasedDataset] Dataset initialization complete
  epoch    auprc    auroc    train_loss    valid_acc    valid_loss    cp     dur
-------  -------  -------  ------------  -----------  ------------  ----  ------
      1   [36m0.1674[0m   [32m0.6116[0m        [35m0.4326[0m       [31m0.9262[0m        [94m0.2673[0m     +  7.7151
      2   [36m0.2394[0m   [32m0.7583[0m        [35m0.2730[0m       0.9262        [94m0.2323[0m     +  8.5791
      3   [36m0.2555[0m   [32m0.7694[0m        [35m0.2598[0m       [31m0.9274[0m        [94m0.2275[0m     +  8.9218
      4   [36m0.2596[0m   0.7687        [35m0.2548[0m       0.9238        0.2320        8.5647
      5   0.2548   [32m0.7753[0m        0.2569       0.9045        0.2351        8.4917
      6   [36m0.2615[0m   [32m0.7833[0m        [35m0.2542[0m       0.8996        0.2399        8.5661
      7   [36m0.2861[0m   0.7820        [35m0.2526[0m       0.8924        0.2458        8.3195
      8   [36m0.2941[0m   0.7605        [35m0.2505[0m       0.8960        0.2429        8.5202
      9   [36m0.3310[0m   0.7611        [35m0.2491[0m       0.9190        0.2296        8.7825
     10   0.2881   0.7575        [35m0.2423[0m       0.8851        0.2740        8.4951
     11   0.2917   0.7670        0.2425       0.8972        0.2594        8.8775
     12   0.2879   0.7701        0.2460       0.9081        0.2530        8.4555
Stopping since valid_loss has not improved in the last 10 epochs.
[32m[I 2023-05-02 16:11:23,015][0m Trial 167 finished with value: 0.22753312978375492 and parameters: {'lr': 0.0006553400295116223, 'dropout': 0.5387255598943966, 'd_model_multiplier': 1, 'num_layers': 1, 'n_heads': 16, 'dim_feedforward': 155, 'batch_size': 40, 'pos_encoding': 'learnable', 'activation': 'relu', 'norm': 'LayerNorm', 'optimizer_name': 'PlainRAdam', 'weight_decay': 0, 'top_n_features': 13}. Best is trial 117 with value: 0.191397856754288.[0m
[FileBasedDataset] Initializing dataset...
	Examples: 8264
	Features: 168
	Max length: 315
Standard scalar turned ON, loading params from cache
[FileBasedDataset] Dataset initialization complete
  epoch    auprc    auroc    train_loss    valid_acc    valid_loss    cp      dur
-------  -------  -------  ------------  -----------  ------------  ----  -------
      1   [36m0.2503[0m   [32m0.7850[0m        [35m0.3015[0m       [31m0.9238[0m        [94m0.2319[0m     +  11.4134
      2   [36m0.2604[0m   0.7841        [35m0.2712[0m       0.8658        0.3527        11.0730
      3   0.2548   [32m0.7899[0m        [35m0.2649[0m       0.8996        0.2799        11.2258
      4   0.2546   0.7737        [35m0.2636[0m       0.9117        0.2486        11.6189
      5   0.2494   0.7831        [35m0.2620[0m       0.8888        0.2723        11.3884
      6   0.2194   0.7756        [35m0.2578[0m       0.9033        0.2681        11.5218
      7   0.2460   0.7835        [35m0.2517[0m       0.9093        0.2426        11.4136
      8   0.2515   0.7864        0.2520       0.9166        0.2360        11.2007
      9   0.2159   0.7682        0.2539       0.9166        0.2565        11.3265
     10   0.2376   0.7780        0.2525       0.9166        0.2487        11.2296
Stopping since valid_loss has not improved in the last 10 epochs.
[32m[I 2023-05-02 16:13:28,260][0m Trial 168 finished with value: 0.23193709949141836 and parameters: {'lr': 0.0013526418920952478, 'dropout': 0.4568097546609654, 'd_model_multiplier': 8, 'num_layers': 4, 'n_heads': 4, 'dim_feedforward': 429, 'batch_size': 17, 'pos_encoding': 'fixed', 'activation': 'gelu', 'norm': 'BatchNorm', 'optimizer_name': 'AdamW', 'weight_decay': 0.01, 'top_n_features': 168}. Best is trial 117 with value: 0.191397856754288.[0m
[FileBasedDataset] Initializing dataset...
	Examples: 8264
	Features: 151
	Max length: 315
Standard scalar turned ON, loading params from cache
[FileBasedDataset] Dataset initialization complete
  epoch    auprc    auroc    train_loss    valid_acc    valid_loss    cp      dur
-------  -------  -------  ------------  -----------  ------------  ----  -------
      1   [36m0.0879[0m   [32m0.5027[0m        [35m0.4010[0m       [31m0.8380[0m        [94m0.4158[0m     +  52.7105
      2   [36m0.1882[0m   [32m0.6698[0m        [35m0.3973[0m       [31m0.8706[0m        [94m0.3845[0m     +  52.8438
      3   0.1359   0.6661        0.4876       [31m0.9226[0m        [94m0.2967[0m     +  52.7548
      4   0.1243   0.6243        0.4849       0.9226        0.3101        52.7027
      5   0.1655   0.6258        0.5795       0.9226        [94m0.2723[0m     +  52.9057
      6   0.1438   0.6259        0.5578       0.9226        0.2990        52.9948
      7   0.1106   0.5455        0.6101       0.9226        0.2831        52.9064
      8   0.1534   0.6662        0.5487       0.8839        0.3139        53.0020
      9   0.1508   0.6646        0.5701       0.9226        0.2763        52.9447
     10   0.1548   0.6652        0.6454       0.9226        0.2876        52.6766
     11   0.1478   0.6310        0.7382       0.9226        0.3951        52.9473
     12   [36m0.1979[0m   [32m0.6788[0m        0.6794       0.7799        0.7171        52.8380
     13   0.1601   0.6296        0.8287       0.9190        0.2779        52.7564
     14   0.1646   0.6157        0.7176       0.9226        0.3731        52.9219
Stopping since valid_loss has not improved in the last 10 epochs.
