[32m[I 2023-05-02 09:56:26,349][0m Trial 97 finished with value: 0.25672180577662146 and parameters: {'lr': 0.0007151119598759718, 'dropout': 0.5422061962092869, 'd_model_multiplier': 2, 'num_layers': 2, 'n_heads': 4, 'dim_feedforward': 225, 'batch_size': 32, 'pos_encoding': 'learnable', 'activation': 'relu', 'norm': 'LayerNorm', 'optimizer_name': 'AdamW', 'weight_decay': 0.01, 'top_n_features': 151}. Best is trial 12 with value: 0.20472501771481755.[0m
[FileBasedDataset] Initializing dataset...
	Examples: 8264
	Features: 175
	Max length: 315
Standard scalar turned ON, loading params from cache
[FileBasedDataset] Dataset initialization complete
  epoch    auprc    auroc    train_loss    valid_acc    valid_loss    cp      dur
-------  -------  -------  ------------  -----------  ------------  ----  -------
      1   [36m0.1718[0m   [32m0.6953[0m        [35m0.2935[0m       [31m0.9166[0m        [94m0.3994[0m     +  19.4599
      2   [36m0.1821[0m   0.6886        [35m0.2446[0m       [31m0.9238[0m        0.4209        20.2818
      3   0.1779   [32m0.7112[0m        [35m0.2408[0m       0.9154        0.4444        20.3192
      4   [36m0.1879[0m   [32m0.7114[0m        [35m0.2361[0m       0.9226        [94m0.3840[0m     +  19.4580
      5   [36m0.1893[0m   0.7100        [35m0.2340[0m       0.9154        [94m0.3717[0m     +  20.3185
      6   [36m0.1916[0m   0.7096        [35m0.2335[0m       0.9105        0.4196        20.2179
      7   0.1858   0.7095        [35m0.2276[0m       0.9202        [94m0.3650[0m     +  20.2563
      8   [36m0.2007[0m   0.6973        0.2299       0.9238        [94m0.3573[0m     +  20.0604
      9   0.1952   0.7021        [35m0.2240[0m       0.9105        0.3691        19.6982
     10   [36m0.2052[0m   [32m0.7134[0m        [35m0.2220[0m       0.9202        [94m0.3184[0m     +  20.1850
     11   0.2004   [32m0.7210[0m        [35m0.2195[0m       0.9202        [94m0.3092[0m     +  20.2856
     12   [36m0.2074[0m   0.7148        0.2223       [31m0.9274[0m        0.3202        19.9523
     13   [36m0.2201[0m   0.7192        [35m0.2181[0m       0.9238        0.3167        19.5420
     14   0.2087   0.7133        [35m0.2174[0m       0.9190        0.3464        19.8464
     15   0.2002   0.6972        [35m0.2148[0m       0.9190        0.3636        20.3496
     16   0.2087   0.7178        [35m0.2128[0m       0.9274        0.3096        20.0598
     17   0.1958   0.6974        0.2136       0.9262        [94m0.3022[0m     +  19.7599
     18   0.1953   0.7064        [35m0.2104[0m       0.9214        0.3141        20.8690
     19   0.1954   0.7037        [35m0.2077[0m       0.9238        0.3134        19.8226
     20   0.1949   0.7072        0.2080       0.9250        0.3158        19.5684
     21   0.1957   0.7114        [35m0.2061[0m       0.9250        0.3149        20.4122
     22   0.1870   0.6991        [35m0.2053[0m       0.9274        0.3029        20.5844
     23   0.2021   0.7120        [35m0.2042[0m       [31m0.9287[0m        0.3130        19.4917
     24   0.1948   0.7145        [35m0.2011[0m       0.9274        [94m0.2838[0m     +  19.9948
     25   0.2063   0.7155        0.2027       [31m0.9299[0m        0.2988        19.6878
     26   0.1921   0.6986        [35m0.1967[0m       0.9287        0.2916        19.7916
     27   0.1958   0.6983        0.1967       0.9287        [94m0.2831[0m     +  20.3932
     28   0.2087   0.7067        [35m0.1962[0m       0.9274        0.3021        20.7685
     29   0.2039   0.7119        [35m0.1945[0m       0.9287        0.2968        19.7230
     30   0.1852   0.7100        0.1949       0.9250        [94m0.2787[0m     +  19.4031
     31   0.1994   0.7151        [35m0.1916[0m       0.9238        0.2968        19.2919
     32   0.2047   0.7066        [35m0.1907[0m       0.9226        [94m0.2677[0m     +  19.4397
     33   0.1898   0.7051        [35m0.1868[0m       0.9274        0.2887        19.6091
     34   0.2028   0.7078        0.1883       0.9262        [94m0.2659[0m     +  19.5129
     35   0.2148   0.7200        0.1886       [31m0.9311[0m        0.2726        19.6826
     36   0.1755   0.7002        [35m0.1854[0m       0.9287        0.2728        20.0036
     37   0.1785   0.6950        [35m0.1849[0m       0.9287        0.2784        19.7375
     38   0.1863   0.6946        [35m0.1809[0m       0.9262        [94m0.2595[0m     +  19.8380
     39   0.1938   0.6846        [35m0.1800[0m       0.9238        0.2750        19.4666
     40   0.2056   0.7064        [35m0.1789[0m       0.9262        0.2640        19.9181
     41   0.2022   0.7073        [35m0.1779[0m       [31m0.9335[0m        0.2875        19.2992
     42   [36m0.2282[0m   0.7161        [35m0.1744[0m       0.9274        0.2692        19.4804
     43   0.2054   0.7177        [35m0.1718[0m       0.9238        [94m0.2562[0m     +  19.6231
     44   0.1990   0.7116        0.1730       0.9274        0.2581        19.5765
     45   0.2064   0.7130        0.1719       0.9274        [94m0.2515[0m     +  19.4807
     46   0.2276   [32m0.7407[0m        [35m0.1647[0m       0.9311        [94m0.2498[0m     +  19.6251
     47   0.2219   0.7042        0.1685       0.9323        0.2579        19.6795
     48   0.1755   0.6915        0.1675       0.9214        0.2910        19.8511
     49   0.1877   0.7065        0.1668       0.9238        0.2681        19.6780
     50   0.1882   0.6812        [35m0.1610[0m       0.9250        0.2904        20.1964
[32m[I 2023-05-02 10:13:02,319][0m Trial 98 finished with value: 0.2497668860541001 and parameters: {'lr': 0.0001876312409971585, 'dropout': 0.4620986586020618, 'd_model_multiplier': 16, 'num_layers': 4, 'n_heads': 16, 'dim_feedforward': 145, 'batch_size': 211, 'pos_encoding': 'fixed', 'activation': 'gelu', 'norm': 'BatchNorm', 'optimizer_name': 'AdamW', 'weight_decay': 0.1, 'top_n_features': 175}. Best is trial 12 with value: 0.20472501771481755.[0m
[FileBasedDataset] Initializing dataset...
	Examples: 8264
	Features: 231
	Max length: 315
Standard scalar turned ON, loading params from cache
[FileBasedDataset] Dataset initialization complete
  epoch    auprc    auroc    train_loss    valid_acc    valid_loss    cp     dur
-------  -------  -------  ------------  -----------  ------------  ----  ------
      1   [36m0.0544[0m   [32m0.3208[0m        [35m0.4753[0m       [31m0.9214[0m        [94m0.3350[0m     +  9.3686
      2   [36m0.2237[0m   [32m0.6614[0m        [35m0.2955[0m       0.9214        [94m0.2587[0m     +  9.2990
      3   [36m0.2246[0m   [32m0.6938[0m        [35m0.2658[0m       0.9214        [94m0.2496[0m     +  9.2979
      4   [36m0.2611[0m   [32m0.7173[0m        [35m0.2619[0m       0.9214        [94m0.2462[0m     +  9.7802
      5   0.2462   [32m0.7222[0m        [35m0.2608[0m       0.9214        0.2469        9.8154
      6   [36m0.2946[0m   [32m0.7367[0m        [35m0.2593[0m       0.9214        [94m0.2438[0m     +  9.8020
      7   [36m0.3112[0m   [32m0.7374[0m        [35m0.2569[0m       0.9214        0.2447        9.9008
      8   0.3031   [32m0.7404[0m        0.2586       0.9214        0.2456        9.8920
      9   0.2761   [32m0.7431[0m        0.2584       0.9214        0.2467        9.8815
     10   0.2787   0.7409        0.2584       0.9214        0.2484        9.7103
     11   0.2803   0.7422        0.2587       0.9214        0.2452        9.7150
     12   0.2970   [32m0.7482[0m        0.2573       0.9202        [94m0.2339[0m     +  9.9887
     13   [36m0.3151[0m   [32m0.7560[0m        [35m0.2556[0m       0.9202        0.2464        10.1998
     14   0.2858   0.7504        [35m0.2533[0m       0.9202        0.2543        10.3553
     15   0.2926   0.7482        [35m0.2491[0m       0.9214        0.2573        10.2055
     16   0.3065   0.7526        [35m0.2458[0m       0.9202        0.2524        9.5364
     17   0.2978   [32m0.7713[0m        0.2480       0.9202        0.2388        9.7009
     18   0.2792   0.7648        0.2483       0.9190        0.2408        9.5163
     19   0.2676   0.7572        0.2463       0.9202        0.2423        9.7851
     20   0.3039   0.7586        0.2465       0.9202        0.2435        9.7518
     21   0.2952   0.7654        [35m0.2425[0m       0.9202        0.2404        9.5935
Stopping since valid_loss has not improved in the last 10 epochs.
[32m[I 2023-05-02 10:16:37,620][0m Trial 99 finished with value: 0.23391489596291926 and parameters: {'lr': 0.0011706622963417394, 'dropout': 0.5697794996517608, 'd_model_multiplier': 2, 'num_layers': 4, 'n_heads': 4, 'dim_feedforward': 246, 'batch_size': 62, 'pos_encoding': 'fixed', 'activation': 'relu', 'norm': 'LayerNorm', 'optimizer_name': 'PlainRAdam', 'weight_decay': 0.01, 'top_n_features': 231}. Best is trial 12 with value: 0.20472501771481755.[0m
[FileBasedDataset] Initializing dataset...
	Examples: 8264
	Features: 161
	Max length: 315
Standard scalar turned ON, loading params from cache
[FileBasedDataset] Dataset initialization complete
  epoch    auprc    auroc    train_loss    valid_acc    valid_loss    cp      dur
-------  -------  -------  ------------  -----------  ------------  ----  -------
      1   [36m0.2607[0m   [32m0.7428[0m        [35m0.2838[0m       [31m0.9141[0m        [94m0.3907[0m     +  15.6446
      2   0.2574   0.7377        [35m0.2683[0m       [31m0.9190[0m        0.4131        15.4074
      3   0.2421   0.7212        [35m0.2661[0m       0.9117        [94m0.3234[0m     +  15.5907
      4   0.2177   0.6954        [35m0.2615[0m       0.9141        [94m0.2854[0m     +  15.8380
      5   [36m0.2769[0m   [32m0.7647[0m        [35m0.2600[0m       0.9154        0.3045        15.8335
      6   [36m0.2979[0m   [32m0.7777[0m        [35m0.2559[0m       [31m0.9202[0m        [94m0.2407[0m     +  15.9938
      7   0.2971   0.7722        [35m0.2514[0m       0.9154        [94m0.2326[0m     +  15.9894
      8   [36m0.3064[0m   [32m0.7916[0m        [35m0.2496[0m       0.9190        [94m0.2271[0m     +  16.1512
      9   0.3007   0.7730        [35m0.2476[0m       [31m0.9226[0m        0.2295        16.0589
     10   [36m0.3094[0m   [32m0.7938[0m        [35m0.2407[0m       0.9214        0.2295        16.0115
     11   [36m0.3330[0m   [32m0.8088[0m        [35m0.2406[0m       [31m0.9250[0m        [94m0.2200[0m     +  15.8953
     12   0.3264   [32m0.8113[0m        [35m0.2355[0m       0.9214        0.2399        16.0459
     13   0.3194   [32m0.8121[0m        [35m0.2353[0m       0.9154        0.2235        16.1460
     14   [36m0.3505[0m   0.8107        [35m0.2312[0m       0.9238        0.2236        15.7950
     15   0.3418   [32m0.8133[0m        0.2330       0.9214        0.2396        15.5826
     16   [36m0.3521[0m   [32m0.8151[0m        0.2335       [31m0.9274[0m        0.2334        15.6406
     17   0.3408   0.8117        [35m0.2311[0m       0.9141        0.2558        15.8080
     18   0.3433   0.8149        [35m0.2273[0m       0.9226        0.2434        15.8559
     19   0.3216   [32m0.8165[0m        0.2278       0.9202        0.2217        16.0517
     20   0.3509   0.8149        0.2288       0.9274        0.2221        15.6006
Stopping since valid_loss has not improved in the last 10 epochs.
[32m[I 2023-05-02 10:22:11,599][0m Trial 100 finished with value: 0.22003879040443625 and parameters: {'lr': 0.0005886282827996577, 'dropout': 0.44215785077198827, 'd_model_multiplier': 8, 'num_layers': 5, 'n_heads': 16, 'dim_feedforward': 129, 'batch_size': 36, 'pos_encoding': 'fixed', 'activation': 'gelu', 'norm': 'BatchNorm', 'optimizer_name': 'AdamW', 'weight_decay': 0.01, 'top_n_features': 161}. Best is trial 12 with value: 0.20472501771481755.[0m
[FileBasedDataset] Initializing dataset...
	Examples: 8264
	Features: 162
	Max length: 315
Standard scalar turned ON, loading params from cache
[FileBasedDataset] Dataset initialization complete
  epoch    auprc    auroc    train_loss    valid_acc    valid_loss    cp      dur
-------  -------  -------  ------------  -----------  ------------  ----  -------
      1   [36m0.1811[0m   [32m0.6742[0m        [35m0.2813[0m       [31m0.9214[0m        [94m0.4081[0m     +  16.9258
      2   [36m0.2122[0m   [32m0.7363[0m        [35m0.2499[0m       0.9081        [94m0.3711[0m     +  17.9274
      3   [36m0.2357[0m   0.7348        [35m0.2475[0m       0.9141        [94m0.3305[0m     +  17.6701
      4   0.2191   0.7276        [35m0.2444[0m       0.9166        0.3433        17.7011
      5   0.1808   0.7284        [35m0.2424[0m       [31m0.9274[0m        0.3396        17.7394
      6   0.1686   0.6638        0.2426       [31m0.9347[0m        [94m0.3241[0m     +  17.7629
      7   0.2017   0.7096        [35m0.2411[0m       0.9262        0.3421        17.9687
      8   0.1971   0.7352        [35m0.2389[0m       0.9250        [94m0.3171[0m     +  17.9945
      9   0.1104   0.6224        [35m0.2364[0m       0.9274        [94m0.2949[0m     +  18.0860
     10   0.1843   0.7208        0.2370       0.9238        0.3077        17.6527
     11   [36m0.2414[0m   [32m0.7710[0m        [35m0.2363[0m       0.9202        0.3081        17.7725
     12   0.2056   0.7383        [35m0.2315[0m       0.9214        [94m0.2854[0m     +  17.9622
     13   0.2278   0.7633        0.2338       0.9238        [94m0.2592[0m     +  17.6610
     14   0.2123   0.7538        [35m0.2313[0m       0.9262        0.2879        18.0695
     15   0.2099   0.7527        [35m0.2304[0m       0.9214        0.2857        17.5558
     16   0.1902   0.7352        [35m0.2289[0m       0.9262        0.2709        17.8977
     17   0.2138   [32m0.7810[0m        0.2297       0.9226        [94m0.2536[0m     +  17.5236
     18   0.2072   0.7796        [35m0.2247[0m       0.9214        0.2790        18.2112
     19   0.2372   0.7692        0.2280       0.9250        [94m0.2534[0m     +  17.9749
     20   0.2149   0.7588        0.2289       0.9238        0.2634        18.3460
     21   0.2319   0.7807        [35m0.2227[0m       0.9214        0.2646        17.9304
     22   0.2215   0.7737        0.2245       0.9202        0.2610        18.2587
     23   0.2412   [32m0.7812[0m        [35m0.2190[0m       0.9226        0.2670        17.9123
     24   0.2239   0.7730        0.2214       0.9226        0.2802        18.0096
     25   0.2018   0.7369        0.2240       0.9178        0.2717        18.2982
     26   0.2276   0.7401        0.2238       0.9238        0.2729        18.0822
     27   [36m0.2559[0m   [32m0.7871[0m        [35m0.2183[0m       0.9262        [94m0.2487[0m     +  18.0368
     28   0.2404   0.7838        0.2219       0.9190        0.2524        17.6705
     29   0.2379   0.7796        0.2189       0.9226        0.2640        17.8352
     30   0.2407   [32m0.7990[0m        [35m0.2155[0m       0.9154        0.2703        17.9540
     31   0.2328   0.7816        0.2180       0.9178        0.2564        17.6032
     32   [36m0.2574[0m   [32m0.8070[0m        [35m0.2155[0m       0.9202        [94m0.2401[0m     +  17.8671
     33   [36m0.2611[0m   [32m0.8109[0m        0.2180       0.9250        0.2474        17.8577
     34   0.2362   0.7975        0.2179       0.9226        0.2556        18.2524
     35   0.2539   0.8027        [35m0.2106[0m       0.9202        0.2432        17.8223
     36   0.2531   0.7973        0.2119       0.9262        [94m0.2371[0m     +  17.9413
     37   [36m0.2611[0m   0.8081        0.2140       0.9274        [94m0.2125[0m     +  18.0892
     38   [36m0.2659[0m   0.8105        0.2161       0.9238        0.2218        17.9866
     39   0.2374   0.7964        0.2121       0.9274        0.2450        17.8242
     40   0.2477   0.8078        0.2115       0.9202        0.2474        17.7530
     41   0.2613   0.8031        0.2126       0.9250        0.2395        17.9973
     42   0.2600   0.8003        0.2108       0.9214        0.2310        17.5465
     43   0.2382   0.8037        0.2128       0.9226        0.2411        18.0244
     44   0.2427   0.7944        [35m0.2069[0m       0.9226        0.2529        18.8276
     45   0.2399   0.8092        0.2108       0.9202        0.2561        18.0570
     46   0.2531   0.7965        0.2088       0.9214        0.2493        18.0130
Stopping since valid_loss has not improved in the last 10 epochs.
[32m[I 2023-05-02 10:36:15,171][0m Trial 101 finished with value: 0.21249047754177014 and parameters: {'lr': 0.0005734528505978846, 'dropout': 0.4419204571600452, 'd_model_multiplier': 8, 'num_layers': 5, 'n_heads': 16, 'dim_feedforward': 129, 'batch_size': 135, 'pos_encoding': 'fixed', 'activation': 'gelu', 'norm': 'BatchNorm', 'optimizer_name': 'AdamW', 'weight_decay': 0.01, 'top_n_features': 162}. Best is trial 12 with value: 0.20472501771481755.[0m
[FileBasedDataset] Initializing dataset...
	Examples: 8264
	Features: 170
	Max length: 315
Standard scalar turned ON, loading params from cache
[FileBasedDataset] Dataset initialization complete
  epoch    auprc    auroc    train_loss    valid_acc    valid_loss    cp      dur
-------  -------  -------  ------------  -----------  ------------  ----  -------
      1   [36m0.1948[0m   [32m0.6401[0m        [35m0.2862[0m       [31m0.9214[0m        [94m0.3105[0m     +  18.1235
      2   [36m0.2528[0m   0.6395        [35m0.2528[0m       [31m0.9274[0m        [94m0.2540[0m     +  17.7536
      3   0.2286   [32m0.6917[0m        [35m0.2497[0m       0.9250        0.2795        18.1309
      4   [36m0.2805[0m   [32m0.7159[0m        [35m0.2483[0m       0.9238        0.2756        17.7289
      5   0.2612   [32m0.7232[0m        [35m0.2478[0m       0.9250        [94m0.2403[0m     +  17.6022
      6   [36m0.2886[0m   [32m0.7767[0m        [35m0.2391[0m       0.9226        0.2469        18.3639
      7   [36m0.2944[0m   0.6949        0.2461       [31m0.9311[0m        0.2448        18.0745
      8   [36m0.3345[0m   0.7688        [35m0.2388[0m       0.9274        0.2702        18.0920
      9   0.2835   0.7650        [35m0.2381[0m       0.9069        0.2855        18.2542
     10   0.2944   0.7540        0.2410       0.9274        0.2664        17.7829
     11   0.3012   0.7447        [35m0.2379[0m       0.9262        0.2776        18.1911
     12   0.3051   0.6591        [35m0.2358[0m       0.9311        0.2500        17.8799
     13   0.2955   0.7168        [35m0.2356[0m       0.9274        0.2739        18.2123
     14   0.2835   0.6711        [35m0.2297[0m       0.9287        0.2487        18.3690
Stopping since valid_loss has not improved in the last 10 epochs.
[32m[I 2023-05-02 10:40:46,607][0m Trial 102 finished with value: 0.24025381912343302 and parameters: {'lr': 0.0006378784873502885, 'dropout': 0.44501196409116495, 'd_model_multiplier': 8, 'num_layers': 5, 'n_heads': 16, 'dim_feedforward': 396, 'batch_size': 127, 'pos_encoding': 'fixed', 'activation': 'gelu', 'norm': 'BatchNorm', 'optimizer_name': 'AdamW', 'weight_decay': 0.01, 'top_n_features': 170}. Best is trial 12 with value: 0.20472501771481755.[0m
[FileBasedDataset] Initializing dataset...
	Examples: 8264
	Features: 161
	Max length: 315
Standard scalar turned ON, loading params from cache
[FileBasedDataset] Dataset initialization complete
  epoch    auprc    auroc    train_loss    valid_acc    valid_loss    cp      dur
-------  -------  -------  ------------  -----------  ------------  ----  -------
      1   [36m0.1589[0m   [32m0.6918[0m        [35m0.3214[0m       [31m0.9250[0m        [94m0.2693[0m     +  20.1948
      2   [36m0.2453[0m   [32m0.7535[0m        [35m0.2764[0m       0.9093        [94m0.2519[0m     +  20.2478
      3   0.2240   0.7430        0.2777       0.9250        [94m0.2507[0m     +  20.5898
      4   0.2143   0.7317        [35m0.2669[0m       0.9202        [94m0.2470[0m     +  21.1708
      5   0.2000   0.7181        0.2720       0.9226        0.2560        20.7043
      6   0.1905   0.7160        0.2795       0.9250        [94m0.2416[0m     +  20.8027
      7   0.2046   0.7287        0.3047       0.9238        0.2446        20.6571
      8   0.1879   0.7312        0.2941       0.9250        0.2436        20.7116
      9   0.1845   0.7265        0.2825       0.9250        0.2423        20.6428
     10   0.2071   0.7388        0.2822       0.9238        0.2444        20.9949
     11   0.1703   0.6757        0.2840       0.9250        0.2513        20.8940
     12   0.1928   0.7259        0.2835       0.9250        0.2500        21.2416
     13   0.1925   0.7330        0.2738       0.9214        0.2451        20.9136
     14   0.1854   0.7337        0.2786       0.9093        0.2629        20.8149
     15   0.1897   0.7332        0.2737       0.9238        0.2508        20.7369
Stopping since valid_loss has not improved in the last 10 epochs.
