[32m[I 2023-05-04 21:23:51,100][0m Trial 496 finished with value: 0.26224948581141455 and parameters: {'lr': 0.007802251748834195, 'dropout': 0.23609379488921695, 'd_model_multiplier': 4, 'num_layers': 6, 'n_heads': 32, 'dim_feedforward': 367, 'batch_size': 77, 'pos_encoding': 'fixed', 'activation': 'relu', 'norm': 'LayerNorm', 'optimizer_name': 'AdamW', 'weight_decay': 0.1, 'top_n_features': 78}. Best is trial 246 with value: 0.16447311791139763.[0m
[FileBasedDataset] Initializing dataset...
	Examples: 8264
	Features: 99
	Max length: 315
Standard scalar turned ON, loading params from cache
[FileBasedDataset] Dataset initialization complete
  epoch    auprc    auroc    train_loss    valid_acc    valid_loss    cp      dur
-------  -------  -------  ------------  -----------  ------------  ----  -------
      1   [36m0.0708[0m   [32m0.3450[0m        [35m0.5711[0m       [31m0.9166[0m        [94m0.5523[0m     +  32.0253
      2   [36m0.0907[0m   [32m0.4367[0m        [35m0.4041[0m       0.9166        [94m0.4294[0m     +  31.8275
      3   [36m0.2006[0m   [32m0.6361[0m        [35m0.3151[0m       0.9166        [94m0.3628[0m     +  32.2401
      4   [36m0.2618[0m   [32m0.7054[0m        [35m0.2818[0m       [31m0.9190[0m        [94m0.3316[0m     +  32.1925
      5   [36m0.2737[0m   [32m0.7290[0m        [35m0.2690[0m       0.9178        [94m0.3178[0m     +  32.2104
      6   [36m0.2794[0m   [32m0.7411[0m        [35m0.2658[0m       [31m0.9202[0m        [94m0.3039[0m     +  32.2941
      7   [36m0.2825[0m   [32m0.7458[0m        [35m0.2593[0m       [31m0.9214[0m        [94m0.2976[0m     +  32.2133
      8   [36m0.2878[0m   [32m0.7485[0m        0.2619       0.9214        [94m0.2945[0m     +  32.2966
      9   [36m0.2878[0m   [32m0.7526[0m        [35m0.2570[0m       0.9202        [94m0.2924[0m     +  32.0886
     10   [36m0.2936[0m   [32m0.7551[0m        [35m0.2568[0m       0.9214        0.2928        32.2456
     11   [36m0.3017[0m   0.7530        [35m0.2512[0m       0.9214        [94m0.2818[0m     +  32.2286
     12   [36m0.3068[0m   [32m0.7578[0m        0.2525       0.9202        0.2849        32.2508
     13   0.3050   0.7528        0.2528       0.9214        [94m0.2805[0m     +  32.3442
     14   0.3001   0.7545        [35m0.2509[0m       0.9190        [94m0.2780[0m     +  32.0366
     15   0.2986   0.7523        [35m0.2508[0m       0.9190        [94m0.2732[0m     +  32.1553
     16   0.2987   0.7538        [35m0.2486[0m       0.9178        [94m0.2731[0m     +  32.3442
     17   0.2912   0.7547        [35m0.2471[0m       0.9202        [94m0.2677[0m     +  32.2599
     18   0.2892   0.7511        0.2471       0.9202        [94m0.2658[0m     +  31.8839
     19   0.2910   0.7531        [35m0.2457[0m       0.9202        [94m0.2622[0m     +  32.0994
     20   0.2827   0.7451        [35m0.2439[0m       0.9202        0.2647        32.2655
     21   0.2895   0.7490        [35m0.2418[0m       0.9202        0.2623        32.2883
     22   0.2913   0.7549        [35m0.2414[0m       0.9190        [94m0.2585[0m     +  32.3831
     23   0.2905   0.7527        0.2421       0.9190        0.2604        32.2621
     24   0.2850   0.7531        0.2417       0.9190        0.2599        32.1969
     25   0.2865   0.7519        [35m0.2398[0m       0.9178        0.2600        32.1888
     26   0.2877   0.7534        [35m0.2368[0m       0.9190        [94m0.2551[0m     +  32.4211
     27   0.2968   [32m0.7580[0m        0.2383       0.9190        [94m0.2548[0m     +  32.2764
     28   0.2909   0.7507        [35m0.2340[0m       0.9178        0.2561        32.6759
     29   0.2872   0.7549        0.2388       0.9190        [94m0.2530[0m     +  32.2730
     30   0.2876   0.7519        0.2366       0.9190        0.2538        32.4528
     31   0.2840   0.7484        0.2375       0.9202        0.2537        32.1562
     32   0.2841   0.7498        0.2348       0.9202        0.2537        32.2106
     33   0.2836   0.7482        0.2351       0.9202        [94m0.2524[0m     +  32.1064
     34   0.2849   0.7489        0.2351       0.9190        0.2531        32.0677
     35   0.2811   0.7492        0.2349       0.9190        0.2535        32.3299
     36   0.2829   0.7518        [35m0.2307[0m       0.9202        [94m0.2520[0m     +  32.1795
     37   0.2788   0.7475        [35m0.2302[0m       0.9190        [94m0.2519[0m     +  32.0285
     38   0.2877   0.7528        [35m0.2281[0m       0.9214        [94m0.2506[0m     +  32.2847
     39   0.2779   0.7486        [35m0.2270[0m       0.9202        0.2524        32.1449
     40   0.2773   0.7493        0.2299       0.9202        0.2522        32.1636
     41   0.2728   0.7440        0.2310       0.9202        0.2537        32.2131
     42   0.2747   0.7444        [35m0.2260[0m       0.9214        0.2542        32.2293
     43   0.2741   0.7461        0.2266       0.9202        0.2536        32.1492
     44   0.2774   0.7526        0.2274       0.9202        0.2523        32.1326
     45   0.2805   0.7555        [35m0.2246[0m       0.9214        0.2517        31.8356
     46   0.2759   0.7540        [35m0.2231[0m       0.9202        0.2518        32.2895
     47   0.2707   0.7482        0.2238       0.9202        0.2549        32.2229
Stopping since valid_loss has not improved in the last 10 epochs.
[32m[I 2023-05-04 21:49:40,663][0m Trial 497 finished with value: 0.25062639403191844 and parameters: {'lr': 2.59204628011979e-05, 'dropout': 0.4317016895563515, 'd_model_multiplier': 4, 'num_layers': 7, 'n_heads': 32, 'dim_feedforward': 357, 'batch_size': 63, 'pos_encoding': 'fixed', 'activation': 'gelu', 'norm': 'BatchNorm', 'optimizer_name': 'RAdam', 'weight_decay': 0.1, 'top_n_features': 99}. Best is trial 246 with value: 0.16447311791139763.[0m
[FileBasedDataset] Initializing dataset...
	Examples: 8264
	Features: 72
	Max length: 315
Standard scalar turned ON, loading params from cache
[FileBasedDataset] Dataset initialization complete
  epoch    auprc    auroc    train_loss    valid_acc    valid_loss    cp      dur
-------  -------  -------  ------------  -----------  ------------  ----  -------
      1   [36m0.0659[0m   [32m0.3686[0m        [35m0.5902[0m       [31m0.9262[0m        [94m0.4565[0m     +  10.3553
      2   [36m0.0797[0m   [32m0.4799[0m        [35m0.3918[0m       0.9262        [94m0.3048[0m     +  10.5275
      3   [36m0.1913[0m   [32m0.6276[0m        [35m0.2994[0m       0.9262        [94m0.2601[0m     +  10.7532
      4   [36m0.1999[0m   [32m0.6642[0m        [35m0.2676[0m       0.9262        [94m0.2486[0m     +  10.5778
      5   [36m0.2166[0m   [32m0.6986[0m        [35m0.2546[0m       0.9262        [94m0.2421[0m     +  10.5410
      6   [36m0.2194[0m   [32m0.7219[0m        [35m0.2465[0m       0.9262        [94m0.2384[0m     +  10.7118
      7   [36m0.2203[0m   [32m0.7334[0m        [35m0.2410[0m       0.9238        [94m0.2370[0m     +  10.4583
      8   [36m0.2295[0m   [32m0.7399[0m        [35m0.2375[0m       0.9214        [94m0.2362[0m     +  10.5517
      9   0.2105   0.7396        [35m0.2355[0m       0.9202        0.2369        10.8147
     10   0.2166   [32m0.7444[0m        [35m0.2341[0m       0.9190        0.2371        10.8015
     11   0.2124   [32m0.7463[0m        [35m0.2324[0m       0.9178        0.2380        10.5869
     12   0.2149   [32m0.7483[0m        [35m0.2309[0m       0.9141        0.2387        10.7995
     13   0.2139   0.7479        [35m0.2292[0m       0.9154        0.2404        10.5968
     14   0.2140   0.7479        0.2305       0.9141        0.2400        10.5792
     15   0.2127   [32m0.7493[0m        [35m0.2288[0m       0.9141        0.2411        10.4964
     16   0.2119   [32m0.7500[0m        [35m0.2265[0m       0.9141        0.2419        10.7821
     17   0.2126   [32m0.7513[0m        [35m0.2262[0m       0.9141        0.2424        10.6561
Stopping since valid_loss has not improved in the last 10 epochs.
[32m[I 2023-05-04 21:52:52,639][0m Trial 498 finished with value: 0.23616621532492077 and parameters: {'lr': 4.987050561784107e-05, 'dropout': 0.2879379202582376, 'd_model_multiplier': 4, 'num_layers': 5, 'n_heads': 8, 'dim_feedforward': 345, 'batch_size': 54, 'pos_encoding': 'fixed', 'activation': 'relu', 'norm': 'LayerNorm', 'optimizer_name': 'PlainRAdam', 'weight_decay': 0.001, 'top_n_features': 72}. Best is trial 246 with value: 0.16447311791139763.[0m
[FileBasedDataset] Initializing dataset...
	Examples: 8264
	Features: 55
	Max length: 315
Standard scalar turned ON, loading params from cache
[FileBasedDataset] Dataset initialization complete
  epoch    auprc    auroc    train_loss    valid_acc    valid_loss    cp      dur
-------  -------  -------  ------------  -----------  ------------  ----  -------
      1   [36m0.2413[0m   [32m0.7836[0m        [35m0.3699[0m       [31m0.9166[0m        [94m0.2440[0m     +  13.2872
      2   [36m0.2970[0m   [32m0.7996[0m        [35m0.2390[0m       0.9154        [94m0.2339[0m     +  13.5060
      3   [36m0.3129[0m   [32m0.8030[0m        [35m0.2336[0m       0.9166        [94m0.2329[0m     +  13.4701
      4   [36m0.3169[0m   [32m0.8046[0m        [35m0.2300[0m       [31m0.9178[0m        0.2354        13.4475
      5   0.3073   0.8011        [35m0.2280[0m       [31m0.9190[0m        0.2390        13.5586
      6   0.2997   [32m0.8054[0m        [35m0.2244[0m       0.9166        0.2421        13.5185
      7   0.2935   0.7999        [35m0.2231[0m       0.9154        0.2458        13.4162
      8   0.2919   0.7908        [35m0.2211[0m       0.9141        0.2482        13.5482
      9   0.2802   0.7725        [35m0.2176[0m       0.9141        0.2523        13.7601
     10   0.2884   0.7803        0.2182       0.9141        0.2512        13.4229
     11   0.2770   0.7693        [35m0.2145[0m       0.9141        0.2557        13.4601
     12   0.2763   0.7703        [35m0.2128[0m       0.9141        0.2558        13.5559
Stopping since valid_loss has not improved in the last 10 epochs.
[32m[I 2023-05-04 21:55:48,555][0m Trial 499 finished with value: 0.23288851724137993 and parameters: {'lr': 9.890012232299579e-05, 'dropout': 0.26732204857915015, 'd_model_multiplier': 8, 'num_layers': 4, 'n_heads': 16, 'dim_feedforward': 378, 'batch_size': 37, 'pos_encoding': 'fixed', 'activation': 'relu', 'norm': 'LayerNorm', 'optimizer_name': 'RAdam', 'weight_decay': 0.1, 'top_n_features': 55}. Best is trial 246 with value: 0.16447311791139763.[0m
[FileBasedDataset] Initializing dataset...
	Examples: 8264
	Features: 62
	Max length: 315
Standard scalar turned ON, loading params from cache
[FileBasedDataset] Dataset initialization complete
  epoch    auprc    auroc    train_loss    valid_acc    valid_loss    cp      dur
-------  -------  -------  ------------  -----------  ------------  ----  -------
      1   [36m0.2760[0m   [32m0.7640[0m        [35m0.2940[0m       [31m0.9033[0m        [94m0.2650[0m     +  26.9770
      2   [36m0.2925[0m   [32m0.7679[0m        [35m0.2367[0m       0.9021        [94m0.2635[0m     +  27.1520
      3   [36m0.3124[0m   [32m0.7830[0m        [35m0.2323[0m       [31m0.9105[0m        [94m0.2609[0m     +  27.2795
      4   [36m0.3163[0m   [32m0.7904[0m        [35m0.2311[0m       0.9105        [94m0.2595[0m     +  27.2641
      5   0.3141   [32m0.7909[0m        [35m0.2295[0m       0.9105        0.2623        27.1046
      6   [36m0.3307[0m   [32m0.7988[0m        [35m0.2287[0m       0.9105        [94m0.2571[0m     +  27.2017
      7   0.3187   0.7986        [35m0.2281[0m       0.9093        0.2614        27.3971
      8   [36m0.3353[0m   [32m0.8036[0m        [35m0.2276[0m       [31m0.9141[0m        0.2589        27.3841
      9   0.3329   [32m0.8084[0m        [35m0.2258[0m       0.9105        [94m0.2558[0m     +  27.4541
     10   [36m0.3406[0m   [32m0.8110[0m        [35m0.2249[0m       0.9141        [94m0.2535[0m     +  27.2400
     11   [36m0.3428[0m   [32m0.8141[0m        [35m0.2228[0m       0.9141        0.2543        27.2836
     12   0.3423   [32m0.8179[0m        0.2237       0.9117        [94m0.2525[0m     +  27.3194
     13   [36m0.3444[0m   [32m0.8201[0m        [35m0.2218[0m       0.9129        0.2533        27.3777
     14   [36m0.3472[0m   [32m0.8224[0m        [35m0.2208[0m       0.9129        0.2527        27.1833
     15   0.3464   0.8196        0.2215       0.9117        [94m0.2525[0m     +  27.3556
     16   [36m0.3502[0m   [32m0.8244[0m        [35m0.2195[0m       0.9141        [94m0.2522[0m     +  27.3517
     17   [36m0.3571[0m   0.8238        [35m0.2182[0m       0.9117        [94m0.2511[0m     +  27.3491
     18   [36m0.3581[0m   0.8233        [35m0.2182[0m       [31m0.9154[0m        [94m0.2508[0m     +  27.2234
     19   [36m0.3629[0m   [32m0.8268[0m        0.2200       0.9117        [94m0.2502[0m     +  27.4093
     20   0.3580   0.8220        0.2195       0.9129        0.2519        27.2226
     21   0.3602   0.8232        [35m0.2172[0m       0.9129        0.2509        27.1068
     22   0.3547   0.8234        [35m0.2159[0m       0.9141        0.2503        27.1272
     23   0.3513   0.8198        [35m0.2131[0m       0.9129        0.2547        26.9298
     24   0.3576   [32m0.8283[0m        [35m0.2130[0m       0.9141        0.2514        27.2413
     25   0.3525   0.8239        0.2140       0.9129        0.2528        26.9530
     26   0.3557   0.8262        0.2139       0.9129        0.2522        27.0861
     27   0.3539   0.8224        0.2146       0.9141        0.2536        27.2112
     28   0.3404   0.8190        [35m0.2120[0m       0.9129        0.2571        27.2383
Stopping since valid_loss has not improved in the last 10 epochs.
[32m[I 2023-05-04 22:08:59,962][0m Trial 500 finished with value: 0.2502186149989391 and parameters: {'lr': 3.5975376604777725e-05, 'dropout': 0.40742732962006545, 'd_model_multiplier': 2, 'num_layers': 6, 'n_heads': 32, 'dim_feedforward': 316, 'batch_size': 18, 'pos_encoding': 'learnable', 'activation': 'relu', 'norm': 'LayerNorm', 'optimizer_name': 'AdamW', 'weight_decay': 0.1, 'top_n_features': 62}. Best is trial 246 with value: 0.16447311791139763.[0m
[FileBasedDataset] Initializing dataset...
	Examples: 8264
	Features: 183
	Max length: 315
Standard scalar turned ON, loading params from cache
[FileBasedDataset] Dataset initialization complete
  epoch    auprc    auroc    train_loss    valid_acc    valid_loss    cp      dur
-------  -------  -------  ------------  -----------  ------------  ----  -------
      1   [36m0.0601[0m   [32m0.4747[0m        [35m0.5775[0m       [31m0.9371[0m        [94m0.4740[0m     +  19.8901
      2   0.0548   0.4373        [35m0.4425[0m       0.9371        [94m0.3318[0m     +  20.0567
      3   [36m0.0703[0m   [32m0.5502[0m        [35m0.3484[0m       0.9371        [94m0.2638[0m     +  20.5794
      4   [36m0.1278[0m   [32m0.6153[0m        [35m0.3013[0m       0.9371        [94m0.2385[0m     +  20.1094
      5   [36m0.1451[0m   [32m0.6446[0m        [35m0.2786[0m       0.9371        [94m0.2292[0m     +  20.6428
      6   [36m0.1534[0m   [32m0.6575[0m        [35m0.2676[0m       0.9371        [94m0.2255[0m     +  20.2301
      7   [36m0.1623[0m   [32m0.6654[0m        [35m0.2607[0m       0.9371        [94m0.2238[0m     +  20.4638
      8   [36m0.1656[0m   [32m0.6699[0m        [35m0.2568[0m       0.9371        [94m0.2229[0m     +  20.2551
      9   [36m0.1669[0m   [32m0.6739[0m        [35m0.2548[0m       0.9371        [94m0.2222[0m     +  20.4659
     10   [36m0.1762[0m   [32m0.6784[0m        [35m0.2521[0m       0.9371        [94m0.2216[0m     +  20.2709
     11   [36m0.1815[0m   [32m0.6852[0m        [35m0.2502[0m       0.9371        [94m0.2208[0m     +  20.3478
     12   [36m0.1873[0m   [32m0.6910[0m        [35m0.2486[0m       0.9359        [94m0.2204[0m     +  20.2878
     13   [36m0.1993[0m   [32m0.6991[0m        [35m0.2471[0m       0.9359        [94m0.2194[0m     +  20.3635
     14   0.1990   [32m0.7049[0m        [35m0.2455[0m       0.9371        [94m0.2184[0m     +  20.4229
     15   [36m0.2044[0m   [32m0.7125[0m        [35m0.2437[0m       0.9371        [94m0.2184[0m     +  20.3738
     16   [36m0.2107[0m   [32m0.7179[0m        [35m0.2427[0m       0.9359        [94m0.2178[0m     +  20.2788
     17   [36m0.2164[0m   [32m0.7220[0m        [35m0.2413[0m       0.9299        0.2180        20.3011
     18   0.2130   [32m0.7253[0m        [35m0.2406[0m       0.9311        0.2180        20.0470
     19   0.2158   [32m0.7275[0m        [35m0.2392[0m       0.9299        [94m0.2177[0m     +  19.8873
     20   0.2149   [32m0.7281[0m        [35m0.2388[0m       0.9299        0.2179        20.3754
     21   [36m0.2195[0m   [32m0.7306[0m        0.2391       0.9299        0.2185        20.2556
     22   [36m0.2288[0m   [32m0.7325[0m        [35m0.2384[0m       0.9299        0.2185        20.3611
     23   [36m0.2307[0m   [32m0.7328[0m        0.2387       0.9311        0.2182        20.3151
     24   0.2264   [32m0.7337[0m        [35m0.2376[0m       0.9323        [94m0.2177[0m     +  20.2493
     25   [36m0.2319[0m   [32m0.7371[0m        [35m0.2360[0m       0.9311        [94m0.2175[0m     +  20.1543
     26   [36m0.2334[0m   [32m0.7377[0m        0.2374       0.9311        0.2179        20.3567
     27   [36m0.2360[0m   [32m0.7391[0m        [35m0.2351[0m       0.9335        [94m0.2168[0m     +  20.2875
     28   [36m0.2404[0m   [32m0.7408[0m        [35m0.2346[0m       0.9335        0.2177        20.0403
     29   [36m0.2414[0m   [32m0.7412[0m        [35m0.2341[0m       0.9347        0.2192        20.2799
     30   0.2399   [32m0.7425[0m        0.2347       0.9347        0.2173        20.2274
     31   0.2395   [32m0.7439[0m        [35m0.2324[0m       0.9323        0.2192        20.7784
     32   [36m0.2424[0m   [32m0.7443[0m        0.2333       0.9299        0.2198        20.5530
     33   0.2416   [32m0.7457[0m        [35m0.2323[0m       0.9274        0.2211        20.5345
     34   [36m0.2432[0m   0.7454        0.2335       0.9274        0.2205        20.4978
     35   [36m0.2450[0m   0.7454        0.2329       0.9299        0.2182        20.2551
     36   [36m0.2476[0m   [32m0.7474[0m        0.2326       0.9287        0.2196        20.3246
Stopping since valid_loss has not improved in the last 10 epochs.
[32m[I 2023-05-04 22:21:33,197][0m Trial 501 finished with value: 0.21684558655359437 and parameters: {'lr': 1.0729459312744097e-05, 'dropout': 0.46387891391531133, 'd_model_multiplier': 4, 'num_layers': 4, 'n_heads': 32, 'dim_feedforward': 333, 'batch_size': 59, 'pos_encoding': 'fixed', 'activation': 'relu', 'norm': 'LayerNorm', 'optimizer_name': 'RAdam', 'weight_decay': 0.1, 'top_n_features': 183}. Best is trial 246 with value: 0.16447311791139763.[0m
[FileBasedDataset] Initializing dataset...
	Examples: 8264
	Features: 59
	Max length: 315
Standard scalar turned ON, loading params from cache
[FileBasedDataset] Dataset initialization complete
Warning, assumed runtime error: CUDA out of memory. Tried to allocate 1.68 GiB (GPU 0; 23.70 GiB total capacity; 19.05 GiB already allocated; 795.25 MiB free; 21.83 GiB reserved in total by PyTorch) If reserved memory is >> allocated memory try setting max_split_size_mb to avoid fragmentation.  See documentation for Memory Management and PYTORCH_CUDA_ALLOC_CONF
[32m[I 2023-05-04 22:21:37,695][0m Trial 502 finished with value: 100.0 and parameters: {'lr': 2.475658984923004e-06, 'dropout': 0.16727086636019955, 'd_model_multiplier': 32, 'num_layers': 5, 'n_heads': 64, 'dim_feedforward': 428, 'batch_size': 71, 'pos_encoding': 'fixed', 'activation': 'gelu', 'norm': 'BatchNorm', 'optimizer_name': 'RAdam', 'weight_decay': 0.001, 'top_n_features': 59}. Best is trial 246 with value: 0.16447311791139763.[0m
[FileBasedDataset] Initializing dataset...
	Examples: 8264
	Features: 68
	Max length: 315
Standard scalar turned ON, loading params from cache
[FileBasedDataset] Dataset initialization complete
  epoch    auprc    auroc    train_loss    valid_acc    valid_loss    cp     dur
-------  -------  -------  ------------  -----------  ------------  ----  ------
      1   [36m0.3652[0m   [32m0.8050[0m        [35m0.2658[0m       [31m0.9274[0m        [94m0.2291[0m     +  8.3324
      2   0.2422   0.7632        [35m0.2656[0m       0.9190        0.2561        8.7026
      3   0.2420   0.7579        [35m0.2607[0m       0.9166        0.2447        9.0133
      4   0.2305   0.7553        0.2611       0.9190        0.2584        9.0915
      5   0.2371   0.7558        [35m0.2604[0m       0.9190        0.2648        9.2237
      6   0.2442   0.7517        0.2620       0.9190        0.2694        9.1808
      7   0.2394   0.7603        0.2617       0.9190        0.2562        9.0593
      8   0.2642   0.7624        [35m0.2597[0m       0.9154        0.2530        9.3177
      9   0.2470   0.7568        0.2610       0.9190        0.2586        9.4337
     10   0.2553   0.7630        [35m0.2589[0m       0.9190        0.2503        9.1898
Stopping since valid_loss has not improved in the last 10 epochs.
