[32m[I 2023-05-03 00:06:04,711][0m Trial 233 finished with value: 0.21902460533733667 and parameters: {'lr': 0.0010837949510680012, 'dropout': 0.5600587721085268, 'd_model_multiplier': 2, 'num_layers': 2, 'n_heads': 64, 'dim_feedforward': 303, 'batch_size': 21, 'pos_encoding': 'fixed', 'activation': 'gelu', 'norm': 'BatchNorm', 'optimizer_name': 'AdamW', 'weight_decay': 0.001, 'top_n_features': 35}. Best is trial 117 with value: 0.191397856754288.[0m
[FileBasedDataset] Initializing dataset...
	Examples: 8264
	Features: 54
	Max length: 315
Standard scalar turned ON, loading params from cache
[FileBasedDataset] Dataset initialization complete
  epoch    auprc    auroc    train_loss    valid_acc    valid_loss    cp      dur
-------  -------  -------  ------------  -----------  ------------  ----  -------
      1   [36m0.2314[0m   [32m0.7527[0m        [35m0.3288[0m       [31m0.9238[0m        [94m0.4074[0m     +  21.8984
      2   [36m0.2605[0m   [32m0.7582[0m        [35m0.2671[0m       [31m0.9323[0m        [94m0.3153[0m     +  21.8716
      3   [36m0.3027[0m   [32m0.7804[0m        [35m0.2598[0m       0.9299        [94m0.2684[0m     +  22.5462
      4   0.2759   0.7787        [35m0.2562[0m       0.9299        [94m0.2334[0m     +  22.1830
      5   [36m0.3033[0m   [32m0.7968[0m        [35m0.2467[0m       [31m0.9347[0m        [94m0.2323[0m     +  22.3459
      6   0.2731   [32m0.8086[0m        [35m0.2458[0m       0.9250        [94m0.2226[0m     +  22.3034
      7   0.2738   0.8030        [35m0.2391[0m       0.9274        [94m0.2141[0m     +  22.4536
      8   [36m0.3161[0m   0.8002        0.2402       0.9299        0.2175        22.2504
      9   [36m0.3451[0m   [32m0.8160[0m        0.2394       0.9287        [94m0.2107[0m     +  22.2548
     10   0.3391   [32m0.8221[0m        [35m0.2377[0m       0.9274        [94m0.2071[0m     +  22.3236
     11   0.3283   [32m0.8306[0m        0.2432       0.9299        0.2077        22.2782
     12   0.3403   0.8238        0.2401       0.9335        [94m0.2052[0m     +  22.4126
     13   [36m0.3502[0m   0.8057        0.2400       0.9335        0.2080        22.4534
     14   0.3158   [32m0.8352[0m        [35m0.2364[0m       0.9323        0.2089        22.2905
     15   0.3181   0.8286        [35m0.2317[0m       0.9335        0.2110        22.5956
     16   0.3360   0.8216        0.2350       0.9274        0.2091        22.4411
     17   0.3213   0.8279        0.2322       0.9214        0.2237        22.2462
     18   0.2956   0.7853        0.2328       0.9274        0.2152        22.4516
     19   0.2877   0.7880        0.2319       0.9274        0.2161        22.4031
     20   [36m0.3560[0m   0.8164        0.2319       0.9323        0.2080        22.1204
     21   0.3190   0.8140        [35m0.2291[0m       0.9335        0.2126        22.4854
Stopping since valid_loss has not improved in the last 10 epochs.
[32m[I 2023-05-03 00:14:17,121][0m Trial 234 finished with value: 0.2052096268105824 and parameters: {'lr': 0.0005836620267634272, 'dropout': 0.4458859352365449, 'd_model_multiplier': 8, 'num_layers': 4, 'n_heads': 32, 'dim_feedforward': 317, 'batch_size': 66, 'pos_encoding': 'fixed', 'activation': 'gelu', 'norm': 'BatchNorm', 'optimizer_name': 'PlainRAdam', 'weight_decay': 0.1, 'top_n_features': 54}. Best is trial 117 with value: 0.191397856754288.[0m
[FileBasedDataset] Initializing dataset...
	Examples: 8264
	Features: 53
	Max length: 315
Standard scalar turned ON, loading params from cache
[FileBasedDataset] Dataset initialization complete
  epoch    auprc    auroc    train_loss    valid_acc    valid_loss    cp      dur
-------  -------  -------  ------------  -----------  ------------  ----  -------
      1   [36m0.1839[0m   [32m0.7854[0m        [35m0.2678[0m       [31m0.9383[0m        [94m0.1950[0m     +  21.0803
      2   [36m0.2060[0m   [32m0.7931[0m        [35m0.2482[0m       0.9323        0.1998        21.6641
      3   [36m0.2066[0m   [32m0.7991[0m        [35m0.2430[0m       0.9250        0.2073        21.3239
      4   [36m0.2271[0m   [32m0.8057[0m        [35m0.2424[0m       0.9287        0.2023        21.5036
      5   [36m0.2437[0m   [32m0.8113[0m        [35m0.2408[0m       0.9323        [94m0.1877[0m     +  21.8421
      6   [36m0.2755[0m   0.8042        [35m0.2348[0m       0.9371        0.1930        21.6439
      7   0.2572   [32m0.8137[0m        [35m0.2341[0m       0.9347        [94m0.1845[0m     +  21.6280
      8   0.2284   [32m0.8173[0m        [35m0.2306[0m       0.9335        0.1887        21.5936
      9   0.2546   [32m0.8174[0m        0.2316       0.9323        0.1874        21.4224
     10   0.2580   0.8161        [35m0.2303[0m       0.9311        0.1900        21.6348
     11   [36m0.2917[0m   [32m0.8202[0m        [35m0.2285[0m       0.9335        0.1865        21.5864
     12   0.2849   0.8160        [35m0.2277[0m       0.9323        [94m0.1837[0m     +  21.3903
     13   0.2738   0.8176        [35m0.2246[0m       0.9335        0.1865        21.6036
     14   [36m0.2984[0m   0.8155        0.2254       0.9335        [94m0.1784[0m     +  21.6605
     15   [36m0.3009[0m   [32m0.8211[0m        0.2247       0.9371        0.1785        21.7114
     16   0.2795   [32m0.8224[0m        [35m0.2218[0m       0.9359        0.1808        21.8449
     17   [36m0.3026[0m   0.8205        0.2245       0.9383        [94m0.1761[0m     +  21.8292
     18   0.2823   [32m0.8255[0m        [35m0.2209[0m       0.9323        0.1860        21.7720
     19   0.2957   0.8240        0.2237       0.9383        0.1771        21.6192
     20   0.2612   0.8161        0.2233       0.9371        0.1858        21.6896
     21   0.2922   0.8234        0.2232       [31m0.9444[0m        0.1761        21.8625
     22   0.2909   0.8230        [35m0.2196[0m       0.9335        0.1842        21.6162
     23   0.2586   0.8137        0.2200       0.9383        0.1821        21.6620
     24   0.2616   0.8093        [35m0.2185[0m       0.9359        0.1942        21.6947
     25   0.2527   0.8118        0.2187       0.9274        0.1973        21.6830
     26   0.2645   0.8204        [35m0.2163[0m       0.9359        0.1855        21.5012
Stopping since valid_loss has not improved in the last 10 epochs.
[32m[I 2023-05-03 00:24:02,004][0m Trial 235 finished with value: 0.17609698172014526 and parameters: {'lr': 0.0002801273584286464, 'dropout': 0.4371420372105658, 'd_model_multiplier': 8, 'num_layers': 4, 'n_heads': 32, 'dim_feedforward': 329, 'batch_size': 68, 'pos_encoding': 'fixed', 'activation': 'relu', 'norm': 'LayerNorm', 'optimizer_name': 'AdamW', 'weight_decay': 0.1, 'top_n_features': 53}. Best is trial 235 with value: 0.17609698172014526.[0m
[FileBasedDataset] Initializing dataset...
	Examples: 8264
	Features: 52
	Max length: 315
Standard scalar turned ON, loading params from cache
[FileBasedDataset] Dataset initialization complete
  epoch    auprc    auroc    train_loss    valid_acc    valid_loss    cp      dur
-------  -------  -------  ------------  -----------  ------------  ----  -------
      1   [36m0.1934[0m   [32m0.7193[0m        [35m0.3585[0m       [31m0.9178[0m        [94m0.3869[0m     +  21.9008
      2   0.1860   0.7059        [35m0.2726[0m       [31m0.9262[0m        [94m0.3102[0m     +  22.4751
      3   0.1926   0.7179        [35m0.2662[0m       [31m0.9287[0m        [94m0.2952[0m     +  22.0250
      4   0.1785   [32m0.7352[0m        [35m0.2615[0m       0.9262        [94m0.2620[0m     +  22.5890
      5   0.1917   [32m0.7403[0m        [35m0.2556[0m       [31m0.9311[0m        [94m0.2560[0m     +  22.4987
      6   0.1855   0.7331        [35m0.2514[0m       0.9311        [94m0.2308[0m     +  22.5120
      7   0.1866   [32m0.7530[0m        [35m0.2452[0m       0.9299        [94m0.2301[0m     +  22.4476
      8   [36m0.2066[0m   [32m0.7558[0m        0.2466       [31m0.9335[0m        [94m0.2276[0m     +  22.4669
      9   0.1974   0.7356        [35m0.2399[0m       0.9311        0.2298        22.5622
     10   0.1941   0.7337        [35m0.2389[0m       0.9323        0.2289        22.3118
     11   0.2039   0.7427        [35m0.2381[0m       0.9274        [94m0.2264[0m     +  22.2771
     12   0.2048   0.7369        [35m0.2292[0m       0.9323        0.2270        22.3864
     13   0.2065   0.7383        0.2348       0.9287        0.2289        22.2602
     14   [36m0.2244[0m   [32m0.7612[0m        0.2301       0.9311        0.2280        22.5542
     15   0.2144   0.7527        [35m0.2271[0m       0.9323        [94m0.2218[0m     +  22.5088
     16   0.2035   0.7510        [35m0.2238[0m       0.9311        0.2385        22.5570
     17   [36m0.2325[0m   [32m0.7802[0m        0.2255       0.9262        0.2240        22.4419
     18   0.2217   [32m0.7818[0m        [35m0.2213[0m       0.9262        0.2288        22.4684
     19   0.2103   0.7548        0.2219       0.9287        0.2338        22.3086
     20   0.2254   [32m0.7834[0m        0.2252       0.9274        0.2284        22.6477
     21   [36m0.2432[0m   [32m0.7901[0m        [35m0.2206[0m       0.9226        0.2222        22.1884
     22   0.2172   0.7730        [35m0.2191[0m       0.9238        0.2361        22.4112
     23   0.2340   0.7841        [35m0.2169[0m       0.9311        0.2232        22.7093
     24   [36m0.2536[0m   [32m0.7915[0m        0.2190       0.9238        0.2246        22.4622
Stopping since valid_loss has not improved in the last 10 epochs.
[32m[I 2023-05-03 00:33:24,044][0m Trial 236 finished with value: 0.22184130340418187 and parameters: {'lr': 0.0002916013754725196, 'dropout': 0.45654454877545175, 'd_model_multiplier': 8, 'num_layers': 4, 'n_heads': 32, 'dim_feedforward': 320, 'batch_size': 70, 'pos_encoding': 'fixed', 'activation': 'gelu', 'norm': 'BatchNorm', 'optimizer_name': 'PlainRAdam', 'weight_decay': 0.1, 'top_n_features': 52}. Best is trial 235 with value: 0.17609698172014526.[0m
[FileBasedDataset] Initializing dataset...
	Examples: 8264
	Features: 61
	Max length: 315
Standard scalar turned ON, loading params from cache
[FileBasedDataset] Dataset initialization complete
  epoch    auprc    auroc    train_loss    valid_acc    valid_loss    cp      dur
-------  -------  -------  ------------  -----------  ------------  ----  -------
      1   [36m0.3072[0m   [32m0.7555[0m        [35m0.2677[0m       [31m0.9202[0m        [94m0.2459[0m     +  21.3631
      2   0.3021   [32m0.7634[0m        [35m0.2438[0m       0.9202        [94m0.2436[0m     +  21.1737
      3   0.2992   [32m0.7689[0m        [35m0.2423[0m       0.9190        0.2512        21.4476
      4   [36m0.3121[0m   [32m0.7699[0m        [35m0.2395[0m       0.9166        0.2631        21.4300
      5   0.3023   0.7623        [35m0.2324[0m       0.9178        0.2709        21.5775
      6   0.3010   [32m0.7729[0m        0.2325       0.9008        0.2755        21.6135
      7   [36m0.3197[0m   0.7706        [35m0.2258[0m       0.9141        0.2674        21.4233
      8   [36m0.3216[0m   [32m0.7758[0m        [35m0.2256[0m       0.9069        0.2732        21.4718
      9   [36m0.3221[0m   0.7698        [35m0.2244[0m       0.9057        0.2692        21.6431
     10   0.3068   0.7711        0.2249       0.9081        0.2715        21.6974
     11   0.3092   0.7663        0.2245       0.9069        0.2845        21.6262
Stopping since valid_loss has not improved in the last 10 epochs.
[32m[I 2023-05-03 00:37:42,440][0m Trial 237 finished with value: 0.2435934559465752 and parameters: {'lr': 0.00041636475605908433, 'dropout': 0.4451068824882733, 'd_model_multiplier': 8, 'num_layers': 4, 'n_heads': 32, 'dim_feedforward': 248, 'batch_size': 66, 'pos_encoding': 'learnable', 'activation': 'relu', 'norm': 'LayerNorm', 'optimizer_name': 'AdamW', 'weight_decay': 0.1, 'top_n_features': 61}. Best is trial 235 with value: 0.17609698172014526.[0m
[FileBasedDataset] Initializing dataset...
	Examples: 8264
	Features: 57
	Max length: 315
Standard scalar turned ON, loading params from cache
[FileBasedDataset] Dataset initialization complete
Warning, assumed runtime error: CUDA out of memory. Tried to allocate 2.02 GiB (GPU 0; 23.70 GiB total capacity; 15.88 GiB already allocated; 255.25 MiB free; 22.36 GiB reserved in total by PyTorch) If reserved memory is >> allocated memory try setting max_split_size_mb to avoid fragmentation.  See documentation for Memory Management and PYTORCH_CUDA_ALLOC_CONF
[32m[I 2023-05-03 00:37:48,493][0m Trial 238 finished with value: 100.0 and parameters: {'lr': 0.0002466742679751637, 'dropout': 0.4736159251911276, 'd_model_multiplier': 8, 'num_layers': 4, 'n_heads': 32, 'dim_feedforward': 414, 'batch_size': 171, 'pos_encoding': 'fixed', 'activation': 'gelu', 'norm': 'BatchNorm', 'optimizer_name': 'PlainRAdam', 'weight_decay': 0.1, 'top_n_features': 57}. Best is trial 235 with value: 0.17609698172014526.[0m
[FileBasedDataset] Initializing dataset...
	Examples: 8264
	Features: 213
	Max length: 315
Standard scalar turned ON, loading params from cache
[FileBasedDataset] Dataset initialization complete
Warning, assumed runtime error: CUDA out of memory. Tried to allocate 2.26 GiB (GPU 0; 23.70 GiB total capacity; 17.07 GiB already allocated; 1.98 GiB free; 20.63 GiB reserved in total by PyTorch) If reserved memory is >> allocated memory try setting max_split_size_mb to avoid fragmentation.  See documentation for Memory Management and PYTORCH_CUDA_ALLOC_CONF
[32m[I 2023-05-03 00:37:55,419][0m Trial 239 finished with value: 100.0 and parameters: {'lr': 0.0003451867247131358, 'dropout': 0.42003002216710633, 'd_model_multiplier': 8, 'num_layers': 3, 'n_heads': 32, 'dim_feedforward': 367, 'batch_size': 191, 'pos_encoding': 'fixed', 'activation': 'gelu', 'norm': 'BatchNorm', 'optimizer_name': 'AdamW', 'weight_decay': 0.1, 'top_n_features': 213}. Best is trial 235 with value: 0.17609698172014526.[0m
[FileBasedDataset] Initializing dataset...
	Examples: 8264
	Features: 52
	Max length: 315
Standard scalar turned ON, loading params from cache
[FileBasedDataset] Dataset initialization complete
  epoch    auprc    auroc    train_loss    valid_acc    valid_loss    cp      dur
-------  -------  -------  ------------  -----------  ------------  ----  -------
      1   [36m0.3262[0m   [32m0.7592[0m        [35m0.2733[0m       [31m0.9178[0m        [94m0.2635[0m     +  21.2333
      2   0.3024   0.7571        [35m0.2556[0m       0.9154        0.2678        21.3840
      3   0.3126   [32m0.7785[0m        [35m0.2493[0m       0.9154        [94m0.2611[0m     +  21.2804
      4   0.2960   [32m0.7841[0m        [35m0.2463[0m       0.9154        [94m0.2560[0m     +  21.9359
      5   0.3059   [32m0.7876[0m        [35m0.2426[0m       0.9129        [94m0.2499[0m     +  21.3021
      6   0.2913   0.7824        [35m0.2374[0m       0.9117        0.2678        21.7930
      7   0.2789   0.7667        0.2385       0.9141        0.2573        21.7693
      8   0.3218   [32m0.8043[0m        [35m0.2311[0m       0.9178        [94m0.2433[0m     +  21.6443
      9   0.2974   0.7878        0.2322       0.9178        0.2531        21.6090
     10   [36m0.3299[0m   0.8033        0.2331       0.9129        0.2443        21.6749
     11   0.2697   0.7456        0.2377       0.9141        0.2690        21.5493
     12   0.2005   0.6896        0.2346       0.9129        0.3158        21.6673
     13   0.2092   0.6921        0.2516       0.9129        0.2984        21.5763
     14   0.2494   0.7066        0.2430       0.9141        0.3249        22.0621
     15   0.1995   0.6938        0.2399       0.9141        0.3342        21.8785
     16   0.2064   0.6956        0.2487       0.9141        0.2955        21.7113
     17   0.2063   0.6865        0.2477       0.9141        0.2974        21.7437
Stopping since valid_loss has not improved in the last 10 epochs.
[32m[I 2023-05-03 00:44:25,862][0m Trial 240 finished with value: 0.2432960588057067 and parameters: {'lr': 0.00173084215236878, 'dropout': 0.4472910317445574, 'd_model_multiplier': 8, 'num_layers': 4, 'n_heads': 32, 'dim_feedforward': 295, 'batch_size': 77, 'pos_encoding': 'learnable', 'activation': 'relu', 'norm': 'LayerNorm', 'optimizer_name': 'PlainRAdam', 'weight_decay': 0.1, 'top_n_features': 52}. Best is trial 235 with value: 0.17609698172014526.[0m
[FileBasedDataset] Initializing dataset...
	Examples: 8264
	Features: 66
	Max length: 315
Standard scalar turned ON, loading params from cache
[FileBasedDataset] Dataset initialization complete
  epoch    auprc    auroc    train_loss    valid_acc    valid_loss    cp      dur
-------  -------  -------  ------------  -----------  ------------  ----  -------
      1   [36m0.2401[0m   [32m0.6701[0m        [35m0.2796[0m       [31m0.9154[0m        [94m0.2990[0m     +  25.3827
      2   [36m0.3216[0m   [32m0.7486[0m        [35m0.2639[0m       [31m0.9178[0m        [94m0.2496[0m     +  25.2158
      3   0.2480   0.7191        0.2711       0.9154        0.2583        25.5518
      4   0.2412   0.7157        [35m0.2565[0m       0.9154        0.2640        25.6922
      5   0.2348   0.7153        [35m0.2545[0m       0.9154        0.2706        25.5240
      6   0.2659   0.7194        [35m0.2544[0m       0.9154        0.2747        25.5800
      7   0.2595   0.7199        0.2550       0.9154        0.2758        25.4475
      8   0.2531   0.7152        [35m0.2511[0m       0.9154        0.2796        25.5359
      9   0.2698   0.7203        0.2531       0.9154        0.2746        25.5917
     10   0.2626   0.7175        0.2522       0.9154        0.2774        25.2000
     11   0.2681   0.7231        [35m0.2508[0m       0.9154        0.2764        25.5117
Stopping since valid_loss has not improved in the last 10 epochs.
[32m[I 2023-05-03 00:49:32,494][0m Trial 241 finished with value: 0.24962741495115726 and parameters: {'lr': 0.0006140001450228134, 'dropout': 0.4324879626395417, 'd_model_multiplier': 8, 'num_layers': 5, 'n_heads': 32, 'dim_feedforward': 326, 'batch_size': 66, 'pos_encoding': 'fixed', 'activation': 'relu', 'norm': 'LayerNorm', 'optimizer_name': 'AdamW', 'weight_decay': 0.1, 'top_n_features': 66}. Best is trial 235 with value: 0.17609698172014526.[0m
[FileBasedDataset] Initializing dataset...
	Examples: 8264
	Features: 45
	Max length: 315
Standard scalar turned ON, loading params from cache
[FileBasedDataset] Dataset initialization complete
  epoch    auprc    auroc    train_loss    valid_acc    valid_loss    cp      dur
-------  -------  -------  ------------  -----------  ------------  ----  -------
      1   [36m0.2724[0m   [32m0.7210[0m        [35m0.2732[0m       [31m0.9081[0m        [94m0.3225[0m     +  21.1486
      2   [36m0.2855[0m   [32m0.7272[0m        [35m0.2420[0m       [31m0.9093[0m        [94m0.3122[0m     +  21.2581
      3   0.2743   [32m0.7469[0m        [35m0.2367[0m       0.9093        [94m0.3087[0m     +  21.2885
      4   0.2689   0.7312        [35m0.2343[0m       0.9081        [94m0.3074[0m     +  21.2174
      5   0.2686   0.7467        [35m0.2285[0m       0.9033        0.3093        21.3225
      6   0.2592   [32m0.7723[0m        [35m0.2250[0m       0.8984        0.3156        21.6458
      7   0.2518   0.7598        0.2250       0.9021        0.3179        21.3030
      8   0.2661   0.7650        [35m0.2219[0m       0.9033        0.3271        21.2381
      9   0.2573   0.7687        0.2238       0.9033        0.3281        21.5014
     10   0.2447   0.7524        0.2237       0.8972        0.3263        21.3527
     11   0.2694   [32m0.7727[0m        [35m0.2209[0m       0.9045        0.3248        21.2691
     12   0.2644   0.7692        0.2223       0.9033        0.3134        21.1558
     13   0.2819   [32m0.7750[0m        0.2220       0.8960        0.3266        21.3702
Stopping since valid_loss has not improved in the last 10 epochs.
