[32m[I 2023-05-02 11:32:41,798][0m Trial 109 finished with value: 0.23498444608271915 and parameters: {'lr': 0.0035944445723254097, 'dropout': 0.37165386068192197, 'd_model_multiplier': 8, 'num_layers': 7, 'n_heads': 16, 'dim_feedforward': 427, 'batch_size': 13, 'pos_encoding': 'fixed', 'activation': 'gelu', 'norm': 'BatchNorm', 'optimizer_name': 'PlainRAdam', 'weight_decay': 0.1, 'top_n_features': 234}. Best is trial 12 with value: 0.20472501771481755.[0m
[FileBasedDataset] Initializing dataset...
	Examples: 8264
	Features: 154
	Max length: 315
Standard scalar turned ON, loading params from cache
[FileBasedDataset] Dataset initialization complete
  epoch    auprc    auroc    train_loss    valid_acc    valid_loss    cp      dur
-------  -------  -------  ------------  -----------  ------------  ----  -------
      1   [36m0.3228[0m   [32m0.7876[0m        [35m0.3174[0m       [31m0.9226[0m        [94m0.2896[0m     +  10.9534
      2   [36m0.3406[0m   [32m0.7965[0m        [35m0.2470[0m       0.9226        0.3096        10.9144
      3   [36m0.3581[0m   [32m0.8094[0m        [35m0.2388[0m       0.9190        0.2911        11.4350
      4   0.3349   0.8033        [35m0.2360[0m       [31m0.9250[0m        [94m0.2731[0m     +  11.4025
      5   [36m0.3720[0m   [32m0.8180[0m        [35m0.2304[0m       0.9202        0.2931        11.4223
      6   [36m0.3742[0m   0.8031        0.2357       0.9214        0.3179        11.3409
      7   [36m0.3756[0m   [32m0.8250[0m        0.2335       0.9117        0.3479        11.1371
      8   0.3446   0.8117        0.2312       0.9154        0.2809        11.2979
      9   0.3450   0.8127        0.2346       0.9129        0.3370        11.1114
     10   0.3466   0.7861        [35m0.2274[0m       0.9178        0.3407        11.2112
     11   0.3084   0.7756        0.2298       0.9093        0.3595        11.3692
     12   0.3740   0.7968        0.2299       0.9202        0.2942        11.2781
     13   0.3507   0.8050        0.2276       0.9129        0.3081        11.2474
Stopping since valid_loss has not improved in the last 10 epochs.
[32m[I 2023-05-02 11:35:19,556][0m Trial 110 finished with value: 0.2731120150351611 and parameters: {'lr': 0.0010478999312065742, 'dropout': 0.4238518162705608, 'd_model_multiplier': 8, 'num_layers': 2, 'n_heads': 16, 'dim_feedforward': 381, 'batch_size': 104, 'pos_encoding': 'fixed', 'activation': 'gelu', 'norm': 'BatchNorm', 'optimizer_name': 'PlainRAdam', 'weight_decay': 0.1, 'top_n_features': 154}. Best is trial 12 with value: 0.20472501771481755.[0m
[FileBasedDataset] Initializing dataset...
	Examples: 8264
	Features: 57
	Max length: 315
Standard scalar turned ON, loading params from cache
[FileBasedDataset] Dataset initialization complete
  epoch    auprc    auroc    train_loss    valid_acc    valid_loss    cp     dur
-------  -------  -------  ------------  -----------  ------------  ----  ------
      1   [36m0.3208[0m   [32m0.7445[0m        [35m0.2924[0m       [31m0.9274[0m        [94m0.3322[0m     +  9.4399
      2   0.2979   [32m0.7587[0m        [35m0.2471[0m       0.9069        0.3501        10.0949
      3   0.2987   [32m0.7596[0m        0.2492       0.8996        0.3787        10.0723
      4   0.3038   0.7223        0.2555       0.9190        0.3457        10.6682
      5   [36m0.3311[0m   0.7082        0.2503       0.9154        0.3983        10.3598
      6   0.3247   0.6841        0.2522       [31m0.9347[0m        [94m0.3267[0m     +  10.2852
      7   0.2598   0.7312        0.2553       0.9238        [94m0.2812[0m     +  10.7262
      8   0.2968   0.7556        0.2546       0.9274        [94m0.2415[0m     +  10.3594
      9   0.3205   [32m0.7623[0m        [35m0.2469[0m       0.9129        [94m0.2390[0m     +  10.5587
     10   0.2961   [32m0.7810[0m        [35m0.2461[0m       0.9274        [94m0.2319[0m     +  10.2969
     11   0.3080   0.7758        [35m0.2453[0m       0.9214        0.2336        10.0776
     12   0.2774   0.7720        [35m0.2437[0m       0.9250        [94m0.2310[0m     +  10.3336
     13   0.3003   0.7692        [35m0.2414[0m       0.9238        0.2375        10.2300
     14   0.3118   0.7759        [35m0.2390[0m       0.9287        0.2330        10.4751
     15   0.2893   0.7737        [35m0.2358[0m       0.9274        [94m0.2272[0m     +  10.9263
     16   0.2892   0.7768        0.2368       0.9274        0.2339        10.4916
     17   0.3013   0.7802        [35m0.2345[0m       0.9287        0.2273        10.2653
     18   0.2880   0.7726        [35m0.2321[0m       0.9262        0.2313        10.6408
     19   0.2865   0.7673        0.2342       0.9274        0.2296        10.5104
     20   0.2870   0.7645        0.2362       0.9262        0.2391        10.6878
     21   0.2945   0.7689        0.2333       0.9274        0.2328        10.3029
     22   0.2787   0.7733        0.2334       0.9262        0.2305        10.4154
     23   0.2933   0.7729        0.2337       0.9262        0.2309        10.5687
     24   0.3088   0.7779        0.2322       0.9274        0.2289        11.2183
Stopping since valid_loss has not improved in the last 10 epochs.
[32m[I 2023-05-02 11:39:40,993][0m Trial 111 finished with value: 0.22717249514185964 and parameters: {'lr': 0.006675374600583172, 'dropout': 0.5546056690164308, 'd_model_multiplier': 8, 'num_layers': 1, 'n_heads': 16, 'dim_feedforward': 360, 'batch_size': 152, 'pos_encoding': 'fixed', 'activation': 'gelu', 'norm': 'BatchNorm', 'optimizer_name': 'PlainRAdam', 'weight_decay': 0.1, 'top_n_features': 57}. Best is trial 12 with value: 0.20472501771481755.[0m
[FileBasedDataset] Initializing dataset...
	Examples: 8264
	Features: 166
	Max length: 315
Standard scalar turned ON, loading params from cache
[FileBasedDataset] Dataset initialization complete
  epoch    auprc    auroc    train_loss    valid_acc    valid_loss    cp      dur
-------  -------  -------  ------------  -----------  ------------  ----  -------
      1   [36m0.2019[0m   [32m0.6768[0m        [35m0.2815[0m       [31m0.9226[0m        [94m0.2722[0m     +  11.2756
      2   0.1920   0.6556        [35m0.2460[0m       [31m0.9238[0m        0.3088        11.0818
      3   [36m0.2243[0m   [32m0.6971[0m        [35m0.2404[0m       0.9141        0.3646        11.4597
      4   0.2199   0.6307        0.2413       0.9214        0.3780        11.4963
      5   0.1650   0.6344        [35m0.2394[0m       0.9214        0.3475        11.3242
      6   0.1861   0.6407        0.2399       0.9154        0.3733        11.4863
      7   0.2043   0.6591        0.2405       0.9141        0.3761        11.6504
      8   0.1480   0.5687        0.2423       0.9154        0.4149        11.5488
      9   0.2008   0.6757        0.2443       0.9045        0.4122        11.4280
     10   0.1619   0.5960        0.2456       0.9202        0.3658        11.4463
Stopping since valid_loss has not improved in the last 10 epochs.
[32m[I 2023-05-02 11:41:46,582][0m Trial 112 finished with value: 0.2721716194371935 and parameters: {'lr': 0.004461902749248374, 'dropout': 0.3925997888514623, 'd_model_multiplier': 8, 'num_layers': 1, 'n_heads': 16, 'dim_feedforward': 409, 'batch_size': 185, 'pos_encoding': 'fixed', 'activation': 'gelu', 'norm': 'BatchNorm', 'optimizer_name': 'PlainRAdam', 'weight_decay': 0.1, 'top_n_features': 166}. Best is trial 12 with value: 0.20472501771481755.[0m
[FileBasedDataset] Initializing dataset...
	Examples: 8264
	Features: 171
	Max length: 315
Standard scalar turned ON, loading params from cache
[FileBasedDataset] Dataset initialization complete
  epoch    auprc    auroc    train_loss    valid_acc    valid_loss    cp     dur
-------  -------  -------  ------------  -----------  ------------  ----  ------
      1   [36m0.2093[0m   [32m0.6765[0m        [35m0.2872[0m       [31m0.8730[0m        [94m0.4583[0m     +  8.2559
      2   [36m0.2646[0m   0.6370        [35m0.2738[0m       0.8730        0.5041        9.3021
      3   0.1313   0.4921        0.2890       [31m0.9166[0m        [94m0.4102[0m     +  9.7050
      4   [36m0.2769[0m   [32m0.7275[0m        0.2981       0.9166        [94m0.2789[0m     +  9.5935
      5   0.2378   0.7111        0.2937       0.9166        0.3094        9.5294
      6   0.2593   [32m0.7461[0m        0.2903       [31m0.9178[0m        0.3119        9.8106
      7   0.2547   [32m0.7474[0m        0.2846       0.9141        0.2899        9.4533
      8   [36m0.2967[0m   0.7452        [35m0.2681[0m       0.9178        [94m0.2760[0m     +  9.3194
      9   0.2650   [32m0.7522[0m        0.2739       0.9166        0.3160        9.3599
     10   0.2954   [32m0.7782[0m        [35m0.2653[0m       0.9178        [94m0.2618[0m     +  9.8384
     11   [36m0.3122[0m   [32m0.7854[0m        [35m0.2562[0m       0.9178        [94m0.2421[0m     +  9.3611
     12   0.2858   0.7705        [35m0.2472[0m       0.9178        0.2440        9.4289
     13   0.2928   0.7759        0.2472       0.9117        0.2548        9.5976
     14   0.2870   [32m0.7871[0m        0.2506       0.9154        0.2427        9.4469
     15   0.3026   0.7469        [35m0.2454[0m       0.9178        0.2532        9.7834
     16   0.2796   0.7694        [35m0.2398[0m       0.9154        0.2499        9.8087
     17   0.3094   0.7745        [35m0.2391[0m       [31m0.9190[0m        0.2460        9.9322
     18   [36m0.3272[0m   0.7701        0.2404       0.9178        0.2437        9.9378
     19   0.2898   0.7676        0.2414       0.9190        0.2457        9.8515
     20   0.2781   0.7718        0.2412       0.9166        0.2451        9.6984
Stopping since valid_loss has not improved in the last 10 epochs.
[32m[I 2023-05-02 11:45:07,870][0m Trial 113 finished with value: 0.24206983682754682 and parameters: {'lr': 0.0020061479837393723, 'dropout': 0.5312857380161013, 'd_model_multiplier': 8, 'num_layers': 1, 'n_heads': 16, 'dim_feedforward': 472, 'batch_size': 24, 'pos_encoding': 'fixed', 'activation': 'gelu', 'norm': 'BatchNorm', 'optimizer_name': 'PlainRAdam', 'weight_decay': 0.001, 'top_n_features': 171}. Best is trial 12 with value: 0.20472501771481755.[0m
[FileBasedDataset] Initializing dataset...
	Examples: 8264
	Features: 184
	Max length: 315
Standard scalar turned ON, loading params from cache
[FileBasedDataset] Dataset initialization complete
  epoch    auprc    auroc    train_loss    valid_acc    valid_loss    cp      dur
-------  -------  -------  ------------  -----------  ------------  ----  -------
      1   [36m0.2454[0m   [32m0.7298[0m        [35m0.3417[0m       [31m0.8888[0m        [94m0.3345[0m     +  10.1398
      2   0.2123   0.7096        0.3500       0.8791        [94m0.3242[0m     +  10.1118
      3   0.1942   0.7049        [35m0.2849[0m       [31m0.9154[0m        [94m0.2551[0m     +  9.7124
      4   0.2067   0.7103        [35m0.2771[0m       0.9117        0.2730        10.2073
      5   0.2026   0.7147        [35m0.2766[0m       0.8827        0.2818        10.2392
      6   0.2101   0.7077        0.2833       0.8900        0.2732        10.5411
      7   0.2199   0.7071        0.2817       0.9141        0.2597        10.2019
      8   0.1896   0.7014        0.2939       0.8888        0.2663        10.1126
      9   0.2017   0.7026        0.3055       0.8900        0.2682        10.0531
     10   0.2402   0.7115        0.3187       [31m0.9287[0m        [94m0.2460[0m     +  10.0040
     11   0.2376   0.7132        0.3153       0.9262        0.2525        9.9301
     12   0.2050   0.7067        0.3074       0.9141        0.2523        9.9896
     13   0.2008   0.7070        0.3052       0.8888        0.2647        10.1031
     14   0.2069   0.7016        0.3145       0.9129        0.2494        10.3378
     15   0.2187   0.7121        0.3226       0.8996        0.2584        10.0716
     16   0.1899   0.7099        0.3105       0.9178        0.2514        9.9718
     17   0.2277   0.7068        0.3227       0.9274        0.2583        9.9934
     18   0.2368   0.7062        0.3219       0.9274        [94m0.2445[0m     +  9.8393
     19   0.2013   0.7110        0.3186       0.9141        0.2569        10.2052
     20   0.2220   0.7112        0.3159       0.9250        0.2484        10.1219
     21   0.2076   0.7036        0.3230       0.8839        0.2847        10.0660
     22   0.1906   0.6919        0.3277       0.9226        0.2459        10.0716
     23   0.1915   0.7037        0.3257       0.9117        0.2546        10.1931
     24   0.2266   0.7148        0.3144       0.8912        0.2766        10.2184
     25   0.2095   0.7089        0.3185       0.9190        0.2453        10.1849
     26   0.2082   0.7099        0.3255       0.9250        [94m0.2411[0m     +  10.0039
     27   0.1993   0.7160        0.3143       0.9202        0.2476        10.0926
     28   0.2019   0.7095        0.3111       0.8912        0.2896        10.3255
     29   0.2262   0.7073        0.3259       0.8972        0.2568        10.4605
     30   0.2125   0.7131        0.3184       0.8912        0.2639        10.2314
     31   0.1894   0.7049        0.3208       0.8900        0.2908        10.0168
     32   0.2213   0.6989        0.3223       0.9274        0.2428        10.1263
     33   0.1935   0.7130        0.3308       0.8888        0.2884        10.3247
     34   0.2014   0.7073        0.3123       0.8984        0.2548        10.4241
     35   0.1909   0.7097        0.3163       0.9250        0.2478        10.2135
Stopping since valid_loss has not improved in the last 10 epochs.
[32m[I 2023-05-02 11:51:13,608][0m Trial 114 finished with value: 0.2411033125839758 and parameters: {'lr': 0.014226617265297968, 'dropout': 0.5947235973353052, 'd_model_multiplier': 8, 'num_layers': 2, 'n_heads': 16, 'dim_feedforward': 344, 'batch_size': 29, 'pos_encoding': 'fixed', 'activation': 'gelu', 'norm': 'BatchNorm', 'optimizer_name': 'PlainRAdam', 'weight_decay': 0.1, 'top_n_features': 184}. Best is trial 12 with value: 0.20472501771481755.[0m
[FileBasedDataset] Initializing dataset...
	Examples: 8264
	Features: 178
	Max length: 315
Standard scalar turned ON, loading params from cache
[FileBasedDataset] Dataset initialization complete
  epoch    auprc    auroc    train_loss    valid_acc    valid_loss    cp     dur
-------  -------  -------  ------------  -----------  ------------  ----  ------
      1   [36m0.1835[0m   [32m0.6470[0m        [35m0.2749[0m       [31m0.9323[0m        [94m0.2342[0m     +  7.9286
      2   [36m0.1901[0m   [32m0.6748[0m        [35m0.2632[0m       0.9323        [94m0.2328[0m     +  8.7121
      3   [36m0.1978[0m   [32m0.7211[0m        [35m0.2520[0m       0.9323        0.2337        8.9540
      4   [36m0.2039[0m   [32m0.7232[0m        [35m0.2493[0m       0.9311        [94m0.2311[0m     +  8.9901
      5   0.1990   [32m0.7374[0m        [35m0.2485[0m       0.9311        0.2358        9.3637
      6   [36m0.2118[0m   [32m0.7544[0m        [35m0.2410[0m       0.9311        [94m0.2200[0m     +  9.3349
      7   0.2042   0.7505        0.2416       0.9311        0.2230        9.4086
      8   0.2063   [32m0.7597[0m        [35m0.2394[0m       0.9299        0.2203        9.5876
      9   0.2091   0.7546        [35m0.2349[0m       0.9311        0.2206        9.5075
     10   0.2078   0.7530        0.2360       0.9299        0.2211        9.4733
     11   [36m0.2205[0m   0.7538        0.2353       0.9311        0.2206        9.6824
     12   0.2191   0.7547        0.2350       0.9311        0.2266        9.4044
     13   0.2106   0.7402        0.2364       0.9311        0.2305        9.2744
     14   [36m0.2236[0m   0.7408        0.2359       0.9323        0.2283        9.3441
     15   [36m0.2290[0m   [32m0.7800[0m        [35m0.2313[0m       0.9299        [94m0.2164[0m     +  9.4247
     16   0.2250   0.7632        [35m0.2298[0m       0.9323        0.2213        9.4844
     17   0.2279   0.7466        0.2320       0.9311        0.2206        9.7816
     18   [36m0.2466[0m   0.7645        [35m0.2261[0m       0.9323        0.2204        9.4429
     19   0.2230   0.7733        0.2269       0.9287        0.2191        9.4804
     20   0.2275   0.7632        0.2280       0.9287        0.2193        9.3203
     21   0.2073   0.7661        0.2297       0.9250        0.2207        9.4431
     22   [36m0.2540[0m   0.7592        0.2286       [31m0.9347[0m        0.2188        9.4673
     23   0.2304   0.7647        0.2280       0.9299        0.2191        9.1855
     24   0.2090   0.6935        0.2280       0.9311        0.2285        9.3139
Stopping since valid_loss has not improved in the last 10 epochs.
[32m[I 2023-05-02 11:55:06,707][0m Trial 115 finished with value: 0.2164282140557394 and parameters: {'lr': 0.005028341904805781, 'dropout': 0.34419067250361035, 'd_model_multiplier': 1, 'num_layers': 1, 'n_heads': 16, 'dim_feedforward': 435, 'batch_size': 41, 'pos_encoding': 'learnable', 'activation': 'gelu', 'norm': 'BatchNorm', 'optimizer_name': 'PlainRAdam', 'weight_decay': 0, 'top_n_features': 178}. Best is trial 12 with value: 0.20472501771481755.[0m
[FileBasedDataset] Initializing dataset...
	Examples: 8264
	Features: 180
	Max length: 315
Standard scalar turned ON, loading params from cache
[FileBasedDataset] Dataset initialization complete
  epoch    auprc    auroc    train_loss    valid_acc    valid_loss    cp     dur
-------  -------  -------  ------------  -----------  ------------  ----  ------
      1   [36m0.2050[0m   [32m0.7356[0m        [35m0.2987[0m       [31m0.9141[0m        [94m0.2726[0m     +  8.1840
      2   [36m0.2339[0m   [32m0.7381[0m        [35m0.2534[0m       0.9093        0.2742        8.7384
      3   [36m0.2539[0m   [32m0.7424[0m        [35m0.2475[0m       0.9008        0.2804        8.7739
      4   [36m0.2712[0m   0.7343        [35m0.2469[0m       0.9057        0.2769        9.0109
      5   [36m0.2732[0m   0.7224        [35m0.2428[0m       0.9093        0.2764        9.2694
      6   [36m0.3147[0m   0.7412        [35m0.2351[0m       0.9069        0.2857        9.8380
      7   0.2658   [32m0.7611[0m        0.2393       0.9081        [94m0.2586[0m     +  9.1661
      8   0.2596   0.7343        0.2387       0.9021        0.2731        9.2158
      9   0.2978   [32m0.7617[0m        [35m0.2322[0m       0.9117        0.2592        9.2440
     10   0.2855   [32m0.7896[0m        [35m0.2316[0m       0.9117        [94m0.2529[0m     +  9.5616
     11   0.3004   [32m0.7944[0m        0.2320       0.9093        [94m0.2504[0m     +  9.3921
     12   0.3038   [32m0.7973[0m        [35m0.2293[0m       0.9093        0.2557        9.2370
     13   0.2896   0.7657        0.2316       0.9093        0.2652        9.4610
     14   0.3058   0.7784        [35m0.2279[0m       0.9045        0.2673        9.3408
     15   0.2850   0.7860        0.2280       0.9069        0.2660        9.2914
     16   0.2757   0.7468        [35m0.2278[0m       0.9057        0.2703        9.2051
     17   0.2889   [32m0.7974[0m        [35m0.2232[0m       0.8948        0.2732        9.3918
     18   0.3023   0.7894        0.2265       0.9045        0.2681        9.3077
     19   0.2970   [32m0.7976[0m        0.2268       0.8924        0.2896        9.0238
     20   0.3050   0.7845        [35m0.2198[0m       0.9033        0.2709        9.3605
Stopping since valid_loss has not improved in the last 10 epochs.
