[32m[I 2023-05-04 03:37:04,419][0m Trial 402 finished with value: 0.23760348677346899 and parameters: {'lr': 2.7737990833386183e-05, 'dropout': 0.3977159441370237, 'd_model_multiplier': 64, 'num_layers': 5, 'n_heads': 32, 'dim_feedforward': 349, 'batch_size': 43, 'pos_encoding': 'fixed', 'activation': 'relu', 'norm': 'LayerNorm', 'optimizer_name': 'RAdam', 'weight_decay': 0.1, 'top_n_features': 78}. Best is trial 246 with value: 0.16447311791139763.[0m
[FileBasedDataset] Initializing dataset...
	Examples: 8264
	Features: 64
	Max length: 315
Standard scalar turned ON, loading params from cache
[FileBasedDataset] Dataset initialization complete
  epoch    auprc    auroc    train_loss    valid_acc    valid_loss    cp      dur
-------  -------  -------  ------------  -----------  ------------  ----  -------
      1   [36m0.0584[0m   [32m0.3264[0m        [35m0.6716[0m       [31m0.9250[0m        [94m0.5840[0m     +  27.5513
      2   0.0544   0.3227        [35m0.5153[0m       0.9250        [94m0.4158[0m     +  26.9735
      3   [36m0.0649[0m   [32m0.4431[0m        [35m0.3756[0m       0.9250        [94m0.3110[0m     +  27.3080
      4   [36m0.1809[0m   [32m0.6013[0m        [35m0.3036[0m       0.9250        [94m0.2702[0m     +  27.3818
      5   [36m0.2353[0m   [32m0.6762[0m        [35m0.2748[0m       0.9250        [94m0.2521[0m     +  27.5144
      6   [36m0.2560[0m   [32m0.7192[0m        [35m0.2617[0m       0.9250        [94m0.2419[0m     +  27.6633
      7   [36m0.2744[0m   [32m0.7511[0m        [35m0.2513[0m       [31m0.9299[0m        [94m0.2351[0m     +  27.4788
      8   [36m0.2833[0m   [32m0.7689[0m        [35m0.2454[0m       0.9262        [94m0.2308[0m     +  27.9719
      9   0.2828   [32m0.7775[0m        [35m0.2402[0m       0.9238        [94m0.2284[0m     +  27.3950
     10   [36m0.2865[0m   [32m0.7848[0m        [35m0.2382[0m       0.9250        [94m0.2266[0m     +  27.7586
     11   0.2816   [32m0.7914[0m        [35m0.2362[0m       0.9238        [94m0.2254[0m     +  27.6822
     12   0.2856   [32m0.7952[0m        [35m0.2343[0m       0.9262        [94m0.2241[0m     +  27.3361
     13   [36m0.2899[0m   [32m0.7980[0m        [35m0.2334[0m       0.9250        [94m0.2231[0m     +  27.3850
     14   [36m0.2939[0m   [32m0.8007[0m        0.2335       0.9226        [94m0.2223[0m     +  27.2270
     15   [36m0.2943[0m   [32m0.8022[0m        [35m0.2319[0m       0.9238        [94m0.2219[0m     +  27.3555
     16   [36m0.2956[0m   [32m0.8035[0m        [35m0.2309[0m       0.9226        [94m0.2213[0m     +  27.3636
     17   [36m0.2997[0m   [32m0.8049[0m        [35m0.2303[0m       0.9214        [94m0.2210[0m     +  27.5461
     18   0.2964   [32m0.8054[0m        0.2308       0.9202        [94m0.2206[0m     +  27.4943
     19   0.2993   [32m0.8059[0m        [35m0.2287[0m       0.9214        [94m0.2204[0m     +  27.2646
     20   0.2993   [32m0.8067[0m        0.2305       0.9226        [94m0.2200[0m     +  27.7127
     21   0.2972   0.8067        [35m0.2285[0m       0.9226        [94m0.2198[0m     +  27.2785
     22   0.2985   0.8063        [35m0.2282[0m       0.9226        [94m0.2197[0m     +  27.3729
     23   [36m0.2998[0m   0.8065        0.2285       0.9238        [94m0.2195[0m     +  27.5352
     24   [36m0.3011[0m   0.8065        [35m0.2271[0m       0.9214        0.2197        27.2223
     25   [36m0.3035[0m   [32m0.8071[0m        0.2271       0.9226        [94m0.2194[0m     +  27.3701
     26   0.3020   0.8063        [35m0.2264[0m       0.9214        0.2197        27.4834
     27   [36m0.3073[0m   0.8070        [35m0.2259[0m       0.9214        0.2194        27.5091
     28   [36m0.3106[0m   [32m0.8071[0m        0.2262       0.9202        [94m0.2194[0m     +  27.2248
     29   0.3092   0.8071        [35m0.2244[0m       0.9202        [94m0.2192[0m     +  27.4394
     30   0.3078   0.8069        0.2260       0.9202        0.2193        27.2261
     31   0.3073   0.8065        0.2252       0.9214        0.2195        27.4487
     32   0.3098   0.8067        [35m0.2242[0m       0.9190        0.2194        27.3852
     33   0.3095   0.8071        [35m0.2230[0m       0.9190        0.2194        27.3983
     34   0.3074   0.8067        [35m0.2225[0m       0.9190        0.2194        27.4471
     35   0.3094   0.8064        0.2227       0.9190        0.2193        27.3732
     36   0.3059   0.8067        0.2245       0.9190        0.2192        27.2151
     37   0.3079   0.8068        0.2227       0.9190        0.2192        27.4352
     38   0.3063   0.8068        [35m0.2214[0m       0.9190        0.2193        27.1772
     39   0.3061   0.8068        0.2226       0.9190        [94m0.2191[0m     +  27.3203
     40   0.3062   [32m0.8072[0m        [35m0.2210[0m       0.9190        0.2192        27.5144
     41   0.3067   [32m0.8073[0m        0.2218       0.9190        0.2195        27.5532
     42   0.3073   0.8073        0.2212       0.9190        0.2194        27.3676
     43   0.3051   [32m0.8080[0m        0.2210       0.9190        0.2193        27.4233
     44   0.3047   [32m0.8083[0m        0.2211       0.9190        [94m0.2189[0m     +  27.1399
     45   0.3048   [32m0.8083[0m        [35m0.2203[0m       0.9202        0.2190        27.2123
     46   0.3048   0.8083        [35m0.2197[0m       0.9214        0.2191        26.9853
     47   0.3038   [32m0.8086[0m        0.2200       0.9202        0.2195        27.4178
     48   0.3015   0.8075        [35m0.2195[0m       0.9214        0.2194        27.3281
     49   0.3020   0.8075        0.2206       0.9202        0.2195        27.3490
     50   0.3035   0.8075        0.2197       0.9226        0.2194        27.3191
[32m[I 2023-05-04 03:59:57,635][0m Trial 403 finished with value: 0.21893260397350342 and parameters: {'lr': 7.929537192841937e-06, 'dropout': 0.31630406543814954, 'd_model_multiplier': 4, 'num_layers': 6, 'n_heads': 32, 'dim_feedforward': 356, 'batch_size': 61, 'pos_encoding': 'fixed', 'activation': 'relu', 'norm': 'LayerNorm', 'optimizer_name': 'PlainRAdam', 'weight_decay': 0.1, 'top_n_features': 64}. Best is trial 246 with value: 0.16447311791139763.[0m
[FileBasedDataset] Initializing dataset...
	Examples: 8264
	Features: 57
	Max length: 315
Standard scalar turned ON, loading params from cache
[FileBasedDataset] Dataset initialization complete
Warning, assumed runtime error: CUDA out of memory. Tried to allocate 1.85 GiB (GPU 0; 23.70 GiB total capacity; 22.04 GiB already allocated; 329.25 MiB free; 22.29 GiB reserved in total by PyTorch) If reserved memory is >> allocated memory try setting max_split_size_mb to avoid fragmentation.  See documentation for Memory Management and PYTORCH_CUDA_ALLOC_CONF
[32m[I 2023-05-04 04:00:03,498][0m Trial 404 finished with value: 100.0 and parameters: {'lr': 3.607291329060511e-05, 'dropout': 0.42121842324186937, 'd_model_multiplier': 2, 'num_layers': 7, 'n_heads': 32, 'dim_feedforward': 331, 'batch_size': 156, 'pos_encoding': 'fixed', 'activation': 'relu', 'norm': 'LayerNorm', 'optimizer_name': 'RAdam', 'weight_decay': 0.1, 'top_n_features': 57}. Best is trial 246 with value: 0.16447311791139763.[0m
[FileBasedDataset] Initializing dataset...
	Examples: 8264
	Features: 72
	Max length: 315
Standard scalar turned ON, loading params from cache
[FileBasedDataset] Dataset initialization complete
  epoch    auprc    auroc    train_loss    valid_acc    valid_loss    cp      dur
-------  -------  -------  ------------  -----------  ------------  ----  -------
      1   [36m0.2256[0m   [32m0.7900[0m        [35m0.2799[0m       [31m0.8984[0m        [94m0.3044[0m     +  45.9018
      2   [36m0.2350[0m   0.7854        [35m0.2567[0m       0.8948        [94m0.2952[0m     +  46.2955
      3   [36m0.2534[0m   0.7863        [35m0.2499[0m       [31m0.9008[0m        [94m0.2768[0m     +  46.0889
      4   0.2415   0.7819        [35m0.2464[0m       0.8996        [94m0.2690[0m     +  46.1965
      5   [36m0.3093[0m   0.7827        [35m0.2443[0m       [31m0.9154[0m        [94m0.2300[0m     +  46.1728
      6   0.2482   0.7789        [35m0.2435[0m       0.9021        0.2650        46.3877
      7   0.2668   0.7890        [35m0.2401[0m       0.9057        0.2483        46.2964
      8   0.2979   [32m0.7922[0m        [35m0.2366[0m       0.9033        0.2512        46.2851
      9   0.2496   0.7891        [35m0.2351[0m       0.9093        0.2489        46.2651
     10   0.2687   [32m0.7942[0m        0.2426       0.9129        0.2392        46.3449
     11   [36m0.3137[0m   [32m0.8106[0m        0.2352       0.9093        0.2476        46.4994
     12   [36m0.3386[0m   [32m0.8163[0m        [35m0.2332[0m       [31m0.9214[0m        [94m0.2193[0m     +  46.2686
     13   0.3278   0.7926        [35m0.2328[0m       [31m0.9274[0m        [94m0.2183[0m     +  46.6025
     14   0.3231   0.7976        0.2335       [31m0.9311[0m        0.2277        46.4033
     15   0.2941   0.7941        [35m0.2309[0m       0.9154        0.2318        46.6193
     16   0.2824   0.7944        0.2324       0.9299        0.2305        46.6847
     17   0.3143   0.7934        [35m0.2273[0m       0.9226        0.2249        46.5269
     18   0.3156   0.7947        0.2337       0.9250        0.2266        46.3173
     19   0.2921   0.7861        0.2285       0.9238        0.2254        46.6017
     20   0.3021   0.7977        0.2285       0.9238        0.2292        46.7377
     21   0.2965   0.7977        0.2275       0.9299        0.2506        47.2692
     22   0.2975   0.7951        [35m0.2246[0m       0.9238        0.2402        46.5845
Stopping since valid_loss has not improved in the last 10 epochs.
[32m[I 2023-05-04 04:17:56,968][0m Trial 405 finished with value: 0.2182545665529936 and parameters: {'lr': 0.00011406010040180565, 'dropout': 0.5075593138485005, 'd_model_multiplier': 32, 'num_layers': 5, 'n_heads': 32, 'dim_feedforward': 370, 'batch_size': 48, 'pos_encoding': 'fixed', 'activation': 'relu', 'norm': 'LayerNorm', 'optimizer_name': 'AdamW', 'weight_decay': 0, 'top_n_features': 72}. Best is trial 246 with value: 0.16447311791139763.[0m
[FileBasedDataset] Initializing dataset...
	Examples: 8264
	Features: 50
	Max length: 315
Standard scalar turned ON, loading params from cache
[FileBasedDataset] Dataset initialization complete
Warning, assumed runtime error: CUDA out of memory. Tried to allocate 1.33 GiB (GPU 0; 23.70 GiB total capacity; 19.89 GiB already allocated; 1.05 GiB free; 21.56 GiB reserved in total by PyTorch) If reserved memory is >> allocated memory try setting max_split_size_mb to avoid fragmentation.  See documentation for Memory Management and PYTORCH_CUDA_ALLOC_CONF
[32m[I 2023-05-04 04:18:00,427][0m Trial 406 finished with value: 100.0 and parameters: {'lr': 2.0860770689400546e-06, 'dropout': 0.16268291278472316, 'd_model_multiplier': 16, 'num_layers': 10, 'n_heads': 64, 'dim_feedforward': 343, 'batch_size': 56, 'pos_encoding': 'fixed', 'activation': 'relu', 'norm': 'LayerNorm', 'optimizer_name': 'PlainRAdam', 'weight_decay': 0.1, 'top_n_features': 50}. Best is trial 246 with value: 0.16447311791139763.[0m
[FileBasedDataset] Initializing dataset...
	Examples: 8264
	Features: 60
	Max length: 315
Standard scalar turned ON, loading params from cache
[FileBasedDataset] Dataset initialization complete
  epoch    auprc    auroc    train_loss    valid_acc    valid_loss    cp      dur
-------  -------  -------  ------------  -----------  ------------  ----  -------
      1   [36m0.0756[0m   [32m0.4762[0m        [35m0.6822[0m       [31m0.8888[0m        [94m0.6391[0m     +  27.3647
      2   0.0585   0.3342        [35m0.5988[0m       [31m0.9311[0m        [94m0.5353[0m     +  27.5244
      3   0.0598   0.3130        [35m0.5048[0m       0.9311        [94m0.4354[0m     +  27.5908
      4   0.0556   0.3514        [35m0.4187[0m       0.9311        [94m0.3539[0m     +  27.2691
      5   0.0671   [32m0.4839[0m        [35m0.3555[0m       0.9311        [94m0.3003[0m     +  27.5318
      6   [36m0.1135[0m   [32m0.5908[0m        [35m0.3162[0m       0.9311        [94m0.2699[0m     +  27.5957
      7   [36m0.1957[0m   [32m0.6508[0m        [35m0.2938[0m       0.9311        [94m0.2527[0m     +  27.8824
      8   [36m0.2381[0m   [32m0.6813[0m        [35m0.2803[0m       0.9311        [94m0.2421[0m     +  27.4958
      9   [36m0.2494[0m   [32m0.7026[0m        [35m0.2702[0m       0.9311        [94m0.2351[0m     +  27.4398
     10   [36m0.2685[0m   [32m0.7189[0m        [35m0.2640[0m       0.9311        [94m0.2302[0m     +  27.6376
     11   [36m0.2823[0m   [32m0.7318[0m        [35m0.2595[0m       0.9311        [94m0.2263[0m     +  27.4025
     12   [36m0.2899[0m   [32m0.7434[0m        [35m0.2558[0m       0.9311        [94m0.2231[0m     +  27.3857
     13   [36m0.2946[0m   [32m0.7520[0m        [35m0.2521[0m       0.9311        [94m0.2205[0m     +  27.8309
     14   0.2929   [32m0.7599[0m        [35m0.2487[0m       0.9311        [94m0.2179[0m     +  27.3648
     15   0.2938   [32m0.7683[0m        [35m0.2458[0m       [31m0.9323[0m        [94m0.2155[0m     +  27.5767
     16   [36m0.3094[0m   [32m0.7752[0m        [35m0.2434[0m       [31m0.9335[0m        [94m0.2133[0m     +  27.6754
     17   [36m0.3186[0m   [32m0.7805[0m        [35m0.2410[0m       0.9335        [94m0.2115[0m     +  27.5106
     18   [36m0.3231[0m   [32m0.7847[0m        [35m0.2396[0m       [31m0.9347[0m        [94m0.2101[0m     +  27.4314
     19   0.3175   [32m0.7873[0m        [35m0.2382[0m       0.9335        [94m0.2090[0m     +  27.2140
     20   0.3181   [32m0.7897[0m        [35m0.2366[0m       0.9299        [94m0.2083[0m     +  27.3256
     21   0.3229   [32m0.7926[0m        [35m0.2363[0m       0.9287        [94m0.2077[0m     +  27.4062
     22   0.3184   [32m0.7933[0m        [35m0.2360[0m       0.9274        [94m0.2072[0m     +  27.5881
     23   0.3184   [32m0.7937[0m        [35m0.2356[0m       0.9287        [94m0.2068[0m     +  27.9007
     24   0.3169   [32m0.7949[0m        [35m0.2333[0m       0.9274        [94m0.2064[0m     +  27.4849
     25   0.3146   [32m0.7952[0m        0.2334       0.9274        [94m0.2061[0m     +  27.4446
     26   0.3063   [32m0.7957[0m        [35m0.2327[0m       0.9262        [94m0.2059[0m     +  27.1476
     27   0.3060   [32m0.7960[0m        [35m0.2326[0m       0.9262        [94m0.2058[0m     +  27.5043
     28   0.3050   [32m0.7961[0m        [35m0.2315[0m       0.9262        [94m0.2057[0m     +  27.8240
     29   0.3032   [32m0.7961[0m        [35m0.2311[0m       0.9262        0.2057        27.5262
     30   0.3038   [32m0.7966[0m        [35m0.2310[0m       0.9287        0.2057        27.6314
     31   0.3033   [32m0.7973[0m        [35m0.2302[0m       0.9274        [94m0.2056[0m     +  27.5292
     32   0.3036   [32m0.7974[0m        [35m0.2296[0m       0.9274        [94m0.2055[0m     +  27.8470
     33   0.3046   [32m0.7979[0m        0.2300       0.9274        [94m0.2055[0m     +  27.5603
     34   0.3029   [32m0.7983[0m        0.2309       0.9274        [94m0.2053[0m     +  27.2304
     35   0.2989   0.7978        [35m0.2284[0m       0.9274        0.2054        27.2788
     36   0.3000   0.7983        0.2302       0.9274        [94m0.2052[0m     +  27.3060
     37   0.2972   0.7979        0.2288       0.9262        0.2052        27.4960
     38   0.2976   0.7982        [35m0.2278[0m       0.9274        0.2055        27.6513
     39   0.2943   [32m0.7984[0m        0.2284       0.9262        0.2056        27.8148
     40   0.2959   [32m0.7992[0m        [35m0.2271[0m       0.9262        0.2054        27.7360
     41   0.2960   [32m0.7997[0m        0.2274       0.9250        0.2055        27.8580
     42   0.2958   [32m0.7999[0m        [35m0.2269[0m       0.9250        0.2054        27.4248
     43   0.2965   [32m0.8006[0m        0.2276       0.9262        0.2055        27.6270
     44   0.2948   [32m0.8008[0m        [35m0.2264[0m       0.9262        0.2054        27.3762
     45   0.2949   [32m0.8010[0m        [35m0.2263[0m       0.9250        0.2055        27.2876
Stopping since valid_loss has not improved in the last 10 epochs.
