[32m[I 2023-05-02 04:30:33,444][0m Trial 35 finished with value: 0.34167783656028045 and parameters: {'lr': 0.00031485595070626215, 'dropout': 0.5091223745017656, 'd_model_multiplier': 32, 'num_layers': 1, 'n_heads': 64, 'dim_feedforward': 299, 'batch_size': 139, 'pos_encoding': 'learnable', 'activation': 'gelu', 'norm': 'BatchNorm', 'optimizer_name': 'PlainRAdam', 'weight_decay': 0.001, 'top_n_features': 223}. Best is trial 12 with value: 0.20472501771481755.[0m
[FileBasedDataset] Initializing dataset...
	Examples: 8264
	Features: 135
	Max length: 315
Standard scalar turned ON, loading params from cache
[FileBasedDataset] Dataset initialization complete
  epoch    auprc    auroc    train_loss    valid_acc    valid_loss    cp      dur
-------  -------  -------  ------------  -----------  ------------  ----  -------
      1   [36m0.0560[0m   [32m0.3110[0m        [35m0.6488[0m       [31m0.9033[0m        [94m0.6545[0m     +  13.6172
      2   0.0556   0.3087        [35m0.4784[0m       [31m0.9178[0m        [94m0.4853[0m     +  14.8902
      3   [36m0.1675[0m   [32m0.6273[0m        [35m0.3176[0m       0.9166        [94m0.3497[0m     +  14.6729
      4   [36m0.2434[0m   [32m0.6903[0m        [35m0.2770[0m       0.9154        [94m0.3124[0m     +  13.9112
      5   [36m0.2786[0m   [32m0.7091[0m        [35m0.2695[0m       0.9166        [94m0.2912[0m     +  13.6247
      6   [36m0.2968[0m   [32m0.7182[0m        [35m0.2631[0m       [31m0.9190[0m        [94m0.2789[0m     +  14.3340
      7   [36m0.3189[0m   [32m0.7320[0m        [35m0.2595[0m       [31m0.9214[0m        0.2815        14.0882
      8   [36m0.3304[0m   0.7319        [35m0.2593[0m       0.9202        [94m0.2598[0m     +  14.3883
      9   [36m0.3360[0m   0.7296        [35m0.2520[0m       0.9214        [94m0.2510[0m     +  14.1640
     10   [36m0.3477[0m   0.7309        [35m0.2511[0m       0.9202        [94m0.2508[0m     +  14.0932
     11   [36m0.3563[0m   [32m0.7401[0m        [35m0.2477[0m       0.9214        0.2512        14.1666
     12   [36m0.3607[0m   0.7383        0.2492       0.9202        [94m0.2479[0m     +  14.2416
     13   0.3588   [32m0.7439[0m        [35m0.2470[0m       [31m0.9238[0m        0.2584        14.6353
     14   0.3599   [32m0.7440[0m        0.2476       0.9238        0.2519        14.2726
     15   [36m0.3706[0m   [32m0.7499[0m        [35m0.2412[0m       0.9238        0.2500        14.0101
     16   [36m0.3747[0m   [32m0.7540[0m        [35m0.2404[0m       0.9202        [94m0.2403[0m     +  14.0751
     17   0.3701   0.7530        0.2426       0.9214        0.2415        14.2325
     18   [36m0.3779[0m   [32m0.7588[0m        [35m0.2334[0m       0.9214        [94m0.2397[0m     +  14.0983
     19   0.3707   [32m0.7596[0m        0.2343       0.9202        [94m0.2386[0m     +  14.2289
     20   0.3525   0.7588        [35m0.2334[0m       0.9226        0.2413        13.8573
     21   0.3474   0.7591        0.2349       0.9190        0.2408        14.1145
     22   0.3408   [32m0.7640[0m        [35m0.2330[0m       0.9190        0.2428        14.2500
     23   0.3507   [32m0.7700[0m        [35m0.2325[0m       0.9214        0.2393        14.3822
     24   0.3486   [32m0.7721[0m        0.2326       0.9226        0.2572        14.4681
     25   0.3478   0.7674        [35m0.2287[0m       0.9202        0.2432        13.8992
     26   0.3534   0.7638        0.2301       0.9226        0.2425        14.2101
     27   0.3405   0.7639        0.2307       0.9202        0.2431        14.3155
     28   0.3370   0.7655        [35m0.2282[0m       0.9190        0.2390        14.2044
     29   0.3544   [32m0.7724[0m        0.2317       0.9178        [94m0.2374[0m     +  14.2578
     30   0.3405   0.7691        [35m0.2268[0m       0.9202        0.2425        14.2479
     31   0.3359   0.7706        0.2269       0.9214        0.2381        14.5138
     32   0.3398   0.7663        [35m0.2228[0m       0.9202        0.2414        14.2870
     33   0.3550   0.7723        0.2269       0.9202        0.2417        14.3028
     34   0.3533   0.7710        0.2281       0.9166        0.2533        14.1495
     35   0.3489   0.7690        [35m0.2225[0m       0.9190        0.2411        14.1814
     36   0.3461   0.7646        0.2234       0.9178        0.2546        14.2103
     37   0.3292   0.7682        0.2259       0.9166        0.2468        14.5525
     38   0.3444   0.7666        [35m0.2214[0m       0.9202        0.2427        14.5713
Stopping since valid_loss has not improved in the last 10 epochs.
[32m[I 2023-05-02 04:39:49,344][0m Trial 36 finished with value: 0.23743451627234882 and parameters: {'lr': 0.0013300532935259638, 'dropout': 0.47658677505708585, 'd_model_multiplier': 1, 'num_layers': 5, 'n_heads': 8, 'dim_feedforward': 343, 'batch_size': 231, 'pos_encoding': 'learnable', 'activation': 'gelu', 'norm': 'BatchNorm', 'optimizer_name': 'RAdam', 'weight_decay': 0.01, 'top_n_features': 135}. Best is trial 12 with value: 0.20472501771481755.[0m
[FileBasedDataset] Initializing dataset...
	Examples: 8264
	Features: 151
	Max length: 315
Standard scalar turned ON, loading params from cache
[FileBasedDataset] Dataset initialization complete
  epoch    auprc    auroc    train_loss    valid_acc    valid_loss    cp      dur
-------  -------  -------  ------------  -----------  ------------  ----  -------
      1   [36m0.2170[0m   [32m0.6840[0m        [35m0.3038[0m       [31m0.9154[0m        [94m0.2729[0m     +  71.3481
      2   [36m0.2257[0m   [32m0.6940[0m        [35m0.2733[0m       0.9154        0.2900        71.4014
      3   [36m0.2520[0m   [32m0.7056[0m        [35m0.2671[0m       0.9141        [94m0.2615[0m     +  71.5440
      4   [36m0.3009[0m   [32m0.7733[0m        [35m0.2654[0m       0.9021        0.2859        71.3635
      5   0.3004   0.7467        [35m0.2499[0m       0.9141        0.2680        71.4072
      6   0.2729   0.7439        0.2530       0.9057        0.2840        71.5575
      7   0.2879   0.7598        [35m0.2498[0m       0.8936        0.3023        71.5628
      8   0.2729   0.7449        [35m0.2478[0m       0.8900        0.3103        71.5778
      9   0.2687   0.7517        [35m0.2448[0m       0.8815        0.3594        71.4053
     10   0.2556   0.7371        [35m0.2438[0m       0.8888        0.3284        71.9313
     11   0.2640   0.7544        [35m0.2400[0m       0.9045        0.2792        71.5644
     12   0.2946   0.7564        0.2407       0.8984        0.2923        71.3764
Stopping since valid_loss has not improved in the last 10 epochs.
[32m[I 2023-05-02 04:55:20,237][0m Trial 37 finished with value: 0.2615431935820355 and parameters: {'lr': 7.45275061914794e-05, 'dropout': 0.5739702584078199, 'd_model_multiplier': 8, 'num_layers': 15, 'n_heads': 32, 'dim_feedforward': 487, 'batch_size': 27, 'pos_encoding': 'learnable', 'activation': 'relu', 'norm': 'BatchNorm', 'optimizer_name': 'AdamW', 'weight_decay': 0.1, 'top_n_features': 151}. Best is trial 12 with value: 0.20472501771481755.[0m
[FileBasedDataset] Initializing dataset...
	Examples: 8264
	Features: 167
	Max length: 315
Standard scalar turned ON, loading params from cache
[FileBasedDataset] Dataset initialization complete
  epoch    auprc    auroc    train_loss    valid_acc    valid_loss    cp      dur
-------  -------  -------  ------------  -----------  ------------  ----  -------
      1   [36m0.2759[0m   [32m0.7478[0m        [35m0.2885[0m       [31m0.9238[0m        [94m0.2849[0m     +  13.1989
      2   0.2497   0.7274        [35m0.2455[0m       [31m0.9250[0m        0.2893        14.9937
      3   [36m0.2997[0m   [32m0.7809[0m        0.2524       0.9226        [94m0.2711[0m     +  14.2688
      4   [36m0.3077[0m   0.7531        0.2564       0.9226        0.2856        14.3262
      5   [36m0.3254[0m   [32m0.8341[0m        0.2661       0.9202        [94m0.2359[0m     +  13.9610
      6   0.3094   0.7899        0.2835       0.9238        0.2454        14.3386
      7   0.2403   0.7086        0.2649       0.9226        0.3187        14.6278
      8   0.2972   0.7950        0.2506       0.9226        0.2778        14.5649
      9   0.2942   0.7947        [35m0.2449[0m       0.9226        0.2797        14.3224
     10   0.3075   0.8124        [35m0.2440[0m       0.9226        0.2634        14.0886
     11   0.3204   0.8155        0.2472       0.9250        0.2594        14.8474
     12   0.3108   0.8134        0.2505       0.9250        0.2412        14.1985
     13   [36m0.3389[0m   0.8237        [35m0.2422[0m       0.9226        [94m0.2335[0m     +  14.5170
     14   0.3375   0.8272        0.2439       0.9214        0.2360        14.4690
     15   [36m0.3453[0m   0.8250        0.2429       0.9238        0.2364        14.6163
     16   [36m0.3474[0m   0.8246        [35m0.2415[0m       [31m0.9274[0m        0.2423        14.3600
     17   [36m0.3557[0m   0.8292        [35m0.2387[0m       0.9226        0.2560        14.4611
     18   0.3474   0.8320        0.2402       0.9226        0.2339        14.3455
     19   0.3516   [32m0.8345[0m        [35m0.2383[0m       0.9190        0.2416        14.3696
     20   0.3357   0.8240        0.2434       0.9226        0.2752        14.4603
     21   0.3477   0.8239        0.2392       0.9226        0.2715        14.4858
     22   0.3104   0.8230        0.2435       0.9166        0.2359        14.3226
Stopping since valid_loss has not improved in the last 10 epochs.
[32m[I 2023-05-02 05:00:51,486][0m Trial 38 finished with value: 0.2335057026529831 and parameters: {'lr': 0.004520999328259488, 'dropout': 0.5234681539408138, 'd_model_multiplier': 16, 'num_layers': 2, 'n_heads': 16, 'dim_feedforward': 388, 'batch_size': 201, 'pos_encoding': 'learnable', 'activation': 'gelu', 'norm': 'LayerNorm', 'optimizer_name': 'PlainRAdam', 'weight_decay': 0.001, 'top_n_features': 167}. Best is trial 12 with value: 0.20472501771481755.[0m
[FileBasedDataset] Initializing dataset...
	Examples: 8264
	Features: 193
	Max length: 315
Standard scalar turned ON, loading params from cache
[FileBasedDataset] Dataset initialization complete
  epoch    auprc    auroc    train_loss    valid_acc    valid_loss    cp     dur
-------  -------  -------  ------------  -----------  ------------  ----  ------
      1   [36m0.0646[0m   [32m0.4101[0m        [35m0.7115[0m       [31m0.8428[0m        [94m0.6867[0m     +  9.3437
      2   [36m0.0668[0m   [32m0.4187[0m        [35m0.6829[0m       [31m0.9202[0m        [94m0.6715[0m     +  9.4785
      3   [36m0.0717[0m   [32m0.4427[0m        [35m0.6394[0m       0.9202        [94m0.6519[0m     +  10.0938
      4   0.0705   0.4416        [35m0.5936[0m       0.9202        [94m0.6303[0m     +  10.2299
      5   [36m0.0730[0m   [32m0.4549[0m        [35m0.5314[0m       0.9202        [94m0.6075[0m     +  10.3332
      6   [36m0.0777[0m   [32m0.4761[0m        [35m0.4663[0m       0.9202        [94m0.5892[0m     +  10.1976
      7   [36m0.1031[0m   [32m0.5099[0m        [35m0.4109[0m       0.9202        [94m0.5491[0m     +  10.5419
      8   [36m0.1081[0m   [32m0.5347[0m        [35m0.3736[0m       0.9202        [94m0.5165[0m     +  10.3907
      9   [36m0.1215[0m   [32m0.5554[0m        [35m0.3400[0m       0.9202        [94m0.4683[0m     +  10.2372
     10   [36m0.1292[0m   [32m0.5870[0m        [35m0.3208[0m       0.9202        [94m0.4280[0m     +  10.3683
     11   [36m0.1423[0m   [32m0.6286[0m        [35m0.3062[0m       0.9202        [94m0.3891[0m     +  10.4761
     12   [36m0.1560[0m   [32m0.6577[0m        [35m0.2974[0m       0.9202        [94m0.3627[0m     +  10.4194
     13   [36m0.1649[0m   [32m0.6808[0m        [35m0.2876[0m       0.9202        [94m0.3499[0m     +  10.5606
     14   [36m0.1704[0m   [32m0.6934[0m        [35m0.2832[0m       0.9202        [94m0.3400[0m     +  10.4472
     15   [36m0.1791[0m   [32m0.7112[0m        0.2837       0.9202        [94m0.3246[0m     +  10.3025
     16   [36m0.1874[0m   [32m0.7224[0m        [35m0.2789[0m       0.9202        [94m0.3159[0m     +  10.4091
     17   [36m0.1911[0m   [32m0.7256[0m        [35m0.2716[0m       0.9202        [94m0.3075[0m     +  10.4475
     18   [36m0.2016[0m   [32m0.7342[0m        0.2734       0.9202        [94m0.2990[0m     +  10.4221
     19   [36m0.2085[0m   [32m0.7412[0m        [35m0.2706[0m       0.9202        [94m0.2961[0m     +  10.5197
     20   [36m0.2102[0m   [32m0.7440[0m        0.2720       0.9202        [94m0.2883[0m     +  10.5313
     21   [36m0.2153[0m   [32m0.7479[0m        [35m0.2667[0m       0.9202        0.2916        10.3554
     22   [36m0.2172[0m   [32m0.7486[0m        0.2670       0.9202        0.2893        10.3903
     23   [36m0.2178[0m   [32m0.7503[0m        0.2703       0.9202        [94m0.2773[0m     +  10.5930
     24   [36m0.2181[0m   [32m0.7507[0m        0.2670       0.9202        0.2817        10.5462
     25   0.2101   0.7443        [35m0.2631[0m       0.9202        0.2828        10.7640
     26   0.2137   0.7471        0.2635       0.9202        0.2813        10.6331
     27   0.2148   0.7472        0.2689       0.9202        0.2832        10.4152
     28   0.2147   0.7469        0.2637       0.9202        0.2793        10.4136
     29   0.2116   0.7363        0.2632       0.9202        0.2820        10.4574
     30   [36m0.2193[0m   0.7356        [35m0.2624[0m       0.9202        0.2830        10.7110
     31   0.2171   0.7343        [35m0.2618[0m       0.9202        0.2864        10.9892
     32   [36m0.2219[0m   0.7360        [35m0.2577[0m       0.9202        0.2813        10.3716
Stopping since valid_loss has not improved in the last 10 epochs.
[32m[I 2023-05-02 05:06:35,560][0m Trial 39 finished with value: 0.27734491820058627 and parameters: {'lr': 0.0002219552691611951, 'dropout': 0.6075528207237512, 'd_model_multiplier': 1, 'num_layers': 4, 'n_heads': 4, 'dim_feedforward': 335, 'batch_size': 112, 'pos_encoding': 'learnable', 'activation': 'relu', 'norm': 'BatchNorm', 'optimizer_name': 'RAdam', 'weight_decay': 0.01, 'top_n_features': 193}. Best is trial 12 with value: 0.20472501771481755.[0m
[FileBasedDataset] Initializing dataset...
	Examples: 8264
	Features: 106
	Max length: 315
Standard scalar turned ON, loading params from cache
[FileBasedDataset] Dataset initialization complete
  epoch    auprc    auroc    train_loss    valid_acc    valid_loss    cp      dur
-------  -------  -------  ------------  -----------  ------------  ----  -------
      1   [36m0.0592[0m   [32m0.3388[0m        [35m0.7381[0m       [31m0.9238[0m        [94m0.3508[0m     +  20.5649
      2   [36m0.1017[0m   [32m0.5171[0m        [35m0.2749[0m       0.9238        [94m0.3228[0m     +  20.9443
      3   [36m0.1866[0m   [32m0.7277[0m        [35m0.2711[0m       0.9238        [94m0.2478[0m     +  20.6974
      4   [36m0.2057[0m   [32m0.7376[0m        [35m0.2645[0m       0.9093        0.2493        20.8589
      5   [36m0.2375[0m   0.7273        0.2657       0.9238        [94m0.2476[0m     +  20.9774
      6   0.2159   0.7314        [35m0.2612[0m       0.9238        0.2512        21.0375
      7   0.2006   0.7323        [35m0.2593[0m       0.9238        [94m0.2469[0m     +  21.4110
      8   [36m0.2408[0m   0.7354        [35m0.2585[0m       0.9226        [94m0.2399[0m     +  21.0434
      9   0.2279   0.7368        0.2586       [31m0.9250[0m        0.2426        21.1403
     10   0.2333   0.7278        0.2599       0.9238        0.2429        21.0196
     11   0.2251   0.7315        0.2597       0.9238        0.2453        20.8185
     12   [36m0.2458[0m   0.7338        0.2588       0.9238        0.2478        21.4673
     13   0.2160   0.7215        [35m0.2559[0m       0.9238        0.2454        21.0414
     14   0.2230   0.7314        0.2579       0.9238        0.2450        21.5365
     15   0.2163   0.7287        0.2583       0.9238        0.2438        21.2766
     16   0.2379   [32m0.7418[0m        0.2564       0.9238        [94m0.2381[0m     +  21.0276
     17   0.2359   0.7334        [35m0.2536[0m       0.9238        0.2438        21.3733
     18   [36m0.2768[0m   [32m0.7428[0m        0.2584       0.9238        [94m0.2369[0m     +  21.3649
     19   0.2021   0.7104        0.2586       0.9238        0.2484        21.2048
     20   0.1959   0.7334        0.2545       0.9238        0.2421        21.1323
     21   0.2015   0.7194        0.2547       0.9238        0.2462        20.9469
     22   0.2159   0.7323        0.2573       0.9238        0.2428        20.9851
     23   0.1930   0.7262        0.2559       0.9238        0.2496        21.0074
     24   0.1938   0.7066        0.2574       0.9238        0.2488        21.5773
     25   0.1779   0.6921        0.2566       0.9238        0.2514        20.9619
     26   0.1885   0.7089        0.2594       0.9238        0.2490        21.1695
     27   0.2297   0.7300        0.2560       0.9238        0.2416        21.1770
Stopping since valid_loss has not improved in the last 10 epochs.
[32m[I 2023-05-02 05:16:27,257][0m Trial 40 finished with value: 0.23692039428267542 and parameters: {'lr': 0.0353264312405006, 'dropout': 0.45462291794380383, 'd_model_multiplier': 2, 'num_layers': 7, 'n_heads': 16, 'dim_feedforward': 375, 'batch_size': 171, 'pos_encoding': 'learnable', 'activation': 'gelu', 'norm': 'LayerNorm', 'optimizer_name': 'AdamW', 'weight_decay': 0.1, 'top_n_features': 106}. Best is trial 12 with value: 0.20472501771481755.[0m
[FileBasedDataset] Initializing dataset...
	Examples: 8264
	Features: 232
	Max length: 315
Standard scalar turned ON, loading params from cache
[FileBasedDataset] Dataset initialization complete
  epoch    auprc    auroc    train_loss    valid_acc    valid_loss    cp      dur
-------  -------  -------  ------------  -----------  ------------  ----  -------
      1   [36m0.1629[0m   [32m0.6759[0m        [35m0.3129[0m       [31m0.9274[0m        [94m0.3276[0m     +  15.1711
      2   [36m0.2339[0m   [32m0.7275[0m        [35m0.2646[0m       0.9262        [94m0.3171[0m     +  16.0071
      3   [36m0.2368[0m   [32m0.7372[0m        [35m0.2638[0m       0.9238        [94m0.2973[0m     +  15.5978
      4   0.2319   0.7256        0.2702       0.9238        [94m0.2572[0m     +  15.6230
      5   0.2089   0.6907        [35m0.2577[0m       0.9250        [94m0.2545[0m     +  16.1658
      6   0.2351   [32m0.7484[0m        [35m0.2566[0m       0.9190        [94m0.2334[0m     +  15.7244
      7   0.2155   0.7176        0.2599       0.9274        0.2391        16.1907
      8   [36m0.2413[0m   [32m0.7646[0m        0.2584       0.9262        0.2432        15.9548
      9   [36m0.2675[0m   [32m0.7823[0m        [35m0.2560[0m       0.9274        [94m0.2308[0m     +  16.5114
     10   0.2421   [32m0.7827[0m        [35m0.2446[0m       0.8972        0.2582        16.2526
     11   0.2367   0.7783        0.2549       0.8827        0.2721        15.8764
     12   0.2516   [32m0.7844[0m        0.2495       0.9117        0.2455        15.2439
     13   0.2621   [32m0.7954[0m        0.2487       0.8815        0.2835        15.7829
     14   0.2289   0.7792        0.2501       0.9166        0.2394        15.8945
     15   0.2375   0.7885        0.2497       0.9141        0.2340        16.1242
     16   0.2275   0.7837        0.2451       0.7872        0.4340        15.7627
     17   0.2534   [32m0.8062[0m        [35m0.2442[0m       0.9081        0.2493        16.3727
     18   0.2478   0.7988        0.2483       0.9129        0.2400        15.6011
Stopping since valid_loss has not improved in the last 10 epochs.
