[32m[I 2023-05-03 09:28:38,607][0m Trial 325 finished with value: 100.0 and parameters: {'lr': 2.7444914434248516e-07, 'dropout': 0.3939289908322148, 'd_model_multiplier': 4, 'num_layers': 7, 'n_heads': 32, 'dim_feedforward': 360, 'batch_size': 122, 'pos_encoding': 'fixed', 'activation': 'relu', 'norm': 'LayerNorm', 'optimizer_name': 'RAdam', 'weight_decay': 0.1, 'top_n_features': 69}. Best is trial 246 with value: 0.16447311791139763.[0m
[FileBasedDataset] Initializing dataset...
	Examples: 8264
	Features: 62
	Max length: 315
Standard scalar turned ON, loading params from cache
[FileBasedDataset] Dataset initialization complete
Warning, assumed runtime error: CUDA out of memory. Tried to allocate 1.53 GiB (GPU 0; 23.70 GiB total capacity; 18.76 GiB already allocated; 957.25 MiB free; 21.67 GiB reserved in total by PyTorch) If reserved memory is >> allocated memory try setting max_split_size_mb to avoid fragmentation.  See documentation for Memory Management and PYTORCH_CUDA_ALLOC_CONF
[32m[I 2023-05-03 09:28:43,857][0m Trial 326 finished with value: 100.0 and parameters: {'lr': 2.1464152520900762e-05, 'dropout': 0.4251438427271946, 'd_model_multiplier': 4, 'num_layers': 6, 'n_heads': 32, 'dim_feedforward': 375, 'batch_size': 129, 'pos_encoding': 'fixed', 'activation': 'relu', 'norm': 'LayerNorm', 'optimizer_name': 'RAdam', 'weight_decay': 0.1, 'top_n_features': 62}. Best is trial 246 with value: 0.16447311791139763.[0m
[FileBasedDataset] Initializing dataset...
	Examples: 8264
	Features: 59
	Max length: 315
Standard scalar turned ON, loading params from cache
[FileBasedDataset] Dataset initialization complete
Warning, assumed runtime error: CUDA out of memory. Tried to allocate 1.64 GiB (GPU 0; 23.70 GiB total capacity; 19.88 GiB already allocated; 957.25 MiB free; 21.67 GiB reserved in total by PyTorch) If reserved memory is >> allocated memory try setting max_split_size_mb to avoid fragmentation.  See documentation for Memory Management and PYTORCH_CUDA_ALLOC_CONF
[32m[I 2023-05-03 09:28:48,966][0m Trial 327 finished with value: 100.0 and parameters: {'lr': 5.9430984134758494e-05, 'dropout': 0.43747273057339797, 'd_model_multiplier': 4, 'num_layers': 5, 'n_heads': 32, 'dim_feedforward': 344, 'batch_size': 139, 'pos_encoding': 'fixed', 'activation': 'relu', 'norm': 'LayerNorm', 'optimizer_name': 'RAdam', 'weight_decay': 0.1, 'top_n_features': 59}. Best is trial 246 with value: 0.16447311791139763.[0m
[FileBasedDataset] Initializing dataset...
	Examples: 8264
	Features: 72
	Max length: 315
Standard scalar turned ON, loading params from cache
[FileBasedDataset] Dataset initialization complete
  epoch    auprc    auroc    train_loss    valid_acc    valid_loss    cp      dur
-------  -------  -------  ------------  -----------  ------------  ----  -------
      1   [36m0.0776[0m   [32m0.3789[0m        [35m0.6975[0m       [31m0.2842[0m        [94m0.7085[0m     +  24.2296
      2   0.0754   0.3620        [35m0.6950[0m       [31m0.3495[0m        [94m0.7043[0m     +  24.5091
      3   0.0726   0.3419        [35m0.6890[0m       [31m0.4184[0m        [94m0.6988[0m     +  24.6930
      4   0.0701   0.3230        [35m0.6831[0m       [31m0.4921[0m        [94m0.6924[0m     +  24.5140
      5   0.0683   0.3072        [35m0.6765[0m       [31m0.5707[0m        [94m0.6853[0m     +  24.6697
      6   0.0673   0.2948        [35m0.6710[0m       [31m0.6433[0m        [94m0.6776[0m     +  24.6277
      7   0.0667   0.2852        [35m0.6608[0m       [31m0.7158[0m        [94m0.6694[0m     +  25.2674
      8   0.0664   0.2796        [35m0.6533[0m       [31m0.7618[0m        [94m0.6609[0m     +  25.1343
      9   0.0662   0.2750        [35m0.6439[0m       [31m0.7969[0m        [94m0.6520[0m     +  25.4541
     10   0.0662   0.2722        [35m0.6355[0m       [31m0.8392[0m        [94m0.6429[0m     +  25.3455
     11   0.0663   0.2708        [35m0.6271[0m       [31m0.8670[0m        [94m0.6337[0m     +  25.3683
     12   0.0663   0.2691        [35m0.6175[0m       [31m0.8827[0m        [94m0.6243[0m     +  25.1749
     13   0.0665   0.2687        [35m0.6069[0m       [31m0.8936[0m        [94m0.6148[0m     +  25.0184
     14   0.0667   0.2683        [35m0.5987[0m       [31m0.8984[0m        [94m0.6053[0m     +  25.2974
     15   0.0667   0.2677        [35m0.5875[0m       [31m0.8996[0m        [94m0.5958[0m     +  25.2435
     16   0.0668   0.2675        [35m0.5781[0m       0.8996        [94m0.5863[0m     +  24.9969
     17   0.0670   0.2677        [35m0.5682[0m       0.8996        [94m0.5769[0m     +  25.5004
     18   0.0673   0.2683        [35m0.5587[0m       0.8996        [94m0.5676[0m     +  25.4981
     19   0.0676   0.2684        [35m0.5488[0m       0.8996        [94m0.5584[0m     +  25.0395
     20   0.0679   0.2686        [35m0.5394[0m       0.8996        [94m0.5493[0m     +  25.1904
     21   0.0682   0.2690        [35m0.5310[0m       0.8996        [94m0.5404[0m     +  25.2762
     22   0.0690   0.2691        [35m0.5217[0m       0.8996        [94m0.5316[0m     +  25.1172
     23   0.0690   0.2693        [35m0.5130[0m       0.8996        [94m0.5231[0m     +  25.1317
     24   0.0691   0.2695        [35m0.5027[0m       0.8996        [94m0.5147[0m     +  25.1896
     25   0.0698   0.2698        [35m0.4942[0m       0.8996        [94m0.5065[0m     +  25.0961
     26   0.0698   0.2699        [35m0.4856[0m       0.8996        [94m0.4985[0m     +  25.2833
     27   0.0699   0.2707        [35m0.4775[0m       0.8996        [94m0.4908[0m     +  25.5715
     28   0.0700   0.2711        [35m0.4705[0m       0.8996        [94m0.4833[0m     +  25.1933
     29   0.0711   0.2717        [35m0.4612[0m       0.8996        [94m0.4759[0m     +  25.1456
     30   0.0712   0.2721        [35m0.4528[0m       0.8996        [94m0.4688[0m     +  25.2093
     31   0.0713   0.2727        [35m0.4460[0m       0.8996        [94m0.4619[0m     +  25.1830
     32   0.0715   0.2738        [35m0.4383[0m       0.8996        [94m0.4552[0m     +  24.8955
     33   0.0717   0.2748        [35m0.4319[0m       0.8996        [94m0.4488[0m     +  25.3312
     34   0.0719   0.2762        [35m0.4252[0m       0.8996        [94m0.4426[0m     +  25.0266
     35   0.0720   0.2781        [35m0.4182[0m       0.8996        [94m0.4366[0m     +  25.0704
     36   0.0722   0.2796        [35m0.4121[0m       0.8996        [94m0.4309[0m     +  25.0151
     37   0.0725   0.2817        [35m0.4061[0m       0.8996        [94m0.4254[0m     +  25.3931
     38   0.0726   0.2842        [35m0.3989[0m       0.8996        [94m0.4202[0m     +  25.5187
     39   0.0729   0.2876        [35m0.3931[0m       0.8996        [94m0.4151[0m     +  25.2376
     40   0.0732   0.2910        [35m0.3887[0m       0.8996        [94m0.4102[0m     +  25.2076
     41   0.0736   0.2954        [35m0.3814[0m       0.8996        [94m0.4056[0m     +  25.4022
     42   0.0741   0.3002        [35m0.3782[0m       0.8996        [94m0.4011[0m     +  25.3152
     43   0.0745   0.3058        [35m0.3722[0m       0.8996        [94m0.3969[0m     +  24.9024
     44   0.0750   0.3122        [35m0.3659[0m       0.8996        [94m0.3929[0m     +  25.2805
     45   0.0755   0.3180        [35m0.3611[0m       0.8996        [94m0.3890[0m     +  25.4879
     46   0.0763   0.3256        [35m0.3581[0m       0.8996        [94m0.3853[0m     +  25.3785
     47   0.0769   0.3331        [35m0.3528[0m       0.8996        [94m0.3818[0m     +  25.1922
     48   [36m0.0778[0m   0.3420        [35m0.3490[0m       0.8996        [94m0.3784[0m     +  25.2902
     49   [36m0.0787[0m   0.3507        [35m0.3456[0m       0.8996        [94m0.3752[0m     +  25.3183
     50   [36m0.0816[0m   0.3592        [35m0.3422[0m       0.8996        [94m0.3722[0m     +  25.0113
[32m[I 2023-05-03 09:49:51,292][0m Trial 328 finished with value: 0.37217228040729783 and parameters: {'lr': 3.7621328206235406e-07, 'dropout': 0.4194184044345339, 'd_model_multiplier': 4, 'num_layers': 5, 'n_heads': 32, 'dim_feedforward': 379, 'batch_size': 123, 'pos_encoding': 'fixed', 'activation': 'relu', 'norm': 'LayerNorm', 'optimizer_name': 'RAdam', 'weight_decay': 0.1, 'top_n_features': 72}. Best is trial 246 with value: 0.16447311791139763.[0m
[FileBasedDataset] Initializing dataset...
	Examples: 8264
	Features: 69
	Max length: 315
Standard scalar turned ON, loading params from cache
[FileBasedDataset] Dataset initialization complete
Warning, assumed runtime error: CUDA out of memory. Tried to allocate 1.66 GiB (GPU 0; 23.70 GiB total capacity; 19.98 GiB already allocated; 957.25 MiB free; 21.67 GiB reserved in total by PyTorch) If reserved memory is >> allocated memory try setting max_split_size_mb to avoid fragmentation.  See documentation for Memory Management and PYTORCH_CUDA_ALLOC_CONF
[32m[I 2023-05-03 09:49:57,342][0m Trial 329 finished with value: 100.0 and parameters: {'lr': 8.412933737080946e-05, 'dropout': 0.44413568807291914, 'd_model_multiplier': 4, 'num_layers': 5, 'n_heads': 32, 'dim_feedforward': 316, 'batch_size': 140, 'pos_encoding': 'fixed', 'activation': 'relu', 'norm': 'LayerNorm', 'optimizer_name': 'RAdam', 'weight_decay': 0.1, 'top_n_features': 69}. Best is trial 246 with value: 0.16447311791139763.[0m
[FileBasedDataset] Initializing dataset...
	Examples: 8264
	Features: 75
	Max length: 315
Standard scalar turned ON, loading params from cache
[FileBasedDataset] Dataset initialization complete
  epoch    auprc    auroc    train_loss    valid_acc    valid_loss    cp      dur
-------  -------  -------  ------------  -----------  ------------  ----  -------
      1   [36m0.0851[0m   [32m0.5627[0m        [35m0.4441[0m       [31m0.9335[0m        [94m0.2521[0m     +  23.4159
      2   [36m0.1974[0m   [32m0.6781[0m        [35m0.2662[0m       0.9335        [94m0.2241[0m     +  23.6338
      3   [36m0.3042[0m   [32m0.7505[0m        [35m0.2465[0m       [31m0.9359[0m        [94m0.2088[0m     +  23.6922
      4   [36m0.3259[0m   [32m0.7779[0m        [35m0.2404[0m       [31m0.9371[0m        [94m0.2043[0m     +  23.7863
      5   [36m0.3426[0m   [32m0.7817[0m        [35m0.2360[0m       0.9359        [94m0.2025[0m     +  23.9023
      6   0.3369   [32m0.7845[0m        [35m0.2340[0m       0.9359        [94m0.2017[0m     +  23.7340
      7   0.3350   [32m0.7871[0m        [35m0.2324[0m       0.9347        [94m0.2010[0m     +  23.8005
      8   0.3336   [32m0.7899[0m        0.2334       0.9347        0.2012        23.9346
      9   0.3317   [32m0.7926[0m        [35m0.2317[0m       0.9347        [94m0.2008[0m     +  24.0220
     10   0.3256   [32m0.7936[0m        [35m0.2304[0m       0.9347        0.2014        23.9807
     11   0.3252   [32m0.7965[0m        0.2304       0.9250        0.2013        23.9524
     12   0.3255   [32m0.7977[0m        [35m0.2290[0m       0.9262        0.2018        23.9812
     13   0.3254   [32m0.7978[0m        [35m0.2284[0m       0.9323        0.2024        23.8587
     14   0.3272   [32m0.8022[0m        [35m0.2280[0m       0.9299        0.2017        23.8976
     15   0.3274   [32m0.8033[0m        [35m0.2273[0m       0.9287        0.2022        23.9010
     16   0.3247   [32m0.8043[0m        [35m0.2265[0m       0.9274        0.2021        23.8347
     17   0.3245   [32m0.8059[0m        [35m0.2256[0m       0.9287        0.2020        23.8182
     18   0.3152   0.8040        [35m0.2236[0m       0.9274        0.2046        23.9459
Stopping since valid_loss has not improved in the last 10 epochs.
[32m[I 2023-05-03 09:57:31,534][0m Trial 330 finished with value: 0.20077502397322597 and parameters: {'lr': 3.1000014200442066e-05, 'dropout': 0.45687200918408133, 'd_model_multiplier': 4, 'num_layers': 5, 'n_heads': 32, 'dim_feedforward': 366, 'batch_size': 26, 'pos_encoding': 'fixed', 'activation': 'relu', 'norm': 'LayerNorm', 'optimizer_name': 'RAdam', 'weight_decay': 0.001, 'top_n_features': 75}. Best is trial 246 with value: 0.16447311791139763.[0m
[FileBasedDataset] Initializing dataset...
	Examples: 8264
	Features: 63
	Max length: 315
Standard scalar turned ON, loading params from cache
[FileBasedDataset] Dataset initialization complete
  epoch    auprc    auroc    train_loss    valid_acc    valid_loss    cp      dur
-------  -------  -------  ------------  -----------  ------------  ----  -------
      1   [36m0.1842[0m   [32m0.7015[0m        [35m0.4131[0m       [31m0.9299[0m        [94m0.2389[0m     +  23.6666
      2   [36m0.2692[0m   [32m0.7633[0m        [35m0.2517[0m       0.9287        [94m0.2203[0m     +  23.9221
      3   [36m0.2869[0m   [32m0.7644[0m        [35m0.2399[0m       0.9299        0.2216        23.7329
      4   [36m0.2980[0m   [32m0.7719[0m        [35m0.2371[0m       0.9274        0.2223        23.9424
      5   0.2816   0.7716        [35m0.2325[0m       0.9274        0.2249        23.9479
      6   0.2747   [32m0.7749[0m        [35m0.2313[0m       0.9238        0.2285        23.8511
      7   0.2727   [32m0.7802[0m        [35m0.2304[0m       0.9226        0.2272        23.6832
      8   0.2787   [32m0.7826[0m        [35m0.2295[0m       0.9190        0.2298        24.8922
      9   0.2787   [32m0.7840[0m        [35m0.2292[0m       0.9262        0.2270        23.7833
     10   0.2762   [32m0.7876[0m        0.2293       0.9214        0.2286        23.8582
     11   0.2910   0.7864        [35m0.2276[0m       0.9274        0.2274        23.8815
Stopping since valid_loss has not improved in the last 10 epochs.
[32m[I 2023-05-03 10:02:18,979][0m Trial 331 finished with value: 0.22026065332947936 and parameters: {'lr': 4.056180375329768e-05, 'dropout': 0.44898744970169713, 'd_model_multiplier': 4, 'num_layers': 5, 'n_heads': 32, 'dim_feedforward': 357, 'batch_size': 26, 'pos_encoding': 'fixed', 'activation': 'relu', 'norm': 'LayerNorm', 'optimizer_name': 'RAdam', 'weight_decay': 0.001, 'top_n_features': 63}. Best is trial 246 with value: 0.16447311791139763.[0m
[FileBasedDataset] Initializing dataset...
	Examples: 8264
	Features: 77
	Max length: 315
Standard scalar turned ON, loading params from cache
[FileBasedDataset] Dataset initialization complete
Warning, assumed runtime error: CUDA out of memory. Tried to allocate 1.55 GiB (GPU 0; 23.70 GiB total capacity; 19.05 GiB already allocated; 957.25 MiB free; 21.67 GiB reserved in total by PyTorch) If reserved memory is >> allocated memory try setting max_split_size_mb to avoid fragmentation.  See documentation for Memory Management and PYTORCH_CUDA_ALLOC_CONF
[32m[I 2023-05-03 10:02:24,396][0m Trial 332 finished with value: 100.0 and parameters: {'lr': 8.358268128371433e-05, 'dropout': 0.4582675150992949, 'd_model_multiplier': 4, 'num_layers': 6, 'n_heads': 32, 'dim_feedforward': 370, 'batch_size': 131, 'pos_encoding': 'fixed', 'activation': 'relu', 'norm': 'LayerNorm', 'optimizer_name': 'RAdam', 'weight_decay': 0.001, 'top_n_features': 77}. Best is trial 246 with value: 0.16447311791139763.[0m
[FileBasedDataset] Initializing dataset...
	Examples: 8264
	Features: 84
	Max length: 315
Standard scalar turned ON, loading params from cache
[FileBasedDataset] Dataset initialization complete
  epoch    auprc    auroc    train_loss    valid_acc    valid_loss    cp      dur
-------  -------  -------  ------------  -----------  ------------  ----  -------
      1   [36m0.1070[0m   [32m0.5001[0m        [35m0.6811[0m       [31m0.8634[0m        [94m0.6376[0m     +  24.6027
      2   0.0794   0.3547        [35m0.5687[0m       [31m0.9008[0m        [94m0.5083[0m     +  24.1804
      3   0.0824   0.3584        [35m0.4491[0m       0.9008        [94m0.4086[0m     +  24.1164
      4   0.0923   0.4284        [35m0.3628[0m       0.9008        [94m0.3542[0m     +  24.5431
      5   [36m0.1285[0m   [32m0.5433[0m        [35m0.3115[0m       0.9008        [94m0.3277[0m     +  24.2342
      6   [36m0.1647[0m   [32m0.6151[0m        [35m0.2842[0m       0.9008        [94m0.3148[0m     +  24.7318
      7   [36m0.1928[0m   [32m0.6522[0m        [35m0.2696[0m       0.9008        [94m0.3082[0m     +  24.6160
      8   [36m0.2093[0m   [32m0.6724[0m        [35m0.2607[0m       0.9008        [94m0.3046[0m     +  24.7396
      9   [36m0.2159[0m   [32m0.6841[0m        [35m0.2543[0m       0.9008        [94m0.3024[0m     +  24.8397
     10   [36m0.2215[0m   [32m0.6942[0m        [35m0.2490[0m       0.9008        [94m0.3008[0m     +  24.8029
     11   [36m0.2281[0m   [32m0.7058[0m        [35m0.2464[0m       0.9008        [94m0.2997[0m     +  24.5818
     12   [36m0.2351[0m   [32m0.7139[0m        [35m0.2447[0m       0.9008        [94m0.2988[0m     +  24.5051
     13   [36m0.2406[0m   [32m0.7204[0m        [35m0.2415[0m       0.8996        [94m0.2984[0m     +  24.5902
     14   [36m0.2457[0m   [32m0.7256[0m        [35m0.2394[0m       0.8984        [94m0.2982[0m     +  24.8092
     15   [36m0.2512[0m   [32m0.7298[0m        [35m0.2361[0m       0.8996        0.2984        24.9998
     16   [36m0.2562[0m   [32m0.7321[0m        [35m0.2349[0m       0.8996        0.2993        24.7629
     17   [36m0.2594[0m   [32m0.7330[0m        [35m0.2335[0m       0.8960        0.3004        24.8954
     18   [36m0.2605[0m   0.7325        [35m0.2316[0m       0.8960        0.3016        24.7184
     19   [36m0.2652[0m   [32m0.7339[0m        [35m0.2291[0m       0.8996        0.3023        24.6058
     20   [36m0.2697[0m   [32m0.7361[0m        [35m0.2288[0m       0.8984        0.3026        24.7181
     21   [36m0.2713[0m   [32m0.7378[0m        [35m0.2275[0m       0.8972        0.3027        24.6868
     22   [36m0.2738[0m   [32m0.7388[0m        0.2289       0.8996        0.3035        24.5701
     23   [36m0.2749[0m   [32m0.7406[0m        0.2283       0.8984        0.3030        24.8827
Stopping since valid_loss has not improved in the last 10 epochs.
[32m[I 2023-05-03 10:12:17,505][0m Trial 333 finished with value: 0.2981507511136033 and parameters: {'lr': 1.1910564713980704e-05, 'dropout': 0.4286218384119692, 'd_model_multiplier': 4, 'num_layers': 5, 'n_heads': 32, 'dim_feedforward': 348, 'batch_size': 108, 'pos_encoding': 'fixed', 'activation': 'relu', 'norm': 'LayerNorm', 'optimizer_name': 'RAdam', 'weight_decay': 0.001, 'top_n_features': 84}. Best is trial 246 with value: 0.16447311791139763.[0m
[FileBasedDataset] Initializing dataset...
	Examples: 8264
	Features: 74
	Max length: 315
Standard scalar turned ON, loading params from cache
[FileBasedDataset] Dataset initialization complete
  epoch    auprc    auroc    train_loss    valid_acc    valid_loss    cp      dur
-------  -------  -------  ------------  -----------  ------------  ----  -------
      1   [36m0.1331[0m   [32m0.5680[0m        [35m0.4280[0m       [31m0.9045[0m        [94m0.3170[0m     +  23.7728
      2   [36m0.2700[0m   [32m0.7554[0m        [35m0.2549[0m       0.9045        [94m0.2862[0m     +  23.9796
      3   [36m0.3539[0m   [32m0.7921[0m        [35m0.2378[0m       [31m0.9069[0m        [94m0.2718[0m     +  24.3537
      4   [36m0.3669[0m   [32m0.7974[0m        [35m0.2328[0m       0.9045        [94m0.2702[0m     +  23.9934
      5   0.3658   [32m0.8070[0m        [35m0.2309[0m       0.9069        [94m0.2652[0m     +  23.8663
      6   0.3648   [32m0.8122[0m        [35m0.2279[0m       [31m0.9093[0m        [94m0.2642[0m     +  24.0536
      7   0.3604   [32m0.8169[0m        [35m0.2271[0m       [31m0.9105[0m        0.2650        23.8793
      8   0.3579   [32m0.8174[0m        [35m0.2260[0m       0.9081        [94m0.2628[0m     +  24.0310
      9   0.3549   [32m0.8198[0m        [35m0.2254[0m       0.9081        0.2643        24.0701
     10   0.3490   [32m0.8198[0m        [35m0.2248[0m       0.9045        0.2661        24.0375
     11   0.3444   [32m0.8222[0m        [35m0.2218[0m       0.9033        0.2657        24.1821
     12   0.3457   [32m0.8230[0m        0.2226       0.9069        0.2665        24.1654
     13   0.3398   0.8214        [35m0.2218[0m       0.9021        0.2700        24.0767
     14   0.3348   0.8192        [35m0.2199[0m       0.9045        0.2727        23.9904
     15   0.3276   0.8181        [35m0.2171[0m       0.9069        0.2745        23.9309
     16   0.3307   0.8172        0.2180       0.9021        0.2761        24.1200
     17   0.3309   0.8180        [35m0.2170[0m       0.9057        0.2753        24.0839
Stopping since valid_loss has not improved in the last 10 epochs.
