[32m[I 2023-05-05 06:31:56,522][0m Trial 557 finished with value: 0.23923437155900296 and parameters: {'lr': 0.0031431571346132014, 'dropout': 0.25503139699736355, 'd_model_multiplier': 32, 'num_layers': 5, 'n_heads': 32, 'dim_feedforward': 362, 'batch_size': 22, 'pos_encoding': 'fixed', 'activation': 'relu', 'norm': 'LayerNorm', 'optimizer_name': 'AdamW', 'weight_decay': 0.001, 'top_n_features': 54}. Best is trial 246 with value: 0.16447311791139763.[0m
[FileBasedDataset] Initializing dataset...
	Examples: 8264
	Features: 75
	Max length: 315
Standard scalar turned ON, loading params from cache
[FileBasedDataset] Dataset initialization complete
  epoch    auprc    auroc    train_loss    valid_acc    valid_loss    cp      dur
-------  -------  -------  ------------  -----------  ------------  ----  -------
      1   [36m0.1272[0m   [32m0.5665[0m        [35m0.4811[0m       [31m0.9141[0m        [94m0.3017[0m     +  16.6967
      2   [36m0.2605[0m   [32m0.7491[0m        [35m0.2624[0m       0.9141        [94m0.2615[0m     +  16.2719
      3   [36m0.2828[0m   [32m0.7774[0m        [35m0.2422[0m       [31m0.9154[0m        [94m0.2520[0m     +  16.5574
      4   [36m0.3007[0m   [32m0.7908[0m        [35m0.2365[0m       0.9129        [94m0.2480[0m     +  16.7298
      5   [36m0.3113[0m   [32m0.7953[0m        [35m0.2346[0m       0.9117        [94m0.2463[0m     +  17.2006
      6   [36m0.3135[0m   [32m0.7969[0m        [35m0.2302[0m       0.9129        0.2463        16.8344
      7   [36m0.3281[0m   [32m0.7976[0m        [35m0.2281[0m       0.9117        [94m0.2460[0m     +  16.7658
      8   [36m0.3342[0m   [32m0.7995[0m        [35m0.2268[0m       0.9117        [94m0.2459[0m     +  16.5749
      9   0.3323   0.7973        [35m0.2250[0m       0.9093        0.2481        16.2995
     10   [36m0.3372[0m   [32m0.8002[0m        [35m0.2234[0m       0.9105        0.2486        16.5455
     11   0.3353   [32m0.8003[0m        [35m0.2214[0m       0.9105        0.2483        16.8519
     12   [36m0.3396[0m   0.8002        [35m0.2196[0m       0.9105        0.2480        16.4634
     13   0.3210   [32m0.8010[0m        [35m0.2178[0m       0.9093        0.2500        16.5466
     14   0.3278   [32m0.8010[0m        [35m0.2172[0m       0.9081        0.2504        16.5268
     15   0.3329   [32m0.8020[0m        [35m0.2149[0m       0.9093        0.2524        16.9506
     16   0.3381   [32m0.8042[0m        [35m0.2125[0m       0.9081        0.2516        16.6116
     17   0.3331   0.8024        [35m0.2117[0m       0.9093        0.2539        16.6760
Stopping since valid_loss has not improved in the last 10 epochs.
[32m[I 2023-05-05 06:36:57,129][0m Trial 558 finished with value: 0.24586119319896743 and parameters: {'lr': 5.2235169871576485e-05, 'dropout': 0.29174520419375716, 'd_model_multiplier': 4, 'num_layers': 3, 'n_heads': 32, 'dim_feedforward': 420, 'batch_size': 51, 'pos_encoding': 'fixed', 'activation': 'relu', 'norm': 'LayerNorm', 'optimizer_name': 'RAdam', 'weight_decay': 0, 'top_n_features': 75}. Best is trial 246 with value: 0.16447311791139763.[0m
[FileBasedDataset] Initializing dataset...
	Examples: 8264
	Features: 59
	Max length: 315
Standard scalar turned ON, loading params from cache
[FileBasedDataset] Dataset initialization complete
  epoch    auprc    auroc    train_loss    valid_acc    valid_loss    cp      dur
-------  -------  -------  ------------  -----------  ------------  ----  -------
      1   [36m0.1575[0m   [32m0.6864[0m        [35m0.2916[0m       [31m0.9117[0m        [94m0.3124[0m     +  19.7033
      2   [36m0.1593[0m   0.6807        [35m0.2674[0m       [31m0.9129[0m        [94m0.3122[0m     +  20.0967
      3   0.1564   [32m0.6877[0m        [35m0.2639[0m       0.9008        [94m0.3024[0m     +  19.9338
      4   [36m0.1646[0m   0.6845        [35m0.2593[0m       [31m0.9154[0m        [94m0.2901[0m     +  19.9474
      5   0.1592   0.6866        [35m0.2586[0m       0.9105        [94m0.2875[0m     +  20.2143
      6   0.1567   0.6844        [35m0.2569[0m       0.8960        0.3009        20.2252
      7   0.1540   [32m0.6888[0m        [35m0.2558[0m       0.9154        0.3016        20.2418
      8   0.1604   0.6802        [35m0.2555[0m       0.9154        0.3264        20.4492
      9   [36m0.1904[0m   0.6874        [35m0.2550[0m       0.9154        0.2985        20.5270
     10   0.1528   0.6538        [35m0.2515[0m       0.9154        0.3083        20.1733
     11   0.1587   0.6544        0.2517       0.9154        0.3132        20.3832
     12   0.1602   0.6529        [35m0.2507[0m       0.9154        0.2963        20.0911
     13   0.1602   0.6782        [35m0.2494[0m       0.9154        [94m0.2805[0m     +  20.7298
     14   0.1673   0.6700        0.2502       0.9154        [94m0.2769[0m     +  20.1406
     15   0.1647   0.6788        0.2505       0.9154        0.2782        20.2025
     16   0.1604   0.6636        [35m0.2480[0m       0.9154        0.2819        20.2870
     17   0.1620   0.6731        0.2516       0.9154        [94m0.2768[0m     +  20.2895
     18   0.1611   0.6770        0.2495       0.9154        0.2789        20.1029
     19   0.1619   0.6808        [35m0.2477[0m       0.9154        0.2788        20.1730
     20   0.1607   0.6869        0.2506       0.9154        [94m0.2765[0m     +  20.1010
     21   0.1631   0.6792        0.2480       0.9154        0.2786        19.9755
     22   0.1631   0.6859        0.2480       0.9129        0.2813        20.1472
     23   0.1582   0.6819        [35m0.2473[0m       0.9154        0.2793        20.2112
     24   0.1649   0.6836        [35m0.2468[0m       0.9154        0.2766        20.0859
     25   0.1624   0.6863        [35m0.2454[0m       0.9154        0.2773        20.2366
     26   0.1612   0.6791        0.2459       0.9154        0.2766        20.2367
     27   0.1628   0.6788        0.2455       0.9154        0.2796        20.1865
     28   0.1634   0.6794        [35m0.2448[0m       0.9154        0.2786        20.1205
     29   0.1628   0.6752        0.2469       0.9154        0.2770        20.2152
Stopping since valid_loss has not improved in the last 10 epochs.
[32m[I 2023-05-05 06:47:04,038][0m Trial 559 finished with value: 0.2764896899461746 and parameters: {'lr': 0.007119560905178371, 'dropout': 0.42581607268041183, 'd_model_multiplier': 4, 'num_layers': 4, 'n_heads': 32, 'dim_feedforward': 343, 'batch_size': 28, 'pos_encoding': 'fixed', 'activation': 'relu', 'norm': 'LayerNorm', 'optimizer_name': 'RAdam', 'weight_decay': 0.01, 'top_n_features': 59}. Best is trial 246 with value: 0.16447311791139763.[0m
[FileBasedDataset] Initializing dataset...
	Examples: 8264
	Features: 66
	Max length: 315
Standard scalar turned ON, loading params from cache
[FileBasedDataset] Dataset initialization complete
  epoch    auprc    auroc    train_loss    valid_acc    valid_loss    cp      dur
-------  -------  -------  ------------  -----------  ------------  ----  -------
      1   [36m0.1498[0m   [32m0.6899[0m        [35m0.2815[0m       [31m0.9371[0m        [94m0.2443[0m     +  21.9290
      2   [36m0.1514[0m   [32m0.7012[0m        [35m0.2694[0m       0.9335        [94m0.2380[0m     +  21.9681
      3   0.1504   [32m0.7052[0m        [35m0.2641[0m       0.9299        0.2406        21.9909
      4   0.1500   [32m0.7064[0m        [35m0.2612[0m       0.9287        0.2415        22.1381
      5   [36m0.1606[0m   0.7060        [35m0.2603[0m       0.9371        0.2398        22.3493
      6   0.1517   0.7062        0.2603       0.9287        0.2481        22.1620
      7   0.1456   0.7034        [35m0.2599[0m       0.9347        0.2452        21.9664
      8   0.1453   0.7028        [35m0.2590[0m       0.9347        0.2498        22.2891
      9   0.1407   0.7046        0.2628       0.9371        0.2453        22.1021
     10   0.1449   [32m0.7064[0m        0.2594       0.9335        0.2455        22.4082
     11   0.1436   0.7046        [35m0.2589[0m       0.9323        0.2494        22.2229
Stopping since valid_loss has not improved in the last 10 epochs.
[32m[I 2023-05-05 06:51:30,258][0m Trial 560 finished with value: 0.23795399722049718 and parameters: {'lr': 0.0016525437322629914, 'dropout': 0.5116963296205657, 'd_model_multiplier': 1, 'num_layers': 6, 'n_heads': 32, 'dim_feedforward': 337, 'batch_size': 20, 'pos_encoding': 'fixed', 'activation': 'relu', 'norm': 'LayerNorm', 'optimizer_name': 'AdamW', 'weight_decay': 0.001, 'top_n_features': 66}. Best is trial 246 with value: 0.16447311791139763.[0m
[FileBasedDataset] Initializing dataset...
	Examples: 8264
	Features: 122
	Max length: 315
Standard scalar turned ON, loading params from cache
[FileBasedDataset] Dataset initialization complete
Warning, assumed runtime error: CUDA out of memory. Tried to allocate 1.92 GiB (GPU 0; 23.70 GiB total capacity; 20.48 GiB already allocated; 139.25 MiB free; 22.47 GiB reserved in total by PyTorch) If reserved memory is >> allocated memory try setting max_split_size_mb to avoid fragmentation.  See documentation for Memory Management and PYTORCH_CUDA_ALLOC_CONF
[32m[I 2023-05-05 06:51:34,940][0m Trial 561 finished with value: 100.0 and parameters: {'lr': 3.398106412382825e-05, 'dropout': 0.5310384506628786, 'd_model_multiplier': 4, 'num_layers': 7, 'n_heads': 64, 'dim_feedforward': 375, 'batch_size': 81, 'pos_encoding': 'fixed', 'activation': 'relu', 'norm': 'LayerNorm', 'optimizer_name': 'RAdam', 'weight_decay': 0.1, 'top_n_features': 122}. Best is trial 246 with value: 0.16447311791139763.[0m
[FileBasedDataset] Initializing dataset...
	Examples: 8264
	Features: 62
	Max length: 315
Standard scalar turned ON, loading params from cache
[FileBasedDataset] Dataset initialization complete
  epoch    auprc    auroc    train_loss    valid_acc    valid_loss    cp     dur
-------  -------  -------  ------------  -----------  ------------  ----  ------
      1   [36m0.0720[0m   [32m0.4774[0m        [35m0.4814[0m       [31m0.9226[0m        [94m0.3123[0m     +  9.5417
      2   [36m0.1987[0m   [32m0.7056[0m        [35m0.2794[0m       0.9226        [94m0.2525[0m     +  10.4207
      3   [36m0.2316[0m   [32m0.7499[0m        [35m0.2569[0m       0.9226        [94m0.2398[0m     +  10.4937
      4   [36m0.3106[0m   [32m0.7959[0m        [35m0.2457[0m       0.9202        [94m0.2278[0m     +  10.5559
      5   [36m0.3589[0m   [32m0.8107[0m        [35m0.2391[0m       [31m0.9238[0m        [94m0.2181[0m     +  10.8462
      6   [36m0.3628[0m   [32m0.8141[0m        [35m0.2362[0m       [31m0.9250[0m        [94m0.2175[0m     +  10.8840
      7   [36m0.3771[0m   [32m0.8208[0m        [35m0.2352[0m       [31m0.9262[0m        [94m0.2145[0m     +  11.0204
      8   0.3584   0.8201        [35m0.2319[0m       0.9238        0.2193        10.9873
      9   0.3304   0.8188        [35m0.2312[0m       0.9214        0.2197        11.1598
     10   0.3222   0.8182        [35m0.2271[0m       0.9214        0.2268        11.0158
     11   0.3203   0.8184        [35m0.2261[0m       0.9202        0.2242        10.8943
     12   0.3140   0.8183        [35m0.2261[0m       0.9166        0.2268        11.1105
     13   0.3240   [32m0.8242[0m        [35m0.2232[0m       0.9166        0.2224        11.2378
     14   0.3173   0.8217        0.2245       0.9166        0.2261        10.8715
     15   0.3215   0.8210        [35m0.2225[0m       0.9190        0.2269        11.2839
     16   0.3253   0.8217        0.2232       0.9178        0.2235        10.6125
Stopping since valid_loss has not improved in the last 10 epochs.
[32m[I 2023-05-05 06:54:39,409][0m Trial 562 finished with value: 0.21449680964461332 and parameters: {'lr': 0.0010463309010361654, 'dropout': 0.39750840907681245, 'd_model_multiplier': 4, 'num_layers': 5, 'n_heads': 4, 'dim_feedforward': 323, 'batch_size': 118, 'pos_encoding': 'fixed', 'activation': 'relu', 'norm': 'LayerNorm', 'optimizer_name': 'RAdam', 'weight_decay': 0.001, 'top_n_features': 62}. Best is trial 246 with value: 0.16447311791139763.[0m
[FileBasedDataset] Initializing dataset...
	Examples: 8264
	Features: 49
	Max length: 315
Standard scalar turned ON, loading params from cache
[FileBasedDataset] Dataset initialization complete
  epoch    auprc    auroc    train_loss    valid_acc    valid_loss    cp     dur
-------  -------  -------  ------------  -----------  ------------  ----  ------
      1   [36m0.2250[0m   [32m0.6219[0m        [35m0.3664[0m       [31m0.9081[0m        [94m0.2952[0m     +  9.3878
      2   [36m0.2721[0m   [32m0.6877[0m        [35m0.2566[0m       [31m0.9093[0m        [94m0.2833[0m     +  8.9986
      3   [36m0.2784[0m   [32m0.7187[0m        [35m0.2424[0m       0.9093        [94m0.2798[0m     +  9.6483
      4   [36m0.2932[0m   [32m0.7376[0m        [35m0.2394[0m       0.9069        [94m0.2770[0m     +  9.9731
      5   [36m0.3029[0m   [32m0.7539[0m        [35m0.2348[0m       0.9093        [94m0.2742[0m     +  9.7145
      6   [36m0.3167[0m   [32m0.7655[0m        [35m0.2323[0m       0.9081        [94m0.2721[0m     +  10.0770
      7   [36m0.3189[0m   [32m0.7733[0m        [35m0.2311[0m       0.9033        [94m0.2709[0m     +  9.7446
      8   [36m0.3237[0m   [32m0.7798[0m        [35m0.2296[0m       0.9033        [94m0.2701[0m     +  9.6923
      9   0.3219   [32m0.7841[0m        0.2302       0.9045        [94m0.2697[0m     +  9.9608
     10   [36m0.3240[0m   [32m0.7884[0m        [35m0.2290[0m       0.9057        [94m0.2693[0m     +  9.6470
     11   [36m0.3241[0m   [32m0.7921[0m        [35m0.2275[0m       0.9069        [94m0.2687[0m     +  10.0428
     12   [36m0.3268[0m   [32m0.7938[0m        [35m0.2263[0m       0.9057        [94m0.2682[0m     +  9.7348
     13   [36m0.3280[0m   [32m0.7970[0m        [35m0.2260[0m       0.9057        [94m0.2679[0m     +  9.7098
     14   0.3257   [32m0.7992[0m        0.2261       0.9057        0.2680        10.0730
     15   0.3251   [32m0.8007[0m        [35m0.2251[0m       0.9057        [94m0.2677[0m     +  9.7083
     16   0.3270   [32m0.8026[0m        0.2263       0.9057        [94m0.2675[0m     +  10.1608
     17   0.3271   [32m0.8040[0m        [35m0.2248[0m       0.9057        [94m0.2671[0m     +  10.5250
     18   0.3268   [32m0.8047[0m        0.2251       0.9057        0.2671        10.0708
     19   [36m0.3299[0m   [32m0.8066[0m        [35m0.2238[0m       0.9033        [94m0.2671[0m     +  9.9015
     20   [36m0.3310[0m   [32m0.8079[0m        [35m0.2229[0m       0.9033        [94m0.2669[0m     +  10.2416
     21   [36m0.3325[0m   [32m0.8092[0m        0.2239       0.9021        [94m0.2669[0m     +  10.1531
     22   0.3255   [32m0.8097[0m        [35m0.2226[0m       0.9021        [94m0.2667[0m     +  9.9543
     23   0.3323   [32m0.8111[0m        0.2233       0.9021        [94m0.2663[0m     +  10.0207
     24   0.3266   [32m0.8124[0m        [35m0.2224[0m       0.9021        [94m0.2661[0m     +  9.8665
     25   0.3279   [32m0.8139[0m        [35m0.2223[0m       0.9008        [94m0.2659[0m     +  9.8670
     26   0.3277   [32m0.8149[0m        [35m0.2222[0m       0.9008        [94m0.2657[0m     +  9.9087
     27   0.3288   [32m0.8158[0m        [35m0.2218[0m       0.9008        0.2658        9.5112
     28   0.3295   [32m0.8169[0m        [35m0.2200[0m       0.9008        0.2658        9.9124
     29   0.3310   [32m0.8183[0m        0.2202       0.8996        [94m0.2653[0m     +  9.9213
     30   0.3317   [32m0.8190[0m        0.2207       0.8996        [94m0.2652[0m     +  9.9812
     31   0.3304   [32m0.8194[0m        0.2202       0.9008        [94m0.2648[0m     +  9.7466
     32   0.3316   [32m0.8200[0m        [35m0.2194[0m       0.9021        [94m0.2643[0m     +  9.6951
     33   [36m0.3334[0m   [32m0.8208[0m        0.2195       0.9008        [94m0.2636[0m     +  9.9681
     34   [36m0.3340[0m   [32m0.8213[0m        0.2206       0.9008        [94m0.2636[0m     +  9.7235
     35   0.3339   [32m0.8215[0m        [35m0.2191[0m       0.9008        [94m0.2633[0m     +  9.7361
     36   [36m0.3351[0m   [32m0.8220[0m        [35m0.2190[0m       0.9008        0.2636        9.7042
     37   [36m0.3355[0m   [32m0.8224[0m        0.2195       0.9008        0.2633        10.3327
     38   0.3328   [32m0.8236[0m        [35m0.2167[0m       0.9021        [94m0.2630[0m     +  10.1435
     39   0.3337   [32m0.8245[0m        0.2182       0.9008        [94m0.2622[0m     +  10.1137
     40   0.3328   [32m0.8259[0m        0.2178       0.8996        [94m0.2619[0m     +  10.0590
     41   0.3332   0.8258        0.2173       0.9008        [94m0.2618[0m     +  9.4763
     42   0.3345   [32m0.8268[0m        [35m0.2165[0m       0.8996        [94m0.2616[0m     +  10.0375
     43   0.3353   [32m0.8274[0m        0.2192       0.9008        [94m0.2611[0m     +  9.8407
     44   [36m0.3374[0m   [32m0.8282[0m        0.2174       0.8996        [94m0.2600[0m     +  9.8746
     45   0.3372   [32m0.8292[0m        [35m0.2164[0m       0.8996        [94m0.2598[0m     +  9.7545
     46   [36m0.3382[0m   [32m0.8296[0m        [35m0.2161[0m       0.8984        [94m0.2595[0m     +  9.8529
     47   [36m0.3395[0m   [32m0.8299[0m        0.2162       0.8984        0.2598        10.2341
     48   [36m0.3404[0m   [32m0.8307[0m        [35m0.2151[0m       0.8996        0.2601        10.4373
     49   0.3400   [32m0.8317[0m        [35m0.2150[0m       0.8996        0.2596        10.3545
     50   0.3398   [32m0.8318[0m        0.2158       0.8984        [94m0.2592[0m     +  10.1069
[32m[I 2023-05-05 07:02:57,174][0m Trial 563 finished with value: 0.2592013486927913 and parameters: {'lr': 1.9878885744145474e-05, 'dropout': 0.4110222054309565, 'd_model_multiplier': 4, 'num_layers': 1, 'n_heads': 32, 'dim_feedforward': 313, 'batch_size': 56, 'pos_encoding': 'fixed', 'activation': 'relu', 'norm': 'LayerNorm', 'optimizer_name': 'AdamW', 'weight_decay': 0.1, 'top_n_features': 49}. Best is trial 246 with value: 0.16447311791139763.[0m
[FileBasedDataset] Initializing dataset...
	Examples: 8264
	Features: 171
	Max length: 315
Standard scalar turned ON, loading params from cache
[FileBasedDataset] Dataset initialization complete
  epoch    auprc    auroc    train_loss    valid_acc    valid_loss    cp      dur
-------  -------  -------  ------------  -----------  ------------  ----  -------
      1   [36m0.2176[0m   [32m0.7150[0m        [35m0.3015[0m       [31m0.9262[0m        [94m0.2537[0m     +  29.0981
      2   [36m0.2406[0m   [32m0.7357[0m        [35m0.2463[0m       0.9238        [94m0.2499[0m     +  28.9370
      3   [36m0.2590[0m   [32m0.7554[0m        [35m0.2432[0m       0.9214        [94m0.2427[0m     +  28.6495
      4   0.2148   0.7017        [35m0.2406[0m       0.9202        0.2616        29.0641
      5   0.1864   0.6536        [35m0.2398[0m       0.9214        0.2751        28.9575
      6   0.1977   0.6790        [35m0.2370[0m       0.9202        0.2707        29.2067
      7   0.2064   0.6736        [35m0.2349[0m       0.9226        0.2735        28.8345
      8   0.2083   0.6927        [35m0.2326[0m       0.9214        0.2657        28.7636
      9   0.1929   0.6633        [35m0.2282[0m       0.9214        0.2795        28.9029
     10   0.2314   0.6861        [35m0.2246[0m       0.9250        0.2626        28.8891
     11   0.2185   0.6757        [35m0.2189[0m       0.9238        0.2631        28.9232
     12   0.2242   0.7090        [35m0.2179[0m       0.9226        0.2700        28.8654
Stopping since valid_loss has not improved in the last 10 epochs.
[32m[I 2023-05-05 07:09:13,853][0m Trial 564 finished with value: 0.24268487493137061 and parameters: {'lr': 0.00010551052498963596, 'dropout': 0.3307951396942285, 'd_model_multiplier': 4, 'num_layers': 6, 'n_heads': 32, 'dim_feedforward': 352, 'batch_size': 15, 'pos_encoding': 'learnable', 'activation': 'relu', 'norm': 'LayerNorm', 'optimizer_name': 'RAdam', 'weight_decay': 0.1, 'top_n_features': 171}. Best is trial 246 with value: 0.16447311791139763.[0m
[FileBasedDataset] Initializing dataset...
	Examples: 8264
	Features: 41
	Max length: 315
Standard scalar turned ON, loading params from cache
[FileBasedDataset] Dataset initialization complete
Warning, assumed runtime error: CUDA out of memory. Tried to allocate 1.96 GiB (GPU 0; 23.70 GiB total capacity; 18.37 GiB already allocated; 151.25 MiB free; 22.46 GiB reserved in total by PyTorch) If reserved memory is >> allocated memory try setting max_split_size_mb to avoid fragmentation.  See documentation for Memory Management and PYTORCH_CUDA_ALLOC_CONF
