[32m[I 2023-05-02 14:17:23,533][0m Trial 143 finished with value: 0.2406596307526765 and parameters: {'lr': 0.0002920353300688259, 'dropout': 0.3586645599182816, 'd_model_multiplier': 16, 'num_layers': 3, 'n_heads': 4, 'dim_feedforward': 436, 'batch_size': 64, 'pos_encoding': 'learnable', 'activation': 'gelu', 'norm': 'BatchNorm', 'optimizer_name': 'PlainRAdam', 'weight_decay': 0.1, 'top_n_features': 173}. Best is trial 117 with value: 0.191397856754288.[0m
[FileBasedDataset] Initializing dataset...
	Examples: 8264
	Features: 163
	Max length: 315
Standard scalar turned ON, loading params from cache
[FileBasedDataset] Dataset initialization complete
  epoch    auprc    auroc    train_loss    valid_acc    valid_loss    cp     dur
-------  -------  -------  ------------  -----------  ------------  ----  ------
      1   [36m0.0983[0m   [32m0.5089[0m        [35m0.4792[0m       [31m0.9033[0m        [94m0.4588[0m     +  9.0081
      2   [36m0.2641[0m   [32m0.7615[0m        [35m0.2706[0m       0.8996        [94m0.3621[0m     +  8.8012
      3   [36m0.2850[0m   [32m0.7805[0m        [35m0.2484[0m       0.9021        [94m0.3381[0m     +  9.2812
      4   [36m0.3023[0m   0.7778        [35m0.2441[0m       0.9021        [94m0.3322[0m     +  9.6623
      5   [36m0.3156[0m   [32m0.7883[0m        [35m0.2390[0m       0.9008        0.3332        9.4921
      6   0.3118   [32m0.7924[0m        [35m0.2379[0m       0.8996        [94m0.3081[0m     +  9.6859
      7   [36m0.3237[0m   [32m0.7950[0m        [35m0.2310[0m       0.9021        0.3093        9.2350
      8   0.3101   0.7849        0.2313       0.9008        [94m0.3029[0m     +  9.5017
      9   [36m0.3269[0m   0.7939        [35m0.2270[0m       0.9008        0.3145        9.1765
     10   [36m0.3355[0m   0.7942        [35m0.2256[0m       [31m0.9057[0m        [94m0.2981[0m     +  9.4970
     11   0.3273   0.7950        [35m0.2219[0m       0.9021        0.3090        9.5540
     12   0.3235   0.7866        [35m0.2179[0m       0.8984        [94m0.2892[0m     +  9.6886
     13   0.3208   0.7888        [35m0.2159[0m       0.8984        0.2941        9.3805
     14   0.3164   0.7939        [35m0.2126[0m       0.9008        0.2939        9.4550
     15   0.3064   0.7788        [35m0.2095[0m       0.8984        0.3035        9.4502
     16   0.3138   0.7882        0.2105       0.8996        0.2954        9.6228
     17   0.3191   0.7935        [35m0.2056[0m       0.8996        0.2929        9.5884
     18   0.2981   0.7839        [35m0.2028[0m       0.8984        0.2963        9.6166
     19   0.3055   0.7928        0.2035       0.8996        0.2907        9.7889
     20   0.3062   0.7920        [35m0.1988[0m       0.8996        [94m0.2872[0m     +  9.4140
     21   0.2974   0.7879        [35m0.1948[0m       0.8972        0.3013        9.6689
     22   0.2942   0.7838        0.1960       0.8960        [94m0.2827[0m     +  9.5110
     23   0.2777   0.7780        [35m0.1937[0m       0.8936        0.2935        9.6620
     24   0.2870   0.7880        [35m0.1876[0m       0.8900        0.2995        9.3357
     25   0.3066   0.7929        [35m0.1870[0m       0.8948        0.2908        9.8054
     26   0.2903   0.7817        [35m0.1833[0m       0.8936        0.2935        9.7660
     27   0.3105   [32m0.7971[0m        [35m0.1819[0m       0.8984        0.2969        9.7853
     28   0.2881   0.7826        [35m0.1768[0m       0.8948        0.2981        9.4669
     29   0.2725   0.7672        [35m0.1753[0m       0.8912        0.2978        9.5334
     30   0.2600   0.7503        [35m0.1722[0m       0.8948        0.3051        9.3437
     31   0.2893   0.7660        [35m0.1661[0m       0.8960        0.2931        9.2006
Stopping since valid_loss has not improved in the last 10 epochs.
[32m[I 2023-05-02 14:22:28,175][0m Trial 144 finished with value: 0.2826743222673974 and parameters: {'lr': 0.000144391638135102, 'dropout': 0.31897686251931023, 'd_model_multiplier': 16, 'num_layers': 3, 'n_heads': 4, 'dim_feedforward': 441, 'batch_size': 69, 'pos_encoding': 'fixed', 'activation': 'gelu', 'norm': 'BatchNorm', 'optimizer_name': 'PlainRAdam', 'weight_decay': 0.1, 'top_n_features': 163}. Best is trial 117 with value: 0.191397856754288.[0m
[FileBasedDataset] Initializing dataset...
	Examples: 8264
	Features: 168
	Max length: 315
Standard scalar turned ON, loading params from cache
[FileBasedDataset] Dataset initialization complete
  epoch    auprc    auroc    train_loss    valid_acc    valid_loss    cp      dur
-------  -------  -------  ------------  -----------  ------------  ----  -------
      1   [36m0.1971[0m   [32m0.6112[0m        [35m0.4443[0m       [31m0.9214[0m        [94m0.3344[0m     +  10.2744
      2   [36m0.2348[0m   [32m0.7175[0m        [35m0.2611[0m       0.9190        [94m0.2845[0m     +  10.4568
      3   [36m0.2609[0m   [32m0.7319[0m        [35m0.2484[0m       0.9178        [94m0.2699[0m     +  10.4338
      4   0.2540   [32m0.7446[0m        [35m0.2452[0m       0.9190        [94m0.2633[0m     +  10.4915
      5   [36m0.2709[0m   [32m0.7531[0m        [35m0.2423[0m       0.9202        [94m0.2572[0m     +  10.3139
      6   [36m0.2746[0m   [32m0.7578[0m        [35m0.2382[0m       0.9202        [94m0.2543[0m     +  10.4365
      7   [36m0.2818[0m   [32m0.7675[0m        [35m0.2369[0m       0.9190        0.2602        10.7074
      8   [36m0.2917[0m   [32m0.7678[0m        [35m0.2342[0m       0.9202        0.2591        10.5146
      9   [36m0.3122[0m   [32m0.7768[0m        [35m0.2286[0m       0.9202        [94m0.2525[0m     +  11.0746
     10   0.2975   0.7653        [35m0.2280[0m       0.9214        0.2548        10.2449
     11   0.3059   0.7686        [35m0.2243[0m       0.9214        0.2566        10.7068
     12   0.3086   0.7715        [35m0.2206[0m       [31m0.9250[0m        0.2595        10.7454
     13   0.2902   0.7627        0.2220       0.9214        0.2676        10.9512
     14   0.2961   0.7414        [35m0.2191[0m       0.9238        0.2752        10.7210
     15   0.2985   0.7540        [35m0.2152[0m       [31m0.9262[0m        0.2651        10.8161
     16   0.2703   0.7339        [35m0.2135[0m       0.9190        0.2913        10.9796
     17   0.2776   0.7310        [35m0.2109[0m       0.9178        0.2953        10.5996
     18   0.2878   0.7289        [35m0.2082[0m       0.9238        0.3173        10.9181
Stopping since valid_loss has not improved in the last 10 epochs.
[32m[I 2023-05-02 14:25:50,995][0m Trial 145 finished with value: 0.2524598456351616 and parameters: {'lr': 0.000572531462326904, 'dropout': 0.3786100333041993, 'd_model_multiplier': 16, 'num_layers': 4, 'n_heads': 4, 'dim_feedforward': 400, 'batch_size': 132, 'pos_encoding': 'fixed', 'activation': 'gelu', 'norm': 'BatchNorm', 'optimizer_name': 'PlainRAdam', 'weight_decay': 0.1, 'top_n_features': 168}. Best is trial 117 with value: 0.191397856754288.[0m
[FileBasedDataset] Initializing dataset...
	Examples: 8264
	Features: 129
	Max length: 315
Standard scalar turned ON, loading params from cache
[FileBasedDataset] Dataset initialization complete
  epoch    auprc    auroc    train_loss    valid_acc    valid_loss    cp     dur
-------  -------  -------  ------------  -----------  ------------  ----  ------
      1   [36m0.1812[0m   [32m0.7229[0m        [35m0.2690[0m       [31m0.9226[0m        [94m0.2548[0m     +  8.0952
      2   [36m0.2030[0m   [32m0.7387[0m        [35m0.2427[0m       0.9166        [94m0.2527[0m     +  9.3519
      3   0.1992   0.7269        [35m0.2381[0m       0.9226        0.2653        9.1974
      4   [36m0.2167[0m   0.7375        [35m0.2367[0m       0.9141        0.2661        9.1652
      5   [36m0.2304[0m   [32m0.7455[0m        [35m0.2300[0m       0.9129        0.2590        9.3100
      6   [36m0.2455[0m   [32m0.7709[0m        [35m0.2283[0m       0.9178        [94m0.2469[0m     +  9.4948
      7   [36m0.2463[0m   [32m0.7726[0m        [35m0.2251[0m       0.9166        0.2576        9.3208
      8   0.2379   0.7637        [35m0.2211[0m       0.9190        0.2713        9.4811
      9   0.2398   [32m0.7993[0m        0.2241       0.9178        0.2578        9.6021
     10   0.2387   0.7859        [35m0.2203[0m       0.9117        0.2674        9.6927
     11   0.2408   0.7859        [35m0.2168[0m       0.9154        0.2660        9.5000
     12   0.2326   0.7889        0.2168       0.9117        0.2713        9.4734
     13   0.2215   0.7858        [35m0.2154[0m       0.9202        0.2716        9.7300
     14   0.2417   0.7911        0.2170       0.9178        0.2546        9.7177
     15   0.2462   0.7896        [35m0.2135[0m       0.9166        0.2608        9.8616
Stopping since valid_loss has not improved in the last 10 epochs.
[32m[I 2023-05-02 14:28:21,945][0m Trial 146 finished with value: 0.24686573579132629 and parameters: {'lr': 0.0008895813602058226, 'dropout': 0.33768677855924534, 'd_model_multiplier': 16, 'num_layers': 3, 'n_heads': 4, 'dim_feedforward': 421, 'batch_size': 60, 'pos_encoding': 'fixed', 'activation': 'gelu', 'norm': 'BatchNorm', 'optimizer_name': 'AdamW', 'weight_decay': 0.1, 'top_n_features': 129}. Best is trial 117 with value: 0.191397856754288.[0m
[FileBasedDataset] Initializing dataset...
	Examples: 8264
	Features: 178
	Max length: 315
Standard scalar turned ON, loading params from cache
[FileBasedDataset] Dataset initialization complete
  epoch    auprc    auroc    train_loss    valid_acc    valid_loss    cp     dur
-------  -------  -------  ------------  -----------  ------------  ----  ------
      1   [36m0.1420[0m   [32m0.6331[0m        [35m0.4157[0m       [31m0.9347[0m        [94m0.2333[0m     +  8.3669
      2   [36m0.1782[0m   [32m0.6969[0m        [35m0.2668[0m       [31m0.9383[0m        [94m0.2139[0m     +  9.4787
      3   [36m0.1871[0m   [32m0.7174[0m        [35m0.2529[0m       [31m0.9395[0m        [94m0.2111[0m     +  9.6821
      4   [36m0.2037[0m   [32m0.7384[0m        [35m0.2495[0m       0.9371        [94m0.2111[0m     +  9.4261
      5   0.1985   0.7328        [35m0.2452[0m       0.9359        0.2156        9.3954
      6   0.2001   [32m0.7385[0m        [35m0.2417[0m       0.9347        0.2177        9.8530
      7   0.1841   0.7347        [35m0.2410[0m       0.9311        0.2204        9.3121
      8   0.1776   0.7381        [35m0.2406[0m       0.9299        0.2207        9.6528
      9   0.1787   0.7367        [35m0.2405[0m       0.9287        0.2226        9.3747
     10   0.1809   [32m0.7425[0m        [35m0.2364[0m       0.9250        0.2225        9.4137
     11   0.1853   0.7415        [35m0.2359[0m       0.9274        0.2224        9.5673
     12   0.1935   [32m0.7526[0m        [35m0.2341[0m       0.9287        0.2234        9.4673
     13   0.1857   0.7476        0.2354       0.9311        0.2242        9.5493
Stopping since valid_loss has not improved in the last 10 epochs.
[32m[I 2023-05-02 14:30:34,359][0m Trial 147 finished with value: 0.21108453835224442 and parameters: {'lr': 0.00042378365852081763, 'dropout': 0.4709984562549456, 'd_model_multiplier': 8, 'num_layers': 1, 'n_heads': 8, 'dim_feedforward': 128, 'batch_size': 78, 'pos_encoding': 'learnable', 'activation': 'relu', 'norm': 'LayerNorm', 'optimizer_name': 'PlainRAdam', 'weight_decay': 0.1, 'top_n_features': 178}. Best is trial 117 with value: 0.191397856754288.[0m
[FileBasedDataset] Initializing dataset...
	Examples: 8264
	Features: 178
	Max length: 315
Standard scalar turned ON, loading params from cache
[FileBasedDataset] Dataset initialization complete
  epoch    auprc    auroc    train_loss    valid_acc    valid_loss    cp     dur
-------  -------  -------  ------------  -----------  ------------  ----  ------
      1   [36m0.2116[0m   [32m0.7002[0m        [35m0.2809[0m       [31m0.9154[0m        [94m0.2602[0m     +  8.5315
      2   [36m0.2303[0m   [32m0.7184[0m        [35m0.2459[0m       [31m0.9178[0m        [94m0.2569[0m     +  9.1173
      3   [36m0.2366[0m   [32m0.7495[0m        [35m0.2428[0m       0.9105        [94m0.2489[0m     +  8.9491
      4   [36m0.2425[0m   0.7433        [35m0.2402[0m       0.9129        0.2517        9.3729
      5   [36m0.2807[0m   [32m0.7569[0m        [35m0.2389[0m       [31m0.9190[0m        [94m0.2437[0m     +  9.5934
      6   0.2690   0.7508        [35m0.2349[0m       0.9190        0.2479        9.4008
      7   [36m0.2839[0m   [32m0.7633[0m        [35m0.2336[0m       [31m0.9226[0m        0.2446        9.3590
      8   [36m0.2995[0m   [32m0.7643[0m        0.2370       0.9166        0.2442        9.3591
      9   0.2922   0.7636        [35m0.2325[0m       0.9166        0.2473        9.7092
     10   0.2909   [32m0.7674[0m        [35m0.2319[0m       [31m0.9238[0m        0.2490        9.4211
     11   0.2911   0.7596        0.2321       0.9214        0.2503        9.3201
     12   [36m0.3138[0m   0.7653        0.2320       0.9214        0.2452        9.4268
     13   0.2975   0.7584        [35m0.2317[0m       0.9214        0.2462        9.7506
     14   0.3022   0.7559        [35m0.2294[0m       0.9154        0.2472        9.8814
Stopping since valid_loss has not improved in the last 10 epochs.
[32m[I 2023-05-02 14:32:55,777][0m Trial 148 finished with value: 0.24370623065525848 and parameters: {'lr': 0.00041391999346651175, 'dropout': 0.46548562508695807, 'd_model_multiplier': 8, 'num_layers': 1, 'n_heads': 8, 'dim_feedforward': 153, 'batch_size': 76, 'pos_encoding': 'fixed', 'activation': 'relu', 'norm': 'LayerNorm', 'optimizer_name': 'AdamW', 'weight_decay': 0.1, 'top_n_features': 178}. Best is trial 117 with value: 0.191397856754288.[0m
[FileBasedDataset] Initializing dataset...
	Examples: 8264
	Features: 237
	Max length: 315
Standard scalar turned ON, loading params from cache
[FileBasedDataset] Dataset initialization complete
  epoch    auprc    auroc    train_loss    valid_acc    valid_loss    cp     dur
-------  -------  -------  ------------  -----------  ------------  ----  ------
      1   [36m0.1763[0m   [32m0.6196[0m        [35m0.4372[0m       [31m0.9214[0m        [94m0.2667[0m     +  8.7364
      2   [36m0.2694[0m   [32m0.7465[0m        [35m0.2634[0m       [31m0.9226[0m        [94m0.2321[0m     +  9.0746
      3   [36m0.2902[0m   [32m0.7727[0m        [35m0.2475[0m       [31m0.9238[0m        [94m0.2269[0m     +  9.2820
      4   [36m0.3121[0m   [32m0.7841[0m        [35m0.2430[0m       0.9214        [94m0.2236[0m     +  9.3663
      5   [36m0.3241[0m   [32m0.7867[0m        [35m0.2403[0m       0.9226        0.2237        9.5571
      6   0.3226   [32m0.7894[0m        [35m0.2380[0m       0.9202        0.2241        9.6574
      7   [36m0.3306[0m   [32m0.7947[0m        [35m0.2337[0m       0.9202        [94m0.2232[0m     +  9.7067
      8   [36m0.3384[0m   0.7839        [35m0.2322[0m       [31m0.9250[0m        0.2276        9.4041
      9   0.3275   0.7901        [35m0.2314[0m       0.9202        0.2276        9.3609
     10   0.3282   0.7875        [35m0.2282[0m       0.9214        0.2281        9.3995
     11   [36m0.3487[0m   [32m0.8004[0m        [35m0.2270[0m       0.9226        0.2232        9.2448
     12   [36m0.3532[0m   0.7996        [35m0.2231[0m       0.9250        [94m0.2229[0m     +  9.3329
     13   0.3427   [32m0.8014[0m        [35m0.2219[0m       0.9250        0.2268        9.5391
     14   [36m0.3535[0m   0.7846        [35m0.2212[0m       [31m0.9274[0m        0.2322        9.7085
     15   0.3357   0.7921        [35m0.2183[0m       0.9238        0.2270        9.4127
     16   0.3351   0.7729        [35m0.2146[0m       0.9274        0.2345        9.7504
     17   [36m0.3847[0m   0.7933        [35m0.2130[0m       [31m0.9323[0m        [94m0.2208[0m     +  10.1938
     18   0.3694   [32m0.8023[0m        [35m0.2108[0m       0.9287        0.2256        9.9036
     19   0.3094   0.7445        [35m0.2075[0m       0.9262        0.2460        9.7083
     20   0.3390   0.7780        [35m0.2068[0m       0.9274        0.2310        9.6772
     21   0.3291   0.7818        [35m0.2058[0m       0.9299        0.2333        9.5880
     22   0.3230   0.7712        [35m0.2004[0m       0.9262        0.2384        9.9455
     23   0.3094   0.7797        [35m0.1983[0m       0.9226        0.2394        9.9947
     24   0.3255   0.7960        0.1985       0.9274        0.2316        9.7957
     25   0.3227   0.7841        [35m0.1968[0m       0.9202        0.2369        9.8897
     26   0.3028   0.7751        [35m0.1906[0m       0.9250        0.2431        9.7561
Stopping since valid_loss has not improved in the last 10 epochs.
[32m[I 2023-05-02 14:37:14,902][0m Trial 149 finished with value: 0.22075664393486683 and parameters: {'lr': 0.00038903399955954337, 'dropout': 0.3270753622887121, 'd_model_multiplier': 8, 'num_layers': 1, 'n_heads': 8, 'dim_feedforward': 128, 'batch_size': 84, 'pos_encoding': 'fixed', 'activation': 'relu', 'norm': 'LayerNorm', 'optimizer_name': 'PlainRAdam', 'weight_decay': 0.1, 'top_n_features': 237}. Best is trial 117 with value: 0.191397856754288.[0m
[FileBasedDataset] Initializing dataset...
	Examples: 8264
	Features: 201
	Max length: 315
Standard scalar turned ON, loading params from cache
[FileBasedDataset] Dataset initialization complete
  epoch    auprc    auroc    train_loss    valid_acc    valid_loss    cp     dur
-------  -------  -------  ------------  -----------  ------------  ----  ------
      1   [36m0.2254[0m   [32m0.7549[0m        [35m0.2795[0m       [31m0.9202[0m        [94m0.2362[0m     +  9.1473
      2   [36m0.2263[0m   [32m0.7770[0m        [35m0.2462[0m       0.9069        0.2366        8.9285
      3   0.2250   [32m0.7824[0m        [35m0.2451[0m       0.9057        0.2417        8.9913
      4   [36m0.2395[0m   [32m0.7928[0m        [35m0.2414[0m       0.9021        0.2511        9.5896
      5   [36m0.2426[0m   0.7926        [35m0.2401[0m       0.9081        0.2422        9.1995
      6   0.2236   0.7785        0.2402       0.9069        0.2503        9.0844
      7   0.2235   0.7756        [35m0.2388[0m       0.9105        0.2472        9.8039
      8   0.2316   0.7795        [35m0.2363[0m       0.9093        0.2505        9.6792
      9   0.2275   0.7710        0.2372       0.9081        0.2596        9.2659
     10   0.2288   0.7684        [35m0.2359[0m       0.9093        0.2530        9.2116
Stopping since valid_loss has not improved in the last 10 epochs.
[32m[I 2023-05-02 14:38:57,471][0m Trial 150 finished with value: 0.2362463576257445 and parameters: {'lr': 0.00021417701037855313, 'dropout': 0.4918299003200124, 'd_model_multiplier': 8, 'num_layers': 1, 'n_heads': 8, 'dim_feedforward': 138, 'batch_size': 57, 'pos_encoding': 'learnable', 'activation': 'relu', 'norm': 'LayerNorm', 'optimizer_name': 'AdamW', 'weight_decay': 0.1, 'top_n_features': 201}. Best is trial 117 with value: 0.191397856754288.[0m
[FileBasedDataset] Initializing dataset...
	Examples: 8264
	Features: 161
	Max length: 315
Standard scalar turned ON, loading params from cache
[FileBasedDataset] Dataset initialization complete
  epoch    auprc    auroc    train_loss    valid_acc    valid_loss    cp     dur
-------  -------  -------  ------------  -----------  ------------  ----  ------
      1   [36m0.2447[0m   [32m0.6764[0m        [35m0.3169[0m       [31m0.9021[0m        [94m0.3080[0m     +  8.5667
      2   [36m0.2629[0m   [32m0.7089[0m        [35m0.2464[0m       0.9008        0.3094        9.3715
      3   [36m0.2671[0m   [32m0.7253[0m        [35m0.2412[0m       0.8960        [94m0.3052[0m     +  9.8891
      4   [36m0.2745[0m   [32m0.7341[0m        [35m0.2401[0m       0.8972        [94m0.3017[0m     +  9.5226
      5   0.2743   [32m0.7441[0m        [35m0.2354[0m       0.8996        0.3095        9.2874
      6   [36m0.2801[0m   [32m0.7470[0m        [35m0.2344[0m       0.9008        0.3187        9.5215
      7   [36m0.2847[0m   [32m0.7522[0m        [35m0.2328[0m       0.8996        0.3114        9.3979
      8   [36m0.2948[0m   [32m0.7595[0m        [35m0.2313[0m       0.9021        0.3102        9.4725
      9   0.2899   0.7561        0.2326       [31m0.9033[0m        0.3069        9.5003
     10   [36m0.2968[0m   [32m0.7596[0m        [35m0.2294[0m       0.9021        0.3018        9.7779
     11   [36m0.3085[0m   0.7581        [35m0.2289[0m       0.9033        0.3037        9.4566
     12   0.2903   0.7594        [35m0.2262[0m       0.9008        0.3044        9.7864
     13   [36m0.3091[0m   [32m0.7607[0m        [35m0.2242[0m       0.9008        0.3252        9.7905
Stopping since valid_loss has not improved in the last 10 epochs.
