[32m[I 2023-05-03 03:18:02,983][0m Trial 261 finished with value: 0.2701039134311921 and parameters: {'lr': 0.0004853202585663857, 'dropout': 0.5462109767429263, 'd_model_multiplier': 32, 'num_layers': 3, 'n_heads': 16, 'dim_feedforward': 430, 'batch_size': 19, 'pos_encoding': 'learnable', 'activation': 'relu', 'norm': 'BatchNorm', 'optimizer_name': 'AdamW', 'weight_decay': 0.01, 'top_n_features': 236}. Best is trial 246 with value: 0.16447311791139763.[0m
[FileBasedDataset] Initializing dataset...
	Examples: 8264
	Features: 104
	Max length: 315
Standard scalar turned ON, loading params from cache
[FileBasedDataset] Dataset initialization complete
  epoch    auprc    auroc    train_loss    valid_acc    valid_loss    cp     dur
-------  -------  -------  ------------  -----------  ------------  ----  ------
      1   [36m0.2085[0m   [32m0.7380[0m        [35m0.2733[0m       [31m0.9105[0m        [94m0.2854[0m     +  9.8886
      2   0.1852   0.7187        [35m0.2590[0m       0.9069        0.2999        9.9842
      3   0.1865   0.7103        0.2643       0.9069        [94m0.2849[0m     +  10.1494
      4   0.1955   0.7207        [35m0.2584[0m       [31m0.9129[0m        [94m0.2799[0m     +  10.3546
      5   0.1896   0.7076        [35m0.2523[0m       0.9057        0.2969        10.1808
      6   0.1872   0.7025        0.2552       0.9081        0.2901        10.1710
      7   0.1976   0.7093        0.2542       [31m0.9154[0m        0.2898        10.5924
      8   0.1914   0.7106        0.2549       0.9129        0.2908        10.2540
      9   0.1865   0.7054        0.2526       0.9129        0.2943        10.0491
     10   0.1825   0.7036        0.2531       0.9129        0.3011        10.5149
     11   0.1850   0.7056        [35m0.2510[0m       0.9129        0.2985        10.1314
     12   0.1892   0.7074        0.2522       0.9129        0.2955        10.2569
     13   0.1824   0.7047        [35m0.2507[0m       0.9154        0.3004        9.9473
Stopping since valid_loss has not improved in the last 10 epochs.
[32m[I 2023-05-03 03:20:26,136][0m Trial 262 finished with value: 0.279854732041924 and parameters: {'lr': 0.0027016154220004637, 'dropout': 0.4416984127356728, 'd_model_multiplier': 64, 'num_layers': 4, 'n_heads': 4, 'dim_feedforward': 128, 'batch_size': 63, 'pos_encoding': 'fixed', 'activation': 'gelu', 'norm': 'LayerNorm', 'optimizer_name': 'PlainRAdam', 'weight_decay': 0.1, 'top_n_features': 104}. Best is trial 246 with value: 0.16447311791139763.[0m
[FileBasedDataset] Initializing dataset...
	Examples: 8264
	Features: 93
	Max length: 315
Standard scalar turned ON, loading params from cache
[FileBasedDataset] Dataset initialization complete
  epoch    auprc    auroc    train_loss    valid_acc    valid_loss    cp      dur
-------  -------  -------  ------------  -----------  ------------  ----  -------
      1   [36m0.2316[0m   [32m0.7384[0m        [35m0.2850[0m       [31m0.7074[0m        [94m0.6516[0m     +  13.8428
      2   0.1522   0.6308        [35m0.2577[0m       [31m0.8102[0m        [94m0.5541[0m     +  13.6271
      3   0.1725   0.5915        0.2590       [31m0.8501[0m        [94m0.4758[0m     +  13.7520
      4   0.1717   0.6046        [35m0.2519[0m       [31m0.8972[0m        [94m0.3910[0m     +  14.1994
      5   [36m0.2616[0m   [32m0.7604[0m        0.2551       [31m0.9117[0m        [94m0.3427[0m     +  13.9685
      6   [36m0.2791[0m   0.7452        0.2539       [31m0.9166[0m        [94m0.2576[0m     +  14.2430
      7   [36m0.2879[0m   [32m0.8149[0m        [35m0.2466[0m       0.9166        [94m0.2489[0m     +  14.2333
      8   0.2663   [32m0.8162[0m        [35m0.2424[0m       0.9093        [94m0.2425[0m     +  14.2542
      9   0.2770   [32m0.8175[0m        [35m0.2396[0m       0.8984        0.2552        14.2620
     10   [36m0.2883[0m   [32m0.8209[0m        [35m0.2394[0m       0.8972        0.2552        14.4119
     11   0.2751   0.8180        [35m0.2379[0m       0.9166        [94m0.2378[0m     +  14.3765
     12   0.2872   [32m0.8220[0m        [35m0.2360[0m       [31m0.9202[0m        [94m0.2343[0m     +  14.2626
     13   [36m0.2894[0m   0.8175        [35m0.2346[0m       0.9166        [94m0.2280[0m     +  14.5033
     14   [36m0.2994[0m   [32m0.8278[0m        [35m0.2312[0m       0.9057        0.2362        14.3037
     15   [36m0.3060[0m   0.8261        [35m0.2288[0m       0.9081        0.2355        14.1799
     16   [36m0.3206[0m   [32m0.8296[0m        [35m0.2288[0m       0.9141        0.2280        14.3634
     17   0.2915   0.8238        0.2381       0.9178        0.2294        14.2762
     18   0.2873   0.8274        0.2298       0.9117        0.2344        14.1600
     19   0.2982   0.8245        0.2310       0.9105        0.2408        14.4315
     20   0.2897   0.8222        0.2336       0.9141        0.2326        14.0225
     21   0.3038   0.8253        0.2294       0.9105        0.2351        14.3308
     22   0.3006   0.8270        0.2321       0.9141        0.2429        14.1459
Stopping since valid_loss has not improved in the last 10 epochs.
[32m[I 2023-05-03 03:25:53,712][0m Trial 263 finished with value: 0.22800183860177428 and parameters: {'lr': 0.0009146073277669634, 'dropout': 0.4995619686391888, 'd_model_multiplier': 8, 'num_layers': 2, 'n_heads': 32, 'dim_feedforward': 202, 'batch_size': 78, 'pos_encoding': 'fixed', 'activation': 'gelu', 'norm': 'BatchNorm', 'optimizer_name': 'AdamW', 'weight_decay': 0.1, 'top_n_features': 93}. Best is trial 246 with value: 0.16447311791139763.[0m
[FileBasedDataset] Initializing dataset...
	Examples: 8264
	Features: 206
	Max length: 315
Standard scalar turned ON, loading params from cache
[FileBasedDataset] Dataset initialization complete
  epoch    auprc    auroc    train_loss    valid_acc    valid_loss    cp      dur
-------  -------  -------  ------------  -----------  ------------  ----  -------
      1   [36m0.2291[0m   [32m0.7676[0m        [35m0.2887[0m       [31m0.9105[0m        [94m0.2468[0m     +  20.0245
      2   0.2236   [32m0.7717[0m        [35m0.2621[0m       [31m0.9299[0m        [94m0.2233[0m     +  20.2477
      3   [36m0.2320[0m   [32m0.7823[0m        0.2627       0.9250        0.2334        20.4829
      4   [36m0.2470[0m   [32m0.7958[0m        0.2710       0.9274        [94m0.2159[0m     +  20.1314
      5   [36m0.2539[0m   [32m0.7965[0m        [35m0.2601[0m       0.9299        [94m0.2147[0m     +  20.2581
      6   [36m0.2746[0m   [32m0.8026[0m        [35m0.2509[0m       [31m0.9347[0m        [94m0.2115[0m     +  20.5188
      7   0.2677   0.8003        0.2521       0.9274        0.2139        20.6757
      8   [36m0.2754[0m   [32m0.8042[0m        [35m0.2494[0m       0.9190        0.2370        20.5544
      9   [36m0.2771[0m   [32m0.8066[0m        [35m0.2446[0m       0.9226        0.2196        20.4272
     10   [36m0.3058[0m   [32m0.8071[0m        [35m0.2422[0m       0.9287        0.2146        20.3839
     11   0.2828   0.8060        0.2427       0.9311        0.2119        20.5139
     12   0.2995   [32m0.8114[0m        [35m0.2413[0m       0.9250        0.2161        20.3429
     13   [36m0.3180[0m   0.8085        0.2415       [31m0.9420[0m        [94m0.2067[0m     +  20.6745
     14   0.2948   0.8055        [35m0.2409[0m       0.9323        0.2137        20.3424
     15   0.3031   0.8093        [35m0.2398[0m       0.9274        0.2146        20.2648
     16   0.3024   [32m0.8147[0m        [35m0.2390[0m       0.9250        0.2108        20.6996
     17   0.2921   0.8128        0.2415       0.9287        0.2143        20.4845
     18   0.3021   [32m0.8148[0m        [35m0.2364[0m       0.9359        [94m0.2053[0m     +  20.9949
     19   0.2980   [32m0.8172[0m        [35m0.2352[0m       0.9335        [94m0.2040[0m     +  20.7047
     20   0.3066   [32m0.8213[0m        [35m0.2350[0m       0.9214        0.2197        20.4713
     21   [36m0.3197[0m   [32m0.8217[0m        0.2354       0.9274        0.2056        20.5689
     22   0.3164   0.8142        [35m0.2341[0m       0.9250        0.2204        20.8527
     23   0.3177   0.8179        0.2352       0.9226        0.2229        20.6392
     24   0.3100   [32m0.8231[0m        0.2349       0.9129        0.2210        20.4838
     25   0.2923   0.8079        0.2360       0.8948        0.2718        20.7081
     26   0.3137   0.8220        0.2343       0.9202        0.2151        20.3788
     27   0.3095   0.8212        0.2352       0.9299        0.2078        20.5997
     28   [36m0.3259[0m   [32m0.8302[0m        [35m0.2333[0m       0.9214        0.2081        20.6660
Stopping since valid_loss has not improved in the last 10 epochs.
[32m[I 2023-05-03 03:35:49,528][0m Trial 264 finished with value: 0.20399591416805227 and parameters: {'lr': 0.001435362914520722, 'dropout': 0.5366260969791525, 'd_model_multiplier': 4, 'num_layers': 2, 'n_heads': 64, 'dim_feedforward': 417, 'batch_size': 68, 'pos_encoding': 'learnable', 'activation': 'relu', 'norm': 'LayerNorm', 'optimizer_name': 'PlainRAdam', 'weight_decay': 0.1, 'top_n_features': 206}. Best is trial 246 with value: 0.16447311791139763.[0m
[FileBasedDataset] Initializing dataset...
	Examples: 8264
	Features: 194
	Max length: 315
Standard scalar turned ON, loading params from cache
[FileBasedDataset] Dataset initialization complete
  epoch    auprc    auroc    train_loss    valid_acc    valid_loss    cp      dur
-------  -------  -------  ------------  -----------  ------------  ----  -------
      1   [36m0.2442[0m   [32m0.7421[0m        [35m0.2949[0m       [31m0.9045[0m        [94m0.4659[0m     +  23.0781
      2   0.0941   0.5401        [35m0.2607[0m       [31m0.9154[0m        0.4680        23.5579
      3   0.0898   0.4657        0.2649       0.6070        0.6647        23.5529
      4   0.1504   0.5491        [35m0.2594[0m       0.6723        0.6314        23.6029
      5   0.1750   0.6314        0.2672       [31m0.9274[0m        [94m0.3449[0m     +  23.7400
      6   0.2343   0.6906        0.2731       0.9274        0.3531        23.6652
      7   0.2118   0.7143        0.2705       0.9226        [94m0.2528[0m     +  23.8058
      8   [36m0.2791[0m   [32m0.7729[0m        0.2797       [31m0.9287[0m        [94m0.2462[0m     +  23.5486
      9   0.1301   0.5568        0.2978       0.9287        0.2851        23.3971
     10   0.2537   0.7719        0.2897       0.9250        [94m0.2421[0m     +  23.5564
     11   0.2663   [32m0.7998[0m        0.2703       0.9166        [94m0.2297[0m     +  23.6429
     12   0.2215   0.7697        0.2744       0.9250        0.2314        23.6770
     13   0.2703   [32m0.8059[0m        0.2734       0.8875        0.2968        23.3803
     14   [36m0.2934[0m   [32m0.8140[0m        [35m0.2558[0m       [31m0.9299[0m        [94m0.2204[0m     +  23.5076
     15   0.2774   0.7831        0.2678       0.9287        0.2275        23.6803
     16   [36m0.3038[0m   [32m0.8168[0m        [35m0.2488[0m       0.9299        [94m0.2163[0m     +  23.6002
     17   0.2643   0.8016        [35m0.2478[0m       0.9190        0.2295        23.5860
     18   0.3001   0.7999        0.2572       0.9299        0.2192        23.6376
     19   0.2337   0.7438        0.2740       0.9262        0.2337        24.0337
     20   0.2679   0.7879        0.3588       0.9287        0.2245        23.6419
     21   0.2757   0.7848        0.2945       0.9287        0.2237        23.8377
     22   0.2538   0.8003        0.2619       0.9262        0.2238        23.4401
     23   0.2997   0.8034        [35m0.2445[0m       0.9274        0.2165        23.6956
     24   [36m0.3079[0m   0.8048        0.2505       0.9274        [94m0.2144[0m     +  23.4571
     25   0.2522   0.7920        0.2878       0.9226        0.2296        23.3135
     26   0.2702   0.7920        0.2602       0.9287        0.2287        23.4697
     27   0.2497   0.7442        0.3030       0.9287        0.2289        23.4790
     28   0.2632   0.7928        0.2994       0.9287        0.2251        23.6571
     29   0.2769   0.8003        0.2962       0.9287        0.2248        23.6605
     30   0.2550   0.7962        0.2706       0.9262        0.2212        23.4616
     31   0.2853   0.7938        0.2687       0.9287        0.2237        23.7438
     32   0.2804   0.7976        0.2651       0.9287        0.2193        23.4950
     33   0.2737   0.7993        0.2688       0.9287        0.2261        23.5728
Stopping since valid_loss has not improved in the last 10 epochs.
[32m[I 2023-05-03 03:49:12,942][0m Trial 265 finished with value: 0.21440078902813947 and parameters: {'lr': 0.0015863450650290812, 'dropout': 0.5270072126102342, 'd_model_multiplier': 8, 'num_layers': 2, 'n_heads': 64, 'dim_feedforward': 414, 'batch_size': 69, 'pos_encoding': 'learnable', 'activation': 'gelu', 'norm': 'BatchNorm', 'optimizer_name': 'PlainRAdam', 'weight_decay': 0.01, 'top_n_features': 194}. Best is trial 246 with value: 0.16447311791139763.[0m
[FileBasedDataset] Initializing dataset...
	Examples: 8264
	Features: 24
	Max length: 315
Standard scalar turned ON, loading params from cache
[FileBasedDataset] Dataset initialization complete
  epoch    auprc    auroc    train_loss    valid_acc    valid_loss    cp      dur
-------  -------  -------  ------------  -----------  ------------  ----  -------
      1   [36m0.2030[0m   [32m0.7320[0m        [35m0.2764[0m       [31m0.8670[0m        [94m0.3932[0m     +  13.4787
      2   [36m0.2175[0m   [32m0.7322[0m        0.2875       [31m0.8912[0m        [94m0.3066[0m     +  13.6479
      3   0.2082   0.7246        [35m0.2674[0m       [31m0.9045[0m        0.3216        14.7194
      4   [36m0.2291[0m   [32m0.7374[0m        [35m0.2603[0m       0.8742        0.3391        13.6865
      5   0.2207   [32m0.7433[0m        [35m0.2455[0m       0.8706        0.3337        13.8140
      6   [36m0.2310[0m   [32m0.7496[0m        [35m0.2394[0m       0.8839        0.3185        13.6372
      7   [36m0.2356[0m   0.7406        [35m0.2359[0m       0.8912        [94m0.3018[0m     +  13.4500
      8   [36m0.2425[0m   [32m0.7529[0m        [35m0.2321[0m       0.8996        0.3036        13.6467
      9   0.2352   0.7484        0.2338       0.8996        [94m0.2970[0m     +  13.7705
     10   [36m0.2431[0m   [32m0.7550[0m        [35m0.2306[0m       0.9021        [94m0.2942[0m     +  13.7179
     11   0.2280   0.7425        0.2320       0.8900        0.2972        13.6477
     12   0.2308   0.7378        0.2323       0.9033        0.3074        13.7278
     13   0.2239   0.7480        [35m0.2306[0m       0.9045        0.3026        13.6426
     14   0.2335   [32m0.7567[0m        [35m0.2303[0m       [31m0.9093[0m        [94m0.2899[0m     +  13.8060
     15   0.2354   0.7459        [35m0.2257[0m       0.8972        0.2903        13.5066
     16   [36m0.2440[0m   0.7516        0.2310       0.8960        [94m0.2848[0m     +  13.5381
     17   0.2224   0.7296        0.2321       [31m0.9117[0m        [94m0.2813[0m     +  13.5590
     18   0.2381   0.7395        0.2296       0.8936        0.2829        13.5388
     19   0.2279   0.7338        0.2310       0.8972        [94m0.2809[0m     +  13.6747
     20   0.2353   0.7328        0.2289       0.9021        [94m0.2796[0m     +  13.5966
     21   0.2333   0.7311        0.2292       0.9008        [94m0.2793[0m     +  13.7448
     22   0.2329   0.7332        0.2292       0.8996        0.2818        13.6507
     23   0.2196   0.7219        0.2300       0.9021        0.2993        13.5931
     24   0.2336   0.7335        0.2309       0.9021        0.2810        13.8128
     25   [36m0.2513[0m   0.7352        0.2289       0.8996        0.3157        13.5578
     26   0.2347   0.7350        0.2296       0.8984        0.3239        13.6519
     27   0.2236   0.7312        0.2293       0.8984        0.2952        13.7055
     28   0.2372   0.7245        0.2280       0.8996        0.3060        13.7578
     29   0.2379   0.7285        0.2281       0.8900        0.3385        13.6651
     30   0.2370   0.7184        0.2264       0.8948        0.3259        13.6709
Stopping since valid_loss has not improved in the last 10 epochs.
[32m[I 2023-05-03 03:56:18,936][0m Trial 266 finished with value: 0.2793417136841414 and parameters: {'lr': 0.0020008403590979443, 'dropout': 0.5338232005547368, 'd_model_multiplier': 8, 'num_layers': 1, 'n_heads': 64, 'dim_feedforward': 422, 'batch_size': 51, 'pos_encoding': 'learnable', 'activation': 'relu', 'norm': 'LayerNorm', 'optimizer_name': 'PlainRAdam', 'weight_decay': 0.1, 'top_n_features': 24}. Best is trial 246 with value: 0.16447311791139763.[0m
[FileBasedDataset] Initializing dataset...
	Examples: 8264
	Features: 208
	Max length: 315
Standard scalar turned ON, loading params from cache
[FileBasedDataset] Dataset initialization complete
  epoch    auprc    auroc    train_loss    valid_acc    valid_loss    cp      dur
-------  -------  -------  ------------  -----------  ------------  ----  -------
      1   [36m0.2499[0m   [32m0.7187[0m        [35m0.2731[0m       [31m0.8634[0m        [94m0.5122[0m     +  20.9015
      2   0.2418   0.6647        [35m0.2619[0m       0.5695        0.6798        21.0205
      3   0.1857   0.5389        0.2669       [31m0.8815[0m        0.5561        21.2168
      4   0.2395   0.6745        0.2775       0.8730        [94m0.3864[0m     +  21.2274
      5   0.1929   0.6030        0.2750       [31m0.9105[0m        [94m0.3070[0m     +  21.3671
      6   0.2216   0.7074        0.2759       0.9045        [94m0.3043[0m     +  21.1325
      7   0.2319   0.6784        0.2950       0.8948        0.3573        21.3351
      8   0.1942   0.6930        0.2891       0.8948        0.3054        21.6581
      9   0.2157   0.6899        0.2659       0.8984        0.3076        21.4320
     10   0.2110   0.7036        [35m0.2610[0m       0.9021        [94m0.3036[0m     +  21.3033
     11   0.2278   0.7025        [35m0.2556[0m       0.9045        [94m0.2962[0m     +  21.1726
     12   0.2171   0.6790        [35m0.2523[0m       0.9021        0.3067        21.1763
     13   0.2197   0.7177        [35m0.2513[0m       0.9033        0.2973        21.2286
     14   0.2271   [32m0.7217[0m        [35m0.2468[0m       0.9105        [94m0.2925[0m     +  21.1966
     15   0.2350   0.7174        [35m0.2453[0m       0.9081        0.2964        21.1985
     16   0.2257   0.6994        [35m0.2386[0m       0.9033        0.2952        21.1926
     17   0.2407   0.6815        0.2577       0.8924        0.3062        21.0511
     18   0.2429   0.7170        0.2474       0.8924        0.2941        21.1577
     19   [36m0.2549[0m   0.7206        0.2421       [31m0.9117[0m        0.2959        21.2870
     20   0.2277   0.6743        0.2439       0.9081        0.3142        21.6016
     21   0.2179   0.7106        0.2484       0.9057        0.2942        21.1801
     22   0.2231   0.6979        0.2430       0.9093        0.2929        21.0979
     23   0.2377   0.7149        0.2450       0.9081        0.2938        21.4759
Stopping since valid_loss has not improved in the last 10 epochs.
