[32m[I 2023-05-05 09:38:34,311][0m Trial 595 finished with value: 0.2153934873955858 and parameters: {'lr': 0.00012983013450445358, 'dropout': 0.44640411779742956, 'd_model_multiplier': 1, 'num_layers': 4, 'n_heads': 32, 'dim_feedforward': 389, 'batch_size': 47, 'pos_encoding': 'fixed', 'activation': 'relu', 'norm': 'LayerNorm', 'optimizer_name': 'RAdam', 'weight_decay': 0, 'top_n_features': 38}. Best is trial 246 with value: 0.16447311791139763.[0m
[FileBasedDataset] Initializing dataset...
	Examples: 8264
	Features: 97
	Max length: 315
Standard scalar turned ON, loading params from cache
[FileBasedDataset] Dataset initialization complete
  epoch    auprc    auroc    train_loss    valid_acc    valid_loss    cp      dur
-------  -------  -------  ------------  -----------  ------------  ----  -------
      1   [36m0.0697[0m   [32m0.3693[0m        [35m0.5007[0m       [31m0.9141[0m        [94m0.3409[0m     +  18.5552
      2   [36m0.1881[0m   [32m0.6310[0m        [35m0.2867[0m       0.9141        [94m0.2808[0m     +  18.8448
      3   [36m0.2182[0m   [32m0.6861[0m        [35m0.2555[0m       0.9141        [94m0.2700[0m     +  18.9719
      4   [36m0.2583[0m   [32m0.7154[0m        [35m0.2477[0m       0.9129        [94m0.2646[0m     +  19.0227
      5   [36m0.2725[0m   [32m0.7161[0m        [35m0.2379[0m       [31m0.9154[0m        0.2673        19.0024
      6   [36m0.2887[0m   [32m0.7230[0m        [35m0.2362[0m       0.9154        0.2655        19.1144
      7   [36m0.3037[0m   [32m0.7322[0m        [35m0.2339[0m       [31m0.9166[0m        [94m0.2637[0m     +  19.0458
      8   [36m0.3081[0m   [32m0.7373[0m        [35m0.2303[0m       [31m0.9178[0m        0.2651        18.8715
      9   [36m0.3242[0m   [32m0.7426[0m        [35m0.2293[0m       [31m0.9214[0m        0.2639        19.0223
     10   [36m0.3262[0m   [32m0.7442[0m        0.2298       [31m0.9226[0m        [94m0.2637[0m     +  18.8160
     11   [36m0.3342[0m   [32m0.7491[0m        [35m0.2271[0m       0.9202        0.2651        19.0057
     12   0.3302   [32m0.7492[0m        [35m0.2269[0m       0.9202        0.2663        19.0496
     13   [36m0.3415[0m   [32m0.7551[0m        [35m0.2257[0m       0.9214        [94m0.2630[0m     +  18.9271
     14   [36m0.3439[0m   [32m0.7582[0m        [35m0.2237[0m       0.9214        [94m0.2621[0m     +  19.0171
     15   0.3404   [32m0.7602[0m        [35m0.2236[0m       0.9214        [94m0.2614[0m     +  19.0552
     16   [36m0.3488[0m   [32m0.7622[0m        [35m0.2229[0m       0.9214        [94m0.2609[0m     +  19.0124
     17   [36m0.3687[0m   [32m0.7663[0m        [35m0.2228[0m       0.9214        0.2612        18.9088
     18   0.3648   [32m0.7675[0m        [35m0.2199[0m       0.9226        [94m0.2608[0m     +  18.9270
     19   0.3620   [32m0.7694[0m        [35m0.2191[0m       0.9226        0.2636        19.0556
     20   [36m0.3745[0m   [32m0.7730[0m        [35m0.2187[0m       0.9226        0.2620        18.8831
     21   0.3666   0.7729        [35m0.2176[0m       0.9214        [94m0.2608[0m     +  18.9539
     22   [36m0.3775[0m   [32m0.7769[0m        [35m0.2154[0m       0.9214        [94m0.2574[0m     +  18.9149
     23   0.3670   0.7767        [35m0.2141[0m       0.9226        0.2588        19.5418
     24   0.3582   0.7740        0.2166       0.9190        0.2606        19.2631
     25   0.3585   [32m0.7787[0m        0.2145       0.9202        0.2598        18.7957
     26   0.3571   [32m0.7814[0m        [35m0.2125[0m       0.9190        [94m0.2561[0m     +  18.9906
     27   0.3642   [32m0.7839[0m        [35m0.2118[0m       0.9190        0.2574        18.9590
     28   0.3589   0.7837        [35m0.2106[0m       0.9202        0.2571        19.0922
     29   0.3505   0.7818        [35m0.2094[0m       0.9178        0.2616        18.9681
     30   0.3424   [32m0.7901[0m        [35m0.2078[0m       0.9202        0.2596        18.9536
     31   0.3517   0.7850        0.2082       0.9190        0.2613        18.9976
     32   0.3471   0.7870        [35m0.2045[0m       0.9190        0.2621        19.1865
     33   0.3477   0.7856        0.2050       0.9178        0.2620        18.9031
     34   0.3484   [32m0.7938[0m        [35m0.2034[0m       0.9178        0.2601        19.0345
     35   0.3401   0.7904        0.2039       0.9166        0.2607        19.1841
Stopping since valid_loss has not improved in the last 10 epochs.
[32m[I 2023-05-05 09:49:59,544][0m Trial 596 finished with value: 0.2561362267189187 and parameters: {'lr': 7.89786031955118e-05, 'dropout': 0.3808321915564501, 'd_model_multiplier': 1, 'num_layers': 5, 'n_heads': 32, 'dim_feedforward': 405, 'batch_size': 34, 'pos_encoding': 'fixed', 'activation': 'relu', 'norm': 'LayerNorm', 'optimizer_name': 'RAdam', 'weight_decay': 0, 'top_n_features': 97}. Best is trial 246 with value: 0.16447311791139763.[0m
[FileBasedDataset] Initializing dataset...
	Examples: 8264
	Features: 52
	Max length: 315
Standard scalar turned ON, loading params from cache
[FileBasedDataset] Dataset initialization complete
  epoch    auprc    auroc    train_loss    valid_acc    valid_loss    cp     dur
-------  -------  -------  ------------  -----------  ------------  ----  ------
      1   [36m0.0779[0m   [32m0.3342[0m        [35m0.6695[0m       [31m0.9105[0m        [94m0.5921[0m     +  8.6795
      2   [36m0.0798[0m   [32m0.3439[0m        [35m0.5295[0m       0.9105        [94m0.4535[0m     +  8.8083
      3   [36m0.0843[0m   [32m0.3742[0m        [35m0.4169[0m       0.9105        [94m0.3712[0m     +  9.5473
      4   [36m0.0983[0m   [32m0.4817[0m        [35m0.3524[0m       0.9105        [94m0.3252[0m     +  9.6919
      5   [36m0.1368[0m   [32m0.6087[0m        [35m0.3112[0m       0.9105        [94m0.2988[0m     +  9.5181
      6   [36m0.1894[0m   [32m0.6840[0m        [35m0.2866[0m       0.9105        [94m0.2844[0m     +  9.5153
      7   [36m0.2109[0m   [32m0.7231[0m        [35m0.2726[0m       0.9105        [94m0.2767[0m     +  9.5149
      8   [36m0.2275[0m   [32m0.7471[0m        [35m0.2626[0m       0.9105        [94m0.2720[0m     +  9.6536
      9   [36m0.2405[0m   [32m0.7602[0m        [35m0.2561[0m       0.9105        [94m0.2695[0m     +  9.7305
     10   [36m0.2445[0m   [32m0.7659[0m        [35m0.2529[0m       0.9105        [94m0.2679[0m     +  9.8390
     11   [36m0.2465[0m   [32m0.7691[0m        [35m0.2511[0m       0.9105        [94m0.2670[0m     +  9.4238
     12   [36m0.2539[0m   [32m0.7717[0m        [35m0.2480[0m       0.9105        [94m0.2657[0m     +  9.7638
     13   [36m0.2586[0m   [32m0.7730[0m        [35m0.2450[0m       0.9105        [94m0.2648[0m     +  9.4387
     14   [36m0.2684[0m   [32m0.7757[0m        [35m0.2432[0m       0.9105        [94m0.2635[0m     +  9.5341
     15   [36m0.2796[0m   [32m0.7785[0m        [35m0.2425[0m       0.9105        [94m0.2624[0m     +  9.6468
     16   [36m0.2895[0m   [32m0.7808[0m        [35m0.2410[0m       0.9105        [94m0.2615[0m     +  9.2953
     17   [36m0.2963[0m   [32m0.7836[0m        [35m0.2388[0m       0.9105        [94m0.2601[0m     +  9.3740
     18   [36m0.3023[0m   [32m0.7861[0m        [35m0.2372[0m       0.9105        [94m0.2586[0m     +  9.3383
     19   [36m0.3096[0m   [32m0.7893[0m        0.2376       0.9093        [94m0.2577[0m     +  9.4546
     20   [36m0.3162[0m   [32m0.7910[0m        [35m0.2367[0m       0.9093        [94m0.2564[0m     +  9.4503
     21   [36m0.3229[0m   [32m0.7928[0m        [35m0.2351[0m       0.9105        [94m0.2557[0m     +  9.3903
     22   [36m0.3294[0m   [32m0.7946[0m        0.2351       0.9105        [94m0.2553[0m     +  9.3640
     23   [36m0.3333[0m   [32m0.7951[0m        [35m0.2343[0m       0.9105        [94m0.2547[0m     +  9.8896
     24   [36m0.3369[0m   [32m0.7954[0m        [35m0.2330[0m       [31m0.9117[0m        [94m0.2540[0m     +  9.0345
     25   [36m0.3417[0m   [32m0.7964[0m        [35m0.2329[0m       0.9117        0.2542        9.2389
     26   [36m0.3458[0m   [32m0.7966[0m        [35m0.2328[0m       [31m0.9129[0m        [94m0.2538[0m     +  9.4753
     27   0.3456   [32m0.7969[0m        [35m0.2327[0m       [31m0.9141[0m        [94m0.2536[0m     +  9.0230
     28   [36m0.3478[0m   [32m0.7974[0m        0.2337       [31m0.9154[0m        [94m0.2533[0m     +  9.1735
     29   [36m0.3479[0m   0.7973        [35m0.2323[0m       0.9154        0.2533        9.4673
     30   [36m0.3487[0m   0.7973        [35m0.2304[0m       0.9154        0.2534        9.2523
     31   [36m0.3495[0m   [32m0.7975[0m        0.2315       [31m0.9166[0m        [94m0.2532[0m     +  9.4236
     32   0.3493   0.7974        0.2312       0.9166        [94m0.2531[0m     +  9.7444
     33   [36m0.3497[0m   0.7972        0.2314       0.9166        0.2532        9.3197
     34   [36m0.3498[0m   0.7972        0.2313       0.9154        0.2532        9.5084
     35   [36m0.3502[0m   [32m0.7978[0m        [35m0.2304[0m       0.9141        [94m0.2528[0m     +  9.4231
     36   [36m0.3517[0m   [32m0.7979[0m        [35m0.2293[0m       0.9141        [94m0.2527[0m     +  9.7153
     37   [36m0.3524[0m   [32m0.7981[0m        [35m0.2293[0m       0.9141        0.2527        9.4921
     38   [36m0.3537[0m   0.7979        0.2300       0.9141        0.2527        9.7231
     39   [36m0.3550[0m   [32m0.7984[0m        0.2299       0.9141        0.2528        9.7026
     40   0.3546   0.7984        0.2296       0.9154        [94m0.2527[0m     +  9.5309
     41   [36m0.3553[0m   0.7983        0.2294       0.9154        [94m0.2525[0m     +  9.7296
     42   [36m0.3563[0m   [32m0.7988[0m        [35m0.2278[0m       0.9154        0.2525        9.4902
     43   [36m0.3572[0m   0.7987        0.2292       0.9166        [94m0.2518[0m     +  9.5716
     44   [36m0.3579[0m   [32m0.7990[0m        [35m0.2277[0m       0.9166        [94m0.2518[0m     +  9.3806
     45   [36m0.3593[0m   [32m0.8000[0m        0.2282       0.9166        0.2519        9.4776
     46   [36m0.3607[0m   [32m0.8001[0m        0.2285       0.9166        0.2520        9.2950
     47   [36m0.3608[0m   [32m0.8005[0m        0.2284       0.9166        [94m0.2517[0m     +  9.4088
     48   0.3607   0.7999        0.2298       0.9166        [94m0.2515[0m     +  9.5637
     49   0.3607   [32m0.8006[0m        0.2281       0.9166        0.2518        9.3792
     50   [36m0.3614[0m   [32m0.8009[0m        0.2286       0.9166        [94m0.2511[0m     +  9.6700
[32m[I 2023-05-05 09:57:54,931][0m Trial 597 finished with value: 0.2511341387750592 and parameters: {'lr': 2.539530971074302e-05, 'dropout': 0.40898816678289085, 'd_model_multiplier': 1, 'num_layers': 1, 'n_heads': 32, 'dim_feedforward': 223, 'batch_size': 45, 'pos_encoding': 'fixed', 'activation': 'relu', 'norm': 'LayerNorm', 'optimizer_name': 'RAdam', 'weight_decay': 0, 'top_n_features': 52}. Best is trial 246 with value: 0.16447311791139763.[0m
[FileBasedDataset] Initializing dataset...
	Examples: 8264
	Features: 66
	Max length: 315
Standard scalar turned ON, loading params from cache
[FileBasedDataset] Dataset initialization complete
  epoch    auprc    auroc    train_loss    valid_acc    valid_loss    cp      dur
-------  -------  -------  ------------  -----------  ------------  ----  -------
      1   [36m0.0666[0m   [32m0.4228[0m        [35m0.6427[0m       [31m0.8005[0m        [94m0.6476[0m     +  31.0106
      2   0.0656   0.4191        [35m0.6419[0m       [31m0.8126[0m        [94m0.6455[0m     +  31.2136
      3   0.0649   0.4150        [35m0.6397[0m       [31m0.8247[0m        [94m0.6427[0m     +  31.3285
      4   0.0640   0.4104        [35m0.6379[0m       [31m0.8392[0m        [94m0.6396[0m     +  31.1441
      5   0.0632   0.4051        [35m0.6343[0m       [31m0.8525[0m        [94m0.6360[0m     +  31.3416
      6   0.0625   0.3990        [35m0.6313[0m       [31m0.8646[0m        [94m0.6322[0m     +  31.4187
      7   0.0618   0.3932        [35m0.6288[0m       [31m0.8815[0m        [94m0.6282[0m     +  31.4894
      8   0.0612   0.3876        [35m0.6256[0m       [31m0.8888[0m        [94m0.6239[0m     +  31.2431
      9   0.0606   0.3817        [35m0.6198[0m       [31m0.9008[0m        [94m0.6196[0m     +  31.3565
     10   0.0601   0.3759        [35m0.6160[0m       [31m0.9093[0m        [94m0.6151[0m     +  31.2924
     11   0.0597   0.3717        [35m0.6135[0m       [31m0.9129[0m        [94m0.6105[0m     +  31.3118
     12   0.0595   0.3680        [35m0.6100[0m       [31m0.9154[0m        [94m0.6058[0m     +  31.4042
     13   0.0592   0.3649        [35m0.6051[0m       [31m0.9166[0m        [94m0.6011[0m     +  31.3623
     14   0.0592   0.3626        [35m0.6006[0m       [31m0.9178[0m        [94m0.5963[0m     +  31.4118
     15   0.0590   0.3605        [35m0.5959[0m       [31m0.9190[0m        [94m0.5915[0m     +  31.3026
     16   0.0589   0.3577        [35m0.5935[0m       [31m0.9214[0m        [94m0.5867[0m     +  31.3251
     17   0.0588   0.3557        [35m0.5882[0m       0.9214        [94m0.5820[0m     +  31.3480
     18   0.0586   0.3533        [35m0.5840[0m       0.9214        [94m0.5772[0m     +  31.4789
     19   0.0585   0.3512        [35m0.5799[0m       0.9214        [94m0.5724[0m     +  31.4780
     20   0.0585   0.3496        [35m0.5748[0m       0.9214        [94m0.5677[0m     +  31.4004
     21   0.0584   0.3480        [35m0.5711[0m       0.9214        [94m0.5630[0m     +  31.3373
     22   0.0584   0.3472        [35m0.5671[0m       0.9214        [94m0.5583[0m     +  31.1814
     23   0.0585   0.3461        [35m0.5642[0m       0.9214        [94m0.5537[0m     +  31.2474
     24   0.0585   0.3453        [35m0.5601[0m       0.9214        [94m0.5491[0m     +  31.3493
     25   0.0585   0.3449        [35m0.5569[0m       0.9214        [94m0.5446[0m     +  31.1699
     26   0.0586   0.3446        [35m0.5511[0m       0.9214        [94m0.5401[0m     +  31.2876
     27   0.0588   0.3446        [35m0.5499[0m       0.9214        [94m0.5357[0m     +  31.3595
     28   0.0591   0.3445        [35m0.5455[0m       0.9214        [94m0.5314[0m     +  31.3613
     29   0.0593   0.3446        [35m0.5411[0m       0.9214        [94m0.5271[0m     +  31.3278
     30   0.0594   0.3442        [35m0.5353[0m       0.9214        [94m0.5229[0m     +  31.4768
     31   0.0594   0.3442        [35m0.5330[0m       0.9214        [94m0.5188[0m     +  31.3095
     32   0.0596   0.3441        [35m0.5290[0m       0.9214        [94m0.5147[0m     +  31.0299
     33   0.0598   0.3444        [35m0.5246[0m       0.9214        [94m0.5107[0m     +  32.0619
     34   0.0599   0.3445        [35m0.5214[0m       0.9214        [94m0.5067[0m     +  31.4596
     35   0.0599   0.3447        [35m0.5187[0m       0.9214        [94m0.5028[0m     +  31.2821
     36   0.0600   0.3450        [35m0.5158[0m       0.9214        [94m0.4990[0m     +  31.2485
     37   0.0601   0.3452        [35m0.5107[0m       0.9214        [94m0.4953[0m     +  31.3830
     38   0.0601   0.3453        [35m0.5101[0m       0.9214        [94m0.4915[0m     +  31.3340
     39   0.0603   0.3455        [35m0.5060[0m       0.9214        [94m0.4879[0m     +  31.3237
     40   0.0606   0.3460        [35m0.5030[0m       0.9214        [94m0.4844[0m     +  31.2052
     41   0.0606   0.3461        [35m0.4986[0m       0.9214        [94m0.4809[0m     +  31.2265
     42   0.0607   0.3461        [35m0.4964[0m       0.9214        [94m0.4774[0m     +  31.2516
     43   0.0607   0.3463        [35m0.4926[0m       0.9214        [94m0.4740[0m     +  31.2534
     44   0.0608   0.3464        [35m0.4897[0m       0.9214        [94m0.4708[0m     +  31.3172
     45   0.0609   0.3467        [35m0.4862[0m       0.9214        [94m0.4675[0m     +  31.3157
     46   0.0610   0.3471        [35m0.4837[0m       0.9214        [94m0.4643[0m     +  31.3713
     47   0.0612   0.3474        [35m0.4805[0m       0.9214        [94m0.4612[0m     +  31.1735
     48   0.0612   0.3474        [35m0.4781[0m       0.9214        [94m0.4581[0m     +  31.2911
     49   0.0615   0.3478        [35m0.4758[0m       0.9214        [94m0.4551[0m     +  31.4550
     50   0.0619   0.3483        [35m0.4737[0m       0.9214        [94m0.4522[0m     +  31.2602
[32m[I 2023-05-05 10:24:08,679][0m Trial 598 finished with value: 0.4521695099401647 and parameters: {'lr': 3.8295753291295734e-08, 'dropout': 0.4716408024042566, 'd_model_multiplier': 4, 'num_layers': 7, 'n_heads': 32, 'dim_feedforward': 382, 'batch_size': 42, 'pos_encoding': 'fixed', 'activation': 'relu', 'norm': 'LayerNorm', 'optimizer_name': 'RAdam', 'weight_decay': 0, 'top_n_features': 66}. Best is trial 246 with value: 0.16447311791139763.[0m
[FileBasedDataset] Initializing dataset...
	Examples: 8264
	Features: 79
	Max length: 315
Standard scalar turned ON, loading params from cache
[FileBasedDataset] Dataset initialization complete
  epoch    auprc    auroc    train_loss    valid_acc    valid_loss    cp      dur
-------  -------  -------  ------------  -----------  ------------  ----  -------
      1   [36m0.1623[0m   [32m0.6694[0m        [35m0.3187[0m       [31m0.9238[0m        [94m0.2541[0m     +  26.9160
      2   [36m0.2256[0m   [32m0.7413[0m        [35m0.2467[0m       0.9238        [94m0.2432[0m     +  26.9822
      3   [36m0.2592[0m   [32m0.7730[0m        0.2470       0.9214        [94m0.2326[0m     +  26.9540
      4   0.2502   0.7478        [35m0.2412[0m       0.9214        0.2429        26.9382
      5   0.2464   0.7600        [35m0.2405[0m       0.9214        0.2399        26.8986
      6   [36m0.2757[0m   0.7724        [35m0.2366[0m       0.9226        0.2349        26.8123
      7   0.2438   [32m0.7796[0m        0.2372       [31m0.9250[0m        0.2446        27.1763
      8   0.2582   0.7529        [35m0.2365[0m       0.9250        0.2444        27.0027
      9   0.1767   0.7008        0.2395       0.9226        0.2716        27.0177
     10   [36m0.2847[0m   0.7723        [35m0.2351[0m       0.9166        0.2493        27.0664
     11   0.2623   0.7631        0.2354       0.9141        0.2530        27.2167
     12   0.2591   0.7510        [35m0.2328[0m       0.9166        0.2542        27.2806
Stopping since valid_loss has not improved in the last 10 epochs.
