[32m[I 2023-05-03 04:04:49,691][0m Trial 267 finished with value: 0.2925246706031975 and parameters: {'lr': 0.004077510962456748, 'dropout': 0.5590467639251255, 'd_model_multiplier': 4, 'num_layers': 2, 'n_heads': 64, 'dim_feedforward': 405, 'batch_size': 74, 'pos_encoding': 'learnable', 'activation': 'gelu', 'norm': 'BatchNorm', 'optimizer_name': 'PlainRAdam', 'weight_decay': 0, 'top_n_features': 208}. Best is trial 246 with value: 0.16447311791139763.[0m
[FileBasedDataset] Initializing dataset...
	Examples: 8264
	Features: 202
	Max length: 315
Standard scalar turned ON, loading params from cache
[FileBasedDataset] Dataset initialization complete
  epoch    auprc    auroc    train_loss    valid_acc    valid_loss    cp      dur
-------  -------  -------  ------------  -----------  ------------  ----  -------
      1   [36m0.1790[0m   [32m0.7394[0m        [35m0.2974[0m       [31m0.9129[0m        [94m0.2686[0m     +  22.4214
      2   0.1664   0.7162        [35m0.2865[0m       [31m0.9178[0m        0.3297        22.4393
      3   0.1717   0.7347        0.2999       [31m0.9335[0m        0.3059        22.2565
      4   0.1635   0.7179        [35m0.2804[0m       0.9262        [94m0.2495[0m     +  22.5671
      5   0.1596   0.7114        [35m0.2677[0m       0.8972        0.2770        22.4397
      6   [36m0.1806[0m   [32m0.7484[0m        [35m0.2536[0m       0.9287        [94m0.2380[0m     +  22.5157
      7   0.1637   0.7193        0.2590       0.9178        0.2597        22.5058
      8   [36m0.1943[0m   [32m0.7593[0m        [35m0.2509[0m       0.9250        [94m0.2214[0m     +  22.5231
      9   [36m0.2136[0m   [32m0.7740[0m        [35m0.2455[0m       0.9262        0.2338        22.7331
     10   0.2012   0.7724        0.2468       0.9238        0.2332        22.3983
     11   [36m0.2274[0m   [32m0.7777[0m        0.2484       0.9299        0.2272        22.3502
     12   0.2207   0.7773        [35m0.2416[0m       0.9226        0.2347        22.6999
     13   [36m0.2538[0m   [32m0.7783[0m        0.2426       0.9129        0.2359        22.5834
     14   0.2370   0.7773        0.2428       0.9141        0.2415        22.4671
     15   [36m0.2565[0m   0.7781        0.2444       0.9335        [94m0.2136[0m     +  22.7555
     16   0.2424   [32m0.7821[0m        0.2417       0.9274        0.2285        22.3411
     17   0.2071   0.7674        0.2430       0.9274        0.2330        22.1434
     18   0.1961   0.7532        0.2435       0.9311        0.2737        22.3270
     19   0.2320   0.7696        0.2450       0.9250        0.2183        22.4236
     20   0.2220   0.7682        0.2448       0.9214        0.2208        22.2657
     21   0.2302   0.7689        [35m0.2392[0m       0.9214        0.2476        22.2080
     22   [36m0.2839[0m   0.7783        0.2404       0.9190        0.2601        22.5900
     23   [36m0.2898[0m   [32m0.7872[0m        0.2419       0.9274        0.2176        22.3636
     24   [36m0.2938[0m   [32m0.7888[0m        0.2406       0.9311        0.2226        22.4183
Stopping since valid_loss has not improved in the last 10 epochs.
[32m[I 2023-05-03 04:14:12,120][0m Trial 268 finished with value: 0.21362942436309093 and parameters: {'lr': 0.0012887235006957519, 'dropout': 0.5497979307361454, 'd_model_multiplier': 8, 'num_layers': 2, 'n_heads': 64, 'dim_feedforward': 413, 'batch_size': 59, 'pos_encoding': 'learnable', 'activation': 'relu', 'norm': 'LayerNorm', 'optimizer_name': 'PlainRAdam', 'weight_decay': 0.1, 'top_n_features': 202}. Best is trial 246 with value: 0.16447311791139763.[0m
[FileBasedDataset] Initializing dataset...
	Examples: 8264
	Features: 149
	Max length: 315
Standard scalar turned ON, loading params from cache
[FileBasedDataset] Dataset initialization complete
  epoch    auprc    auroc    train_loss    valid_acc    valid_loss    cp      dur
-------  -------  -------  ------------  -----------  ------------  ----  -------
      1   [36m0.3457[0m   [32m0.7816[0m        [35m0.3503[0m       [31m0.9057[0m        [94m0.3806[0m     +  23.1486
      2   [36m0.3763[0m   [32m0.7874[0m        [35m0.2526[0m       [31m0.9141[0m        [94m0.3368[0m     +  23.4289
      3   0.3730   [32m0.7955[0m        [35m0.2471[0m       0.9129        [94m0.3305[0m     +  23.3125
      4   0.3682   0.7934        [35m0.2451[0m       0.9081        [94m0.3233[0m     +  23.4396
      5   0.3725   0.7880        [35m0.2394[0m       0.9081        [94m0.2992[0m     +  23.5557
      6   0.3645   [32m0.7972[0m        [35m0.2348[0m       0.9057        0.3121        23.5120
      7   0.3729   0.7971        [35m0.2316[0m       0.9081        [94m0.2956[0m     +  23.7036
      8   0.3686   0.7899        [35m0.2313[0m       0.9069        0.3002        23.4304
      9   0.3416   0.7832        [35m0.2290[0m       0.9069        [94m0.2901[0m     +  23.5712
     10   0.3307   0.7830        [35m0.2262[0m       0.9069        0.2907        23.6008
     11   0.3483   0.7773        0.2281       0.9105        0.3100        23.2327
     12   0.3515   0.7817        [35m0.2225[0m       0.9129        0.3100        23.6406
     13   0.3709   0.7858        0.2251       0.9129        0.3263        23.3666
     14   0.3613   0.7760        [35m0.2183[0m       0.9117        0.3230        23.4915
     15   0.3363   0.7731        0.2209       0.9081        0.3155        24.2819
     16   0.3697   0.7886        0.2198       0.9069        0.3562        23.6718
     17   0.3424   0.7865        0.2205       0.9069        0.3516        23.4663
     18   0.3313   0.7735        [35m0.2131[0m       0.9081        0.3488        23.6733
Stopping since valid_loss has not improved in the last 10 epochs.
[32m[I 2023-05-03 04:21:40,595][0m Trial 269 finished with value: 0.290140835755249 and parameters: {'lr': 0.00013397868313636585, 'dropout': 0.5150946158169112, 'd_model_multiplier': 8, 'num_layers': 2, 'n_heads': 64, 'dim_feedforward': 435, 'batch_size': 68, 'pos_encoding': 'learnable', 'activation': 'gelu', 'norm': 'BatchNorm', 'optimizer_name': 'PlainRAdam', 'weight_decay': 0.01, 'top_n_features': 149}. Best is trial 246 with value: 0.16447311791139763.[0m
[FileBasedDataset] Initializing dataset...
	Examples: 8264
	Features: 139
	Max length: 315
Standard scalar turned ON, loading params from cache
[FileBasedDataset] Dataset initialization complete
  epoch    auprc    auroc    train_loss    valid_acc    valid_loss    cp     dur
-------  -------  -------  ------------  -----------  ------------  ----  ------
      1   [36m0.2071[0m   [32m0.6918[0m        [35m0.3475[0m       [31m0.9081[0m        [94m0.2905[0m     +  9.2125
      2   [36m0.2541[0m   [32m0.7380[0m        [35m0.2459[0m       0.8984        [94m0.2772[0m     +  9.2001
      3   [36m0.2688[0m   [32m0.7417[0m        [35m0.2395[0m       0.8996        [94m0.2762[0m     +  9.3276
      4   [36m0.2832[0m   [32m0.7446[0m        [35m0.2357[0m       0.8996        0.2821        9.2665
      5   0.2747   0.7386        [35m0.2319[0m       0.9021        0.2904        9.4423
      6   [36m0.2920[0m   [32m0.7487[0m        0.2336       0.8984        0.2829        9.2697
      7   [36m0.2941[0m   [32m0.7488[0m        0.2321       0.9008        0.2815        9.5635
      8   0.2880   0.7379        0.2320       0.8996        0.2870        9.8688
      9   [36m0.2957[0m   0.7415        [35m0.2313[0m       0.8996        0.2826        9.5546
     10   0.2833   0.7352        [35m0.2302[0m       0.9033        0.2917        9.4647
     11   0.2901   0.7408        0.2313       0.8996        0.2843        10.0470
     12   0.2868   0.7218        [35m0.2266[0m       0.8984        0.3027        9.5986
Stopping since valid_loss has not improved in the last 10 epochs.
[32m[I 2023-05-03 04:23:44,232][0m Trial 270 finished with value: 0.27615876839988324 and parameters: {'lr': 0.0007770307246315209, 'dropout': 0.41893891157310226, 'd_model_multiplier': 4, 'num_layers': 1, 'n_heads': 16, 'dim_feedforward': 139, 'batch_size': 62, 'pos_encoding': 'learnable', 'activation': 'relu', 'norm': 'LayerNorm', 'optimizer_name': 'PlainRAdam', 'weight_decay': 0.1, 'top_n_features': 139}. Best is trial 246 with value: 0.16447311791139763.[0m
[FileBasedDataset] Initializing dataset...
	Examples: 8264
	Features: 53
	Max length: 315
Standard scalar turned ON, loading params from cache
[FileBasedDataset] Dataset initialization complete
  epoch    auprc    auroc    train_loss    valid_acc    valid_loss    cp      dur
-------  -------  -------  ------------  -----------  ------------  ----  -------
      1   [36m0.2950[0m   [32m0.6524[0m        [35m0.3544[0m       [31m0.9021[0m        [94m0.3070[0m     +  10.1013
      2   [36m0.3023[0m   [32m0.6594[0m        [35m0.2683[0m       [31m0.9081[0m        0.3152        10.3755
      3   [36m0.3252[0m   [32m0.7408[0m        [35m0.2537[0m       0.9045        [94m0.2951[0m     +  10.3353
      4   [36m0.3586[0m   [32m0.7505[0m        [35m0.2442[0m       0.9069        [94m0.2893[0m     +  10.4318
      5   [36m0.3647[0m   0.7491        [35m0.2431[0m       0.9069        [94m0.2868[0m     +  10.3436
      6   0.3410   0.7486        [35m0.2380[0m       0.9021        0.2956        10.5756
      7   0.3307   0.7454        [35m0.2328[0m       [31m0.9093[0m        0.2944        10.3651
      8   [36m0.3773[0m   [32m0.7519[0m        [35m0.2322[0m       0.9057        0.2987        10.4488
      9   0.3355   0.7476        [35m0.2301[0m       0.9069        0.2897        10.5082
     10   0.3158   0.7487        [35m0.2291[0m       0.9057        [94m0.2860[0m     +  10.4313
     11   0.3211   0.7356        [35m0.2260[0m       0.9057        0.2974        10.4894
     12   0.2811   0.7471        0.2281       0.9069        0.2972        10.3337
     13   0.3262   0.7499        0.2293       0.9081        0.2882        10.5240
     14   0.2907   0.7283        0.2271       0.9045        0.3082        10.4863
     15   0.3051   0.7438        0.2289       0.9021        0.2919        10.3230
     16   0.3136   0.7392        [35m0.2232[0m       0.9045        0.2928        10.8859
     17   0.3397   [32m0.7600[0m        [35m0.2231[0m       0.9057        [94m0.2851[0m     +  10.5126
     18   0.3414   0.7583        [35m0.2228[0m       0.9069        0.2911        10.4782
     19   0.3182   0.7561        [35m0.2207[0m       0.9057        [94m0.2829[0m     +  10.6501
     20   0.3015   [32m0.7605[0m        [35m0.2203[0m       0.9033        0.2916        10.3215
     21   0.2899   0.7590        [35m0.2197[0m       0.9033        0.3011        10.6200
     22   0.3091   0.7598        0.2199       0.9045        0.2927        10.6362
     23   0.2754   0.7587        [35m0.2187[0m       0.8960        0.2982        10.4964
     24   0.3037   [32m0.7623[0m        [35m0.2175[0m       0.8984        0.2916        10.4480
     25   0.2980   [32m0.7722[0m        0.2186       0.8996        0.2925        10.3698
     26   0.2921   [32m0.7744[0m        0.2191       0.8996        0.2869        10.4666
     27   0.3017   0.7710        [35m0.2167[0m       0.9008        0.2933        10.5371
     28   0.3088   [32m0.7749[0m        0.2169       0.9033        0.2925        10.3329
Stopping since valid_loss has not improved in the last 10 epochs.
[32m[I 2023-05-03 04:28:48,513][0m Trial 271 finished with value: 0.2829154592903811 and parameters: {'lr': 0.0025476622149741357, 'dropout': 0.4534415421617118, 'd_model_multiplier': 8, 'num_layers': 8, 'n_heads': 4, 'dim_feedforward': 224, 'batch_size': 47, 'pos_encoding': 'learnable', 'activation': 'gelu', 'norm': 'BatchNorm', 'optimizer_name': 'PlainRAdam', 'weight_decay': 0.1, 'top_n_features': 53}. Best is trial 246 with value: 0.16447311791139763.[0m
[FileBasedDataset] Initializing dataset...
	Examples: 8264
	Features: 68
	Max length: 315
Standard scalar turned ON, loading params from cache
[FileBasedDataset] Dataset initialization complete
  epoch    auprc    auroc    train_loss    valid_acc    valid_loss    cp      dur
-------  -------  -------  ------------  -----------  ------------  ----  -------
      1   [36m0.3625[0m   [32m0.7832[0m        [35m0.2873[0m       [31m0.9105[0m        [94m0.2445[0m     +  19.6350
      2   0.3566   0.7725        [35m0.2487[0m       0.9093        0.2591        19.4844
      3   0.3258   0.7772        0.2522       0.9093        0.2632        19.8404
      4   0.3277   [32m0.7930[0m        [35m0.2457[0m       0.9057        0.2580        19.6980
      5   [36m0.3687[0m   0.7813        0.2473       0.9093        0.2554        19.9011
      6   0.3661   [32m0.8045[0m        [35m0.2444[0m       [31m0.9154[0m        [94m0.2422[0m     +  19.9594
      7   [36m0.3735[0m   0.7864        [35m0.2396[0m       [31m0.9178[0m        0.2572        19.8825
      8   [36m0.3923[0m   0.7843        [35m0.2378[0m       0.9129        0.2439        19.9779
      9   [36m0.4066[0m   [32m0.8142[0m        [35m0.2377[0m       0.9166        [94m0.2416[0m     +  19.8117
     10   0.3878   0.7905        [35m0.2345[0m       0.9129        0.2472        19.8343
     11   0.4031   [32m0.8176[0m        0.2353       0.9141        [94m0.2401[0m     +  19.9625
     12   0.3944   0.8062        [35m0.2332[0m       0.9178        0.2411        19.6622
     13   0.3701   0.7862        0.2334       0.9154        0.2564        19.8708
     14   0.3968   0.8071        0.2334       0.9178        0.2493        20.2844
     15   [36m0.4321[0m   [32m0.8291[0m        [35m0.2309[0m       0.9154        [94m0.2325[0m     +  19.7947
     16   0.3765   0.8156        0.2319       0.9105        0.2336        20.0698
     17   0.3758   0.7998        0.2330       0.9129        0.2677        20.1008
     18   0.3955   0.8288        0.2375       0.9166        0.2616        19.7100
     19   0.3802   0.8223        0.2317       0.9154        0.2550        20.0074
     20   0.3756   0.8107        0.2353       0.9154        0.2529        19.9098
     21   0.3732   0.8112        0.2358       0.9117        0.2510        19.8514
     22   0.3682   0.7995        0.2327       0.9105        0.2789        19.9256
     23   0.3771   0.8180        0.2316       0.9154        0.2542        19.9552
     24   0.3632   0.8050        0.2361       0.9105        0.2671        19.9173
Stopping since valid_loss has not improved in the last 10 epochs.
[32m[I 2023-05-03 04:37:06,760][0m Trial 272 finished with value: 0.2325157941540899 and parameters: {'lr': 0.001401955858912487, 'dropout': 0.5361583814486219, 'd_model_multiplier': 4, 'num_layers': 4, 'n_heads': 32, 'dim_feedforward': 189, 'batch_size': 56, 'pos_encoding': 'learnable', 'activation': 'relu', 'norm': 'LayerNorm', 'optimizer_name': 'PlainRAdam', 'weight_decay': 0.01, 'top_n_features': 68}. Best is trial 246 with value: 0.16447311791139763.[0m
[FileBasedDataset] Initializing dataset...
	Examples: 8264
	Features: 16
	Max length: 315
Standard scalar turned ON, loading params from cache
[FileBasedDataset] Dataset initialization complete
  epoch    auprc    auroc    train_loss    valid_acc    valid_loss    cp      dur
-------  -------  -------  ------------  -----------  ------------  ----  -------
      1   [36m0.2283[0m   [32m0.7787[0m        [35m0.3317[0m       [31m0.9274[0m        [94m0.5620[0m     +  10.7277
      2   [36m0.2285[0m   0.7623        [35m0.2631[0m       0.9129        [94m0.5480[0m     +  10.9388
      3   0.2062   0.7191        [35m0.2549[0m       0.9190        [94m0.4921[0m     +  10.8627
      4   0.2087   0.7106        [35m0.2530[0m       0.9250        [94m0.4087[0m     +  10.7867
      5   0.2285   0.7632        0.2567       [31m0.9311[0m        [94m0.4029[0m     +  11.1244
      6   [36m0.2325[0m   [32m0.7924[0m        [35m0.2487[0m       [31m0.9323[0m        [94m0.3338[0m     +  10.8397
      7   [36m0.2446[0m   [32m0.7946[0m        0.2511       0.9311        [94m0.2870[0m     +  10.7762
      8   [36m0.2515[0m   0.7900        [35m0.2484[0m       0.9311        [94m0.2351[0m     +  10.7719
      9   [36m0.2517[0m   0.7909        [35m0.2403[0m       0.9311        [94m0.2304[0m     +  10.9216
     10   0.2385   [32m0.8026[0m        [35m0.2383[0m       0.9311        0.2330        10.7233
     11   0.2441   0.8018        0.2384       0.9311        0.2368        10.8354
     12   0.2433   [32m0.8082[0m        [35m0.2353[0m       0.9311        0.2307        10.7656
     13   0.2514   [32m0.8104[0m        [35m0.2337[0m       0.9311        0.2329        10.8822
     14   0.2415   [32m0.8136[0m        [35m0.2330[0m       0.9311        [94m0.2300[0m     +  10.9369
     15   0.2456   [32m0.8222[0m        [35m0.2310[0m       0.9311        [94m0.2240[0m     +  11.0179
     16   [36m0.2549[0m   0.8203        [35m0.2289[0m       0.9311        0.2250        10.8288
     17   0.2432   0.8203        [35m0.2288[0m       0.9311        0.2318        10.9547
     18   [36m0.2551[0m   [32m0.8283[0m        [35m0.2255[0m       0.9299        0.2291        11.0231
     19   [36m0.2584[0m   [32m0.8317[0m        0.2257       0.9299        [94m0.2228[0m     +  11.0494
     20   [36m0.2610[0m   0.8294        [35m0.2240[0m       0.9311        0.2523        10.7960
     21   [36m0.2736[0m   [32m0.8350[0m        0.2247       0.9299        0.2938        10.8752
     22   [36m0.2776[0m   [32m0.8390[0m        0.2247       0.9299        0.2433        11.0727
     23   0.2578   0.8349        [35m0.2216[0m       0.9311        [94m0.2181[0m     +  11.0476
     24   0.2499   [32m0.8405[0m        0.2235       0.9299        0.2268        10.8527
     25   0.2611   0.8392        [35m0.2213[0m       0.9299        0.2442        11.0453
     26   0.2645   0.8401        0.2225       0.9299        [94m0.2090[0m     +  10.9610
     27   [36m0.2801[0m   [32m0.8443[0m        0.2225       0.9299        0.2668        10.9431
     28   0.2585   0.8384        [35m0.2196[0m       0.9299        0.2149        10.8737
     29   0.2566   0.8392        0.2213       0.9311        0.2261        10.8401
     30   0.2447   0.8359        [35m0.2196[0m       0.9311        0.2314        10.9076
     31   0.2547   0.8403        [35m0.2180[0m       0.9299        0.2121        10.9904
     32   0.2770   0.8359        0.2199       0.9299        0.2165        11.0019
     33   [36m0.2924[0m   0.8385        0.2204       0.9311        0.2232        10.8032
     34   0.2639   0.8370        0.2181       0.9311        0.2282        10.9562
     35   0.2727   0.8406        [35m0.2174[0m       0.9311        0.2536        10.7780
Stopping since valid_loss has not improved in the last 10 epochs.
