[32m[I 2023-05-02 12:57:45,919][0m Trial 130 finished with value: 0.2344096940474758 and parameters: {'lr': 0.00018020517976373063, 'dropout': 0.3904771076966729, 'd_model_multiplier': 1, 'num_layers': 1, 'n_heads': 32, 'dim_feedforward': 431, 'batch_size': 8, 'pos_encoding': 'learnable', 'activation': 'gelu', 'norm': 'BatchNorm', 'optimizer_name': 'PlainRAdam', 'weight_decay': 0, 'top_n_features': 143}. Best is trial 117 with value: 0.191397856754288.[0m
[FileBasedDataset] Initializing dataset...
	Examples: 8264
	Features: 157
	Max length: 315
Standard scalar turned ON, loading params from cache
[FileBasedDataset] Dataset initialization complete
  epoch    auprc    auroc    train_loss    valid_acc    valid_loss    cp      dur
-------  -------  -------  ------------  -----------  ------------  ----  -------
      1   [36m0.2648[0m   [32m0.7411[0m        [35m0.2797[0m       [31m0.9117[0m        [94m0.2657[0m     +  11.1470
      2   [36m0.2813[0m   [32m0.7664[0m        [35m0.2623[0m       0.9105        [94m0.2614[0m     +  11.4349
      3   0.2772   [32m0.7764[0m        [35m0.2529[0m       [31m0.9129[0m        0.2645        11.1959
      4   [36m0.2947[0m   [32m0.7764[0m        [35m0.2477[0m       0.9105        0.2646        11.2182
      5   [36m0.3153[0m   0.7748        [35m0.2413[0m       0.9129        [94m0.2608[0m     +  11.3475
      6   0.3015   [32m0.7776[0m        [35m0.2392[0m       [31m0.9141[0m        [94m0.2595[0m     +  11.0402
      7   [36m0.3512[0m   [32m0.7840[0m        [35m0.2362[0m       [31m0.9154[0m        [94m0.2559[0m     +  11.3257
      8   0.3317   0.7830        [35m0.2349[0m       0.9141        0.2595        11.1063
      9   0.3151   0.7738        [35m0.2317[0m       0.9154        0.2670        11.4185
     10   0.3183   [32m0.7908[0m        [35m0.2300[0m       0.9141        0.2575        11.2515
     11   0.3208   0.7879        [35m0.2298[0m       0.9045        0.2650        11.3310
     12   0.3381   [32m0.7911[0m        0.2313       [31m0.9166[0m        [94m0.2525[0m     +  11.3828
     13   0.3293   [32m0.7926[0m        [35m0.2277[0m       0.9141        0.2564        11.4296
     14   0.3236   0.7916        0.2288       0.9154        [94m0.2522[0m     +  11.4285
     15   0.3090   0.7835        0.2288       0.9129        0.2551        11.1764
     16   0.3465   [32m0.7999[0m        [35m0.2254[0m       0.9057        0.2553        11.1686
     17   0.3285   0.7877        0.2283       0.9166        0.2536        11.1925
     18   0.3433   0.7884        0.2255       0.9166        0.2552        11.1365
     19   0.3129   0.7910        [35m0.2245[0m       0.9117        0.2540        10.9765
     20   0.2902   0.7856        [35m0.2242[0m       0.9117        0.2561        11.1085
     21   0.3288   0.7993        [35m0.2221[0m       0.9141        [94m0.2497[0m     +  11.1521
     22   0.3270   0.7937        0.2230       0.9166        0.2506        11.4229
     23   0.3465   0.7933        0.2240       0.9117        0.2509        11.2113
     24   0.3394   0.7941        0.2238       0.9117        0.2535        11.4445
     25   0.3140   0.7920        [35m0.2207[0m       0.9008        0.2671        11.4643
     26   0.3170   0.7853        0.2221       0.9117        0.2558        11.6381
     27   0.3303   [32m0.8038[0m        0.2237       0.9069        0.2609        11.2979
     28   0.3364   0.8005        0.2220       0.9141        [94m0.2491[0m     +  11.1837
     29   0.3391   0.7976        0.2237       0.9154        0.2507        11.3882
     30   0.2830   0.7768        [35m0.2207[0m       0.9117        0.2636        11.4906
     31   0.2999   0.7889        0.2215       0.9129        0.2552        11.2776
     32   0.2982   0.7786        0.2212       0.9129        0.2660        11.4826
     33   0.3084   0.7914        0.2223       0.9141        0.2521        11.1761
     34   0.3223   0.7981        0.2259       0.9081        0.2584        11.4313
     35   0.3224   0.7952        [35m0.2200[0m       0.9141        0.2584        11.3177
     36   0.3192   0.7992        [35m0.2200[0m       0.9154        0.2596        11.3804
     37   0.3307   0.7965        [35m0.2197[0m       0.9166        0.2495        11.1362
Stopping since valid_loss has not improved in the last 10 epochs.
[32m[I 2023-05-02 13:04:55,985][0m Trial 131 finished with value: 0.24910886837518634 and parameters: {'lr': 0.0029827419412485237, 'dropout': 0.35925705373258077, 'd_model_multiplier': 1, 'num_layers': 2, 'n_heads': 32, 'dim_feedforward': 447, 'batch_size': 21, 'pos_encoding': 'learnable', 'activation': 'gelu', 'norm': 'BatchNorm', 'optimizer_name': 'PlainRAdam', 'weight_decay': 0, 'top_n_features': 157}. Best is trial 117 with value: 0.191397856754288.[0m
[FileBasedDataset] Initializing dataset...
	Examples: 8264
	Features: 151
	Max length: 315
Standard scalar turned ON, loading params from cache
[FileBasedDataset] Dataset initialization complete
  epoch    auprc    auroc    train_loss    valid_acc    valid_loss    cp      dur
-------  -------  -------  ------------  -----------  ------------  ----  -------
      1   [36m0.3582[0m   [32m0.7754[0m        [35m0.2739[0m       [31m0.9190[0m        [94m0.2471[0m     +  10.9877
      2   0.3463   0.7439        [35m0.2599[0m       0.9190        0.2554        11.1136
      3   0.3540   0.7754        [35m0.2565[0m       0.9178        0.3044        11.1247
      4   [36m0.3735[0m   [32m0.8058[0m        [35m0.2528[0m       0.9178        0.2482        11.1878
      5   0.3213   [32m0.8124[0m        [35m0.2450[0m       0.9129        0.2611        11.1523
      6   0.3430   0.7914        0.2460       0.9190        0.2493        11.1242
      7   0.3589   [32m0.8136[0m        0.2454       0.9178        [94m0.2391[0m     +  11.3736
      8   [36m0.3788[0m   [32m0.8354[0m        [35m0.2444[0m       [31m0.9274[0m        [94m0.2273[0m     +  11.1539
      9   [36m0.3841[0m   0.8289        [35m0.2361[0m       0.9226        [94m0.2262[0m     +  11.0818
     10   0.3703   0.8343        0.2375       0.9202        0.2437        11.4252
     11   0.3693   0.8324        [35m0.2331[0m       0.9238        0.2316        11.2514
     12   0.3658   [32m0.8363[0m        [35m0.2329[0m       0.9202        0.2304        11.3136
     13   [36m0.3875[0m   0.8286        0.2339       0.9238        [94m0.2228[0m     +  11.3298
     14   0.3563   0.8259        [35m0.2293[0m       0.9190        0.2271        10.9145
     15   [36m0.3884[0m   0.8191        0.2298       0.9214        0.2308        11.1779
     16   0.3564   0.8277        [35m0.2286[0m       0.9202        0.2245        11.1926
     17   0.3715   0.8282        [35m0.2275[0m       0.9226        0.2234        11.1741
     18   0.3539   0.8250        0.2282       0.9190        0.2330        11.1635
     19   0.3729   0.8286        [35m0.2243[0m       0.9141        0.2266        11.1825
     20   0.3510   0.8218        0.2259       0.9214        0.2278        11.0942
     21   0.3546   0.8168        [35m0.2223[0m       0.9214        0.2284        11.0481
     22   0.3529   0.8137        0.2232       0.9190        0.2364        11.1980
Stopping since valid_loss has not improved in the last 10 epochs.
[32m[I 2023-05-02 13:09:13,456][0m Trial 132 finished with value: 0.22278635370507927 and parameters: {'lr': 0.0020448449806795507, 'dropout': 0.3762145663817256, 'd_model_multiplier': 1, 'num_layers': 2, 'n_heads': 32, 'dim_feedforward': 437, 'batch_size': 26, 'pos_encoding': 'learnable', 'activation': 'gelu', 'norm': 'BatchNorm', 'optimizer_name': 'PlainRAdam', 'weight_decay': 0, 'top_n_features': 151}. Best is trial 117 with value: 0.191397856754288.[0m
[FileBasedDataset] Initializing dataset...
	Examples: 8264
	Features: 148
	Max length: 315
Standard scalar turned ON, loading params from cache
[FileBasedDataset] Dataset initialization complete
  epoch    auprc    auroc    train_loss    valid_acc    valid_loss    cp      dur
-------  -------  -------  ------------  -----------  ------------  ----  -------
      1   [36m0.2824[0m   [32m0.7730[0m        [35m0.2813[0m       [31m0.8888[0m        [94m0.2882[0m     +  13.8015
      2   0.2727   [32m0.7782[0m        [35m0.2574[0m       0.8742        0.3359        13.8118
      3   0.2785   0.7689        [35m0.2561[0m       [31m0.8984[0m        0.2884        13.8401
      4   0.2509   0.7175        [35m0.2500[0m       [31m0.9033[0m        [94m0.2828[0m     +  13.9488
      5   0.2690   [32m0.7810[0m        [35m0.2500[0m       0.8585        0.3224        13.9444
      6   [36m0.2846[0m   0.7761        [35m0.2473[0m       0.8549        0.3450        14.0962
      7   0.2674   0.7802        [35m0.2446[0m       0.8271        0.4001        14.2003
      8   [36m0.2939[0m   [32m0.7852[0m        0.2502       0.8235        0.4179        13.9933
      9   0.2566   0.7717        0.2488       0.8307        0.3941        14.0953
     10   0.2833   0.7806        0.2455       0.7316        0.5390        14.0162
     11   0.2377   0.7359        0.2498       0.8452        0.3850        14.1578
     12   0.2492   0.7603        0.2503       0.8634        0.3311        13.9200
     13   0.2504   0.7442        0.2460       0.8307        0.4063        13.8547
Stopping since valid_loss has not improved in the last 10 epochs.
[32m[I 2023-05-02 13:12:29,636][0m Trial 133 finished with value: 0.28283969926430497 and parameters: {'lr': 0.004884968526734332, 'dropout': 0.3992807288377115, 'd_model_multiplier': 1, 'num_layers': 3, 'n_heads': 32, 'dim_feedforward': 465, 'batch_size': 44, 'pos_encoding': 'learnable', 'activation': 'gelu', 'norm': 'BatchNorm', 'optimizer_name': 'PlainRAdam', 'weight_decay': 0, 'top_n_features': 148}. Best is trial 117 with value: 0.191397856754288.[0m
[FileBasedDataset] Initializing dataset...
	Examples: 8264
	Features: 134
	Max length: 315
Standard scalar turned ON, loading params from cache
[FileBasedDataset] Dataset initialization complete
  epoch    auprc    auroc    train_loss    valid_acc    valid_loss    cp      dur
-------  -------  -------  ------------  -----------  ------------  ----  -------
      1   [36m0.2099[0m   [32m0.7137[0m        [35m0.3019[0m       [31m0.9069[0m        [94m0.3128[0m     +  10.9797
      2   [36m0.2297[0m   [32m0.7344[0m        [35m0.2497[0m       0.8996        [94m0.3033[0m     +  11.4659
      3   [36m0.2451[0m   [32m0.7430[0m        [35m0.2469[0m       0.9008        0.3186        11.1702
      4   [36m0.2457[0m   [32m0.7443[0m        [35m0.2423[0m       0.9045        [94m0.2966[0m     +  11.3291
      5   [36m0.2594[0m   [32m0.7598[0m        [35m0.2401[0m       [31m0.9081[0m        [94m0.2785[0m     +  11.0172
      6   [36m0.2792[0m   [32m0.7640[0m        [35m0.2382[0m       [31m0.9129[0m        [94m0.2742[0m     +  11.1371
      7   [36m0.2826[0m   0.7597        [35m0.2312[0m       0.9045        [94m0.2731[0m     +  11.4040
      8   0.2780   0.7616        0.2322       0.9117        [94m0.2701[0m     +  11.2262
      9   0.2521   0.7404        [35m0.2286[0m       0.9081        0.2751        11.2432
     10   0.2789   [32m0.7734[0m        [35m0.2272[0m       0.9069        [94m0.2657[0m     +  11.1902
     11   0.2699   [32m0.7790[0m        0.2294       0.9069        0.2678        11.1908
     12   0.2721   0.7698        [35m0.2247[0m       0.9093        0.2705        11.0704
     13   0.2764   0.7770        0.2262       0.9057        0.2687        11.1067
     14   0.2575   0.7715        [35m0.2216[0m       0.9045        0.2720        11.3336
     15   0.2712   [32m0.7861[0m        0.2217       0.9033        [94m0.2652[0m     +  11.2088
     16   0.2689   [32m0.7900[0m        [35m0.2214[0m       0.9033        0.2681        11.0971
     17   0.2711   0.7856        0.2215       0.9033        0.2656        11.1290
     18   0.2580   0.7812        [35m0.2180[0m       0.9045        0.2685        11.2559
     19   0.2691   0.7868        0.2203       0.9021        0.2668        11.1729
     20   0.2556   0.7792        [35m0.2167[0m       0.9057        0.2687        11.1052
     21   0.2572   [32m0.7903[0m        0.2197       0.9069        0.2753        11.2935
     22   0.2625   0.7894        [35m0.2159[0m       0.9057        0.2699        11.1193
     23   0.2598   0.7899        0.2166       0.9057        0.2671        11.1042
     24   0.2634   0.7854        0.2162       0.9093        0.2732        11.1787
Stopping since valid_loss has not improved in the last 10 epochs.
[32m[I 2023-05-02 13:17:09,990][0m Trial 134 finished with value: 0.26518253877560777 and parameters: {'lr': 0.0013481702954555106, 'dropout': 0.42659824512162436, 'd_model_multiplier': 1, 'num_layers': 2, 'n_heads': 32, 'dim_feedforward': 428, 'batch_size': 50, 'pos_encoding': 'learnable', 'activation': 'gelu', 'norm': 'BatchNorm', 'optimizer_name': 'PlainRAdam', 'weight_decay': 0, 'top_n_features': 134}. Best is trial 117 with value: 0.191397856754288.[0m
[FileBasedDataset] Initializing dataset...
	Examples: 8264
	Features: 121
	Max length: 315
Standard scalar turned ON, loading params from cache
[FileBasedDataset] Dataset initialization complete
  epoch    auprc    auroc    train_loss    valid_acc    valid_loss    cp      dur
-------  -------  -------  ------------  -----------  ------------  ----  -------
      1   [36m0.2172[0m   [32m0.7038[0m        [35m0.3466[0m       [31m0.9202[0m        [94m0.3004[0m     +  27.6820
      2   [36m0.2176[0m   0.6969        [35m0.3332[0m       [31m0.9287[0m        [94m0.2366[0m     +  27.8468
      3   [36m0.2201[0m   [32m0.7296[0m        [35m0.2849[0m       0.9021        0.2891        27.9391
      4   0.1721   0.7139        [35m0.2752[0m       0.9262        0.2615        27.7728
      5   [36m0.2253[0m   0.7257        [35m0.2613[0m       0.9262        0.2412        27.6992
      6   [36m0.2564[0m   [32m0.7347[0m        0.2619       0.9262        0.2388        27.8266
      7   0.2112   0.7258        [35m0.2599[0m       0.9274        [94m0.2349[0m     +  27.8483
      8   0.2025   0.7199        [35m0.2568[0m       0.9274        [94m0.2332[0m     +  27.9155
      9   0.2132   0.7329        0.2577       0.9274        [94m0.2292[0m     +  27.7966
     10   0.2240   0.7301        [35m0.2544[0m       0.9287        0.2340        27.8134
     11   0.2129   0.7329        0.2546       0.9274        [94m0.2291[0m     +  27.9172
     12   0.2218   0.7277        [35m0.2542[0m       0.9274        0.2326        27.7572
     13   0.2346   0.7336        0.2553       0.9274        0.2348        27.8057
     14   0.2104   0.7255        0.2547       0.9274        0.2294        27.9023
     15   0.2227   [32m0.7351[0m        [35m0.2520[0m       0.9274        [94m0.2290[0m     +  27.7133
     16   0.2256   0.7319        0.2555       0.9274        0.2300        27.8008
     17   0.2254   0.7287        0.2532       0.9287        0.2309        27.8653
     18   0.2407   0.7316        0.2535       0.9274        0.2300        27.7686
     19   0.2162   0.7250        [35m0.2517[0m       0.9287        0.2309        27.8808
     20   0.2169   0.7242        0.2520       0.9287        0.2329        27.8604
     21   0.2231   0.7337        0.2525       0.9287        0.2299        27.9013
     22   0.2430   [32m0.7384[0m        [35m0.2512[0m       0.9287        0.2297        27.7362
     23   0.2310   [32m0.7403[0m        0.2514       0.9287        0.2306        27.8109
     24   0.2343   0.7329        [35m0.2508[0m       0.9287        0.2291        27.9551
     25   0.2444   0.7379        0.2515       0.9287        [94m0.2289[0m     +  27.7593
     26   0.2429   0.7354        0.2510       0.9287        [94m0.2284[0m     +  27.7972
     27   0.2466   [32m0.7406[0m        0.2665       0.9287        0.2291        27.7218
     28   0.2307   0.7347        0.2555       0.9287        0.2320        27.6388
     29   0.2439   0.7376        0.2514       0.9274        [94m0.2279[0m     +  27.6726
     30   0.2350   0.7373        0.2517       0.9287        0.2290        27.9538
     31   0.2335   0.7368        0.2527       0.9287        0.2293        27.9125
     32   0.2485   0.7361        0.2522       0.9287        0.2286        27.7265
     33   0.2432   0.7362        0.2509       0.9287        0.2294        27.6515
     34   0.2396   [32m0.7416[0m        0.2533       0.9274        [94m0.2275[0m     +  27.9290
     35   0.2320   0.7374        0.2572       0.9287        0.2311        27.7639
     36   0.2409   0.7377        [35m0.2507[0m       0.9274        0.2276        27.6808
     37   0.2543   0.7353        0.2561       0.9287        0.2315        27.7739
     38   0.2432   0.7403        0.2574       0.9287        [94m0.2271[0m     +  27.7748
     39   0.2283   0.7385        0.2512       0.9287        0.2301        27.7790
     40   0.2463   0.7402        [35m0.2498[0m       0.9274        0.2274        27.8567
     41   0.2454   0.7390        0.2519       0.9274        0.2278        27.7687
     42   0.2502   [32m0.7432[0m        0.2509       0.9274        [94m0.2263[0m     +  28.0731
     43   0.2467   0.7422        0.2507       0.9274        0.2276        27.9081
     44   0.2481   0.7404        0.2507       0.9287        0.2285        27.8371
     45   0.2465   0.7379        0.2512       0.9287        0.2309        27.8170
     46   0.2402   0.7386        0.2510       0.9274        0.2285        28.0373
     47   0.2448   0.7423        0.2509       0.9274        0.2290        27.9253
     48   0.2449   [32m0.7464[0m        0.2499       0.9287        0.2298        27.8411
     49   0.2523   0.7442        0.2508       0.9287        0.2297        27.8704
     50   0.2450   0.7397        0.2509       0.9287        0.2288        27.7086
[32m[I 2023-05-02 13:40:23,585][0m Trial 135 finished with value: 0.2262772197014187 and parameters: {'lr': 0.003188447953973845, 'dropout': 0.3605576496668373, 'd_model_multiplier': 1, 'num_layers': 4, 'n_heads': 64, 'dim_feedforward': 412, 'batch_size': 16, 'pos_encoding': 'learnable', 'activation': 'relu', 'norm': 'BatchNorm', 'optimizer_name': 'AdamW', 'weight_decay': 0, 'top_n_features': 121}. Best is trial 117 with value: 0.191397856754288.[0m
[FileBasedDataset] Initializing dataset...
	Examples: 8264
	Features: 227
	Max length: 315
Standard scalar turned ON, loading params from cache
[FileBasedDataset] Dataset initialization complete
  epoch    auprc    auroc    train_loss    valid_acc    valid_loss    cp     dur
-------  -------  -------  ------------  -----------  ------------  ----  ------
      1   [36m0.2035[0m   [32m0.6893[0m        [35m0.2890[0m       [31m0.9166[0m        [94m0.2801[0m     +  9.3697
      2   0.1887   0.6849        [35m0.2683[0m       0.9129        0.2927        9.1133
      3   0.1801   0.6803        [35m0.2621[0m       [31m0.9178[0m        0.2836        9.6053
      4   0.1817   0.6749        [35m0.2609[0m       0.9154        0.2926        9.1834
      5   0.1735   0.6738        [35m0.2585[0m       0.9069        0.3070        9.2083
      6   0.1816   0.6726        0.2629       0.9154        0.2932        9.6243
      7   0.2034   0.6723        0.2613       [31m0.9202[0m        [94m0.2786[0m     +  9.6752
      8   [36m0.2080[0m   0.6734        0.2613       0.9178        0.2892        9.6797
      9   0.1835   0.6718        0.2605       0.9105        0.2908        9.6921
     10   [36m0.2162[0m   0.6750        0.2586       0.9202        [94m0.2705[0m     +  9.7348
     11   0.1849   [32m0.6979[0m        [35m0.2582[0m       0.9190        [94m0.2685[0m     +  9.5894
     12   0.2058   0.6779        [35m0.2579[0m       0.9202        [94m0.2647[0m     +  9.4354
     13   0.1824   0.6744        [35m0.2574[0m       0.9081        0.2925        9.5500
     14   0.1814   0.6805        0.2582       0.9202        0.2677        9.4779
     15   [36m0.2204[0m   0.6846        [35m0.2569[0m       0.9202        0.2677        9.3395
     16   0.1865   0.6767        0.2590       0.9202        0.2688        9.3308
     17   0.1883   0.6892        [35m0.2562[0m       0.9141        0.2702        9.5580
     18   0.1843   0.6925        0.2567       0.9117        0.2771        9.4133
     19   0.2014   [32m0.7092[0m        [35m0.2530[0m       0.9008        0.2789        9.4493
     20   0.2188   0.6931        [35m0.2520[0m       [31m0.9214[0m        0.2711        9.2951
     21   0.2141   [32m0.7260[0m        0.2520       0.9081        0.2702        9.4071
Stopping since valid_loss has not improved in the last 10 epochs.
