[32m[I 2023-05-05 05:21:13,334][0m Trial 551 finished with value: 0.25837419212693313 and parameters: {'lr': 2.844544289299414e-06, 'dropout': 0.548651115937647, 'd_model_multiplier': 4, 'num_layers': 8, 'n_heads': 4, 'dim_feedforward': 321, 'batch_size': 27, 'pos_encoding': 'fixed', 'activation': 'relu', 'norm': 'LayerNorm', 'optimizer_name': 'AdamW', 'weight_decay': 0.001, 'top_n_features': 67}. Best is trial 246 with value: 0.16447311791139763.[0m
[FileBasedDataset] Initializing dataset...
	Examples: 8264
	Features: 47
	Max length: 315
Standard scalar turned ON, loading params from cache
[FileBasedDataset] Dataset initialization complete
  epoch    auprc    auroc    train_loss    valid_acc    valid_loss    cp      dur
-------  -------  -------  ------------  -----------  ------------  ----  -------
      1   [36m0.1093[0m   [32m0.4632[0m        [35m0.5933[0m       [31m0.9093[0m        [94m0.4639[0m     +  26.9483
      2   0.1084   [32m0.4660[0m        [35m0.4307[0m       0.9093        [94m0.3647[0m     +  26.8964
      3   [36m0.1161[0m   [32m0.5205[0m        [35m0.3541[0m       0.9093        [94m0.3230[0m     +  27.1908
      4   [36m0.1268[0m   [32m0.5888[0m        [35m0.3129[0m       0.9093        [94m0.3046[0m     +  27.0948
      5   [36m0.1479[0m   [32m0.6439[0m        [35m0.2900[0m       0.9093        [94m0.2948[0m     +  27.2626
      6   [36m0.1692[0m   [32m0.6830[0m        [35m0.2761[0m       0.9093        [94m0.2891[0m     +  27.0949
      7   [36m0.1919[0m   [32m0.7081[0m        [35m0.2688[0m       0.9093        [94m0.2851[0m     +  27.2719
      8   [36m0.2034[0m   [32m0.7232[0m        [35m0.2632[0m       0.9093        [94m0.2822[0m     +  27.2546
      9   [36m0.2187[0m   [32m0.7354[0m        [35m0.2572[0m       0.9093        [94m0.2802[0m     +  27.0129
     10   [36m0.2418[0m   [32m0.7477[0m        [35m0.2518[0m       0.9093        [94m0.2776[0m     +  26.9512
     11   [36m0.2554[0m   [32m0.7574[0m        [35m0.2489[0m       0.9093        [94m0.2748[0m     +  27.0641
     12   [36m0.2655[0m   [32m0.7661[0m        [35m0.2462[0m       0.9093        [94m0.2723[0m     +  27.0877
     13   [36m0.2755[0m   [32m0.7733[0m        [35m0.2437[0m       [31m0.9105[0m        [94m0.2701[0m     +  27.1481
     14   [36m0.2946[0m   [32m0.7808[0m        [35m0.2424[0m       0.9105        [94m0.2680[0m     +  26.9954
     15   [36m0.3056[0m   [32m0.7883[0m        [35m0.2411[0m       0.9105        [94m0.2659[0m     +  27.0260
     16   [36m0.3111[0m   [32m0.7921[0m        [35m0.2391[0m       0.9093        [94m0.2641[0m     +  27.0317
     17   [36m0.3156[0m   [32m0.7955[0m        [35m0.2384[0m       [31m0.9117[0m        [94m0.2629[0m     +  27.1703
     18   [36m0.3190[0m   [32m0.7980[0m        [35m0.2373[0m       [31m0.9129[0m        [94m0.2615[0m     +  27.1558
     19   [36m0.3228[0m   [32m0.8009[0m        [35m0.2351[0m       0.9105        [94m0.2605[0m     +  27.2630
     20   [36m0.3295[0m   [32m0.8029[0m        [35m0.2349[0m       0.9105        [94m0.2600[0m     +  26.9555
     21   [36m0.3324[0m   [32m0.8048[0m        [35m0.2335[0m       0.9093        [94m0.2594[0m     +  27.0591
     22   [36m0.3354[0m   [32m0.8054[0m        0.2337       0.9081        [94m0.2590[0m     +  27.1235
     23   [36m0.3399[0m   [32m0.8064[0m        0.2336       0.9081        [94m0.2590[0m     +  27.1703
     24   0.3380   [32m0.8067[0m        [35m0.2332[0m       0.9081        [94m0.2582[0m     +  27.0671
     25   [36m0.3402[0m   [32m0.8071[0m        0.2337       0.9081        [94m0.2580[0m     +  27.0884
     26   [36m0.3416[0m   0.8070        [35m0.2316[0m       0.9081        [94m0.2577[0m     +  27.1690
     27   [36m0.3418[0m   [32m0.8074[0m        0.2330       0.9081        0.2578        27.1227
     28   [36m0.3418[0m   [32m0.8075[0m        [35m0.2302[0m       0.9081        [94m0.2574[0m     +  27.1456
     29   [36m0.3423[0m   0.8073        0.2305       0.9081        0.2574        27.3740
     30   [36m0.3427[0m   0.8071        0.2315       0.9081        [94m0.2573[0m     +  27.5132
     31   0.3425   0.8069        [35m0.2302[0m       0.9081        [94m0.2572[0m     +  27.0049
     32   [36m0.3477[0m   0.8069        [35m0.2300[0m       0.9081        [94m0.2569[0m     +  27.2186
     33   0.3461   0.8069        0.2309       0.9081        0.2570        27.1987
     34   0.3462   0.8071        0.2302       0.9081        [94m0.2569[0m     +  27.1095
     35   0.3464   0.8070        0.2318       0.9081        0.2569        27.1688
     36   0.3412   0.8067        [35m0.2291[0m       0.9069        [94m0.2569[0m     +  27.1748
     37   0.3410   0.8065        0.2296       0.9069        [94m0.2568[0m     +  27.2176
     38   0.3416   0.8062        [35m0.2289[0m       0.9069        [94m0.2566[0m     +  27.2269
     39   0.3446   0.8065        [35m0.2280[0m       0.9069        0.2567        27.0769
     40   0.3453   0.8060        0.2302       0.9069        [94m0.2563[0m     +  27.2808
     41   0.3457   0.8063        0.2300       0.9081        [94m0.2563[0m     +  27.1261
     42   0.3466   0.8060        0.2284       0.9081        [94m0.2562[0m     +  27.0719
     43   0.3465   0.8060        0.2296       0.9081        [94m0.2562[0m     +  27.1175
     44   0.3466   0.8058        0.2293       0.9081        0.2563        27.1915
     45   0.3453   0.8060        0.2292       0.9081        0.2563        27.1431
     46   0.3451   0.8060        [35m0.2279[0m       0.9081        0.2564        27.0299
     47   0.3456   0.8065        [35m0.2274[0m       0.9093        0.2563        27.1760
     48   0.3447   0.8063        0.2297       0.9093        [94m0.2562[0m     +  27.0622
     49   0.3441   0.8057        0.2292       0.9093        [94m0.2562[0m     +  27.1264
     50   0.3418   0.8054        0.2302       0.9093        0.2563        27.1899
[32m[I 2023-05-05 05:43:55,071][0m Trial 552 finished with value: 0.2561874202212731 and parameters: {'lr': 2.060242550008125e-06, 'dropout': 0.5105229319987684, 'd_model_multiplier': 4, 'num_layers': 6, 'n_heads': 32, 'dim_feedforward': 238, 'batch_size': 39, 'pos_encoding': 'fixed', 'activation': 'relu', 'norm': 'LayerNorm', 'optimizer_name': 'AdamW', 'weight_decay': 0.001, 'top_n_features': 47}. Best is trial 246 with value: 0.16447311791139763.[0m
[FileBasedDataset] Initializing dataset...
	Examples: 8264
	Features: 63
	Max length: 315
Standard scalar turned ON, loading params from cache
[FileBasedDataset] Dataset initialization complete
  epoch    auprc    auroc    train_loss    valid_acc    valid_loss    cp      dur
-------  -------  -------  ------------  -----------  ------------  ----  -------
      1   [36m0.0698[0m   [32m0.4957[0m        [35m0.4093[0m       [31m0.9287[0m        [94m0.2705[0m     +  19.9246
      2   [36m0.1694[0m   [32m0.6649[0m        [35m0.2759[0m       0.9287        [94m0.2422[0m     +  19.8049
      3   [36m0.2135[0m   [32m0.7038[0m        [35m0.2599[0m       0.9287        [94m0.2343[0m     +  20.1693
      4   [36m0.2361[0m   [32m0.7245[0m        [35m0.2525[0m       0.9287        [94m0.2313[0m     +  19.8620
      5   [36m0.2617[0m   [32m0.7396[0m        [35m0.2491[0m       [31m0.9299[0m        [94m0.2291[0m     +  20.0813
      6   [36m0.2715[0m   [32m0.7487[0m        [35m0.2464[0m       0.9299        [94m0.2282[0m     +  19.9934
      7   [36m0.2720[0m   [32m0.7532[0m        [35m0.2422[0m       [31m0.9311[0m        0.2294        19.9941
      8   [36m0.2796[0m   0.7477        [35m0.2398[0m       0.9311        0.2324        19.9973
      9   0.2773   0.7456        0.2398       0.9299        0.2339        20.0291
     10   0.2735   0.7456        [35m0.2372[0m       0.9299        0.2352        20.1378
     11   0.2761   0.7489        [35m0.2371[0m       0.9299        0.2351        20.0220
     12   0.2788   0.7504        [35m0.2347[0m       0.9299        0.2349        20.0137
     13   [36m0.2803[0m   0.7500        [35m0.2345[0m       0.9287        0.2363        20.0139
     14   [36m0.2824[0m   [32m0.7543[0m        0.2360       0.9287        0.2348        19.9476
     15   [36m0.2851[0m   [32m0.7554[0m        [35m0.2341[0m       0.9299        0.2346        20.0312
Stopping since valid_loss has not improved in the last 10 epochs.
[32m[I 2023-05-05 05:49:15,769][0m Trial 553 finished with value: 0.22818843064494115 and parameters: {'lr': 1.1046312984172524e-05, 'dropout': 0.5639442818469321, 'd_model_multiplier': 4, 'num_layers': 4, 'n_heads': 32, 'dim_feedforward': 343, 'batch_size': 34, 'pos_encoding': 'fixed', 'activation': 'relu', 'norm': 'LayerNorm', 'optimizer_name': 'AdamW', 'weight_decay': 0.001, 'top_n_features': 63}. Best is trial 246 with value: 0.16447311791139763.[0m
[FileBasedDataset] Initializing dataset...
	Examples: 8264
	Features: 132
	Max length: 315
Standard scalar turned ON, loading params from cache
[FileBasedDataset] Dataset initialization complete
  epoch    auprc    auroc    train_loss    valid_acc    valid_loss    cp      dur
-------  -------  -------  ------------  -----------  ------------  ----  -------
      1   [36m0.1222[0m   [32m0.5998[0m        [35m0.2937[0m       [31m0.9323[0m        [94m0.2491[0m     +  39.8937
      2   [36m0.1240[0m   [32m0.6187[0m        [35m0.2411[0m       0.9323        0.2539        40.0315
      3   [36m0.1392[0m   [32m0.6356[0m        [35m0.2337[0m       0.9262        0.2570        40.3565
      4   [36m0.1429[0m   [32m0.6432[0m        [35m0.2306[0m       0.9238        0.2596        40.3529
      5   0.1418   [32m0.6523[0m        [35m0.2270[0m       0.9226        0.2613        40.2908
      6   [36m0.1445[0m   [32m0.6556[0m        [35m0.2241[0m       0.9250        0.2622        40.0996
      7   [36m0.1492[0m   [32m0.6635[0m        [35m0.2237[0m       0.9226        0.2614        40.1843
      8   0.1439   [32m0.6672[0m        [35m0.2204[0m       0.9178        0.2644        40.1135
      9   0.1439   0.6649        [35m0.2190[0m       0.9238        0.2648        40.0236
     10   0.1444   0.6630        [35m0.2163[0m       0.9202        0.2653        40.0472
Stopping since valid_loss has not improved in the last 10 epochs.
[32m[I 2023-05-05 05:56:37,620][0m Trial 554 finished with value: 0.2490809207293402 and parameters: {'lr': 2.428352771875113e-05, 'dropout': 0.2152879432534969, 'd_model_multiplier': 2, 'num_layers': 5, 'n_heads': 64, 'dim_feedforward': 448, 'batch_size': 30, 'pos_encoding': 'fixed', 'activation': 'relu', 'norm': 'LayerNorm', 'optimizer_name': 'AdamW', 'weight_decay': 0.001, 'top_n_features': 132}. Best is trial 246 with value: 0.16447311791139763.[0m
[FileBasedDataset] Initializing dataset...
	Examples: 8264
	Features: 83
	Max length: 315
Standard scalar turned ON, loading params from cache
[FileBasedDataset] Dataset initialization complete
  epoch    auprc    auroc    train_loss    valid_acc    valid_loss    cp      dur
-------  -------  -------  ------------  -----------  ------------  ----  -------
      1   [36m0.2131[0m   [32m0.7273[0m        [35m0.6959[0m       [31m0.5550[0m        [94m0.6901[0m     +  27.2234
      2   0.2105   0.7236        [35m0.6923[0m       [31m0.5792[0m        [94m0.6866[0m     +  27.5417
      3   0.2070   0.7198        [35m0.6890[0m       [31m0.6046[0m        [94m0.6831[0m     +  27.4361
      4   0.2025   0.7147        [35m0.6851[0m       [31m0.6191[0m        [94m0.6796[0m     +  27.3012
      5   0.1981   0.7098        [35m0.6808[0m       [31m0.6336[0m        [94m0.6762[0m     +  27.2725
      6   0.1946   0.7052        [35m0.6795[0m       [31m0.6445[0m        [94m0.6728[0m     +  27.4717
      7   0.1896   0.7001        [35m0.6748[0m       [31m0.6578[0m        [94m0.6694[0m     +  27.1071
      8   0.1849   0.6946        [35m0.6731[0m       [31m0.6747[0m        [94m0.6660[0m     +  27.2808
      9   0.1802   0.6891        [35m0.6686[0m       [31m0.6929[0m        [94m0.6627[0m     +  27.5021
     10   0.1750   0.6829        [35m0.6651[0m       [31m0.7050[0m        [94m0.6594[0m     +  27.2256
     11   0.1692   0.6754        [35m0.6648[0m       [31m0.7207[0m        [94m0.6561[0m     +  27.6131
     12   0.1633   0.6682        [35m0.6600[0m       [31m0.7328[0m        [94m0.6528[0m     +  27.5155
     13   0.1579   0.6611        [35m0.6575[0m       [31m0.7533[0m        [94m0.6496[0m     +  27.5850
     14   0.1535   0.6551        [35m0.6551[0m       [31m0.7582[0m        [94m0.6463[0m     +  27.2923
     15   0.1492   0.6488        [35m0.6531[0m       [31m0.7703[0m        [94m0.6431[0m     +  27.4008
     16   0.1437   0.6420        [35m0.6500[0m       [31m0.7763[0m        [94m0.6400[0m     +  27.7261
     17   0.1358   0.6348        [35m0.6469[0m       [31m0.7811[0m        [94m0.6368[0m     +  27.4023
     18   0.1307   0.6289        [35m0.6428[0m       [31m0.8017[0m        [94m0.6337[0m     +  27.4320
     19   0.1249   0.6218        [35m0.6389[0m       [31m0.8102[0m        [94m0.6306[0m     +  27.2107
     20   0.1197   0.6149        [35m0.6373[0m       [31m0.8235[0m        [94m0.6275[0m     +  27.3183
     21   0.1158   0.6084        [35m0.6348[0m       [31m0.8331[0m        [94m0.6244[0m     +  27.2902
     22   0.1116   0.6017        [35m0.6321[0m       [31m0.8476[0m        [94m0.6214[0m     +  27.3260
     23   0.1082   0.5941        [35m0.6289[0m       [31m0.8513[0m        [94m0.6184[0m     +  27.4654
     24   0.1057   0.5872        [35m0.6261[0m       [31m0.8609[0m        [94m0.6154[0m     +  27.1733
     25   0.1034   0.5802        [35m0.6239[0m       [31m0.8682[0m        [94m0.6124[0m     +  27.3807
     26   0.1013   0.5735        [35m0.6214[0m       [31m0.8742[0m        [94m0.6095[0m     +  27.3856
     27   0.0998   0.5661        [35m0.6192[0m       [31m0.8815[0m        [94m0.6066[0m     +  27.2805
     28   0.0986   0.5598        [35m0.6166[0m       [31m0.8851[0m        [94m0.6037[0m     +  27.4643
     29   0.0972   0.5521        [35m0.6138[0m       [31m0.8924[0m        [94m0.6008[0m     +  27.5385
     30   0.0965   0.5458        [35m0.6103[0m       [31m0.8948[0m        [94m0.5980[0m     +  27.4546
     31   0.0954   0.5398        [35m0.6088[0m       [31m0.8972[0m        [94m0.5951[0m     +  27.6159
     32   0.0954   0.5341        [35m0.6055[0m       [31m0.9021[0m        [94m0.5923[0m     +  27.4197
     33   0.1021   0.5286        [35m0.6030[0m       [31m0.9045[0m        [94m0.5896[0m     +  27.4050
     34   0.1014   0.5237        [35m0.6016[0m       [31m0.9093[0m        [94m0.5868[0m     +  27.4950
     35   0.1007   0.5182        [35m0.5995[0m       [31m0.9141[0m        [94m0.5841[0m     +  27.6342
     36   0.0923   0.5130        [35m0.5975[0m       [31m0.9166[0m        [94m0.5814[0m     +  27.2551
     37   0.0870   0.5075        [35m0.5931[0m       [31m0.9178[0m        [94m0.5787[0m     +  27.4788
     38   0.0856   0.5023        [35m0.5894[0m       [31m0.9190[0m        [94m0.5760[0m     +  27.4525
     39   0.0838   0.4972        0.5899       [31m0.9202[0m        [94m0.5734[0m     +  27.4679
     40   0.0844   0.4923        [35m0.5861[0m       [31m0.9214[0m        [94m0.5708[0m     +  27.4753
     41   0.0834   0.4872        [35m0.5854[0m       0.9214        [94m0.5682[0m     +  27.5097
     42   0.0853   0.4822        [35m0.5805[0m       0.9214        [94m0.5656[0m     +  27.2380
     43   0.0843   0.4776        [35m0.5793[0m       0.9214        [94m0.5630[0m     +  27.5089
     44   0.0833   0.4724        [35m0.5775[0m       0.9214        [94m0.5605[0m     +  27.2457
     45   0.0904   0.4686        [35m0.5737[0m       0.9214        [94m0.5580[0m     +  27.5993
     46   0.0897   0.4643        [35m0.5721[0m       0.9214        [94m0.5555[0m     +  27.5073
     47   0.0894   0.4606        [35m0.5704[0m       0.9214        [94m0.5530[0m     +  27.2777
     48   0.0888   0.4561        [35m0.5681[0m       0.9214        [94m0.5506[0m     +  27.2119
     49   0.0882   0.4518        [35m0.5660[0m       0.9214        [94m0.5481[0m     +  27.3869
     50   0.0878   0.4482        [35m0.5635[0m       0.9214        [94m0.5457[0m     +  27.4615
[32m[I 2023-05-05 06:19:34,279][0m Trial 555 finished with value: 0.5457392741431636 and parameters: {'lr': 2.2331047463691933e-08, 'dropout': 0.47556423566833156, 'd_model_multiplier': 4, 'num_layers': 6, 'n_heads': 32, 'dim_feedforward': 329, 'batch_size': 45, 'pos_encoding': 'fixed', 'activation': 'relu', 'norm': 'LayerNorm', 'optimizer_name': 'AdamW', 'weight_decay': 0.001, 'top_n_features': 83}. Best is trial 246 with value: 0.16447311791139763.[0m
[FileBasedDataset] Initializing dataset...
	Examples: 8264
	Features: 71
	Max length: 315
Standard scalar turned ON, loading params from cache
[FileBasedDataset] Dataset initialization complete
  epoch    auprc    auroc    train_loss    valid_acc    valid_loss    cp      dur
-------  -------  -------  ------------  -----------  ------------  ----  -------
      1   [36m0.0946[0m   [32m0.5721[0m        [35m0.4632[0m       [31m0.9250[0m        [94m0.2769[0m     +  12.6516
      2   [36m0.2299[0m   [32m0.7245[0m        [35m0.2632[0m       0.9238        [94m0.2383[0m     +  12.8508
      3   [36m0.2426[0m   [32m0.7433[0m        [35m0.2416[0m       0.9214        [94m0.2339[0m     +  12.7385
      4   [36m0.2481[0m   0.7429        [35m0.2348[0m       0.9226        [94m0.2337[0m     +  12.6646
      5   [36m0.2615[0m   [32m0.7460[0m        [35m0.2304[0m       0.9238        0.2337        12.7071
      6   [36m0.2740[0m   [32m0.7515[0m        [35m0.2286[0m       0.9238        [94m0.2334[0m     +  12.8356
      7   0.2703   [32m0.7561[0m        [35m0.2264[0m       [31m0.9262[0m        [94m0.2333[0m     +  12.7654
      8   0.2711   [32m0.7587[0m        [35m0.2249[0m       0.9262        0.2351        12.9453
      9   [36m0.2756[0m   [32m0.7620[0m        [35m0.2231[0m       [31m0.9274[0m        0.2342        13.0197
     10   0.2700   [32m0.7623[0m        [35m0.2208[0m       0.9274        0.2349        12.6047
     11   0.2678   [32m0.7641[0m        [35m0.2182[0m       0.9250        0.2356        12.6919
     12   0.2617   0.7635        [35m0.2177[0m       0.9250        0.2371        12.8377
     13   0.2610   [32m0.7651[0m        [35m0.2145[0m       0.9250        0.2385        12.7655
     14   0.2488   0.7637        [35m0.2124[0m       0.9238        0.2397        12.8358
     15   0.2522   [32m0.7655[0m        [35m0.2118[0m       0.9250        0.2388        12.8233
     16   0.2498   [32m0.7655[0m        [35m0.2100[0m       0.9214        0.2401        12.8304
Stopping since valid_loss has not improved in the last 10 epochs.
[32m[I 2023-05-05 06:23:12,463][0m Trial 556 finished with value: 0.23327785980816765 and parameters: {'lr': 7.038242655052855e-05, 'dropout': 0.24175942501453535, 'd_model_multiplier': 4, 'num_layers': 4, 'n_heads': 16, 'dim_feedforward': 230, 'batch_size': 38, 'pos_encoding': 'learnable', 'activation': 'relu', 'norm': 'LayerNorm', 'optimizer_name': 'RAdam', 'weight_decay': 0.001, 'top_n_features': 71}. Best is trial 246 with value: 0.16447311791139763.[0m
[FileBasedDataset] Initializing dataset...
	Examples: 8264
	Features: 54
	Max length: 315
Standard scalar turned ON, loading params from cache
[FileBasedDataset] Dataset initialization complete
  epoch    auprc    auroc    train_loss    valid_acc    valid_loss    cp      dur
-------  -------  -------  ------------  -----------  ------------  ----  -------
      1   [36m0.2116[0m   [32m0.7445[0m        [35m0.9289[0m       [31m0.9166[0m        [94m0.2392[0m     +  47.3694
      2   [36m0.2355[0m   0.7334        [35m0.2781[0m       0.8815        0.2879        47.5619
      3   0.2258   [32m0.7492[0m        [35m0.2684[0m       [31m0.9262[0m        0.2549        47.6596
      4   0.2188   0.7434        [35m0.2637[0m       0.9262        0.2916        47.5166
      5   0.2068   0.7444        [35m0.2600[0m       [31m0.9274[0m        0.3032        47.5566
      6   0.2241   0.7439        0.2617       0.9008        0.2953        47.5940
      7   0.2137   [32m0.7506[0m        [35m0.2583[0m       [31m0.9287[0m        0.2833        47.6288
      8   0.1953   0.7489        [35m0.2577[0m       0.9287        0.2797        47.5827
      9   0.1897   0.7395        [35m0.2562[0m       0.9274        0.3476        47.5376
     10   0.2039   0.7498        0.2566       0.9287        0.2823        47.2336
Stopping since valid_loss has not improved in the last 10 epochs.
