[32m[I 2023-05-03 05:35:41,404][0m Trial 285 finished with value: 0.29251243941657057 and parameters: {'lr': 0.0017401175356843187, 'dropout': 0.5916697230062891, 'd_model_multiplier': 1, 'num_layers': 1, 'n_heads': 32, 'dim_feedforward': 407, 'batch_size': 45, 'pos_encoding': 'fixed', 'activation': 'relu', 'norm': 'LayerNorm', 'optimizer_name': 'RAdam', 'weight_decay': 0.1, 'top_n_features': 45}. Best is trial 246 with value: 0.16447311791139763.[0m
[FileBasedDataset] Initializing dataset...
	Examples: 8264
	Features: 42
	Max length: 315
Standard scalar turned ON, loading params from cache
[FileBasedDataset] Dataset initialization complete
  epoch    auprc    auroc    train_loss    valid_acc    valid_loss    cp     dur
-------  -------  -------  ------------  -----------  ------------  ----  ------
      1   [36m0.1163[0m   [32m0.5994[0m        [35m0.3971[0m       [31m0.9262[0m        [94m0.2611[0m     +  8.2160
      2   [36m0.2172[0m   [32m0.7261[0m        [35m0.2628[0m       0.9250        [94m0.2435[0m     +  9.4401
      3   [36m0.2453[0m   [32m0.7496[0m        [35m0.2531[0m       0.9250        [94m0.2435[0m     +  9.4240
      4   [36m0.2471[0m   0.7448        [35m0.2464[0m       0.9226        0.2478        9.4445
      5   [36m0.2525[0m   0.7450        [35m0.2414[0m       0.9166        0.2568        9.2787
      6   0.2287   0.7381        [35m0.2383[0m       0.9129        0.2669        9.4441
      7   0.2493   [32m0.7554[0m        0.2387       0.9238        0.2471        9.3861
      8   [36m0.2590[0m   [32m0.7645[0m        0.2405       0.9226        0.2470        9.1923
      9   [36m0.2775[0m   [32m0.7656[0m        0.2404       0.9214        0.2468        9.7920
     10   0.2743   [32m0.7683[0m        [35m0.2345[0m       0.9166        0.2537        9.4763
     11   0.2601   0.7681        [35m0.2340[0m       0.9178        0.2561        9.7074
Stopping since valid_loss has not improved in the last 10 epochs.
[32m[I 2023-05-03 05:37:33,463][0m Trial 286 finished with value: 0.24352872139011864 and parameters: {'lr': 0.0023304671043652614, 'dropout': 0.6181389721189603, 'd_model_multiplier': 1, 'num_layers': 1, 'n_heads': 16, 'dim_feedforward': 397, 'batch_size': 82, 'pos_encoding': 'fixed', 'activation': 'relu', 'norm': 'LayerNorm', 'optimizer_name': 'RAdam', 'weight_decay': 0.1, 'top_n_features': 42}. Best is trial 246 with value: 0.16447311791139763.[0m
[FileBasedDataset] Initializing dataset...
	Examples: 8264
	Features: 22
	Max length: 315
Standard scalar turned ON, loading params from cache
[FileBasedDataset] Dataset initialization complete
  epoch    auprc    auroc    train_loss    valid_acc    valid_loss    cp     dur
-------  -------  -------  ------------  -----------  ------------  ----  ------
      1   [36m0.3569[0m   [32m0.7884[0m        [35m0.3055[0m       [31m0.9105[0m        [94m0.2627[0m     +  8.3076
      2   [36m0.4160[0m   [32m0.8206[0m        [35m0.2482[0m       [31m0.9250[0m        [94m0.2486[0m     +  9.1519
      3   [36m0.4324[0m   [32m0.8325[0m        [35m0.2456[0m       [31m0.9262[0m        [94m0.2425[0m     +  9.0626
      4   0.4310   [32m0.8350[0m        [35m0.2446[0m       0.9250        0.2433        8.7647
      5   [36m0.4402[0m   [32m0.8373[0m        0.2448       0.9214        0.2452        9.0477
      6   [36m0.4448[0m   [32m0.8410[0m        [35m0.2388[0m       0.9262        [94m0.2384[0m     +  9.3073
      7   [36m0.4705[0m   [32m0.8462[0m        [35m0.2379[0m       [31m0.9287[0m        [94m0.2380[0m     +  9.2248
      8   [36m0.4747[0m   [32m0.8482[0m        [35m0.2377[0m       0.9262        [94m0.2348[0m     +  9.0419
      9   [36m0.4962[0m   [32m0.8578[0m        [35m0.2336[0m       0.9262        [94m0.2285[0m     +  9.1652
     10   0.4932   0.8560        [35m0.2310[0m       0.9202        [94m0.2264[0m     +  9.1762
     11   0.4913   0.8562        [35m0.2296[0m       0.9202        [94m0.2241[0m     +  9.0113
     12   0.4950   0.8539        0.2304       0.9238        0.2242        9.3140
     13   [36m0.4988[0m   0.8540        0.2305       0.9250        0.2249        9.1134
     14   [36m0.4998[0m   [32m0.8593[0m        [35m0.2278[0m       0.9274        [94m0.2232[0m     +  8.9675
     15   [36m0.5292[0m   0.8579        [35m0.2256[0m       0.9226        0.2238        9.0625
     16   [36m0.5356[0m   0.8537        0.2281       0.9238        [94m0.2231[0m     +  9.1975
     17   [36m0.5405[0m   0.8489        0.2280       0.9226        [94m0.2222[0m     +  8.8976
     18   0.5074   0.8499        [35m0.2248[0m       0.9250        0.2269        9.0179
     19   [36m0.5591[0m   [32m0.8629[0m        [35m0.2241[0m       [31m0.9311[0m        [94m0.2184[0m     +  9.1637
     20   0.5545   0.8581        [35m0.2236[0m       0.9250        [94m0.2182[0m     +  9.1327
     21   0.5407   0.8583        0.2239       0.9262        0.2198        8.8635
     22   0.5124   0.8471        0.2236       0.9178        0.2335        9.0856
     23   0.5554   0.8605        0.2245       0.9250        0.2200        9.0895
     24   0.5207   0.8517        [35m0.2194[0m       0.9238        0.2243        8.7966
     25   0.5428   0.8563        0.2222       0.9299        0.2231        8.8706
     26   0.5307   0.8485        0.2247       0.9238        0.2290        9.1582
     27   0.5276   0.8538        0.2238       0.9262        0.2292        9.1947
     28   [36m0.5639[0m   [32m0.8671[0m        0.2227       0.9262        0.2195        9.3520
     29   0.5071   0.8537        0.2218       0.9238        0.2286        9.0550
Stopping since valid_loss has not improved in the last 10 epochs.
[32m[I 2023-05-03 05:42:05,843][0m Trial 287 finished with value: 0.218155175339354 and parameters: {'lr': 0.0019119016827503755, 'dropout': 0.5844538402310576, 'd_model_multiplier': 1, 'num_layers': 1, 'n_heads': 32, 'dim_feedforward': 411, 'batch_size': 40, 'pos_encoding': 'fixed', 'activation': 'relu', 'norm': 'LayerNorm', 'optimizer_name': 'RAdam', 'weight_decay': 0.1, 'top_n_features': 22}. Best is trial 246 with value: 0.16447311791139763.[0m
[FileBasedDataset] Initializing dataset...
	Examples: 8264
	Features: 60
	Max length: 315
Standard scalar turned ON, loading params from cache
[FileBasedDataset] Dataset initialization complete
  epoch    auprc    auroc    train_loss    valid_acc    valid_loss    cp      dur
-------  -------  -------  ------------  -----------  ------------  ----  -------
      1   [36m0.2348[0m   [32m0.8038[0m        [35m0.2826[0m       [31m0.9250[0m        [94m0.2215[0m     +  10.3996
      2   [36m0.2497[0m   0.8021        [35m0.2547[0m       [31m0.9287[0m        [94m0.2115[0m     +  10.4911
      3   0.2462   0.7756        0.2561       [31m0.9311[0m        0.2262        10.6921
      4   [36m0.2659[0m   0.7904        [35m0.2531[0m       0.9299        0.2217        10.6450
      5   [36m0.2778[0m   0.7843        [35m0.2499[0m       [31m0.9347[0m        [94m0.2087[0m     +  10.5631
      6   0.2626   0.7839        [35m0.2437[0m       0.9323        0.2169        10.6816
      7   0.2653   0.7966        [35m0.2431[0m       0.9347        0.2152        10.5273
      8   0.2609   0.7837        0.2434       0.9347        0.2136        10.6310
      9   0.2644   0.8012        [35m0.2390[0m       0.9311        0.2118        10.6586
     10   0.2516   0.7999        0.2391       0.9323        0.2138        10.9396
     11   0.2645   [32m0.8045[0m        [35m0.2388[0m       0.9335        [94m0.2060[0m     +  10.4035
     12   0.2675   0.8037        0.2403       0.9335        0.2070        10.7923
     13   0.2608   0.7988        [35m0.2369[0m       [31m0.9359[0m        0.2072        10.4879
     14   0.2654   0.8029        [35m0.2365[0m       0.9311        0.2092        10.5146
     15   0.2607   0.7944        0.2390       0.9311        0.2094        10.6689
     16   0.2531   0.7876        0.2375       0.9311        0.2148        10.6286
     17   0.2547   0.8044        0.2401       0.9299        0.2210        10.7507
     18   0.2589   0.7988        0.2405       0.9347        0.2125        10.6812
     19   0.2451   0.8006        0.2409       0.9311        [94m0.2047[0m     +  10.5332
     20   0.2560   0.7904        0.2395       0.9347        0.2091        10.7131
     21   0.2571   0.7816        0.2402       0.9359        [94m0.2031[0m     +  10.5851
     22   0.2710   [32m0.8055[0m        0.2392       0.9250        0.2217        10.5965
     23   0.2460   0.7762        0.2373       0.9311        0.2337        10.7497
     24   0.2568   0.7981        0.2400       0.9323        0.2076        10.6501
     25   0.2464   0.7841        0.2379       0.9323        0.2089        10.5262
     26   0.2638   [32m0.8068[0m        0.2371       0.9335        [94m0.2001[0m     +  10.8657
     27   0.2704   [32m0.8071[0m        0.2391       0.9359        0.2084        10.6060
     28   0.2626   [32m0.8110[0m        0.2406       0.9299        0.2073        10.8281
     29   0.2369   0.8005        0.2380       0.9311        0.2072        10.7006
     30   0.2664   0.8099        0.2394       0.9311        0.2001        10.7231
     31   0.2592   0.8023        0.2397       0.9311        0.2023        10.8822
     32   0.2569   0.7986        0.2373       0.9335        0.2014        11.3673
     33   0.2599   0.7967        0.2395       0.9323        0.2009        10.7044
     34   0.2575   0.7951        0.2402       0.9335        0.2100        10.9055
     35   0.2461   0.7928        0.2386       0.9287        0.2227        10.5844
Stopping since valid_loss has not improved in the last 10 epochs.
[32m[I 2023-05-03 05:48:31,044][0m Trial 288 finished with value: 0.2000684682302348 and parameters: {'lr': 0.002833319197583949, 'dropout': 0.5865107375455123, 'd_model_multiplier': 1, 'num_layers': 1, 'n_heads': 64, 'dim_feedforward': 414, 'batch_size': 49, 'pos_encoding': 'fixed', 'activation': 'relu', 'norm': 'LayerNorm', 'optimizer_name': 'RAdam', 'weight_decay': 0.1, 'top_n_features': 60}. Best is trial 246 with value: 0.16447311791139763.[0m
[FileBasedDataset] Initializing dataset...
	Examples: 8264
	Features: 62
	Max length: 315
Standard scalar turned ON, loading params from cache
[FileBasedDataset] Dataset initialization complete
  epoch    auprc    auroc    train_loss    valid_acc    valid_loss    cp      dur
-------  -------  -------  ------------  -----------  ------------  ----  -------
      1   [36m0.2619[0m   [32m0.7461[0m        [35m0.2845[0m       [31m0.9395[0m        [94m0.2056[0m     +  10.6448
      2   [36m0.2835[0m   [32m0.7600[0m        [35m0.2596[0m       0.9347        [94m0.2014[0m     +  10.8635
      3   0.2649   0.7349        [35m0.2595[0m       [31m0.9407[0m        0.2087        10.9005
      4   0.2741   0.7211        [35m0.2507[0m       [31m0.9420[0m        0.2198        10.8866
      5   0.2817   0.7413        [35m0.2463[0m       0.9407        0.2086        10.7188
      6   0.2805   0.7457        [35m0.2442[0m       [31m0.9444[0m        0.2015        10.4748
      7   [36m0.2986[0m   [32m0.7700[0m        0.2446       0.9444        [94m0.1989[0m     +  10.6258
      8   [36m0.3079[0m   0.7507        [35m0.2421[0m       0.9444        0.2023        10.3625
      9   0.2776   0.7504        [35m0.2410[0m       0.9420        0.2067        10.7602
     10   0.2880   0.7465        [35m0.2402[0m       0.9432        0.2119        10.8815
     11   0.2808   [32m0.7741[0m        [35m0.2385[0m       0.9432        0.2176        10.6281
     12   0.2807   0.7600        0.2414       0.9420        0.2006        10.7148
     13   0.2930   0.7598        0.2442       0.9420        0.2002        10.5915
     14   0.2745   0.7510        0.2401       0.9395        0.2057        10.6888
     15   0.2551   0.7566        0.2394       0.9407        0.2159        10.5824
     16   0.2353   0.7513        0.2419       0.9383        0.2017        10.5659
     17   0.2608   0.7692        0.2450       0.9395        [94m0.1966[0m     +  10.6970
     18   0.2647   0.7555        0.2412       0.9420        0.2032        11.0872
     19   0.2484   0.7543        0.2430       0.9395        0.1997        10.7501
     20   0.2685   0.7680        0.2420       0.9432        0.2084        10.7516
     21   0.2711   0.7699        0.2428       0.9432        [94m0.1965[0m     +  10.6156
     22   0.2682   0.7630        0.2410       0.9407        0.1975        10.9715
     23   0.2793   0.7713        0.2393       0.9383        0.2060        11.0015
     24   0.2564   0.7600        0.2423       0.9407        0.2038        10.7260
     25   0.2739   0.7680        0.2403       0.9407        0.1971        10.9199
     26   0.2569   0.7684        [35m0.2384[0m       0.9420        0.2012        10.7562
     27   0.2360   0.7488        0.2426       0.9407        0.2040        10.6066
     28   0.2418   0.7566        0.2425       0.9383        0.2127        10.8860
     29   0.2312   0.7599        0.2412       0.9395        0.2053        10.9793
     30   0.2339   0.7538        0.2394       0.9383        0.2028        11.1316
Stopping since valid_loss has not improved in the last 10 epochs.
[32m[I 2023-05-03 05:54:05,271][0m Trial 289 finished with value: 0.1965105299541711 and parameters: {'lr': 0.0033713188383357718, 'dropout': 0.5835511535642175, 'd_model_multiplier': 1, 'num_layers': 1, 'n_heads': 64, 'dim_feedforward': 417, 'batch_size': 50, 'pos_encoding': 'fixed', 'activation': 'relu', 'norm': 'LayerNorm', 'optimizer_name': 'RAdam', 'weight_decay': 0.1, 'top_n_features': 62}. Best is trial 246 with value: 0.16447311791139763.[0m
[FileBasedDataset] Initializing dataset...
	Examples: 8264
	Features: 55
	Max length: 315
Standard scalar turned ON, loading params from cache
[FileBasedDataset] Dataset initialization complete
  epoch    auprc    auroc    train_loss    valid_acc    valid_loss    cp      dur
-------  -------  -------  ------------  -----------  ------------  ----  -------
      1   [36m0.2695[0m   [32m0.7641[0m        [35m0.2754[0m       [31m0.9093[0m        [94m0.2806[0m     +  10.4098
      2   0.2654   [32m0.7676[0m        [35m0.2484[0m       [31m0.9105[0m        0.3062        10.7430
      3   0.2576   0.7657        [35m0.2477[0m       0.9105        0.3062        10.7464
      4   0.2524   [32m0.7709[0m        [35m0.2438[0m       0.9093        0.3302        11.0028
      5   0.2597   [32m0.7783[0m        [35m0.2392[0m       [31m0.9141[0m        0.3089        10.7664
      6   0.2594   [32m0.7861[0m        [35m0.2374[0m       0.9105        0.3086        11.0939
      7   0.2606   0.7841        0.2377       0.9141        0.3077        10.5299
      8   0.2605   0.7818        [35m0.2362[0m       0.9069        0.3189        10.5827
      9   0.2628   0.7796        0.2386       [31m0.9154[0m        0.3487        10.7820
     10   0.2538   0.7796        0.2386       0.9154        0.3139        10.6709
Stopping since valid_loss has not improved in the last 10 epochs.
[32m[I 2023-05-03 05:56:03,422][0m Trial 290 finished with value: 0.2805911397523142 and parameters: {'lr': 0.0034985885045431386, 'dropout': 0.607130350983162, 'd_model_multiplier': 1, 'num_layers': 1, 'n_heads': 64, 'dim_feedforward': 402, 'batch_size': 52, 'pos_encoding': 'fixed', 'activation': 'relu', 'norm': 'LayerNorm', 'optimizer_name': 'RAdam', 'weight_decay': 0.1, 'top_n_features': 55}. Best is trial 246 with value: 0.16447311791139763.[0m
[FileBasedDataset] Initializing dataset...
	Examples: 8264
	Features: 57
	Max length: 315
Standard scalar turned ON, loading params from cache
[FileBasedDataset] Dataset initialization complete
  epoch    auprc    auroc    train_loss    valid_acc    valid_loss    cp      dur
-------  -------  -------  ------------  -----------  ------------  ----  -------
      1   [36m0.3488[0m   [32m0.7484[0m        [35m0.2692[0m       [31m0.9226[0m        [94m0.2723[0m     +  10.3282
      2   0.3219   0.7002        [35m0.2567[0m       [31m0.9238[0m        0.3391        10.6116
      3   0.3255   0.7274        [35m0.2486[0m       0.9117        0.3147        10.6109
      4   [36m0.3668[0m   [32m0.7538[0m        [35m0.2456[0m       0.9081        0.2924        10.5891
      5   [36m0.3680[0m   [32m0.7937[0m        0.2483       0.9129        [94m0.2642[0m     +  10.5831
      6   0.3046   0.7740        [35m0.2402[0m       0.9117        0.3038        10.3611
      7   0.3105   0.7913        0.2406       0.9117        0.2831        10.5213
      8   0.3583   [32m0.7987[0m        [35m0.2398[0m       0.9129        [94m0.2559[0m     +  10.5392
      9   0.3240   0.7752        [35m0.2391[0m       0.9129        0.2884        10.6425
     10   0.3337   0.7754        0.2406       0.8694        0.3430        10.7641
     11   0.3300   [32m0.8074[0m        0.2408       0.9141        [94m0.2416[0m     +  10.6859
     12   0.3251   0.7921        [35m0.2383[0m       0.8948        0.2672        10.6515
     13   0.3460   0.7914        0.2400       0.8489        0.3625        10.6487
     14   0.3191   0.7948        0.2402       0.9008        0.2672        10.5073
     15   0.3303   0.7857        0.2412       0.8851        0.2659        10.6725
     16   0.3279   0.8012        0.2417       0.9045        0.2477        10.7932
     17   0.3252   [32m0.8143[0m        0.2397       0.9057        0.2496        10.7598
     18   0.2890   0.7694        0.2406       0.8755        0.2949        10.5813
     19   0.3054   0.8042        0.2439       0.9008        0.2609        10.6469
     20   0.3600   0.8031        [35m0.2383[0m       0.9045        0.2644        10.5192
     21   0.3348   0.8138        0.2394       0.9129        [94m0.2412[0m     +  10.7178
     22   0.3141   0.7894        0.2416       0.9154        0.2460        10.4234
     23   0.3003   0.7893        0.2421       0.9045        0.2579        10.6596
     24   0.3252   0.8135        0.2384       0.9226        0.2552        10.3750
     25   0.3471   [32m0.8191[0m        [35m0.2375[0m       0.8960        0.2634        10.5844
     26   0.3237   0.7967        0.2393       0.9190        0.2429        10.5833
     27   0.3344   0.8073        0.2405       0.9105        0.2458        10.4531
     28   0.3288   0.8170        0.2386       0.9069        0.2462        10.6326
     29   0.3270   0.8018        0.2431       0.9093        0.2440        10.4765
     30   0.3378   0.8147        0.2395       0.9202        0.2566        10.3746
Stopping since valid_loss has not improved in the last 10 epochs.
