[32m[I 2023-05-02 07:32:29,352][0m Trial 63 finished with value: 0.2508879147172695 and parameters: {'lr': 0.00047734115025328203, 'dropout': 0.4968556804002685, 'd_model_multiplier': 8, 'num_layers': 3, 'n_heads': 4, 'dim_feedforward': 497, 'batch_size': 8, 'pos_encoding': 'fixed', 'activation': 'relu', 'norm': 'LayerNorm', 'optimizer_name': 'AdamW', 'weight_decay': 0.01, 'top_n_features': 197}. Best is trial 12 with value: 0.20472501771481755.[0m
[FileBasedDataset] Initializing dataset...
	Examples: 8264
	Features: 209
	Max length: 315
Standard scalar turned ON, loading params from cache
[FileBasedDataset] Dataset initialization complete
  epoch    auprc    auroc    train_loss    valid_acc    valid_loss    cp     dur
-------  -------  -------  ------------  -----------  ------------  ----  ------
      1   [36m0.2698[0m   [32m0.7457[0m        [35m0.2681[0m       [31m0.9190[0m        [94m0.2733[0m     +  8.8426
      2   [36m0.2953[0m   [32m0.7581[0m        [35m0.2603[0m       0.9190        0.2868        8.0746
      3   [36m0.3256[0m   [32m0.7765[0m        [35m0.2536[0m       0.9190        0.2847        8.3167
      4   [36m0.3475[0m   [32m0.7876[0m        [35m0.2501[0m       [31m0.9214[0m        0.2852        9.0770
      5   [36m0.3608[0m   [32m0.7892[0m        0.2514       0.9214        [94m0.2692[0m     +  8.1735
      6   [36m0.3976[0m   [32m0.8047[0m        [35m0.2455[0m       [31m0.9250[0m        0.2703        8.2722
      7   0.3722   0.7994        [35m0.2432[0m       0.9226        0.2991        9.2717
      8   [36m0.4026[0m   [32m0.8130[0m        [35m0.2424[0m       [31m0.9299[0m        [94m0.2563[0m     +  8.3319
      9   0.3793   0.8067        [35m0.2415[0m       0.9287        0.2645        9.1612
     10   0.3780   [32m0.8162[0m        [35m0.2385[0m       0.9262        0.2575        9.5574
     11   0.3979   0.8132        0.2389       0.9287        0.2661        9.3534
     12   0.3786   0.8112        [35m0.2377[0m       0.9250        0.2632        9.6981
     13   0.3779   [32m0.8180[0m        [35m0.2360[0m       0.9166        [94m0.2545[0m     +  9.8129
     14   0.3546   0.8149        0.2399       0.9008        0.2640        9.3027
     15   0.3884   0.8177        0.2361       0.9166        0.2589        9.1600
     16   0.3886   0.8172        0.2367       0.9274        0.2578        9.2249
     17   0.3698   0.8089        [35m0.2347[0m       0.9166        0.2701        8.9374
     18   0.3695   [32m0.8188[0m        0.2353       0.9190        [94m0.2528[0m     +  9.2671
     19   0.3492   0.8006        [35m0.2337[0m       0.9129        0.2739        9.3369
     20   0.3411   0.8097        [35m0.2313[0m       0.9178        0.2667        9.1155
     21   0.3201   0.7980        0.2333       0.9202        0.2765        9.1835
     22   0.3946   0.8157        0.2331       0.9190        [94m0.2518[0m     +  9.0386
     23   0.3254   0.7989        0.2321       0.9190        0.2903        9.2962
     24   0.3242   0.8032        [35m0.2310[0m       0.9202        0.2737        9.2265
     25   0.3450   0.8071        0.2321       0.9214        0.2710        9.2871
     26   0.3467   0.8052        [35m0.2292[0m       0.9214        0.2716        9.0978
     27   0.3644   0.8155        [35m0.2272[0m       0.9214        0.2640        9.0942
     28   0.3689   [32m0.8203[0m        0.2277       0.9190        0.2543        9.1634
     29   0.4006   [32m0.8268[0m        0.2325       0.9214        [94m0.2428[0m     +  9.2476
     30   [36m0.4076[0m   [32m0.8330[0m        0.2276       0.9250        [94m0.2401[0m     +  9.0504
     31   0.4010   [32m0.8369[0m        [35m0.2262[0m       0.9141        0.2454        9.4058
     32   [36m0.4272[0m   [32m0.8385[0m        0.2275       0.9105        0.2516        9.3439
     33   0.4131   0.8316        0.2279       0.9045        0.2487        9.3141
     34   0.3790   0.8262        [35m0.2255[0m       0.9021        0.2619        9.1514
     35   0.4038   0.8311        [35m0.2254[0m       0.9214        [94m0.2334[0m     +  9.1067
     36   0.3999   0.8281        0.2269       0.9178        0.2396        9.1882
     37   0.3968   0.8276        [35m0.2235[0m       0.9214        0.2451        9.2611
     38   0.4126   0.8345        0.2275       0.9154        0.2354        8.9989
     39   [36m0.4292[0m   0.8312        0.2264       0.9214        0.2398        9.3614
     40   0.4165   0.8349        0.2253       0.9250        0.2466        9.0083
     41   0.3852   0.8232        0.2249       0.9238        0.2653        9.0821
     42   0.3622   0.8166        0.2252       0.9202        0.2685        9.0902
     43   0.3854   0.8234        0.2288       0.9214        0.2522        9.1929
     44   0.3706   0.8190        0.2245       0.9166        0.2613        9.2245
Stopping since valid_loss has not improved in the last 10 epochs.
[32m[I 2023-05-02 07:39:20,185][0m Trial 64 finished with value: 0.2334133966892345 and parameters: {'lr': 0.0008753766298624107, 'dropout': 0.5217965873235016, 'd_model_multiplier': 8, 'num_layers': 2, 'n_heads': 4, 'dim_feedforward': 440, 'batch_size': 39, 'pos_encoding': 'fixed', 'activation': 'relu', 'norm': 'LayerNorm', 'optimizer_name': 'AdamW', 'weight_decay': 0.01, 'top_n_features': 209}. Best is trial 12 with value: 0.20472501771481755.[0m
[FileBasedDataset] Initializing dataset...
	Examples: 8264
	Features: 184
	Max length: 315
Standard scalar turned ON, loading params from cache
[FileBasedDataset] Dataset initialization complete
  epoch    auprc    auroc    train_loss    valid_acc    valid_loss    cp     dur
-------  -------  -------  ------------  -----------  ------------  ----  ------
      1   [36m0.2236[0m   [32m0.6834[0m        [35m0.2934[0m       [31m0.9226[0m        [94m0.2493[0m     +  8.3071
      2   [36m0.2495[0m   [32m0.7244[0m        [35m0.2516[0m       0.9226        [94m0.2429[0m     +  8.5666
      3   [36m0.2821[0m   [32m0.7369[0m        [35m0.2483[0m       [31m0.9250[0m        [94m0.2403[0m     +  9.1446
      4   [36m0.2938[0m   [32m0.7431[0m        [35m0.2439[0m       0.9202        0.2406        8.9086
      5   [36m0.2954[0m   0.7407        [35m0.2416[0m       0.9129        0.2445        8.9122
      6   [36m0.3030[0m   0.7327        [35m0.2393[0m       0.9117        0.2500        9.4939
      7   [36m0.3070[0m   [32m0.7437[0m        [35m0.2375[0m       0.9154        0.2460        9.8148
      8   0.3052   0.7418        [35m0.2350[0m       0.9105        0.2512        9.2729
      9   0.2950   0.7394        [35m0.2339[0m       0.9105        0.2591        9.6544
     10   0.2865   0.7314        0.2354       0.9081        0.2584        9.6550
     11   0.2930   0.7353        [35m0.2325[0m       0.9105        0.2615        9.2047
     12   0.2862   0.7247        0.2332       0.9117        0.2663        9.2212
Stopping since valid_loss has not improved in the last 10 epochs.
[32m[I 2023-05-02 07:41:19,521][0m Trial 65 finished with value: 0.24028419651892916 and parameters: {'lr': 0.00012262436073907652, 'dropout': 0.49223535210362634, 'd_model_multiplier': 8, 'num_layers': 1, 'n_heads': 4, 'dim_feedforward': 504, 'batch_size': 20, 'pos_encoding': 'fixed', 'activation': 'relu', 'norm': 'LayerNorm', 'optimizer_name': 'AdamW', 'weight_decay': 0.01, 'top_n_features': 184}. Best is trial 12 with value: 0.20472501771481755.[0m
[FileBasedDataset] Initializing dataset...
	Examples: 8264
	Features: 239
	Max length: 315
Standard scalar turned ON, loading params from cache
[FileBasedDataset] Dataset initialization complete
  epoch    auprc    auroc    train_loss    valid_acc    valid_loss    cp     dur
-------  -------  -------  ------------  -----------  ------------  ----  ------
      1   [36m0.2364[0m   [32m0.7255[0m        [35m0.2852[0m       [31m0.9262[0m        [94m0.2419[0m     +  8.0828
      2   [36m0.2382[0m   [32m0.7338[0m        [35m0.2520[0m       0.9190        0.2471        9.2270
      3   0.2275   0.7289        [35m0.2506[0m       0.9214        0.2491        9.1246
      4   [36m0.2415[0m   0.7199        [35m0.2452[0m       0.9190        0.2601        9.2096
      5   [36m0.2472[0m   0.7326        [35m0.2451[0m       0.9202        0.2640        9.2183
      6   0.2400   [32m0.7448[0m        [35m0.2421[0m       0.9141        0.2584        9.1394
      7   0.2402   0.7418        0.2430       0.9214        0.2620        8.9249
      8   [36m0.2523[0m   [32m0.7451[0m        [35m0.2392[0m       0.9250        0.2721        9.8838
      9   0.2411   0.7407        [35m0.2386[0m       0.9154        0.2771        9.7902
     10   0.2408   0.7386        [35m0.2374[0m       0.9238        0.2866        9.5026
Stopping since valid_loss has not improved in the last 10 epochs.
[32m[I 2023-05-02 07:43:01,426][0m Trial 66 finished with value: 0.24192649844083416 and parameters: {'lr': 0.000279167561436317, 'dropout': 0.5854754785332105, 'd_model_multiplier': 8, 'num_layers': 2, 'n_heads': 4, 'dim_feedforward': 492, 'batch_size': 34, 'pos_encoding': 'fixed', 'activation': 'relu', 'norm': 'LayerNorm', 'optimizer_name': 'AdamW', 'weight_decay': 0.01, 'top_n_features': 239}. Best is trial 12 with value: 0.20472501771481755.[0m
[FileBasedDataset] Initializing dataset...
	Examples: 8264
	Features: 160
	Max length: 315
Standard scalar turned ON, loading params from cache
[FileBasedDataset] Dataset initialization complete
  epoch    auprc    auroc    train_loss    valid_acc    valid_loss    cp     dur
-------  -------  -------  ------------  -----------  ------------  ----  ------
      1   [36m0.2401[0m   [32m0.7557[0m        [35m0.2816[0m       [31m0.8924[0m        [94m0.2770[0m     +  8.4425
      2   0.2346   0.7530        [35m0.2668[0m       [31m0.8984[0m        [94m0.2713[0m     +  8.9813
      3   [36m0.2439[0m   0.7499        [35m0.2608[0m       [31m0.9154[0m        0.2729        8.6847
      4   [36m0.2443[0m   0.7497        [35m0.2566[0m       0.9117        0.2744        9.0958
      5   [36m0.2452[0m   0.7498        0.2599       0.9154        0.2806        9.3100
      6   0.2383   0.7455        0.2578       0.9154        0.2795        9.3105
      7   0.2386   0.7472        0.2572       0.9117        0.2752        9.3462
      8   0.2443   0.7467        [35m0.2553[0m       0.9154        0.2850        9.5453
      9   0.2307   0.7416        [35m0.2548[0m       0.9154        0.2959        9.1472
     10   [36m0.2477[0m   0.7488        [35m0.2541[0m       0.9154        0.2942        9.3701
     11   0.2362   0.7452        [35m0.2538[0m       0.9154        0.2915        9.2856
Stopping since valid_loss has not improved in the last 10 epochs.
[32m[I 2023-05-02 07:44:51,640][0m Trial 67 finished with value: 0.27127403950604734 and parameters: {'lr': 0.0021279527477548036, 'dropout': 0.5362180682278371, 'd_model_multiplier': 8, 'num_layers': 3, 'n_heads': 4, 'dim_feedforward': 445, 'batch_size': 46, 'pos_encoding': 'fixed', 'activation': 'relu', 'norm': 'LayerNorm', 'optimizer_name': 'AdamW', 'weight_decay': 0.01, 'top_n_features': 160}. Best is trial 12 with value: 0.20472501771481755.[0m
[FileBasedDataset] Initializing dataset...
	Examples: 8264
	Features: 225
	Max length: 315
Standard scalar turned ON, loading params from cache
[FileBasedDataset] Dataset initialization complete
  epoch    auprc    auroc    train_loss    valid_acc    valid_loss    cp     dur
-------  -------  -------  ------------  -----------  ------------  ----  ------
      1   [36m0.2760[0m   [32m0.7013[0m        [35m0.2688[0m       [31m0.9214[0m        [94m0.3080[0m     +  8.1934
      2   0.2408   0.6543        [35m0.2524[0m       0.9214        0.3214        8.8216
      3   0.2295   0.6412        [35m0.2490[0m       0.9214        0.3175        9.0170
      4   0.1924   0.6300        [35m0.2486[0m       0.9214        0.3400        8.8941
      5   0.1709   0.5872        [35m0.2439[0m       0.9214        0.3797        9.1068
      6   0.1683   0.5943        0.2447       0.9214        0.3685        8.9564
      7   0.1666   0.6242        [35m0.2439[0m       0.9214        0.3695        9.1239
      8   0.1819   0.6397        [35m0.2400[0m       0.9214        0.3629        9.3291
      9   0.2333   0.6661        [35m0.2368[0m       [31m0.9226[0m        0.3373        9.1229
     10   0.2258   0.6404        [35m0.2348[0m       0.9214        0.3444        9.0732
Stopping since valid_loss has not improved in the last 10 epochs.
[32m[I 2023-05-02 07:46:30,534][0m Trial 68 finished with value: 0.3080188526153709 and parameters: {'lr': 0.0004590088054253706, 'dropout': 0.47180516822424895, 'd_model_multiplier': 16, 'num_layers': 1, 'n_heads': 4, 'dim_feedforward': 475, 'batch_size': 28, 'pos_encoding': 'fixed', 'activation': 'relu', 'norm': 'LayerNorm', 'optimizer_name': 'AdamW', 'weight_decay': 0.1, 'top_n_features': 225}. Best is trial 12 with value: 0.20472501771481755.[0m
[FileBasedDataset] Initializing dataset...
	Examples: 8264
	Features: 197
	Max length: 315
Standard scalar turned ON, loading params from cache
[FileBasedDataset] Dataset initialization complete
  epoch    auprc    auroc    train_loss    valid_acc    valid_loss    cp     dur
-------  -------  -------  ------------  -----------  ------------  ----  ------
      1   [36m0.1178[0m   [32m0.6496[0m        [35m0.6599[0m       [31m0.9154[0m        [94m0.6010[0m     +  8.9928
      2   0.0574   0.3358        [35m0.5574[0m       [31m0.9274[0m        [94m0.4866[0m     +  9.4547
      3   0.0584   0.3162        [35m0.4610[0m       0.9274        [94m0.3980[0m     +  9.6092
      4   0.0548   0.3186        [35m0.3875[0m       0.9274        [94m0.3278[0m     +  9.8133
      5   0.0612   0.4013        [35m0.3377[0m       0.9274        [94m0.2952[0m     +  9.4160
      6   0.0853   0.4667        [35m0.3105[0m       0.9274        [94m0.2789[0m     +  9.3881
      7   0.0946   0.5119        [35m0.2913[0m       0.9274        [94m0.2701[0m     +  9.4602
      8   0.1043   0.5506        [35m0.2814[0m       0.9274        [94m0.2648[0m     +  9.4080
      9   0.1120   0.5758        [35m0.2736[0m       0.9274        [94m0.2614[0m     +  9.4011
     10   [36m0.1208[0m   0.5972        [35m0.2703[0m       0.9274        [94m0.2593[0m     +  9.4900
     11   [36m0.1229[0m   0.6096        [35m0.2636[0m       0.9274        [94m0.2577[0m     +  9.7173
     12   [36m0.1258[0m   0.6233        [35m0.2626[0m       0.9274        [94m0.2563[0m     +  9.7165
     13   [36m0.1259[0m   0.6298        [35m0.2598[0m       0.9274        [94m0.2551[0m     +  9.7069
     14   [36m0.1272[0m   0.6334        [35m0.2585[0m       0.9274        [94m0.2543[0m     +  9.6950
     15   [36m0.1299[0m   0.6412        0.2596       0.9274        [94m0.2535[0m     +  10.3126
     16   [36m0.1333[0m   0.6475        [35m0.2569[0m       0.9274        [94m0.2530[0m     +  9.8554
     17   [36m0.1353[0m   [32m0.6566[0m        0.2579       0.9274        [94m0.2524[0m     +  10.2084
     18   [36m0.1373[0m   [32m0.6608[0m        0.2578       0.9274        [94m0.2522[0m     +  9.8081
     19   [36m0.1395[0m   [32m0.6656[0m        [35m0.2540[0m       0.9274        [94m0.2519[0m     +  9.7077
     20   [36m0.1406[0m   [32m0.6693[0m        0.2549       0.9274        [94m0.2513[0m     +  9.6491
     21   [36m0.1407[0m   [32m0.6720[0m        0.2557       0.9274        [94m0.2507[0m     +  9.7042
     22   [36m0.1437[0m   [32m0.6776[0m        [35m0.2533[0m       0.9274        [94m0.2500[0m     +  9.5058
     23   [36m0.1457[0m   [32m0.6797[0m        0.2560       0.9274        [94m0.2497[0m     +  9.4367
     24   [36m0.1477[0m   [32m0.6854[0m        0.2547       0.9274        [94m0.2488[0m     +  9.7042
     25   [36m0.1509[0m   [32m0.6954[0m        0.2572       0.9274        [94m0.2469[0m     +  9.3432
     26   [36m0.1570[0m   [32m0.7038[0m        [35m0.2522[0m       0.9274        [94m0.2459[0m     +  9.5411
     27   [36m0.1716[0m   [32m0.7172[0m        [35m0.2511[0m       0.9274        [94m0.2429[0m     +  9.5766
     28   [36m0.1940[0m   [32m0.7328[0m        [35m0.2471[0m       0.9274        [94m0.2386[0m     +  9.9973
     29   [36m0.2055[0m   [32m0.7421[0m        0.2484       0.9226        [94m0.2362[0m     +  9.9905
     30   [36m0.2124[0m   0.7411        [35m0.2446[0m       0.9226        [94m0.2362[0m     +  10.1934
     31   [36m0.2163[0m   [32m0.7464[0m        [35m0.2422[0m       0.9226        [94m0.2354[0m     +  9.6397
     32   [36m0.2264[0m   [32m0.7476[0m        0.2428       0.9250        [94m0.2342[0m     +  9.5983
     33   [36m0.2334[0m   [32m0.7507[0m        [35m0.2402[0m       0.9262        0.2342        9.9473
     34   0.2323   [32m0.7553[0m        0.2421       0.9274        [94m0.2338[0m     +  9.2199
     35   [36m0.2344[0m   [32m0.7578[0m        [35m0.2379[0m       0.9274        0.2343        9.3840
     36   0.2317   [32m0.7587[0m        0.2404       0.9262        0.2340        9.5177
     37   [36m0.2361[0m   [32m0.7592[0m        0.2380       0.9250        0.2339        9.3945
     38   [36m0.2401[0m   [32m0.7614[0m        0.2400       0.9250        [94m0.2335[0m     +  9.6412
     39   0.2354   [32m0.7626[0m        [35m0.2378[0m       0.9262        [94m0.2332[0m     +  9.6843
     40   0.2380   0.7619        0.2383       0.9262        0.2332        9.8328
     41   [36m0.2411[0m   [32m0.7651[0m        [35m0.2360[0m       0.9262        [94m0.2330[0m     +  9.9386
     42   [36m0.2437[0m   0.7649        [35m0.2346[0m       0.9250        [94m0.2328[0m     +  9.5960
     43   0.2410   [32m0.7683[0m        0.2350       0.9250        0.2330        9.5174
     44   0.2385   [32m0.7687[0m        [35m0.2343[0m       0.9250        0.2334        9.1923
     45   0.2385   0.7669        [35m0.2334[0m       0.9250        0.2346        9.5095
     46   0.2349   0.7668        [35m0.2332[0m       0.9250        0.2355        9.5589
     47   0.2317   0.7657        0.2341       0.9250        0.2368        9.6713
     48   0.2344   0.7638        [35m0.2310[0m       0.9262        0.2373        9.6409
     49   0.2364   0.7634        0.2344       0.9274        0.2365        9.4734
     50   0.2357   0.7618        [35m0.2303[0m       0.9274        0.2367        9.6678
[32m[I 2023-05-02 07:54:34,174][0m Trial 69 finished with value: 0.23276533390042858 and parameters: {'lr': 4.608827453242271e-05, 'dropout': 0.5112407754582766, 'd_model_multiplier': 4, 'num_layers': 4, 'n_heads': 4, 'dim_feedforward': 469, 'batch_size': 65, 'pos_encoding': 'fixed', 'activation': 'relu', 'norm': 'LayerNorm', 'optimizer_name': 'RAdam', 'weight_decay': 0.01, 'top_n_features': 197}. Best is trial 12 with value: 0.20472501771481755.[0m
[FileBasedDataset] Initializing dataset...
	Examples: 8264
	Features: 214
	Max length: 315
Standard scalar turned ON, loading params from cache
[FileBasedDataset] Dataset initialization complete
  epoch    auprc    auroc    train_loss    valid_acc    valid_loss    cp     dur
-------  -------  -------  ------------  -----------  ------------  ----  ------
      1   [36m0.2346[0m   [32m0.7083[0m        [35m0.2899[0m       [31m0.9178[0m        [94m0.2649[0m     +  8.9628
      2   0.2069   [32m0.7125[0m        [35m0.2580[0m       0.9178        0.2684        8.9866
      3   0.2060   [32m0.7170[0m        0.2590       0.9178        [94m0.2609[0m     +  9.1715
      4   0.2074   0.7159        0.2597       0.9178        0.2615        9.3258
      5   0.2132   0.7156        0.2600       0.9178        [94m0.2587[0m     +  9.5224
      6   0.2162   0.7155        [35m0.2572[0m       0.9178        0.2612        9.3646
      7   0.2229   0.7164        [35m0.2556[0m       0.9178        0.2599        9.4175
      8   0.2069   0.7118        0.2584       0.9178        0.2616        9.3145
      9   0.2136   0.7141        [35m0.2548[0m       0.9178        0.2611        9.2166
     10   0.2078   0.7160        0.2551       0.9178        0.2606        9.4631
     11   0.2038   0.7148        0.2548       0.9178        0.2659        9.4159
     12   0.2043   0.7144        [35m0.2522[0m       0.9178        0.2655        9.4012
     13   0.2085   0.7163        0.2539       0.9178        0.2629        9.4775
     14   0.2130   [32m0.7194[0m        0.2537       0.9178        0.2614        9.2400
Stopping since valid_loss has not improved in the last 10 epochs.
