[32m[I 2023-05-04 07:01:15,639][0m Trial 416 finished with value: 0.24043148323587235 and parameters: {'lr': 2.6620357380593464e-06, 'dropout': 0.28694498064562163, 'd_model_multiplier': 4, 'num_layers': 5, 'n_heads': 32, 'dim_feedforward': 347, 'batch_size': 81, 'pos_encoding': 'fixed', 'activation': 'relu', 'norm': 'LayerNorm', 'optimizer_name': 'AdamW', 'weight_decay': 0.001, 'top_n_features': 60}. Best is trial 246 with value: 0.16447311791139763.[0m
[FileBasedDataset] Initializing dataset...
	Examples: 8264
	Features: 98
	Max length: 315
Standard scalar turned ON, loading params from cache
[FileBasedDataset] Dataset initialization complete
  epoch    auprc    auroc    train_loss    valid_acc    valid_loss    cp       dur
-------  -------  -------  ------------  -----------  ------------  ----  --------
      1   [36m0.0606[0m   [32m0.3540[0m        [35m0.5566[0m       [31m0.9166[0m        [94m0.3363[0m     +  121.1456
      2   [36m0.2165[0m   [32m0.6572[0m        [35m0.2896[0m       0.9166        [94m0.2712[0m     +  121.2316
      3   [36m0.2807[0m   [32m0.6987[0m        [35m0.2525[0m       0.9166        [94m0.2637[0m     +  121.4598
      4   [36m0.3173[0m   [32m0.7221[0m        [35m0.2444[0m       0.9166        [94m0.2594[0m     +  121.6306
      5   [36m0.3319[0m   [32m0.7429[0m        [35m0.2405[0m       [31m0.9178[0m        [94m0.2546[0m     +  121.6079
      6   [36m0.3421[0m   [32m0.7571[0m        [35m0.2371[0m       [31m0.9190[0m        [94m0.2497[0m     +  121.4907
      7   [36m0.3570[0m   [32m0.7692[0m        [35m0.2346[0m       [31m0.9202[0m        [94m0.2455[0m     +  121.3618
      8   [36m0.3685[0m   [32m0.7773[0m        [35m0.2326[0m       [31m0.9214[0m        [94m0.2432[0m     +  121.5592
      9   0.3671   [32m0.7819[0m        [35m0.2317[0m       0.9202        [94m0.2416[0m     +  121.4232
     10   [36m0.3694[0m   [32m0.7853[0m        [35m0.2300[0m       0.9214        [94m0.2409[0m     +  121.4922
     11   [36m0.3731[0m   [32m0.7882[0m        [35m0.2277[0m       0.9214        [94m0.2391[0m     +  122.0303
     12   0.3694   [32m0.7890[0m        0.2282       0.9202        [94m0.2391[0m     +  121.7310
     13   0.3714   [32m0.7911[0m        [35m0.2259[0m       0.9202        [94m0.2389[0m     +  121.6756
     14   [36m0.3765[0m   [32m0.7934[0m        [35m0.2258[0m       0.9202        [94m0.2381[0m     +  121.5338
     15   0.3750   [32m0.7949[0m        [35m0.2257[0m       0.9202        [94m0.2379[0m     +  121.4515
     16   0.3734   [32m0.7963[0m        [35m0.2249[0m       0.9190        [94m0.2374[0m     +  121.7568
     17   0.3717   [32m0.7969[0m        [35m0.2240[0m       0.9190        [94m0.2373[0m     +  121.5018
     18   [36m0.3779[0m   [32m0.7984[0m        [35m0.2222[0m       0.9166        [94m0.2370[0m     +  122.0658
     19   0.3776   [32m0.7997[0m        [35m0.2215[0m       0.9166        [94m0.2369[0m     +  121.4261
     20   0.3703   0.7992        0.2215       0.9166        0.2377        121.7934
     21   0.3695   [32m0.8000[0m        [35m0.2199[0m       0.9154        0.2377        121.7052
     22   0.3724   0.7997        0.2211       0.9166        0.2383        121.4774
     23   0.3710   [32m0.8004[0m        [35m0.2194[0m       0.9154        0.2387        121.8919
     24   0.3673   0.7998        [35m0.2191[0m       0.9190        0.2386        121.9048
     25   0.3694   [32m0.8019[0m        [35m0.2181[0m       0.9154        0.2383        121.6356
     26   0.3690   [32m0.8039[0m        0.2191       0.9178        0.2371        122.1363
     27   0.3681   0.8019        [35m0.2171[0m       0.9154        0.2380        121.7592
     28   0.3651   0.8024        [35m0.2166[0m       0.9166        0.2386        121.9448
Stopping since valid_loss has not improved in the last 10 epochs.
[32m[I 2023-05-04 08:00:57,726][0m Trial 417 finished with value: 0.23691020132084134 and parameters: {'lr': 1.5750769377575952e-06, 'dropout': 0.4074328030365082, 'd_model_multiplier': 64, 'num_layers': 6, 'n_heads': 32, 'dim_feedforward': 360, 'batch_size': 49, 'pos_encoding': 'fixed', 'activation': 'relu', 'norm': 'LayerNorm', 'optimizer_name': 'RAdam', 'weight_decay': 0.001, 'top_n_features': 98}. Best is trial 246 with value: 0.16447311791139763.[0m
[FileBasedDataset] Initializing dataset...
	Examples: 8264
	Features: 104
	Max length: 315
Standard scalar turned ON, loading params from cache
[FileBasedDataset] Dataset initialization complete
  epoch    auprc    auroc    train_loss    valid_acc    valid_loss    cp      dur
-------  -------  -------  ------------  -----------  ------------  ----  -------
      1   [36m0.0823[0m   [32m0.3448[0m        [35m0.5341[0m       [31m0.9141[0m        [94m0.4075[0m     +  25.0628
      2   0.0795   [32m0.4141[0m        [35m0.3581[0m       0.9141        [94m0.3257[0m     +  24.9001
      3   [36m0.0912[0m   [32m0.5016[0m        [35m0.3026[0m       0.9141        [94m0.3030[0m     +  24.6582
      4   [36m0.1087[0m   [32m0.5648[0m        [35m0.2807[0m       0.9141        [94m0.2939[0m     +  25.0380
      5   [36m0.1291[0m   [32m0.6141[0m        [35m0.2689[0m       0.9141        [94m0.2883[0m     +  25.1723
      6   [36m0.1606[0m   [32m0.6475[0m        [35m0.2628[0m       0.9141        [94m0.2845[0m     +  24.7448
      7   [36m0.1774[0m   [32m0.6671[0m        [35m0.2577[0m       0.9141        [94m0.2815[0m     +  24.7351
      8   [36m0.1916[0m   [32m0.6819[0m        [35m0.2543[0m       0.9141        [94m0.2794[0m     +  24.8582
      9   [36m0.2003[0m   [32m0.6935[0m        [35m0.2510[0m       0.9141        [94m0.2773[0m     +  24.8758
     10   [36m0.2132[0m   [32m0.7030[0m        [35m0.2491[0m       0.9141        [94m0.2754[0m     +  24.7735
     11   [36m0.2245[0m   [32m0.7122[0m        [35m0.2484[0m       0.9141        [94m0.2736[0m     +  24.8806
     12   [36m0.2406[0m   [32m0.7222[0m        [35m0.2461[0m       0.9141        [94m0.2719[0m     +  24.8902
     13   [36m0.2474[0m   [32m0.7292[0m        [35m0.2444[0m       0.9141        [94m0.2701[0m     +  25.0297
     14   [36m0.2528[0m   [32m0.7351[0m        [35m0.2426[0m       0.9141        [94m0.2689[0m     +  24.8012
     15   [36m0.2603[0m   [32m0.7403[0m        [35m0.2415[0m       0.9141        [94m0.2673[0m     +  24.7910
     16   [36m0.2657[0m   [32m0.7452[0m        [35m0.2405[0m       0.9141        [94m0.2661[0m     +  24.8260
     17   [36m0.2701[0m   [32m0.7484[0m        [35m0.2389[0m       0.9141        [94m0.2654[0m     +  25.0335
     18   [36m0.2725[0m   [32m0.7512[0m        [35m0.2388[0m       0.9129        [94m0.2646[0m     +  25.0255
     19   [36m0.2760[0m   [32m0.7537[0m        [35m0.2380[0m       0.9129        [94m0.2640[0m     +  24.8229
     20   [36m0.2777[0m   [32m0.7551[0m        [35m0.2361[0m       0.9129        [94m0.2638[0m     +  24.8959
     21   0.2762   [32m0.7570[0m        0.2366       0.9129        [94m0.2633[0m     +  24.8516
     22   [36m0.2805[0m   [32m0.7586[0m        0.2368       0.9141        [94m0.2629[0m     +  24.8514
     23   [36m0.2843[0m   [32m0.7598[0m        [35m0.2356[0m       0.9141        [94m0.2627[0m     +  24.9136
     24   [36m0.2860[0m   [32m0.7610[0m        0.2357       0.9141        [94m0.2627[0m     +  24.7016
     25   [36m0.2870[0m   [32m0.7619[0m        [35m0.2355[0m       0.9129        [94m0.2623[0m     +  24.8453
     26   0.2869   [32m0.7627[0m        [35m0.2340[0m       0.9129        0.2628        25.0039
     27   [36m0.2873[0m   [32m0.7644[0m        0.2345       0.9129        [94m0.2622[0m     +  25.1279
     28   0.2862   [32m0.7651[0m        0.2351       0.9129        0.2623        24.9240
     29   0.2869   [32m0.7657[0m        [35m0.2329[0m       0.9129        [94m0.2621[0m     +  24.7552
     30   [36m0.2876[0m   [32m0.7665[0m        0.2341       0.9129        0.2621        24.7958
     31   [36m0.2886[0m   [32m0.7672[0m        0.2335       0.9129        [94m0.2621[0m     +  24.7747
     32   [36m0.2886[0m   [32m0.7684[0m        0.2343       0.9117        [94m0.2617[0m     +  25.0006
     33   [36m0.2889[0m   [32m0.7690[0m        0.2334       0.9141        [94m0.2616[0m     +  24.8421
     34   [36m0.2916[0m   [32m0.7697[0m        [35m0.2325[0m       0.9141        [94m0.2614[0m     +  24.9358
     35   [36m0.2934[0m   [32m0.7700[0m        [35m0.2315[0m       0.9141        0.2616        24.8385
     36   0.2927   [32m0.7709[0m        0.2322       0.9141        [94m0.2611[0m     +  24.8377
     37   0.2927   [32m0.7714[0m        0.2321       0.9141        0.2611        24.7864
     38   0.2925   [32m0.7720[0m        [35m0.2312[0m       0.9141        0.2612        25.0604
     39   0.2920   [32m0.7727[0m        0.2315       0.9141        [94m0.2610[0m     +  24.8126
     40   0.2910   [32m0.7731[0m        0.2317       0.9141        0.2611        24.7854
     41   0.2914   [32m0.7735[0m        [35m0.2306[0m       0.9141        0.2612        24.7923
     42   0.2924   [32m0.7739[0m        [35m0.2306[0m       0.9141        0.2610        24.9049
     43   0.2917   [32m0.7742[0m        0.2319       0.9141        [94m0.2607[0m     +  25.0512
     44   0.2921   [32m0.7744[0m        0.2307       0.9141        0.2609        24.7877
     45   0.2926   [32m0.7753[0m        0.2306       0.9141        0.2608        24.9309
     46   0.2923   [32m0.7756[0m        0.2314       0.9141        0.2608        24.8811
     47   0.2926   [32m0.7760[0m        [35m0.2305[0m       0.9141        0.2608        24.6983
     48   0.2908   [32m0.7763[0m        0.2314       0.9141        0.2610        24.8565
     49   0.2927   [32m0.7770[0m        [35m0.2302[0m       0.9141        [94m0.2604[0m     +  25.0961
     50   0.2915   [32m0.7772[0m        0.2308       [31m0.9154[0m        [94m0.2603[0m     +  24.9671
[32m[I 2023-05-04 08:21:48,326][0m Trial 418 finished with value: 0.26034602723754446 and parameters: {'lr': 1.272640161388567e-06, 'dropout': 0.3260007403554191, 'd_model_multiplier': 4, 'num_layers': 5, 'n_heads': 32, 'dim_feedforward': 379, 'batch_size': 15, 'pos_encoding': 'fixed', 'activation': 'relu', 'norm': 'LayerNorm', 'optimizer_name': 'AdamW', 'weight_decay': 0.1, 'top_n_features': 104}. Best is trial 246 with value: 0.16447311791139763.[0m
[FileBasedDataset] Initializing dataset...
	Examples: 8264
	Features: 69
	Max length: 315
Standard scalar turned ON, loading params from cache
[FileBasedDataset] Dataset initialization complete
  epoch    auprc    auroc    train_loss    valid_acc    valid_loss    cp      dur
-------  -------  -------  ------------  -----------  ------------  ----  -------
      1   [36m0.0567[0m   [32m0.3371[0m        [35m0.7164[0m       [31m0.4027[0m        [94m0.6929[0m     +  31.0305
      2   0.0557   0.3198        [35m0.6864[0m       [31m0.7328[0m        [94m0.6513[0m     +  30.9303
      3   [36m0.0591[0m   0.3106        [35m0.6461[0m       [31m0.9105[0m        [94m0.6034[0m     +  31.1040
      4   0.0587   0.3054        [35m0.5994[0m       [31m0.9250[0m        [94m0.5542[0m     +  30.9786
      5   0.0572   0.3000        [35m0.5519[0m       0.9250        [94m0.5070[0m     +  31.0310
      6   0.0554   0.2962        [35m0.5082[0m       0.9250        [94m0.4638[0m     +  31.3502
      7   0.0540   0.2986        [35m0.4660[0m       0.9250        [94m0.4249[0m     +  31.3083
      8   0.0540   0.3094        [35m0.4297[0m       0.9250        [94m0.3909[0m     +  31.3261
      9   0.0550   0.3265        [35m0.3970[0m       0.9250        [94m0.3629[0m     +  31.0953
     10   0.0565   [32m0.3507[0m        [35m0.3710[0m       0.9250        [94m0.3411[0m     +  31.5603
     11   0.0579   [32m0.3753[0m        [35m0.3491[0m       0.9250        [94m0.3243[0m     +  31.2907
     12   [36m0.0604[0m   [32m0.4085[0m        [35m0.3324[0m       0.9250        [94m0.3112[0m     +  31.3344
     13   [36m0.0639[0m   [32m0.4436[0m        [35m0.3202[0m       0.9250        [94m0.3010[0m     +  31.1958
     14   [36m0.0678[0m   [32m0.4732[0m        [35m0.3099[0m       0.9250        [94m0.2927[0m     +  31.2251
     15   [36m0.0729[0m   [32m0.5034[0m        [35m0.3006[0m       0.9250        [94m0.2858[0m     +  31.3716
     16   [36m0.0807[0m   [32m0.5318[0m        [35m0.2941[0m       0.9250        [94m0.2801[0m     +  31.1563
     17   [36m0.0901[0m   [32m0.5534[0m        [35m0.2878[0m       0.9250        [94m0.2754[0m     +  31.1287
     18   [36m0.0994[0m   [32m0.5763[0m        [35m0.2827[0m       0.9250        [94m0.2713[0m     +  31.1274
     19   [36m0.1084[0m   [32m0.5953[0m        [35m0.2779[0m       0.9250        [94m0.2678[0m     +  31.2602
     20   [36m0.1139[0m   [32m0.6099[0m        [35m0.2739[0m       0.9250        [94m0.2648[0m     +  31.2992
     21   [36m0.1243[0m   [32m0.6268[0m        [35m0.2712[0m       0.9250        [94m0.2622[0m     +  31.3118
     22   [36m0.1354[0m   [32m0.6402[0m        [35m0.2680[0m       0.9238        [94m0.2599[0m     +  31.2838
     23   [36m0.1440[0m   [32m0.6508[0m        [35m0.2655[0m       0.9238        [94m0.2579[0m     +  31.2543
     24   [36m0.1483[0m   [32m0.6585[0m        [35m0.2634[0m       0.9238        [94m0.2562[0m     +  31.3164
     25   [36m0.1551[0m   [32m0.6680[0m        [35m0.2603[0m       0.9238        [94m0.2546[0m     +  31.1614
     26   [36m0.1597[0m   [32m0.6758[0m        [35m0.2582[0m       0.9238        [94m0.2533[0m     +  31.1374
     27   [36m0.1633[0m   [32m0.6814[0m        [35m0.2556[0m       0.9238        [94m0.2521[0m     +  31.0511
     28   [36m0.1671[0m   [32m0.6875[0m        [35m0.2548[0m       0.9238        [94m0.2510[0m     +  31.1951
     29   [36m0.1710[0m   [32m0.6932[0m        [35m0.2530[0m       0.9238        [94m0.2500[0m     +  31.3093
     30   [36m0.1750[0m   [32m0.6988[0m        [35m0.2527[0m       0.9214        [94m0.2490[0m     +  31.0420
     31   [36m0.1772[0m   [32m0.7028[0m        [35m0.2505[0m       0.9202        [94m0.2481[0m     +  31.1234
     32   [36m0.1803[0m   [32m0.7066[0m        [35m0.2487[0m       0.9202        [94m0.2475[0m     +  31.3057
     33   [36m0.1822[0m   [32m0.7100[0m        [35m0.2480[0m       0.9202        [94m0.2469[0m     +  31.3904
     34   [36m0.1845[0m   [32m0.7131[0m        [35m0.2472[0m       0.9202        [94m0.2463[0m     +  30.9373
     35   [36m0.1868[0m   [32m0.7164[0m        [35m0.2466[0m       0.9202        [94m0.2457[0m     +  31.2860
     36   [36m0.1882[0m   [32m0.7192[0m        [35m0.2464[0m       0.9202        [94m0.2451[0m     +  31.2130
     37   [36m0.1891[0m   [32m0.7214[0m        [35m0.2452[0m       0.9202        [94m0.2448[0m     +  31.1939
     38   [36m0.1918[0m   [32m0.7239[0m        0.2452       0.9202        [94m0.2443[0m     +  31.1422
     39   [36m0.1942[0m   [32m0.7263[0m        [35m0.2440[0m       0.9202        [94m0.2438[0m     +  31.2862
     40   [36m0.1968[0m   [32m0.7289[0m        [35m0.2431[0m       0.9202        [94m0.2435[0m     +  31.3665
     41   [36m0.1994[0m   [32m0.7312[0m        [35m0.2428[0m       0.9202        [94m0.2430[0m     +  31.0369
     42   [36m0.2013[0m   [32m0.7331[0m        [35m0.2425[0m       0.9202        [94m0.2426[0m     +  31.2053
     43   [36m0.2033[0m   [32m0.7350[0m        [35m0.2412[0m       0.9202        [94m0.2424[0m     +  31.3046
     44   [36m0.2036[0m   [32m0.7358[0m        0.2413       0.9214        [94m0.2420[0m     +  31.1588
     45   [36m0.2043[0m   [32m0.7367[0m        [35m0.2406[0m       0.9214        [94m0.2418[0m     +  31.2173
     46   [36m0.2049[0m   [32m0.7384[0m        [35m0.2397[0m       0.9214        [94m0.2414[0m     +  31.3754
     47   [36m0.2064[0m   [32m0.7399[0m        0.2404       0.9214        [94m0.2410[0m     +  31.0794
     48   [36m0.2070[0m   [32m0.7406[0m        0.2400       0.9214        [94m0.2409[0m     +  31.3099
     49   [36m0.2078[0m   [32m0.7415[0m        [35m0.2393[0m       0.9214        [94m0.2406[0m     +  31.2538
     50   [36m0.2099[0m   [32m0.7430[0m        [35m0.2383[0m       0.9214        [94m0.2403[0m     +  31.6939
