[32m[I 2023-05-02 06:34:14,653][0m Trial 51 finished with value: 0.4498369267802717 and parameters: {'lr': 0.005683690037493059, 'dropout': 0.5695813513862762, 'd_model_multiplier': 64, 'num_layers': 9, 'n_heads': 16, 'dim_feedforward': 262, 'batch_size': 60, 'pos_encoding': 'fixed', 'activation': 'gelu', 'norm': 'BatchNorm', 'optimizer_name': 'AdamW', 'weight_decay': 0, 'top_n_features': 221}. Best is trial 12 with value: 0.20472501771481755.[0m
[FileBasedDataset] Initializing dataset...
	Examples: 8264
	Features: 212
	Max length: 315
Standard scalar turned ON, loading params from cache
[FileBasedDataset] Dataset initialization complete
  epoch    auprc    auroc    train_loss    valid_acc    valid_loss    cp     dur
-------  -------  -------  ------------  -----------  ------------  ----  ------
      1   [36m0.2310[0m   [32m0.6917[0m        [35m0.2891[0m       [31m0.8017[0m        [94m0.6183[0m     +  9.2162
      2   0.1619   0.5309        [35m0.2781[0m       0.7715        0.6452        9.0011
      3   0.0677   0.3800        [35m0.2760[0m       0.7956        0.6329        9.0262
      4   [36m0.2343[0m   [32m0.7162[0m        0.2845       [31m0.8646[0m        [94m0.5815[0m     +  9.4560
      5   0.1040   0.5079        0.2794       [31m0.9274[0m        [94m0.3355[0m     +  9.0845
      6   0.1254   0.5581        0.2831       0.9274        [94m0.2658[0m     +  9.4462
      7   [36m0.2566[0m   0.7127        0.2776       0.9274        [94m0.2374[0m     +  9.2288
      8   0.2434   [32m0.7609[0m        [35m0.2682[0m       0.9274        [94m0.2354[0m     +  9.0821
      9   [36m0.2641[0m   [32m0.7839[0m        [35m0.2644[0m       0.9262        [94m0.2220[0m     +  9.3122
     10   [36m0.2835[0m   0.7582        [35m0.2597[0m       [31m0.9287[0m        0.2274        9.1786
     11   [36m0.2960[0m   0.7789        0.2615       0.9287        0.2234        9.3610
     12   0.2787   0.7767        [35m0.2558[0m       0.9287        0.2230        9.4394
     13   [36m0.3172[0m   [32m0.7982[0m        [35m0.2523[0m       [31m0.9299[0m        [94m0.2148[0m     +  9.0465
     14   0.3132   0.7700        [35m0.2470[0m       0.9287        0.2202        9.2982
     15   [36m0.3290[0m   0.7969        [35m0.2410[0m       0.9299        [94m0.2144[0m     +  9.1807
     16   0.3100   0.7830        [35m0.2403[0m       [31m0.9311[0m        0.2178        9.1296
     17   0.3010   0.7751        0.2403       0.9287        0.2238        9.3232
     18   0.2962   0.7852        [35m0.2373[0m       0.9299        0.2190        9.0630
     19   0.2952   0.7749        0.2403       0.9287        0.2228        9.3345
     20   0.3022   [32m0.8028[0m        0.2392       0.9299        0.2156        8.9189
     21   0.3163   0.7965        [35m0.2369[0m       [31m0.9323[0m        0.2159        9.1539
     22   0.3144   [32m0.8056[0m        [35m0.2364[0m       0.9299        0.2149        9.2191
     23   0.3276   [32m0.8123[0m        0.2370       0.9323        [94m0.2124[0m     +  9.4910
     24   [36m0.3368[0m   0.8080        0.2366       0.9323        0.2126        9.2010
     25   0.3167   0.8109        [35m0.2341[0m       0.9311        0.2152        9.2194
     26   0.3183   0.8081        0.2358       0.9299        0.2173        9.1439
     27   0.3212   [32m0.8157[0m        0.2347       0.9311        0.2144        9.5990
     28   0.3138   0.8015        [35m0.2335[0m       0.9262        0.2167        9.3747
     29   0.3218   0.7987        0.2371       0.9323        0.2166        9.1578
     30   0.2969   0.7794        0.2339       0.9262        0.2225        9.4378
     31   0.3099   0.8020        [35m0.2324[0m       0.9287        0.2170        9.1897
     32   0.3027   0.8001        0.2350       0.9287        0.2182        9.2829
Stopping since valid_loss has not improved in the last 10 epochs.
[32m[I 2023-05-02 06:39:20,263][0m Trial 52 finished with value: 0.2124404691907486 and parameters: {'lr': 0.0010686938688129585, 'dropout': 0.5257726747179655, 'd_model_multiplier': 8, 'num_layers': 1, 'n_heads': 16, 'dim_feedforward': 243, 'batch_size': 42, 'pos_encoding': 'fixed', 'activation': 'gelu', 'norm': 'BatchNorm', 'optimizer_name': 'AdamW', 'weight_decay': 0.1, 'top_n_features': 212}. Best is trial 12 with value: 0.20472501771481755.[0m
[FileBasedDataset] Initializing dataset...
	Examples: 8264
	Features: 200
	Max length: 315
Standard scalar turned ON, loading params from cache
[FileBasedDataset] Dataset initialization complete
  epoch    auprc    auroc    train_loss    valid_acc    valid_loss    cp     dur
-------  -------  -------  ------------  -----------  ------------  ----  ------
      1   [36m0.1128[0m   [32m0.3951[0m        [35m0.2833[0m       [31m0.1415[0m        [94m1.0385[0m     +  9.7542
      2   0.1009   [32m0.4264[0m        [35m0.2637[0m       [31m0.2140[0m        [94m0.8007[0m     +  9.7902
      3   0.0922   0.3634        0.2638       0.1971        0.8667        10.2120
      4   [36m0.1365[0m   [32m0.5438[0m        0.2695       0.1294        0.9682        10.7967
      5   0.0965   0.3877        [35m0.2622[0m       0.1898        0.8408        10.3498
      6   [36m0.2264[0m   [32m0.6561[0m        [35m0.2597[0m       [31m0.5949[0m        [94m0.6713[0m     +  10.3529
      7   0.1609   0.6062        0.2688       [31m0.9021[0m        [94m0.5168[0m     +  10.3794
      8   0.2193   0.6130        0.2743       [31m0.9105[0m        [94m0.4204[0m     +  10.2430
      9   [36m0.2565[0m   [32m0.7221[0m        0.2611       0.9081        [94m0.3709[0m     +  10.2917
     10   [36m0.2821[0m   [32m0.7408[0m        0.2628       0.9069        [94m0.3585[0m     +  10.4319
     11   0.2789   [32m0.7492[0m        0.2620       0.9105        [94m0.2771[0m     +  10.3239
     12   0.2673   [32m0.7621[0m        [35m0.2582[0m       0.9033        0.2827        10.2767
     13   0.2818   0.7573        0.2650       0.9093        [94m0.2692[0m     +  10.1141
     14   [36m0.2884[0m   [32m0.7654[0m        [35m0.2549[0m       0.9057        0.2728        9.9341
     15   0.2871   0.7550        [35m0.2511[0m       0.9093        0.2984        10.3466
     16   0.2852   [32m0.7673[0m        0.2537       0.9081        0.2779        10.4088
     17   0.2845   0.7606        0.2527       0.9105        0.2707        10.6142
     18   0.2747   [32m0.7723[0m        [35m0.2447[0m       0.9033        0.2762        10.5160
     19   0.2674   0.7717        0.2491       0.9045        0.2692        10.2260
     20   0.2788   0.7657        [35m0.2417[0m       0.9081        0.2693        10.2736
     21   [36m0.2901[0m   0.7682        0.2432       0.9081        [94m0.2687[0m     +  10.1912
     22   [36m0.3038[0m   0.7723        [35m0.2408[0m       0.9069        [94m0.2650[0m     +  10.1423
     23   0.2896   0.7698        0.2433       0.9105        0.2666        10.3449
     24   0.3027   [32m0.7744[0m        [35m0.2403[0m       0.9093        [94m0.2632[0m     +  10.4501
     25   0.3016   [32m0.7766[0m        [35m0.2362[0m       0.9057        0.2657        10.1690
     26   [36m0.3072[0m   [32m0.7794[0m        [35m0.2337[0m       0.9093        0.2639        10.1510
     27   [36m0.3161[0m   [32m0.7832[0m        0.2369       [31m0.9129[0m        [94m0.2602[0m     +  10.4010
     28   0.2855   0.7600        [35m0.2333[0m       0.9069        0.2666        10.4747
     29   0.3125   0.7755        0.2338       [31m0.9154[0m        0.2613        10.7810
     30   0.3160   0.7827        0.2339       0.9117        0.2624        10.5130
     31   [36m0.3325[0m   [32m0.7908[0m        0.2369       0.9117        [94m0.2565[0m     +  10.4735
     32   [36m0.3345[0m   0.7869        [35m0.2310[0m       [31m0.9178[0m        0.2580        10.4058
     33   [36m0.3403[0m   0.7903        [35m0.2287[0m       0.9154        0.2619        10.4083
     34   0.3360   0.7905        0.2305       0.9154        0.2606        10.5954
     35   0.3371   0.7893        0.2299       0.9093        0.2582        10.6611
     36   0.3380   0.7898        0.2319       0.9154        0.2595        10.5327
     37   0.3366   0.7888        0.2305       0.9154        0.2591        10.2340
     38   [36m0.3468[0m   0.7904        0.2322       0.9141        0.2582        10.5105
     39   0.3377   0.7901        0.2306       0.9093        [94m0.2560[0m     +  10.3285
     40   [36m0.3477[0m   0.7865        [35m0.2287[0m       0.9117        0.2586        10.2328
     41   0.3380   0.7843        0.2331       0.9166        0.2601        10.2653
     42   [36m0.3516[0m   0.7857        [35m0.2272[0m       0.9154        0.2578        10.5024
     43   0.3425   0.7877        0.2315       0.9154        0.2584        10.1448
     44   [36m0.3586[0m   0.7868        0.2305       0.9117        [94m0.2554[0m     +  10.3095
     45   0.3466   0.7880        0.2294       0.9166        [94m0.2542[0m     +  10.2571
     46   0.3537   0.7908        0.2274       0.9154        0.2602        10.2106
     47   0.3512   0.7842        0.2285       0.9129        0.2598        10.3156
     48   0.3538   0.7871        0.2292       0.9166        0.2588        10.7174
     49   0.3551   0.7870        0.2303       0.9117        0.2583        10.9623
     50   [36m0.3644[0m   [32m0.7915[0m        0.2289       0.9117        [94m0.2542[0m     +  11.1863
[32m[I 2023-05-02 06:47:59,840][0m Trial 53 finished with value: 0.2542142234517412 and parameters: {'lr': 0.0016236003598109822, 'dropout': 0.5333527930415983, 'd_model_multiplier': 8, 'num_layers': 1, 'n_heads': 16, 'dim_feedforward': 235, 'batch_size': 113, 'pos_encoding': 'fixed', 'activation': 'gelu', 'norm': 'BatchNorm', 'optimizer_name': 'AdamW', 'weight_decay': 0.1, 'top_n_features': 200}. Best is trial 12 with value: 0.20472501771481755.[0m
[FileBasedDataset] Initializing dataset...
	Examples: 8264
	Features: 213
	Max length: 315
Standard scalar turned ON, loading params from cache
[FileBasedDataset] Dataset initialization complete
  epoch    auprc    auroc    train_loss    valid_acc    valid_loss    cp     dur
-------  -------  -------  ------------  -----------  ------------  ----  ------
      1   [36m0.2576[0m   [32m0.7119[0m        [35m0.2877[0m       [31m0.9238[0m        [94m0.3661[0m     +  9.5619
      2   0.2501   [32m0.7321[0m        [35m0.2558[0m       0.9190        [94m0.3507[0m     +  8.6374
      3   0.2467   0.7281        [35m0.2510[0m       0.9226        [94m0.3506[0m     +  9.2355
      4   0.2342   0.7261        [35m0.2471[0m       0.9202        [94m0.3488[0m     +  9.0704
      5   0.2262   0.7245        [35m0.2454[0m       0.9202        [94m0.3433[0m     +  9.3455
      6   0.2258   0.7182        [35m0.2439[0m       0.9178        [94m0.3378[0m     +  9.3594
      7   0.2250   0.7130        0.2445       0.9226        [94m0.3330[0m     +  9.5164
      8   0.2238   0.7208        [35m0.2437[0m       0.9154        0.3605        9.4335
      9   0.2121   0.7110        [35m0.2429[0m       0.9154        0.3456        9.3521
     10   0.2192   0.7246        [35m0.2413[0m       0.9166        0.3530        9.4034
     11   0.2099   0.7099        [35m0.2379[0m       0.9166        0.3463        9.5915
     12   0.2091   0.7028        0.2403       0.9178        0.3393        9.7264
     13   0.2175   0.7055        [35m0.2375[0m       0.9178        0.3511        9.4292
     14   0.2159   0.6949        0.2388       0.9166        0.3438        9.5251
     15   0.2110   0.6939        [35m0.2366[0m       0.9154        0.3545        9.5648
     16   0.1992   0.6723        0.2392       0.9190        0.3495        9.5148
Stopping since valid_loss has not improved in the last 10 epochs.
[32m[I 2023-05-02 06:50:40,041][0m Trial 54 finished with value: 0.33300036451404297 and parameters: {'lr': 0.00012734176610861684, 'dropout': 0.5973291487378216, 'd_model_multiplier': 8, 'num_layers': 1, 'n_heads': 16, 'dim_feedforward': 291, 'batch_size': 46, 'pos_encoding': 'fixed', 'activation': 'gelu', 'norm': 'BatchNorm', 'optimizer_name': 'AdamW', 'weight_decay': 0.1, 'top_n_features': 213}. Best is trial 12 with value: 0.20472501771481755.[0m
[FileBasedDataset] Initializing dataset...
	Examples: 8264
	Features: 155
	Max length: 315
Standard scalar turned ON, loading params from cache
[FileBasedDataset] Dataset initialization complete
  epoch    auprc    auroc    train_loss    valid_acc    valid_loss    cp      dur
-------  -------  -------  ------------  -----------  ------------  ----  -------
      1   [36m0.1794[0m   [32m0.5731[0m        [35m0.3055[0m       [31m0.9008[0m        [94m0.3453[0m     +  20.7274
      2   [36m0.2548[0m   [32m0.7829[0m        [35m0.2766[0m       0.8912        0.3699        20.8119
      3   [36m0.2680[0m   0.7377        [35m0.2672[0m       [31m0.9226[0m        [94m0.2737[0m     +  21.0885
      4   [36m0.2771[0m   0.7683        0.2769       0.8295        0.4229        21.3446
      5   0.2383   0.7692        [35m0.2614[0m       0.9226        0.2737        21.1152
      6   0.2194   0.7520        0.2706       0.9226        [94m0.2487[0m     +  21.3287
      7   0.2223   0.7505        0.2641       0.9226        0.2586        21.1313
      8   0.2317   0.7459        0.2835       0.9129        [94m0.2469[0m     +  21.1719
      9   0.2002   0.7445        0.2861       0.9226        [94m0.2444[0m     +  21.4389
     10   0.2280   0.7316        0.2699       0.9226        0.2510        21.4404
     11   0.2250   0.7391        0.2727       0.9226        [94m0.2430[0m     +  21.1451
     12   0.2162   0.7434        0.2749       0.9214        0.2549        20.9827
     13   0.2111   0.7469        0.2848       0.9226        0.2461        21.3882
     14   0.2229   0.7493        0.2695       0.9226        [94m0.2415[0m     +  21.4525
     15   0.2245   0.7520        0.2928       0.9226        0.2463        21.3881
     16   0.2298   0.7464        0.2800       0.9226        [94m0.2413[0m     +  21.1753
     17   0.2104   0.7428        0.2772       0.9226        0.2544        21.1554
     18   0.2082   0.7423        0.2835       0.9226        [94m0.2411[0m     +  21.0524
     19   0.2301   0.7524        0.2754       0.9226        [94m0.2410[0m     +  21.1724
     20   0.2204   0.7349        0.2754       0.9226        0.2447        21.3030
     21   0.2175   0.7447        0.2615       0.9226        0.2415        21.2148
     22   0.2252   0.7515        0.2623       0.9226        [94m0.2396[0m     +  21.1648
     23   0.2364   0.7527        0.2675       0.9154        0.2488        21.0066
     24   0.2125   0.7469        0.2767       0.9226        0.2426        21.4997
     25   0.2038   0.7297        0.2838       0.9226        0.2452        21.6699
     26   0.2324   0.7480        0.2633       0.9226        0.2418        21.3576
     27   0.2185   0.7344        0.2821       0.9226        0.2508        20.9958
     28   0.2226   0.7507        0.2667       0.9214        0.2409        20.8741
     29   0.2380   0.7507        0.2730       0.9226        0.2401        21.0173
     30   0.2397   0.7463        0.2806       0.9226        0.2447        21.2319
     31   0.2051   0.7354        0.2864       0.9226        0.2460        21.3761
Stopping since valid_loss has not improved in the last 10 epochs.
[32m[I 2023-05-02 07:02:00,199][0m Trial 55 finished with value: 0.23957668174567218 and parameters: {'lr': 0.0011827782066901006, 'dropout': 0.5026514375381643, 'd_model_multiplier': 8, 'num_layers': 7, 'n_heads': 16, 'dim_feedforward': 415, 'batch_size': 86, 'pos_encoding': 'fixed', 'activation': 'gelu', 'norm': 'BatchNorm', 'optimizer_name': 'AdamW', 'weight_decay': 0.1, 'top_n_features': 155}. Best is trial 12 with value: 0.20472501771481755.[0m
[FileBasedDataset] Initializing dataset...
	Examples: 8264
	Features: 227
	Max length: 315
Standard scalar turned ON, loading params from cache
[FileBasedDataset] Dataset initialization complete
  epoch    auprc    auroc    train_loss    valid_acc    valid_loss    cp     dur
-------  -------  -------  ------------  -----------  ------------  ----  ------
      1   [36m0.2428[0m   [32m0.7618[0m        [35m0.2809[0m       [31m0.9250[0m        [94m0.2255[0m     +  8.7122
      2   0.2393   0.7512        [35m0.2674[0m       0.9154        0.2475        8.8703
      3   [36m0.2560[0m   [32m0.7692[0m        [35m0.2624[0m       0.9069        0.2683        8.9711
      4   [36m0.2776[0m   [32m0.7782[0m        [35m0.2592[0m       0.8912        0.2846        9.0555
      5   [36m0.3019[0m   [32m0.7975[0m        [35m0.2579[0m       0.9178        0.2510        9.0671
      6   0.2792   0.7833        [35m0.2546[0m       0.8815        0.3140        9.3345
      7   [36m0.3203[0m   [32m0.8035[0m        [35m0.2504[0m       [31m0.9299[0m        [94m0.2252[0m     +  9.1203
      8   [36m0.3261[0m   [32m0.8057[0m        0.2525       [31m0.9359[0m        [94m0.2173[0m     +  9.3739
      9   [36m0.3268[0m   [32m0.8067[0m        [35m0.2457[0m       0.9323        0.2181        9.2306
     10   0.2977   0.7967        0.2476       0.9214        0.2238        9.3428
     11   0.3003   [32m0.8090[0m        [35m0.2420[0m       0.9141        0.2335        9.2343
     12   0.3155   0.8078        [35m0.2386[0m       0.9081        0.2474        9.1019
     13   0.2991   [32m0.8226[0m        0.2417       0.9226        0.2179        9.1348
     14   0.2870   0.8158        [35m0.2384[0m       0.9226        0.2177        9.6709
     15   0.2880   0.8156        [35m0.2363[0m       0.9335        [94m0.2115[0m     +  9.9644
     16   0.2801   0.8170        0.2372       0.9287        0.2136        9.9057
     17   0.2870   0.8011        [35m0.2353[0m       0.9299        0.2140        9.6710
     18   0.2952   0.7904        [35m0.2329[0m       0.9154        0.2360        9.2233
     19   0.2985   0.7924        [35m0.2325[0m       0.9081        0.2449        9.1377
     20   0.3023   0.7984        [35m0.2304[0m       0.9045        0.2537        9.3104
     21   0.3031   0.8083        0.2314       0.9057        0.2542        9.1316
     22   0.2601   0.8006        [35m0.2287[0m       0.9129        0.2420        9.2456
     23   0.2778   0.8112        [35m0.2275[0m       0.9178        0.2319        9.2607
     24   0.2869   0.8053        0.2304       0.9117        0.2393        9.2893
Stopping since valid_loss has not improved in the last 10 epochs.
