[32m[I 2023-05-02 16:26:43,459][0m Trial 169 finished with value: 0.2722642102527647 and parameters: {'lr': 0.00048168941012985774, 'dropout': 0.5012165669347332, 'd_model_multiplier': 16, 'num_layers': 8, 'n_heads': 32, 'dim_feedforward': 439, 'batch_size': 9, 'pos_encoding': 'learnable', 'activation': 'gelu', 'norm': 'BatchNorm', 'optimizer_name': 'PlainRAdam', 'weight_decay': 0, 'top_n_features': 151}. Best is trial 117 with value: 0.191397856754288.[0m
[FileBasedDataset] Initializing dataset...
	Examples: 8264
	Features: 177
	Max length: 315
Standard scalar turned ON, loading params from cache
[FileBasedDataset] Dataset initialization complete
  epoch    auprc    auroc    train_loss    valid_acc    valid_loss    cp      dur
-------  -------  -------  ------------  -----------  ------------  ----  -------
      1   [36m0.0597[0m   [32m0.3555[0m        [35m0.6428[0m       [31m0.9202[0m        [94m0.6307[0m     +  11.8112
      2   0.0554   0.3371        [35m0.6315[0m       [31m0.9274[0m        [94m0.6142[0m     +  11.9564
      3   0.0536   0.3226        [35m0.6171[0m       [31m0.9347[0m        [94m0.5943[0m     +  11.9446
      4   0.0531   0.3102        [35m0.6003[0m       [31m0.9359[0m        [94m0.5727[0m     +  11.6902
      5   0.0524   0.3010        [35m0.5804[0m       0.9359        [94m0.5504[0m     +  10.6703
      6   0.0530   0.2957        [35m0.5612[0m       0.9359        [94m0.5284[0m     +  11.3164
      7   0.0541   0.2926        [35m0.5429[0m       0.9359        [94m0.5071[0m     +  11.4440
      8   0.0544   0.2914        [35m0.5255[0m       0.9359        [94m0.4864[0m     +  11.7479
      9   0.0544   0.2906        [35m0.5062[0m       0.9359        [94m0.4660[0m     +  11.6433
     10   0.0561   0.2918        [35m0.4895[0m       0.9359        [94m0.4455[0m     +  11.8096
     11   0.0559   0.2949        [35m0.4725[0m       0.9359        [94m0.4251[0m     +  11.6708
     12   0.0575   0.2990        [35m0.4548[0m       0.9359        [94m0.4048[0m     +  11.8963
     13   0.0595   0.3050        [35m0.4398[0m       0.9359        [94m0.3846[0m     +  11.7130
     14   0.0549   0.3160        [35m0.4217[0m       0.9359        [94m0.3653[0m     +  11.7706
     15   0.0560   0.3313        [35m0.4045[0m       0.9359        [94m0.3469[0m     +  11.8117
     16   0.0563   0.3509        [35m0.3916[0m       0.9359        [94m0.3309[0m     +  11.6805
     17   0.0559   [32m0.3691[0m        [35m0.3788[0m       0.9359        [94m0.3171[0m     +  11.6266
     18   0.0548   [32m0.3848[0m        [35m0.3650[0m       0.9359        [94m0.3053[0m     +  11.5084
     19   0.0557   [32m0.4041[0m        [35m0.3540[0m       0.9359        [94m0.2952[0m     +  11.7068
     20   0.0572   [32m0.4258[0m        [35m0.3430[0m       0.9359        [94m0.2866[0m     +  11.6179
     21   0.0588   [32m0.4467[0m        [35m0.3347[0m       0.9359        [94m0.2793[0m     +  11.5638
     22   [36m0.0617[0m   [32m0.4676[0m        [35m0.3271[0m       0.9359        [94m0.2731[0m     +  12.0900
     23   [36m0.0674[0m   [32m0.4885[0m        [35m0.3180[0m       0.9359        [94m0.2678[0m     +  11.4975
     24   [36m0.0739[0m   [32m0.5077[0m        [35m0.3133[0m       0.9359        [94m0.2633[0m     +  11.9588
     25   [36m0.0822[0m   [32m0.5232[0m        [35m0.3081[0m       0.9359        [94m0.2594[0m     +  11.7159
     26   [36m0.0881[0m   [32m0.5364[0m        [35m0.3044[0m       0.9359        [94m0.2560[0m     +  11.8205
     27   [36m0.0920[0m   [32m0.5454[0m        [35m0.2992[0m       0.9359        [94m0.2531[0m     +  11.5344
     28   [36m0.0959[0m   [32m0.5544[0m        [35m0.2955[0m       0.9359        [94m0.2505[0m     +  11.9704
     29   [36m0.0989[0m   [32m0.5612[0m        [35m0.2921[0m       0.9359        [94m0.2482[0m     +  11.9114
     30   [36m0.1024[0m   [32m0.5660[0m        [35m0.2885[0m       0.9359        [94m0.2461[0m     +  11.5352
     31   [36m0.1064[0m   [32m0.5724[0m        [35m0.2860[0m       0.9359        [94m0.2442[0m     +  11.7699
     32   [36m0.1102[0m   [32m0.5799[0m        [35m0.2860[0m       0.9359        [94m0.2426[0m     +  11.4579
     33   [36m0.1129[0m   [32m0.5863[0m        [35m0.2810[0m       0.9359        [94m0.2411[0m     +  11.7640
     34   [36m0.1166[0m   [32m0.5920[0m        [35m0.2791[0m       0.9359        [94m0.2397[0m     +  11.8590
     35   [36m0.1179[0m   [32m0.5976[0m        [35m0.2781[0m       0.9359        [94m0.2386[0m     +  11.8498
     36   [36m0.1192[0m   [32m0.6012[0m        [35m0.2763[0m       0.9359        [94m0.2375[0m     +  11.8446
     37   [36m0.1204[0m   [32m0.6059[0m        [35m0.2722[0m       0.9359        [94m0.2365[0m     +  11.8631
     38   [36m0.1223[0m   [32m0.6109[0m        0.2731       0.9359        [94m0.2356[0m     +  11.7952
     39   [36m0.1237[0m   [32m0.6170[0m        [35m0.2705[0m       0.9359        [94m0.2348[0m     +  11.8202
     40   [36m0.1244[0m   [32m0.6197[0m        0.2708       0.9359        [94m0.2341[0m     +  11.6175
     41   [36m0.1260[0m   [32m0.6235[0m        [35m0.2674[0m       0.9359        [94m0.2334[0m     +  12.2527
     42   0.1260   [32m0.6256[0m        [35m0.2671[0m       0.9359        [94m0.2328[0m     +  12.0597
     43   [36m0.1265[0m   [32m0.6281[0m        0.2676       0.9359        [94m0.2322[0m     +  11.8416
     44   0.1264   [32m0.6307[0m        [35m0.2651[0m       0.9359        [94m0.2317[0m     +  11.9344
     45   [36m0.1268[0m   [32m0.6328[0m        [35m0.2633[0m       0.9359        [94m0.2312[0m     +  11.9126
     46   [36m0.1279[0m   [32m0.6354[0m        0.2653       0.9359        [94m0.2308[0m     +  11.9156
     47   [36m0.1285[0m   [32m0.6370[0m        0.2634       0.9359        [94m0.2304[0m     +  11.8166
     48   0.1277   [32m0.6388[0m        [35m0.2622[0m       0.9359        [94m0.2300[0m     +  12.1803
     49   0.1278   [32m0.6414[0m        [35m0.2616[0m       0.9359        [94m0.2297[0m     +  11.7274
     50   [36m0.1290[0m   [32m0.6444[0m        0.2628       0.9359        [94m0.2294[0m     +  11.7958
[32m[I 2023-05-02 16:36:33,091][0m Trial 170 finished with value: 0.2293756976993946 and parameters: {'lr': 2.175870936045356e-05, 'dropout': 0.44262386674815585, 'd_model_multiplier': 1, 'num_layers': 2, 'n_heads': 16, 'dim_feedforward': 128, 'batch_size': 178, 'pos_encoding': 'fixed', 'activation': 'relu', 'norm': 'LayerNorm', 'optimizer_name': 'RAdam', 'weight_decay': 0.1, 'top_n_features': 177}. Best is trial 117 with value: 0.191397856754288.[0m
[FileBasedDataset] Initializing dataset...
	Examples: 8264
	Features: 186
	Max length: 315
Standard scalar turned ON, loading params from cache
[FileBasedDataset] Dataset initialization complete
  epoch    auprc    auroc    train_loss    valid_acc    valid_loss    cp     dur
-------  -------  -------  ------------  -----------  ------------  ----  ------
      1   [36m0.2145[0m   [32m0.7005[0m        [35m0.3091[0m       [31m0.9226[0m        [94m0.4609[0m     +  9.1594
      2   [36m0.2500[0m   0.6910        [35m0.2612[0m       0.9214        [94m0.3957[0m     +  9.4362
      3   0.2468   0.6628        [35m0.2573[0m       0.9226        [94m0.3560[0m     +  9.6787
      4   0.2092   0.6467        0.2577       0.9226        [94m0.3135[0m     +  9.5772
      5   0.2385   0.6757        [35m0.2544[0m       0.9190        0.3255        9.7395
      6   [36m0.2522[0m   [32m0.7144[0m        [35m0.2533[0m       0.9045        0.3363        9.4608
      7   0.2448   [32m0.7160[0m        [35m0.2528[0m       0.9141        [94m0.2821[0m     +  9.6819
      8   0.2435   0.7062        0.2555       0.9117        [94m0.2616[0m     +  9.4732
      9   0.2417   [32m0.7276[0m        [35m0.2502[0m       0.9166        [94m0.2546[0m     +  9.8755
     10   [36m0.2732[0m   [32m0.7511[0m        [35m0.2471[0m       0.9141        0.2647        9.4640
     11   0.2721   0.7480        [35m0.2431[0m       0.9154        [94m0.2513[0m     +  9.6354
     12   0.2692   0.7403        0.2467       0.9202        [94m0.2494[0m     +  9.7822
     13   0.2652   [32m0.7519[0m        0.2433       0.9154        0.2565        9.9415
     14   0.2631   0.7377        [35m0.2407[0m       0.8779        0.2974        9.7252
     15   0.2690   [32m0.7538[0m        0.2437       0.9093        0.2609        9.6328
     16   0.2681   0.7499        [35m0.2366[0m       0.9093        0.2617        9.7649
     17   [36m0.2912[0m   [32m0.7724[0m        0.2387       0.9202        [94m0.2431[0m     +  9.4752
     18   [36m0.2970[0m   0.7546        [35m0.2337[0m       0.9081        0.2584        9.3616
     19   [36m0.3073[0m   0.7702        0.2348       [31m0.9262[0m        [94m0.2363[0m     +  9.6296
     20   [36m0.3132[0m   [32m0.7769[0m        0.2351       0.9226        0.2369        9.8000
     21   0.3126   0.7611        [35m0.2312[0m       0.9178        0.2454        9.7110
     22   [36m0.3233[0m   0.7664        [35m0.2308[0m       0.9202        0.2433        9.6754
     23   0.3170   0.7709        [35m0.2275[0m       0.9154        0.2423        9.6668
     24   0.3123   0.7718        0.2300       0.9214        0.2402        9.6424
     25   0.3038   0.7667        0.2284       0.9190        0.2404        9.6428
     26   0.3060   0.7643        0.2297       0.9166        0.2377        9.6138
     27   0.3091   0.7686        [35m0.2254[0m       0.9081        0.2481        9.6128
     28   0.2982   0.7690        0.2269       0.9166        0.2403        9.5287
Stopping since valid_loss has not improved in the last 10 epochs.
[32m[I 2023-05-02 16:41:13,190][0m Trial 171 finished with value: 0.23633875667220014 and parameters: {'lr': 0.0009592699617144404, 'dropout': 0.5600384026453157, 'd_model_multiplier': 2, 'num_layers': 2, 'n_heads': 16, 'dim_feedforward': 445, 'batch_size': 30, 'pos_encoding': 'fixed', 'activation': 'gelu', 'norm': 'BatchNorm', 'optimizer_name': 'PlainRAdam', 'weight_decay': 0.01, 'top_n_features': 186}. Best is trial 117 with value: 0.191397856754288.[0m
[FileBasedDataset] Initializing dataset...
	Examples: 8264
	Features: 38
	Max length: 315
Standard scalar turned ON, loading params from cache
[FileBasedDataset] Dataset initialization complete
  epoch    auprc    auroc    train_loss    valid_acc    valid_loss    cp     dur
-------  -------  -------  ------------  -----------  ------------  ----  ------
      1   [36m0.1973[0m   [32m0.7276[0m        [35m0.4261[0m       [31m0.9226[0m        [94m0.4102[0m     +  9.0872
      2   [36m0.2589[0m   [32m0.7887[0m        [35m0.2852[0m       0.9214        [94m0.3173[0m     +  9.4509
      3   [36m0.2816[0m   [32m0.7953[0m        [35m0.2745[0m       0.9202        [94m0.2676[0m     +  9.7964
      4   [36m0.2950[0m   [32m0.7973[0m        [35m0.2653[0m       0.9190        [94m0.2435[0m     +  9.3412
      5   [36m0.3046[0m   [32m0.8010[0m        [35m0.2586[0m       0.9190        [94m0.2348[0m     +  9.2700
      6   [36m0.3255[0m   [32m0.8102[0m        [35m0.2583[0m       0.9226        [94m0.2298[0m     +  9.6852
      7   [36m0.3339[0m   [32m0.8175[0m        [35m0.2543[0m       0.9214        [94m0.2255[0m     +  9.8084
      8   0.3336   0.8109        [35m0.2509[0m       [31m0.9250[0m        [94m0.2241[0m     +  9.2469
      9   [36m0.3533[0m   0.8155        [35m0.2472[0m       0.9250        [94m0.2188[0m     +  9.5271
     10   [36m0.3566[0m   0.8166        [35m0.2435[0m       0.9238        [94m0.2172[0m     +  9.2210
     11   0.3560   0.8130        0.2442       0.9238        [94m0.2169[0m     +  9.1725
     12   [36m0.3577[0m   0.8164        [35m0.2360[0m       0.9250        [94m0.2157[0m     +  9.2552
     13   [36m0.3651[0m   [32m0.8183[0m        0.2410       0.9250        [94m0.2149[0m     +  9.3067
     14   0.3602   0.8157        0.2362       [31m0.9262[0m        [94m0.2148[0m     +  9.5066
     15   [36m0.3713[0m   0.8103        [35m0.2340[0m       [31m0.9287[0m        0.2154        9.5096
     16   0.3554   0.8134        0.2350       0.9250        0.2187        9.5953
     17   0.3652   0.8117        [35m0.2337[0m       0.9287        0.2191        9.4554
     18   0.3619   0.8124        [35m0.2316[0m       0.9141        0.2282        9.5193
     19   [36m0.3769[0m   0.8153        [35m0.2295[0m       0.9226        0.2220        9.4869
     20   0.3652   0.8134        0.2324       0.9154        0.2264        9.9173
     21   0.3615   0.8106        0.2338       0.9178        0.2254        9.7455
     22   0.3598   0.8142        0.2296       0.9202        0.2297        9.5372
     23   0.3452   0.8124        [35m0.2290[0m       0.9154        0.2255        9.6959
Stopping since valid_loss has not improved in the last 10 epochs.
[32m[I 2023-05-02 16:45:01,670][0m Trial 172 finished with value: 0.21479462647524536 and parameters: {'lr': 0.0006559134807030924, 'dropout': 0.5758441739106079, 'd_model_multiplier': 2, 'num_layers': 2, 'n_heads': 16, 'dim_feedforward': 450, 'batch_size': 62, 'pos_encoding': 'fixed', 'activation': 'gelu', 'norm': 'BatchNorm', 'optimizer_name': 'PlainRAdam', 'weight_decay': 0.01, 'top_n_features': 38}. Best is trial 117 with value: 0.191397856754288.[0m
[FileBasedDataset] Initializing dataset...
	Examples: 8264
	Features: 33
	Max length: 315
Standard scalar turned ON, loading params from cache
[FileBasedDataset] Dataset initialization complete
  epoch    auprc    auroc    train_loss    valid_acc    valid_loss    cp     dur
-------  -------  -------  ------------  -----------  ------------  ----  ------
      1   [36m0.3232[0m   [32m0.7754[0m        [35m0.3749[0m       [31m0.9214[0m        [94m0.4717[0m     +  9.5636
      2   [36m0.3520[0m   0.7702        [35m0.2657[0m       0.9190        [94m0.4056[0m     +  9.4768
      3   [36m0.3609[0m   0.7716        [35m0.2599[0m       [31m0.9287[0m        [94m0.3593[0m     +  10.0007
      4   [36m0.3694[0m   0.7656        [35m0.2530[0m       [31m0.9299[0m        [94m0.3283[0m     +  9.8537
      5   [36m0.3833[0m   [32m0.7769[0m        0.2548       0.9299        [94m0.2955[0m     +  9.7937
      6   0.3519   [32m0.7839[0m        [35m0.2511[0m       0.9274        [94m0.2756[0m     +  9.8931
      7   0.3527   [32m0.7934[0m        [35m0.2482[0m       0.9262        [94m0.2493[0m     +  9.7302
      8   0.3572   0.7910        0.2487       0.9274        [94m0.2426[0m     +  9.8926
      9   0.3584   [32m0.7958[0m        [35m0.2476[0m       0.9287        0.2444        9.7729
     10   [36m0.3957[0m   [32m0.8068[0m        [35m0.2425[0m       0.9299        [94m0.2396[0m     +  10.4000
     11   [36m0.3996[0m   0.8055        [35m0.2411[0m       0.9287        [94m0.2345[0m     +  10.1565
     12   [36m0.4017[0m   [32m0.8094[0m        [35m0.2407[0m       0.9274        0.2360        9.9005
     13   [36m0.4041[0m   0.8068        [35m0.2375[0m       0.9274        [94m0.2297[0m     +  9.7084
     14   [36m0.4124[0m   [32m0.8167[0m        0.2398       [31m0.9311[0m        0.2336        9.8325
     15   [36m0.4242[0m   [32m0.8215[0m        [35m0.2374[0m       0.9299        [94m0.2287[0m     +  9.9788
     16   [36m0.4245[0m   0.8211        0.2385       [31m0.9323[0m        0.2292        10.0946
     17   0.4234   [32m0.8257[0m        0.2393       0.9311        0.2310        9.9290
     18   [36m0.4245[0m   [32m0.8313[0m        0.2395       0.9311        [94m0.2227[0m     +  10.0405
     19   [36m0.4301[0m   [32m0.8351[0m        0.2386       0.9311        0.2268        9.7693
     20   [36m0.4339[0m   0.8337        [35m0.2355[0m       0.9287        [94m0.2181[0m     +  9.9181
     21   0.4321   [32m0.8369[0m        [35m0.2340[0m       0.9299        0.2231        9.9702
     22   0.4163   0.8361        0.2352       0.9299        [94m0.2175[0m     +  9.8800
     23   0.4304   [32m0.8393[0m        0.2351       0.9299        [94m0.2133[0m     +  10.2212
     24   [36m0.4375[0m   [32m0.8403[0m        [35m0.2327[0m       0.9323        0.2147        10.0702
     25   0.4325   [32m0.8427[0m        0.2401       0.9299        0.2148        9.9396
     26   0.4173   0.8347        0.2390       0.9311        0.2133        9.9885
     27   0.4221   0.8422        0.2357       0.9299        [94m0.2109[0m     +  9.9822
     28   0.3917   0.8415        0.2330       0.9299        0.2128        9.8298
     29   0.3893   0.8411        [35m0.2311[0m       0.9299        0.2143        10.1257
     30   0.3736   0.8410        [35m0.2307[0m       0.9287        0.2172        10.1089
     31   0.3900   [32m0.8459[0m        [35m0.2293[0m       0.9299        0.2112        9.9072
     32   0.4061   [32m0.8484[0m        0.2351       0.9202        0.2127        9.8648
     33   0.4032   0.8475        0.2331       0.9299        [94m0.2096[0m     +  10.0724
     34   0.4045   0.8428        [35m0.2283[0m       0.9274        0.2102        10.0501
     35   0.3813   0.8408        0.2288       0.9226        0.2125        9.9115
     36   0.3760   0.8442        [35m0.2237[0m       0.9250        0.2118        9.7504
     37   0.3876   0.8443        0.2268       0.9262        0.2110        12.2179
     38   0.3933   0.8468        [35m0.2233[0m       0.9287        0.2110        10.2692
     39   0.3879   0.8456        0.2270       0.9274        0.2116        10.2126
     40   0.4016   0.8434        0.2257       0.9274        0.2123        10.1634
     41   0.4036   0.8435        [35m0.2232[0m       0.9262        0.2098        10.2678
     42   0.3954   0.8425        [35m0.2231[0m       0.9274        0.2113        10.4041
Stopping since valid_loss has not improved in the last 10 epochs.
