[32m[I 2023-05-05 14:14:16,094][0m Trial 630 finished with value: 100.0 and parameters: {'lr': 0.0004628365041758846, 'dropout': 0.3901683314072248, 'd_model_multiplier': 4, 'num_layers': 5, 'n_heads': 64, 'dim_feedforward': 296, 'batch_size': 137, 'pos_encoding': 'fixed', 'activation': 'relu', 'norm': 'LayerNorm', 'optimizer_name': 'RAdam', 'weight_decay': 0.1, 'top_n_features': 134}. Best is trial 246 with value: 0.16447311791139763.[0m
[FileBasedDataset] Initializing dataset...
	Examples: 8264
	Features: 102
	Max length: 315
Standard scalar turned ON, loading params from cache
[FileBasedDataset] Dataset initialization complete
  epoch    auprc    auroc    train_loss    valid_acc    valid_loss    cp      dur
-------  -------  -------  ------------  -----------  ------------  ----  -------
      1   [36m0.0732[0m   [32m0.3381[0m        [35m0.5639[0m       [31m0.9069[0m        [94m0.4502[0m     +  38.1459
      2   [36m0.0874[0m   [32m0.4588[0m        [35m0.3842[0m       0.9069        [94m0.3380[0m     +  38.4794
      3   [36m0.1426[0m   [32m0.6264[0m        [35m0.3000[0m       0.9069        [94m0.3018[0m     +  38.4716
      4   [36m0.2274[0m   [32m0.7030[0m        [35m0.2692[0m       0.9069        [94m0.2881[0m     +  38.6145
      5   [36m0.2566[0m   [32m0.7239[0m        [35m0.2565[0m       0.9069        [94m0.2824[0m     +  38.5738
      6   [36m0.2745[0m   [32m0.7348[0m        [35m0.2498[0m       0.9069        [94m0.2789[0m     +  38.6157
      7   [36m0.2921[0m   [32m0.7442[0m        [35m0.2466[0m       0.9069        [94m0.2765[0m     +  38.6224
      8   [36m0.3004[0m   [32m0.7523[0m        [35m0.2441[0m       0.9069        [94m0.2742[0m     +  38.6542
      9   [36m0.3080[0m   [32m0.7594[0m        [35m0.2427[0m       [31m0.9081[0m        [94m0.2728[0m     +  38.6791
     10   [36m0.3135[0m   [32m0.7642[0m        [35m0.2408[0m       0.9081        [94m0.2719[0m     +  38.5836
     11   [36m0.3156[0m   [32m0.7690[0m        [35m0.2390[0m       0.9069        [94m0.2706[0m     +  38.5632
     12   [36m0.3214[0m   [32m0.7735[0m        [35m0.2370[0m       0.9057        [94m0.2692[0m     +  38.6690
     13   [36m0.3235[0m   [32m0.7768[0m        [35m0.2352[0m       0.9069        [94m0.2679[0m     +  38.6864
     14   [36m0.3278[0m   [32m0.7793[0m        [35m0.2341[0m       0.9045        [94m0.2672[0m     +  38.6167
     15   [36m0.3324[0m   [32m0.7818[0m        0.2346       0.9069        [94m0.2660[0m     +  38.6877
     16   [36m0.3403[0m   [32m0.7847[0m        [35m0.2324[0m       0.9081        [94m0.2655[0m     +  38.7284
     17   [36m0.3432[0m   [32m0.7864[0m        [35m0.2320[0m       0.9045        [94m0.2650[0m     +  38.6112
     18   [36m0.3434[0m   [32m0.7878[0m        [35m0.2310[0m       0.9057        [94m0.2645[0m     +  38.5374
     19   [36m0.3459[0m   [32m0.7892[0m        [35m0.2294[0m       0.9057        [94m0.2643[0m     +  38.4694
