[32m[I 2023-05-04 10:41:15,607][0m Trial 431 finished with value: 100.0 and parameters: {'lr': 2.6311713185285052e-05, 'dropout': 0.45119750475204884, 'd_model_multiplier': 64, 'num_layers': 6, 'n_heads': 32, 'dim_feedforward': 337, 'batch_size': 70, 'pos_encoding': 'fixed', 'activation': 'relu', 'norm': 'LayerNorm', 'optimizer_name': 'RAdam', 'weight_decay': 0.1, 'top_n_features': 62}. Best is trial 246 with value: 0.16447311791139763.[0m
[FileBasedDataset] Initializing dataset...
	Examples: 8264
	Features: 66
	Max length: 315
Standard scalar turned ON, loading params from cache
[FileBasedDataset] Dataset initialization complete
  epoch    auprc    auroc    train_loss    valid_acc    valid_loss    cp      dur
-------  -------  -------  ------------  -----------  ------------  ----  -------
      1   [36m0.2469[0m   [32m0.7175[0m        [35m0.3495[0m       [31m0.9105[0m        [94m0.2763[0m     +  53.5132
      2   [36m0.3114[0m   [32m0.7560[0m        [35m0.2341[0m       [31m0.9117[0m        [94m0.2655[0m     +  54.0552
      3   [36m0.3387[0m   [32m0.7673[0m        [35m0.2311[0m       0.9105        [94m0.2635[0m     +  53.7399
      4   [36m0.3463[0m   [32m0.7717[0m        [35m0.2283[0m       [31m0.9141[0m        [94m0.2616[0m     +  54.2072
      5   [36m0.3481[0m   [32m0.7746[0m        [35m0.2268[0m       0.9129        [94m0.2602[0m     +  54.0495
      6   [36m0.3603[0m   [32m0.7746[0m        [35m0.2261[0m       0.9141        0.2615        53.9128
      7   [36m0.3693[0m   [32m0.7783[0m        [35m0.2234[0m       [31m0.9154[0m        0.2631        54.3508
      8   [36m0.3809[0m   [32m0.7836[0m        0.2247       0.9141        [94m0.2582[0m     +  54.1312
      9   0.3694   [32m0.7882[0m        [35m0.2231[0m       [31m0.9166[0m        0.2614        54.1125
     10   0.3735   [32m0.7926[0m        [35m0.2204[0m       0.9129        0.2628        54.1886
     11   [36m0.3850[0m   0.7912        [35m0.2195[0m       0.9141        0.2601        54.0257
     12   0.3767   0.7835        [35m0.2187[0m       [31m0.9178[0m        0.2637        54.1582
     13   [36m0.4003[0m   0.7802        [35m0.2163[0m       0.9154        0.2669        54.6022
     14   0.3903   [32m0.7941[0m        [35m0.2148[0m       0.9129        0.2629        54.1145
     15   0.3755   0.7933        [35m0.2121[0m       0.9117        0.2638        54.1190
     16   0.3736   0.7877        0.2135       0.9154        0.2667        54.2501
     17   0.3611   0.7868        [35m0.2091[0m       0.9129        0.2690        54.0291
Stopping since valid_loss has not improved in the last 10 epochs.
[32m[I 2023-05-04 10:57:34,830][0m Trial 432 finished with value: 0.25818670350954637 and parameters: {'lr': 3.371308048016912e-05, 'dropout': 0.4427522440973415, 'd_model_multiplier': 32, 'num_layers': 6, 'n_heads': 32, 'dim_feedforward': 321, 'batch_size': 66, 'pos_encoding': 'fixed', 'activation': 'relu', 'norm': 'LayerNorm', 'optimizer_name': 'RAdam', 'weight_decay': 0.1, 'top_n_features': 66}. Best is trial 246 with value: 0.16447311791139763.[0m
[FileBasedDataset] Initializing dataset...
	Examples: 8264
	Features: 57
	Max length: 315
Standard scalar turned ON, loading params from cache
[FileBasedDataset] Dataset initialization complete
  epoch    auprc    auroc    train_loss    valid_acc    valid_loss    cp      dur
-------  -------  -------  ------------  -----------  ------------  ----  -------
      1   [36m0.0461[0m   [32m0.2707[0m        [35m0.5939[0m       [31m0.9299[0m        [94m0.4842[0m     +  10.8596
      2   [36m0.0483[0m   [32m0.3080[0m        [35m0.4364[0m       0.9299        [94m0.3450[0m     +  10.7699
      3   [36m0.0741[0m   [32m0.5149[0m        [35m0.3308[0m       0.9299        [94m0.2746[0m     +  10.9449
      4   [36m0.1388[0m   [32m0.6345[0m        [35m0.2808[0m       0.9299        [94m0.2487[0m     +  10.8933
      5   [36m0.1726[0m   [32m0.6835[0m        [35m0.2636[0m       0.9287        [94m0.2369[0m     +  10.8281
      6   [36m0.2104[0m   [32m0.7125[0m        [35m0.2547[0m       0.9262        [94m0.2298[0m     +  11.1723
      7   [36m0.2343[0m   [32m0.7299[0m        [35m0.2456[0m       0.9299        [94m0.2266[0m     +  10.8181
      8   [36m0.2402[0m   [32m0.7349[0m        [35m0.2421[0m       0.9287        [94m0.2266[0m     +  10.8581
      9   [36m0.2430[0m   [32m0.7400[0m        [35m0.2372[0m       0.9250        0.2272        10.9707
     10   [36m0.2502[0m   [32m0.7480[0m        [35m0.2357[0m       0.9262        [94m0.2265[0m     +  11.0695
     11   [36m0.2542[0m   [32m0.7531[0m        [35m0.2339[0m       0.9262        [94m0.2259[0m     +  11.0077
     12   [36m0.2717[0m   [32m0.7581[0m        0.2343       0.9250        [94m0.2243[0m     +  10.9504
     13   0.2703   [32m0.7607[0m        [35m0.2328[0m       0.9250        [94m0.2235[0m     +  10.8495
     14   [36m0.2737[0m   [32m0.7631[0m        0.2331       0.9274        [94m0.2233[0m     +  10.8534
     15   [36m0.2868[0m   [32m0.7677[0m        [35m0.2321[0m       0.9238        [94m0.2231[0m     +  10.9418
     16   [36m0.3030[0m   [32m0.7683[0m        [35m0.2306[0m       0.9250        [94m0.2221[0m     +  11.0212
     17   [36m0.3101[0m   [32m0.7699[0m        [35m0.2293[0m       0.9250        [94m0.2218[0m     +  11.2870
     18   [36m0.3117[0m   [32m0.7718[0m        0.2299       0.9238        0.2220        11.1893
     19   [36m0.3120[0m   [32m0.7731[0m        [35m0.2287[0m       0.9226        0.2224        10.9628
     20   [36m0.3143[0m   [32m0.7742[0m        0.2288       0.9238        [94m0.2210[0m     +  10.9697
     21   [36m0.3163[0m   [32m0.7754[0m        0.2294       0.9250        [94m0.2202[0m     +  11.1624
     22   [36m0.3181[0m   [32m0.7764[0m        [35m0.2283[0m       0.9274        [94m0.2196[0m     +  10.9208
     23   0.3178   [32m0.7780[0m        [35m0.2280[0m       0.9274        [94m0.2187[0m     +  10.8193
     24   [36m0.3204[0m   [32m0.7787[0m        [35m0.2261[0m       0.9274        0.2190        10.8499
     25   0.3204   [32m0.7796[0m        0.2288       0.9262        0.2188        10.9011
     26   [36m0.3221[0m   [32m0.7797[0m        0.2272       0.9262        [94m0.2184[0m     +  10.7961
     27   [36m0.3259[0m   [32m0.7814[0m        0.2262       0.9262        [94m0.2181[0m     +  11.0174
     28   0.3233   [32m0.7821[0m        [35m0.2261[0m       0.9287        [94m0.2171[0m     +  11.0754
     29   0.3257   [32m0.7832[0m        0.2269       0.9287        0.2175        11.0195
     30   [36m0.3323[0m   [32m0.7836[0m        [35m0.2243[0m       0.9287        [94m0.2167[0m     +  11.0199
     31   0.3319   [32m0.7838[0m        0.2259       [31m0.9323[0m        [94m0.2158[0m     +  10.9527
     32   0.3293   [32m0.7844[0m        0.2250       0.9311        0.2170        10.9940
     33   0.3319   [32m0.7857[0m        [35m0.2235[0m       0.9287        0.2160        10.9615
     34   [36m0.3330[0m   [32m0.7866[0m        0.2239       0.9311        [94m0.2155[0m     +  11.0864
     35   [36m0.3347[0m   0.7859        [35m0.2225[0m       [31m0.9335[0m        [94m0.2153[0m     +  10.7791
     36   [36m0.3350[0m   0.7852        0.2242       0.9299        0.2167        11.1055
     37   [36m0.3372[0m   0.7864        [35m0.2221[0m       0.9335        [94m0.2150[0m     +  10.8285
     38   [36m0.3426[0m   [32m0.7868[0m        0.2226       0.9311        [94m0.2150[0m     +  10.8835
     39   [36m0.3498[0m   [32m0.7884[0m        [35m0.2216[0m       0.9311        [94m0.2144[0m     +  10.8763
     40   [36m0.3604[0m   0.7880        [35m0.2213[0m       0.9311        [94m0.2133[0m     +  11.0896
     41   0.3541   [32m0.7890[0m        0.2223       0.9299        0.2143        10.9703
     42   0.3584   [32m0.7894[0m        0.2236       0.9323        [94m0.2131[0m     +  10.9314
     43   [36m0.3671[0m   [32m0.7910[0m        [35m0.2208[0m       0.9323        [94m0.2125[0m     +  10.8832
     44   0.3620   0.7899        0.2214       0.9323        0.2130        10.9885
     45   0.3616   0.7884        0.2216       0.9311        0.2136        10.7959
     46   0.3640   0.7903        [35m0.2207[0m       0.9323        0.2134        11.0286
     47   0.3643   0.7908        [35m0.2199[0m       0.9335        0.2133        10.9406
     48   [36m0.3698[0m   0.7905        [35m0.2192[0m       [31m0.9347[0m        0.2134        11.1220
     49   0.3669   0.7909        [35m0.2170[0m       0.9311        0.2137        11.1908
     50   0.3694   [32m0.7912[0m        0.2196       0.9347        0.2129        11.0218
[32m[I 2023-05-04 11:06:47,033][0m Trial 433 finished with value: 0.21251246689885242 and parameters: {'lr': 1.5411646875766804e-05, 'dropout': 0.4243253430054782, 'd_model_multiplier': 32, 'num_layers': 6, 'n_heads': 4, 'dim_feedforward': 350, 'batch_size': 72, 'pos_encoding': 'fixed', 'activation': 'relu', 'norm': 'LayerNorm', 'optimizer_name': 'RAdam', 'weight_decay': 0.1, 'top_n_features': 57}. Best is trial 246 with value: 0.16447311791139763.[0m
[FileBasedDataset] Initializing dataset...
	Examples: 8264
	Features: 73
	Max length: 315
Standard scalar turned ON, loading params from cache
[FileBasedDataset] Dataset initialization complete
  epoch    auprc    auroc    train_loss    valid_acc    valid_loss    cp      dur
-------  -------  -------  ------------  -----------  ------------  ----  -------
      1   [36m0.2799[0m   [32m0.7671[0m        [35m0.3225[0m       [31m0.9226[0m        [94m0.2432[0m     +  53.8423
      2   0.2796   [32m0.7901[0m        [35m0.2383[0m       0.9214        [94m0.2392[0m     +  54.0150
      3   [36m0.2924[0m   [32m0.7965[0m        [35m0.2323[0m       0.9226        [94m0.2343[0m     +  54.0971
      4   [36m0.3002[0m   0.7947        [35m0.2298[0m       0.9202        0.2365        54.4212
      5   0.2833   0.7906        [35m0.2289[0m       0.9202        0.2416        54.2316
      6   0.2882   0.7831        [35m0.2278[0m       0.9214        0.2412        54.1204
      7   0.2863   0.7901        [35m0.2246[0m       0.9202        0.2398        54.0601
      8   [36m0.3005[0m   0.7933        0.2246       0.9202        0.2375        54.1729
      9   0.2807   [32m0.7998[0m        [35m0.2200[0m       0.9178        0.2369        54.1421
     10   0.2942   [32m0.8040[0m        [35m0.2178[0m       0.9190        [94m0.2341[0m     +  54.1513
     11   0.2927   [32m0.8053[0m        [35m0.2148[0m       0.9202        0.2376        54.5542
     12   0.2813   0.7968        [35m0.2142[0m       0.9202        0.2422        54.7513
     13   0.2785   [32m0.8137[0m        [35m0.2099[0m       0.9178        0.2395        54.3323
     14   0.2859   0.7922        0.2101       0.9190        0.2440        54.0660
     15   0.2552   0.7880        [35m0.2084[0m       0.9190        0.2463        54.0655
     16   0.2560   0.7721        [35m0.2049[0m       0.9202        0.2563        54.5377
     17   0.2705   0.7709        [35m0.2023[0m       0.9166        0.2520        53.9873
     18   0.2669   0.7541        0.2029       0.9166        0.2548        54.1782
     19   0.2432   0.7428        [35m0.1978[0m       0.9202        0.2604        54.2213
Stopping since valid_loss has not improved in the last 10 epochs.
[32m[I 2023-05-04 11:24:55,503][0m Trial 434 finished with value: 0.23406272841912515 and parameters: {'lr': 4.946191281135119e-05, 'dropout': 0.3998130278612864, 'd_model_multiplier': 32, 'num_layers': 6, 'n_heads': 32, 'dim_feedforward': 332, 'batch_size': 62, 'pos_encoding': 'fixed', 'activation': 'relu', 'norm': 'LayerNorm', 'optimizer_name': 'RAdam', 'weight_decay': 0.1, 'top_n_features': 73}. Best is trial 246 with value: 0.16447311791139763.[0m
[FileBasedDataset] Initializing dataset...
	Examples: 8264
	Features: 94
	Max length: 315
Standard scalar turned ON, loading params from cache
[FileBasedDataset] Dataset initialization complete
Warning, assumed runtime error: CUDA out of memory. Tried to allocate 994.00 MiB (GPU 0; 23.70 GiB total capacity; 20.46 GiB already allocated; 785.25 MiB free; 21.84 GiB reserved in total by PyTorch) If reserved memory is >> allocated memory try setting max_split_size_mb to avoid fragmentation.  See documentation for Memory Management and PYTORCH_CUDA_ALLOC_CONF
[32m[I 2023-05-04 11:25:00,101][0m Trial 435 finished with value: 100.0 and parameters: {'lr': 7.783619839293959e-05, 'dropout': 0.43452164251512043, 'd_model_multiplier': 32, 'num_layers': 7, 'n_heads': 32, 'dim_feedforward': 342, 'batch_size': 82, 'pos_encoding': 'fixed', 'activation': 'relu', 'norm': 'LayerNorm', 'optimizer_name': 'RAdam', 'weight_decay': 0.1, 'top_n_features': 94}. Best is trial 246 with value: 0.16447311791139763.[0m
[FileBasedDataset] Initializing dataset...
	Examples: 8264
	Features: 53
	Max length: 315
Standard scalar turned ON, loading params from cache
[FileBasedDataset] Dataset initialization complete
  epoch    auprc    auroc    train_loss    valid_acc    valid_loss    cp      dur
-------  -------  -------  ------------  -----------  ------------  ----  -------
      1   [36m0.1863[0m   [32m0.6655[0m        [35m0.3770[0m       [31m0.9178[0m        [94m0.2646[0m     +  45.6991
      2   [36m0.2762[0m   [32m0.7352[0m        [35m0.2415[0m       [31m0.9202[0m        [94m0.2497[0m     +  46.2299
      3   [36m0.2991[0m   [32m0.7508[0m        [35m0.2331[0m       [31m0.9214[0m        [94m0.2459[0m     +  46.0646
      4   [36m0.3162[0m   [32m0.7602[0m        [35m0.2300[0m       0.9202        [94m0.2455[0m     +  46.5435
      5   [36m0.3360[0m   [32m0.7638[0m        [35m0.2285[0m       0.9190        [94m0.2448[0m     +  46.4829
      6   [36m0.3407[0m   [32m0.7653[0m        [35m0.2269[0m       0.9129        0.2486        46.5560
      7   [36m0.3611[0m   [32m0.7670[0m        [35m0.2268[0m       0.9178        0.2449        46.4538
      8   0.3599   [32m0.7708[0m        [35m0.2244[0m       0.9117        0.2499        45.9128
      9   0.3515   [32m0.7729[0m        [35m0.2223[0m       0.9141        0.2482        46.1478
     10   0.3492   [32m0.7770[0m        [35m0.2209[0m       0.9154        0.2488        46.4743
     11   0.3420   [32m0.7777[0m        [35m0.2204[0m       0.9166        0.2518        46.3166
     12   0.3322   [32m0.7795[0m        [35m0.2180[0m       0.9154        0.2545        46.3760
     13   0.3270   [32m0.7799[0m        [35m0.2180[0m       0.9178        0.2502        46.2912
     14   0.3081   0.7766        [35m0.2150[0m       0.9154        0.2549        46.1775
Stopping since valid_loss has not improved in the last 10 epochs.
[32m[I 2023-05-04 11:36:38,234][0m Trial 436 finished with value: 0.2448158120373861 and parameters: {'lr': 2.1819114414988103e-05, 'dropout': 0.37644222950332173, 'd_model_multiplier': 32, 'num_layers': 5, 'n_heads': 32, 'dim_feedforward': 359, 'batch_size': 76, 'pos_encoding': 'fixed', 'activation': 'relu', 'norm': 'LayerNorm', 'optimizer_name': 'RAdam', 'weight_decay': 0.1, 'top_n_features': 53}. Best is trial 246 with value: 0.16447311791139763.[0m
[FileBasedDataset] Initializing dataset...
	Examples: 8264
	Features: 61
	Max length: 315
Standard scalar turned ON, loading params from cache
[FileBasedDataset] Dataset initialization complete
  epoch    auprc    auroc    train_loss    valid_acc    valid_loss    cp      dur
-------  -------  -------  ------------  -----------  ------------  ----  -------
      1   [36m0.1595[0m   [32m0.6866[0m        [35m0.3790[0m       [31m0.9274[0m        [94m0.2569[0m     +  54.0530
      2   [36m0.2551[0m   [32m0.7448[0m        [35m0.2527[0m       0.9274        [94m0.2511[0m     +  54.2286
      3   [36m0.2782[0m   [32m0.7460[0m        [35m0.2476[0m       [31m0.9287[0m        0.2586        54.3644
      4   [36m0.3040[0m   [32m0.7533[0m        [35m0.2405[0m       [31m0.9323[0m        0.2637        54.2859
      5   [36m0.3117[0m   [32m0.7677[0m        [35m0.2402[0m       0.9274        0.2605        54.0653
      6   [36m0.3230[0m   [32m0.7787[0m        [35m0.2392[0m       0.9287        0.2601        54.0061
      7   0.3050   0.7769        [35m0.2380[0m       0.9287        0.2581        54.5928
      8   0.3093   0.7775        [35m0.2371[0m       0.9274        0.2680        54.2901
      9   0.3063   [32m0.7808[0m        [35m0.2356[0m       0.9238        0.2581        54.3903
     10   0.3084   0.7751        [35m0.2345[0m       0.9311        0.2652        54.3877
     11   0.3011   0.7781        0.2372       0.9287        0.2609        54.3823
Stopping since valid_loss has not improved in the last 10 epochs.
