[32m[I 2023-05-02 07:05:52,405][0m Trial 56 finished with value: 0.2114639981720763 and parameters: {'lr': 0.0005851615486802006, 'dropout': 0.5575651994199265, 'd_model_multiplier': 8, 'num_layers': 2, 'n_heads': 4, 'dim_feedforward': 238, 'batch_size': 19, 'pos_encoding': 'fixed', 'activation': 'relu', 'norm': 'LayerNorm', 'optimizer_name': 'AdamW', 'weight_decay': 0.1, 'top_n_features': 227}. Best is trial 12 with value: 0.20472501771481755.[0m
[FileBasedDataset] Initializing dataset...
	Examples: 8264
	Features: 228
	Max length: 315
Standard scalar turned ON, loading params from cache
[FileBasedDataset] Dataset initialization complete
  epoch    auprc    auroc    train_loss    valid_acc    valid_loss    cp      dur
-------  -------  -------  ------------  -----------  ------------  ----  -------
      1   [36m0.1652[0m   [32m0.6870[0m        [35m0.2782[0m       [31m0.9299[0m        [94m0.2301[0m     +  11.3345
      2   [36m0.2112[0m   [32m0.6916[0m        [35m0.2630[0m       0.9299        0.2324        11.1059
      3   0.1864   0.6914        [35m0.2617[0m       [31m0.9311[0m        [94m0.2284[0m     +  11.3376
      4   0.1999   [32m0.7070[0m        [35m0.2590[0m       0.9274        0.2299        11.1248
      5   [36m0.2533[0m   [32m0.7485[0m        [35m0.2512[0m       0.9262        0.2292        11.4302
      6   0.2451   [32m0.7492[0m        [35m0.2484[0m       0.9166        0.2581        11.2166
      7   [36m0.2602[0m   [32m0.7620[0m        [35m0.2467[0m       0.9214        0.2381        11.3132
      8   [36m0.3003[0m   [32m0.7675[0m        [35m0.2408[0m       0.9274        [94m0.2270[0m     +  11.4454
      9   0.2913   [32m0.7741[0m        0.2417       [31m0.9323[0m        [94m0.2169[0m     +  10.8718
     10   0.2924   [32m0.7770[0m        [35m0.2382[0m       0.9323        0.2209        11.2247
     11   [36m0.3027[0m   0.7760        0.2398       0.9311        0.2231        11.1164
     12   [36m0.3094[0m   [32m0.7839[0m        [35m0.2340[0m       [31m0.9347[0m        [94m0.2158[0m     +  11.3521
     13   0.3072   0.7766        [35m0.2313[0m       [31m0.9383[0m        0.2206        11.3074
     14   0.3054   0.7792        0.2323       [31m0.9407[0m        0.2207        11.5441
     15   [36m0.3136[0m   0.7722        0.2339       0.9383        [94m0.2134[0m     +  11.2762
     16   [36m0.3175[0m   0.7692        [35m0.2303[0m       0.9395        0.2179        11.1859
     17   0.2555   0.7481        [35m0.2278[0m       0.9395        0.2300        11.3638
     18   0.2609   0.7803        [35m0.2266[0m       [31m0.9420[0m        0.2238        11.1901
     19   0.2908   0.7787        0.2298       0.9383        0.2227        11.4125
     20   0.2898   0.7775        [35m0.2253[0m       0.9395        0.2203        11.0719
     21   0.2891   [32m0.7844[0m        0.2273       0.9407        0.2167        11.3415
     22   0.2598   0.7386        0.2267       [31m0.9444[0m        0.2194        11.1811
     23   0.2733   0.7495        [35m0.2240[0m       0.9420        0.2207        11.1399
     24   0.2772   0.7572        [35m0.2239[0m       0.9420        0.2158        11.4078
Stopping since valid_loss has not improved in the last 10 epochs.
[32m[I 2023-05-02 07:10:35,206][0m Trial 57 finished with value: 0.21339567550125801 and parameters: {'lr': 0.0005275289547560971, 'dropout': 0.560796520703218, 'd_model_multiplier': 8, 'num_layers': 2, 'n_heads': 4, 'dim_feedforward': 492, 'batch_size': 10, 'pos_encoding': 'fixed', 'activation': 'relu', 'norm': 'LayerNorm', 'optimizer_name': 'AdamW', 'weight_decay': 0.1, 'top_n_features': 228}. Best is trial 12 with value: 0.20472501771481755.[0m
[FileBasedDataset] Initializing dataset...
	Examples: 8264
	Features: 227
	Max length: 315
Standard scalar turned ON, loading params from cache
[FileBasedDataset] Dataset initialization complete
  epoch    auprc    auroc    train_loss    valid_acc    valid_loss    cp      dur
-------  -------  -------  ------------  -----------  ------------  ----  -------
      1   [36m0.1860[0m   [32m0.7198[0m        [35m0.2729[0m       [31m0.9335[0m        [94m0.2312[0m     +  11.4684
      2   [36m0.2014[0m   [32m0.7259[0m        [35m0.2589[0m       0.9335        [94m0.2280[0m     +  11.6598
      3   [36m0.2272[0m   [32m0.7394[0m        [35m0.2584[0m       0.9335        [94m0.2228[0m     +  11.6982
      4   [36m0.2346[0m   [32m0.7493[0m        [35m0.2557[0m       0.9323        [94m0.2222[0m     +  11.5341
      5   [36m0.2397[0m   0.7477        [35m0.2501[0m       0.9311        0.2304        11.8800
      6   0.2339   [32m0.7521[0m        [35m0.2447[0m       0.9335        0.2330        11.6305
      7   0.2312   0.7476        [35m0.2441[0m       0.9274        0.2287        11.6361
      8   0.2366   0.7389        [35m0.2422[0m       0.9323        0.2397        11.8210
      9   0.2081   0.7359        [35m0.2365[0m       0.9311        0.2511        11.1497
     10   0.2193   0.7473        [35m0.2356[0m       0.9287        0.2334        11.5745
     11   [36m0.2541[0m   0.7499        0.2358       [31m0.9359[0m        0.2346        11.3012
     12   0.2303   0.7462        [35m0.2346[0m       0.9311        0.2457        11.3821
     13   0.2221   0.7411        [35m0.2344[0m       0.9335        0.2437        11.7089
Stopping since valid_loss has not improved in the last 10 epochs.
[32m[I 2023-05-02 07:13:17,598][0m Trial 58 finished with value: 0.22222139162913487 and parameters: {'lr': 0.00038646999473549343, 'dropout': 0.5304992808312475, 'd_model_multiplier': 8, 'num_layers': 4, 'n_heads': 4, 'dim_feedforward': 512, 'batch_size': 16, 'pos_encoding': 'fixed', 'activation': 'relu', 'norm': 'LayerNorm', 'optimizer_name': 'AdamW', 'weight_decay': 0.1, 'top_n_features': 227}. Best is trial 12 with value: 0.20472501771481755.[0m
[FileBasedDataset] Initializing dataset...
	Examples: 8264
	Features: 187
	Max length: 315
Standard scalar turned ON, loading params from cache
[FileBasedDataset] Dataset initialization complete
  epoch    auprc    auroc    train_loss    valid_acc    valid_loss    cp      dur
-------  -------  -------  ------------  -----------  ------------  ----  -------
      1   [36m0.2084[0m   [32m0.7268[0m        [35m0.2783[0m       [31m0.8851[0m        [94m0.2994[0m     +  10.5987
      2   [36m0.2108[0m   [32m0.7323[0m        [35m0.2653[0m       [31m0.8972[0m        [94m0.2910[0m     +  10.2009
      3   [36m0.2137[0m   0.7248        [35m0.2582[0m       0.8912        0.3050        10.0563
      4   0.2114   0.7194        [35m0.2573[0m       [31m0.9081[0m        [94m0.2883[0m     +  10.2708
      5   0.2104   0.7173        [35m0.2566[0m       0.8960        0.2925        10.3478
      6   0.2119   0.7246        [35m0.2551[0m       [31m0.9105[0m        [94m0.2808[0m     +  10.5661
      7   0.2132   0.7265        0.2562       0.9057        0.2808        10.8116
      8   0.2130   0.7317        [35m0.2533[0m       0.9057        0.2832        10.6342
      9   0.2121   0.7283        0.2543       0.9069        [94m0.2795[0m     +  10.6779
     10   0.2100   0.7248        0.2537       0.9081        0.2821        10.5908
     11   0.2118   0.7292        [35m0.2530[0m       0.9069        [94m0.2785[0m     +  10.8565
     12   0.2090   0.7272        [35m0.2523[0m       0.9045        0.2839        10.7516
     13   0.2080   0.7278        0.2527       0.9069        0.2799        10.7523
     14   0.2066   0.7277        0.2531       [31m0.9129[0m        [94m0.2724[0m     +  10.7217
     15   0.2112   0.7250        [35m0.2523[0m       0.9105        0.2732        10.6178
     16   0.2125   0.7279        0.2542       0.9117        0.2736        11.5017
     17   0.2103   0.7274        [35m0.2511[0m       0.9105        0.2729        10.7894
     18   0.2103   0.7265        0.2530       0.9081        0.2725        10.6084
     19   0.2074   0.7218        0.2515       0.9129        [94m0.2670[0m     +  10.8146
     20   0.2117   0.7300        0.2540       0.9105        [94m0.2660[0m     +  10.7039
     21   0.2133   0.7290        0.2523       0.9105        [94m0.2624[0m     +  10.7669
     22   [36m0.2279[0m   [32m0.7622[0m        [35m0.2506[0m       0.9081        [94m0.2583[0m     +  10.2263
     23   [36m0.2496[0m   [32m0.7733[0m        [35m0.2439[0m       0.9069        [94m0.2496[0m     +  10.3889
     24   [36m0.2722[0m   [32m0.7859[0m        [35m0.2438[0m       [31m0.9141[0m        [94m0.2425[0m     +  10.8413
     25   [36m0.2780[0m   [32m0.7899[0m        [35m0.2400[0m       0.9129        [94m0.2397[0m     +  10.4533
     26   0.2683   0.7875        [35m0.2383[0m       0.9081        0.2466        10.6784
     27   [36m0.2852[0m   [32m0.7899[0m        0.2405       [31m0.9190[0m        [94m0.2331[0m     +  10.7799
     28   [36m0.3158[0m   [32m0.7983[0m        0.2394       [31m0.9226[0m        [94m0.2266[0m     +  10.7857
     29   0.2954   0.7922        [35m0.2373[0m       0.9178        0.2357        10.9203
     30   0.2940   0.7935        [35m0.2355[0m       0.9178        0.2336        10.6887
     31   0.2997   0.7791        [35m0.2339[0m       0.9178        0.2334        10.6329
     32   [36m0.3170[0m   0.7881        0.2345       0.9226        0.2333        10.5307
     33   0.2954   0.7909        0.2349       0.9166        0.2341        10.5037
     34   0.3021   0.7903        0.2343       0.9214        0.2360        10.5743
     35   0.2875   0.7854        0.2342       0.9105        0.2416        10.7402
     36   [36m0.3235[0m   0.7897        [35m0.2320[0m       [31m0.9250[0m        0.2312        10.5205
     37   0.3091   0.7896        0.2328       0.9226        0.2340        10.7739
Stopping since valid_loss has not improved in the last 10 epochs.
[32m[I 2023-05-02 07:20:04,586][0m Trial 59 finished with value: 0.2265723713345943 and parameters: {'lr': 0.0008549572143764238, 'dropout': 0.569839852705504, 'd_model_multiplier': 8, 'num_layers': 2, 'n_heads': 4, 'dim_feedforward': 453, 'batch_size': 11, 'pos_encoding': 'fixed', 'activation': 'relu', 'norm': 'LayerNorm', 'optimizer_name': 'AdamW', 'weight_decay': 0.1, 'top_n_features': 187}. Best is trial 12 with value: 0.20472501771481755.[0m
[FileBasedDataset] Initializing dataset...
	Examples: 8264
	Features: 174
	Max length: 315
Standard scalar turned ON, loading params from cache
[FileBasedDataset] Dataset initialization complete
  epoch    auprc    auroc    train_loss    valid_acc    valid_loss    cp     dur
-------  -------  -------  ------------  -----------  ------------  ----  ------
      1   [36m0.1684[0m   [32m0.6778[0m        [35m0.2916[0m       [31m0.9287[0m        [94m0.2447[0m     +  9.9378
      2   [36m0.1835[0m   [32m0.6970[0m        [35m0.2613[0m       0.9250        [94m0.2388[0m     +  10.2195
      3   [36m0.2102[0m   [32m0.7222[0m        [35m0.2566[0m       0.9250        [94m0.2357[0m     +  9.9024
      4   [36m0.2540[0m   [32m0.7549[0m        [35m0.2526[0m       0.9250        [94m0.2290[0m     +  9.8737
      5   [36m0.2791[0m   [32m0.7556[0m        [35m0.2493[0m       0.9214        0.2300        9.9047
      6   [36m0.2820[0m   [32m0.7568[0m        [35m0.2461[0m       0.9250        0.2304        9.8393
      7   0.2678   [32m0.7585[0m        [35m0.2449[0m       0.9274        0.2337        9.8874
      8   0.2805   [32m0.7606[0m        [35m0.2404[0m       0.9274        0.2366        10.1660
      9   [36m0.2837[0m   [32m0.7617[0m        0.2418       0.9274        0.2328        9.7368
     10   0.2745   0.7594        [35m0.2388[0m       [31m0.9323[0m        0.2389        10.0094
     11   [36m0.2861[0m   [32m0.7660[0m        0.2401       0.9287        0.2304        9.9158
     12   0.2777   0.7589        [35m0.2366[0m       0.9287        0.2409        10.1047
     13   0.2749   0.7611        [35m0.2349[0m       0.9299        0.2399        10.1497
Stopping since valid_loss has not improved in the last 10 epochs.
[32m[I 2023-05-02 07:22:24,885][0m Trial 60 finished with value: 0.22903964807929195 and parameters: {'lr': 0.0001853974922040157, 'dropout': 0.633365720444478, 'd_model_multiplier': 8, 'num_layers': 4, 'n_heads': 4, 'dim_feedforward': 481, 'batch_size': 23, 'pos_encoding': 'fixed', 'activation': 'relu', 'norm': 'LayerNorm', 'optimizer_name': 'AdamW', 'weight_decay': 0.1, 'top_n_features': 174}. Best is trial 12 with value: 0.20472501771481755.[0m
[FileBasedDataset] Initializing dataset...
	Examples: 8264
	Features: 228
	Max length: 315
Standard scalar turned ON, loading params from cache
[FileBasedDataset] Dataset initialization complete
  epoch    auprc    auroc    train_loss    valid_acc    valid_loss    cp     dur
-------  -------  -------  ------------  -----------  ------------  ----  ------
      1   [36m0.2047[0m   [32m0.6846[0m        [35m0.2766[0m       [31m0.9190[0m        [94m0.2608[0m     +  8.3387
      2   [36m0.2257[0m   [32m0.6937[0m        [35m0.2607[0m       0.9190        0.2664        8.2115
      3   [36m0.2583[0m   [32m0.7199[0m        [35m0.2551[0m       0.9190        [94m0.2560[0m     +  8.9586
      4   [36m0.2626[0m   [32m0.7326[0m        [35m0.2520[0m       [31m0.9202[0m        0.2673        8.9917
      5   [36m0.2773[0m   [32m0.7610[0m        [35m0.2490[0m       0.9202        0.2640        8.9463
      6   [36m0.2776[0m   [32m0.7642[0m        [35m0.2479[0m       0.9202        0.2710        9.0254
      7   [36m0.2913[0m   [32m0.7747[0m        [35m0.2444[0m       0.9190        0.2715        9.7609
      8   [36m0.3028[0m   [32m0.7873[0m        [35m0.2423[0m       [31m0.9226[0m        0.2678        9.6228
      9   [36m0.3033[0m   0.7858        0.2447       0.9202        0.2811        9.3543
     10   [36m0.3145[0m   [32m0.7945[0m        [35m0.2397[0m       0.9202        0.2870        9.5250
     11   0.3139   0.7926        [35m0.2394[0m       [31m0.9262[0m        0.2810        9.8085
     12   [36m0.3232[0m   [32m0.7994[0m        0.2409       0.9226        0.2756        9.2620
Stopping since valid_loss has not improved in the last 10 epochs.
[32m[I 2023-05-02 07:24:24,041][0m Trial 61 finished with value: 0.25597321897510894 and parameters: {'lr': 0.0006998345121288106, 'dropout': 0.5494840879039065, 'd_model_multiplier': 8, 'num_layers': 2, 'n_heads': 4, 'dim_feedforward': 236, 'batch_size': 37, 'pos_encoding': 'fixed', 'activation': 'relu', 'norm': 'LayerNorm', 'optimizer_name': 'AdamW', 'weight_decay': 0, 'top_n_features': 228}. Best is trial 12 with value: 0.20472501771481755.[0m
[FileBasedDataset] Initializing dataset...
	Examples: 8264
	Features: 210
	Max length: 315
Standard scalar turned ON, loading params from cache
[FileBasedDataset] Dataset initialization complete
  epoch    auprc    auroc    train_loss    valid_acc    valid_loss    cp     dur
-------  -------  -------  ------------  -----------  ------------  ----  ------
      1   [36m0.1110[0m   [32m0.6529[0m        [35m0.2784[0m       [31m0.8888[0m        [94m0.2619[0m     +  8.2062
      2   [36m0.1474[0m   [32m0.6557[0m        [35m0.2599[0m       [31m0.9323[0m        [94m0.2299[0m     +  8.7849
      3   0.1318   [32m0.6616[0m        [35m0.2573[0m       0.9141        0.2425        8.8481
      4   [36m0.1524[0m   [32m0.6900[0m        [35m0.2571[0m       0.9311        [94m0.2292[0m     +  8.7488
      5   [36m0.1574[0m   [32m0.7010[0m        [35m0.2521[0m       0.9226        0.2308        8.8135
      6   [36m0.1642[0m   [32m0.7138[0m        [35m0.2514[0m       0.9105        0.2399        8.8329
      7   [36m0.1771[0m   [32m0.7365[0m        [35m0.2490[0m       0.8984        0.2603        8.6735
      8   [36m0.1808[0m   0.7301        [35m0.2447[0m       0.9178        0.2372        9.2012
      9   [36m0.1885[0m   [32m0.7473[0m        0.2474       0.8996        0.2661        9.2094
     10   [36m0.1934[0m   0.7460        0.2466       0.9287        [94m0.2210[0m     +  9.5178
     11   [36m0.2023[0m   [32m0.7535[0m        [35m0.2429[0m       0.9166        0.2363        9.5938
     12   [36m0.2029[0m   0.7450        0.2433       0.9214        0.2347        9.2186
     13   [36m0.2031[0m   0.7512        [35m0.2421[0m       0.9274        0.2274        9.0606
     14   [36m0.2094[0m   0.7504        [35m0.2415[0m       0.9250        0.2299        9.1026
     15   [36m0.2333[0m   [32m0.7579[0m        [35m0.2374[0m       0.9299        0.2247        8.7849
     16   0.2160   [32m0.7596[0m        0.2402       0.9226        0.2317        9.0774
     17   0.2078   [32m0.7622[0m        0.2375       0.9178        0.2359        9.1489
     18   0.2146   [32m0.7652[0m        [35m0.2370[0m       0.9117        0.2554        9.7282
     19   0.2328   [32m0.7674[0m        [35m0.2348[0m       0.9274        0.2311        9.0309
Stopping since valid_loss has not improved in the last 10 epochs.
[32m[I 2023-05-02 07:27:25,245][0m Trial 62 finished with value: 0.220975230293666 and parameters: {'lr': 0.0004368380491771148, 'dropout': 0.4951404053989128, 'd_model_multiplier': 8, 'num_layers': 1, 'n_heads': 4, 'dim_feedforward': 498, 'batch_size': 18, 'pos_encoding': 'fixed', 'activation': 'relu', 'norm': 'LayerNorm', 'optimizer_name': 'AdamW', 'weight_decay': 0.01, 'top_n_features': 210}. Best is trial 12 with value: 0.20472501771481755.[0m
[FileBasedDataset] Initializing dataset...
	Examples: 8264
	Features: 197
	Max length: 315
Standard scalar turned ON, loading params from cache
[FileBasedDataset] Dataset initialization complete
  epoch    auprc    auroc    train_loss    valid_acc    valid_loss    cp      dur
-------  -------  -------  ------------  -----------  ------------  ----  -------
      1   [36m0.1393[0m   [32m0.7051[0m        [35m0.2760[0m       [31m0.9238[0m        [94m0.2652[0m     +  14.8989
      2   0.1379   0.6995        [35m0.2636[0m       0.9190        0.2767        15.1859
      3   [36m0.1404[0m   [32m0.7052[0m        [35m0.2612[0m       0.9226        0.2816        14.8941
      4   0.1382   [32m0.7067[0m        [35m0.2593[0m       0.9214        0.2795        14.9987
      5   0.1384   [32m0.7096[0m        [35m0.2551[0m       0.9226        [94m0.2594[0m     +  14.7965
      6   0.1387   [32m0.7097[0m        [35m0.2549[0m       0.9226        0.2640        14.6872
      7   [36m0.1440[0m   [32m0.7157[0m        0.2575       0.9238        0.2615        15.3096
      8   0.1435   0.7108        0.2585       0.9226        0.2682        14.8921
      9   0.1429   0.7118        0.2554       0.9238        0.2614        15.1524
     10   [36m0.1516[0m   [32m0.7365[0m        [35m0.2499[0m       0.9226        [94m0.2509[0m     +  15.3256
     11   0.1368   0.7147        [35m0.2485[0m       0.8803        0.2752        15.7486
     12   0.1370   0.7146        [35m0.2476[0m       0.9129        0.2553        14.9953
     13   0.1492   [32m0.7484[0m        [35m0.2445[0m       0.9008        0.2752        15.0050
     14   [36m0.1536[0m   0.7444        [35m0.2390[0m       0.8972        0.2665        14.7428
     15   [36m0.1544[0m   [32m0.7503[0m        [35m0.2369[0m       0.9008        0.2826        14.8193
     16   0.1505   0.7317        0.2394       0.8924        0.2715        15.4434
     17   0.1502   0.7361        0.2396       0.8863        0.2779        15.8351
     18   [36m0.1602[0m   [32m0.7513[0m        0.2386       0.9069        0.2631        15.6327
     19   [36m0.1633[0m   [32m0.7543[0m        0.2393       0.9057        0.2697        15.4152
Stopping since valid_loss has not improved in the last 10 epochs.
