[32m[I 2023-05-02 15:09:14,008][0m Trial 158 finished with value: 0.2433878176157535 and parameters: {'lr': 0.006173282726970838, 'dropout': 0.4035141068260572, 'd_model_multiplier': 1, 'num_layers': 2, 'n_heads': 4, 'dim_feedforward': 207, 'batch_size': 72, 'pos_encoding': 'fixed', 'activation': 'gelu', 'norm': 'BatchNorm', 'optimizer_name': 'PlainRAdam', 'weight_decay': 0.1, 'top_n_features': 182}. Best is trial 117 with value: 0.191397856754288.[0m
[FileBasedDataset] Initializing dataset...
	Examples: 8264
	Features: 231
	Max length: 315
Standard scalar turned ON, loading params from cache
[FileBasedDataset] Dataset initialization complete
  epoch    auprc    auroc    train_loss    valid_acc    valid_loss    cp      dur
-------  -------  -------  ------------  -----------  ------------  ----  -------
      1   [36m0.1438[0m   [32m0.6162[0m        [35m2.2690[0m       [31m0.8573[0m        [94m0.4047[0m     +  16.3521
      2   [36m0.1819[0m   [32m0.6451[0m        [35m0.3088[0m       0.7449        0.4796        16.8696
      3   0.1726   [32m0.6465[0m        [35m0.2743[0m       [31m0.9081[0m        [94m0.3119[0m     +  17.0551
      4   [36m0.1820[0m   0.6456        [35m0.2659[0m       0.9045        0.3159        16.8754
      5   0.1473   0.6359        [35m0.2656[0m       [31m0.9250[0m        [94m0.2954[0m     +  16.9789
      6   0.1734   [32m0.6537[0m        [35m0.2644[0m       [31m0.9299[0m        0.3151        17.2184
      7   0.1642   0.6475        [35m0.2621[0m       0.9299        [94m0.2933[0m     +  17.4256
      8   0.1820   0.6384        [35m0.2597[0m       0.9299        [94m0.2865[0m     +  17.0858
      9   0.1581   0.6410        0.2609       0.9299        0.3779        16.8948
     10   0.1793   0.6312        0.2600       0.9299        0.3980        17.1875
     11   0.1119   0.5976        0.2602       0.9299        0.2962        16.8678
     12   0.1023   0.5989        [35m0.2565[0m       0.9299        0.3215        16.9708
     13   0.1363   0.6313        0.2614       0.9299        0.3118        17.0122
     14   0.1688   [32m0.6598[0m        0.2579       0.9299        [94m0.2771[0m     +  16.8168
     15   0.1628   0.6581        [35m0.2565[0m       0.9299        0.3369        16.7937
     16   0.1523   [32m0.6618[0m        0.2569       0.9299        0.3158        17.0583
     17   0.1467   0.6418        [35m0.2552[0m       0.9299        0.3267        17.1947
     18   0.0824   0.4808        0.2558       0.9299        0.3340        17.3248
     19   0.1648   0.6511        [35m0.2550[0m       0.9299        0.2893        16.7306
     20   0.1424   0.6425        [35m0.2532[0m       0.9299        0.3115        17.2555
     21   0.1601   0.6468        0.2539       0.9299        0.2855        17.0732
     22   0.1495   0.6364        0.2542       0.9299        0.2934        16.8771
     23   0.1478   0.6374        [35m0.2529[0m       0.9299        [94m0.2643[0m     +  16.9674
     24   0.0741   0.3970        0.2546       0.9299        0.2860        17.1166
     25   0.1532   0.6472        [35m0.2522[0m       0.9299        0.2698        17.0113
     26   0.1716   0.6489        [35m0.2518[0m       0.9299        0.2727        16.8307
     27   0.0701   0.5000        0.2526       0.9299        0.2703        17.2332
     28   0.1096   0.5934        [35m0.2495[0m       0.9299        0.2661        17.0451
     29   0.0701   0.5000        0.2527       0.9299        0.2646        17.0173
     30   0.1341   0.6400        0.2531       0.9299        [94m0.2617[0m     +  17.0714
     31   0.1085   0.6049        0.2526       0.9299        0.2981        17.1269
     32   0.1368   0.6418        0.2519       0.9299        [94m0.2583[0m     +  17.2130
     33   0.1081   0.4727        0.2533       0.9299        0.2585        17.1726
     34   0.1412   0.6152        0.2503       0.9299        [94m0.2569[0m     +  16.8780
     35   0.0920   0.4438        0.2543       0.9299        [94m0.2566[0m     +  17.1651
     36   0.0701   0.5000        0.2518       0.9299        [94m0.2557[0m     +  17.1110
     37   0.0701   0.5000        0.2498       0.9299        [94m0.2553[0m     +  17.0839
     38   0.1300   0.6100        0.2523       0.9299        [94m0.2533[0m     +  17.1540
     39   0.0780   0.4783        0.2552       0.9299        0.2586        16.9799
     40   0.0701   0.5000        0.2535       0.9299        0.2543        17.1387
     41   0.1727   0.6488        0.2536       0.9299        [94m0.2487[0m     +  17.0609
     42   0.0701   0.5000        0.2523       0.9299        0.2540        16.8475
     43   0.0701   0.5000        0.2524       0.9299        0.2541        16.9162
     44   0.1527   0.6407        0.2527       0.9299        [94m0.2481[0m     +  16.9765
     45   0.1335   0.5854        0.2526       0.9299        0.2541        16.9951
     46   0.0701   0.5000        0.2521       0.9299        0.2542        16.9498
     47   0.0701   0.5000        0.2516       0.9299        0.2543        16.8111
     48   0.0701   0.5000        [35m0.2494[0m       0.9299        0.2545        17.1238
     49   0.1370   0.6118        0.2508       0.9299        0.2497        16.9054
     50   0.1482   [32m0.6951[0m        0.2511       0.9299        0.2543        17.1066
[32m[I 2023-05-02 15:23:28,328][0m Trial 159 finished with value: 0.2481499861705116 and parameters: {'lr': 0.01044719799127782, 'dropout': 0.4794807994307057, 'd_model_multiplier': 32, 'num_layers': 3, 'n_heads': 16, 'dim_feedforward': 227, 'batch_size': 114, 'pos_encoding': 'fixed', 'activation': 'relu', 'norm': 'LayerNorm', 'optimizer_name': 'AdamW', 'weight_decay': 0, 'top_n_features': 231}. Best is trial 117 with value: 0.191397856754288.[0m
[FileBasedDataset] Initializing dataset...
	Examples: 8264
	Features: 26
	Max length: 315
Standard scalar turned ON, loading params from cache
[FileBasedDataset] Dataset initialization complete
  epoch    auprc    auroc    train_loss    valid_acc    valid_loss    cp      dur
-------  -------  -------  ------------  -----------  ------------  ----  -------
      1   [36m0.3585[0m   [32m0.8247[0m        [35m0.3333[0m       [31m0.9178[0m        [94m0.5731[0m     +  13.0333
      2   0.3535   [32m0.8283[0m        [35m0.2542[0m       0.9178        [94m0.5157[0m     +  13.0708
      3   0.3335   0.8099        0.2543       [31m0.9299[0m        [94m0.4649[0m     +  13.3550
      4   0.2631   0.7595        [35m0.2514[0m       0.9287        [94m0.3799[0m     +  13.3014
      5   0.2609   0.7658        [35m0.2480[0m       0.9287        [94m0.3325[0m     +  13.1926
      6   0.2158   0.7326        [35m0.2471[0m       0.9274        [94m0.3025[0m     +  13.1388
      7   0.2108   0.7366        [35m0.2443[0m       0.9274        [94m0.2874[0m     +  13.3474
      8   0.2084   0.7326        [35m0.2434[0m       0.9287        [94m0.2714[0m     +  13.3528
      9   0.2123   0.7207        [35m0.2413[0m       0.9287        [94m0.2656[0m     +  13.2565
     10   0.1971   0.7328        [35m0.2413[0m       0.9274        [94m0.2647[0m     +  13.3136
     11   0.1797   0.7062        0.2419       0.9287        [94m0.2615[0m     +  13.8959
     12   0.2526   0.7739        [35m0.2386[0m       0.9262        [94m0.2512[0m     +  13.2400
     13   0.2600   0.7676        [35m0.2378[0m       0.9262        0.2528        13.2668
     14   0.2524   0.7692        [35m0.2372[0m       0.9262        0.2556        13.4358
     15   0.2581   0.7646        0.2381       0.9262        0.2516        13.6103
     16   0.2932   0.7901        0.2395       0.9274        0.2531        13.4764
     17   0.2962   0.7952        0.2389       0.9238        [94m0.2442[0m     +  13.4658
     18   0.3019   0.8195        0.2402       0.9250        0.2544        13.2773
     19   0.3034   0.8207        0.2394       0.9250        0.2513        13.2657
     20   0.3166   [32m0.8316[0m        [35m0.2359[0m       0.9262        0.2516        13.2829
     21   0.3059   [32m0.8319[0m        0.2384       0.9250        0.2462        13.3573
     22   0.3040   [32m0.8356[0m        0.2367       0.9250        0.2464        13.2994
     23   0.3025   0.8317        0.2419       0.9238        0.2512        13.4029
     24   0.3037   [32m0.8394[0m        0.2401       0.9262        0.2706        13.2467
     25   0.3041   0.8346        [35m0.2337[0m       0.9262        0.2599        13.1679
     26   0.3070   0.8263        0.2399       0.9274        [94m0.2427[0m     +  13.2050
     27   0.3122   0.8320        0.2346       0.9287        [94m0.2420[0m     +  13.5014
     28   0.3124   0.8348        [35m0.2329[0m       0.9274        [94m0.2408[0m     +  13.4256
     29   0.3130   0.8384        0.2370       0.9287        [94m0.2397[0m     +  13.2267
     30   0.3093   0.8347        [35m0.2289[0m       0.9262        [94m0.2264[0m     +  13.2263
     31   0.3208   0.8372        0.2341       0.9274        [94m0.2204[0m     +  13.0924
     32   0.3210   0.8331        0.2307       0.9274        [94m0.2199[0m     +  13.2110
     33   0.3222   0.8284        0.2315       0.9262        [94m0.2176[0m     +  13.4772
     34   0.3193   0.8346        0.2313       0.9250        0.2221        13.3078
     35   0.3134   0.8312        0.2329       0.9274        [94m0.2169[0m     +  13.1426
     36   0.3220   0.8241        0.2300       0.9287        [94m0.2125[0m     +  13.3051
     37   0.3182   0.8187        0.2295       0.9287        0.2149        13.2436
     38   0.3198   0.8149        0.2313       0.9262        0.2155        13.2569
     39   0.3218   0.8127        [35m0.2286[0m       0.9274        0.2227        13.3118
     40   0.3284   0.8152        [35m0.2284[0m       0.9299        0.2157        13.2737
     41   0.3374   0.8193        [35m0.2283[0m       [31m0.9311[0m        0.2127        13.1696
     42   0.3126   0.8121        0.2293       0.9262        0.2207        13.2161
     43   0.3151   0.8191        [35m0.2253[0m       0.9287        0.2160        13.3524
     44   0.2988   0.8147        0.2302       0.9238        0.2207        13.3934
     45   0.3071   0.8157        [35m0.2224[0m       0.9262        0.2179        13.3017
Stopping since valid_loss has not improved in the last 10 epochs.
[32m[I 2023-05-02 15:33:43,206][0m Trial 160 finished with value: 0.2125424469450653 and parameters: {'lr': 0.00014713090182931978, 'dropout': 0.522605838812969, 'd_model_multiplier': 8, 'num_layers': 2, 'n_heads': 32, 'dim_feedforward': 132, 'batch_size': 30, 'pos_encoding': 'learnable', 'activation': 'gelu', 'norm': 'BatchNorm', 'optimizer_name': 'PlainRAdam', 'weight_decay': 0.01, 'top_n_features': 26}. Best is trial 117 with value: 0.191397856754288.[0m
[FileBasedDataset] Initializing dataset...
	Examples: 8264
	Features: 60
	Max length: 315
Standard scalar turned ON, loading params from cache
[FileBasedDataset] Dataset initialization complete
  epoch    auprc    auroc    train_loss    valid_acc    valid_loss    cp      dur
-------  -------  -------  ------------  -----------  ------------  ----  -------
      1   [36m0.3480[0m   [32m0.7770[0m        [35m0.3428[0m       [31m0.9117[0m        [94m0.3492[0m     +  13.1906
      2   [36m0.3620[0m   [32m0.7847[0m        [35m0.2556[0m       [31m0.9154[0m        [94m0.3105[0m     +  13.1017
      3   0.3572   0.7842        [35m0.2482[0m       [31m0.9178[0m        [94m0.2918[0m     +  13.4011
      4   0.3373   0.7815        [35m0.2461[0m       0.9141        [94m0.2778[0m     +  13.3740
      5   0.3412   [32m0.7911[0m        [35m0.2423[0m       0.9117        [94m0.2720[0m     +  13.3395
      6   0.3303   0.7895        [35m0.2405[0m       0.9105        [94m0.2685[0m     +  13.2916
      7   0.3292   [32m0.7957[0m        [35m0.2367[0m       0.9081        [94m0.2651[0m     +  13.3150
      8   0.3431   [32m0.8107[0m        [35m0.2366[0m       0.9057        [94m0.2622[0m     +  13.3570
      9   0.3414   0.8054        [35m0.2353[0m       0.9045        0.2663        13.3880
     10   0.3420   [32m0.8130[0m        0.2369       0.9045        0.2629        13.2430
     11   0.3445   [32m0.8214[0m        [35m0.2329[0m       0.9069        [94m0.2600[0m     +  13.4043
     12   [36m0.3666[0m   [32m0.8311[0m        [35m0.2310[0m       0.9081        [94m0.2537[0m     +  13.1766
     13   [36m0.3676[0m   [32m0.8391[0m        0.2339       0.9069        0.2544        13.2992
     14   0.3607   0.8382        [35m0.2295[0m       0.9081        0.2540        13.2573
     15   0.3571   0.8380        0.2305       0.9081        0.2577        13.2398
     16   [36m0.3682[0m   0.8388        [35m0.2269[0m       0.9117        0.2564        13.3129
     17   0.3640   0.8375        0.2283       0.9069        0.2553        13.4240
     18   0.3578   0.8381        [35m0.2261[0m       0.9081        0.2602        13.2715
     19   0.3634   0.8376        0.2273       0.9081        0.2614        13.0757
     20   0.3621   [32m0.8432[0m        0.2267       0.9057        0.2590        13.2673
     21   0.3582   [32m0.8451[0m        [35m0.2244[0m       0.9081        0.2633        13.3734
Stopping since valid_loss has not improved in the last 10 epochs.
[32m[I 2023-05-02 15:38:36,772][0m Trial 161 finished with value: 0.2537322187077754 and parameters: {'lr': 0.00010194117341991292, 'dropout': 0.5207287738319645, 'd_model_multiplier': 8, 'num_layers': 2, 'n_heads': 32, 'dim_feedforward': 133, 'batch_size': 30, 'pos_encoding': 'learnable', 'activation': 'gelu', 'norm': 'BatchNorm', 'optimizer_name': 'PlainRAdam', 'weight_decay': 0.01, 'top_n_features': 60}. Best is trial 117 with value: 0.191397856754288.[0m
[FileBasedDataset] Initializing dataset...
	Examples: 8264
	Features: 92
	Max length: 315
Standard scalar turned ON, loading params from cache
[FileBasedDataset] Dataset initialization complete
  epoch    auprc    auroc    train_loss    valid_acc    valid_loss    cp     dur
-------  -------  -------  ------------  -----------  ------------  ----  ------
      1   [36m0.2933[0m   [32m0.7196[0m        [35m0.3013[0m       [31m0.9141[0m        [94m0.3109[0m     +  9.2143
      2   [36m0.3056[0m   [32m0.7230[0m        [35m0.2502[0m       [31m0.9202[0m        [94m0.2966[0m     +  9.6913
      3   0.2902   0.7200        [35m0.2459[0m       0.9190        [94m0.2906[0m     +  9.3539
      4   0.2961   [32m0.7281[0m        [35m0.2437[0m       0.9166        [94m0.2826[0m     +  9.5324
      5   0.2810   0.7140        [35m0.2391[0m       0.9178        [94m0.2734[0m     +  9.6078
      6   0.2769   0.7213        [35m0.2376[0m       0.9154        0.2752        9.6091
      7   0.2622   0.7034        0.2402       0.9141        0.2754        9.5534
      8   0.2664   0.6934        [35m0.2363[0m       0.9129        0.2788        9.9053
      9   0.2583   0.6823        0.2381       0.9141        0.2835        9.6918
     10   0.2571   0.6789        [35m0.2322[0m       0.9141        0.2878        9.4629
     11   0.2565   0.6679        0.2348       0.9166        0.2876        9.5297
     12   0.2627   0.6639        [35m0.2320[0m       0.9166        0.2939        9.6785
     13   0.2549   0.6386        0.2323       0.9154        0.2997        9.3174
     14   0.2485   0.6506        0.2348       0.9178        0.3012        9.5797
Stopping since valid_loss has not improved in the last 10 epochs.
[32m[I 2023-05-02 15:41:00,655][0m Trial 162 finished with value: 0.27344818180821107 and parameters: {'lr': 0.00016884062257437908, 'dropout': 0.505063002968575, 'd_model_multiplier': 8, 'num_layers': 1, 'n_heads': 32, 'dim_feedforward': 128, 'batch_size': 24, 'pos_encoding': 'learnable', 'activation': 'gelu', 'norm': 'BatchNorm', 'optimizer_name': 'PlainRAdam', 'weight_decay': 0.01, 'top_n_features': 92}. Best is trial 117 with value: 0.191397856754288.[0m
[FileBasedDataset] Initializing dataset...
	Examples: 8264
	Features: 36
	Max length: 315
Standard scalar turned ON, loading params from cache
[FileBasedDataset] Dataset initialization complete
  epoch    auprc    auroc    train_loss    valid_acc    valid_loss    cp      dur
-------  -------  -------  ------------  -----------  ------------  ----  -------
      1   [36m0.2739[0m   [32m0.7212[0m        [35m0.3745[0m       [31m0.9323[0m        [94m0.3372[0m     +  14.2335
      2   [36m0.3017[0m   [32m0.7492[0m        [35m0.2578[0m       [31m0.9335[0m        [94m0.3044[0m     +  14.6436
      3   [36m0.3237[0m   [32m0.7558[0m        [35m0.2485[0m       [31m0.9347[0m        [94m0.2855[0m     +  14.9033
      4   [36m0.3251[0m   0.7542        [35m0.2432[0m       0.9347        [94m0.2699[0m     +  15.2138
      5   [36m0.3303[0m   0.7545        [35m0.2388[0m       0.9347        [94m0.2614[0m     +  15.2263
      6   0.3272   [32m0.7626[0m        [35m0.2380[0m       0.9347        [94m0.2584[0m     +  15.2431
      7   0.3285   0.7592        [35m0.2341[0m       0.9335        [94m0.2509[0m     +  15.0535
      8   [36m0.3339[0m   0.7603        [35m0.2303[0m       0.9347        [94m0.2491[0m     +  14.8754
      9   [36m0.3359[0m   [32m0.7680[0m        0.2304       0.9335        0.2502        14.8711
     10   [36m0.3474[0m   [32m0.7701[0m        [35m0.2263[0m       [31m0.9359[0m        [94m0.2400[0m     +  15.0924
     11   0.3167   0.7690        0.2269       0.9311        0.2486        14.8176
     12   0.3287   [32m0.7769[0m        [35m0.2249[0m       0.9335        0.2405        14.8707
     13   0.3188   0.7729        0.2253       0.9311        [94m0.2394[0m     +  14.8961
     14   0.3191   0.7724        [35m0.2188[0m       0.9323        [94m0.2347[0m     +  15.1082
     15   0.3135   0.7619        0.2214       0.9299        0.2416        15.1041
     16   0.3249   0.7699        0.2238       0.9323        0.2420        15.1164
     17   0.3077   0.7745        [35m0.2179[0m       0.9274        0.2430        14.8596
     18   0.3045   0.7746        0.2180       0.9311        0.2368        15.0347
     19   0.2893   0.7733        0.2197       0.9287        0.2395        14.9259
     20   0.2741   [32m0.7822[0m        0.2188       0.9250        0.2446        15.2098
     21   0.2989   0.7816        [35m0.2164[0m       0.9250        0.2352        15.2367
     22   0.2928   0.7754        0.2185       0.9323        [94m0.2290[0m     +  15.1084
     23   0.2939   0.7757        [35m0.2163[0m       0.9311        0.2361        15.1180
     24   0.2851   0.7803        0.2168       0.9299        0.2370        15.2531
     25   0.2812   [32m0.7873[0m        0.2193       0.9287        0.2403        15.3077
     26   0.2697   [32m0.7891[0m        0.2163       0.9262        0.2341        15.2511
     27   0.2728   0.7857        [35m0.2133[0m       0.9262        0.2428        15.1252
     28   0.2703   [32m0.7945[0m        [35m0.2106[0m       0.9274        0.2370        15.0823
     29   0.2952   [32m0.7951[0m        0.2130       0.9287        0.2308        15.1424
     30   0.2952   [32m0.8000[0m        [35m0.2063[0m       0.9287        0.2341        15.0291
     31   0.2930   [32m0.8010[0m        0.2074       0.9262        0.2456        15.0467
Stopping since valid_loss has not improved in the last 10 epochs.
