[32m[I 2023-05-03 07:34:43,352][0m Trial 309 finished with value: 0.24539300029987002 and parameters: {'lr': 0.0012150296669572052, 'dropout': 0.57130967796178, 'd_model_multiplier': 1, 'num_layers': 4, 'n_heads': 64, 'dim_feedforward': 426, 'batch_size': 58, 'pos_encoding': 'fixed', 'activation': 'relu', 'norm': 'LayerNorm', 'optimizer_name': 'RAdam', 'weight_decay': 0.1, 'top_n_features': 29}. Best is trial 246 with value: 0.16447311791139763.[0m
[FileBasedDataset] Initializing dataset...
	Examples: 8264
	Features: 35
	Max length: 315
Standard scalar turned ON, loading params from cache
[FileBasedDataset] Dataset initialization complete
  epoch    auprc    auroc    train_loss    valid_acc    valid_loss    cp      dur
-------  -------  -------  ------------  -----------  ------------  ----  -------
      1   [36m0.1510[0m   [32m0.6612[0m        [35m0.3040[0m       [31m0.9359[0m        [94m0.2307[0m     +  10.3380
      2   [36m0.1657[0m   [32m0.6618[0m        [35m0.2542[0m       0.9311        0.2562        10.4030
      3   [36m0.1717[0m   [32m0.7073[0m        [35m0.2493[0m       0.9323        0.2620        10.6737
      4   [36m0.1746[0m   [32m0.7100[0m        [35m0.2464[0m       0.9323        0.2604        10.5864
      5   [36m0.1748[0m   [32m0.7190[0m        [35m0.2442[0m       0.9335        0.2544        10.6641
      6   [36m0.1877[0m   [32m0.7341[0m        [35m0.2416[0m       0.9323        0.2461        10.6163
      7   0.1844   0.7243        [35m0.2400[0m       0.9323        0.2505        10.4603
      8   [36m0.1945[0m   0.7333        [35m0.2369[0m       0.9323        0.2560        10.6176
      9   [36m0.1962[0m   0.7332        [35m0.2366[0m       0.9299        0.2450        10.5272
     10   [36m0.1962[0m   [32m0.7364[0m        0.2367       0.9311        0.2529        10.5649
Stopping since valid_loss has not improved in the last 10 epochs.
[32m[I 2023-05-03 07:36:39,618][0m Trial 310 finished with value: 0.23070668173275952 and parameters: {'lr': 0.002093414193178641, 'dropout': 0.6023600823108911, 'd_model_multiplier': 1, 'num_layers': 2, 'n_heads': 32, 'dim_feedforward': 400, 'batch_size': 38, 'pos_encoding': 'fixed', 'activation': 'relu', 'norm': 'LayerNorm', 'optimizer_name': 'RAdam', 'weight_decay': 0.1, 'top_n_features': 35}. Best is trial 246 with value: 0.16447311791139763.[0m
[FileBasedDataset] Initializing dataset...
	Examples: 8264
	Features: 40
	Max length: 315
Standard scalar turned ON, loading params from cache
[FileBasedDataset] Dataset initialization complete
  epoch    auprc    auroc    train_loss    valid_acc    valid_loss    cp      dur
-------  -------  -------  ------------  -----------  ------------  ----  -------
      1   [36m0.0953[0m   [32m0.3478[0m        [35m0.6467[0m       [31m0.9117[0m        [94m0.5684[0m     +  16.1116
      2   0.0887   [32m0.3491[0m        [35m0.5513[0m       0.9117        [94m0.4686[0m     +  16.1871
      3   0.0768   [32m0.3538[0m        [35m0.4593[0m       0.9117        [94m0.3952[0m     +  16.8738
      4   0.0771   [32m0.3821[0m        [35m0.3889[0m       0.9117        [94m0.3496[0m     +  16.4360
      5   0.0839   [32m0.4470[0m        [35m0.3414[0m       0.9117        [94m0.3222[0m     +  16.4647
      6   [36m0.0974[0m   [32m0.5248[0m        [35m0.3114[0m       0.9117        [94m0.3056[0m     +  16.3441
      7   [36m0.1480[0m   [32m0.5929[0m        [35m0.2935[0m       0.9117        [94m0.2949[0m     +  16.4189
      8   [36m0.1835[0m   [32m0.6368[0m        [35m0.2809[0m       0.9117        [94m0.2881[0m     +  16.3760
      9   [36m0.2176[0m   [32m0.6637[0m        [35m0.2705[0m       0.9117        [94m0.2837[0m     +  16.1444
     10   [36m0.2280[0m   [32m0.6804[0m        [35m0.2647[0m       0.9117        [94m0.2806[0m     +  16.2986
     11   [36m0.2324[0m   [32m0.6939[0m        [35m0.2600[0m       0.9117        [94m0.2788[0m     +  16.2934
     12   [36m0.2409[0m   [32m0.7055[0m        [35m0.2556[0m       0.9117        [94m0.2769[0m     +  16.4468
     13   [36m0.2507[0m   [32m0.7144[0m        [35m0.2546[0m       0.9117        [94m0.2758[0m     +  16.3531
     14   [36m0.2616[0m   [32m0.7219[0m        [35m0.2506[0m       0.9117        [94m0.2751[0m     +  16.1561
     15   [36m0.2692[0m   [32m0.7295[0m        [35m0.2491[0m       0.9117        [94m0.2738[0m     +  16.3813
     16   [36m0.2746[0m   [32m0.7345[0m        [35m0.2470[0m       0.9117        [94m0.2734[0m     +  16.3245
     17   [36m0.2813[0m   [32m0.7395[0m        0.2471       0.9117        [94m0.2725[0m     +  16.5567
     18   [36m0.2886[0m   [32m0.7437[0m        [35m0.2456[0m       0.9117        [94m0.2721[0m     +  16.2911
     19   [36m0.2959[0m   [32m0.7472[0m        [35m0.2424[0m       0.9117        [94m0.2711[0m     +  16.2761
     20   [36m0.3029[0m   [32m0.7510[0m        [35m0.2418[0m       0.9105        [94m0.2703[0m     +  16.4476
     21   [36m0.3100[0m   [32m0.7541[0m        [35m0.2407[0m       0.9105        [94m0.2690[0m     +  16.4079
     22   0.3098   [32m0.7566[0m        [35m0.2396[0m       0.9117        [94m0.2686[0m     +  16.2556
     23   [36m0.3132[0m   [32m0.7593[0m        [35m0.2394[0m       0.9117        [94m0.2684[0m     +  16.1891
     24   0.3130   [32m0.7611[0m        [35m0.2373[0m       [31m0.9166[0m        [94m0.2679[0m     +  16.3790
     25   0.3116   [32m0.7630[0m        [35m0.2373[0m       [31m0.9190[0m        [94m0.2678[0m     +  16.3225
     26   0.3106   [32m0.7651[0m        [35m0.2356[0m       0.9141        [94m0.2672[0m     +  16.6167
     27   0.3093   [32m0.7655[0m        [35m0.2350[0m       0.9141        0.2679        16.3746
     28   0.3093   [32m0.7672[0m        0.2350       0.9141        0.2677        16.2028
     29   0.3086   [32m0.7681[0m        [35m0.2320[0m       0.9129        0.2683        16.3434
     30   0.3065   [32m0.7684[0m        0.2326       0.9117        0.2689        16.4499
     31   0.3065   [32m0.7685[0m        0.2325       0.9129        0.2697        16.3783
     32   0.3074   [32m0.7694[0m        [35m0.2319[0m       0.9129        0.2699        16.4018
     33   0.3077   [32m0.7698[0m        [35m0.2319[0m       0.9129        0.2707        16.2616
     34   0.3079   0.7696        [35m0.2307[0m       0.9129        0.2716        16.5106
     35   0.3086   [32m0.7701[0m        [35m0.2304[0m       0.9117        0.2722        16.2881
Stopping since valid_loss has not improved in the last 10 epochs.
[32m[I 2023-05-03 07:46:30,916][0m Trial 311 finished with value: 0.26722026956881406 and parameters: {'lr': 4.162638974857645e-06, 'dropout': 0.5602129745318699, 'd_model_multiplier': 4, 'num_layers': 3, 'n_heads': 32, 'dim_feedforward': 412, 'batch_size': 43, 'pos_encoding': 'fixed', 'activation': 'relu', 'norm': 'LayerNorm', 'optimizer_name': 'RAdam', 'weight_decay': 0, 'top_n_features': 40}. Best is trial 246 with value: 0.16447311791139763.[0m
[FileBasedDataset] Initializing dataset...
	Examples: 8264
	Features: 45
	Max length: 315
Standard scalar turned ON, loading params from cache
[FileBasedDataset] Dataset initialization complete
  epoch    auprc    auroc    train_loss    valid_acc    valid_loss    cp      dur
-------  -------  -------  ------------  -----------  ------------  ----  -------
      1   [36m0.2597[0m   [32m0.7250[0m        [35m0.2768[0m       [31m0.9117[0m        [94m0.2535[0m     +  15.9432
      2   0.2534   [32m0.7496[0m        [35m0.2617[0m       0.9093        0.2762        16.9340
      3   [36m0.2615[0m   [32m0.7540[0m        [35m0.2520[0m       0.9081        0.2856        16.5697
      4   [36m0.2620[0m   0.7476        [35m0.2499[0m       0.9093        0.2790        16.1559
      5   0.2366   0.7409        0.2542       0.9057        0.2762        16.2211
      6   0.1917   0.6986        0.2541       0.8609        0.3028        15.9231
      7   0.1901   0.6990        0.2559       0.8730        0.2707        16.1855
      8   0.1976   0.6935        0.2582       0.8984        0.2694        16.2190
      9   0.1834   0.6985        0.2558       [31m0.9226[0m        [94m0.2535[0m     +  16.2008
     10   0.1974   0.6966        0.2583       [31m0.9238[0m        0.2582        16.2038
     11   0.2000   0.6980        0.2576       [31m0.9262[0m        0.2578        16.4909
     12   0.1985   0.7021        0.2559       0.9262        [94m0.2512[0m     +  16.1367
     13   0.2001   0.7015        0.2559       [31m0.9274[0m        0.2580        16.3227
     14   0.2058   0.6996        0.2551       0.9274        0.2536        16.5082
     15   0.2038   0.7028        0.2554       0.9214        0.2594        16.3518
     16   0.2022   0.7023        0.2561       0.9262        0.2536        16.4710
     17   0.1903   0.6998        0.2579       0.9262        0.2611        16.2846
     18   0.1968   0.6979        0.2547       0.9274        0.2545        16.3770
     19   0.2179   0.6993        0.2571       0.9262        0.2544        16.5114
     20   0.1942   0.6929        0.2565       0.9262        0.2565        16.2828
     21   0.1919   0.6982        0.2552       0.9274        0.2539        16.2334
Stopping since valid_loss has not improved in the last 10 epochs.
[32m[I 2023-05-03 07:52:30,210][0m Trial 312 finished with value: 0.25115453868996274 and parameters: {'lr': 0.010675670781809867, 'dropout': 0.6562509547460538, 'd_model_multiplier': 1, 'num_layers': 4, 'n_heads': 32, 'dim_feedforward': 421, 'batch_size': 64, 'pos_encoding': 'fixed', 'activation': 'relu', 'norm': 'LayerNorm', 'optimizer_name': 'RAdam', 'weight_decay': 0.1, 'top_n_features': 45}. Best is trial 246 with value: 0.16447311791139763.[0m
[FileBasedDataset] Initializing dataset...
	Examples: 8264
	Features: 23
	Max length: 315
Standard scalar turned ON, loading params from cache
[FileBasedDataset] Dataset initialization complete
  epoch    auprc    auroc    train_loss    valid_acc    valid_loss    cp      dur
-------  -------  -------  ------------  -----------  ------------  ----  -------
      1   [36m0.1775[0m   [32m0.5931[0m        [35m0.3091[0m       [31m0.8501[0m        [94m0.4711[0m     +  72.9205
      2   [36m0.1846[0m   [32m0.6500[0m        0.3193       [31m0.9105[0m        [94m0.3078[0m     +  73.0921
      3   0.1774   [32m0.6516[0m        0.3219       0.8767        0.3422        73.4010
      4   0.1822   0.6297        0.3116       0.8755        0.3250        73.2661
      5   0.1699   0.6389        0.3111       0.8815        0.3481        73.5019
      6   0.1650   0.6501        [35m0.2886[0m       0.8972        0.3291        73.3509
      7   0.1642   0.6466        [35m0.2800[0m       0.9033        0.3347        73.3508
      8   0.1623   [32m0.6535[0m        [35m0.2695[0m       0.9081        0.3333        73.2510
      9   0.1668   [32m0.6552[0m        [35m0.2596[0m       0.9081        0.3342        73.3067
     10   0.1609   0.6362        [35m0.2571[0m       0.9008        0.3321        73.5739
     11   0.1604   0.6288        [35m0.2538[0m       0.8803        0.3402        73.3917
Stopping since valid_loss has not improved in the last 10 epochs.
[32m[I 2023-05-03 08:07:13,611][0m Trial 313 finished with value: 0.30784585408442977 and parameters: {'lr': 0.000920231383921296, 'dropout': 0.4029439995297607, 'd_model_multiplier': 32, 'num_layers': 3, 'n_heads': 64, 'dim_feedforward': 406, 'batch_size': 51, 'pos_encoding': 'fixed', 'activation': 'relu', 'norm': 'LayerNorm', 'optimizer_name': 'RAdam', 'weight_decay': 0.1, 'top_n_features': 23}. Best is trial 246 with value: 0.16447311791139763.[0m
[FileBasedDataset] Initializing dataset...
	Examples: 8264
	Features: 57
	Max length: 315
Standard scalar turned ON, loading params from cache
[FileBasedDataset] Dataset initialization complete
  epoch    auprc    auroc    train_loss    valid_acc    valid_loss    cp      dur
-------  -------  -------  ------------  -----------  ------------  ----  -------
      1   [36m0.2403[0m   [32m0.7652[0m        [35m0.3732[0m       [31m0.9347[0m        [94m0.2279[0m     +  44.5651
      2   0.1571   0.6906        0.3848       0.9347        0.2697        45.0254
      3   0.1941   0.7112        [35m0.3661[0m       0.8222        0.6341        44.9101
      4   0.1989   0.7225        [35m0.3564[0m       0.8827        0.2784        44.9234
      5   0.1110   0.6035        [35m0.3346[0m       0.9347        0.3160        45.1964
      6   0.2127   0.7253        [35m0.3280[0m       0.8936        0.2866        44.9839
      7   0.1915   0.7119        [35m0.3124[0m       0.9323        0.3240        44.7458
      8   0.1719   0.7063        [35m0.2933[0m       0.9323        0.2809        45.0375
      9   0.1595   0.7044        [35m0.2809[0m       0.9347        0.3471        44.9709
     10   0.1841   0.7127        [35m0.2754[0m       0.9299        0.2830        44.6787
Stopping since valid_loss has not improved in the last 10 epochs.
[32m[I 2023-05-03 08:15:29,233][0m Trial 314 finished with value: 0.22790655250488775 and parameters: {'lr': 0.0015891510828208817, 'dropout': 0.6225258037141053, 'd_model_multiplier': 64, 'num_layers': 2, 'n_heads': 32, 'dim_feedforward': 441, 'batch_size': 57, 'pos_encoding': 'fixed', 'activation': 'relu', 'norm': 'LayerNorm', 'optimizer_name': 'RAdam', 'weight_decay': 0.1, 'top_n_features': 57}. Best is trial 246 with value: 0.16447311791139763.[0m
[FileBasedDataset] Initializing dataset...
	Examples: 8264
	Features: 67
	Max length: 315
Standard scalar turned ON, loading params from cache
[FileBasedDataset] Dataset initialization complete
  epoch    auprc    auroc    train_loss    valid_acc    valid_loss    cp      dur
-------  -------  -------  ------------  -----------  ------------  ----  -------
      1   [36m0.3226[0m   [32m0.7746[0m        [35m0.3890[0m       [31m0.9311[0m        [94m0.2153[0m     +  23.5272
      2   [36m0.4594[0m   [32m0.8371[0m        [35m0.2502[0m       0.9311        [94m0.1910[0m     +  23.9263
      3   [36m0.4786[0m   [32m0.8559[0m        [35m0.2402[0m       [31m0.9359[0m        [94m0.1877[0m     +  23.9991
      4   0.4758   [32m0.8642[0m        [35m0.2372[0m       [31m0.9383[0m        [94m0.1862[0m     +  23.9555
      5   0.4608   0.8625        [35m0.2358[0m       0.9371        0.1879        23.8924
      6   0.4557   [32m0.8661[0m        [35m0.2345[0m       [31m0.9395[0m        [94m0.1853[0m     +  23.8589
      7   0.4372   [32m0.8699[0m        [35m0.2313[0m       0.9395        0.1866        23.9150
      8   0.4239   0.8656        [35m0.2296[0m       [31m0.9407[0m        0.1873        23.9282
      9   0.4119   0.8643        [35m0.2287[0m       0.9395        0.1895        23.7679
     10   0.3965   0.8653        [35m0.2256[0m       0.9371        0.1901        23.7541
     11   0.3715   0.8538        [35m0.2238[0m       0.9371        0.1946        23.7788
     12   0.3354   0.8492        [35m0.2232[0m       0.9323        0.1992        23.8233
     13   0.3402   0.8359        [35m0.2198[0m       0.9323        0.2003        23.9471
     14   0.3069   0.8377        [35m0.2174[0m       0.9299        0.2029        23.8360
     15   0.2843   0.8316        [35m0.2151[0m       0.9250        0.2087        23.8208
Stopping since valid_loss has not improved in the last 10 epochs.
[32m[I 2023-05-03 08:21:51,816][0m Trial 315 finished with value: 0.1852705024696319 and parameters: {'lr': 4.4401954403124515e-05, 'dropout': 0.32041321304899045, 'd_model_multiplier': 4, 'num_layers': 5, 'n_heads': 32, 'dim_feedforward': 368, 'batch_size': 26, 'pos_encoding': 'fixed', 'activation': 'relu', 'norm': 'LayerNorm', 'optimizer_name': 'RAdam', 'weight_decay': 0.1, 'top_n_features': 67}. Best is trial 246 with value: 0.16447311791139763.[0m
[FileBasedDataset] Initializing dataset...
	Examples: 8264
	Features: 60
	Max length: 315
Standard scalar turned ON, loading params from cache
[FileBasedDataset] Dataset initialization complete
  epoch    auprc    auroc    train_loss    valid_acc    valid_loss    cp      dur
-------  -------  -------  ------------  -----------  ------------  ----  -------
      1   [36m0.1311[0m   [32m0.5466[0m        [35m0.3999[0m       [31m0.9238[0m        [94m0.2728[0m     +  23.4946
      2   [36m0.2338[0m   [32m0.7177[0m        [35m0.2558[0m       0.9238        [94m0.2552[0m     +  23.6073
      3   [36m0.2995[0m   [32m0.7533[0m        [35m0.2437[0m       [31m0.9250[0m        [94m0.2441[0m     +  24.1247
      4   [36m0.3062[0m   [32m0.7750[0m        [35m0.2403[0m       0.9250        [94m0.2371[0m     +  23.5948
      5   [36m0.3092[0m   [32m0.7911[0m        [35m0.2360[0m       0.9226        [94m0.2304[0m     +  23.6843
      6   [36m0.3161[0m   [32m0.7955[0m        [35m0.2357[0m       0.9238        [94m0.2292[0m     +  23.5270
      7   [36m0.3301[0m   [32m0.7968[0m        [35m0.2338[0m       0.9214        [94m0.2292[0m     +  23.7033
      8   0.3265   [32m0.7987[0m        0.2342       0.9226        [94m0.2269[0m     +  23.7794
      9   [36m0.3401[0m   [32m0.8031[0m        [35m0.2325[0m       0.9250        0.2279        23.5558
     10   0.3356   0.8029        0.2326       0.9226        [94m0.2255[0m     +  23.7407
     11   0.3286   0.8016        [35m0.2314[0m       0.9238        0.2290        23.6380
     12   0.3359   [32m0.8057[0m        0.2330       0.9250        0.2259        23.7205
     13   [36m0.3405[0m   [32m0.8072[0m        0.2317       0.9238        0.2260        23.7548
     14   0.3290   0.8023        [35m0.2292[0m       0.9238        0.2277        23.8085
     15   0.3146   0.8007        [35m0.2287[0m       0.9238        0.2313        23.7157
     16   0.3195   0.7993        0.2296       0.9226        0.2312        23.6359
     17   0.3175   0.8008        [35m0.2282[0m       0.9202        0.2313        23.4615
     18   0.3220   0.8027        [35m0.2281[0m       0.9214        0.2298        23.5400
     19   0.3144   0.7984        [35m0.2269[0m       0.9226        0.2327        23.6356
Stopping since valid_loss has not improved in the last 10 epochs.
[32m[I 2023-05-03 08:29:46,353][0m Trial 316 finished with value: 0.22549452362390643 and parameters: {'lr': 7.238407012128088e-05, 'dropout': 0.5825896420487507, 'd_model_multiplier': 4, 'num_layers': 5, 'n_heads': 32, 'dim_feedforward': 353, 'batch_size': 33, 'pos_encoding': 'fixed', 'activation': 'relu', 'norm': 'LayerNorm', 'optimizer_name': 'RAdam', 'weight_decay': 0.1, 'top_n_features': 60}. Best is trial 246 with value: 0.16447311791139763.[0m
[FileBasedDataset] Initializing dataset...
	Examples: 8264
	Features: 55
	Max length: 315
Standard scalar turned ON, loading params from cache
[FileBasedDataset] Dataset initialization complete
Warning, assumed runtime error: CUDA out of memory. Tried to allocate 4.66 GiB (GPU 0; 23.70 GiB total capacity; 16.20 GiB already allocated; 4.06 GiB free; 18.55 GiB reserved in total by PyTorch) If reserved memory is >> allocated memory try setting max_split_size_mb to avoid fragmentation.  See documentation for Memory Management and PYTORCH_CUDA_ALLOC_CONF
