[32m[I 2023-05-04 15:33:51,796][0m Trial 462 finished with value: 0.20638819185717364 and parameters: {'lr': 5.1520147171106866e-05, 'dropout': 0.43873858552209183, 'd_model_multiplier': 4, 'num_layers': 5, 'n_heads': 32, 'dim_feedforward': 339, 'batch_size': 41, 'pos_encoding': 'fixed', 'activation': 'relu', 'norm': 'LayerNorm', 'optimizer_name': 'RAdam', 'weight_decay': 0.1, 'top_n_features': 76}. Best is trial 246 with value: 0.16447311791139763.[0m
[FileBasedDataset] Initializing dataset...
	Examples: 8264
	Features: 57
	Max length: 315
Standard scalar turned ON, loading params from cache
[FileBasedDataset] Dataset initialization complete
  epoch    auprc    auroc    train_loss    valid_acc    valid_loss    cp      dur
-------  -------  -------  ------------  -----------  ------------  ----  -------
      1   [36m0.1550[0m   [32m0.6112[0m        [35m0.7476[0m       [31m0.1064[0m        [94m0.7573[0m     +  23.8520
      2   0.1193   0.5380        [35m0.7306[0m       [31m0.1632[0m        [94m0.7352[0m     +  24.0548
      3   0.0923   0.4528        [35m0.7104[0m       [31m0.2914[0m        [94m0.7077[0m     +  24.1892
      4   0.0760   0.3878        [35m0.6852[0m       [31m0.5816[0m        [94m0.6774[0m     +  24.3384
      5   0.0708   0.3599        [35m0.6585[0m       [31m0.8440[0m        [94m0.6456[0m     +  24.3868
      6   0.0675   0.3485        [35m0.6294[0m       [31m0.9081[0m        [94m0.6134[0m     +  24.4874
      7   0.0640   0.3419        [35m0.6016[0m       [31m0.9141[0m        [94m0.5817[0m     +  24.3431
      8   0.0625   0.3376        [35m0.5715[0m       [31m0.9154[0m        [94m0.5509[0m     +  24.4457
      9   0.0619   0.3357        [35m0.5427[0m       0.9154        [94m0.5216[0m     +  24.3304
     10   0.0614   0.3342        [35m0.5160[0m       0.9154        [94m0.4939[0m     +  24.6279
     11   0.0614   0.3340        [35m0.4898[0m       0.9154        [94m0.4681[0m     +  24.4310
     12   0.0615   0.3356        [35m0.4663[0m       0.9154        [94m0.4443[0m     +  24.6402
     13   0.0617   0.3383        [35m0.4446[0m       0.9154        [94m0.4226[0m     +  24.2618
     14   0.0621   0.3437        [35m0.4243[0m       0.9154        [94m0.4030[0m     +  24.5837
     15   0.0626   0.3508        [35m0.4029[0m       0.9154        [94m0.3855[0m     +  24.2612
     16   0.0636   0.3622        [35m0.3853[0m       0.9154        [94m0.3700[0m     +  24.4861
     17   0.0647   0.3757        [35m0.3690[0m       0.9154        [94m0.3563[0m     +  24.6593
     18   0.0664   0.3954        [35m0.3558[0m       0.9154        [94m0.3444[0m     +  24.2887
     19   0.0687   0.4186        [35m0.3437[0m       0.9154        [94m0.3344[0m     +  24.7623
     20   0.0715   0.4446        [35m0.3333[0m       0.9154        [94m0.3259[0m     +  24.2500
     21   0.0744   0.4680        [35m0.3248[0m       0.9154        [94m0.3188[0m     +  24.5179
     22   0.0778   0.4911        [35m0.3158[0m       0.9154        [94m0.3128[0m     +  24.5302
     23   0.0820   0.5142        [35m0.3094[0m       0.9154        [94m0.3076[0m     +  24.5242
     24   0.0867   0.5353        [35m0.3034[0m       0.9154        [94m0.3031[0m     +  24.6198
     25   0.0922   0.5540        [35m0.2994[0m       0.9154        [94m0.2991[0m     +  24.6267
     26   0.0999   0.5712        [35m0.2939[0m       0.9154        [94m0.2955[0m     +  24.3944
     27   0.1074   0.5840        [35m0.2881[0m       0.9154        [94m0.2924[0m     +  24.2865
     28   0.1174   0.5968        [35m0.2850[0m       0.9154        [94m0.2897[0m     +  24.4058
     29   0.1280   0.6070        [35m0.2821[0m       0.9141        [94m0.2873[0m     +  24.7212
     30   0.1369   [32m0.6156[0m        [35m0.2795[0m       0.9141        [94m0.2851[0m     +  24.2709
     31   0.1467   [32m0.6238[0m        [35m0.2751[0m       0.9141        [94m0.2831[0m     +  24.3877
     32   0.1545   [32m0.6320[0m        [35m0.2735[0m       0.9141        [94m0.2813[0m     +  24.3976
     33   [36m0.1635[0m   [32m0.6391[0m        [35m0.2707[0m       0.9141        [94m0.2797[0m     +  24.2841
     34   [36m0.1721[0m   [32m0.6459[0m        [35m0.2686[0m       0.9141        [94m0.2781[0m     +  24.1409
     35   [36m0.1781[0m   [32m0.6520[0m        [35m0.2668[0m       0.9141        [94m0.2767[0m     +  24.3340
     36   [36m0.1824[0m   [32m0.6567[0m        [35m0.2664[0m       0.9141        [94m0.2754[0m     +  24.3611
     37   [36m0.1908[0m   [32m0.6618[0m        [35m0.2639[0m       0.9141        [94m0.2743[0m     +  24.4908
     38   [36m0.1976[0m   [32m0.6667[0m        [35m0.2630[0m       0.9141        [94m0.2732[0m     +  24.7617
     39   [36m0.2034[0m   [32m0.6712[0m        [35m0.2625[0m       0.9141        [94m0.2721[0m     +  24.5794
     40   [36m0.2069[0m   [32m0.6736[0m        [35m0.2595[0m       0.9141        [94m0.2712[0m     +  24.5627
     41   [36m0.2113[0m   [32m0.6775[0m        [35m0.2581[0m       0.9141        [94m0.2703[0m     +  24.2073
     42   [36m0.2185[0m   [32m0.6814[0m        [35m0.2574[0m       0.9141        [94m0.2695[0m     +  24.3784
     43   [36m0.2223[0m   [32m0.6844[0m        [35m0.2558[0m       0.9141        [94m0.2687[0m     +  23.9175
     44   [36m0.2269[0m   [32m0.6880[0m        [35m0.2545[0m       0.9141        [94m0.2680[0m     +  24.7167
     45   [36m0.2297[0m   [32m0.6908[0m        [35m0.2540[0m       0.9141        [94m0.2673[0m     +  24.6477
     46   [36m0.2336[0m   [32m0.6935[0m        [35m0.2523[0m       0.9129        [94m0.2666[0m     +  24.3847
     47   [36m0.2363[0m   [32m0.6948[0m        [35m0.2518[0m       0.9129        [94m0.2659[0m     +  24.0448
     48   [36m0.2406[0m   [32m0.6976[0m        [35m0.2517[0m       0.9129        [94m0.2652[0m     +  24.5887
     49   [36m0.2438[0m   [32m0.7002[0m        [35m0.2502[0m       0.9129        [94m0.2646[0m     +  24.6539
     50   [36m0.2450[0m   [32m0.7021[0m        [35m0.2492[0m       0.9141        [94m0.2641[0m     +  24.4162
[32m[I 2023-05-04 15:54:17,543][0m Trial 463 finished with value: 0.2641144246043144 and parameters: {'lr': 1.0129684920324714e-06, 'dropout': 0.45226688997802816, 'd_model_multiplier': 4, 'num_layers': 5, 'n_heads': 32, 'dim_feedforward': 277, 'batch_size': 89, 'pos_encoding': 'fixed', 'activation': 'relu', 'norm': 'LayerNorm', 'optimizer_name': 'RAdam', 'weight_decay': 0.1, 'top_n_features': 57}. Best is trial 246 with value: 0.16447311791139763.[0m
[FileBasedDataset] Initializing dataset...
	Examples: 8264
	Features: 63
	Max length: 315
Standard scalar turned ON, loading params from cache
[FileBasedDataset] Dataset initialization complete
  epoch    auprc    auroc    train_loss    valid_acc    valid_loss    cp      dur
-------  -------  -------  ------------  -----------  ------------  ----  -------
      1   [36m0.0692[0m   [32m0.3380[0m        [35m0.5378[0m       [31m0.9190[0m        [94m0.4253[0m     +  10.2449
      2   [36m0.0756[0m   [32m0.4004[0m        [35m0.3913[0m       0.9190        [94m0.3388[0m     +  9.5960
      3   [36m0.1612[0m   [32m0.4925[0m        [35m0.3287[0m       0.9190        [94m0.3023[0m     +  9.5173
      4   [36m0.1649[0m   [32m0.5836[0m        [35m0.2960[0m       0.9190        [94m0.2808[0m     +  10.5627
      5   [36m0.1703[0m   [32m0.6561[0m        [35m0.2762[0m       0.9190        [94m0.2683[0m     +  10.1481
      6   [36m0.1881[0m   [32m0.6930[0m        [35m0.2648[0m       0.9190        [94m0.2628[0m     +  10.3485
      7   [36m0.1967[0m   [32m0.7149[0m        [35m0.2604[0m       0.9190        [94m0.2601[0m     +  10.5573
      8   [36m0.1968[0m   [32m0.7310[0m        [35m0.2555[0m       0.9190        [94m0.2586[0m     +  10.1174
      9   [36m0.2057[0m   [32m0.7450[0m        [35m0.2544[0m       0.9190        [94m0.2568[0m     +  9.8639
     10   [36m0.2181[0m   [32m0.7533[0m        [35m0.2521[0m       0.9190        [94m0.2558[0m     +  9.8025
     11   [36m0.2294[0m   0.7492        [35m0.2504[0m       0.9190        0.2565        9.7106
     12   [36m0.2447[0m   0.7488        [35m0.2452[0m       0.9190        [94m0.2555[0m     +  9.8052
     13   [36m0.2468[0m   0.7416        [35m0.2421[0m       0.9190        0.2577        10.2930
     14   [36m0.2483[0m   0.7527        [35m0.2421[0m       0.9166        0.2557        9.5985
     15   [36m0.2489[0m   0.7522        [35m0.2402[0m       0.9166        0.2572        9.4181
     16   [36m0.2544[0m   [32m0.7586[0m        [35m0.2378[0m       0.9178        0.2559        9.7229
     17   0.2535   0.7580        0.2384       0.9166        0.2561        10.1168
     18   [36m0.2577[0m   [32m0.7625[0m        [35m0.2365[0m       0.9166        0.2559        10.4164
     19   0.2576   [32m0.7662[0m        0.2375       0.9141        [94m0.2553[0m     +  10.1368
     20   [36m0.2580[0m   [32m0.7668[0m        [35m0.2362[0m       0.9141        0.2557        9.8621
     21   [36m0.2618[0m   [32m0.7696[0m        0.2374       0.9129        [94m0.2552[0m     +  9.8177
     22   [36m0.2630[0m   [32m0.7736[0m        0.2362       0.9129        [94m0.2543[0m     +  9.6715
     23   0.2623   [32m0.7740[0m        0.2363       0.9129        0.2549        9.5447
     24   0.2627   [32m0.7744[0m        [35m0.2352[0m       0.9141        0.2548        9.5056
     25   [36m0.2669[0m   [32m0.7771[0m        [35m0.2339[0m       0.9141        0.2551        9.6033
     26   [36m0.2689[0m   [32m0.7796[0m        [35m0.2319[0m       0.9141        [94m0.2537[0m     +  9.6569
     27   0.2667   0.7795        0.2342       0.9154        0.2539        10.2099
     28   0.2660   0.7780        0.2326       0.9154        0.2554        9.8422
     29   0.2689   [32m0.7804[0m        [35m0.2311[0m       0.9141        0.2559        10.1637
     30   [36m0.2692[0m   [32m0.7828[0m        [35m0.2310[0m       0.9154        0.2546        9.8944
     31   0.2673   0.7826        0.2327       0.9154        0.2551        10.3295
     32   0.2676   0.7827        [35m0.2310[0m       0.9166        0.2541        10.3484
     33   0.2688   [32m0.7834[0m        [35m0.2305[0m       0.9166        0.2539        9.8912
     34   0.2668   0.7826        0.2307       0.9178        0.2542        9.9834
     35   0.2690   [32m0.7841[0m        0.2315       0.9178        [94m0.2533[0m     +  10.3530
     36   0.2686   0.7839        [35m0.2296[0m       0.9166        0.2541        9.6086
     37   [36m0.2716[0m   [32m0.7847[0m        0.2301       0.9166        [94m0.2528[0m     +  9.5090
     38   [36m0.2720[0m   [32m0.7847[0m        0.2300       0.9166        0.2531        9.8305
     39   0.2706   0.7843        0.2298       0.9178        [94m0.2524[0m     +  9.5405
     40   0.2677   0.7836        0.2302       0.9178        0.2539        10.7807
     41   0.2709   0.7843        [35m0.2292[0m       0.9166        0.2550        10.4696
     42   0.2701   0.7843        0.2293       0.9166        0.2554        10.1779
     43   0.2693   0.7838        [35m0.2287[0m       0.9178        0.2537        9.9724
     44   0.2708   0.7844        [35m0.2268[0m       0.9166        0.2528        9.6747
     45   0.2696   0.7840        0.2296       0.9166        0.2535        10.2648
     46   [36m0.2726[0m   [32m0.7854[0m        0.2272       0.9178        0.2555        10.1421
     47   0.2718   0.7841        0.2272       0.9178        0.2533        9.4183
     48   0.2694   0.7827        [35m0.2263[0m       0.9166        0.2544        9.9032
Stopping since valid_loss has not improved in the last 10 epochs.
[32m[I 2023-05-04 16:02:26,513][0m Trial 464 finished with value: 0.2524195722650011 and parameters: {'lr': 4.0312894056660306e-05, 'dropout': 0.5097844279329043, 'd_model_multiplier': 4, 'num_layers': 4, 'n_heads': 4, 'dim_feedforward': 372, 'batch_size': 75, 'pos_encoding': 'fixed', 'activation': 'relu', 'norm': 'LayerNorm', 'optimizer_name': 'AdamW', 'weight_decay': 0.1, 'top_n_features': 63}. Best is trial 246 with value: 0.16447311791139763.[0m
[FileBasedDataset] Initializing dataset...
	Examples: 8264
	Features: 72
	Max length: 315
Standard scalar turned ON, loading params from cache
[FileBasedDataset] Dataset initialization complete
  epoch    auprc    auroc    train_loss    valid_acc    valid_loss    cp      dur
-------  -------  -------  ------------  -----------  ------------  ----  -------
      1   [36m0.0650[0m   [32m0.3913[0m        [35m0.5940[0m       [31m0.9299[0m        [94m0.3660[0m     +  29.5795
      2   [36m0.1150[0m   [32m0.6316[0m        [35m0.3300[0m       0.9299        [94m0.2494[0m     +  29.4044
      3   [36m0.1856[0m   [32m0.7152[0m        [35m0.2635[0m       0.9287        [94m0.2334[0m     +  29.9049
      4   [36m0.2155[0m   [32m0.7404[0m        [35m0.2469[0m       0.9262        [94m0.2292[0m     +  29.9079
      5   [36m0.2324[0m   [32m0.7482[0m        [35m0.2392[0m       0.9238        0.2307        29.6825
      6   [36m0.2360[0m   [32m0.7517[0m        [35m0.2360[0m       0.9250        0.2325        29.8209
      7   [36m0.2497[0m   [32m0.7518[0m        [35m0.2351[0m       0.9238        0.2333        29.8473
      8   [36m0.2553[0m   [32m0.7558[0m        [35m0.2334[0m       0.9238        0.2332        29.7550
      9   [36m0.2564[0m   [32m0.7575[0m        [35m0.2314[0m       0.9262        0.2322        30.0664
     10   [36m0.2587[0m   [32m0.7601[0m        [35m0.2298[0m       0.9262        0.2324        29.8916
     11   [36m0.2712[0m   [32m0.7614[0m        0.2306       0.9226        0.2337        29.7126
     12   [36m0.2739[0m   [32m0.7646[0m        [35m0.2292[0m       0.9226        0.2333        29.6422
     13   0.2737   0.7639        [35m0.2265[0m       0.9226        0.2352        29.7019
Stopping since valid_loss has not improved in the last 10 epochs.
[32m[I 2023-05-04 16:09:24,506][0m Trial 465 finished with value: 0.22922993605413633 and parameters: {'lr': 2.5033615233095113e-05, 'dropout': 0.5482530836504792, 'd_model_multiplier': 8, 'num_layers': 6, 'n_heads': 32, 'dim_feedforward': 360, 'batch_size': 71, 'pos_encoding': 'fixed', 'activation': 'relu', 'norm': 'LayerNorm', 'optimizer_name': 'RAdam', 'weight_decay': 0.001, 'top_n_features': 72}. Best is trial 246 with value: 0.16447311791139763.[0m
[FileBasedDataset] Initializing dataset...
	Examples: 8264
	Features: 67
	Max length: 315
Standard scalar turned ON, loading params from cache
[FileBasedDataset] Dataset initialization complete
  epoch    auprc    auroc    train_loss    valid_acc    valid_loss    cp      dur
-------  -------  -------  ------------  -----------  ------------  ----  -------
      1   [36m0.2944[0m   [32m0.7791[0m        [35m0.2702[0m       [31m0.9226[0m        [94m0.2324[0m     +  69.9217
      2   [36m0.3102[0m   [32m0.7904[0m        [35m0.2358[0m       0.9226        [94m0.2292[0m     +  70.3651
      3   [36m0.3119[0m   [32m0.8023[0m        [35m0.2332[0m       0.9214        [94m0.2268[0m     +  70.2771
      4   [36m0.3146[0m   [32m0.8089[0m        [35m0.2291[0m       0.9190        [94m0.2265[0m     +  70.1885
      5   0.3125   [32m0.8145[0m        [35m0.2274[0m       0.9190        0.2278        70.1986
      6   [36m0.3193[0m   [32m0.8158[0m        [35m0.2260[0m       0.9202        [94m0.2265[0m     +  70.5033
      7   0.3176   [32m0.8190[0m        [35m0.2252[0m       0.9190        0.2282        70.4231
      8   0.3005   [32m0.8205[0m        [35m0.2217[0m       0.9154        0.2344        70.3363
      9   0.2999   0.8195        [35m0.2194[0m       0.9166        0.2324        70.3208
     10   0.3055   [32m0.8230[0m        [35m0.2183[0m       0.9214        0.2275        70.4273
     11   0.3022   0.8219        [35m0.2157[0m       0.9141        0.2316        70.3940
     12   0.2965   [32m0.8249[0m        [35m0.2141[0m       0.9166        0.2350        70.3137
     13   0.2927   [32m0.8278[0m        [35m0.2113[0m       0.9178        0.2331        70.5580
     14   0.3014   [32m0.8281[0m        [35m0.2094[0m       0.9178        0.2323        70.4072
     15   0.2969   0.8265        [35m0.2059[0m       0.9178        0.2335        70.3731
Stopping since valid_loss has not improved in the last 10 epochs.
