[32m[I 2023-01-09 17:09:55,497][0m Trial 138 finished with value: 0.340984218247903 and parameters: {'lr': 0.0001856568638582865, 'dropout': 0.6701559111489068, 'd_model_multiplier': 64, 'num_layers': 2, 'n_heads': 8, 'dim_feedforward': 477, 'batch_size': 139, 'pos_encoding': 'fixed', 'activation': 'relu', 'norm': 'BatchNorm', 'optimizer_name': 'RAdam', 'weight_decay': 0.1}. Best is trial 122 with value: 0.40157405369010674.[0m
[EnsembleDataset] Initializing dataset...
	Examples: 27964
	Features: 621
	Max length: 316
[EnsembleDataset] Dataset initialization complete
  epoch    auprc    auroc    train_loss    valid_loss    cp      dur
-------  -------  -------  ------------  ------------  ----  -------
      1   [36m0.2898[0m   [32m0.8362[0m        [35m0.1243[0m        [31m0.0655[0m     +  31.6265
      2   0.2837   [32m0.8450[0m        0.1716        0.0701        32.1065
      3   0.2617   0.7794        0.2358        0.0805        32.3024
Stopping since valid_loss has not improved in the last 3 epochs.
[32m[I 2023-01-09 17:16:18,532][0m Trial 139 finished with value: 0.28977873639534435 and parameters: {'lr': 0.00014439918998927637, 'dropout': 0.18287042648954926, 'd_model_multiplier': 64, 'num_layers': 2, 'n_heads': 8, 'dim_feedforward': 475, 'batch_size': 138, 'pos_encoding': 'fixed', 'activation': 'relu', 'norm': 'BatchNorm', 'optimizer_name': 'RAdam', 'weight_decay': 0.1}. Best is trial 122 with value: 0.40157405369010674.[0m
[EnsembleDataset] Initializing dataset...
	Examples: 27964
	Features: 621
	Max length: 316
[EnsembleDataset] Dataset initialization complete
  epoch    auprc    auroc    train_loss    valid_loss    cp      dur
-------  -------  -------  ------------  ------------  ----  -------
      1   [36m0.3186[0m   [32m0.8366[0m        [35m0.1531[0m        [31m0.0495[0m     +  32.1568
      2   0.3112   0.8305        0.1932        0.0533        32.5073
      3   0.3069   0.8340        0.3485        0.0542        32.4786
Stopping since valid_loss has not improved in the last 3 epochs.
[32m[I 2023-01-09 17:22:41,012][0m Trial 140 finished with value: 0.3186309296774808 and parameters: {'lr': 0.0003024119418060649, 'dropout': 0.6726680463285224, 'd_model_multiplier': 64, 'num_layers': 2, 'n_heads': 8, 'dim_feedforward': 179, 'batch_size': 145, 'pos_encoding': 'learnable', 'activation': 'relu', 'norm': 'BatchNorm', 'optimizer_name': 'RAdam', 'weight_decay': 0}. Best is trial 122 with value: 0.40157405369010674.[0m
[EnsembleDataset] Initializing dataset...
	Examples: 27964
	Features: 621
	Max length: 316
[EnsembleDataset] Dataset initialization complete
  epoch    auprc    auroc    train_loss    valid_loss    cp      dur
-------  -------  -------  ------------  ------------  ----  -------
      1   [36m0.3607[0m   [32m0.8449[0m        [35m0.1166[0m        [31m0.0552[0m     +  29.4080
      2   0.3582   [32m0.8458[0m        0.1211        0.0553        30.1279
      3   0.3571   [32m0.8460[0m        [35m0.0979[0m        0.0553        30.7914
Stopping since valid_loss has not improved in the last 3 epochs.
[32m[I 2023-01-09 17:28:50,856][0m Trial 141 finished with value: 0.3606543770275164 and parameters: {'lr': 0.00020739991113362876, 'dropout': 0.6347607732643707, 'd_model_multiplier': 4, 'num_layers': 3, 'n_heads': 8, 'dim_feedforward': 491, 'batch_size': 134, 'pos_encoding': 'fixed', 'activation': 'relu', 'norm': 'BatchNorm', 'optimizer_name': 'RAdam', 'weight_decay': 0.1}. Best is trial 122 with value: 0.40157405369010674.[0m
[EnsembleDataset] Initializing dataset...
	Examples: 27964
	Features: 621
	Max length: 316
[EnsembleDataset] Dataset initialization complete
  epoch    auprc    auroc    train_loss    valid_loss    cp      dur
-------  -------  -------  ------------  ------------  ----  -------
      1   [36m0.2882[0m   [32m0.8385[0m        [35m0.1470[0m        [31m0.0511[0m     +  42.3001
      2   [36m0.2900[0m   [32m0.8408[0m        0.2131        [31m0.0506[0m     +  42.1684
      3   0.2782   0.8391        0.2068        0.0518        42.2857
      4   0.2671   0.8332        0.2616        0.0559        42.1425
Stopping since valid_loss has not improved in the last 3 epochs.
[32m[I 2023-01-09 17:37:59,900][0m Trial 142 finished with value: 0.2900186183733597 and parameters: {'lr': 0.00021798608799682273, 'dropout': 0.6616917134833055, 'd_model_multiplier': 64, 'num_layers': 3, 'n_heads': 8, 'dim_feedforward': 490, 'batch_size': 134, 'pos_encoding': 'fixed', 'activation': 'relu', 'norm': 'BatchNorm', 'optimizer_name': 'RAdam', 'weight_decay': 0.1}. Best is trial 122 with value: 0.40157405369010674.[0m
[EnsembleDataset] Initializing dataset...
	Examples: 27964
	Features: 621
	Max length: 316
[EnsembleDataset] Dataset initialization complete
  epoch    auprc    auroc    train_loss    valid_loss    cp      dur
-------  -------  -------  ------------  ------------  ----  -------
      1   [36m0.2759[0m   [32m0.8414[0m        [35m0.1344[0m        [31m0.0504[0m     +  30.1659
      2   [36m0.2766[0m   0.8404        0.1437        0.0504        31.0877
      3   0.2761   0.8403        [35m0.1133[0m        0.0505        31.0581
Stopping since valid_loss has not improved in the last 3 epochs.
[32m[I 2023-01-09 17:44:14,794][0m Trial 143 finished with value: 0.2765594438128905 and parameters: {'lr': 3.767630717721279e-05, 'dropout': 0.6396929932640443, 'd_model_multiplier': 4, 'num_layers': 3, 'n_heads': 8, 'dim_feedforward': 483, 'batch_size': 153, 'pos_encoding': 'fixed', 'activation': 'relu', 'norm': 'BatchNorm', 'optimizer_name': 'RAdam', 'weight_decay': 0.1}. Best is trial 122 with value: 0.40157405369010674.[0m
[EnsembleDataset] Initializing dataset...
	Examples: 27964
	Features: 621
	Max length: 316
[EnsembleDataset] Dataset initialization complete
  epoch    auprc    auroc    train_loss    valid_loss    cp      dur
-------  -------  -------  ------------  ------------  ----  -------
      1   [36m0.3161[0m   [32m0.8246[0m        [35m0.1379[0m        [31m0.0530[0m     +  31.2241
      2   [36m0.3217[0m   [32m0.8294[0m        [35m0.1220[0m        [31m0.0528[0m     +  30.7745
      3   [36m0.3227[0m   [32m0.8327[0m        [35m0.1071[0m        [31m0.0526[0m     +  30.9003
      4   [36m0.3257[0m   0.8305        [35m0.0982[0m        0.0526        29.7469
      5   [36m0.3291[0m   [32m0.8346[0m        [35m0.0908[0m        [31m0.0524[0m     +  30.7802
      6   0.3286   [32m0.8364[0m        [35m0.0754[0m        0.0524        30.3589
      7   0.3286   0.8361        [35m0.0677[0m        [31m0.0523[0m     +  30.3331
      8   0.3278   0.8334        [35m0.0672[0m        0.0524        31.0405
      9   0.3207   0.8243        [35m0.0592[0m        0.0530        29.7010
Stopping since valid_loss has not improved in the last 3 epochs.
[32m[I 2023-01-09 18:01:47,856][0m Trial 144 finished with value: 0.329094900671473 and parameters: {'lr': 0.0002211552775091876, 'dropout': 0.6829347321375728, 'd_model_multiplier': 4, 'num_layers': 4, 'n_heads': 8, 'dim_feedforward': 497, 'batch_size': 130, 'pos_encoding': 'fixed', 'activation': 'relu', 'norm': 'BatchNorm', 'optimizer_name': 'RAdam', 'weight_decay': 0.1}. Best is trial 122 with value: 0.40157405369010674.[0m
[EnsembleDataset] Initializing dataset...
	Examples: 27964
	Features: 621
	Max length: 316
[EnsembleDataset] Dataset initialization complete
  epoch    auprc    auroc    train_loss    valid_loss    cp      dur
-------  -------  -------  ------------  ------------  ----  -------
      1   [36m0.3083[0m   [32m0.8383[0m        [35m0.1381[0m        [31m0.0473[0m     +  42.3741
      2   [36m0.3104[0m   [32m0.8446[0m        0.1638        0.0475        42.3383
      3   [36m0.3138[0m   0.8414        0.2570        0.0477        42.5970
Stopping since valid_loss has not improved in the last 3 epochs.
[32m[I 2023-01-09 18:08:49,591][0m Trial 145 finished with value: 0.3138331703006456 and parameters: {'lr': 0.00016238998286170642, 'dropout': 0.6527418847523474, 'd_model_multiplier': 64, 'num_layers': 3, 'n_heads': 8, 'dim_feedforward': 476, 'batch_size': 139, 'pos_encoding': 'fixed', 'activation': 'relu', 'norm': 'BatchNorm', 'optimizer_name': 'RAdam', 'weight_decay': 0.1}. Best is trial 122 with value: 0.40157405369010674.[0m
[EnsembleDataset] Initializing dataset...
	Examples: 27964
	Features: 621
	Max length: 316
[EnsembleDataset] Dataset initialization complete
  epoch    auprc    auroc    train_loss    valid_loss    cp      dur
-------  -------  -------  ------------  ------------  ----  -------
      1   [36m0.3161[0m   [32m0.8470[0m        [35m0.1405[0m        [31m0.0472[0m     +  29.2722
      2   [36m0.3280[0m   [32m0.8533[0m        [35m0.1181[0m        [31m0.0467[0m     +  29.3159
      3   [36m0.3372[0m   [32m0.8553[0m        [35m0.0936[0m        [31m0.0464[0m     +  29.8666
      4   0.3315   0.8511        [35m0.0789[0m        0.0465        29.7414
      5   [36m0.3379[0m   0.8528        [35m0.0639[0m        [31m0.0464[0m     +  29.8639
      6   0.3363   0.8512        [35m0.0601[0m        0.0464        30.6404
      7   0.3346   [32m0.8555[0m        [35m0.0572[0m        [31m0.0463[0m     +  29.9974
      8   [36m0.3417[0m   0.8553        [35m0.0558[0m        [31m0.0462[0m     +  29.5898
      9   0.3396   0.8549        [35m0.0551[0m        0.0463        30.1682
     10   0.3383   [32m0.8569[0m        [35m0.0547[0m        0.0463        30.5228
     11   0.3399   [32m0.8571[0m        [35m0.0537[0m        [31m0.0462[0m     +  29.9170
     12   0.3399   [32m0.8573[0m        [35m0.0526[0m        0.0462        30.0226
     13   0.3405   0.8569        [35m0.0520[0m        0.0462        29.4176
     14   [36m0.3419[0m   [32m0.8577[0m        [35m0.0516[0m        [31m0.0462[0m     +  29.8071
     15   0.3418   0.8575        [35m0.0515[0m        [31m0.0462[0m     +  29.9185
     16   0.3416   0.8567        [35m0.0511[0m        0.0462        30.6253
     17   0.3416   0.8564        0.0512        0.0462        31.2196
Stopping since valid_loss has not improved in the last 3 epochs.
[32m[I 2023-01-09 18:41:32,904][0m Trial 146 finished with value: 0.3419034843282082 and parameters: {'lr': 0.00039657595736821067, 'dropout': 0.6725838191243142, 'd_model_multiplier': 4, 'num_layers': 2, 'n_heads': 8, 'dim_feedforward': 508, 'batch_size': 112, 'pos_encoding': 'fixed', 'activation': 'relu', 'norm': 'BatchNorm', 'optimizer_name': 'RAdam', 'weight_decay': 0.001}. Best is trial 122 with value: 0.40157405369010674.[0m
[EnsembleDataset] Initializing dataset...
	Examples: 27964
	Features: 621
	Max length: 316
[EnsembleDataset] Dataset initialization complete
  epoch    auprc    auroc    train_loss    valid_loss    cp      dur
-------  -------  -------  ------------  ------------  ----  -------
      1   [36m0.3224[0m   [32m0.8353[0m        [35m0.1573[0m        [31m0.0543[0m     +  34.0502
      2   0.3208   0.8353        0.1807        0.0545        34.1327
      3   [36m0.3233[0m   [32m0.8396[0m        0.1712        0.0543        34.0803
Stopping since valid_loss has not improved in the last 3 epochs.
[32m[I 2023-01-09 18:48:00,914][0m Trial 147 finished with value: 0.3232626093206216 and parameters: {'lr': 0.0011082787836955625, 'dropout': 0.6867043409639205, 'd_model_multiplier': 4, 'num_layers': 7, 'n_heads': 8, 'dim_feedforward': 507, 'batch_size': 169, 'pos_encoding': 'fixed', 'activation': 'relu', 'norm': 'BatchNorm', 'optimizer_name': 'RAdam', 'weight_decay': 0.001}. Best is trial 122 with value: 0.40157405369010674.[0m
[EnsembleDataset] Initializing dataset...
	Examples: 27964
	Features: 621
	Max length: 316
[EnsembleDataset] Dataset initialization complete
Warning, assumed runtime error: CUDA out of memory. Tried to allocate 2.71 GiB (GPU 0; 23.70 GiB total capacity; 19.56 GiB already allocated; 995.31 MiB free; 21.65 GiB reserved in total by PyTorch) If reserved memory is >> allocated memory try setting max_split_size_mb to avoid fragmentation.  See documentation for Memory Management and PYTORCH_CUDA_ALLOC_CONF
[32m[I 2023-01-09 18:48:05,390][0m Trial 148 finished with value: 0.0 and parameters: {'lr': 0.0004157064189701674, 'dropout': 0.6363039610215082, 'd_model_multiplier': 4, 'num_layers': 3, 'n_heads': 64, 'dim_feedforward': 512, 'batch_size': 114, 'pos_encoding': 'fixed', 'activation': 'relu', 'norm': 'BatchNorm', 'optimizer_name': 'RAdam', 'weight_decay': 0.001}. Best is trial 122 with value: 0.40157405369010674.[0m
[EnsembleDataset] Initializing dataset...
	Examples: 27964
	Features: 621
	Max length: 316
[EnsembleDataset] Dataset initialization complete
  epoch    auprc    auroc    train_loss    valid_loss    cp      dur
-------  -------  -------  ------------  ------------  ----  -------
      1   [36m0.2675[0m   [32m0.8183[0m        [35m0.0904[0m        [31m0.0788[0m     +  29.6945
      2   0.2668   [32m0.8185[0m        [35m0.0827[0m        0.0877        30.1503
      3   [36m0.2676[0m   [32m0.8212[0m        [35m0.0768[0m        0.0987        30.5616
      4   [36m0.2797[0m   [32m0.8253[0m        [35m0.0711[0m        [31m0.0773[0m     +  30.0680
      5   0.2712   0.8188        [35m0.0704[0m        [31m0.0704[0m     +  30.2013
      6   0.2672   0.8227        [35m0.0652[0m        0.0715        29.5805
      7   0.2697   0.8206        [35m0.0631[0m        [31m0.0677[0m     +  30.2428
      8   0.2742   [32m0.8260[0m        0.0634        0.0977        30.3638
      9   0.2699   0.8098        [35m0.0626[0m        0.0684        30.2552
     10   0.2756   0.8197        [35m0.0579[0m        [31m0.0560[0m     +  31.0456
     11   0.2786   [32m0.8285[0m        [35m0.0567[0m        [31m0.0529[0m     +  31.2488
     12   0.2792   0.8100        [35m0.0547[0m        0.0542        29.8717
     13   0.2723   0.8181        0.0563        [31m0.0498[0m     +  29.7351
     14   [36m0.2936[0m   0.8246        [35m0.0535[0m        [31m0.0481[0m     +  29.9036
     15   0.2928   [32m0.8306[0m        0.0549        0.0514        29.5220
     16   [36m0.2957[0m   0.8301        [35m0.0532[0m        0.0569        30.0008
Stopping since valid_loss has not improved in the last 3 epochs.
[32m[I 2023-01-09 19:18:54,577][0m Trial 149 finished with value: 0.29567315275869244 and parameters: {'lr': 8.703508101509103e-05, 'dropout': 0.1250384155000221, 'd_model_multiplier': 4, 'num_layers': 2, 'n_heads': 8, 'dim_feedforward': 497, 'batch_size': 119, 'pos_encoding': 'fixed', 'activation': 'relu', 'norm': 'BatchNorm', 'optimizer_name': 'RAdam', 'weight_decay': 0.001}. Best is trial 122 with value: 0.40157405369010674.[0m
[EnsembleDataset] Initializing dataset...
	Examples: 27964
	Features: 621
	Max length: 316
[EnsembleDataset] Dataset initialization complete
  epoch    auprc    auroc    train_loss    valid_loss    cp      dur
-------  -------  -------  ------------  ------------  ----  -------
      1   [36m0.3436[0m   [32m0.8270[0m        [35m0.1701[0m        [31m0.0448[0m     +  30.2276
      2   [36m0.3570[0m   [32m0.8381[0m        [35m0.0574[0m        [31m0.0436[0m     +  30.7731
      3   0.3562   [32m0.8385[0m        [35m0.0544[0m        0.0436        30.6085
      4   [36m0.3658[0m   0.8382        [35m0.0536[0m        [31m0.0433[0m     +  30.4420
      5   0.3554   0.8367        0.0542        0.0437        30.5093
      6   0.3625   0.8373        0.0541        0.0437        30.2686
Stopping since valid_loss has not improved in the last 3 epochs.
[32m[I 2023-01-09 19:30:51,849][0m Trial 150 finished with value: 0.3658299316319761 and parameters: {'lr': 0.005963058938936406, 'dropout': 0.6187608471402392, 'd_model_multiplier': 4, 'num_layers': 2, 'n_heads': 16, 'dim_feedforward': 489, 'batch_size': 111, 'pos_encoding': 'fixed', 'activation': 'gelu', 'norm': 'BatchNorm', 'optimizer_name': 'RAdam', 'weight_decay': 0.001}. Best is trial 122 with value: 0.40157405369010674.[0m
[EnsembleDataset] Initializing dataset...
	Examples: 27964
	Features: 621
	Max length: 316
[EnsembleDataset] Dataset initialization complete
  epoch    auprc    auroc    train_loss    valid_loss    cp      dur
-------  -------  -------  ------------  ------------  ----  -------
      1   [36m0.3030[0m   [32m0.8309[0m        [35m0.1129[0m        [31m0.0520[0m     +  29.0593
      2   [36m0.3115[0m   [32m0.8391[0m        [35m0.0530[0m        [31m0.0510[0m     +  29.0381
      3   0.3106   [32m0.8443[0m        [35m0.0524[0m        0.0513        29.7676
      4   0.3084   0.8439        0.0525        0.0512        29.3085
Stopping since valid_loss has not improved in the last 3 epochs.
[32m[I 2023-01-09 19:38:55,406][0m Trial 151 finished with value: 0.3114960280792516 and parameters: {'lr': 0.0067930973758309485, 'dropout': 0.6054256165614615, 'd_model_multiplier': 4, 'num_layers': 2, 'n_heads': 8, 'dim_feedforward': 500, 'batch_size': 108, 'pos_encoding': 'fixed', 'activation': 'gelu', 'norm': 'BatchNorm', 'optimizer_name': 'RAdam', 'weight_decay': 0.001}. Best is trial 122 with value: 0.40157405369010674.[0m
[EnsembleDataset] Initializing dataset...
	Examples: 27964
	Features: 621
	Max length: 316
[EnsembleDataset] Dataset initialization complete
  epoch    auprc    auroc    train_loss    valid_loss    cp      dur
-------  -------  -------  ------------  ------------  ----  -------
      1   [36m0.2960[0m   [32m0.8410[0m        [35m0.1783[0m        [31m0.0518[0m     +  29.7458
      2   [36m0.2974[0m   [32m0.8439[0m        [35m0.0611[0m        [31m0.0515[0m     +  30.0631
      3   0.2888   0.8410        [35m0.0532[0m        0.0520        30.5616
      4   0.2955   0.8424        [35m0.0532[0m        [31m0.0515[0m     +  29.5582
      5   [36m0.3021[0m   [32m0.8448[0m        [35m0.0523[0m        [31m0.0512[0m     +  30.3899
      6   0.2955   0.8418        0.0527        0.0522        30.3748
      7   0.3007   [32m0.8461[0m        0.0534        [31m0.0512[0m     +  29.4509
Stopping since valid_loss has not improved in the last 3 epochs.
[32m[I 2023-01-09 19:52:43,546][0m Trial 152 finished with value: 0.30206273418185403 and parameters: {'lr': 0.0038651274715710516, 'dropout': 0.6182686803999805, 'd_model_multiplier': 4, 'num_layers': 2, 'n_heads': 16, 'dim_feedforward': 489, 'batch_size': 102, 'pos_encoding': 'fixed', 'activation': 'gelu', 'norm': 'BatchNorm', 'optimizer_name': 'RAdam', 'weight_decay': 0.001}. Best is trial 122 with value: 0.40157405369010674.[0m
[EnsembleDataset] Initializing dataset...
	Examples: 27964
	Features: 621
	Max length: 316
[EnsembleDataset] Dataset initialization complete
  epoch    auprc    auroc    train_loss    valid_loss    cp      dur
-------  -------  -------  ------------  ------------  ----  -------
      1   [36m0.3569[0m   [32m0.8426[0m        [35m0.1304[0m        [31m0.0525[0m     +  31.5664
      2   0.3542   0.8399        [35m0.1211[0m        0.0527        32.1560
      3   [36m0.3571[0m   [32m0.8485[0m        [35m0.1028[0m        [31m0.0523[0m     +  31.6700
      4   [36m0.3646[0m   [32m0.8503[0m        [35m0.0865[0m        [31m0.0521[0m     +  32.1588
      5   0.3613   0.8494        [35m0.0709[0m        0.0524        31.7952
      6   0.3604   0.8462        [35m0.0590[0m        0.0523        31.8690
Stopping since valid_loss has not improved in the last 3 epochs.
[32m[I 2023-01-09 20:04:51,608][0m Trial 153 finished with value: 0.36462591995273963 and parameters: {'lr': 0.0006639455476387853, 'dropout': 0.6579397436964199, 'd_model_multiplier': 4, 'num_layers': 3, 'n_heads': 16, 'dim_feedforward': 469, 'batch_size': 123, 'pos_encoding': 'fixed', 'activation': 'gelu', 'norm': 'BatchNorm', 'optimizer_name': 'RAdam', 'weight_decay': 0.001}. Best is trial 122 with value: 0.40157405369010674.[0m
[EnsembleDataset] Initializing dataset...
	Examples: 27964
	Features: 621
	Max length: 316
[EnsembleDataset] Dataset initialization complete
  epoch    auprc    auroc    train_loss    valid_loss    cp      dur
-------  -------  -------  ------------  ------------  ----  -------
      1   [36m0.3198[0m   [32m0.8318[0m        [35m0.1404[0m        [31m0.0507[0m     +  32.1615
      2   [36m0.3281[0m   [32m0.8345[0m        0.1459        [31m0.0505[0m     +  31.7243
      3   0.3211   0.8231        [35m0.1024[0m        0.0508        31.3706
      4   0.3215   0.8252        [35m0.0769[0m        0.0508        31.2614
Stopping since valid_loss has not improved in the last 3 epochs.
[32m[I 2023-01-09 20:13:04,519][0m Trial 154 finished with value: 0.32810852401835505 and parameters: {'lr': 0.0009890809588877266, 'dropout': 0.6506742381882622, 'd_model_multiplier': 4, 'num_layers': 3, 'n_heads': 16, 'dim_feedforward': 467, 'batch_size': 132, 'pos_encoding': 'fixed', 'activation': 'gelu', 'norm': 'BatchNorm', 'optimizer_name': 'RAdam', 'weight_decay': 0.001}. Best is trial 122 with value: 0.40157405369010674.[0m
[EnsembleDataset] Initializing dataset...
	Examples: 27964
	Features: 621
	Max length: 316
[EnsembleDataset] Dataset initialization complete
  epoch    auprc    auroc    train_loss    valid_loss    cp      dur
-------  -------  -------  ------------  ------------  ----  -------
      1   [36m0.3222[0m   [32m0.8237[0m        [35m0.3481[0m        [31m0.0504[0m     +  34.8264
      2   0.3091   0.8214        [35m0.0608[0m        0.0509        34.9454
      3   0.3060   0.8049        [35m0.0584[0m        0.0512        35.1289
Stopping since valid_loss has not improved in the last 3 epochs.
