[32m[I 2023-05-03 00:54:31,770][0m Trial 242 finished with value: 0.3074318096852504 and parameters: {'lr': 0.0005131045958668071, 'dropout': 0.4085113306164989, 'd_model_multiplier': 8, 'num_layers': 4, 'n_heads': 32, 'dim_feedforward': 343, 'batch_size': 54, 'pos_encoding': 'fixed', 'activation': 'relu', 'norm': 'LayerNorm', 'optimizer_name': 'AdamW', 'weight_decay': 0.1, 'top_n_features': 45}. Best is trial 235 with value: 0.17609698172014526.[0m
[FileBasedDataset] Initializing dataset...
	Examples: 8264
	Features: 54
	Max length: 315
Standard scalar turned ON, loading params from cache
[FileBasedDataset] Dataset initialization complete
  epoch    auprc    auroc    train_loss    valid_acc    valid_loss    cp      dur
-------  -------  -------  ------------  -----------  ------------  ----  -------
      1   [36m0.1560[0m   [32m0.6268[0m        [35m0.3110[0m       [31m0.9323[0m        [94m0.2746[0m     +  29.3459
      2   [36m0.1605[0m   [32m0.6626[0m        [35m0.2772[0m       0.9311        [94m0.2715[0m     +  29.5492
      3   [36m0.1686[0m   [32m0.7029[0m        [35m0.2651[0m       0.9311        [94m0.2674[0m     +  29.7953
      4   [36m0.1723[0m   [32m0.7115[0m        [35m0.2615[0m       0.9311        [94m0.2617[0m     +  29.7731
      5   [36m0.1785[0m   [32m0.7212[0m        [35m0.2585[0m       0.9323        [94m0.2551[0m     +  29.6825
      6   [36m0.1791[0m   [32m0.7239[0m        [35m0.2570[0m       0.9311        [94m0.2448[0m     +  29.7391
      7   0.1788   0.7230        [35m0.2557[0m       0.9323        0.2494        29.6514
      8   [36m0.1856[0m   0.7210        0.2561       0.9311        0.2501        29.6530
      9   0.1693   0.7038        0.2584       0.9323        0.2645        29.7114
     10   0.1813   0.7231        0.2558       0.9323        0.2461        29.7240
     11   [36m0.1968[0m   [32m0.7301[0m        0.2558       0.9311        [94m0.2418[0m     +  29.9045
     12   0.1919   0.7232        0.2558       0.9323        [94m0.2396[0m     +  29.6328
     13   0.1841   [32m0.7308[0m        [35m0.2546[0m       0.9323        [94m0.2358[0m     +  29.8843
     14   0.1911   0.7289        [35m0.2544[0m       0.9323        0.2365        29.7724
     15   0.1921   0.7259        [35m0.2535[0m       0.9323        [94m0.2319[0m     +  29.6791
     16   0.1915   0.7290        [35m0.2524[0m       0.9323        [94m0.2268[0m     +  29.8895
     17   0.1850   [32m0.7310[0m        0.2538       0.9323        0.2293        29.7587
     18   0.1933   0.7285        0.2535       0.9323        [94m0.2266[0m     +  29.7516
     19   0.1926   0.7287        0.2530       0.9323        [94m0.2238[0m     +  29.8161
     20   0.1920   0.7268        0.2532       0.9323        0.2242        29.6564
     21   0.1868   0.7277        0.2534       0.9323        0.2252        29.7299
     22   0.1842   0.7267        0.2532       0.9323        [94m0.2235[0m     +  29.7067
     23   0.1872   0.7239        [35m0.2522[0m       0.9323        0.2245        29.7585
     24   0.1919   [32m0.7321[0m        0.2541       0.9323        0.2242        29.7177
     25   0.1873   0.7268        0.2528       0.9323        0.2248        29.7322
     26   0.1862   0.7292        [35m0.2513[0m       0.9323        0.2255        29.7935
     27   0.1807   0.7267        0.2526       0.9323        0.2252        29.6888
     28   0.1864   0.7272        0.2518       0.9323        0.2244        29.6259
     29   [36m0.1970[0m   0.7299        0.2519       0.9323        0.2238        29.6762
     30   0.1931   0.7274        0.2526       0.9323        0.2250        29.5260
     31   0.1821   0.7278        0.2521       0.9323        0.2241        29.7911
Stopping since valid_loss has not improved in the last 10 epochs.
[32m[I 2023-05-03 01:10:25,458][0m Trial 243 finished with value: 0.22350563972900106 and parameters: {'lr': 0.0008698529161347708, 'dropout': 0.4397244889644902, 'd_model_multiplier': 8, 'num_layers': 6, 'n_heads': 32, 'dim_feedforward': 311, 'batch_size': 25, 'pos_encoding': 'fixed', 'activation': 'relu', 'norm': 'LayerNorm', 'optimizer_name': 'AdamW', 'weight_decay': 0.1, 'top_n_features': 54}. Best is trial 235 with value: 0.17609698172014526.[0m
[FileBasedDataset] Initializing dataset...
	Examples: 8264
	Features: 229
	Max length: 315
Standard scalar turned ON, loading params from cache
[FileBasedDataset] Dataset initialization complete
  epoch    auprc    auroc    train_loss    valid_acc    valid_loss    cp     dur
-------  -------  -------  ------------  -----------  ------------  ----  ------
      1   [36m0.1957[0m   [32m0.7175[0m        [35m0.2865[0m       [31m0.9129[0m        [94m0.2627[0m     +  8.8543
      2   [36m0.2037[0m   0.6960        [35m0.2566[0m       [31m0.9178[0m        0.2716        9.5557
      3   [36m0.2284[0m   [32m0.7455[0m        [35m0.2532[0m       0.9178        0.2763        9.9510
      4   [36m0.2457[0m   0.7450        [35m0.2481[0m       [31m0.9190[0m        0.2811        9.9136
      5   [36m0.2722[0m   [32m0.7767[0m        [35m0.2443[0m       0.9178        0.2748        9.9083
      6   [36m0.2830[0m   [32m0.7816[0m        [35m0.2418[0m       0.9178        0.2807        9.4126
      7   [36m0.2938[0m   [32m0.7829[0m        [35m0.2392[0m       [31m0.9202[0m        [94m0.2519[0m     +  9.7579
      8   [36m0.2982[0m   0.7780        [35m0.2386[0m       0.9178        0.2849        9.9284
      9   [36m0.3128[0m   [32m0.7910[0m        [35m0.2339[0m       0.9178        0.2521        9.8462
     10   0.3090   0.7872        0.2364       0.9202        0.2558        9.5988
     11   [36m0.3251[0m   [32m0.7946[0m        0.2343       [31m0.9214[0m        [94m0.2479[0m     +  9.7118
     12   [36m0.3336[0m   [32m0.7966[0m        0.2352       0.9202        [94m0.2410[0m     +  9.6013
     13   [36m0.3390[0m   0.7860        [35m0.2311[0m       0.9190        0.2499        9.8247
     14   [36m0.3465[0m   [32m0.8002[0m        0.2340       0.9214        0.2435        9.7959
     15   [36m0.3576[0m   [32m0.8015[0m        [35m0.2276[0m       [31m0.9238[0m        [94m0.2383[0m     +  9.8583
     16   [36m0.3734[0m   [32m0.8105[0m        [35m0.2262[0m       0.9238        0.2436        9.7216
     17   0.3668   0.8097        0.2287       0.9202        0.2413        9.7787
     18   0.3603   0.8067        0.2297       0.9238        0.2456        9.9033
     19   0.3597   0.8004        0.2290       0.9226        0.2467        9.7314
     20   0.3636   0.8000        0.2281       0.9226        0.2413        9.9523
     21   0.3277   0.7843        [35m0.2249[0m       0.9178        0.2503        9.6165
     22   0.3456   0.7895        [35m0.2227[0m       0.9214        0.2449        9.7611
     23   0.3452   0.7875        0.2236       0.9202        0.2395        10.0203
     24   0.3638   0.8012        0.2256       0.9214        [94m0.2380[0m     +  9.9567
     25   0.3641   0.8062        0.2258       0.9238        0.2408        9.8661
     26   0.3634   0.8067        0.2247       0.9226        0.2390        9.6602
     27   0.3693   0.8047        [35m0.2218[0m       0.9238        [94m0.2359[0m     +  9.9182
     28   [36m0.3825[0m   0.7989        0.2223       0.9238        0.2374        9.7964
     29   0.3572   0.7884        0.2227       0.9226        0.2411        9.5850
     30   0.3674   0.7998        0.2230       0.9214        0.2386        10.0459
     31   0.3536   0.7916        0.2242       0.9214        0.2402        9.6515
     32   0.3411   0.7871        0.2228       0.9190        0.2484        9.6191
     33   0.3513   0.7870        [35m0.2192[0m       0.9202        0.2384        9.5597
     34   0.3148   0.7664        0.2201       0.9190        0.2472        9.6503
     35   0.3426   0.7763        0.2212       0.9214        0.2462        9.5073
     36   0.3703   0.7963        0.2200       0.9226        0.2368        9.9233
Stopping since valid_loss has not improved in the last 10 epochs.
[32m[I 2023-05-03 01:16:26,627][0m Trial 244 finished with value: 0.23593477728216938 and parameters: {'lr': 0.0011074734820749016, 'dropout': 0.5295215334630522, 'd_model_multiplier': 4, 'num_layers': 5, 'n_heads': 4, 'dim_feedforward': 128, 'batch_size': 60, 'pos_encoding': 'fixed', 'activation': 'relu', 'norm': 'LayerNorm', 'optimizer_name': 'AdamW', 'weight_decay': 0.1, 'top_n_features': 229}. Best is trial 235 with value: 0.17609698172014526.[0m
[FileBasedDataset] Initializing dataset...
	Examples: 8264
	Features: 142
	Max length: 315
Standard scalar turned ON, loading params from cache
[FileBasedDataset] Dataset initialization complete
  epoch    auprc    auroc    train_loss    valid_acc    valid_loss    cp      dur
-------  -------  -------  ------------  -----------  ------------  ----  -------
      1   [36m0.2047[0m   [32m0.7054[0m        [35m0.2923[0m       [31m0.8839[0m        [94m0.2923[0m     +  21.5811
      2   [36m0.2059[0m   [32m0.7121[0m        [35m0.2677[0m       [31m0.8875[0m        [94m0.2871[0m     +  21.4434
      3   [36m0.2362[0m   [32m0.7465[0m        [35m0.2635[0m       [31m0.8984[0m        [94m0.2734[0m     +  21.5528
      4   0.2354   [32m0.7555[0m        [35m0.2554[0m       [31m0.9008[0m        [94m0.2575[0m     +  21.7448
      5   0.2221   0.7380        [35m0.2504[0m       [31m0.9117[0m        0.2578        21.6860
      6   0.2276   0.7394        [35m0.2486[0m       0.8996        0.2613        21.7731
      7   0.2284   [32m0.7609[0m        [35m0.2432[0m       0.9081        0.2580        21.8902
      8   0.2151   0.7533        [35m0.2406[0m       0.9093        [94m0.2563[0m     +  21.7577
      9   0.2248   0.7396        [35m0.2389[0m       0.8948        0.2778        21.8715
     10   [36m0.2431[0m   0.7603        0.2390       0.8996        0.2670        21.6651
     11   0.2375   0.7597        [35m0.2380[0m       0.8996        0.2696        21.4834
     12   0.2322   0.7552        [35m0.2358[0m       0.8996        0.2766        21.7132
     13   0.2390   0.7570        0.2447       [31m0.9178[0m        [94m0.2463[0m     +  21.9461
     14   [36m0.2486[0m   [32m0.7716[0m        0.2380       0.9045        0.2560        21.5147
     15   0.2214   0.7534        [35m0.2338[0m       0.9069        0.2641        21.7307
     16   0.2377   0.7657        [35m0.2321[0m       0.9045        0.2625        21.7329
     17   [36m0.2562[0m   0.7679        [35m0.2301[0m       0.9008        0.2830        21.6632
     18   0.2555   [32m0.7735[0m        0.2335       0.9093        0.2677        21.8513
     19   0.2379   0.7413        0.2309       0.9008        0.2739        21.8879
     20   0.2291   0.7324        0.2339       [31m0.9190[0m        0.2617        21.9017
     21   [36m0.2628[0m   0.7684        0.2317       0.9129        0.2612        21.5328
     22   [36m0.2792[0m   [32m0.7757[0m        [35m0.2252[0m       0.9069        0.2653        21.6444
Stopping since valid_loss has not improved in the last 10 epochs.
[32m[I 2023-05-03 01:24:47,042][0m Trial 245 finished with value: 0.24634377319622502 and parameters: {'lr': 0.0004420125746935512, 'dropout': 0.4282336447695232, 'd_model_multiplier': 8, 'num_layers': 4, 'n_heads': 32, 'dim_feedforward': 332, 'batch_size': 71, 'pos_encoding': 'fixed', 'activation': 'relu', 'norm': 'LayerNorm', 'optimizer_name': 'AdamW', 'weight_decay': 0.1, 'top_n_features': 142}. Best is trial 235 with value: 0.17609698172014526.[0m
[FileBasedDataset] Initializing dataset...
	Examples: 8264
	Features: 100
	Max length: 315
Standard scalar turned ON, loading params from cache
[FileBasedDataset] Dataset initialization complete
  epoch    auprc    auroc    train_loss    valid_acc    valid_loss    cp      dur
-------  -------  -------  ------------  -----------  ------------  ----  -------
      1   [36m0.2917[0m   [32m0.7680[0m        [35m0.2975[0m       [31m0.9432[0m        [94m0.2434[0m     +  17.8910
      2   0.2737   0.7622        [35m0.2769[0m       0.9420        0.3440        18.0855
      3   0.2259   0.6399        [35m0.2720[0m       0.9371        0.3967        17.9963
      4   0.2769   0.6738        0.2817       0.9383        0.3500        18.1410
      5   0.2217   0.6870        0.2822       0.9371        [94m0.2118[0m     +  18.1449
      6   0.1695   0.6195        0.2788       0.9432        0.2474        18.3284
      7   0.0922   0.6279        0.2774       0.9395        0.2454        18.1941
      8   0.2910   [32m0.8504[0m        0.2726       0.9359        [94m0.1875[0m     +  18.0550
      9   [36m0.3476[0m   0.8274        [35m0.2578[0m       0.9347        0.1939        18.0973
     10   0.2906   0.8325        0.2650       0.9214        0.2150        18.1773
     11   0.2941   0.8155        0.3224       0.9008        0.2903        18.1731
     12   0.2825   0.8445        0.3104       0.9359        0.1932        18.3110
     13   0.2761   0.8245        0.3273       0.9008        0.2775        18.1532
     14   0.3026   0.8107        0.3057       0.9226        0.2404        18.4319
     15   0.2970   0.7850        0.3121       0.9407        0.1914        18.2102
     16   0.2792   0.8444        0.3034       0.9335        [94m0.1860[0m     +  18.2790
     17   0.2619   0.8504        0.2956       0.9347        0.1897        18.0947
     18   0.2525   0.8409        0.2788       0.9262        0.2112        18.2497
     19   0.2996   0.8349        0.2809       0.9323        0.1966        18.2003
     20   0.2726   0.8219        0.2872       0.9323        0.1946        18.2045
     21   0.2699   0.8397        0.2836       0.9347        [94m0.1770[0m     +  18.2233
     22   0.3109   0.8501        0.2724       0.9407        0.1887        18.0807
     23   0.3154   0.8246        0.2766       0.9226        0.2244        17.9881
     24   0.2894   0.8433        0.2793       0.9057        0.2390        18.1465
     25   0.3132   0.8295        0.2698       0.9420        0.1902        18.0556
     26   0.2972   0.8367        0.2634       0.9202        0.2441        18.1263
     27   0.3234   0.8357        0.2602       0.9287        0.2144        18.2326
     28   0.3116   0.8369        0.2615       0.9359        0.1927        18.3707
     29   0.3209   0.8413        0.2578       0.9359        0.1965        18.1991
     30   0.3317   0.8345        [35m0.2546[0m       [31m0.9456[0m        [94m0.1722[0m     +  18.1014
     31   0.3347   0.8283        0.2557       0.9371        0.1891        18.1617
     32   0.3211   0.8256        0.2546       0.9456        0.1769        18.2330
     33   0.3178   0.8239        0.2571       0.9395        0.1836        18.0554
     34   0.3131   0.8423        [35m0.2542[0m       0.9420        0.1751        18.0169
     35   0.3422   0.8334        [35m0.2463[0m       0.9420        0.1747        18.0592
     36   0.3400   0.8385        0.2470       0.9420        0.1771        18.0630
     37   [36m0.3524[0m   [32m0.8551[0m        0.2491       0.9444        [94m0.1674[0m     +  18.0635
     38   [36m0.4063[0m   0.8544        [35m0.2449[0m       0.9444        [94m0.1645[0m     +  18.1664
     39   0.3161   0.8508        [35m0.2413[0m       0.9323        0.1865        18.2300
     40   0.3470   0.8534        0.2447       0.9456        0.1679        18.2771
     41   0.3696   0.8501        0.2418       [31m0.9492[0m        0.1681        18.2675
     42   0.3416   0.8440        0.2438       0.9383        0.1822        18.0991
     43   0.3645   0.8276        0.2422       0.9456        0.1693        18.1160
     44   0.3631   0.8494        0.2460       0.9456        0.1736        18.1364
     45   0.3437   0.8533        [35m0.2397[0m       0.9347        0.1819        18.2842
     46   0.3509   0.8494        [35m0.2372[0m       0.9407        0.1800        18.2383
     47   0.3581   0.8511        0.2404       0.9335        0.1876        18.3064
Stopping since valid_loss has not improved in the last 10 epochs.
[32m[I 2023-05-03 01:39:21,068][0m Trial 246 finished with value: 0.16447311791139763 and parameters: {'lr': 0.0006902481260359048, 'dropout': 0.46203984390654546, 'd_model_multiplier': 8, 'num_layers': 3, 'n_heads': 32, 'dim_feedforward': 331, 'batch_size': 18, 'pos_encoding': 'fixed', 'activation': 'gelu', 'norm': 'BatchNorm', 'optimizer_name': 'PlainRAdam', 'weight_decay': 0.1, 'top_n_features': 100}. Best is trial 246 with value: 0.16447311791139763.[0m
[FileBasedDataset] Initializing dataset...
	Examples: 8264
	Features: 107
	Max length: 315
Standard scalar turned ON, loading params from cache
[FileBasedDataset] Dataset initialization complete
  epoch    auprc    auroc    train_loss    valid_acc    valid_loss    cp      dur
-------  -------  -------  ------------  -----------  ------------  ----  -------
      1   [36m0.2386[0m   [32m0.7169[0m        [35m0.2792[0m       [31m0.9166[0m        [94m0.2765[0m     +  18.0472
      2   0.2108   [32m0.7230[0m        [35m0.2578[0m       0.9021        0.3491        18.0138
      3   0.1299   0.5958        0.2650       0.9021        0.4582        18.1907
      4   0.1825   0.6958        0.2620       0.9057        0.4565        18.0930
      5   0.1597   0.5518        0.2680       0.9033        0.3852        18.0779
      6   0.1274   0.5946        0.2595       [31m0.9190[0m        0.3140        18.0376
      7   [36m0.2458[0m   [32m0.7526[0m        0.2640       [31m0.9262[0m        [94m0.2387[0m     +  18.0109
      8   0.2220   0.7328        0.2672       0.9190        0.2441        18.1334
      9   0.2406   [32m0.7708[0m        0.2600       0.9178        0.2423        18.0674
     10   [36m0.2840[0m   0.7571        [35m0.2565[0m       0.9262        [94m0.2314[0m     +  18.0772
     11   0.2695   0.7471        [35m0.2506[0m       [31m0.9274[0m        0.2349        18.0648
     12   0.2815   0.7585        [35m0.2446[0m       0.9226        0.2330        18.0044
     13   0.2524   0.7563        0.2544       0.9057        0.2550        18.0056
     14   0.2669   [32m0.7715[0m        0.2501       0.9202        0.2354        18.0548
     15   0.2369   0.7464        0.2719       0.9226        0.2357        18.0769
     16   0.2372   0.7499        0.2789       0.9226        0.2340        18.0840
     17   0.2100   0.7243        0.2621       0.9238        0.2541        18.2065
     18   0.2092   0.7167        0.2520       0.9226        0.2429        18.0222
     19   0.2342   0.7590        0.2572       0.9226        0.2356        18.3897
Stopping since valid_loss has not improved in the last 10 epochs.
[32m[I 2023-05-03 01:45:23,593][0m Trial 247 finished with value: 0.23135652047150657 and parameters: {'lr': 0.0006368889252693615, 'dropout': 0.46049063009708474, 'd_model_multiplier': 8, 'num_layers': 3, 'n_heads': 32, 'dim_feedforward': 318, 'batch_size': 19, 'pos_encoding': 'fixed', 'activation': 'gelu', 'norm': 'BatchNorm', 'optimizer_name': 'PlainRAdam', 'weight_decay': 0.1, 'top_n_features': 107}. Best is trial 246 with value: 0.16447311791139763.[0m
[FileBasedDataset] Initializing dataset...
	Examples: 8264
	Features: 99
	Max length: 315
Standard scalar turned ON, loading params from cache
[FileBasedDataset] Dataset initialization complete
  epoch    auprc    auroc    train_loss    valid_acc    valid_loss    cp      dur
-------  -------  -------  ------------  -----------  ------------  ----  -------
      1   [36m0.2208[0m   [32m0.7166[0m        [35m0.2978[0m       [31m0.9238[0m        [94m0.2716[0m     +  19.0287
      2   0.1963   0.6922        [35m0.2759[0m       [31m0.9274[0m        [94m0.2713[0m     +  19.0104
      3   0.1969   0.6788        [35m0.2740[0m       0.9166        0.3346        19.2390
      4   0.1563   0.6259        0.2766       0.8658        0.4162        19.1362
      5   0.1378   0.6220        [35m0.2733[0m       0.8996        0.4407        19.2077
      6   0.1348   0.6118        0.2789       0.9141        0.3317        18.9995
      7   0.1629   0.6122        0.2736       0.8888        0.4759        19.0832
      8   0.1338   0.5938        [35m0.2722[0m       0.8948        0.3660        19.2100
      9   0.1556   0.6234        0.2743       0.9105        0.4288        19.0820
     10   0.1903   0.6920        0.2795       0.8924        0.3687        19.1824
     11   0.1886   0.6580        0.2727       [31m0.9299[0m        0.3063        19.0233
Stopping since valid_loss has not improved in the last 10 epochs.
