[32m[I 2023-05-03 23:15:34,801][0m Trial 384 finished with value: 0.26514495572271196 and parameters: {'lr': 8.176725728069647e-06, 'dropout': 0.38455571325968335, 'd_model_multiplier': 4, 'num_layers': 4, 'n_heads': 32, 'dim_feedforward': 374, 'batch_size': 53, 'pos_encoding': 'fixed', 'activation': 'relu', 'norm': 'LayerNorm', 'optimizer_name': 'RAdam', 'weight_decay': 0.001, 'top_n_features': 66}. Best is trial 246 with value: 0.16447311791139763.[0m
[FileBasedDataset] Initializing dataset...
	Examples: 8264
	Features: 61
	Max length: 315
Standard scalar turned ON, loading params from cache
[FileBasedDataset] Dataset initialization complete
  epoch    auprc    auroc    train_loss    valid_acc    valid_loss    cp      dur
-------  -------  -------  ------------  -----------  ------------  ----  -------
      1   [36m0.0599[0m   [32m0.3286[0m        [35m0.6517[0m       [31m0.9214[0m        [94m0.6120[0m     +  19.9967
      2   0.0565   0.2867        [35m0.5834[0m       0.9214        [94m0.5499[0m     +  20.1023
      3   0.0566   0.2814        [35m0.5268[0m       0.9214        [94m0.4983[0m     +  20.6601
      4   0.0564   0.2814        [35m0.4794[0m       0.9214        [94m0.4550[0m     +  20.3547
      5   0.0560   0.2825        [35m0.4398[0m       0.9214        [94m0.4189[0m     +  20.1346
      6   0.0558   0.2881        [35m0.4069[0m       0.9214        [94m0.3891[0m     +  20.1621
      7   0.0573   0.3123        [35m0.3795[0m       0.9214        [94m0.3649[0m     +  20.1951
      8   0.0593   [32m0.3437[0m        [35m0.3576[0m       0.9214        [94m0.3454[0m     +  20.6445
      9   [36m0.0622[0m   [32m0.3809[0m        [35m0.3386[0m       0.9214        [94m0.3300[0m     +  20.3901
     10   [36m0.0668[0m   [32m0.4221[0m        [35m0.3240[0m       0.9214        [94m0.3179[0m     +  20.3306
     11   [36m0.0719[0m   [32m0.4552[0m        [35m0.3123[0m       0.9214        [94m0.3083[0m     +  20.2468
     12   [36m0.0788[0m   [32m0.4841[0m        [35m0.3035[0m       0.9214        [94m0.3006[0m     +  20.5158
     13   [36m0.0882[0m   [32m0.5076[0m        [35m0.2958[0m       0.9214        [94m0.2943[0m     +  20.0366
     14   [36m0.1010[0m   [32m0.5306[0m        [35m0.2900[0m       0.9214        [94m0.2891[0m     +  20.4609
     15   [36m0.1118[0m   [32m0.5516[0m        [35m0.2841[0m       0.9214        [94m0.2846[0m     +  20.5660
     16   [36m0.1218[0m   [32m0.5708[0m        [35m0.2798[0m       0.9214        [94m0.2808[0m     +  20.4044
     17   [36m0.1293[0m   [32m0.5866[0m        [35m0.2764[0m       0.9214        [94m0.2774[0m     +  20.2928
     18   [36m0.1348[0m   [32m0.6010[0m        [35m0.2737[0m       0.9214        [94m0.2743[0m     +  20.6233
     19   [36m0.1405[0m   [32m0.6146[0m        [35m0.2707[0m       0.9214        [94m0.2717[0m     +  20.6162
     20   [36m0.1447[0m   [32m0.6272[0m        [35m0.2676[0m       0.9214        [94m0.2692[0m     +  20.3247
     21   [36m0.1490[0m   [32m0.6390[0m        [35m0.2649[0m       0.9214        [94m0.2670[0m     +  20.1025
     22   [36m0.1562[0m   [32m0.6504[0m        [35m0.2627[0m       0.9214        [94m0.2649[0m     +  20.8556
     23   [36m0.1613[0m   [32m0.6595[0m        [35m0.2617[0m       0.9214        [94m0.2630[0m     +  20.2202
     24   [36m0.1658[0m   [32m0.6687[0m        [35m0.2589[0m       0.9214        [94m0.2612[0m     +  20.8525
     25   [36m0.1700[0m   [32m0.6758[0m        [35m0.2580[0m       0.9214        [94m0.2596[0m     +  20.5354
     26   [36m0.1739[0m   [32m0.6829[0m        [35m0.2562[0m       0.9214        [94m0.2581[0m     +  20.3981
     27   [36m0.1811[0m   [32m0.6924[0m        [35m0.2556[0m       0.9214        [94m0.2566[0m     +  20.5852
     28   [36m0.1869[0m   [32m0.6995[0m        [35m0.2532[0m       0.9214        [94m0.2553[0m     +  20.4154
     29   [36m0.1935[0m   [32m0.7067[0m        [35m0.2526[0m       0.9214        [94m0.2540[0m     +  20.5978
     30   [36m0.1989[0m   [32m0.7134[0m        [35m0.2519[0m       0.9214        [94m0.2528[0m     +  20.6655
     31   [36m0.2042[0m   [32m0.7192[0m        [35m0.2506[0m       0.9202        [94m0.2517[0m     +  20.7697
     32   [36m0.2077[0m   [32m0.7244[0m        [35m0.2494[0m       0.9202        [94m0.2506[0m     +  19.9707
     33   [36m0.2104[0m   [32m0.7294[0m        [35m0.2480[0m       0.9202        [94m0.2497[0m     +  20.7346
     34   [36m0.2159[0m   [32m0.7345[0m        [35m0.2480[0m       0.9190        [94m0.2487[0m     +  20.5552
     35   [36m0.2181[0m   [32m0.7376[0m        [35m0.2464[0m       0.9178        [94m0.2479[0m     +  20.4061
     36   [36m0.2212[0m   [32m0.7406[0m        0.2475       0.9190        [94m0.2470[0m     +  20.3804
     37   [36m0.2254[0m   [32m0.7445[0m        [35m0.2454[0m       0.9190        [94m0.2462[0m     +  20.4307
     38   [36m0.2292[0m   [32m0.7467[0m        [35m0.2444[0m       0.9178        [94m0.2455[0m     +  20.7666
     39   [36m0.2345[0m   [32m0.7487[0m        [35m0.2441[0m       0.9178        [94m0.2448[0m     +  20.0199
     40   [36m0.2378[0m   [32m0.7508[0m        [35m0.2431[0m       0.9178        [94m0.2442[0m     +  20.8955
     41   [36m0.2403[0m   [32m0.7528[0m        0.2433       0.9178        [94m0.2436[0m     +  20.2864
     42   [36m0.2515[0m   [32m0.7555[0m        [35m0.2425[0m       0.9166        [94m0.2430[0m     +  20.3767
     43   [36m0.2549[0m   [32m0.7575[0m        [35m0.2413[0m       0.9166        [94m0.2425[0m     +  20.7828
     44   [36m0.2559[0m   [32m0.7586[0m        [35m0.2407[0m       0.9178        [94m0.2421[0m     +  20.0970
     45   [36m0.2587[0m   [32m0.7602[0m        [35m0.2406[0m       0.9178        [94m0.2417[0m     +  20.5384
     46   [36m0.2595[0m   [32m0.7611[0m        [35m0.2393[0m       0.9178        [94m0.2413[0m     +  20.2855
     47   [36m0.2613[0m   [32m0.7630[0m        [35m0.2391[0m       0.9178        [94m0.2409[0m     +  20.4625
     48   [36m0.2626[0m   [32m0.7644[0m        0.2391       0.9178        [94m0.2405[0m     +  20.7714
     49   [36m0.2647[0m   [32m0.7658[0m        [35m0.2390[0m       0.9178        [94m0.2402[0m     +  20.4077
     50   [36m0.2656[0m   [32m0.7665[0m        [35m0.2375[0m       0.9178        [94m0.2399[0m     +  20.3332
[32m[I 2023-05-03 23:32:41,226][0m Trial 385 finished with value: 0.2398675502319578 and parameters: {'lr': 1.0209744215814438e-06, 'dropout': 0.2948022218034038, 'd_model_multiplier': 4, 'num_layers': 4, 'n_heads': 32, 'dim_feedforward': 354, 'batch_size': 75, 'pos_encoding': 'fixed', 'activation': 'relu', 'norm': 'LayerNorm', 'optimizer_name': 'AdamW', 'weight_decay': 0.1, 'top_n_features': 61}. Best is trial 246 with value: 0.16447311791139763.[0m
[FileBasedDataset] Initializing dataset...
	Examples: 8264
	Features: 51
	Max length: 315
Standard scalar turned ON, loading params from cache
[FileBasedDataset] Dataset initialization complete
Warning, assumed runtime error: CUDA out of memory. Tried to allocate 1.63 GiB (GPU 0; 23.70 GiB total capacity; 21.83 GiB already allocated; 75.25 MiB free; 22.53 GiB reserved in total by PyTorch) If reserved memory is >> allocated memory try setting max_split_size_mb to avoid fragmentation.  See documentation for Memory Management and PYTORCH_CUDA_ALLOC_CONF
[32m[I 2023-05-03 23:32:45,365][0m Trial 386 finished with value: 100.0 and parameters: {'lr': 8.904671894258844e-06, 'dropout': 0.28729267199228253, 'd_model_multiplier': 32, 'num_layers': 5, 'n_heads': 64, 'dim_feedforward': 363, 'batch_size': 69, 'pos_encoding': 'fixed', 'activation': 'relu', 'norm': 'LayerNorm', 'optimizer_name': 'RAdam', 'weight_decay': 0.1, 'top_n_features': 51}. Best is trial 246 with value: 0.16447311791139763.[0m
[FileBasedDataset] Initializing dataset...
	Examples: 8264
	Features: 81
	Max length: 315
Standard scalar turned ON, loading params from cache
[FileBasedDataset] Dataset initialization complete
  epoch    auprc    auroc    train_loss    valid_acc    valid_loss    cp      dur
-------  -------  -------  ------------  -----------  ------------  ----  -------
      1   [36m0.0754[0m   [32m0.3557[0m        [35m0.6882[0m       [31m0.9154[0m        [94m0.6259[0m     +  27.1862
      2   0.0638   0.3038        [35m0.5476[0m       [31m0.9166[0m        [94m0.4542[0m     +  27.6492
      3   0.0626   0.3002        [35m0.4203[0m       0.9166        [94m0.3582[0m     +  27.6779
      4   0.0688   [32m0.3864[0m        [35m0.3456[0m       0.9166        [94m0.3145[0m     +  27.7439
      5   [36m0.0930[0m   [32m0.5141[0m        [35m0.3049[0m       0.9166        [94m0.2953[0m     +  27.4543
      6   [36m0.1211[0m   [32m0.5852[0m        [35m0.2837[0m       0.9166        [94m0.2861[0m     +  28.2033
      7   [36m0.1446[0m   [32m0.6253[0m        [35m0.2731[0m       0.9166        [94m0.2813[0m     +  27.5456
      8   [36m0.1614[0m   [32m0.6497[0m        [35m0.2663[0m       0.9166        [94m0.2787[0m     +  27.5918
      9   [36m0.1758[0m   [32m0.6681[0m        [35m0.2604[0m       0.9166        [94m0.2764[0m     +  28.0252
     10   [36m0.1824[0m   [32m0.6820[0m        [35m0.2576[0m       0.9166        [94m0.2750[0m     +  27.7136
     11   [36m0.1897[0m   [32m0.6929[0m        [35m0.2559[0m       0.9166        [94m0.2737[0m     +  28.1803
     12   [36m0.1937[0m   [32m0.7024[0m        [35m0.2540[0m       0.9166        [94m0.2728[0m     +  27.7961
     13   [36m0.2015[0m   [32m0.7113[0m        [35m0.2536[0m       0.9166        [94m0.2722[0m     +  27.9424
     14   [36m0.2064[0m   [32m0.7196[0m        [35m0.2528[0m       0.9166        [94m0.2713[0m     +  28.1744
     15   [36m0.2109[0m   [32m0.7273[0m        [35m0.2527[0m       0.9166        [94m0.2701[0m     +  27.6667
     16   [36m0.2208[0m   [32m0.7329[0m        [35m0.2509[0m       0.9166        [94m0.2699[0m     +  27.9256
     17   [36m0.2279[0m   [32m0.7389[0m        [35m0.2507[0m       0.9166        [94m0.2691[0m     +  27.7406
     18   [36m0.2354[0m   [32m0.7456[0m        0.2512       0.9166        [94m0.2678[0m     +  28.0385
     19   [36m0.2434[0m   [32m0.7508[0m        0.2511       0.9166        [94m0.2661[0m     +  27.7720
     20   [36m0.2646[0m   [32m0.7573[0m        [35m0.2497[0m       0.9166        [94m0.2647[0m     +  28.1910
     21   [36m0.2792[0m   [32m0.7643[0m        [35m0.2480[0m       0.9166        [94m0.2629[0m     +  28.5644
     22   [36m0.2834[0m   [32m0.7692[0m        [35m0.2465[0m       0.9166        [94m0.2602[0m     +  27.5339
     23   [36m0.3059[0m   [32m0.7785[0m        [35m0.2464[0m       0.9166        [94m0.2560[0m     +  27.9448
     24   [36m0.3265[0m   [32m0.7899[0m        [35m0.2445[0m       [31m0.9178[0m        [94m0.2493[0m     +  27.7361
     25   [36m0.3549[0m   [32m0.8025[0m        [35m0.2441[0m       [31m0.9202[0m        [94m0.2424[0m     +  28.1147
     26   [36m0.3716[0m   [32m0.8084[0m        [35m0.2431[0m       [31m0.9214[0m        [94m0.2366[0m     +  27.7685
     27   [36m0.3760[0m   [32m0.8117[0m        [35m0.2422[0m       0.9202        [94m0.2346[0m     +  28.1882
     28   [36m0.3787[0m   [32m0.8125[0m        [35m0.2398[0m       0.9202        [94m0.2335[0m     +  28.2418
     29   [36m0.3855[0m   [32m0.8143[0m        [35m0.2387[0m       0.9190        0.2337        28.2032
     30   [36m0.3966[0m   [32m0.8153[0m        [35m0.2351[0m       0.9178        0.2336        27.7985
     31   0.3879   [32m0.8164[0m        0.2370       0.9141        0.2348        27.9886
     32   0.3921   [32m0.8176[0m        0.2356       0.9141        0.2351        28.0467
     33   [36m0.4000[0m   [32m0.8189[0m        0.2361       0.9141        0.2349        28.4136
     34   0.3874   0.8189        [35m0.2332[0m       0.9141        0.2358        27.6114
     35   0.3947   [32m0.8202[0m        0.2343       0.9129        0.2356        27.7051
     36   [36m0.4034[0m   [32m0.8215[0m        0.2345       0.9166        0.2349        28.3572
     37   0.3999   [32m0.8217[0m        0.2337       0.9117        0.2357        27.9054
Stopping since valid_loss has not improved in the last 10 epochs.
[32m[I 2023-05-03 23:50:28,434][0m Trial 387 finished with value: 0.23350674787844827 and parameters: {'lr': 1.5388373932090955e-05, 'dropout': 0.6447215562046248, 'd_model_multiplier': 4, 'num_layers': 6, 'n_heads': 32, 'dim_feedforward': 346, 'batch_size': 87, 'pos_encoding': 'fixed', 'activation': 'relu', 'norm': 'LayerNorm', 'optimizer_name': 'RAdam', 'weight_decay': 0.1, 'top_n_features': 81}. Best is trial 246 with value: 0.16447311791139763.[0m
[FileBasedDataset] Initializing dataset...
	Examples: 8264
	Features: 70
	Max length: 315
Standard scalar turned ON, loading params from cache
[FileBasedDataset] Dataset initialization complete
  epoch    auprc    auroc    train_loss    valid_acc    valid_loss    cp      dur
-------  -------  -------  ------------  -----------  ------------  ----  -------
      1   [36m0.1644[0m   [32m0.6079[0m        [35m0.3438[0m       [31m0.9166[0m        [94m0.2820[0m     +  30.9273
      2   [36m0.2418[0m   [32m0.6812[0m        [35m0.2449[0m       [31m0.9190[0m        [94m0.2703[0m     +  30.9617
      3   [36m0.2519[0m   [32m0.7038[0m        [35m0.2331[0m       0.9190        [94m0.2692[0m     +  31.0677
      4   [36m0.2666[0m   [32m0.7193[0m        [35m0.2310[0m       0.9190        [94m0.2663[0m     +  30.8435
      5   0.2606   [32m0.7270[0m        [35m0.2289[0m       0.9166        [94m0.2659[0m     +  30.9813
      6   0.2651   [32m0.7293[0m        [35m0.2262[0m       0.9166        0.2674        30.8961
      7   0.2636   [32m0.7357[0m        0.2262       0.9166        [94m0.2655[0m     +  30.8928
      8   0.2623   [32m0.7400[0m        [35m0.2256[0m       0.9166        0.2659        30.7967
      9   0.2598   0.7366        [35m0.2252[0m       0.9166        0.2672        30.7842
     10   0.2589   [32m0.7417[0m        [35m0.2236[0m       0.9178        0.2665        31.0279
     11   0.2587   [32m0.7435[0m        [35m0.2228[0m       0.9178        0.2675        31.2666
     12   0.2550   [32m0.7440[0m        [35m0.2224[0m       0.9166        0.2686        30.9032
     13   0.2530   0.7438        [35m0.2219[0m       0.9154        0.2693        31.1222
     14   0.2550   [32m0.7468[0m        [35m0.2206[0m       0.9154        0.2701        31.2626
     15   0.2533   [32m0.7507[0m        0.2207       0.9166        0.2678        31.3631
     16   0.2487   0.7483        [35m0.2184[0m       0.9166        0.2706        30.9341
Stopping since valid_loss has not improved in the last 10 epochs.
[32m[I 2023-05-03 23:59:16,880][0m Trial 388 finished with value: 0.26549586355506005 and parameters: {'lr': 2.214563030130047e-05, 'dropout': 0.4115329357883834, 'd_model_multiplier': 4, 'num_layers': 7, 'n_heads': 32, 'dim_feedforward': 332, 'batch_size': 61, 'pos_encoding': 'fixed', 'activation': 'relu', 'norm': 'LayerNorm', 'optimizer_name': 'AdamW', 'weight_decay': 0, 'top_n_features': 70}. Best is trial 246 with value: 0.16447311791139763.[0m
[FileBasedDataset] Initializing dataset...
	Examples: 8264
	Features: 55
	Max length: 315
Standard scalar turned ON, loading params from cache
[FileBasedDataset] Dataset initialization complete
  epoch    auprc    auroc    train_loss    valid_acc    valid_loss    cp       dur
-------  -------  -------  ------------  -----------  ------------  ----  --------
      1   [36m0.2414[0m   [32m0.7828[0m        [35m0.3045[0m       [31m0.9008[0m        [94m0.2602[0m     +  101.8608
      2   [36m0.2825[0m   [32m0.7932[0m        [35m0.2433[0m       [31m0.9057[0m        0.2717        102.5203
      3   [36m0.2958[0m   [32m0.8022[0m        [35m0.2431[0m       [31m0.9166[0m        [94m0.2473[0m     +  101.6398
      4   [36m0.3091[0m   [32m0.8134[0m        [35m0.2402[0m       [31m0.9178[0m        0.2545        101.9344
      5   0.2879   [32m0.8266[0m        [35m0.2399[0m       0.9154        [94m0.2436[0m     +  101.9921
      6   0.2981   0.8252        [35m0.2346[0m       0.9178        [94m0.2318[0m     +  101.8757
      7   [36m0.3151[0m   [32m0.8344[0m        0.2358       [31m0.9238[0m        0.2404        101.9608
      8   0.2853   0.8245        0.2375       0.8972        0.2806        101.8161
      9   0.3002   0.8294        0.2407       0.8972        0.2695        101.8200
     10   0.3052   0.8299        0.2350       0.8948        0.2948        102.5569
     11   0.3060   0.8331        0.2415       0.9069        0.2639        102.2951
     12   0.2884   0.8340        0.2352       0.9190        0.2356        102.0711
     13   0.2816   0.8331        0.2359       0.9081        0.2550        102.1764
     14   0.2913   0.8307        0.2397       0.9129        0.2352        102.0280
     15   0.2771   0.8261        0.2378       0.9141        [94m0.2310[0m     +  102.0479
     16   0.2891   [32m0.8355[0m        0.2371       0.8996        0.2584        102.0450
     17   0.2615   0.8159        0.2365       0.9045        0.2570        102.0736
     18   0.2926   0.8092        0.2451       0.8960        0.3031        102.0236
     19   0.2929   0.7860        0.2402       0.9214        0.2363        102.0240
     20   0.2794   0.8143        0.2357       0.8972        0.2829        101.7182
     21   0.2991   0.8116        0.2389       0.9166        0.2564        101.8949
     22   0.2971   0.8060        [35m0.2332[0m       0.9093        0.2578        101.9552
     23   0.2768   0.8091        0.2366       0.8851        0.3335        101.6718
     24   0.2696   0.8006        0.2382       0.9166        0.2316        101.4562
Stopping since valid_loss has not improved in the last 10 epochs.
[32m[I 2023-05-04 00:41:58,765][0m Trial 389 finished with value: 0.2309726057382708 and parameters: {'lr': 9.046198853639571e-05, 'dropout': 0.40170619637095895, 'd_model_multiplier': 64, 'num_layers': 5, 'n_heads': 32, 'dim_feedforward': 329, 'batch_size': 78, 'pos_encoding': 'fixed', 'activation': 'relu', 'norm': 'LayerNorm', 'optimizer_name': 'RAdam', 'weight_decay': 0.1, 'top_n_features': 55}. Best is trial 246 with value: 0.16447311791139763.[0m
[FileBasedDataset] Initializing dataset...
	Examples: 8264
	Features: 63
	Max length: 315
Standard scalar turned ON, loading params from cache
[FileBasedDataset] Dataset initialization complete
  epoch    auprc    auroc    train_loss    valid_acc    valid_loss    cp      dur
-------  -------  -------  ------------  -----------  ------------  ----  -------
      1   [36m0.3071[0m   [32m0.7497[0m        [35m0.3477[0m       [31m0.9214[0m        [94m0.2400[0m     +  21.6436
      2   [36m0.3890[0m   [32m0.7868[0m        [35m0.2417[0m       [31m0.9311[0m        [94m0.2259[0m     +  21.4819
      3   [36m0.3936[0m   [32m0.7960[0m        [35m0.2358[0m       0.9274        [94m0.2241[0m     +  21.6269
      4   [36m0.3939[0m   [32m0.8030[0m        [35m0.2323[0m       0.9262        [94m0.2233[0m     +  21.2864
      5   0.3883   [32m0.8057[0m        [35m0.2298[0m       0.9250        0.2235        21.0280
      6   0.3866   [32m0.8101[0m        [35m0.2269[0m       0.9274        0.2235        21.0661
      7   0.3867   [32m0.8139[0m        [35m0.2263[0m       0.9238        [94m0.2225[0m     +  21.3423
      8   0.3894   [32m0.8157[0m        [35m0.2244[0m       0.9262        0.2225        21.0908
      9   0.3831   [32m0.8180[0m        [35m0.2217[0m       0.9238        0.2226        21.2125
     10   0.3821   [32m0.8188[0m        [35m0.2211[0m       0.9226        [94m0.2218[0m     +  21.0895
     11   0.3790   [32m0.8212[0m        [35m0.2200[0m       0.9214        0.2221        21.1143
     12   0.3665   [32m0.8212[0m        [35m0.2174[0m       0.9214        0.2234        21.2120
     13   0.3760   [32m0.8221[0m        [35m0.2171[0m       0.9226        0.2228        21.3092
     14   0.3709   [32m0.8240[0m        [35m0.2158[0m       0.9202        0.2232        20.8422
     15   0.3716   0.8232        [35m0.2138[0m       0.9238        0.2224        21.0903
     16   0.3722   0.8235        0.2142       0.9226        0.2227        21.0198
     17   0.3574   0.8235        [35m0.2113[0m       0.9214        0.2232        21.0892
     18   0.3688   0.8226        [35m0.2109[0m       0.9214        0.2232        21.1468
     19   0.3693   [32m0.8247[0m        [35m0.2105[0m       0.9226        0.2225        21.1349
Stopping since valid_loss has not improved in the last 10 epochs.
