[32m[I 2023-05-05 07:45:18,068][0m Trial 573 finished with value: 0.21033777336183454 and parameters: {'lr': 0.0003284224081336603, 'dropout': 0.42437264292163174, 'd_model_multiplier': 4, 'num_layers': 1, 'n_heads': 8, 'dim_feedforward': 338, 'batch_size': 57, 'pos_encoding': 'learnable', 'activation': 'relu', 'norm': 'LayerNorm', 'optimizer_name': 'AdamW', 'weight_decay': 0.1, 'top_n_features': 200}. Best is trial 246 with value: 0.16447311791139763.[0m
[FileBasedDataset] Initializing dataset...
	Examples: 8264
	Features: 208
	Max length: 315
Standard scalar turned ON, loading params from cache
[FileBasedDataset] Dataset initialization complete
  epoch    auprc    auroc    train_loss    valid_acc    valid_loss    cp     dur
-------  -------  -------  ------------  -----------  ------------  ----  ------
      1   [36m0.0799[0m   [32m0.5240[0m        [35m0.4516[0m       [31m0.9226[0m        [94m0.2923[0m     +  9.6021
      2   [36m0.2084[0m   [32m0.7151[0m        [35m0.2737[0m       0.9226        [94m0.2471[0m     +  8.9658
      3   [36m0.2255[0m   [32m0.7606[0m        [35m0.2534[0m       0.9214        [94m0.2380[0m     +  9.3700
      4   [36m0.2624[0m   [32m0.7854[0m        [35m0.2459[0m       0.9190        [94m0.2317[0m     +  9.4923
      5   [36m0.2680[0m   [32m0.7927[0m        [35m0.2407[0m       0.9141        [94m0.2307[0m     +  9.5682
      6   [36m0.2777[0m   [32m0.7990[0m        [35m0.2383[0m       0.9166        [94m0.2290[0m     +  9.4840
      7   [36m0.3076[0m   [32m0.8033[0m        [35m0.2345[0m       [31m0.9238[0m        [94m0.2274[0m     +  9.6168
      8   [36m0.3171[0m   0.8026        [35m0.2323[0m       0.9226        0.2275        9.5555
      9   [36m0.3246[0m   0.7990        [35m0.2300[0m       0.9214        0.2296        9.7412
     10   0.3202   0.7976        [35m0.2280[0m       0.9178        0.2294        9.6706
     11   [36m0.3308[0m   0.8028        [35m0.2250[0m       0.9178        0.2276        9.6331
     12   [36m0.3373[0m   0.7938        [35m0.2228[0m       0.9190        0.2279        9.4214
     13   [36m0.3451[0m   0.7989        [35m0.2192[0m       0.9214        [94m0.2265[0m     +  9.7836
     14   [36m0.3504[0m   0.7931        [35m0.2170[0m       0.9226        0.2289        9.8772
     15   0.3336   0.7897        [35m0.2129[0m       0.9190        0.2319        9.9074
     16   0.3359   0.7842        [35m0.2117[0m       0.9214        0.2324        9.8691
     17   0.3347   0.7784        [35m0.2074[0m       0.9214        0.2343        10.0028
     18   0.3398   0.7936        [35m0.2043[0m       0.9178        0.2326        9.7885
     19   0.3311   0.7835        [35m0.2008[0m       0.9154        0.2378        9.8838
     20   0.3339   0.7814        [35m0.1990[0m       0.9190        0.2402        9.7938
     21   0.3329   0.7931        [35m0.1962[0m       0.9190        0.2406        9.7551
     22   0.3276   0.7929        [35m0.1915[0m       0.9154        0.2433        9.6104
Stopping since valid_loss has not improved in the last 10 epochs.
[32m[I 2023-05-05 07:49:00,837][0m Trial 574 finished with value: 0.22654883035581375 and parameters: {'lr': 0.00016388085990502377, 'dropout': 0.22794307436301917, 'd_model_multiplier': 1, 'num_layers': 1, 'n_heads': 32, 'dim_feedforward': 346, 'batch_size': 42, 'pos_encoding': 'learnable', 'activation': 'relu', 'norm': 'LayerNorm', 'optimizer_name': 'RAdam', 'weight_decay': 0.1, 'top_n_features': 208}. Best is trial 246 with value: 0.16447311791139763.[0m
[FileBasedDataset] Initializing dataset...
	Examples: 8264
	Features: 189
	Max length: 315
Standard scalar turned ON, loading params from cache
[FileBasedDataset] Dataset initialization complete
  epoch    auprc    auroc    train_loss    valid_acc    valid_loss    cp     dur
-------  -------  -------  ------------  -----------  ------------  ----  ------
      1   [36m0.2569[0m   [32m0.7736[0m        [35m0.2971[0m       [31m0.9141[0m        [94m0.2404[0m     +  9.1718
      2   [36m0.2832[0m   [32m0.7936[0m        [35m0.2491[0m       [31m0.9154[0m        [94m0.2336[0m     +  9.8326
      3   0.2812   0.7602        [35m0.2452[0m       [31m0.9190[0m        0.2532        9.7747
      4   0.2617   0.7426        [35m0.2422[0m       0.9166        0.2674        9.9435
      5   0.2417   0.7246        [35m0.2389[0m       0.9166        0.2861        10.0034
      6   0.2480   0.7119        [35m0.2376[0m       0.9166        0.2885        9.9847
      7   0.2776   0.7549        [35m0.2368[0m       0.9166        0.2667        9.9907
      8   0.2559   0.7221        [35m0.2346[0m       0.9166        0.2914        10.4291
      9   [36m0.2910[0m   0.7323        [35m0.2317[0m       [31m0.9214[0m        0.2649        10.0603
     10   [36m0.2954[0m   0.7626        [35m0.2301[0m       0.9202        0.2518        9.7775
     11   0.2852   0.7482        [35m0.2277[0m       0.9202        0.2536        10.2302
Stopping since valid_loss has not improved in the last 10 epochs.
[32m[I 2023-05-05 07:51:00,412][0m Trial 575 finished with value: 0.23360307111957773 and parameters: {'lr': 0.0008466313309069633, 'dropout': 0.2496940419647105, 'd_model_multiplier': 4, 'num_layers': 1, 'n_heads': 32, 'dim_feedforward': 352, 'batch_size': 53, 'pos_encoding': 'learnable', 'activation': 'relu', 'norm': 'LayerNorm', 'optimizer_name': 'RAdam', 'weight_decay': 0.1, 'top_n_features': 189}. Best is trial 246 with value: 0.16447311791139763.[0m
[FileBasedDataset] Initializing dataset...
	Examples: 8264
	Features: 211
	Max length: 315
Standard scalar turned ON, loading params from cache
[FileBasedDataset] Dataset initialization complete
  epoch    auprc    auroc    train_loss    valid_acc    valid_loss    cp     dur
-------  -------  -------  ------------  -----------  ------------  ----  ------
      1   [36m0.0824[0m   [32m0.3735[0m        [35m0.7591[0m       [31m0.1306[0m        [94m0.7572[0m     +  9.4755
      2   0.0798   0.3491        [35m0.7409[0m       [31m0.1644[0m        [94m0.7397[0m     +  10.4742
      3   0.0750   0.3331        [35m0.7273[0m       [31m0.2104[0m        [94m0.7229[0m     +  9.5125
      4   0.0702   0.3210        [35m0.7112[0m       [31m0.2805[0m        [94m0.7067[0m     +  9.7161
      5   0.0663   0.3139        [35m0.6966[0m       [31m0.3881[0m        [94m0.6911[0m     +  10.1600
      6   0.0640   0.3074        [35m0.6800[0m       [31m0.5224[0m        [94m0.6762[0m     +  10.2269
      7   0.0614   0.2995        [35m0.6686[0m       [31m0.6892[0m        [94m0.6618[0m     +  10.0824
      8   0.0609   0.2925        [35m0.6554[0m       [31m0.8017[0m        [94m0.6479[0m     +  10.1462
      9   0.0597   0.2864        [35m0.6428[0m       [31m0.8658[0m        [94m0.6346[0m     +  10.3153
     10   0.0616   0.2820        [35m0.6294[0m       [31m0.9045[0m        [94m0.6217[0m     +  10.2418
     11   0.0613   0.2795        [35m0.6193[0m       [31m0.9178[0m        [94m0.6094[0m     +  10.5428
     12   0.0612   0.2776        [35m0.6066[0m       0.9178        [94m0.5975[0m     +  10.1388
     13   0.0609   0.2762        [35m0.5969[0m       0.9178        [94m0.5861[0m     +  10.2856
     14   0.0608   0.2752        [35m0.5841[0m       0.9178        [94m0.5752[0m     +  10.1832
     15   0.0569   0.2748        [35m0.5751[0m       [31m0.9190[0m        [94m0.5646[0m     +  10.3703
     16   0.0553   0.2744        [35m0.5649[0m       0.9190        [94m0.5544[0m     +  10.2395
     17   0.0541   0.2736        [35m0.5563[0m       0.9190        [94m0.5446[0m     +  10.2163
     18   0.0537   0.2730        [35m0.5468[0m       0.9190        [94m0.5352[0m     +  10.6876
     19   0.0534   0.2728        [35m0.5376[0m       0.9190        [94m0.5261[0m     +  10.2814
     20   0.0533   0.2727        [35m0.5282[0m       0.9190        [94m0.5173[0m     +  10.1856
     21   0.0531   0.2726        [35m0.5202[0m       0.9190        [94m0.5089[0m     +  10.5787
     22   0.0530   0.2723        [35m0.5124[0m       0.9190        [94m0.5007[0m     +  10.2034
     23   0.0528   0.2716        [35m0.5041[0m       0.9190        [94m0.4929[0m     +  10.1532
     24   0.0527   0.2715        [35m0.4971[0m       0.9190        [94m0.4854[0m     +  10.0136
     25   0.0527   0.2717        [35m0.4906[0m       0.9190        [94m0.4781[0m     +  10.0556
     26   0.0527   0.2719        [35m0.4836[0m       0.9190        [94m0.4710[0m     +  10.1943
     27   0.0527   0.2720        [35m0.4771[0m       0.9190        [94m0.4643[0m     +  9.8732
     28   0.0527   0.2723        [35m0.4701[0m       0.9190        [94m0.4578[0m     +  10.0973
     29   0.0527   0.2726        [35m0.4628[0m       0.9190        [94m0.4515[0m     +  10.3205
     30   0.0527   0.2728        [35m0.4571[0m       0.9190        [94m0.4454[0m     +  10.5800
     31   0.0527   0.2734        [35m0.4522[0m       0.9190        [94m0.4396[0m     +  10.0626
     32   0.0527   0.2742        [35m0.4457[0m       0.9190        [94m0.4340[0m     +  9.9655
     33   0.0528   0.2748        [35m0.4414[0m       0.9190        [94m0.4285[0m     +  10.3264
     34   0.0528   0.2760        [35m0.4361[0m       0.9190        [94m0.4233[0m     +  10.1574
     35   0.0529   0.2774        [35m0.4314[0m       0.9190        [94m0.4182[0m     +  10.3637
     36   0.0530   0.2786        [35m0.4252[0m       0.9190        [94m0.4134[0m     +  10.2301
     37   0.0530   0.2798        [35m0.4199[0m       0.9190        [94m0.4087[0m     +  9.9836
     38   0.0531   0.2808        [35m0.4144[0m       0.9190        [94m0.4041[0m     +  10.0985
     39   0.0532   0.2822        [35m0.4118[0m       0.9190        [94m0.3998[0m     +  10.4375
     40   0.0532   0.2835        [35m0.4073[0m       0.9190        [94m0.3955[0m     +  9.8531
     41   0.0533   0.2849        [35m0.4020[0m       0.9190        [94m0.3914[0m     +  10.0406
     42   0.0534   0.2868        [35m0.3980[0m       0.9190        [94m0.3875[0m     +  10.3088
     43   0.0535   0.2887        [35m0.3953[0m       0.9190        [94m0.3837[0m     +  10.2577
     44   0.0537   0.2907        [35m0.3901[0m       0.9190        [94m0.3800[0m     +  10.2637
     45   0.0539   0.2936        [35m0.3866[0m       0.9190        [94m0.3765[0m     +  10.3658
     46   0.0540   0.2959        [35m0.3835[0m       0.9190        [94m0.3731[0m     +  10.2491
     47   0.0542   0.2990        [35m0.3802[0m       0.9190        [94m0.3698[0m     +  9.9797
     48   0.0544   0.3022        [35m0.3771[0m       0.9190        [94m0.3666[0m     +  10.0467
     49   0.0547   0.3052        [35m0.3732[0m       0.9190        [94m0.3635[0m     +  10.2776
     50   0.0549   0.3086        [35m0.3706[0m       0.9190        [94m0.3605[0m     +  10.1276
[32m[I 2023-05-05 07:59:32,404][0m Trial 576 finished with value: 0.360484925946705 and parameters: {'lr': 1.9217002674558002e-07, 'dropout': 0.41339547350778993, 'd_model_multiplier': 4, 'num_layers': 1, 'n_heads': 32, 'dim_feedforward': 436, 'batch_size': 60, 'pos_encoding': 'learnable', 'activation': 'relu', 'norm': 'LayerNorm', 'optimizer_name': 'AdamW', 'weight_decay': 0.1, 'top_n_features': 211}. Best is trial 246 with value: 0.16447311791139763.[0m
[FileBasedDataset] Initializing dataset...
	Examples: 8264
	Features: 193
	Max length: 315
Standard scalar turned ON, loading params from cache
[FileBasedDataset] Dataset initialization complete
  epoch    auprc    auroc    train_loss    valid_acc    valid_loss    cp      dur
-------  -------  -------  ------------  -----------  ------------  ----  -------
      1   [36m0.3109[0m   [32m0.7354[0m        [35m0.3144[0m       [31m0.9033[0m        [94m0.2937[0m     +  12.6373
      2   [36m0.3253[0m   [32m0.7636[0m        [35m0.2441[0m       0.9033        0.2959        12.8438
      3   [36m0.3346[0m   [32m0.7765[0m        [35m0.2403[0m       0.9021        [94m0.2830[0m     +  12.9533
      4   [36m0.3441[0m   [32m0.7782[0m        [35m0.2357[0m       [31m0.9069[0m        [94m0.2733[0m     +  12.9584
      5   [36m0.3454[0m   [32m0.7860[0m        [35m0.2345[0m       [31m0.9081[0m        0.2766        13.1340
      6   [36m0.3649[0m   0.7822        [35m0.2339[0m       0.9069        0.2771        12.9433
      7   0.3494   0.7748        [35m0.2315[0m       0.9033        0.2781        12.9596
      8   0.3446   0.7672        [35m0.2291[0m       [31m0.9093[0m        0.2942        12.8152
      9   0.3547   [32m0.7867[0m        0.2314       0.9057        0.2784        13.1110
     10   [36m0.3776[0m   [32m0.7905[0m        [35m0.2265[0m       0.9045        0.2776        12.9127
     11   0.3521   0.7852        [35m0.2264[0m       0.9045        0.2813        12.9432
     12   0.3697   [32m0.7917[0m        [35m0.2260[0m       0.9021        0.2796        13.0874
     13   0.3641   0.7821        0.2264       0.9057        0.3022        12.9548
Stopping since valid_loss has not improved in the last 10 epochs.
[32m[I 2023-05-05 08:02:34,202][0m Trial 577 finished with value: 0.2733155847352534 and parameters: {'lr': 0.00027808393097027953, 'dropout': 0.4314642663347937, 'd_model_multiplier': 4, 'num_layers': 1, 'n_heads': 64, 'dim_feedforward': 369, 'batch_size': 48, 'pos_encoding': 'learnable', 'activation': 'relu', 'norm': 'LayerNorm', 'optimizer_name': 'RAdam', 'weight_decay': 0.1, 'top_n_features': 193}. Best is trial 246 with value: 0.16447311791139763.[0m
[FileBasedDataset] Initializing dataset...
	Examples: 8264
	Features: 215
	Max length: 315
Standard scalar turned ON, loading params from cache
[FileBasedDataset] Dataset initialization complete
  epoch    auprc    auroc    train_loss    valid_acc    valid_loss    cp     dur
-------  -------  -------  ------------  -----------  ------------  ----  ------
      1   [36m0.2726[0m   [32m0.7368[0m        [35m0.2669[0m       [31m0.9069[0m        [94m0.2604[0m     +  9.1423
      2   [36m0.2924[0m   [32m0.7468[0m        [35m0.2476[0m       0.9045        [94m0.2567[0m     +  9.3823
      3   [36m0.2976[0m   0.7457        [35m0.2467[0m       [31m0.9141[0m        [94m0.2525[0m     +  9.5974
      4   [36m0.3054[0m   [32m0.7469[0m        [35m0.2451[0m       [31m0.9178[0m        [94m0.2478[0m     +  9.3878
      5   [36m0.3363[0m   [32m0.7536[0m        [35m0.2420[0m       [31m0.9214[0m        [94m0.2459[0m     +  9.7050
      6   0.3270   [32m0.7580[0m        0.2422       0.9154        0.2459        9.5530
      7   0.3325   [32m0.7591[0m        [35m0.2386[0m       0.9154        0.2462        9.5801
      8   [36m0.3425[0m   0.7551        0.2398       0.9129        0.2587        9.6225
      9   [36m0.3487[0m   [32m0.7604[0m        0.2412       0.9141        0.2490        9.5594
     10   0.3302   [32m0.7647[0m        0.2398       0.9178        0.2462        9.8259
     11   0.3487   [32m0.7723[0m        [35m0.2373[0m       0.9166        [94m0.2419[0m     +  9.4485
     12   [36m0.3508[0m   0.7663        0.2403       0.9129        0.2469        9.7313
     13   [36m0.3551[0m   0.7657        0.2384       0.9129        0.2508        9.8438
     14   0.3456   [32m0.7724[0m        [35m0.2369[0m       0.9129        0.2447        9.8671
     15   0.3538   0.7674        [35m0.2355[0m       0.9214        0.2461        9.9167
     16   0.3411   [32m0.7736[0m        [35m0.2344[0m       0.9081        0.2626        9.8081
     17   0.3312   0.7714        0.2352       0.9117        0.2591        9.7780
     18   0.3230   0.7711        0.2351       0.9105        0.2560        9.6490
     19   0.3118   [32m0.7753[0m        [35m0.2312[0m       0.9129        0.2529        9.6108
     20   0.3180   [32m0.7777[0m        0.2315       0.9129        0.2600        9.8169
Stopping since valid_loss has not improved in the last 10 epochs.
[32m[I 2023-05-05 08:05:57,219][0m Trial 578 finished with value: 0.2418503102293506 and parameters: {'lr': 0.0002263531725666455, 'dropout': 0.4509370974657776, 'd_model_multiplier': 4, 'num_layers': 1, 'n_heads': 32, 'dim_feedforward': 359, 'batch_size': 25, 'pos_encoding': 'learnable', 'activation': 'relu', 'norm': 'LayerNorm', 'optimizer_name': 'AdamW', 'weight_decay': 0.1, 'top_n_features': 215}. Best is trial 246 with value: 0.16447311791139763.[0m
[FileBasedDataset] Initializing dataset...
	Examples: 8264
	Features: 181
	Max length: 315
Standard scalar turned ON, loading params from cache
[FileBasedDataset] Dataset initialization complete
  epoch    auprc    auroc    train_loss    valid_acc    valid_loss    cp      dur
-------  -------  -------  ------------  -----------  ------------  ----  -------
      1   [36m0.2137[0m   [32m0.7140[0m        [35m0.2927[0m       [31m0.9287[0m        [94m0.2578[0m     +  25.1307
      2   0.0867   0.5454        [35m0.2554[0m       0.9287        0.3258        25.2334
      3   0.0969   0.5469        [35m0.2500[0m       0.9274        0.3218        25.4731
      4   0.0962   0.5298        [35m0.2467[0m       0.9274        0.3328        25.5367
      5   0.1048   0.5356        [35m0.2453[0m       0.9274        0.3139        25.4670
      6   0.0738   0.4358        [35m0.2441[0m       0.9274        0.4207        25.3434
      7   0.0685   0.4224        0.2451       [31m0.9299[0m        0.3804        25.4288
      8   0.0803   0.4362        0.2480       0.9287        0.4142        25.1897
      9   0.0915   0.4298        0.2509       0.9250        0.4297        25.6699
     10   0.0998   0.4502        0.2483       0.9287        0.3491        25.3803
Stopping since valid_loss has not improved in the last 10 epochs.
[32m[I 2023-05-05 08:10:37,201][0m Trial 579 finished with value: 0.257820294532551 and parameters: {'lr': 9.305571842066025e-05, 'dropout': 0.37015557557566864, 'd_model_multiplier': 64, 'num_layers': 1, 'n_heads': 32, 'dim_feedforward': 339, 'batch_size': 54, 'pos_encoding': 'learnable', 'activation': 'relu', 'norm': 'LayerNorm', 'optimizer_name': 'RAdam', 'weight_decay': 0.1, 'top_n_features': 181}. Best is trial 246 with value: 0.16447311791139763.[0m
[FileBasedDataset] Initializing dataset...
	Examples: 8264
	Features: 175
	Max length: 315
Standard scalar turned ON, loading params from cache
[FileBasedDataset] Dataset initialization complete
  epoch    auprc    auroc    train_loss    valid_acc    valid_loss    cp      dur
-------  -------  -------  ------------  -----------  ------------  ----  -------
      1   [36m0.1873[0m   [32m0.7191[0m        [35m0.2902[0m       [31m0.9190[0m        [94m0.2411[0m     +  10.0238
      2   0.1834   0.7094        [35m0.2496[0m       0.9166        0.2490        10.0832
      3   [36m0.1951[0m   0.7096        [35m0.2461[0m       0.9166        0.2499        10.3234
      4   0.1865   0.6962        [35m0.2454[0m       [31m0.9202[0m        0.2496        9.9361
      5   [36m0.1962[0m   0.6943        [35m0.2434[0m       [31m0.9238[0m        0.2519        10.1096
      6   [36m0.2056[0m   0.6949        [35m0.2420[0m       [31m0.9262[0m        0.2419        10.1247
      7   [36m0.2136[0m   [32m0.7227[0m        [35m0.2366[0m       0.9166        0.2568        9.8039
      8   0.1889   0.6957        0.2373       0.9190        0.2466        10.1841
      9   0.1984   0.7026        [35m0.2349[0m       0.9202        0.2444        10.0844
     10   0.2094   0.7225        [35m0.2340[0m       0.9238        [94m0.2398[0m     +  9.9014
     11   0.1885   0.7098        [35m0.2304[0m       0.9238        0.2456        9.9058
     12   0.1797   0.7134        [35m0.2265[0m       0.9262        0.2433        9.9752
     13   [36m0.2186[0m   [32m0.7244[0m        [35m0.2261[0m       0.9250        [94m0.2371[0m     +  9.9949
     14   0.2022   [32m0.7252[0m        [35m0.2258[0m       [31m0.9274[0m        0.2383        9.9380
     15   0.2184   [32m0.7333[0m        [35m0.2220[0m       0.9202        0.2464        10.0396
     16   0.2028   0.7207        0.2240       [31m0.9287[0m        0.2385        10.1446
     17   0.2072   0.7219        [35m0.2192[0m       0.9274        0.2419        10.1811
     18   0.2020   0.7295        0.2203       0.9250        0.2381        9.9090
     19   [36m0.2267[0m   [32m0.7468[0m        [35m0.2164[0m       0.9250        0.2373        9.9831
     20   0.2052   0.7269        [35m0.2161[0m       0.9274        [94m0.2366[0m     +  9.9273
     21   0.2200   0.7417        [35m0.2158[0m       0.9274        [94m0.2357[0m     +  9.8619
     22   0.2188   [32m0.7492[0m        [35m0.2133[0m       0.9250        0.2363        10.0938
     23   0.2023   0.7413        [35m0.2116[0m       0.9274        0.2363        10.0116
     24   0.1853   0.7367        [35m0.2101[0m       0.9250        0.2454        10.0156
     25   0.1911   0.7243        [35m0.2078[0m       0.9214        0.2539        10.1545
     26   0.2078   0.7298        [35m0.2071[0m       0.9214        0.2467        10.0564
     27   0.1988   0.7251        [35m0.2003[0m       0.9226        0.2531        10.1270
     28   0.1875   0.7317        0.2017       0.9190        0.2459        9.9521
     29   0.1747   0.7266        [35m0.1991[0m       0.9214        0.2530        9.9658
     30   0.1727   0.7109        0.2001       0.9202        0.2576        10.0290
Stopping since valid_loss has not improved in the last 10 epochs.
