[32m[I 2023-05-02 16:52:14,497][0m Trial 173 finished with value: 0.2096020353928731 and parameters: {'lr': 0.00037170562109550863, 'dropout': 0.5765206372983221, 'd_model_multiplier': 8, 'num_layers': 2, 'n_heads': 16, 'dim_feedforward': 457, 'batch_size': 62, 'pos_encoding': 'fixed', 'activation': 'gelu', 'norm': 'BatchNorm', 'optimizer_name': 'PlainRAdam', 'weight_decay': 0.01, 'top_n_features': 33}. Best is trial 117 with value: 0.191397856754288.[0m
[FileBasedDataset] Initializing dataset...
	Examples: 8264
	Features: 34
	Max length: 315
Standard scalar turned ON, loading params from cache
[FileBasedDataset] Dataset initialization complete
  epoch    auprc    auroc    train_loss    valid_acc    valid_loss    cp      dur
-------  -------  -------  ------------  -----------  ------------  ----  -------
      1   [36m0.4441[0m   [32m0.8177[0m        [35m0.4005[0m       [31m0.9166[0m        [94m0.4403[0m     +  11.7572
      2   [36m0.4491[0m   [32m0.8270[0m        [35m0.2721[0m       0.9141        [94m0.3683[0m     +  11.8413
      3   [36m0.4496[0m   [32m0.8310[0m        [35m0.2643[0m       [31m0.9214[0m        [94m0.3242[0m     +  11.9883
      4   0.4419   [32m0.8334[0m        [35m0.2601[0m       [31m0.9226[0m        [94m0.2927[0m     +  12.3328
      5   0.4476   [32m0.8376[0m        [35m0.2577[0m       [31m0.9250[0m        [94m0.2737[0m     +  12.3750
      6   0.4318   [32m0.8400[0m        [35m0.2546[0m       0.9214        [94m0.2649[0m     +  11.8945
      7   0.4290   0.8290        [35m0.2508[0m       0.9214        [94m0.2526[0m     +  12.0789
      8   [36m0.4512[0m   [32m0.8438[0m        0.2517       0.9250        [94m0.2438[0m     +  12.2013
      9   0.4355   0.8299        [35m0.2465[0m       0.9250        [94m0.2412[0m     +  11.9793
     10   0.4372   0.8268        0.2474       0.9214        0.2416        12.1455
     11   [36m0.4535[0m   0.8387        0.2467       0.9214        0.2436        12.0638
     12   0.4503   0.8355        [35m0.2425[0m       0.9226        0.2435        12.1379
     13   0.4394   0.8376        [35m0.2409[0m       0.9190        [94m0.2403[0m     +  12.0298
     14   [36m0.4568[0m   0.8393        0.2413       0.9214        [94m0.2312[0m     +  12.2039
     15   0.4510   0.8389        [35m0.2386[0m       0.9238        [94m0.2259[0m     +  12.0393
     16   0.4534   0.8376        0.2399       0.9166        0.2292        12.0929
     17   0.4505   0.8369        0.2394       0.9178        0.2298        11.9371
     18   0.4427   0.8355        [35m0.2324[0m       0.9190        0.2293        11.9234
     19   0.4392   0.8332        [35m0.2317[0m       0.9166        0.2327        12.0387
     20   0.4355   0.8337        [35m0.2311[0m       0.9178        0.2325        12.0877
     21   0.4184   0.8176        [35m0.2257[0m       0.9178        0.2384        12.2785
     22   0.4251   0.8207        0.2292       0.9141        0.2350        12.1670
     23   0.4403   0.8364        0.2337       0.9154        0.2280        11.9585
     24   0.4329   0.8337        0.2288       0.9190        0.2331        12.0949
     25   [36m0.4615[0m   [32m0.8444[0m        0.2282       0.9154        [94m0.2242[0m     +  12.0300
     26   0.4461   0.8357        [35m0.2254[0m       0.9190        0.2286        12.0428
     27   0.4416   0.8313        0.2260       0.9178        0.2324        12.3454
     28   0.4509   0.8330        [35m0.2222[0m       0.9105        0.2379        11.8702
     29   0.4326   0.8343        0.2236       0.9129        0.2405        11.9318
     30   0.4377   0.8385        0.2239       0.9141        0.2353        12.1196
     31   0.4445   0.8376        [35m0.2220[0m       0.9129        0.2297        12.0237
     32   0.4358   0.8376        [35m0.2186[0m       0.9154        0.2286        12.6581
     33   0.4352   0.8330        0.2211       0.9166        0.2358        12.2157
     34   0.4368   0.8337        [35m0.2183[0m       0.9105        0.2404        12.0641
Stopping since valid_loss has not improved in the last 10 epochs.
[32m[I 2023-05-02 16:59:19,031][0m Trial 174 finished with value: 0.22416453739175485 and parameters: {'lr': 0.0003104187079351194, 'dropout': 0.5703859972693992, 'd_model_multiplier': 8, 'num_layers': 3, 'n_heads': 16, 'dim_feedforward': 455, 'batch_size': 61, 'pos_encoding': 'fixed', 'activation': 'gelu', 'norm': 'BatchNorm', 'optimizer_name': 'PlainRAdam', 'weight_decay': 0.01, 'top_n_features': 34}. Best is trial 117 with value: 0.191397856754288.[0m
[FileBasedDataset] Initializing dataset...
	Examples: 8264
	Features: 37
	Max length: 315
Standard scalar turned ON, loading params from cache
[FileBasedDataset] Dataset initialization complete
  epoch    auprc    auroc    train_loss    valid_acc    valid_loss    cp     dur
-------  -------  -------  ------------  -----------  ------------  ----  ------
      1   [36m0.2500[0m   [32m0.7421[0m        [35m0.3593[0m       [31m0.9093[0m        [94m0.3896[0m     +  9.4352
      2   [36m0.2791[0m   [32m0.7553[0m        [35m0.2587[0m       0.9081        [94m0.3554[0m     +  9.9320
      3   [36m0.2949[0m   [32m0.7619[0m        [35m0.2536[0m       [31m0.9129[0m        [94m0.3334[0m     +  10.1546
      4   [36m0.3107[0m   0.7491        [35m0.2483[0m       [31m0.9250[0m        [94m0.3017[0m     +  10.3037
      5   [36m0.3277[0m   [32m0.7664[0m        [35m0.2450[0m       0.9226        [94m0.2970[0m     +  9.9763
      6   [36m0.3377[0m   0.7615        [35m0.2437[0m       0.9238        [94m0.2879[0m     +  9.9791
      7   [36m0.3495[0m   0.7527        [35m0.2395[0m       0.9250        [94m0.2801[0m     +  10.1767
      8   [36m0.3602[0m   [32m0.7902[0m        0.2407       0.9238        [94m0.2794[0m     +  10.0161
      9   [36m0.3689[0m   [32m0.7998[0m        [35m0.2389[0m       [31m0.9262[0m        [94m0.2766[0m     +  10.2779
     10   [36m0.3722[0m   [32m0.8096[0m        0.2407       0.9214        0.2829        10.5435
     11   0.3712   0.8001        0.2396       0.9262        [94m0.2649[0m     +  10.1616
     12   0.3664   0.8025        [35m0.2346[0m       0.9226        0.2727        10.3013
     13   0.3668   0.8095        0.2368       0.9214        0.2724        10.1582
     14   [36m0.3767[0m   0.8032        0.2378       0.9214        0.2929        10.0880
     15   0.3690   0.7941        0.2400       0.9226        0.2867        10.2246
     16   [36m0.3785[0m   0.8001        0.2388       0.9226        0.2855        10.0062
     17   [36m0.3800[0m   0.7902        0.2384       0.9202        0.2971        9.7860
     18   [36m0.3905[0m   0.7960        [35m0.2310[0m       0.9214        0.2859        10.0599
     19   0.3879   0.7912        0.2366       [31m0.9274[0m        0.2684        9.8954
     20   [36m0.3967[0m   0.7848        0.2370       0.9238        0.2814        10.2576
Stopping since valid_loss has not improved in the last 10 epochs.
[32m[I 2023-05-02 17:02:51,744][0m Trial 175 finished with value: 0.2648738203919352 and parameters: {'lr': 0.00046645362002451494, 'dropout': 0.5857874036586703, 'd_model_multiplier': 8, 'num_layers': 2, 'n_heads': 16, 'dim_feedforward': 285, 'batch_size': 68, 'pos_encoding': 'fixed', 'activation': 'gelu', 'norm': 'BatchNorm', 'optimizer_name': 'PlainRAdam', 'weight_decay': 0.01, 'top_n_features': 37}. Best is trial 117 with value: 0.191397856754288.[0m
[FileBasedDataset] Initializing dataset...
	Examples: 8264
	Features: 44
	Max length: 315
Standard scalar turned ON, loading params from cache
[FileBasedDataset] Dataset initialization complete
  epoch    auprc    auroc    train_loss    valid_acc    valid_loss    cp     dur
-------  -------  -------  ------------  -----------  ------------  ----  ------
      1   [36m0.2307[0m   [32m0.7318[0m        [35m0.3116[0m       [31m0.9190[0m        [94m0.3198[0m     +  8.6840
      2   [36m0.2357[0m   [32m0.7326[0m        [35m0.2539[0m       0.9105        [94m0.3138[0m     +  8.7610
      3   0.2267   0.7279        [35m0.2508[0m       0.9166        [94m0.3026[0m     +  8.5374
      4   0.2214   0.7259        [35m0.2456[0m       0.9154        [94m0.3012[0m     +  9.1101
      5   0.2124   0.7190        0.2509       0.9141        0.3056        8.9385
      6   0.2152   0.7246        [35m0.2424[0m       0.9178        [94m0.2924[0m     +  9.1903
      7   0.2105   0.7196        0.2470       [31m0.9202[0m        [94m0.2797[0m     +  9.5405
      8   0.1944   0.7006        [35m0.2412[0m       0.9141        0.2853        9.7262
      9   0.1950   0.7167        0.2427       0.9105        0.2882        9.1316
     10   0.1900   0.6926        0.2460       0.9166        0.2912        9.5813
     11   0.2004   0.7185        [35m0.2406[0m       0.9081        0.2979        9.4246
     12   0.2015   0.7264        0.2409       0.9057        0.2999        9.3660
     13   0.2068   0.7295        [35m0.2384[0m       0.9141        0.2816        9.1222
     14   0.1893   0.6870        0.2429       0.9166        0.2940        9.2330
     15   0.2092   [32m0.7521[0m        0.2390       0.9105        0.2877        9.1060
     16   0.2097   [32m0.7553[0m        [35m0.2366[0m       0.9141        [94m0.2714[0m     +  9.2500
     17   0.2152   [32m0.7709[0m        0.2388       0.9129        [94m0.2654[0m     +  9.1690
     18   0.2137   [32m0.7772[0m        [35m0.2357[0m       0.9154        [94m0.2576[0m     +  9.1948
     19   0.1998   0.7462        0.2370       0.9141        0.2830        9.3568
     20   0.2163   [32m0.7779[0m        0.2358       0.9141        0.2845        9.2894
     21   0.2206   [32m0.7864[0m        [35m0.2345[0m       0.9154        0.2856        9.0692
     22   0.2213   0.7846        [35m0.2314[0m       0.9154        0.2787        9.1083
     23   0.2153   0.7859        [35m0.2302[0m       0.9069        0.2954        9.1636
     24   0.2287   [32m0.7871[0m        0.2318       0.9129        0.2847        9.2775
     25   0.2202   0.7846        [35m0.2302[0m       0.9069        0.2750        9.2172
     26   0.2197   0.7799        [35m0.2300[0m       0.9117        0.2667        9.3211
     27   0.2200   0.7728        0.2356       0.9129        0.2721        9.4123
Stopping since valid_loss has not improved in the last 10 epochs.
[32m[I 2023-05-02 17:07:09,627][0m Trial 176 finished with value: 0.25757241377014634 and parameters: {'lr': 0.0006640507659161188, 'dropout': 0.5453787382229386, 'd_model_multiplier': 8, 'num_layers': 1, 'n_heads': 16, 'dim_feedforward': 418, 'batch_size': 54, 'pos_encoding': 'fixed', 'activation': 'gelu', 'norm': 'BatchNorm', 'optimizer_name': 'PlainRAdam', 'weight_decay': 0.01, 'top_n_features': 44}. Best is trial 117 with value: 0.191397856754288.[0m
[FileBasedDataset] Initializing dataset...
	Examples: 8264
	Features: 27
	Max length: 315
Standard scalar turned ON, loading params from cache
[FileBasedDataset] Dataset initialization complete
  epoch    auprc    auroc    train_loss    valid_acc    valid_loss    cp      dur
-------  -------  -------  ------------  -----------  ------------  ----  -------
      1   [36m0.2967[0m   [32m0.7235[0m        [35m0.2967[0m       [31m0.8742[0m        [94m0.4403[0m     +  11.6191
      2   [36m0.2976[0m   0.7209        [35m0.2587[0m       [31m0.9081[0m        [94m0.3520[0m     +  11.7408
      3   0.2968   [32m0.7265[0m        [35m0.2565[0m       [31m0.9166[0m        [94m0.2928[0m     +  12.2808
      4   [36m0.3007[0m   [32m0.7283[0m        [35m0.2511[0m       [31m0.9178[0m        [94m0.2780[0m     +  11.9643
      5   [36m0.3037[0m   [32m0.7333[0m        [35m0.2446[0m       0.9178        [94m0.2705[0m     +  11.9898
      6   [36m0.3115[0m   [32m0.7501[0m        [35m0.2435[0m       [31m0.9190[0m        0.2748        11.9805
      7   0.3042   0.7500        [35m0.2427[0m       0.9190        0.2775        11.9366
      8   0.3073   [32m0.7565[0m        [35m0.2402[0m       0.9190        [94m0.2675[0m     +  11.9105
      9   0.3034   0.7558        0.2407       [31m0.9202[0m        [94m0.2626[0m     +  12.1319
     10   0.3026   0.7409        0.2417       0.9190        0.2713        11.9958
     11   [36m0.3169[0m   [32m0.7573[0m        0.2434       0.9190        [94m0.2583[0m     +  12.0902
     12   [36m0.3223[0m   [32m0.7643[0m        [35m0.2335[0m       0.9129        0.2641        12.0621
     13   0.3175   [32m0.7660[0m        0.2376       0.9166        [94m0.2567[0m     +  12.1394
     14   0.3184   [32m0.7710[0m        [35m0.2321[0m       [31m0.9214[0m        [94m0.2549[0m     +  12.0852
     15   [36m0.3225[0m   [32m0.7763[0m        0.2337       0.9190        [94m0.2530[0m     +  12.0291
     16   [36m0.3351[0m   [32m0.7910[0m        0.2363       0.9178        [94m0.2495[0m     +  12.2005
     17   0.3290   0.7848        [35m0.2288[0m       0.9178        [94m0.2489[0m     +  11.9692
     18   [36m0.3377[0m   [32m0.7920[0m        0.2347       0.9178        0.2501        11.9262
     19   [36m0.3475[0m   [32m0.7991[0m        0.2303       0.9214        [94m0.2469[0m     +  11.9432
     20   [36m0.3529[0m   [32m0.8131[0m        0.2313       0.9190        [94m0.2457[0m     +  12.0564
     21   0.3334   0.8078        0.2290       0.9166        [94m0.2456[0m     +  12.1809
     22   0.3494   0.8059        0.2313       0.9190        0.2457        12.1944
     23   0.3483   0.8112        [35m0.2281[0m       0.9154        [94m0.2422[0m     +  12.0785
     24   0.3501   [32m0.8216[0m        0.2305       0.9154        [94m0.2409[0m     +  12.1073
     25   0.3358   [32m0.8223[0m        [35m0.2280[0m       0.9154        0.2415        12.1865
     26   [36m0.3572[0m   [32m0.8296[0m        [35m0.2259[0m       0.9166        [94m0.2371[0m     +  12.0898
     27   0.3359   0.8266        0.2284       0.9166        0.2402        12.0607
     28   0.3444   0.8256        0.2264       0.9154        0.2401        11.9184
     29   0.3495   0.8231        [35m0.2228[0m       0.9178        0.2394        12.0901
     30   0.3406   0.8233        0.2251       0.9141        0.2396        12.2380
     31   0.3453   0.8216        0.2264       0.9154        0.2391        12.1955
     32   0.3482   0.8253        0.2249       0.9166        0.2381        12.1965
     33   [36m0.3585[0m   0.8265        0.2266       0.9178        [94m0.2364[0m     +  12.1616
     34   [36m0.3616[0m   0.8250        0.2242       0.9202        [94m0.2362[0m     +  12.0271
     35   0.3574   0.8256        0.2251       0.9178        0.2368        12.1778
     36   0.3572   0.8294        [35m0.2208[0m       0.9166        0.2372        12.0933
     37   0.3525   [32m0.8315[0m        0.2214       0.9154        [94m0.2357[0m     +  12.1394
     38   0.3524   0.8307        [35m0.2207[0m       0.9166        0.2361        12.0459
     39   0.3496   0.8285        0.2232       0.9129        0.2373        11.7997
     40   0.3519   0.8277        0.2228       0.9178        0.2359        12.0821
     41   0.3446   0.8283        [35m0.2199[0m       0.9178        0.2368        12.0580
     42   0.3289   0.8241        [35m0.2177[0m       0.9166        0.2389        12.0703
     43   0.3257   0.8245        0.2205       0.9129        0.2399        12.1458
     44   0.3208   0.8252        0.2199       0.9166        0.2385        11.8962
     45   0.3252   0.8280        0.2180       0.9154        0.2378        11.9977
     46   0.3407   0.8285        0.2186       0.9154        0.2366        11.9000
Stopping since valid_loss has not improved in the last 10 epochs.
[32m[I 2023-05-02 17:16:37,879][0m Trial 177 finished with value: 0.23565268932764014 and parameters: {'lr': 0.0002447890506191105, 'dropout': 0.5781991412849506, 'd_model_multiplier': 8, 'num_layers': 3, 'n_heads': 16, 'dim_feedforward': 435, 'batch_size': 62, 'pos_encoding': 'fixed', 'activation': 'gelu', 'norm': 'BatchNorm', 'optimizer_name': 'AdamW', 'weight_decay': 0.01, 'top_n_features': 27}. Best is trial 117 with value: 0.191397856754288.[0m
[FileBasedDataset] Initializing dataset...
	Examples: 8264
	Features: 17
	Max length: 315
Standard scalar turned ON, loading params from cache
[FileBasedDataset] Dataset initialization complete
  epoch    auprc    auroc    train_loss    valid_acc    valid_loss    cp     dur
-------  -------  -------  ------------  -----------  ------------  ----  ------
      1   [36m0.0594[0m   [32m0.3503[0m        [35m0.5116[0m       [31m0.9214[0m        [94m0.3495[0m     +  9.4561
      2   [36m0.0998[0m   [32m0.5631[0m        [35m0.3225[0m       0.9214        [94m0.2804[0m     +  8.8930
      3   [36m0.1456[0m   [32m0.6402[0m        [35m0.2761[0m       0.9214        [94m0.2697[0m     +  9.7334
      4   [36m0.1614[0m   [32m0.6517[0m        [35m0.2606[0m       0.9214        [94m0.2681[0m     +  9.2261
      5   [36m0.1680[0m   [32m0.6650[0m        [35m0.2565[0m       0.9214        0.2693        9.6374
      6   0.1625   [32m0.6699[0m        [35m0.2541[0m       0.9214        0.2683        9.4883
      7   0.1655   [32m0.6762[0m        [35m0.2490[0m       0.9214        0.2685        9.6536
      8   [36m0.1709[0m   [32m0.6831[0m        0.2512       0.9202        [94m0.2667[0m     +  9.6679
      9   [36m0.1806[0m   [32m0.6902[0m        0.2510       0.9202        [94m0.2648[0m     +  9.7716
     10   [36m0.1956[0m   [32m0.7038[0m        [35m0.2464[0m       0.9190        [94m0.2630[0m     +  9.8444
     11   [36m0.2214[0m   [32m0.7246[0m        [35m0.2437[0m       0.9154        [94m0.2580[0m     +  9.4209
     12   [36m0.2330[0m   [32m0.7374[0m        [35m0.2426[0m       0.9093        0.2594        9.4717
     13   [36m0.2366[0m   [32m0.7409[0m        [35m0.2404[0m       0.9057        0.2623        9.6009
     14   0.2361   [32m0.7437[0m        [35m0.2376[0m       0.9081        0.2660        9.4792
     15   [36m0.2396[0m   [32m0.7444[0m        [35m0.2352[0m       0.9069        0.2676        9.7033
     16   0.2359   [32m0.7454[0m        0.2371       0.9057        0.2673        9.8430
     17   0.2330   [32m0.7457[0m        0.2376       0.8984        0.2749        9.8541
     18   0.2339   [32m0.7464[0m        0.2357       0.9033        0.2698        9.5677
     19   0.2333   [32m0.7476[0m        [35m0.2350[0m       0.9033        0.2704        9.5711
     20   0.2364   [32m0.7489[0m        0.2375       0.9045        0.2710        9.6099
Stopping since valid_loss has not improved in the last 10 epochs.
