[32m[I 2023-05-05 08:15:49,234][0m Trial 580 finished with value: 0.23571219569817636 and parameters: {'lr': 0.0003777513635747627, 'dropout': 0.3412285688797403, 'd_model_multiplier': 2, 'num_layers': 1, 'n_heads': 32, 'dim_feedforward': 330, 'batch_size': 11, 'pos_encoding': 'learnable', 'activation': 'relu', 'norm': 'LayerNorm', 'optimizer_name': 'RAdam', 'weight_decay': 0.1, 'top_n_features': 175}. Best is trial 246 with value: 0.16447311791139763.[0m
[FileBasedDataset] Initializing dataset...
	Examples: 8264
	Features: 192
	Max length: 315
Standard scalar turned ON, loading params from cache
[FileBasedDataset] Dataset initialization complete
  epoch    auprc    auroc    train_loss    valid_acc    valid_loss    cp     dur
-------  -------  -------  ------------  -----------  ------------  ----  ------
      1   [36m0.0535[0m   [32m0.3397[0m        [35m0.4920[0m       [31m0.9287[0m        [94m0.3337[0m     +  8.6899
      2   [36m0.1741[0m   [32m0.5550[0m        [35m0.3237[0m       0.9287        [94m0.2701[0m     +  8.9717
      3   [36m0.2100[0m   [32m0.6201[0m        [35m0.2868[0m       0.9287        [94m0.2516[0m     +  9.1460
      4   [36m0.2145[0m   [32m0.6506[0m        [35m0.2727[0m       0.9287        [94m0.2442[0m     +  9.3811
      5   0.1805   [32m0.6696[0m        [35m0.2655[0m       0.9287        [94m0.2411[0m     +  9.0878
      6   0.1637   [32m0.6787[0m        [35m0.2647[0m       0.9287        [94m0.2393[0m     +  9.4647
      7   0.1668   [32m0.6893[0m        [35m0.2627[0m       0.9287        [94m0.2380[0m     +  9.2685
      8   0.1830   [32m0.6924[0m        [35m0.2598[0m       0.9287        [94m0.2370[0m     +  9.3750
      9   0.1984   [32m0.6992[0m        [35m0.2577[0m       0.9287        [94m0.2363[0m     +  9.4575
     10   0.2004   [32m0.7051[0m        0.2589       0.9287        [94m0.2356[0m     +  9.4225
     11   0.2043   [32m0.7089[0m        [35m0.2563[0m       0.9287        [94m0.2352[0m     +  9.1122
     12   0.1990   0.7083        0.2601       0.9287        [94m0.2351[0m     +  9.3738
     13   0.2060   0.7080        0.2596       0.9287        [94m0.2349[0m     +  9.4757
     14   [36m0.2152[0m   0.7085        0.2603       0.9287        [94m0.2347[0m     +  9.1944
     15   [36m0.2178[0m   0.7082        0.2588       0.9287        [94m0.2346[0m     +  9.4495
     16   [36m0.2263[0m   0.7073        0.2576       0.9287        [94m0.2345[0m     +  9.3263
     17   [36m0.2294[0m   [32m0.7096[0m        0.2586       0.9287        [94m0.2343[0m     +  9.2291
     18   [36m0.2412[0m   [32m0.7099[0m        0.2572       0.9287        [94m0.2341[0m     +  9.4587
     19   [36m0.2469[0m   0.7070        0.2582       0.9287        0.2341        9.5825
     20   0.2414   0.7091        0.2573       0.9287        [94m0.2338[0m     +  9.2220
     21   0.2428   [32m0.7125[0m        0.2567       0.9287        0.2339        9.5230
     22   0.2444   [32m0.7129[0m        [35m0.2552[0m       0.9287        [94m0.2336[0m     +  9.3013
     23   [36m0.2475[0m   [32m0.7144[0m        0.2583       0.9287        0.2337        9.6856
     24   [36m0.2481[0m   0.7132        0.2568       0.9287        0.2336        9.4013
     25   [36m0.2714[0m   [32m0.7162[0m        0.2559       0.9287        [94m0.2333[0m     +  9.2997
     26   0.2674   0.7148        0.2581       0.9287        0.2334        9.5193
     27   0.2511   0.7139        0.2585       0.9287        0.2335        9.2653
     28   0.2516   0.7142        0.2565       0.9287        0.2336        9.3440
     29   0.2511   0.7126        0.2565       0.9287        0.2335        9.4135
     30   0.2465   0.7130        0.2565       0.9287        0.2333        9.5203
     31   0.2461   0.7141        0.2581       0.9287        0.2334        9.5055
     32   0.2587   0.7115        0.2571       0.9287        0.2335        9.2941
     33   0.2523   0.7132        0.2571       0.9287        0.2335        9.4462
     34   0.2635   0.7127        0.2560       0.9287        0.2337        9.4156
Stopping since valid_loss has not improved in the last 10 epochs.
[32m[I 2023-05-05 08:21:17,307][0m Trial 581 finished with value: 0.23328259817021646 and parameters: {'lr': 0.00015091013265466016, 'dropout': 0.4399806722285701, 'd_model_multiplier': 1, 'num_layers': 2, 'n_heads': 4, 'dim_feedforward': 344, 'batch_size': 38, 'pos_encoding': 'learnable', 'activation': 'relu', 'norm': 'LayerNorm', 'optimizer_name': 'AdamW', 'weight_decay': 0.1, 'top_n_features': 192}. Best is trial 246 with value: 0.16447311791139763.[0m
[FileBasedDataset] Initializing dataset...
	Examples: 8264
	Features: 206
	Max length: 315
Standard scalar turned ON, loading params from cache
[FileBasedDataset] Dataset initialization complete
  epoch    auprc    auroc    train_loss    valid_acc    valid_loss    cp     dur
-------  -------  -------  ------------  -----------  ------------  ----  ------
      1   [36m0.2519[0m   [32m0.7688[0m        [35m0.3207[0m       [31m0.9287[0m        [94m0.2242[0m     +  9.9700
      2   [36m0.2566[0m   [32m0.7845[0m        [35m0.2493[0m       0.9262        0.2248        9.9985
      3   0.2559   0.7718        [35m0.2449[0m       0.9238        [94m0.2235[0m     +  10.1843
      4   0.2564   0.7614        [35m0.2425[0m       0.9226        0.2254        10.7410
      5   0.2400   0.7486        0.2425       0.9238        0.2321        10.4371
      6   0.2360   0.7351        [35m0.2389[0m       0.9250        0.2345        10.1936
      7   0.2336   0.7230        [35m0.2371[0m       [31m0.9299[0m        0.2365        10.1805
      8   0.2356   0.7121        [35m0.2361[0m       0.9299        0.2407        10.2440
      9   0.2227   0.6970        0.2376       [31m0.9311[0m        0.2552        10.5461
     10   0.2295   0.7019        0.2366       0.9274        0.2421        10.1565
     11   0.2267   0.6943        0.2376       0.9311        0.2495        10.4045
     12   0.2223   0.6900        [35m0.2358[0m       0.9311        0.2453        10.3492
Stopping since valid_loss has not improved in the last 10 epochs.
[32m[I 2023-05-05 08:23:31,319][0m Trial 582 finished with value: 0.22348685131972473 and parameters: {'lr': 0.0006042565533317291, 'dropout': 0.41630018379680866, 'd_model_multiplier': 4, 'num_layers': 1, 'n_heads': 32, 'dim_feedforward': 458, 'batch_size': 59, 'pos_encoding': 'learnable', 'activation': 'relu', 'norm': 'LayerNorm', 'optimizer_name': 'RAdam', 'weight_decay': 0.1, 'top_n_features': 206}. Best is trial 246 with value: 0.16447311791139763.[0m
[FileBasedDataset] Initializing dataset...
	Examples: 8264
	Features: 204
	Max length: 315
Standard scalar turned ON, loading params from cache
[FileBasedDataset] Dataset initialization complete
  epoch    auprc    auroc    train_loss    valid_acc    valid_loss    cp      dur
-------  -------  -------  ------------  -----------  ------------  ----  -------
      1   [36m0.1922[0m   [32m0.6599[0m        [35m0.4162[0m       [31m0.9057[0m        [94m0.3037[0m     +  34.4842
      2   [36m0.2460[0m   [32m0.7149[0m        [35m0.2489[0m       0.9057        0.3072        34.5471
      3   0.2340   [32m0.7331[0m        [35m0.2410[0m       0.9045        0.3138        34.6982
      4   0.2298   [32m0.7424[0m        [35m0.2366[0m       0.8996        0.3243        34.6695
      5   0.2271   [32m0.7441[0m        [35m0.2332[0m       0.8996        0.3356        34.6864
      6   0.2252   [32m0.7462[0m        [35m0.2313[0m       0.9008        0.3535        34.9492
      7   0.2348   [32m0.7533[0m        [35m0.2287[0m       0.8996        0.3408        34.6287
      8   0.2352   [32m0.7577[0m        [35m0.2266[0m       0.8996        0.3375        34.8509
      9   0.2393   [32m0.7598[0m        0.2276       0.9008        0.3392        34.7316
     10   0.2444   [32m0.7634[0m        [35m0.2257[0m       0.9021        0.3413        34.7001
Stopping since valid_loss has not improved in the last 10 epochs.
[32m[I 2023-05-05 08:29:53,404][0m Trial 583 finished with value: 0.3036912743457139 and parameters: {'lr': 6.373210559637891e-05, 'dropout': 0.46517420628825285, 'd_model_multiplier': 4, 'num_layers': 4, 'n_heads': 64, 'dim_feedforward': 381, 'batch_size': 51, 'pos_encoding': 'learnable', 'activation': 'relu', 'norm': 'LayerNorm', 'optimizer_name': 'RAdam', 'weight_decay': 0.1, 'top_n_features': 204}. Best is trial 246 with value: 0.16447311791139763.[0m
[FileBasedDataset] Initializing dataset...
	Examples: 8264
	Features: 222
	Max length: 315
Standard scalar turned ON, loading params from cache
[FileBasedDataset] Dataset initialization complete
  epoch    auprc    auroc    train_loss    valid_acc    valid_loss    cp      dur
-------  -------  -------  ------------  -----------  ------------  ----  -------
      1   [36m0.1692[0m   [32m0.7249[0m        [35m0.3153[0m       [31m0.9323[0m        [94m0.2474[0m     +  12.8113
      2   [36m0.1839[0m   0.7204        [35m0.2716[0m       0.9299        0.2528        13.0728
      3   [36m0.1923[0m   0.7239        [35m0.2643[0m       0.9311        0.2615        13.0868
      4   [36m0.1928[0m   0.7217        [35m0.2613[0m       0.9311        0.2577        13.1089
      5   0.1873   0.7212        [35m0.2603[0m       0.9311        [94m0.2471[0m     +  13.0456
      6   0.1891   0.7205        [35m0.2571[0m       0.9311        [94m0.2465[0m     +  12.9900
      7   0.1875   [32m0.7276[0m        0.2575       0.9299        [94m0.2397[0m     +  13.0690
      8   0.1892   0.7257        [35m0.2563[0m       0.9311        [94m0.2386[0m     +  12.9854
      9   [36m0.1945[0m   0.7245        0.2577       0.9323        [94m0.2375[0m     +  13.2147
     10   0.1932   0.7256        0.2577       0.9311        0.2394        12.9969
     11   0.1919   0.7271        0.2584       [31m0.9335[0m        [94m0.2281[0m     +  13.1189
     12   [36m0.1967[0m   [32m0.7303[0m        0.2585       0.9311        [94m0.2265[0m     +  13.1010
     13   0.1864   0.7276        [35m0.2561[0m       0.9311        [94m0.2243[0m     +  13.0215
     14   0.1925   0.7279        0.2569       0.9323        [94m0.2227[0m     +  13.7025
     15   0.1906   0.7272        0.2574       0.9299        0.2230        12.9789
     16   0.1931   0.7272        0.2563       0.9311        0.2256        13.4061
     17   0.1858   0.7250        0.2561       0.9311        0.2279        13.1881
     18   0.1856   0.7261        [35m0.2545[0m       0.9299        0.2232        13.2611
     19   0.1863   0.7218        0.2563       0.9299        0.2232        13.2144
     20   [36m0.2092[0m   0.7251        0.2583       0.9262        0.2311        13.1364
     21   0.1979   0.7257        0.2589       0.9311        0.2232        13.0544
     22   0.1934   0.7260        [35m0.2544[0m       0.9323        0.2377        12.9939
     23   0.1952   0.7266        0.2546       0.9311        0.2295        12.8740
Stopping since valid_loss has not improved in the last 10 epochs.
[32m[I 2023-05-05 08:35:09,098][0m Trial 584 finished with value: 0.22273879400043417 and parameters: {'lr': 0.0010633786038929869, 'dropout': 0.5437053547119592, 'd_model_multiplier': 4, 'num_layers': 2, 'n_heads': 32, 'dim_feedforward': 336, 'batch_size': 19, 'pos_encoding': 'learnable', 'activation': 'relu', 'norm': 'LayerNorm', 'optimizer_name': 'AdamW', 'weight_decay': 0.1, 'top_n_features': 222}. Best is trial 246 with value: 0.16447311791139763.[0m
[FileBasedDataset] Initializing dataset...
	Examples: 8264
	Features: 87
	Max length: 315
Standard scalar turned ON, loading params from cache
[FileBasedDataset] Dataset initialization complete
  epoch    auprc    auroc    train_loss    valid_acc    valid_loss    cp      dur
-------  -------  -------  ------------  -----------  ------------  ----  -------
      1   [36m0.2876[0m   [32m0.7362[0m        [35m0.3353[0m       [31m0.9214[0m        [94m0.2434[0m     +  19.2347
      2   [36m0.3214[0m   [32m0.7874[0m        [35m0.2423[0m       [31m0.9238[0m        [94m0.2292[0m     +  19.3850
      3   [36m0.3318[0m   [32m0.8023[0m        [35m0.2371[0m       0.9214        [94m0.2263[0m     +  19.5460
      4   [36m0.3380[0m   [32m0.8114[0m        [35m0.2341[0m       0.9226        [94m0.2248[0m     +  19.6576
      5   0.3120   [32m0.8119[0m        [35m0.2321[0m       0.9226        0.2265        19.6513
      6   0.3210   0.8114        [35m0.2309[0m       0.9166        0.2277        19.5494
      7   0.3140   0.8089        [35m0.2281[0m       0.9178        0.2303        19.4407
      8   0.3057   0.8045        [35m0.2272[0m       0.9141        0.2330        19.5711
      9   0.3059   0.8022        [35m0.2249[0m       0.9141        0.2355        19.5595
     10   0.2960   0.7969        [35m0.2230[0m       0.9141        0.2388        19.5552
     11   0.2935   0.7972        [35m0.2213[0m       0.9117        0.2411        19.4985
     12   0.2700   0.7877        [35m0.2183[0m       0.9117        0.2486        19.6682
     13   0.2691   0.7751        [35m0.2160[0m       0.9117        0.2499        19.5066
Stopping since valid_loss has not improved in the last 10 epochs.
[32m[I 2023-05-05 08:39:43,892][0m Trial 585 finished with value: 0.22484064466143172 and parameters: {'lr': 2.3379649117396127e-05, 'dropout': 0.39722172996644356, 'd_model_multiplier': 32, 'num_layers': 4, 'n_heads': 16, 'dim_feedforward': 417, 'batch_size': 24, 'pos_encoding': 'learnable', 'activation': 'relu', 'norm': 'LayerNorm', 'optimizer_name': 'RAdam', 'weight_decay': 0.1, 'top_n_features': 87}. Best is trial 246 with value: 0.16447311791139763.[0m
[FileBasedDataset] Initializing dataset...
	Examples: 8264
	Features: 184
	Max length: 315
Standard scalar turned ON, loading params from cache
[FileBasedDataset] Dataset initialization complete
  epoch    auprc    auroc    train_loss    valid_acc    valid_loss    cp      dur
-------  -------  -------  ------------  -----------  ------------  ----  -------
      1   [36m0.1347[0m   [32m0.6801[0m        [35m0.2812[0m       [31m0.9250[0m        [94m0.2697[0m     +  17.4367
      2   [36m0.2223[0m   [32m0.7638[0m        [35m0.2515[0m       0.9238        [94m0.2640[0m     +  16.7256
      3   [36m0.2261[0m   0.7547        [35m0.2471[0m       0.9214        [94m0.2605[0m     +  16.9881
      4   [36m0.2490[0m   [32m0.7756[0m        [35m0.2415[0m       0.9178        0.2625        17.3116
      5   [36m0.2566[0m   [32m0.7793[0m        [35m0.2394[0m       0.9202        0.2681        17.0541
      6   [36m0.2616[0m   [32m0.7886[0m        [35m0.2360[0m       0.9214        0.2615        16.9676
      7   0.2418   0.7612        [35m0.2322[0m       0.9238        0.2606        17.1327
      8   0.2585   0.7768        [35m0.2304[0m       0.9202        [94m0.2592[0m     +  17.0536
      9   [36m0.2718[0m   0.7785        [35m0.2289[0m       0.9238        0.2651        17.0060
     10   0.2492   0.7682        [35m0.2284[0m       0.9202        [94m0.2580[0m     +  17.2763
     11   0.2417   0.7620        [35m0.2281[0m       0.9226        0.2807        16.9942
     12   0.2507   0.7829        0.2334       0.9226        [94m0.2559[0m     +  17.4290
     13   0.2463   0.7862        0.2319       0.9190        [94m0.2519[0m     +  16.8846
     14   0.2516   [32m0.7941[0m        [35m0.2276[0m       0.9202        [94m0.2510[0m     +  17.0988
     15   0.2494   0.7572        [35m0.2232[0m       0.9250        0.2520        17.1814
     16   0.2528   0.7749        0.2278       0.9238        [94m0.2507[0m     +  17.1120
     17   0.2612   0.7840        0.2271       0.9214        0.2541        17.1431
     18   0.2562   0.7802        0.2281       0.9226        [94m0.2502[0m     +  17.2317
     19   0.2595   0.7866        0.2250       0.9250        [94m0.2490[0m     +  17.2617
     20   0.2529   0.7912        0.2258       0.9250        0.2500        17.1502
     21   0.2432   0.7804        [35m0.2223[0m       0.9214        0.2499        17.0372
     22   0.2423   [32m0.8030[0m        [35m0.2216[0m       0.9190        [94m0.2456[0m     +  17.4650
     23   0.2582   [32m0.8034[0m        0.2240       0.9238        [94m0.2440[0m     +  17.1243
     24   [36m0.2755[0m   0.7949        0.2228       [31m0.9274[0m        [94m0.2424[0m     +  17.3722
     25   0.2641   0.7966        [35m0.2211[0m       0.9274        0.2444        17.0451
     26   0.2603   0.7828        [35m0.2206[0m       0.9274        0.2434        17.3046
     27   0.2507   0.7809        0.2232       0.9226        0.2461        17.1125
     28   0.2702   0.7950        [35m0.2196[0m       0.9262        [94m0.2389[0m     +  17.2516
     29   0.2744   0.7763        [35m0.2163[0m       0.9274        0.2497        17.4785
     30   0.2580   0.7894        0.2203       0.9250        0.2450        17.2680
     31   0.2581   0.7843        0.2197       0.9262        0.2431        17.2903
     32   0.2671   0.8020        0.2212       0.9262        0.2442        17.0001
     33   0.2528   0.7953        0.2195       0.9214        0.2455        17.2095
     34   0.2512   0.7923        0.2165       0.9214        0.2480        17.1338
     35   0.2373   0.7777        0.2169       0.9226        0.2513        17.5359
     36   0.2445   0.7772        0.2186       0.9202        0.2523        17.2901
     37   0.2460   0.7925        0.2176       0.9214        0.2440        16.8745
Stopping since valid_loss has not improved in the last 10 epochs.
[32m[I 2023-05-05 08:50:37,603][0m Trial 586 finished with value: 0.23888391998687708 and parameters: {'lr': 0.0007475461376902786, 'dropout': 0.3504936390068972, 'd_model_multiplier': 4, 'num_layers': 3, 'n_heads': 32, 'dim_feedforward': 355, 'batch_size': 72, 'pos_encoding': 'fixed', 'activation': 'relu', 'norm': 'LayerNorm', 'optimizer_name': 'AdamW', 'weight_decay': 0.1, 'top_n_features': 184}. Best is trial 246 with value: 0.16447311791139763.[0m
[FileBasedDataset] Initializing dataset...
	Examples: 8264
	Features: 70
	Max length: 315
Standard scalar turned ON, loading params from cache
[FileBasedDataset] Dataset initialization complete
  epoch    auprc    auroc    train_loss    valid_acc    valid_loss    cp     dur
-------  -------  -------  ------------  -----------  ------------  ----  ------
      1   [36m0.0807[0m   [32m0.4763[0m        [35m0.4576[0m       [31m0.9190[0m        [94m0.2981[0m     +  9.4753
      2   [36m0.2253[0m   [32m0.6948[0m        [35m0.2783[0m       0.9190        [94m0.2613[0m     +  9.4308
      3   [36m0.2513[0m   [32m0.7455[0m        [35m0.2536[0m       [31m0.9202[0m        [94m0.2564[0m     +  9.5584
      4   [36m0.2702[0m   [32m0.7668[0m        [35m0.2459[0m       0.9166        [94m0.2537[0m     +  9.8229
      5   0.2696   [32m0.7781[0m        [35m0.2430[0m       0.9190        [94m0.2534[0m     +  9.6897
      6   [36m0.2798[0m   [32m0.7846[0m        [35m0.2388[0m       0.9202        0.2535        9.7607
      7   [36m0.2820[0m   [32m0.7870[0m        [35m0.2378[0m       0.9202        0.2556        9.4495
      8   0.2819   [32m0.7883[0m        [35m0.2371[0m       0.9154        0.2570        9.5460
      9   [36m0.2823[0m   0.7873        [35m0.2350[0m       0.9117        0.2597        9.5200
     10   0.2797   0.7857        [35m0.2348[0m       0.9129        0.2613        9.5307
     11   [36m0.2845[0m   0.7863        [35m0.2325[0m       0.9093        0.2636        9.8871
     12   [36m0.2847[0m   0.7869        0.2335       0.9105        0.2650        9.4944
     13   [36m0.2863[0m   0.7869        0.2339       0.9117        0.2656        9.8339
     14   [36m0.2870[0m   [32m0.7888[0m        [35m0.2321[0m       0.9117        0.2659        9.9723
Stopping since valid_loss has not improved in the last 10 epochs.
