[32m[I 2023-05-03 19:26:05,131][0m Trial 372 finished with value: 0.22003212318436988 and parameters: {'lr': 2.5012269308705643e-06, 'dropout': 0.3144171618079782, 'd_model_multiplier': 64, 'num_layers': 6, 'n_heads': 32, 'dim_feedforward': 357, 'batch_size': 53, 'pos_encoding': 'fixed', 'activation': 'relu', 'norm': 'LayerNorm', 'optimizer_name': 'AdamW', 'weight_decay': 0.001, 'top_n_features': 59}. Best is trial 246 with value: 0.16447311791139763.[0m
[FileBasedDataset] Initializing dataset...
	Examples: 8264
	Features: 62
	Max length: 315
Standard scalar turned ON, loading params from cache
[FileBasedDataset] Dataset initialization complete
Warning, assumed runtime error: CUDA out of memory. Tried to allocate 752.00 MiB (GPU 0; 23.70 GiB total capacity; 21.33 GiB already allocated; 75.25 MiB free; 22.53 GiB reserved in total by PyTorch) If reserved memory is >> allocated memory try setting max_split_size_mb to avoid fragmentation.  See documentation for Memory Management and PYTORCH_CUDA_ALLOC_CONF
[32m[I 2023-05-03 19:26:09,682][0m Trial 373 finished with value: 100.0 and parameters: {'lr': 3.981464492558105e-06, 'dropout': 0.32693906244013954, 'd_model_multiplier': 64, 'num_layers': 7, 'n_heads': 32, 'dim_feedforward': 347, 'batch_size': 62, 'pos_encoding': 'fixed', 'activation': 'relu', 'norm': 'LayerNorm', 'optimizer_name': 'AdamW', 'weight_decay': 0.001, 'top_n_features': 62}. Best is trial 246 with value: 0.16447311791139763.[0m
[FileBasedDataset] Initializing dataset...
	Examples: 8264
	Features: 66
	Max length: 315
Standard scalar turned ON, loading params from cache
[FileBasedDataset] Dataset initialization complete
  epoch    auprc    auroc    train_loss    valid_acc    valid_loss    cp       dur
-------  -------  -------  ------------  -----------  ------------  ----  --------
      1   [36m0.3387[0m   [32m0.8073[0m        [35m0.2575[0m       [31m0.9214[0m        [94m0.2314[0m     +  121.2701
      2   [36m0.3496[0m   [32m0.8094[0m        [35m0.2418[0m       [31m0.9250[0m        [94m0.2294[0m     +  121.6332
      3   0.3413   [32m0.8180[0m        [35m0.2373[0m       0.9238        0.2296        121.4384
      4   0.3386   [32m0.8184[0m        [35m0.2336[0m       0.9226        0.2356        121.2307
      5   0.3322   [32m0.8217[0m        [35m0.2299[0m       0.9238        0.2338        121.3031
      6   0.3345   0.8215        [35m0.2263[0m       0.9214        0.2384        121.4105
      7   0.3479   [32m0.8301[0m        [35m0.2217[0m       0.9202        0.2323        121.4243
      8   0.3261   0.8277        [35m0.2200[0m       0.9166        0.2418        121.2989
      9   0.3397   [32m0.8320[0m        [35m0.2158[0m       0.9202        0.2414        121.5039
     10   0.3478   [32m0.8400[0m        [35m0.2138[0m       0.9202        0.2431        121.5483
     11   0.3362   0.8340        [35m0.2111[0m       0.9214        0.2422        121.6320
Stopping since valid_loss has not improved in the last 10 epochs.
[32m[I 2023-05-03 19:50:33,303][0m Trial 374 finished with value: 0.22939993182091356 and parameters: {'lr': 1.7159539454200077e-05, 'dropout': 0.33294823225226866, 'd_model_multiplier': 64, 'num_layers': 6, 'n_heads': 32, 'dim_feedforward': 331, 'batch_size': 59, 'pos_encoding': 'fixed', 'activation': 'relu', 'norm': 'LayerNorm', 'optimizer_name': 'AdamW', 'weight_decay': 0.001, 'top_n_features': 66}. Best is trial 246 with value: 0.16447311791139763.[0m
[FileBasedDataset] Initializing dataset...
	Examples: 8264
	Features: 55
	Max length: 315
Standard scalar turned ON, loading params from cache
[FileBasedDataset] Dataset initialization complete
  epoch    auprc    auroc    train_loss    valid_acc    valid_loss    cp       dur
-------  -------  -------  ------------  -----------  ------------  ----  --------
      1   [36m0.2674[0m   [32m0.7654[0m        [35m0.2971[0m       [31m0.9045[0m        [94m0.2724[0m     +  104.2072
      2   0.2644   [32m0.7701[0m        [35m0.2321[0m       0.9021        0.2754        104.2403
      3   0.2620   0.7667        [35m0.2306[0m       0.9008        0.2764        104.0469
      4   0.2630   0.7634        [35m0.2294[0m       0.9033        0.2778        104.3192
      5   [36m0.2750[0m   0.7624        [35m0.2290[0m       [31m0.9057[0m        0.2769        104.2837
      6   [36m0.2761[0m   0.7667        [35m0.2263[0m       0.9057        0.2751        104.3852
      7   [36m0.2828[0m   0.7610        [35m0.2241[0m       0.9057        0.2773        103.9879
      8   0.2800   0.7607        [35m0.2235[0m       0.9057        0.2761        104.3738
      9   0.2804   0.7559        [35m0.2223[0m       0.9021        0.2793        104.1872
     10   [36m0.2858[0m   0.7501        [35m0.2188[0m       0.9021        0.2803        104.1096
Stopping since valid_loss has not improved in the last 10 epochs.
[32m[I 2023-05-03 20:09:43,036][0m Trial 375 finished with value: 0.2723743405909319 and parameters: {'lr': 7.910899331267951e-06, 'dropout': 0.3056288731235214, 'd_model_multiplier': 64, 'num_layers': 5, 'n_heads': 32, 'dim_feedforward': 325, 'batch_size': 21, 'pos_encoding': 'fixed', 'activation': 'relu', 'norm': 'LayerNorm', 'optimizer_name': 'RAdam', 'weight_decay': 0.001, 'top_n_features': 55}. Best is trial 246 with value: 0.16447311791139763.[0m
[FileBasedDataset] Initializing dataset...
	Examples: 8264
	Features: 68
	Max length: 315
Standard scalar turned ON, loading params from cache
[FileBasedDataset] Dataset initialization complete
  epoch    auprc    auroc    train_loss    valid_acc    valid_loss    cp       dur
-------  -------  -------  ------------  -----------  ------------  ----  --------
      1   [36m0.2999[0m   [32m0.7865[0m        [35m0.2800[0m       [31m0.9202[0m        [94m0.2338[0m     +  102.3509
      2   [36m0.3333[0m   [32m0.8048[0m        [35m0.2336[0m       [31m0.9238[0m        [94m0.2283[0m     +  102.5268
      3   0.3297   [32m0.8099[0m        [35m0.2304[0m       [31m0.9250[0m        [94m0.2246[0m     +  102.8579
      4   [36m0.3426[0m   [32m0.8160[0m        [35m0.2273[0m       0.9250        [94m0.2233[0m     +  102.9034
      5   [36m0.3435[0m   [32m0.8199[0m        [35m0.2258[0m       0.9250        [94m0.2218[0m     +  102.3988
      6   [36m0.3452[0m   [32m0.8240[0m        [35m0.2244[0m       0.9238        [94m0.2209[0m     +  102.9136
      7   [36m0.3485[0m   [32m0.8282[0m        [35m0.2232[0m       0.9250        [94m0.2193[0m     +  102.5531
      8   0.3385   [32m0.8285[0m        [35m0.2217[0m       0.9238        [94m0.2187[0m     +  102.7378
      9   0.3477   [32m0.8308[0m        [35m0.2199[0m       0.9238        [94m0.2182[0m     +  102.6573
     10   [36m0.3505[0m   [32m0.8338[0m        [35m0.2180[0m       0.9202        [94m0.2174[0m     +  102.7280
     11   [36m0.3509[0m   [32m0.8347[0m        [35m0.2164[0m       0.9238        0.2176        102.5840
     12   0.3466   [32m0.8362[0m        [35m0.2154[0m       0.9226        [94m0.2171[0m     +  102.5315
     13   0.3498   [32m0.8384[0m        [35m0.2138[0m       0.9214        0.2174        102.8191
     14   0.3477   [32m0.8395[0m        [35m0.2119[0m       0.9226        [94m0.2164[0m     +  102.8434
     15   0.3445   [32m0.8400[0m        [35m0.2100[0m       0.9214        0.2169        102.5543
     16   0.3453   [32m0.8403[0m        [35m0.2099[0m       0.9226        0.2166        102.9020
     17   0.3444   [32m0.8422[0m        [35m0.2073[0m       0.9190        [94m0.2162[0m     +  102.9068
     18   0.3281   0.8417        0.2074       0.9190        0.2178        102.5286
     19   0.3328   [32m0.8424[0m        [35m0.2056[0m       0.9190        0.2173        102.8468
     20   0.3294   0.8413        [35m0.2038[0m       0.9202        0.2188        102.8645
     21   0.3298   0.8397        0.2038       0.9178        0.2192        102.6898
     22   0.3310   0.8421        [35m0.2015[0m       0.9154        0.2193        103.1202
     23   0.3355   0.8393        [35m0.2004[0m       0.9154        0.2197        103.1821
     24   0.3319   0.8390        [35m0.2002[0m       0.9154        0.2208        102.9697
     25   0.3290   0.8355        [35m0.1982[0m       0.9141        0.2225        102.9893
     26   0.3305   0.8395        [35m0.1967[0m       0.9166        0.2221        102.9645
Stopping since valid_loss has not improved in the last 10 epochs.
[32m[I 2023-05-03 20:56:28,845][0m Trial 376 finished with value: 0.21615294868885535 and parameters: {'lr': 2.7959828630489947e-06, 'dropout': 0.2768602459051122, 'd_model_multiplier': 64, 'num_layers': 5, 'n_heads': 32, 'dim_feedforward': 364, 'batch_size': 57, 'pos_encoding': 'fixed', 'activation': 'relu', 'norm': 'LayerNorm', 'optimizer_name': 'AdamW', 'weight_decay': 0.1, 'top_n_features': 68}. Best is trial 246 with value: 0.16447311791139763.[0m
[FileBasedDataset] Initializing dataset...
	Examples: 8264
	Features: 58
	Max length: 315
Standard scalar turned ON, loading params from cache
[FileBasedDataset] Dataset initialization complete
Warning, assumed runtime error: CUDA out of memory. Tried to allocate 1.09 GiB (GPU 0; 23.70 GiB total capacity; 21.31 GiB already allocated; 75.25 MiB free; 22.53 GiB reserved in total by PyTorch) If reserved memory is >> allocated memory try setting max_split_size_mb to avoid fragmentation.  See documentation for Memory Management and PYTORCH_CUDA_ALLOC_CONF
[32m[I 2023-05-03 20:56:33,143][0m Trial 377 finished with value: 100.0 and parameters: {'lr': 4.095251691495414e-06, 'dropout': 0.3016471174057487, 'd_model_multiplier': 64, 'num_layers': 6, 'n_heads': 64, 'dim_feedforward': 342, 'batch_size': 46, 'pos_encoding': 'fixed', 'activation': 'relu', 'norm': 'LayerNorm', 'optimizer_name': 'RAdam', 'weight_decay': 0.1, 'top_n_features': 58}. Best is trial 246 with value: 0.16447311791139763.[0m
[FileBasedDataset] Initializing dataset...
	Examples: 8264
	Features: 75
	Max length: 315
Standard scalar turned ON, loading params from cache
[FileBasedDataset] Dataset initialization complete
  epoch    auprc    auroc    train_loss    valid_acc    valid_loss    cp      dur
-------  -------  -------  ------------  -----------  ------------  ----  -------
      1   [36m0.2692[0m   [32m0.7886[0m        [35m0.2773[0m       [31m0.9262[0m        [94m0.2227[0m     +  82.8264
      2   [36m0.2772[0m   0.7757        [35m0.2372[0m       0.9262        0.2327        82.7280
      3   [36m0.2789[0m   0.7790        [35m0.2331[0m       0.9190        0.2345        82.7015
      4   0.2768   0.7795        [35m0.2317[0m       0.9166        0.2378        83.1169
      5   0.2726   0.7819        [35m0.2282[0m       0.9093        0.2429        82.8783
      6   0.2674   0.7817        [35m0.2265[0m       0.9105        0.2436        82.9059
      7   0.2689   0.7810        [35m0.2250[0m       0.9105        0.2440        82.7900
      8   0.2701   0.7806        [35m0.2226[0m       0.9081        0.2474        82.9103
      9   0.2755   0.7800        [35m0.2222[0m       0.9093        0.2477        82.7338
     10   0.2698   0.7776        [35m0.2214[0m       0.9045        0.2468        82.6657
Stopping since valid_loss has not improved in the last 10 epochs.
[32m[I 2023-05-03 21:11:46,961][0m Trial 378 finished with value: 0.22273093651182851 and parameters: {'lr': 5.6961702318667865e-06, 'dropout': 0.41156529772666506, 'd_model_multiplier': 64, 'num_layers': 4, 'n_heads': 32, 'dim_feedforward': 336, 'batch_size': 66, 'pos_encoding': 'fixed', 'activation': 'relu', 'norm': 'LayerNorm', 'optimizer_name': 'AdamW', 'weight_decay': 0.001, 'top_n_features': 75}. Best is trial 246 with value: 0.16447311791139763.[0m
[FileBasedDataset] Initializing dataset...
	Examples: 8264
	Features: 88
	Max length: 315
Standard scalar turned ON, loading params from cache
[FileBasedDataset] Dataset initialization complete
  epoch    auprc    auroc    train_loss    valid_acc    valid_loss    cp      dur
-------  -------  -------  ------------  -----------  ------------  ----  -------
      1   [36m0.0712[0m   [32m0.3084[0m        [35m0.6499[0m       [31m0.9190[0m        [94m0.5764[0m     +  31.4922
      2   0.0643   0.3021        [35m0.5193[0m       0.9190        [94m0.4476[0m     +  31.7831
      3   [36m0.0794[0m   [32m0.3535[0m        [35m0.4073[0m       0.9190        [94m0.3589[0m     +  32.0116
      4   [36m0.1294[0m   [32m0.4856[0m        [35m0.3346[0m       0.9190        [94m0.3066[0m     +  31.8884
      5   [36m0.1594[0m   [32m0.5759[0m        [35m0.2930[0m       0.9190        [94m0.2824[0m     +  31.8598
      6   [36m0.1679[0m   [32m0.6308[0m        [35m0.2738[0m       0.9190        [94m0.2712[0m     +  32.1162
      7   [36m0.1829[0m   [32m0.6653[0m        [35m0.2642[0m       0.9190        [94m0.2651[0m     +  32.1328
      8   [36m0.1879[0m   [32m0.6857[0m        [35m0.2573[0m       0.9190        [94m0.2611[0m     +  32.1492
      9   [36m0.1968[0m   [32m0.7067[0m        [35m0.2537[0m       0.9190        [94m0.2577[0m     +  32.1677
     10   [36m0.2195[0m   [32m0.7298[0m        [35m0.2491[0m       0.9190        [94m0.2539[0m     +  32.1564
     11   [36m0.2565[0m   [32m0.7609[0m        [35m0.2454[0m       0.9190        [94m0.2480[0m     +  31.8688
     12   [36m0.2950[0m   [32m0.7818[0m        [35m0.2408[0m       0.9178        [94m0.2422[0m     +  31.8922
     13   [36m0.3114[0m   [32m0.7862[0m        [35m0.2365[0m       0.9190        [94m0.2405[0m     +  32.1320
     14   [36m0.3251[0m   [32m0.7900[0m        [35m0.2348[0m       [31m0.9202[0m        [94m0.2380[0m     +  31.8234
     15   [36m0.3335[0m   [32m0.7921[0m        [35m0.2340[0m       [31m0.9226[0m        [94m0.2358[0m     +  31.8152
     16   [36m0.3389[0m   [32m0.7931[0m        [35m0.2321[0m       0.9226        0.2360        31.9464
     17   [36m0.3454[0m   [32m0.7958[0m        [35m0.2300[0m       [31m0.9238[0m        [94m0.2348[0m     +  32.0031
     18   [36m0.3544[0m   [32m0.7988[0m        [35m0.2296[0m       0.9238        [94m0.2327[0m     +  32.2535
     19   [36m0.3651[0m   [32m0.8000[0m        [35m0.2292[0m       0.9226        0.2329        32.1575
     20   [36m0.3685[0m   [32m0.8025[0m        [35m0.2292[0m       [31m0.9262[0m        [94m0.2310[0m     +  32.2321
     21   0.3679   [32m0.8036[0m        [35m0.2284[0m       0.9262        0.2320        31.9204
     22   [36m0.3690[0m   [32m0.8041[0m        0.2286       0.9250        0.2317        31.9390
     23   [36m0.3729[0m   [32m0.8048[0m        [35m0.2275[0m       0.9238        0.2319        32.0039
     24   [36m0.3766[0m   [32m0.8058[0m        [35m0.2271[0m       0.9262        0.2313        32.1366
     25   [36m0.3768[0m   [32m0.8077[0m        [35m0.2261[0m       0.9250        [94m0.2306[0m     +  31.8389
     26   [36m0.3780[0m   [32m0.8079[0m        [35m0.2258[0m       0.9250        0.2312        31.3130
     27   [36m0.3791[0m   0.8078        0.2261       0.9238        [94m0.2304[0m     +  32.0971
     28   0.3765   [32m0.8097[0m        0.2258       0.9238        0.2314        31.9001
     29   [36m0.3838[0m   [32m0.8122[0m        [35m0.2239[0m       0.9238        [94m0.2299[0m     +  31.7168
     30   [36m0.3883[0m   [32m0.8137[0m        0.2241       0.9226        0.2303        32.2025
     31   0.3820   [32m0.8148[0m        0.2259       0.9238        [94m0.2291[0m     +  31.9750
     32   0.3831   [32m0.8156[0m        0.2248       0.9214        0.2295        32.1974
     33   0.3853   [32m0.8161[0m        [35m0.2231[0m       0.9226        0.2299        31.6373
     34   0.3799   [32m0.8186[0m        [35m0.2228[0m       0.9226        [94m0.2290[0m     +  32.0834
     35   0.3835   0.8174        [35m0.2223[0m       0.9226        0.2294        32.1071
     36   0.3785   [32m0.8191[0m        [35m0.2216[0m       0.9214        0.2301        31.5024
     37   0.3801   0.8190        [35m0.2212[0m       0.9214        0.2290        32.4652
     38   0.3819   [32m0.8206[0m        0.2218       0.9226        [94m0.2274[0m     +  31.9732
     39   0.3816   [32m0.8210[0m        [35m0.2205[0m       0.9214        0.2286        31.5090
     40   0.3855   [32m0.8233[0m        [35m0.2202[0m       0.9226        0.2284        31.9812
     41   0.3850   0.8232        [35m0.2200[0m       0.9226        0.2275        32.5671
     42   0.3829   0.8227        [35m0.2197[0m       0.9226        [94m0.2271[0m     +  32.1211
     43   0.3806   0.8229        [35m0.2191[0m       0.9226        [94m0.2270[0m     +  32.5565
     44   0.3830   [32m0.8244[0m        [35m0.2177[0m       0.9226        0.2271        32.6306
     45   0.3791   [32m0.8253[0m        [35m0.2177[0m       0.9226        0.2273        32.0933
     46   0.3758   0.8253        0.2187       0.9226        0.2279        31.8768
     47   0.3753   0.8248        0.2182       0.9226        [94m0.2268[0m     +  32.0658
     48   0.3800   [32m0.8264[0m        0.2185       0.9226        [94m0.2258[0m     +  31.9932
     49   0.3716   [32m0.8278[0m        [35m0.2166[0m       0.9226        0.2271        31.6509
     50   0.3726   0.8250        0.2172       0.9226        0.2269        31.9499
[32m[I 2023-05-03 21:38:30,524][0m Trial 379 finished with value: 0.2258078725118879 and parameters: {'lr': 1.246908227653394e-05, 'dropout': 0.3299572465911491, 'd_model_multiplier': 4, 'num_layers': 7, 'n_heads': 32, 'dim_feedforward': 350, 'batch_size': 95, 'pos_encoding': 'fixed', 'activation': 'relu', 'norm': 'LayerNorm', 'optimizer_name': 'RAdam', 'weight_decay': 0.1, 'top_n_features': 88}. Best is trial 246 with value: 0.16447311791139763.[0m
[FileBasedDataset] Initializing dataset...
	Examples: 8264
	Features: 63
	Max length: 315
Standard scalar turned ON, loading params from cache
[FileBasedDataset] Dataset initialization complete
  epoch    auprc    auroc    train_loss    valid_acc    valid_loss    cp      dur
-------  -------  -------  ------------  -----------  ------------  ----  -------
      1   [36m0.0575[0m   [32m0.4294[0m        [35m0.5021[0m       [31m0.9311[0m        [94m0.2874[0m     +  23.5166
      2   [36m0.1422[0m   [32m0.6556[0m        [35m0.2717[0m       0.9299        [94m0.2433[0m     +  23.7112
      3   [36m0.1692[0m   [32m0.7144[0m        [35m0.2462[0m       0.9262        [94m0.2373[0m     +  23.4667
      4   [36m0.1797[0m   [32m0.7357[0m        [35m0.2369[0m       0.9190        0.2379        23.3356
      5   [36m0.1862[0m   [32m0.7463[0m        [35m0.2327[0m       0.9214        0.2406        23.9490
      6   [36m0.1892[0m   [32m0.7542[0m        [35m0.2310[0m       0.9178        0.2377        23.7521
      7   [36m0.1920[0m   [32m0.7618[0m        [35m0.2284[0m       0.9178        0.2413        23.7989
      8   [36m0.1977[0m   [32m0.7683[0m        [35m0.2283[0m       0.9202        0.2394        23.9862
      9   [36m0.1977[0m   [32m0.7737[0m        [35m0.2257[0m       0.9190        0.2413        23.9085
     10   [36m0.1991[0m   [32m0.7764[0m        [35m0.2248[0m       0.9190        0.2390        23.8243
     11   [36m0.2012[0m   0.7761        [35m0.2238[0m       0.9190        0.2418        23.8961
     12   0.2005   [32m0.7777[0m        [35m0.2222[0m       0.9166        0.2423        23.7722
Stopping since valid_loss has not improved in the last 10 epochs.
