[32m[I 2023-01-09 05:55:02,445][0m Trial 92 finished with value: 0.27392898973643515 and parameters: {'lr': 3.950367928025081e-08, 'dropout': 0.6413227923094432, 'd_model_multiplier': 16, 'num_layers': 3, 'n_heads': 64, 'dim_feedforward': 474, 'batch_size': 51, 'pos_encoding': 'fixed', 'activation': 'gelu', 'norm': 'BatchNorm', 'optimizer_name': 'PlainRAdam', 'weight_decay': 0}. Best is trial 48 with value: 0.3954917461755389.[0m
[EnsembleDataset] Initializing dataset...
	Examples: 27964
	Features: 621
	Max length: 316
[EnsembleDataset] Dataset initialization complete
  epoch    auprc    auroc    train_loss    valid_loss    cp      dur
-------  -------  -------  ------------  ------------  ----  -------
      1   [36m0.2614[0m   [32m0.8321[0m        [35m0.1005[0m        [31m0.0636[0m     +  32.2674
      2   [36m0.2627[0m   [32m0.8331[0m        [35m0.0962[0m        0.0641        32.3406
      3   0.2626   0.8327        [35m0.0956[0m        [31m0.0607[0m     +  32.7114
      4   0.2583   0.8329        0.0962        0.0662        31.5409
      5   0.2592   0.8322        [35m0.0926[0m        0.0645        32.1961
Stopping since valid_loss has not improved in the last 3 epochs.
[32m[I 2023-01-09 06:05:44,762][0m Trial 93 finished with value: 0.2627320490097237 and parameters: {'lr': 5.806861344149473e-09, 'dropout': 0.204982267008841, 'd_model_multiplier': 16, 'num_layers': 5, 'n_heads': 8, 'dim_feedforward': 462, 'batch_size': 29, 'pos_encoding': 'fixed', 'activation': 'gelu', 'norm': 'BatchNorm', 'optimizer_name': 'PlainRAdam', 'weight_decay': 0}. Best is trial 48 with value: 0.3954917461755389.[0m
[EnsembleDataset] Initializing dataset...
	Examples: 27964
	Features: 621
	Max length: 316
[EnsembleDataset] Dataset initialization complete
Warning, assumed runtime error: CUDA out of memory. Tried to allocate 1.50 GiB (GPU 0; 23.70 GiB total capacity; 21.16 GiB already allocated; 247.31 MiB free; 22.38 GiB reserved in total by PyTorch) If reserved memory is >> allocated memory try setting max_split_size_mb to avoid fragmentation.  See documentation for Memory Management and PYTORCH_CUDA_ALLOC_CONF
[32m[I 2023-01-09 06:05:47,701][0m Trial 94 finished with value: 0.0 and parameters: {'lr': 1.1816588029962912e-09, 'dropout': 0.6671272643303521, 'd_model_multiplier': 16, 'num_layers': 6, 'n_heads': 64, 'dim_feedforward': 442, 'batch_size': 63, 'pos_encoding': 'fixed', 'activation': 'gelu', 'norm': 'BatchNorm', 'optimizer_name': 'PlainRAdam', 'weight_decay': 0}. Best is trial 48 with value: 0.3954917461755389.[0m
[EnsembleDataset] Initializing dataset...
	Examples: 27964
	Features: 621
	Max length: 316
[EnsembleDataset] Dataset initialization complete
  epoch    auprc    auroc    train_loss    valid_loss    cp      dur
-------  -------  -------  ------------  ------------  ----  -------
      1   [36m0.2708[0m   [32m0.7994[0m        [35m0.1276[0m        [31m0.0502[0m     +  55.5853
      2   0.2696   0.7976        [35m0.1194[0m        0.0503        54.9084
      3   0.2685   0.7946        0.1194        0.0503        54.8930
Stopping since valid_loss has not improved in the last 3 epochs.
[32m[I 2023-01-09 06:13:44,842][0m Trial 95 finished with value: 0.27082873412556707 and parameters: {'lr': 2.7564445345356815e-07, 'dropout': 0.6297465722647461, 'd_model_multiplier': 2, 'num_layers': 2, 'n_heads': 64, 'dim_feedforward': 419, 'batch_size': 92, 'pos_encoding': 'fixed', 'activation': 'gelu', 'norm': 'BatchNorm', 'optimizer_name': 'PlainRAdam', 'weight_decay': 0}. Best is trial 48 with value: 0.3954917461755389.[0m
[EnsembleDataset] Initializing dataset...
	Examples: 27964
	Features: 621
	Max length: 316
[EnsembleDataset] Dataset initialization complete
  epoch    auprc    auroc    train_loss    valid_loss    cp       dur
-------  -------  -------  ------------  ------------  ----  --------
      1   [36m0.2497[0m   [32m0.7888[0m        [35m0.0941[0m        [31m0.0880[0m     +  261.3522
      2   [36m0.2510[0m   [32m0.7902[0m        0.0964        0.0954        261.5189
      3   0.2501   0.7900        [35m0.0931[0m        0.1008        261.3487
Stopping since valid_loss has not improved in the last 3 epochs.
[32m[I 2023-01-09 06:35:21,876][0m Trial 96 finished with value: 0.25099342876338004 and parameters: {'lr': 7.722484048587495e-10, 'dropout': 0.29245960106548186, 'd_model_multiplier': 32, 'num_layers': 3, 'n_heads': 64, 'dim_feedforward': 486, 'batch_size': 21, 'pos_encoding': 'fixed', 'activation': 'gelu', 'norm': 'BatchNorm', 'optimizer_name': 'AdamW', 'weight_decay': 0}. Best is trial 48 with value: 0.3954917461755389.[0m
[EnsembleDataset] Initializing dataset...
	Examples: 27964
	Features: 621
	Max length: 316
[EnsembleDataset] Dataset initialization complete
  epoch    auprc    auroc    train_loss    valid_loss    cp      dur
-------  -------  -------  ------------  ------------  ----  -------
      1   [36m0.2698[0m   [32m0.8205[0m        [35m0.1419[0m        [31m0.0557[0m     +  27.6797
      2   [36m0.2700[0m   [32m0.8209[0m        [35m0.1319[0m        [31m0.0557[0m     +  28.9614
      3   0.2697   0.8205        0.1425        0.0557        28.7995
      4   0.2698   0.8204        0.1367        0.0557        28.4793
Stopping since valid_loss has not improved in the last 3 epochs.
[32m[I 2023-01-09 06:43:20,527][0m Trial 97 finished with value: 0.2700174404273999 and parameters: {'lr': 1.9767304873077293e-09, 'dropout': 0.6806821473165338, 'd_model_multiplier': 4, 'num_layers': 4, 'n_heads': 8, 'dim_feedforward': 409, 'batch_size': 66, 'pos_encoding': 'fixed', 'activation': 'gelu', 'norm': 'BatchNorm', 'optimizer_name': 'PlainRAdam', 'weight_decay': 0.001}. Best is trial 48 with value: 0.3954917461755389.[0m
[EnsembleDataset] Initializing dataset...
	Examples: 27964
	Features: 621
	Max length: 316
[EnsembleDataset] Dataset initialization complete
  epoch    auprc    auroc    train_loss    valid_loss    cp      dur
-------  -------  -------  ------------  ------------  ----  -------
      1   [36m0.3481[0m   [32m0.8355[0m        [35m0.1428[0m        [31m0.0494[0m     +  29.0760
      2   [36m0.3510[0m   [32m0.8358[0m        [35m0.1384[0m        [31m0.0493[0m     +  29.1951
      3   0.3492   0.8353        [35m0.1379[0m        0.0494        30.1915
      4   0.3485   0.8354        [35m0.1351[0m        0.0494        29.7497
Stopping since valid_loss has not improved in the last 3 epochs.
[32m[I 2023-01-09 06:51:23,325][0m Trial 98 finished with value: 0.35096225703558076 and parameters: {'lr': 4.2450454439833824e-09, 'dropout': 0.6995766930662015, 'd_model_multiplier': 32, 'num_layers': 3, 'n_heads': 8, 'dim_feedforward': 467, 'batch_size': 114, 'pos_encoding': 'fixed', 'activation': 'gelu', 'norm': 'BatchNorm', 'optimizer_name': 'RAdam', 'weight_decay': 0}. Best is trial 48 with value: 0.3954917461755389.[0m
[EnsembleDataset] Initializing dataset...
	Examples: 27964
	Features: 621
	Max length: 316
[EnsembleDataset] Dataset initialization complete
  epoch    auprc    auroc    train_loss    valid_loss    cp      dur
-------  -------  -------  ------------  ------------  ----  -------
      1   [36m0.3042[0m   [32m0.8249[0m        [35m0.0847[0m        [31m0.0695[0m     +  28.6853
      2   [36m0.3064[0m   [32m0.8252[0m        0.0931        0.0727        29.9926
      3   [36m0.3067[0m   0.8250        0.0854        0.0727        29.6687
Stopping since valid_loss has not improved in the last 3 epochs.
[32m[I 2023-01-09 06:57:36,886][0m Trial 99 finished with value: 0.30674776599269804 and parameters: {'lr': 4.054565472870243e-09, 'dropout': 0.12518254541033969, 'd_model_multiplier': 32, 'num_layers': 2, 'n_heads': 8, 'dim_feedforward': 465, 'batch_size': 116, 'pos_encoding': 'fixed', 'activation': 'gelu', 'norm': 'BatchNorm', 'optimizer_name': 'RAdam', 'weight_decay': 0}. Best is trial 48 with value: 0.3954917461755389.[0m
[EnsembleDataset] Initializing dataset...
	Examples: 27964
	Features: 621
	Max length: 316
[EnsembleDataset] Dataset initialization complete
  epoch    auprc    auroc    train_loss    valid_loss    cp      dur
-------  -------  -------  ------------  ------------  ----  -------
      1   [36m0.3252[0m   [32m0.8336[0m        [35m0.1208[0m        [31m0.0502[0m     +  28.9013
      2   [36m0.3265[0m   [32m0.8370[0m        [35m0.1118[0m        [31m0.0501[0m     +  28.8521
      3   0.3261   0.8345        0.1231        0.0506        28.9925
      4   0.3256   0.8343        0.1166        0.0506        28.9230
Stopping since valid_loss has not improved in the last 3 epochs.
[32m[I 2023-01-09 07:05:39,557][0m Trial 100 finished with value: 0.32654539423291346 and parameters: {'lr': 4.073271179908825e-10, 'dropout': 0.46096317839588574, 'd_model_multiplier': 32, 'num_layers': 1, 'n_heads': 8, 'dim_feedforward': 501, 'batch_size': 124, 'pos_encoding': 'fixed', 'activation': 'gelu', 'norm': 'BatchNorm', 'optimizer_name': 'RAdam', 'weight_decay': 0.01}. Best is trial 48 with value: 0.3954917461755389.[0m
[EnsembleDataset] Initializing dataset...
	Examples: 27964
	Features: 621
	Max length: 316
[EnsembleDataset] Dataset initialization complete
  epoch    auprc    auroc    train_loss    valid_loss    cp      dur
-------  -------  -------  ------------  ------------  ----  -------
      1   [36m0.2660[0m   [32m0.8081[0m        [35m0.1321[0m        [31m0.0526[0m     +  31.1936
      2   [36m0.2661[0m   0.8081        0.1506        [31m0.0521[0m     +  30.2998
      3   0.2660   0.8080        0.1392        0.0522        30.1051
      4   0.2660   [32m0.8081[0m        0.1400        0.0524        30.2734
Stopping since valid_loss has not improved in the last 3 epochs.
[32m[I 2023-01-09 07:13:48,611][0m Trial 101 finished with value: 0.26606271111742097 and parameters: {'lr': 1.4065295532496315e-08, 'dropout': 0.6942517218368198, 'd_model_multiplier': 32, 'num_layers': 3, 'n_heads': 8, 'dim_feedforward': 476, 'batch_size': 103, 'pos_encoding': 'fixed', 'activation': 'gelu', 'norm': 'BatchNorm', 'optimizer_name': 'RAdam', 'weight_decay': 0}. Best is trial 48 with value: 0.3954917461755389.[0m
[EnsembleDataset] Initializing dataset...
	Examples: 27964
	Features: 621
	Max length: 316
[EnsembleDataset] Dataset initialization complete
  epoch    auprc    auroc    train_loss    valid_loss    cp      dur
-------  -------  -------  ------------  ------------  ----  -------
      1   [36m0.3173[0m   [32m0.8150[0m        [35m0.1260[0m        [31m0.0506[0m     +  29.7913
      2   [36m0.3200[0m   [32m0.8154[0m        0.1292        [31m0.0505[0m     +  30.5432
      3   0.3182   0.8154        [35m0.1245[0m        0.0506        30.7379
      4   0.3185   [32m0.8157[0m        0.1349        0.0506        30.0535
Stopping since valid_loss has not improved in the last 3 epochs.
[32m[I 2023-01-09 07:21:59,888][0m Trial 102 finished with value: 0.32001425195280453 and parameters: {'lr': 3.069221010166869e-08, 'dropout': 0.6512298713307322, 'd_model_multiplier': 32, 'num_layers': 3, 'n_heads': 8, 'dim_feedforward': 384, 'batch_size': 84, 'pos_encoding': 'fixed', 'activation': 'gelu', 'norm': 'BatchNorm', 'optimizer_name': 'RAdam', 'weight_decay': 0}. Best is trial 48 with value: 0.3954917461755389.[0m
[EnsembleDataset] Initializing dataset...
	Examples: 27964
	Features: 621
	Max length: 316
[EnsembleDataset] Dataset initialization complete
  epoch    auprc    auroc    train_loss    valid_loss    cp      dur
-------  -------  -------  ------------  ------------  ----  -------
      1   [36m0.2275[0m   [32m0.7582[0m        [35m0.2600[0m        [31m0.5981[0m     +  29.6175
      2   [36m0.2736[0m   [32m0.8191[0m        [35m0.1256[0m        [31m0.0572[0m     +  29.0553
      3   [36m0.3124[0m   [32m0.8310[0m        [35m0.0577[0m        [31m0.0512[0m     +  29.9285
      4   [36m0.3141[0m   [32m0.8336[0m        [35m0.0517[0m        [31m0.0511[0m     +  29.1131
      5   [36m0.3179[0m   [32m0.8357[0m        [35m0.0513[0m        0.0520        29.4205
      6   0.3124   [32m0.8376[0m        0.0536        0.0513        30.0266
Stopping since valid_loss has not improved in the last 3 epochs.
[32m[I 2023-01-09 07:33:51,416][0m Trial 103 finished with value: 0.3178778927999883 and parameters: {'lr': 0.0019147694310898628, 'dropout': 0.3347770378305144, 'd_model_multiplier': 32, 'num_layers': 2, 'n_heads': 8, 'dim_feedforward': 458, 'batch_size': 135, 'pos_encoding': 'fixed', 'activation': 'gelu', 'norm': 'BatchNorm', 'optimizer_name': 'RAdam', 'weight_decay': 0}. Best is trial 48 with value: 0.3954917461755389.[0m
[EnsembleDataset] Initializing dataset...
	Examples: 27964
	Features: 621
	Max length: 316
[EnsembleDataset] Dataset initialization complete
  epoch    auprc    auroc    train_loss    valid_loss    cp      dur
-------  -------  -------  ------------  ------------  ----  -------
      1   [36m0.2814[0m   [32m0.8211[0m        [35m0.1326[0m        [31m0.0531[0m     +  46.1600
      2   [36m0.2823[0m   [32m0.8223[0m        [35m0.1287[0m        [31m0.0530[0m     +  46.2987
      3   0.2814   0.8218        0.1363        0.0531        46.1993
      4   [36m0.2829[0m   0.8215        0.1385        0.0530        45.9891
Stopping since valid_loss has not improved in the last 3 epochs.
[32m[I 2023-01-09 07:43:16,950][0m Trial 104 finished with value: 0.28292715010608965 and parameters: {'lr': 8.434680779996748e-09, 'dropout': 0.6683712549279244, 'd_model_multiplier': 64, 'num_layers': 4, 'n_heads': 8, 'dim_feedforward': 430, 'batch_size': 43, 'pos_encoding': 'fixed', 'activation': 'gelu', 'norm': 'BatchNorm', 'optimizer_name': 'PlainRAdam', 'weight_decay': 0}. Best is trial 48 with value: 0.3954917461755389.[0m
[EnsembleDataset] Initializing dataset...
	Examples: 27964
	Features: 621
	Max length: 316
[EnsembleDataset] Dataset initialization complete
  epoch    auprc    auroc    train_loss    valid_loss    cp      dur
-------  -------  -------  ------------  ------------  ----  -------
      1   [36m0.3504[0m   [32m0.8441[0m        [35m0.1626[0m        [31m0.0567[0m     +  66.3576
      2   [36m0.3509[0m   [32m0.8446[0m        [35m0.1424[0m        [31m0.0567[0m     +  66.3304
      3   [36m0.3510[0m   [32m0.8447[0m        0.1503        0.0567        66.2262
      4   0.3506   0.8445        0.1478        0.0567        66.2921
Stopping since valid_loss has not improved in the last 3 epochs.
[32m[I 2023-01-09 07:54:26,405][0m Trial 105 finished with value: 0.3510375225717655 and parameters: {'lr': 2.5255658704690623e-09, 'dropout': 0.685467045744762, 'd_model_multiplier': 8, 'num_layers': 2, 'n_heads': 64, 'dim_feedforward': 492, 'batch_size': 73, 'pos_encoding': 'fixed', 'activation': 'gelu', 'norm': 'BatchNorm', 'optimizer_name': 'RAdam', 'weight_decay': 0.1}. Best is trial 48 with value: 0.3954917461755389.[0m
[EnsembleDataset] Initializing dataset...
	Examples: 27964
	Features: 621
	Max length: 316
[EnsembleDataset] Dataset initialization complete
  epoch    auprc    auroc    train_loss    valid_loss    cp      dur
-------  -------  -------  ------------  ------------  ----  -------
      1   [36m0.2846[0m   [32m0.8450[0m        [35m0.1375[0m        [31m0.0515[0m     +  27.5734
      2   [36m0.2853[0m   [32m0.8455[0m        0.1418        [31m0.0515[0m     +  29.5144
      3   0.2852   0.8454        [35m0.1309[0m        [31m0.0515[0m     +  28.5680
      4   0.2851   0.8454        0.1598        0.0515        28.5887
      5   0.2849   0.8452        0.1444        0.0515        28.7677
Stopping since valid_loss has not improved in the last 3 epochs.
[32m[I 2023-01-09 08:04:18,168][0m Trial 106 finished with value: 0.28527501835504154 and parameters: {'lr': 1.2180056252333132e-09, 'dropout': 0.6885623907380141, 'd_model_multiplier': 8, 'num_layers': 2, 'n_heads': 8, 'dim_feedforward': 480, 'batch_size': 95, 'pos_encoding': 'fixed', 'activation': 'gelu', 'norm': 'BatchNorm', 'optimizer_name': 'RAdam', 'weight_decay': 0.1}. Best is trial 48 with value: 0.3954917461755389.[0m
[EnsembleDataset] Initializing dataset...
	Examples: 27964
	Features: 621
	Max length: 316
[EnsembleDataset] Dataset initialization complete
  epoch    auprc    auroc    train_loss    valid_loss    cp      dur
-------  -------  -------  ------------  ------------  ----  -------
      1   [36m0.3103[0m   [32m0.8211[0m        [35m0.1351[0m        [31m0.0621[0m     +  28.7129
      2   [36m0.3151[0m   [32m0.8221[0m        [35m0.1330[0m        [31m0.0599[0m     +  28.9743
      3   [36m0.3165[0m   0.8217        0.1429        0.0608        28.5787
      4   [36m0.3172[0m   [32m0.8228[0m        [35m0.1283[0m        [31m0.0590[0m     +  29.1714
      5   0.3145   0.8215        0.1574        0.0618        29.5111
      6   0.3168   0.8221        0.1484        [31m0.0588[0m     +  29.2724
      7   0.3168   0.8222        0.1375        [31m0.0588[0m     +  29.3453
      8   0.3136   0.8216        0.1304        [31m0.0581[0m     +  30.0191
      9   [36m0.3172[0m   0.8227        0.1412        [31m0.0579[0m     +  29.1687
     10   0.3170   0.8227        0.1339        0.0586        29.3882
     11   0.3147   0.8218        0.1365        0.0613        29.6903
Stopping since valid_loss has not improved in the last 3 epochs.
[32m[I 2023-01-09 08:25:35,889][0m Trial 107 finished with value: 0.31720541367209704 and parameters: {'lr': 2.3010703928553407e-09, 'dropout': 0.6146773550758813, 'd_model_multiplier': 8, 'num_layers': 1, 'n_heads': 4, 'dim_feedforward': 490, 'batch_size': 74, 'pos_encoding': 'fixed', 'activation': 'relu', 'norm': 'BatchNorm', 'optimizer_name': 'RAdam', 'weight_decay': 0.1}. Best is trial 48 with value: 0.3954917461755389.[0m
[EnsembleDataset] Initializing dataset...
	Examples: 27964
	Features: 621
	Max length: 316
[EnsembleDataset] Dataset initialization complete
Warning, assumed runtime error: CUDA out of memory. Tried to allocate 1.75 GiB (GPU 0; 23.70 GiB total capacity; 17.82 GiB already allocated; 703.31 MiB free; 21.94 GiB reserved in total by PyTorch) If reserved memory is >> allocated memory try setting max_split_size_mb to avoid fragmentation.  See documentation for Memory Management and PYTORCH_CUDA_ALLOC_CONF
[32m[I 2023-01-09 08:25:41,477][0m Trial 108 finished with value: 0.0 and parameters: {'lr': 7.408616218977818e-10, 'dropout': 0.639954326339921, 'd_model_multiplier': 32, 'num_layers': 3, 'n_heads': 32, 'dim_feedforward': 503, 'batch_size': 147, 'pos_encoding': 'fixed', 'activation': 'gelu', 'norm': 'BatchNorm', 'optimizer_name': 'RAdam', 'weight_decay': 0.1}. Best is trial 48 with value: 0.3954917461755389.[0m
[EnsembleDataset] Initializing dataset...
	Examples: 27964
	Features: 621
	Max length: 316
[EnsembleDataset] Dataset initialization complete
  epoch    auprc    auroc    train_loss    valid_loss    cp      dur
-------  -------  -------  ------------  ------------  ----  -------
      1   [36m0.2807[0m   [32m0.7549[0m        [35m0.0933[0m        [31m0.0584[0m     +  41.2806
      2   0.2806   [32m0.7549[0m        [35m0.0917[0m        [31m0.0584[0m     +  41.6159
      3   [36m0.2807[0m   [32m0.7549[0m        0.0932        [31m0.0584[0m     +  41.5432
      4   [36m0.2807[0m   [32m0.7550[0m        0.0941        [31m0.0584[0m     +  41.5990
      5   [36m0.2808[0m   [32m0.7551[0m        [35m0.0917[0m        [31m0.0583[0m     +  41.7527
      6   0.2807   [32m0.7551[0m        0.0931        [31m0.0583[0m     +  41.5950
      7   [36m0.2808[0m   [32m0.7551[0m        0.0930        [31m0.0583[0m     +  41.6414
      8   0.2808   [32m0.7551[0m        0.0917        [31m0.0583[0m     +  41.4181
      9   [36m0.2810[0m   [32m0.7552[0m        0.0922        [31m0.0582[0m     +  41.6411
     10   [36m0.2810[0m   [32m0.7552[0m        [35m0.0913[0m        [31m0.0582[0m     +  41.5260
     11   [36m0.2811[0m   [32m0.7553[0m        0.0942        [31m0.0582[0m     +  41.6128
     12   0.2810   [32m0.7553[0m        [35m0.0911[0m        [31m0.0581[0m     +  41.8454
     13   [36m0.2811[0m   [32m0.7553[0m        0.0923        [31m0.0581[0m     +  41.4683
     14   [36m0.2811[0m   [32m0.7554[0m        0.0932        [31m0.0581[0m     +  41.3404
     15   [36m0.2811[0m   [32m0.7554[0m        0.0940        [31m0.0581[0m     +  41.6091
     16   [36m0.2815[0m   [32m0.7555[0m        0.0931        [31m0.0580[0m     +  41.4698
     17   [36m0.2816[0m   [32m0.7555[0m        [35m0.0908[0m        [31m0.0580[0m     +  41.6198
     18   0.2816   [32m0.7556[0m        0.0934        [31m0.0580[0m     +  41.7105
     19   [36m0.2816[0m   [32m0.7556[0m        0.0934        [31m0.0579[0m     +  41.5758
     20   [36m0.2816[0m   [32m0.7557[0m        0.0925        [31m0.0579[0m     +  41.5186
     21   [36m0.2816[0m   [32m0.7557[0m        0.0913        [31m0.0579[0m     +  41.4820
     22   [36m0.2817[0m   [32m0.7558[0m        0.0935        [31m0.0579[0m     +  41.7061
     23   0.2817   [32m0.7558[0m        0.0924        [31m0.0578[0m     +  41.8861
     24   0.2816   [32m0.7559[0m        0.0922        [31m0.0578[0m     +  41.1940
     25   [36m0.2818[0m   [32m0.7560[0m        0.0934        [31m0.0578[0m     +  41.5313
