[32m[I 2023-01-10 07:05:49,563][0m Trial 199 finished with value: 0.30047586823718486 and parameters: {'lr': 1.2715802645940366e-05, 'dropout': 0.6128916001116173, 'd_model_multiplier': 4, 'num_layers': 6, 'n_heads': 4, 'dim_feedforward': 438, 'batch_size': 83, 'pos_encoding': 'fixed', 'activation': 'gelu', 'norm': 'BatchNorm', 'optimizer_name': 'PlainRAdam', 'weight_decay': 0.1}. Best is trial 122 with value: 0.40157405369010674.[0m
[EnsembleDataset] Initializing dataset...
	Examples: 27964
	Features: 621
	Max length: 316
[EnsembleDataset] Dataset initialization complete
  epoch    auprc    auroc    train_loss    valid_loss    cp      dur
-------  -------  -------  ------------  ------------  ----  -------
      1   [36m0.2832[0m   [32m0.8308[0m        [35m0.0908[0m        [31m0.0534[0m     +  29.8949
      2   [36m0.3059[0m   [32m0.8398[0m        [35m0.0796[0m        0.0625        30.0273
      3   0.2975   [32m0.8423[0m        [35m0.0765[0m        [31m0.0525[0m     +  30.1077
      4   0.3024   0.8417        [35m0.0727[0m        0.0605        30.1758
      5   [36m0.3123[0m   [32m0.8437[0m        [35m0.0705[0m        [31m0.0503[0m     +  30.6287
      6   [36m0.3211[0m   [32m0.8447[0m        [35m0.0668[0m        [31m0.0487[0m     +  30.1973
      7   0.3098   0.8426        [35m0.0648[0m        0.0558        30.8657
      8   0.3091   0.8432        [35m0.0639[0m        0.0506        30.0289
      9   [36m0.3294[0m   0.8427        [35m0.0634[0m        [31m0.0485[0m     +  30.3788
     10   0.3136   0.8434        [35m0.0600[0m        0.0498        31.0520
     11   0.3208   [32m0.8469[0m        [35m0.0580[0m        0.0489        29.4474
Stopping since valid_loss has not improved in the last 3 epochs.
[32m[I 2023-01-10 07:27:17,629][0m Trial 200 finished with value: 0.32937930207777827 and parameters: {'lr': 6.956676103599534e-05, 'dropout': 0.2708316440225111, 'd_model_multiplier': 8, 'num_layers': 3, 'n_heads': 8, 'dim_feedforward': 458, 'batch_size': 100, 'pos_encoding': 'fixed', 'activation': 'gelu', 'norm': 'BatchNorm', 'optimizer_name': 'RAdam', 'weight_decay': 0.1}. Best is trial 122 with value: 0.40157405369010674.[0m
[EnsembleDataset] Initializing dataset...
	Examples: 27964
	Features: 621
	Max length: 316
[EnsembleDataset] Dataset initialization complete
  epoch    auprc    auroc    train_loss    valid_loss    cp      dur
-------  -------  -------  ------------  ------------  ----  -------
      1   [36m0.3399[0m   [32m0.8300[0m        [35m0.1248[0m        [31m0.0526[0m     +  29.1243
      2   [36m0.3490[0m   [32m0.8359[0m        [35m0.1049[0m        [31m0.0515[0m     +  29.7868
slurmstepd: error: *** JOB 7309637 ON gpu2264 CANCELLED AT 2023-01-10T07:31:22 DUE TO TIME LIMIT ***
