[32m[I 2023-05-04 18:15:24,600][0m Trial 477 finished with value: 0.24098752242622237 and parameters: {'lr': 5.287115264939855e-06, 'dropout': 0.5568417697718698, 'd_model_multiplier': 32, 'num_layers': 7, 'n_heads': 32, 'dim_feedforward': 348, 'batch_size': 72, 'pos_encoding': 'fixed', 'activation': 'relu', 'norm': 'LayerNorm', 'optimizer_name': 'RAdam', 'weight_decay': 0.001, 'top_n_features': 73}. Best is trial 246 with value: 0.16447311791139763.[0m
[FileBasedDataset] Initializing dataset...
	Examples: 8264
	Features: 65
	Max length: 315
Standard scalar turned ON, loading params from cache
[FileBasedDataset] Dataset initialization complete
  epoch    auprc    auroc    train_loss    valid_acc    valid_loss    cp      dur
-------  -------  -------  ------------  -----------  ------------  ----  -------
      1   [36m0.0658[0m   [32m0.3465[0m        [35m0.6098[0m       [31m0.9226[0m        [94m0.4500[0m     +  27.5902
      2   [36m0.0988[0m   [32m0.5105[0m        [35m0.3661[0m       0.9226        [94m0.2865[0m     +  27.7206
      3   [36m0.1732[0m   [32m0.6362[0m        [35m0.2774[0m       0.9226        [94m0.2624[0m     +  27.6262
      4   [36m0.1816[0m   [32m0.6921[0m        [35m0.2553[0m       0.9226        [94m0.2559[0m     +  27.4059
      5   [36m0.2022[0m   [32m0.7252[0m        [35m0.2452[0m       0.9214        [94m0.2516[0m     +  28.1460
      6   [36m0.2122[0m   [32m0.7483[0m        [35m0.2390[0m       0.9226        [94m0.2490[0m     +  27.7823
      7   0.2118   [32m0.7586[0m        [35m0.2352[0m       0.9190        [94m0.2483[0m     +  27.6202
      8   [36m0.2140[0m   [32m0.7626[0m        [35m0.2334[0m       0.9202        0.2485        28.0298
      9   0.2113   [32m0.7666[0m        [35m0.2306[0m       0.9190        [94m0.2480[0m     +  27.6951
     10   0.2125   [32m0.7699[0m        0.2310       0.9190        [94m0.2473[0m     +  27.6512
     11   [36m0.2160[0m   [32m0.7714[0m        [35m0.2279[0m       0.9214        0.2474        27.7449
     12   0.2152   [32m0.7728[0m        [35m0.2265[0m       0.9202        0.2481        27.8046
     13   0.2077   [32m0.7732[0m        0.2274       0.9202        0.2483        27.8998
     14   0.2154   [32m0.7773[0m        0.2269       0.9214        0.2477        28.2308
     15   0.2116   0.7767        0.2273       0.9202        0.2479        27.7563
     16   0.2146   [32m0.7783[0m        [35m0.2253[0m       0.9202        0.2480        27.9407
     17   0.2125   [32m0.7786[0m        0.2257       0.9214        0.2474        27.8719
     18   0.2118   [32m0.7793[0m        [35m0.2234[0m       0.9214        0.2485        27.7327
     19   0.2104   0.7784        [35m0.2227[0m       0.9202        0.2482        27.7505
     20   0.2098   [32m0.7795[0m        0.2233       0.9214        [94m0.2472[0m     +  27.7833
     21   0.2095   [32m0.7798[0m        0.2228       0.9202        0.2478        27.9405
     22   0.2089   0.7788        [35m0.2223[0m       0.9202        0.2473        27.8557
     23   0.2073   0.7785        [35m0.2216[0m       0.9202        [94m0.2470[0m     +  27.8103
     24   0.2063   0.7786        [35m0.2204[0m       0.9202        0.2473        27.9701
     25   0.2076   0.7781        0.2214       0.9202        0.2486        28.0338
     26   0.2069   0.7795        0.2206       0.9202        [94m0.2468[0m     +  28.4464
     27   0.2068   [32m0.7801[0m        [35m0.2195[0m       0.9178        0.2480        27.7688
     28   0.2037   0.7783        0.2200       0.9178        [94m0.2466[0m     +  27.5528
     29   0.2060   0.7775        [35m0.2170[0m       0.9154        0.2468        27.6818
     30   0.2044   0.7768        0.2198       0.9166        [94m0.2464[0m     +  27.8195
     31   0.2014   0.7768        [35m0.2165[0m       0.9166        [94m0.2463[0m     +  27.5553
     32   0.2021   0.7762        0.2180       0.9154        [94m0.2461[0m     +  27.8448
     33   0.2029   0.7772        0.2183       0.9141        [94m0.2457[0m     +  27.9326
     34   0.2006   0.7770        [35m0.2152[0m       0.9129        0.2467        27.8866
     35   0.2011   0.7771        0.2170       0.9129        [94m0.2456[0m     +  27.6731
     36   0.2144   0.7756        0.2165       0.9141        0.2457        27.7579
     37   0.2030   0.7745        0.2154       0.9154        [94m0.2454[0m     +  27.8757
     38   [36m0.2161[0m   0.7740        [35m0.2143[0m       0.9154        [94m0.2448[0m     +  28.1433
     39   [36m0.2171[0m   0.7740        0.2144       0.9141        [94m0.2445[0m     +  27.6203
     40   [36m0.2340[0m   0.7723        0.2157       0.9141        [94m0.2439[0m     +  27.6105
     41   0.2281   0.7719        [35m0.2124[0m       0.9141        0.2450        27.8191
     42   0.2214   0.7709        0.2130       0.9154        0.2454        27.9790
     43   0.2249   0.7719        0.2140       0.9154        0.2450        27.6102
     44   0.2238   0.7721        [35m0.2117[0m       0.9141        0.2450        27.9953
     45   0.2254   0.7708        0.2119       0.9154        0.2447        27.7805
     46   0.2240   0.7709        [35m0.2110[0m       0.9154        0.2452        27.5516
     47   0.2294   0.7715        0.2114       0.9141        0.2456        28.0301
     48   0.2261   0.7690        0.2117       0.9129        0.2468        27.5834
     49   0.2283   0.7672        [35m0.2100[0m       0.9141        0.2464        27.6147
Stopping since valid_loss has not improved in the last 10 epochs.
[32m[I 2023-05-04 18:38:38,264][0m Trial 478 finished with value: 0.24392313316482442 and parameters: {'lr': 2.3271453417374723e-05, 'dropout': 0.4078085970798573, 'd_model_multiplier': 4, 'num_layers': 6, 'n_heads': 32, 'dim_feedforward': 390, 'batch_size': 65, 'pos_encoding': 'fixed', 'activation': 'relu', 'norm': 'LayerNorm', 'optimizer_name': 'RAdam', 'weight_decay': 0.1, 'top_n_features': 65}. Best is trial 246 with value: 0.16447311791139763.[0m
[FileBasedDataset] Initializing dataset...
	Examples: 8264
	Features: 52
	Max length: 315
Standard scalar turned ON, loading params from cache
[FileBasedDataset] Dataset initialization complete
Warning, assumed runtime error: CUDA out of memory. Tried to allocate 1.44 GiB (GPU 0; 23.70 GiB total capacity; 16.19 GiB already allocated; 779.25 MiB free; 21.85 GiB reserved in total by PyTorch) If reserved memory is >> allocated memory try setting max_split_size_mb to avoid fragmentation.  See documentation for Memory Management and PYTORCH_CUDA_ALLOC_CONF
[32m[I 2023-05-04 18:38:41,893][0m Trial 479 finished with value: 100.0 and parameters: {'lr': 0.0001851678862505566, 'dropout': 0.5002424027345571, 'd_model_multiplier': 8, 'num_layers': 5, 'n_heads': 64, 'dim_feedforward': 430, 'batch_size': 61, 'pos_encoding': 'fixed', 'activation': 'relu', 'norm': 'LayerNorm', 'optimizer_name': 'AdamW', 'weight_decay': 0.1, 'top_n_features': 52}. Best is trial 246 with value: 0.16447311791139763.[0m
[FileBasedDataset] Initializing dataset...
	Examples: 8264
	Features: 95
	Max length: 315
Standard scalar turned ON, loading params from cache
[FileBasedDataset] Dataset initialization complete
  epoch    auprc    auroc    train_loss    valid_acc    valid_loss    cp      dur
-------  -------  -------  ------------  -----------  ------------  ----  -------
      1   [36m0.1448[0m   [32m0.6291[0m        [35m0.4317[0m       [31m0.9311[0m        [94m0.2502[0m     +  34.4880
      2   [36m0.2035[0m   [32m0.7003[0m        [35m0.2630[0m       0.9311        [94m0.2273[0m     +  34.5615
      3   [36m0.2937[0m   [32m0.7312[0m        [35m0.2458[0m       [31m0.9323[0m        [94m0.2175[0m     +  35.0292
      4   [36m0.3163[0m   [32m0.7342[0m        [35m0.2365[0m       [31m0.9347[0m        [94m0.2162[0m     +  34.9189
      5   0.3074   [32m0.7397[0m        [35m0.2326[0m       [31m0.9359[0m        0.2170        34.9548
      6   0.2878   0.7358        [35m0.2321[0m       0.9287        0.2176        34.9022
      7   0.2912   0.7361        [35m0.2293[0m       0.9323        0.2182        35.1932
      8   0.2905   0.7356        [35m0.2291[0m       0.9311        0.2190        35.2564
      9   0.2806   0.7309        [35m0.2283[0m       0.9299        0.2200        34.9243
     10   0.2824   0.7283        [35m0.2260[0m       0.9311        0.2193        35.1032
     11   0.2779   0.7280        [35m0.2250[0m       0.9299        0.2208        35.1383
     12   0.2733   0.7231        [35m0.2233[0m       0.9323        0.2213        35.1198
     13   0.2942   0.7289        0.2233       0.9323        0.2192        35.0168
Stopping since valid_loss has not improved in the last 10 epochs.
[32m[I 2023-05-04 18:46:52,604][0m Trial 480 finished with value: 0.21618800476968217 and parameters: {'lr': 6.488907078559896e-05, 'dropout': 0.35612245074698334, 'd_model_multiplier': 4, 'num_layers': 8, 'n_heads': 32, 'dim_feedforward': 374, 'batch_size': 51, 'pos_encoding': 'fixed', 'activation': 'relu', 'norm': 'LayerNorm', 'optimizer_name': 'PlainRAdam', 'weight_decay': 0.1, 'top_n_features': 95}. Best is trial 246 with value: 0.16447311791139763.[0m
[FileBasedDataset] Initializing dataset...
	Examples: 8264
	Features: 69
	Max length: 315
Standard scalar turned ON, loading params from cache
[FileBasedDataset] Dataset initialization complete
  epoch    auprc    auroc    train_loss    valid_acc    valid_loss    cp      dur
-------  -------  -------  ------------  -----------  ------------  ----  -------
      1   [36m0.2650[0m   [32m0.7145[0m        [35m0.3403[0m       [31m0.9359[0m        [94m0.2202[0m     +  29.3021
      2   [36m0.2915[0m   [32m0.7586[0m        [35m0.2460[0m       [31m0.9371[0m        [94m0.2165[0m     +  29.4872
      3   [36m0.3032[0m   [32m0.7827[0m        [35m0.2422[0m       0.9359        [94m0.2134[0m     +  29.5137
      4   [36m0.3109[0m   [32m0.7907[0m        [35m0.2402[0m       0.9371        [94m0.2133[0m     +  29.3845
      5   0.3053   [32m0.7987[0m        [35m0.2384[0m       0.9371        [94m0.2093[0m     +  29.3112
      6   0.3034   [32m0.8011[0m        [35m0.2348[0m       0.9371        0.2099        29.3865
      7   0.3032   0.8003        [35m0.2330[0m       0.9347        0.2103        29.4703
      8   0.2961   0.8010        0.2334       0.9359        [94m0.2081[0m     +  29.4346
      9   0.3056   [32m0.8064[0m        [35m0.2321[0m       0.9335        [94m0.2055[0m     +  29.4633
     10   0.2923   0.8046        [35m0.2297[0m       0.9347        0.2088        29.4372
     11   0.2956   0.8039        [35m0.2283[0m       0.9335        0.2091        29.3237
     12   0.2946   0.8039        [35m0.2264[0m       0.9347        0.2077        29.4010
     13   0.2942   0.8061        [35m0.2246[0m       0.9347        0.2093        29.3257
     14   0.2912   0.8051        [35m0.2241[0m       0.9347        0.2068        29.3119
     15   0.2940   0.8030        [35m0.2225[0m       0.9347        0.2091        29.2574
     16   0.2949   0.8064        [35m0.2215[0m       0.9347        0.2060        29.1447
     17   0.2928   0.8020        [35m0.2193[0m       0.9347        0.2082        29.1860
     18   0.2842   0.8003        [35m0.2189[0m       0.9335        0.2100        29.1540
Stopping since valid_loss has not improved in the last 10 epochs.
[32m[I 2023-05-04 18:56:11,480][0m Trial 481 finished with value: 0.20553121713081324 and parameters: {'lr': 3.41160018292123e-05, 'dropout': 0.39197258786742406, 'd_model_multiplier': 4, 'num_layers': 6, 'n_heads': 32, 'dim_feedforward': 323, 'batch_size': 13, 'pos_encoding': 'fixed', 'activation': 'relu', 'norm': 'LayerNorm', 'optimizer_name': 'RAdam', 'weight_decay': 0.1, 'top_n_features': 69}. Best is trial 246 with value: 0.16447311791139763.[0m
[FileBasedDataset] Initializing dataset...
	Examples: 8264
	Features: 57
	Max length: 315
Standard scalar turned ON, loading params from cache
[FileBasedDataset] Dataset initialization complete
  epoch    auprc    auroc    train_loss    valid_acc    valid_loss    cp      dur
-------  -------  -------  ------------  -----------  ------------  ----  -------
      1   [36m0.1361[0m   [32m0.6223[0m        [35m0.3914[0m       [31m0.9250[0m        [94m0.2617[0m     +  19.9772
      2   [36m0.1920[0m   [32m0.7145[0m        [35m0.2616[0m       0.9250        [94m0.2441[0m     +  20.1437
      3   [36m0.2352[0m   [32m0.7397[0m        [35m0.2479[0m       0.9250        [94m0.2387[0m     +  20.6113
      4   [36m0.2497[0m   [32m0.7500[0m        [35m0.2431[0m       0.9250        [94m0.2363[0m     +  20.4211
      5   [36m0.2614[0m   [32m0.7521[0m        [35m0.2372[0m       0.9238        0.2371        20.6326
      6   [36m0.2689[0m   [32m0.7522[0m        [35m0.2337[0m       0.9250        0.2377        20.5581
      7   [36m0.2831[0m   [32m0.7554[0m        [35m0.2323[0m       [31m0.9287[0m        0.2364        20.7730
      8   0.2823   [32m0.7568[0m        0.2330       [31m0.9299[0m        [94m0.2356[0m     +  20.6268
      9   [36m0.2856[0m   [32m0.7596[0m        [35m0.2302[0m       0.9274        [94m0.2352[0m     +  20.2154
     10   [36m0.2858[0m   [32m0.7608[0m        0.2305       0.9274        [94m0.2342[0m     +  20.3956
     11   [36m0.2868[0m   [32m0.7625[0m        [35m0.2300[0m       0.9287        [94m0.2340[0m     +  20.2512
     12   [36m0.2891[0m   [32m0.7641[0m        [35m0.2295[0m       0.9287        [94m0.2335[0m     +  20.0518
     13   [36m0.2918[0m   [32m0.7650[0m        [35m0.2275[0m       0.9287        0.2335        20.4240
     14   [36m0.2949[0m   [32m0.7664[0m        [35m0.2270[0m       0.9287        0.2338        20.3484
     15   [36m0.2954[0m   [32m0.7681[0m        0.2279       0.9287        [94m0.2331[0m     +  19.9403
     16   [36m0.2984[0m   [32m0.7691[0m        0.2275       0.9287        0.2332        20.2101
     17   [36m0.3050[0m   [32m0.7705[0m        [35m0.2268[0m       0.9287        [94m0.2323[0m     +  20.7485
     18   0.3050   [32m0.7709[0m        0.2271       0.9287        0.2330        20.4937
     19   [36m0.3068[0m   [32m0.7728[0m        [35m0.2246[0m       0.9274        0.2325        20.4125
     20   [36m0.3116[0m   [32m0.7734[0m        0.2250       0.9262        0.2332        20.6516
     21   [36m0.3117[0m   [32m0.7735[0m        0.2251       0.9262        0.2325        20.6129
     22   0.3040   [32m0.7747[0m        [35m0.2229[0m       0.9262        0.2330        20.4358
     23   0.3058   [32m0.7760[0m        0.2254       0.9262        0.2324        20.5378
     24   [36m0.3131[0m   [32m0.7771[0m        0.2254       0.9250        [94m0.2315[0m     +  20.5593
     25   [36m0.3157[0m   [32m0.7772[0m        0.2235       0.9274        0.2317        20.6301
     26   [36m0.3176[0m   0.7771        0.2237       0.9262        0.2327        20.2129
     27   0.3174   0.7770        [35m0.2226[0m       0.9238        0.2333        20.2912
     28   [36m0.3177[0m   [32m0.7780[0m        0.2231       0.9274        0.2320        20.3263
     29   0.3161   [32m0.7782[0m        [35m0.2207[0m       0.9250        0.2332        20.5799
     30   [36m0.3182[0m   [32m0.7787[0m        0.2231       0.9238        0.2322        20.5127
     31   [36m0.3195[0m   0.7784        [35m0.2199[0m       0.9214        0.2342        20.3704
     32   [36m0.3207[0m   [32m0.7791[0m        0.2209       0.9226        0.2326        20.1668
     33   [36m0.3213[0m   [32m0.7791[0m        0.2209       0.9226        0.2331        20.5856
Stopping since valid_loss has not improved in the last 10 epochs.
[32m[I 2023-05-04 19:07:47,370][0m Trial 482 finished with value: 0.2314631808751872 and parameters: {'lr': 1.968951975198616e-05, 'dropout': 0.45920995610944854, 'd_model_multiplier': 4, 'num_layers': 4, 'n_heads': 32, 'dim_feedforward': 286, 'batch_size': 68, 'pos_encoding': 'fixed', 'activation': 'relu', 'norm': 'LayerNorm', 'optimizer_name': 'AdamW', 'weight_decay': 0.001, 'top_n_features': 57}. Best is trial 246 with value: 0.16447311791139763.[0m
[FileBasedDataset] Initializing dataset...
	Examples: 8264
	Features: 62
	Max length: 315
Standard scalar turned ON, loading params from cache
[FileBasedDataset] Dataset initialization complete
  epoch    auprc    auroc    train_loss    valid_acc    valid_loss    cp     dur
-------  -------  -------  ------------  -----------  ------------  ----  ------
      1   [36m0.2349[0m   [32m0.7411[0m        [35m0.2769[0m       [31m0.9335[0m        [94m0.2258[0m     +  9.0888
      2   [36m0.3407[0m   [32m0.7853[0m        [35m0.2564[0m       [31m0.9347[0m        0.2287        8.8056
      3   0.2232   0.7648        [35m0.2518[0m       0.9190        0.2361        9.4163
      4   0.3136   0.7780        [35m0.2485[0m       0.9323        0.2311        8.9830
      5   0.1655   0.6751        [35m0.2483[0m       0.9323        0.2512        9.4264
      6   0.2119   0.6845        0.2619       0.9323        0.2426        9.4882
      7   0.3272   0.7508        0.2550       0.9347        0.2340        9.1126
      8   0.3243   0.7144        0.2530       [31m0.9383[0m        [94m0.2225[0m     +  9.1527
      9   0.2003   0.6791        0.2503       0.9323        0.2406        9.0746
     10   0.2203   0.6880        0.2567       0.9323        0.2327        9.3228
     11   0.2099   0.6731        0.2569       0.9323        0.2369        9.3419
     12   0.2284   0.6731        0.2577       0.9323        0.2342        9.4816
     13   0.2304   0.6783        0.2581       0.9323        0.2369        9.3219
     14   0.2125   0.6752        0.2556       0.9323        0.2358        9.2827
     15   0.1797   0.6722        0.2575       0.9323        0.2411        9.5486
     16   0.2283   0.6720        0.2563       0.9323        0.2451        9.3669
     17   0.2308   0.6800        0.2556       0.9323        0.2424        9.4141
Stopping since valid_loss has not improved in the last 10 epochs.
