[32m[I 2023-01-08 18:08:03,943][0m Trial 44 finished with value: 0.3544252058760372 and parameters: {'lr': 9.908549713310421e-10, 'dropout': 0.6100280161289948, 'd_model_multiplier': 4, 'num_layers': 5, 'n_heads': 8, 'dim_feedforward': 430, 'batch_size': 85, 'pos_encoding': 'fixed', 'activation': 'gelu', 'norm': 'BatchNorm', 'optimizer_name': 'RAdam', 'weight_decay': 0.1}. Best is trial 34 with value: 0.3590221978612867.[0m
[EnsembleDataset] Initializing dataset...
	Examples: 27964
	Features: 621
	Max length: 316
[EnsembleDataset] Dataset initialization complete
  epoch    auprc    auroc    train_loss    valid_loss    cp      dur
-------  -------  -------  ------------  ------------  ----  -------
      1   [36m0.3028[0m   [32m0.8248[0m        [35m0.1342[0m        [31m0.0525[0m     +  29.1477
      2   [36m0.3035[0m   [32m0.8250[0m        [35m0.1271[0m        [31m0.0525[0m     +  29.1765
      3   [36m0.3036[0m   [32m0.8254[0m        0.1456        [31m0.0525[0m     +  29.6502
      4   0.3031   0.8253        0.1350        0.0525        29.3922
      5   [36m0.3038[0m   [32m0.8254[0m        0.1316        [31m0.0525[0m     +  29.7056
      6   0.3033   0.8254        0.1373        [31m0.0525[0m     +  29.6310
      7   0.3034   0.8251        0.1374        0.0525        29.7796
Stopping since valid_loss has not improved in the last 3 epochs.
[32m[I 2023-01-08 18:21:48,885][0m Trial 45 finished with value: 0.30382008744348277 and parameters: {'lr': 1.0313308785955784e-09, 'dropout': 0.6540740496093609, 'd_model_multiplier': 4, 'num_layers': 4, 'n_heads': 8, 'dim_feedforward': 429, 'batch_size': 72, 'pos_encoding': 'fixed', 'activation': 'gelu', 'norm': 'BatchNorm', 'optimizer_name': 'RAdam', 'weight_decay': 0.1}. Best is trial 34 with value: 0.3590221978612867.[0m
[EnsembleDataset] Initializing dataset...
	Examples: 27964
	Features: 621
	Max length: 316
[EnsembleDataset] Dataset initialization complete
  epoch    auprc    auroc    train_loss    valid_loss    cp      dur
-------  -------  -------  ------------  ------------  ----  -------
      1   [36m0.3393[0m   [32m0.8275[0m        [35m0.1173[0m        [31m0.0509[0m     +  30.0049
      2   [36m0.3396[0m   0.8273        [35m0.1160[0m        [31m0.0509[0m     +  29.8046
      3   [36m0.3398[0m   [32m0.8278[0m        0.1194        [31m0.0508[0m     +  30.4960
      4   0.3395   0.8274        [35m0.1128[0m        0.0509        30.2203
      5   [36m0.3401[0m   0.8274        [35m0.1121[0m        [31m0.0508[0m     +  30.3460
      6   0.3395   [32m0.8279[0m        0.1133        0.0509        30.0944
      7   0.3397   [32m0.8279[0m        0.1157        0.0509        29.5385
      8   [36m0.3401[0m   0.8273        [35m0.1093[0m        [31m0.0508[0m     +  29.6679
      9   0.3394   0.8278        0.1137        0.0508        30.5890
     10   [36m0.3403[0m   0.8274        0.1175        0.0508        29.8694
Stopping since valid_loss has not improved in the last 3 epochs.
[32m[I 2023-01-08 18:42:16,325][0m Trial 46 finished with value: 0.34033530616560925 and parameters: {'lr': 2.9299356210757217e-10, 'dropout': 0.5891464128194333, 'd_model_multiplier': 32, 'num_layers': 3, 'n_heads': 8, 'dim_feedforward': 463, 'batch_size': 87, 'pos_encoding': 'fixed', 'activation': 'gelu', 'norm': 'BatchNorm', 'optimizer_name': 'PlainRAdam', 'weight_decay': 0.1}. Best is trial 34 with value: 0.3590221978612867.[0m
[EnsembleDataset] Initializing dataset...
	Examples: 27964
	Features: 621
	Max length: 316
[EnsembleDataset] Dataset initialization complete
  epoch    auprc    auroc    train_loss    valid_loss    cp      dur
-------  -------  -------  ------------  ------------  ----  -------
      1   [36m0.2910[0m   [32m0.8206[0m        [35m0.1190[0m        [31m0.0501[0m     +  41.8477
      2   [36m0.2910[0m   [32m0.8208[0m        [35m0.1178[0m        [31m0.0500[0m     +  41.8123
      3   [36m0.2911[0m   [32m0.8211[0m        0.1276        0.0503        42.0385
      4   0.2909   0.8210        [35m0.1112[0m        0.0503        42.1247
Stopping since valid_loss has not improved in the last 3 epochs.
[32m[I 2023-01-08 18:51:28,106][0m Trial 47 finished with value: 0.2910994407193179 and parameters: {'lr': 2.364800546633033e-10, 'dropout': 0.6060414933288221, 'd_model_multiplier': 32, 'num_layers': 6, 'n_heads': 8, 'dim_feedforward': 462, 'batch_size': 82, 'pos_encoding': 'fixed', 'activation': 'relu', 'norm': 'BatchNorm', 'optimizer_name': 'PlainRAdam', 'weight_decay': 0.1}. Best is trial 34 with value: 0.3590221978612867.[0m
[EnsembleDataset] Initializing dataset...
	Examples: 27964
	Features: 621
	Max length: 316
[EnsembleDataset] Dataset initialization complete
  epoch    auprc    auroc    train_loss    valid_loss    cp      dur
-------  -------  -------  ------------  ------------  ----  -------
      1   [36m0.3952[0m   [32m0.8535[0m        [35m0.1404[0m        [31m0.0449[0m     +  29.4438
      2   [36m0.3955[0m   [32m0.8537[0m        0.1438        0.0449        29.5517
      3   0.3955   0.8536        0.1448        [31m0.0448[0m     +  29.5461
      4   0.3955   0.8536        [35m0.1304[0m        0.0449        30.4516
      5   0.3951   0.8535        [35m0.1301[0m        0.0449        29.7094
Stopping since valid_loss has not improved in the last 3 epochs.
[32m[I 2023-01-08 19:01:50,590][0m Trial 48 finished with value: 0.3954917461755389 and parameters: {'lr': 6.306831527596734e-10, 'dropout': 0.6583490973220353, 'd_model_multiplier': 32, 'num_layers': 3, 'n_heads': 8, 'dim_feedforward': 512, 'batch_size': 93, 'pos_encoding': 'fixed', 'activation': 'gelu', 'norm': 'BatchNorm', 'optimizer_name': 'PlainRAdam', 'weight_decay': 0.1}. Best is trial 48 with value: 0.3954917461755389.[0m
[EnsembleDataset] Initializing dataset...
	Examples: 27964
	Features: 621
	Max length: 316
[EnsembleDataset] Dataset initialization complete
  epoch    auprc    auroc    train_loss    valid_loss    cp      dur
-------  -------  -------  ------------  ------------  ----  -------
      1   [36m0.3142[0m   [32m0.8225[0m        [35m0.1315[0m        [31m0.0522[0m     +  29.1817
      2   0.3134   [32m0.8225[0m        [35m0.1310[0m        0.0522        29.1304
      3   0.3142   [32m0.8227[0m        [35m0.1281[0m        [31m0.0522[0m     +  28.7574
      4   [36m0.3145[0m   0.8224        0.1284        [31m0.0522[0m     +  29.3729
      5   [36m0.3148[0m   0.8223        0.1367        0.0522        29.0308
      6   0.3118   0.8224        0.1322        0.0524        28.8556
Stopping since valid_loss has not improved in the last 3 epochs.
[32m[I 2023-01-08 19:14:06,706][0m Trial 49 finished with value: 0.31484933211632493 and parameters: {'lr': 5.60261281128881e-10, 'dropout': 0.667404826173302, 'd_model_multiplier': 32, 'num_layers': 2, 'n_heads': 8, 'dim_feedforward': 511, 'batch_size': 71, 'pos_encoding': 'fixed', 'activation': 'gelu', 'norm': 'BatchNorm', 'optimizer_name': 'PlainRAdam', 'weight_decay': 0.1}. Best is trial 48 with value: 0.3954917461755389.[0m
[EnsembleDataset] Initializing dataset...
	Examples: 27964
	Features: 621
	Max length: 316
[EnsembleDataset] Dataset initialization complete
  epoch    auprc    auroc    train_loss    valid_loss    cp      dur
-------  -------  -------  ------------  ------------  ----  -------
      1   [36m0.3478[0m   [32m0.8300[0m        [35m0.1438[0m        [31m0.0583[0m     +  30.1573
      2   0.3477   0.8299        0.1576        0.0583        30.4700
      3   0.3475   [32m0.8302[0m        [35m0.1346[0m        0.0584        30.4888
      4   [36m0.3486[0m   0.8298        [35m0.1292[0m        [31m0.0582[0m     +  29.8234
      5   0.3480   0.8302        0.1516        0.0584        29.5913
      6   0.3478   0.8299        [35m0.1265[0m        0.0585        30.0526
      7   0.3482   0.8301        0.1417        [31m0.0581[0m     +  29.9625
      8   [36m0.3488[0m   0.8298        0.1347        [31m0.0581[0m     +  29.7979
      9   0.3476   0.8299        0.1418        0.0584        29.9855
     10   0.3482   0.8299        0.1525        0.0582        29.5559
Stopping since valid_loss has not improved in the last 3 epochs.
[32m[I 2023-01-08 19:33:56,411][0m Trial 50 finished with value: 0.3487920043216239 and parameters: {'lr': 3.5989215509332792e-09, 'dropout': 0.6814575460404366, 'd_model_multiplier': 32, 'num_layers': 3, 'n_heads': 8, 'dim_feedforward': 488, 'batch_size': 91, 'pos_encoding': 'fixed', 'activation': 'gelu', 'norm': 'BatchNorm', 'optimizer_name': 'PlainRAdam', 'weight_decay': 0.1}. Best is trial 48 with value: 0.3954917461755389.[0m
[EnsembleDataset] Initializing dataset...
	Examples: 27964
	Features: 621
	Max length: 316
[EnsembleDataset] Dataset initialization complete
  epoch    auprc    auroc    train_loss    valid_loss    cp      dur
-------  -------  -------  ------------  ------------  ----  -------
      1   [36m0.3055[0m   [32m0.8499[0m        [35m0.1395[0m        [31m0.0470[0m     +  29.3217
      2   [36m0.3057[0m   [32m0.8502[0m        0.1443        [31m0.0470[0m     +  29.7867
      3   0.3056   0.8499        [35m0.1251[0m        0.0470        30.0341
      4   0.3054   0.8499        0.1447        0.0470        29.6393
Stopping since valid_loss has not improved in the last 3 epochs.
[32m[I 2023-01-08 19:42:03,590][0m Trial 51 finished with value: 0.3056850048440823 and parameters: {'lr': 8.671369642196908e-10, 'dropout': 0.6992829837405568, 'd_model_multiplier': 32, 'num_layers': 3, 'n_heads': 8, 'dim_feedforward': 488, 'batch_size': 93, 'pos_encoding': 'fixed', 'activation': 'gelu', 'norm': 'BatchNorm', 'optimizer_name': 'PlainRAdam', 'weight_decay': 0.1}. Best is trial 48 with value: 0.3954917461755389.[0m
[EnsembleDataset] Initializing dataset...
	Examples: 27964
	Features: 621
	Max length: 316
[EnsembleDataset] Dataset initialization complete
  epoch    auprc    auroc    train_loss    valid_loss    cp      dur
-------  -------  -------  ------------  ------------  ----  -------
      1   [36m0.2482[0m   [32m0.8386[0m        [35m0.1256[0m        [31m0.0473[0m     +  29.2734
      2   0.2477   0.8384        0.1259        [31m0.0473[0m     +  29.2640
      3   0.2474   0.8386        0.1315        0.0473        30.3778
      4   0.2476   0.8384        0.1366        [31m0.0472[0m     +  29.5994
      5   0.2469   0.8380        0.1327        0.0473        29.7256
      6   0.2474   0.8385        0.1312        0.0474        30.0233
Stopping since valid_loss has not improved in the last 3 epochs.
[32m[I 2023-01-08 19:54:26,748][0m Trial 52 finished with value: 0.24819061035005832 and parameters: {'lr': 2.281834307705836e-09, 'dropout': 0.6659615422814774, 'd_model_multiplier': 32, 'num_layers': 3, 'n_heads': 8, 'dim_feedforward': 470, 'batch_size': 60, 'pos_encoding': 'fixed', 'activation': 'gelu', 'norm': 'BatchNorm', 'optimizer_name': 'PlainRAdam', 'weight_decay': 0.1}. Best is trial 48 with value: 0.3954917461755389.[0m
[EnsembleDataset] Initializing dataset...
	Examples: 27964
	Features: 621
	Max length: 316
[EnsembleDataset] Dataset initialization complete
  epoch    auprc    auroc    train_loss    valid_loss    cp      dur
-------  -------  -------  ------------  ------------  ----  -------
      1   [36m0.3213[0m   [32m0.8476[0m        [35m0.1278[0m        [31m0.0488[0m     +  31.7458
      2   [36m0.3224[0m   0.8475        [35m0.1139[0m        [31m0.0487[0m     +  31.7026
      3   0.3205   0.8475        0.1269        0.0488        31.5846
      4   [36m0.3238[0m   [32m0.8478[0m        0.1279        [31m0.0487[0m     +  31.5525
      5   0.3191   0.8471        0.1229        0.0489        31.5110
      6   0.3233   0.8478        0.1293        [31m0.0486[0m     +  31.6248
      7   0.3222   0.8475        0.1306        0.0487        31.5420
      8   0.3213   0.8475        0.1223        0.0488        31.5671
Stopping since valid_loss has not improved in the last 3 epochs.
[32m[I 2023-01-08 20:10:34,997][0m Trial 53 finished with value: 0.32378867806495343 and parameters: {'lr': 2.4347374908865256e-10, 'dropout': 0.6391696518439715, 'd_model_multiplier': 32, 'num_layers': 4, 'n_heads': 8, 'dim_feedforward': 428, 'batch_size': 119, 'pos_encoding': 'fixed', 'activation': 'gelu', 'norm': 'BatchNorm', 'optimizer_name': 'PlainRAdam', 'weight_decay': 0.1}. Best is trial 48 with value: 0.3954917461755389.[0m
[EnsembleDataset] Initializing dataset...
	Examples: 27964
	Features: 621
	Max length: 316
[EnsembleDataset] Dataset initialization complete
  epoch    auprc    auroc    train_loss    valid_loss    cp      dur
-------  -------  -------  ------------  ------------  ----  -------
      1   [36m0.2972[0m   [32m0.8248[0m        [35m0.1267[0m        [31m0.0520[0m     +  29.3571
      2   0.2971   [32m0.8260[0m        0.1320        0.0522        30.0855
      3   0.2953   0.8241        0.1311        0.0523        29.5964
Stopping since valid_loss has not improved in the last 3 epochs.
[32m[I 2023-01-08 20:16:48,884][0m Trial 54 finished with value: 0.29719305344962044 and parameters: {'lr': 4.386138886305712e-09, 'dropout': 0.6201843890347714, 'd_model_multiplier': 32, 'num_layers': 2, 'n_heads': 8, 'dim_feedforward': 455, 'batch_size': 89, 'pos_encoding': 'fixed', 'activation': 'gelu', 'norm': 'BatchNorm', 'optimizer_name': 'PlainRAdam', 'weight_decay': 0.1}. Best is trial 48 with value: 0.3954917461755389.[0m
[EnsembleDataset] Initializing dataset...
	Examples: 27964
	Features: 621
	Max length: 316
[EnsembleDataset] Dataset initialization complete
  epoch    auprc    auroc    train_loss    valid_loss    cp      dur
-------  -------  -------  ------------  ------------  ----  -------
      1   [36m0.2721[0m   [32m0.8416[0m        [35m0.1149[0m        [31m0.0563[0m     +  30.5180
      2   [36m0.2721[0m   0.8415        0.1200        0.0565        29.9162
      3   0.2707   0.8415        0.1247        [31m0.0556[0m     +  29.8117
      4   [36m0.2728[0m   [32m0.8418[0m        0.1166        0.0561        29.9130
      5   0.2719   0.8406        [35m0.1122[0m        0.0562        30.2395
Stopping since valid_loss has not improved in the last 3 epochs.
[32m[I 2023-01-08 20:26:56,887][0m Trial 55 finished with value: 0.2727981448539118 and parameters: {'lr': 6.072351219737059e-10, 'dropout': 0.575356983762945, 'd_model_multiplier': 32, 'num_layers': 3, 'n_heads': 8, 'dim_feedforward': 492, 'batch_size': 96, 'pos_encoding': 'fixed', 'activation': 'gelu', 'norm': 'BatchNorm', 'optimizer_name': 'PlainRAdam', 'weight_decay': 0}. Best is trial 48 with value: 0.3954917461755389.[0m
[EnsembleDataset] Initializing dataset...
	Examples: 27964
	Features: 621
	Max length: 316
[EnsembleDataset] Dataset initialization complete
  epoch    auprc    auroc    train_loss    valid_loss    cp      dur
-------  -------  -------  ------------  ------------  ----  -------
      1   [36m0.2856[0m   [32m0.8391[0m        [35m0.1351[0m        [31m0.0481[0m     +  30.4300
      2   0.2854   [32m0.8392[0m        [35m0.1233[0m        0.0481        30.7019
      3   0.2853   0.8392        0.1470        0.0481        31.1375
Stopping since valid_loss has not improved in the last 3 epochs.
[32m[I 2023-01-08 20:33:13,671][0m Trial 56 finished with value: 0.28556003182611095 and parameters: {'lr': 1.3878684037968907e-09, 'dropout': 0.6773404479030312, 'd_model_multiplier': 16, 'num_layers': 4, 'n_heads': 8, 'dim_feedforward': 479, 'batch_size': 141, 'pos_encoding': 'fixed', 'activation': 'gelu', 'norm': 'BatchNorm', 'optimizer_name': 'PlainRAdam', 'weight_decay': 0.1}. Best is trial 48 with value: 0.3954917461755389.[0m
[EnsembleDataset] Initializing dataset...
	Examples: 27964
	Features: 621
	Max length: 316
[EnsembleDataset] Dataset initialization complete
  epoch    auprc    auroc    train_loss    valid_loss    cp       dur
-------  -------  -------  ------------  ------------  ----  --------
      1   [36m0.3351[0m   [32m0.8642[0m        [35m0.1183[0m        [31m0.0490[0m     +  171.8168
      2   0.3288   0.8639        0.1195        0.0492        171.5337
      3   0.3334   [32m0.8642[0m        0.1198        [31m0.0490[0m     +  171.7283
Stopping since valid_loss has not improved in the last 3 epochs.
[32m[I 2023-01-08 20:48:59,452][0m Trial 57 finished with value: 0.33513557983361314 and parameters: {'lr': 1.6079452813500048e-10, 'dropout': 0.6501140711780007, 'd_model_multiplier': 32, 'num_layers': 5, 'n_heads': 32, 'dim_feedforward': 509, 'batch_size': 81, 'pos_encoding': 'fixed', 'activation': 'gelu', 'norm': 'BatchNorm', 'optimizer_name': 'PlainRAdam', 'weight_decay': 0.1}. Best is trial 48 with value: 0.3954917461755389.[0m
[EnsembleDataset] Initializing dataset...
	Examples: 27964
	Features: 621
	Max length: 316
[EnsembleDataset] Dataset initialization complete
  epoch    auprc    auroc    train_loss    valid_loss    cp      dur
-------  -------  -------  ------------  ------------  ----  -------
      1   [36m0.2831[0m   [32m0.8417[0m        [35m0.1567[0m        [31m0.1960[0m     +  73.4564
      2   [36m0.2835[0m   [32m0.8418[0m        [35m0.1512[0m        [31m0.1933[0m     +  72.8132
      3   0.2834   0.8415        0.1531        0.1970        72.8561
      4   0.2832   0.8418        [35m0.1493[0m        0.1978        73.3122
Stopping since valid_loss has not improved in the last 3 epochs.
[32m[I 2023-01-08 21:00:53,904][0m Trial 58 finished with value: 0.2834616402225834 and parameters: {'lr': 1.2490378695354127e-10, 'dropout': 0.10336144224495913, 'd_model_multiplier': 32, 'num_layers': 2, 'n_heads': 32, 'dim_feedforward': 507, 'batch_size': 82, 'pos_encoding': 'fixed', 'activation': 'gelu', 'norm': 'BatchNorm', 'optimizer_name': 'PlainRAdam', 'weight_decay': 0.1}. Best is trial 48 with value: 0.3954917461755389.[0m
[EnsembleDataset] Initializing dataset...
	Examples: 27964
	Features: 621
	Max length: 316
[EnsembleDataset] Dataset initialization complete
  epoch    auprc    auroc    train_loss    valid_loss    cp      dur
-------  -------  -------  ------------  ------------  ----  -------
      1   [36m0.3360[0m   [32m0.8419[0m        [35m0.1607[0m        [31m0.0556[0m     +  42.1978
      2   [36m0.3368[0m   [32m0.8421[0m        [35m0.1606[0m        0.0559        42.0591
      3   0.3362   0.8415        0.1620        [31m0.0556[0m     +  42.0820
      4   0.3358   0.8418        0.1650        0.0558        42.0369
      5   0.3363   0.8419        [35m0.1561[0m        0.0557        42.1862
Stopping since valid_loss has not improved in the last 3 epochs.
[32m[I 2023-01-08 21:12:13,888][0m Trial 59 finished with value: 0.3367917375975717 and parameters: {'lr': 2.693368575234631e-10, 'dropout': 0.6798378603215748, 'd_model_multiplier': 32, 'num_layers': 1, 'n_heads': 32, 'dim_feedforward': 463, 'batch_size': 109, 'pos_encoding': 'fixed', 'activation': 'relu', 'norm': 'BatchNorm', 'optimizer_name': 'PlainRAdam', 'weight_decay': 0.1}. Best is trial 48 with value: 0.3954917461755389.[0m
[EnsembleDataset] Initializing dataset...
	Examples: 27964
	Features: 621
	Max length: 316
[EnsembleDataset] Dataset initialization complete
  epoch    auprc    auroc    train_loss    valid_loss    cp      dur
-------  -------  -------  ------------  ------------  ----  -------
      1   [36m0.3176[0m   [32m0.8213[0m        [35m0.1332[0m        [31m0.0559[0m     +  42.1440
      2   [36m0.3178[0m   [32m0.8218[0m        0.1350        [31m0.0559[0m     +  42.4099
      3   0.3172   0.8211        0.1341        0.0559        41.9805
      4   [36m0.3180[0m   0.8215        [35m0.1330[0m        0.0559        42.2188
Stopping since valid_loss has not improved in the last 3 epochs.
[32m[I 2023-01-08 21:21:23,666][0m Trial 60 finished with value: 0.31804453526881415 and parameters: {'lr': 2.980559639722288e-10, 'dropout': 0.6832236261097074, 'd_model_multiplier': 32, 'num_layers': 1, 'n_heads': 32, 'dim_feedforward': 418, 'batch_size': 109, 'pos_encoding': 'fixed', 'activation': 'relu', 'norm': 'BatchNorm', 'optimizer_name': 'PlainRAdam', 'weight_decay': 0.1}. Best is trial 48 with value: 0.3954917461755389.[0m
[EnsembleDataset] Initializing dataset...
	Examples: 27964
	Features: 621
	Max length: 316
[EnsembleDataset] Dataset initialization complete
  epoch    auprc    auroc    train_loss    valid_loss    cp      dur
-------  -------  -------  ------------  ------------  ----  -------
      1   [36m0.3385[0m   [32m0.8331[0m        [35m0.1353[0m        [31m0.0517[0m     +  39.9335
      2   [36m0.3405[0m   0.8330        0.1360        [31m0.0517[0m     +  39.8957
      3   0.3400   0.8325        0.1377        [31m0.0517[0m     +  40.2136
      4   0.3383   0.8325        [35m0.1342[0m        0.0518        39.9208
      5   0.3378   0.8325        0.1397        0.0517        40.0907
Stopping since valid_loss has not improved in the last 3 epochs.
