[32m[I 2023-05-04 16:28:16,150][0m Trial 466 finished with value: 0.22646890701376973 and parameters: {'lr': 1.113984687410722e-05, 'dropout': 0.3845522601519797, 'd_model_multiplier': 32, 'num_layers': 8, 'n_heads': 32, 'dim_feedforward': 327, 'batch_size': 64, 'pos_encoding': 'fixed', 'activation': 'relu', 'norm': 'LayerNorm', 'optimizer_name': 'AdamW', 'weight_decay': 0.1, 'top_n_features': 67}. Best is trial 246 with value: 0.16447311791139763.[0m
[FileBasedDataset] Initializing dataset...
	Examples: 8264
	Features: 53
	Max length: 315
Standard scalar turned ON, loading params from cache
[FileBasedDataset] Dataset initialization complete
  epoch    auprc    auroc    train_loss    valid_acc    valid_loss    cp      dur
-------  -------  -------  ------------  -----------  ------------  ----  -------
      1   [36m0.1116[0m   [32m0.4092[0m        [35m0.6921[0m       [31m0.7606[0m        [94m0.6757[0m     +  34.1528
      2   0.0914   0.3644        [35m0.6527[0m       [31m0.9045[0m        [94m0.6270[0m     +  34.3261
      3   0.0925   0.3474        [35m0.6046[0m       0.9045        [94m0.5735[0m     +  34.5715
      4   0.0892   0.3430        [35m0.5536[0m       0.9045        [94m0.5223[0m     +  34.7201
      5   0.0877   0.3420        [35m0.5034[0m       0.9045        [94m0.4770[0m     +  34.6570
      6   0.0876   0.3448        [35m0.4591[0m       0.9045        [94m0.4388[0m     +  34.4203
      7   0.0881   0.3508        [35m0.4212[0m       0.9045        [94m0.4078[0m     +  34.6594
      8   0.0903   0.3612        [35m0.3896[0m       0.9045        [94m0.3831[0m     +  34.5262
      9   0.0919   0.3806        [35m0.3613[0m       0.9045        [94m0.3637[0m     +  34.2282
     10   0.0955   0.4087        [35m0.3420[0m       0.9045        [94m0.3488[0m     +  34.3341
     11   0.1027   [32m0.4457[0m        [35m0.3243[0m       0.9045        [94m0.3371[0m     +  34.1381
     12   [36m0.1132[0m   [32m0.4842[0m        [35m0.3110[0m       0.9045        [94m0.3282[0m     +  34.3626
     13   [36m0.1486[0m   [32m0.5215[0m        [35m0.2989[0m       0.9045        [94m0.3213[0m     +  34.3831
     14   [36m0.1663[0m   [32m0.5573[0m        [35m0.2889[0m       0.9045        [94m0.3159[0m     +  34.2693
     15   [36m0.1817[0m   [32m0.5881[0m        [35m0.2827[0m       0.9045        [94m0.3117[0m     +  34.3750
     16   [36m0.1948[0m   [32m0.6125[0m        [35m0.2759[0m       0.9045        [94m0.3085[0m     +  34.5651
     17   [36m0.1990[0m   [32m0.6345[0m        [35m0.2703[0m       0.9045        [94m0.3059[0m     +  34.3938
     18   [36m0.2049[0m   [32m0.6513[0m        [35m0.2678[0m       0.9045        [94m0.3037[0m     +  34.4834
     19   [36m0.2136[0m   [32m0.6655[0m        [35m0.2639[0m       0.9045        [94m0.3021[0m     +  34.3667
     20   [36m0.2204[0m   [32m0.6784[0m        [35m0.2609[0m       0.9045        [94m0.3007[0m     +  34.1598
     21   [36m0.2278[0m   [32m0.6903[0m        [35m0.2589[0m       0.9045        [94m0.2993[0m     +  34.3697
     22   [36m0.2297[0m   [32m0.6996[0m        [35m0.2555[0m       0.9045        [94m0.2982[0m     +  34.4201
     23   [36m0.2358[0m   [32m0.7074[0m        [35m0.2546[0m       0.9045        [94m0.2972[0m     +  34.3881
     24   [36m0.2435[0m   [32m0.7156[0m        [35m0.2537[0m       0.9045        [94m0.2961[0m     +  34.3994
     25   [36m0.2478[0m   [32m0.7222[0m        [35m0.2514[0m       0.9045        [94m0.2956[0m     +  34.5688
     26   [36m0.2526[0m   [32m0.7270[0m        [35m0.2498[0m       0.9045        [94m0.2948[0m     +  34.2485
     27   [36m0.2575[0m   [32m0.7312[0m        [35m0.2492[0m       0.9045        [94m0.2940[0m     +  34.2141
     28   [36m0.2608[0m   [32m0.7347[0m        [35m0.2489[0m       0.9045        [94m0.2933[0m     +  34.4761
     29   [36m0.2663[0m   [32m0.7398[0m        [35m0.2459[0m       0.9045        [94m0.2926[0m     +  34.5583
     30   [36m0.2675[0m   [32m0.7430[0m        0.2464       0.9045        [94m0.2918[0m     +  34.3436
     31   [36m0.2688[0m   [32m0.7468[0m        0.2463       [31m0.9057[0m        [94m0.2910[0m     +  34.1508
     32   [36m0.2738[0m   [32m0.7515[0m        [35m0.2450[0m       0.9057        [94m0.2902[0m     +  34.3491
     33   [36m0.2757[0m   [32m0.7538[0m        [35m0.2448[0m       0.9057        [94m0.2896[0m     +  34.1586
     34   [36m0.2785[0m   [32m0.7568[0m        [35m0.2424[0m       0.9057        [94m0.2890[0m     +  34.5762
     35   [36m0.2828[0m   [32m0.7598[0m        0.2431       0.9045        [94m0.2883[0m     +  34.2817
     36   [36m0.2851[0m   [32m0.7620[0m        0.2429       0.9045        [94m0.2876[0m     +  34.2475
     37   [36m0.2853[0m   [32m0.7636[0m        [35m0.2406[0m       0.9045        [94m0.2869[0m     +  34.2954
     38   [36m0.2860[0m   [32m0.7660[0m        [35m0.2406[0m       0.9045        [94m0.2861[0m     +  34.1980
     39   [36m0.2873[0m   [32m0.7677[0m        [35m0.2401[0m       0.9045        [94m0.2856[0m     +  34.5566
     40   [36m0.2898[0m   [32m0.7703[0m        [35m0.2392[0m       0.9045        [94m0.2847[0m     +  34.5248
     41   [36m0.2932[0m   [32m0.7730[0m        0.2400       0.9045        [94m0.2838[0m     +  34.2998
     42   [36m0.2952[0m   [32m0.7748[0m        [35m0.2392[0m       0.9057        [94m0.2834[0m     +  34.0895
     43   [36m0.2980[0m   [32m0.7766[0m        [35m0.2378[0m       0.9057        [94m0.2824[0m     +  34.2486
     44   [36m0.3001[0m   [32m0.7790[0m        0.2390       0.9057        [94m0.2819[0m     +  34.2706
     45   [36m0.3031[0m   [32m0.7806[0m        [35m0.2366[0m       0.9045        [94m0.2813[0m     +  34.5316
     46   [36m0.3059[0m   [32m0.7827[0m        0.2372       0.9045        [94m0.2806[0m     +  34.5338
     47   [36m0.3082[0m   [32m0.7839[0m        [35m0.2364[0m       0.9045        [94m0.2802[0m     +  34.1874
     48   [36m0.3105[0m   [32m0.7857[0m        0.2365       0.9045        [94m0.2794[0m     +  34.3046
     49   [36m0.3125[0m   [32m0.7869[0m        [35m0.2356[0m       0.9045        [94m0.2787[0m     +  34.1138
     50   [36m0.3147[0m   [32m0.7892[0m        [35m0.2351[0m       0.9045        [94m0.2778[0m     +  34.2072
[32m[I 2023-05-04 16:57:01,587][0m Trial 467 finished with value: 0.2778454970798152 and parameters: {'lr': 7.987172806841552e-07, 'dropout': 0.4897928002114429, 'd_model_multiplier': 4, 'num_layers': 4, 'n_heads': 64, 'dim_feedforward': 342, 'batch_size': 55, 'pos_encoding': 'fixed', 'activation': 'relu', 'norm': 'LayerNorm', 'optimizer_name': 'RAdam', 'weight_decay': 0.1, 'top_n_features': 53}. Best is trial 246 with value: 0.16447311791139763.[0m
[FileBasedDataset] Initializing dataset...
	Examples: 8264
	Features: 48
	Max length: 315
Standard scalar turned ON, loading params from cache
[FileBasedDataset] Dataset initialization complete
  epoch    auprc    auroc    train_loss    valid_acc    valid_loss    cp      dur
-------  -------  -------  ------------  -----------  ------------  ----  -------
      1   [36m0.0634[0m   [32m0.3926[0m        [35m0.3381[0m       [31m0.9311[0m        [94m0.3026[0m     +  27.0642
      2   [36m0.0846[0m   [32m0.5377[0m        [35m0.2771[0m       0.9311        [94m0.2640[0m     +  26.9350
      3   [36m0.1259[0m   [32m0.6153[0m        [35m0.2647[0m       0.9311        [94m0.2470[0m     +  27.1683
      4   [36m0.1564[0m   0.6121        0.2743       0.9311        [94m0.2444[0m     +  27.3667
      5   0.1499   [32m0.6641[0m        0.2706       0.9178        0.2600        27.1854
      6   [36m0.1834[0m   0.6575        0.2683       0.9311        [94m0.2428[0m     +  27.5835
      7   0.1639   [32m0.6656[0m        [35m0.2627[0m       0.9311        [94m0.2392[0m     +  27.3605
      8   0.1675   [32m0.6743[0m        0.2682       0.9311        0.2423        27.3741
      9   0.0689   0.5000        0.2764       0.9311        0.2543        27.7081
     10   0.0689   0.5000        0.2783       0.9311        0.2541        27.1752
     11   0.0689   0.5000        0.3007       0.9311        0.2539        27.4100
     12   0.0689   0.5000        0.2781       0.9311        0.2540        27.5446
     13   0.0689   0.5000        0.2780       0.9311        0.2539        27.4834
     14   0.0689   0.5000        0.2779       0.9311        0.2539        27.4873
     15   0.0689   0.5000        0.2864       0.9311        0.2538        27.3376
     16   0.0689   0.5000        0.2780       0.9311        0.2539        27.3162
Stopping since valid_loss has not improved in the last 10 epochs.
[32m[I 2023-05-04 17:04:47,298][0m Trial 468 finished with value: 0.23916485125453468 and parameters: {'lr': 0.08823108384852245, 'dropout': 0.29187271144703386, 'd_model_multiplier': 4, 'num_layers': 6, 'n_heads': 32, 'dim_feedforward': 319, 'batch_size': 46, 'pos_encoding': 'fixed', 'activation': 'relu', 'norm': 'LayerNorm', 'optimizer_name': 'RAdam', 'weight_decay': 0.1, 'top_n_features': 48}. Best is trial 246 with value: 0.16447311791139763.[0m
[FileBasedDataset] Initializing dataset...
	Examples: 8264
	Features: 60
	Max length: 315
Standard scalar turned ON, loading params from cache
[FileBasedDataset] Dataset initialization complete
  epoch    auprc    auroc    train_loss    valid_acc    valid_loss    cp      dur
-------  -------  -------  ------------  -----------  ------------  ----  -------
      1   [36m0.1941[0m   [32m0.6923[0m        [35m0.2824[0m       [31m0.8936[0m        [94m0.2771[0m     +  12.6707
      2   [36m0.1967[0m   0.6802        [35m0.2626[0m       [31m0.8984[0m        [94m0.2708[0m     +  12.8431
      3   0.1893   0.6786        [35m0.2622[0m       [31m0.8996[0m        [94m0.2699[0m     +  12.7180
      4   0.1961   0.6795        [35m0.2606[0m       [31m0.9154[0m        [94m0.2605[0m     +  12.7084
      5   [36m0.2064[0m   0.6816        [35m0.2562[0m       0.9057        0.2630        13.1785
      6   [36m0.2148[0m   0.6758        0.2588       [31m0.9178[0m        [94m0.2587[0m     +  12.9373
      7   0.2026   0.6780        0.2581       [31m0.9190[0m        0.2603        12.9835
      8   [36m0.2163[0m   0.6705        0.2578       [31m0.9202[0m        [94m0.2574[0m     +  12.7583
      9   0.2030   0.6735        0.2575       0.9166        0.2609        12.7695
     10   0.2068   0.6780        [35m0.2538[0m       0.9190        0.2575        13.0506
     11   0.2083   0.6815        0.2542       0.9190        [94m0.2557[0m     +  12.9356
     12   0.2148   0.6900        0.2568       0.9190        [94m0.2557[0m     +  13.0386
     13   0.2013   0.6850        0.2549       0.9190        [94m0.2555[0m     +  13.1657
     14   0.1894   0.6645        0.2571       0.9190        0.2568        13.1199
     15   0.1915   0.6695        [35m0.2524[0m       0.9190        0.2575        12.8968
     16   0.2014   0.6732        [35m0.2521[0m       0.9190        0.2579        13.1545
     17   0.2086   0.6801        0.2529       0.9190        0.2615        13.2814
     18   0.2047   0.6844        0.2533       0.9190        0.2567        13.3149
     19   0.2072   0.6801        [35m0.2509[0m       0.9190        [94m0.2551[0m     +  13.2859
     20   0.2042   0.6837        0.2511       0.9190        0.2555        13.0123
     21   0.2148   0.6855        0.2511       0.9190        0.2570        12.8574
     22   [36m0.2174[0m   0.6846        0.2521       0.9190        0.2556        13.0803
     23   0.2173   0.6751        0.2522       0.9190        [94m0.2548[0m     +  12.9111
     24   [36m0.2243[0m   0.6876        0.2512       0.9190        [94m0.2542[0m     +  13.1924
     25   0.2087   0.6820        [35m0.2492[0m       0.9190        0.2550        12.9717
     26   0.2036   0.6750        0.2501       0.9190        0.2553        12.9621
     27   0.2155   0.6806        0.2500       0.9190        0.2545        13.1451
     28   0.2158   0.6746        [35m0.2488[0m       0.9190        0.2544        13.1630
     29   0.2120   0.6732        [35m0.2482[0m       0.9190        0.2550        12.9765
     30   0.2215   0.6757        0.2498       0.9190        0.2547        12.8181
     31   [36m0.2243[0m   0.6740        0.2498       0.9190        0.2548        12.7085
     32   0.2073   0.6769        [35m0.2482[0m       0.9190        0.2548        12.5505
     33   0.2015   0.6794        0.2484       0.9190        0.2550        13.3192
     34   0.2081   0.6808        0.2490       0.9190        [94m0.2541[0m     +  13.0147
     35   0.2050   0.6820        0.2482       0.9190        0.2549        12.8908
     36   0.2089   0.6822        [35m0.2477[0m       0.9190        0.2549        12.8556
     37   0.2150   0.6824        0.2484       0.9190        [94m0.2540[0m     +  12.9096
     38   0.2161   0.6869        0.2480       0.9190        [94m0.2537[0m     +  12.8087
     39   0.2102   0.6877        [35m0.2476[0m       0.9190        0.2541        12.7796
     40   0.2034   0.6866        0.2480       0.9190        0.2545        13.3141
     41   0.2073   0.6826        0.2478       0.9190        0.2542        13.1844
     42   0.2064   0.6917        [35m0.2468[0m       0.9190        0.2544        12.9580
     43   0.1999   0.6869        0.2481       0.9190        0.2552        12.8544
     44   0.2002   0.6825        0.2481       0.9190        0.2549        13.2865
     45   0.2042   0.6908        0.2478       0.9190        0.2545        13.0915
     46   0.2050   0.6905        0.2484       0.9190        0.2551        12.8829
     47   0.2083   0.6857        0.2476       0.9190        0.2554        13.2415
Stopping since valid_loss has not improved in the last 10 epochs.
[32m[I 2023-05-04 17:15:12,338][0m Trial 469 finished with value: 0.2536532978922525 and parameters: {'lr': 0.005301349052793872, 'dropout': 0.4024065765330892, 'd_model_multiplier': 4, 'num_layers': 7, 'n_heads': 8, 'dim_feedforward': 350, 'batch_size': 59, 'pos_encoding': 'fixed', 'activation': 'relu', 'norm': 'LayerNorm', 'optimizer_name': 'AdamW', 'weight_decay': 0.001, 'top_n_features': 60}. Best is trial 246 with value: 0.16447311791139763.[0m
[FileBasedDataset] Initializing dataset...
	Examples: 8264
	Features: 91
	Max length: 315
Standard scalar turned ON, loading params from cache
[FileBasedDataset] Dataset initialization complete
  epoch    auprc    auroc    train_loss    valid_acc    valid_loss    cp      dur
-------  -------  -------  ------------  -----------  ------------  ----  -------
      1   [36m0.2042[0m   [32m0.6503[0m        [35m0.4103[0m       [31m0.9190[0m        [94m0.2657[0m     +  25.5508
      2   [36m0.3004[0m   [32m0.7708[0m        [35m0.2505[0m       [31m0.9202[0m        [94m0.2412[0m     +  25.6249
      3   0.2900   [32m0.7815[0m        [35m0.2373[0m       0.9141        0.2488        25.8140
      4   0.2866   [32m0.7927[0m        [35m0.2313[0m       0.9129        0.2482        26.0240
      5   0.2908   [32m0.7949[0m        [35m0.2302[0m       0.9105        0.2506        25.5442
      6   0.2938   [32m0.7983[0m        [35m0.2280[0m       0.9105        0.2514        25.7191
      7   0.2814   0.7976        [35m0.2274[0m       0.9117        0.2562        25.7797
      8   0.2730   0.7871        [35m0.2264[0m       0.9141        0.2565        25.9943
      9   0.2764   0.7838        [35m0.2252[0m       0.9105        0.2631        26.0285
     10   0.2758   0.7890        [35m0.2215[0m       0.9093        0.2613        25.8496
     11   0.2817   0.7858        [35m0.2210[0m       0.9141        0.2634        26.2233
Stopping since valid_loss has not improved in the last 10 epochs.
[32m[I 2023-05-04 17:20:23,141][0m Trial 470 finished with value: 0.24120934827404125 and parameters: {'lr': 7.737917161615645e-05, 'dropout': 0.43037969430871204, 'd_model_multiplier': 8, 'num_layers': 5, 'n_heads': 32, 'dim_feedforward': 333, 'batch_size': 67, 'pos_encoding': 'fixed', 'activation': 'relu', 'norm': 'LayerNorm', 'optimizer_name': 'RAdam', 'weight_decay': 0.1, 'top_n_features': 91}. Best is trial 246 with value: 0.16447311791139763.[0m
[FileBasedDataset] Initializing dataset...
	Examples: 8264
	Features: 106
	Max length: 315
Standard scalar turned ON, loading params from cache
[FileBasedDataset] Dataset initialization complete
Warning, assumed runtime error: CUDA out of memory. Tried to allocate 1.79 GiB (GPU 0; 23.70 GiB total capacity; 18.54 GiB already allocated; 51.25 MiB free; 22.56 GiB reserved in total by PyTorch) If reserved memory is >> allocated memory try setting max_split_size_mb to avoid fragmentation.  See documentation for Memory Management and PYTORCH_CUDA_ALLOC_CONF
[32m[I 2023-05-04 17:20:29,306][0m Trial 471 finished with value: 100.0 and parameters: {'lr': 5.2728241020330314e-08, 'dropout': 0.36658501627411466, 'd_model_multiplier': 4, 'num_layers': 4, 'n_heads': 32, 'dim_feedforward': 337, 'batch_size': 151, 'pos_encoding': 'fixed', 'activation': 'relu', 'norm': 'LayerNorm', 'optimizer_name': 'PlainRAdam', 'weight_decay': 0.1, 'top_n_features': 106}. Best is trial 246 with value: 0.16447311791139763.[0m
[FileBasedDataset] Initializing dataset...
	Examples: 8264
	Features: 68
	Max length: 315
Standard scalar turned ON, loading params from cache
[FileBasedDataset] Dataset initialization complete
Warning, assumed runtime error: CUDA out of memory. Tried to allocate 1.85 GiB (GPU 0; 23.70 GiB total capacity; 19.76 GiB already allocated; 785.25 MiB free; 21.84 GiB reserved in total by PyTorch) If reserved memory is >> allocated memory try setting max_split_size_mb to avoid fragmentation.  See documentation for Memory Management and PYTORCH_CUDA_ALLOC_CONF
