[32m[I 2023-05-02 00:55:14,511][0m Trial 5 finished with value: 0.6829633771147953 and parameters: {'lr': 9.253392554534966e-07, 'dropout': 0.11563479139426676, 'd_model_multiplier': 1, 'num_layers': 8, 'n_heads': 8, 'dim_feedforward': 367, 'batch_size': 236, 'pos_encoding': 'learnable', 'activation': 'gelu', 'norm': 'LayerNorm', 'optimizer_name': 'RAdam', 'weight_decay': 0, 'top_n_features': 132}. Best is trial 0 with value: 0.23786523179607208.[0m
[FileBasedDataset] Initializing dataset...
	Examples: 8264
	Features: 118
	Max length: 315
Standard scalar turned ON, loading params from cache
[FileBasedDataset] Dataset initialization complete
  epoch    auprc    auroc    train_loss    valid_acc    valid_loss    cp      dur
-------  -------  -------  ------------  -----------  ------------  ----  -------
      1   [36m0.0515[0m   [32m0.2589[0m        [35m0.5982[0m       [31m0.9226[0m        [94m0.5145[0m     +  13.2843
      2   [36m0.0530[0m   [32m0.2611[0m        [35m0.4681[0m       0.9226        [94m0.4158[0m     +  13.5541
      3   [36m0.0538[0m   [32m0.2692[0m        [35m0.3958[0m       0.9226        [94m0.3615[0m     +  13.5806
      4   [36m0.0552[0m   [32m0.2923[0m        [35m0.3537[0m       0.9226        [94m0.3303[0m     +  13.7377
      5   [36m0.0577[0m   [32m0.3335[0m        [35m0.3269[0m       0.9226        [94m0.3114[0m     +  13.7817
      6   [36m0.0618[0m   [32m0.3786[0m        [35m0.3096[0m       0.9226        [94m0.2994[0m     +  13.6506
      7   [36m0.0670[0m   [32m0.4294[0m        [35m0.2976[0m       0.9226        [94m0.2915[0m     +  13.5882
      8   [36m0.0730[0m   [32m0.4780[0m        [35m0.2902[0m       0.9226        [94m0.2859[0m     +  13.4246
      9   [36m0.0802[0m   [32m0.5171[0m        [35m0.2828[0m       0.9226        [94m0.2819[0m     +  14.0247
     10   [36m0.0913[0m   [32m0.5496[0m        [35m0.2795[0m       0.9226        [94m0.2790[0m     +  13.8940
     11   [36m0.1213[0m   [32m0.5774[0m        [35m0.2771[0m       0.9226        [94m0.2768[0m     +  13.5893
     12   [36m0.1324[0m   [32m0.5992[0m        [35m0.2728[0m       0.9226        [94m0.2751[0m     +  13.7423
     13   [36m0.1416[0m   [32m0.6193[0m        [35m0.2714[0m       0.9226        [94m0.2737[0m     +  13.8614
     14   [36m0.1526[0m   [32m0.6359[0m        [35m0.2697[0m       0.9226        [94m0.2728[0m     +  13.5282
     15   [36m0.1603[0m   [32m0.6502[0m        [35m0.2685[0m       0.9226        [94m0.2720[0m     +  13.7759
     16   [36m0.1698[0m   [32m0.6612[0m        [35m0.2676[0m       0.9226        [94m0.2713[0m     +  13.5897
     17   [36m0.1773[0m   [32m0.6719[0m        [35m0.2671[0m       0.9226        [94m0.2708[0m     +  13.6558
     18   [36m0.1846[0m   [32m0.6814[0m        [35m0.2654[0m       0.9226        [94m0.2705[0m     +  13.7521
     19   [36m0.1911[0m   [32m0.6900[0m        [35m0.2653[0m       0.9226        [94m0.2702[0m     +  13.7268
     20   [36m0.1943[0m   [32m0.6972[0m        [35m0.2649[0m       0.9226        [94m0.2698[0m     +  13.5173
     21   [36m0.1991[0m   [32m0.7034[0m        [35m0.2645[0m       0.9226        [94m0.2695[0m     +  13.6160
     22   [36m0.2047[0m   [32m0.7090[0m        [35m0.2643[0m       0.9226        [94m0.2692[0m     +  13.9140
     23   [36m0.2089[0m   [32m0.7142[0m        [35m0.2632[0m       0.9226        [94m0.2688[0m     +  13.6164
     24   0.2042   [32m0.7186[0m        0.2637       0.9226        [94m0.2684[0m     +  13.5039
     25   0.2085   [32m0.7238[0m        [35m0.2629[0m       0.9226        [94m0.2679[0m     +  13.5985
     26   [36m0.2111[0m   [32m0.7287[0m        [35m0.2617[0m       0.9226        [94m0.2675[0m     +  13.3500
     27   [36m0.2146[0m   [32m0.7323[0m        0.2618       0.9226        [94m0.2670[0m     +  13.4468
     28   [36m0.2208[0m   [32m0.7361[0m        0.2621       0.9226        [94m0.2665[0m     +  13.8049
     29   [36m0.2255[0m   [32m0.7395[0m        [35m0.2612[0m       0.9226        [94m0.2660[0m     +  13.6720
     30   [36m0.2287[0m   [32m0.7421[0m        [35m0.2610[0m       0.9226        [94m0.2656[0m     +  13.6044
     31   [36m0.2305[0m   [32m0.7448[0m        [35m0.2604[0m       0.9226        [94m0.2651[0m     +  13.3521
     32   [36m0.2328[0m   [32m0.7471[0m        [35m0.2599[0m       0.9226        [94m0.2647[0m     +  13.4905
     33   [36m0.2372[0m   [32m0.7499[0m        [35m0.2593[0m       0.9226        [94m0.2643[0m     +  14.0068
     34   [36m0.2395[0m   [32m0.7517[0m        0.2595       0.9226        [94m0.2639[0m     +  13.4484
     35   [36m0.2421[0m   [32m0.7534[0m        0.2593       0.9226        [94m0.2635[0m     +  13.7878
     36   [36m0.2440[0m   [32m0.7548[0m        [35m0.2593[0m       0.9226        [94m0.2633[0m     +  13.7064
     37   0.2439   [32m0.7567[0m        [35m0.2591[0m       0.9226        [94m0.2630[0m     +  13.5055
     38   [36m0.2463[0m   [32m0.7588[0m        [35m0.2583[0m       0.9226        [94m0.2626[0m     +  13.5882
     39   [36m0.2512[0m   [32m0.7604[0m        [35m0.2581[0m       0.9226        [94m0.2624[0m     +  13.6963
     40   [36m0.2519[0m   [32m0.7618[0m        [35m0.2578[0m       0.9226        [94m0.2621[0m     +  13.5323
     41   [36m0.2540[0m   [32m0.7632[0m        0.2580       0.9226        [94m0.2616[0m     +  14.0616
     42   [36m0.2553[0m   [32m0.7644[0m        [35m0.2568[0m       0.9226        [94m0.2612[0m     +  13.8177
     43   [36m0.2567[0m   [32m0.7658[0m        0.2575       0.9226        [94m0.2610[0m     +  13.6789
     44   [36m0.2579[0m   [32m0.7670[0m        0.2568       0.9226        [94m0.2606[0m     +  13.6675
     45   [36m0.2597[0m   [32m0.7685[0m        [35m0.2568[0m       0.9226        [94m0.2604[0m     +  13.7496
     46   [36m0.2604[0m   [32m0.7691[0m        [35m0.2560[0m       0.9226        [94m0.2601[0m     +  14.1498
     47   [36m0.2612[0m   [32m0.7699[0m        [35m0.2558[0m       0.9226        [94m0.2598[0m     +  13.8626
     48   [36m0.2618[0m   [32m0.7704[0m        [35m0.2558[0m       0.9226        [94m0.2596[0m     +  13.8788
     49   [36m0.2630[0m   [32m0.7714[0m        0.2558       0.9226        [94m0.2593[0m     +  13.7009
     50   [36m0.2632[0m   [32m0.7721[0m        [35m0.2550[0m       0.9226        [94m0.2592[0m     +  13.8392
[32m[I 2023-05-02 01:06:54,114][0m Trial 6 finished with value: 0.25917867107368653 and parameters: {'lr': 8.06184080114586e-08, 'dropout': 0.24900358878865098, 'd_model_multiplier': 32, 'num_layers': 1, 'n_heads': 32, 'dim_feedforward': 146, 'batch_size': 13, 'pos_encoding': 'learnable', 'activation': 'relu', 'norm': 'LayerNorm', 'optimizer_name': 'AdamW', 'weight_decay': 0.1, 'top_n_features': 118}. Best is trial 0 with value: 0.23786523179607208.[0m
[FileBasedDataset] Initializing dataset...
	Examples: 8264
	Features: 121
	Max length: 315
Standard scalar turned ON, loading params from cache
[FileBasedDataset] Dataset initialization complete
  epoch    auprc    auroc    train_loss    valid_acc    valid_loss    cp      dur
-------  -------  -------  ------------  -----------  ------------  ----  -------
      1   [36m0.1019[0m   [32m0.3575[0m        [35m0.7122[0m       [31m0.3289[0m        [94m0.7038[0m     +  15.2926
      2   0.0908   0.3456        [35m0.6981[0m       [31m0.4861[0m        [94m0.6841[0m     +  15.8033
      3   0.0760   0.3402        [35m0.6793[0m       [31m0.7582[0m        [94m0.6596[0m     +  15.8852
      4   0.0719   0.3320        [35m0.6546[0m       [31m0.8863[0m        [94m0.6326[0m     +  15.9684
      5   0.0699   0.3261        [35m0.6312[0m       [31m0.9069[0m        [94m0.6044[0m     +  16.2086
      6   0.0691   0.3232        [35m0.6048[0m       0.9069        [94m0.5759[0m     +  16.2080
      7   0.0684   0.3209        [35m0.5789[0m       0.9069        [94m0.5478[0m     +  16.0141
      8   0.0677   0.3192        [35m0.5517[0m       0.9069        [94m0.5212[0m     +  15.6306
      9   0.0674   0.3185        [35m0.5276[0m       0.9069        [94m0.4964[0m     +  15.6829
     10   0.0675   0.3190        [35m0.5028[0m       0.9069        [94m0.4735[0m     +  15.7747
     11   0.0675   0.3195        [35m0.4807[0m       0.9069        [94m0.4528[0m     +  15.4850
     12   0.0676   0.3202        [35m0.4575[0m       0.9069        [94m0.4341[0m     +  15.2713
     13   0.0677   0.3218        [35m0.4385[0m       0.9069        [94m0.4173[0m     +  15.7789
     14   0.0680   0.3244        [35m0.4200[0m       0.9069        [94m0.4022[0m     +  15.6507
     15   0.0686   0.3318        [35m0.4039[0m       0.9069        [94m0.3885[0m     +  15.6655
     16   0.0695   0.3451        [35m0.3890[0m       0.9069        [94m0.3763[0m     +  16.0148
     17   0.0714   [32m0.3675[0m        [35m0.3748[0m       0.9069        [94m0.3654[0m     +  15.9784
     18   0.0738   [32m0.3933[0m        [35m0.3616[0m       0.9069        [94m0.3556[0m     +  15.6556
     19   0.0765   [32m0.4193[0m        [35m0.3502[0m       0.9069        [94m0.3467[0m     +  15.6651
     20   0.0793   [32m0.4443[0m        [35m0.3387[0m       0.9069        [94m0.3389[0m     +  15.7403
     21   0.0830   [32m0.4719[0m        [35m0.3301[0m       0.9069        [94m0.3319[0m     +  15.4445
     22   0.0876   [32m0.4996[0m        [35m0.3211[0m       0.9069        [94m0.3256[0m     +  15.2235
     23   0.0929   [32m0.5252[0m        [35m0.3129[0m       0.9069        [94m0.3201[0m     +  15.8320
     24   0.0992   [32m0.5505[0m        [35m0.3062[0m       0.9069        [94m0.3153[0m     +  15.6515
     25   [36m0.1075[0m   [32m0.5746[0m        [35m0.3001[0m       0.9069        [94m0.3110[0m     +  15.6589
     26   [36m0.1179[0m   [32m0.5940[0m        [35m0.2945[0m       0.9069        [94m0.3073[0m     +  15.6470
     27   [36m0.1362[0m   [32m0.6122[0m        [35m0.2909[0m       0.9069        [94m0.3040[0m     +  15.7393
     28   [36m0.1655[0m   [32m0.6298[0m        [35m0.2868[0m       0.9069        [94m0.3014[0m     +  15.8764
     29   [36m0.1761[0m   [32m0.6427[0m        [35m0.2837[0m       0.9069        [94m0.2989[0m     +  15.7190
     30   [36m0.1843[0m   [32m0.6539[0m        [35m0.2798[0m       0.9069        [94m0.2968[0m     +  15.2393
     31   [36m0.1947[0m   [32m0.6634[0m        [35m0.2764[0m       0.9069        [94m0.2949[0m     +  16.0569
     32   [36m0.2020[0m   [32m0.6721[0m        [35m0.2747[0m       0.9069        [94m0.2933[0m     +  15.8273
     33   [36m0.2048[0m   [32m0.6790[0m        [35m0.2716[0m       0.9069        [94m0.2918[0m     +  15.6644
     34   [36m0.2069[0m   [32m0.6847[0m        [35m0.2701[0m       0.9069        [94m0.2907[0m     +  16.0452
     35   [36m0.2111[0m   [32m0.6905[0m        [35m0.2666[0m       0.9069        [94m0.2895[0m     +  16.0189
     36   [36m0.2156[0m   [32m0.6966[0m        [35m0.2650[0m       0.9069        [94m0.2884[0m     +  15.8345
     37   [36m0.2200[0m   [32m0.7014[0m        0.2657       0.9069        [94m0.2874[0m     +  15.7730
     38   [36m0.2233[0m   [32m0.7053[0m        [35m0.2631[0m       0.9069        [94m0.2867[0m     +  15.8542
     39   [36m0.2315[0m   [32m0.7103[0m        [35m0.2615[0m       0.9069        [94m0.2859[0m     +  15.8459
     40   [36m0.2339[0m   [32m0.7139[0m        [35m0.2601[0m       0.9069        [94m0.2852[0m     +  15.5557
     41   [36m0.2356[0m   [32m0.7167[0m        [35m0.2591[0m       0.9069        [94m0.2846[0m     +  15.8870
     42   [36m0.2360[0m   [32m0.7192[0m        [35m0.2581[0m       0.9069        [94m0.2838[0m     +  15.8753
     43   [36m0.2384[0m   [32m0.7221[0m        [35m0.2563[0m       0.9069        [94m0.2832[0m     +  15.6211
     44   [36m0.2407[0m   [32m0.7246[0m        [35m0.2557[0m       0.9069        [94m0.2828[0m     +  15.9086
     45   [36m0.2415[0m   [32m0.7272[0m        [35m0.2543[0m       0.9069        [94m0.2821[0m     +  15.5862
     46   [36m0.2472[0m   [32m0.7283[0m        [35m0.2538[0m       0.9069        [94m0.2819[0m     +  15.9808
     47   [36m0.2485[0m   [32m0.7303[0m        [35m0.2531[0m       0.9069        [94m0.2817[0m     +  15.5875
     48   [36m0.2504[0m   [32m0.7328[0m        [35m0.2515[0m       0.9069        [94m0.2811[0m     +  15.8329
     49   [36m0.2534[0m   [32m0.7353[0m        [35m0.2510[0m       0.9069        [94m0.2804[0m     +  15.7722
     50   [36m0.2544[0m   [32m0.7372[0m        [35m0.2497[0m       0.9069        [94m0.2801[0m     +  16.0746
[32m[I 2023-05-02 01:20:11,816][0m Trial 7 finished with value: 0.2800745686207602 and parameters: {'lr': 5.636199973335043e-07, 'dropout': 0.4632210752118876, 'd_model_multiplier': 64, 'num_layers': 8, 'n_heads': 4, 'dim_feedforward': 324, 'batch_size': 94, 'pos_encoding': 'fixed', 'activation': 'gelu', 'norm': 'LayerNorm', 'optimizer_name': 'PlainRAdam', 'weight_decay': 0.1, 'top_n_features': 121}. Best is trial 0 with value: 0.23786523179607208.[0m
[FileBasedDataset] Initializing dataset...
	Examples: 8264
	Features: 239
	Max length: 315
Standard scalar turned ON, loading params from cache
[FileBasedDataset] Dataset initialization complete
Warning, assumed runtime error: CUDA out of memory. Tried to allocate 2.93 GiB (GPU 0; 23.70 GiB total capacity; 20.64 GiB already allocated; 107.25 MiB free; 22.51 GiB reserved in total by PyTorch) If reserved memory is >> allocated memory try setting max_split_size_mb to avoid fragmentation.  See documentation for Memory Management and PYTORCH_CUDA_ALLOC_CONF
[32m[I 2023-05-02 01:20:17,836][0m Trial 8 finished with value: 100.0 and parameters: {'lr': 0.04882980854535755, 'dropout': 0.6673646014264424, 'd_model_multiplier': 2, 'num_layers': 8, 'n_heads': 64, 'dim_feedforward': 166, 'batch_size': 124, 'pos_encoding': 'fixed', 'activation': 'relu', 'norm': 'BatchNorm', 'optimizer_name': 'RAdam', 'weight_decay': 0.1, 'top_n_features': 239}. Best is trial 0 with value: 0.23786523179607208.[0m
[FileBasedDataset] Initializing dataset...
	Examples: 8264
	Features: 18
	Max length: 315
Standard scalar turned ON, loading params from cache
[FileBasedDataset] Dataset initialization complete
Warning, assumed runtime error: CUDA out of memory. Tried to allocate 2.22 GiB (GPU 0; 23.70 GiB total capacity; 18.86 GiB already allocated; 91.25 MiB free; 22.53 GiB reserved in total by PyTorch) If reserved memory is >> allocated memory try setting max_split_size_mb to avoid fragmentation.  See documentation for Memory Management and PYTORCH_CUDA_ALLOC_CONF
[32m[I 2023-05-02 01:20:21,786][0m Trial 9 finished with value: 100.0 and parameters: {'lr': 0.0024716764119156764, 'dropout': 0.30058817699016865, 'd_model_multiplier': 16, 'num_layers': 15, 'n_heads': 64, 'dim_feedforward': 149, 'batch_size': 94, 'pos_encoding': 'learnable', 'activation': 'gelu', 'norm': 'LayerNorm', 'optimizer_name': 'RAdam', 'weight_decay': 0.01, 'top_n_features': 18}. Best is trial 0 with value: 0.23786523179607208.[0m
[FileBasedDataset] Initializing dataset...
	Examples: 8264
	Features: 195
	Max length: 315
Standard scalar turned ON, loading params from cache
[FileBasedDataset] Dataset initialization complete
  epoch    auprc    auroc    train_loss    valid_acc    valid_loss    cp      dur
-------  -------  -------  ------------  -----------  ------------  ----  -------
      1   [36m0.0812[0m   [32m0.4509[0m        [35m0.6594[0m       [31m0.8549[0m        [94m0.6759[0m     +  18.6777
      2   0.0786   0.4418        [35m0.6549[0m       [31m0.8609[0m        0.6760        18.1127
      3   0.0787   0.4410        [35m0.6546[0m       [31m0.8622[0m        0.6761        18.6604
      4   0.0791   0.4413        0.6587       0.8597        0.6762        18.7798
      5   0.0785   0.4403        0.6584       [31m0.8634[0m        [94m0.6758[0m     +  19.6509
      6   0.0784   0.4403        0.6562       [31m0.8670[0m        [94m0.6756[0m     +  18.7120
      7   0.0781   0.4384        0.6564       0.8670        0.6756        19.1117
      8   0.0781   0.4379        0.6567       0.8646        [94m0.6756[0m     +  19.3101
      9   0.0777   0.4353        0.6561       0.8646        0.6757        19.8173
     10   0.0784   0.4386        [35m0.6543[0m       0.8646        [94m0.6756[0m     +  19.2764
     11   0.0767   0.4325        0.6558       0.8658        [94m0.6753[0m     +  19.2583
     12   0.0768   0.4326        0.6563       0.8658        0.6756        19.3931
     13   0.0769   0.4333        [35m0.6520[0m       0.8646        0.6756        19.3971
     14   0.0758   0.4304        0.6541       [31m0.8694[0m        [94m0.6750[0m     +  18.8888
     15   0.0765   0.4306        0.6563       0.8658        0.6752        18.4383
     16   0.0770   0.4329        0.6538       0.8694        [94m0.6750[0m     +  19.4966
     17   0.0759   0.4310        [35m0.6513[0m       [31m0.8706[0m        [94m0.6747[0m     +  19.0732
     18   0.0761   0.4301        [35m0.6504[0m       [31m0.8730[0m        [94m0.6746[0m     +  19.1159
     19   0.0764   0.4324        0.6525       0.8706        0.6751        18.9634
     20   0.0758   0.4274        0.6542       0.8694        0.6750        19.0737
     21   0.0750   0.4291        0.6532       0.8694        [94m0.6745[0m     +  19.0061
     22   0.0761   0.4300        0.6523       0.8694        0.6748        19.4506
     23   0.0753   0.4285        0.6515       [31m0.8779[0m        [94m0.6739[0m     +  18.5630
     24   0.0757   0.4287        0.6529       0.8730        0.6742        18.9531
     25   0.0748   0.4272        0.6510       0.8706        0.6746        19.3247
     26   0.0758   0.4286        0.6517       0.8767        0.6740        20.1090
     27   0.0750   0.4271        [35m0.6496[0m       0.8742        0.6740        19.2414
     28   0.0747   0.4254        0.6502       0.8718        0.6742        19.2473
     29   0.0742   0.4249        0.6504       [31m0.8803[0m        [94m0.6736[0m     +  19.2073
     30   0.0736   0.4236        0.6533       0.8767        0.6736        18.8644
     31   0.0734   0.4222        0.6513       0.8767        0.6738        19.6096
     32   0.0730   0.4217        0.6507       0.8755        0.6737        19.4744
     33   0.0728   0.4202        0.6532       0.8779        0.6737        19.2494
     34   0.0737   0.4242        0.6504       0.8791        [94m0.6734[0m     +  18.7258
     35   0.0741   0.4236        [35m0.6485[0m       0.8791        0.6736        18.7156
     36   0.0736   0.4211        0.6497       [31m0.8815[0m        [94m0.6731[0m     +  18.7027
     37   0.0724   0.4191        0.6506       0.8767        0.6736        19.1231
     38   0.0726   0.4196        0.6508       0.8791        0.6735        18.7853
     39   0.0728   0.4188        0.6494       0.8779        0.6736        19.2912
     40   0.0723   0.4182        [35m0.6475[0m       [31m0.8827[0m        [94m0.6730[0m     +  19.6461
     41   0.0716   0.4159        0.6509       0.8803        0.6730        19.1347
     42   0.0719   0.4167        0.6504       0.8803        0.6733        19.3279
     43   0.0719   0.4139        0.6476       0.8815        0.6732        19.3810
     44   0.0722   0.4177        0.6496       [31m0.8839[0m        [94m0.6730[0m     +  19.1057
     45   0.0719   0.4158        [35m0.6473[0m       0.8827        [94m0.6728[0m     +  18.3339
     46   0.0715   0.4155        0.6515       0.8803        0.6729        18.5534
     47   0.0710   0.4118        0.6489       [31m0.8888[0m        [94m0.6721[0m     +  19.1293
     48   0.0710   0.4110        0.6481       0.8875        0.6727        18.9833
     49   0.0707   0.4119        [35m0.6462[0m       0.8875        0.6725        19.1912
     50   0.0702   0.4094        [35m0.6456[0m       0.8888        0.6724        18.9643
[32m[I 2023-05-02 01:36:18,278][0m Trial 10 finished with value: 0.6721280657538768 and parameters: {'lr': 1.0437075065732811e-08, 'dropout': 0.5794483367723846, 'd_model_multiplier': 8, 'num_layers': 4, 'n_heads': 16, 'dim_feedforward': 406, 'batch_size': 246, 'pos_encoding': 'fixed', 'activation': 'relu', 'norm': 'BatchNorm', 'optimizer_name': 'AdamW', 'weight_decay': 0, 'top_n_features': 195}. Best is trial 0 with value: 0.23786523179607208.[0m
[FileBasedDataset] Initializing dataset...
	Examples: 8264
	Features: 180
	Max length: 315
Standard scalar turned ON, loading params from cache
[FileBasedDataset] Dataset initialization complete
Warning, assumed runtime error: CUDA out of memory. Tried to allocate 1.12 GiB (GPU 0; 23.70 GiB total capacity; 20.51 GiB already allocated; 99.25 MiB free; 22.52 GiB reserved in total by PyTorch) If reserved memory is >> allocated memory try setting max_split_size_mb to avoid fragmentation.  See documentation for Memory Management and PYTORCH_CUDA_ALLOC_CONF
