[32m[I 2023-05-04 17:20:33,168][0m Trial 472 finished with value: 100.0 and parameters: {'lr': 4.241232046413705e-05, 'dropout': 0.46666292307400054, 'd_model_multiplier': 4, 'num_layers': 5, 'n_heads': 64, 'dim_feedforward': 435, 'batch_size': 78, 'pos_encoding': 'fixed', 'activation': 'relu', 'norm': 'LayerNorm', 'optimizer_name': 'AdamW', 'weight_decay': 0.1, 'top_n_features': 68}. Best is trial 246 with value: 0.16447311791139763.[0m
[FileBasedDataset] Initializing dataset...
	Examples: 8264
	Features: 55
	Max length: 315
Standard scalar turned ON, loading params from cache
[FileBasedDataset] Dataset initialization complete
  epoch    auprc    auroc    train_loss    valid_acc    valid_loss    cp      dur
-------  -------  -------  ------------  -----------  ------------  ----  -------
      1   [36m0.0705[0m   [32m0.3554[0m        [35m0.6188[0m       [31m0.9178[0m        [94m0.4630[0m     +  15.8806
      2   [36m0.0832[0m   [32m0.4776[0m        [35m0.3958[0m       0.9178        [94m0.3161[0m     +  16.0813
      3   [36m0.1898[0m   [32m0.6265[0m        [35m0.3004[0m       0.9178        [94m0.2751[0m     +  16.2288
      4   [36m0.2456[0m   [32m0.6736[0m        [35m0.2674[0m       0.9178        [94m0.2626[0m     +  16.1599
      5   [36m0.2787[0m   [32m0.7043[0m        [35m0.2545[0m       0.9178        [94m0.2575[0m     +  15.9441
      6   [36m0.2801[0m   [32m0.7229[0m        [35m0.2482[0m       [31m0.9190[0m        [94m0.2547[0m     +  16.3294
      7   [36m0.2906[0m   [32m0.7413[0m        [35m0.2440[0m       0.9178        [94m0.2523[0m     +  16.2413
      8   [36m0.2934[0m   [32m0.7553[0m        [35m0.2397[0m       0.9178        [94m0.2503[0m     +  16.0015
      9   [36m0.3014[0m   [32m0.7629[0m        [35m0.2385[0m       [31m0.9202[0m        [94m0.2491[0m     +  16.1996
     10   [36m0.3071[0m   [32m0.7687[0m        [35m0.2358[0m       [31m0.9238[0m        [94m0.2481[0m     +  16.1880
     11   [36m0.3164[0m   [32m0.7732[0m        0.2361       0.9238        [94m0.2474[0m     +  16.2923
     12   0.3144   [32m0.7769[0m        [35m0.2343[0m       [31m0.9250[0m        [94m0.2468[0m     +  16.2203
     13   [36m0.3258[0m   [32m0.7799[0m        [35m0.2336[0m       0.9250        [94m0.2462[0m     +  16.0296
     14   [36m0.3336[0m   [32m0.7832[0m        [35m0.2316[0m       0.9250        [94m0.2457[0m     +  16.4038
     15   [36m0.3347[0m   [32m0.7849[0m        0.2318       0.9238        [94m0.2451[0m     +  15.9341
     16   [36m0.3405[0m   [32m0.7862[0m        [35m0.2304[0m       0.9214        [94m0.2447[0m     +  16.2690
     17   [36m0.3427[0m   [32m0.7889[0m        [35m0.2292[0m       0.9202        [94m0.2443[0m     +  16.2547
     18   [36m0.3434[0m   [32m0.7908[0m        0.2309       0.9202        [94m0.2435[0m     +  16.1917
     19   [36m0.3496[0m   [32m0.7924[0m        0.2298       0.9202        [94m0.2431[0m     +  16.0484
     20   [36m0.3516[0m   [32m0.7938[0m        [35m0.2282[0m       0.9178        [94m0.2430[0m     +  16.2730
     21   [36m0.3536[0m   [32m0.7954[0m        [35m0.2275[0m       0.9178        [94m0.2423[0m     +  16.1697
     22   [36m0.3601[0m   [32m0.7971[0m        0.2279       0.9190        [94m0.2420[0m     +  16.1173
     23   [36m0.3636[0m   [32m0.7982[0m        [35m0.2267[0m       0.9202        0.2422        16.2672
     24   [36m0.3656[0m   [32m0.7991[0m        0.2270       0.9202        [94m0.2417[0m     +  16.2789
     25   [36m0.3685[0m   [32m0.8006[0m        0.2278       0.9214        [94m0.2414[0m     +  16.1806
     26   [36m0.3716[0m   [32m0.8022[0m        [35m0.2265[0m       0.9214        [94m0.2411[0m     +  16.2632
     27   0.3714   [32m0.8037[0m        [35m0.2251[0m       0.9214        [94m0.2406[0m     +  16.3223
     28   0.3713   [32m0.8039[0m        [35m0.2245[0m       0.9214        0.2407        16.0407
     29   [36m0.3717[0m   [32m0.8043[0m        0.2257       0.9214        0.2408        16.1641
     30   [36m0.3746[0m   [32m0.8051[0m        0.2246       0.9202        0.2411        15.9935
     31   [36m0.3749[0m   [32m0.8058[0m        0.2257       0.9190        [94m0.2400[0m     +  16.1869
     32   [36m0.3799[0m   [32m0.8063[0m        0.2247       0.9202        [94m0.2396[0m     +  16.0277
     33   0.3797   [32m0.8064[0m        [35m0.2245[0m       0.9190        [94m0.2394[0m     +  16.2352
     34   [36m0.3859[0m   [32m0.8073[0m        0.2246       0.9190        [94m0.2389[0m     +  16.2601
     35   0.3858   [32m0.8078[0m        [35m0.2233[0m       0.9178        [94m0.2384[0m     +  16.1036
     36   0.3771   [32m0.8083[0m        0.2247       0.9178        0.2384        16.2682
     37   0.3788   [32m0.8090[0m        0.2236       0.9178        [94m0.2383[0m     +  16.1651
     38   0.3774   [32m0.8096[0m        [35m0.2233[0m       0.9178        [94m0.2383[0m     +  16.0030
     39   0.3772   [32m0.8100[0m        [35m0.2232[0m       0.9166        0.2386        16.2588
     40   0.3782   [32m0.8101[0m        [35m0.2230[0m       0.9166        [94m0.2382[0m     +  16.4219
     41   0.3798   [32m0.8106[0m        [35m0.2224[0m       0.9166        0.2383        16.2792
     42   0.3815   [32m0.8111[0m        [35m0.2221[0m       0.9166        [94m0.2379[0m     +  16.1450
     43   0.3730   [32m0.8115[0m        [35m0.2219[0m       0.9166        0.2383        16.1322
     44   0.3728   [32m0.8119[0m        0.2219       0.9166        0.2385        16.1052
     45   0.3722   [32m0.8128[0m        0.2225       0.9166        0.2380        16.1617
     46   0.3762   [32m0.8133[0m        0.2226       0.9166        [94m0.2371[0m     +  16.2658
     47   0.3802   0.8131        [35m0.2207[0m       0.9166        0.2374        15.9646
     48   0.3729   0.8131        [35m0.2203[0m       0.9166        0.2375        16.1137
     49   0.3727   0.8128        0.2224       0.9166        0.2377        16.1611
     50   0.3741   [32m0.8135[0m        0.2211       0.9166        0.2374        16.0921
[32m[I 2023-05-04 17:34:05,157][0m Trial 473 finished with value: 0.23710792394582422 and parameters: {'lr': 8.647048128004342e-06, 'dropout': 0.42327543708582893, 'd_model_multiplier': 4, 'num_layers': 3, 'n_heads': 32, 'dim_feedforward': 196, 'batch_size': 31, 'pos_encoding': 'fixed', 'activation': 'relu', 'norm': 'LayerNorm', 'optimizer_name': 'RAdam', 'weight_decay': 0.001, 'top_n_features': 55}. Best is trial 246 with value: 0.16447311791139763.[0m
[FileBasedDataset] Initializing dataset...
	Examples: 8264
	Features: 80
	Max length: 315
Standard scalar turned ON, loading params from cache
[FileBasedDataset] Dataset initialization complete
  epoch    auprc    auroc    train_loss    valid_acc    valid_loss    cp     dur
-------  -------  -------  ------------  -----------  ------------  ----  ------
      1   [36m0.0553[0m   [32m0.3240[0m        [35m0.6760[0m       [31m0.7340[0m        [94m0.6686[0m     +  9.6760
      2   0.0549   0.3231        [35m0.6704[0m       [31m0.7823[0m        [94m0.6610[0m     +  9.5026
      3   0.0550   0.3233        [35m0.6636[0m       [31m0.8392[0m        [94m0.6512[0m     +  9.6050
      4   0.0550   [32m0.3247[0m        [35m0.6541[0m       [31m0.8646[0m        [94m0.6397[0m     +  10.5154
      5   0.0549   [32m0.3257[0m        [35m0.6425[0m       [31m0.8960[0m        [94m0.6270[0m     +  10.3082
      6   [36m0.0553[0m   [32m0.3293[0m        [35m0.6301[0m       [31m0.9117[0m        [94m0.6131[0m     +  10.0343
      7   [36m0.0555[0m   [32m0.3310[0m        [35m0.6185[0m       [31m0.9190[0m        [94m0.5985[0m     +  9.8226
      8   [36m0.0555[0m   [32m0.3316[0m        [35m0.6048[0m       [31m0.9226[0m        [94m0.5837[0m     +  10.8440
      9   0.0554   [32m0.3320[0m        [35m0.5913[0m       0.9226        [94m0.5687[0m     +  10.5342
     10   0.0552   0.3311        [35m0.5779[0m       0.9226        [94m0.5538[0m     +  10.6115
     11   0.0548   0.3286        [35m0.5633[0m       0.9226        [94m0.5392[0m     +  10.5843
     12   0.0546   0.3273        [35m0.5491[0m       0.9226        [94m0.5249[0m     +  9.9955
     13   0.0545   0.3264        [35m0.5358[0m       0.9226        [94m0.5111[0m     +  10.4096
     14   0.0543   0.3245        [35m0.5220[0m       0.9226        [94m0.4980[0m     +  10.2163
     15   0.0541   0.3228        [35m0.5093[0m       0.9226        [94m0.4853[0m     +  10.1429
     16   0.0541   0.3219        [35m0.4971[0m       0.9226        [94m0.4734[0m     +  10.4742
     17   0.0541   0.3212        [35m0.4865[0m       0.9226        [94m0.4621[0m     +  10.3463
     18   0.0541   0.3203        [35m0.4759[0m       0.9226        [94m0.4515[0m     +  10.2682
     19   0.0540   0.3190        [35m0.4657[0m       0.9226        [94m0.4417[0m     +  10.4752
     20   0.0540   0.3191        [35m0.4559[0m       0.9226        [94m0.4326[0m     +  10.5732
     21   0.0540   0.3187        [35m0.4460[0m       0.9226        [94m0.4241[0m     +  10.3823
     22   0.0540   0.3187        [35m0.4383[0m       0.9226        [94m0.4162[0m     +  10.4974
     23   0.0541   0.3195        [35m0.4295[0m       0.9226        [94m0.4088[0m     +  10.4960
     24   0.0542   0.3210        [35m0.4225[0m       0.9226        [94m0.4020[0m     +  9.5809
     25   0.0544   0.3227        [35m0.4160[0m       0.9226        [94m0.3957[0m     +  9.3367
     26   0.0547   0.3259        [35m0.4098[0m       0.9226        [94m0.3897[0m     +  9.7513
     27   0.0549   0.3290        [35m0.4041[0m       0.9226        [94m0.3841[0m     +  9.9647
     28   0.0552   [32m0.3338[0m        [35m0.3982[0m       0.9226        [94m0.3788[0m     +  9.7536
     29   [36m0.0556[0m   [32m0.3386[0m        [35m0.3921[0m       0.9226        [94m0.3738[0m     +  9.9353
     30   [36m0.0561[0m   [32m0.3449[0m        [35m0.3880[0m       0.9226        [94m0.3692[0m     +  10.2299
     31   [36m0.0566[0m   [32m0.3511[0m        [35m0.3824[0m       0.9226        [94m0.3648[0m     +  9.9571
     32   [36m0.0571[0m   [32m0.3576[0m        [35m0.3778[0m       0.9226        [94m0.3606[0m     +  9.9790
     33   [36m0.0575[0m   [32m0.3628[0m        [35m0.3731[0m       0.9226        [94m0.3567[0m     +  10.3359
     34   [36m0.0578[0m   [32m0.3670[0m        [35m0.3700[0m       0.9226        [94m0.3530[0m     +  10.1124
     35   [36m0.0582[0m   [32m0.3709[0m        [35m0.3662[0m       0.9226        [94m0.3494[0m     +  9.9385
     36   [36m0.0586[0m   [32m0.3757[0m        [35m0.3621[0m       0.9226        [94m0.3461[0m     +  10.3513
     37   [36m0.0592[0m   [32m0.3814[0m        [35m0.3582[0m       0.9226        [94m0.3429[0m     +  9.6051
     38   [36m0.0597[0m   [32m0.3857[0m        [35m0.3543[0m       0.9226        [94m0.3399[0m     +  9.5889
     39   [36m0.0605[0m   [32m0.3931[0m        [35m0.3511[0m       0.9226        [94m0.3369[0m     +  9.6421
     40   [36m0.0612[0m   [32m0.4010[0m        [35m0.3478[0m       0.9226        [94m0.3341[0m     +  9.8114
     41   [36m0.0617[0m   [32m0.4065[0m        [35m0.3457[0m       0.9226        [94m0.3314[0m     +  9.6605
     42   [36m0.0625[0m   [32m0.4140[0m        [35m0.3424[0m       0.9226        [94m0.3289[0m     +  9.8749
     43   [36m0.0633[0m   [32m0.4222[0m        [35m0.3395[0m       0.9226        [94m0.3264[0m     +  9.9027
     44   [36m0.0640[0m   [32m0.4298[0m        [35m0.3370[0m       0.9226        [94m0.3240[0m     +  9.7120
     45   [36m0.0648[0m   [32m0.4373[0m        [35m0.3347[0m       0.9226        [94m0.3218[0m     +  9.9929
     46   [36m0.0657[0m   [32m0.4452[0m        [35m0.3322[0m       0.9226        [94m0.3196[0m     +  10.1132
     47   [36m0.0664[0m   [32m0.4511[0m        [35m0.3299[0m       0.9226        [94m0.3175[0m     +  10.2294
     48   [36m0.0669[0m   [32m0.4562[0m        [35m0.3279[0m       0.9226        [94m0.3154[0m     +  9.9414
     49   [36m0.0675[0m   [32m0.4603[0m        [35m0.3252[0m       0.9226        [94m0.3135[0m     +  9.8914
     50   [36m0.0682[0m   [32m0.4645[0m        [35m0.3228[0m       0.9226        [94m0.3116[0m     +  10.4207
[32m[I 2023-05-04 17:42:33,198][0m Trial 474 finished with value: 0.3116361559734667 and parameters: {'lr': 5.766008703424425e-07, 'dropout': 0.2587060065470019, 'd_model_multiplier': 8, 'num_layers': 6, 'n_heads': 4, 'dim_feedforward': 328, 'batch_size': 50, 'pos_encoding': 'fixed', 'activation': 'relu', 'norm': 'LayerNorm', 'optimizer_name': 'RAdam', 'weight_decay': 0.1, 'top_n_features': 80}. Best is trial 246 with value: 0.16447311791139763.[0m
[FileBasedDataset] Initializing dataset...
	Examples: 8264
	Features: 63
	Max length: 315
Standard scalar turned ON, loading params from cache
[FileBasedDataset] Dataset initialization complete
  epoch    auprc    auroc    train_loss    valid_acc    valid_loss    cp      dur
-------  -------  -------  ------------  -----------  ------------  ----  -------
      1   [36m0.2498[0m   [32m0.7359[0m        [35m0.3459[0m       [31m0.9250[0m        [94m0.2390[0m     +  19.7579
      2   [36m0.3135[0m   [32m0.7757[0m        [35m0.2466[0m       0.9214        [94m0.2237[0m     +  20.0376
      3   [36m0.3210[0m   [32m0.7837[0m        [35m0.2358[0m       0.9214        [94m0.2215[0m     +  20.0154
      4   0.3187   [32m0.7856[0m        [35m0.2335[0m       0.9250        [94m0.2211[0m     +  20.2568
      5   0.3201   0.7826        [35m0.2316[0m       [31m0.9262[0m        0.2216        20.2607
      6   [36m0.3232[0m   0.7836        [35m0.2312[0m       [31m0.9299[0m        0.2213        20.0781
      7   [36m0.3270[0m   0.7848        [35m0.2290[0m       0.9262        0.2214        20.2370
      8   [36m0.3289[0m   0.7831        [35m0.2288[0m       0.9250        0.2218        20.5467
      9   [36m0.3328[0m   0.7828        [35m0.2274[0m       0.9238        0.2223        20.3543
     10   [36m0.3332[0m   0.7834        [35m0.2268[0m       0.9238        0.2223        20.4098
     11   [36m0.3343[0m   0.7832        [35m0.2255[0m       0.9250        0.2218        20.1211
     12   [36m0.3362[0m   0.7845        [35m0.2249[0m       0.9250        0.2218        20.1626
     13   [36m0.3391[0m   0.7837        [35m0.2239[0m       0.9250        0.2217        20.0689
Stopping since valid_loss has not improved in the last 10 epochs.
[32m[I 2023-05-04 17:47:16,445][0m Trial 475 finished with value: 0.22105688032352938 and parameters: {'lr': 1.516199763541174e-05, 'dropout': 0.27973380972102085, 'd_model_multiplier': 4, 'num_layers': 4, 'n_heads': 32, 'dim_feedforward': 358, 'batch_size': 39, 'pos_encoding': 'fixed', 'activation': 'relu', 'norm': 'LayerNorm', 'optimizer_name': 'AdamW', 'weight_decay': 0.1, 'top_n_features': 63}. Best is trial 246 with value: 0.16447311791139763.[0m
[FileBasedDataset] Initializing dataset...
	Examples: 8264
	Features: 59
	Max length: 315
Standard scalar turned ON, loading params from cache
[FileBasedDataset] Dataset initialization complete
  epoch    auprc    auroc    train_loss    valid_acc    valid_loss    cp      dur
-------  -------  -------  ------------  -----------  ------------  ----  -------
      1   [36m0.2234[0m   [32m0.6823[0m        [35m0.3916[0m       [31m0.8972[0m        [94m0.3068[0m     +  23.2940
      2   [36m0.3358[0m   [32m0.7792[0m        [35m0.2476[0m       [31m0.9008[0m        [94m0.2841[0m     +  24.0992
      3   [36m0.3517[0m   [32m0.7867[0m        [35m0.2324[0m       [31m0.9033[0m        0.2864        23.3573
      4   [36m0.3767[0m   [32m0.7914[0m        [35m0.2297[0m       [31m0.9069[0m        0.2862        24.2986
      5   [36m0.3822[0m   [32m0.7937[0m        [35m0.2273[0m       [31m0.9081[0m        [94m0.2832[0m     +  24.1037
      6   [36m0.3822[0m   0.7934        [35m0.2257[0m       0.9069        0.2859        23.7300
      7   [36m0.3941[0m   [32m0.7956[0m        [35m0.2242[0m       [31m0.9105[0m        0.2861        23.5747
      8   [36m0.4003[0m   [32m0.7971[0m        0.2243       0.9081        0.2849        23.8402
      9   [36m0.4146[0m   [32m0.7990[0m        [35m0.2234[0m       0.9093        [94m0.2793[0m     +  24.0432
     10   0.4130   0.7984        [35m0.2204[0m       [31m0.9129[0m        0.2797        23.6739
     11   0.4045   0.7984        [35m0.2202[0m       0.9093        0.2831        23.9047
     12   [36m0.4184[0m   [32m0.7992[0m        0.2209       0.9093        0.2816        23.9398
     13   [36m0.4262[0m   [32m0.8014[0m        [35m0.2180[0m       0.9105        0.2829        23.7018
     14   0.4065   0.7997        0.2186       0.9093        0.2869        24.1209
     15   0.4019   0.8013        0.2186       0.9069        0.2821        23.7765
     16   0.4043   [32m0.8033[0m        [35m0.2156[0m       0.9081        0.2807        23.6719
     17   0.4075   0.8011        0.2181       0.9117        [94m0.2767[0m     +  24.0482
     18   0.4018   [32m0.8039[0m        0.2167       0.9093        0.2771        23.7299
     19   0.4034   [32m0.8040[0m        [35m0.2146[0m       0.9033        [94m0.2759[0m     +  23.8400
     20   0.3913   [32m0.8044[0m        [35m0.2141[0m       0.9033        0.2785        23.9708
     21   0.3853   [32m0.8089[0m        [35m0.2115[0m       0.9021        [94m0.2745[0m     +  24.0387
     22   0.4035   0.8069        0.2118       0.9057        0.2756        23.9922
     23   0.3991   0.8073        [35m0.2106[0m       0.9057        0.2747        23.9209
     24   0.3995   [32m0.8098[0m        [35m0.2102[0m       0.9069        0.2755        23.9358
     25   0.3908   0.8089        [35m0.2072[0m       0.9045        0.2780        23.7332
     26   0.3794   0.8091        0.2093       0.9033        0.2759        23.7597
     27   0.3604   0.8011        0.2074       0.9021        0.2814        23.6599
     28   0.3667   0.8079        [35m0.2049[0m       0.8996        0.2799        24.1680
     29   0.3607   0.8041        [35m0.2037[0m       0.9045        0.2866        23.6919
     30   0.3401   0.8017        0.2046       0.8996        0.2904        23.8060
Stopping since valid_loss has not improved in the last 10 epochs.
[32m[I 2023-05-04 17:59:36,939][0m Trial 476 finished with value: 0.2745070803230302 and parameters: {'lr': 0.00011650017100465306, 'dropout': 0.44554417551039105, 'd_model_multiplier': 4, 'num_layers': 5, 'n_heads': 32, 'dim_feedforward': 310, 'batch_size': 57, 'pos_encoding': 'fixed', 'activation': 'relu', 'norm': 'LayerNorm', 'optimizer_name': 'PlainRAdam', 'weight_decay': 0.1, 'top_n_features': 59}. Best is trial 246 with value: 0.16447311791139763.[0m
[FileBasedDataset] Initializing dataset...
	Examples: 8264
	Features: 73
	Max length: 315
Standard scalar turned ON, loading params from cache
[FileBasedDataset] Dataset initialization complete
  epoch    auprc    auroc    train_loss    valid_acc    valid_loss    cp      dur
-------  -------  -------  ------------  -----------  ------------  ----  -------
      1   [36m0.0757[0m   [32m0.3835[0m        [35m0.5859[0m       [31m0.9214[0m        [94m0.3603[0m     +  62.4277
      2   [36m0.1744[0m   [32m0.6727[0m        [35m0.3296[0m       0.9214        [94m0.2599[0m     +  62.7994
      3   [36m0.2445[0m   [32m0.7368[0m        [35m0.2649[0m       0.9202        [94m0.2461[0m     +  62.5274
      4   [36m0.2766[0m   [32m0.7581[0m        [35m0.2492[0m       0.9202        [94m0.2426[0m     +  62.7521
      5   [36m0.2835[0m   [32m0.7715[0m        [35m0.2423[0m       [31m0.9226[0m        [94m0.2410[0m     +  62.9533
      6   [36m0.2905[0m   [32m0.7793[0m        [35m0.2373[0m       0.9202        0.2414        63.1983
      7   [36m0.2921[0m   [32m0.7835[0m        [35m0.2355[0m       0.9154        0.2437        63.1506
      8   [36m0.2946[0m   [32m0.7859[0m        [35m0.2347[0m       0.9190        0.2455        62.5783
      9   [36m0.2950[0m   [32m0.7895[0m        [35m0.2305[0m       0.9178        0.2457        62.8644
     10   0.2927   [32m0.7911[0m        0.2314       0.9190        0.2463        62.9995
     11   0.2949   [32m0.7930[0m        [35m0.2292[0m       0.9202        0.2467        62.8924
     12   [36m0.2957[0m   [32m0.7952[0m        [35m0.2281[0m       0.9190        0.2471        62.6677
     13   [36m0.2973[0m   [32m0.7970[0m        0.2285       0.9190        0.2485        62.8254
     14   0.2942   [32m0.7973[0m        [35m0.2281[0m       0.9178        0.2487        62.5043
Stopping since valid_loss has not improved in the last 10 epochs.
