[32m[I 2023-05-03 13:34:56,449][0m Trial 351 finished with value: 0.22159553977785837 and parameters: {'lr': 5.806473899547747e-05, 'dropout': 0.40352706453056825, 'd_model_multiplier': 4, 'num_layers': 5, 'n_heads': 32, 'dim_feedforward': 316, 'batch_size': 78, 'pos_encoding': 'fixed', 'activation': 'relu', 'norm': 'LayerNorm', 'optimizer_name': 'RAdam', 'weight_decay': 0.001, 'top_n_features': 102}. Best is trial 246 with value: 0.16447311791139763.[0m
[FileBasedDataset] Initializing dataset...
	Examples: 8264
	Features: 66
	Max length: 315
Standard scalar turned ON, loading params from cache
[FileBasedDataset] Dataset initialization complete
  epoch    auprc    auroc    train_loss    valid_acc    valid_loss    cp      dur
-------  -------  -------  ------------  -----------  ------------  ----  -------
      1   [36m0.0594[0m   [32m0.3602[0m        [35m0.5550[0m       [31m0.9250[0m        [94m0.3877[0m     +  23.5781
      2   [36m0.1368[0m   [32m0.6333[0m        [35m0.3238[0m       0.9250        [94m0.2623[0m     +  24.1075
      3   [36m0.2128[0m   [32m0.7338[0m        [35m0.2612[0m       0.9250        [94m0.2425[0m     +  23.8863
      4   [36m0.2440[0m   [32m0.7685[0m        [35m0.2448[0m       [31m0.9274[0m        [94m0.2365[0m     +  24.1383
      5   [36m0.2583[0m   [32m0.7806[0m        [35m0.2398[0m       0.9274        [94m0.2343[0m     +  24.0093
      6   [36m0.2667[0m   [32m0.7842[0m        [35m0.2348[0m       0.9250        [94m0.2340[0m     +  23.7409
      7   [36m0.2703[0m   [32m0.7867[0m        [35m0.2321[0m       0.9250        [94m0.2334[0m     +  23.9292
      8   [36m0.2730[0m   [32m0.7879[0m        [35m0.2304[0m       0.9250        [94m0.2322[0m     +  23.8828
      9   0.2725   0.7876        [35m0.2294[0m       0.9262        [94m0.2314[0m     +  24.0431
     10   0.2727   0.7859        [35m0.2267[0m       0.9274        0.2323        23.8163
     11   [36m0.2817[0m   0.7864        [35m0.2257[0m       0.9274        [94m0.2307[0m     +  24.1549
     12   [36m0.2845[0m   [32m0.7881[0m        0.2260       0.9274        [94m0.2300[0m     +  24.2426
     13   [36m0.2888[0m   [32m0.7887[0m        0.2265       0.9262        [94m0.2284[0m     +  24.0294
     14   [36m0.2945[0m   [32m0.7895[0m        [35m0.2249[0m       0.9262        0.2288        23.9999
     15   [36m0.3029[0m   [32m0.7907[0m        [35m0.2229[0m       0.9226        [94m0.2283[0m     +  24.4329
     16   [36m0.3083[0m   [32m0.7917[0m        0.2236       0.9226        [94m0.2277[0m     +  24.0070
     17   [36m0.3140[0m   [32m0.7933[0m        [35m0.2222[0m       0.9214        [94m0.2272[0m     +  24.1284
     18   [36m0.3152[0m   [32m0.7937[0m        0.2223       0.9226        [94m0.2266[0m     +  24.0323
     19   [36m0.3167[0m   [32m0.7952[0m        [35m0.2214[0m       0.9238        [94m0.2265[0m     +  24.0077
     20   [36m0.3185[0m   [32m0.7958[0m        [35m0.2200[0m       0.9238        [94m0.2260[0m     +  24.1342
     21   [36m0.3217[0m   [32m0.7965[0m        [35m0.2193[0m       0.9226        [94m0.2248[0m     +  23.8725
     22   [36m0.3222[0m   0.7951        [35m0.2168[0m       0.9226        [94m0.2247[0m     +  23.9338
     23   [36m0.3233[0m   0.7948        0.2178       0.9226        0.2255        24.3428
     24   0.3213   0.7959        0.2178       0.9214        0.2253        24.1284
     25   0.3139   0.7960        0.2171       0.9226        0.2254        23.9249
     26   0.3072   [32m0.7972[0m        [35m0.2143[0m       0.9238        0.2249        24.2478
     27   0.3069   0.7951        [35m0.2125[0m       0.9238        0.2262        23.9708
     28   0.3081   0.7968        0.2152       0.9238        0.2248        24.1529
     29   0.3114   0.7957        0.2127       0.9250        0.2248        23.9872
     30   0.3098   0.7942        0.2127       0.9262        0.2257        23.9753
     31   0.3089   0.7970        [35m0.2109[0m       0.9262        [94m0.2245[0m     +  23.9470
     32   0.3102   0.7968        0.2111       0.9262        0.2262        23.9961
     33   0.3115   0.7969        [35m0.2087[0m       0.9262        0.2267        23.8492
     34   0.3015   0.7950        0.2092       0.9262        0.2286        24.0388
     35   0.3073   0.7922        0.2087       0.9250        0.2303        23.9669
     36   0.3112   0.7912        [35m0.2055[0m       0.9250        0.2289        23.8231
     37   0.2992   0.7936        0.2068       0.9250        0.2324        23.8329
     38   0.3190   0.7955        0.2056       0.9274        0.2264        24.2668
     39   0.3052   0.7943        [35m0.2043[0m       0.9250        0.2300        23.9598
     40   0.3143   0.7949        0.2059       0.9238        0.2298        24.0667
Stopping since valid_loss has not improved in the last 10 epochs.
[32m[I 2023-05-03 13:51:23,230][0m Trial 352 finished with value: 0.224463079633707 and parameters: {'lr': 3.5144816590306775e-05, 'dropout': 0.3372738670011616, 'd_model_multiplier': 4, 'num_layers': 5, 'n_heads': 32, 'dim_feedforward': 345, 'batch_size': 69, 'pos_encoding': 'fixed', 'activation': 'relu', 'norm': 'LayerNorm', 'optimizer_name': 'RAdam', 'weight_decay': 0.001, 'top_n_features': 66}. Best is trial 246 with value: 0.16447311791139763.[0m
[FileBasedDataset] Initializing dataset...
	Examples: 8264
	Features: 71
	Max length: 315
Standard scalar turned ON, loading params from cache
[FileBasedDataset] Dataset initialization complete
  epoch    auprc    auroc    train_loss    valid_acc    valid_loss    cp      dur
-------  -------  -------  ------------  -----------  ------------  ----  -------
      1   [36m0.0490[0m   [32m0.3110[0m        [35m0.6413[0m       [31m0.9311[0m        [94m0.5157[0m     +  31.2947
      2   [36m0.0574[0m   [32m0.4160[0m        [35m0.4255[0m       0.9311        [94m0.3152[0m     +  31.2291
      3   [36m0.1779[0m   [32m0.6412[0m        [35m0.3017[0m       0.9311        [94m0.2481[0m     +  31.3297
      4   [36m0.2390[0m   [32m0.7118[0m        [35m0.2636[0m       [31m0.9323[0m        [94m0.2284[0m     +  31.4308
      5   [36m0.2674[0m   [32m0.7361[0m        [35m0.2492[0m       0.9299        [94m0.2209[0m     +  31.6809
      6   [36m0.2799[0m   [32m0.7462[0m        [35m0.2416[0m       0.9323        [94m0.2187[0m     +  31.2169
      7   [36m0.2926[0m   [32m0.7528[0m        [35m0.2380[0m       [31m0.9335[0m        [94m0.2172[0m     +  31.3939
      8   0.2840   [32m0.7576[0m        [35m0.2355[0m       0.9335        [94m0.2163[0m     +  31.4821
      9   0.2869   [32m0.7593[0m        [35m0.2343[0m       0.9335        [94m0.2159[0m     +  31.6667
     10   [36m0.2951[0m   [32m0.7601[0m        [35m0.2328[0m       0.9323        0.2163        31.4837
     11   0.2947   [32m0.7640[0m        [35m0.2325[0m       0.9311        [94m0.2156[0m     +  31.1809
     12   0.2929   [32m0.7645[0m        [35m0.2311[0m       0.9323        0.2157        31.4852
     13   0.2909   [32m0.7649[0m        [35m0.2293[0m       0.9323        0.2164        31.5680
     14   0.2933   [32m0.7674[0m        [35m0.2292[0m       [31m0.9347[0m        0.2157        31.4317
     15   0.2925   [32m0.7688[0m        0.2294       0.9347        0.2160        31.6190
     16   0.2898   [32m0.7694[0m        [35m0.2256[0m       0.9347        0.2165        31.3357
     17   0.2837   [32m0.7714[0m        0.2264       0.9323        0.2162        31.6085
     18   0.2787   [32m0.7735[0m        [35m0.2254[0m       0.9347        [94m0.2153[0m     +  31.3356
     19   0.2853   0.7735        [35m0.2244[0m       0.9347        0.2161        31.2558
     20   0.2889   [32m0.7744[0m        [35m0.2241[0m       0.9347        0.2163        31.4753
     21   0.2899   [32m0.7754[0m        [35m0.2220[0m       [31m0.9359[0m        0.2164        31.7064
     22   0.2903   [32m0.7762[0m        0.2232       0.9359        0.2168        31.4631
     23   0.2946   0.7735        [35m0.2215[0m       0.9347        0.2177        31.6946
     24   0.2884   [32m0.7766[0m        [35m0.2206[0m       0.9335        0.2169        31.5007
     25   0.2833   0.7738        [35m0.2183[0m       0.9347        0.2186        31.3834
     26   0.2853   0.7724        0.2184       0.9347        0.2186        31.7434
     27   0.2870   0.7740        0.2190       0.9311        0.2190        31.7078
Stopping since valid_loss has not improved in the last 10 epochs.
[32m[I 2023-05-03 14:06:06,031][0m Trial 353 finished with value: 0.2152804545787903 and parameters: {'lr': 2.149576330817143e-05, 'dropout': 0.31491807040099046, 'd_model_multiplier': 4, 'num_layers': 7, 'n_heads': 32, 'dim_feedforward': 330, 'batch_size': 82, 'pos_encoding': 'fixed', 'activation': 'relu', 'norm': 'LayerNorm', 'optimizer_name': 'RAdam', 'weight_decay': 0.001, 'top_n_features': 71}. Best is trial 246 with value: 0.16447311791139763.[0m
[FileBasedDataset] Initializing dataset...
	Examples: 8264
	Features: 96
	Max length: 315
Standard scalar turned ON, loading params from cache
[FileBasedDataset] Dataset initialization complete
  epoch    auprc    auroc    train_loss    valid_acc    valid_loss    cp      dur
-------  -------  -------  ------------  -----------  ------------  ----  -------
      1   [36m0.0555[0m   [32m0.2508[0m        [35m0.7205[0m       [31m0.9129[0m        [94m0.6172[0m     +  26.9987
      2   [36m0.0636[0m   [32m0.3061[0m        [35m0.5017[0m       0.9129        [94m0.4127[0m     +  27.5482
      3   [36m0.0941[0m   [32m0.5307[0m        [35m0.3505[0m       0.9129        [94m0.3109[0m     +  27.2516
      4   [36m0.2910[0m   [32m0.6630[0m        [35m0.2872[0m       0.9129        [94m0.2782[0m     +  27.3701
      5   [36m0.3141[0m   [32m0.7007[0m        [35m0.2653[0m       0.9129        [94m0.2682[0m     +  27.4616
      6   0.3077   [32m0.7217[0m        [35m0.2550[0m       0.9129        [94m0.2645[0m     +  27.4782
      7   0.2982   [32m0.7387[0m        [35m0.2495[0m       0.9129        [94m0.2620[0m     +  27.1841
      8   0.2966   [32m0.7494[0m        [35m0.2448[0m       0.9129        [94m0.2598[0m     +  27.4618
      9   0.2995   [32m0.7582[0m        [35m0.2394[0m       [31m0.9141[0m        [94m0.2577[0m     +  27.2388
     10   0.2939   [32m0.7634[0m        [35m0.2359[0m       0.9141        [94m0.2569[0m     +  27.2976
     11   0.2914   [32m0.7662[0m        [35m0.2336[0m       0.9117        [94m0.2556[0m     +  27.4290
     12   0.2907   [32m0.7673[0m        [35m0.2327[0m       0.9105        0.2561        27.3443
     13   0.2879   [32m0.7691[0m        [35m0.2298[0m       0.9093        0.2561        27.3535
     14   0.2832   [32m0.7710[0m        0.2304       0.9081        0.2561        27.4907
     15   0.2892   [32m0.7717[0m        [35m0.2291[0m       0.9093        0.2563        27.4131
     16   0.2861   [32m0.7720[0m        [35m0.2268[0m       0.9093        0.2569        27.4753
     17   0.2865   [32m0.7725[0m        [35m0.2257[0m       0.9093        0.2570        27.4001
     18   0.2882   [32m0.7734[0m        [35m0.2254[0m       0.9093        0.2567        27.1125
     19   0.2893   [32m0.7745[0m        [35m0.2250[0m       0.9069        0.2567        27.1300
     20   0.2879   [32m0.7746[0m        [35m0.2234[0m       0.9045        0.2574        27.2601
Stopping since valid_loss has not improved in the last 10 epochs.
[32m[I 2023-05-03 14:15:41,232][0m Trial 354 finished with value: 0.2556418636329517 and parameters: {'lr': 1.2038769010422104e-05, 'dropout': 0.2806547865417379, 'd_model_multiplier': 4, 'num_layers': 6, 'n_heads': 32, 'dim_feedforward': 179, 'batch_size': 66, 'pos_encoding': 'fixed', 'activation': 'relu', 'norm': 'LayerNorm', 'optimizer_name': 'RAdam', 'weight_decay': 0.001, 'top_n_features': 96}. Best is trial 246 with value: 0.16447311791139763.[0m
[FileBasedDataset] Initializing dataset...
	Examples: 8264
	Features: 108
	Max length: 315
Standard scalar turned ON, loading params from cache
[FileBasedDataset] Dataset initialization complete
  epoch    auprc    auroc    train_loss    valid_acc    valid_loss    cp      dur
-------  -------  -------  ------------  -----------  ------------  ----  -------
      1   [36m0.0621[0m   [32m0.2853[0m        [35m0.6091[0m       [31m0.9141[0m        [94m0.5089[0m     +  24.0483
      2   [36m0.0625[0m   0.2743        [35m0.4409[0m       0.9141        [94m0.3763[0m     +  24.0000
      3   [36m0.0744[0m   [32m0.4262[0m        [35m0.3330[0m       0.9141        [94m0.3172[0m     +  24.0069
      4   [36m0.1155[0m   [32m0.5829[0m        [35m0.2847[0m       0.9141        [94m0.2930[0m     +  24.0556
      5   [36m0.1656[0m   [32m0.6644[0m        [35m0.2647[0m       0.9141        [94m0.2809[0m     +  23.9980
      6   [36m0.2034[0m   [32m0.7081[0m        [35m0.2574[0m       0.9141        [94m0.2727[0m     +  24.0817
      7   [36m0.2307[0m   [32m0.7341[0m        [35m0.2516[0m       0.9141        [94m0.2673[0m     +  24.0751
      8   [36m0.2640[0m   [32m0.7576[0m        [35m0.2479[0m       0.9141        [94m0.2613[0m     +  24.1934
      9   [36m0.3058[0m   [32m0.7774[0m        [35m0.2432[0m       0.9141        [94m0.2555[0m     +  24.0906
     10   [36m0.3550[0m   [32m0.7925[0m        [35m0.2412[0m       0.9141        [94m0.2504[0m     +  24.2088
     11   [36m0.3708[0m   [32m0.8029[0m        [35m0.2372[0m       [31m0.9154[0m        [94m0.2460[0m     +  24.3000
     12   [36m0.3728[0m   [32m0.8092[0m        [35m0.2370[0m       0.9141        [94m0.2424[0m     +  23.9142
     13   [36m0.3830[0m   [32m0.8131[0m        [35m0.2346[0m       0.9141        [94m0.2409[0m     +  23.8561
     14   [36m0.3878[0m   [32m0.8176[0m        [35m0.2331[0m       0.9129        [94m0.2384[0m     +  24.3919
     15   [36m0.3942[0m   [32m0.8183[0m        0.2337       0.9141        [94m0.2375[0m     +  24.2292
     16   [36m0.3948[0m   [32m0.8199[0m        [35m0.2327[0m       0.9154        [94m0.2360[0m     +  24.0756
     17   [36m0.3964[0m   [32m0.8214[0m        [35m0.2323[0m       0.9154        [94m0.2346[0m     +  24.0513
     18   [36m0.3986[0m   [32m0.8227[0m        [35m0.2288[0m       0.9141        [94m0.2342[0m     +  24.0558
     19   0.3981   [32m0.8242[0m        0.2310       0.9129        [94m0.2327[0m     +  24.3432
     20   [36m0.3997[0m   [32m0.8243[0m        0.2301       [31m0.9166[0m        [94m0.2324[0m     +  24.0959
     21   [36m0.4001[0m   [32m0.8249[0m        0.2301       0.9166        0.2334        24.1473
     22   [36m0.4026[0m   [32m0.8265[0m        0.2294       [31m0.9178[0m        [94m0.2316[0m     +  24.0091
     23   0.4006   [32m0.8272[0m        [35m0.2287[0m       [31m0.9190[0m        0.2332        24.1480
     24   [36m0.4041[0m   [32m0.8293[0m        0.2288       [31m0.9202[0m        [94m0.2307[0m     +  24.0801
     25   0.3992   0.8284        0.2291       0.9190        0.2326        24.3497
     26   0.4040   [32m0.8311[0m        [35m0.2270[0m       [31m0.9214[0m        [94m0.2301[0m     +  23.9121
     27   0.3947   0.8285        [35m0.2269[0m       0.9190        0.2332        23.9102
     28   0.3999   0.8301        [35m0.2259[0m       0.9202        0.2316        24.1376
     29   0.3928   0.8309        0.2261       0.9202        0.2332        24.3557
     30   0.3952   [32m0.8312[0m        [35m0.2257[0m       0.9202        0.2337        24.0733
     31   0.3965   [32m0.8318[0m        [35m0.2250[0m       0.9214        0.2330        24.1975
     32   0.3969   [32m0.8325[0m        0.2261       0.9214        0.2317        24.4837
     33   0.3982   0.8322        [35m0.2237[0m       0.9214        0.2315        24.3295
     34   0.4005   [32m0.8336[0m        0.2243       0.9214        0.2313        24.2715
     35   [36m0.4057[0m   [32m0.8344[0m        [35m0.2235[0m       [31m0.9226[0m        0.2304        24.1830
Stopping since valid_loss has not improved in the last 10 epochs.
[32m[I 2023-05-03 14:30:12,655][0m Trial 355 finished with value: 0.23014432588702535 and parameters: {'lr': 1.5067474484438946e-05, 'dropout': 0.3826392515457203, 'd_model_multiplier': 4, 'num_layers': 5, 'n_heads': 32, 'dim_feedforward': 337, 'batch_size': 73, 'pos_encoding': 'fixed', 'activation': 'relu', 'norm': 'LayerNorm', 'optimizer_name': 'RAdam', 'weight_decay': 0.001, 'top_n_features': 108}. Best is trial 246 with value: 0.16447311791139763.[0m
[FileBasedDataset] Initializing dataset...
	Examples: 8264
	Features: 75
	Max length: 315
Standard scalar turned ON, loading params from cache
[FileBasedDataset] Dataset initialization complete
  epoch    auprc    auroc    train_loss    valid_acc    valid_loss    cp      dur
-------  -------  -------  ------------  -----------  ------------  ----  -------
      1   [36m0.0718[0m   [32m0.3815[0m        [35m0.5799[0m       [31m0.9202[0m        [94m0.4024[0m     +  23.8171
      2   [36m0.1387[0m   [32m0.5854[0m        [35m0.3321[0m       0.9202        [94m0.2816[0m     +  23.7889
      3   [36m0.1531[0m   [32m0.6503[0m        [35m0.2636[0m       0.9202        [94m0.2690[0m     +  24.0273
      4   [36m0.1663[0m   [32m0.6780[0m        [35m0.2485[0m       0.9202        [94m0.2661[0m     +  23.7210
      5   [36m0.1906[0m   [32m0.6925[0m        [35m0.2428[0m       0.9202        [94m0.2655[0m     +  24.0381
      6   [36m0.1983[0m   [32m0.7001[0m        [35m0.2373[0m       0.9154        0.2680        24.0798
      7   [36m0.2016[0m   [32m0.7094[0m        [35m0.2331[0m       0.9117        0.2687        24.1092
      8   0.2004   [32m0.7143[0m        [35m0.2316[0m       0.9141        0.2698        23.8786
      9   0.1993   [32m0.7182[0m        [35m0.2281[0m       0.9129        0.2722        24.0086
     10   0.1984   [32m0.7187[0m        [35m0.2275[0m       0.9154        0.2729        23.9989
     11   0.2012   [32m0.7206[0m        0.2285       0.9141        0.2712        24.0313
     12   [36m0.2038[0m   [32m0.7230[0m        [35m0.2263[0m       0.9141        0.2710        23.7629
     13   [36m0.2046[0m   [32m0.7243[0m        [35m0.2235[0m       0.9117        0.2719        23.9126
     14   0.1998   [32m0.7255[0m        [35m0.2232[0m       0.9129        0.2721        24.0564
Stopping since valid_loss has not improved in the last 10 epochs.
