[32m[I 2023-05-02 08:47:48,453][0m Trial 85 finished with value: 0.2475891887709192 and parameters: {'lr': 0.0008712008290199911, 'dropout': 0.43589452845313653, 'd_model_multiplier': 16, 'num_layers': 4, 'n_heads': 4, 'dim_feedforward': 131, 'batch_size': 67, 'pos_encoding': 'fixed', 'activation': 'relu', 'norm': 'LayerNorm', 'optimizer_name': 'AdamW', 'weight_decay': 0.01, 'top_n_features': 118}. Best is trial 12 with value: 0.20472501771481755.[0m
[FileBasedDataset] Initializing dataset...
	Examples: 8264
	Features: 100
	Max length: 315
Standard scalar turned ON, loading params from cache
[FileBasedDataset] Dataset initialization complete
  epoch    auprc    auroc    train_loss    valid_acc    valid_loss    cp      dur
-------  -------  -------  ------------  -----------  ------------  ----  -------
      1   [36m0.1574[0m   [32m0.6127[0m        [35m0.3238[0m       [31m0.8416[0m        [94m0.4267[0m     +  19.7282
      2   0.1505   0.6100        [35m0.2874[0m       [31m0.8634[0m        0.4470        19.5889
      3   [36m0.1765[0m   [32m0.6875[0m        [35m0.2659[0m       [31m0.8815[0m        [94m0.3695[0m     +  19.8310
      4   0.1418   0.6169        [35m0.2650[0m       0.8392        0.4381        19.8990
      5   0.1397   0.6100        [35m0.2643[0m       0.8537        0.4001        19.8613
      6   0.1527   0.6257        [35m0.2617[0m       0.8670        0.3907        19.8197
      7   0.1518   0.6305        [35m0.2578[0m       0.8742        0.3828        19.7974
      8   0.1510   0.6236        [35m0.2560[0m       [31m0.8863[0m        0.3803        19.9834
      9   0.1512   0.6333        [35m0.2542[0m       [31m0.9045[0m        [94m0.3587[0m     +  19.7013
     10   0.1547   0.6316        [35m0.2530[0m       [31m0.9057[0m        [94m0.3579[0m     +  19.8211
     11   0.1515   0.6276        [35m0.2501[0m       0.9057        0.3613        19.8251
     12   0.1486   0.6253        0.2520       [31m0.9069[0m        [94m0.3562[0m     +  19.7371
     13   0.1519   0.6304        0.2506       0.9033        0.3655        20.0219
     14   0.1561   0.6403        0.2512       0.9033        0.3650        19.9084
     15   0.1559   0.6412        0.2506       [31m0.9081[0m        0.3628        19.8810
     16   0.1556   0.6436        [35m0.2485[0m       0.9081        0.3661        19.9050
     17   0.1540   0.6400        0.2511       [31m0.9093[0m        0.3643        19.7252
     18   0.1519   0.6316        [35m0.2478[0m       0.9081        0.3688        20.1498
     19   0.1531   0.6360        [35m0.2476[0m       0.9093        0.3634        19.9977
     20   0.1589   0.6425        0.2479       0.9093        0.3656        19.9794
     21   0.1541   0.6360        0.2496       0.9057        0.3695        19.9141
Stopping since valid_loss has not improved in the last 10 epochs.
[32m[I 2023-05-02 08:55:06,557][0m Trial 86 finished with value: 0.35616946169946617 and parameters: {'lr': 0.0006534965225718603, 'dropout': 0.45128046963575724, 'd_model_multiplier': 16, 'num_layers': 3, 'n_heads': 32, 'dim_feedforward': 162, 'batch_size': 44, 'pos_encoding': 'fixed', 'activation': 'relu', 'norm': 'LayerNorm', 'optimizer_name': 'AdamW', 'weight_decay': 0.1, 'top_n_features': 100}. Best is trial 12 with value: 0.20472501771481755.[0m
[FileBasedDataset] Initializing dataset...
	Examples: 8264
	Features: 126
	Max length: 315
Standard scalar turned ON, loading params from cache
[FileBasedDataset] Dataset initialization complete
  epoch    auprc    auroc    train_loss    valid_acc    valid_loss    cp      dur
-------  -------  -------  ------------  -----------  ------------  ----  -------
      1   [36m0.2627[0m   [32m0.7406[0m        [35m0.2692[0m       [31m0.9033[0m        [94m0.2835[0m     +  11.3236
      2   [36m0.2926[0m   [32m0.7763[0m        [35m0.2478[0m       [31m0.9093[0m        [94m0.2691[0m     +  11.3822
      3   [36m0.3371[0m   [32m0.8074[0m        [35m0.2410[0m       0.9093        [94m0.2547[0m     +  11.5251
      4   0.3288   [32m0.8149[0m        [35m0.2339[0m       0.9057        0.2598        11.7376
      5   [36m0.3544[0m   [32m0.8207[0m        [35m0.2336[0m       0.9057        0.2555        11.5913
      6   0.3427   [32m0.8237[0m        [35m0.2302[0m       0.9093        [94m0.2547[0m     +  11.6217
      7   0.3307   0.8153        0.2312       0.8996        0.2579        11.7521
      8   0.3316   0.8193        [35m0.2277[0m       0.9021        0.2600        11.6575
      9   0.3449   0.8196        [35m0.2266[0m       0.9069        0.2552        11.5516
     10   0.3360   0.8225        [35m0.2226[0m       0.9033        0.2583        11.5789
     11   0.3322   0.8190        0.2234       0.9057        0.2579        11.6800
     12   0.3463   [32m0.8250[0m        [35m0.2182[0m       0.9093        0.2583        11.6980
Stopping since valid_loss has not improved in the last 10 epochs.
[32m[I 2023-05-02 08:57:37,777][0m Trial 87 finished with value: 0.2546677276618247 and parameters: {'lr': 0.00023270298157781338, 'dropout': 0.4605689626447939, 'd_model_multiplier': 16, 'num_layers': 5, 'n_heads': 8, 'dim_feedforward': 138, 'batch_size': 52, 'pos_encoding': 'fixed', 'activation': 'relu', 'norm': 'LayerNorm', 'optimizer_name': 'AdamW', 'weight_decay': 0.01, 'top_n_features': 126}. Best is trial 12 with value: 0.20472501771481755.[0m
[FileBasedDataset] Initializing dataset...
	Examples: 8264
	Features: 81
	Max length: 315
Standard scalar turned ON, loading params from cache
[FileBasedDataset] Dataset initialization complete
  epoch    auprc    auroc    train_loss    valid_acc    valid_loss    cp     dur
-------  -------  -------  ------------  -----------  ------------  ----  ------
      1   [36m0.0685[0m   [32m0.3414[0m        [35m0.6753[0m       [31m0.9238[0m        [94m0.5749[0m     +  9.4453
      2   0.0610   0.3320        [35m0.4950[0m       0.9238        [94m0.4014[0m     +  9.4954
      3   0.0617   [32m0.3508[0m        [35m0.3960[0m       0.9238        [94m0.3507[0m     +  9.6841
      4   [36m0.1076[0m   [32m0.5252[0m        [35m0.3473[0m       0.9238        [94m0.2982[0m     +  9.8854
      5   [36m0.1521[0m   [32m0.6689[0m        [35m0.3073[0m       0.9238        [94m0.2685[0m     +  9.9347
      6   [36m0.1900[0m   [32m0.7039[0m        [35m0.2857[0m       0.9238        [94m0.2561[0m     +  9.9230
      7   [36m0.2114[0m   [32m0.7154[0m        [35m0.2767[0m       0.9238        [94m0.2500[0m     +  9.8805
      8   [36m0.2145[0m   [32m0.7193[0m        [35m0.2718[0m       0.9238        [94m0.2468[0m     +  10.1060
      9   [36m0.2181[0m   [32m0.7232[0m        [35m0.2675[0m       0.9238        [94m0.2448[0m     +  10.1853
     10   [36m0.2222[0m   0.7228        0.2676       0.9238        [94m0.2435[0m     +  9.8857
     11   0.2168   [32m0.7247[0m        0.2701       0.9238        [94m0.2428[0m     +  10.1060
     12   0.2200   [32m0.7249[0m        0.2682       0.9238        [94m0.2422[0m     +  9.9756
     13   0.2165   [32m0.7253[0m        [35m0.2646[0m       0.9238        [94m0.2420[0m     +  10.1169
     14   0.2176   0.7250        0.2661       0.9238        [94m0.2416[0m     +  9.8841
     15   0.2161   0.7251        0.2685       0.9238        [94m0.2416[0m     +  9.8928
     16   0.2183   0.7250        [35m0.2635[0m       0.9238        [94m0.2414[0m     +  10.0402
     17   0.2211   0.7242        [35m0.2624[0m       0.9238        [94m0.2413[0m     +  10.0222
     18   [36m0.2223[0m   0.7240        0.2656       0.9238        0.2414        10.0076
     19   0.2216   0.7234        0.2625       0.9238        [94m0.2413[0m     +  9.8206
     20   0.2205   0.7236        0.2645       0.9238        [94m0.2412[0m     +  9.9786
     21   0.2189   0.7226        [35m0.2610[0m       0.9238        0.2412        9.9102
     22   0.2166   0.7222        0.2622       0.9238        0.2413        10.0002
     23   0.2156   0.7220        [35m0.2599[0m       0.9238        0.2413        9.9278
     24   0.2152   0.7196        0.2625       0.9238        0.2413        9.9853
     25   0.2153   0.7197        [35m0.2573[0m       0.9238        0.2414        9.8738
     26   0.2152   0.7201        0.2592       0.9238        0.2414        10.0982
     27   0.2129   0.7197        0.2603       0.9238        0.2416        10.1626
     28   0.2128   0.7197        0.2596       0.9238        0.2416        9.9767
     29   0.2131   0.7202        0.2597       0.9238        0.2415        9.6656
Stopping since valid_loss has not improved in the last 10 epochs.
[32m[I 2023-05-02 09:02:36,530][0m Trial 88 finished with value: 0.24122136481727913 and parameters: {'lr': 8.133867206657515e-05, 'dropout': 0.48351151701354556, 'd_model_multiplier': 1, 'num_layers': 6, 'n_heads': 4, 'dim_feedforward': 144, 'batch_size': 76, 'pos_encoding': 'fixed', 'activation': 'relu', 'norm': 'LayerNorm', 'optimizer_name': 'AdamW', 'weight_decay': 0.1, 'top_n_features': 81}. Best is trial 12 with value: 0.20472501771481755.[0m
[FileBasedDataset] Initializing dataset...
	Examples: 8264
	Features: 157
	Max length: 315
Standard scalar turned ON, loading params from cache
[FileBasedDataset] Dataset initialization complete
  epoch    auprc    auroc    train_loss    valid_acc    valid_loss    cp      dur
-------  -------  -------  ------------  -----------  ------------  ----  -------
      1   [36m0.1840[0m   [32m0.7126[0m        [35m0.2771[0m       [31m0.9238[0m        [94m0.2450[0m     +  11.5743
      2   0.1740   [32m0.7238[0m        [35m0.2575[0m       [31m0.9262[0m        [94m0.2431[0m     +  11.6624
      3   [36m0.1881[0m   [32m0.7284[0m        [35m0.2548[0m       0.9262        0.2497        11.9873
      4   [36m0.1955[0m   [32m0.7287[0m        [35m0.2547[0m       0.9250        0.2487        12.0142
      5   [36m0.2223[0m   [32m0.7596[0m        [35m0.2476[0m       0.9202        0.2477        11.6559
      6   [36m0.2304[0m   [32m0.7758[0m        [35m0.2440[0m       0.9141        0.2448        12.0152
      7   [36m0.2725[0m   [32m0.7904[0m        [35m0.2419[0m       0.9190        0.2465        12.1366
      8   0.2722   0.7891        [35m0.2384[0m       0.9202        [94m0.2419[0m     +  12.0091
      9   0.2724   [32m0.7960[0m        0.2390       0.9214        0.2498        11.9582
     10   [36m0.2738[0m   [32m0.8073[0m        0.2412       0.9226        0.2453        12.1960
     11   [36m0.2846[0m   0.8000        [35m0.2346[0m       0.9202        0.2468        12.2780
     12   0.2716   0.8014        [35m0.2335[0m       0.9202        0.2470        11.7939
     13   0.2741   0.8037        0.2336       0.9190        [94m0.2385[0m     +  12.3206
     14   [36m0.2943[0m   [32m0.8094[0m        [35m0.2324[0m       0.9202        0.2503        12.0379
     15   0.2583   0.8008        0.2343       0.9214        0.2595        12.2069
     16   0.2735   0.8050        0.2335       0.9238        0.2460        12.1662
     17   0.2835   [32m0.8109[0m        0.2325       0.9202        0.2416        12.2033
     18   0.2873   [32m0.8142[0m        [35m0.2294[0m       0.9190        [94m0.2377[0m     +  12.2748
     19   0.2889   [32m0.8165[0m        0.2307       0.9226        0.2467        12.2675
     20   0.2868   0.8149        [35m0.2285[0m       0.9190        0.2448        12.0625
     21   0.2934   0.8143        0.2292       0.9178        0.2448        12.5401
     22   0.2891   0.8122        0.2302       0.9214        [94m0.2366[0m     +  12.1495
     23   0.2844   [32m0.8182[0m        [35m0.2284[0m       0.9202        0.2401        12.2713
     24   0.2934   [32m0.8206[0m        0.2292       0.9214        [94m0.2348[0m     +  12.0953
     25   0.2866   0.8122        [35m0.2283[0m       0.9214        0.2384        12.0854
     26   0.2625   0.8046        [35m0.2268[0m       0.9190        0.2411        12.3342
     27   0.2610   0.8010        0.2284       0.9154        0.2356        12.4105
     28   0.2543   0.7832        0.2287       0.9117        0.2493        12.3466
     29   0.2720   0.7951        [35m0.2267[0m       0.9190        0.2439        12.2828
     30   0.2657   0.7948        0.2283       0.9202        0.2407        12.0822
     31   0.2630   0.8021        0.2275       0.9202        0.2416        11.9393
     32   0.2787   0.8016        0.2288       0.9202        0.2360        12.3538
     33   0.2691   0.7969        [35m0.2259[0m       0.9178        0.2451        12.4666
Stopping since valid_loss has not improved in the last 10 epochs.
[32m[I 2023-05-02 09:09:29,179][0m Trial 89 finished with value: 0.23479994282829142 and parameters: {'lr': 0.001237115072277193, 'dropout': 0.41642404405239397, 'd_model_multiplier': 4, 'num_layers': 3, 'n_heads': 16, 'dim_feedforward': 178, 'batch_size': 91, 'pos_encoding': 'fixed', 'activation': 'relu', 'norm': 'LayerNorm', 'optimizer_name': 'AdamW', 'weight_decay': 0.01, 'top_n_features': 157}. Best is trial 12 with value: 0.20472501771481755.[0m
[FileBasedDataset] Initializing dataset...
	Examples: 8264
	Features: 166
	Max length: 315
Standard scalar turned ON, loading params from cache
[FileBasedDataset] Dataset initialization complete
  epoch    auprc    auroc    train_loss    valid_acc    valid_loss    cp      dur
-------  -------  -------  ------------  -----------  ------------  ----  -------
      1   [36m0.1537[0m   [32m0.6423[0m        [35m0.2755[0m       [31m0.9274[0m        [94m0.2676[0m     +  95.8790
      2   [36m0.1644[0m   [32m0.6811[0m        [35m0.2641[0m       0.9274        0.2680        95.7121
      3   0.1593   [32m0.6838[0m        [35m0.2617[0m       0.9274        0.2742        95.6368
      4   [36m0.1899[0m   [32m0.6864[0m        0.2618       0.9274        0.2682        95.9206
      5   0.1862   [32m0.6880[0m        [35m0.2576[0m       0.9274        0.2700        95.8674
      6   [36m0.1931[0m   [32m0.6882[0m        0.2583       0.9274        0.2687        95.8648
      7   [36m0.2134[0m   [32m0.6888[0m        0.2583       0.9274        0.2689        95.8851
      8   0.2001   [32m0.6917[0m        [35m0.2572[0m       0.9274        0.2762        96.1160
      9   0.2053   [32m0.6957[0m        [35m0.2562[0m       0.9274        0.2750        95.6927
     10   0.2059   0.6953        [35m0.2527[0m       0.9274        0.2740        95.8396
Stopping since valid_loss has not improved in the last 10 epochs.
[32m[I 2023-05-02 09:27:03,820][0m Trial 90 finished with value: 0.26764552639358136 and parameters: {'lr': 0.0003106909097807889, 'dropout': 0.5355597844814264, 'd_model_multiplier': 2, 'num_layers': 13, 'n_heads': 64, 'dim_feedforward': 193, 'batch_size': 24, 'pos_encoding': 'fixed', 'activation': 'relu', 'norm': 'LayerNorm', 'optimizer_name': 'AdamW', 'weight_decay': 0, 'top_n_features': 166}. Best is trial 12 with value: 0.20472501771481755.[0m
[FileBasedDataset] Initializing dataset...
	Examples: 8264
	Features: 140
	Max length: 315
Standard scalar turned ON, loading params from cache
[FileBasedDataset] Dataset initialization complete
  epoch    auprc    auroc    train_loss    valid_acc    valid_loss    cp     dur
-------  -------  -------  ------------  -----------  ------------  ----  ------
      1   [36m0.1425[0m   [32m0.6949[0m        [35m0.3507[0m       [31m0.9214[0m        [94m0.3215[0m     +  8.8698
      2   [36m0.1780[0m   [32m0.7521[0m        [35m0.2687[0m       0.9178        [94m0.3028[0m     +  8.9504
      3   [36m0.2060[0m   [32m0.7740[0m        [35m0.2605[0m       0.9190        [94m0.2509[0m     +  9.1411
      4   0.2010   0.7572        [35m0.2574[0m       [31m0.9238[0m        [94m0.2315[0m     +  9.3097
      5   0.2005   [32m0.7743[0m        [35m0.2506[0m       [31m0.9299[0m        [94m0.2218[0m     +  9.1066
      6   [36m0.2153[0m   [32m0.7931[0m        [35m0.2496[0m       0.9262        [94m0.2181[0m     +  9.1788
      7   [36m0.2243[0m   0.7853        [35m0.2452[0m       0.9250        [94m0.2174[0m     +  9.1425
      8   [36m0.2363[0m   0.7743        [35m0.2390[0m       0.9250        [94m0.2168[0m     +  9.6403
      9   0.2313   0.7738        0.2397       [31m0.9311[0m        0.2179        9.2515
     10   0.2328   0.7878        [35m0.2316[0m       0.9238        [94m0.2136[0m     +  9.1700
     11   [36m0.2381[0m   0.7883        0.2327       0.9141        0.2219        9.3848
     12   0.2227   0.7928        [35m0.2302[0m       0.9129        0.2237        9.4675
     13   0.2239   0.7871        0.2312       0.9117        0.2414        9.2960
     14   0.2265   [32m0.7938[0m        [35m0.2276[0m       0.9202        0.2172        9.3049
     15   0.2266   0.7903        0.2311       0.9117        0.2293        9.2712
     16   0.2214   0.7873        [35m0.2253[0m       0.9057        0.2405        9.2524
     17   [36m0.2462[0m   [32m0.8030[0m        0.2287       0.9238        0.2144        9.2732
     18   0.2425   0.8008        0.2275       0.9154        0.2163        9.4821
     19   0.2320   0.7887        0.2261       0.9214        0.2173        9.3547
Stopping since valid_loss has not improved in the last 10 epochs.
[32m[I 2023-05-02 09:30:09,781][0m Trial 91 finished with value: 0.21362207231743593 and parameters: {'lr': 0.003942247381693, 'dropout': 0.5113248205627465, 'd_model_multiplier': 2, 'num_layers': 3, 'n_heads': 4, 'dim_feedforward': 128, 'batch_size': 60, 'pos_encoding': 'learnable', 'activation': 'gelu', 'norm': 'BatchNorm', 'optimizer_name': 'PlainRAdam', 'weight_decay': 0.01, 'top_n_features': 140}. Best is trial 12 with value: 0.20472501771481755.[0m
[FileBasedDataset] Initializing dataset...
	Examples: 8264
	Features: 111
	Max length: 315
Standard scalar turned ON, loading params from cache
[FileBasedDataset] Dataset initialization complete
  epoch    auprc    auroc    train_loss    valid_acc    valid_loss    cp     dur
-------  -------  -------  ------------  -----------  ------------  ----  ------
      1   [36m0.2391[0m   [32m0.7625[0m        [35m0.2936[0m       [31m0.9178[0m        [94m0.2518[0m     +  8.7928
      2   [36m0.2581[0m   [32m0.7683[0m        [35m0.2562[0m       0.9178        [94m0.2361[0m     +  9.1536
      3   [36m0.2836[0m   0.7673        [35m0.2454[0m       [31m0.9214[0m        [94m0.2359[0m     +  9.1154
      4   0.2529   0.7561        [35m0.2431[0m       0.9069        0.2500        9.3578
      5   0.2816   0.7658        [35m0.2409[0m       0.9141        0.2415        8.9083
      6   [36m0.2868[0m   [32m0.7717[0m        [35m0.2361[0m       [31m0.9238[0m        [94m0.2334[0m     +  9.0928
      7   [36m0.3121[0m   [32m0.7768[0m        [35m0.2343[0m       [31m0.9250[0m        [94m0.2314[0m     +  9.2486
      8   [36m0.3187[0m   0.7715        [35m0.2337[0m       0.9214        [94m0.2304[0m     +  9.1412
      9   [36m0.3273[0m   0.7739        [35m0.2312[0m       0.9250        [94m0.2288[0m     +  9.1913
     10   0.3024   0.7713        0.2316       0.9202        0.2370        9.3076
     11   0.3182   [32m0.7788[0m        [35m0.2295[0m       0.9238        0.2302        9.1076
     12   0.3180   0.7686        [35m0.2278[0m       0.9250        0.2360        8.9490
     13   0.3096   0.7719        [35m0.2276[0m       0.9166        0.2361        9.0736
     14   0.3150   0.7751        [35m0.2244[0m       0.9250        0.2296        9.5181
     15   0.3226   0.7783        0.2274       0.9250        0.2293        9.1253
     16   0.3164   0.7744        [35m0.2227[0m       0.9226        0.2295        9.2649
     17   0.3213   [32m0.7820[0m        0.2288       [31m0.9262[0m        [94m0.2279[0m     +  9.1823
     18   0.3177   0.7773        0.2266       0.9262        0.2292        8.9554
     19   0.3187   0.7773        0.2263       0.9226        0.2307        8.9987
     20   0.3242   [32m0.7836[0m        0.2287       0.9250        [94m0.2276[0m     +  9.2444
     21   0.3129   0.7783        0.2245       0.9238        0.2304        9.3305
     22   0.3107   0.7761        0.2268       0.9226        0.2337        9.5807
     23   0.3167   0.7688        [35m0.2221[0m       0.9202        0.2342        9.2543
     24   0.3210   0.7823        [35m0.2217[0m       0.9214        0.2290        9.4070
     25   0.3015   0.7688        0.2225       0.9250        0.2349        9.0329
     26   0.3064   0.7821        0.2240       0.9250        0.2307        8.9498
     27   0.3077   0.7806        [35m0.2215[0m       0.9214        0.2321        9.1914
     28   0.3136   0.7768        0.2244       0.9214        0.2331        9.3187
     29   0.3170   0.7766        0.2227       0.9250        0.2317        8.9449
Stopping since valid_loss has not improved in the last 10 epochs.
