[32m[I 2023-05-05 12:33:36,367][0m Trial 617 finished with value: 0.2706386031810433 and parameters: {'lr': 0.0022421894198176233, 'dropout': 0.4642932584212474, 'd_model_multiplier': 4, 'num_layers': 4, 'n_heads': 32, 'dim_feedforward': 316, 'batch_size': 69, 'pos_encoding': 'fixed', 'activation': 'relu', 'norm': 'LayerNorm', 'optimizer_name': 'RAdam', 'weight_decay': 0.1, 'top_n_features': 108}. Best is trial 246 with value: 0.16447311791139763.[0m
[FileBasedDataset] Initializing dataset...
	Examples: 8264
	Features: 104
	Max length: 315
Standard scalar turned ON, loading params from cache
[FileBasedDataset] Dataset initialization complete
  epoch    auprc    auroc    train_loss    valid_acc    valid_loss    cp      dur
-------  -------  -------  ------------  -----------  ------------  ----  -------
      1   [36m0.2061[0m   [32m0.6174[0m        [35m0.6963[0m       [31m0.5490[0m        [94m0.6871[0m     +  20.0489
      2   0.2042   0.6105        [35m0.6925[0m       [31m0.6058[0m        [94m0.6815[0m     +  20.6217
      3   0.2007   0.5999        [35m0.6880[0m       [31m0.6614[0m        [94m0.6745[0m     +  20.2025
      4   0.1986   0.5883        [35m0.6814[0m       [31m0.7412[0m        [94m0.6664[0m     +  20.4392
      5   0.1986   0.5776        [35m0.6720[0m       [31m0.8283[0m        [94m0.6574[0m     +  20.3518
      6   0.1866   0.5655        [35m0.6623[0m       [31m0.8730[0m        [94m0.6478[0m     +  20.6294
      7   0.1684   0.5458        [35m0.6521[0m       [31m0.8936[0m        [94m0.6378[0m     +  20.7250
      8   0.1440   0.5193        [35m0.6423[0m       [31m0.9021[0m        [94m0.6274[0m     +  20.5691
      9   0.1163   0.4898        [35m0.6311[0m       [31m0.9057[0m        [94m0.6168[0m     +  20.6600
     10   0.1105   0.4595        [35m0.6215[0m       0.9057        [94m0.6061[0m     +  20.6926
     11   0.1064   0.4364        [35m0.6121[0m       0.9045        [94m0.5953[0m     +  20.5077
     12   0.1034   0.4178        [35m0.5981[0m       0.9045        [94m0.5846[0m     +  20.5520
     13   0.0897   0.4023        [35m0.5892[0m       0.9045        [94m0.5739[0m     +  20.7018
     14   0.0875   0.3887        [35m0.5786[0m       0.9045        [94m0.5634[0m     +  20.9588
     15   0.0860   0.3777        [35m0.5684[0m       0.9045        [94m0.5531[0m     +  20.5366
     16   0.0852   0.3693        [35m0.5591[0m       0.9045        [94m0.5429[0m     +  20.7988
     17   0.0844   0.3620        [35m0.5469[0m       0.9045        [94m0.5331[0m     +  20.4422
     18   0.0840   0.3567        [35m0.5360[0m       0.9045        [94m0.5234[0m     +  20.8964
     19   0.0836   0.3521        [35m0.5268[0m       0.9045        [94m0.5140[0m     +  20.6315
     20   0.0834   0.3492        [35m0.5172[0m       0.9045        [94m0.5050[0m     +  20.4827
     21   0.0771   0.3475        [35m0.5083[0m       0.9045        [94m0.4962[0m     +  20.3754
     22   0.0750   0.3460        [35m0.4981[0m       0.9045        [94m0.4877[0m     +  20.5899
     23   0.0740   0.3452        [35m0.4906[0m       0.9045        [94m0.4795[0m     +  20.6610
     24   0.0740   0.3450        [35m0.4812[0m       0.9045        [94m0.4716[0m     +  20.8587
     25   0.0741   0.3448        [35m0.4725[0m       0.9045        [94m0.4641[0m     +  20.5847
     26   0.0742   0.3451        [35m0.4649[0m       0.9045        [94m0.4568[0m     +  20.7601
     27   0.0736   0.3458        [35m0.4573[0m       0.9045        [94m0.4498[0m     +  20.6273
     28   0.0736   0.3463        [35m0.4490[0m       0.9045        [94m0.4431[0m     +  20.6844
     29   0.0738   0.3474        [35m0.4415[0m       0.9045        [94m0.4368[0m     +  20.5647
     30   0.0739   0.3486        [35m0.4342[0m       0.9045        [94m0.4307[0m     +  20.7123
     31   0.0741   0.3500        [35m0.4282[0m       0.9045        [94m0.4249[0m     +  20.7004
     32   0.0740   0.3519        [35m0.4214[0m       0.9045        [94m0.4194[0m     +  20.5305
     33   0.0739   0.3537        [35m0.4143[0m       0.9045        [94m0.4141[0m     +  20.5167
     34   0.0738   0.3562        [35m0.4090[0m       0.9045        [94m0.4090[0m     +  20.6732
     35   0.0738   0.3585        [35m0.4036[0m       0.9045        [94m0.4042[0m     +  20.5721
     36   0.0741   0.3610        [35m0.3967[0m       0.9045        [94m0.3996[0m     +  20.3960
     37   0.0744   0.3649        [35m0.3929[0m       0.9045        [94m0.3952[0m     +  20.3254
     38   0.0748   0.3685        [35m0.3878[0m       0.9045        [94m0.3910[0m     +  20.5281
     39   0.0753   0.3730        [35m0.3818[0m       0.9045        [94m0.3870[0m     +  20.9554
     40   0.0757   0.3770        [35m0.3776[0m       0.9045        [94m0.3832[0m     +  20.7671
     41   0.0763   0.3816        [35m0.3725[0m       0.9045        [94m0.3796[0m     +  20.6081
     42   0.0768   0.3868        [35m0.3682[0m       0.9045        [94m0.3761[0m     +  20.7149
     43   0.0774   0.3922        [35m0.3634[0m       0.9045        [94m0.3728[0m     +  20.5765
     44   0.0780   0.3970        [35m0.3603[0m       0.9045        [94m0.3697[0m     +  20.6559
     45   0.0785   0.4019        [35m0.3554[0m       0.9045        [94m0.3667[0m     +  20.5660
     46   0.0791   0.4073        [35m0.3514[0m       0.9045        [94m0.3639[0m     +  20.4786
     47   0.0796   0.4121        [35m0.3497[0m       0.9045        [94m0.3612[0m     +  20.7455
     48   0.0803   0.4176        [35m0.3466[0m       0.9045        [94m0.3586[0m     +  20.5958
     49   0.0809   0.4232        [35m0.3426[0m       0.9045        [94m0.3562[0m     +  20.5496
     50   0.0816   0.4281        [35m0.3387[0m       0.9045        [94m0.3538[0m     +  20.5303
[32m[I 2023-05-05 12:50:50,596][0m Trial 618 finished with value: 0.35382953167249964 and parameters: {'lr': 2.6801543299196064e-07, 'dropout': 0.48316653320909425, 'd_model_multiplier': 4, 'num_layers': 4, 'n_heads': 32, 'dim_feedforward': 327, 'batch_size': 77, 'pos_encoding': 'fixed', 'activation': 'relu', 'norm': 'LayerNorm', 'optimizer_name': 'RAdam', 'weight_decay': 0.1, 'top_n_features': 104}. Best is trial 246 with value: 0.16447311791139763.[0m
[FileBasedDataset] Initializing dataset...
	Examples: 8264
	Features: 115
	Max length: 315
Standard scalar turned ON, loading params from cache
[FileBasedDataset] Dataset initialization complete
  epoch    auprc    auroc    train_loss    valid_acc    valid_loss    cp      dur
-------  -------  -------  ------------  -----------  ------------  ----  -------
      1   [36m0.2933[0m   [32m0.7784[0m        [35m0.2751[0m       [31m0.9069[0m        [94m0.2597[0m     +  19.9814
      2   0.2822   0.7741        [35m0.2558[0m       0.9045        0.2818        20.1204
      3   0.2342   0.7533        [35m0.2556[0m       [31m0.9141[0m        0.2632        20.4210
      4   0.2759   0.6780        [35m0.2468[0m       0.9105        0.2684        20.4550
      5   [36m0.3338[0m   0.7612        0.2494       0.9141        [94m0.2595[0m     +  20.2646
      6   0.1964   0.7069        0.2585       [31m0.9214[0m        [94m0.2591[0m     +  20.3963
      7   0.2027   0.7054        0.2576       [31m0.9226[0m        0.2606        20.1851
      8   0.2012   0.7137        0.2560       0.9202        [94m0.2574[0m     +  20.2668
      9   0.2084   0.7137        0.2535       0.9202        [94m0.2510[0m     +  20.4198
     10   0.2053   0.7154        0.2546       0.9202        0.2534        20.2606
     11   0.2682   0.6988        [35m0.2465[0m       0.9226        0.2749        20.3577
     12   0.2172   0.7200        [35m0.2433[0m       0.9214        0.2582        20.2821
     13   0.2005   0.7106        0.2533       0.9226        0.2542        20.4190
     14   0.2066   0.7164        0.2556       0.9202        [94m0.2504[0m     +  20.1047
     15   0.2793   0.7478        0.2487       [31m0.9250[0m        [94m0.2436[0m     +  20.0374
     16   0.2034   0.7125        0.2461       0.9202        0.2541        20.3373
     17   0.2025   0.7098        0.2539       0.9202        0.2504        20.4838
     18   0.2006   0.7114        0.2544       0.9202        0.2535        20.4977
     19   0.2030   0.7121        0.2530       0.9238        0.2512        20.5759
     20   0.2019   0.7168        0.2538       0.9214        0.2530        20.5013
     21   0.2028   0.7127        0.2531       0.9214        0.2526        20.3080
     22   0.2012   0.7094        0.2535       0.9202        0.2531        20.2350
     23   0.2023   0.7117        0.2525       0.9226        0.2606        20.2146
     24   0.2047   0.7123        0.2538       0.9202        0.2686        20.0552
Stopping since valid_loss has not improved in the last 10 epochs.
[32m[I 2023-05-05 12:59:18,840][0m Trial 619 finished with value: 0.2435811486505107 and parameters: {'lr': 0.0031396967963481805, 'dropout': 0.44776985754239, 'd_model_multiplier': 4, 'num_layers': 4, 'n_heads': 32, 'dim_feedforward': 177, 'batch_size': 71, 'pos_encoding': 'fixed', 'activation': 'relu', 'norm': 'LayerNorm', 'optimizer_name': 'RAdam', 'weight_decay': 0.1, 'top_n_features': 115}. Best is trial 246 with value: 0.16447311791139763.[0m
[FileBasedDataset] Initializing dataset...
	Examples: 8264
	Features: 126
	Max length: 315
Standard scalar turned ON, loading params from cache
[FileBasedDataset] Dataset initialization complete
  epoch    auprc    auroc    train_loss    valid_acc    valid_loss    cp     dur
-------  -------  -------  ------------  -----------  ------------  ----  ------
      1   [36m0.1274[0m   [32m0.6002[0m        [35m0.4224[0m       [31m0.9262[0m        [94m0.2630[0m     +  9.0723
      2   [36m0.2034[0m   [32m0.6647[0m        [35m0.2603[0m       0.9262        [94m0.2482[0m     +  8.4620
      3   [36m0.2461[0m   [32m0.7048[0m        [35m0.2467[0m       0.9262        [94m0.2424[0m     +  8.9938
      4   [36m0.2778[0m   [32m0.7235[0m        [35m0.2399[0m       [31m0.9287[0m        [94m0.2387[0m     +  9.2348
      5   [36m0.2954[0m   [32m0.7348[0m        [35m0.2347[0m       [31m0.9299[0m        0.2394        9.3097
      6   0.2946   [32m0.7460[0m        [35m0.2316[0m       [31m0.9323[0m        [94m0.2363[0m     +  9.7480
      7   0.2921   [32m0.7550[0m        [35m0.2273[0m       0.9311        0.2368        9.4916
      8   0.2846   [32m0.7667[0m        [35m0.2225[0m       0.9311        [94m0.2329[0m     +  8.9627
      9   0.2759   0.7599        [35m0.2208[0m       0.9311        0.2351        9.3528
     10   0.2834   0.7605        [35m0.2174[0m       0.9287        0.2340        9.5528
     11   0.2841   0.7621        [35m0.2130[0m       0.9299        0.2383        9.2143
     12   0.2902   0.7635        [35m0.2111[0m       [31m0.9335[0m        0.2380        9.4803
     13   0.2812   0.7567        [35m0.2072[0m       0.9311        0.2412        9.2664
     14   0.2918   0.7649        [35m0.2042[0m       0.9287        0.2403        9.5306
     15   0.2877   0.7652        [35m0.2020[0m       0.9287        0.2417        9.6835
     16   0.2831   0.7630        [35m0.1988[0m       0.9299        0.2447        9.7382
     17   0.2889   0.7664        [35m0.1956[0m       0.9287        0.2459        9.5305
Stopping since valid_loss has not improved in the last 10 epochs.
[32m[I 2023-05-05 13:02:07,473][0m Trial 620 finished with value: 0.23294426098988452 and parameters: {'lr': 0.0008809816122762438, 'dropout': 0.23173499548997517, 'd_model_multiplier': 4, 'num_layers': 2, 'n_heads': 4, 'dim_feedforward': 187, 'batch_size': 66, 'pos_encoding': 'learnable', 'activation': 'relu', 'norm': 'LayerNorm', 'optimizer_name': 'RAdam', 'weight_decay': 0.1, 'top_n_features': 126}. Best is trial 246 with value: 0.16447311791139763.[0m
[FileBasedDataset] Initializing dataset...
	Examples: 8264
	Features: 122
	Max length: 315
Standard scalar turned ON, loading params from cache
[FileBasedDataset] Dataset initialization complete
  epoch    auprc    auroc    train_loss    valid_acc    valid_loss    cp      dur
-------  -------  -------  ------------  -----------  ------------  ----  -------
      1   [36m0.2199[0m   [32m0.7370[0m        [35m0.3265[0m       [31m0.8936[0m        [94m0.5227[0m     +  16.7810
      2   0.2172   0.7244        [35m0.2684[0m       [31m0.9021[0m        [94m0.3901[0m     +  17.0208
      3   [36m0.2254[0m   0.7345        [35m0.2660[0m       [31m0.9081[0m        [94m0.3297[0m     +  16.9264
      4   [36m0.2258[0m   0.7235        [35m0.2611[0m       [31m0.9093[0m        [94m0.3110[0m     +  17.2189
      5   [36m0.2272[0m   0.7297        [35m0.2580[0m       [31m0.9129[0m        0.3298        16.9308
      6   [36m0.2359[0m   0.7266        0.2609       0.9093        0.4080        16.9378
      7   0.2079   0.6698        [35m0.2569[0m       0.9117        0.3973        17.0005
      8   0.2232   0.7327        0.2606       0.8972        0.4492        16.8570
      9   0.1914   0.6276        0.2675       0.9093        0.3919        16.9876
     10   0.1849   0.6272        0.2599       0.9045        0.3388        16.8655
     11   [36m0.2366[0m   [32m0.7463[0m        0.2635       0.9045        [94m0.2854[0m     +  16.7940
     12   0.2187   0.7131        [35m0.2508[0m       0.9033        0.2979        17.6830
     13   0.2325   [32m0.7681[0m        [35m0.2501[0m       0.9093        [94m0.2557[0m     +  16.7565
     14   0.2349   [32m0.7706[0m        [35m0.2443[0m       0.9045        [94m0.2541[0m     +  16.8135
     15   0.2312   0.7586        0.2487       0.8948        0.2705        16.8982
     16   0.2353   0.7556        0.2460       [31m0.9141[0m        0.2557        16.7177
     17   0.2304   0.7625        0.2489       0.9117        0.2563        16.8769
     18   0.2219   0.7535        0.2496       [31m0.9154[0m        0.2617        17.0215
     19   0.2265   0.7542        0.2554       0.9154        0.2574        16.9979
     20   0.2199   0.7437        0.2496       0.9008        0.2742        16.8911
     21   0.2298   0.7457        0.2495       0.9141        0.2560        16.8744
     22   0.2165   0.7414        0.2493       0.9093        0.2607        16.9553
     23   0.2172   0.7410        0.2509       0.9069        0.2629        16.8871
     24   [36m0.2380[0m   0.7524        0.2469       0.9117        [94m0.2527[0m     +  16.9489
     25   0.2320   0.7431        0.2446       0.9105        0.2645        17.0372
     26   [36m0.2445[0m   0.7511        0.2481       0.9141        [94m0.2522[0m     +  17.0385
     27   0.2239   0.7477        0.2504       0.8912        0.2757        17.0426
     28   0.2282   0.7483        0.2476       0.9093        0.2633        17.0783
     29   0.2265   0.7409        [35m0.2438[0m       0.9093        0.2638        17.0191
     30   [36m0.2523[0m   0.7448        [35m0.2399[0m       0.9057        0.2756        17.0364
     31   0.2199   0.7385        0.2410       0.9069        0.2789        16.9305
     32   0.2307   0.7471        0.2417       0.9081        0.2692        16.9333
     33   0.2269   0.7414        0.2426       0.9093        0.2747        16.9509
     34   0.2214   0.7479        0.2426       0.9117        0.2648        17.0832
     35   0.2325   0.7440        [35m0.2391[0m       [31m0.9166[0m        0.2661        17.2269
Stopping since valid_loss has not improved in the last 10 epochs.
[32m[I 2023-05-05 13:12:19,476][0m Trial 621 finished with value: 0.25220930356500804 and parameters: {'lr': 0.0016477753065163602, 'dropout': 0.6764092493863441, 'd_model_multiplier': 4, 'num_layers': 3, 'n_heads': 32, 'dim_feedforward': 177, 'batch_size': 63, 'pos_encoding': 'fixed', 'activation': 'gelu', 'norm': 'BatchNorm', 'optimizer_name': 'RAdam', 'weight_decay': 0.1, 'top_n_features': 122}. Best is trial 246 with value: 0.16447311791139763.[0m
[FileBasedDataset] Initializing dataset...
	Examples: 8264
	Features: 117
	Max length: 315
Standard scalar turned ON, loading params from cache
[FileBasedDataset] Dataset initialization complete
  epoch    auprc    auroc    train_loss    valid_acc    valid_loss    cp      dur
-------  -------  -------  ------------  -----------  ------------  ----  -------
      1   [36m0.2377[0m   [32m0.6778[0m        [35m0.4310[0m       [31m0.9057[0m        [94m0.2760[0m     +  16.4377
      2   [36m0.2952[0m   [32m0.7639[0m        [35m0.2536[0m       [31m0.9117[0m        [94m0.2515[0m     +  16.5317
      3   [36m0.3366[0m   [32m0.8028[0m        [35m0.2429[0m       [31m0.9129[0m        [94m0.2419[0m     +  16.4711
      4   [36m0.3759[0m   [32m0.8187[0m        [35m0.2359[0m       [31m0.9154[0m        [94m0.2364[0m     +  16.5936
      5   0.3747   [32m0.8221[0m        [35m0.2329[0m       0.9117        [94m0.2355[0m     +  16.7418
      6   [36m0.3780[0m   [32m0.8264[0m        [35m0.2312[0m       0.9093        [94m0.2331[0m     +  16.6554
      7   [36m0.3825[0m   [32m0.8283[0m        [35m0.2283[0m       0.9093        [94m0.2319[0m     +  16.5424
      8   0.3803   [32m0.8304[0m        [35m0.2268[0m       0.9117        [94m0.2313[0m     +  16.8638
      9   [36m0.3932[0m   [32m0.8327[0m        [35m0.2260[0m       0.9093        [94m0.2293[0m     +  16.5339
     10   [36m0.3937[0m   [32m0.8373[0m        [35m0.2228[0m       0.9045        [94m0.2278[0m     +  16.6932
     11   [36m0.3992[0m   [32m0.8396[0m        [35m0.2191[0m       0.8996        0.2283        16.5572
     12   [36m0.4024[0m   [32m0.8404[0m        [35m0.2178[0m       0.8996        0.2313        16.8850
     13   0.3804   0.8385        [35m0.2173[0m       0.8972        0.2336        16.7374
     14   0.3833   0.8376        [35m0.2157[0m       0.9021        0.2330        16.7202
     15   0.3601   0.8361        [35m0.2128[0m       0.8996        0.2377        17.0248
     16   0.3456   0.8352        [35m0.2108[0m       0.9021        0.2473        16.7736
     17   0.3593   0.8384        [35m0.2078[0m       0.9057        0.2412        16.6587
     18   0.3589   [32m0.8412[0m        [35m0.2059[0m       0.9021        0.2485        16.7494
     19   0.3461   0.8373        0.2060       0.9057        0.2498        16.8389
Stopping since valid_loss has not improved in the last 10 epochs.
[32m[I 2023-05-05 13:17:54,359][0m Trial 622 finished with value: 0.2277948610763884 and parameters: {'lr': 0.00017907491292421118, 'dropout': 0.3782092459489498, 'd_model_multiplier': 4, 'num_layers': 3, 'n_heads': 32, 'dim_feedforward': 158, 'batch_size': 74, 'pos_encoding': 'fixed', 'activation': 'relu', 'norm': 'LayerNorm', 'optimizer_name': 'RAdam', 'weight_decay': 0.1, 'top_n_features': 117}. Best is trial 246 with value: 0.16447311791139763.[0m
[FileBasedDataset] Initializing dataset...
	Examples: 8264
	Features: 99
	Max length: 315
Standard scalar turned ON, loading params from cache
[FileBasedDataset] Dataset initialization complete
  epoch    auprc    auroc    train_loss    valid_acc    valid_loss    cp      dur
-------  -------  -------  ------------  -----------  ------------  ----  -------
      1   [36m0.1301[0m   [32m0.5765[0m        [35m0.4407[0m       [31m0.9226[0m        [94m0.2727[0m     +  33.9717
      2   [36m0.2892[0m   [32m0.7416[0m        [35m0.2643[0m       0.9226        [94m0.2423[0m     +  34.0056
      3   [36m0.3378[0m   [32m0.7790[0m        [35m0.2485[0m       0.9226        [94m0.2342[0m     +  33.9822
      4   [36m0.3543[0m   [32m0.7902[0m        [35m0.2434[0m       [31m0.9262[0m        [94m0.2300[0m     +  33.8555
      5   [36m0.3557[0m   [32m0.7957[0m        [35m0.2395[0m       0.9250        [94m0.2269[0m     +  33.9229
      6   [36m0.3580[0m   0.7924        [35m0.2356[0m       0.9262        [94m0.2269[0m     +  34.0649
      7   [36m0.3610[0m   0.7880        0.2358       [31m0.9274[0m        0.2279        34.0449
      8   [36m0.3621[0m   0.7846        [35m0.2342[0m       0.9274        0.2293        33.8755
      9   [36m0.3717[0m   0.7882        [35m0.2333[0m       0.9274        0.2290        34.0863
     10   [36m0.3754[0m   0.7888        [35m0.2299[0m       [31m0.9311[0m        0.2297        33.7882
     11   0.3715   0.7869        [35m0.2295[0m       0.9311        0.2304        33.8472
     12   [36m0.3768[0m   0.7868        0.2296       0.9299        0.2310        34.0628
     13   [36m0.3787[0m   0.7880        0.2299       0.9274        0.2312        34.1350
     14   0.3760   0.7860        [35m0.2277[0m       0.9262        0.2323        33.9430
Stopping since valid_loss has not improved in the last 10 epochs.
