[32m[I 2023-05-02 20:31:13,568][0m Trial 205 finished with value: 0.2065182991208736 and parameters: {'lr': 0.0009022044845196198, 'dropout': 0.4361250064121629, 'd_model_multiplier': 4, 'num_layers': 4, 'n_heads': 32, 'dim_feedforward': 216, 'batch_size': 70, 'pos_encoding': 'fixed', 'activation': 'relu', 'norm': 'LayerNorm', 'optimizer_name': 'AdamW', 'weight_decay': 0.1, 'top_n_features': 33}. Best is trial 117 with value: 0.191397856754288.[0m
[FileBasedDataset] Initializing dataset...
	Examples: 8264
	Features: 31
	Max length: 315
Standard scalar turned ON, loading params from cache
[FileBasedDataset] Dataset initialization complete
  epoch    auprc    auroc    train_loss    valid_acc    valid_loss    cp      dur
-------  -------  -------  ------------  -----------  ------------  ----  -------
      1   [36m0.2453[0m   [32m0.7278[0m        [35m0.2699[0m       [31m0.8501[0m        [94m0.3744[0m     +  19.7076
      2   [36m0.2755[0m   [32m0.7800[0m        [35m0.2519[0m       [31m0.9141[0m        [94m0.2513[0m     +  19.5187
      3   [36m0.2896[0m   [32m0.7938[0m        [35m0.2487[0m       0.9117        [94m0.2461[0m     +  19.8572
      4   [36m0.2924[0m   [32m0.8103[0m        [35m0.2440[0m       [31m0.9154[0m        [94m0.2417[0m     +  19.9752
      5   [36m0.3135[0m   [32m0.8253[0m        [35m0.2394[0m       [31m0.9166[0m        [94m0.2359[0m     +  20.2076
      6   0.2967   0.8145        [35m0.2319[0m       0.9166        0.2524        20.3966
      7   [36m0.3223[0m   [32m0.8319[0m        [35m0.2315[0m       0.9129        0.2473        19.9393
      8   0.3146   0.8317        [35m0.2279[0m       0.9141        0.2488        19.9001
      9   0.3215   0.8314        0.2319       0.9166        0.2447        19.9073
     10   0.2943   0.8175        0.2317       0.9154        0.2720        19.6525
     11   0.3186   0.8303        0.2296       0.9154        0.2458        19.7948
     12   0.3173   [32m0.8334[0m        [35m0.2277[0m       0.9141        0.2439        21.3416
     13   0.3098   0.8293        [35m0.2270[0m       0.9154        0.2563        19.8492
     14   [36m0.3246[0m   0.8259        0.2288       [31m0.9178[0m        0.2543        20.0936
Stopping since valid_loss has not improved in the last 10 epochs.
[32m[I 2023-05-02 20:36:14,158][0m Trial 206 finished with value: 0.23593741759856063 and parameters: {'lr': 0.0010351081455878663, 'dropout': 0.43496520761547325, 'd_model_multiplier': 4, 'num_layers': 4, 'n_heads': 32, 'dim_feedforward': 215, 'batch_size': 69, 'pos_encoding': 'fixed', 'activation': 'relu', 'norm': 'LayerNorm', 'optimizer_name': 'AdamW', 'weight_decay': 0.1, 'top_n_features': 31}. Best is trial 117 with value: 0.191397856754288.[0m
[FileBasedDataset] Initializing dataset...
	Examples: 8264
	Features: 38
	Max length: 315
Standard scalar turned ON, loading params from cache
[FileBasedDataset] Dataset initialization complete
  epoch    auprc    auroc    train_loss    valid_acc    valid_loss    cp      dur
-------  -------  -------  ------------  -----------  ------------  ----  -------
      1   [36m0.1896[0m   [32m0.7198[0m        [35m0.2799[0m       [31m0.9202[0m        [94m0.2586[0m     +  23.8429
      2   [36m0.2410[0m   [32m0.7743[0m        [35m0.2515[0m       0.9057        [94m0.2565[0m     +  23.5534
      3   [36m0.2761[0m   [32m0.8071[0m        [35m0.2439[0m       0.9105        [94m0.2481[0m     +  23.8953
      4   0.2679   0.7960        [35m0.2369[0m       0.9069        0.2490        23.9438
      5   [36m0.2885[0m   [32m0.8107[0m        0.2374       0.9117        [94m0.2428[0m     +  24.0327
      6   0.2741   0.8042        [35m0.2337[0m       0.9093        [94m0.2422[0m     +  23.8862
      7   [36m0.3014[0m   [32m0.8159[0m        [35m0.2325[0m       0.9166        [94m0.2390[0m     +  23.7222
      8   0.2988   0.8131        [35m0.2297[0m       0.9178        0.2425        23.9597
      9   [36m0.3358[0m   [32m0.8244[0m        [35m0.2267[0m       0.9202        [94m0.2327[0m     +  23.9384
     10   0.3096   0.8150        [35m0.2242[0m       0.9105        0.2485        23.7680
     11   0.3249   [32m0.8301[0m        0.2252       0.9154        0.2400        24.0496
     12   0.3054   0.8199        0.2254       0.9178        0.2409        23.7968
     13   0.2984   0.8270        [35m0.2233[0m       0.9166        0.2348        24.0968
     14   0.3073   0.8257        [35m0.2228[0m       0.9069        0.2530        24.0576
     15   0.3099   0.8233        [35m0.2201[0m       0.9178        0.2465        23.8796
     16   [36m0.3577[0m   [32m0.8307[0m        [35m0.2166[0m       [31m0.9238[0m        0.2428        23.7563
     17   0.3009   0.8219        0.2179       0.9057        0.2636        23.7636
     18   0.3300   0.8248        0.2221       0.9178        0.2469        24.0851
Stopping since valid_loss has not improved in the last 10 epochs.
[32m[I 2023-05-02 20:43:49,238][0m Trial 207 finished with value: 0.23265445506270016 and parameters: {'lr': 0.0008035506599557241, 'dropout': 0.44290879244617704, 'd_model_multiplier': 4, 'num_layers': 5, 'n_heads': 32, 'dim_feedforward': 229, 'batch_size': 86, 'pos_encoding': 'fixed', 'activation': 'relu', 'norm': 'LayerNorm', 'optimizer_name': 'AdamW', 'weight_decay': 0.1, 'top_n_features': 38}. Best is trial 117 with value: 0.191397856754288.[0m
[FileBasedDataset] Initializing dataset...
	Examples: 8264
	Features: 54
	Max length: 315
Standard scalar turned ON, loading params from cache
[FileBasedDataset] Dataset initialization complete
  epoch    auprc    auroc    train_loss    valid_acc    valid_loss    cp      dur
-------  -------  -------  ------------  -----------  ------------  ----  -------
      1   [36m0.1595[0m   [32m0.7302[0m        [35m0.3011[0m       [31m0.9432[0m        [94m0.1994[0m     +  20.0089
      2   [36m0.1779[0m   [32m0.7326[0m        [35m0.2665[0m       0.9432        [94m0.1957[0m     +  19.8167
      3   0.1624   0.7185        [35m0.2643[0m       0.9432        0.1974        19.9846
      4   0.1622   0.7269        [35m0.2630[0m       0.9432        0.2022        20.2051
      5   0.1736   0.7279        [35m0.2619[0m       0.9432        0.2010        20.1226
      6   0.1770   [32m0.7368[0m        [35m0.2606[0m       0.9432        0.1990        20.2130
      7   0.1712   0.7287        0.2622       0.9432        0.1977        20.0741
      8   0.1727   0.7309        [35m0.2593[0m       0.9432        0.1978        20.0441
      9   0.1684   0.7311        [35m0.2581[0m       0.9420        0.1992        20.2104
     10   0.1661   0.7307        0.2593       0.9420        0.1992        20.1681
     11   0.1767   0.7311        [35m0.2578[0m       0.9420        0.1992        19.9734
Stopping since valid_loss has not improved in the last 10 epochs.
[32m[I 2023-05-02 20:47:50,699][0m Trial 208 finished with value: 0.1957275327272542 and parameters: {'lr': 0.0015262082354163939, 'dropout': 0.44762570164082943, 'd_model_multiplier': 4, 'num_layers': 4, 'n_heads': 32, 'dim_feedforward': 242, 'batch_size': 72, 'pos_encoding': 'fixed', 'activation': 'relu', 'norm': 'LayerNorm', 'optimizer_name': 'AdamW', 'weight_decay': 0.1, 'top_n_features': 54}. Best is trial 117 with value: 0.191397856754288.[0m
[FileBasedDataset] Initializing dataset...
	Examples: 8264
	Features: 58
	Max length: 315
Standard scalar turned ON, loading params from cache
[FileBasedDataset] Dataset initialization complete
  epoch    auprc    auroc    train_loss    valid_acc    valid_loss    cp      dur
-------  -------  -------  ------------  -----------  ------------  ----  -------
      1   [36m0.1458[0m   [32m0.6690[0m        [35m0.2818[0m       [31m0.9250[0m        [94m0.2699[0m     +  20.1569
      2   0.1361   [32m0.6776[0m        [35m0.2661[0m       0.9250        [94m0.2655[0m     +  20.0169
      3   [36m0.1581[0m   [32m0.6868[0m        [35m0.2590[0m       0.9250        0.2660        20.3940
      4   0.1482   0.6857        [35m0.2551[0m       0.9250        [94m0.2640[0m     +  20.3696
      5   [36m0.1774[0m   0.6839        [35m0.2547[0m       0.9238        [94m0.2597[0m     +  20.3455
      6   [36m0.1831[0m   [32m0.6910[0m        [35m0.2541[0m       0.9214        [94m0.2587[0m     +  20.3110
      7   0.1724   0.6889        [35m0.2507[0m       0.9238        0.2620        20.3314
      8   [36m0.1855[0m   0.6881        0.2526       0.9202        0.2616        20.1440
      9   [36m0.1864[0m   0.6884        [35m0.2506[0m       0.9214        0.2623        20.2817
     10   0.1836   0.6801        [35m0.2497[0m       0.9226        0.2644        20.4347
     11   [36m0.1868[0m   0.6835        0.2499       0.9202        0.2626        20.3412
     12   0.1807   0.6781        0.2498       0.9226        0.2667        20.2662
     13   [36m0.1876[0m   0.6868        [35m0.2490[0m       0.9226        0.2608        20.2108
     14   0.1839   0.6858        [35m0.2482[0m       0.9226        0.2664        20.2046
     15   0.1869   0.6813        0.2498       0.9190        0.2652        20.2122
Stopping since valid_loss has not improved in the last 10 epochs.
[32m[I 2023-05-02 20:53:15,655][0m Trial 209 finished with value: 0.25874730186061673 and parameters: {'lr': 0.0015331031732113292, 'dropout': 0.42330803322235927, 'd_model_multiplier': 4, 'num_layers': 4, 'n_heads': 32, 'dim_feedforward': 253, 'batch_size': 79, 'pos_encoding': 'fixed', 'activation': 'relu', 'norm': 'LayerNorm', 'optimizer_name': 'AdamW', 'weight_decay': 0.1, 'top_n_features': 58}. Best is trial 117 with value: 0.191397856754288.[0m
[FileBasedDataset] Initializing dataset...
	Examples: 8264
	Features: 79
	Max length: 315
Standard scalar turned ON, loading params from cache
[FileBasedDataset] Dataset initialization complete
  epoch    auprc    auroc    train_loss    valid_acc    valid_loss    cp      dur
-------  -------  -------  ------------  -----------  ------------  ----  -------
      1   [36m0.1391[0m   [32m0.5874[0m        [35m0.3063[0m       [31m0.9311[0m        [94m0.2771[0m     +  23.4699
      2   0.1192   [32m0.6213[0m        [35m0.2672[0m       0.9311        [94m0.2592[0m     +  23.5378
      3   0.1318   [32m0.6717[0m        [35m0.2601[0m       0.9311        0.2630        23.6427
      4   0.1301   0.6663        [35m0.2581[0m       0.9311        0.2638        23.5371
      5   0.1374   [32m0.6766[0m        [35m0.2576[0m       0.9311        0.2684        23.4437
      6   0.1383   0.6759        0.2582       0.9311        0.2648        23.4820
      7   0.1367   0.6724        [35m0.2551[0m       0.9299        0.2608        23.4550
      8   [36m0.1408[0m   [32m0.6829[0m        [35m0.2534[0m       0.9299        [94m0.2589[0m     +  23.6038
      9   [36m0.1479[0m   0.6829        0.2539       0.9311        0.2618        23.8130
     10   0.1427   0.6795        0.2541       0.9311        0.2619        23.6932
     11   0.1443   0.6785        0.2558       0.9311        [94m0.2572[0m     +  23.7806
     12   [36m0.1546[0m   0.6814        0.2551       0.9299        [94m0.2539[0m     +  23.8040
     13   [36m0.1607[0m   [32m0.6843[0m        0.2534       0.9299        [94m0.2526[0m     +  23.6480
     14   0.1533   0.6792        0.2536       0.9311        0.2534        23.7218
     15   0.1502   0.6807        0.2536       0.9311        [94m0.2495[0m     +  23.8504
     16   0.1477   0.6792        [35m0.2531[0m       0.9299        [94m0.2430[0m     +  23.5797
     17   0.1481   0.6834        0.2532       0.9299        [94m0.2429[0m     +  23.4139
     18   0.1501   0.6802        [35m0.2522[0m       0.9299        [94m0.2382[0m     +  23.4796
     19   0.1541   0.6819        0.2543       0.9299        0.2412        24.6753
     20   0.1504   0.6829        0.2524       0.9299        [94m0.2348[0m     +  23.3998
     21   0.1507   0.6805        [35m0.2515[0m       0.9311        0.2376        23.4583
     22   0.1536   0.6784        0.2531       0.9311        0.2373        23.3623
     23   [36m0.1713[0m   0.6818        0.2527       0.9299        0.2372        23.7939
     24   0.1468   0.6768        0.2527       0.9299        0.2363        23.6719
     25   0.1510   0.6832        0.2534       0.9299        0.2349        23.7928
     26   0.1590   0.6800        0.2529       0.9299        0.2357        23.4948
     27   0.1604   0.6821        [35m0.2515[0m       0.9299        0.2359        23.5638
     28   0.1519   0.6774        0.2519       0.9299        [94m0.2348[0m     +  23.5291
     29   0.1513   0.6775        [35m0.2509[0m       0.9287        0.2366        23.5725
     30   0.1550   0.6771        0.2521       0.9287        0.2360        23.5880
     31   0.1513   0.6801        0.2522       0.9299        0.2379        23.4959
     32   0.1653   0.6794        0.2525       0.9299        0.2432        23.6657
     33   0.1528   0.6760        [35m0.2506[0m       0.9299        0.2405        23.5660
     34   0.1526   0.6798        0.2529       0.9311        0.2460        23.6550
     35   0.1647   0.6765        0.2509       0.9299        0.2421        23.5559
     36   0.1516   0.6779        0.2517       0.9311        0.2406        23.8335
     37   0.1568   0.6796        0.2515       0.9311        0.2451        23.7261
Stopping since valid_loss has not improved in the last 10 epochs.
[32m[I 2023-05-02 21:08:15,064][0m Trial 210 finished with value: 0.23480377212941575 and parameters: {'lr': 0.0020307384358731985, 'dropout': 0.4363671445976443, 'd_model_multiplier': 4, 'num_layers': 5, 'n_heads': 32, 'dim_feedforward': 194, 'batch_size': 66, 'pos_encoding': 'fixed', 'activation': 'relu', 'norm': 'LayerNorm', 'optimizer_name': 'AdamW', 'weight_decay': 0.1, 'top_n_features': 79}. Best is trial 117 with value: 0.191397856754288.[0m
[FileBasedDataset] Initializing dataset...
	Examples: 8264
	Features: 46
	Max length: 315
Standard scalar turned ON, loading params from cache
[FileBasedDataset] Dataset initialization complete
  epoch    auprc    auroc    train_loss    valid_acc    valid_loss    cp      dur
-------  -------  -------  ------------  -----------  ------------  ----  -------
      1   [36m0.2379[0m   [32m0.8243[0m        [35m0.2636[0m       [31m0.9081[0m        [94m0.2579[0m     +  19.5083
      2   [36m0.2823[0m   [32m0.8328[0m        [35m0.2458[0m       [31m0.9154[0m        [94m0.2233[0m     +  20.1865
      3   [36m0.2886[0m   0.8299        [35m0.2434[0m       [31m0.9250[0m        [94m0.2099[0m     +  19.8809
      4   0.2754   0.8298        [35m0.2386[0m       0.9214        0.2155        19.9001
      5   [36m0.2990[0m   0.8292        [35m0.2355[0m       0.9250        0.2122        20.0568
      6   [36m0.3345[0m   0.8317        0.2358       [31m0.9311[0m        [94m0.2085[0m     +  20.0828
      7   0.3323   0.8289        [35m0.2308[0m       0.9299        0.2137        19.8929
      8   [36m0.3388[0m   0.8234        [35m0.2298[0m       0.9311        0.2135        20.1596
      9   0.3058   0.8220        [35m0.2295[0m       0.9299        0.2178        20.0822
     10   0.3050   0.8221        [35m0.2261[0m       0.9287        0.2152        20.1719
     11   0.2942   0.8188        [35m0.2225[0m       0.9311        0.2179        20.1460
     12   0.2752   0.8276        0.2246       0.9299        0.2270        20.0166
     13   0.2904   [32m0.8330[0m        0.2227       [31m0.9323[0m        0.2161        20.1356
     14   0.2429   0.8226        [35m0.2176[0m       0.9262        0.2202        20.2449
     15   0.2881   0.8282        0.2189       0.9287        0.2171        20.2582
Stopping since valid_loss has not improved in the last 10 epochs.
[32m[I 2023-05-02 21:13:36,343][0m Trial 211 finished with value: 0.2084964440984622 and parameters: {'lr': 0.0005653479476396005, 'dropout': 0.45347788124148747, 'd_model_multiplier': 4, 'num_layers': 4, 'n_heads': 32, 'dim_feedforward': 215, 'batch_size': 71, 'pos_encoding': 'fixed', 'activation': 'relu', 'norm': 'LayerNorm', 'optimizer_name': 'AdamW', 'weight_decay': 0.1, 'top_n_features': 46}. Best is trial 117 with value: 0.191397856754288.[0m
[FileBasedDataset] Initializing dataset...
	Examples: 8264
	Features: 48
	Max length: 315
Standard scalar turned ON, loading params from cache
[FileBasedDataset] Dataset initialization complete
  epoch    auprc    auroc    train_loss    valid_acc    valid_loss    cp      dur
-------  -------  -------  ------------  -----------  ------------  ----  -------
      1   [36m0.2669[0m   [32m0.7620[0m        [35m0.2799[0m       [31m0.8984[0m        [94m0.2608[0m     +  19.9089
      2   0.2136   0.7424        [35m0.2615[0m       [31m0.9287[0m        [94m0.2324[0m     +  20.1711
      3   0.2094   0.7358        [35m0.2588[0m       0.9287        0.2421        19.8987
      4   0.2124   0.7344        [35m0.2554[0m       0.9274        0.2342        20.2285
      5   0.2023   0.7429        0.2559       0.9287        0.2546        19.9291
      6   0.1812   0.7396        [35m0.2544[0m       0.9287        0.2483        19.9718
      7   0.2006   0.7398        0.2565       0.9287        0.2509        20.0387
      8   0.1664   0.7354        [35m0.2540[0m       0.9287        0.2544        20.0680
      9   0.1960   0.7302        [35m0.2529[0m       0.9287        0.2398        20.0826
     10   0.1829   0.7340        0.2544       0.9287        0.2398        20.3989
     11   0.1857   0.7331        0.2550       0.9287        0.2388        20.2085
Stopping since valid_loss has not improved in the last 10 epochs.
[32m[I 2023-05-02 21:17:37,892][0m Trial 212 finished with value: 0.23237991776258798 and parameters: {'lr': 0.0012542688082907544, 'dropout': 0.447432462458258, 'd_model_multiplier': 4, 'num_layers': 4, 'n_heads': 32, 'dim_feedforward': 243, 'batch_size': 72, 'pos_encoding': 'fixed', 'activation': 'relu', 'norm': 'LayerNorm', 'optimizer_name': 'AdamW', 'weight_decay': 0.1, 'top_n_features': 48}. Best is trial 117 with value: 0.191397856754288.[0m
[FileBasedDataset] Initializing dataset...
	Examples: 8264
	Features: 46
	Max length: 315
Standard scalar turned ON, loading params from cache
[FileBasedDataset] Dataset initialization complete
  epoch    auprc    auroc    train_loss    valid_acc    valid_loss    cp      dur
-------  -------  -------  ------------  -----------  ------------  ----  -------
      1   [36m0.2141[0m   [32m0.7654[0m        [35m0.2711[0m       [31m0.9214[0m        [94m0.2391[0m     +  19.9516
      2   [36m0.2519[0m   [32m0.7781[0m        [35m0.2454[0m       [31m0.9262[0m        [94m0.2239[0m     +  20.2201
      3   0.2488   0.7772        [35m0.2382[0m       0.9262        0.2341        20.3851
      4   [36m0.2522[0m   [32m0.7800[0m        [35m0.2355[0m       0.9238        0.2332        20.7602
      5   [36m0.2720[0m   [32m0.7892[0m        [35m0.2326[0m       0.9238        0.2362        20.3087
      6   [36m0.2806[0m   [32m0.7905[0m        [35m0.2302[0m       0.9262        0.2265        20.5079
      7   [36m0.2820[0m   0.7870        0.2311       0.9226        0.2327        20.3891
      8   [36m0.2851[0m   [32m0.7948[0m        [35m0.2274[0m       0.9250        0.2259        20.4479
      9   0.2441   0.7866        [35m0.2273[0m       0.9250        0.2268        20.4213
     10   [36m0.2945[0m   [32m0.7975[0m        [35m0.2259[0m       0.9238        0.2342        20.3923
     11   0.2748   0.7886        0.2281       0.9250        0.2327        20.3208
Stopping since valid_loss has not improved in the last 10 epochs.
