[32m[I 2023-05-02 02:17:30,052][0m Trial 18 finished with value: 0.23047267046487893 and parameters: {'lr': 0.01627065005986551, 'dropout': 0.40013903800066314, 'd_model_multiplier': 2, 'num_layers': 3, 'n_heads': 16, 'dim_feedforward': 249, 'batch_size': 216, 'pos_encoding': 'fixed', 'activation': 'gelu', 'norm': 'BatchNorm', 'optimizer_name': 'PlainRAdam', 'weight_decay': 0.001, 'top_n_features': 235}. Best is trial 12 with value: 0.20472501771481755.[0m
[FileBasedDataset] Initializing dataset...
	Examples: 8264
	Features: 89
	Max length: 315
Standard scalar turned ON, loading params from cache
[FileBasedDataset] Dataset initialization complete
  epoch    auprc    auroc    train_loss    valid_acc    valid_loss    cp      dur
-------  -------  -------  ------------  -----------  ------------  ----  -------
      1   [36m0.1930[0m   [32m0.7823[0m        [35m0.2906[0m       [31m0.8948[0m        [94m0.2678[0m     +  16.1266
      2   0.1491   0.6970        [35m0.2796[0m       [31m0.9081[0m        0.2818        16.2494
      3   0.1727   0.6861        0.2873       [31m0.9262[0m        [94m0.2462[0m     +  16.3736
      4   0.1543   0.6687        [35m0.2760[0m       0.9166        0.2802        16.4145
      5   0.1465   0.6754        [35m0.2645[0m       0.9154        0.2586        16.8728
      6   0.1514   0.6764        [35m0.2641[0m       0.9093        0.2707        17.0473
      7   0.1534   0.6714        0.2654       0.9141        0.2821        17.0447
      8   0.1560   0.6698        [35m0.2620[0m       0.9202        0.2564        16.9550
      9   0.1531   0.6592        [35m0.2615[0m       0.9057        0.2666        16.5712
     10   0.1484   0.6801        [35m0.2595[0m       0.9141        0.2591        16.7197
     11   0.1489   0.6713        [35m0.2593[0m       0.8912        0.2816        16.5599
     12   0.1475   0.7019        0.2614       0.9250        0.2564        16.8888
Stopping since valid_loss has not improved in the last 10 epochs.
[32m[I 2023-05-02 02:21:06,903][0m Trial 19 finished with value: 0.24618992713947827 and parameters: {'lr': 0.018486860030670495, 'dropout': 0.36264648826192974, 'd_model_multiplier': 2, 'num_layers': 6, 'n_heads': 16, 'dim_feedforward': 225, 'batch_size': 52, 'pos_encoding': 'fixed', 'activation': 'gelu', 'norm': 'BatchNorm', 'optimizer_name': 'PlainRAdam', 'weight_decay': 0.001, 'top_n_features': 89}. Best is trial 12 with value: 0.20472501771481755.[0m
[FileBasedDataset] Initializing dataset...
	Examples: 8264
	Features: 141
	Max length: 315
Standard scalar turned ON, loading params from cache
[FileBasedDataset] Dataset initialization complete
  epoch    auprc    auroc    train_loss    valid_acc    valid_loss    cp      dur
-------  -------  -------  ------------  -----------  ------------  ----  -------
      1   [36m0.1971[0m   [32m0.6402[0m        [35m0.3102[0m       [31m0.9190[0m        [94m0.2688[0m     +  24.4085
      2   0.1967   [32m0.6867[0m        [35m0.2663[0m       0.9190        0.3499        24.6729
      3   [36m0.2273[0m   0.6825        [35m0.2609[0m       0.9154        0.3060        24.6211
      4   0.2117   0.6459        0.2689       0.9190        [94m0.2642[0m     +  24.6701
      5   0.2002   0.6454        0.2805       0.9190        [94m0.2640[0m     +  24.7562
      6   0.1952   0.6458        0.2614       0.9190        0.2660        24.8699
      7   0.1922   0.6533        0.2706       0.9190        0.2645        24.7478
      8   0.1916   0.6580        0.2868       0.9190        [94m0.2622[0m     +  24.8792
      9   0.1868   0.6511        0.2632       0.9141        0.2673        24.7842
     10   0.1864   0.6551        0.2622       0.9190        0.2707        24.9947
     11   0.1791   0.6593        0.3282       0.9033        0.2847        25.1449
     12   0.1810   0.6544        0.2743       0.9141        0.2655        25.0960
     13   0.1830   0.6493        0.2689       0.9190        0.2810        25.2140
     14   0.1890   0.6593        0.3075       0.9190        0.2630        25.5230
     15   0.2003   0.6580        0.2770       0.9190        0.2648        25.3651
     16   0.1929   0.6567        0.2815       0.9190        0.2683        25.2211
     17   0.1925   0.6581        0.2777       0.9178        0.2674        25.0475
Stopping since valid_loss has not improved in the last 10 epochs.
[32m[I 2023-05-02 02:28:36,555][0m Trial 20 finished with value: 0.26216345924564255 and parameters: {'lr': 0.013596599980764141, 'dropout': 0.4300687928798599, 'd_model_multiplier': 2, 'num_layers': 10, 'n_heads': 16, 'dim_feedforward': 256, 'batch_size': 96, 'pos_encoding': 'fixed', 'activation': 'gelu', 'norm': 'BatchNorm', 'optimizer_name': 'PlainRAdam', 'weight_decay': 0.001, 'top_n_features': 141}. Best is trial 12 with value: 0.20472501771481755.[0m
[FileBasedDataset] Initializing dataset...
	Examples: 8264
	Features: 231
	Max length: 315
Standard scalar turned ON, loading params from cache
[FileBasedDataset] Dataset initialization complete
  epoch    auprc    auroc    train_loss    valid_acc    valid_loss    cp      dur
-------  -------  -------  ------------  -----------  ------------  ----  -------
      1   [36m0.2308[0m   [32m0.6692[0m        [35m0.3147[0m       [31m0.8803[0m        [94m0.3760[0m     +  23.3104
      2   0.2076   [32m0.7149[0m        [35m0.2720[0m       0.1729        1.0061        22.9195
      3   0.1433   0.5870        0.2804       [31m0.9238[0m        [94m0.3056[0m     +  23.0540
      4   0.1057   0.5431        0.2933       0.6820        0.6498        22.0516
      5   0.0571   0.3242        0.3311       [31m0.9250[0m        0.3997        22.6793
      6   0.1498   0.6986        0.5447       0.9250        [94m0.2884[0m     +  22.7415
      7   0.1764   [32m0.7271[0m        0.5448       0.8452        0.6752        22.8243
      8   0.1685   0.7065        0.5414       0.8537        0.6212        23.1986
      9   0.0742   0.4262        0.4705       0.9105        0.5085        22.9604
     10   0.0730   0.3688        0.4244       0.5889        0.6796        22.9101
     11   0.2092   0.6772        0.4482       0.9238        0.3147        22.5732
     12   0.2029   0.6872        0.3887       0.9250        [94m0.2611[0m     +  23.0435
     13   0.2089   0.7174        0.3652       0.9250        [94m0.2522[0m     +  22.7135
     14   0.1834   0.7050        0.3485       0.9226        [94m0.2511[0m     +  22.6387
     15   0.1759   0.7076        0.3344       0.8476        0.4165        23.1185
     16   0.1593   0.6748        0.3058       0.1052        1.0596        22.9847
     17   0.1848   0.6615        0.3159       0.5103        0.7768        23.2370
     18   0.1970   0.7141        0.2969       0.7086        0.5776        22.8587
     19   0.1848   [32m0.7303[0m        0.2912       0.9238        0.2524        22.7020
     20   0.1714   0.7144        0.3032       0.9045        0.2587        22.9609
     21   0.1692   0.7206        0.2798       0.9250        [94m0.2453[0m     +  23.1719
     22   0.2067   0.7048        0.2794       0.9250        0.2472        23.1174
     23   0.1828   0.6970        [35m0.2690[0m       0.9250        0.2518        23.0544
     24   0.1717   0.7051        [35m0.2674[0m       0.9154        0.2555        22.9936
     25   0.1804   0.6961        0.2803       0.9250        0.2571        22.8480
     26   0.1756   0.7195        0.2787       0.9250        0.2466        23.1454
     27   0.1945   0.7162        0.2697       0.9250        [94m0.2429[0m     +  22.2329
     28   0.1947   0.6988        [35m0.2601[0m       0.9250        0.2454        23.1889
     29   0.1813   0.6904        0.2641       0.9250        0.2459        22.1866
     30   0.1745   0.7231        [35m0.2597[0m       0.9250        0.2486        23.1229
     31   0.1863   0.7019        [35m0.2590[0m       0.9250        0.2460        22.8854
     32   0.1694   0.6818        [35m0.2573[0m       0.9250        0.2550        22.7566
     33   0.1737   0.7156        0.2665       0.9226        0.2450        22.9010
     34   0.1774   0.7136        0.2606       0.9226        0.2478        22.5203
     35   0.1963   0.7070        0.2578       0.9250        0.2453        22.6590
     36   0.1776   0.7163        0.2620       0.9250        0.2437        23.1338
Stopping since valid_loss has not improved in the last 10 epochs.
[32m[I 2023-05-02 02:42:44,549][0m Trial 21 finished with value: 0.24287627120260172 and parameters: {'lr': 0.008452383531706811, 'dropout': 0.5141145997759081, 'd_model_multiplier': 32, 'num_layers': 3, 'n_heads': 16, 'dim_feedforward': 317, 'batch_size': 210, 'pos_encoding': 'fixed', 'activation': 'gelu', 'norm': 'BatchNorm', 'optimizer_name': 'PlainRAdam', 'weight_decay': 0.001, 'top_n_features': 231}. Best is trial 12 with value: 0.20472501771481755.[0m
[FileBasedDataset] Initializing dataset...
	Examples: 8264
	Features: 187
	Max length: 315
Standard scalar turned ON, loading params from cache
[FileBasedDataset] Dataset initialization complete
  epoch    auprc    auroc    train_loss    valid_acc    valid_loss    cp      dur
-------  -------  -------  ------------  -----------  ------------  ----  -------
      1   [36m0.0669[0m   [32m0.4096[0m        [35m0.6242[0m       [31m0.9299[0m        [94m0.6248[0m     +  14.4766
      2   [36m0.0811[0m   [32m0.4582[0m        [35m0.4182[0m       [31m0.9311[0m        [94m0.4849[0m     +  14.7018
      3   [36m0.1827[0m   [32m0.6488[0m        [35m0.3153[0m       [31m0.9323[0m        [94m0.4058[0m     +  14.8761
      4   0.1779   [32m0.6947[0m        [35m0.2814[0m       0.9311        [94m0.3660[0m     +  14.5776
      5   0.1806   [32m0.7166[0m        [35m0.2712[0m       0.9311        [94m0.3408[0m     +  14.3106
      6   [36m0.1877[0m   [32m0.7271[0m        [35m0.2709[0m       0.9311        [94m0.3239[0m     +  14.2165
      7   [36m0.1981[0m   [32m0.7404[0m        [35m0.2673[0m       0.9323        [94m0.3107[0m     +  14.1261
      8   [36m0.2063[0m   [32m0.7511[0m        [35m0.2646[0m       0.9323        [94m0.3037[0m     +  14.6406
      9   [36m0.2186[0m   [32m0.7575[0m        [35m0.2591[0m       0.9323        [94m0.2980[0m     +  14.7739
     10   0.2185   [32m0.7619[0m        [35m0.2575[0m       0.9323        [94m0.2939[0m     +  14.2311
     11   0.2104   [32m0.7648[0m        0.2604       0.9323        [94m0.2854[0m     +  14.4263
     12   [36m0.2191[0m   [32m0.7711[0m        [35m0.2549[0m       0.9323        [94m0.2724[0m     +  14.2684
     13   0.2037   0.7648        [35m0.2513[0m       0.9323        [94m0.2639[0m     +  15.0166
     14   0.2008   0.7681        0.2548       0.9323        [94m0.2596[0m     +  14.7278
     15   0.2149   0.7692        0.2520       0.9323        [94m0.2478[0m     +  14.2484
     16   0.2073   0.7691        [35m0.2505[0m       0.9323        [94m0.2393[0m     +  14.4087
     17   0.2132   [32m0.7754[0m        [35m0.2475[0m       0.9323        0.2448        14.4798
     18   0.2083   0.7736        0.2515       0.9311        0.2434        14.3853
     19   0.2089   0.7737        [35m0.2467[0m       0.9311        [94m0.2383[0m     +  14.6987
     20   0.2158   [32m0.7786[0m        0.2475       0.9311        [94m0.2383[0m     +  14.4027
     21   0.2059   0.7642        [35m0.2442[0m       0.9311        [94m0.2359[0m     +  14.2096
     22   0.1985   0.7550        0.2458       0.9311        [94m0.2324[0m     +  14.6326
     23   0.2045   0.7577        0.2451       0.9311        0.2338        14.4631
     24   0.1907   0.7541        [35m0.2429[0m       0.9311        [94m0.2294[0m     +  14.4623
     25   0.1837   0.7509        [35m0.2410[0m       0.9311        0.2324        14.3910
     26   0.1889   0.7581        0.2435       0.9299        0.2336        14.1128
     27   0.1986   0.7711        [35m0.2374[0m       0.9274        0.2300        14.4905
     28   0.1935   0.7669        0.2422       0.9311        [94m0.2256[0m     +  14.7285
     29   0.1975   0.7671        [35m0.2369[0m       0.9299        0.2260        14.9028
     30   0.1927   0.7634        0.2401       0.9274        0.2259        14.5273
     31   0.1874   0.7613        [35m0.2366[0m       0.9311        [94m0.2218[0m     +  14.3619
     32   0.1895   0.7574        0.2426       0.9323        0.2232        14.2319
     33   0.1843   0.7530        [35m0.2361[0m       0.9323        0.2230        14.5961
     34   0.1850   0.7577        0.2386       0.9323        0.2225        14.7090
     35   0.1912   0.7694        [35m0.2345[0m       0.9311        [94m0.2211[0m     +  14.6114
     36   0.1893   0.7641        0.2389       0.9311        0.2220        14.4888
     37   0.1952   0.7647        0.2356       0.9323        0.2219        14.2803
     38   0.2048   0.7736        [35m0.2340[0m       0.9311        [94m0.2196[0m     +  14.5948
     39   0.2067   0.7710        0.2375       0.9311        0.2207        14.4052
     40   0.2008   0.7649        0.2366       0.9311        0.2230        14.2238
     41   0.1980   0.7605        0.2341       0.9323        0.2256        14.6703
     42   0.2018   0.7664        [35m0.2313[0m       0.9299        0.2227        14.6004
     43   0.2171   [32m0.7805[0m        [35m0.2288[0m       0.9299        [94m0.2175[0m     +  14.0659
     44   0.2062   0.7713        0.2333       0.9299        0.2208        14.5977
     45   [36m0.2271[0m   0.7800        0.2330       0.9274        0.2177        14.7491
     46   [36m0.2278[0m   [32m0.7844[0m        0.2304       0.9287        [94m0.2173[0m     +  14.7525
     47   0.2211   0.7793        0.2305       0.9262        0.2191        14.3179
     48   0.2162   0.7794        0.2295       0.9274        0.2191        14.4805
     49   0.2206   0.7797        [35m0.2251[0m       0.9287        0.2194        14.7909
     50   0.2096   0.7816        0.2288       0.9311        0.2249        14.5950
[32m[I 2023-05-02 02:54:50,734][0m Trial 22 finished with value: 0.21725659121048638 and parameters: {'lr': 0.0007189055373413652, 'dropout': 0.5769599877296447, 'd_model_multiplier': 2, 'num_layers': 2, 'n_heads': 16, 'dim_feedforward': 456, 'batch_size': 255, 'pos_encoding': 'fixed', 'activation': 'gelu', 'norm': 'BatchNorm', 'optimizer_name': 'PlainRAdam', 'weight_decay': 0.01, 'top_n_features': 187}. Best is trial 12 with value: 0.20472501771481755.[0m
[FileBasedDataset] Initializing dataset...
	Examples: 8264
	Features: 179
	Max length: 315
Standard scalar turned ON, loading params from cache
[FileBasedDataset] Dataset initialization complete
  epoch    auprc    auroc    train_loss    valid_acc    valid_loss    cp      dur
-------  -------  -------  ------------  -----------  ------------  ----  -------
      1   [36m0.0914[0m   [32m0.3683[0m        [35m0.6334[0m       [31m0.9262[0m        [94m0.6220[0m     +  17.5988
      2   0.0788   [32m0.3885[0m        [35m0.4464[0m       0.9262        [94m0.5082[0m     +  19.1727
      3   [36m0.1161[0m   [32m0.5850[0m        [35m0.3299[0m       0.9262        [94m0.4246[0m     +  18.4476
      4   [36m0.1528[0m   [32m0.6647[0m        [35m0.2953[0m       0.9238        [94m0.3696[0m     +  17.7829
      5   [36m0.1648[0m   [32m0.6795[0m        [35m0.2759[0m       0.9250        [94m0.3331[0m     +  18.2941
      6   [36m0.1751[0m   [32m0.6931[0m        [35m0.2717[0m       0.9250        [94m0.3065[0m     +  18.2273
      7   [36m0.1877[0m   [32m0.6948[0m        [35m0.2683[0m       0.9250        [94m0.3022[0m     +  18.0449
      8   [36m0.1881[0m   0.6873        [35m0.2650[0m       0.9262        [94m0.2763[0m     +  18.7438
      9   [36m0.1974[0m   0.6947        [35m0.2618[0m       0.9250        [94m0.2648[0m     +  18.0172
     10   [36m0.2081[0m   [32m0.6994[0m        [35m0.2603[0m       0.9238        0.2661        17.7604
     11   [36m0.2113[0m   0.6986        0.2620       0.9238        0.2713        18.2052
     12   0.2045   0.6988        0.2638       0.9250        [94m0.2576[0m     +  17.7141
     13   [36m0.2135[0m   [32m0.7049[0m        [35m0.2539[0m       0.9238        [94m0.2533[0m     +  18.8469
     14   [36m0.2202[0m   0.7033        [35m0.2529[0m       0.9250        [94m0.2501[0m     +  18.2377
     15   [36m0.2246[0m   0.7047        0.2592       0.9250        0.2510        18.0763
     16   0.2193   0.6996        [35m0.2519[0m       0.9250        [94m0.2482[0m     +  18.4068
     17   0.2137   0.6988        0.2549       0.9238        [94m0.2472[0m     +  17.7750
     18   [36m0.2273[0m   0.7040        0.2530       0.9238        [94m0.2466[0m     +  18.2518
     19   [36m0.2370[0m   [32m0.7119[0m        [35m0.2500[0m       0.9226        0.2566        18.1969
     20   0.2271   0.7100        0.2527       0.9226        0.2553        18.2738
     21   0.2274   0.7095        0.2538       0.9250        0.2481        18.0391
     22   0.2318   0.7053        [35m0.2492[0m       0.9238        [94m0.2460[0m     +  17.6496
     23   0.2273   0.7056        [35m0.2460[0m       0.9226        0.2468        17.7642
     24   0.2235   0.7044        0.2522       0.9214        0.2503        18.1500
     25   0.2244   0.7026        0.2533       0.9250        0.2469        18.8492
     26   0.2232   0.7040        0.2481       0.9238        0.2463        18.2417
     27   0.2227   0.7074        0.2462       0.9250        0.2470        17.9308
     28   0.2165   0.7019        0.2493       0.9238        0.2464        17.7876
     29   0.2168   0.7006        [35m0.2441[0m       0.9250        0.2482        18.3072
     30   0.2217   0.7001        0.2485       0.9250        0.2465        18.5988
     31   0.2204   0.7000        0.2468       0.9238        [94m0.2437[0m     +  18.0836
     32   0.2328   0.7072        [35m0.2419[0m       0.9250        [94m0.2421[0m     +  18.1709
     33   0.2315   0.7112        0.2453       0.9238        [94m0.2416[0m     +  17.7600
     34   0.2345   [32m0.7131[0m        [35m0.2418[0m       0.9238        [94m0.2400[0m     +  18.2402
     35   0.2284   0.7125        [35m0.2408[0m       0.9262        0.2401        18.7612
     36   0.2236   0.7113        [35m0.2368[0m       0.9250        0.2421        18.0950
     37   0.2250   0.7126        0.2397       0.9250        0.2409        18.0551
     38   0.2302   [32m0.7135[0m        0.2391       [31m0.9274[0m        0.2408        18.9149
     39   0.2222   0.7104        0.2397       0.9262        0.2441        18.0167
     40   0.2328   [32m0.7156[0m        0.2369       [31m0.9287[0m        0.2411        18.3821
     41   0.2189   0.7121        [35m0.2359[0m       0.9287        0.2437        17.4912
     42   0.2313   [32m0.7161[0m        0.2362       0.9262        0.2487        18.4649
     43   0.2230   0.7132        0.2359       0.9262        0.2476        19.3069
Stopping since valid_loss has not improved in the last 10 epochs.
