[32m[I 2023-01-09 09:17:43,742][0m Trial 109 finished with value: 0.28175376014905135 and parameters: {'lr': 4.65451799793006e-09, 'dropout': 0.5985393390570258, 'd_model_multiplier': 8, 'num_layers': 9, 'n_heads': 8, 'dim_feedforward': 512, 'batch_size': 80, 'pos_encoding': 'fixed', 'activation': 'gelu', 'norm': 'LayerNorm', 'optimizer_name': 'RAdam', 'weight_decay': 0.1}. Best is trial 48 with value: 0.3954917461755389.[0m
[EnsembleDataset] Initializing dataset...
	Examples: 27964
	Features: 621
	Max length: 316
[EnsembleDataset] Dataset initialization complete
  epoch    auprc    auroc    train_loss    valid_loss    cp      dur
-------  -------  -------  ------------  ------------  ----  -------
      1   [36m0.3306[0m   [32m0.8500[0m        [35m0.1121[0m        [31m0.0522[0m     +  29.7923
      2   [36m0.3330[0m   [32m0.8510[0m        [35m0.1001[0m        0.0526        30.0590
      3   0.3305   0.8503        [35m0.0940[0m        0.0539        29.9004
      4   [36m0.3338[0m   0.8505        0.0999        [31m0.0519[0m     +  29.4136
      5   [36m0.3368[0m   0.8507        [35m0.0931[0m        [31m0.0509[0m     +  30.2128
      6   [36m0.3375[0m   [32m0.8517[0m        [35m0.0858[0m        [31m0.0503[0m     +  30.1360
      7   0.3293   0.8516        0.0928        0.0505        30.2806
      8   0.3359   [32m0.8528[0m        0.0882        0.0508        30.0031
Stopping since valid_loss has not improved in the last 3 epochs.
[32m[I 2023-01-09 09:33:41,467][0m Trial 110 finished with value: 0.33748799293799137 and parameters: {'lr': 1.6484672515800766e-05, 'dropout': 0.3772836477579, 'd_model_multiplier': 8, 'num_layers': 2, 'n_heads': 8, 'dim_feedforward': 471, 'batch_size': 116, 'pos_encoding': 'fixed', 'activation': 'relu', 'norm': 'BatchNorm', 'optimizer_name': 'RAdam', 'weight_decay': 0.1}. Best is trial 48 with value: 0.3954917461755389.[0m
[EnsembleDataset] Initializing dataset...
	Examples: 27964
	Features: 621
	Max length: 316
[EnsembleDataset] Dataset initialization complete
  epoch    auprc    auroc    train_loss    valid_loss    cp      dur
-------  -------  -------  ------------  ------------  ----  -------
      1   [36m0.2658[0m   [32m0.8041[0m        [35m0.1085[0m        [31m0.0589[0m     +  29.4285
      2   [36m0.2742[0m   [32m0.8043[0m        [35m0.0935[0m        [31m0.0571[0m     +  29.8623
      3   [36m0.2775[0m   [32m0.8053[0m        [35m0.0904[0m        0.0586        29.7317
      4   0.2654   0.8032        0.0965        0.0605        29.9206
Stopping since valid_loss has not improved in the last 3 epochs.
[32m[I 2023-01-09 09:41:42,637][0m Trial 111 finished with value: 0.2775137996841347 and parameters: {'lr': 2.367887996196979e-05, 'dropout': 0.41619337127867934, 'd_model_multiplier': 8, 'num_layers': 2, 'n_heads': 8, 'dim_feedforward': 471, 'batch_size': 88, 'pos_encoding': 'fixed', 'activation': 'relu', 'norm': 'BatchNorm', 'optimizer_name': 'RAdam', 'weight_decay': 0.1}. Best is trial 48 with value: 0.3954917461755389.[0m
[EnsembleDataset] Initializing dataset...
	Examples: 27964
	Features: 621
	Max length: 316
[EnsembleDataset] Dataset initialization complete
  epoch    auprc    auroc    train_loss    valid_loss    cp      dur
-------  -------  -------  ------------  ------------  ----  -------
      1   [36m0.3057[0m   [32m0.8227[0m        [35m0.1283[0m        [31m0.0545[0m     +  29.1369
      2   0.3031   0.8225        [35m0.1085[0m        [31m0.0530[0m     +  29.0318
      3   [36m0.3060[0m   0.8225        0.1206        0.0531        29.6259
      4   [36m0.3073[0m   [32m0.8230[0m        0.1179        [31m0.0526[0m     +  29.4589
      5   0.3046   0.8229        0.1182        0.0548        29.9944
      6   [36m0.3081[0m   0.8229        0.1119        0.0535        29.7648
      7   0.3080   [32m0.8237[0m        0.1136        [31m0.0525[0m     +  30.1789
      8   [36m0.3093[0m   [32m0.8247[0m        [35m0.1063[0m        0.0525        29.6613
      9   0.3093   0.8241        0.1123        [31m0.0518[0m     +  29.3424
     10   0.3077   0.8235        [35m0.0992[0m        [31m0.0514[0m     +  29.9257
     11   0.3077   [32m0.8253[0m        0.1042        [31m0.0511[0m     +  28.5230
     12   0.3053   0.8248        [35m0.0946[0m        [31m0.0505[0m     +  29.3166
     13   0.3069   0.8244        0.0998        [31m0.0501[0m     +  29.7667
     14   [36m0.3095[0m   0.8247        [35m0.0940[0m        0.0505        29.4662
     15   0.3085   0.8243        0.0984        [31m0.0499[0m     +  29.3269
     16   0.3086   [32m0.8258[0m        0.0949        [31m0.0499[0m     +  29.4553
     17   0.3091   0.8250        [35m0.0937[0m        [31m0.0498[0m     +  29.5215
     18   [36m0.3161[0m   [32m0.8273[0m        0.0955        0.0503        29.7856
     19   0.3154   [32m0.8286[0m        0.0954        0.0504        30.4622
Stopping since valid_loss has not improved in the last 3 epochs.
[32m[I 2023-01-09 10:19:00,903][0m Trial 112 finished with value: 0.316146669420097 and parameters: {'lr': 9.441997177063524e-06, 'dropout': 0.5003380321239879, 'd_model_multiplier': 8, 'num_layers': 1, 'n_heads': 8, 'dim_feedforward': 451, 'batch_size': 114, 'pos_encoding': 'fixed', 'activation': 'relu', 'norm': 'BatchNorm', 'optimizer_name': 'RAdam', 'weight_decay': 0.1}. Best is trial 48 with value: 0.3954917461755389.[0m
[EnsembleDataset] Initializing dataset...
	Examples: 27964
	Features: 621
	Max length: 316
[EnsembleDataset] Dataset initialization complete
  epoch    auprc    auroc    train_loss    valid_loss    cp      dur
-------  -------  -------  ------------  ------------  ----  -------
      1   [36m0.3340[0m   [32m0.8464[0m        [35m0.1399[0m        [31m0.0537[0m     +  30.2434
      2   [36m0.3358[0m   [32m0.8467[0m        0.1561        [31m0.0537[0m     +  30.8695
      3   0.3357   0.8463        0.1403        0.0537        30.1960
      4   0.3351   0.8460        [35m0.1392[0m        0.0537        30.8547
Stopping since valid_loss has not improved in the last 3 epochs.
[32m[I 2023-01-09 10:27:24,937][0m Trial 113 finished with value: 0.33578809355871186 and parameters: {'lr': 4.3449919470866926e-06, 'dropout': 0.6547598593288178, 'd_model_multiplier': 8, 'num_layers': 2, 'n_heads': 8, 'dim_feedforward': 491, 'batch_size': 129, 'pos_encoding': 'fixed', 'activation': 'relu', 'norm': 'BatchNorm', 'optimizer_name': 'RAdam', 'weight_decay': 0.1}. Best is trial 48 with value: 0.3954917461755389.[0m
[EnsembleDataset] Initializing dataset...
	Examples: 27964
	Features: 621
	Max length: 316
[EnsembleDataset] Dataset initialization complete
  epoch    auprc    auroc    train_loss    valid_loss    cp      dur
-------  -------  -------  ------------  ------------  ----  -------
      1   [36m0.3080[0m   [32m0.8283[0m        [35m0.1393[0m        [31m0.0483[0m     +  29.8764
      2   [36m0.3083[0m   [32m0.8291[0m        [35m0.1342[0m        [31m0.0482[0m     +  30.0140
      3   0.3080   0.8283        0.1368        0.0483        29.9804
      4   0.3080   0.8282        0.1392        0.0483        29.6294
Stopping since valid_loss has not improved in the last 3 epochs.
[32m[I 2023-01-09 10:35:43,121][0m Trial 114 finished with value: 0.3083104223272821 and parameters: {'lr': 2.974744316068382e-09, 'dropout': 0.68468705069652, 'd_model_multiplier': 8, 'num_layers': 3, 'n_heads': 8, 'dim_feedforward': 480, 'batch_size': 103, 'pos_encoding': 'fixed', 'activation': 'relu', 'norm': 'BatchNorm', 'optimizer_name': 'RAdam', 'weight_decay': 0.1}. Best is trial 48 with value: 0.3954917461755389.[0m
[EnsembleDataset] Initializing dataset...
	Examples: 27964
	Features: 621
	Max length: 316
[EnsembleDataset] Dataset initialization complete
  epoch    auprc    auroc    train_loss    valid_loss    cp      dur
-------  -------  -------  ------------  ------------  ----  -------
      1   [36m0.2858[0m   [32m0.8443[0m        [35m0.1074[0m        [31m0.0620[0m     +  33.2846
      2   0.2817   [32m0.8478[0m        [35m0.1051[0m        [31m0.0590[0m     +  33.2829
      3   [36m0.2887[0m   0.8458        [35m0.0968[0m        0.0607        33.4762
      4   [36m0.2950[0m   0.8331        [35m0.0908[0m        0.0608        33.3910
Stopping since valid_loss has not improved in the last 3 epochs.
[32m[I 2023-01-09 10:44:19,315][0m Trial 115 finished with value: 0.2950290012306789 and parameters: {'lr': 0.0001385285992348995, 'dropout': 0.4340770831636258, 'd_model_multiplier': 4, 'num_layers': 2, 'n_heads': 32, 'dim_feedforward': 468, 'batch_size': 71, 'pos_encoding': 'fixed', 'activation': 'relu', 'norm': 'BatchNorm', 'optimizer_name': 'RAdam', 'weight_decay': 0.1}. Best is trial 48 with value: 0.3954917461755389.[0m
[EnsembleDataset] Initializing dataset...
	Examples: 27964
	Features: 621
	Max length: 316
[EnsembleDataset] Dataset initialization complete
  epoch    auprc    auroc    train_loss    valid_loss    cp      dur
-------  -------  -------  ------------  ------------  ----  -------
      1   [36m0.3731[0m   [32m0.8439[0m        [35m0.1216[0m        [31m0.0529[0m     +  31.1168
      2   [36m0.3773[0m   [32m0.8466[0m        [35m0.1118[0m        [31m0.0524[0m     +  30.3320
      3   0.3683   0.8450        [35m0.1106[0m        0.0534        30.3625
      4   [36m0.3787[0m   0.8456        [35m0.1036[0m        [31m0.0522[0m     +  31.1340
      5   0.3615   0.8425        0.1059        0.0529        30.8044
      6   0.3710   0.8398        [35m0.0998[0m        0.0531        31.2317
Stopping since valid_loss has not improved in the last 3 epochs.
[32m[I 2023-01-09 10:56:46,391][0m Trial 116 finished with value: 0.3786644449948225 and parameters: {'lr': 3.076477811022887e-05, 'dropout': 0.6330435278399398, 'd_model_multiplier': 32, 'num_layers': 3, 'n_heads': 8, 'dim_feedforward': 439, 'batch_size': 59, 'pos_encoding': 'fixed', 'activation': 'gelu', 'norm': 'BatchNorm', 'optimizer_name': 'RAdam', 'weight_decay': 0.1}. Best is trial 48 with value: 0.3954917461755389.[0m
[EnsembleDataset] Initializing dataset...
	Examples: 27964
	Features: 621
	Max length: 316
[EnsembleDataset] Dataset initialization complete
  epoch    auprc    auroc    train_loss    valid_loss    cp      dur
-------  -------  -------  ------------  ------------  ----  -------
      1   [36m0.2985[0m   [32m0.8248[0m        [35m0.1330[0m        [31m0.0510[0m     +  45.2376
      2   0.2957   [32m0.8249[0m        [35m0.1247[0m        0.0511        45.0008
      3   0.2967   0.8247        0.1252        0.0513        44.9704
Stopping since valid_loss has not improved in the last 3 epochs.
[32m[I 2023-01-09 11:04:08,181][0m Trial 117 finished with value: 0.29850260625764924 and parameters: {'lr': 1.5642730380438954e-09, 'dropout': 0.6254831693760599, 'd_model_multiplier': 32, 'num_layers': 3, 'n_heads': 16, 'dim_feedforward': 448, 'batch_size': 58, 'pos_encoding': 'fixed', 'activation': 'gelu', 'norm': 'BatchNorm', 'optimizer_name': 'AdamW', 'weight_decay': 0.1}. Best is trial 48 with value: 0.3954917461755389.[0m
[EnsembleDataset] Initializing dataset...
	Examples: 27964
	Features: 621
	Max length: 316
[EnsembleDataset] Dataset initialization complete
  epoch    auprc    auroc    train_loss    valid_loss    cp      dur
-------  -------  -------  ------------  ------------  ----  -------
      1   [36m0.2783[0m   [32m0.8096[0m        [35m0.1277[0m        [31m0.0534[0m     +  31.6209
      2   0.2759   0.8089        [35m0.1253[0m        [31m0.0534[0m     +  31.2213
      3   [36m0.2784[0m   0.8094        0.1374        [31m0.0534[0m     +  31.2983
      4   [36m0.2794[0m   0.8094        [35m0.1189[0m        0.0536        31.7170
      5   0.2759   0.8085        0.1325        0.0534        31.4792
Stopping since valid_loss has not improved in the last 3 epochs.
[32m[I 2023-01-09 11:14:29,360][0m Trial 118 finished with value: 0.279359432937118 and parameters: {'lr': 6.073809588470713e-05, 'dropout': 0.644772204005069, 'd_model_multiplier': 32, 'num_layers': 3, 'n_heads': 8, 'dim_feedforward': 434, 'batch_size': 162, 'pos_encoding': 'fixed', 'activation': 'gelu', 'norm': 'BatchNorm', 'optimizer_name': 'RAdam', 'weight_decay': 0.1}. Best is trial 48 with value: 0.3954917461755389.[0m
[EnsembleDataset] Initializing dataset...
	Examples: 27964
	Features: 621
	Max length: 316
[EnsembleDataset] Dataset initialization complete
Warning, assumed runtime error: CUDA out of memory. Tried to allocate 1.83 GiB (GPU 0; 23.70 GiB total capacity; 18.36 GiB already allocated; 617.31 MiB free; 22.02 GiB reserved in total by PyTorch) If reserved memory is >> allocated memory try setting max_split_size_mb to avoid fragmentation.  See documentation for Memory Management and PYTORCH_CUDA_ALLOC_CONF
[32m[I 2023-01-09 11:14:32,814][0m Trial 119 finished with value: 0.0 and parameters: {'lr': 0.0008914896280329338, 'dropout': 0.6964127651371922, 'd_model_multiplier': 32, 'num_layers': 3, 'n_heads': 64, 'dim_feedforward': 441, 'batch_size': 77, 'pos_encoding': 'fixed', 'activation': 'gelu', 'norm': 'BatchNorm', 'optimizer_name': 'PlainRAdam', 'weight_decay': 0.1}. Best is trial 48 with value: 0.3954917461755389.[0m
[EnsembleDataset] Initializing dataset...
	Examples: 27964
	Features: 621
	Max length: 316
[EnsembleDataset] Dataset initialization complete
  epoch    auprc    auroc    train_loss    valid_loss    cp      dur
-------  -------  -------  ------------  ------------  ----  -------
      1   [36m0.3311[0m   [32m0.8345[0m        [35m0.1232[0m        [31m0.0522[0m     +  29.5120
      2   0.3305   0.8344        [35m0.1163[0m        0.0530        29.6254
      3   0.3290   0.8339        0.1194        0.0534        29.5583
Stopping since valid_loss has not improved in the last 3 epochs.
[32m[I 2023-01-09 11:20:41,905][0m Trial 120 finished with value: 0.33105252411398667 and parameters: {'lr': 5.707823937005169e-10, 'dropout': 0.5857145906229603, 'd_model_multiplier': 32, 'num_layers': 2, 'n_heads': 8, 'dim_feedforward': 460, 'batch_size': 53, 'pos_encoding': 'fixed', 'activation': 'gelu', 'norm': 'BatchNorm', 'optimizer_name': 'RAdam', 'weight_decay': 0.001}. Best is trial 48 with value: 0.3954917461755389.[0m
[EnsembleDataset] Initializing dataset...
	Examples: 27964
	Features: 621
	Max length: 316
[EnsembleDataset] Dataset initialization complete
  epoch    auprc    auroc    train_loss    valid_loss    cp      dur
-------  -------  -------  ------------  ------------  ----  -------
      1   [36m0.2994[0m   [32m0.8191[0m        [35m0.1475[0m        [31m0.0568[0m     +  30.1170
      2   [36m0.3024[0m   0.8091        0.1479        0.0596        30.0721
      3   [36m0.3045[0m   [32m0.8205[0m        [35m0.1325[0m        [31m0.0560[0m     +  29.3351
      4   [36m0.3091[0m   0.8158        0.1356        [31m0.0555[0m     +  29.0503
      5   0.3052   0.8161        [35m0.1248[0m        0.0563        29.7583
      6   0.3073   0.8166        [35m0.1223[0m        [31m0.0546[0m     +  30.0658
      7   [36m0.3117[0m   [32m0.8221[0m        [35m0.1139[0m        [31m0.0530[0m     +  29.9424
      8   [36m0.3166[0m   [32m0.8230[0m        0.1194        0.0531        30.3444
      9   0.3143   [32m0.8241[0m        0.1198        [31m0.0524[0m     +  30.6104
     10   0.3162   0.8241        [35m0.1103[0m        0.0524        29.9134
     11   [36m0.3257[0m   [32m0.8251[0m        [35m0.1002[0m        [31m0.0521[0m     +  30.1409
     12   0.3228   0.8236        [35m0.0961[0m        [31m0.0521[0m     +  30.1690
     13   0.3183   0.8238        0.0993        0.0534        29.9967
     14   0.3155   0.8238        [35m0.0915[0m        0.0531        30.1548
     15   [36m0.3258[0m   0.8244        0.0924        [31m0.0511[0m     +  29.8758
     16   0.3255   0.8242        [35m0.0906[0m        0.0526        28.9601
     17   0.3181   0.8244        0.0934        0.0520        30.1814
Stopping since valid_loss has not improved in the last 3 epochs.
[32m[I 2023-01-09 11:53:51,516][0m Trial 121 finished with value: 0.325822761843787 and parameters: {'lr': 1.966564459786103e-05, 'dropout': 0.6754329258981793, 'd_model_multiplier': 32, 'num_layers': 1, 'n_heads': 8, 'dim_feedforward': 497, 'batch_size': 84, 'pos_encoding': 'fixed', 'activation': 'gelu', 'norm': 'BatchNorm', 'optimizer_name': 'RAdam', 'weight_decay': 0.1}. Best is trial 48 with value: 0.3954917461755389.[0m
[EnsembleDataset] Initializing dataset...
	Examples: 27964
	Features: 621
	Max length: 316
[EnsembleDataset] Dataset initialization complete
  epoch    auprc    auroc    train_loss    valid_loss    cp      dur
-------  -------  -------  ------------  ------------  ----  -------
      1   [36m0.3945[0m   [32m0.8540[0m        [35m0.1448[0m        [31m0.0577[0m     +  29.4488
      2   [36m0.3981[0m   [32m0.8554[0m        [35m0.1271[0m        [31m0.0576[0m     +  29.8542
      3   [36m0.3983[0m   [32m0.8596[0m        [35m0.1186[0m        [31m0.0573[0m     +  29.6180
      4   [36m0.4016[0m   [32m0.8605[0m        [35m0.0969[0m        0.0574        29.6386
      5   0.4011   0.8604        [35m0.0887[0m        0.0573        28.9139
Stopping since valid_loss has not improved in the last 3 epochs.
[32m[I 2023-01-09 12:03:45,293][0m Trial 122 finished with value: 0.40157405369010674 and parameters: {'lr': 7.729784380014021e-05, 'dropout': 0.6594354080067655, 'd_model_multiplier': 4, 'num_layers': 2, 'n_heads': 8, 'dim_feedforward': 485, 'batch_size': 94, 'pos_encoding': 'fixed', 'activation': 'relu', 'norm': 'BatchNorm', 'optimizer_name': 'RAdam', 'weight_decay': 0.1}. Best is trial 122 with value: 0.40157405369010674.[0m
[EnsembleDataset] Initializing dataset...
	Examples: 27964
	Features: 621
	Max length: 316
[EnsembleDataset] Dataset initialization complete
  epoch    auprc    auroc    train_loss    valid_loss    cp      dur
-------  -------  -------  ------------  ------------  ----  -------
      1   [36m0.2582[0m   [32m0.8149[0m        [35m0.1508[0m        [31m0.0490[0m     +  29.6039
      2   [36m0.2590[0m   [32m0.8151[0m        [35m0.1499[0m        [31m0.0490[0m     +  30.2399
      3   0.2579   0.8141        [35m0.1322[0m        [31m0.0489[0m     +  30.1423
      4   0.2586   0.8147        [35m0.1278[0m        [31m0.0489[0m     +  29.4152
      5   0.2579   0.8150        0.1389        0.0489        29.8895
      6   0.2584   0.8150        [35m0.1114[0m        0.0489        29.8763
Stopping since valid_loss has not improved in the last 3 epochs.
[32m[I 2023-01-09 12:15:39,289][0m Trial 123 finished with value: 0.25900552255424236 and parameters: {'lr': 3.0922897495677894e-05, 'dropout': 0.6662933187181708, 'd_model_multiplier': 4, 'num_layers': 2, 'n_heads': 8, 'dim_feedforward': 485, 'batch_size': 97, 'pos_encoding': 'fixed', 'activation': 'gelu', 'norm': 'BatchNorm', 'optimizer_name': 'RAdam', 'weight_decay': 0.1}. Best is trial 122 with value: 0.40157405369010674.[0m
[EnsembleDataset] Initializing dataset...
	Examples: 27964
	Features: 621
	Max length: 316
[EnsembleDataset] Dataset initialization complete
  epoch    auprc    auroc    train_loss    valid_loss    cp      dur
-------  -------  -------  ------------  ------------  ----  -------
      1   [36m0.3094[0m   [32m0.8393[0m        [35m0.1218[0m        [31m0.0472[0m     +  30.1230
      2   [36m0.3105[0m   [32m0.8396[0m        [35m0.0873[0m        [31m0.0470[0m     +  30.6164
      3   [36m0.3134[0m   [32m0.8469[0m        [35m0.0715[0m        [31m0.0469[0m     +  30.7155
      4   [36m0.3145[0m   [32m0.8480[0m        [35m0.0604[0m        [31m0.0468[0m     +  29.4982
      5   [36m0.3171[0m   [32m0.8481[0m        [35m0.0550[0m        [31m0.0467[0m     +  29.8917
      6   [36m0.3181[0m   [32m0.8484[0m        [35m0.0538[0m        0.0470        30.2352
      7   0.3171   0.8479        [35m0.0533[0m        0.0469        29.8178
Stopping since valid_loss has not improved in the last 3 epochs.
[32m[I 2023-01-09 12:29:22,536][0m Trial 124 finished with value: 0.31811108521427744 and parameters: {'lr': 0.00043979486855865086, 'dropout': 0.6568572482822893, 'd_model_multiplier': 4, 'num_layers': 3, 'n_heads': 8, 'dim_feedforward': 455, 'batch_size': 92, 'pos_encoding': 'fixed', 'activation': 'gelu', 'norm': 'BatchNorm', 'optimizer_name': 'RAdam', 'weight_decay': 0.1}. Best is trial 122 with value: 0.40157405369010674.[0m
[EnsembleDataset] Initializing dataset...
	Examples: 27964
	Features: 621
	Max length: 316
[EnsembleDataset] Dataset initialization complete
  epoch    auprc    auroc    train_loss    valid_loss    cp      dur
-------  -------  -------  ------------  ------------  ----  -------
      1   [36m0.2531[0m   [32m0.8270[0m        [35m0.1547[0m        [31m0.0537[0m     +  30.3186
      2   0.2529   [32m0.8274[0m        [35m0.1486[0m        0.0541        29.5860
      3   0.2528   0.8270        [35m0.1335[0m        0.0539        30.3744
Stopping since valid_loss has not improved in the last 3 epochs.
