## SLURM PROLOG ###############################################################
##    Job ID : 7309637
##  Job Name : tuneSkorchTst.sh
##  Nodelist : gpu2264
##      CPUs : 1
##  Mem/Node : 65536 MB
## Directory : /gpfs/home/isears1/Repos/tabnet-sepsis
##   Job Started : Sun Jan  8 07:31:06 EST 2023
###############################################################################
module: loading 'cuda/11.3.1'
module: cuda: To use: module load gcc/10.2
module: loading 'cudnn/8.2.0'
module: cudnn: To use: module load cuda/11.1.1 gcc/10.2
Sun Jan  8 07:31:06 2023       
+-----------------------------------------------------------------------------+
| NVIDIA-SMI 515.65.01    Driver Version: 515.65.01    CUDA Version: 11.7     |
|-------------------------------+----------------------+----------------------+
| GPU  Name        Persistence-M| Bus-Id        Disp.A | Volatile Uncorr. ECC |
| Fan  Temp  Perf  Pwr:Usage/Cap|         Memory-Usage | GPU-Util  Compute M. |
|                               |                      |               MIG M. |
|===============================+======================+======================|
|   0  NVIDIA GeForce ...  On   | 00000000:A1:00.0 Off |                  N/A |
| 30%   30C    P8    18W / 350W |      7MiB / 24576MiB |      0%      Default |
|                               |                      |                  N/A |
+-------------------------------+----------------------+----------------------+
                                                                               
+-----------------------------------------------------------------------------+
| Processes:                                                                  |
|  GPU   GI   CI        PID   Type   Process name                  GPU Memory |
|        ID   ID                                                   Usage      |
|=============================================================================|
|    0   N/A  N/A     16267      G   X                                   5MiB |
+-----------------------------------------------------------------------------+
Python 3.10.4
[32m[I 2023-01-08 07:31:10,999][0m A new study created in memory with name: no-name-4036c3f3-a565-41fb-889a-010339022076[0m
[EnsembleDataset] Initializing dataset...
	Examples: 27964
	Features: 621
	Max length: 316
[EnsembleDataset] Dataset initialization complete
  epoch    auprc    auroc    train_loss    valid_loss    cp      dur
-------  -------  -------  ------------  ------------  ----  -------
      1   [36m0.2893[0m   [32m0.8325[0m        [35m0.1203[0m        [31m0.0526[0m     +  35.5204
      2   [36m0.2902[0m   [32m0.8325[0m        [35m0.1123[0m        [31m0.0526[0m     +  30.3272
      3   [36m0.2904[0m   [32m0.8328[0m        [35m0.1056[0m        [31m0.0525[0m     +  29.7210
      4   0.2894   0.8326        0.1154        0.0526        29.7270
      5   [36m0.2911[0m   0.8328        0.1154        [31m0.0525[0m     +  30.1157
      6   0.2908   [32m0.8329[0m        0.1129        0.0525        29.7053
      7   0.2869   0.8326        [35m0.0980[0m        0.0527        29.5469
Stopping since valid_loss has not improved in the last 3 epochs.
[32m[I 2023-01-08 07:46:28,975][0m Trial 0 finished with value: 0.29109745476075927 and parameters: {'lr': 7.650128386723807e-06, 'dropout': 0.6192016474646977, 'd_model_multiplier': 16, 'num_layers': 4, 'n_heads': 8, 'dim_feedforward': 341, 'batch_size': 132, 'pos_encoding': 'learnable', 'activation': 'gelu', 'norm': 'BatchNorm', 'optimizer_name': 'AdamW', 'weight_decay': 0.1}. Best is trial 0 with value: 0.29109745476075927.[0m
[EnsembleDataset] Initializing dataset...
	Examples: 27964
	Features: 621
	Max length: 316
[EnsembleDataset] Dataset initialization complete
Warning, assumed runtime error: CUDA out of memory. Tried to allocate 782.00 MiB (GPU 0; 23.70 GiB total capacity; 21.86 GiB already allocated; 325.31 MiB free; 22.32 GiB reserved in total by PyTorch) If reserved memory is >> allocated memory try setting max_split_size_mb to avoid fragmentation.  See documentation for Memory Management and PYTORCH_CUDA_ALLOC_CONF
[32m[I 2023-01-08 07:46:33,387][0m Trial 1 finished with value: 0.0 and parameters: {'lr': 1.7525900456703066e-05, 'dropout': 0.15247249223463458, 'd_model_multiplier': 8, 'num_layers': 15, 'n_heads': 16, 'dim_feedforward': 235, 'batch_size': 128, 'pos_encoding': 'fixed', 'activation': 'relu', 'norm': 'BatchNorm', 'optimizer_name': 'RAdam', 'weight_decay': 0}. Best is trial 0 with value: 0.29109745476075927.[0m
[EnsembleDataset] Initializing dataset...
	Examples: 27964
	Features: 621
	Max length: 316
[EnsembleDataset] Dataset initialization complete
  epoch    auprc    auroc    train_loss    valid_loss    cp      dur
-------  -------  -------  ------------  ------------  ----  -------
      1   [36m0.2184[0m   [32m0.6834[0m        [35m0.0614[0m        [31m0.0607[0m     +  29.0002
      2   0.2184   [32m0.6834[0m        0.0618        [31m0.0607[0m     +  29.7636
      3   0.2184   [32m0.6835[0m        0.0619        [31m0.0607[0m     +  29.5150
      4   [36m0.2184[0m   [32m0.6835[0m        0.0617        [31m0.0607[0m     +  29.4656
      5   [36m0.2184[0m   [32m0.6835[0m        0.0616        [31m0.0607[0m     +  29.5977
      6   [36m0.2185[0m   [32m0.6836[0m        [35m0.0614[0m        [31m0.0607[0m     +  29.8210
      7   [36m0.2185[0m   [32m0.6837[0m        0.0617        [31m0.0607[0m     +  29.4478
      8   [36m0.2186[0m   [32m0.6837[0m        0.0615        [31m0.0607[0m     +  30.0007
      9   [36m0.2186[0m   [32m0.6838[0m        0.0615        [31m0.0606[0m     +  29.7904
     10   [36m0.2186[0m   [32m0.6838[0m        0.0617        [31m0.0606[0m     +  29.6103
     11   [36m0.2186[0m   [32m0.6839[0m        0.0615        [31m0.0606[0m     +  29.2316
     12   [36m0.2186[0m   [32m0.6839[0m        0.0615        [31m0.0606[0m     +  29.6775
     13   [36m0.2187[0m   [32m0.6839[0m        0.0617        [31m0.0606[0m     +  29.1080
     14   0.2186   [32m0.6840[0m        0.0616        [31m0.0606[0m     +  30.0945
     15   0.2187   [32m0.6841[0m        0.0616        [31m0.0606[0m     +  29.6059
     16   [36m0.2187[0m   [32m0.6841[0m        0.0616        [31m0.0606[0m     +  29.4785
     17   [36m0.2188[0m   [32m0.6842[0m        0.0616        [31m0.0606[0m     +  29.4613
     18   [36m0.2188[0m   [32m0.6842[0m        0.0615        [31m0.0606[0m     +  30.0085
     19   [36m0.2188[0m   [32m0.6843[0m        0.0615        [31m0.0606[0m     +  29.8359
     20   [36m0.2188[0m   [32m0.6843[0m        [35m0.0613[0m        [31m0.0606[0m     +  29.8500
     21   [36m0.2188[0m   [32m0.6843[0m        0.0616        [31m0.0606[0m     +  29.5933
     22   [36m0.2189[0m   [32m0.6844[0m        0.0617        [31m0.0606[0m     +  30.0183
     23   [36m0.2190[0m   [32m0.6844[0m        0.0616        [31m0.0606[0m     +  29.7634
     24   [36m0.2191[0m   [32m0.6845[0m        0.0616        [31m0.0605[0m     +  29.2574
     25   [36m0.2193[0m   [32m0.6845[0m        0.0614        [31m0.0605[0m     +  29.7285
[32m[I 2023-01-08 08:38:10,070][0m Trial 2 finished with value: 0.21925782354995688 and parameters: {'lr': 6.535120841196469e-10, 'dropout': 0.017577048610281882, 'd_model_multiplier': 8, 'num_layers': 3, 'n_heads': 8, 'dim_feedforward': 310, 'batch_size': 211, 'pos_encoding': 'learnable', 'activation': 'relu', 'norm': 'LayerNorm', 'optimizer_name': 'AdamW', 'weight_decay': 0.1}. Best is trial 0 with value: 0.29109745476075927.[0m
[EnsembleDataset] Initializing dataset...
	Examples: 27964
	Features: 621
	Max length: 316
[EnsembleDataset] Dataset initialization complete
Warning, assumed runtime error: CUDA out of memory. Tried to allocate 4.81 GiB (GPU 0; 23.70 GiB total capacity; 17.10 GiB already allocated; 2.35 GiB free; 20.28 GiB reserved in total by PyTorch) If reserved memory is >> allocated memory try setting max_split_size_mb to avoid fragmentation.  See documentation for Memory Management and PYTORCH_CUDA_ALLOC_CONF
[32m[I 2023-01-08 08:38:16,662][0m Trial 3 finished with value: 0.0 and parameters: {'lr': 2.5899615315617058e-06, 'dropout': 0.3585191159330917, 'd_model_multiplier': 4, 'num_layers': 4, 'n_heads': 64, 'dim_feedforward': 456, 'batch_size': 202, 'pos_encoding': 'fixed', 'activation': 'gelu', 'norm': 'BatchNorm', 'optimizer_name': 'AdamW', 'weight_decay': 0}. Best is trial 0 with value: 0.29109745476075927.[0m
[EnsembleDataset] Initializing dataset...
	Examples: 27964
	Features: 621
	Max length: 316
[EnsembleDataset] Dataset initialization complete
Warning, assumed runtime error: CUDA out of memory. Tried to allocate 1.38 GiB (GPU 0; 23.70 GiB total capacity; 20.78 GiB already allocated; 1001.31 MiB free; 21.65 GiB reserved in total by PyTorch) If reserved memory is >> allocated memory try setting max_split_size_mb to avoid fragmentation.  See documentation for Memory Management and PYTORCH_CUDA_ALLOC_CONF
[32m[I 2023-01-08 08:38:21,169][0m Trial 4 finished with value: 0.0 and parameters: {'lr': 1.3329912546238771e-05, 'dropout': 0.30617032406644484, 'd_model_multiplier': 64, 'num_layers': 15, 'n_heads': 32, 'dim_feedforward': 311, 'batch_size': 116, 'pos_encoding': 'fixed', 'activation': 'relu', 'norm': 'LayerNorm', 'optimizer_name': 'AdamW', 'weight_decay': 0.1}. Best is trial 0 with value: 0.29109745476075927.[0m
[EnsembleDataset] Initializing dataset...
	Examples: 27964
	Features: 621
	Max length: 316
[EnsembleDataset] Dataset initialization complete
Warning, assumed runtime error: CUDA out of memory. Tried to allocate 528.00 MiB (GPU 0; 23.70 GiB total capacity; 22.25 GiB already allocated; 45.31 MiB free; 22.59 GiB reserved in total by PyTorch) If reserved memory is >> allocated memory try setting max_split_size_mb to avoid fragmentation.  See documentation for Memory Management and PYTORCH_CUDA_ALLOC_CONF
[32m[I 2023-01-08 08:38:27,107][0m Trial 5 finished with value: 0.0 and parameters: {'lr': 0.022943455140601993, 'dropout': 0.40890964208795966, 'd_model_multiplier': 32, 'num_layers': 15, 'n_heads': 8, 'dim_feedforward': 441, 'batch_size': 173, 'pos_encoding': 'fixed', 'activation': 'gelu', 'norm': 'BatchNorm', 'optimizer_name': 'AdamW', 'weight_decay': 0}. Best is trial 0 with value: 0.29109745476075927.[0m
[EnsembleDataset] Initializing dataset...
	Examples: 27964
	Features: 621
	Max length: 316
[EnsembleDataset] Dataset initialization complete
Warning, assumed runtime error: CUDA out of memory. Tried to allocate 1.76 GiB (GPU 0; 23.70 GiB total capacity; 19.39 GiB already allocated; 1.44 GiB free; 21.19 GiB reserved in total by PyTorch) If reserved memory is >> allocated memory try setting max_split_size_mb to avoid fragmentation.  See documentation for Memory Management and PYTORCH_CUDA_ALLOC_CONF
[32m[I 2023-01-08 08:38:32,037][0m Trial 6 finished with value: 0.0 and parameters: {'lr': 9.474517722589443e-07, 'dropout': 0.5824835136531568, 'd_model_multiplier': 16, 'num_layers': 4, 'n_heads': 32, 'dim_feedforward': 403, 'batch_size': 148, 'pos_encoding': 'learnable', 'activation': 'gelu', 'norm': 'BatchNorm', 'optimizer_name': 'RAdam', 'weight_decay': 0.01}. Best is trial 0 with value: 0.29109745476075927.[0m
[EnsembleDataset] Initializing dataset...
	Examples: 27964
	Features: 621
	Max length: 316
[EnsembleDataset] Dataset initialization complete
  epoch    auprc    auroc    train_loss    valid_loss    cp      dur
-------  -------  -------  ------------  ------------  ----  -------
      1   [36m0.2456[0m   [32m0.8120[0m        [35m0.1014[0m        [31m0.0678[0m     +  29.2504
      2   0.2441   [32m0.8127[0m        0.1075        [31m0.0676[0m     +  29.6589
      3   [36m0.2508[0m   [32m0.8133[0m        0.1103        [31m0.0673[0m     +  29.4428
      4   0.2482   0.8124        [35m0.0993[0m        [31m0.0664[0m     +  29.6954
      5   0.2470   0.8122        0.1062        [31m0.0627[0m     +  29.3776
      6   0.2438   0.8123        0.1018        0.0645        29.6644
      7   0.2434   0.8121        0.1017        0.0657        29.4823
      8   0.2487   0.8124        [35m0.0963[0m        [31m0.0618[0m     +  29.3650
      9   0.2480   0.8120        0.1053        0.0633        29.0988
     10   0.2378   0.8115        0.1004        0.0623        30.4336
Stopping since valid_loss has not improved in the last 3 epochs.
[32m[I 2023-01-08 08:59:24,716][0m Trial 7 finished with value: 0.2507972541156919 and parameters: {'lr': 2.388916406147595e-07, 'dropout': 0.4808303976346305, 'd_model_multiplier': 2, 'num_layers': 3, 'n_heads': 16, 'dim_feedforward': 326, 'batch_size': 75, 'pos_encoding': 'learnable', 'activation': 'gelu', 'norm': 'BatchNorm', 'optimizer_name': 'RAdam', 'weight_decay': 0.001}. Best is trial 0 with value: 0.29109745476075927.[0m
[EnsembleDataset] Initializing dataset...
	Examples: 27964
	Features: 621
	Max length: 316
[EnsembleDataset] Dataset initialization complete
Warning, assumed runtime error: CUDA out of memory. Tried to allocate 4.17 GiB (GPU 0; 23.70 GiB total capacity; 14.74 GiB already allocated; 1.49 GiB free; 21.14 GiB reserved in total by PyTorch) If reserved memory is >> allocated memory try setting max_split_size_mb to avoid fragmentation.  See documentation for Memory Management and PYTORCH_CUDA_ALLOC_CONF
[32m[I 2023-01-08 08:59:30,689][0m Trial 8 finished with value: 0.0 and parameters: {'lr': 0.00023698626500654593, 'dropout': 0.05518761996385274, 'd_model_multiplier': 4, 'num_layers': 11, 'n_heads': 64, 'dim_feedforward': 288, 'batch_size': 175, 'pos_encoding': 'learnable', 'activation': 'relu', 'norm': 'BatchNorm', 'optimizer_name': 'RAdam', 'weight_decay': 0}. Best is trial 0 with value: 0.29109745476075927.[0m
[EnsembleDataset] Initializing dataset...
	Examples: 27964
	Features: 621
	Max length: 316
[EnsembleDataset] Dataset initialization complete
  epoch    auprc    auroc    train_loss    valid_loss    cp      dur
-------  -------  -------  ------------  ------------  ----  -------
      1   [36m0.0887[0m   [32m0.5118[0m      [35m120.8443[0m        [31m1.0320[0m     +  29.2376
      2   [36m0.1211[0m   [32m0.6154[0m       [35m10.4975[0m        1.1600        29.4666
      3   [36m0.1525[0m   [32m0.7111[0m        [35m3.3943[0m        1.5004        29.8796
      4   0.1076   0.5602        4.0343        [31m0.4240[0m     +  29.1405
      5   0.1155   0.5437        [35m2.6218[0m        0.4803        29.1927
      6   [36m0.1550[0m   0.7105        3.2357        0.7709        29.4428
Stopping since valid_loss has not improved in the last 3 epochs.
[32m[I 2023-01-08 09:12:15,472][0m Trial 9 finished with value: 0.15499412420235442 and parameters: {'lr': 0.03596389068169565, 'dropout': 0.5991583096962761, 'd_model_multiplier': 32, 'num_layers': 5, 'n_heads': 4, 'dim_feedforward': 505, 'batch_size': 52, 'pos_encoding': 'fixed', 'activation': 'gelu', 'norm': 'BatchNorm', 'optimizer_name': 'PlainRAdam', 'weight_decay': 0.001}. Best is trial 0 with value: 0.29109745476075927.[0m
[EnsembleDataset] Initializing dataset...
	Examples: 27964
	Features: 621
	Max length: 316
[EnsembleDataset] Dataset initialization complete
  epoch    auprc    auroc    train_loss    valid_loss    cp      dur
-------  -------  -------  ------------  ------------  ----  -------
      1   [36m0.2477[0m   [32m0.7557[0m        [35m0.1060[0m        [31m0.0662[0m     +  42.1793
      2   [36m0.2478[0m   0.7557        [35m0.1048[0m        [31m0.0662[0m     +  42.2553
      3   [36m0.2479[0m   0.7556        0.1085        [31m0.0662[0m     +  41.7106
Stopping since valid_loss has not improved in the last 3 epochs.
[32m[I 2023-01-08 09:19:44,869][0m Trial 10 finished with value: 0.24791797074032426 and parameters: {'lr': 1.2171913482755252e-08, 'dropout': 0.6964666946068467, 'd_model_multiplier': 16, 'num_layers': 9, 'n_heads': 8, 'dim_feedforward': 165, 'batch_size': 86, 'pos_encoding': 'learnable', 'activation': 'gelu', 'norm': 'LayerNorm', 'optimizer_name': 'PlainRAdam', 'weight_decay': 0.1}. Best is trial 0 with value: 0.29109745476075927.[0m
[EnsembleDataset] Initializing dataset...
	Examples: 27964
	Features: 621
	Max length: 316
[EnsembleDataset] Dataset initialization complete
  epoch    auprc    auroc    train_loss    valid_loss    cp      dur
-------  -------  -------  ------------  ------------  ----  -------
      1   [36m0.2786[0m   [32m0.8252[0m        [35m0.1228[0m        [31m0.0734[0m     +  28.5282
      2   0.2744   0.8247        [35m0.1200[0m        0.0748        28.6370
      3   [36m0.2789[0m   [32m0.8259[0m        [35m0.1195[0m        [31m0.0665[0m     +  28.5905
      4   [36m0.2801[0m   0.8251        0.1209        0.0699        28.9745
      5   0.2773   0.8255        [35m0.1185[0m        [31m0.0646[0m     +  28.5551
      6   0.2767   0.8249        [35m0.1151[0m        0.0747        28.0754
      7   0.2737   0.8250        0.1183        0.0713        29.2306
Stopping since valid_loss has not improved in the last 3 epochs.
[32m[I 2023-01-08 09:34:25,220][0m Trial 11 finished with value: 0.280146636417364 and parameters: {'lr': 5.8219689755530795e-08, 'dropout': 0.4960713319029342, 'd_model_multiplier': 2, 'num_layers': 1, 'n_heads': 16, 'dim_feedforward': 370, 'batch_size': 15, 'pos_encoding': 'learnable', 'activation': 'gelu', 'norm': 'BatchNorm', 'optimizer_name': 'RAdam', 'weight_decay': 0.001}. Best is trial 0 with value: 0.29109745476075927.[0m
[EnsembleDataset] Initializing dataset...
	Examples: 27964
	Features: 621
	Max length: 316
[EnsembleDataset] Dataset initialization complete
  epoch    auprc    auroc    train_loss    valid_loss    cp      dur
-------  -------  -------  ------------  ------------  ----  -------
      1   [36m0.3213[0m   [32m0.8386[0m        [35m0.1500[0m        [31m0.0493[0m     +  28.1997
      2   [36m0.3219[0m   [32m0.8395[0m        0.1547        [31m0.0490[0m     +  28.3856
      3   0.3214   0.8384        [35m0.1494[0m        0.0491        28.9111
      4   0.3211   0.8392        0.1501        0.0491        28.3249
Stopping since valid_loss has not improved in the last 3 epochs.
[32m[I 2023-01-08 09:43:01,923][0m Trial 12 finished with value: 0.3218802073112433 and parameters: {'lr': 4.235143569079466e-08, 'dropout': 0.5130093552684967, 'd_model_multiplier': 1, 'num_layers': 1, 'n_heads': 16, 'dim_feedforward': 372, 'batch_size': 24, 'pos_encoding': 'learnable', 'activation': 'gelu', 'norm': 'BatchNorm', 'optimizer_name': 'RAdam', 'weight_decay': 0.001}. Best is trial 12 with value: 0.3218802073112433.[0m
[EnsembleDataset] Initializing dataset...
	Examples: 27964
	Features: 621
	Max length: 316
[EnsembleDataset] Dataset initialization complete
  epoch    auprc    auroc    train_loss    valid_loss    cp      dur
-------  -------  -------  ------------  ------------  ----  -------
      1   [36m0.3145[0m   [32m0.8212[0m        [35m0.1130[0m        [31m0.0566[0m     +  29.5461
      2   0.3144   0.8211        0.1438        0.0566        29.9990
      3   0.3144   0.8211        0.1665        0.0566        29.9694
Stopping since valid_loss has not improved in the last 3 epochs.
[32m[I 2023-01-08 09:49:45,680][0m Trial 13 finished with value: 0.31446282875205844 and parameters: {'lr': 1.709649537701086e-09, 'dropout': 0.658139567530594, 'd_model_multiplier': 1, 'num_layers': 7, 'n_heads': 4, 'dim_feedforward': 242, 'batch_size': 242, 'pos_encoding': 'learnable', 'activation': 'gelu', 'norm': 'BatchNorm', 'optimizer_name': 'AdamW', 'weight_decay': 0.01}. Best is trial 12 with value: 0.3218802073112433.[0m
[EnsembleDataset] Initializing dataset...
	Examples: 27964
	Features: 621
	Max length: 316
[EnsembleDataset] Dataset initialization complete
  epoch    auprc    auroc    train_loss    valid_loss    cp      dur
-------  -------  -------  ------------  ------------  ----  -------
      1   [36m0.3142[0m   [32m0.8484[0m        [35m0.1664[0m        [31m0.0479[0m     +  30.2367
      2   0.3142   0.8482        [35m0.1464[0m        0.0479        29.7376
      3   [36m0.3143[0m   [32m0.8486[0m        [35m0.1459[0m        0.0479        30.8640
Stopping since valid_loss has not improved in the last 3 epochs.
[32m[I 2023-01-08 09:56:31,811][0m Trial 14 finished with value: 0.31427997591932033 and parameters: {'lr': 3.186172151601964e-10, 'dropout': 0.6840400714857062, 'd_model_multiplier': 1, 'num_layers': 8, 'n_heads': 4, 'dim_feedforward': 229, 'batch_size': 249, 'pos_encoding': 'learnable', 'activation': 'gelu', 'norm': 'BatchNorm', 'optimizer_name': 'PlainRAdam', 'weight_decay': 0.01}. Best is trial 12 with value: 0.3218802073112433.[0m
[EnsembleDataset] Initializing dataset...
	Examples: 27964
	Features: 621
	Max length: 316
[EnsembleDataset] Dataset initialization complete
  epoch    auprc    auroc    train_loss    valid_loss    cp      dur
-------  -------  -------  ------------  ------------  ----  -------
      1   [36m0.3208[0m   [32m0.7590[0m        [35m0.0867[0m        [31m0.0659[0m     +  31.1194
      2   0.3208   [32m0.7590[0m        [35m0.0866[0m        [31m0.0659[0m     +  31.1018
      3   0.3208   [32m0.7590[0m        0.0868        [31m0.0659[0m     +  30.1960
Stopping since valid_loss has not improved in the last 3 epochs.
