[32m[I 2023-05-03 12:22:57,886][0m Trial 344 finished with value: 0.28205069910370023 and parameters: {'lr': 3.362448107653732e-05, 'dropout': 0.30275957597189507, 'd_model_multiplier': 4, 'num_layers': 6, 'n_heads': 32, 'dim_feedforward': 306, 'batch_size': 74, 'pos_encoding': 'fixed', 'activation': 'relu', 'norm': 'LayerNorm', 'optimizer_name': 'RAdam', 'weight_decay': 0.001, 'top_n_features': 96}. Best is trial 246 with value: 0.16447311791139763.[0m
[FileBasedDataset] Initializing dataset...
	Examples: 8264
	Features: 89
	Max length: 315
Standard scalar turned ON, loading params from cache
[FileBasedDataset] Dataset initialization complete
  epoch    auprc    auroc    train_loss    valid_acc    valid_loss    cp      dur
-------  -------  -------  ------------  -----------  ------------  ----  -------
      1   [36m0.0492[0m   [32m0.3298[0m        [35m0.6247[0m       [31m0.9347[0m        [94m0.4254[0m     +  30.7416
      2   [36m0.1601[0m   [32m0.6449[0m        [35m0.3533[0m       0.9347        [94m0.2527[0m     +  30.7618
      3   [36m0.2582[0m   [32m0.7594[0m        [35m0.2719[0m       0.9335        [94m0.2194[0m     +  31.3138
      4   [36m0.2797[0m   [32m0.7904[0m        [35m0.2513[0m       0.9323        [94m0.2105[0m     +  31.5019
      5   [36m0.2907[0m   [32m0.7986[0m        [35m0.2435[0m       0.9335        [94m0.2076[0m     +  30.9438
      6   [36m0.2957[0m   [32m0.8026[0m        [35m0.2395[0m       0.9299        [94m0.2063[0m     +  31.4932
      7   [36m0.2997[0m   [32m0.8035[0m        [35m0.2377[0m       0.9311        [94m0.2050[0m     +  31.4326
      8   [36m0.3095[0m   [32m0.8052[0m        [35m0.2351[0m       0.9311        0.2060        31.1108
      9   [36m0.3114[0m   [32m0.8076[0m        [35m0.2336[0m       0.9311        0.2069        31.3562
     10   [36m0.3219[0m   [32m0.8083[0m        [35m0.2329[0m       0.9335        [94m0.2042[0m     +  31.7288
     11   [36m0.3247[0m   0.8077        [35m0.2327[0m       0.9311        0.2059        31.2868
     12   0.3189   0.8067        [35m0.2300[0m       0.9311        0.2066        31.2603
     13   0.3145   0.8058        [35m0.2296[0m       0.9299        [94m0.2041[0m     +  31.4792
     14   0.3111   0.8041        [35m0.2280[0m       0.9299        0.2041        31.4030
     15   0.3093   0.8034        [35m0.2275[0m       0.9323        [94m0.2030[0m     +  31.3437
     16   0.3118   0.8038        [35m0.2265[0m       0.9311        0.2040        31.1296
     17   0.3109   0.8024        [35m0.2250[0m       0.9323        0.2032        31.4654
     18   0.3099   0.8020        0.2255       0.9347        [94m0.2029[0m     +  31.4306
     19   0.3139   0.8006        [35m0.2243[0m       0.9347        [94m0.2008[0m     +  31.3369
     20   0.3085   0.7978        [35m0.2220[0m       0.9323        0.2027        31.5181
     21   0.3052   0.7959        0.2226       0.9311        0.2043        31.3883
     22   0.3086   0.7954        0.2236       0.9323        0.2047        31.3025
     23   0.3060   0.7923        [35m0.2206[0m       0.9335        0.2041        31.4073
     24   0.3080   0.7930        [35m0.2194[0m       0.9311        0.2041        31.3503
     25   0.2956   0.7917        0.2207       0.9323        0.2055        31.2853
     26   0.3003   0.7899        [35m0.2171[0m       0.9299        0.2057        31.1274
     27   0.3066   0.7891        [35m0.2161[0m       0.9323        0.2046        31.3822
     28   0.2961   0.7878        [35m0.2157[0m       [31m0.9359[0m        0.2055        31.4086
Stopping since valid_loss has not improved in the last 10 epochs.
[32m[I 2023-05-03 12:38:07,779][0m Trial 345 finished with value: 0.2008238984080439 and parameters: {'lr': 2.51870353448516e-05, 'dropout': 0.26281034229496003, 'd_model_multiplier': 4, 'num_layers': 7, 'n_heads': 32, 'dim_feedforward': 332, 'batch_size': 71, 'pos_encoding': 'fixed', 'activation': 'relu', 'norm': 'LayerNorm', 'optimizer_name': 'RAdam', 'weight_decay': 0.001, 'top_n_features': 89}. Best is trial 246 with value: 0.16447311791139763.[0m
[FileBasedDataset] Initializing dataset...
	Examples: 8264
	Features: 78
	Max length: 315
Standard scalar turned ON, loading params from cache
[FileBasedDataset] Dataset initialization complete
  epoch    auprc    auroc    train_loss    valid_acc    valid_loss    cp      dur
-------  -------  -------  ------------  -----------  ------------  ----  -------
      1   [36m0.0717[0m   [32m0.3315[0m        [35m0.5977[0m       [31m0.9093[0m        [94m0.4600[0m     +  27.2207
      2   [36m0.1236[0m   [32m0.5411[0m        [35m0.3691[0m       0.9093        [94m0.3174[0m     +  27.6790
      3   [36m0.2619[0m   [32m0.7082[0m        [35m0.2785[0m       0.9093        [94m0.2794[0m     +  27.7663
      4   [36m0.3434[0m   [32m0.7505[0m        [35m0.2512[0m       [31m0.9129[0m        [94m0.2637[0m     +  27.3746
      5   [36m0.3750[0m   [32m0.7655[0m        [35m0.2387[0m       [31m0.9166[0m        [94m0.2567[0m     +  27.8795
      6   [36m0.3872[0m   [32m0.7667[0m        [35m0.2334[0m       [31m0.9178[0m        [94m0.2548[0m     +  27.6761
      7   [36m0.3872[0m   0.7633        [35m0.2298[0m       0.9154        0.2556        27.4823
      8   0.3853   0.7622        [35m0.2287[0m       0.9154        0.2557        27.6217
      9   [36m0.3886[0m   0.7606        [35m0.2263[0m       0.9141        0.2556        27.4744
     10   0.3829   0.7590        [35m0.2240[0m       0.9154        0.2577        27.8712
     11   0.3783   0.7611        [35m0.2227[0m       0.9141        0.2575        27.8965
     12   0.3797   0.7615        0.2227       0.9141        0.2590        27.7142
     13   0.3759   0.7620        [35m0.2197[0m       0.9154        0.2606        27.4839
     14   0.3774   0.7632        0.2202       0.9141        0.2594        27.6113
     15   0.3729   0.7633        0.2199       0.9154        0.2616        27.8760
Stopping since valid_loss has not improved in the last 10 epochs.
[32m[I 2023-05-03 12:45:31,026][0m Trial 346 finished with value: 0.25481315198587534 and parameters: {'lr': 2.367329125221069e-05, 'dropout': 0.2965158776801595, 'd_model_multiplier': 4, 'num_layers': 6, 'n_heads': 32, 'dim_feedforward': 327, 'batch_size': 73, 'pos_encoding': 'fixed', 'activation': 'relu', 'norm': 'LayerNorm', 'optimizer_name': 'RAdam', 'weight_decay': 0.001, 'top_n_features': 78}. Best is trial 246 with value: 0.16447311791139763.[0m
[FileBasedDataset] Initializing dataset...
	Examples: 8264
	Features: 86
	Max length: 315
Standard scalar turned ON, loading params from cache
[FileBasedDataset] Dataset initialization complete
  epoch    auprc    auroc    train_loss    valid_acc    valid_loss    cp      dur
-------  -------  -------  ------------  -----------  ------------  ----  -------
      1   [36m0.0449[0m   [32m0.2954[0m        [35m0.6041[0m       [31m0.9335[0m        [94m0.4084[0m     +  31.5006
      2   [36m0.0910[0m   [32m0.5033[0m        [35m0.3459[0m       0.9335        [94m0.2695[0m     +  31.3972
      3   [36m0.1208[0m   [32m0.6135[0m        [35m0.2696[0m       0.9335        [94m0.2438[0m     +  31.5656
      4   [36m0.1668[0m   [32m0.6849[0m        [35m0.2510[0m       0.9323        [94m0.2285[0m     +  31.4701
      5   [36m0.2151[0m   [32m0.7100[0m        [35m0.2411[0m       0.9323        [94m0.2213[0m     +  31.6885
      6   [36m0.2464[0m   [32m0.7255[0m        [35m0.2351[0m       0.9335        [94m0.2181[0m     +  31.5726
      7   [36m0.2614[0m   [32m0.7401[0m        [35m0.2325[0m       0.9335        [94m0.2157[0m     +  31.5595
      8   [36m0.2672[0m   [32m0.7461[0m        [35m0.2309[0m       [31m0.9347[0m        [94m0.2146[0m     +  31.4944
      9   0.2663   [32m0.7535[0m        [35m0.2291[0m       0.9347        [94m0.2139[0m     +  31.8782
     10   0.2670   [32m0.7606[0m        [35m0.2276[0m       0.9323        [94m0.2135[0m     +  31.6328
     11   0.2664   [32m0.7651[0m        [35m0.2262[0m       0.9323        0.2137        31.4384
     12   0.2640   [32m0.7669[0m        [35m0.2253[0m       0.9335        0.2142        31.5370
     13   [36m0.2675[0m   [32m0.7726[0m        [35m0.2237[0m       0.9323        0.2141        31.4721
     14   0.2608   [32m0.7774[0m        [35m0.2222[0m       0.9323        0.2142        32.2718
     15   0.2672   0.7761        [35m0.2205[0m       [31m0.9359[0m        0.2149        31.6820
     16   0.2645   [32m0.7813[0m        [35m0.2197[0m       0.9335        0.2155        31.3848
     17   0.2556   [32m0.7821[0m        [35m0.2185[0m       0.9359        0.2154        31.2629
     18   0.2566   [32m0.7870[0m        [35m0.2174[0m       0.9335        0.2144        31.7257
     19   0.2571   [32m0.7911[0m        0.2182       0.9311        0.2145        31.9458
Stopping since valid_loss has not improved in the last 10 epochs.
[32m[I 2023-05-03 12:56:04,754][0m Trial 347 finished with value: 0.21352458349738762 and parameters: {'lr': 3.821042736918238e-05, 'dropout': 0.2701552552434475, 'd_model_multiplier': 4, 'num_layers': 7, 'n_heads': 32, 'dim_feedforward': 334, 'batch_size': 91, 'pos_encoding': 'fixed', 'activation': 'relu', 'norm': 'LayerNorm', 'optimizer_name': 'RAdam', 'weight_decay': 0.001, 'top_n_features': 86}. Best is trial 246 with value: 0.16447311791139763.[0m
[FileBasedDataset] Initializing dataset...
	Examples: 8264
	Features: 91
	Max length: 315
Standard scalar turned ON, loading params from cache
[FileBasedDataset] Dataset initialization complete
  epoch    auprc    auroc    train_loss    valid_acc    valid_loss    cp      dur
-------  -------  -------  ------------  -----------  ------------  ----  -------
      1   [36m0.0599[0m   [32m0.3441[0m        [35m0.6045[0m       [31m0.9359[0m        [94m0.4974[0m     +  30.8742
      2   [36m0.0656[0m   [32m0.3934[0m        [35m0.4348[0m       0.9359        [94m0.3318[0m     +  30.9559
      3   [36m0.1047[0m   [32m0.5492[0m        [35m0.3235[0m       0.9359        [94m0.2622[0m     +  31.4609
      4   [36m0.1398[0m   [32m0.6384[0m        [35m0.2770[0m       0.9359        [94m0.2385[0m     +  31.0629
      5   [36m0.1638[0m   [32m0.6887[0m        [35m0.2586[0m       0.9347        [94m0.2277[0m     +  31.4315
      6   [36m0.1666[0m   [32m0.7122[0m        [35m0.2489[0m       0.9323        [94m0.2236[0m     +  31.5159
      7   [36m0.1703[0m   [32m0.7207[0m        [35m0.2422[0m       0.9311        [94m0.2226[0m     +  31.3214
      8   [36m0.1712[0m   [32m0.7270[0m        [35m0.2386[0m       0.9323        [94m0.2224[0m     +  31.6765
      9   0.1705   [32m0.7343[0m        [35m0.2348[0m       0.9299        [94m0.2222[0m     +  31.5596
     10   0.1705   [32m0.7407[0m        [35m0.2345[0m       0.9274        [94m0.2213[0m     +  31.5360
     11   0.1703   [32m0.7449[0m        [35m0.2323[0m       0.9262        0.2217        31.4766
     12   [36m0.1713[0m   [32m0.7483[0m        [35m0.2309[0m       0.9262        0.2213        31.4312
     13   0.1705   [32m0.7516[0m        [35m0.2301[0m       0.9262        0.2221        31.2763
     14   0.1691   [32m0.7523[0m        [35m0.2287[0m       0.9262        0.2225        31.5013
     15   0.1707   [32m0.7541[0m        [35m0.2285[0m       0.9274        0.2218        31.6733
     16   [36m0.1718[0m   [32m0.7552[0m        [35m0.2261[0m       0.9274        0.2215        31.5215
     17   [36m0.1733[0m   [32m0.7566[0m        [35m0.2259[0m       0.9274        0.2216        31.5989
     18   [36m0.1742[0m   [32m0.7579[0m        [35m0.2244[0m       0.9262        0.2216        31.6927
     19   [36m0.1768[0m   [32m0.7581[0m        [35m0.2229[0m       0.9250        0.2221        31.6404
Stopping since valid_loss has not improved in the last 10 epochs.
[32m[I 2023-05-03 13:06:34,642][0m Trial 348 finished with value: 0.22129065663235076 and parameters: {'lr': 1.527964921127624e-05, 'dropout': 0.2512075036425189, 'd_model_multiplier': 4, 'num_layers': 7, 'n_heads': 32, 'dim_feedforward': 321, 'batch_size': 77, 'pos_encoding': 'fixed', 'activation': 'relu', 'norm': 'LayerNorm', 'optimizer_name': 'RAdam', 'weight_decay': 0.001, 'top_n_features': 91}. Best is trial 246 with value: 0.16447311791139763.[0m
[FileBasedDataset] Initializing dataset...
	Examples: 8264
	Features: 99
	Max length: 315
Standard scalar turned ON, loading params from cache
[FileBasedDataset] Dataset initialization complete
  epoch    auprc    auroc    train_loss    valid_acc    valid_loss    cp      dur
-------  -------  -------  ------------  -----------  ------------  ----  -------
      1   [36m0.0744[0m   [32m0.3065[0m        [35m0.5538[0m       [31m0.9166[0m        [94m0.4177[0m     +  31.0231
      2   [36m0.1179[0m   [32m0.5998[0m        [35m0.3395[0m       0.9166        [94m0.2894[0m     +  31.0170
      3   [36m0.2476[0m   [32m0.7012[0m        [35m0.2707[0m       0.9166        [94m0.2626[0m     +  31.0117
      4   [36m0.3009[0m   [32m0.7266[0m        [35m0.2538[0m       0.9166        [94m0.2545[0m     +  31.5392
      5   [36m0.3136[0m   [32m0.7498[0m        [35m0.2471[0m       0.9154        [94m0.2479[0m     +  31.4749
      6   [36m0.3303[0m   [32m0.7679[0m        [35m0.2385[0m       [31m0.9190[0m        [94m0.2424[0m     +  31.4276
      7   [36m0.3321[0m   [32m0.7731[0m        [35m0.2349[0m       [31m0.9226[0m        [94m0.2413[0m     +  31.3779
      8   [36m0.3342[0m   [32m0.7788[0m        [35m0.2325[0m       [31m0.9238[0m        [94m0.2402[0m     +  31.4535
      9   0.3288   [32m0.7809[0m        [35m0.2302[0m       0.9226        [94m0.2394[0m     +  31.3243
     10   0.3283   [32m0.7827[0m        [35m0.2281[0m       0.9202        [94m0.2391[0m     +  31.0927
     11   0.3249   [32m0.7857[0m        [35m0.2276[0m       0.9190        [94m0.2388[0m     +  31.1135
     12   0.3226   0.7843        [35m0.2252[0m       0.9178        0.2396        31.2463
     13   0.3295   [32m0.7880[0m        0.2253       0.9202        [94m0.2384[0m     +  31.2532
     14   0.3269   0.7878        [35m0.2242[0m       0.9166        0.2389        31.0349
     15   0.3232   0.7861        [35m0.2234[0m       0.9166        0.2397        31.6828
     16   0.3190   0.7863        [35m0.2230[0m       0.9166        0.2398        31.1806
     17   0.3225   [32m0.7894[0m        [35m0.2220[0m       0.9166        0.2389        31.2228
     18   0.3107   0.7872        [35m0.2210[0m       0.9190        0.2409        31.3372
     19   0.3166   [32m0.7901[0m        [35m0.2203[0m       0.9190        0.2395        31.4872
     20   0.3180   0.7879        [35m0.2185[0m       0.9190        0.2407        31.3718
     21   0.3041   0.7859        [35m0.2182[0m       0.9178        0.2414        31.3952
     22   0.3069   0.7861        [35m0.2174[0m       0.9190        0.2420        31.3332
Stopping since valid_loss has not improved in the last 10 epochs.
[32m[I 2023-05-03 13:18:36,105][0m Trial 349 finished with value: 0.23836079535345933 and parameters: {'lr': 2.6243195611505512e-05, 'dropout': 0.28527947563874767, 'd_model_multiplier': 4, 'num_layers': 7, 'n_heads': 32, 'dim_feedforward': 339, 'batch_size': 70, 'pos_encoding': 'fixed', 'activation': 'relu', 'norm': 'LayerNorm', 'optimizer_name': 'RAdam', 'weight_decay': 0.001, 'top_n_features': 99}. Best is trial 246 with value: 0.16447311791139763.[0m
[FileBasedDataset] Initializing dataset...
	Examples: 8264
	Features: 89
	Max length: 315
Standard scalar turned ON, loading params from cache
[FileBasedDataset] Dataset initialization complete
  epoch    auprc    auroc    train_loss    valid_acc    valid_loss    cp      dur
-------  -------  -------  ------------  -----------  ------------  ----  -------
      1   [36m0.0739[0m   [32m0.3589[0m        [35m0.5707[0m       [31m0.9178[0m        [94m0.4618[0m     +  27.6308
      2   [36m0.0826[0m   [32m0.4588[0m        [35m0.4041[0m       0.9178        [94m0.3315[0m     +  27.6844
      3   [36m0.1687[0m   [32m0.6539[0m        [35m0.3039[0m       0.9178        [94m0.2777[0m     +  27.6138
      4   [36m0.2084[0m   [32m0.7207[0m        [35m0.2683[0m       0.9178        [94m0.2600[0m     +  28.1434
      5   [36m0.2553[0m   [32m0.7547[0m        [35m0.2534[0m       0.9166        [94m0.2498[0m     +  28.1083
      6   [36m0.3004[0m   [32m0.7723[0m        [35m0.2450[0m       [31m0.9202[0m        [94m0.2424[0m     +  28.1221
      7   [36m0.3101[0m   [32m0.7798[0m        [35m0.2392[0m       0.9129        [94m0.2389[0m     +  27.7659
      8   [36m0.3161[0m   [32m0.7827[0m        [35m0.2356[0m       0.9093        [94m0.2379[0m     +  28.0037
      9   0.3139   [32m0.7832[0m        [35m0.2319[0m       0.9093        [94m0.2373[0m     +  27.9051
     10   0.3090   [32m0.7840[0m        [35m0.2311[0m       0.9081        [94m0.2371[0m     +  28.1414
     11   0.3093   [32m0.7853[0m        [35m0.2292[0m       0.9081        0.2372        28.2413
     12   0.3155   [32m0.7859[0m        [35m0.2284[0m       0.9081        [94m0.2368[0m     +  28.0609
     13   0.3154   [32m0.7876[0m        [35m0.2279[0m       0.9117        0.2373        27.8714
     14   0.3148   [32m0.7889[0m        [35m0.2252[0m       0.9129        0.2370        28.0362
     15   [36m0.3169[0m   [32m0.7900[0m        [35m0.2244[0m       0.9141        [94m0.2368[0m     +  28.4013
     16   0.3144   [32m0.7902[0m        0.2245       0.9166        0.2386        28.1994
     17   0.3142   0.7896        [35m0.2235[0m       0.9166        0.2389        27.8333
     18   0.3139   0.7901        [35m0.2235[0m       0.9178        0.2392        28.0193
     19   0.3153   [32m0.7913[0m        [35m0.2213[0m       0.9178        0.2404        28.3122
     20   0.3152   [32m0.7935[0m        [35m0.2206[0m       0.9154        0.2401        27.8002
     21   0.3156   [32m0.7943[0m        0.2209       0.9154        0.2418        28.2357
Stopping since valid_loss has not improved in the last 10 epochs.
[32m[I 2023-05-03 13:28:53,640][0m Trial 350 finished with value: 0.23676397902789686 and parameters: {'lr': 2.049530522154144e-05, 'dropout': 0.26621373677566407, 'd_model_multiplier': 4, 'num_layers': 6, 'n_heads': 32, 'dim_feedforward': 327, 'batch_size': 86, 'pos_encoding': 'fixed', 'activation': 'relu', 'norm': 'LayerNorm', 'optimizer_name': 'RAdam', 'weight_decay': 0.001, 'top_n_features': 89}. Best is trial 246 with value: 0.16447311791139763.[0m
[FileBasedDataset] Initializing dataset...
	Examples: 8264
	Features: 102
	Max length: 315
Standard scalar turned ON, loading params from cache
[FileBasedDataset] Dataset initialization complete
  epoch    auprc    auroc    train_loss    valid_acc    valid_loss    cp      dur
-------  -------  -------  ------------  -----------  ------------  ----  -------
      1   [36m0.0547[0m   [32m0.3173[0m        [35m0.5322[0m       [31m0.9299[0m        [94m0.3451[0m     +  23.5703
      2   [36m0.1852[0m   [32m0.6268[0m        [35m0.3052[0m       0.9299        [94m0.2455[0m     +  23.9832
      3   [36m0.2092[0m   [32m0.6799[0m        [35m0.2607[0m       0.9299        [94m0.2338[0m     +  24.2262
      4   [36m0.2267[0m   [32m0.7114[0m        [35m0.2500[0m       0.9299        [94m0.2280[0m     +  23.9883
      5   [36m0.2668[0m   [32m0.7406[0m        [35m0.2439[0m       0.9287        [94m0.2216[0m     +  24.3088
      6   [36m0.2692[0m   [32m0.7445[0m        [35m0.2382[0m       0.9287        0.2237        23.9986
      7   [36m0.2717[0m   [32m0.7484[0m        [35m0.2348[0m       0.9262        0.2243        24.2545
      8   0.2683   [32m0.7542[0m        [35m0.2323[0m       0.9274        0.2255        24.0147
      9   0.2691   [32m0.7569[0m        [35m0.2311[0m       0.9262        0.2270        24.0645
     10   [36m0.2741[0m   [32m0.7614[0m        [35m0.2298[0m       0.9274        0.2264        24.4560
     11   0.2649   [32m0.7617[0m        [35m0.2286[0m       0.9262        0.2290        24.1836
     12   0.2737   [32m0.7646[0m        [35m0.2285[0m       0.9262        0.2277        24.2330
     13   0.2616   0.7645        0.2294       0.9274        0.2279        24.2521
     14   0.2705   0.7620        [35m0.2268[0m       0.9262        0.2301        24.3498
Stopping since valid_loss has not improved in the last 10 epochs.
