[32m[I 2023-05-03 08:29:53,564][0m Trial 317 finished with value: 100.0 and parameters: {'lr': 0.00012179208456329308, 'dropout': 0.30890312041622586, 'd_model_multiplier': 4, 'num_layers': 5, 'n_heads': 64, 'dim_feedforward': 362, 'batch_size': 197, 'pos_encoding': 'fixed', 'activation': 'relu', 'norm': 'LayerNorm', 'optimizer_name': 'RAdam', 'weight_decay': 0.1, 'top_n_features': 55}. Best is trial 246 with value: 0.16447311791139763.[0m
[FileBasedDataset] Initializing dataset...
	Examples: 8264
	Features: 65
	Max length: 315
Standard scalar turned ON, loading params from cache
[FileBasedDataset] Dataset initialization complete
  epoch    auprc    auroc    train_loss    valid_acc    valid_loss    cp      dur
-------  -------  -------  ------------  -----------  ------------  ----  -------
      1   [36m0.1181[0m   [32m0.5867[0m        [35m0.6691[0m       [31m0.8755[0m        [94m0.6391[0m     +  23.9946
      2   0.0943   0.4052        [35m0.6333[0m       [31m0.9335[0m        [94m0.5906[0m     +  24.2672
      3   0.0838   0.3381        [35m0.5875[0m       [31m0.9347[0m        [94m0.5365[0m     +  25.0997
      4   0.0585   0.3095        [35m0.5364[0m       0.9347        [94m0.4831[0m     +  25.0077
      5   0.0505   0.2964        [35m0.4872[0m       0.9347        [94m0.4340[0m     +  25.1828
      6   0.0481   0.2972        [35m0.4458[0m       0.9347        [94m0.3907[0m     +  25.3030
      7   0.0491   0.3241        [35m0.4075[0m       0.9347        [94m0.3538[0m     +  24.9833
      8   0.0517   0.3665        [35m0.3769[0m       0.9347        [94m0.3230[0m     +  25.7346
      9   0.0596   0.4294        [35m0.3506[0m       0.9347        [94m0.2981[0m     +  25.2200
     10   0.0938   0.4928        [35m0.3291[0m       0.9347        [94m0.2790[0m     +  24.9880
     11   [36m0.1374[0m   0.5494        [35m0.3149[0m       0.9347        [94m0.2642[0m     +  25.3083
     12   [36m0.1765[0m   [32m0.5929[0m        [35m0.3012[0m       0.9347        [94m0.2526[0m     +  25.2861
     13   [36m0.2108[0m   [32m0.6316[0m        [35m0.2922[0m       0.9347        [94m0.2433[0m     +  25.3064
     14   [36m0.2385[0m   [32m0.6633[0m        [35m0.2854[0m       0.9347        [94m0.2357[0m     +  25.6686
     15   [36m0.2683[0m   [32m0.6878[0m        [35m0.2769[0m       0.9347        [94m0.2293[0m     +  24.8890
     16   [36m0.2860[0m   [32m0.7078[0m        [35m0.2728[0m       0.9347        [94m0.2239[0m     +  25.1765
     17   [36m0.3057[0m   [32m0.7248[0m        [35m0.2681[0m       0.9347        [94m0.2192[0m     +  25.2693
     18   [36m0.3205[0m   [32m0.7416[0m        [35m0.2641[0m       [31m0.9359[0m        [94m0.2150[0m     +  25.2039
     19   [36m0.3347[0m   [32m0.7530[0m        [35m0.2597[0m       [31m0.9371[0m        [94m0.2114[0m     +  25.5107
     20   [36m0.3489[0m   [32m0.7615[0m        [35m0.2579[0m       [31m0.9383[0m        [94m0.2082[0m     +  25.0542
     21   [36m0.3573[0m   [32m0.7694[0m        [35m0.2550[0m       0.9371        [94m0.2054[0m     +  25.1577
     22   [36m0.3577[0m   [32m0.7756[0m        [35m0.2533[0m       [31m0.9395[0m        [94m0.2029[0m     +  25.4775
     23   [36m0.3668[0m   [32m0.7812[0m        [35m0.2504[0m       [31m0.9407[0m        [94m0.2008[0m     +  24.8780
     24   [36m0.3721[0m   [32m0.7845[0m        [35m0.2484[0m       [31m0.9420[0m        [94m0.1991[0m     +  25.0819
     25   [36m0.3738[0m   [32m0.7868[0m        [35m0.2480[0m       0.9420        [94m0.1975[0m     +  25.2062
     26   [36m0.3774[0m   [32m0.7905[0m        [35m0.2462[0m       [31m0.9444[0m        [94m0.1961[0m     +  25.1478
     27   [36m0.3819[0m   [32m0.7935[0m        0.2464       0.9444        [94m0.1948[0m     +  25.4351
     28   [36m0.3841[0m   [32m0.7957[0m        [35m0.2450[0m       0.9432        [94m0.1939[0m     +  25.0693
     29   [36m0.3870[0m   [32m0.7987[0m        [35m0.2449[0m       0.9420        [94m0.1929[0m     +  25.2076
     30   [36m0.3915[0m   [32m0.7999[0m        [35m0.2443[0m       0.9420        [94m0.1922[0m     +  25.1927
     31   [36m0.3937[0m   [32m0.8019[0m        [35m0.2430[0m       0.9432        [94m0.1915[0m     +  25.1625
     32   [36m0.3953[0m   [32m0.8040[0m        [35m0.2419[0m       0.9420        [94m0.1908[0m     +  25.0448
     33   0.3856   [32m0.8046[0m        [35m0.2417[0m       0.9420        [94m0.1903[0m     +  25.0530
     34   0.3871   [32m0.8062[0m        0.2424       0.9420        [94m0.1898[0m     +  25.5025
     35   0.3876   [32m0.8065[0m        [35m0.2402[0m       0.9420        [94m0.1895[0m     +  25.2717
     36   0.3848   [32m0.8079[0m        [35m0.2394[0m       0.9420        [94m0.1890[0m     +  25.2552
     37   0.3854   [32m0.8089[0m        0.2395       0.9420        [94m0.1886[0m     +  25.1907
     38   0.3853   [32m0.8096[0m        [35m0.2394[0m       0.9420        [94m0.1883[0m     +  25.3023
     39   0.3845   [32m0.8106[0m        [35m0.2392[0m       0.9420        [94m0.1880[0m     +  25.0345
     40   0.3855   [32m0.8111[0m        [35m0.2387[0m       0.9432        [94m0.1876[0m     +  25.3027
     41   0.3844   [32m0.8116[0m        [35m0.2382[0m       0.9432        [94m0.1874[0m     +  25.0943
     42   0.3836   [32m0.8124[0m        0.2390       0.9432        [94m0.1872[0m     +  25.0212
     43   0.3844   [32m0.8133[0m        0.2388       0.9432        [94m0.1869[0m     +  25.1381
     44   0.3852   [32m0.8136[0m        0.2387       0.9432        [94m0.1867[0m     +  25.0192
     45   0.3864   [32m0.8142[0m        [35m0.2371[0m       0.9420        [94m0.1865[0m     +  25.2688
     46   0.3855   [32m0.8144[0m        [35m0.2367[0m       0.9432        [94m0.1863[0m     +  25.1480
     47   0.3859   [32m0.8150[0m        0.2370       0.9407        0.1863        25.1156
     48   0.3867   0.8148        [35m0.2366[0m       0.9407        [94m0.1861[0m     +  25.0071
     49   0.3875   [32m0.8160[0m        [35m0.2365[0m       0.9407        [94m0.1861[0m     +  25.2825
     50   0.3879   0.8159        0.2371       0.9407        [94m0.1859[0m     +  25.1277
[32m[I 2023-05-03 08:50:56,152][0m Trial 318 finished with value: 0.18587597585683002 and parameters: {'lr': 4.15409846094464e-06, 'dropout': 0.40899120279949613, 'd_model_multiplier': 4, 'num_layers': 5, 'n_heads': 32, 'dim_feedforward': 390, 'batch_size': 119, 'pos_encoding': 'fixed', 'activation': 'relu', 'norm': 'LayerNorm', 'optimizer_name': 'RAdam', 'weight_decay': 0.1, 'top_n_features': 65}. Best is trial 246 with value: 0.16447311791139763.[0m
[FileBasedDataset] Initializing dataset...
	Examples: 8264
	Features: 65
	Max length: 315
Standard scalar turned ON, loading params from cache
[FileBasedDataset] Dataset initialization complete
  epoch    auprc    auroc    train_loss    valid_acc    valid_loss    cp      dur
-------  -------  -------  ------------  -----------  ------------  ----  -------
      1   [36m0.2250[0m   [32m0.7495[0m        [35m0.3934[0m       [31m0.9395[0m        [94m0.2062[0m     +  27.5747
      2   [36m0.2810[0m   [32m0.8011[0m        [35m0.2510[0m       0.9395        [94m0.1914[0m     +  27.6382
      3   [36m0.3215[0m   [32m0.8093[0m        [35m0.2405[0m       [31m0.9456[0m        [94m0.1862[0m     +  27.5214
      4   0.3177   [32m0.8141[0m        [35m0.2388[0m       0.9444        [94m0.1847[0m     +  27.4168
      5   0.3199   [32m0.8158[0m        [35m0.2367[0m       0.9432        0.1849        27.5339
      6   0.3045   [32m0.8171[0m        [35m0.2339[0m       0.9432        0.1854        27.5288
      7   0.3060   [32m0.8194[0m        0.2340       0.9432        0.1855        27.5553
      8   0.2976   [32m0.8263[0m        [35m0.2322[0m       0.9432        [94m0.1837[0m     +  27.6124
      9   0.3092   0.8250        [35m0.2317[0m       0.9432        0.1843        27.6917
     10   0.2990   0.8245        [35m0.2289[0m       0.9432        0.1870        27.6698
     11   0.2969   0.8204        [35m0.2275[0m       0.9407        0.1869        27.7206
     12   0.2981   [32m0.8318[0m        [35m0.2270[0m       0.9395        0.1845        27.5539
     13   0.2878   0.8236        [35m0.2263[0m       0.9432        0.1888        27.6705
     14   0.2902   0.8289        [35m0.2257[0m       0.9395        0.1863        27.8022
     15   0.2963   0.8298        [35m0.2238[0m       0.9407        0.1859        27.6401
     16   0.2881   [32m0.8331[0m        [35m0.2226[0m       0.9407        0.1867        27.6765
     17   0.2783   0.8311        [35m0.2200[0m       0.9383        0.1886        27.7080
Stopping since valid_loss has not improved in the last 10 epochs.
[32m[I 2023-05-03 08:59:14,271][0m Trial 319 finished with value: 0.18372506434784835 and parameters: {'lr': 4.486903567018373e-05, 'dropout': 0.4235257174803894, 'd_model_multiplier': 4, 'num_layers': 6, 'n_heads': 32, 'dim_feedforward': 371, 'batch_size': 27, 'pos_encoding': 'fixed', 'activation': 'relu', 'norm': 'LayerNorm', 'optimizer_name': 'RAdam', 'weight_decay': 0.1, 'top_n_features': 65}. Best is trial 246 with value: 0.16447311791139763.[0m
[FileBasedDataset] Initializing dataset...
	Examples: 8264
	Features: 66
	Max length: 315
Standard scalar turned ON, loading params from cache
[FileBasedDataset] Dataset initialization complete
Warning, assumed runtime error: CUDA out of memory. Tried to allocate 1.72 GiB (GPU 0; 23.70 GiB total capacity; 20.80 GiB already allocated; 957.25 MiB free; 21.67 GiB reserved in total by PyTorch) If reserved memory is >> allocated memory try setting max_split_size_mb to avoid fragmentation.  See documentation for Memory Management and PYTORCH_CUDA_ALLOC_CONF
[32m[I 2023-05-03 08:59:19,938][0m Trial 320 finished with value: 100.0 and parameters: {'lr': 3.0461533888517433e-05, 'dropout': 0.4099153153265866, 'd_model_multiplier': 4, 'num_layers': 5, 'n_heads': 32, 'dim_feedforward': 385, 'batch_size': 145, 'pos_encoding': 'fixed', 'activation': 'relu', 'norm': 'LayerNorm', 'optimizer_name': 'RAdam', 'weight_decay': 0.1, 'top_n_features': 66}. Best is trial 246 with value: 0.16447311791139763.[0m
[FileBasedDataset] Initializing dataset...
	Examples: 8264
	Features: 62
	Max length: 315
Standard scalar turned ON, loading params from cache
[FileBasedDataset] Dataset initialization complete
  epoch    auprc    auroc    train_loss    valid_acc    valid_loss    cp      dur
-------  -------  -------  ------------  -----------  ------------  ----  -------
      1   [36m0.0490[0m   [32m0.2729[0m        [35m0.6107[0m       [31m0.9323[0m        [94m0.5062[0m     +  24.6881
      2   [36m0.0509[0m   [32m0.3104[0m        [35m0.4726[0m       0.9323        [94m0.3703[0m     +  24.7438
      3   [36m0.0675[0m   [32m0.4662[0m        [35m0.3650[0m       0.9323        [94m0.2860[0m     +  25.0073
      4   [36m0.1418[0m   [32m0.6034[0m        [35m0.3035[0m       0.9323        [94m0.2509[0m     +  25.2493
      5   [36m0.1841[0m   [32m0.6581[0m        [35m0.2776[0m       0.9323        [94m0.2365[0m     +  25.4502
      6   [36m0.2018[0m   [32m0.6872[0m        [35m0.2658[0m       0.9323        [94m0.2293[0m     +  25.4161
      7   [36m0.2336[0m   [32m0.7092[0m        [35m0.2595[0m       0.9323        [94m0.2248[0m     +  25.1211
      8   [36m0.2818[0m   [32m0.7310[0m        [35m0.2552[0m       0.9323        [94m0.2212[0m     +  24.8432
      9   [36m0.3034[0m   [32m0.7503[0m        [35m0.2512[0m       0.9323        [94m0.2172[0m     +  25.4971
     10   [36m0.3159[0m   [32m0.7633[0m        [35m0.2483[0m       0.9323        [94m0.2127[0m     +  24.9975
     11   [36m0.3355[0m   [32m0.7711[0m        [35m0.2430[0m       [31m0.9359[0m        [94m0.2089[0m     +  25.1828
     12   [36m0.3492[0m   [32m0.7741[0m        [35m0.2389[0m       [31m0.9407[0m        [94m0.2070[0m     +  25.1718
     13   [36m0.3543[0m   [32m0.7784[0m        [35m0.2377[0m       0.9407        [94m0.2059[0m     +  25.5099
     14   [36m0.3571[0m   [32m0.7827[0m        [35m0.2365[0m       0.9395        [94m0.2053[0m     +  25.1850
     15   [36m0.3620[0m   [32m0.7844[0m        [35m0.2348[0m       0.9395        [94m0.2044[0m     +  25.3387
     16   [36m0.3634[0m   [32m0.7883[0m        0.2353       0.9371        [94m0.2034[0m     +  25.1031
     17   [36m0.3671[0m   [32m0.7903[0m        [35m0.2337[0m       0.9383        [94m0.2028[0m     +  25.4167
     18   [36m0.3692[0m   [32m0.7925[0m        [35m0.2331[0m       0.9383        [94m0.2023[0m     +  25.4192
     19   0.3666   [32m0.7927[0m        0.2332       0.9383        [94m0.2019[0m     +  25.1863
     20   0.3629   [32m0.7936[0m        [35m0.2322[0m       0.9383        [94m0.2019[0m     +  25.1735
     21   0.3645   [32m0.7952[0m        [35m0.2313[0m       0.9359        [94m0.2017[0m     +  25.3715
     22   0.3652   [32m0.7965[0m        [35m0.2313[0m       0.9371        [94m0.2016[0m     +  25.2195
     23   0.3675   [32m0.7980[0m        [35m0.2310[0m       0.9371        [94m0.2012[0m     +  25.3787
     24   0.3662   [32m0.7987[0m        [35m0.2300[0m       0.9359        [94m0.2010[0m     +  25.5972
     25   0.3649   [32m0.8007[0m        0.2301       0.9359        [94m0.2005[0m     +  25.2198
     26   0.3661   0.8001        [35m0.2297[0m       0.9359        0.2009        25.0884
     27   0.3681   [32m0.8016[0m        [35m0.2284[0m       0.9359        [94m0.2004[0m     +  25.2096
     28   [36m0.3713[0m   [32m0.8033[0m        0.2287       0.9359        [94m0.2004[0m     +  25.0983
     29   [36m0.3718[0m   [32m0.8040[0m        0.2298       0.9371        [94m0.2003[0m     +  25.2536
     30   [36m0.3748[0m   [32m0.8045[0m        [35m0.2280[0m       0.9383        [94m0.2001[0m     +  25.3859
     31   0.3726   [32m0.8048[0m        [35m0.2274[0m       0.9383        [94m0.2001[0m     +  25.5123
     32   0.3729   [32m0.8061[0m        0.2277       0.9359        [94m0.1996[0m     +  25.4080
     33   0.3736   [32m0.8066[0m        [35m0.2266[0m       0.9359        0.1998        25.1277
     34   0.3719   0.8062        [35m0.2262[0m       0.9371        0.2005        25.0864
     35   0.3719   [32m0.8071[0m        0.2270       0.9371        0.2003        25.3504
     36   0.3667   [32m0.8083[0m        0.2264       0.9359        0.2000        25.4111
     37   0.3635   [32m0.8084[0m        [35m0.2248[0m       0.9359        0.2001        25.3877
     38   0.3630   [32m0.8087[0m        0.2256       0.9359        0.2002        25.4997
     39   0.3608   [32m0.8095[0m        0.2264       0.9359        [94m0.1996[0m     +  25.3864
     40   0.3597   0.8095        0.2255       0.9359        0.2001        25.2057
     41   0.3616   [32m0.8112[0m        [35m0.2229[0m       0.9359        [94m0.1993[0m     +  25.4637
     42   0.3618   [32m0.8113[0m        0.2238       0.9371        0.2000        25.4323
     43   0.3600   [32m0.8118[0m        0.2245       0.9347        0.1997        25.4005
     44   0.3600   [32m0.8131[0m        0.2237       0.9359        0.1994        25.3194
     45   0.3545   [32m0.8138[0m        0.2233       0.9359        [94m0.1989[0m     +  25.3703
     46   0.3520   [32m0.8146[0m        [35m0.2225[0m       0.9347        0.1995        25.3790
     47   0.3510   [32m0.8150[0m        [35m0.2218[0m       0.9371        0.1991        25.2445
     48   0.3512   0.8145        [35m0.2212[0m       0.9359        0.2001        25.2988
     49   0.3456   0.8140        0.2217       0.9347        0.2009        25.3439
     50   0.3483   0.8148        0.2220       0.9371        0.2002        25.2373
[32m[I 2023-05-03 09:20:26,681][0m Trial 321 finished with value: 0.19891628702289393 and parameters: {'lr': 2.716770422527114e-05, 'dropout': 0.4160724343501081, 'd_model_multiplier': 4, 'num_layers': 5, 'n_heads': 32, 'dim_feedforward': 360, 'batch_size': 128, 'pos_encoding': 'fixed', 'activation': 'relu', 'norm': 'LayerNorm', 'optimizer_name': 'RAdam', 'weight_decay': 0.1, 'top_n_features': 62}. Best is trial 246 with value: 0.16447311791139763.[0m
[FileBasedDataset] Initializing dataset...
	Examples: 8264
	Features: 67
	Max length: 315
Standard scalar turned ON, loading params from cache
[FileBasedDataset] Dataset initialization complete
  epoch    auprc    auroc    train_loss    valid_acc    valid_loss    cp      dur
-------  -------  -------  ------------  -----------  ------------  ----  -------
      1   [36m0.2001[0m   [32m0.6501[0m        [35m0.4097[0m       [31m0.9226[0m        [94m0.2591[0m     +  23.7977
      2   [36m0.2753[0m   [32m0.7658[0m        [35m0.2524[0m       0.9202        [94m0.2355[0m     +  23.9024
      3   [36m0.2808[0m   [32m0.7869[0m        [35m0.2378[0m       [31m0.9238[0m        [94m0.2319[0m     +  23.8208
      4   0.2787   [32m0.7978[0m        [35m0.2330[0m       0.9202        [94m0.2306[0m     +  23.9243
      5   [36m0.2818[0m   [32m0.8046[0m        [35m0.2318[0m       0.9238        [94m0.2280[0m     +  24.0722
      6   0.2771   [32m0.8105[0m        [35m0.2284[0m       0.9226        0.2281        23.8613
      7   0.2780   [32m0.8136[0m        [35m0.2284[0m       0.9190        0.2288        23.8488
      8   [36m0.2823[0m   [32m0.8158[0m        [35m0.2282[0m       0.9190        [94m0.2274[0m     +  23.8239
      9   [36m0.2869[0m   [32m0.8201[0m        [35m0.2262[0m       0.9190        0.2274        23.9429
     10   0.2833   [32m0.8222[0m        [35m0.2248[0m       0.9214        [94m0.2265[0m     +  23.6367
     11   [36m0.2918[0m   0.8216        [35m0.2233[0m       0.9202        0.2267        23.7614
     12   0.2868   0.8178        [35m0.2219[0m       0.9190        0.2272        23.6446
     13   [36m0.2960[0m   0.8184        [35m0.2210[0m       0.9190        0.2276        23.8771
     14   0.2845   0.8211        0.2215       0.9178        0.2270        23.8212
     15   0.2858   0.8202        [35m0.2190[0m       0.9178        0.2277        23.9068
     16   0.2915   0.8169        [35m0.2177[0m       0.9226        0.2272        23.7719
     17   0.2930   0.8154        [35m0.2176[0m       0.9226        0.2284        23.8039
     18   0.2788   0.8066        [35m0.2139[0m       0.9178        0.2315        23.7550
     19   0.2868   0.8105        0.2149       0.9214        0.2301        23.7657
Stopping since valid_loss has not improved in the last 10 epochs.
[32m[I 2023-05-03 09:28:24,268][0m Trial 322 finished with value: 0.22653434169732098 and parameters: {'lr': 4.321930041045881e-05, 'dropout': 0.41539678962304494, 'd_model_multiplier': 4, 'num_layers': 5, 'n_heads': 32, 'dim_feedforward': 372, 'batch_size': 30, 'pos_encoding': 'fixed', 'activation': 'relu', 'norm': 'LayerNorm', 'optimizer_name': 'RAdam', 'weight_decay': 0.1, 'top_n_features': 67}. Best is trial 246 with value: 0.16447311791139763.[0m
[FileBasedDataset] Initializing dataset...
	Examples: 8264
	Features: 64
	Max length: 315
Standard scalar turned ON, loading params from cache
[FileBasedDataset] Dataset initialization complete
Warning, assumed runtime error: CUDA out of memory. Tried to allocate 1.60 GiB (GPU 0; 23.70 GiB total capacity; 19.62 GiB already allocated; 957.25 MiB free; 21.67 GiB reserved in total by PyTorch) If reserved memory is >> allocated memory try setting max_split_size_mb to avoid fragmentation.  See documentation for Memory Management and PYTORCH_CUDA_ALLOC_CONF
[32m[I 2023-05-03 09:28:29,497][0m Trial 323 finished with value: 100.0 and parameters: {'lr': 1.1321139483958599e-05, 'dropout': 0.42944495798471294, 'd_model_multiplier': 4, 'num_layers': 6, 'n_heads': 32, 'dim_feedforward': 364, 'batch_size': 135, 'pos_encoding': 'fixed', 'activation': 'relu', 'norm': 'LayerNorm', 'optimizer_name': 'RAdam', 'weight_decay': 0.1, 'top_n_features': 64}. Best is trial 246 with value: 0.16447311791139763.[0m
[FileBasedDataset] Initializing dataset...
	Examples: 8264
	Features: 64
	Max length: 315
Standard scalar turned ON, loading params from cache
[FileBasedDataset] Dataset initialization complete
Warning, assumed runtime error: CUDA out of memory. Tried to allocate 1.55 GiB (GPU 0; 23.70 GiB total capacity; 19.05 GiB already allocated; 957.25 MiB free; 21.67 GiB reserved in total by PyTorch) If reserved memory is >> allocated memory try setting max_split_size_mb to avoid fragmentation.  See documentation for Memory Management and PYTORCH_CUDA_ALLOC_CONF
[32m[I 2023-05-03 09:28:34,132][0m Trial 324 finished with value: 100.0 and parameters: {'lr': 4.602408843694912e-05, 'dropout': 0.4106241425853908, 'd_model_multiplier': 4, 'num_layers': 6, 'n_heads': 32, 'dim_feedforward': 371, 'batch_size': 131, 'pos_encoding': 'fixed', 'activation': 'relu', 'norm': 'LayerNorm', 'optimizer_name': 'RAdam', 'weight_decay': 0.1, 'top_n_features': 64}. Best is trial 246 with value: 0.16447311791139763.[0m
[FileBasedDataset] Initializing dataset...
	Examples: 8264
	Features: 69
	Max length: 315
Standard scalar turned ON, loading params from cache
[FileBasedDataset] Dataset initialization complete
Warning, assumed runtime error: CUDA out of memory. Tried to allocate 1.44 GiB (GPU 0; 23.70 GiB total capacity; 21.24 GiB already allocated; 955.25 MiB free; 21.67 GiB reserved in total by PyTorch) If reserved memory is >> allocated memory try setting max_split_size_mb to avoid fragmentation.  See documentation for Memory Management and PYTORCH_CUDA_ALLOC_CONF
