[32m[I 2023-05-03 15:53:51,656][0m Trial 363 finished with value: 0.23832730733605942 and parameters: {'lr': 9.365238160362097e-05, 'dropout': 0.34412089106548577, 'd_model_multiplier': 4, 'num_layers': 7, 'n_heads': 32, 'dim_feedforward': 341, 'batch_size': 68, 'pos_encoding': 'fixed', 'activation': 'relu', 'norm': 'LayerNorm', 'optimizer_name': 'AdamW', 'weight_decay': 0.1, 'top_n_features': 60}. Best is trial 246 with value: 0.16447311791139763.[0m
[FileBasedDataset] Initializing dataset...
	Examples: 8264
	Features: 81
	Max length: 315
Standard scalar turned ON, loading params from cache
[FileBasedDataset] Dataset initialization complete
  epoch    auprc    auroc    train_loss    valid_acc    valid_loss    cp      dur
-------  -------  -------  ------------  -----------  ------------  ----  -------
      1   [36m0.2969[0m   [32m0.6943[0m        [35m0.3294[0m       [31m0.9093[0m        [94m0.2763[0m     +  27.2481
      2   [36m0.3815[0m   [32m0.7698[0m        [35m0.2415[0m       [31m0.9105[0m        [94m0.2566[0m     +  27.4621
      3   [36m0.3935[0m   [32m0.7901[0m        [35m0.2341[0m       [31m0.9117[0m        [94m0.2494[0m     +  27.6936
      4   [36m0.4008[0m   [32m0.7992[0m        [35m0.2308[0m       0.9117        [94m0.2459[0m     +  27.7988
      5   [36m0.4155[0m   [32m0.8042[0m        [35m0.2287[0m       0.9093        [94m0.2450[0m     +  27.8661
      6   [36m0.4214[0m   [32m0.8094[0m        [35m0.2272[0m       [31m0.9141[0m        [94m0.2421[0m     +  27.2813
      7   0.4151   [32m0.8149[0m        [35m0.2241[0m       [31m0.9154[0m        [94m0.2394[0m     +  27.5552
      8   0.4189   [32m0.8167[0m        [35m0.2232[0m       0.9141        0.2399        27.6655
      9   0.4169   [32m0.8198[0m        [35m0.2215[0m       [31m0.9190[0m        [94m0.2383[0m     +  27.2215
     10   0.4162   [32m0.8202[0m        [35m0.2199[0m       0.9190        0.2385        27.6646
     11   0.4150   [32m0.8212[0m        [35m0.2188[0m       0.9166        0.2384        27.6459
     12   0.4168   [32m0.8223[0m        [35m0.2182[0m       0.9141        0.2385        27.5391
     13   0.4138   [32m0.8238[0m        [35m0.2143[0m       0.9166        [94m0.2372[0m     +  27.6376
     14   0.4092   [32m0.8245[0m        0.2146       0.9166        0.2388        27.6331
     15   0.4145   [32m0.8252[0m        [35m0.2130[0m       0.9141        0.2395        27.3568
     16   0.4022   0.8245        [35m0.2112[0m       0.9129        0.2406        27.6706
     17   0.4047   0.8244        [35m0.2099[0m       0.9141        0.2410        27.3988
     18   0.4123   [32m0.8254[0m        [35m0.2088[0m       0.9129        0.2413        27.3835
     19   0.4012   0.8252        [35m0.2082[0m       0.9141        0.2415        27.5176
     20   0.3930   0.8227        [35m0.2070[0m       0.9129        0.2450        27.5253
     21   0.3956   0.8232        [35m0.2026[0m       0.9129        0.2449        27.5329
     22   0.3809   0.8209        0.2047       0.9129        0.2480        27.5918
Stopping since valid_loss has not improved in the last 10 epochs.
[32m[I 2023-05-03 16:04:26,550][0m Trial 364 finished with value: 0.23721089432108358 and parameters: {'lr': 2.259580282446397e-05, 'dropout': 0.2302967961912518, 'd_model_multiplier': 4, 'num_layers': 6, 'n_heads': 32, 'dim_feedforward': 330, 'batch_size': 59, 'pos_encoding': 'fixed', 'activation': 'relu', 'norm': 'LayerNorm', 'optimizer_name': 'AdamW', 'weight_decay': 0, 'top_n_features': 81}. Best is trial 246 with value: 0.16447311791139763.[0m
[FileBasedDataset] Initializing dataset...
	Examples: 8264
	Features: 54
	Max length: 315
Standard scalar turned ON, loading params from cache
[FileBasedDataset] Dataset initialization complete
Warning, assumed runtime error: CUDA out of memory. Tried to allocate 90.00 MiB (GPU 0; 23.70 GiB total capacity; 22.38 GiB already allocated; 75.25 MiB free; 22.53 GiB reserved in total by PyTorch) If reserved memory is >> allocated memory try setting max_split_size_mb to avoid fragmentation.  See documentation for Memory Management and PYTORCH_CUDA_ALLOC_CONF
[32m[I 2023-05-03 16:04:30,592][0m Trial 365 finished with value: 100.0 and parameters: {'lr': 3.0071686352436153e-05, 'dropout': 0.39667699958990693, 'd_model_multiplier': 32, 'num_layers': 8, 'n_heads': 32, 'dim_feedforward': 318, 'batch_size': 73, 'pos_encoding': 'fixed', 'activation': 'relu', 'norm': 'LayerNorm', 'optimizer_name': 'AdamW', 'weight_decay': 0.1, 'top_n_features': 54}. Best is trial 246 with value: 0.16447311791139763.[0m
[FileBasedDataset] Initializing dataset...
	Examples: 8264
	Features: 72
	Max length: 315
Standard scalar turned ON, loading params from cache
[FileBasedDataset] Dataset initialization complete
  epoch    auprc    auroc    train_loss    valid_acc    valid_loss    cp      dur
-------  -------  -------  ------------  -----------  ------------  ----  -------
      1   [36m0.3606[0m   [32m0.8138[0m        [35m0.2735[0m       [31m0.9226[0m        [94m0.2247[0m     +  41.1456
      2   [36m0.3811[0m   [32m0.8229[0m        [35m0.2362[0m       0.9214        [94m0.2206[0m     +  41.7400
      3   [36m0.3874[0m   [32m0.8273[0m        [35m0.2322[0m       0.9190        [94m0.2193[0m     +  41.6427
      4   [36m0.3885[0m   [32m0.8316[0m        [35m0.2288[0m       0.9190        [94m0.2182[0m     +  41.8249
      5   0.3867   [32m0.8367[0m        [35m0.2257[0m       0.9202        [94m0.2161[0m     +  41.7368
      6   0.3837   [32m0.8384[0m        [35m0.2234[0m       0.9190        0.2167        41.7849
      7   0.3869   [32m0.8401[0m        [35m0.2204[0m       0.9178        0.2186        41.9810
      8   0.3865   0.8393        [35m0.2177[0m       0.9166        0.2198        41.9697
      9   0.3807   0.8371        [35m0.2162[0m       0.9214        0.2204        41.7574
     10   0.3788   0.8368        [35m0.2155[0m       0.9202        0.2223        41.7623
     11   0.3781   [32m0.8405[0m        [35m0.2142[0m       0.9166        0.2251        41.4997
     12   0.3625   0.8361        [35m0.2105[0m       0.9202        0.2272        41.4853
     13   0.3617   0.8379        [35m0.2097[0m       0.9178        0.2304        41.6193
     14   0.3682   0.8402        [35m0.2075[0m       0.9178        0.2281        41.6268
Stopping since valid_loss has not improved in the last 10 epochs.
[32m[I 2023-05-03 16:14:56,646][0m Trial 366 finished with value: 0.21606102293895552 and parameters: {'lr': 4.990688162927333e-05, 'dropout': 0.376991669699773, 'd_model_multiplier': 4, 'num_layers': 5, 'n_heads': 64, 'dim_feedforward': 311, 'batch_size': 64, 'pos_encoding': 'fixed', 'activation': 'relu', 'norm': 'LayerNorm', 'optimizer_name': 'AdamW', 'weight_decay': 0.1, 'top_n_features': 72}. Best is trial 246 with value: 0.16447311791139763.[0m
[FileBasedDataset] Initializing dataset...
	Examples: 8264
	Features: 65
	Max length: 315
Standard scalar turned ON, loading params from cache
[FileBasedDataset] Dataset initialization complete
  epoch    auprc    auroc    train_loss    valid_acc    valid_loss    cp      dur
-------  -------  -------  ------------  -----------  ------------  ----  -------
      1   [36m0.2908[0m   [32m0.8091[0m        [35m0.2911[0m       [31m0.9287[0m        [94m0.2079[0m     +  82.6702
      2   [36m0.2952[0m   [32m0.8123[0m        [35m0.2387[0m       [31m0.9299[0m        [94m0.2061[0m     +  82.6730
      3   0.2950   [32m0.8134[0m        [35m0.2342[0m       0.9287        [94m0.2058[0m     +  82.7008
      4   [36m0.2993[0m   [32m0.8167[0m        [35m0.2322[0m       0.9274        [94m0.2053[0m     +  82.5158
      5   [36m0.3097[0m   [32m0.8172[0m        [35m0.2301[0m       0.9299        0.2057        83.0698
      6   [36m0.3175[0m   [32m0.8189[0m        [35m0.2277[0m       0.9274        0.2064        82.8090
      7   0.3164   0.8180        [35m0.2263[0m       0.9299        0.2062        82.8162
      8   0.3089   [32m0.8190[0m        [35m0.2257[0m       [31m0.9311[0m        0.2071        82.6244
      9   [36m0.3233[0m   [32m0.8207[0m        [35m0.2234[0m       0.9299        0.2057        82.8211
     10   [36m0.3241[0m   [32m0.8216[0m        [35m0.2216[0m       0.9311        0.2063        82.8030
     11   [36m0.3250[0m   0.8209        [35m0.2210[0m       0.9311        0.2076        82.8090
     12   0.3215   0.8181        [35m0.2191[0m       0.9311        0.2075        83.0280
     13   0.3205   0.8168        [35m0.2176[0m       [31m0.9323[0m        0.2095        82.8760
Stopping since valid_loss has not improved in the last 10 epochs.
[32m[I 2023-05-03 16:34:24,184][0m Trial 367 finished with value: 0.20530544076353635 and parameters: {'lr': 3.2064173182685584e-06, 'dropout': 0.3226868019157047, 'd_model_multiplier': 64, 'num_layers': 4, 'n_heads': 32, 'dim_feedforward': 334, 'batch_size': 53, 'pos_encoding': 'fixed', 'activation': 'relu', 'norm': 'LayerNorm', 'optimizer_name': 'AdamW', 'weight_decay': 0.1, 'top_n_features': 65}. Best is trial 246 with value: 0.16447311791139763.[0m
[FileBasedDataset] Initializing dataset...
	Examples: 8264
	Features: 66
	Max length: 315
Standard scalar turned ON, loading params from cache
[FileBasedDataset] Dataset initialization complete
Warning, assumed runtime error: CUDA out of memory. Tried to allocate 126.00 MiB (GPU 0; 23.70 GiB total capacity; 22.18 GiB already allocated; 75.25 MiB free; 22.53 GiB reserved in total by PyTorch) If reserved memory is >> allocated memory try setting max_split_size_mb to avoid fragmentation.  See documentation for Memory Management and PYTORCH_CUDA_ALLOC_CONF
[32m[I 2023-05-03 16:34:27,801][0m Trial 368 finished with value: 100.0 and parameters: {'lr': 6.345300041603792e-06, 'dropout': 0.35144664702450173, 'd_model_multiplier': 64, 'num_layers': 9, 'n_heads': 32, 'dim_feedforward': 335, 'batch_size': 51, 'pos_encoding': 'fixed', 'activation': 'relu', 'norm': 'LayerNorm', 'optimizer_name': 'AdamW', 'weight_decay': 0.1, 'top_n_features': 66}. Best is trial 246 with value: 0.16447311791139763.[0m
[FileBasedDataset] Initializing dataset...
	Examples: 8264
	Features: 65
	Max length: 315
Standard scalar turned ON, loading params from cache
[FileBasedDataset] Dataset initialization complete
  epoch    auprc    auroc    train_loss    valid_acc    valid_loss    cp       dur
-------  -------  -------  ------------  -----------  ------------  ----  --------
      1   [36m0.4458[0m   [32m0.8502[0m        [35m0.2750[0m       [31m0.9274[0m        [94m0.2128[0m     +  120.1678
      2   [36m0.4537[0m   0.8431        [35m0.2364[0m       0.9262        0.2146        120.3576
      3   [36m0.4636[0m   0.8444        [35m0.2324[0m       [31m0.9299[0m        [94m0.2119[0m     +  120.7258
      4   [36m0.4693[0m   0.8442        [35m0.2297[0m       0.9299        [94m0.2111[0m     +  120.7307
      5   0.4682   0.8453        [35m0.2286[0m       0.9299        [94m0.2098[0m     +  120.5585
      6   [36m0.4704[0m   0.8435        [35m0.2267[0m       [31m0.9311[0m        0.2108        120.4460
      7   0.4694   0.8431        [35m0.2253[0m       0.9274        0.2103        120.4795
      8   0.4604   0.8431        [35m0.2237[0m       0.9250        0.2109        120.6833
      9   0.4543   0.8434        [35m0.2209[0m       [31m0.9323[0m        [94m0.2082[0m     +  120.6792
     10   [36m0.4777[0m   0.8458        [35m0.2191[0m       0.9311        [94m0.2060[0m     +  120.7352
     11   0.4709   0.8447        [35m0.2180[0m       0.9287        0.2078        120.5252
     12   0.4774   0.8453        [35m0.2155[0m       0.9323        [94m0.2055[0m     +  121.0078
     13   [36m0.4796[0m   0.8461        [35m0.2153[0m       0.9311        0.2071        120.7769
     14   0.4744   0.8467        [35m0.2126[0m       [31m0.9335[0m        0.2089        120.6825
     15   0.4749   0.8462        [35m0.2117[0m       [31m0.9371[0m        [94m0.2046[0m     +  120.9677
     16   0.4756   0.8463        [35m0.2101[0m       [31m0.9383[0m        0.2076        120.3432
     17   [36m0.4820[0m   0.8452        [35m0.2093[0m       0.9347        0.2086        120.5571
     18   0.4769   0.8440        [35m0.2067[0m       0.9359        0.2075        120.4305
     19   0.4713   0.8412        [35m0.2058[0m       0.9359        0.2071        120.8988
     20   0.4807   0.8418        [35m0.2045[0m       0.9371        0.2097        120.6724
     21   0.4697   0.8379        [35m0.2026[0m       0.9323        0.2118        120.7132
     22   0.4761   0.8383        [35m0.2017[0m       0.9323        0.2106        120.9947
     23   0.4799   0.8357        [35m0.2003[0m       0.9359        0.2118        120.9744
     24   0.4637   0.8323        [35m0.1993[0m       0.9347        0.2142        120.8546
Stopping since valid_loss has not improved in the last 10 epochs.
[32m[I 2023-05-03 17:25:08,349][0m Trial 369 finished with value: 0.2046491935975318 and parameters: {'lr': 3.168286202811326e-06, 'dropout': 0.310442394972708, 'd_model_multiplier': 64, 'num_layers': 6, 'n_heads': 32, 'dim_feedforward': 351, 'batch_size': 54, 'pos_encoding': 'fixed', 'activation': 'relu', 'norm': 'LayerNorm', 'optimizer_name': 'AdamW', 'weight_decay': 0.001, 'top_n_features': 65}. Best is trial 246 with value: 0.16447311791139763.[0m
[FileBasedDataset] Initializing dataset...
	Examples: 8264
	Features: 64
	Max length: 315
Standard scalar turned ON, loading params from cache
[FileBasedDataset] Dataset initialization complete
  epoch    auprc    auroc    train_loss    valid_acc    valid_loss    cp       dur
-------  -------  -------  ------------  -----------  ------------  ----  --------
      1   [36m0.2704[0m   [32m0.7761[0m        [35m0.2891[0m       [31m0.9081[0m        [94m0.2656[0m     +  120.7110
      2   [36m0.2770[0m   [32m0.7818[0m        [35m0.2326[0m       0.9045        0.2660        120.9533
      3   [36m0.2774[0m   [32m0.7833[0m        [35m0.2287[0m       0.9021        0.2680        120.9580
      4   0.2773   0.7833        [35m0.2256[0m       0.9045        0.2681        121.2157
      5   0.2766   [32m0.7852[0m        [35m0.2242[0m       0.9069        0.2689        120.9178
      6   0.2766   [32m0.7855[0m        [35m0.2223[0m       0.9057        0.2692        121.0895
      7   0.2756   [32m0.7864[0m        [35m0.2196[0m       0.9069        0.2711        121.0496
      8   0.2725   0.7846        0.2200       0.9081        0.2723        121.0846
      9   0.2729   0.7844        [35m0.2185[0m       0.9081        0.2713        120.8144
     10   0.2723   0.7845        [35m0.2162[0m       0.9069        0.2728        120.9755
Stopping since valid_loss has not improved in the last 10 epochs.
[32m[I 2023-05-03 17:47:22,650][0m Trial 370 finished with value: 0.26564694611308365 and parameters: {'lr': 2.024992613612739e-06, 'dropout': 0.3186976375820365, 'd_model_multiplier': 64, 'num_layers': 6, 'n_heads': 32, 'dim_feedforward': 352, 'batch_size': 55, 'pos_encoding': 'fixed', 'activation': 'relu', 'norm': 'LayerNorm', 'optimizer_name': 'AdamW', 'weight_decay': 0.001, 'top_n_features': 64}. Best is trial 246 with value: 0.16447311791139763.[0m
[FileBasedDataset] Initializing dataset...
	Examples: 8264
	Features: 70
	Max length: 315
Standard scalar turned ON, loading params from cache
[FileBasedDataset] Dataset initialization complete
  epoch    auprc    auroc    train_loss    valid_acc    valid_loss    cp       dur
-------  -------  -------  ------------  -----------  ------------  ----  --------
      1   [36m0.2857[0m   [32m0.7541[0m        [35m0.2660[0m       [31m0.9287[0m        [94m0.2335[0m     +  122.0631
      2   [36m0.3102[0m   [32m0.7718[0m        [35m0.2320[0m       0.9262        [94m0.2302[0m     +  122.0729
      3   [36m0.3114[0m   [32m0.7811[0m        [35m0.2295[0m       0.9226        [94m0.2288[0m     +  122.0755
      4   [36m0.3146[0m   [32m0.7887[0m        [35m0.2255[0m       0.9226        [94m0.2273[0m     +  122.1120
      5   [36m0.3216[0m   [32m0.7914[0m        [35m0.2227[0m       0.9226        [94m0.2264[0m     +  122.1105
      6   0.3194   [32m0.7918[0m        [35m0.2218[0m       0.9226        0.2269        122.2196
      7   0.3129   0.7916        [35m0.2191[0m       0.9214        0.2294        122.0709
      8   0.3141   0.7911        [35m0.2167[0m       0.9214        0.2302        122.3068
      9   0.3157   0.7904        [35m0.2150[0m       0.9202        0.2293        122.3032
     10   0.3132   0.7839        [35m0.2122[0m       0.9214        0.2320        122.4075
     11   0.3120   0.7882        [35m0.2108[0m       0.9214        0.2313        122.5748
     12   0.3126   0.7881        [35m0.2099[0m       0.9202        0.2340        122.2712
     13   0.3121   0.7833        [35m0.2080[0m       0.9190        0.2353        122.4178
     14   0.3131   0.7839        [35m0.2060[0m       0.9190        0.2360        122.2351
Stopping since valid_loss has not improved in the last 10 epochs.
[32m[I 2023-05-03 18:18:10,711][0m Trial 371 finished with value: 0.22638560242347303 and parameters: {'lr': 3.2014565371305917e-06, 'dropout': 0.2990201445583437, 'd_model_multiplier': 64, 'num_layers': 6, 'n_heads': 32, 'dim_feedforward': 341, 'batch_size': 50, 'pos_encoding': 'fixed', 'activation': 'relu', 'norm': 'LayerNorm', 'optimizer_name': 'AdamW', 'weight_decay': 0.001, 'top_n_features': 70}. Best is trial 246 with value: 0.16447311791139763.[0m
[FileBasedDataset] Initializing dataset...
	Examples: 8264
	Features: 59
	Max length: 315
Standard scalar turned ON, loading params from cache
[FileBasedDataset] Dataset initialization complete
  epoch    auprc    auroc    train_loss    valid_acc    valid_loss    cp       dur
-------  -------  -------  ------------  -----------  ------------  ----  --------
      1   [36m0.3192[0m   [32m0.7532[0m        [35m0.2697[0m       [31m0.9190[0m        [94m0.2565[0m     +  121.2613
      2   [36m0.3323[0m   [32m0.7745[0m        [35m0.2317[0m       [31m0.9226[0m        [94m0.2514[0m     +  121.6162
      3   [36m0.3419[0m   [32m0.7853[0m        [35m0.2289[0m       0.9214        [94m0.2462[0m     +  121.3269
      4   [36m0.3510[0m   [32m0.7900[0m        [35m0.2264[0m       0.9202        [94m0.2439[0m     +  121.1735
      5   [36m0.3623[0m   [32m0.7941[0m        0.2266       0.9214        [94m0.2423[0m     +  121.3349
      6   [36m0.3688[0m   [32m0.7989[0m        [35m0.2249[0m       0.9214        [94m0.2403[0m     +  121.1477
      7   [36m0.3768[0m   [32m0.8022[0m        [35m0.2238[0m       0.9214        [94m0.2379[0m     +  121.3350
      8   [36m0.3841[0m   [32m0.8040[0m        [35m0.2213[0m       0.9226        [94m0.2363[0m     +  121.4732
      9   [36m0.3909[0m   [32m0.8076[0m        [35m0.2200[0m       0.9214        [94m0.2341[0m     +  121.7661
     10   [36m0.3954[0m   [32m0.8108[0m        [35m0.2188[0m       [31m0.9238[0m        [94m0.2325[0m     +  121.7256
     11   [36m0.4037[0m   [32m0.8123[0m        [35m0.2186[0m       0.9202        [94m0.2311[0m     +  121.7701
     12   [36m0.4054[0m   [32m0.8152[0m        [35m0.2172[0m       0.9202        [94m0.2297[0m     +  121.8601
     13   [36m0.4059[0m   [32m0.8161[0m        [35m0.2160[0m       0.9190        [94m0.2288[0m     +  121.9502
     14   [36m0.4178[0m   [32m0.8199[0m        [35m0.2143[0m       0.9202        [94m0.2251[0m     +  121.6819
     15   [36m0.4231[0m   [32m0.8216[0m        [35m0.2138[0m       0.9214        [94m0.2244[0m     +  121.2588
     16   0.4164   [32m0.8248[0m        [35m0.2127[0m       0.9202        [94m0.2233[0m     +  121.6439
     17   0.4169   [32m0.8253[0m        [35m0.2112[0m       0.9202        0.2236        121.4852
     18   0.4188   [32m0.8273[0m        [35m0.2099[0m       0.9190        [94m0.2224[0m     +  121.6614
     19   0.4201   [32m0.8299[0m        [35m0.2099[0m       0.9202        [94m0.2210[0m     +  121.1740
     20   0.4194   [32m0.8320[0m        [35m0.2076[0m       0.9226        [94m0.2206[0m     +  121.3994
     21   0.4198   [32m0.8322[0m        [35m0.2066[0m       0.9214        0.2213        121.6892
     22   0.4199   [32m0.8325[0m        0.2069       0.9202        [94m0.2201[0m     +  121.7725
     23   0.4196   [32m0.8343[0m        [35m0.2046[0m       0.9214        [94m0.2200[0m     +  121.3387
     24   0.4106   0.8329        [35m0.2038[0m       0.9190        0.2205        121.5798
     25   0.4118   [32m0.8351[0m        0.2044       0.9214        0.2206        122.0507
     26   0.4076   0.8347        [35m0.2029[0m       0.9190        0.2212        121.6037
     27   0.4095   [32m0.8368[0m        [35m0.2027[0m       0.9190        0.2207        121.8084
     28   0.4095   0.8365        [35m0.2004[0m       0.9190        0.2222        121.7133
     29   0.4023   0.8359        [35m0.1987[0m       0.9214        0.2229        121.8517
     30   0.3970   0.8350        0.1996       0.9190        0.2244        121.7173
     31   0.3948   0.8348        [35m0.1983[0m       0.9214        0.2250        122.0690
     32   0.3896   0.8346        [35m0.1970[0m       0.9190        0.2255        121.5530
Stopping since valid_loss has not improved in the last 10 epochs.
