[32m[I 2023-05-02 13:43:52,206][0m Trial 136 finished with value: 0.26469792303107814 and parameters: {'lr': 0.007380085261040127, 'dropout': 0.38824384985369376, 'd_model_multiplier': 4, 'num_layers': 1, 'n_heads': 32, 'dim_feedforward': 417, 'batch_size': 34, 'pos_encoding': 'learnable', 'activation': 'gelu', 'norm': 'LayerNorm', 'optimizer_name': 'PlainRAdam', 'weight_decay': 0, 'top_n_features': 227}. Best is trial 117 with value: 0.191397856754288.[0m
[FileBasedDataset] Initializing dataset...
	Examples: 8264
	Features: 166
	Max length: 315
Standard scalar turned ON, loading params from cache
[FileBasedDataset] Dataset initialization complete
  epoch    auprc    auroc    train_loss    valid_acc    valid_loss    cp      dur
-------  -------  -------  ------------  -----------  ------------  ----  -------
      1   [36m0.1165[0m   [32m0.6537[0m        [35m0.2927[0m       [31m0.7110[0m        [94m0.5871[0m     +  21.0054
      2   0.1014   0.5970        [35m0.2650[0m       0.6796        0.6235        21.1560
      3   0.0986   0.5759        [35m0.2643[0m       0.3108        0.8718        21.2671
      4   0.0933   0.5513        0.2671       [31m0.8089[0m        [94m0.4715[0m     +  21.2115
      5   [36m0.1659[0m   [32m0.7112[0m        [35m0.2626[0m       [31m0.8222[0m        [94m0.4301[0m     +  21.1542
      6   [36m0.2300[0m   [32m0.7205[0m        [35m0.2599[0m       [31m0.8682[0m        [94m0.3525[0m     +  21.1924
      7   0.2220   [32m0.7468[0m        [35m0.2549[0m       [31m0.9202[0m        [94m0.2606[0m     +  21.9252
      8   0.2242   [32m0.7521[0m        0.2555       0.9190        0.2646        21.0718
      9   [36m0.2351[0m   0.7478        [35m0.2461[0m       0.9154        0.2647        21.2047
     10   [36m0.2560[0m   [32m0.7687[0m        0.2554       [31m0.9226[0m        [94m0.2524[0m     +  20.9527
     11   [36m0.2876[0m   0.7632        0.2469       0.9190        0.2604        21.3126
     12   0.2699   0.7657        0.2516       0.9202        [94m0.2523[0m     +  21.1531
     13   [36m0.3148[0m   0.7597        0.2541       [31m0.9250[0m        [94m0.2488[0m     +  21.0418
     14   [36m0.3199[0m   [32m0.7857[0m        [35m0.2431[0m       0.9226        [94m0.2413[0m     +  21.2423
     15   [36m0.3714[0m   [32m0.7919[0m        0.2439       [31m0.9287[0m        [94m0.2337[0m     +  21.1800
     16   0.3172   0.7842        [35m0.2416[0m       0.9202        0.2357        21.0487
     17   0.3472   0.7835        [35m0.2374[0m       0.9250        0.2383        21.2512
     18   0.2763   0.7746        0.2431       0.9178        0.2733        21.1849
     19   0.3065   [32m0.8226[0m        0.2409       0.9093        0.2704        21.2072
     20   0.3028   0.7676        0.2422       0.9250        0.2618        21.0817
     21   0.2524   0.7594        [35m0.2374[0m       0.9238        0.2532        21.2136
     22   0.3328   0.7972        [35m0.2342[0m       0.9226        0.2362        21.1601
     23   0.3623   0.7692        [35m0.2315[0m       0.9274        0.2613        21.1922
     24   0.2979   0.8065        [35m0.2299[0m       0.9033        0.2656        21.0793
Stopping since valid_loss has not improved in the last 10 epochs.
[32m[I 2023-05-02 13:52:44,355][0m Trial 137 finished with value: 0.23371332960412752 and parameters: {'lr': 0.0002512225712186015, 'dropout': 0.33480419205081946, 'd_model_multiplier': 16, 'num_layers': 3, 'n_heads': 32, 'dim_feedforward': 266, 'batch_size': 20, 'pos_encoding': 'learnable', 'activation': 'gelu', 'norm': 'BatchNorm', 'optimizer_name': 'AdamW', 'weight_decay': 0, 'top_n_features': 166}. Best is trial 117 with value: 0.191397856754288.[0m
[FileBasedDataset] Initializing dataset...
	Examples: 8264
	Features: 157
	Max length: 315
Standard scalar turned ON, loading params from cache
[FileBasedDataset] Dataset initialization complete
  epoch    auprc    auroc    train_loss    valid_acc    valid_loss    cp     dur
-------  -------  -------  ------------  -----------  ------------  ----  ------
      1   [36m0.3124[0m   [32m0.7931[0m        [35m0.2891[0m       [31m0.9166[0m        [94m0.2461[0m     +  8.9594
      2   0.3018   0.7477        [35m0.2485[0m       0.9141        0.2730        8.3671
      3   0.2889   0.7283        0.2505       0.9117        0.2859        8.7291
      4   0.2990   0.7364        [35m0.2435[0m       0.9154        0.2630        9.0259
      5   [36m0.3134[0m   0.7438        [35m0.2402[0m       0.9129        0.2601        8.8228
      6   [36m0.3339[0m   0.7749        [35m0.2361[0m       0.9166        0.2515        8.7623
      7   0.3206   0.7570        [35m0.2338[0m       [31m0.9202[0m        0.2607        8.7742
      8   [36m0.3441[0m   0.7501        0.2338       [31m0.9214[0m        0.2778        8.9534
      9   0.3339   0.7722        [35m0.2303[0m       0.9154        0.2511        8.9997
     10   [36m0.3516[0m   [32m0.7987[0m        0.2308       [31m0.9238[0m        [94m0.2433[0m     +  8.8719
     11   0.3419   0.7901        [35m0.2295[0m       0.9141        0.2514        8.9552
     12   0.3186   0.7729        [35m0.2289[0m       0.9141        0.2588        9.1971
     13   0.3328   [32m0.8116[0m        [35m0.2285[0m       0.9141        0.2698        9.2500
     14   0.2874   0.7706        [35m0.2269[0m       0.9129        0.3029        8.9947
     15   0.2915   0.7843        0.2332       0.9129        0.2947        9.2021
     16   0.3091   [32m0.8205[0m        0.2332       0.9141        0.2439        8.8855
     17   0.3110   0.7764        0.2270       0.9202        0.2720        9.0478
     18   0.3324   0.7880        [35m0.2268[0m       0.9141        0.2929        9.0451
     19   0.3437   0.8114        [35m0.2240[0m       0.9190        0.2436        8.9515
Stopping since valid_loss has not improved in the last 10 epochs.
[32m[I 2023-05-02 13:55:44,062][0m Trial 138 finished with value: 0.2432581794233103 and parameters: {'lr': 0.00045896663389847597, 'dropout': 0.34673269044945654, 'd_model_multiplier': 64, 'num_layers': 2, 'n_heads': 4, 'dim_feedforward': 456, 'batch_size': 40, 'pos_encoding': 'learnable', 'activation': 'relu', 'norm': 'LayerNorm', 'optimizer_name': 'PlainRAdam', 'weight_decay': 0, 'top_n_features': 157}. Best is trial 117 with value: 0.191397856754288.[0m
[FileBasedDataset] Initializing dataset...
	Examples: 8264
	Features: 138
	Max length: 315
Standard scalar turned ON, loading params from cache
[FileBasedDataset] Dataset initialization complete
  epoch    auprc    auroc    train_loss    valid_acc    valid_loss    cp     dur
-------  -------  -------  ------------  -----------  ------------  ----  ------
      1   [36m0.2423[0m   [32m0.7202[0m        [35m0.2933[0m       [31m0.9045[0m        [94m0.2942[0m     +  8.0422
      2   [36m0.2531[0m   [32m0.7282[0m        [35m0.2553[0m       0.9008        [94m0.2906[0m     +  8.4035
      3   [36m0.2776[0m   0.7224        [35m0.2504[0m       0.9008        [94m0.2849[0m     +  8.7695
      4   0.2772   0.7259        [35m0.2425[0m       0.9033        [94m0.2830[0m     +  8.8103
      5   0.2747   0.7032        [35m0.2403[0m       [31m0.9057[0m        0.2884        8.7093
      6   [36m0.2856[0m   0.6935        [35m0.2397[0m       [31m0.9069[0m        0.2894        8.7641
      7   [36m0.3242[0m   [32m0.7342[0m        [35m0.2358[0m       [31m0.9093[0m        [94m0.2764[0m     +  8.7376
      8   [36m0.3381[0m   0.7295        [35m0.2334[0m       [31m0.9117[0m        [94m0.2764[0m     +  9.0960
      9   [36m0.3560[0m   0.7180        [35m0.2307[0m       0.9117        0.2785        10.0135
     10   [36m0.3587[0m   0.7171        [35m0.2306[0m       0.9117        0.2783        9.6738
     11   [36m0.3695[0m   [32m0.7378[0m        [35m0.2265[0m       0.9117        [94m0.2741[0m     +  9.2221
     12   [36m0.3697[0m   0.7309        0.2300       [31m0.9129[0m        [94m0.2737[0m     +  8.9600
     13   [36m0.3705[0m   0.7191        0.2272       [31m0.9141[0m        0.2750        9.0598
     14   [36m0.3741[0m   0.7325        [35m0.2251[0m       0.9141        [94m0.2734[0m     +  8.8118
     15   [36m0.3837[0m   0.7302        [35m0.2244[0m       0.9141        [94m0.2711[0m     +  8.9812
     16   0.3795   0.7371        [35m0.2228[0m       0.9105        0.2711        8.9979
     17   0.3771   0.7261        [35m0.2209[0m       0.9141        0.2746        8.7192
     18   [36m0.3978[0m   [32m0.7445[0m        [35m0.2207[0m       [31m0.9154[0m        [94m0.2659[0m     +  8.8069
     19   [36m0.4007[0m   [32m0.7472[0m        0.2212       0.9154        0.2682        8.8502
     20   0.3975   0.7466        [35m0.2187[0m       0.9117        0.2659        8.9749
     21   0.3981   0.7430        [35m0.2169[0m       0.9141        0.2704        8.9208
     22   0.3930   0.7334        0.2176       0.9117        0.2718        8.7697
     23   0.3951   0.7385        [35m0.2148[0m       0.9117        0.2709        8.8108
     24   [36m0.4261[0m   [32m0.7789[0m        0.2155       0.9141        [94m0.2593[0m     +  8.9261
     25   0.4003   0.7404        0.2163       0.9154        0.2694        8.9396
     26   0.4200   0.7646        [35m0.2139[0m       0.9154        0.2630        8.8208
     27   0.4231   0.7644        0.2157       0.9117        0.2610        8.7929
     28   0.4247   0.7498        [35m0.2133[0m       [31m0.9166[0m        0.2679        8.8773
     29   0.4127   0.7470        [35m0.2127[0m       0.9166        0.2667        8.9125
     30   [36m0.4275[0m   0.7594        0.2140       [31m0.9190[0m        0.2628        8.6409
     31   0.4137   0.7520        0.2169       0.9166        0.2659        8.8453
     32   0.4192   0.7672        [35m0.2112[0m       0.9166        0.2627        8.9035
     33   0.4160   0.7554        [35m0.2110[0m       0.9154        0.2653        9.2186
Stopping since valid_loss has not improved in the last 10 epochs.
[32m[I 2023-05-02 14:00:48,123][0m Trial 139 finished with value: 0.25926623681724575 and parameters: {'lr': 0.000776160476222672, 'dropout': 0.41566220459881564, 'd_model_multiplier': 1, 'num_layers': 1, 'n_heads': 4, 'dim_feedforward': 479, 'batch_size': 28, 'pos_encoding': 'learnable', 'activation': 'gelu', 'norm': 'BatchNorm', 'optimizer_name': 'AdamW', 'weight_decay': 0.1, 'top_n_features': 138}. Best is trial 117 with value: 0.191397856754288.[0m
[FileBasedDataset] Initializing dataset...
	Examples: 8264
	Features: 150
	Max length: 315
Standard scalar turned ON, loading params from cache
[FileBasedDataset] Dataset initialization complete
  epoch    auprc    auroc    train_loss    valid_acc    valid_loss    cp      dur
-------  -------  -------  ------------  -----------  ------------  ----  -------
      1   [36m0.1954[0m   [32m0.5362[0m        [35m0.3914[0m       [31m0.9214[0m        [94m0.3282[0m     +  21.1954
      2   [36m0.2432[0m   [32m0.7502[0m        [35m0.3532[0m       0.8815        0.3911        21.2988
      3   0.2380   0.7403        [35m0.2891[0m       0.9057        [94m0.2912[0m     +  21.4528
      4   0.2402   0.7243        [35m0.2887[0m       0.9202        [94m0.2785[0m     +  21.4530
      5   0.2309   0.7182        [35m0.2656[0m       0.9202        [94m0.2573[0m     +  21.3918
      6   0.2211   0.7396        [35m0.2610[0m       0.9202        [94m0.2570[0m     +  21.1914
      7   0.2301   0.7333        [35m0.2593[0m       0.9202        [94m0.2555[0m     +  21.2813
      8   0.2254   0.7369        [35m0.2581[0m       0.9190        0.2596        21.2337
      9   0.2271   0.7363        [35m0.2573[0m       0.9202        0.2588        21.2890
     10   0.2192   0.7465        [35m0.2572[0m       0.9129        0.2594        21.1977
     11   0.2346   0.7483        [35m0.2554[0m       0.9081        0.2658        21.4492
     12   0.2198   0.7362        0.2581       0.8984        0.2680        21.3057
     13   0.2228   [32m0.7532[0m        0.2560       0.9033        0.2630        21.3903
     14   0.2357   0.7513        0.2558       0.8912        0.2805        21.4378
     15   [36m0.2463[0m   0.7478        0.2565       0.8791        0.2951        21.4030
     16   0.2355   [32m0.7565[0m        0.2557       0.8791        0.2948        21.3410
Stopping since valid_loss has not improved in the last 10 epochs.
[32m[I 2023-05-02 14:06:53,476][0m Trial 140 finished with value: 0.2554762654429912 and parameters: {'lr': 0.0022320041475178696, 'dropout': 0.2897773138723362, 'd_model_multiplier': 32, 'num_layers': 2, 'n_heads': 32, 'dim_feedforward': 142, 'batch_size': 34, 'pos_encoding': 'learnable', 'activation': 'relu', 'norm': 'LayerNorm', 'optimizer_name': 'RAdam', 'weight_decay': 0, 'top_n_features': 150}. Best is trial 117 with value: 0.191397856754288.[0m
[FileBasedDataset] Initializing dataset...
	Examples: 8264
	Features: 190
	Max length: 315
Standard scalar turned ON, loading params from cache
[FileBasedDataset] Dataset initialization complete
  epoch    auprc    auroc    train_loss    valid_acc    valid_loss    cp     dur
-------  -------  -------  ------------  -----------  ------------  ----  ------
      1   [36m0.2101[0m   [32m0.6390[0m        [35m0.3730[0m       [31m0.9166[0m        [94m0.3499[0m     +  8.7787
      2   [36m0.2212[0m   [32m0.6872[0m        [35m0.2667[0m       0.9141        [94m0.3092[0m     +  9.6984
      3   [36m0.2532[0m   [32m0.7263[0m        [35m0.2561[0m       0.9154        [94m0.2997[0m     +  9.9776
      4   [36m0.2840[0m   [32m0.7289[0m        [35m0.2522[0m       0.9166        [94m0.2749[0m     +  9.6818
      5   [36m0.2871[0m   [32m0.7319[0m        [35m0.2429[0m       0.9154        [94m0.2686[0m     +  10.1025
      6   [36m0.2914[0m   [32m0.7503[0m        0.2455       0.9129        [94m0.2605[0m     +  10.2352
      7   [36m0.2953[0m   [32m0.7657[0m        [35m0.2378[0m       0.9141        [94m0.2570[0m     +  9.9611
      8   [36m0.3001[0m   [32m0.7730[0m        [35m0.2347[0m       0.9117        0.2595        9.8223
      9   [36m0.3045[0m   [32m0.7796[0m        0.2359       0.9105        [94m0.2557[0m     +  9.9807
     10   0.3012   [32m0.7963[0m        [35m0.2326[0m       0.9129        [94m0.2492[0m     +  10.1148
     11   [36m0.3057[0m   [32m0.7984[0m        [35m0.2280[0m       0.9081        [94m0.2468[0m     +  10.0294
     12   0.3000   0.7960        [35m0.2261[0m       0.9105        0.2483        9.8640
     13   0.3030   [32m0.8038[0m        [35m0.2256[0m       0.9117        [94m0.2434[0m     +  10.0873
     14   [36m0.3162[0m   [32m0.8071[0m        0.2285       0.9105        [94m0.2419[0m     +  10.3488
     15   0.3147   0.8036        [35m0.2249[0m       0.9117        0.2421        9.9740
     16   0.3103   0.8051        [35m0.2247[0m       0.9105        0.2428        10.0693
     17   0.3039   0.8044        [35m0.2193[0m       0.9129        0.2443        10.1825
     18   0.3051   0.8035        0.2193       0.9105        0.2444        10.2215
     19   0.3027   0.8005        [35m0.2174[0m       0.9093        0.2435        9.7713
     20   0.3062   0.8070        0.2189       0.9129        0.2428        10.0153
     21   [36m0.3186[0m   0.8066        0.2191       0.9141        [94m0.2406[0m     +  10.1134
     22   0.3121   [32m0.8074[0m        0.2188       0.9141        0.2449        10.2050
     23   0.3072   0.8037        0.2181       0.9117        0.2425        9.9698
     24   0.2970   0.8044        0.2194       0.9093        0.2433        9.8266
     25   0.2955   0.8015        [35m0.2143[0m       0.9105        0.2454        9.8501
     26   0.3071   0.8064        0.2154       0.9117        0.2417        9.9003
     27   0.2815   0.7904        [35m0.2119[0m       0.9093        0.2486        9.8176
     28   0.2863   0.7904        0.2158       0.9141        0.2497        9.9245
     29   0.2589   0.7719        0.2123       0.9081        0.2564        10.0144
     30   0.3067   0.8069        0.2164       0.9117        0.2439        9.8988
Stopping since valid_loss has not improved in the last 10 epochs.
[32m[I 2023-05-02 14:12:02,547][0m Trial 141 finished with value: 0.24057038972534897 and parameters: {'lr': 0.0011486480319960924, 'dropout': 0.5429987978371931, 'd_model_multiplier': 1, 'num_layers': 2, 'n_heads': 16, 'dim_feedforward': 458, 'batch_size': 55, 'pos_encoding': 'fixed', 'activation': 'gelu', 'norm': 'BatchNorm', 'optimizer_name': 'PlainRAdam', 'weight_decay': 0.1, 'top_n_features': 190}. Best is trial 117 with value: 0.191397856754288.[0m
[FileBasedDataset] Initializing dataset...
	Examples: 8264
	Features: 172
	Max length: 315
Standard scalar turned ON, loading params from cache
[FileBasedDataset] Dataset initialization complete
  epoch    auprc    auroc    train_loss    valid_acc    valid_loss    cp     dur
-------  -------  -------  ------------  -----------  ------------  ----  ------
      1   [36m0.3007[0m   [32m0.8064[0m        [35m0.3609[0m       [31m0.9311[0m        [94m0.2373[0m     +  8.6900
      2   [36m0.3291[0m   0.8024        [35m0.2539[0m       [31m0.9323[0m        [94m0.2258[0m     +  8.6169
      3   0.3256   0.7941        [35m0.2490[0m       [31m0.9335[0m        [94m0.2154[0m     +  9.4159
      4   0.3023   0.7997        [35m0.2410[0m       0.9299        0.2195        9.4619
      5   0.2783   0.7877        [35m0.2369[0m       0.9299        0.2215        9.2883
      6   0.2683   0.7947        [35m0.2315[0m       0.9311        0.2211        9.2598
      7   0.2494   0.7805        [35m0.2270[0m       0.9262        0.2253        9.3533
      8   0.2554   0.7809        [35m0.2255[0m       0.9274        0.2255        9.1066
      9   0.2356   0.7764        [35m0.2209[0m       0.9226        0.2380        9.3418
     10   0.2356   0.7929        0.2212       0.9226        0.2284        9.4526
     11   0.2092   0.7819        [35m0.2161[0m       0.9190        0.2424        9.7903
     12   0.2095   0.7733        [35m0.2159[0m       0.9154        0.2440        9.6207
Stopping since valid_loss has not improved in the last 10 epochs.
[32m[I 2023-05-02 14:14:03,822][0m Trial 142 finished with value: 0.21544783475032886 and parameters: {'lr': 0.00036075392707762556, 'dropout': 0.3584929436441342, 'd_model_multiplier': 16, 'num_layers': 3, 'n_heads': 4, 'dim_feedforward': 445, 'batch_size': 61, 'pos_encoding': 'fixed', 'activation': 'gelu', 'norm': 'BatchNorm', 'optimizer_name': 'PlainRAdam', 'weight_decay': 0.1, 'top_n_features': 172}. Best is trial 117 with value: 0.191397856754288.[0m
[FileBasedDataset] Initializing dataset...
	Examples: 8264
	Features: 173
	Max length: 315
Standard scalar turned ON, loading params from cache
[FileBasedDataset] Dataset initialization complete
  epoch    auprc    auroc    train_loss    valid_acc    valid_loss    cp     dur
-------  -------  -------  ------------  -----------  ------------  ----  ------
      1   [36m0.1874[0m   [32m0.6581[0m        [35m0.3647[0m       [31m0.9262[0m        [94m0.2922[0m     +  8.7153
      2   [36m0.2116[0m   [32m0.7050[0m        [35m0.2550[0m       [31m0.9274[0m        [94m0.2779[0m     +  9.0579
      3   0.2073   [32m0.7096[0m        [35m0.2452[0m       0.9238        [94m0.2646[0m     +  9.1072
      4   0.2090   [32m0.7163[0m        [35m0.2417[0m       0.9202        [94m0.2587[0m     +  9.3445
      5   [36m0.2174[0m   [32m0.7194[0m        [35m0.2390[0m       0.9238        0.2612        9.4210
      6   [36m0.2197[0m   [32m0.7316[0m        [35m0.2331[0m       0.9262        [94m0.2538[0m     +  9.5525
      7   [36m0.2432[0m   0.7226        [35m0.2320[0m       0.9262        [94m0.2522[0m     +  9.7575
      8   0.2323   0.7187        [35m0.2302[0m       0.9274        0.2533        9.8478
      9   [36m0.2454[0m   0.7248        [35m0.2270[0m       0.9274        [94m0.2511[0m     +  9.4768
     10   0.2420   0.7286        [35m0.2250[0m       [31m0.9299[0m        [94m0.2438[0m     +  9.5335
     11   [36m0.2585[0m   [32m0.7409[0m        0.2252       0.9274        [94m0.2407[0m     +  9.4802
     12   0.2442   0.7290        [35m0.2236[0m       0.9202        0.2487        9.4891
     13   [36m0.2636[0m   0.7316        [35m0.2209[0m       0.9202        0.2572        9.4325
     14   0.2543   0.7326        [35m0.2187[0m       0.9226        0.2453        9.7556
     15   0.2393   0.7265        [35m0.2169[0m       0.9214        0.2553        9.3564
     16   0.2396   0.7350        [35m0.2115[0m       0.9238        0.2458        9.7095
     17   0.2302   0.7269        [35m0.2100[0m       0.9238        0.2609        9.5308
     18   0.2464   0.7296        [35m0.2041[0m       0.9226        0.2494        9.5742
     19   0.2259   0.7219        0.2046       0.9226        0.2539        9.7284
     20   0.2297   0.7296        [35m0.1989[0m       0.9190        0.2600        9.5246
Stopping since valid_loss has not improved in the last 10 epochs.
