[32m[I 2023-05-04 00:49:03,413][0m Trial 390 finished with value: 0.22182342552432413 and parameters: {'lr': 4.315808071204189e-05, 'dropout': 0.27709756905920857, 'd_model_multiplier': 4, 'num_layers': 4, 'n_heads': 32, 'dim_feedforward': 310, 'batch_size': 113, 'pos_encoding': 'fixed', 'activation': 'relu', 'norm': 'LayerNorm', 'optimizer_name': 'AdamW', 'weight_decay': 0.001, 'top_n_features': 63}. Best is trial 246 with value: 0.16447311791139763.[0m
[FileBasedDataset] Initializing dataset...
	Examples: 8264
	Features: 93
	Max length: 315
Standard scalar turned ON, loading params from cache
[FileBasedDataset] Dataset initialization complete
  epoch    auprc    auroc    train_loss    valid_acc    valid_loss    cp      dur
-------  -------  -------  ------------  -----------  ------------  ----  -------
      1   [36m0.0684[0m   [32m0.4317[0m        [35m0.5724[0m       [31m0.9335[0m        [94m0.4087[0m     +  41.7613
      2   0.0678   [32m0.4489[0m        [35m0.3810[0m       0.9335        [94m0.2837[0m     +  41.8154
      3   [36m0.0757[0m   [32m0.5336[0m        [35m0.3005[0m       0.9335        [94m0.2522[0m     +  41.9142
      4   [36m0.0997[0m   [32m0.5928[0m        [35m0.2735[0m       0.9335        [94m0.2437[0m     +  41.9801
      5   [36m0.1145[0m   [32m0.6233[0m        [35m0.2605[0m       0.9335        [94m0.2403[0m     +  41.9099
      6   [36m0.1277[0m   [32m0.6423[0m        [35m0.2525[0m       0.9335        [94m0.2381[0m     +  41.8997
      7   [36m0.1516[0m   [32m0.6553[0m        [35m0.2488[0m       0.9335        [94m0.2363[0m     +  41.8942
      8   [36m0.1715[0m   [32m0.6679[0m        [35m0.2447[0m       0.9335        [94m0.2343[0m     +  41.8978
      9   [36m0.1889[0m   [32m0.6767[0m        [35m0.2439[0m       0.9335        [94m0.2325[0m     +  41.8945
     10   [36m0.1954[0m   [32m0.6849[0m        [35m0.2404[0m       0.9335        [94m0.2315[0m     +  41.8770
     11   [36m0.2022[0m   [32m0.6910[0m        [35m0.2382[0m       0.9323        0.2316        41.7177
     12   0.2021   [32m0.6944[0m        [35m0.2374[0m       0.9323        0.2323        41.7829
     13   0.1985   [32m0.6964[0m        [35m0.2362[0m       0.9311        0.2331        41.8650
     14   [36m0.2024[0m   [32m0.6994[0m        [35m0.2350[0m       0.9323        0.2340        41.8349
     15   [36m0.2032[0m   [32m0.7014[0m        [35m0.2350[0m       0.9262        0.2347        41.8157
     16   0.1980   [32m0.7034[0m        [35m0.2342[0m       0.9262        0.2357        41.9186
     17   0.1937   [32m0.7048[0m        [35m0.2339[0m       0.9262        0.2363        41.8386
     18   0.1907   [32m0.7069[0m        [35m0.2337[0m       0.9274        0.2367        41.9431
     19   0.1907   [32m0.7081[0m        0.2337       0.9287        0.2373        41.8726
Stopping since valid_loss has not improved in the last 10 epochs.
[32m[I 2023-05-04 01:03:03,117][0m Trial 391 finished with value: 0.23147523124334024 and parameters: {'lr': 2.4584451980423367e-06, 'dropout': 0.4356839891468732, 'd_model_multiplier': 4, 'num_layers': 5, 'n_heads': 64, 'dim_feedforward': 381, 'batch_size': 22, 'pos_encoding': 'fixed', 'activation': 'relu', 'norm': 'LayerNorm', 'optimizer_name': 'RAdam', 'weight_decay': 0.1, 'top_n_features': 93}. Best is trial 246 with value: 0.16447311791139763.[0m
[FileBasedDataset] Initializing dataset...
	Examples: 8264
	Features: 74
	Max length: 315
Standard scalar turned ON, loading params from cache
[FileBasedDataset] Dataset initialization complete
  epoch    auprc    auroc    train_loss    valid_acc    valid_loss    cp      dur
-------  -------  -------  ------------  -----------  ------------  ----  -------
      1   [36m0.0669[0m   [32m0.3741[0m        [35m0.7082[0m       [31m0.7521[0m        [94m0.6589[0m     +  19.7916
      2   0.0653   0.3191        [35m0.6259[0m       [31m0.9190[0m        [94m0.5626[0m     +  20.1517
      3   0.0655   0.3079        [35m0.5316[0m       0.9190        [94m0.4719[0m     +  19.8763
      4   0.0665   0.3159        [35m0.4500[0m       0.9190        [94m0.3990[0m     +  20.0789
      5   [36m0.0692[0m   0.3605        [35m0.3833[0m       0.9190        [94m0.3467[0m     +  20.1817
      6   [36m0.0841[0m   [32m0.4464[0m        [35m0.3361[0m       0.9190        [94m0.3131[0m     +  20.0429
      7   [36m0.1213[0m   [32m0.5202[0m        [35m0.3073[0m       0.9190        [94m0.2932[0m     +  20.1979
      8   [36m0.1525[0m   [32m0.5739[0m        [35m0.2885[0m       0.9190        [94m0.2809[0m     +  20.0055
      9   [36m0.1805[0m   [32m0.6116[0m        [35m0.2761[0m       0.9190        [94m0.2727[0m     +  19.9641
     10   [36m0.2083[0m   [32m0.6416[0m        [35m0.2682[0m       0.9190        [94m0.2669[0m     +  19.8605
     11   [36m0.2332[0m   [32m0.6647[0m        [35m0.2615[0m       0.9190        [94m0.2627[0m     +  19.6679
     12   [36m0.2481[0m   [32m0.6805[0m        [35m0.2579[0m       0.9190        [94m0.2594[0m     +  19.8344
     13   [36m0.2630[0m   [32m0.6949[0m        [35m0.2542[0m       0.9190        [94m0.2566[0m     +  20.0372
     14   [36m0.2631[0m   [32m0.7041[0m        [35m0.2524[0m       0.9190        [94m0.2545[0m     +  20.1509
     15   [36m0.2739[0m   [32m0.7143[0m        [35m0.2479[0m       0.9190        [94m0.2523[0m     +  20.3894
     16   [36m0.2789[0m   [32m0.7232[0m        [35m0.2459[0m       0.9178        [94m0.2505[0m     +  20.0117
     17   [36m0.2830[0m   [32m0.7281[0m        [35m0.2443[0m       0.9178        [94m0.2491[0m     +  19.9854
     18   [36m0.2850[0m   [32m0.7325[0m        [35m0.2426[0m       0.9190        [94m0.2479[0m     +  20.1320
     19   [36m0.2886[0m   [32m0.7370[0m        [35m0.2411[0m       0.9178        [94m0.2469[0m     +  20.1404
     20   [36m0.2897[0m   [32m0.7411[0m        [35m0.2389[0m       [31m0.9202[0m        [94m0.2462[0m     +  20.3221
     21   [36m0.2913[0m   [32m0.7441[0m        [35m0.2381[0m       0.9202        [94m0.2458[0m     +  20.0294
     22   [36m0.2922[0m   [32m0.7460[0m        [35m0.2362[0m       0.9202        [94m0.2454[0m     +  20.2447
     23   0.2915   [32m0.7474[0m        [35m0.2356[0m       0.9202        0.2454        20.0579
     24   0.2909   [32m0.7485[0m        [35m0.2342[0m       0.9202        0.2456        20.3545
     25   0.2904   [32m0.7496[0m        [35m0.2339[0m       0.9202        0.2456        20.0971
     26   [36m0.2987[0m   [32m0.7504[0m        [35m0.2338[0m       0.9202        0.2455        20.0632
     27   0.2900   [32m0.7505[0m        [35m0.2333[0m       [31m0.9214[0m        0.2455        20.0577
     28   0.2974   [32m0.7512[0m        [35m0.2325[0m       0.9214        0.2458        20.1230
     29   0.2967   [32m0.7522[0m        [35m0.2322[0m       0.9214        0.2455        19.8779
     30   0.2975   [32m0.7530[0m        [35m0.2320[0m       0.9214        0.2457        19.9439
     31   0.2975   [32m0.7538[0m        [35m0.2314[0m       0.9202        0.2457        19.9396
Stopping since valid_loss has not improved in the last 10 epochs.
[32m[I 2023-05-04 01:13:46,995][0m Trial 392 finished with value: 0.2453758924244537 and parameters: {'lr': 3.406806682220793e-06, 'dropout': 0.30932169224878875, 'd_model_multiplier': 4, 'num_layers': 4, 'n_heads': 32, 'dim_feedforward': 321, 'batch_size': 57, 'pos_encoding': 'fixed', 'activation': 'relu', 'norm': 'LayerNorm', 'optimizer_name': 'PlainRAdam', 'weight_decay': 0.1, 'top_n_features': 74}. Best is trial 246 with value: 0.16447311791139763.[0m
[FileBasedDataset] Initializing dataset...
	Examples: 8264
	Features: 57
	Max length: 315
Standard scalar turned ON, loading params from cache
[FileBasedDataset] Dataset initialization complete
  epoch    auprc    auroc    train_loss    valid_acc    valid_loss    cp      dur
-------  -------  -------  ------------  -----------  ------------  ----  -------
      1   [36m0.2136[0m   [32m0.7023[0m        [35m0.3112[0m       [31m0.9299[0m        [94m0.2271[0m     +  27.0603
      2   [36m0.2646[0m   [32m0.7485[0m        [35m0.2406[0m       0.9287        [94m0.2168[0m     +  27.1447
      3   [36m0.3008[0m   [32m0.7616[0m        [35m0.2346[0m       [31m0.9347[0m        [94m0.2138[0m     +  27.1578
      4   [36m0.3060[0m   [32m0.7712[0m        [35m0.2313[0m       0.9347        [94m0.2123[0m     +  27.2073
      5   [36m0.3186[0m   [32m0.7754[0m        [35m0.2307[0m       0.9311        [94m0.2119[0m     +  27.1847
      6   0.3135   [32m0.7825[0m        [35m0.2285[0m       0.9323        [94m0.2114[0m     +  27.4066
      7   0.3085   [32m0.7844[0m        0.2301       0.9323        [94m0.2113[0m     +  27.2612
      8   0.3077   [32m0.7873[0m        [35m0.2265[0m       0.9323        [94m0.2112[0m     +  27.2807
      9   0.3178   [32m0.7915[0m        0.2270       0.9311        [94m0.2101[0m     +  27.1807
     10   0.3010   [32m0.7924[0m        0.2267       0.9311        0.2105        27.5885
     11   0.3083   [32m0.7941[0m        [35m0.2260[0m       0.9299        0.2103        27.4995
     12   0.3091   [32m0.7987[0m        [35m0.2245[0m       0.9299        [94m0.2093[0m     +  27.6246
     13   0.3122   [32m0.8015[0m        [35m0.2232[0m       0.9323        [94m0.2084[0m     +  27.2186
     14   0.3072   [32m0.8030[0m        [35m0.2225[0m       0.9311        0.2090        27.3511
     15   [36m0.3263[0m   [32m0.8037[0m        [35m0.2217[0m       0.9311        [94m0.2078[0m     +  27.3127
     16   [36m0.3282[0m   [32m0.8062[0m        [35m0.2202[0m       0.9311        [94m0.2075[0m     +  27.3622
     17   0.3258   [32m0.8082[0m        [35m0.2192[0m       0.9299        0.2086        27.4703
     18   0.3258   [32m0.8101[0m        [35m0.2173[0m       0.9335        [94m0.2075[0m     +  27.2275
     19   0.3260   [32m0.8119[0m        0.2182       0.9311        0.2075        27.3156
     20   [36m0.3288[0m   [32m0.8119[0m        [35m0.2166[0m       0.9323        [94m0.2067[0m     +  27.5451
     21   0.3285   0.8109        0.2166       0.9323        [94m0.2059[0m     +  27.1884
     22   [36m0.3301[0m   [32m0.8148[0m        0.2170       0.9323        [94m0.2057[0m     +  27.3540
     23   0.3201   [32m0.8162[0m        [35m0.2165[0m       0.9323        0.2059        27.3265
     24   0.3291   [32m0.8175[0m        [35m0.2142[0m       0.9347        [94m0.2039[0m     +  27.3622
     25   0.3252   0.8152        0.2143       0.9311        0.2047        27.1334
     26   [36m0.3336[0m   0.8158        0.2151       0.9335        0.2047        27.1565
     27   [36m0.3352[0m   0.8139        [35m0.2130[0m       0.9347        0.2039        27.5346
     28   [36m0.3397[0m   0.8120        [35m0.2122[0m       0.9347        [94m0.2039[0m     +  27.2602
     29   0.3358   0.8127        [35m0.2114[0m       0.9335        0.2046        27.3771
     30   0.3267   0.8118        [35m0.2096[0m       0.9335        0.2057        27.4553
     31   0.3337   0.8127        0.2098       0.9335        0.2044        27.3260
     32   0.3274   0.8126        0.2106       0.9335        0.2048        27.4513
     33   0.3365   0.8114        [35m0.2093[0m       0.9335        0.2050        27.3383
     34   0.3379   0.8152        [35m0.2077[0m       0.9323        [94m0.2028[0m     +  27.4070
     35   0.3348   0.8117        0.2080       0.9335        0.2045        27.3818
     36   0.3381   0.8121        [35m0.2062[0m       [31m0.9359[0m        [94m0.2027[0m     +  27.2949
     37   [36m0.3585[0m   0.8149        0.2066       0.9359        [94m0.2014[0m     +  27.3894
     38   0.3380   0.8103        [35m0.2038[0m       0.9347        0.2043        27.4261
     39   0.3540   0.8098        0.2074       [31m0.9383[0m        0.2027        27.3218
     40   0.3551   0.8065        0.2043       0.9359        0.2034        27.3301
     41   0.3375   0.8061        0.2062       0.9359        0.2038        27.6906
     42   0.3413   0.8113        [35m0.2035[0m       0.9335        0.2038        27.1614
     43   0.3386   0.8093        [35m0.2034[0m       0.9335        0.2046        27.0362
     44   0.3374   0.8074        0.2037       0.9335        0.2044        27.1330
     45   0.3396   0.8053        [35m0.2013[0m       0.9347        0.2052        27.2340
     46   0.3361   0.8010        0.2026       0.9335        0.2065        27.2966
Stopping since valid_loss has not improved in the last 10 epochs.
[32m[I 2023-05-04 01:35:14,029][0m Trial 393 finished with value: 0.2013731892552889 and parameters: {'lr': 2.6483737039536313e-05, 'dropout': 0.3562865553324489, 'd_model_multiplier': 4, 'num_layers': 6, 'n_heads': 32, 'dim_feedforward': 340, 'batch_size': 49, 'pos_encoding': 'fixed', 'activation': 'relu', 'norm': 'LayerNorm', 'optimizer_name': 'AdamW', 'weight_decay': 0.1, 'top_n_features': 57}. Best is trial 246 with value: 0.16447311791139763.[0m
[FileBasedDataset] Initializing dataset...
	Examples: 8264
	Features: 57
	Max length: 315
Standard scalar turned ON, loading params from cache
[FileBasedDataset] Dataset initialization complete
  epoch    auprc    auroc    train_loss    valid_acc    valid_loss    cp      dur
-------  -------  -------  ------------  -----------  ------------  ----  -------
      1   [36m0.0729[0m   [32m0.4142[0m        [35m0.5041[0m       [31m0.9178[0m        [94m0.3306[0m     +  27.0917
      2   [36m0.1621[0m   [32m0.6488[0m        [35m0.2880[0m       0.9178        [94m0.2725[0m     +  27.1948
      3   [36m0.2222[0m   [32m0.6961[0m        [35m0.2498[0m       0.9178        [94m0.2643[0m     +  27.3557
      4   [36m0.2403[0m   [32m0.6996[0m        [35m0.2358[0m       [31m0.9202[0m        0.2658        27.4692
      5   [36m0.2466[0m   [32m0.7084[0m        [35m0.2305[0m       [31m0.9214[0m        0.2652        27.5579
      6   0.2457   [32m0.7181[0m        [35m0.2282[0m       0.9214        0.2643        27.4199
      7   0.2452   [32m0.7246[0m        [35m0.2264[0m       0.9202        0.2648        27.4931
      8   0.2388   [32m0.7313[0m        [35m0.2262[0m       0.9190        0.2647        27.4174
      9   0.2258   0.7312        [35m0.2243[0m       0.9141        0.2679        27.4940
     10   0.2299   [32m0.7399[0m        0.2245       0.9154        0.2656        27.3608
     11   0.2286   [32m0.7422[0m        [35m0.2221[0m       0.9129        0.2678        27.3855
     12   0.2298   [32m0.7459[0m        [35m0.2217[0m       0.9129        0.2662        27.4251
Stopping since valid_loss has not improved in the last 10 epochs.
[32m[I 2023-05-04 01:41:10,601][0m Trial 394 finished with value: 0.2642746649529366 and parameters: {'lr': 2.6275912140884347e-05, 'dropout': 0.36289084033581787, 'd_model_multiplier': 4, 'num_layers': 6, 'n_heads': 32, 'dim_feedforward': 345, 'batch_size': 44, 'pos_encoding': 'fixed', 'activation': 'relu', 'norm': 'LayerNorm', 'optimizer_name': 'RAdam', 'weight_decay': 0.1, 'top_n_features': 57}. Best is trial 246 with value: 0.16447311791139763.[0m
[FileBasedDataset] Initializing dataset...
	Examples: 8264
	Features: 65
	Max length: 315
Standard scalar turned ON, loading params from cache
[FileBasedDataset] Dataset initialization complete
  epoch    auprc    auroc    train_loss    valid_acc    valid_loss    cp      dur
-------  -------  -------  ------------  -----------  ------------  ----  -------
      1   [36m0.2303[0m   [32m0.7524[0m        [35m0.3069[0m       [31m0.9323[0m        [94m0.2242[0m     +  30.8458
      2   [36m0.2336[0m   [32m0.7635[0m        [35m0.2386[0m       0.9190        0.2304        31.0878
      3   0.2271   [32m0.7699[0m        [35m0.2342[0m       0.9214        0.2258        31.3787
      4   0.2244   [32m0.7773[0m        [35m0.2330[0m       0.9166        0.2277        31.1675
      5   0.2300   [32m0.7809[0m        [35m0.2312[0m       0.9250        [94m0.2221[0m     +  31.0307
      6   [36m0.2352[0m   [32m0.7848[0m        [35m0.2297[0m       0.9250        [94m0.2190[0m     +  30.9545
      7   0.2335   0.7834        [35m0.2288[0m       0.9250        0.2211        31.1834
      8   0.2336   0.7842        [35m0.2279[0m       0.9262        [94m0.2178[0m     +  31.1332
      9   0.2298   0.7767        [35m0.2254[0m       0.9250        0.2211        31.8183
     10   0.2335   0.7772        0.2263       0.9299        0.2195        30.9283
     11   [36m0.2392[0m   0.7822        [35m0.2242[0m       0.9250        0.2185        30.9747
     12   0.2391   0.7826        0.2243       0.9238        0.2198        30.9792
     13   [36m0.2476[0m   0.7838        [35m0.2226[0m       0.9250        [94m0.2157[0m     +  31.0312
     14   [36m0.2531[0m   [32m0.7849[0m        [35m0.2198[0m       0.9287        [94m0.2147[0m     +  31.0319
     15   [36m0.2596[0m   [32m0.7902[0m        [35m0.2196[0m       0.9274        0.2150        31.1159
     16   0.2550   0.7878        [35m0.2164[0m       0.9226        0.2171        31.0617
     17   0.2523   0.7858        0.2167       0.9226        0.2207        31.2420
     18   0.2565   0.7860        0.2183       0.9238        0.2172        31.4442
     19   [36m0.2601[0m   0.7854        0.2170       0.9274        0.2152        31.0225
     20   [36m0.2603[0m   0.7877        [35m0.2151[0m       0.9250        0.2180        31.3736
     21   [36m0.2618[0m   [32m0.7905[0m        0.2151       0.9262        0.2157        31.1808
     22   [36m0.2677[0m   [32m0.7919[0m        [35m0.2143[0m       0.9262        [94m0.2139[0m     +  31.0567
     23   [36m0.2721[0m   [32m0.7932[0m        [35m0.2124[0m       0.9287        0.2145        31.1803
     24   0.2677   [32m0.7935[0m        0.2134       0.9262        0.2177        31.2161
     25   0.2680   0.7911        [35m0.2119[0m       0.9262        0.2176        31.0339
     26   0.2543   0.7823        [35m0.2100[0m       0.9250        0.2221        30.9685
     27   0.2715   0.7917        [35m0.2090[0m       0.9238        0.2169        31.3659
     28   0.2671   0.7868        0.2106       0.9250        0.2200        31.1183
     29   0.2667   0.7910        [35m0.2087[0m       0.9274        0.2168        31.1867
     30   0.2672   0.7880        [35m0.2061[0m       0.9238        0.2197        30.9890
     31   0.2656   0.7894        [35m0.2056[0m       0.9262        0.2186        31.0762
Stopping since valid_loss has not improved in the last 10 epochs.
[32m[I 2023-05-04 01:57:48,126][0m Trial 395 finished with value: 0.21393712628024666 and parameters: {'lr': 3.396281769753168e-05, 'dropout': 0.3386430347790712, 'd_model_multiplier': 4, 'num_layers': 7, 'n_heads': 32, 'dim_feedforward': 342, 'batch_size': 51, 'pos_encoding': 'fixed', 'activation': 'relu', 'norm': 'LayerNorm', 'optimizer_name': 'AdamW', 'weight_decay': 0.001, 'top_n_features': 65}. Best is trial 246 with value: 0.16447311791139763.[0m
[FileBasedDataset] Initializing dataset...
	Examples: 8264
	Features: 52
	Max length: 315
Standard scalar turned ON, loading params from cache
[FileBasedDataset] Dataset initialization complete
Warning, assumed runtime error: CUDA out of memory. Tried to allocate 724.00 MiB (GPU 0; 23.70 GiB total capacity; 20.25 GiB already allocated; 125.25 MiB free; 22.48 GiB reserved in total by PyTorch) If reserved memory is >> allocated memory try setting max_split_size_mb to avoid fragmentation.  See documentation for Memory Management and PYTORCH_CUDA_ALLOC_CONF
