[32m[I 2023-05-04 01:57:52,320][0m Trial 396 finished with value: 100.0 and parameters: {'lr': 4.790816791214357e-05, 'dropout': 0.3882878394531471, 'd_model_multiplier': 64, 'num_layers': 5, 'n_heads': 64, 'dim_feedforward': 353, 'batch_size': 49, 'pos_encoding': 'fixed', 'activation': 'relu', 'norm': 'LayerNorm', 'optimizer_name': 'PlainRAdam', 'weight_decay': 0.1, 'top_n_features': 52}. Best is trial 246 with value: 0.16447311791139763.[0m
[FileBasedDataset] Initializing dataset...
	Examples: 8264
	Features: 59
	Max length: 315
Standard scalar turned ON, loading params from cache
[FileBasedDataset] Dataset initialization complete
  epoch    auprc    auroc    train_loss    valid_acc    valid_loss    cp      dur
-------  -------  -------  ------------  -----------  ------------  ----  -------
      1   [36m0.0558[0m   [32m0.3300[0m        [35m0.5608[0m       [31m0.9274[0m        [94m0.4113[0m     +  27.2147
      2   [36m0.1898[0m   [32m0.6569[0m        [35m0.3508[0m       0.9274        [94m0.2660[0m     +  27.1294
      3   [36m0.2695[0m   [32m0.7248[0m        [35m0.2722[0m       [31m0.9287[0m        [94m0.2355[0m     +  27.1940
      4   [36m0.2843[0m   [32m0.7432[0m        [35m0.2489[0m       [31m0.9299[0m        [94m0.2290[0m     +  27.2364
      5   0.2784   [32m0.7486[0m        [35m0.2399[0m       0.9299        [94m0.2274[0m     +  27.5015
      6   [36m0.2870[0m   [32m0.7519[0m        [35m0.2360[0m       0.9250        [94m0.2264[0m     +  27.3955
      7   [36m0.2928[0m   [32m0.7552[0m        [35m0.2343[0m       0.9274        [94m0.2255[0m     +  27.3685
      8   [36m0.2952[0m   [32m0.7578[0m        [35m0.2325[0m       0.9287        [94m0.2248[0m     +  27.1575
      9   0.2883   [32m0.7590[0m        [35m0.2311[0m       [31m0.9311[0m        [94m0.2243[0m     +  27.4377
     10   0.2920   [32m0.7617[0m        [35m0.2292[0m       0.9299        0.2244        27.4769
     11   0.2937   [32m0.7631[0m        0.2294       0.9311        [94m0.2241[0m     +  27.2106
     12   0.2876   [32m0.7645[0m        [35m0.2284[0m       0.9262        0.2243        27.2526
     13   0.2877   [32m0.7666[0m        0.2285       0.9250        0.2242        27.5656
     14   0.2865   [32m0.7674[0m        [35m0.2282[0m       0.9262        0.2246        27.4114
     15   0.2883   [32m0.7678[0m        [35m0.2264[0m       0.9274        0.2241        27.8478
     16   0.2880   [32m0.7699[0m        0.2273       0.9262        0.2253        27.2882
     17   0.2852   [32m0.7704[0m        0.2267       0.9274        0.2242        27.1092
     18   0.2832   [32m0.7711[0m        [35m0.2254[0m       0.9262        0.2250        27.3380
     19   0.2821   0.7697        [35m0.2239[0m       0.9238        0.2263        27.2801
     20   0.2844   [32m0.7715[0m        0.2244       0.9262        0.2249        27.3081
Stopping since valid_loss has not improved in the last 10 epochs.
[32m[I 2023-05-04 02:07:27,803][0m Trial 397 finished with value: 0.2240698867203823 and parameters: {'lr': 1.7987612896397404e-05, 'dropout': 0.33080274711446517, 'd_model_multiplier': 4, 'num_layers': 6, 'n_heads': 32, 'dim_feedforward': 339, 'batch_size': 55, 'pos_encoding': 'fixed', 'activation': 'relu', 'norm': 'LayerNorm', 'optimizer_name': 'RAdam', 'weight_decay': 0, 'top_n_features': 59}. Best is trial 246 with value: 0.16447311791139763.[0m
[FileBasedDataset] Initializing dataset...
	Examples: 8264
	Features: 68
	Max length: 315
Standard scalar turned ON, loading params from cache
[FileBasedDataset] Dataset initialization complete
  epoch    auprc    auroc    train_loss    valid_acc    valid_loss    cp      dur
-------  -------  -------  ------------  -----------  ------------  ----  -------
      1   [36m0.0567[0m   [32m0.3472[0m        [35m0.4677[0m       [31m0.9202[0m        [94m0.3361[0m     +  26.0517
      2   [36m0.1720[0m   [32m0.6196[0m        [35m0.3071[0m       0.9202        [94m0.2737[0m     +  26.5890
      3   [36m0.2552[0m   [32m0.6948[0m        [35m0.2725[0m       0.9202        [94m0.2553[0m     +  26.4169
      4   [36m0.3046[0m   [32m0.7334[0m        [35m0.2607[0m       0.9202        [94m0.2459[0m     +  26.2948
      5   [36m0.3416[0m   [32m0.7665[0m        [35m0.2521[0m       0.9202        [94m0.2375[0m     +  26.4241
      6   [36m0.3535[0m   [32m0.7833[0m        [35m0.2441[0m       0.9190        [94m0.2317[0m     +  26.3405
      7   0.3474   [32m0.7916[0m        [35m0.2399[0m       [31m0.9226[0m        [94m0.2296[0m     +  26.4685
      8   0.3396   [32m0.7938[0m        [35m0.2366[0m       0.9202        [94m0.2296[0m     +  26.3692
      9   0.3308   [32m0.7976[0m        [35m0.2352[0m       0.9214        [94m0.2287[0m     +  26.3321
     10   0.3278   [32m0.7983[0m        [35m0.2333[0m       0.9190        0.2292        26.3114
     11   0.3245   [32m0.8015[0m        [35m0.2325[0m       0.9190        [94m0.2287[0m     +  26.3669
     12   0.3240   [32m0.8033[0m        [35m0.2319[0m       0.9166        0.2289        26.3714
     13   0.3196   [32m0.8047[0m        [35m0.2318[0m       0.9154        0.2291        26.4637
     14   0.3181   [32m0.8048[0m        0.2319       0.9141        0.2295        26.4414
     15   0.3153   0.8043        [35m0.2307[0m       0.9141        0.2300        26.4028
     16   0.3152   [32m0.8049[0m        [35m0.2302[0m       0.9141        0.2303        26.6083
     17   0.3129   0.8044        [35m0.2291[0m       0.9141        0.2308        26.6750
     18   0.3113   0.8045        0.2292       0.9141        0.2309        26.3682
     19   0.3102   [32m0.8049[0m        [35m0.2278[0m       0.9154        0.2311        26.7027
     20   0.3113   [32m0.8052[0m        [35m0.2275[0m       0.9141        0.2310        26.2676
Stopping since valid_loss has not improved in the last 10 epochs.
[32m[I 2023-05-04 02:16:43,660][0m Trial 398 finished with value: 0.22872181603417 and parameters: {'lr': 1.1542560123100077e-05, 'dropout': 0.3554075640206065, 'd_model_multiplier': 2, 'num_layers': 6, 'n_heads': 32, 'dim_feedforward': 334, 'batch_size': 47, 'pos_encoding': 'fixed', 'activation': 'relu', 'norm': 'LayerNorm', 'optimizer_name': 'AdamW', 'weight_decay': 0.1, 'top_n_features': 68}. Best is trial 246 with value: 0.16447311791139763.[0m
[FileBasedDataset] Initializing dataset...
	Examples: 8264
	Features: 55
	Max length: 315
Standard scalar turned ON, loading params from cache
[FileBasedDataset] Dataset initialization complete
  epoch    auprc    auroc    train_loss    valid_acc    valid_loss    cp      dur
-------  -------  -------  ------------  -----------  ------------  ----  -------
      1   [36m0.2384[0m   [32m0.7210[0m        [35m0.3438[0m       [31m0.9154[0m        [94m0.2684[0m     +  27.5005
      2   [36m0.2967[0m   [32m0.7477[0m        [35m0.2377[0m       [31m0.9178[0m        [94m0.2676[0m     +  27.6715
      3   [36m0.3044[0m   [32m0.7540[0m        [35m0.2337[0m       0.9166        [94m0.2651[0m     +  27.5875
      4   0.3019   [32m0.7580[0m        [35m0.2309[0m       0.9178        [94m0.2639[0m     +  27.6774
      5   [36m0.3064[0m   [32m0.7593[0m        [35m0.2301[0m       0.9166        [94m0.2592[0m     +  27.6867
      6   [36m0.3185[0m   0.7576        [35m0.2281[0m       0.9178        [94m0.2584[0m     +  27.4765
      7   [36m0.3377[0m   0.7509        [35m0.2234[0m       [31m0.9190[0m        [94m0.2566[0m     +  27.5271
      8   0.3346   0.7569        0.2243       0.9166        [94m0.2544[0m     +  27.5898
      9   0.3213   0.7500        [35m0.2229[0m       0.9166        [94m0.2543[0m     +  27.6375
     10   0.3201   0.7545        [35m0.2212[0m       0.9190        0.2543        27.7345
     11   0.3277   0.7383        0.2213       0.9178        [94m0.2532[0m     +  27.7730
     12   0.3275   0.7501        [35m0.2188[0m       0.9190        [94m0.2512[0m     +  27.5315
     13   0.3215   0.7450        [35m0.2174[0m       0.9178        0.2528        27.5538
     14   0.3204   [32m0.7604[0m        [35m0.2163[0m       0.9190        [94m0.2503[0m     +  27.7128
     15   0.3119   0.7507        [35m0.2132[0m       [31m0.9202[0m        0.2531        27.7413
     16   0.3208   0.7571        [35m0.2115[0m       [31m0.9214[0m        0.2518        27.6134
     17   0.3161   0.7480        0.2120       0.9202        0.2507        27.4609
     18   0.3205   [32m0.7667[0m        [35m0.2113[0m       0.9214        [94m0.2482[0m     +  27.7941
     19   0.3067   0.7598        [35m0.2076[0m       0.9214        0.2500        27.6501
     20   0.2989   0.7639        0.2076       0.9190        0.2515        27.6461
     21   0.2960   0.7597        [35m0.2062[0m       0.9178        0.2532        27.5255
     22   0.2923   0.7507        [35m0.2040[0m       0.9178        0.2550        27.6574
     23   0.3049   0.7469        [35m0.2033[0m       0.9214        0.2562        27.7797
     24   0.2855   0.7560        [35m0.2004[0m       0.9202        0.2541        27.5933
     25   0.2929   0.7590        0.2008       0.9202        0.2548        27.7434
     26   0.2772   0.7463        [35m0.1974[0m       0.9166        0.2605        27.7145
     27   0.2810   0.7527        0.1981       0.9166        0.2589        28.3372
Stopping since valid_loss has not improved in the last 10 epochs.
[32m[I 2023-05-04 02:29:40,012][0m Trial 399 finished with value: 0.24816494845439474 and parameters: {'lr': 6.424949898765184e-05, 'dropout': 0.34683575220269525, 'd_model_multiplier': 4, 'num_layers': 6, 'n_heads': 32, 'dim_feedforward': 326, 'batch_size': 27, 'pos_encoding': 'fixed', 'activation': 'relu', 'norm': 'LayerNorm', 'optimizer_name': 'PlainRAdam', 'weight_decay': 0.1, 'top_n_features': 55}. Best is trial 246 with value: 0.16447311791139763.[0m
[FileBasedDataset] Initializing dataset...
	Examples: 8264
	Features: 61
	Max length: 315
Standard scalar turned ON, loading params from cache
[FileBasedDataset] Dataset initialization complete
  epoch    auprc    auroc    train_loss    valid_acc    valid_loss    cp      dur
-------  -------  -------  ------------  -----------  ------------  ----  -------
      1   [36m0.0554[0m   [32m0.3292[0m        [35m0.6333[0m       [31m0.9226[0m        [94m0.5678[0m     +  27.0620
      2   [36m0.0591[0m   [32m0.3522[0m        [35m0.5163[0m       0.9226        [94m0.4250[0m     +  27.3565
      3   [36m0.0669[0m   [32m0.3768[0m        [35m0.4094[0m       0.9226        [94m0.3454[0m     +  27.3799
      4   [36m0.0728[0m   [32m0.4372[0m        [35m0.3444[0m       0.9226        [94m0.3064[0m     +  27.6908
      5   [36m0.0971[0m   [32m0.5104[0m        [35m0.3048[0m       0.9226        [94m0.2858[0m     +  27.3734
      6   [36m0.1188[0m   [32m0.5657[0m        [35m0.2824[0m       0.9226        [94m0.2749[0m     +  27.4649
      7   [36m0.1404[0m   [32m0.6049[0m        [35m0.2707[0m       0.9226        [94m0.2691[0m     +  27.5148
      8   [36m0.1593[0m   [32m0.6332[0m        [35m0.2619[0m       0.9214        [94m0.2652[0m     +  27.3164
      9   [36m0.1769[0m   [32m0.6559[0m        [35m0.2545[0m       0.9214        [94m0.2627[0m     +  27.3791
     10   [36m0.1866[0m   [32m0.6714[0m        [35m0.2516[0m       0.9226        [94m0.2606[0m     +  27.3207
     11   [36m0.1956[0m   [32m0.6852[0m        [35m0.2470[0m       0.9226        [94m0.2588[0m     +  27.2799
     12   [36m0.2017[0m   [32m0.6949[0m        [35m0.2437[0m       [31m0.9250[0m        [94m0.2577[0m     +  27.3358
     13   [36m0.2080[0m   [32m0.7033[0m        [35m0.2418[0m       0.9226        [94m0.2569[0m     +  27.4451
     14   [36m0.2096[0m   [32m0.7080[0m        [35m0.2390[0m       0.9166        [94m0.2564[0m     +  27.2971
     15   [36m0.2125[0m   [32m0.7114[0m        [35m0.2385[0m       0.9166        [94m0.2561[0m     +  27.6057
     16   [36m0.2167[0m   [32m0.7154[0m        [35m0.2374[0m       0.9141        [94m0.2556[0m     +  27.4402
     17   [36m0.2169[0m   [32m0.7189[0m        [35m0.2362[0m       0.9141        [94m0.2550[0m     +  27.4989
     18   0.2161   [32m0.7217[0m        [35m0.2355[0m       0.9129        [94m0.2547[0m     +  27.4115
     19   [36m0.2181[0m   [32m0.7246[0m        [35m0.2348[0m       0.9117        [94m0.2541[0m     +  27.4603
     20   [36m0.2191[0m   [32m0.7276[0m        [35m0.2339[0m       0.9117        [94m0.2537[0m     +  27.5007
     21   [36m0.2193[0m   [32m0.7300[0m        0.2347       0.9093        [94m0.2534[0m     +  27.5537
     22   [36m0.2202[0m   [32m0.7316[0m        [35m0.2326[0m       0.9081        [94m0.2532[0m     +  27.2511
     23   [36m0.2217[0m   [32m0.7338[0m        [35m0.2318[0m       0.9081        0.2532        27.4560
     24   0.2190   [32m0.7356[0m        0.2323       0.9081        [94m0.2530[0m     +  27.7596
     25   0.2205   [32m0.7376[0m        0.2326       0.9093        0.2532        27.4950
     26   0.2189   [32m0.7386[0m        0.2318       0.9093        [94m0.2529[0m     +  27.4329
     27   0.2206   [32m0.7401[0m        [35m0.2312[0m       0.9117        [94m0.2528[0m     +  27.5223
     28   0.2188   [32m0.7408[0m        [35m0.2298[0m       0.9081        0.2538        27.6275
     29   0.2200   [32m0.7413[0m        [35m0.2294[0m       0.9093        0.2534        27.5478
     30   0.2200   [32m0.7418[0m        [35m0.2292[0m       0.9081        0.2534        27.4578
     31   [36m0.2224[0m   [32m0.7434[0m        [35m0.2287[0m       0.9081        0.2534        27.6347
     32   [36m0.2229[0m   [32m0.7440[0m        0.2305       0.9093        0.2534        27.6602
     33   0.2215   [32m0.7443[0m        0.2294       0.9081        0.2534        27.3683
     34   0.2212   [32m0.7454[0m        [35m0.2277[0m       0.9081        0.2531        27.2095
     35   0.2213   0.7452        [35m0.2277[0m       0.9117        0.2535        27.3182
     36   0.2200   [32m0.7459[0m        0.2287       0.9093        0.2539        27.3269
Stopping since valid_loss has not improved in the last 10 epochs.
[32m[I 2023-05-04 02:46:38,531][0m Trial 400 finished with value: 0.25276195622773384 and parameters: {'lr': 5.759418775944202e-06, 'dropout': 0.492112234050635, 'd_model_multiplier': 4, 'num_layers': 6, 'n_heads': 32, 'dim_feedforward': 366, 'batch_size': 54, 'pos_encoding': 'fixed', 'activation': 'relu', 'norm': 'LayerNorm', 'optimizer_name': 'RAdam', 'weight_decay': 0.1, 'top_n_features': 61}. Best is trial 246 with value: 0.16447311791139763.[0m
[FileBasedDataset] Initializing dataset...
	Examples: 8264
	Features: 83
	Max length: 315
Standard scalar turned ON, loading params from cache
[FileBasedDataset] Dataset initialization complete
  epoch    auprc    auroc    train_loss    valid_acc    valid_loss    cp       dur
-------  -------  -------  ------------  -----------  ------------  ----  --------
      1   [36m0.2783[0m   [32m0.7976[0m        [35m0.2898[0m       [31m0.9335[0m        [94m0.2164[0m     +  118.4394
      2   [36m0.3141[0m   0.7959        [35m0.2754[0m       0.9335        [94m0.2139[0m     +  118.5809
      3   0.2968   [32m0.8049[0m        [35m0.2708[0m       0.9335        [94m0.2074[0m     +  118.6006
      4   0.3080   [32m0.8093[0m        [35m0.2662[0m       0.9335        [94m0.2071[0m     +  118.7697
      5   0.3082   0.8047        [35m0.2638[0m       0.9335        0.2109        118.6389
      6   0.3082   0.8075        [35m0.2616[0m       0.9335        [94m0.2068[0m     +  118.6206
      7   0.2983   0.8028        [35m0.2609[0m       0.9335        0.2118        118.5070
      8   0.3050   0.8056        [35m0.2593[0m       0.9335        0.2119        119.0072
      9   0.3108   [32m0.8134[0m        [35m0.2586[0m       0.9335        0.2104        119.0793
     10   0.3020   0.8102        0.2600       0.9335        0.2107        119.0938
     11   0.3048   0.8124        [35m0.2574[0m       0.9335        0.2131        118.5944
     12   0.2959   0.8059        [35m0.2569[0m       0.9335        0.2161        119.0487
     13   0.3027   0.8074        [35m0.2565[0m       0.9335        0.2150        118.6730
     14   0.3089   0.8115        [35m0.2560[0m       0.9335        0.2148        118.7402
     15   0.2869   0.8109        [35m0.2555[0m       0.9335        0.2183        118.6230
Stopping since valid_loss has not improved in the last 10 epochs.
[32m[I 2023-05-04 03:18:20,926][0m Trial 401 finished with value: 0.20683532402351804 and parameters: {'lr': 0.00015309052415420988, 'dropout': 0.37291175050728304, 'd_model_multiplier': 4, 'num_layers': 15, 'n_heads': 64, 'dim_feedforward': 303, 'batch_size': 17, 'pos_encoding': 'fixed', 'activation': 'relu', 'norm': 'LayerNorm', 'optimizer_name': 'AdamW', 'weight_decay': 0.001, 'top_n_features': 83}. Best is trial 246 with value: 0.16447311791139763.[0m
[FileBasedDataset] Initializing dataset...
	Examples: 8264
	Features: 78
	Max length: 315
Standard scalar turned ON, loading params from cache
[FileBasedDataset] Dataset initialization complete
  epoch    auprc    auroc    train_loss    valid_acc    valid_loss    cp       dur
-------  -------  -------  ------------  -----------  ------------  ----  --------
      1   [36m0.2842[0m   [32m0.7844[0m        [35m0.3022[0m       [31m0.9190[0m        [94m0.2376[0m     +  101.8449
      2   0.2710   [32m0.7878[0m        [35m0.2381[0m       0.9081        0.2484        101.5478
      3   0.2705   0.7869        0.2383       0.9117        0.2565        101.9085
      4   0.2647   0.7855        [35m0.2375[0m       0.9069        0.2636        101.9747
      5   0.2779   0.7869        [35m0.2355[0m       0.9117        0.2648        101.9124
      6   0.2808   [32m0.7893[0m        [35m0.2328[0m       0.9105        0.2672        101.9218
      7   [36m0.3082[0m   [32m0.7931[0m        [35m0.2300[0m       0.9166        0.2561        101.9027
      8   0.2749   0.7855        [35m0.2282[0m       0.9069        0.2725        101.9141
      9   0.2773   0.7863        [35m0.2252[0m       0.9081        0.2746        101.6450
     10   0.3009   [32m0.8019[0m        [35m0.2249[0m       0.9105        0.2618        101.9031
Stopping since valid_loss has not improved in the last 10 epochs.
