[32m[I 2023-05-03 04:43:40,677][0m Trial 273 finished with value: 0.20895724528285584 and parameters: {'lr': 0.0009524236251089918, 'dropout': 0.5943478641154126, 'd_model_multiplier': 1, 'num_layers': 2, 'n_heads': 32, 'dim_feedforward': 423, 'batch_size': 38, 'pos_encoding': 'fixed', 'activation': 'gelu', 'norm': 'BatchNorm', 'optimizer_name': 'PlainRAdam', 'weight_decay': 0.1, 'top_n_features': 16}. Best is trial 246 with value: 0.16447311791139763.[0m
[FileBasedDataset] Initializing dataset...
	Examples: 8264
	Features: 19
	Max length: 315
Standard scalar turned ON, loading params from cache
[FileBasedDataset] Dataset initialization complete
  epoch    auprc    auroc    train_loss    valid_acc    valid_loss    cp      dur
-------  -------  -------  ------------  -----------  ------------  ----  -------
      1   [36m0.3014[0m   [32m0.8003[0m        [35m0.3293[0m       [31m0.9093[0m        [94m0.3764[0m     +  10.8305
      2   0.2846   0.7973        [35m0.2476[0m       0.8912        [94m0.3660[0m     +  10.7917
      3   0.2749   0.7987        0.2524       0.8948        [94m0.3563[0m     +  10.9407
      4   0.2970   [32m0.8039[0m        0.2482       [31m0.9105[0m        [94m0.3047[0m     +  10.7672
      5   0.2730   0.8011        0.2498       0.9093        [94m0.2681[0m     +  10.6458
      6   0.2993   [32m0.8072[0m        [35m0.2411[0m       [31m0.9154[0m        [94m0.2479[0m     +  10.8069
      7   0.2627   0.8055        0.2416       0.9093        0.2517        10.9712
      8   0.2851   [32m0.8115[0m        [35m0.2381[0m       0.9105        [94m0.2383[0m     +  10.7536
      9   0.2671   0.8093        [35m0.2348[0m       0.9093        0.2399        10.9887
     10   0.2620   0.8106        0.2352       0.9093        0.2432        11.0000
     11   0.2647   0.8113        [35m0.2339[0m       0.9081        0.2401        10.9226
     12   0.2712   [32m0.8134[0m        [35m0.2308[0m       0.9081        0.2398        10.9456
     13   0.2735   0.8127        0.2325       0.9141        [94m0.2370[0m     +  10.8493
     14   0.2961   [32m0.8152[0m        [35m0.2281[0m       0.9093        [94m0.2351[0m     +  10.6015
     15   0.2869   0.8142        [35m0.2280[0m       0.9081        [94m0.2337[0m     +  10.7632
     16   0.3002   0.8139        [35m0.2233[0m       0.9117        0.2359        10.9646
     17   0.2866   [32m0.8169[0m        0.2261       0.9105        0.2385        10.8893
     18   [36m0.3283[0m   [32m0.8188[0m        0.2251       0.9141        [94m0.2296[0m     +  10.9837
     19   0.3170   0.8180        [35m0.2232[0m       0.9129        0.2312        10.8669
     20   [36m0.3340[0m   [32m0.8203[0m        [35m0.2228[0m       [31m0.9178[0m        0.2392        10.9944
     21   [36m0.3353[0m   [32m0.8225[0m        [35m0.2218[0m       0.9178        0.2320        10.8243
     22   0.3136   0.8195        [35m0.2202[0m       0.9166        0.2482        10.8737
     23   0.3291   0.8201        [35m0.2176[0m       0.9129        0.2465        10.7949
     24   0.3146   0.8219        0.2186       0.9154        0.2365        10.8692
     25   [36m0.3425[0m   0.8222        0.2183       0.9166        0.2356        10.9889
     26   0.3246   0.8214        0.2176       0.9154        0.3337        11.0108
     27   0.3255   [32m0.8233[0m        0.2190       0.9154        0.2497        10.7669
Stopping since valid_loss has not improved in the last 10 epochs.
[32m[I 2023-05-03 04:48:45,818][0m Trial 274 finished with value: 0.22961565760271724 and parameters: {'lr': 0.0010004518508535398, 'dropout': 0.5902202870511795, 'd_model_multiplier': 1, 'num_layers': 2, 'n_heads': 32, 'dim_feedforward': 431, 'batch_size': 37, 'pos_encoding': 'fixed', 'activation': 'gelu', 'norm': 'BatchNorm', 'optimizer_name': 'PlainRAdam', 'weight_decay': 0.1, 'top_n_features': 19}. Best is trial 246 with value: 0.16447311791139763.[0m
[FileBasedDataset] Initializing dataset...
	Examples: 8264
	Features: 29
	Max length: 315
Standard scalar turned ON, loading params from cache
[FileBasedDataset] Dataset initialization complete
  epoch    auprc    auroc    train_loss    valid_acc    valid_loss    cp      dur
-------  -------  -------  ------------  -----------  ------------  ----  -------
      1   [36m0.2201[0m   [32m0.7629[0m        [35m0.3387[0m       [31m0.9274[0m        [94m0.2281[0m     +  10.3607
      2   [36m0.3478[0m   [32m0.8419[0m        [35m0.2517[0m       0.9226        [94m0.2086[0m     +  10.4388
      3   [36m0.3745[0m   [32m0.8419[0m        [35m0.2431[0m       0.9226        0.2087        10.7302
      4   0.3735   [32m0.8495[0m        [35m0.2430[0m       0.9226        0.2104        10.9677
      5   0.3743   0.8494        [35m0.2404[0m       0.9214        0.2111        10.5815
      6   0.3489   0.8485        [35m0.2395[0m       0.9178        0.2143        10.7243
      7   0.3421   0.8490        [35m0.2368[0m       0.9154        0.2171        10.6085
      8   0.3507   [32m0.8500[0m        0.2393       0.9166        0.2167        10.6528
      9   0.3650   0.8471        0.2387       0.9178        0.2184        10.5793
     10   0.3491   [32m0.8503[0m        [35m0.2348[0m       0.9178        0.2163        10.5511
     11   0.3388   0.8493        0.2357       0.9178        0.2175        10.6208
Stopping since valid_loss has not improved in the last 10 epochs.
[32m[I 2023-05-03 04:50:53,702][0m Trial 275 finished with value: 0.20855162290016138 and parameters: {'lr': 0.000709115620693641, 'dropout': 0.598842843214, 'd_model_multiplier': 1, 'num_layers': 2, 'n_heads': 32, 'dim_feedforward': 421, 'batch_size': 32, 'pos_encoding': 'fixed', 'activation': 'relu', 'norm': 'LayerNorm', 'optimizer_name': 'RAdam', 'weight_decay': 0.1, 'top_n_features': 29}. Best is trial 246 with value: 0.16447311791139763.[0m
[FileBasedDataset] Initializing dataset...
	Examples: 8264
	Features: 33
	Max length: 315
Standard scalar turned ON, loading params from cache
[FileBasedDataset] Dataset initialization complete
  epoch    auprc    auroc    train_loss    valid_acc    valid_loss    cp     dur
-------  -------  -------  ------------  -----------  ------------  ----  ------
      1   [36m0.1984[0m   [32m0.7007[0m        [35m0.3541[0m       [31m0.9299[0m        [94m0.2360[0m     +  8.9383
      2   [36m0.2650[0m   [32m0.7355[0m        [35m0.2487[0m       0.9214        0.2368        8.3873
      3   0.2556   0.7292        [35m0.2458[0m       0.9202        0.2465        9.0617
      4   [36m0.2775[0m   0.7301        [35m0.2427[0m       0.9141        0.2524        8.9462
      5   [36m0.2819[0m   [32m0.7373[0m        [35m0.2409[0m       0.9166        0.2496        9.0837
      6   0.2617   0.7331        0.2415       0.9154        0.2570        9.1710
      7   0.2593   0.7321        [35m0.2376[0m       0.9166        0.2553        8.8494
      8   0.2545   [32m0.7386[0m        0.2399       0.9129        0.2554        9.2885
      9   0.2607   [32m0.7416[0m        0.2378       0.9117        0.2634        9.0632
     10   0.2750   [32m0.7429[0m        [35m0.2372[0m       0.9190        0.2517        9.3423
Stopping since valid_loss has not improved in the last 10 epochs.
[32m[I 2023-05-03 04:52:33,376][0m Trial 276 finished with value: 0.23597909717346477 and parameters: {'lr': 0.00072269765353056, 'dropout': 0.6063046774015282, 'd_model_multiplier': 1, 'num_layers': 1, 'n_heads': 32, 'dim_feedforward': 423, 'batch_size': 35, 'pos_encoding': 'fixed', 'activation': 'relu', 'norm': 'LayerNorm', 'optimizer_name': 'PlainRAdam', 'weight_decay': 0.1, 'top_n_features': 33}. Best is trial 246 with value: 0.16447311791139763.[0m
[FileBasedDataset] Initializing dataset...
	Examples: 8264
	Features: 27
	Max length: 315
Standard scalar turned ON, loading params from cache
[FileBasedDataset] Dataset initialization complete
  epoch    auprc    auroc    train_loss    valid_acc    valid_loss    cp      dur
-------  -------  -------  ------------  -----------  ------------  ----  -------
      1   [36m0.4077[0m   [32m0.7891[0m        [35m0.3147[0m       [31m0.9274[0m        [94m0.3262[0m     +  10.7329
      2   [36m0.4291[0m   0.7872        [35m0.2620[0m       [31m0.9335[0m        [94m0.2724[0m     +  10.7669
      3   0.4247   0.7868        [35m0.2590[0m       0.9287        [94m0.2379[0m     +  10.9144
      4   0.3950   [32m0.7899[0m        [35m0.2559[0m       0.9262        [94m0.2318[0m     +  10.9752
      5   [36m0.4389[0m   [32m0.8012[0m        [35m0.2539[0m       0.9287        [94m0.2256[0m     +  10.7461
      6   0.4081   0.7961        [35m0.2461[0m       0.9238        [94m0.2230[0m     +  10.9656
      7   0.3886   [32m0.8053[0m        [35m0.2439[0m       0.9274        [94m0.2194[0m     +  10.6047
      8   0.4109   [32m0.8173[0m        [35m0.2377[0m       0.9238        0.2237        10.9265
      9   0.4123   0.8169        [35m0.2374[0m       0.9250        0.2235        10.9317
     10   0.4143   [32m0.8211[0m        [35m0.2361[0m       0.9250        0.2202        10.8269
     11   0.3988   [32m0.8228[0m        0.2364       0.9226        0.2248        10.8352
     12   0.4071   [32m0.8252[0m        [35m0.2312[0m       0.9238        0.2210        10.9604
     13   0.4279   0.8250        [35m0.2289[0m       0.9238        0.2236        10.9692
     14   0.4088   [32m0.8275[0m        0.2303       0.9238        0.2246        10.9293
     15   0.4042   [32m0.8301[0m        [35m0.2251[0m       0.9250        0.2283        11.3071
     16   0.4163   [32m0.8315[0m        0.2280       0.9250        0.2218        10.9265
Stopping since valid_loss has not improved in the last 10 epochs.
[32m[I 2023-05-03 04:55:39,267][0m Trial 277 finished with value: 0.2193733920425429 and parameters: {'lr': 0.0010763645693028622, 'dropout': 0.5741316625535248, 'd_model_multiplier': 1, 'num_layers': 2, 'n_heads': 32, 'dim_feedforward': 420, 'batch_size': 30, 'pos_encoding': 'fixed', 'activation': 'gelu', 'norm': 'BatchNorm', 'optimizer_name': 'RAdam', 'weight_decay': 0.1, 'top_n_features': 27}. Best is trial 246 with value: 0.16447311791139763.[0m
[FileBasedDataset] Initializing dataset...
	Examples: 8264
	Features: 74
	Max length: 315
Standard scalar turned ON, loading params from cache
[FileBasedDataset] Dataset initialization complete
  epoch    auprc    auroc    train_loss    valid_acc    valid_loss    cp      dur
-------  -------  -------  ------------  -----------  ------------  ----  -------
      1   [36m0.2622[0m   [32m0.7349[0m        [35m0.3036[0m       [31m0.9154[0m        [94m0.2599[0m     +  10.4431
      2   0.2540   [32m0.7462[0m        [35m0.2366[0m       [31m0.9166[0m        [94m0.2546[0m     +  10.5660
      3   [36m0.2779[0m   [32m0.7540[0m        [35m0.2313[0m       [31m0.9178[0m        0.2553        10.6766
      4   0.2723   [32m0.7579[0m        [35m0.2297[0m       0.9105        0.2578        10.6465
      5   0.2669   [32m0.7644[0m        [35m0.2246[0m       0.9117        0.2621        10.8282
      6   0.2737   [32m0.7682[0m        [35m0.2234[0m       0.9081        0.2736        10.8095
      7   0.2732   0.7661        [35m0.2185[0m       0.9045        0.2723        10.6000
      8   0.2635   0.7583        0.2194       0.9069        0.2724        10.6456
      9   0.2746   0.7492        0.2198       0.9129        0.2729        10.9906
     10   0.2748   0.7543        [35m0.2168[0m       0.9093        0.2724        10.9651
     11   0.2686   0.7612        [35m0.2161[0m       0.9141        0.2721        10.9876
Stopping since valid_loss has not improved in the last 10 epochs.
[32m[I 2023-05-03 04:57:48,522][0m Trial 278 finished with value: 0.2545542315126114 and parameters: {'lr': 0.0013918681391676755, 'dropout': 0.4278768885010805, 'd_model_multiplier': 1, 'num_layers': 2, 'n_heads': 32, 'dim_feedforward': 407, 'batch_size': 43, 'pos_encoding': 'fixed', 'activation': 'relu', 'norm': 'LayerNorm', 'optimizer_name': 'RAdam', 'weight_decay': 0.1, 'top_n_features': 74}. Best is trial 246 with value: 0.16447311791139763.[0m
[FileBasedDataset] Initializing dataset...
	Examples: 8264
	Features: 16
	Max length: 315
Standard scalar turned ON, loading params from cache
[FileBasedDataset] Dataset initialization complete
  epoch    auprc    auroc    train_loss    valid_acc    valid_loss    cp     dur
-------  -------  -------  ------------  -----------  ------------  ----  ------
      1   [36m0.2214[0m   [32m0.7298[0m        [35m0.3560[0m       [31m0.9093[0m        [94m0.3729[0m     +  8.6862
      2   [36m0.2615[0m   [32m0.7669[0m        [35m0.2545[0m       0.9045        [94m0.3670[0m     +  8.9748
      3   [36m0.2615[0m   [32m0.7750[0m        [35m0.2510[0m       0.9008        [94m0.3604[0m     +  8.9247
      4   [36m0.2746[0m   [32m0.7869[0m        0.2526       0.9021        0.3760        9.0586
      5   [36m0.2753[0m   [32m0.7949[0m        [35m0.2467[0m       0.9081        [94m0.3523[0m     +  9.0712
      6   0.2730   [32m0.8018[0m        [35m0.2459[0m       0.9069        0.3531        9.0173
      7   [36m0.2825[0m   [32m0.8061[0m        [35m0.2456[0m       0.9081        [94m0.3403[0m     +  9.1235
      8   [36m0.2843[0m   [32m0.8098[0m        [35m0.2434[0m       0.9069        [94m0.3181[0m     +  9.1758
      9   [36m0.2870[0m   [32m0.8159[0m        [35m0.2426[0m       0.9081        [94m0.3096[0m     +  9.2613
     10   0.2822   0.8091        0.2458       0.9081        [94m0.3012[0m     +  9.0946
     11   [36m0.2934[0m   0.8152        [35m0.2425[0m       [31m0.9129[0m        [94m0.2787[0m     +  9.1095
     12   0.2886   0.8130        [35m0.2398[0m       [31m0.9141[0m        [94m0.2599[0m     +  8.9941
     13   0.2872   0.8154        [35m0.2353[0m       0.9117        [94m0.2521[0m     +  8.9204
     14   0.2885   0.8151        [35m0.2334[0m       0.9141        [94m0.2467[0m     +  9.2567
     15   0.2880   0.8147        [35m0.2326[0m       [31m0.9154[0m        [94m0.2397[0m     +  9.1756
     16   [36m0.3016[0m   0.8131        [35m0.2323[0m       0.9154        [94m0.2381[0m     +  9.1799
     17   0.3014   0.8133        [35m0.2309[0m       [31m0.9178[0m        0.2395        9.1619
     18   0.2980   [32m0.8165[0m        [35m0.2299[0m       [31m0.9190[0m        [94m0.2352[0m     +  9.3892
     19   0.2981   0.8133        [35m0.2298[0m       0.9178        [94m0.2317[0m     +  9.1345
     20   0.3002   0.8156        [35m0.2288[0m       0.9178        [94m0.2286[0m     +  9.4916
     21   [36m0.3127[0m   0.8164        [35m0.2262[0m       0.9154        [94m0.2262[0m     +  9.1512
     22   [36m0.3232[0m   [32m0.8172[0m        [35m0.2260[0m       0.9154        [94m0.2252[0m     +  9.2885
     23   0.3070   [32m0.8184[0m        [35m0.2256[0m       0.9190        0.2307        8.9633
     24   0.3135   [32m0.8211[0m        [35m0.2242[0m       0.9178        0.2277        9.3101
     25   0.3209   [32m0.8234[0m        [35m0.2230[0m       [31m0.9202[0m        0.2262        9.3228
     26   0.3169   0.8224        0.2242       0.9202        [94m0.2251[0m     +  9.0001
     27   0.3196   [32m0.8243[0m        0.2251       [31m0.9214[0m        0.2267        9.2573
     28   [36m0.3294[0m   [32m0.8266[0m        [35m0.2215[0m       0.9214        [94m0.2239[0m     +  8.9070
     29   0.3271   [32m0.8279[0m        [35m0.2207[0m       [31m0.9226[0m        [94m0.2222[0m     +  9.4283
     30   [36m0.3314[0m   [32m0.8313[0m        [35m0.2192[0m       0.9214        0.2305        9.1163
     31   [36m0.3371[0m   0.8296        0.2201       [31m0.9238[0m        0.2234        9.3652
     32   0.3353   [32m0.8313[0m        [35m0.2185[0m       0.9238        0.2269        9.4196
     33   0.3275   0.8297        0.2192       0.9178        0.2279        9.3374
     34   0.3355   [32m0.8318[0m        0.2186       0.9190        0.2298        9.4884
     35   0.3292   0.8311        [35m0.2175[0m       0.9166        0.2244        8.9588
     36   [36m0.3453[0m   0.8317        [35m0.2158[0m       0.9202        [94m0.2221[0m     +  9.1234
     37   [36m0.3453[0m   [32m0.8333[0m        0.2169       0.9226        0.2269        9.0807
     38   0.3343   0.8314        0.2163       0.9190        0.2281        8.9021
     39   [36m0.3547[0m   [32m0.8338[0m        [35m0.2157[0m       [31m0.9250[0m        0.2303        9.2876
     40   0.3376   0.8321        0.2182       0.9190        0.2296        9.1997
     41   0.3480   0.8324        0.2165       0.9226        0.2317        9.2801
     42   0.3438   0.8320        [35m0.2151[0m       0.9202        0.2261        9.0646
     43   0.3439   0.8319        0.2160       0.9202        0.2272        9.3529
     44   0.3251   0.8308        0.2151       0.9154        0.2268        9.4781
     45   0.3341   0.8335        [35m0.2137[0m       0.9166        0.2277        9.3040
Stopping since valid_loss has not improved in the last 10 epochs.
