[32m[I 2023-05-03 14:36:12,722][0m Trial 356 finished with value: 0.2655250464341949 and parameters: {'lr': 3.7731356134391835e-05, 'dropout': 0.41110273019651883, 'd_model_multiplier': 4, 'num_layers': 5, 'n_heads': 32, 'dim_feedforward': 294, 'batch_size': 70, 'pos_encoding': 'fixed', 'activation': 'relu', 'norm': 'LayerNorm', 'optimizer_name': 'RAdam', 'weight_decay': 0.001, 'top_n_features': 75}. Best is trial 246 with value: 0.16447311791139763.[0m
[FileBasedDataset] Initializing dataset...
	Examples: 8264
	Features: 81
	Max length: 315
Standard scalar turned ON, loading params from cache
[FileBasedDataset] Dataset initialization complete
  epoch    auprc    auroc    train_loss    valid_acc    valid_loss    cp      dur
-------  -------  -------  ------------  -----------  ------------  ----  -------
      1   [36m0.1961[0m   [32m0.6903[0m        [35m0.3107[0m       [31m0.9202[0m        [94m0.2597[0m     +  22.7979
      2   [36m0.2469[0m   [32m0.7609[0m        [35m0.2411[0m       0.9141        [94m0.2516[0m     +  23.0050
      3   0.2406   [32m0.7669[0m        [35m0.2331[0m       0.9178        [94m0.2507[0m     +  23.1577
      4   [36m0.2500[0m   [32m0.7693[0m        [35m0.2285[0m       0.9178        [94m0.2504[0m     +  23.1523
      5   0.2476   [32m0.7725[0m        [35m0.2278[0m       0.9190        [94m0.2487[0m     +  22.8339
      6   [36m0.2556[0m   [32m0.7744[0m        [35m0.2248[0m       0.9190        0.2493        23.2450
      7   [36m0.2608[0m   [32m0.7805[0m        [35m0.2242[0m       0.9166        [94m0.2473[0m     +  23.2210
      8   [36m0.2754[0m   [32m0.7828[0m        [35m0.2216[0m       0.9178        [94m0.2453[0m     +  23.1794
      9   [36m0.2930[0m   [32m0.7900[0m        [35m0.2197[0m       0.9178        [94m0.2435[0m     +  23.1427
     10   0.2847   [32m0.7937[0m        0.2210       0.9190        [94m0.2422[0m     +  23.1867
     11   0.2881   [32m0.7961[0m        0.2206       0.9154        0.2440        23.0503
     12   0.2916   [32m0.7997[0m        [35m0.2179[0m       0.9154        0.2432        23.0896
     13   0.2888   [32m0.8029[0m        [35m0.2174[0m       0.9166        [94m0.2405[0m     +  23.3265
     14   [36m0.2965[0m   [32m0.8064[0m        [35m0.2156[0m       0.9166        [94m0.2369[0m     +  23.2399
     15   [36m0.3000[0m   [32m0.8092[0m        [35m0.2155[0m       0.9154        [94m0.2365[0m     +  23.4323
     16   [36m0.3066[0m   [32m0.8120[0m        [35m0.2128[0m       0.9190        0.2365        23.1220
     17   [36m0.3129[0m   0.8108        0.2135       0.9178        [94m0.2352[0m     +  23.0825
     18   0.2988   0.8116        [35m0.2112[0m       0.9166        [94m0.2335[0m     +  23.0830
     19   0.3045   0.8111        [35m0.2112[0m       0.9178        0.2348        22.8598
     20   0.3126   [32m0.8136[0m        [35m0.2096[0m       0.9166        [94m0.2325[0m     +  22.9856
     21   0.3058   0.8121        0.2100       0.9166        0.2346        23.2526
     22   0.3067   0.8117        [35m0.2061[0m       0.9190        0.2350        23.2669
     23   0.3068   0.8130        [35m0.2060[0m       0.9202        0.2338        23.1347
     24   0.3063   0.8085        [35m0.2041[0m       0.9190        0.2355        23.1378
     25   [36m0.3138[0m   0.8103        [35m0.2032[0m       [31m0.9238[0m        0.2332        23.1805
     26   [36m0.3145[0m   0.8082        [35m0.2025[0m       0.9214        0.2352        22.9537
     27   0.3042   0.8047        [35m0.2010[0m       0.9214        0.2370        23.1955
     28   0.2935   0.8013        [35m0.1975[0m       0.9190        0.2396        22.9034
     29   0.3016   0.8014        0.1984       0.9190        0.2399        23.2822
Stopping since valid_loss has not improved in the last 10 epochs.
[32m[I 2023-05-03 14:47:47,577][0m Trial 357 finished with value: 0.2324767783914829 and parameters: {'lr': 6.400804593160132e-05, 'dropout': 0.24936367534084325, 'd_model_multiplier': 2, 'num_layers': 5, 'n_heads': 32, 'dim_feedforward': 314, 'batch_size': 61, 'pos_encoding': 'fixed', 'activation': 'relu', 'norm': 'LayerNorm', 'optimizer_name': 'AdamW', 'weight_decay': 0.001, 'top_n_features': 81}. Best is trial 246 with value: 0.16447311791139763.[0m
[FileBasedDataset] Initializing dataset...
	Examples: 8264
	Features: 63
	Max length: 315
Standard scalar turned ON, loading params from cache
[FileBasedDataset] Dataset initialization complete
  epoch    auprc    auroc    train_loss    valid_acc    valid_loss    cp      dur
-------  -------  -------  ------------  -----------  ------------  ----  -------
      1   [36m0.0653[0m   [32m0.3090[0m        [35m0.6453[0m       [31m0.9105[0m        [94m0.4994[0m     +  31.2331
      2   [36m0.1047[0m   [32m0.5178[0m        [35m0.3882[0m       0.9105        [94m0.3185[0m     +  30.9880
      3   [36m0.2225[0m   [32m0.6975[0m        [35m0.2777[0m       0.9093        [94m0.2784[0m     +  31.6520
      4   [36m0.2785[0m   [32m0.7621[0m        [35m0.2510[0m       0.9081        [94m0.2636[0m     +  31.3001
      5   [36m0.2956[0m   [32m0.7860[0m        [35m0.2383[0m       0.9057        [94m0.2570[0m     +  31.3280
      6   [36m0.2995[0m   [32m0.7935[0m        [35m0.2329[0m       0.9105        [94m0.2548[0m     +  31.5022
      7   [36m0.3043[0m   [32m0.7984[0m        [35m0.2308[0m       0.9081        [94m0.2530[0m     +  31.6146
      8   [36m0.3111[0m   [32m0.8021[0m        [35m0.2273[0m       0.9081        [94m0.2522[0m     +  31.3913
      9   [36m0.3136[0m   [32m0.8034[0m        [35m0.2270[0m       0.9045        [94m0.2517[0m     +  31.1381
     10   0.3105   0.8031        0.2272       0.9057        0.2520        31.3390
     11   0.3127   [32m0.8045[0m        [35m0.2239[0m       0.9069        0.2525        31.5156
     12   [36m0.3137[0m   0.8033        [35m0.2230[0m       0.9069        0.2537        31.4509
     13   [36m0.3150[0m   0.8028        [35m0.2220[0m       0.9069        0.2536        31.4062
     14   [36m0.3151[0m   0.8024        [35m0.2218[0m       0.9069        0.2544        31.6934
     15   0.3134   0.7989        [35m0.2203[0m       0.9069        0.2561        31.7387
     16   0.3139   0.7975        [35m0.2189[0m       0.9081        0.2562        31.4044
     17   [36m0.3158[0m   0.7997        [35m0.2185[0m       0.9069        0.2545        31.8132
     18   [36m0.3194[0m   0.7958        [35m0.2173[0m       0.9081        0.2559        31.5186
Stopping since valid_loss has not improved in the last 10 epochs.
[32m[I 2023-05-03 14:57:46,448][0m Trial 358 finished with value: 0.2517000334979257 and parameters: {'lr': 2.7922831929816223e-05, 'dropout': 0.32235482444042984, 'd_model_multiplier': 4, 'num_layers': 7, 'n_heads': 32, 'dim_feedforward': 349, 'batch_size': 80, 'pos_encoding': 'fixed', 'activation': 'relu', 'norm': 'LayerNorm', 'optimizer_name': 'RAdam', 'weight_decay': 0.1, 'top_n_features': 63}. Best is trial 246 with value: 0.16447311791139763.[0m
[FileBasedDataset] Initializing dataset...
	Examples: 8264
	Features: 69
	Max length: 315
Standard scalar turned ON, loading params from cache
[FileBasedDataset] Dataset initialization complete
  epoch    auprc    auroc    train_loss    valid_acc    valid_loss    cp      dur
-------  -------  -------  ------------  -----------  ------------  ----  -------
      1   [36m0.0608[0m   [32m0.3476[0m        [35m0.6283[0m       [31m0.9190[0m        [94m0.5376[0m     +  34.2548
      2   [36m0.0671[0m   [32m0.3741[0m        [35m0.4827[0m       0.9190        [94m0.3932[0m     +  34.6883
      3   [36m0.0767[0m   [32m0.4702[0m        [35m0.3670[0m       0.9190        [94m0.3160[0m     +  34.8816
      4   [36m0.1256[0m   [32m0.6023[0m        [35m0.3035[0m       0.9190        [94m0.2833[0m     +  34.7358
      5   [36m0.1632[0m   [32m0.6572[0m        [35m0.2736[0m       0.9190        [94m0.2701[0m     +  34.7540
      6   [36m0.1862[0m   [32m0.6920[0m        [35m0.2588[0m       0.9178        [94m0.2627[0m     +  34.9311
      7   [36m0.2133[0m   [32m0.7132[0m        [35m0.2480[0m       0.9154        [94m0.2574[0m     +  35.0753
      8   [36m0.2260[0m   [32m0.7223[0m        [35m0.2424[0m       0.9141        [94m0.2552[0m     +  34.9215
      9   [36m0.2377[0m   [32m0.7270[0m        [35m0.2372[0m       0.9129        [94m0.2540[0m     +  34.6868
     10   [36m0.2514[0m   [32m0.7319[0m        [35m0.2342[0m       0.9154        [94m0.2535[0m     +  34.7130
     11   [36m0.2550[0m   [32m0.7353[0m        0.2352       0.9141        [94m0.2528[0m     +  34.8076
     12   [36m0.2555[0m   [32m0.7384[0m        [35m0.2313[0m       0.9166        [94m0.2523[0m     +  34.9272
     13   [36m0.2575[0m   [32m0.7394[0m        [35m0.2299[0m       0.9166        0.2524        34.7369
     14   0.2564   [32m0.7412[0m        0.2301       0.9166        0.2524        34.9451
     15   [36m0.2597[0m   [32m0.7429[0m        0.2305       0.9166        [94m0.2520[0m     +  35.0182
     16   [36m0.2637[0m   [32m0.7440[0m        0.2306       0.9178        [94m0.2515[0m     +  34.9450
     17   [36m0.2666[0m   [32m0.7452[0m        [35m0.2271[0m       0.9178        [94m0.2513[0m     +  35.1209
     18   [36m0.2696[0m   [32m0.7474[0m        0.2280       0.9178        0.2515        34.9904
     19   [36m0.2715[0m   [32m0.7480[0m        [35m0.2269[0m       0.9178        0.2516        34.7943
     20   0.2713   0.7479        0.2273       0.9178        0.2514        34.7460
     21   [36m0.2753[0m   [32m0.7490[0m        [35m0.2255[0m       0.9178        [94m0.2512[0m     +  34.5805
     22   [36m0.2762[0m   [32m0.7499[0m        0.2274       0.9178        [94m0.2507[0m     +  34.8537
     23   [36m0.2770[0m   [32m0.7507[0m        [35m0.2254[0m       0.9166        [94m0.2506[0m     +  34.8798
     24   [36m0.2772[0m   [32m0.7512[0m        0.2257       0.9190        [94m0.2504[0m     +  34.9333
     25   [36m0.2779[0m   [32m0.7512[0m        [35m0.2245[0m       0.9190        0.2507        34.5867
     26   [36m0.2785[0m   [32m0.7512[0m        0.2257       0.9190        [94m0.2504[0m     +  34.9532
     27   [36m0.2807[0m   [32m0.7534[0m        0.2256       0.9178        [94m0.2498[0m     +  34.6389
     28   [36m0.2814[0m   0.7533        0.2247       0.9190        [94m0.2495[0m     +  34.8785
     29   0.2809   [32m0.7535[0m        0.2246       0.9166        [94m0.2493[0m     +  34.8053
     30   0.2788   0.7525        [35m0.2233[0m       0.9166        0.2496        35.1932
     31   0.2779   0.7531        0.2233       0.9190        0.2493        34.7490
     32   0.2797   0.7531        0.2239       [31m0.9202[0m        [94m0.2492[0m     +  34.9490
     33   [36m0.2822[0m   0.7528        0.2237       [31m0.9214[0m        [94m0.2489[0m     +  34.4333
     34   [36m0.2839[0m   0.7523        [35m0.2229[0m       0.9190        0.2491        34.8610
     35   0.2831   0.7518        0.2240       0.9202        [94m0.2488[0m     +  34.6079
     36   [36m0.2839[0m   0.7515        [35m0.2223[0m       0.9202        0.2489        35.2813
     37   [36m0.2863[0m   0.7508        0.2239       0.9202        0.2489        34.8266
     38   0.2832   0.7500        0.2227       0.9202        [94m0.2486[0m     +  34.8231
     39   0.2833   0.7500        0.2235       0.9190        [94m0.2485[0m     +  34.8927
     40   0.2862   0.7498        [35m0.2199[0m       0.9190        [94m0.2483[0m     +  34.6127
     41   0.2842   0.7500        0.2225       0.9178        0.2485        35.0697
     42   0.2836   0.7496        0.2202       0.9178        [94m0.2482[0m     +  34.8113
     43   0.2828   0.7487        0.2207       0.9190        0.2486        34.7346
     44   0.2837   0.7488        0.2212       0.9154        [94m0.2479[0m     +  34.9229
     45   0.2809   0.7481        0.2214       0.9166        0.2482        34.8922
     46   0.2847   0.7488        0.2211       0.9166        [94m0.2478[0m     +  34.8169
     47   0.2833   0.7480        0.2212       0.9166        0.2479        34.8882
     48   0.2800   0.7470        [35m0.2196[0m       0.9154        0.2483        34.6197
     49   0.2823   0.7474        0.2208       0.9154        0.2483        34.9103
     50   0.2844   0.7479        [35m0.2190[0m       0.9154        0.2479        34.9058
[32m[I 2023-05-03 15:26:52,289][0m Trial 359 finished with value: 0.24781164433244063 and parameters: {'lr': 9.54780843075637e-06, 'dropout': 0.4248051580302336, 'd_model_multiplier': 4, 'num_layers': 8, 'n_heads': 32, 'dim_feedforward': 324, 'batch_size': 64, 'pos_encoding': 'fixed', 'activation': 'relu', 'norm': 'LayerNorm', 'optimizer_name': 'RAdam', 'weight_decay': 0.1, 'top_n_features': 69}. Best is trial 246 with value: 0.16447311791139763.[0m
[FileBasedDataset] Initializing dataset...
	Examples: 8264
	Features: 58
	Max length: 315
Standard scalar turned ON, loading params from cache
[FileBasedDataset] Dataset initialization complete
  epoch    auprc    auroc    train_loss    valid_acc    valid_loss    cp      dur
-------  -------  -------  ------------  -----------  ------------  ----  -------
      1   [36m0.3368[0m   [32m0.7616[0m        [35m0.2983[0m       [31m0.9359[0m        [94m0.2034[0m     +  27.4574
      2   [36m0.3710[0m   [32m0.7676[0m        [35m0.2418[0m       [31m0.9395[0m        [94m0.1995[0m     +  27.6803
      3   0.3676   [32m0.7757[0m        [35m0.2366[0m       0.9395        0.1997        27.3382
      4   0.3547   [32m0.7784[0m        [35m0.2340[0m       [31m0.9407[0m        0.2003        27.4509
      5   0.3510   [32m0.7797[0m        0.2341       [31m0.9420[0m        0.2008        27.4455
      6   0.3505   0.7787        [35m0.2305[0m       0.9395        0.2018        27.6272
      7   0.3379   0.7785        [35m0.2302[0m       0.9407        0.2028        27.7082
      8   0.3328   0.7758        [35m0.2299[0m       0.9395        0.2039        27.5692
      9   0.3239   0.7764        [35m0.2279[0m       0.9407        0.2051        27.6415
     10   0.3357   0.7704        0.2284       0.9359        0.2071        27.5630
     11   0.3197   0.7679        [35m0.2242[0m       0.9347        0.2112        27.4675
Stopping since valid_loss has not improved in the last 10 epochs.
[32m[I 2023-05-03 15:32:23,123][0m Trial 360 finished with value: 0.19945212213059002 and parameters: {'lr': 4.348173755851842e-05, 'dropout': 0.3959119341575506, 'd_model_multiplier': 4, 'num_layers': 6, 'n_heads': 32, 'dim_feedforward': 329, 'batch_size': 56, 'pos_encoding': 'fixed', 'activation': 'relu', 'norm': 'LayerNorm', 'optimizer_name': 'AdamW', 'weight_decay': 0.1, 'top_n_features': 58}. Best is trial 246 with value: 0.16447311791139763.[0m
[FileBasedDataset] Initializing dataset...
	Examples: 8264
	Features: 59
	Max length: 315
Standard scalar turned ON, loading params from cache
[FileBasedDataset] Dataset initialization complete
  epoch    auprc    auroc    train_loss    valid_acc    valid_loss    cp      dur
-------  -------  -------  ------------  -----------  ------------  ----  -------
      1   [36m0.3313[0m   [32m0.7707[0m        [35m0.2765[0m       [31m0.9141[0m        [94m0.2553[0m     +  34.6116
      2   [36m0.3423[0m   [32m0.7865[0m        [35m0.2388[0m       0.9141        [94m0.2476[0m     +  34.7157
      3   [36m0.3438[0m   [32m0.7929[0m        [35m0.2337[0m       [31m0.9154[0m        [94m0.2453[0m     +  34.7562
      4   [36m0.3547[0m   [32m0.8012[0m        [35m0.2324[0m       [31m0.9190[0m        [94m0.2416[0m     +  34.7857
      5   0.3525   [32m0.8035[0m        [35m0.2302[0m       0.9166        0.2422        34.6023
      6   0.3426   [32m0.8063[0m        [35m0.2279[0m       0.9129        [94m0.2389[0m     +  34.8418
      7   0.3414   0.8038        0.2286       0.9129        0.2416        34.6060
      8   [36m0.3612[0m   [32m0.8125[0m        [35m0.2263[0m       0.9141        [94m0.2377[0m     +  35.0987
      9   0.3525   [32m0.8145[0m        [35m0.2254[0m       0.9166        [94m0.2356[0m     +  34.9021
     10   0.3497   [32m0.8180[0m        [35m0.2238[0m       0.9154        0.2370        34.5803
     11   0.3454   [32m0.8206[0m        0.2240       0.9154        0.2365        34.9598
     12   [36m0.3616[0m   [32m0.8230[0m        [35m0.2224[0m       0.9166        [94m0.2332[0m     +  34.7362
     13   0.3551   [32m0.8257[0m        0.2230       0.9166        0.2339        35.1906
     14   [36m0.3745[0m   0.8246        [35m0.2222[0m       0.9178        [94m0.2331[0m     +  34.7144
     15   0.3698   0.8254        [35m0.2211[0m       0.9129        0.2343        34.7201
     16   0.3741   [32m0.8299[0m        [35m0.2189[0m       0.9178        [94m0.2322[0m     +  34.6369
     17   [36m0.3886[0m   0.8298        [35m0.2183[0m       [31m0.9202[0m        [94m0.2307[0m     +  34.6648
     18   0.3483   0.8238        [35m0.2167[0m       0.9166        0.2375        34.7665
     19   0.3614   0.8273        [35m0.2159[0m       0.9166        0.2347        34.9187
     20   0.3716   0.8282        0.2161       0.9166        0.2337        34.7223
     21   0.3713   0.8263        0.2165       0.9166        0.2334        35.0516
     22   0.3610   0.8279        [35m0.2134[0m       0.9166        0.2342        34.9015
     23   0.3617   0.8241        0.2137       0.9141        0.2354        34.8151
     24   0.3622   0.8276        [35m0.2099[0m       0.9154        0.2344        34.4926
     25   0.3571   0.8269        0.2129       0.9154        0.2360        34.7453
     26   0.3623   0.8271        [35m0.2097[0m       0.9178        0.2355        34.8761
Stopping since valid_loss has not improved in the last 10 epochs.
[32m[I 2023-05-03 15:48:03,910][0m Trial 361 finished with value: 0.23074643618394558 and parameters: {'lr': 6.43384262992757e-05, 'dropout': 0.38960010545712026, 'd_model_multiplier': 4, 'num_layers': 8, 'n_heads': 32, 'dim_feedforward': 332, 'batch_size': 58, 'pos_encoding': 'fixed', 'activation': 'relu', 'norm': 'LayerNorm', 'optimizer_name': 'AdamW', 'weight_decay': 0.001, 'top_n_features': 59}. Best is trial 246 with value: 0.16447311791139763.[0m
[FileBasedDataset] Initializing dataset...
	Examples: 8264
	Features: 65
	Max length: 315
Standard scalar turned ON, loading params from cache
[FileBasedDataset] Dataset initialization complete
Warning, assumed runtime error: CUDA out of memory. Tried to allocate 1.30 GiB (GPU 0; 23.70 GiB total capacity; 19.58 GiB already allocated; 951.25 MiB free; 21.68 GiB reserved in total by PyTorch) If reserved memory is >> allocated memory try setting max_split_size_mb to avoid fragmentation.  See documentation for Memory Management and PYTORCH_CUDA_ALLOC_CONF
[32m[I 2023-05-03 15:48:07,582][0m Trial 362 finished with value: 100.0 and parameters: {'lr': 4.7115194864299845e-05, 'dropout': 0.36651791662446587, 'd_model_multiplier': 4, 'num_layers': 6, 'n_heads': 64, 'dim_feedforward': 323, 'batch_size': 55, 'pos_encoding': 'fixed', 'activation': 'relu', 'norm': 'LayerNorm', 'optimizer_name': 'AdamW', 'weight_decay': 0.1, 'top_n_features': 65}. Best is trial 246 with value: 0.16447311791139763.[0m
[FileBasedDataset] Initializing dataset...
	Examples: 8264
	Features: 60
	Max length: 315
Standard scalar turned ON, loading params from cache
[FileBasedDataset] Dataset initialization complete
  epoch    auprc    auroc    train_loss    valid_acc    valid_loss    cp      dur
-------  -------  -------  ------------  -----------  ------------  ----  -------
      1   [36m0.2416[0m   [32m0.7507[0m        [35m0.2788[0m       [31m0.9202[0m        [94m0.2383[0m     +  31.2482
      2   [36m0.2586[0m   [32m0.7597[0m        [35m0.2368[0m       0.9045        0.2584        31.1570
      3   [36m0.2649[0m   [32m0.7646[0m        [35m0.2324[0m       0.9057        0.2515        31.4862
      4   [36m0.2733[0m   [32m0.7684[0m        [35m0.2304[0m       0.9081        0.2501        31.4109
      5   [36m0.2798[0m   [32m0.7700[0m        [35m0.2283[0m       0.9081        0.2578        30.8844
      6   0.2736   0.7697        [35m0.2270[0m       0.9045        0.2567        31.1818
      7   0.2639   0.7660        [35m0.2245[0m       0.9069        0.2535        31.3894
      8   0.2710   0.7677        0.2249       0.9069        0.2621        31.6236
      9   0.2685   0.7691        [35m0.2227[0m       0.9117        0.2561        31.1819
     10   0.2683   0.7691        [35m0.2209[0m       0.9105        0.2570        31.1565
Stopping since valid_loss has not improved in the last 10 epochs.
