[32m[I 2023-05-02 22:12:22,012][0m Trial 221 finished with value: 0.24616259446383387 and parameters: {'lr': 0.0005204679548555498, 'dropout': 0.45535377657672754, 'd_model_multiplier': 4, 'num_layers': 3, 'n_heads': 8, 'dim_feedforward': 259, 'batch_size': 13, 'pos_encoding': 'fixed', 'activation': 'relu', 'norm': 'LayerNorm', 'optimizer_name': 'AdamW', 'weight_decay': 0.1, 'top_n_features': 219}. Best is trial 117 with value: 0.191397856754288.[0m
[FileBasedDataset] Initializing dataset...
	Examples: 8264
	Features: 46
	Max length: 315
Standard scalar turned ON, loading params from cache
[FileBasedDataset] Dataset initialization complete
  epoch    auprc    auroc    train_loss    valid_acc    valid_loss    cp     dur
-------  -------  -------  ------------  -----------  ------------  ----  ------
      1   [36m0.2729[0m   [32m0.7307[0m        [35m0.2565[0m       [31m0.9214[0m        [94m0.2649[0m     +  9.9782
      2   [36m0.3062[0m   [32m0.7692[0m        [35m0.2437[0m       0.9202        [94m0.2455[0m     +  10.1356
      3   [36m0.3117[0m   0.7679        [35m0.2383[0m       0.9166        [94m0.2437[0m     +  10.3090
      4   [36m0.3245[0m   [32m0.7752[0m        [35m0.2353[0m       [31m0.9226[0m        [94m0.2436[0m     +  10.0321
      5   0.3215   0.7741        [35m0.2337[0m       0.9202        [94m0.2408[0m     +  10.2507
      6   0.3184   0.7583        [35m0.2332[0m       0.9214        0.2459        10.2611
      7   [36m0.3541[0m   0.7749        [35m0.2297[0m       0.9226        [94m0.2396[0m     +  10.2939
      8   0.3462   [32m0.7805[0m        [35m0.2276[0m       0.9190        [94m0.2391[0m     +  10.2308
      9   [36m0.3555[0m   0.7772        [35m0.2250[0m       [31m0.9238[0m        0.2446        10.2792
     10   0.3489   0.7754        0.2258       0.9238        0.2503        10.1704
     11   0.3407   0.7773        [35m0.2234[0m       0.9214        0.2541        10.2655
     12   [36m0.3591[0m   [32m0.7845[0m        [35m0.2224[0m       0.9214        0.2504        10.2204
     13   [36m0.3631[0m   [32m0.7851[0m        [35m0.2188[0m       0.9214        0.2543        10.3334
     14   0.3601   0.7839        [35m0.2185[0m       0.9214        0.2467        10.0526
     15   0.3617   [32m0.7885[0m        [35m0.2177[0m       [31m0.9250[0m        0.2455        10.2026
     16   [36m0.3651[0m   0.7835        [35m0.2172[0m       0.9226        0.2423        10.3776
     17   [36m0.3673[0m   [32m0.7902[0m        [35m0.2162[0m       0.9238        0.2420        9.8468
Stopping since valid_loss has not improved in the last 10 epochs.
[32m[I 2023-05-02 22:15:25,992][0m Trial 222 finished with value: 0.23906676570334198 and parameters: {'lr': 0.0007537008178325868, 'dropout': 0.46765714262928537, 'd_model_multiplier': 4, 'num_layers': 3, 'n_heads': 8, 'dim_feedforward': 185, 'batch_size': 16, 'pos_encoding': 'fixed', 'activation': 'relu', 'norm': 'LayerNorm', 'optimizer_name': 'AdamW', 'weight_decay': 0.1, 'top_n_features': 46}. Best is trial 117 with value: 0.191397856754288.[0m
[FileBasedDataset] Initializing dataset...
	Examples: 8264
	Features: 227
	Max length: 315
Standard scalar turned ON, loading params from cache
[FileBasedDataset] Dataset initialization complete
  epoch    auprc    auroc    train_loss    valid_acc    valid_loss    cp      dur
-------  -------  -------  ------------  -----------  ------------  ----  -------
      1   [36m0.2615[0m   [32m0.7227[0m        [35m0.2898[0m       [31m0.9178[0m        [94m0.2569[0m     +  10.2589
      2   [36m0.2852[0m   [32m0.7499[0m        [35m0.2474[0m       0.9178        0.2658        10.1307
      3   [36m0.2940[0m   [32m0.7573[0m        [35m0.2430[0m       [31m0.9202[0m        [94m0.2534[0m     +  10.5951
      4   0.2832   0.7531        [35m0.2390[0m       [31m0.9214[0m        0.2603        10.6613
      5   [36m0.3162[0m   [32m0.7629[0m        [35m0.2381[0m       0.9214        [94m0.2485[0m     +  10.8005
      6   [36m0.3163[0m   [32m0.7693[0m        [35m0.2365[0m       0.9214        0.2520        10.4357
      7   0.2897   0.7624        [35m0.2335[0m       0.9214        0.2502        10.6948
      8   0.2969   0.7656        [35m0.2328[0m       [31m0.9226[0m        0.2485        10.6904
      9   0.2963   0.7598        [35m0.2314[0m       0.9226        0.2561        10.6965
     10   0.2909   0.7611        [35m0.2304[0m       0.9190        0.2546        10.4257
     11   0.3079   0.7623        [35m0.2304[0m       0.9202        0.2538        10.5755
     12   [36m0.3188[0m   0.7675        [35m0.2281[0m       0.9226        0.2538        10.8164
     13   0.3108   [32m0.7718[0m        [35m0.2255[0m       0.9214        0.2555        10.5307
     14   0.3091   [32m0.7739[0m        [35m0.2247[0m       0.9226        0.2548        10.6171
Stopping since valid_loss has not improved in the last 10 epochs.
[32m[I 2023-05-02 22:18:04,806][0m Trial 223 finished with value: 0.24848271986557466 and parameters: {'lr': 0.0004106338922247913, 'dropout': 0.47956316412649, 'd_model_multiplier': 4, 'num_layers': 4, 'n_heads': 8, 'dim_feedforward': 323, 'batch_size': 75, 'pos_encoding': 'fixed', 'activation': 'relu', 'norm': 'LayerNorm', 'optimizer_name': 'AdamW', 'weight_decay': 0.1, 'top_n_features': 227}. Best is trial 117 with value: 0.191397856754288.[0m
[FileBasedDataset] Initializing dataset...
	Examples: 8264
	Features: 221
	Max length: 315
Standard scalar turned ON, loading params from cache
[FileBasedDataset] Dataset initialization complete
  epoch    auprc    auroc    train_loss    valid_acc    valid_loss    cp     dur
-------  -------  -------  ------------  -----------  ------------  ----  ------
      1   [36m0.2063[0m   [32m0.7182[0m        [35m0.2741[0m       [31m0.9202[0m        [94m0.2584[0m     +  9.3426
      2   [36m0.2381[0m   [32m0.7630[0m        [35m0.2472[0m       0.9141        [94m0.2486[0m     +  9.9346
      3   [36m0.2482[0m   [32m0.7694[0m        [35m0.2423[0m       0.9141        [94m0.2475[0m     +  9.7302
      4   [36m0.2634[0m   [32m0.7757[0m        [35m0.2393[0m       0.9154        0.2479        9.5555
      5   [36m0.2954[0m   [32m0.7791[0m        [35m0.2336[0m       0.9178        [94m0.2445[0m     +  9.7593
      6   [36m0.2981[0m   0.7771        [35m0.2312[0m       0.9202        [94m0.2422[0m     +  10.0203
      7   [36m0.3382[0m   [32m0.7877[0m        [35m0.2307[0m       [31m0.9226[0m        0.2433        9.9120
      8   0.3341   0.7845        [35m0.2268[0m       0.9214        0.2434        9.9381
      9   [36m0.3838[0m   0.7859        0.2276       [31m0.9250[0m        [94m0.2413[0m     +  10.1503
     10   0.3501   0.7792        [35m0.2216[0m       0.9238        0.2446        9.8995
     11   0.3628   0.7865        0.2239       [31m0.9274[0m        [94m0.2384[0m     +  9.7577
     12   0.3408   0.7841        0.2217       0.9202        0.2405        9.9591
     13   0.3444   0.7833        0.2221       0.9250        0.2488        9.6964
     14   0.3512   [32m0.7902[0m        [35m0.2189[0m       0.9274        0.2399        9.8536
     15   0.3472   0.7851        [35m0.2184[0m       0.9250        0.2538        9.8837
     16   0.3127   0.7849        0.2199       0.9141        0.2507        9.9358
     17   0.3552   0.7869        [35m0.2182[0m       0.9238        0.2535        9.7297
     18   0.3314   0.7810        0.2201       0.9214        0.2595        9.9285
     19   0.3252   0.7724        0.2188       0.9250        0.2624        10.0518
     20   0.3460   0.7789        [35m0.2149[0m       0.9262        0.2513        9.9602
Stopping since valid_loss has not improved in the last 10 epochs.
[32m[I 2023-05-02 22:21:32,284][0m Trial 224 finished with value: 0.23839068591162257 and parameters: {'lr': 0.0005539911692656839, 'dropout': 0.4263436585524305, 'd_model_multiplier': 4, 'num_layers': 3, 'n_heads': 8, 'dim_feedforward': 355, 'batch_size': 63, 'pos_encoding': 'fixed', 'activation': 'relu', 'norm': 'LayerNorm', 'optimizer_name': 'AdamW', 'weight_decay': 0.1, 'top_n_features': 221}. Best is trial 117 with value: 0.191397856754288.[0m
[FileBasedDataset] Initializing dataset...
	Examples: 8264
	Features: 22
	Max length: 315
Standard scalar turned ON, loading params from cache
[FileBasedDataset] Dataset initialization complete
  epoch    auprc    auroc    train_loss    valid_acc    valid_loss    cp      dur
-------  -------  -------  ------------  -----------  ------------  ----  -------
      1   [36m0.2335[0m   [32m0.6861[0m        [35m0.3157[0m       [31m0.9081[0m        [94m0.3811[0m     +  21.5310
      2   0.2332   [32m0.6956[0m        [35m0.2665[0m       0.9081        [94m0.3796[0m     +  21.9687
      3   [36m0.2375[0m   [32m0.6962[0m        [35m0.2587[0m       0.9081        0.3800        21.8110
      4   0.2237   0.6881        [35m0.2576[0m       0.9081        [94m0.3782[0m     +  21.7970
      5   0.2287   0.6942        [35m0.2534[0m       0.9081        [94m0.3670[0m     +  21.8687
      6   0.2208   0.6895        0.2539       0.9081        [94m0.3636[0m     +  21.8175
      7   0.2282   [32m0.6976[0m        [35m0.2518[0m       0.9081        [94m0.3476[0m     +  21.7245
      8   0.2290   0.6959        [35m0.2512[0m       0.9081        [94m0.3419[0m     +  21.6455
      9   0.2261   0.6927        0.2516       0.9081        [94m0.3288[0m     +  21.7605
     10   0.2173   0.6948        [35m0.2500[0m       0.9081        [94m0.3194[0m     +  21.8421
     11   0.2358   0.6928        0.2515       0.9081        [94m0.3148[0m     +  21.6996
     12   0.2256   [32m0.6986[0m        [35m0.2498[0m       0.9081        [94m0.3064[0m     +  21.8433
     13   [36m0.2478[0m   0.6972        0.2508       0.9081        [94m0.2953[0m     +  21.6611
     14   0.2247   0.6966        0.2501       0.9081        0.2999        21.8314
     15   0.2376   0.6981        [35m0.2494[0m       0.9081        [94m0.2852[0m     +  21.8066
     16   0.2187   0.6981        [35m0.2486[0m       0.9081        0.2867        21.7383
     17   0.2238   0.6970        [35m0.2483[0m       0.9081        0.2859        21.7171
     18   [36m0.2510[0m   [32m0.7048[0m        [35m0.2464[0m       0.9081        0.2854        21.7633
     19   0.2487   0.7026        0.2482       0.9081        [94m0.2836[0m     +  21.7865
     20   0.2455   0.6990        0.2483       0.9081        0.2844        21.7405
     21   0.2445   0.7043        0.2471       0.9081        [94m0.2830[0m     +  21.7821
     22   [36m0.2525[0m   [32m0.7052[0m        0.2481       0.9081        0.2861        21.7577
     23   0.2493   0.7007        0.2480       0.9081        0.2831        21.7455
     24   0.2458   0.6958        0.2473       0.9081        0.2841        22.5166
     25   0.2467   0.6962        0.2472       0.9081        [94m0.2830[0m     +  21.7031
     26   0.2521   0.6936        [35m0.2455[0m       0.9081        [94m0.2829[0m     +  21.7756
     27   0.2425   0.6977        0.2465       0.9081        [94m0.2828[0m     +  21.6091
     28   0.2477   0.6961        0.2474       0.9081        [94m0.2826[0m     +  21.7018
     29   0.2436   0.6988        0.2470       0.9081        0.2839        21.7746
     30   0.2418   0.6989        0.2462       0.9081        [94m0.2825[0m     +  21.8072
     31   0.2319   0.6946        [35m0.2449[0m       0.9081        0.2829        21.7311
     32   0.2391   0.6958        0.2475       0.9081        [94m0.2825[0m     +  21.8022
     33   0.2349   0.6921        0.2463       0.9081        0.2827        21.8065
     34   0.2436   0.6926        0.2460       0.9081        0.2825        21.7102
     35   0.2439   0.6941        0.2453       0.9081        0.2840        21.7670
     36   0.2461   0.6973        0.2466       0.9081        0.2832        21.6124
     37   0.2393   0.7002        0.2458       0.9081        0.2831        21.8671
     38   0.2407   0.6955        0.2459       0.9081        0.2837        21.7798
     39   0.2394   0.6969        0.2459       0.9081        0.2839        21.6707
     40   0.2253   0.6968        0.2465       0.9081        0.2862        21.8604
     41   0.2297   0.6949        0.2471       0.9081        0.2864        21.6630
Stopping since valid_loss has not improved in the last 10 epochs.
[32m[I 2023-05-02 22:36:51,277][0m Trial 225 finished with value: 0.2824831089002622 and parameters: {'lr': 0.000950881908069491, 'dropout': 0.4404815427529027, 'd_model_multiplier': 8, 'num_layers': 4, 'n_heads': 32, 'dim_feedforward': 344, 'batch_size': 15, 'pos_encoding': 'fixed', 'activation': 'relu', 'norm': 'LayerNorm', 'optimizer_name': 'AdamW', 'weight_decay': 0.1, 'top_n_features': 22}. Best is trial 117 with value: 0.191397856754288.[0m
[FileBasedDataset] Initializing dataset...
	Examples: 8264
	Features: 63
	Max length: 315
Standard scalar turned ON, loading params from cache
[FileBasedDataset] Dataset initialization complete
  epoch    auprc    auroc    train_loss    valid_acc    valid_loss    cp     dur
-------  -------  -------  ------------  -----------  ------------  ----  ------
      1   [36m0.0636[0m   [32m0.4245[0m        [35m0.6156[0m       [31m0.9274[0m        [94m0.5142[0m     +  9.3520
      2   0.0630   0.4216        [35m0.5062[0m       0.9274        [94m0.4232[0m     +  9.6456
      3   [36m0.0661[0m   [32m0.4392[0m        [35m0.4365[0m       0.9274        [94m0.3695[0m     +  9.3101
      4   [36m0.0685[0m   [32m0.4617[0m        [35m0.3906[0m       0.9274        [94m0.3362[0m     +  9.5761
      5   [36m0.0720[0m   [32m0.4877[0m        [35m0.3623[0m       0.9274        [94m0.3131[0m     +  9.5671
      6   [36m0.0798[0m   [32m0.5159[0m        [35m0.3376[0m       0.9274        [94m0.2968[0m     +  9.9188
      7   [36m0.0912[0m   [32m0.5406[0m        [35m0.3222[0m       0.9274        [94m0.2850[0m     +  9.9146
      8   [36m0.1047[0m   [32m0.5615[0m        [35m0.3085[0m       0.9274        [94m0.2759[0m     +  9.9562
      9   [36m0.1156[0m   [32m0.5835[0m        [35m0.2987[0m       0.9274        [94m0.2689[0m     +  9.6483
     10   [36m0.1283[0m   [32m0.6015[0m        [35m0.2900[0m       0.9274        [94m0.2636[0m     +  10.0600
     11   [36m0.1366[0m   [32m0.6172[0m        [35m0.2826[0m       0.9274        [94m0.2592[0m     +  9.9000
     12   [36m0.1423[0m   [32m0.6317[0m        [35m0.2745[0m       0.9262        [94m0.2557[0m     +  9.8827
     13   [36m0.1489[0m   [32m0.6435[0m        [35m0.2710[0m       0.9238        [94m0.2529[0m     +  10.1633
     14   [36m0.1546[0m   [32m0.6550[0m        [35m0.2674[0m       0.9238        [94m0.2505[0m     +  9.6729
     15   [36m0.1632[0m   [32m0.6659[0m        [35m0.2630[0m       0.9226        [94m0.2483[0m     +  9.3960
     16   [36m0.1713[0m   [32m0.6757[0m        [35m0.2620[0m       0.9238        [94m0.2464[0m     +  9.4624
     17   [36m0.1772[0m   [32m0.6861[0m        [35m0.2572[0m       0.9226        [94m0.2448[0m     +  9.5607
     18   [36m0.1845[0m   [32m0.6947[0m        [35m0.2549[0m       0.9226        [94m0.2433[0m     +  9.7738
     19   [36m0.1911[0m   [32m0.7022[0m        [35m0.2531[0m       0.9226        [94m0.2420[0m     +  9.8023
     20   [36m0.1958[0m   [32m0.7081[0m        [35m0.2526[0m       0.9226        [94m0.2408[0m     +  9.7626
     21   [36m0.2011[0m   [32m0.7136[0m        [35m0.2509[0m       0.9226        [94m0.2397[0m     +  9.3959
     22   [36m0.2057[0m   [32m0.7177[0m        [35m0.2493[0m       0.9250        [94m0.2388[0m     +  9.9478
     23   [36m0.2088[0m   [32m0.7215[0m        [35m0.2453[0m       0.9262        [94m0.2381[0m     +  9.8820
     24   [36m0.2121[0m   [32m0.7253[0m        0.2456       0.9250        [94m0.2376[0m     +  9.9443
     25   [36m0.2156[0m   [32m0.7295[0m        [35m0.2448[0m       0.9250        [94m0.2370[0m     +  9.8904
     26   [36m0.2201[0m   [32m0.7326[0m        0.2452       0.9238        [94m0.2366[0m     +  9.6673
     27   [36m0.2227[0m   [32m0.7354[0m        [35m0.2433[0m       0.9226        [94m0.2361[0m     +  9.5714
     28   [36m0.2259[0m   [32m0.7382[0m        [35m0.2425[0m       0.9226        [94m0.2357[0m     +  9.6883
     29   [36m0.2280[0m   [32m0.7404[0m        [35m0.2417[0m       0.9226        [94m0.2354[0m     +  9.4747
     30   [36m0.2324[0m   [32m0.7415[0m        [35m0.2415[0m       0.9226        [94m0.2353[0m     +  9.6195
     31   0.2315   [32m0.7428[0m        0.2416       0.9214        [94m0.2353[0m     +  9.6661
     32   [36m0.2334[0m   [32m0.7443[0m        [35m0.2411[0m       0.9214        [94m0.2350[0m     +  9.7152
     33   [36m0.2375[0m   [32m0.7452[0m        [35m0.2409[0m       0.9202        0.2350        9.7988
     34   [36m0.2385[0m   [32m0.7457[0m        [35m0.2393[0m       0.9214        [94m0.2348[0m     +  9.8099
     35   [36m0.2390[0m   [32m0.7465[0m        [35m0.2389[0m       0.9202        0.2348        9.8314
     36   [36m0.2402[0m   [32m0.7475[0m        0.2394       0.9190        [94m0.2345[0m     +  9.9276
     37   [36m0.2425[0m   [32m0.7479[0m        [35m0.2383[0m       0.9190        [94m0.2344[0m     +  9.7044
     38   [36m0.2441[0m   [32m0.7483[0m        0.2384       0.9190        0.2345        9.8782
     39   [36m0.2445[0m   [32m0.7488[0m        [35m0.2377[0m       0.9190        [94m0.2344[0m     +  9.7691
     40   0.2444   [32m0.7492[0m        0.2384       0.9190        [94m0.2343[0m     +  9.6156
     41   0.2439   [32m0.7492[0m        [35m0.2376[0m       0.9190        [94m0.2343[0m     +  9.6072
     42   0.2444   [32m0.7497[0m        [35m0.2350[0m       0.9202        [94m0.2342[0m     +  9.7938
     43   0.2442   0.7497        0.2384       0.9202        0.2343        9.5525
     44   [36m0.2446[0m   [32m0.7497[0m        0.2360       0.9202        0.2344        9.6810
     45   [36m0.2456[0m   [32m0.7505[0m        0.2361       0.9202        0.2343        9.7658
     46   [36m0.2472[0m   [32m0.7510[0m        0.2369       0.9202        [94m0.2341[0m     +  9.5342
     47   0.2460   0.7507        0.2373       0.9202        0.2342        9.6385
     48   0.2467   [32m0.7512[0m        0.2352       0.9178        [94m0.2341[0m     +  9.8632
     49   0.2461   0.7508        0.2355       0.9190        0.2343        9.6271
     50   0.2464   0.7509        0.2357       0.9178        [94m0.2341[0m     +  9.7048
