[32m[I 2023-05-04 20:22:55,088][0m Trial 488 finished with value: 0.2723433031929159 and parameters: {'lr': 0.004163953150037487, 'dropout': 0.6670370566427266, 'd_model_multiplier': 4, 'num_layers': 6, 'n_heads': 32, 'dim_feedforward': 331, 'batch_size': 64, 'pos_encoding': 'fixed', 'activation': 'relu', 'norm': 'LayerNorm', 'optimizer_name': 'RAdam', 'weight_decay': 0.1, 'top_n_features': 66}. Best is trial 246 with value: 0.16447311791139763.[0m
[FileBasedDataset] Initializing dataset...
	Examples: 8264
	Features: 59
	Max length: 315
Standard scalar turned ON, loading params from cache
[FileBasedDataset] Dataset initialization complete
  epoch    auprc    auroc    train_loss    valid_acc    valid_loss    cp      dur
-------  -------  -------  ------------  -----------  ------------  ----  -------
      1   [36m0.0596[0m   [32m0.3434[0m        [35m0.4677[0m       [31m0.9166[0m        [94m0.3246[0m     +  21.6423
      2   [36m0.2045[0m   [32m0.6372[0m        [35m0.2891[0m       0.9166        [94m0.2779[0m     +  21.7215
      3   [36m0.2528[0m   [32m0.7011[0m        [35m0.2563[0m       0.9166        [94m0.2673[0m     +  22.0683
      4   [36m0.2834[0m   [32m0.7294[0m        [35m0.2475[0m       0.9154        [94m0.2600[0m     +  22.0780
      5   [36m0.3164[0m   [32m0.7432[0m        [35m0.2416[0m       0.9166        [94m0.2534[0m     +  22.0964
      6   [36m0.3277[0m   [32m0.7493[0m        [35m0.2384[0m       [31m0.9178[0m        [94m0.2522[0m     +  22.1355
      7   [36m0.3329[0m   [32m0.7521[0m        [35m0.2356[0m       0.9178        [94m0.2522[0m     +  22.0652
      8   [36m0.3371[0m   [32m0.7560[0m        [35m0.2331[0m       [31m0.9202[0m        0.2523        22.4982
      9   [36m0.3426[0m   [32m0.7583[0m        0.2336       0.9202        [94m0.2520[0m     +  22.0362
     10   [36m0.3445[0m   [32m0.7595[0m        [35m0.2313[0m       0.9190        0.2536        21.9462
     11   [36m0.3542[0m   [32m0.7620[0m        [35m0.2309[0m       0.9178        0.2536        22.0056
     12   0.3518   [32m0.7628[0m        [35m0.2288[0m       0.9178        0.2553        21.8566
     13   0.3523   [32m0.7646[0m        0.2297       [31m0.9214[0m        0.2534        21.8383
     14   0.3524   [32m0.7662[0m        0.2295       0.9202        0.2527        21.8646
     15   [36m0.3572[0m   [32m0.7679[0m        0.2298       0.9190        0.2533        21.8091
     16   [36m0.3577[0m   [32m0.7690[0m        0.2289       0.9166        0.2531        21.8348
     17   [36m0.3589[0m   [32m0.7694[0m        [35m0.2272[0m       0.9166        0.2522        21.8758
     18   0.3578   0.7688        [35m0.2253[0m       0.9166        0.2556        22.0038
Stopping since valid_loss has not improved in the last 10 epochs.
[32m[I 2023-05-04 20:29:53,712][0m Trial 489 finished with value: 0.25203626297477366 and parameters: {'lr': 3.226603529759864e-05, 'dropout': 0.5680499903513823, 'd_model_multiplier': 8, 'num_layers': 4, 'n_heads': 32, 'dim_feedforward': 452, 'batch_size': 71, 'pos_encoding': 'fixed', 'activation': 'relu', 'norm': 'LayerNorm', 'optimizer_name': 'PlainRAdam', 'weight_decay': 0.1, 'top_n_features': 59}. Best is trial 246 with value: 0.16447311791139763.[0m
[FileBasedDataset] Initializing dataset...
	Examples: 8264
	Features: 70
	Max length: 315
Standard scalar turned ON, loading params from cache
[FileBasedDataset] Dataset initialization complete
  epoch    auprc    auroc    train_loss    valid_acc    valid_loss    cp      dur
-------  -------  -------  ------------  -----------  ------------  ----  -------
      1   [36m0.2834[0m   [32m0.7312[0m        [35m0.3228[0m       [31m0.9069[0m        [94m0.3388[0m     +  29.9631
      2   [36m0.3112[0m   0.7236        [35m0.2688[0m       [31m0.9081[0m        0.4068        30.4244
      3   0.2470   0.6843        [35m0.2613[0m       0.9069        0.4527        30.3037
      4   0.3080   [32m0.7320[0m        [35m0.2584[0m       [31m0.9105[0m        0.4049        30.4262
      5   [36m0.3333[0m   [32m0.7517[0m        [35m0.2489[0m       0.9105        0.3621        30.1101
      6   0.2887   0.7352        [35m0.2468[0m       0.9081        0.4686        30.6206
      7   0.3210   [32m0.7677[0m        0.2491       0.9081        0.3487        30.8365
      8   [36m0.3492[0m   [32m0.7802[0m        [35m0.2371[0m       0.9081        [94m0.3167[0m     +  30.5534
      9   0.3265   0.7673        0.2442       0.9069        0.3628        30.4852
     10   0.3169   0.7599        0.2372       0.9105        0.4091        30.5899
     11   0.3098   0.7704        0.2383       0.9057        0.3489        30.5420
     12   0.3121   [32m0.7823[0m        0.2383       0.9069        0.3270        30.5555
     13   0.3263   0.7744        [35m0.2303[0m       0.9081        0.3651        30.5123
     14   0.3074   0.7806        0.2334       0.9045        0.3480        30.3728
     15   0.3076   0.7737        0.2330       0.9057        0.3442        30.0220
     16   0.3023   0.7682        0.2313       0.9069        0.3537        30.5692
     17   0.3210   0.7736        [35m0.2264[0m       0.9069        0.3420        30.4483
Stopping since valid_loss has not improved in the last 10 epochs.
[32m[I 2023-05-04 20:39:02,977][0m Trial 490 finished with value: 0.31666344729676715 and parameters: {'lr': 0.0002652435396219593, 'dropout': 0.4511177903792686, 'd_model_multiplier': 32, 'num_layers': 3, 'n_heads': 32, 'dim_feedforward': 443, 'batch_size': 82, 'pos_encoding': 'fixed', 'activation': 'relu', 'norm': 'LayerNorm', 'optimizer_name': 'AdamW', 'weight_decay': 0.001, 'top_n_features': 70}. Best is trial 246 with value: 0.16447311791139763.[0m
[FileBasedDataset] Initializing dataset...
	Examples: 8264
	Features: 61
	Max length: 315
Standard scalar turned ON, loading params from cache
[FileBasedDataset] Dataset initialization complete
  epoch    auprc    auroc    train_loss    valid_acc    valid_loss    cp      dur
-------  -------  -------  ------------  -----------  ------------  ----  -------
      1   [36m0.2410[0m   [32m0.7002[0m        [35m0.3608[0m       [31m0.9154[0m        [94m0.2654[0m     +  27.0595
      2   [36m0.3216[0m   [32m0.7785[0m        [35m0.2396[0m       [31m0.9202[0m        [94m0.2456[0m     +  27.0950
      3   [36m0.3278[0m   [32m0.7846[0m        [35m0.2292[0m       [31m0.9262[0m        [94m0.2447[0m     +  27.0580
      4   [36m0.3406[0m   [32m0.7888[0m        [35m0.2286[0m       0.9226        0.2450        27.3140
      5   0.3262   [32m0.7908[0m        [35m0.2259[0m       0.9178        0.2461        27.3474
      6   0.3352   [32m0.7966[0m        [35m0.2246[0m       0.9178        0.2471        27.4203
      7   0.3134   [32m0.7969[0m        [35m0.2231[0m       0.9154        0.2481        27.8044
      8   0.3304   [32m0.7993[0m        [35m0.2224[0m       0.9141        0.2487        27.4412
      9   0.3127   0.7963        [35m0.2196[0m       0.9141        0.2524        27.3546
     10   0.3154   0.7984        [35m0.2187[0m       0.9093        0.2562        27.3055
     11   0.3087   0.7975        [35m0.2179[0m       0.9141        0.2548        27.3291
     12   0.3211   [32m0.8025[0m        [35m0.2151[0m       0.9117        0.2541        27.4960
Stopping since valid_loss has not improved in the last 10 epochs.
[32m[I 2023-05-04 20:44:59,026][0m Trial 491 finished with value: 0.24473300215843366 and parameters: {'lr': 0.00014090815378506213, 'dropout': 0.30710615325570306, 'd_model_multiplier': 4, 'num_layers': 6, 'n_heads': 32, 'dim_feedforward': 300, 'batch_size': 60, 'pos_encoding': 'fixed', 'activation': 'relu', 'norm': 'LayerNorm', 'optimizer_name': 'RAdam', 'weight_decay': 0.1, 'top_n_features': 61}. Best is trial 246 with value: 0.16447311791139763.[0m
[FileBasedDataset] Initializing dataset...
	Examples: 8264
	Features: 85
	Max length: 315
Standard scalar turned ON, loading params from cache
[FileBasedDataset] Dataset initialization complete
  epoch    auprc    auroc    train_loss    valid_acc    valid_loss    cp     dur
-------  -------  -------  ------------  -----------  ------------  ----  ------
      1   [36m0.1534[0m   [32m0.6515[0m        [35m0.7196[0m       [31m0.5018[0m        [94m0.6958[0m     +  9.2073
      2   [36m0.1564[0m   0.6457        [35m0.7025[0m       [31m0.5308[0m        [94m0.6944[0m     +  9.0349
      3   [36m0.1582[0m   [32m0.6567[0m        [35m0.6878[0m       0.5030        0.6945        9.2944
      4   [36m0.1714[0m   [32m0.6572[0m        [35m0.6648[0m       0.5042        [94m0.6942[0m     +  9.5777
      5   0.1556   [32m0.6623[0m        [35m0.6433[0m       0.5091        [94m0.6934[0m     +  9.5771
      6   0.1595   0.6520        [35m0.6216[0m       [31m0.5780[0m        [94m0.6908[0m     +  9.7111
      7   0.1291   0.6369        [35m0.5976[0m       [31m0.6143[0m        [94m0.6875[0m     +  9.3719
      8   0.1140   0.6049        [35m0.5773[0m       [31m0.7037[0m        [94m0.6841[0m     +  9.5971
      9   0.1140   0.6022        [35m0.5549[0m       0.6917        0.6847        9.6314
     10   0.0980   0.5545        [35m0.5303[0m       [31m0.7654[0m        [94m0.6800[0m     +  9.5374
     11   0.0922   0.5232        [35m0.5056[0m       [31m0.8561[0m        [94m0.6714[0m     +  9.5487
     12   0.0931   0.5252        [35m0.4873[0m       0.8307        0.6744        9.4422
     13   0.0752   0.4452        [35m0.4661[0m       [31m0.8888[0m        [94m0.6606[0m     +  9.4592
     14   0.0800   0.4705        [35m0.4514[0m       [31m0.8924[0m        0.6637        9.3286
     15   0.0716   0.4439        [35m0.4333[0m       [31m0.9141[0m        [94m0.6372[0m     +  9.6432
     16   0.0711   0.4314        [35m0.4200[0m       [31m0.9154[0m        [94m0.6364[0m     +  9.5949
     17   0.0700   0.4330        [35m0.4016[0m       0.9129        [94m0.6305[0m     +  9.6501
     18   0.0680   0.4183        [35m0.3899[0m       [31m0.9166[0m        [94m0.6302[0m     +  9.4717
     19   0.0721   0.4470        [35m0.3837[0m       [31m0.9178[0m        [94m0.6078[0m     +  9.8544
     20   0.0670   0.4140        [35m0.3718[0m       [31m0.9202[0m        0.6123        9.5935
     21   0.0696   0.4436        [35m0.3660[0m       0.9202        [94m0.5661[0m     +  9.6256
     22   0.0695   0.4381        [35m0.3533[0m       0.9202        [94m0.5622[0m     +  9.5250
     23   0.0729   0.4668        [35m0.3451[0m       0.9202        [94m0.5539[0m     +  9.6818
     24   0.0732   0.4703        [35m0.3446[0m       0.9202        [94m0.5470[0m     +  9.5763
     25   0.0749   0.4805        [35m0.3372[0m       0.9202        [94m0.5435[0m     +  9.5373
     26   0.0787   0.5043        [35m0.3300[0m       0.9202        [94m0.5325[0m     +  9.7950
     27   0.0793   0.5048        [35m0.3234[0m       0.9202        [94m0.5208[0m     +  9.3752
     28   0.0806   0.5087        0.3237       0.9202        [94m0.5079[0m     +  9.6224
     29   0.0824   0.5193        [35m0.3203[0m       0.9202        0.5295        9.4432
     30   0.0893   0.5465        [35m0.3161[0m       0.9202        [94m0.4858[0m     +  9.4452
     31   0.0919   0.5553        [35m0.3113[0m       0.9202        [94m0.4694[0m     +  9.3035
     32   0.0950   0.5619        0.3121       0.9202        [94m0.4660[0m     +  9.2978
     33   0.0991   0.5730        [35m0.3099[0m       0.9202        0.4729        9.6586
     34   0.1072   0.5869        [35m0.3034[0m       0.9202        0.4785        9.4504
     35   0.1129   0.5986        [35m0.3016[0m       0.9202        [94m0.4612[0m     +  9.6222
     36   0.1175   0.6069        0.3052       0.9202        [94m0.4596[0m     +  9.6857
     37   0.1223   0.6204        [35m0.3003[0m       0.9202        [94m0.4586[0m     +  9.5357
     38   0.1277   0.6149        [35m0.2997[0m       0.9202        0.4591        9.6947
     39   0.1350   0.6298        [35m0.2972[0m       0.9202        [94m0.4362[0m     +  9.3748
     40   0.1388   0.6321        0.2999       0.9202        0.4388        9.5460
     41   0.1409   0.6395        [35m0.2899[0m       0.9202        [94m0.4130[0m     +  9.5650
     42   0.1499   0.6462        0.2944       0.9190        0.4315        9.5849
     43   0.1535   0.6518        0.2923       0.9202        [94m0.4051[0m     +  9.5841
     44   0.1549   0.6498        0.2921       0.9178        0.4381        9.2021
     45   0.1579   0.6579        0.2934       0.9190        0.4118        9.4285
     46   0.1608   [32m0.6636[0m        0.2920       0.9190        0.4083        9.6351
     47   0.1639   [32m0.6644[0m        [35m0.2880[0m       0.9178        0.4118        9.7269
     48   0.1659   [32m0.6648[0m        0.2892       0.9190        [94m0.3963[0m     +  9.4285
     49   0.1713   [32m0.6703[0m        [35m0.2872[0m       0.9178        0.4037        9.6759
     50   [36m0.1768[0m   [32m0.6758[0m        0.2890       0.9178        [94m0.3848[0m     +  9.4744
[32m[I 2023-05-04 20:52:58,233][0m Trial 492 finished with value: 0.38482100131866287 and parameters: {'lr': 6.395798201420775e-06, 'dropout': 0.5158627955203665, 'd_model_multiplier': 4, 'num_layers': 5, 'n_heads': 4, 'dim_feedforward': 352, 'batch_size': 53, 'pos_encoding': 'learnable', 'activation': 'gelu', 'norm': 'BatchNorm', 'optimizer_name': 'RAdam', 'weight_decay': 0.1, 'top_n_features': 85}. Best is trial 246 with value: 0.16447311791139763.[0m
[FileBasedDataset] Initializing dataset...
	Examples: 8264
	Features: 51
	Max length: 315
Standard scalar turned ON, loading params from cache
[FileBasedDataset] Dataset initialization complete
  epoch    auprc    auroc    train_loss    valid_acc    valid_loss    cp      dur
-------  -------  -------  ------------  -----------  ------------  ----  -------
      1   [36m0.2784[0m   [32m0.7788[0m        [35m0.2896[0m       [31m0.9093[0m        [94m0.2480[0m     +  19.9396
      2   [36m0.2964[0m   [32m0.7900[0m        [35m0.2398[0m       [31m0.9166[0m        0.2505        20.0330
      3   0.2931   0.7873        [35m0.2350[0m       0.9166        0.2501        20.0490
      4   0.2892   0.7842        [35m0.2344[0m       0.9154        0.2529        20.1042
      5   0.2915   0.7860        [35m0.2324[0m       0.9166        0.2525        20.3492
      6   0.2909   0.7846        [35m0.2302[0m       0.9129        0.2527        20.1221
      7   0.2924   0.7847        [35m0.2300[0m       0.9141        0.2519        20.3501
      8   [36m0.3025[0m   0.7859        [35m0.2286[0m       0.9154        0.2504        20.1373
      9   0.2979   0.7869        0.2295       0.9166        0.2524        20.2663
     10   [36m0.3104[0m   0.7885        [35m0.2267[0m       0.9154        0.2553        20.2006
Stopping since valid_loss has not improved in the last 10 epochs.
[32m[I 2023-05-04 20:56:40,356][0m Trial 493 finished with value: 0.24795732284111152 and parameters: {'lr': 8.861860904202104e-05, 'dropout': 0.5380472707875124, 'd_model_multiplier': 4, 'num_layers': 4, 'n_heads': 32, 'dim_feedforward': 342, 'batch_size': 68, 'pos_encoding': 'fixed', 'activation': 'relu', 'norm': 'LayerNorm', 'optimizer_name': 'AdamW', 'weight_decay': 0.1, 'top_n_features': 51}. Best is trial 246 with value: 0.16447311791139763.[0m
[FileBasedDataset] Initializing dataset...
	Examples: 8264
	Features: 65
	Max length: 315
Standard scalar turned ON, loading params from cache
[FileBasedDataset] Dataset initialization complete
  epoch    auprc    auroc    train_loss    valid_acc    valid_loss    cp      dur
-------  -------  -------  ------------  -----------  ------------  ----  -------
      1   [36m0.2586[0m   [32m0.7204[0m        [35m0.3865[0m       [31m0.9202[0m        [94m0.2407[0m     +  46.1067
      2   [36m0.2954[0m   [32m0.7625[0m        [35m0.2423[0m       [31m0.9214[0m        [94m0.2338[0m     +  46.3346
      3   0.2843   [32m0.7677[0m        [35m0.2346[0m       [31m0.9226[0m        0.2378        46.3905
      4   0.2812   [32m0.7720[0m        [35m0.2323[0m       [31m0.9238[0m        0.2398        46.3121
      5   0.2810   [32m0.7742[0m        [35m0.2294[0m       0.9214        0.2427        46.4284
      6   0.2762   0.7741        [35m0.2275[0m       0.9214        0.2454        46.5096
      7   0.2773   [32m0.7749[0m        [35m0.2271[0m       0.9214        0.2461        46.3672
      8   0.2778   0.7743        [35m0.2242[0m       0.9202        0.2476        46.2892
      9   0.2816   0.7744        [35m0.2222[0m       0.9214        0.2501        46.4632
     10   0.2827   0.7737        [35m0.2207[0m       0.9214        0.2506        46.5219
     11   0.2781   [32m0.7756[0m        [35m0.2199[0m       0.9190        0.2504        46.4734
Stopping since valid_loss has not improved in the last 10 epochs.
[32m[I 2023-05-04 21:05:57,831][0m Trial 494 finished with value: 0.23379956447083544 and parameters: {'lr': 1.4017837738244384e-05, 'dropout': 0.3456076085881248, 'd_model_multiplier': 8, 'num_layers': 5, 'n_heads': 64, 'dim_feedforward': 323, 'batch_size': 27, 'pos_encoding': 'fixed', 'activation': 'relu', 'norm': 'LayerNorm', 'optimizer_name': 'PlainRAdam', 'weight_decay': 0.001, 'top_n_features': 65}. Best is trial 246 with value: 0.16447311791139763.[0m
[FileBasedDataset] Initializing dataset...
	Examples: 8264
	Features: 45
	Max length: 315
Standard scalar turned ON, loading params from cache
[FileBasedDataset] Dataset initialization complete
  epoch    auprc    auroc    train_loss    valid_acc    valid_loss    cp      dur
-------  -------  -------  ------------  -----------  ------------  ----  -------
      1   [36m0.2459[0m   [32m0.7211[0m        [35m0.2771[0m       [31m0.9069[0m        [94m0.3060[0m     +  56.6147
      2   0.2388   0.7102        [35m0.2630[0m       0.9069        0.3120        56.9608
      3   0.2392   0.7110        [35m0.2611[0m       0.9057        0.3142        56.8826
      4   0.2364   0.7087        [35m0.2582[0m       0.9045        0.3223        57.0247
      5   0.2379   0.7125        [35m0.2541[0m       0.9069        0.3159        57.1081
      6   0.2427   0.7118        0.2543       0.9069        0.3186        57.0016
      7   0.2340   0.7125        0.2557       0.9069        0.3247        56.9580
      8   0.2246   0.7100        [35m0.2537[0m       [31m0.9081[0m        0.3278        56.9086
      9   0.2267   0.7104        [35m0.2518[0m       0.9069        0.3153        57.0061
     10   0.2300   0.7122        [35m0.2505[0m       0.9069        0.3198        56.8318
Stopping since valid_loss has not improved in the last 10 epochs.
[32m[I 2023-05-04 21:16:24,811][0m Trial 495 finished with value: 0.3060079520926366 and parameters: {'lr': 0.0026472947019409525, 'dropout': 0.6135190295000892, 'd_model_multiplier': 4, 'num_layers': 14, 'n_heads': 32, 'dim_feedforward': 334, 'batch_size': 46, 'pos_encoding': 'fixed', 'activation': 'relu', 'norm': 'LayerNorm', 'optimizer_name': 'RAdam', 'weight_decay': 0.1, 'top_n_features': 45}. Best is trial 246 with value: 0.16447311791139763.[0m
[FileBasedDataset] Initializing dataset...
	Examples: 8264
	Features: 78
	Max length: 315
Standard scalar turned ON, loading params from cache
[FileBasedDataset] Dataset initialization complete
  epoch    auprc    auroc    train_loss    valid_acc    valid_loss    cp      dur
-------  -------  -------  ------------  -----------  ------------  ----  -------
      1   [36m0.1330[0m   [32m0.6103[0m        [35m0.8423[0m       [31m0.8634[0m        [94m0.3426[0m     +  27.4276
      2   [36m0.1489[0m   [32m0.6407[0m        [35m0.2763[0m       [31m0.9214[0m        [94m0.2704[0m     +  27.9645
      3   0.1463   [32m0.6516[0m        [35m0.2559[0m       0.9214        [94m0.2666[0m     +  27.7276
      4   [36m0.1518[0m   [32m0.6522[0m        [35m0.2557[0m       0.9214        [94m0.2642[0m     +  27.8364
      5   0.1460   0.6472        [35m0.2551[0m       0.9214        0.2643        27.9071
      6   0.1511   [32m0.6559[0m        [35m0.2533[0m       0.9214        [94m0.2622[0m     +  27.8720
      7   0.1483   0.6553        [35m0.2529[0m       0.9214        0.2631        27.9399
      8   0.1467   0.6521        [35m0.2517[0m       0.9214        0.2630        27.6204
      9   0.1437   0.6491        0.2532       0.9214        0.2639        27.7126
     10   0.1449   0.6493        0.2551       0.9214        0.2633        27.7759
     11   0.1484   0.6529        0.2531       0.9214        0.2630        27.9334
     12   [36m0.1535[0m   0.6551        [35m0.2503[0m       0.9214        0.2636        28.0025
     13   0.1463   0.6518        0.2510       0.9214        0.2638        27.7008
     14   0.1451   0.6529        0.2512       0.9214        0.2636        28.1975
     15   0.1494   [32m0.6593[0m        0.2515       0.9214        0.2639        28.1940
Stopping since valid_loss has not improved in the last 10 epochs.
