[32m[I 2023-05-03 10:19:31,190][0m Trial 334 finished with value: 0.26280482288139184 and parameters: {'lr': 2.8546863635989452e-05, 'dropout': 0.4387614995920764, 'd_model_multiplier': 4, 'num_layers': 5, 'n_heads': 32, 'dim_feedforward': 360, 'batch_size': 24, 'pos_encoding': 'fixed', 'activation': 'relu', 'norm': 'LayerNorm', 'optimizer_name': 'RAdam', 'weight_decay': 0.001, 'top_n_features': 74}. Best is trial 246 with value: 0.16447311791139763.[0m
[FileBasedDataset] Initializing dataset...
	Examples: 8264
	Features: 53
	Max length: 315
Standard scalar turned ON, loading params from cache
[FileBasedDataset] Dataset initialization complete
  epoch    auprc    auroc    train_loss    valid_acc    valid_loss    cp      dur
-------  -------  -------  ------------  -----------  ------------  ----  -------
      1   [36m0.0551[0m   [32m0.2909[0m        [35m0.6351[0m       [31m0.9287[0m        [94m0.5861[0m     +  23.9384
      2   0.0520   [32m0.3013[0m        [35m0.5478[0m       0.9287        [94m0.4843[0m     +  23.8868
      3   0.0514   [32m0.3136[0m        [35m0.4587[0m       0.9287        [94m0.3962[0m     +  24.0556
      4   0.0531   [32m0.3403[0m        [35m0.3909[0m       0.9287        [94m0.3370[0m     +  23.9848
      5   [36m0.0581[0m   [32m0.4101[0m        [35m0.3433[0m       0.9287        [94m0.3009[0m     +  23.9674
      6   [36m0.0674[0m   [32m0.4838[0m        [35m0.3139[0m       0.9287        [94m0.2793[0m     +  24.0871
      7   [36m0.0909[0m   [32m0.5415[0m        [35m0.2947[0m       0.9287        [94m0.2661[0m     +  23.9690
      8   [36m0.1170[0m   [32m0.5800[0m        [35m0.2818[0m       0.9287        [94m0.2578[0m     +  23.9450
      9   [36m0.1346[0m   [32m0.6047[0m        [35m0.2741[0m       0.9287        [94m0.2525[0m     +  23.9323
     10   [36m0.1487[0m   [32m0.6222[0m        [35m0.2654[0m       0.9287        [94m0.2488[0m     +  23.8831
     11   [36m0.1620[0m   [32m0.6373[0m        [35m0.2617[0m       0.9287        [94m0.2462[0m     +  23.8827
     12   [36m0.1674[0m   [32m0.6482[0m        [35m0.2593[0m       0.9287        [94m0.2443[0m     +  24.0747
     13   [36m0.1730[0m   [32m0.6572[0m        [35m0.2547[0m       0.9287        [94m0.2428[0m     +  23.9080
     14   [36m0.1777[0m   [32m0.6652[0m        [35m0.2524[0m       0.9287        [94m0.2416[0m     +  24.1577
     15   [36m0.1779[0m   [32m0.6733[0m        [35m0.2505[0m       0.9274        [94m0.2406[0m     +  24.1009
     16   [36m0.1790[0m   [32m0.6805[0m        [35m0.2488[0m       0.9274        [94m0.2398[0m     +  24.0408
     17   [36m0.1791[0m   [32m0.6872[0m        [35m0.2465[0m       0.9274        [94m0.2391[0m     +  24.0736
     18   [36m0.1806[0m   [32m0.6923[0m        [35m0.2459[0m       0.9274        [94m0.2386[0m     +  24.0569
     19   [36m0.1830[0m   [32m0.6981[0m        [35m0.2443[0m       0.9274        [94m0.2382[0m     +  23.9377
     20   [36m0.1864[0m   [32m0.7026[0m        [35m0.2421[0m       0.9274        [94m0.2379[0m     +  23.8955
     21   [36m0.1890[0m   [32m0.7067[0m        [35m0.2395[0m       0.9274        [94m0.2379[0m     +  23.9844
     22   [36m0.1900[0m   [32m0.7099[0m        [35m0.2388[0m       0.9250        0.2379        24.0108
     23   [36m0.1943[0m   [32m0.7131[0m        0.2392       0.9250        0.2380        23.9649
     24   [36m0.1956[0m   [32m0.7154[0m        [35m0.2361[0m       0.9226        0.2382        23.8640
     25   [36m0.1968[0m   [32m0.7169[0m        0.2369       0.9226        0.2386        24.0094
     26   [36m0.2008[0m   [32m0.7182[0m        0.2365       0.9226        0.2389        23.8985
     27   [36m0.2030[0m   [32m0.7194[0m        [35m0.2356[0m       0.9214        0.2393        23.9789
     28   [36m0.2030[0m   [32m0.7197[0m        [35m0.2342[0m       0.9226        0.2397        23.8465
     29   [36m0.2035[0m   [32m0.7206[0m        [35m0.2331[0m       0.9226        0.2403        23.8462
     30   [36m0.2064[0m   [32m0.7219[0m        0.2336       0.9226        0.2407        24.0925
Stopping since valid_loss has not improved in the last 10 epochs.
[32m[I 2023-05-03 10:31:57,127][0m Trial 335 finished with value: 0.2378626114800302 and parameters: {'lr': 1.456275672852354e-06, 'dropout': 0.3971426323549794, 'd_model_multiplier': 4, 'num_layers': 5, 'n_heads': 32, 'dim_feedforward': 385, 'batch_size': 26, 'pos_encoding': 'fixed', 'activation': 'relu', 'norm': 'LayerNorm', 'optimizer_name': 'RAdam', 'weight_decay': 0.1, 'top_n_features': 53}. Best is trial 246 with value: 0.16447311791139763.[0m
[FileBasedDataset] Initializing dataset...
	Examples: 8264
	Features: 68
	Max length: 315
Standard scalar turned ON, loading params from cache
[FileBasedDataset] Dataset initialization complete
Warning, assumed runtime error: CUDA out of memory. Tried to allocate 1.61 GiB (GPU 0; 23.70 GiB total capacity; 19.77 GiB already allocated; 957.25 MiB free; 21.67 GiB reserved in total by PyTorch) If reserved memory is >> allocated memory try setting max_split_size_mb to avoid fragmentation.  See documentation for Memory Management and PYTORCH_CUDA_ALLOC_CONF
[32m[I 2023-05-03 10:32:02,281][0m Trial 336 finished with value: 100.0 and parameters: {'lr': 4.721374029369515e-05, 'dropout': 0.45821513816578646, 'd_model_multiplier': 4, 'num_layers': 6, 'n_heads': 32, 'dim_feedforward': 368, 'batch_size': 136, 'pos_encoding': 'fixed', 'activation': 'relu', 'norm': 'LayerNorm', 'optimizer_name': 'RAdam', 'weight_decay': 0.001, 'top_n_features': 68}. Best is trial 246 with value: 0.16447311791139763.[0m
[FileBasedDataset] Initializing dataset...
	Examples: 8264
	Features: 74
	Max length: 315
Standard scalar turned ON, loading params from cache
[FileBasedDataset] Dataset initialization complete
  epoch    auprc    auroc    train_loss    valid_acc    valid_loss    cp      dur
-------  -------  -------  ------------  -----------  ------------  ----  -------
      1   [36m0.0660[0m   [32m0.2604[0m        [35m0.7418[0m       [31m0.4293[0m        [94m0.6848[0m     +  24.2556
      2   [36m0.0789[0m   [32m0.2786[0m        [35m0.6018[0m       [31m0.9045[0m        [94m0.5345[0m     +  24.6555
      3   0.0728   [32m0.2931[0m        [35m0.4614[0m       0.9045        [94m0.4161[0m     +  24.7398
      4   [36m0.0908[0m   [32m0.4277[0m        [35m0.3554[0m       0.9045        [94m0.3447[0m     +  24.8482
      5   [36m0.1504[0m   [32m0.5617[0m        [35m0.2964[0m       0.9045        [94m0.3166[0m     +  25.2511
      6   [36m0.1951[0m   [32m0.6310[0m        [35m0.2706[0m       0.9045        [94m0.3042[0m     +  24.9494
      7   [36m0.2205[0m   [32m0.6671[0m        [35m0.2588[0m       0.9045        [94m0.2976[0m     +  24.9645
      8   [36m0.2541[0m   [32m0.6983[0m        [35m0.2510[0m       0.9045        [94m0.2920[0m     +  25.2456
      9   [36m0.2842[0m   [32m0.7177[0m        [35m0.2462[0m       0.9045        [94m0.2874[0m     +  24.8257
     10   [36m0.3108[0m   [32m0.7376[0m        [35m0.2420[0m       [31m0.9057[0m        [94m0.2818[0m     +  25.3087
     11   [36m0.3274[0m   [32m0.7522[0m        [35m0.2396[0m       0.9057        [94m0.2764[0m     +  24.9654
     12   [36m0.3357[0m   [32m0.7624[0m        [35m0.2358[0m       [31m0.9105[0m        [94m0.2727[0m     +  25.4177
     13   [36m0.3435[0m   [32m0.7691[0m        [35m0.2337[0m       0.9093        [94m0.2708[0m     +  25.3112
     14   [36m0.3436[0m   [32m0.7744[0m        [35m0.2324[0m       0.9045        [94m0.2696[0m     +  25.2344
     15   [36m0.3507[0m   [32m0.7798[0m        [35m0.2307[0m       0.9057        [94m0.2683[0m     +  25.7558
     16   [36m0.3539[0m   [32m0.7820[0m        [35m0.2297[0m       0.9045        [94m0.2680[0m     +  25.2682
     17   [36m0.3580[0m   [32m0.7855[0m        [35m0.2276[0m       0.9069        [94m0.2666[0m     +  25.4437
     18   [36m0.3601[0m   [32m0.7871[0m        [35m0.2276[0m       0.9093        [94m0.2662[0m     +  25.0364
     19   [36m0.3659[0m   [32m0.7898[0m        [35m0.2271[0m       0.9105        [94m0.2650[0m     +  24.8574
     20   [36m0.3676[0m   [32m0.7916[0m        [35m0.2267[0m       0.9093        [94m0.2646[0m     +  25.0851
     21   0.3660   [32m0.7936[0m        [35m0.2256[0m       0.9093        [94m0.2642[0m     +  25.0087
     22   0.3668   [32m0.7951[0m        [35m0.2246[0m       0.9093        [94m0.2635[0m     +  25.3534
     23   [36m0.3676[0m   [32m0.7969[0m        0.2250       0.9093        [94m0.2632[0m     +  25.2146
     24   [36m0.3697[0m   [32m0.7987[0m        [35m0.2238[0m       0.9093        [94m0.2631[0m     +  25.3619
     25   [36m0.3704[0m   [32m0.7994[0m        0.2241       0.9093        [94m0.2628[0m     +  25.2878
     26   0.3699   [32m0.8007[0m        0.2244       0.9093        [94m0.2622[0m     +  25.2097
     27   [36m0.3736[0m   [32m0.8009[0m        [35m0.2238[0m       [31m0.9129[0m        0.2624        25.1339
     28   0.3726   [32m0.8014[0m        0.2241       0.9117        0.2623        25.1861
     29   0.3721   [32m0.8030[0m        [35m0.2226[0m       0.9129        [94m0.2615[0m     +  25.3190
     30   0.3693   [32m0.8042[0m        [35m0.2226[0m       0.9117        [94m0.2614[0m     +  24.7188
     31   0.3721   [32m0.8049[0m        [35m0.2209[0m       0.9117        0.2618        25.2433
     32   0.3720   [32m0.8060[0m        0.2218       0.9117        [94m0.2611[0m     +  25.1958
     33   0.3712   0.8059        [35m0.2208[0m       0.9117        [94m0.2609[0m     +  25.4924
     34   0.3718   [32m0.8063[0m        0.2215       0.9117        0.2610        25.1904
     35   0.3703   0.8062        [35m0.2208[0m       0.9117        [94m0.2606[0m     +  25.1327
     36   0.3719   [32m0.8070[0m        [35m0.2205[0m       0.9093        [94m0.2605[0m     +  25.1749
     37   0.3720   [32m0.8076[0m        0.2211       0.9093        [94m0.2597[0m     +  25.0066
     38   0.3715   [32m0.8078[0m        [35m0.2171[0m       0.9093        0.2599        25.2871
     39   0.3713   [32m0.8081[0m        0.2201       0.9105        0.2598        24.8509
     40   0.3706   [32m0.8084[0m        0.2175       0.9117        0.2600        24.7899
     41   0.3718   [32m0.8086[0m        0.2175       0.9105        0.2604        24.9420
     42   0.3697   0.8085        0.2201       0.9117        0.2601        25.1243
     43   0.3686   [32m0.8102[0m        0.2184       0.9129        [94m0.2594[0m     +  25.1112
     44   0.3682   [32m0.8103[0m        0.2187       0.9129        [94m0.2592[0m     +  25.2178
     45   0.3678   0.8092        0.2186       0.9105        0.2598        25.1695
     46   0.3690   0.8099        0.2175       0.9117        0.2601        25.1624
     47   0.3696   [32m0.8106[0m        0.2173       0.9117        0.2603        25.3075
     48   0.3685   [32m0.8108[0m        [35m0.2166[0m       0.9117        0.2602        25.3069
     49   0.3667   0.8100        [35m0.2151[0m       0.9105        0.2608        25.1407
     50   0.3696   [32m0.8111[0m        0.2153       0.9105        0.2607        25.1512
[32m[I 2023-05-03 10:53:01,954][0m Trial 337 finished with value: 0.2592127644417508 and parameters: {'lr': 1.8125238747832238e-05, 'dropout': 0.41769710428100415, 'd_model_multiplier': 4, 'num_layers': 5, 'n_heads': 32, 'dim_feedforward': 337, 'batch_size': 121, 'pos_encoding': 'fixed', 'activation': 'relu', 'norm': 'LayerNorm', 'optimizer_name': 'RAdam', 'weight_decay': 0.001, 'top_n_features': 74}. Best is trial 246 with value: 0.16447311791139763.[0m
[FileBasedDataset] Initializing dataset...
	Examples: 8264
	Features: 111
	Max length: 315
Standard scalar turned ON, loading params from cache
[FileBasedDataset] Dataset initialization complete
  epoch    auprc    auroc    train_loss    valid_acc    valid_loss    cp      dur
-------  -------  -------  ------------  -----------  ------------  ----  -------
      1   [36m0.0847[0m   [32m0.4626[0m        [35m0.4844[0m       [31m0.9129[0m        [94m0.3202[0m     +  23.9015
      2   [36m0.2867[0m   [32m0.7417[0m        [35m0.2813[0m       0.9129        [94m0.2628[0m     +  24.1291
      3   [36m0.3300[0m   [32m0.7731[0m        [35m0.2547[0m       0.9129        [94m0.2513[0m     +  24.0864
      4   [36m0.3584[0m   [32m0.7956[0m        [35m0.2485[0m       [31m0.9141[0m        [94m0.2431[0m     +  24.0401
      5   [36m0.3756[0m   [32m0.8051[0m        [35m0.2422[0m       0.9093        [94m0.2389[0m     +  23.9424
      6   [36m0.3772[0m   [32m0.8076[0m        [35m0.2376[0m       0.9093        [94m0.2371[0m     +  24.0125
      7   [36m0.3793[0m   [32m0.8091[0m        [35m0.2355[0m       [31m0.9154[0m        [94m0.2363[0m     +  24.1767
      8   [36m0.3814[0m   [32m0.8109[0m        [35m0.2343[0m       [31m0.9190[0m        [94m0.2354[0m     +  24.2086
      9   [36m0.3816[0m   0.8105        [35m0.2324[0m       0.9178        0.2359        24.1513
     10   [36m0.3819[0m   0.8097        [35m0.2311[0m       0.9154        0.2364        24.0752
     11   [36m0.3861[0m   [32m0.8112[0m        0.2316       0.9178        0.2366        24.2642
     12   0.3852   0.8095        [35m0.2290[0m       0.9166        0.2377        24.0203
     13   0.3857   0.8098        0.2293       0.9154        0.2381        24.0337
     14   [36m0.3911[0m   0.8096        [35m0.2270[0m       0.9166        0.2373        23.8736
     15   0.3885   0.8076        [35m0.2264[0m       0.9166        0.2387        24.0521
     16   [36m0.3976[0m   0.8089        0.2286       0.9190        0.2365        23.8677
     17   0.3895   0.8071        [35m0.2261[0m       0.9178        0.2381        23.9329
Stopping since valid_loss has not improved in the last 10 epochs.
[32m[I 2023-05-03 11:00:15,900][0m Trial 338 finished with value: 0.23538421866052672 and parameters: {'lr': 1.6886696824454682e-05, 'dropout': 0.4346903522008182, 'd_model_multiplier': 4, 'num_layers': 5, 'n_heads': 32, 'dim_feedforward': 391, 'batch_size': 25, 'pos_encoding': 'fixed', 'activation': 'relu', 'norm': 'LayerNorm', 'optimizer_name': 'RAdam', 'weight_decay': 0.1, 'top_n_features': 111}. Best is trial 246 with value: 0.16447311791139763.[0m
[FileBasedDataset] Initializing dataset...
	Examples: 8264
	Features: 61
	Max length: 315
Standard scalar turned ON, loading params from cache
[FileBasedDataset] Dataset initialization complete
  epoch    auprc    auroc    train_loss    valid_acc    valid_loss    cp      dur
-------  -------  -------  ------------  -----------  ------------  ----  -------
      1   [36m0.0862[0m   [32m0.3962[0m        [35m0.4801[0m       [31m0.9117[0m        [94m0.3393[0m     +  23.5666
      2   [36m0.2856[0m   [32m0.6990[0m        [35m0.2842[0m       0.9117        [94m0.2700[0m     +  23.4352
      3   [36m0.3538[0m   [32m0.7671[0m        [35m0.2507[0m       [31m0.9141[0m        [94m0.2522[0m     +  23.9833
      4   [36m0.3574[0m   [32m0.7991[0m        [35m0.2396[0m       0.9141        [94m0.2444[0m     +  23.6901
      5   [36m0.3601[0m   [32m0.8073[0m        [35m0.2343[0m       [31m0.9178[0m        [94m0.2427[0m     +  23.6022
      6   0.3508   [32m0.8099[0m        [35m0.2315[0m       0.9178        [94m0.2424[0m     +  24.1303
      7   0.3574   [32m0.8113[0m        [35m0.2293[0m       [31m0.9190[0m        [94m0.2416[0m     +  23.9976
      8   0.3571   [32m0.8140[0m        [35m0.2275[0m       0.9190        [94m0.2410[0m     +  24.1467
      9   0.3532   [32m0.8160[0m        0.2286       [31m0.9214[0m        [94m0.2404[0m     +  23.8752
     10   [36m0.3682[0m   [32m0.8197[0m        0.2278       0.9214        [94m0.2389[0m     +  23.8145
     11   0.3640   [32m0.8206[0m        [35m0.2265[0m       0.9190        0.2400        23.8343
     12   0.3611   [32m0.8214[0m        0.2268       0.9214        0.2394        23.9527
     13   [36m0.3743[0m   [32m0.8233[0m        [35m0.2254[0m       0.9202        0.2389        24.2707
     14   0.3721   [32m0.8262[0m        [35m0.2235[0m       0.9178        [94m0.2382[0m     +  24.0933
     15   0.3658   [32m0.8280[0m        0.2248       0.9190        [94m0.2382[0m     +  23.9915
     16   [36m0.3802[0m   [32m0.8297[0m        [35m0.2231[0m       0.9214        [94m0.2364[0m     +  23.9953
     17   [36m0.3835[0m   [32m0.8313[0m        [35m0.2221[0m       0.9214        [94m0.2358[0m     +  23.9144
     18   [36m0.3876[0m   [32m0.8347[0m        [35m0.2212[0m       0.9166        [94m0.2353[0m     +  23.9074
     19   0.3855   0.8333        0.2215       0.9154        0.2370        23.9598
     20   0.3857   [32m0.8349[0m        [35m0.2205[0m       0.9178        0.2371        24.0305
     21   [36m0.3951[0m   [32m0.8357[0m        [35m0.2196[0m       0.9166        0.2354        24.0929
     22   0.3855   0.8357        0.2200       0.9178        0.2363        24.0099
     23   0.3892   [32m0.8385[0m        0.2202       0.9166        0.2356        24.0228
     24   [36m0.3955[0m   [32m0.8412[0m        [35m0.2179[0m       0.9178        [94m0.2333[0m     +  23.7004
     25   0.3817   0.8406        [35m0.2164[0m       0.9141        0.2356        23.5741
     26   [36m0.4094[0m   [32m0.8450[0m        0.2165       0.9166        [94m0.2319[0m     +  23.9242
     27   0.4047   0.8435        [35m0.2164[0m       0.9178        [94m0.2318[0m     +  23.8525
     28   [36m0.4145[0m   0.8444        [35m0.2137[0m       0.9178        0.2321        24.0854
     29   0.4102   [32m0.8474[0m        0.2142       0.9190        [94m0.2301[0m     +  24.3193
     30   [36m0.4170[0m   0.8454        [35m0.2123[0m       0.9178        0.2323        24.0218
     31   0.4052   0.8473        [35m0.2117[0m       0.9166        0.2325        23.9473
     32   0.4074   [32m0.8481[0m        [35m0.2111[0m       0.9154        0.2331        23.9227
     33   0.4002   0.8459        0.2114       0.9166        0.2332        23.8669
     34   0.3943   0.8480        [35m0.2092[0m       0.9178        0.2349        23.8885
     35   0.4008   0.8479        [35m0.2088[0m       0.9141        0.2329        24.0250
     36   0.3866   0.8466        [35m0.2087[0m       0.9117        0.2362        23.9631
     37   0.3943   0.8469        0.2091       0.9093        0.2347        23.8183
     38   0.3928   0.8445        [35m0.2072[0m       0.9117        0.2356        23.7475
Stopping since valid_loss has not improved in the last 10 epochs.
