[32m[I 2023-05-03 06:31:49,114][0m Trial 300 finished with value: 100.0 and parameters: {'lr': 0.0019340567072618417, 'dropout': 0.6165847780857204, 'd_model_multiplier': 1, 'num_layers': 12, 'n_heads': 32, 'dim_feedforward': 407, 'batch_size': 71, 'pos_encoding': 'fixed', 'activation': 'relu', 'norm': 'LayerNorm', 'optimizer_name': 'RAdam', 'weight_decay': 0, 'top_n_features': 71}. Best is trial 246 with value: 0.16447311791139763.[0m
[FileBasedDataset] Initializing dataset...
	Examples: 8264
	Features: 38
	Max length: 315
Standard scalar turned ON, loading params from cache
[FileBasedDataset] Dataset initialization complete
  epoch    auprc    auroc    train_loss    valid_acc    valid_loss    cp      dur
-------  -------  -------  ------------  -----------  ------------  ----  -------
      1   [36m0.2405[0m   [32m0.7506[0m        [35m0.2921[0m       [31m0.9359[0m        [94m0.2225[0m     +  26.0398
      2   [36m0.2738[0m   [32m0.7744[0m        [35m0.2489[0m       0.9347        [94m0.2098[0m     +  25.9719
      3   0.2676   [32m0.7843[0m        [35m0.2486[0m       0.9274        0.2188        26.0874
      4   0.2429   0.7744        [35m0.2441[0m       0.9335        0.2279        26.3246
      5   [36m0.2888[0m   [32m0.7892[0m        0.2451       0.9299        0.2224        25.9528
      6   0.2510   [32m0.7902[0m        0.2441       0.9335        0.2202        26.2786
      7   0.2550   [32m0.7959[0m        [35m0.2433[0m       0.9347        0.2248        26.2516
      8   0.2654   0.7927        [35m0.2416[0m       0.9311        0.2237        26.1670
      9   0.2606   0.7859        [35m0.2395[0m       0.9299        0.2311        26.2573
     10   [36m0.2972[0m   0.7936        [35m0.2346[0m       [31m0.9371[0m        0.2208        26.2590
     11   0.2565   0.7903        0.2373       0.9311        0.2379        26.1053
Stopping since valid_loss has not improved in the last 10 epochs.
[32m[I 2023-05-03 06:37:03,493][0m Trial 301 finished with value: 0.20979434938734215 and parameters: {'lr': 0.0015089708803951681, 'dropout': 0.5911928870516245, 'd_model_multiplier': 1, 'num_layers': 4, 'n_heads': 64, 'dim_feedforward': 394, 'batch_size': 38, 'pos_encoding': 'fixed', 'activation': 'relu', 'norm': 'LayerNorm', 'optimizer_name': 'RAdam', 'weight_decay': 0.1, 'top_n_features': 38}. Best is trial 246 with value: 0.16447311791139763.[0m
[FileBasedDataset] Initializing dataset...
	Examples: 8264
	Features: 40
	Max length: 315
Standard scalar turned ON, loading params from cache
[FileBasedDataset] Dataset initialization complete
  epoch    auprc    auroc    train_loss    valid_acc    valid_loss    cp      dur
-------  -------  -------  ------------  -----------  ------------  ----  -------
      1   [36m0.3279[0m   [32m0.7541[0m        [35m0.2814[0m       [31m0.9287[0m        [94m0.2652[0m     +  26.1008
      2   0.2215   0.7140        [35m0.2605[0m       0.9287        0.3119        26.2857
      3   0.1833   0.7014        [35m0.2595[0m       0.9287        0.3162        25.9004
      4   [36m0.3366[0m   [32m0.7663[0m        [35m0.2564[0m       0.9287        0.2945        26.1916
      5   0.2717   0.7523        [35m0.2479[0m       0.9287        0.2890        26.1846
      6   0.2258   0.7399        0.2503       0.9287        0.2907        26.2355
      7   0.2214   0.7342        0.2520       0.9250        0.3023        26.2308
      8   0.2120   0.7046        0.2579       0.9287        0.2742        26.3143
      9   0.1746   0.6913        0.2605       0.9287        0.2773        26.4126
     10   0.2036   0.6995        0.2602       0.9287        0.2655        26.2334
     11   0.2080   0.7035        0.2577       0.9287        [94m0.2580[0m     +  26.1909
     12   0.2181   0.6960        0.2580       0.9287        [94m0.2490[0m     +  26.3067
     13   0.1803   0.6978        0.2590       0.9287        [94m0.2441[0m     +  26.4639
     14   0.2101   0.7028        0.2575       0.9287        0.2448        26.3224
     15   0.2051   0.6983        0.2587       0.9287        [94m0.2418[0m     +  26.2234
     16   0.2225   0.7043        0.2582       0.9287        0.2466        26.3465
     17   0.2147   0.7087        0.2578       0.9287        0.2451        26.2203
     18   0.2083   0.7056        0.2581       0.9287        0.2432        26.3135
     19   0.1868   0.7040        0.2548       0.9274        0.2449        26.0648
     20   0.2059   0.7047        0.2576       0.9262        0.2511        26.1376
     21   0.1853   0.7003        0.2590       0.9287        0.2500        26.1035
     22   0.1882   0.7004        0.2567       0.9287        0.2460        25.8943
     23   0.1844   0.7012        0.2561       0.9274        0.2437        26.0791
     24   0.2258   0.7067        0.2571       0.9287        [94m0.2409[0m     +  25.8792
     25   0.2053   0.7044        0.2579       0.9287        0.2455        25.9856
     26   0.2014   0.7023        0.2572       0.9287        0.2450        26.1657
     27   0.2180   0.7058        0.2573       0.9287        0.2427        26.1524
     28   0.2046   0.7074        0.2562       0.9287        0.2424        26.1517
     29   0.2013   0.7067        0.2575       0.9287        0.2425        26.0628
     30   0.2308   0.7042        0.2556       0.9287        0.2417        26.3582
     31   0.2068   0.7068        0.2562       0.9287        0.2421        26.1796
     32   0.2012   0.7045        0.2572       0.9287        0.2421        26.0447
     33   0.2032   0.7080        0.2560       0.9287        0.2427        26.0958
Stopping since valid_loss has not improved in the last 10 epochs.
[32m[I 2023-05-03 06:51:54,432][0m Trial 302 finished with value: 0.24089784906701858 and parameters: {'lr': 0.004770095394058925, 'dropout': 0.5884704058997843, 'd_model_multiplier': 1, 'num_layers': 4, 'n_heads': 64, 'dim_feedforward': 391, 'batch_size': 38, 'pos_encoding': 'fixed', 'activation': 'relu', 'norm': 'LayerNorm', 'optimizer_name': 'RAdam', 'weight_decay': 0.1, 'top_n_features': 40}. Best is trial 246 with value: 0.16447311791139763.[0m
[FileBasedDataset] Initializing dataset...
	Examples: 8264
	Features: 31
	Max length: 315
Standard scalar turned ON, loading params from cache
[FileBasedDataset] Dataset initialization complete
  epoch    auprc    auroc    train_loss    valid_acc    valid_loss    cp      dur
-------  -------  -------  ------------  -----------  ------------  ----  -------
      1   [36m0.2125[0m   [32m0.7257[0m        [35m0.2946[0m       [31m0.9178[0m        [94m0.2621[0m     +  25.8870
      2   [36m0.2357[0m   [32m0.7293[0m        [35m0.2714[0m       0.9105        0.2650        25.9434
      3   0.2183   [32m0.7331[0m        [35m0.2672[0m       0.9178        0.2909        26.1145
      4   [36m0.2382[0m   0.7314        0.2702       0.9178        0.2902        26.1094
      5   [36m0.2728[0m   [32m0.7568[0m        [35m0.2641[0m       0.9117        0.2637        25.9259
      6   0.2233   [32m0.7578[0m        0.2673       0.9178        0.2735        25.9943
      7   0.2389   0.7339        [35m0.2633[0m       0.9178        0.2655        26.1248
      8   0.2469   0.7501        [35m0.2617[0m       0.9105        [94m0.2539[0m     +  25.9562
      9   0.0822   0.5000        0.2784       0.9178        0.2849        26.0280
     10   0.0822   0.5000        0.2751       0.9178        0.2849        26.0678
     11   0.0822   0.5000        0.2751       0.9178        0.2849        25.9072
     12   0.0822   0.5000        0.2750       0.9178        0.2848        26.1924
     13   0.0822   0.5000        0.2750       0.9178        0.2848        26.0915
     14   0.0822   0.5000        0.2750       0.9178        0.2848        26.3271
     15   0.0822   0.5000        0.2749       0.9178        0.2848        26.2664
     16   0.0822   0.5000        0.2749       0.9178        0.2848        26.2834
     17   0.0822   0.5000        0.2749       0.9178        0.2848        25.8391
Stopping since valid_loss has not improved in the last 10 epochs.
[32m[I 2023-05-03 06:59:44,300][0m Trial 303 finished with value: 0.25387936095372654 and parameters: {'lr': 0.06650944203952948, 'dropout': 0.6021080417816258, 'd_model_multiplier': 1, 'num_layers': 4, 'n_heads': 64, 'dim_feedforward': 378, 'batch_size': 42, 'pos_encoding': 'fixed', 'activation': 'relu', 'norm': 'LayerNorm', 'optimizer_name': 'RAdam', 'weight_decay': 0.1, 'top_n_features': 31}. Best is trial 246 with value: 0.16447311791139763.[0m
[FileBasedDataset] Initializing dataset...
	Examples: 8264
	Features: 35
	Max length: 315
Standard scalar turned ON, loading params from cache
[FileBasedDataset] Dataset initialization complete
  epoch    auprc    auroc    train_loss    valid_acc    valid_loss    cp      dur
-------  -------  -------  ------------  -----------  ------------  ----  -------
      1   [36m0.2599[0m   [32m0.7332[0m        [35m0.2957[0m       [31m0.9117[0m        [94m0.2537[0m     +  26.0648
      2   0.2497   [32m0.7539[0m        [35m0.2450[0m       [31m0.9154[0m        0.2564        26.0273
      3   0.2491   0.7538        0.2467       0.9057        0.2614        26.2484
      4   0.2546   [32m0.7616[0m        [35m0.2402[0m       0.9141        0.2578        26.1315
      5   [36m0.2737[0m   [32m0.7722[0m        0.2419       [31m0.9214[0m        [94m0.2446[0m     +  26.2074
      6   [36m0.2764[0m   0.7681        [35m0.2399[0m       0.9166        [94m0.2446[0m     +  26.1588
      7   [36m0.2854[0m   0.7698        [35m0.2384[0m       0.9154        0.2515        26.1904
      8   [36m0.2985[0m   0.7714        [35m0.2358[0m       0.9214        [94m0.2435[0m     +  26.2803
      9   [36m0.3104[0m   [32m0.7731[0m        [35m0.2337[0m       0.9190        0.2485        26.2783
     10   [36m0.3147[0m   0.7729        0.2366       0.9190        0.2524        26.2981
     11   [36m0.3296[0m   [32m0.7757[0m        [35m0.2325[0m       [31m0.9262[0m        0.2541        26.1893
     12   0.3177   0.7729        0.2333       [31m0.9274[0m        0.2570        26.1469
     13   [36m0.3441[0m   [32m0.7836[0m        [35m0.2287[0m       [31m0.9287[0m        0.2516        26.4514
     14   [36m0.3498[0m   [32m0.7870[0m        0.2308       [31m0.9299[0m        [94m0.2431[0m     +  26.2476
     15   0.3406   0.7850        0.2298       0.9226        0.2472        25.9914
     16   [36m0.3527[0m   [32m0.7892[0m        0.2291       0.9238        [94m0.2386[0m     +  26.3793
     17   0.2894   0.7818        [35m0.2282[0m       0.9226        0.2479        26.2766
     18   0.2697   0.7682        0.2312       0.9057        0.2757        26.0237
     19   0.2809   0.7615        0.2311       0.9141        0.2597        26.2525
     20   0.2402   0.7598        0.2317       0.8936        0.2843        26.1345
     21   0.2526   0.7726        0.2343       0.8924        0.2694        26.1380
     22   0.2244   0.7468        0.2331       0.8948        0.2928        25.8688
     23   0.2913   0.7665        0.2328       0.9178        0.2706        26.3979
     24   0.2491   0.7677        0.2329       0.9008        0.2773        26.2736
     25   0.2584   0.7200        0.2365       0.9238        0.2817        26.1767
Stopping since valid_loss has not improved in the last 10 epochs.
[32m[I 2023-05-03 07:11:05,964][0m Trial 304 finished with value: 0.23856732630798144 and parameters: {'lr': 0.00159838437688448, 'dropout': 0.5830285355518191, 'd_model_multiplier': 1, 'num_layers': 4, 'n_heads': 64, 'dim_feedforward': 396, 'batch_size': 47, 'pos_encoding': 'fixed', 'activation': 'relu', 'norm': 'LayerNorm', 'optimizer_name': 'RAdam', 'weight_decay': 0.1, 'top_n_features': 35}. Best is trial 246 with value: 0.16447311791139763.[0m
[FileBasedDataset] Initializing dataset...
	Examples: 8264
	Features: 40
	Max length: 315
Standard scalar turned ON, loading params from cache
[FileBasedDataset] Dataset initialization complete
  epoch    auprc    auroc    train_loss    valid_acc    valid_loss    cp      dur
-------  -------  -------  ------------  -----------  ------------  ----  -------
      1   [36m0.2953[0m   [32m0.7759[0m        [35m0.2820[0m       [31m0.9202[0m        [94m0.2303[0m     +  25.8785
      2   0.2830   [32m0.8007[0m        [35m0.2525[0m       0.9190        0.2403        26.0441
      3   [36m0.3071[0m   0.7860        [35m0.2509[0m       [31m0.9250[0m        0.2391        26.1875
      4   0.2957   0.7773        [35m0.2488[0m       0.9214        0.2474        26.1162
      5   0.2764   0.7871        0.2492       0.9154        0.2431        26.3273
      6   0.2757   0.8002        [35m0.2417[0m       0.9214        0.2463        26.1508
      7   [36m0.3144[0m   0.7865        0.2434       0.9226        0.2416        26.2781
      8   0.3107   0.7908        0.2433       0.9250        0.2783        26.1236
      9   0.2459   0.7717        0.2478       0.9226        0.2901        26.3821
     10   0.2421   0.7791        0.2554       0.9202        0.2632        26.2121
Stopping since valid_loss has not improved in the last 10 epochs.
[32m[I 2023-05-03 07:15:53,958][0m Trial 305 finished with value: 0.2302847954984011 and parameters: {'lr': 0.0022642499985031533, 'dropout': 0.5711205267142319, 'd_model_multiplier': 1, 'num_layers': 4, 'n_heads': 64, 'dim_feedforward': 417, 'batch_size': 34, 'pos_encoding': 'fixed', 'activation': 'relu', 'norm': 'LayerNorm', 'optimizer_name': 'RAdam', 'weight_decay': 0, 'top_n_features': 40}. Best is trial 246 with value: 0.16447311791139763.[0m
[FileBasedDataset] Initializing dataset...
	Examples: 8264
	Features: 45
	Max length: 315
Standard scalar turned ON, loading params from cache
[FileBasedDataset] Dataset initialization complete
Warning, assumed runtime error: CUDA out of memory. Tried to allocate 4.38 GiB (GPU 0; 23.70 GiB total capacity; 14.65 GiB already allocated; 4.04 GiB free; 18.56 GiB reserved in total by PyTorch) If reserved memory is >> allocated memory try setting max_split_size_mb to avoid fragmentation.  See documentation for Memory Management and PYTORCH_CUDA_ALLOC_CONF
[32m[I 2023-05-03 07:16:00,310][0m Trial 306 finished with value: 100.0 and parameters: {'lr': 0.0033585204041731687, 'dropout': 0.5933597898145848, 'd_model_multiplier': 1, 'num_layers': 4, 'n_heads': 64, 'dim_feedforward': 403, 'batch_size': 185, 'pos_encoding': 'fixed', 'activation': 'relu', 'norm': 'LayerNorm', 'optimizer_name': 'RAdam', 'weight_decay': 0.1, 'top_n_features': 45}. Best is trial 246 with value: 0.16447311791139763.[0m
[FileBasedDataset] Initializing dataset...
	Examples: 8264
	Features: 54
	Max length: 315
Standard scalar turned ON, loading params from cache
[FileBasedDataset] Dataset initialization complete
  epoch    auprc    auroc    train_loss    valid_acc    valid_loss    cp      dur
-------  -------  -------  ------------  -----------  ------------  ----  -------
      1   [36m0.2177[0m   [32m0.7626[0m        [35m0.2794[0m       [31m0.9178[0m        [94m0.2643[0m     +  15.8056
      2   0.2064   0.7552        [35m0.2664[0m       0.9166        [94m0.2641[0m     +  16.1290
      3   0.2132   [32m0.7668[0m        [35m0.2632[0m       0.9154        0.2676        16.2088
      4   0.2106   0.7640        [35m0.2606[0m       0.9166        [94m0.2591[0m     +  16.2739
      5   0.2065   0.7636        0.2610       0.9166        [94m0.2514[0m     +  16.2620
      6   0.2142   0.7620        [35m0.2578[0m       0.9166        0.2524        16.2877
      7   0.2119   0.7632        [35m0.2559[0m       0.9178        0.2530        16.0807
      8   0.2077   0.7637        0.2595       0.9166        0.2562        16.3223
      9   0.2100   0.7586        0.2602       0.9178        0.2576        16.1353
     10   0.2080   0.7631        0.2572       0.9178        0.2552        16.1747
     11   0.2114   0.7603        0.2594       0.9178        0.2636        16.1782
     12   0.2080   0.7576        0.2576       0.9178        0.2657        16.4594
     13   0.2156   0.7642        0.2581       0.9178        0.2552        16.4900
     14   0.2108   0.7453        0.2576       0.9166        0.2558        16.4574
Stopping since valid_loss has not improved in the last 10 epochs.
[32m[I 2023-05-03 07:20:04,410][0m Trial 307 finished with value: 0.25143427781066985 and parameters: {'lr': 0.01563828554317123, 'dropout': 0.6121996685974925, 'd_model_multiplier': 1, 'num_layers': 4, 'n_heads': 32, 'dim_feedforward': 385, 'batch_size': 52, 'pos_encoding': 'fixed', 'activation': 'relu', 'norm': 'LayerNorm', 'optimizer_name': 'RAdam', 'weight_decay': 0.1, 'top_n_features': 54}. Best is trial 246 with value: 0.16447311791139763.[0m
[FileBasedDataset] Initializing dataset...
	Examples: 8264
	Features: 48
	Max length: 315
Standard scalar turned ON, loading params from cache
[FileBasedDataset] Dataset initialization complete
Warning, assumed runtime error: CUDA out of memory. Tried to allocate 2.56 GiB (GPU 0; 23.70 GiB total capacity; 18.54 GiB already allocated; 1.51 GiB free; 21.10 GiB reserved in total by PyTorch) If reserved memory is >> allocated memory try setting max_split_size_mb to avoid fragmentation.  See documentation for Memory Management and PYTORCH_CUDA_ALLOC_CONF
[32m[I 2023-05-03 07:20:11,193][0m Trial 308 finished with value: 100.0 and parameters: {'lr': 0.0013433772164743905, 'dropout': 0.3322193374466158, 'd_model_multiplier': 4, 'num_layers': 3, 'n_heads': 32, 'dim_feedforward': 433, 'batch_size': 216, 'pos_encoding': 'fixed', 'activation': 'relu', 'norm': 'LayerNorm', 'optimizer_name': 'RAdam', 'weight_decay': 0.1, 'top_n_features': 48}. Best is trial 246 with value: 0.16447311791139763.[0m
[FileBasedDataset] Initializing dataset...
	Examples: 8264
	Features: 29
	Max length: 315
Standard scalar turned ON, loading params from cache
[FileBasedDataset] Dataset initialization complete
  epoch    auprc    auroc    train_loss    valid_acc    valid_loss    cp      dur
-------  -------  -------  ------------  -----------  ------------  ----  -------
      1   [36m0.2749[0m   [32m0.7560[0m        [35m0.3043[0m       [31m0.9117[0m        [94m0.2718[0m     +  25.8656
      2   [36m0.3042[0m   [32m0.7717[0m        [35m0.2412[0m       0.9093        [94m0.2698[0m     +  26.0465
      3   0.2664   0.7653        [35m0.2355[0m       0.8924        0.2785        26.4781
      4   0.2862   0.7698        0.2377       0.9057        0.2746        26.5018
      5   0.2938   [32m0.7739[0m        [35m0.2353[0m       0.9117        0.2755        26.2636
      6   0.2782   0.7684        [35m0.2331[0m       0.9093        0.2771        26.4982
      7   [36m0.3072[0m   0.7727        0.2346       [31m0.9129[0m        0.2734        26.5867
      8   0.2946   0.7715        [35m0.2327[0m       0.9105        0.2803        26.4908
      9   [36m0.3124[0m   [32m0.7774[0m        [35m0.2323[0m       0.9117        [94m0.2689[0m     +  26.4577
     10   0.3105   [32m0.7795[0m        [35m0.2299[0m       0.9117        0.2700        26.4625
     11   [36m0.3225[0m   [32m0.7806[0m        [35m0.2287[0m       0.9129        [94m0.2672[0m     +  26.6300
     12   [36m0.3281[0m   [32m0.7854[0m        0.2323       0.9129        [94m0.2648[0m     +  26.4633
     13   [36m0.3340[0m   [32m0.7882[0m        0.2292       0.9093        [94m0.2610[0m     +  26.6133
     14   0.3230   [32m0.7911[0m        [35m0.2278[0m       0.9105        0.2640        26.3980
     15   0.3309   [32m0.7912[0m        0.2285       0.9129        0.2679        26.4325
     16   [36m0.3368[0m   [32m0.7951[0m        [35m0.2274[0m       0.9129        [94m0.2602[0m     +  26.4520
     17   [36m0.3484[0m   [32m0.7955[0m        [35m0.2268[0m       0.9093        0.2662        26.1159
     18   [36m0.3503[0m   [32m0.7987[0m        [35m0.2243[0m       0.9093        [94m0.2578[0m     +  26.4527
     19   0.3462   0.7970        0.2269       0.9105        0.2591        26.6045
     20   [36m0.3553[0m   [32m0.8001[0m        [35m0.2230[0m       0.9033        [94m0.2553[0m     +  26.2893
     21   [36m0.3651[0m   [32m0.8066[0m        0.2239       0.9117        [94m0.2544[0m     +  26.5261
     22   [36m0.3786[0m   [32m0.8069[0m        0.2231       0.9105        [94m0.2531[0m     +  26.6730
     23   [36m0.3870[0m   0.8067        [35m0.2213[0m       0.9117        [94m0.2454[0m     +  26.4784
     24   0.3633   0.8038        0.2224       0.9093        0.2565        26.2055
     25   0.3835   0.8065        [35m0.2201[0m       [31m0.9202[0m        0.2518        26.3097
     26   0.3847   [32m0.8081[0m        0.2215       0.9105        0.2505        26.3009
     27   [36m0.3887[0m   [32m0.8110[0m        0.2207       0.9069        0.2483        26.3625
     28   0.3850   0.7995        0.2205       0.9141        0.2634        26.3256
     29   0.3802   0.8066        [35m0.2194[0m       0.9117        0.2548        26.5495
     30   0.3831   0.8078        0.2201       0.9117        0.2554        26.3497
     31   0.3848   0.8082        0.2194       0.9033        0.2521        26.4168
     32   0.3826   0.8086        [35m0.2169[0m       0.9057        0.2547        26.1850
Stopping since valid_loss has not improved in the last 10 epochs.
