[32m[I 2023-05-02 08:24:00,961][0m Trial 78 finished with value: 0.22142240484363368 and parameters: {'lr': 0.0017944589616882955, 'dropout': 0.5184164851893082, 'd_model_multiplier': 2, 'num_layers': 3, 'n_heads': 4, 'dim_feedforward': 138, 'batch_size': 59, 'pos_encoding': 'learnable', 'activation': 'gelu', 'norm': 'BatchNorm', 'optimizer_name': 'PlainRAdam', 'weight_decay': 0.01, 'top_n_features': 141}. Best is trial 12 with value: 0.20472501771481755.[0m
[FileBasedDataset] Initializing dataset...
	Examples: 8264
	Features: 151
	Max length: 315
Standard scalar turned ON, loading params from cache
[FileBasedDataset] Dataset initialization complete
  epoch    auprc    auroc    train_loss    valid_acc    valid_loss    cp     dur
-------  -------  -------  ------------  -----------  ------------  ----  ------
      1   [36m0.2101[0m   [32m0.6217[0m        [35m0.7334[0m       [31m0.2624[0m        [94m0.6969[0m     +  9.5442
      2   0.1190   0.4443        [35m0.6919[0m       [31m0.6784[0m        [94m0.6874[0m     +  10.5054
      3   0.0568   0.3079        [35m0.6416[0m       [31m0.9069[0m        [94m0.6722[0m     +  10.5857
      4   0.0552   0.2859        [35m0.5772[0m       [31m0.9154[0m        [94m0.6458[0m     +  10.3561
      5   0.0561   0.2937        [35m0.4975[0m       0.9154        [94m0.5807[0m     +  10.6091
      6   0.0592   0.3340        [35m0.4140[0m       0.9154        [94m0.5007[0m     +  10.8686
      7   0.0706   0.4352        [35m0.3521[0m       0.9154        [94m0.4349[0m     +  10.8931
      8   0.1397   0.5533        [35m0.3182[0m       0.9154        [94m0.3922[0m     +  11.1882
      9   0.2069   [32m0.6386[0m        [35m0.2989[0m       0.9154        [94m0.3620[0m     +  10.4888
     10   [36m0.2499[0m   [32m0.6907[0m        [35m0.2881[0m       0.9154        [94m0.3418[0m     +  10.4070
     11   [36m0.2733[0m   [32m0.7208[0m        [35m0.2804[0m       0.9154        [94m0.3259[0m     +  10.6385
     12   [36m0.2882[0m   [32m0.7400[0m        [35m0.2776[0m       0.9154        [94m0.3139[0m     +  10.7290
     13   [36m0.3002[0m   [32m0.7533[0m        [35m0.2695[0m       0.9154        [94m0.3024[0m     +  10.4488
     14   0.2981   [32m0.7620[0m        0.2704       0.9154        [94m0.2991[0m     +  10.7209
     15   [36m0.3046[0m   [32m0.7713[0m        [35m0.2686[0m       0.9141        [94m0.2918[0m     +  10.5983
     16   0.3014   [32m0.7752[0m        [35m0.2641[0m       0.9141        [94m0.2857[0m     +  10.5891
     17   [36m0.3060[0m   [32m0.7781[0m        [35m0.2593[0m       0.9154        [94m0.2834[0m     +  10.5242
     18   [36m0.3138[0m   0.7775        0.2617       0.9154        [94m0.2809[0m     +  10.7841
     19   [36m0.3230[0m   [32m0.7849[0m        0.2594       0.9141        [94m0.2764[0m     +  11.0752
     20   [36m0.3265[0m   0.7843        0.2602       0.9141        0.2771        10.8675
     21   [36m0.3278[0m   [32m0.7885[0m        [35m0.2559[0m       0.9141        [94m0.2735[0m     +  10.7337
     22   [36m0.3317[0m   [32m0.7916[0m        0.2564       0.9141        [94m0.2722[0m     +  10.5603
     23   0.3275   [32m0.7932[0m        0.2566       0.9141        0.2741        10.5620
     24   0.3292   [32m0.7942[0m        0.2572       0.9141        0.2723        10.7051
     25   0.3283   [32m0.7949[0m        0.2560       0.9154        [94m0.2699[0m     +  10.5748
     26   [36m0.3330[0m   [32m0.7950[0m        [35m0.2546[0m       0.9154        [94m0.2683[0m     +  10.7409
     27   0.3325   [32m0.8003[0m        [35m0.2532[0m       0.9154        [94m0.2667[0m     +  10.6417
     28   [36m0.3336[0m   [32m0.8043[0m        0.2536       0.9154        [94m0.2665[0m     +  10.7260
     29   [36m0.3353[0m   [32m0.8081[0m        0.2534       0.9154        [94m0.2650[0m     +  10.3565
     30   [36m0.3357[0m   [32m0.8091[0m        [35m0.2531[0m       0.9154        0.2673        10.6888
     31   [36m0.3385[0m   [32m0.8097[0m        [35m0.2496[0m       [31m0.9166[0m        0.2652        10.6563
     32   0.3364   [32m0.8106[0m        0.2510       0.9166        [94m0.2629[0m     +  10.7243
     33   [36m0.3415[0m   [32m0.8124[0m        0.2509       [31m0.9178[0m        0.2630        10.2855
     34   [36m0.3451[0m   [32m0.8126[0m        0.2516       0.9166        [94m0.2612[0m     +  10.3608
     35   [36m0.3473[0m   [32m0.8150[0m        0.2512       0.9166        [94m0.2590[0m     +  10.5344
     36   [36m0.3473[0m   [32m0.8152[0m        [35m0.2491[0m       0.9166        [94m0.2569[0m     +  10.7903
     37   [36m0.3474[0m   [32m0.8160[0m        [35m0.2459[0m       0.9166        0.2575        10.8466
     38   [36m0.3488[0m   [32m0.8170[0m        0.2484       0.9166        0.2573        10.6699
     39   [36m0.3516[0m   0.8138        0.2466       0.9166        [94m0.2569[0m     +  10.5857
     40   0.3503   0.8106        0.2502       0.9166        0.2583        10.5753
     41   [36m0.3550[0m   0.8123        0.2470       0.9166        [94m0.2569[0m     +  10.4279
     42   [36m0.3563[0m   0.8159        [35m0.2458[0m       0.9178        0.2569        10.6391
     43   0.3543   0.8162        [35m0.2437[0m       0.9178        [94m0.2557[0m     +  10.9802
     44   [36m0.3610[0m   [32m0.8171[0m        0.2473       0.9178        [94m0.2549[0m     +  10.4925
     45   [36m0.3631[0m   0.8159        0.2481       [31m0.9190[0m        [94m0.2536[0m     +  10.7088
     46   [36m0.3635[0m   0.8164        0.2485       0.9190        0.2540        10.5181
     47   [36m0.3659[0m   0.8152        0.2441       0.9166        [94m0.2525[0m     +  11.0609
     48   [36m0.3682[0m   [32m0.8174[0m        0.2440       0.9178        [94m0.2522[0m     +  10.6466
     49   [36m0.3755[0m   0.8153        0.2448       0.9178        0.2524        10.6673
     50   0.3720   0.8157        [35m0.2432[0m       0.9190        0.2523        10.5655
[32m[I 2023-05-02 08:32:54,631][0m Trial 79 finished with value: 0.2521966115234841 and parameters: {'lr': 0.00010822365965513408, 'dropout': 0.4443593562987422, 'd_model_multiplier': 2, 'num_layers': 5, 'n_heads': 4, 'dim_feedforward': 180, 'batch_size': 107, 'pos_encoding': 'fixed', 'activation': 'relu', 'norm': 'BatchNorm', 'optimizer_name': 'PlainRAdam', 'weight_decay': 0.01, 'top_n_features': 151}. Best is trial 12 with value: 0.20472501771481755.[0m
[FileBasedDataset] Initializing dataset...
	Examples: 8264
	Features: 147
	Max length: 315
Standard scalar turned ON, loading params from cache
[FileBasedDataset] Dataset initialization complete
  epoch    auprc    auroc    train_loss    valid_acc    valid_loss    cp     dur
-------  -------  -------  ------------  -----------  ------------  ----  ------
      1   [36m0.1578[0m   [32m0.6762[0m        [35m0.3001[0m       [31m0.9371[0m        [94m0.2456[0m     +  8.8913
      2   0.1359   0.6490        [35m0.2743[0m       0.9371        [94m0.2443[0m     +  8.4291
      3   0.1198   0.6391        0.2774       0.9371        [94m0.2380[0m     +  9.1997
      4   0.1085   0.6261        [35m0.2650[0m       0.9371        0.2432        8.9676
      5   0.1163   0.6675        [35m0.2611[0m       0.9371        [94m0.2371[0m     +  9.3831
      6   0.1143   0.6668        0.2619       0.9371        [94m0.2315[0m     +  9.3586
      7   0.1138   0.6690        [35m0.2588[0m       0.9371        0.2366        9.5227
      8   0.1208   0.6709        [35m0.2587[0m       0.9371        [94m0.2304[0m     +  9.0316
      9   0.1163   0.6730        [35m0.2583[0m       0.9371        [94m0.2278[0m     +  9.1567
     10   0.1177   0.6704        0.2591       0.9371        0.2280        9.3473
     11   0.1183   0.6721        [35m0.2568[0m       0.9371        0.2324        9.3845
     12   0.1163   0.6709        [35m0.2558[0m       0.9371        [94m0.2275[0m     +  9.1434
     13   0.1150   0.6703        [35m0.2547[0m       0.9371        0.2279        9.2807
     14   0.1181   0.6742        0.2558       0.9371        0.2302        9.3972
     15   0.1153   0.6715        0.2565       0.9371        [94m0.2270[0m     +  9.2696
     16   0.1153   0.6708        [35m0.2545[0m       0.9371        0.2281        8.8503
     17   0.1221   0.6722        0.2558       0.9371        0.2300        9.2698
     18   0.1190   0.6726        0.2550       0.9371        0.2295        9.1855
     19   0.1175   0.6732        0.2555       0.9371        0.2308        9.3830
     20   0.1338   0.6731        [35m0.2544[0m       0.9371        0.2323        9.3789
     21   0.1173   0.6739        0.2555       0.9371        0.2305        9.4100
     22   0.1277   [32m0.6770[0m        [35m0.2544[0m       0.9371        0.2321        9.2156
     23   0.1365   0.6690        0.2544       [31m0.9383[0m        0.2377        9.4787
     24   0.1193   [32m0.6771[0m        [35m0.2532[0m       0.9371        0.2360        9.1742
Stopping since valid_loss has not improved in the last 10 epochs.
[32m[I 2023-05-02 08:36:45,707][0m Trial 80 finished with value: 0.2270017885743779 and parameters: {'lr': 0.008875795915962307, 'dropout': 0.5830929373937257, 'd_model_multiplier': 2, 'num_layers': 3, 'n_heads': 4, 'dim_feedforward': 152, 'batch_size': 52, 'pos_encoding': 'fixed', 'activation': 'gelu', 'norm': 'LayerNorm', 'optimizer_name': 'AdamW', 'weight_decay': 0.01, 'top_n_features': 147}. Best is trial 12 with value: 0.20472501771481755.[0m
[FileBasedDataset] Initializing dataset...
	Examples: 8264
	Features: 134
	Max length: 315
Standard scalar turned ON, loading params from cache
[FileBasedDataset] Dataset initialization complete
  epoch    auprc    auroc    train_loss    valid_acc    valid_loss    cp     dur
-------  -------  -------  ------------  -----------  ------------  ----  ------
      1   [36m0.1879[0m   [32m0.7034[0m        [35m0.3070[0m       [31m0.9214[0m        [94m0.2557[0m     +  8.5469
      2   [36m0.2236[0m   [32m0.7531[0m        [35m0.2486[0m       0.9129        [94m0.2494[0m     +  8.7059
      3   [36m0.2488[0m   [32m0.7647[0m        [35m0.2462[0m       0.9141        [94m0.2425[0m     +  9.2043
      4   [36m0.2632[0m   [32m0.7709[0m        [35m0.2392[0m       0.9190        [94m0.2421[0m     +  9.4248
      5   0.2544   [32m0.7794[0m        0.2397       0.9214        [94m0.2393[0m     +  9.1296
      6   [36m0.2634[0m   0.7778        [35m0.2390[0m       [31m0.9226[0m        0.2414        9.2742
      7   [36m0.2671[0m   [32m0.7926[0m        [35m0.2386[0m       0.9214        [94m0.2338[0m     +  9.2492
      8   [36m0.2735[0m   [32m0.8003[0m        [35m0.2341[0m       0.9226        [94m0.2322[0m     +  9.4545
      9   [36m0.2941[0m   [32m0.8088[0m        [35m0.2333[0m       0.9202        [94m0.2290[0m     +  9.3420
     10   0.2767   0.8087        [35m0.2306[0m       0.9226        0.2317        9.2883
     11   0.2810   [32m0.8102[0m        0.2324       0.9202        [94m0.2284[0m     +  9.1154
     12   0.2791   [32m0.8166[0m        [35m0.2259[0m       0.9214        0.2300        9.4462
     13   0.2864   [32m0.8198[0m        [35m0.2259[0m       0.9214        [94m0.2258[0m     +  9.2790
     14   0.2723   [32m0.8210[0m        0.2264       0.9190        0.2273        9.3975
     15   0.2843   0.8148        [35m0.2228[0m       0.9214        0.2303        9.2378
     16   0.2876   0.8165        0.2238       0.9214        0.2284        9.4814
     17   0.2879   0.8173        [35m0.2220[0m       0.9214        0.2310        9.2524
     18   0.2875   0.8154        0.2238       0.9214        0.2306        9.2382
     19   0.2815   0.8121        0.2226       0.9226        0.2311        9.1649
     20   0.2880   0.8173        [35m0.2204[0m       0.9226        0.2287        9.2775
     21   0.2870   0.8140        [35m0.2200[0m       [31m0.9238[0m        0.2315        9.2540
     22   0.2836   [32m0.8215[0m        [35m0.2199[0m       0.9202        0.2260        9.1619
Stopping since valid_loss has not improved in the last 10 epochs.
[32m[I 2023-05-02 08:40:19,057][0m Trial 81 finished with value: 0.22582951431334955 and parameters: {'lr': 0.00033877973317954685, 'dropout': 0.4915538525026508, 'd_model_multiplier': 2, 'num_layers': 2, 'n_heads': 4, 'dim_feedforward': 156, 'batch_size': 19, 'pos_encoding': 'fixed', 'activation': 'relu', 'norm': 'LayerNorm', 'optimizer_name': 'AdamW', 'weight_decay': 0.01, 'top_n_features': 134}. Best is trial 12 with value: 0.20472501771481755.[0m
[FileBasedDataset] Initializing dataset...
	Examples: 8264
	Features: 156
	Max length: 315
Standard scalar turned ON, loading params from cache
[FileBasedDataset] Dataset initialization complete
  epoch    auprc    auroc    train_loss    valid_acc    valid_loss    cp     dur
-------  -------  -------  ------------  -----------  ------------  ----  ------
      1   [36m0.1797[0m   [32m0.7381[0m        [35m0.2837[0m       [31m0.9359[0m        [94m0.2192[0m     +  8.5135
      2   [36m0.2029[0m   [32m0.7781[0m        [35m0.2489[0m       0.9178        0.2219        9.4676
      3   [36m0.2194[0m   [32m0.7904[0m        [35m0.2412[0m       0.9202        [94m0.2162[0m     +  9.2837
      4   0.2187   0.7874        [35m0.2377[0m       0.9190        0.2199        9.2103
      5   [36m0.2278[0m   [32m0.7948[0m        [35m0.2361[0m       0.9166        0.2199        9.3474
      6   0.2123   0.7929        0.2371       0.9129        0.2354        9.5644
      7   [36m0.2347[0m   0.7833        [35m0.2317[0m       0.9105        0.2362        9.5050
      8   0.2210   0.7817        0.2328       0.9129        0.2391        9.7629
      9   0.2176   [32m0.7955[0m        [35m0.2298[0m       0.9166        0.2431        9.5554
     10   0.2217   0.7897        0.2305       0.9190        0.2392        9.3015
     11   0.2176   0.7867        [35m0.2265[0m       0.9190        0.2277        9.5626
     12   0.2098   0.7841        [35m0.2261[0m       0.9190        0.2302        9.4480
Stopping since valid_loss has not improved in the last 10 epochs.
[32m[I 2023-05-02 08:42:21,804][0m Trial 82 finished with value: 0.21620399053540743 and parameters: {'lr': 0.00018035372028989924, 'dropout': 0.4644537301079474, 'd_model_multiplier': 16, 'num_layers': 4, 'n_heads': 4, 'dim_feedforward': 131, 'batch_size': 42, 'pos_encoding': 'fixed', 'activation': 'relu', 'norm': 'LayerNorm', 'optimizer_name': 'AdamW', 'weight_decay': 0.01, 'top_n_features': 156}. Best is trial 12 with value: 0.20472501771481755.[0m
[FileBasedDataset] Initializing dataset...
	Examples: 8264
	Features: 164
	Max length: 315
Standard scalar turned ON, loading params from cache
[FileBasedDataset] Dataset initialization complete
  epoch    auprc    auroc    train_loss    valid_acc    valid_loss    cp     dur
-------  -------  -------  ------------  -----------  ------------  ----  ------
      1   [36m0.2813[0m   [32m0.7467[0m        [35m0.2789[0m       [31m0.9093[0m        [94m0.2754[0m     +  9.2355
      2   [36m0.2841[0m   [32m0.7736[0m        [35m0.2434[0m       0.9069        [94m0.2706[0m     +  9.2198
      3   [36m0.2900[0m   [32m0.7769[0m        [35m0.2383[0m       0.8984        0.2797        9.2356
      4   [36m0.2967[0m   [32m0.7806[0m        [35m0.2353[0m       0.8996        0.2732        9.2918
      5   0.2911   0.7747        [35m0.2342[0m       0.8984        0.2791        9.1705
      6   [36m0.3080[0m   0.7797        [35m0.2306[0m       0.8863        0.2901        9.4216
      7   [36m0.3188[0m   0.7775        [35m0.2275[0m       0.8912        0.2824        9.3938
      8   [36m0.3202[0m   0.7790        [35m0.2273[0m       0.8936        0.2804        9.2440
      9   [36m0.3259[0m   0.7712        [35m0.2245[0m       0.8815        0.2960        9.5468
     10   [36m0.3350[0m   0.7776        [35m0.2238[0m       0.8936        0.2838        9.3234
     11   0.2915   0.7750        0.2276       0.8839        0.2888        9.3393
Stopping since valid_loss has not improved in the last 10 epochs.
[32m[I 2023-05-02 08:44:13,876][0m Trial 83 finished with value: 0.2705514370458158 and parameters: {'lr': 0.00017966129700450474, 'dropout': 0.4671047259766067, 'd_model_multiplier': 16, 'num_layers': 4, 'n_heads': 4, 'dim_feedforward': 136, 'batch_size': 41, 'pos_encoding': 'fixed', 'activation': 'relu', 'norm': 'LayerNorm', 'optimizer_name': 'AdamW', 'weight_decay': 0.01, 'top_n_features': 164}. Best is trial 12 with value: 0.20472501771481755.[0m
[FileBasedDataset] Initializing dataset...
	Examples: 8264
	Features: 123
	Max length: 315
Standard scalar turned ON, loading params from cache
[FileBasedDataset] Dataset initialization complete
  epoch    auprc    auroc    train_loss    valid_acc    valid_loss    cp     dur
-------  -------  -------  ------------  -----------  ------------  ----  ------
      1   [36m0.2789[0m   [32m0.7910[0m        [35m0.3047[0m       [31m0.9335[0m        [94m0.2082[0m     +  8.3891
      2   0.2577   0.7855        [35m0.2589[0m       0.9274        0.2129        8.3560
      3   0.2413   [32m0.8037[0m        [35m0.2462[0m       0.9274        0.2118        9.1190
      4   0.2546   0.7981        [35m0.2448[0m       0.9250        0.2173        9.0257
      5   0.2562   0.8035        [35m0.2406[0m       0.9311        0.2104        9.2691
      6   0.2482   0.8010        [35m0.2381[0m       0.9262        0.2132        9.2257
      7   0.2654   [32m0.8072[0m        [35m0.2370[0m       0.9287        0.2150        9.1020
      8   0.2369   0.8025        [35m0.2325[0m       0.9262        0.2250        9.1739
      9   0.2399   0.8054        0.2339       0.9262        0.2251        9.5655
     10   0.2438   0.7991        [35m0.2311[0m       0.9287        0.2206        9.3463
Stopping since valid_loss has not improved in the last 10 epochs.
[32m[I 2023-05-02 08:45:53,805][0m Trial 84 finished with value: 0.20818104376924082 and parameters: {'lr': 0.001040644795444706, 'dropout': 0.4509004619481119, 'd_model_multiplier': 2, 'num_layers': 3, 'n_heads': 4, 'dim_feedforward': 130, 'batch_size': 54, 'pos_encoding': 'fixed', 'activation': 'relu', 'norm': 'LayerNorm', 'optimizer_name': 'AdamW', 'weight_decay': 0.01, 'top_n_features': 123}. Best is trial 12 with value: 0.20472501771481755.[0m
[FileBasedDataset] Initializing dataset...
	Examples: 8264
	Features: 118
	Max length: 315
Standard scalar turned ON, loading params from cache
[FileBasedDataset] Dataset initialization complete
  epoch    auprc    auroc    train_loss    valid_acc    valid_loss    cp     dur
-------  -------  -------  ------------  -----------  ------------  ----  ------
      1   [36m0.2689[0m   [32m0.7401[0m        [35m0.2685[0m       [31m0.9166[0m        [94m0.2612[0m     +  8.6305
      2   [36m0.3272[0m   [32m0.7771[0m        [35m0.2454[0m       0.9166        [94m0.2476[0m     +  9.3656
      3   [36m0.3346[0m   0.7741        [35m0.2371[0m       [31m0.9178[0m        0.2546        9.4662
      4   0.3345   0.7674        0.2380       0.9154        0.2713        9.7114
      5   0.3262   0.7735        [35m0.2328[0m       0.9154        0.2686        9.6376
      6   0.3243   [32m0.7981[0m        [35m0.2296[0m       [31m0.9190[0m        0.2536        9.5268
      7   0.2877   0.7724        [35m0.2291[0m       0.9154        0.2883        9.7065
      8   0.2951   0.7853        [35m0.2254[0m       0.9154        0.2839        9.4919
      9   0.3042   0.7848        [35m0.2248[0m       0.9117        0.2793        9.7521
     10   0.3145   0.7828        [35m0.2236[0m       0.9141        0.2754        9.6968
     11   0.3139   0.7912        [35m0.2233[0m       0.9166        0.2646        9.8248
Stopping since valid_loss has not improved in the last 10 epochs.
