## SLURM PROLOG ###############################################################
##    Job ID : 9851912
##  Job Name : tuneSkorchTst.sh
##  Nodelist : gpu2106
##      CPUs : 1
##  Mem/Node : 65536 MB
## Directory : /gpfs/home/isears1/Repos/tabnet-sepsis
##   Job Started : Tue May  2 00:16:18 EDT 2023
###############################################################################
module: loading 'cuda/11.3.1'
module: cuda: To use: module load gcc/10.2
module: loading 'cudnn/8.2.0'
module: cudnn: To use: module load cuda/11.1.1 gcc/10.2
Tue May  2 00:16:18 2023       
+-----------------------------------------------------------------------------+
| NVIDIA-SMI 515.65.01    Driver Version: 515.65.01    CUDA Version: 11.7     |
|-------------------------------+----------------------+----------------------+
| GPU  Name        Persistence-M| Bus-Id        Disp.A | Volatile Uncorr. ECC |
| Fan  Temp  Perf  Pwr:Usage/Cap|         Memory-Usage | GPU-Util  Compute M. |
|                               |                      |               MIG M. |
|===============================+======================+======================|
|   0  NVIDIA GeForce ...  On   | 00000000:01:00.0 Off |                  N/A |
| 43%   44C    P5    96W / 350W |     35MiB / 24576MiB |      0%      Default |
|                               |                      |                  N/A |
+-------------------------------+----------------------+----------------------+
                                                                               
+-----------------------------------------------------------------------------+
| Processes:                                                                  |
|  GPU   GI   CI        PID   Type   Process name                  GPU Memory |
|        ID   ID                                                   Usage      |
|=============================================================================|
|    0   N/A  N/A     15959      G   X                                  33MiB |
+-----------------------------------------------------------------------------+
Python 3.10.4
[32m[I 2023-05-02 00:16:22,699][0m A new study created in memory with name: no-name-5ce9e989-9d56-4002-ac98-f5df1102b7b9[0m
[FileBasedDataset] Initializing dataset...
	Examples: 8264
	Features: 225
	Max length: 315
Standard scalar turned ON, loading params from cache
[FileBasedDataset] Dataset initialization complete
  epoch    auprc    auroc    train_loss    valid_acc    valid_loss    cp      dur
-------  -------  -------  ------------  -----------  ------------  ----  -------
      1   [36m0.2110[0m   [32m0.7134[0m        [35m0.3053[0m       [31m0.9214[0m        [94m0.2569[0m     +  16.4736
      2   [36m0.2512[0m   [32m0.7337[0m        [35m0.2476[0m       0.9202        [94m0.2506[0m     +  14.6989
      3   [36m0.2715[0m   [32m0.7478[0m        [35m0.2466[0m       0.9202        [94m0.2497[0m     +  14.0693
      4   [36m0.2769[0m   [32m0.7605[0m        [35m0.2423[0m       [31m0.9226[0m        [94m0.2462[0m     +  22.9211
      5   [36m0.3014[0m   [32m0.7675[0m        [35m0.2406[0m       [31m0.9250[0m        [94m0.2425[0m     +  13.1737
      6   [36m0.3034[0m   [32m0.7740[0m        [35m0.2388[0m       0.9214        [94m0.2405[0m     +  13.3392
      7   0.2993   [32m0.7756[0m        [35m0.2369[0m       0.9238        0.2417        13.7317
      8   [36m0.3219[0m   [32m0.7815[0m        [35m0.2360[0m       0.9250        [94m0.2391[0m     +  23.6633
      9   0.3198   0.7801        [35m0.2347[0m       0.9238        [94m0.2379[0m     +  13.9450
     10   [36m0.3335[0m   0.7803        [35m0.2313[0m       0.9226        0.2405        14.2418
     11   0.3243   0.7809        [35m0.2312[0m       0.9226        0.2438        14.2332
     12   0.3312   0.7803        [35m0.2311[0m       0.9214        0.2411        13.8998
     13   0.3329   0.7776        [35m0.2283[0m       0.9250        0.2473        24.8299
     14   0.3290   [32m0.7860[0m        0.2287       0.9238        0.2435        13.8097
     15   0.3149   [32m0.7886[0m        0.2287       0.9226        0.2405        13.6069
     16   0.3246   0.7860        [35m0.2255[0m       0.9238        0.2475        13.8705
     17   0.3113   0.7834        0.2277       0.9178        0.2442        23.3328
     18   0.3220   0.7863        0.2262       0.9238        0.2461        13.8683
Stopping since valid_loss has not improved in the last 10 epochs.
[32m[I 2023-05-02 00:21:30,334][0m Trial 0 finished with value: 0.23786523179607208 and parameters: {'lr': 0.00022773707365791534, 'dropout': 0.5046651723743011, 'd_model_multiplier': 8, 'num_layers': 2, 'n_heads': 16, 'dim_feedforward': 359, 'batch_size': 215, 'pos_encoding': 'fixed', 'activation': 'relu', 'norm': 'LayerNorm', 'optimizer_name': 'AdamW', 'weight_decay': 0, 'top_n_features': 225}. Best is trial 0 with value: 0.23786523179607208.[0m
[FileBasedDataset] Initializing dataset...
	Examples: 8264
	Features: 51
	Max length: 315
Standard scalar turned ON, loading params from cache
[FileBasedDataset] Dataset initialization complete
  epoch    auprc    auroc    train_loss    valid_acc    valid_loss    cp     dur
-------  -------  -------  ------------  -----------  ------------  ----  ------
      1   [36m0.0707[0m   [32m0.3242[0m        [35m0.6362[0m       [31m0.8984[0m        [94m0.6225[0m     +  9.9891
      2   0.0705   0.3221        [35m0.6330[0m       [31m0.9033[0m        [94m0.6191[0m     +  8.8871
      3   0.0681   0.3143        [35m0.6234[0m       0.9033        [94m0.6137[0m     +  19.7077
      4   0.0673   0.3080        [35m0.6180[0m       [31m0.9069[0m        [94m0.6088[0m     +  8.8290
      5   0.0662   0.3037        [35m0.6119[0m       [31m0.9093[0m        [94m0.6035[0m     +  8.8500
      6   0.0643   0.2977        [35m0.6003[0m       [31m0.9117[0m        [94m0.5966[0m     +  9.2858
      7   0.0628   0.2931        [35m0.5959[0m       0.9117        [94m0.5918[0m     +  9.2271
      8   0.0615   0.2849        [35m0.5849[0m       [31m0.9129[0m        [94m0.5862[0m     +  9.0332
      9   0.0608   0.2847        [35m0.5758[0m       [31m0.9141[0m        [94m0.5806[0m     +  9.4835
     10   0.0585   0.2783        [35m0.5699[0m       [31m0.9166[0m        [94m0.5749[0m     +  9.3433
     11   0.0576   0.2744        [35m0.5586[0m       [31m0.9178[0m        [94m0.5696[0m     +  9.0509
     12   0.0569   0.2726        [35m0.5543[0m       0.9178        [94m0.5645[0m     +  8.7931
     13   0.0556   0.2698        [35m0.5462[0m       0.9178        [94m0.5588[0m     +  8.7516
     14   0.0548   0.2671        [35m0.5404[0m       0.9178        [94m0.5554[0m     +  8.7976
     15   0.0542   0.2637        [35m0.5305[0m       0.9178        [94m0.5499[0m     +  8.8159
     16   0.0539   0.2606        [35m0.5258[0m       0.9178        [94m0.5451[0m     +  8.8658
     17   0.0539   0.2613        [35m0.5153[0m       0.9178        [94m0.5406[0m     +  8.7367
     18   0.0536   0.2585        [35m0.5077[0m       0.9178        [94m0.5354[0m     +  8.9892
     19   0.0536   0.2578        [35m0.5068[0m       0.9178        [94m0.5310[0m     +  8.9367
     20   0.0537   0.2547        [35m0.4993[0m       0.9178        [94m0.5266[0m     +  8.7900
     21   0.0541   0.2540        [35m0.4949[0m       0.9178        [94m0.5219[0m     +  9.1685
     22   0.0541   0.2541        [35m0.4877[0m       0.9178        [94m0.5168[0m     +  9.3446
     23   0.0544   0.2527        [35m0.4808[0m       0.9178        [94m0.5134[0m     +  10.0319
     24   0.0540   0.2525        [35m0.4771[0m       0.9178        [94m0.5104[0m     +  9.4237
     25   0.0547   0.2498        [35m0.4710[0m       0.9178        [94m0.5041[0m     +  9.2395
     26   0.0548   0.2498        [35m0.4635[0m       0.9178        [94m0.5022[0m     +  9.3955
     27   0.0548   0.2503        [35m0.4610[0m       0.9178        [94m0.4985[0m     +  8.7562
     28   0.0543   0.2499        [35m0.4551[0m       0.9178        [94m0.4950[0m     +  8.8025
     29   0.0548   0.2501        [35m0.4487[0m       0.9178        [94m0.4896[0m     +  8.9452
     30   0.0548   0.2487        [35m0.4464[0m       0.9178        [94m0.4869[0m     +  9.0468
     31   0.0549   0.2500        [35m0.4401[0m       0.9178        [94m0.4835[0m     +  8.7509
     32   0.0548   0.2489        [35m0.4380[0m       0.9178        [94m0.4799[0m     +  8.5915
     33   0.0549   0.2491        [35m0.4330[0m       0.9178        [94m0.4773[0m     +  8.8815
     34   0.0549   0.2493        [35m0.4280[0m       0.9178        [94m0.4729[0m     +  8.7094
     35   0.0549   0.2494        [35m0.4275[0m       0.9178        [94m0.4711[0m     +  8.9565
     36   0.0550   0.2494        [35m0.4194[0m       0.9178        [94m0.4674[0m     +  8.5058
     37   0.0549   0.2494        [35m0.4175[0m       0.9178        [94m0.4644[0m     +  9.0725
     38   0.0550   0.2499        [35m0.4140[0m       0.9178        [94m0.4610[0m     +  8.8305
     39   0.0551   0.2507        [35m0.4109[0m       0.9178        [94m0.4578[0m     +  8.6223
     40   0.0551   0.2504        [35m0.4083[0m       0.9178        [94m0.4549[0m     +  8.8533
     41   0.0547   0.2506        [35m0.4071[0m       0.9178        [94m0.4526[0m     +  8.7068
     42   0.0547   0.2505        [35m0.4014[0m       0.9178        [94m0.4494[0m     +  9.3991
     43   0.0547   0.2513        [35m0.4004[0m       0.9178        [94m0.4471[0m     +  9.1131
     44   0.0548   0.2518        [35m0.3954[0m       0.9178        [94m0.4450[0m     +  9.1753
     45   0.0548   0.2524        [35m0.3905[0m       0.9178        [94m0.4428[0m     +  9.0545
     46   0.0549   0.2523        [35m0.3876[0m       0.9178        [94m0.4396[0m     +  9.0293
     47   0.0553   0.2525        [35m0.3872[0m       0.9178        [94m0.4368[0m     +  8.5728
     48   0.0554   0.2529        [35m0.3849[0m       0.9178        [94m0.4340[0m     +  8.6222
     49   0.0555   0.2537        [35m0.3823[0m       0.9178        [94m0.4323[0m     +  8.7042
     50   0.0555   0.2544        [35m0.3803[0m       0.9178        [94m0.4288[0m     +  8.9614
[32m[I 2023-05-02 00:29:17,276][0m Trial 1 finished with value: 0.4288449683097138 and parameters: {'lr': 8.197545550454173e-08, 'dropout': 0.42708637322043297, 'd_model_multiplier': 1, 'num_layers': 1, 'n_heads': 32, 'dim_feedforward': 471, 'batch_size': 14, 'pos_encoding': 'fixed', 'activation': 'relu', 'norm': 'BatchNorm', 'optimizer_name': 'RAdam', 'weight_decay': 0.01, 'top_n_features': 51}. Best is trial 0 with value: 0.23786523179607208.[0m
[FileBasedDataset] Initializing dataset...
	Examples: 8264
	Features: 222
	Max length: 315
Standard scalar turned ON, loading params from cache
[FileBasedDataset] Dataset initialization complete
Warning, assumed runtime error: CUDA out of memory. Tried to allocate 1.49 GiB (GPU 0; 23.70 GiB total capacity; 20.99 GiB already allocated; 1.29 GiB free; 21.33 GiB reserved in total by PyTorch) If reserved memory is >> allocated memory try setting max_split_size_mb to avoid fragmentation.  See documentation for Memory Management and PYTORCH_CUDA_ALLOC_CONF
[32m[I 2023-05-02 00:29:22,590][0m Trial 2 finished with value: 100.0 and parameters: {'lr': 1.102113016441554e-05, 'dropout': 0.4492830752032858, 'd_model_multiplier': 16, 'num_layers': 12, 'n_heads': 32, 'dim_feedforward': 279, 'batch_size': 126, 'pos_encoding': 'learnable', 'activation': 'relu', 'norm': 'LayerNorm', 'optimizer_name': 'RAdam', 'weight_decay': 0.1, 'top_n_features': 222}. Best is trial 0 with value: 0.23786523179607208.[0m
[FileBasedDataset] Initializing dataset...
	Examples: 8264
	Features: 171
	Max length: 315
Standard scalar turned ON, loading params from cache
[FileBasedDataset] Dataset initialization complete
  epoch    auprc    auroc    train_loss    valid_acc    valid_loss    cp      dur
-------  -------  -------  ------------  -----------  ------------  ----  -------
      1   [36m0.2108[0m   [32m0.7011[0m        [35m0.3800[0m       [31m0.9178[0m        [94m0.2616[0m     +  34.6278
      2   [36m0.2402[0m   [32m0.7493[0m        [35m0.2520[0m       0.9178        [94m0.2518[0m     +  34.8677
      3   [36m0.2468[0m   [32m0.7708[0m        [35m0.2435[0m       0.9105        0.2519        34.9491
      4   [36m0.2594[0m   0.7516        [35m0.2421[0m       0.9141        0.2581        34.9240
      5   [36m0.2676[0m   0.7561        [35m0.2376[0m       0.9045        0.2579        34.9666
      6   [36m0.2697[0m   0.7581        [35m0.2359[0m       0.9069        0.2596        34.5496
      7   0.2636   0.7596        0.2360       0.9117        0.2542        35.0818
      8   0.2621   0.7599        [35m0.2320[0m       0.9081        0.2613        34.8354
      9   [36m0.2754[0m   0.7659        0.2331       0.9045        0.2590        35.4437
     10   0.2617   0.7549        [35m0.2317[0m       0.9069        0.2732        35.3515
     11   [36m0.2875[0m   0.7540        [35m0.2293[0m       [31m0.9202[0m        [94m0.2512[0m     +  34.8249
     12   0.2738   0.7561        [35m0.2289[0m       0.8972        0.2802        35.0332
     13   0.2804   0.7576        [35m0.2284[0m       0.9129        0.2567        34.9745
     14   0.2837   0.7589        [35m0.2265[0m       0.9117        0.2685        34.8052
     15   0.2830   0.7482        [35m0.2262[0m       0.9117        0.2609        35.0804
     16   0.2734   0.7582        0.2291       0.9021        0.2888        35.2012
     17   0.2682   0.7471        [35m0.2256[0m       0.8936        0.3023        35.0391
     18   0.2580   0.7531        0.2263       0.8912        0.2955        34.8613
     19   0.2761   0.7526        [35m0.2255[0m       0.8996        0.2918        35.1155
     20   0.2645   0.7524        [35m0.2234[0m       0.9081        0.2798        35.0265
Stopping since valid_loss has not improved in the last 10 epochs.
[32m[I 2023-05-02 00:41:37,864][0m Trial 3 finished with value: 0.25115755658051697 and parameters: {'lr': 0.00017808761944302582, 'dropout': 0.49935774679918776, 'd_model_multiplier': 4, 'num_layers': 8, 'n_heads': 32, 'dim_feedforward': 504, 'batch_size': 56, 'pos_encoding': 'fixed', 'activation': 'relu', 'norm': 'LayerNorm', 'optimizer_name': 'RAdam', 'weight_decay': 0.01, 'top_n_features': 171}. Best is trial 0 with value: 0.23786523179607208.[0m
[FileBasedDataset] Initializing dataset...
	Examples: 8264
	Features: 98
	Max length: 315
Standard scalar turned ON, loading params from cache
[FileBasedDataset] Dataset initialization complete
Warning, assumed runtime error: CUDA out of memory. Tried to allocate 3.24 GiB (GPU 0; 23.70 GiB total capacity; 18.24 GiB already allocated; 3.04 GiB free; 19.57 GiB reserved in total by PyTorch) If reserved memory is >> allocated memory try setting max_split_size_mb to avoid fragmentation.  See documentation for Memory Management and PYTORCH_CUDA_ALLOC_CONF
[32m[I 2023-05-02 00:41:43,892][0m Trial 4 finished with value: 100.0 and parameters: {'lr': 0.0001801566574221871, 'dropout': 0.36646972313053217, 'd_model_multiplier': 1, 'num_layers': 5, 'n_heads': 64, 'dim_feedforward': 184, 'batch_size': 137, 'pos_encoding': 'learnable', 'activation': 'gelu', 'norm': 'BatchNorm', 'optimizer_name': 'PlainRAdam', 'weight_decay': 0.001, 'top_n_features': 98}. Best is trial 0 with value: 0.23786523179607208.[0m
[FileBasedDataset] Initializing dataset...
	Examples: 8264
	Features: 132
	Max length: 315
Standard scalar turned ON, loading params from cache
[FileBasedDataset] Dataset initialization complete
  epoch    auprc    auroc    train_loss    valid_acc    valid_loss    cp      dur
-------  -------  -------  ------------  -----------  ------------  ----  -------
      1   [36m0.0598[0m   [32m0.4428[0m        [35m0.7704[0m       [31m0.0798[0m        [94m0.7782[0m     +  16.8635
      2   [36m0.0602[0m   [32m0.4438[0m        0.7705       [31m0.0810[0m        [94m0.7776[0m     +  16.1124
      3   [36m0.0604[0m   [32m0.4449[0m        [35m0.7695[0m       0.0810        [94m0.7768[0m     +  16.3486
      4   [36m0.0609[0m   [32m0.4464[0m        [35m0.7692[0m       0.0810        [94m0.7759[0m     +  15.5799
      5   [36m0.0615[0m   [32m0.4482[0m        [35m0.7679[0m       0.0810        [94m0.7749[0m     +  15.0037
      6   [36m0.0619[0m   [32m0.4501[0m        [35m0.7674[0m       0.0810        [94m0.7737[0m     +  15.1138
      7   [36m0.0626[0m   [32m0.4522[0m        [35m0.7662[0m       0.0810        [94m0.7724[0m     +  14.9867
      8   [36m0.0643[0m   [32m0.4551[0m        [35m0.7656[0m       [31m0.0822[0m        [94m0.7711[0m     +  15.2440
      9   [36m0.0659[0m   [32m0.4579[0m        [35m0.7646[0m       0.0822        [94m0.7696[0m     +  14.8949
     10   [36m0.0680[0m   [32m0.4608[0m        [35m0.7633[0m       0.0822        [94m0.7681[0m     +  16.2323
     11   [36m0.0719[0m   [32m0.4638[0m        [35m0.7619[0m       0.0822        [94m0.7665[0m     +  15.5499
     12   [36m0.0720[0m   [32m0.4661[0m        [35m0.7600[0m       0.0822        [94m0.7648[0m     +  16.2735
     13   [36m0.0723[0m   [32m0.4689[0m        [35m0.7589[0m       0.0822        [94m0.7631[0m     +  16.5280
     14   [36m0.0726[0m   [32m0.4722[0m        [35m0.7577[0m       0.0822        [94m0.7613[0m     +  15.4698
     15   0.0726   [32m0.4752[0m        [35m0.7562[0m       0.0810        [94m0.7594[0m     +  16.2669
     16   [36m0.0732[0m   [32m0.4784[0m        [35m0.7548[0m       0.0810        [94m0.7575[0m     +  15.8380
     17   [36m0.0736[0m   [32m0.4811[0m        [35m0.7527[0m       0.0810        [94m0.7556[0m     +  15.7816
     18   [36m0.0739[0m   [32m0.4843[0m        [35m0.7520[0m       0.0822        [94m0.7535[0m     +  15.9901
     19   [36m0.0741[0m   [32m0.4872[0m        [35m0.7501[0m       0.0822        [94m0.7515[0m     +  15.9334
     20   0.0740   [32m0.4888[0m        [35m0.7487[0m       [31m0.0834[0m        [94m0.7494[0m     +  15.7907
     21   [36m0.0744[0m   [32m0.4918[0m        [35m0.7470[0m       0.0834        [94m0.7473[0m     +  15.8989
     22   [36m0.0746[0m   [32m0.4939[0m        [35m0.7458[0m       [31m0.0859[0m        [94m0.7452[0m     +  16.1936
     23   [36m0.0748[0m   [32m0.4955[0m        [35m0.7430[0m       [31m0.0883[0m        [94m0.7430[0m     +  15.8563
     24   0.0720   [32m0.4975[0m        [35m0.7415[0m       0.0883        [94m0.7409[0m     +  15.9420
     25   0.0710   [32m0.4987[0m        [35m0.7394[0m       [31m0.0895[0m        [94m0.7387[0m     +  16.2384
     26   0.0707   [32m0.5007[0m        [35m0.7377[0m       0.0883        [94m0.7365[0m     +  16.2286
     27   0.0708   [32m0.5013[0m        [35m0.7356[0m       [31m0.0931[0m        [94m0.7343[0m     +  15.9291
     28   0.0695   [32m0.5021[0m        [35m0.7342[0m       [31m0.1016[0m        [94m0.7321[0m     +  16.7261
     29   0.0689   0.4995        [35m0.7316[0m       [31m0.1028[0m        [94m0.7299[0m     +  18.2027
     30   0.0688   0.4975        [35m0.7299[0m       [31m0.1076[0m        [94m0.7277[0m     +  16.4941
     31   0.0686   0.4962        [35m0.7284[0m       [31m0.1137[0m        [94m0.7255[0m     +  16.0759
     32   0.0682   0.4935        [35m0.7260[0m       [31m0.1185[0m        [94m0.7232[0m     +  16.2280
     33   0.0680   0.4923        [35m0.7235[0m       [31m0.1221[0m        [94m0.7210[0m     +  16.3257
     34   0.0677   0.4901        [35m0.7221[0m       [31m0.1306[0m        [94m0.7187[0m     +  16.4946
     35   0.0673   0.4865        [35m0.7200[0m       [31m0.1391[0m        [94m0.7165[0m     +  16.3405
     36   0.0662   0.4828        [35m0.7179[0m       [31m0.1548[0m        [94m0.7142[0m     +  16.9604
     37   0.0653   0.4770        [35m0.7156[0m       [31m0.1741[0m        [94m0.7119[0m     +  16.7738
     38   0.0649   0.4724        [35m0.7140[0m       [31m0.1935[0m        [94m0.7097[0m     +  16.7889
     39   0.0645   0.4677        [35m0.7116[0m       [31m0.2092[0m        [94m0.7074[0m     +  16.4253
     40   0.0642   0.4615        [35m0.7097[0m       [31m0.2406[0m        [94m0.7052[0m     +  15.9428
     41   0.0637   0.4553        [35m0.7076[0m       [31m0.2709[0m        [94m0.7029[0m     +  16.1699
     42   0.0634   0.4496        [35m0.7052[0m       [31m0.3120[0m        [94m0.7006[0m     +  16.2427
     43   0.0630   0.4450        [35m0.7029[0m       [31m0.3615[0m        [94m0.6984[0m     +  16.2794
     44   0.0627   0.4399        [35m0.7012[0m       [31m0.3978[0m        [94m0.6962[0m     +  16.4430
     45   0.0627   0.4352        [35m0.6985[0m       [31m0.4631[0m        [94m0.6940[0m     +  16.6142
     46   0.0632   0.4286        [35m0.6969[0m       [31m0.5079[0m        [94m0.6917[0m     +  16.4706
     47   0.0635   0.4222        [35m0.6943[0m       [31m0.5647[0m        [94m0.6895[0m     +  16.4781
     48   0.0628   0.4158        [35m0.6925[0m       [31m0.6143[0m        [94m0.6873[0m     +  16.1756
     49   0.0635   0.4106        [35m0.6902[0m       [31m0.6663[0m        [94m0.6851[0m     +  16.8421
     50   0.0648   0.4068        [35m0.6892[0m       [31m0.7110[0m        [94m0.6830[0m     +  15.9301
