[32m[I 2023-05-02 17:19:59,523][0m Trial 178 finished with value: 0.25795992115172395 and parameters: {'lr': 0.00016029283319120408, 'dropout': 0.606037313795123, 'd_model_multiplier': 2, 'num_layers': 2, 'n_heads': 16, 'dim_feedforward': 451, 'batch_size': 50, 'pos_encoding': 'fixed', 'activation': 'relu', 'norm': 'LayerNorm', 'optimizer_name': 'PlainRAdam', 'weight_decay': 0.01, 'top_n_features': 17}. Best is trial 117 with value: 0.191397856754288.[0m
[FileBasedDataset] Initializing dataset...
	Examples: 8264
	Features: 26
	Max length: 315
Standard scalar turned ON, loading params from cache
[FileBasedDataset] Dataset initialization complete
  epoch    auprc    auroc    train_loss    valid_acc    valid_loss    cp     dur
-------  -------  -------  ------------  -----------  ------------  ----  ------
      1   [36m0.3475[0m   [32m0.7914[0m        [35m0.2727[0m       [31m0.8815[0m        [94m0.4000[0m     +  8.4704
      2   [36m0.3664[0m   [32m0.7949[0m        [35m0.2536[0m       [31m0.8936[0m        [94m0.3881[0m     +  8.4539
      3   [36m0.3709[0m   0.7926        [35m0.2493[0m       0.8888        0.3944        8.9556
      4   [36m0.3818[0m   0.7855        [35m0.2443[0m       [31m0.9057[0m        [94m0.3434[0m     +  9.3827
      5   0.3814   0.7637        0.2450       [31m0.9117[0m        0.3602        9.6500
      6   [36m0.3837[0m   0.7913        [35m0.2410[0m       0.9033        0.3566        9.5654
      7   0.3816   0.7837        0.2420       0.9117        [94m0.3153[0m     +  9.5363
      8   0.3787   0.7887        [35m0.2404[0m       0.9081        [94m0.3138[0m     +  9.6359
      9   0.3739   0.7937        [35m0.2360[0m       [31m0.9166[0m        [94m0.2984[0m     +  9.6932
     10   0.3790   0.7682        [35m0.2356[0m       [31m0.9202[0m        [94m0.2891[0m     +  9.2875
     11   0.3699   0.7792        [35m0.2318[0m       0.9178        [94m0.2869[0m     +  9.2746
     12   [36m0.3926[0m   [32m0.8011[0m        0.2373       0.9154        0.2872        9.3367
     13   [36m0.3931[0m   0.8009        0.2363       0.9141        0.2947        9.3869
     14   0.3829   [32m0.8021[0m        [35m0.2306[0m       0.9141        0.2975        9.5021
     15   [36m0.3946[0m   0.7972        0.2349       [31m0.9214[0m        [94m0.2782[0m     +  9.5435
     16   [36m0.4094[0m   0.8013        0.2327       0.9202        [94m0.2728[0m     +  9.6554
     17   [36m0.4122[0m   [32m0.8034[0m        0.2315       0.9214        [94m0.2494[0m     +  9.4768
     18   0.3907   0.7955        0.2335       0.9190        0.2582        9.2935
     19   [36m0.4128[0m   [32m0.8074[0m        [35m0.2285[0m       0.9214        [94m0.2408[0m     +  9.6452
     20   0.3957   0.8058        0.2304       0.9202        [94m0.2343[0m     +  9.5057
     21   0.4088   [32m0.8075[0m        [35m0.2278[0m       0.9202        [94m0.2327[0m     +  9.2614
     22   0.3969   0.8070        0.2287       0.9214        [94m0.2316[0m     +  9.4401
     23   [36m0.4129[0m   [32m0.8133[0m        [35m0.2252[0m       [31m0.9262[0m        [94m0.2271[0m     +  9.5506
     24   [36m0.4193[0m   0.8104        0.2262       0.9262        [94m0.2259[0m     +  9.4261
     25   0.4096   0.8101        0.2261       0.9238        0.2262        9.7853
     26   [36m0.4198[0m   [32m0.8155[0m        0.2259       [31m0.9274[0m        [94m0.2244[0m     +  9.4748
     27   [36m0.4262[0m   [32m0.8204[0m        [35m0.2227[0m       0.9238        [94m0.2237[0m     +  9.2501
     28   0.4236   [32m0.8220[0m        [35m0.2209[0m       0.9238        0.2240        9.2466
     29   0.4245   [32m0.8247[0m        0.2233       0.9262        [94m0.2229[0m     +  9.6018
     30   0.4178   [32m0.8249[0m        0.2233       0.9274        0.2235        9.5975
     31   0.4228   [32m0.8255[0m        0.2227       0.9274        [94m0.2225[0m     +  9.3518
     32   0.4118   0.8227        0.2258       0.9274        0.2244        9.3260
     33   0.4203   0.8213        0.2245       0.9262        0.2253        9.1514
     34   0.4041   0.8221        0.2226       0.9274        0.2248        9.6553
     35   0.4148   0.8220        0.2221       0.9262        0.2262        9.5190
     36   0.4179   0.8228        0.2238       0.9238        0.2251        9.5838
     37   0.4085   0.8209        [35m0.2204[0m       0.9226        0.2280        9.5295
     38   0.4193   0.8231        [35m0.2179[0m       0.9238        0.2255        9.5025
     39   0.4205   0.8240        [35m0.2179[0m       0.9238        0.2259        9.4308
     40   0.4199   0.8250        0.2186       0.9238        0.2241        9.7348
Stopping since valid_loss has not improved in the last 10 epochs.
[32m[I 2023-05-02 17:26:26,966][0m Trial 179 finished with value: 0.2225004667562614 and parameters: {'lr': 0.00045319465802970014, 'dropout': 0.5203817719103137, 'd_model_multiplier': 8, 'num_layers': 1, 'n_heads': 16, 'dim_feedforward': 390, 'batch_size': 74, 'pos_encoding': 'fixed', 'activation': 'gelu', 'norm': 'BatchNorm', 'optimizer_name': 'AdamW', 'weight_decay': 0.01, 'top_n_features': 26}. Best is trial 117 with value: 0.191397856754288.[0m
[FileBasedDataset] Initializing dataset...
	Examples: 8264
	Features: 42
	Max length: 315
Standard scalar turned ON, loading params from cache
[FileBasedDataset] Dataset initialization complete
  epoch    auprc    auroc    train_loss    valid_acc    valid_loss    cp      dur
-------  -------  -------  ------------  -----------  ------------  ----  -------
      1   [36m0.2666[0m   [32m0.7472[0m        [35m0.4897[0m       [31m0.8900[0m        [94m0.4209[0m     +  35.6971
      2   [36m0.3034[0m   [32m0.7912[0m        [35m0.3623[0m       [31m0.8960[0m        [94m0.3547[0m     +  36.2287
      3   [36m0.3063[0m   [32m0.7960[0m        [35m0.3387[0m       0.8936        [94m0.3164[0m     +  36.3870
      4   0.2946   [32m0.7987[0m        [35m0.3264[0m       0.8948        0.3459        36.7406
      5   0.2694   0.7889        [35m0.3169[0m       [31m0.9117[0m        [94m0.2942[0m     +  36.3965
      6   0.2387   0.7484        [35m0.3051[0m       [31m0.9178[0m        [94m0.2753[0m     +  36.1389
      7   0.2696   0.7726        [35m0.3040[0m       0.8960        0.4294        36.5071
      8   0.2659   0.7857        0.3054       0.9154        0.3383        36.4008
      9   0.2733   0.7870        [35m0.2950[0m       0.9166        0.2766        36.3587
     10   0.2584   0.7593        0.2966       0.9154        0.3108        36.3783
     11   0.2523   0.7677        0.2963       0.9141        0.3766        36.2120
     12   0.2268   0.7543        [35m0.2947[0m       0.9166        0.3558        37.3061
     13   0.2176   0.7612        0.2990       0.9178        0.3640        36.4621
     14   0.2202   0.7596        0.2969       0.9178        0.3208        36.2516
     15   0.1992   0.7426        0.2997       0.9178        0.2960        36.3147
Stopping since valid_loss has not improved in the last 10 epochs.
[32m[I 2023-05-02 17:36:10,496][0m Trial 180 finished with value: 0.2753278235246077 and parameters: {'lr': 0.0007458076491164024, 'dropout': 0.5648418784959867, 'd_model_multiplier': 8, 'num_layers': 14, 'n_heads': 16, 'dim_feedforward': 464, 'batch_size': 67, 'pos_encoding': 'fixed', 'activation': 'gelu', 'norm': 'BatchNorm', 'optimizer_name': 'PlainRAdam', 'weight_decay': 0.01, 'top_n_features': 42}. Best is trial 117 with value: 0.191397856754288.[0m
[FileBasedDataset] Initializing dataset...
	Examples: 8264
	Features: 25
	Max length: 315
Standard scalar turned ON, loading params from cache
[FileBasedDataset] Dataset initialization complete
  epoch    auprc    auroc    train_loss    valid_acc    valid_loss    cp     dur
-------  -------  -------  ------------  -----------  ------------  ----  ------
      1   [36m0.1394[0m   [32m0.5793[0m        [35m0.4526[0m       [31m0.9141[0m        [94m0.3106[0m     +  8.1751
      2   [36m0.2026[0m   [32m0.6820[0m        [35m0.2687[0m       0.9141        [94m0.2777[0m     +  8.7121
      3   [36m0.2287[0m   [32m0.7035[0m        [35m0.2542[0m       0.9141        [94m0.2741[0m     +  8.4306
      4   [36m0.2683[0m   [32m0.7153[0m        [35m0.2486[0m       0.9141        0.2911        9.0317
      5   [36m0.2893[0m   [32m0.7221[0m        [35m0.2429[0m       0.9141        0.2873        9.0640
      6   [36m0.2994[0m   [32m0.7277[0m        0.2438       0.9141        [94m0.2608[0m     +  9.4137
      7   [36m0.3089[0m   [32m0.7290[0m        [35m0.2385[0m       [31m0.9154[0m        0.2696        9.3502
      8   [36m0.3198[0m   [32m0.7303[0m        [35m0.2376[0m       0.9154        0.2895        9.5163
      9   [36m0.3258[0m   [32m0.7428[0m        [35m0.2351[0m       0.9141        0.2974        8.9091
     10   [36m0.3351[0m   [32m0.7439[0m        [35m0.2347[0m       0.9154        [94m0.2566[0m     +  9.0995
     11   [36m0.3415[0m   [32m0.7520[0m        [35m0.2311[0m       [31m0.9190[0m        0.3082        9.7630
     12   [36m0.3429[0m   0.7512        [35m0.2305[0m       0.9178        0.3986        9.2908
     13   [36m0.3432[0m   [32m0.7581[0m        0.2306       0.9190        0.2895        9.2963
     14   [36m0.3440[0m   [32m0.7616[0m        [35m0.2298[0m       0.9178        0.3657        9.4989
     15   0.3415   0.7603        [35m0.2296[0m       [31m0.9202[0m        0.2756        9.2927
     16   0.3436   [32m0.7673[0m        [35m0.2267[0m       0.9178        0.2868        9.4293
     17   0.3404   [32m0.7687[0m        [35m0.2265[0m       [31m0.9262[0m        0.3156        9.2713
     18   0.3397   [32m0.7759[0m        0.2275       0.9190        0.3060        9.3710
     19   [36m0.3448[0m   [32m0.7799[0m        [35m0.2244[0m       0.9214        0.3220        9.3800
Stopping since valid_loss has not improved in the last 10 epochs.
[32m[I 2023-05-02 17:39:14,327][0m Trial 181 finished with value: 0.2565970069119547 and parameters: {'lr': 0.0017366470822023732, 'dropout': 0.3261314151501804, 'd_model_multiplier': 1, 'num_layers': 2, 'n_heads': 4, 'dim_feedforward': 506, 'batch_size': 80, 'pos_encoding': 'fixed', 'activation': 'gelu', 'norm': 'BatchNorm', 'optimizer_name': 'PlainRAdam', 'weight_decay': 0.01, 'top_n_features': 25}. Best is trial 117 with value: 0.191397856754288.[0m
[FileBasedDataset] Initializing dataset...
	Examples: 8264
	Features: 161
	Max length: 315
Standard scalar turned ON, loading params from cache
[FileBasedDataset] Dataset initialization complete
  epoch    auprc    auroc    train_loss    valid_acc    valid_loss    cp     dur
-------  -------  -------  ------------  -----------  ------------  ----  ------
      1   [36m0.1373[0m   [32m0.6899[0m        [35m0.3134[0m       [31m0.9274[0m        [94m0.3063[0m     +  8.2227
      2   [36m0.1743[0m   [32m0.7087[0m        [35m0.2665[0m       0.9190        [94m0.2882[0m     +  9.1285
      3   [36m0.1871[0m   [32m0.7102[0m        [35m0.2648[0m       [31m0.9287[0m        [94m0.2701[0m     +  8.5701
      4   [36m0.2022[0m   [32m0.7186[0m        [35m0.2550[0m       0.9274        [94m0.2473[0m     +  9.3604
      5   [36m0.2068[0m   [32m0.7186[0m        [35m0.2542[0m       [31m0.9299[0m        [94m0.2418[0m     +  9.4172
      6   [36m0.2082[0m   [32m0.7235[0m        [35m0.2502[0m       0.9129        0.2519        9.2655
      7   0.1979   [32m0.7355[0m        0.2507       0.9057        0.2564        9.5693
      8   0.2049   [32m0.7377[0m        0.2506       0.9141        0.2463        9.4904
      9   0.2058   [32m0.7454[0m        [35m0.2460[0m       0.9105        0.2465        9.3547
     10   0.2001   0.7385        [35m0.2456[0m       0.9105        0.2509        9.3422
     11   0.1889   0.7293        0.2462       0.9214        0.2455        9.4091
     12   [36m0.2158[0m   0.7334        [35m0.2396[0m       0.9069        0.2500        9.4872
     13   [36m0.2176[0m   0.7365        0.2414       0.9262        0.2446        9.2824
     14   [36m0.2303[0m   0.7324        [35m0.2396[0m       0.9262        [94m0.2397[0m     +  9.1488
     15   0.2289   0.7320        [35m0.2381[0m       0.9190        0.2433        9.2391
     16   0.2302   0.7352        [35m0.2371[0m       0.9166        0.2453        9.5186
     17   0.1964   0.7277        [35m0.2360[0m       0.9250        [94m0.2381[0m     +  9.3406
     18   0.2236   0.7368        [35m0.2343[0m       0.9190        0.2419        9.4510
     19   0.1971   0.7306        [35m0.2324[0m       0.9226        0.2439        9.4649
     20   0.1892   0.7302        0.2332       0.9190        0.2421        9.4105
     21   0.2098   0.7426        0.2324       0.9262        0.2421        9.2061
     22   0.2284   0.7417        [35m0.2302[0m       0.9226        0.2386        9.1734
     23   0.1892   0.7373        0.2312       0.9250        0.2468        9.3654
     24   0.2013   0.7274        [35m0.2301[0m       0.9021        0.2691        9.3100
     25   0.1926   0.7399        0.2328       0.9250        0.2493        9.1894
     26   0.1972   0.7372        [35m0.2280[0m       0.9190        0.2545        9.3523
Stopping since valid_loss has not improved in the last 10 epochs.
[32m[I 2023-05-02 17:43:25,427][0m Trial 182 finished with value: 0.23809618492945217 and parameters: {'lr': 0.0036323630336575264, 'dropout': 0.5503068253184226, 'd_model_multiplier': 2, 'num_layers': 2, 'n_heads': 8, 'dim_feedforward': 426, 'batch_size': 44, 'pos_encoding': 'fixed', 'activation': 'gelu', 'norm': 'BatchNorm', 'optimizer_name': 'PlainRAdam', 'weight_decay': 0, 'top_n_features': 161}. Best is trial 117 with value: 0.191397856754288.[0m
[FileBasedDataset] Initializing dataset...
	Examples: 8264
	Features: 213
	Max length: 315
Standard scalar turned ON, loading params from cache
[FileBasedDataset] Dataset initialization complete
  epoch    auprc    auroc    train_loss    valid_acc    valid_loss    cp      dur
-------  -------  -------  ------------  -----------  ------------  ----  -------
      1   [36m0.2247[0m   [32m0.6805[0m        [35m0.2827[0m       [31m0.9021[0m        [94m0.3146[0m     +  21.9758
      2   0.2204   0.6761        [35m0.2593[0m       0.9021        0.3279        21.6163
      3   0.1735   0.5782        [35m0.2524[0m       0.8912        0.4722        21.7148
      4   0.2032   0.6526        0.2585       0.8452        0.4994        21.4820
      5   0.2172   [32m0.6893[0m        0.2583       0.7062        0.5988        21.8535
      6   [36m0.2805[0m   [32m0.6944[0m        0.2556       0.7219        0.5878        21.7372
      7   0.2412   0.6901        0.2602       0.8452        0.4665        21.7523
      8   [36m0.2818[0m   [32m0.7013[0m        0.2577       0.8912        0.3308        21.9324
      9   [36m0.3023[0m   [32m0.7311[0m        0.2634       0.8960        [94m0.2917[0m     +  21.7342
     10   0.2808   0.7146        [35m0.2483[0m       [31m0.9166[0m        [94m0.2850[0m     +  21.7931
     11   0.2702   [32m0.7557[0m        0.2680       0.8742        0.3322        21.8588
     12   0.2924   0.7357        0.3318       0.9141        [94m0.2664[0m     +  21.8572
     13   0.2689   0.7330        0.3747       0.6288        0.9526        21.9002
     14   0.2508   0.7423        0.3426       0.8622        0.3701        21.7402
     15   0.2111   0.7496        0.3355       0.8597        0.4027        21.9006
     16   0.0732   0.4370        0.3565       0.9141        0.3991        21.9351
     17   0.2379   [32m0.7563[0m        0.3233       0.8694        0.3092        21.7121
     18   0.2531   0.7259        0.3177       0.9129        0.3164        21.6659
     19   0.2323   0.7479        0.3193       0.8815        0.2958        21.7613
     20   0.2443   0.7393        0.3084       0.8005        0.5576        21.9163
     21   0.2254   0.7141        0.3125       0.9129        0.2913        21.9525
Stopping since valid_loss has not improved in the last 10 epochs.
[32m[I 2023-05-02 17:51:26,470][0m Trial 183 finished with value: 0.2663839164459143 and parameters: {'lr': 0.0003601102148264907, 'dropout': 0.3675298339183161, 'd_model_multiplier': 16, 'num_layers': 3, 'n_heads': 32, 'dim_feedforward': 445, 'batch_size': 26, 'pos_encoding': 'learnable', 'activation': 'gelu', 'norm': 'BatchNorm', 'optimizer_name': 'PlainRAdam', 'weight_decay': 0.01, 'top_n_features': 213}. Best is trial 117 with value: 0.191397856754288.[0m
[FileBasedDataset] Initializing dataset...
	Examples: 8264
	Features: 138
	Max length: 315
Standard scalar turned ON, loading params from cache
[FileBasedDataset] Dataset initialization complete
  epoch    auprc    auroc    train_loss    valid_acc    valid_loss    cp     dur
-------  -------  -------  ------------  -----------  ------------  ----  ------
      1   [36m0.2180[0m   [32m0.7302[0m        [35m0.2906[0m       [31m0.8960[0m        [94m0.3683[0m     +  9.8234
      2   [36m0.2236[0m   0.7156        [35m0.2507[0m       [31m0.9057[0m        [94m0.3420[0m     +  9.6497
      3   0.2150   0.7246        [35m0.2476[0m       0.9021        0.3950        10.0563
      4   0.2061   0.6916        0.2504       0.9033        0.4684        9.8481
      5   [36m0.2342[0m   [32m0.7327[0m        0.2549       0.8948        0.4861        10.3332
      6   0.2288   0.7236        0.2611       0.9008        0.3775        9.7791
      7   0.2023   0.6785        0.2598       [31m0.9069[0m        [94m0.3121[0m     +  9.9823
      8   [36m0.2444[0m   [32m0.7412[0m        0.2554       0.8996        [94m0.2948[0m     +  10.2286
      9   0.2409   0.7365        [35m0.2474[0m       0.9033        [94m0.2754[0m     +  10.0027
     10   [36m0.2600[0m   [32m0.7801[0m        [35m0.2411[0m       0.8863        0.2982        10.1063
     11   0.2503   0.7683        [35m0.2389[0m       0.8948        0.2775        9.8132
     12   0.2517   0.7718        0.2393       0.8984        [94m0.2700[0m     +  10.0432
     13   0.2563   0.7676        0.2389       [31m0.9081[0m        [94m0.2596[0m     +  10.0937
     14   [36m0.2702[0m   0.7643        [35m0.2381[0m       0.9021        0.2691        10.1556
     15   0.2598   0.7702        [35m0.2362[0m       0.8755        0.3403        9.8128
     16   [36m0.2730[0m   0.7683        0.2374       0.8501        0.3460        9.8394
     17   0.2638   0.7719        [35m0.2353[0m       0.9045        0.2683        10.0677
     18   [36m0.2806[0m   0.7653        [35m0.2320[0m       0.9069        0.2630        10.2518
     19   [36m0.2959[0m   0.7650        0.2337       0.8863        0.3042        10.0660
     20   [36m0.2987[0m   0.7742        0.2333       0.9021        0.2798        10.1637
     21   [36m0.3022[0m   0.7699        [35m0.2301[0m       0.9057        0.2774        10.0861
     22   [36m0.3025[0m   0.7723        [35m0.2295[0m       0.8924        0.2949        10.0372
Stopping since valid_loss has not improved in the last 10 epochs.
