[32m[I 2023-05-04 23:33:49,201][0m Trial 508 finished with value: 100.0 and parameters: {'lr': 6.465140712667419e-05, 'dropout': 0.3981674443462895, 'd_model_multiplier': 4, 'num_layers': 5, 'n_heads': 64, 'dim_feedforward': 399, 'batch_size': 141, 'pos_encoding': 'learnable', 'activation': 'relu', 'norm': 'LayerNorm', 'optimizer_name': 'PlainRAdam', 'weight_decay': 0.1, 'top_n_features': 72}. Best is trial 246 with value: 0.16447311791139763.[0m
[FileBasedDataset] Initializing dataset...
	Examples: 8264
	Features: 67
	Max length: 315
Standard scalar turned ON, loading params from cache
[FileBasedDataset] Dataset initialization complete
Warning, assumed runtime error: CUDA out of memory. Tried to allocate 1.46 GiB (GPU 0; 23.70 GiB total capacity; 21.16 GiB already allocated; 571.25 MiB free; 22.05 GiB reserved in total by PyTorch) If reserved memory is >> allocated memory try setting max_split_size_mb to avoid fragmentation.  See documentation for Memory Management and PYTORCH_CUDA_ALLOC_CONF
[32m[I 2023-05-04 23:33:54,868][0m Trial 509 finished with value: 100.0 and parameters: {'lr': 3.7343506578039414e-07, 'dropout': 0.33362483132633497, 'd_model_multiplier': 4, 'num_layers': 6, 'n_heads': 32, 'dim_feedforward': 359, 'batch_size': 123, 'pos_encoding': 'fixed', 'activation': 'relu', 'norm': 'LayerNorm', 'optimizer_name': 'RAdam', 'weight_decay': 0.1, 'top_n_features': 67}. Best is trial 246 with value: 0.16447311791139763.[0m
[FileBasedDataset] Initializing dataset...
	Examples: 8264
	Features: 60
	Max length: 315
Standard scalar turned ON, loading params from cache
[FileBasedDataset] Dataset initialization complete
Warning, assumed runtime error: CUDA out of memory. Tried to allocate 1.55 GiB (GPU 0; 23.70 GiB total capacity; 21.17 GiB already allocated; 561.25 MiB free; 22.06 GiB reserved in total by PyTorch) If reserved memory is >> allocated memory try setting max_split_size_mb to avoid fragmentation.  See documentation for Memory Management and PYTORCH_CUDA_ALLOC_CONF
[32m[I 2023-05-04 23:34:00,366][0m Trial 510 finished with value: 100.0 and parameters: {'lr': 0.0010627044824838804, 'dropout': 0.5768392450305837, 'd_model_multiplier': 16, 'num_layers': 5, 'n_heads': 32, 'dim_feedforward': 322, 'batch_size': 131, 'pos_encoding': 'fixed', 'activation': 'relu', 'norm': 'LayerNorm', 'optimizer_name': 'AdamW', 'weight_decay': 0.001, 'top_n_features': 60}. Best is trial 246 with value: 0.16447311791139763.[0m
[FileBasedDataset] Initializing dataset...
	Examples: 8264
	Features: 82
	Max length: 315
Standard scalar turned ON, loading params from cache
[FileBasedDataset] Dataset initialization complete
  epoch    auprc    auroc    train_loss    valid_acc    valid_loss    cp      dur
-------  -------  -------  ------------  -----------  ------------  ----  -------
      1   [36m0.3044[0m   [32m0.7841[0m        [35m0.2794[0m       [31m0.9238[0m        [94m0.2508[0m     +  17.0863
      2   0.2942   [32m0.7860[0m        [35m0.2424[0m       0.9190        0.2527        17.1996
      3   0.3031   0.7745        [35m0.2422[0m       0.9202        0.2557        17.4610
      4   [36m0.3166[0m   [32m0.7866[0m        [35m0.2397[0m       0.9226        0.2636        17.2822
      5   [36m0.3250[0m   0.7745        [35m0.2357[0m       [31m0.9250[0m        0.2725        17.2690
      6   0.3169   0.7748        [35m0.2341[0m       0.9238        0.2911        17.4654
      7   0.3229   [32m0.7925[0m        [35m0.2325[0m       0.9154        0.2850        17.2704
      8   0.3114   0.7902        [35m0.2267[0m       0.9141        0.2835        17.4699
      9   [36m0.3390[0m   [32m0.8042[0m        [35m0.2252[0m       0.9202        0.2680        17.4040
     10   0.3052   [32m0.8110[0m        [35m0.2211[0m       0.9154        0.2689        17.2465
Stopping since valid_loss has not improved in the last 10 epochs.
[32m[I 2023-05-04 23:37:11,264][0m Trial 511 finished with value: 0.2507589951071983 and parameters: {'lr': 0.0002236318023442764, 'dropout': 0.3624340876522146, 'd_model_multiplier': 8, 'num_layers': 3, 'n_heads': 32, 'dim_feedforward': 344, 'batch_size': 24, 'pos_encoding': 'fixed', 'activation': 'relu', 'norm': 'LayerNorm', 'optimizer_name': 'RAdam', 'weight_decay': 0.1, 'top_n_features': 82}. Best is trial 246 with value: 0.16447311791139763.[0m
[FileBasedDataset] Initializing dataset...
	Examples: 8264
	Features: 118
	Max length: 315
Standard scalar turned ON, loading params from cache
[FileBasedDataset] Dataset initialization complete
  epoch    auprc    auroc    train_loss    valid_acc    valid_loss    cp     dur
-------  -------  -------  ------------  -----------  ------------  ----  ------
      1   [36m0.1082[0m   [32m0.5804[0m        [35m0.6970[0m       [31m0.8307[0m        [94m0.6748[0m     +  9.4069
      2   0.0992   0.5740        [35m0.6844[0m       [31m0.8815[0m        [94m0.6680[0m     +  9.6484
      3   0.0933   0.5516        [35m0.6755[0m       [31m0.9154[0m        [94m0.6576[0m     +  9.4812
      4   0.0862   0.5361        [35m0.6604[0m       [31m0.9287[0m        [94m0.6475[0m     +  9.6210
      5   0.0850   0.5354        [35m0.6403[0m       [31m0.9299[0m        [94m0.6363[0m     +  10.0120
      6   0.0838   0.5215        [35m0.6191[0m       0.9299        [94m0.6292[0m     +  10.0883
      7   0.0901   0.5244        [35m0.5986[0m       0.9299        [94m0.6077[0m     +  9.9650
      8   0.0963   0.5154        [35m0.5634[0m       0.9299        [94m0.5761[0m     +  9.9895
      9   0.0998   0.5147        [35m0.5337[0m       0.9299        [94m0.5628[0m     +  10.1188
     10   [36m0.1083[0m   0.5116        [35m0.4958[0m       0.9299        [94m0.5311[0m     +  9.8014
     11   [36m0.1138[0m   0.5172        [35m0.4620[0m       0.9299        [94m0.5152[0m     +  9.8957
     12   0.1138   0.5219        [35m0.4328[0m       0.9299        [94m0.4781[0m     +  9.6643
     13   0.1137   0.5229        [35m0.4113[0m       0.9299        [94m0.4396[0m     +  9.9357
     14   0.1087   0.5281        [35m0.3971[0m       0.9299        [94m0.4288[0m     +  9.7126
     15   0.1103   0.5362        [35m0.3799[0m       0.9299        [94m0.4041[0m     +  9.7112
     16   0.1125   0.5425        [35m0.3643[0m       0.9299        [94m0.3908[0m     +  9.7606
     17   [36m0.1144[0m   0.5515        [35m0.3505[0m       0.9299        [94m0.3780[0m     +  9.8030
     18   [36m0.1145[0m   0.5595        0.3512       0.9299        [94m0.3635[0m     +  9.7174
     19   [36m0.1167[0m   0.5663        [35m0.3395[0m       0.9299        [94m0.3413[0m     +  9.9426
     20   [36m0.1197[0m   0.5740        [35m0.3306[0m       0.9299        [94m0.3411[0m     +  9.6880
     21   [36m0.1247[0m   [32m0.5827[0m        [35m0.3301[0m       0.9299        [94m0.3282[0m     +  10.0322
     22   [36m0.1247[0m   [32m0.5895[0m        [35m0.3237[0m       0.9299        0.3314        10.1046
     23   [36m0.1269[0m   [32m0.5956[0m        [35m0.3182[0m       0.9299        [94m0.3123[0m     +  9.9150
     24   [36m0.1309[0m   [32m0.6009[0m        [35m0.3167[0m       0.9299        [94m0.3097[0m     +  9.8214
     25   [36m0.1321[0m   [32m0.6067[0m        [35m0.3099[0m       0.9299        [94m0.3039[0m     +  9.6099
     26   [36m0.1360[0m   [32m0.6116[0m        0.3129       0.9299        [94m0.3017[0m     +  9.7958
     27   [36m0.1395[0m   [32m0.6178[0m        [35m0.2986[0m       0.9299        [94m0.2891[0m     +  10.1144
     28   [36m0.1434[0m   [32m0.6226[0m        0.3065       0.9299        0.2939        9.9083
     29   [36m0.1484[0m   [32m0.6283[0m        0.3002       0.9299        [94m0.2861[0m     +  9.6913
     30   [36m0.1524[0m   [32m0.6329[0m        0.2989       0.9299        [94m0.2841[0m     +  9.9959
     31   [36m0.1563[0m   [32m0.6367[0m        0.3002       0.9299        [94m0.2775[0m     +  9.9303
     32   [36m0.1616[0m   [32m0.6393[0m        [35m0.2940[0m       0.9299        [94m0.2758[0m     +  10.0047
     33   [36m0.1660[0m   [32m0.6428[0m        [35m0.2934[0m       0.9299        [94m0.2747[0m     +  9.9281
     34   0.1596   [32m0.6440[0m        [35m0.2925[0m       0.9299        0.2792        9.8166
     35   0.1613   [32m0.6493[0m        [35m0.2895[0m       0.9299        [94m0.2667[0m     +  9.5123
     36   0.1650   [32m0.6517[0m        0.2897       0.9299        0.2669        9.8892
     37   [36m0.1677[0m   [32m0.6541[0m        [35m0.2820[0m       0.9299        [94m0.2610[0m     +  9.8045
     38   [36m0.1697[0m   [32m0.6565[0m        0.2884       0.9299        [94m0.2602[0m     +  9.5945
     39   [36m0.1715[0m   [32m0.6576[0m        0.2832       0.9299        [94m0.2600[0m     +  9.6100
     40   [36m0.1736[0m   [32m0.6591[0m        [35m0.2760[0m       0.9299        [94m0.2579[0m     +  10.6816
     41   [36m0.1762[0m   [32m0.6610[0m        0.2834       0.9299        [94m0.2532[0m     +  9.8949
     42   [36m0.1784[0m   [32m0.6627[0m        0.2813       0.9299        0.2554        9.9856
     43   [36m0.1797[0m   [32m0.6642[0m        0.2819       0.9299        0.2569        10.0023
     44   0.1774   [32m0.6653[0m        [35m0.2746[0m       0.9299        0.2560        9.9360
     45   0.1786   [32m0.6667[0m        [35m0.2736[0m       0.9299        0.2545        9.9052
     46   [36m0.1810[0m   0.6664        0.2763       0.9299        0.2575        9.7016
     47   [36m0.1811[0m   [32m0.6685[0m        0.2815       0.9299        0.2593        9.8282
     48   0.1806   [32m0.6686[0m        0.2750       0.9299        [94m0.2516[0m     +  9.7844
     49   [36m0.1827[0m   [32m0.6687[0m        [35m0.2727[0m       0.9299        [94m0.2497[0m     +  9.8286
     50   [36m0.1838[0m   [32m0.6703[0m        [35m0.2720[0m       0.9299        [94m0.2485[0m     +  9.6711
[32m[I 2023-05-04 23:45:25,866][0m Trial 512 finished with value: 0.24852512962440482 and parameters: {'lr': 2.6373919938318424e-05, 'dropout': 0.560788942787924, 'd_model_multiplier': 1, 'num_layers': 4, 'n_heads': 4, 'dim_feedforward': 307, 'batch_size': 79, 'pos_encoding': 'fixed', 'activation': 'gelu', 'norm': 'BatchNorm', 'optimizer_name': 'PlainRAdam', 'weight_decay': 0, 'top_n_features': 118}. Best is trial 246 with value: 0.16447311791139763.[0m
[FileBasedDataset] Initializing dataset...
	Examples: 8264
	Features: 45
	Max length: 315
Standard scalar turned ON, loading params from cache
[FileBasedDataset] Dataset initialization complete
  epoch    auprc    auroc    train_loss    valid_acc    valid_loss    cp      dur
-------  -------  -------  ------------  -----------  ------------  ----  -------
      1   [36m0.0549[0m   [32m0.3474[0m        [35m0.5407[0m       [31m0.9250[0m        [94m0.4177[0m     +  14.7360
      2   [36m0.0891[0m   [32m0.5284[0m        [35m0.3564[0m       0.9250        [94m0.2904[0m     +  14.6677
      3   [36m0.1684[0m   [32m0.6285[0m        [35m0.2794[0m       0.9250        [94m0.2612[0m     +  14.7655
      4   [36m0.1943[0m   [32m0.6745[0m        [35m0.2525[0m       0.9226        [94m0.2501[0m     +  15.1436
      5   [36m0.2059[0m   [32m0.6834[0m        [35m0.2397[0m       0.9202        [94m0.2476[0m     +  15.0108
      6   [36m0.2137[0m   [32m0.6887[0m        [35m0.2369[0m       0.9214        [94m0.2464[0m     +  14.9140
      7   [36m0.2228[0m   [32m0.6933[0m        [35m0.2334[0m       0.9226        [94m0.2455[0m     +  15.0283
      8   [36m0.2302[0m   [32m0.6971[0m        [35m0.2326[0m       0.9226        [94m0.2444[0m     +  14.7927
      9   [36m0.2376[0m   [32m0.7030[0m        [35m0.2319[0m       0.9226        [94m0.2437[0m     +  15.0664
     10   [36m0.2392[0m   [32m0.7057[0m        [35m0.2308[0m       0.9226        [94m0.2429[0m     +  15.0140
     11   [36m0.2450[0m   [32m0.7096[0m        [35m0.2294[0m       0.9226        [94m0.2425[0m     +  15.1566
     12   [36m0.2499[0m   [32m0.7132[0m        [35m0.2287[0m       0.9226        [94m0.2418[0m     +  15.0078
     13   [36m0.2534[0m   [32m0.7144[0m        [35m0.2284[0m       0.9214        [94m0.2416[0m     +  14.7876
     14   [36m0.2564[0m   [32m0.7173[0m        [35m0.2277[0m       0.9250        [94m0.2412[0m     +  15.2455
     15   [36m0.2601[0m   [32m0.7195[0m        [35m0.2263[0m       0.9250        [94m0.2407[0m     +  15.0298
     16   [36m0.2655[0m   [32m0.7214[0m        [35m0.2259[0m       0.9238        [94m0.2403[0m     +  15.1392
     17   0.2640   [32m0.7234[0m        0.2260       0.9250        [94m0.2399[0m     +  14.9767
     18   [36m0.2689[0m   [32m0.7264[0m        [35m0.2242[0m       0.9250        [94m0.2396[0m     +  15.1866
     19   [36m0.2724[0m   [32m0.7302[0m        [35m0.2226[0m       0.9238        [94m0.2388[0m     +  15.1060
     20   0.2713   0.7298        [35m0.2225[0m       0.9238        0.2396        15.7279
     21   [36m0.2735[0m   [32m0.7339[0m        0.2241       0.9238        0.2402        15.0397
     22   [36m0.2755[0m   [32m0.7355[0m        [35m0.2218[0m       0.9238        0.2409        14.8928
     23   [36m0.2785[0m   [32m0.7391[0m        [35m0.2211[0m       0.9250        0.2398        15.1751
     24   [36m0.2819[0m   [32m0.7399[0m        [35m0.2199[0m       [31m0.9262[0m        0.2396        15.0303
     25   [36m0.2824[0m   [32m0.7431[0m        0.2208       0.9238        [94m0.2380[0m     +  15.3411
     26   0.2790   [32m0.7446[0m        [35m0.2193[0m       0.9238        0.2391        14.9731
     27   0.2811   [32m0.7456[0m        [35m0.2184[0m       0.9250        0.2391        15.1587
     28   [36m0.2832[0m   [32m0.7457[0m        [35m0.2175[0m       0.9250        0.2396        15.0685
     29   [36m0.2861[0m   [32m0.7501[0m        [35m0.2160[0m       [31m0.9274[0m        0.2397        15.3218
     30   [36m0.2872[0m   [32m0.7516[0m        0.2161       0.9274        0.2396        15.1963
     31   0.2852   [32m0.7531[0m        [35m0.2153[0m       0.9262        0.2412        14.9003
     32   0.2872   [32m0.7548[0m        [35m0.2152[0m       0.9238        0.2410        15.1271
     33   0.2777   [32m0.7552[0m        0.2157       0.9214        0.2420        15.3335
     34   0.2792   0.7543        [35m0.2142[0m       0.9226        0.2421        15.3460
Stopping since valid_loss has not improved in the last 10 epochs.
[32m[I 2023-05-04 23:54:15,267][0m Trial 513 finished with value: 0.2380409766857973 and parameters: {'lr': 3.916348521771369e-05, 'dropout': 0.300183998943618, 'd_model_multiplier': 4, 'num_layers': 5, 'n_heads': 16, 'dim_feedforward': 329, 'batch_size': 62, 'pos_encoding': 'fixed', 'activation': 'relu', 'norm': 'LayerNorm', 'optimizer_name': 'RAdam', 'weight_decay': 0.1, 'top_n_features': 45}. Best is trial 246 with value: 0.16447311791139763.[0m
[FileBasedDataset] Initializing dataset...
	Examples: 8264
	Features: 53
	Max length: 315
Standard scalar turned ON, loading params from cache
[FileBasedDataset] Dataset initialization complete
  epoch    auprc    auroc    train_loss    valid_acc    valid_loss    cp      dur
-------  -------  -------  ------------  -----------  ------------  ----  -------
      1   [36m0.2706[0m   [32m0.7496[0m        [35m0.3041[0m       [31m0.9238[0m        [94m0.2470[0m     +  27.3334
      2   [36m0.2816[0m   0.7451        [35m0.2634[0m       [31m0.9262[0m        [94m0.2455[0m     +  27.6169
      3   0.2639   0.7352        [35m0.2621[0m       0.9069        0.2545        27.5528
      4   0.2289   0.7361        [35m0.2586[0m       0.9238        0.2500        27.5727
      5   0.2347   0.7336        [35m0.2550[0m       0.8972        0.2581        27.7023
      6   0.2401   0.7305        [35m0.2546[0m       0.8960        0.2589        27.6852
      7   0.2583   0.7341        [35m0.2545[0m       0.9141        0.2503        27.8439
      8   0.2780   0.7350        0.2545       0.9154        0.2494        27.4688
      9   0.2502   0.7332        [35m0.2531[0m       0.9008        0.2532        27.5583
     10   [36m0.2841[0m   0.7338        0.2532       0.9033        0.2521        27.7602
     11   0.2801   0.7347        0.2559       0.9141        0.2472        27.8023
Stopping since valid_loss has not improved in the last 10 epochs.
[32m[I 2023-05-04 23:59:47,532][0m Trial 514 finished with value: 0.24552990989860918 and parameters: {'lr': 0.0024472587386554618, 'dropout': 0.44118449132388404, 'd_model_multiplier': 4, 'num_layers': 6, 'n_heads': 32, 'dim_feedforward': 438, 'batch_size': 69, 'pos_encoding': 'fixed', 'activation': 'relu', 'norm': 'LayerNorm', 'optimizer_name': 'AdamW', 'weight_decay': 0.01, 'top_n_features': 53}. Best is trial 246 with value: 0.16447311791139763.[0m
[FileBasedDataset] Initializing dataset...
	Examples: 8264
	Features: 64
	Max length: 315
Standard scalar turned ON, loading params from cache
[FileBasedDataset] Dataset initialization complete
  epoch    auprc    auroc    train_loss    valid_acc    valid_loss    cp      dur
-------  -------  -------  ------------  -----------  ------------  ----  -------
      1   [36m0.2197[0m   [32m0.6983[0m        [35m0.2649[0m       [31m0.9238[0m        [94m0.2621[0m     +  20.6308
      2   [36m0.2207[0m   [32m0.7052[0m        [35m0.2516[0m       0.9214        0.2643        20.6440
      3   0.1796   0.6854        [35m0.2417[0m       0.9190        0.2708        21.2321
      4   0.2150   [32m0.7098[0m        [35m0.2413[0m       [31m0.9274[0m        [94m0.2522[0m     +  21.0284
      5   [36m0.2388[0m   [32m0.7259[0m        [35m0.2363[0m       0.9190        [94m0.2496[0m     +  21.1771
      6   0.2227   0.7181        [35m0.2346[0m       0.9214        0.2556        21.1580
      7   [36m0.2581[0m   0.7154        [35m0.2340[0m       [31m0.9287[0m        [94m0.2451[0m     +  21.0484
      8   0.2547   [32m0.7267[0m        0.2354       0.9287        [94m0.2396[0m     +  21.4202
      9   0.2140   0.7066        [35m0.2335[0m       0.9250        0.2518        21.3135
     10   0.2438   0.7199        [35m0.2321[0m       0.9250        0.2444        21.1668
     11   0.2028   0.7258        [35m0.2306[0m       0.9238        0.2505        21.2386
     12   0.2408   0.6846        0.2340       0.9238        0.2550        20.9478
     13   [36m0.2653[0m   0.7262        0.2327       0.9262        0.2458        21.4013
     14   0.2022   0.7231        0.2341       0.9226        0.2522        20.9436
     15   0.1863   0.6725        0.2534       0.9262        0.2554        22.0983
     16   0.1772   0.6736        0.2534       0.9262        0.2546        21.2536
     17   0.1891   0.6744        0.2528       0.9262        0.2554        21.1507
Stopping since valid_loss has not improved in the last 10 epochs.
[32m[I 2023-05-05 00:06:09,072][0m Trial 515 finished with value: 0.2396171045688937 and parameters: {'lr': 0.005553591963263223, 'dropout': 0.3140636510798146, 'd_model_multiplier': 4, 'num_layers': 4, 'n_heads': 32, 'dim_feedforward': 354, 'batch_size': 103, 'pos_encoding': 'fixed', 'activation': 'relu', 'norm': 'LayerNorm', 'optimizer_name': 'RAdam', 'weight_decay': 0.1, 'top_n_features': 64}. Best is trial 246 with value: 0.16447311791139763.[0m
[FileBasedDataset] Initializing dataset...
	Examples: 8264
	Features: 75
	Max length: 315
Standard scalar turned ON, loading params from cache
[FileBasedDataset] Dataset initialization complete
Warning, assumed runtime error: CUDA out of memory. Tried to allocate 1.16 GiB (GPU 0; 23.70 GiB total capacity; 17.10 GiB already allocated; 575.25 MiB free; 22.04 GiB reserved in total by PyTorch) If reserved memory is >> allocated memory try setting max_split_size_mb to avoid fragmentation.  See documentation for Memory Management and PYTORCH_CUDA_ALLOC_CONF
