[32m[I 2023-05-02 10:46:19,123][0m Trial 103 finished with value: 0.24161250518123645 and parameters: {'lr': 0.002564942833312291, 'dropout': 0.4048889281985573, 'd_model_multiplier': 8, 'num_layers': 6, 'n_heads': 16, 'dim_feedforward': 130, 'batch_size': 169, 'pos_encoding': 'fixed', 'activation': 'gelu', 'norm': 'BatchNorm', 'optimizer_name': 'AdamW', 'weight_decay': 0.01, 'top_n_features': 161}. Best is trial 12 with value: 0.20472501771481755.[0m
[FileBasedDataset] Initializing dataset...
	Examples: 8264
	Features: 156
	Max length: 315
Standard scalar turned ON, loading params from cache
[FileBasedDataset] Dataset initialization complete
  epoch    auprc    auroc    train_loss    valid_acc    valid_loss    cp      dur
-------  -------  -------  ------------  -----------  ------------  ----  -------
      1   [36m0.2538[0m   [32m0.7638[0m        [35m0.3142[0m       [31m0.8356[0m        [94m0.4637[0m     +  15.5232
      2   [36m0.2605[0m   0.7401        [35m0.2673[0m       [31m0.9190[0m        [94m0.3713[0m     +  15.5830
      3   [36m0.2613[0m   [32m0.7825[0m        [35m0.2641[0m       0.8984        0.3991        15.8288
      4   [36m0.2769[0m   0.7702        0.2649       [31m0.9274[0m        [94m0.3323[0m     +  16.5129
      5   0.2656   0.7738        0.2646       0.9190        [94m0.2682[0m     +  15.8655
      6   0.2373   0.7556        [35m0.2577[0m       0.9250        [94m0.2303[0m     +  16.5688
      7   0.2381   0.7716        [35m0.2518[0m       0.9262        [94m0.2273[0m     +  16.4903
      8   0.2595   0.7806        0.2545       0.9250        [94m0.2258[0m     +  16.5172
      9   0.2395   0.7710        0.2537       0.9250        0.2287        16.1003
     10   [36m0.2827[0m   0.7802        0.2526       0.9262        [94m0.2241[0m     +  16.3056
     11   0.2706   0.7784        0.2523       0.9250        [94m0.2238[0m     +  16.3582
     12   0.2729   0.7817        0.2539       0.9202        0.2345        17.1269
     13   0.2815   [32m0.7892[0m        0.2565       0.9274        [94m0.2218[0m     +  16.3835
     14   0.2686   [32m0.7905[0m        0.2520       0.9262        0.2227        16.5111
     15   0.2713   0.7875        0.2558       0.9250        0.2241        16.3600
     16   0.2520   0.7830        0.2688       0.9262        0.2328        15.8869
     17   [36m0.3107[0m   0.7829        0.2592       [31m0.9299[0m        0.2342        15.9822
     18   0.2538   0.7862        0.2599       0.9262        0.2275        16.4592
     19   0.2477   0.7828        0.2820       0.9226        0.2290        16.2014
     20   0.2786   0.7751        0.2833       0.9262        0.2322        16.7309
     21   0.2177   0.7615        0.2913       0.9262        0.2388        16.7335
     22   0.2192   0.7466        0.3013       0.9250        0.2417        16.3117
Stopping since valid_loss has not improved in the last 10 epochs.
[32m[I 2023-05-02 10:52:34,574][0m Trial 104 finished with value: 0.2218333433912628 and parameters: {'lr': 0.0016148240477205074, 'dropout': 0.4827800200043715, 'd_model_multiplier': 8, 'num_layers': 4, 'n_heads': 16, 'dim_feedforward': 145, 'batch_size': 157, 'pos_encoding': 'fixed', 'activation': 'gelu', 'norm': 'BatchNorm', 'optimizer_name': 'AdamW', 'weight_decay': 0.01, 'top_n_features': 156}. Best is trial 12 with value: 0.20472501771481755.[0m
[FileBasedDataset] Initializing dataset...
	Examples: 8264
	Features: 176
	Max length: 315
Standard scalar turned ON, loading params from cache
[FileBasedDataset] Dataset initialization complete
  epoch    auprc    auroc    train_loss    valid_acc    valid_loss    cp      dur
-------  -------  -------  ------------  -----------  ------------  ----  -------
      1   [36m0.2373[0m   [32m0.7654[0m        [35m0.2847[0m       [31m0.9238[0m        [94m0.4136[0m     +  17.7672
      2   0.2124   0.7335        [35m0.2562[0m       [31m0.9262[0m        [94m0.4037[0m     +  17.5810
      3   0.2148   0.7611        [35m0.2467[0m       0.9250        [94m0.3700[0m     +  18.1744
      4   0.2048   0.7545        0.2472       [31m0.9274[0m        [94m0.3186[0m     +  17.7254
      5   [36m0.2609[0m   0.7561        [35m0.2420[0m       0.9202        0.3274        18.5262
      6   0.2070   0.7519        [35m0.2397[0m       0.9262        [94m0.2599[0m     +  18.4976
      7   0.2119   0.7545        [35m0.2378[0m       0.9166        0.3068        18.2163
      8   0.1966   0.7584        0.2394       0.9166        0.2876        18.5412
      9   0.2036   0.7529        0.2393       0.9190        0.2839        18.0113
     10   0.1982   0.7597        0.2387       0.9250        [94m0.2426[0m     +  17.7551
     11   0.1860   0.7158        [35m0.2356[0m       0.9238        0.2530        18.1070
     12   0.1805   0.7461        0.2364       0.9226        0.2593        18.0490
     13   0.2271   0.7252        [35m0.2295[0m       0.9238        0.2701        18.0403
     14   0.2099   0.6887        0.2314       0.9274        0.2612        17.7363
     15   0.2189   [32m0.7849[0m        [35m0.2283[0m       0.9238        0.2702        17.6846
     16   0.2109   0.7349        0.2307       0.9238        [94m0.2422[0m     +  17.8938
     17   0.2135   0.7468        [35m0.2257[0m       0.9226        0.2757        17.7152
     18   0.2049   0.7633        [35m0.2249[0m       0.9238        0.2476        17.8727
     19   0.1883   0.7623        [35m0.2246[0m       0.9238        0.2694        17.6708
     20   0.2168   0.7583        [35m0.2236[0m       0.9214        0.2463        18.0479
     21   0.2233   0.7664        0.2238       0.9190        0.2595        17.8485
     22   0.2080   [32m0.7850[0m        0.2242       0.9190        [94m0.2421[0m     +  18.2648
     23   0.2175   0.7702        [35m0.2196[0m       0.9226        0.2629        17.7854
     24   0.2262   0.7759        0.2282       0.9226        0.2679        17.9905
     25   0.2223   0.7388        [35m0.2190[0m       0.9226        0.2443        18.1230
     26   0.2609   0.7617        [35m0.2148[0m       0.9262        [94m0.2344[0m     +  17.5979
     27   0.2375   0.7653        0.2172       0.9226        0.2492        17.5434
     28   0.2431   0.7582        0.2179       0.9214        0.2494        18.2014
     29   0.2265   0.7708        [35m0.2132[0m       0.9238        0.2599        17.7448
     30   0.2022   0.7617        0.2155       0.9214        0.2545        18.0558
     31   0.2220   0.7546        0.2150       0.9226        0.2532        17.6750
     32   0.2273   0.7343        0.2143       0.9214        0.2482        17.9180
     33   [36m0.2613[0m   [32m0.7850[0m        [35m0.2063[0m       0.9190        0.2448        17.9951
     34   0.2067   0.7286        0.2141       0.9202        0.2506        17.9348
     35   0.2371   0.7534        [35m0.2060[0m       0.9214        0.2582        18.1143
Stopping since valid_loss has not improved in the last 10 epochs.
[32m[I 2023-05-02 11:03:21,887][0m Trial 105 finished with value: 0.2343785780264648 and parameters: {'lr': 0.00052741018190341, 'dropout': 0.4340330361134908, 'd_model_multiplier': 8, 'num_layers': 5, 'n_heads': 16, 'dim_feedforward': 162, 'batch_size': 139, 'pos_encoding': 'fixed', 'activation': 'gelu', 'norm': 'BatchNorm', 'optimizer_name': 'AdamW', 'weight_decay': 0.1, 'top_n_features': 176}. Best is trial 12 with value: 0.20472501771481755.[0m
[FileBasedDataset] Initializing dataset...
	Examples: 8264
	Features: 161
	Max length: 315
Standard scalar turned ON, loading params from cache
[FileBasedDataset] Dataset initialization complete
  epoch    auprc    auroc    train_loss    valid_acc    valid_loss    cp      dur
-------  -------  -------  ------------  -----------  ------------  ----  -------
      1   [36m0.1913[0m   [32m0.6869[0m        [35m0.2789[0m       [31m0.9166[0m        [94m0.3400[0m     +  17.8515
      2   [36m0.2011[0m   [32m0.6985[0m        [35m0.2578[0m       0.9093        [94m0.3141[0m     +  18.1110
      3   [36m0.2110[0m   [32m0.7007[0m        [35m0.2548[0m       [31m0.9178[0m        [94m0.3002[0m     +  18.1907
      4   0.2034   0.6934        [35m0.2486[0m       [31m0.9226[0m        [94m0.2773[0m     +  18.0785
      5   0.1963   0.6975        [35m0.2465[0m       0.9141        [94m0.2684[0m     +  18.0247
      6   [36m0.2223[0m   [32m0.7119[0m        0.2483       0.9202        [94m0.2538[0m     +  18.2010
      7   0.2062   0.7108        [35m0.2427[0m       0.9166        0.2653        18.1885
      8   0.1811   0.6492        [35m0.2403[0m       0.9178        0.2834        18.0739
      9   [36m0.2271[0m   0.7081        0.2433       0.9166        0.2773        18.2426
     10   [36m0.2352[0m   [32m0.7435[0m        [35m0.2386[0m       0.9154        0.2635        18.0218
     11   0.2161   0.7182        0.2432       0.9154        0.2648        18.0606
     12   0.1941   0.6918        0.2410       0.9154        0.2753        18.1755
     13   0.2077   0.6947        0.2453       0.9141        0.2811        18.0705
     14   0.2164   0.6956        0.2392       0.9178        0.2687        18.1105
     15   0.1788   0.6276        0.2400       0.9154        0.2836        18.0035
Stopping since valid_loss has not improved in the last 10 epochs.
[32m[I 2023-05-02 11:08:12,099][0m Trial 106 finished with value: 0.25382204828592425 and parameters: {'lr': 0.00027541486228096633, 'dropout': 0.5032750860705415, 'd_model_multiplier': 8, 'num_layers': 6, 'n_heads': 16, 'dim_feedforward': 174, 'batch_size': 37, 'pos_encoding': 'learnable', 'activation': 'gelu', 'norm': 'BatchNorm', 'optimizer_name': 'AdamW', 'weight_decay': 0.01, 'top_n_features': 161}. Best is trial 12 with value: 0.20472501771481755.[0m
[FileBasedDataset] Initializing dataset...
	Examples: 8264
	Features: 154
	Max length: 315
Standard scalar turned ON, loading params from cache
[FileBasedDataset] Dataset initialization complete
  epoch    auprc    auroc    train_loss    valid_acc    valid_loss    cp      dur
-------  -------  -------  ------------  -----------  ------------  ----  -------
      1   [36m0.1105[0m   [32m0.6386[0m        [35m0.3068[0m       [31m0.9287[0m        [94m0.2788[0m     +  16.3859
      2   [36m0.2173[0m   [32m0.7589[0m        0.3105       0.9190        [94m0.2671[0m     +  16.2948
      3   0.1623   0.6793        0.3334       [31m0.9335[0m        [94m0.2330[0m     +  16.3019
      4   0.1996   0.7452        0.3486       0.9323        [94m0.2256[0m     +  16.2289
      5   0.1911   0.7241        0.3564       0.9311        0.2991        16.3700
      6   0.1768   0.7123        0.3408       0.9335        0.2365        16.1953
      7   0.1837   0.7382        0.3248       0.9287        0.2417        16.5806
      8   0.0590   0.3798        [35m0.3055[0m       0.9335        0.3330        16.5009
      9   0.1923   [32m0.7610[0m        [35m0.2964[0m       0.9311        [94m0.2181[0m     +  16.4550
     10   0.1611   0.7020        0.2979       0.9323        0.3112        16.2933
     11   0.1635   0.7238        [35m0.2913[0m       0.9311        0.2305        16.3875
     12   0.1942   0.7420        [35m0.2785[0m       0.9311        0.2253        16.4543
     13   [36m0.2210[0m   0.7508        [35m0.2738[0m       0.9335        0.2294        16.4457
     14   0.2096   0.7509        [35m0.2733[0m       0.9335        0.2301        16.3881
     15   0.1750   0.7521        0.2845       0.9335        0.2247        16.4206
     16   0.1789   0.7296        0.2736       0.9335        0.2306        16.4728
     17   0.2081   0.7516        0.2741       0.9335        [94m0.2178[0m     +  16.3641
     18   0.1691   0.7445        [35m0.2728[0m       0.9335        0.2188        16.3050
     19   0.1803   0.7497        0.2736       0.9335        0.2187        16.4381
     20   0.1585   0.7404        0.2917       0.9311        0.2350        16.2439
     21   0.1534   0.7339        [35m0.2680[0m       0.9335        0.2371        16.3248
     22   0.1208   0.6465        0.2685       0.9335        0.2389        16.5293
     23   0.0688   0.4673        0.2728       0.9335        0.2930        16.4867
     24   0.0648   0.4360        0.2886       0.9335        0.2596        16.4584
     25   0.1801   0.7479        0.2808       0.9226        0.2399        16.3173
     26   0.1792   0.7491        0.2778       0.9335        0.2216        16.4382
Stopping since valid_loss has not improved in the last 10 epochs.
[32m[I 2023-05-02 11:15:35,818][0m Trial 107 finished with value: 0.21776859277573288 and parameters: {'lr': 0.0044805895218438365, 'dropout': 0.38086777257156706, 'd_model_multiplier': 8, 'num_layers': 5, 'n_heads': 16, 'dim_feedforward': 351, 'batch_size': 31, 'pos_encoding': 'fixed', 'activation': 'gelu', 'norm': 'BatchNorm', 'optimizer_name': 'PlainRAdam', 'weight_decay': 0.01, 'top_n_features': 154}. Best is trial 12 with value: 0.20472501771481755.[0m
[FileBasedDataset] Initializing dataset...
	Examples: 8264
	Features: 168
	Max length: 315
Standard scalar turned ON, loading params from cache
[FileBasedDataset] Dataset initialization complete
  epoch    auprc    auroc    train_loss    valid_acc    valid_loss    cp      dur
-------  -------  -------  ------------  -----------  ------------  ----  -------
      1   [36m0.3208[0m   [32m0.8062[0m        [35m0.2886[0m       [31m0.9226[0m        [94m0.2528[0m     +  10.5106
      2   [36m0.3685[0m   0.7924        [35m0.2415[0m       [31m0.9238[0m        [94m0.2392[0m     +  10.9446
      3   0.3504   0.7794        [35m0.2376[0m       0.9226        0.2476        11.0329
      4   0.3375   0.7674        0.2411       0.9238        0.2552        10.9038
      5   0.3019   0.7212        0.2389       0.9226        0.2826        11.0175
      6   0.2768   0.7105        0.2417       0.9238        0.3062        11.1341
      7   0.2764   0.7194        0.2409       0.9141        0.3683        11.2584
      8   0.3030   0.7315        0.2378       0.9238        0.2650        12.0064
      9   0.3606   0.7810        0.2395       [31m0.9274[0m        0.2604        12.0563
     10   0.1905   0.6766        0.2401       0.9214        0.2626        11.2873
     11   0.3284   0.7702        [35m0.2369[0m       0.9214        [94m0.2373[0m     +  11.3942
     12   0.3671   0.7723        0.2473       0.9238        0.2513        10.9409
     13   0.2629   0.7025        0.2379       0.9214        0.2603        11.2585
     14   [36m0.4075[0m   [32m0.8274[0m        0.2412       [31m0.9287[0m        [94m0.2311[0m     +  11.2589
     15   0.3852   0.8028        0.2405       0.9274        0.2467        11.2113
     16   0.3721   [32m0.8289[0m        0.2385       0.9238        [94m0.2247[0m     +  11.1058
     17   0.4068   [32m0.8387[0m        0.2387       0.9262        [94m0.2162[0m     +  11.5110
     18   0.3917   [32m0.8425[0m        0.2390       0.9238        0.2216        11.0840
     19   0.3669   0.8345        [35m0.2361[0m       0.9250        0.2283        11.6637
     20   0.3794   [32m0.8512[0m        0.2366       0.9226        0.2292        11.1949
     21   0.3938   0.8405        [35m0.2348[0m       0.9262        0.2222        11.4271
     22   0.3768   0.8423        0.2369       0.9202        0.2188        11.5319
     23   0.4047   [32m0.8560[0m        [35m0.2339[0m       0.9262        0.2172        11.2806
     24   [36m0.4406[0m   0.8502        [35m0.2313[0m       0.9287        0.2175        11.1751
     25   0.3961   0.8449        0.2327       [31m0.9299[0m        [94m0.2118[0m     +  11.5351
     26   0.4093   0.8557        [35m0.2299[0m       0.9238        0.2206        11.3653
     27   0.4363   [32m0.8564[0m        0.2318       0.9274        0.2150        11.2333
     28   0.3532   0.8451        0.2323       0.9250        0.2168        11.3980
     29   0.3788   0.8521        0.2310       0.9202        0.2138        11.3716
     30   0.3797   [32m0.8579[0m        [35m0.2286[0m       0.9190        0.2293        11.5181
     31   0.3642   0.8325        0.2326       0.9226        0.2188        11.3430
     32   0.3956   0.8489        0.2312       0.9226        0.2128        11.5549
     33   0.3590   0.8310        0.2289       0.9190        0.2294        11.3655
     34   0.3700   0.8414        0.2309       0.9214        0.2209        11.6844
     35   0.3902   0.8497        [35m0.2252[0m       0.9226        [94m0.2115[0m     +  11.2215
     36   0.3663   0.8434        0.2302       0.9262        0.2175        11.2655
     37   0.4195   0.8429        0.2292       0.9238        0.2200        11.4882
     38   0.3791   0.8433        0.2280       0.9250        0.2136        11.0142
     39   0.4004   0.8451        0.2270       0.9274        0.2132        11.1833
     40   0.3979   0.8508        0.2278       0.9287        [94m0.2106[0m     +  11.4078
     41   0.3952   0.8524        0.2270       0.9274        [94m0.2099[0m     +  11.3188
     42   0.3958   0.8490        0.2276       0.9287        0.2116        11.3872
     43   0.3979   0.8431        0.2275       0.9262        0.2130        11.1354
     44   0.3850   0.8394        0.2288       0.9274        0.2160        11.1073
     45   0.3682   0.8335        0.2270       0.9202        0.2239        11.3510
     46   0.3753   0.8510        0.2258       0.9226        0.2110        11.3423
     47   0.3750   0.8467        0.2257       0.9226        0.2145        11.4042
     48   0.3394   0.8331        0.2276       0.9214        0.2230        11.1568
     49   0.3807   0.8508        0.2264       0.9274        0.2106        11.6717
     50   0.3481   0.8253        0.2254       0.9057        0.2722        11.3682
[32m[I 2023-05-02 11:25:01,995][0m Trial 108 finished with value: 0.2099154568496898 and parameters: {'lr': 0.003455818569724779, 'dropout': 0.37220394008548335, 'd_model_multiplier': 8, 'num_layers': 1, 'n_heads': 16, 'dim_feedforward': 414, 'batch_size': 182, 'pos_encoding': 'fixed', 'activation': 'gelu', 'norm': 'BatchNorm', 'optimizer_name': 'PlainRAdam', 'weight_decay': 0.1, 'top_n_features': 168}. Best is trial 12 with value: 0.20472501771481755.[0m
[FileBasedDataset] Initializing dataset...
	Examples: 8264
	Features: 234
	Max length: 315
Standard scalar turned ON, loading params from cache
[FileBasedDataset] Dataset initialization complete
  epoch    auprc    auroc    train_loss    valid_acc    valid_loss    cp      dur
-------  -------  -------  ------------  -----------  ------------  ----  -------
      1   [36m0.1897[0m   [32m0.7228[0m        [35m0.3536[0m       [31m0.6155[0m        [94m0.8439[0m     +  22.6578
      2   [36m0.2214[0m   0.6664        0.3746       [31m0.9262[0m        [94m0.2457[0m     +  22.7501
      3   0.1852   [32m0.7259[0m        0.3660       0.9045        0.3194        23.2906
      4   0.1856   0.7173        0.3609       0.9129        0.2781        22.6957
      5   0.2101   0.6682        [35m0.3163[0m       0.9262        [94m0.2454[0m     +  22.5174
      6   [36m0.2604[0m   0.6908        [35m0.3081[0m       0.9262        [94m0.2411[0m     +  22.9792
      7   0.1980   [32m0.7347[0m        [35m0.2721[0m       0.9129        0.2497        23.1356
      8   0.2075   0.7287        [35m0.2675[0m       0.9262        [94m0.2374[0m     +  23.0633
      9   0.1990   [32m0.7392[0m        [35m0.2644[0m       0.9166        0.2419        22.8579
     10   0.2048   [32m0.7499[0m        [35m0.2602[0m       0.9238        [94m0.2350[0m     +  23.0533
     11   0.2073   0.7387        0.2617       0.9226        0.2381        22.9139
     12   0.2094   0.7377        0.2620       0.9226        0.2375        23.0206
     13   0.2001   0.7247        0.2630       0.9226        0.2392        22.9591
     14   0.2003   0.7387        0.2619       0.9214        0.2390        22.8366
     15   0.2028   0.7398        0.2624       0.9214        0.2371        22.9099
     16   0.1987   0.7332        0.2621       0.9214        0.2374        22.8262
     17   0.1992   0.7342        0.2608       0.9190        0.2383        22.9531
     18   0.1950   0.7346        0.2617       0.9262        0.2373        22.9463
     19   0.2098   0.7343        0.2631       0.9202        0.2382        23.0232
Stopping since valid_loss has not improved in the last 10 epochs.
