[32m[I 2023-05-03 05:04:52,037][0m Trial 279 finished with value: 0.22214300101656723 and parameters: {'lr': 0.0006307585734103936, 'dropout': 0.6000157503353868, 'd_model_multiplier': 1, 'num_layers': 1, 'n_heads': 32, 'dim_feedforward': 416, 'batch_size': 40, 'pos_encoding': 'fixed', 'activation': 'gelu', 'norm': 'BatchNorm', 'optimizer_name': 'RAdam', 'weight_decay': 0.1, 'top_n_features': 16}. Best is trial 246 with value: 0.16447311791139763.[0m
[FileBasedDataset] Initializing dataset...
	Examples: 8264
	Features: 16
	Max length: 315
Standard scalar turned ON, loading params from cache
[FileBasedDataset] Dataset initialization complete
  epoch    auprc    auroc    train_loss    valid_acc    valid_loss    cp      dur
-------  -------  -------  ------------  -----------  ------------  ----  -------
      1   [36m0.1146[0m   [32m0.4401[0m        [35m0.5599[0m       [31m0.9081[0m        [94m0.6760[0m     +  10.7176
      2   [36m0.3030[0m   [32m0.7692[0m        [35m0.3222[0m       0.9069        [94m0.6618[0m     +  10.7781
      3   [36m0.3389[0m   [32m0.8016[0m        [35m0.2763[0m       0.9045        0.6667        10.8980
      4   [36m0.3573[0m   0.7849        [35m0.2591[0m       [31m0.9141[0m        [94m0.6108[0m     +  10.8314
      5   0.3543   0.7743        [35m0.2562[0m       0.9105        0.6338        10.9981
      6   0.3533   0.7735        [35m0.2527[0m       0.9117        [94m0.6098[0m     +  10.8961
      7   0.3547   0.7800        [35m0.2509[0m       0.9105        [94m0.5654[0m     +  10.8802
      8   0.3489   0.7347        [35m0.2481[0m       0.9081        0.5805        10.9809
      9   [36m0.3603[0m   0.7729        0.2517       0.9093        [94m0.5551[0m     +  10.9789
     10   [36m0.3615[0m   0.7625        [35m0.2449[0m       0.9081        [94m0.5271[0m     +  10.8686
     11   0.3503   0.7385        0.2467       0.9081        [94m0.5196[0m     +  10.7329
     12   0.3492   0.7350        0.2462       0.9081        [94m0.4818[0m     +  10.8454
     13   0.3487   0.7366        [35m0.2442[0m       0.9081        [94m0.4787[0m     +  10.7934
     14   0.3417   0.7249        [35m0.2422[0m       0.9081        [94m0.4670[0m     +  10.8845
     15   0.3374   0.7258        0.2434       0.9081        0.4847        10.9044
     16   0.3209   0.7165        0.2438       0.9081        [94m0.4631[0m     +  10.8089
     17   0.3311   0.7269        0.2444       0.9081        [94m0.4508[0m     +  10.9547
     18   0.3323   0.7315        [35m0.2403[0m       0.9081        [94m0.4432[0m     +  10.9525
     19   0.3390   0.7380        0.2427       0.9081        [94m0.4349[0m     +  10.7749
     20   0.3492   0.7578        [35m0.2388[0m       0.9081        [94m0.4209[0m     +  10.9227
     21   0.3132   0.7296        0.2393       0.9081        [94m0.4208[0m     +  10.8770
     22   0.3472   0.7512        0.2391       0.9081        [94m0.3936[0m     +  10.7769
     23   0.3368   0.7444        0.2412       0.9081        0.4044        10.8246
     24   0.3307   0.7496        0.2401       0.9081        0.4064        10.9254
     25   0.2802   0.7251        [35m0.2380[0m       0.9081        0.4013        10.9236
     26   0.3567   0.7823        0.2384       0.9081        [94m0.3755[0m     +  10.7712
     27   [36m0.3642[0m   0.7876        0.2388       0.9081        [94m0.3755[0m     +  10.8770
     28   0.3562   0.7756        [35m0.2367[0m       0.9081        0.3781        11.0857
     29   0.3478   0.7762        [35m0.2359[0m       0.9081        [94m0.3581[0m     +  11.0259
     30   0.3513   0.7764        [35m0.2346[0m       0.9081        [94m0.3541[0m     +  10.9717
     31   [36m0.3662[0m   0.7898        0.2353       0.9081        [94m0.3462[0m     +  10.7647
     32   0.3426   0.7718        0.2359       0.9081        0.3497        11.0416
     33   0.3573   0.7852        [35m0.2345[0m       0.9081        [94m0.3452[0m     +  10.9248
     34   [36m0.3780[0m   0.7924        0.2347       0.9081        [94m0.3311[0m     +  10.9745
     35   0.3628   0.7909        0.2355       0.9081        [94m0.3307[0m     +  11.0832
     36   0.3464   0.7849        0.2366       0.9081        [94m0.3242[0m     +  10.8806
     37   0.3773   [32m0.8057[0m        [35m0.2312[0m       0.9081        [94m0.3198[0m     +  10.8001
     38   0.3719   0.8051        0.2354       0.9081        [94m0.3076[0m     +  11.1912
     39   0.3713   0.8026        0.2333       0.9081        0.3234        11.0219
     40   0.3540   0.7904        0.2330       0.9081        0.3258        10.8562
     41   0.3641   0.7954        0.2328       0.9081        0.3303        10.8431
     42   0.3706   0.7988        0.2331       0.9081        0.3144        10.9159
     43   [36m0.3811[0m   [32m0.8126[0m        0.2347       0.9081        0.3173        11.0150
     44   0.3702   [32m0.8151[0m        [35m0.2308[0m       0.9081        [94m0.2995[0m     +  10.8918
     45   [36m0.3869[0m   [32m0.8173[0m        0.2309       0.9081        0.3273        10.9039
     46   0.3657   0.8089        0.2322       0.9081        0.3288        11.1404
     47   0.3627   0.8093        0.2316       0.9081        0.3290        10.9128
     48   0.3600   0.8017        0.2337       0.9081        0.3225        10.8041
     49   0.3640   0.8058        [35m0.2298[0m       0.9081        0.3247        11.0197
     50   0.3848   [32m0.8219[0m        [35m0.2284[0m       0.9081        0.3069        10.9761
[32m[I 2023-05-03 05:14:00,098][0m Trial 280 finished with value: 0.29948405984523363 and parameters: {'lr': 6.825371597824312e-05, 'dropout': 0.598219563664121, 'd_model_multiplier': 1, 'num_layers': 2, 'n_heads': 32, 'dim_feedforward': 427, 'batch_size': 29, 'pos_encoding': 'fixed', 'activation': 'gelu', 'norm': 'BatchNorm', 'optimizer_name': 'RAdam', 'weight_decay': 0.1, 'top_n_features': 16}. Best is trial 246 with value: 0.16447311791139763.[0m
[FileBasedDataset] Initializing dataset...
	Examples: 8264
	Features: 11
	Max length: 315
Standard scalar turned ON, loading params from cache
[FileBasedDataset] Dataset initialization complete
  epoch    auprc    auroc    train_loss    valid_acc    valid_loss    cp      dur
-------  -------  -------  ------------  -----------  ------------  ----  -------
      1   [36m0.1206[0m   [32m0.5914[0m        [35m0.4002[0m       [31m0.9359[0m        [94m0.2354[0m     +  15.9103
      2   [36m0.1546[0m   [32m0.6428[0m        [35m0.2691[0m       0.9359        [94m0.2227[0m     +  16.0509
      3   [36m0.1678[0m   [32m0.6710[0m        [35m0.2609[0m       0.9359        [94m0.2189[0m     +  15.9133
      4   0.1662   [32m0.6853[0m        [35m0.2600[0m       0.9359        [94m0.2172[0m     +  15.9193
      5   [36m0.1792[0m   [32m0.6922[0m        [35m0.2596[0m       0.9359        [94m0.2167[0m     +  16.0579
      6   [36m0.1797[0m   [32m0.6933[0m        [35m0.2569[0m       0.9359        0.2170        16.0083
      7   0.1784   [32m0.6958[0m        0.2571       0.9359        0.2169        16.0243
      8   [36m0.1815[0m   0.6953        0.2594       0.9347        0.2170        16.1213
      9   [36m0.1834[0m   [32m0.6998[0m        0.2573       0.9359        0.2176        15.9238
     10   0.1753   0.6997        0.2589       0.9347        0.2172        15.9156
     11   0.1670   0.6909        0.2582       0.9359        0.2189        15.9906
     12   0.1742   [32m0.7022[0m        0.2571       0.9347        0.2181        16.0681
     13   0.1734   [32m0.7051[0m        0.2570       0.9335        0.2180        15.9246
     14   0.1705   [32m0.7069[0m        0.2575       0.9335        0.2184        15.9174
Stopping since valid_loss has not improved in the last 10 epochs.
[32m[I 2023-05-03 05:18:00,355][0m Trial 281 finished with value: 0.21666137080869335 and parameters: {'lr': 0.0003743061718243855, 'dropout': 0.6733169955179608, 'd_model_multiplier': 1, 'num_layers': 4, 'n_heads': 32, 'dim_feedforward': 384, 'batch_size': 34, 'pos_encoding': 'fixed', 'activation': 'relu', 'norm': 'LayerNorm', 'optimizer_name': 'RAdam', 'weight_decay': 0, 'top_n_features': 11}. Best is trial 246 with value: 0.16447311791139763.[0m
[FileBasedDataset] Initializing dataset...
	Examples: 8264
	Features: 30
	Max length: 315
Standard scalar turned ON, loading params from cache
[FileBasedDataset] Dataset initialization complete
  epoch    auprc    auroc    train_loss    valid_acc    valid_loss    cp      dur
-------  -------  -------  ------------  -----------  ------------  ----  -------
      1   [36m0.0835[0m   [32m0.4719[0m        [35m0.4894[0m       [31m0.9117[0m        [94m0.5392[0m     +  12.3798
      2   [36m0.3124[0m   [32m0.7347[0m        [35m0.3123[0m       0.9117        [94m0.4042[0m     +  12.8827
      3   [36m0.3460[0m   [32m0.7488[0m        [35m0.2839[0m       [31m0.9129[0m        [94m0.3431[0m     +  12.7782
      4   [36m0.3482[0m   0.7444        [35m0.2699[0m       [31m0.9141[0m        [94m0.3137[0m     +  12.7168
      5   [36m0.3518[0m   0.7445        [35m0.2674[0m       0.9141        [94m0.2886[0m     +  12.7958
      6   [36m0.3570[0m   [32m0.7552[0m        [35m0.2594[0m       [31m0.9178[0m        [94m0.2778[0m     +  12.7285
      7   0.3550   0.7489        0.2601       0.9166        [94m0.2698[0m     +  12.6654
      8   0.3518   0.7491        [35m0.2562[0m       0.9166        [94m0.2632[0m     +  12.7508
      9   0.3540   0.7488        [35m0.2542[0m       0.9166        [94m0.2586[0m     +  12.7170
     10   [36m0.3668[0m   [32m0.7604[0m        [35m0.2503[0m       0.9166        [94m0.2562[0m     +  12.4314
     11   [36m0.3679[0m   [32m0.7700[0m        [35m0.2465[0m       [31m0.9190[0m        [94m0.2497[0m     +  12.5463
     12   [36m0.3720[0m   [32m0.7737[0m        0.2499       0.9190        [94m0.2484[0m     +  12.7748
     13   [36m0.3776[0m   0.7736        [35m0.2417[0m       [31m0.9214[0m        [94m0.2477[0m     +  12.7649
     14   0.3754   0.7702        0.2446       0.9190        [94m0.2472[0m     +  12.5234
     15   [36m0.3813[0m   [32m0.7742[0m        [35m0.2397[0m       0.9166        [94m0.2468[0m     +  12.9178
     16   [36m0.3863[0m   [32m0.7767[0m        0.2405       0.9190        0.2472        12.5566
     17   [36m0.3893[0m   [32m0.7806[0m        0.2399       0.9178        [94m0.2466[0m     +  12.8535
     18   [36m0.3936[0m   [32m0.7851[0m        [35m0.2366[0m       0.9178        [94m0.2454[0m     +  12.6950
     19   0.3892   0.7851        [35m0.2349[0m       0.9190        0.2471        12.5241
     20   [36m0.3941[0m   [32m0.7853[0m        [35m0.2346[0m       0.9214        0.2459        12.3949
     21   0.3875   [32m0.7883[0m        [35m0.2322[0m       0.9190        [94m0.2454[0m     +  12.6500
     22   0.3890   [32m0.7887[0m        0.2324       0.9202        0.2480        12.7013
     23   0.3819   [32m0.7895[0m        0.2330       0.9178        0.2478        12.7914
     24   0.3843   [32m0.7913[0m        0.2350       0.9178        0.2490        12.6310
     25   0.3779   0.7900        [35m0.2313[0m       0.9178        0.2510        12.8121
     26   0.3730   0.7904        [35m0.2294[0m       0.9141        0.2506        12.7610
     27   0.3772   [32m0.7930[0m        [35m0.2279[0m       0.9117        0.2492        12.6573
     28   0.3645   [32m0.7942[0m        0.2285       0.9141        0.2495        12.6008
     29   0.3615   [32m0.7958[0m        0.2288       0.9154        0.2498        12.6803
     30   0.3576   0.7944        0.2283       0.9117        0.2547        12.2633
Stopping since valid_loss has not improved in the last 10 epochs.
[32m[I 2023-05-03 05:24:33,814][0m Trial 282 finished with value: 0.24536017927610312 and parameters: {'lr': 0.0009861093465878214, 'dropout': 0.6361684027755989, 'd_model_multiplier': 1, 'num_layers': 2, 'n_heads': 32, 'dim_feedforward': 435, 'batch_size': 126, 'pos_encoding': 'fixed', 'activation': 'gelu', 'norm': 'BatchNorm', 'optimizer_name': 'PlainRAdam', 'weight_decay': 0.1, 'top_n_features': 30}. Best is trial 246 with value: 0.16447311791139763.[0m
[FileBasedDataset] Initializing dataset...
	Examples: 8264
	Features: 24
	Max length: 315
Standard scalar turned ON, loading params from cache
[FileBasedDataset] Dataset initialization complete
  epoch    auprc    auroc    train_loss    valid_acc    valid_loss    cp     dur
-------  -------  -------  ------------  -----------  ------------  ----  ------
      1   [36m0.2224[0m   [32m0.7392[0m        [35m0.3133[0m       [31m0.9323[0m        [94m0.2274[0m     +  8.1635
      2   [36m0.2269[0m   0.7380        [35m0.2493[0m       0.9287        0.2382        9.2850
      3   0.2209   0.7365        [35m0.2443[0m       0.9262        0.2473        9.0011
      4   [36m0.2271[0m   [32m0.7513[0m        0.2471       0.9274        0.2358        9.1147
      5   0.2224   0.7294        [35m0.2415[0m       0.9299        0.2509        9.1554
      6   [36m0.2557[0m   [32m0.7548[0m        [35m0.2389[0m       [31m0.9335[0m        0.2313        9.1081
      7   [36m0.2607[0m   [32m0.7580[0m        [35m0.2379[0m       0.9299        0.2280        9.2211
      8   0.2368   0.7370        [35m0.2316[0m       0.9299        0.2535        9.5530
      9   [36m0.2620[0m   [32m0.7624[0m        0.2321       0.9323        0.2362        9.4097
     10   [36m0.2753[0m   [32m0.7702[0m        0.2322       0.9335        [94m0.2271[0m     +  9.0753
     11   0.2686   [32m0.7722[0m        [35m0.2308[0m       0.9311        0.2320        8.8973
     12   0.2651   0.7693        [35m0.2306[0m       0.9287        [94m0.2256[0m     +  9.3714
     13   0.2450   0.7566        [35m0.2272[0m       0.9311        0.2366        9.1403
     14   0.2699   [32m0.7805[0m        0.2281       0.9311        [94m0.2245[0m     +  9.1022
     15   0.2638   0.7769        0.2273       0.9299        0.2284        9.2265
     16   [36m0.2764[0m   [32m0.7818[0m        [35m0.2264[0m       0.9311        0.2249        9.4360
     17   0.2714   0.7800        [35m0.2257[0m       0.9299        0.2259        9.6301
     18   [36m0.2795[0m   [32m0.7893[0m        [35m0.2254[0m       0.9311        [94m0.2225[0m     +  9.5024
     19   0.2661   0.7869        [35m0.2251[0m       0.9299        [94m0.2183[0m     +  9.0003
     20   0.2727   0.7890        0.2264       0.9274        0.2187        8.9215
     21   0.2645   0.7795        0.2259       0.9323        0.2267        9.5876
     22   0.2707   0.7846        [35m0.2233[0m       0.9311        0.2230        9.3162
     23   0.2715   0.7727        0.2246       0.9287        [94m0.2165[0m     +  9.3160
     24   0.2767   0.7852        0.2238       0.9299        0.2185        9.0003
     25   0.2671   0.7886        0.2244       0.9311        0.2261        9.2050
     26   [36m0.2882[0m   [32m0.7952[0m        [35m0.2230[0m       0.9287        [94m0.2086[0m     +  9.3358
     27   0.2690   0.7907        0.2231       0.9311        0.2191        9.3874
     28   0.2694   0.7855        0.2247       0.9299        0.2140        8.8296
     29   0.2773   0.7902        [35m0.2215[0m       0.9311        0.2223        8.9269
     30   0.2807   0.7889        0.2216       0.9287        0.2182        9.2254
     31   0.2592   0.7702        [35m0.2212[0m       0.9299        0.2313        9.1283
     32   0.2875   0.7808        0.2226       0.9323        0.2169        9.2365
     33   [36m0.2943[0m   0.7788        0.2237       0.9323        0.2278        8.9558
     34   0.2651   0.7477        [35m0.2195[0m       [31m0.9347[0m        0.2612        9.0933
     35   [36m0.3075[0m   [32m0.7966[0m        0.2250       0.9335        0.2213        9.2418
Stopping since valid_loss has not improved in the last 10 epochs.
[32m[I 2023-05-03 05:30:04,719][0m Trial 283 finished with value: 0.20857878667195445 and parameters: {'lr': 0.0019071453655629968, 'dropout': 0.5815261766266218, 'd_model_multiplier': 1, 'num_layers': 1, 'n_heads': 32, 'dim_feedforward': 410, 'batch_size': 39, 'pos_encoding': 'fixed', 'activation': 'relu', 'norm': 'LayerNorm', 'optimizer_name': 'RAdam', 'weight_decay': 0.1, 'top_n_features': 24}. Best is trial 246 with value: 0.16447311791139763.[0m
[FileBasedDataset] Initializing dataset...
	Examples: 8264
	Features: 44
	Max length: 315
Standard scalar turned ON, loading params from cache
[FileBasedDataset] Dataset initialization complete
  epoch    auprc    auroc    train_loss    valid_acc    valid_loss    cp     dur
-------  -------  -------  ------------  -----------  ------------  ----  ------
      1   [36m0.0574[0m   [32m0.4200[0m        [35m0.4339[0m       [31m0.9323[0m        [94m0.2766[0m     +  9.0657
      2   [36m0.1375[0m   [32m0.6422[0m        [35m0.2904[0m       0.9323        [94m0.2382[0m     +  9.1431
      3   [36m0.1784[0m   [32m0.6956[0m        [35m0.2641[0m       0.9323        [94m0.2297[0m     +  9.7212
      4   [36m0.2193[0m   [32m0.7401[0m        [35m0.2600[0m       0.9311        [94m0.2219[0m     +  9.9023
      5   [36m0.2476[0m   [32m0.7704[0m        [35m0.2513[0m       0.9299        [94m0.2153[0m     +  9.6255
      6   [36m0.2674[0m   0.7536        [35m0.2450[0m       0.9311        0.2205        9.4589
      7   [36m0.2877[0m   [32m0.7809[0m        [35m0.2439[0m       0.9299        0.2164        9.8302
      8   [36m0.3221[0m   0.7739        [35m0.2406[0m       0.9287        0.2166        9.4060
      9   [36m0.3271[0m   [32m0.7932[0m        [35m0.2397[0m       0.9262        [94m0.2114[0m     +  9.7838
     10   0.3255   [32m0.7981[0m        [35m0.2385[0m       0.9287        [94m0.2109[0m     +  9.9960
     11   [36m0.3320[0m   0.7942        [35m0.2384[0m       0.9299        0.2123        10.8115
     12   [36m0.3374[0m   0.7968        0.2393       0.9299        0.2111        9.9029
     13   [36m0.3441[0m   [32m0.7989[0m        [35m0.2365[0m       0.9311        [94m0.2096[0m     +  10.1345
     14   [36m0.3473[0m   [32m0.8018[0m        [35m0.2345[0m       0.9311        [94m0.2089[0m     +  9.7194
     15   0.3370   0.7888        0.2347       0.9311        0.2141        10.1221
     16   0.3302   [32m0.8033[0m        0.2348       0.9287        0.2135        10.1030
     17   0.3367   0.7992        0.2366       0.9299        0.2134        9.7553
     18   0.3255   0.7967        [35m0.2339[0m       0.9287        0.2153        9.8026
     19   0.3363   0.8006        [35m0.2307[0m       0.9299        0.2120        10.0276
     20   0.3318   0.7921        0.2337       [31m0.9335[0m        0.2149        9.6034
     21   0.3287   0.7870        0.2313       0.9299        0.2180        9.5224
     22   0.3307   0.7905        0.2321       0.9323        0.2175        9.5568
     23   0.2992   0.7917        [35m0.2287[0m       0.9287        0.2232        9.8042
Stopping since valid_loss has not improved in the last 10 epochs.
[32m[I 2023-05-03 05:33:59,786][0m Trial 284 finished with value: 0.20891269827948517 and parameters: {'lr': 0.0019151281403670159, 'dropout': 0.5907437572970108, 'd_model_multiplier': 1, 'num_layers': 1, 'n_heads': 16, 'dim_feedforward': 398, 'batch_size': 135, 'pos_encoding': 'fixed', 'activation': 'relu', 'norm': 'LayerNorm', 'optimizer_name': 'RAdam', 'weight_decay': 0.1, 'top_n_features': 44}. Best is trial 246 with value: 0.16447311791139763.[0m
[FileBasedDataset] Initializing dataset...
	Examples: 8264
	Features: 45
	Max length: 315
Standard scalar turned ON, loading params from cache
[FileBasedDataset] Dataset initialization complete
  epoch    auprc    auroc    train_loss    valid_acc    valid_loss    cp     dur
-------  -------  -------  ------------  -----------  ------------  ----  ------
      1   [36m0.2797[0m   [32m0.7045[0m        [35m0.3125[0m       [31m0.9081[0m        [94m0.2925[0m     +  8.9369
      2   [36m0.3038[0m   [32m0.7377[0m        [35m0.2397[0m       0.9045        0.3039        8.9122
      3   0.2966   [32m0.7465[0m        0.2399       0.9033        0.2994        9.3853
      4   [36m0.3101[0m   [32m0.7534[0m        [35m0.2362[0m       0.9045        0.3028        9.3304
      5   [36m0.3136[0m   [32m0.7548[0m        0.2389       [31m0.9093[0m        0.3078        9.1501
      6   0.3057   0.7488        [35m0.2357[0m       0.9093        0.3177        9.3633
      7   [36m0.3162[0m   0.7456        [35m0.2341[0m       [31m0.9129[0m        0.3238        9.4026
      8   0.3126   0.7513        [35m0.2328[0m       0.9069        0.3233        9.1751
      9   0.3151   [32m0.7587[0m        [35m0.2306[0m       0.9045        0.3155        9.0743
     10   0.3135   0.7544        [35m0.2276[0m       0.9081        0.3188        9.3042
Stopping since valid_loss has not improved in the last 10 epochs.
