[32m[I 2023-05-02 20:04:06,444][0m Trial 198 finished with value: 0.2301663290236276 and parameters: {'lr': 0.0007372425220586961, 'dropout': 0.5141592886256751, 'd_model_multiplier': 2, 'num_layers': 6, 'n_heads': 4, 'dim_feedforward': 337, 'batch_size': 58, 'pos_encoding': 'fixed', 'activation': 'gelu', 'norm': 'BatchNorm', 'optimizer_name': 'AdamW', 'weight_decay': 0.1, 'top_n_features': 39}. Best is trial 117 with value: 0.191397856754288.[0m
[FileBasedDataset] Initializing dataset...
	Examples: 8264
	Features: 47
	Max length: 315
Standard scalar turned ON, loading params from cache
[FileBasedDataset] Dataset initialization complete
Warning, assumed runtime error: CUDA out of memory. Tried to allocate 1.59 GiB (GPU 0; 23.70 GiB total capacity; 18.48 GiB already allocated; 405.25 MiB free; 22.21 GiB reserved in total by PyTorch) If reserved memory is >> allocated memory try setting max_split_size_mb to avoid fragmentation.  See documentation for Memory Management and PYTORCH_CUDA_ALLOC_CONF
[32m[I 2023-05-02 20:04:10,108][0m Trial 199 finished with value: 100.0 and parameters: {'lr': 0.0010930152419118034, 'dropout': 0.4190552988771547, 'd_model_multiplier': 2, 'num_layers': 5, 'n_heads': 64, 'dim_feedforward': 308, 'batch_size': 67, 'pos_encoding': 'fixed', 'activation': 'relu', 'norm': 'LayerNorm', 'optimizer_name': 'PlainRAdam', 'weight_decay': 0.1, 'top_n_features': 47}. Best is trial 117 with value: 0.191397856754288.[0m
[FileBasedDataset] Initializing dataset...
	Examples: 8264
	Features: 64
	Max length: 315
Standard scalar turned ON, loading params from cache
[FileBasedDataset] Dataset initialization complete
  epoch    auprc    auroc    train_loss    valid_acc    valid_loss    cp     dur
-------  -------  -------  ------------  -----------  ------------  ----  ------
      1   [36m0.0651[0m   [32m0.3098[0m        [35m0.6575[0m       [31m0.9262[0m        [94m0.6065[0m     +  8.8583
      2   [36m0.1614[0m   [32m0.6333[0m        [35m0.3858[0m       0.9250        [94m0.3486[0m     +  9.7272
      3   [36m0.2183[0m   [32m0.6977[0m        [35m0.2780[0m       0.9250        [94m0.2685[0m     +  10.3778
      4   [36m0.2340[0m   [32m0.7251[0m        [35m0.2644[0m       0.9250        [94m0.2556[0m     +  9.2068
      5   [36m0.2379[0m   0.7235        [35m0.2592[0m       0.9250        [94m0.2457[0m     +  9.7009
      6   0.2315   [32m0.7468[0m        [35m0.2540[0m       0.9262        [94m0.2444[0m     +  10.0996
      7   0.2372   [32m0.7487[0m        [35m0.2516[0m       0.9250        [94m0.2365[0m     +  9.8744
      8   [36m0.2486[0m   [32m0.7526[0m        [35m0.2488[0m       [31m0.9274[0m        [94m0.2334[0m     +  9.7466
      9   [36m0.2516[0m   [32m0.7528[0m        [35m0.2408[0m       0.9250        [94m0.2327[0m     +  10.0731
     10   0.2442   [32m0.7610[0m        [35m0.2397[0m       0.9250        [94m0.2319[0m     +  9.8695
     11   0.2429   [32m0.7678[0m        [35m0.2386[0m       0.9238        [94m0.2302[0m     +  9.9785
     12   [36m0.2861[0m   0.7646        [35m0.2379[0m       [31m0.9287[0m        [94m0.2293[0m     +  9.9852
     13   0.2670   0.7648        [35m0.2359[0m       0.9262        0.2314        9.8740
     14   [36m0.2941[0m   0.7660        [35m0.2342[0m       0.9287        [94m0.2288[0m     +  9.8569
     15   0.2921   0.7670        [35m0.2328[0m       [31m0.9299[0m        [94m0.2281[0m     +  10.1263
     16   [36m0.3022[0m   0.7665        [35m0.2304[0m       0.9274        [94m0.2273[0m     +  9.8471
     17   0.2960   0.7675        0.2313       0.9262        [94m0.2266[0m     +  9.4539
     18   0.2679   0.7656        [35m0.2303[0m       0.9287        0.2272        9.7117
     19   0.2654   0.7650        [35m0.2286[0m       0.9287        0.2276        10.0715
     20   0.2746   [32m0.7713[0m        0.2316       0.9262        0.2270        9.9635
     21   0.2648   0.7685        0.2311       0.9250        0.2308        9.8232
     22   0.2819   0.7682        [35m0.2282[0m       0.9274        0.2291        9.9286
     23   0.2744   0.7657        0.2287       0.9274        0.2296        9.7910
     24   0.2768   [32m0.7728[0m        [35m0.2275[0m       0.9299        0.2277        10.1070
     25   0.2766   0.7652        [35m0.2272[0m       0.9262        0.2280        9.8306
     26   0.2776   0.7706        [35m0.2271[0m       0.9287        0.2272        10.0163
Stopping since valid_loss has not improved in the last 10 epochs.
[32m[I 2023-05-02 20:08:36,789][0m Trial 200 finished with value: 0.22663982652190806 and parameters: {'lr': 0.0006371484293758012, 'dropout': 0.431961572086766, 'd_model_multiplier': 2, 'num_layers': 5, 'n_heads': 4, 'dim_feedforward': 337, 'batch_size': 77, 'pos_encoding': 'fixed', 'activation': 'gelu', 'norm': 'BatchNorm', 'optimizer_name': 'PlainRAdam', 'weight_decay': 0.1, 'top_n_features': 64}. Best is trial 117 with value: 0.191397856754288.[0m
[FileBasedDataset] Initializing dataset...
	Examples: 8264
	Features: 42
	Max length: 315
Standard scalar turned ON, loading params from cache
[FileBasedDataset] Dataset initialization complete
  epoch    auprc    auroc    train_loss    valid_acc    valid_loss    cp     dur
-------  -------  -------  ------------  -----------  ------------  ----  ------
      1   [36m0.2144[0m   [32m0.6922[0m        [35m0.3572[0m       [31m0.9226[0m        [94m0.2549[0m     +  8.5654
      2   [36m0.3592[0m   [32m0.7674[0m        [35m0.2601[0m       [31m0.9262[0m        [94m0.2300[0m     +  8.5883
      3   [36m0.3712[0m   [32m0.7748[0m        [35m0.2461[0m       [31m0.9299[0m        [94m0.2243[0m     +  9.7000
      4   [36m0.3791[0m   [32m0.7754[0m        [35m0.2446[0m       0.9299        0.2248        8.8477
      5   0.3635   [32m0.7806[0m        [35m0.2402[0m       0.9299        0.2247        9.4148
      6   0.3711   [32m0.7869[0m        [35m0.2391[0m       0.9262        0.2251        9.4742
      7   0.3705   [32m0.7874[0m        [35m0.2372[0m       0.9274        0.2251        9.6466
      8   0.3764   [32m0.7931[0m        0.2377       0.9250        0.2260        9.2752
      9   0.3661   0.7858        [35m0.2342[0m       0.9299        0.2278        9.6471
     10   [36m0.3794[0m   0.7911        [35m0.2317[0m       0.9274        0.2269        9.6191
     11   0.3514   0.7928        0.2341       0.9262        0.2292        9.2133
     12   0.3691   [32m0.7968[0m        [35m0.2313[0m       0.9262        [94m0.2240[0m     +  9.4738
     13   0.3561   0.7916        0.2334       0.9238        0.2272        9.1922
     14   0.3511   0.7947        [35m0.2289[0m       0.9238        0.2271        9.4998
     15   0.3500   0.7948        0.2318       0.9238        0.2270        9.5389
     16   0.3395   0.7917        0.2317       0.9250        0.2276        9.5636
     17   0.3401   0.7829        0.2310       0.9202        0.2335        9.2338
     18   0.3521   [32m0.8004[0m        [35m0.2287[0m       0.9226        0.2248        9.4972
     19   0.3522   0.7966        0.2290       0.9214        0.2270        9.4773
     20   0.3601   0.7993        0.2287       0.9287        0.2250        9.9137
     21   0.3578   [32m0.8020[0m        [35m0.2276[0m       0.9226        0.2247        9.3582
Stopping since valid_loss has not improved in the last 10 epochs.
[32m[I 2023-05-02 20:12:03,455][0m Trial 201 finished with value: 0.224015316262643 and parameters: {'lr': 0.00038454315114372784, 'dropout': 0.46485321808352753, 'd_model_multiplier': 2, 'num_layers': 5, 'n_heads': 4, 'dim_feedforward': 324, 'batch_size': 56, 'pos_encoding': 'fixed', 'activation': 'relu', 'norm': 'LayerNorm', 'optimizer_name': 'AdamW', 'weight_decay': 0.1, 'top_n_features': 42}. Best is trial 117 with value: 0.191397856754288.[0m
[FileBasedDataset] Initializing dataset...
	Examples: 8264
	Features: 21
	Max length: 315
Standard scalar turned ON, loading params from cache
[FileBasedDataset] Dataset initialization complete
  epoch    auprc    auroc    train_loss    valid_acc    valid_loss    cp      dur
-------  -------  -------  ------------  -----------  ------------  ----  -------
      1   [36m0.1337[0m   [32m0.5730[0m        [35m0.3799[0m       [31m0.9299[0m        [94m0.2689[0m     +  11.2488
      2   [36m0.2056[0m   [32m0.6462[0m        [35m0.2776[0m       0.9299        [94m0.2432[0m     +  11.6765
      3   0.1856   [32m0.6679[0m        [35m0.2649[0m       0.9299        [94m0.2380[0m     +  11.3906
      4   0.1898   [32m0.6763[0m        [35m0.2640[0m       0.9299        [94m0.2348[0m     +  11.7190
      5   0.1922   [32m0.6780[0m        [35m0.2593[0m       0.9299        [94m0.2334[0m     +  11.5632
      6   0.1907   [32m0.6883[0m        [35m0.2549[0m       0.9299        [94m0.2329[0m     +  11.6775
      7   0.1908   [32m0.6969[0m        0.2579       0.9299        [94m0.2323[0m     +  11.6098
      8   0.1924   [32m0.7009[0m        0.2569       0.9299        [94m0.2320[0m     +  11.6790
      9   0.1956   [32m0.7026[0m        0.2568       0.9299        [94m0.2312[0m     +  11.7260
     10   0.1892   [32m0.7029[0m        0.2585       0.9287        0.2315        11.7075
     11   0.1920   [32m0.7068[0m        [35m0.2533[0m       0.9287        0.2312        11.6037
     12   0.1945   [32m0.7077[0m        0.2537       0.9299        [94m0.2301[0m     +  11.8772
     13   0.1930   [32m0.7087[0m        0.2549       0.9299        0.2309        11.5593
     14   0.1892   0.7087        0.2554       0.9299        0.2316        11.7014
     15   0.1881   0.7085        [35m0.2526[0m       0.9299        0.2309        11.8763
     16   0.1897   0.7068        0.2559       0.9299        0.2320        11.5044
     17   0.1868   0.7067        0.2545       0.9299        0.2322        11.6221
     18   0.1900   0.7074        0.2538       0.9299        0.2321        11.7829
     19   0.1883   0.7085        0.2537       0.9287        0.2337        11.5728
     20   0.1891   0.7078        0.2542       0.9287        0.2319        11.7594
     21   0.1882   0.7069        0.2564       0.9287        0.2326        11.5966
Stopping since valid_loss has not improved in the last 10 epochs.
[32m[I 2023-05-02 20:16:20,407][0m Trial 202 finished with value: 0.23012849236269817 and parameters: {'lr': 0.00022815407381422228, 'dropout': 0.45273244248176003, 'd_model_multiplier': 2, 'num_layers': 10, 'n_heads': 4, 'dim_feedforward': 403, 'batch_size': 52, 'pos_encoding': 'fixed', 'activation': 'relu', 'norm': 'LayerNorm', 'optimizer_name': 'AdamW', 'weight_decay': 0.1, 'top_n_features': 21}. Best is trial 117 with value: 0.191397856754288.[0m
[FileBasedDataset] Initializing dataset...
	Examples: 8264
	Features: 46
	Max length: 315
Standard scalar turned ON, loading params from cache
[FileBasedDataset] Dataset initialization complete
  epoch    auprc    auroc    train_loss    valid_acc    valid_loss    cp     dur
-------  -------  -------  ------------  -----------  ------------  ----  ------
      1   [36m0.3569[0m   [32m0.7832[0m        [35m0.2862[0m       [31m0.9226[0m        [94m0.2293[0m     +  9.0241
      2   [36m0.3624[0m   [32m0.7986[0m        [35m0.2444[0m       0.9226        [94m0.2186[0m     +  9.0366
      3   [36m0.3851[0m   [32m0.8233[0m        [35m0.2406[0m       [31m0.9311[0m        [94m0.2076[0m     +  8.9389
      4   [36m0.3984[0m   [32m0.8253[0m        0.2407       [31m0.9323[0m        0.2077        9.2647
      5   [36m0.4133[0m   [32m0.8304[0m        [35m0.2374[0m       [31m0.9359[0m        [94m0.2060[0m     +  9.2783
      6   0.3931   [32m0.8351[0m        [35m0.2350[0m       0.9335        0.2100        9.3422
      7   0.3981   [32m0.8431[0m        [35m0.2333[0m       0.9347        [94m0.2058[0m     +  9.2139
      8   0.3851   0.8427        [35m0.2325[0m       0.9347        0.2068        9.2288
      9   0.4017   [32m0.8468[0m        [35m0.2290[0m       0.9299        [94m0.2051[0m     +  9.6184
     10   0.3824   [32m0.8540[0m        [35m0.2268[0m       0.9311        0.2056        9.6085
     11   0.3838   0.8530        0.2288       0.9262        0.2062        9.4764
     12   0.3815   0.8539        [35m0.2248[0m       0.9262        0.2142        9.8162
     13   0.3870   [32m0.8545[0m        [35m0.2244[0m       0.9287        [94m0.2047[0m     +  9.6651
     14   0.3898   [32m0.8586[0m        [35m0.2223[0m       0.9287        [94m0.2037[0m     +  9.3087
     15   0.3912   0.8562        0.2232       0.9202        0.2139        9.6086
     16   0.3764   0.8521        [35m0.2220[0m       0.9250        0.2126        9.3351
     17   0.3928   [32m0.8640[0m        [35m0.2213[0m       0.9226        0.2052        9.3711
     18   0.3776   0.8599        [35m0.2199[0m       0.9226        0.2086        9.5241
     19   0.4090   [32m0.8642[0m        [35m0.2181[0m       0.9274        0.2041        9.5063
     20   0.3828   0.8551        [35m0.2160[0m       0.9299        0.2095        9.5973
     21   0.3819   0.8554        0.2173       0.9250        0.2092        9.7506
     22   0.3681   0.8540        [35m0.2152[0m       0.9250        0.2148        9.3260
     23   0.3446   0.8419        0.2161       0.9238        0.2180        9.5759
Stopping since valid_loss has not improved in the last 10 epochs.
[32m[I 2023-05-02 20:20:06,977][0m Trial 203 finished with value: 0.20372162883630543 and parameters: {'lr': 0.0008385144646361651, 'dropout': 0.44064492296846197, 'd_model_multiplier': 4, 'num_layers': 4, 'n_heads': 4, 'dim_feedforward': 215, 'batch_size': 61, 'pos_encoding': 'fixed', 'activation': 'relu', 'norm': 'LayerNorm', 'optimizer_name': 'AdamW', 'weight_decay': 0.1, 'top_n_features': 46}. Best is trial 117 with value: 0.191397856754288.[0m
[FileBasedDataset] Initializing dataset...
	Examples: 8264
	Features: 49
	Max length: 315
Standard scalar turned ON, loading params from cache
[FileBasedDataset] Dataset initialization complete
  epoch    auprc    auroc    train_loss    valid_acc    valid_loss    cp     dur
-------  -------  -------  ------------  -----------  ------------  ----  ------
      1   [36m0.2220[0m   [32m0.6913[0m        [35m0.2697[0m       [31m0.9129[0m        [94m0.2706[0m     +  8.4835
      2   [36m0.2275[0m   [32m0.6979[0m        [35m0.2540[0m       0.8996        0.2718        9.0925
      3   [36m0.2903[0m   [32m0.7568[0m        [35m0.2493[0m       [31m0.9154[0m        [94m0.2572[0m     +  8.9172
      4   [36m0.3132[0m   [32m0.7675[0m        [35m0.2407[0m       0.9129        0.2603        9.1271
      5   [36m0.3155[0m   0.7627        [35m0.2341[0m       0.9069        0.2661        8.9430
      6   [36m0.3318[0m   [32m0.7719[0m        0.2344       0.9129        0.2585        9.1216
      7   0.3163   [32m0.7838[0m        [35m0.2309[0m       0.9057        0.2593        9.2691
      8   [36m0.3320[0m   0.7799        [35m0.2295[0m       0.9021        0.2643        9.0237
      9   [36m0.3426[0m   0.7789        0.2299       [31m0.9166[0m        [94m0.2559[0m     +  9.1312
     10   0.3160   [32m0.7838[0m        [35m0.2279[0m       0.9141        0.2562        9.4405
     11   0.3173   0.7819        [35m0.2274[0m       0.9141        0.2573        9.4286
     12   0.3199   [32m0.7857[0m        [35m0.2259[0m       0.9141        0.2578        9.0283
     13   0.2987   [32m0.7882[0m        0.2319       0.9105        0.2578        9.4398
     14   0.3199   0.7824        0.2273       0.9141        [94m0.2546[0m     +  9.3365
     15   0.3153   0.7834        0.2268       0.9117        0.2572        9.2593
     16   0.3238   0.7787        [35m0.2251[0m       0.9166        0.2581        9.2755
     17   0.3088   0.7731        0.2274       0.9141        0.2635        9.3531
     18   0.3030   0.7747        0.2278       0.9141        0.2588        9.6620
     19   0.3173   0.7830        0.2256       0.9141        0.2578        9.5246
     20   0.3263   0.7821        0.2263       [31m0.9178[0m        0.2558        9.3118
     21   0.3169   [32m0.7946[0m        0.2268       0.9069        0.2578        9.3459
     22   0.2911   0.7746        0.2253       0.9093        0.2568        9.3029
     23   0.3261   0.7813        0.2255       [31m0.9214[0m        [94m0.2490[0m     +  9.6964
     24   0.3121   0.7532        0.2263       0.9190        0.2601        9.1498
     25   0.3253   0.7723        [35m0.2245[0m       0.9178        0.2541        9.3806
     26   0.3290   0.7788        [35m0.2224[0m       0.9178        0.2572        9.4052
     27   0.3342   0.7834        0.2253       0.9117        0.2562        9.3624
     28   0.3215   0.7837        [35m0.2224[0m       0.9178        0.2536        9.5530
     29   0.3411   0.7874        0.2235       0.9190        0.2505        9.5601
     30   0.3173   0.7905        0.2246       0.9178        0.2493        9.4278
     31   0.3048   0.7888        0.2230       0.9178        0.2506        9.0160
     32   0.2802   0.7811        0.2264       0.9093        0.2528        9.3469
Stopping since valid_loss has not improved in the last 10 epochs.
[32m[I 2023-05-02 20:25:13,822][0m Trial 204 finished with value: 0.24901873812962327 and parameters: {'lr': 0.00171608273968334, 'dropout': 0.41772149452391244, 'd_model_multiplier': 4, 'num_layers': 4, 'n_heads': 4, 'dim_feedforward': 248, 'batch_size': 61, 'pos_encoding': 'fixed', 'activation': 'relu', 'norm': 'LayerNorm', 'optimizer_name': 'AdamW', 'weight_decay': 0.1, 'top_n_features': 49}. Best is trial 117 with value: 0.191397856754288.[0m
[FileBasedDataset] Initializing dataset...
	Examples: 8264
	Features: 33
	Max length: 315
Standard scalar turned ON, loading params from cache
[FileBasedDataset] Dataset initialization complete
  epoch    auprc    auroc    train_loss    valid_acc    valid_loss    cp      dur
-------  -------  -------  ------------  -----------  ------------  ----  -------
      1   [36m0.2805[0m   [32m0.8049[0m        [35m0.2768[0m       [31m0.9057[0m        [94m0.2316[0m     +  19.5915
      2   [36m0.3918[0m   [32m0.8227[0m        [35m0.2489[0m       [31m0.9287[0m        [94m0.2207[0m     +  19.6626
      3   0.3917   [32m0.8371[0m        [35m0.2446[0m       0.9287        [94m0.2166[0m     +  19.9889
      4   [36m0.4120[0m   [32m0.8407[0m        [35m0.2418[0m       0.9274        [94m0.2146[0m     +  19.8684
      5   [36m0.4133[0m   [32m0.8414[0m        [35m0.2388[0m       0.9262        [94m0.2105[0m     +  19.8360
      6   0.4050   0.8351        [35m0.2316[0m       [31m0.9299[0m        0.2170        20.2680
      7   0.3891   0.8406        0.2352       0.9226        0.2161        19.8619
      8   [36m0.4266[0m   [32m0.8489[0m        [35m0.2313[0m       0.9299        [94m0.2065[0m     +  20.0143
      9   0.4226   0.8482        [35m0.2309[0m       0.9299        0.2080        20.0187
     10   0.4137   0.8463        [35m0.2282[0m       0.9250        0.2127        19.8936
     11   0.4106   0.8458        [35m0.2276[0m       0.9238        0.2112        19.7628
     12   0.4226   0.8465        [35m0.2261[0m       0.9274        0.2082        19.8890
     13   0.3933   0.8473        [35m0.2250[0m       0.9238        0.2103        20.1259
     14   0.4152   0.8479        [35m0.2241[0m       0.9226        0.2118        19.8394
     15   0.4077   [32m0.8503[0m        0.2246       0.9287        0.2096        19.8790
     16   0.4164   [32m0.8581[0m        0.2242       0.9274        0.2108        20.4789
     17   0.4034   0.8543        [35m0.2213[0m       0.9262        0.2176        20.1546
Stopping since valid_loss has not improved in the last 10 epochs.
