[32m[I 2023-05-04 11:47:31,994][0m Trial 437 finished with value: 0.25114575586086896 and parameters: {'lr': 3.737425606939871e-05, 'dropout': 0.6810717595590248, 'd_model_multiplier': 32, 'num_layers': 6, 'n_heads': 32, 'dim_feedforward': 320, 'batch_size': 57, 'pos_encoding': 'fixed', 'activation': 'relu', 'norm': 'LayerNorm', 'optimizer_name': 'RAdam', 'weight_decay': 0.1, 'top_n_features': 61}. Best is trial 246 with value: 0.16447311791139763.[0m
[FileBasedDataset] Initializing dataset...
	Examples: 8264
	Features: 78
	Max length: 315
Standard scalar turned ON, loading params from cache
[FileBasedDataset] Dataset initialization complete
  epoch    auprc    auroc    train_loss    valid_acc    valid_loss    cp      dur
-------  -------  -------  ------------  -----------  ------------  ----  -------
      1   [36m0.0483[0m   [32m0.2556[0m        [35m0.5610[0m       [31m0.9250[0m        [94m0.4159[0m     +  62.0743
      2   [36m0.0683[0m   [32m0.4818[0m        [35m0.3691[0m       0.9250        [94m0.2853[0m     +  62.0383
      3   [36m0.2427[0m   [32m0.7057[0m        [35m0.2865[0m       0.9250        [94m0.2434[0m     +  62.6332
      4   [36m0.2681[0m   [32m0.7453[0m        [35m0.2607[0m       0.9250        [94m0.2315[0m     +  62.3599
      5   [36m0.3091[0m   [32m0.7667[0m        [35m0.2506[0m       0.9250        [94m0.2258[0m     +  62.7320
      6   [36m0.3492[0m   [32m0.7817[0m        [35m0.2442[0m       [31m0.9262[0m        [94m0.2212[0m     +  62.5452
      7   [36m0.3639[0m   [32m0.7887[0m        [35m0.2408[0m       0.9262        [94m0.2190[0m     +  62.5937
      8   [36m0.3900[0m   [32m0.7916[0m        [35m0.2387[0m       [31m0.9311[0m        [94m0.2179[0m     +  62.4655
      9   0.3886   [32m0.7951[0m        [35m0.2365[0m       [31m0.9323[0m        [94m0.2178[0m     +  62.5397
     10   [36m0.3940[0m   [32m0.7980[0m        [35m0.2346[0m       0.9323        [94m0.2172[0m     +  62.5221
     11   0.3921   [32m0.8005[0m        [35m0.2336[0m       0.9323        [94m0.2165[0m     +  62.4443
     12   0.3870   [32m0.8021[0m        [35m0.2323[0m       0.9323        [94m0.2158[0m     +  63.0156
     13   0.3880   [32m0.8039[0m        [35m0.2307[0m       0.9323        [94m0.2154[0m     +  62.4405
     14   0.3899   [32m0.8060[0m        0.2309       [31m0.9335[0m        [94m0.2147[0m     +  62.4417
     15   0.3829   [32m0.8074[0m        [35m0.2291[0m       0.9323        0.2151        62.3690
     16   0.3801   [32m0.8097[0m        [35m0.2280[0m       0.9323        0.2147        62.5422
     17   0.3821   [32m0.8115[0m        0.2284       0.9311        [94m0.2142[0m     +  62.5770
     18   0.3894   [32m0.8134[0m        [35m0.2273[0m       0.9274        [94m0.2131[0m     +  62.6908
     19   0.3879   [32m0.8142[0m        0.2273       0.9287        [94m0.2130[0m     +  63.0205
     20   0.3782   [32m0.8159[0m        [35m0.2267[0m       0.9287        0.2131        62.5656
     21   0.3764   [32m0.8168[0m        [35m0.2262[0m       0.9287        0.2131        62.5295
     22   0.3805   0.8164        [35m0.2248[0m       0.9274        [94m0.2128[0m     +  62.5438
     23   0.3773   [32m0.8177[0m        0.2255       0.9250        [94m0.2124[0m     +  62.4564
     24   0.3792   [32m0.8185[0m        [35m0.2230[0m       0.9274        0.2130        62.6986
     25   0.3785   [32m0.8185[0m        0.2241       0.9250        0.2129        62.6447
     26   0.3713   [32m0.8188[0m        0.2242       0.9262        0.2134        62.4337
     27   0.3656   [32m0.8205[0m        [35m0.2220[0m       0.9262        [94m0.2123[0m     +  62.5399
     28   0.3627   0.8203        0.2229       0.9274        0.2134        62.4102
     29   0.3574   0.8200        [35m0.2219[0m       0.9299        0.2135        62.3803
     30   0.3659   [32m0.8219[0m        [35m0.2214[0m       0.9287        0.2131        62.1931
     31   0.3578   0.8209        [35m0.2198[0m       0.9299        0.2141        62.5265
     32   0.3645   0.8216        0.2208       0.9299        0.2135        62.2042
     33   0.3674   [32m0.8229[0m        0.2210       0.9299        0.2124        62.5535
     34   0.3601   [32m0.8233[0m        0.2207       0.9323        0.2125        62.6935
     35   0.3614   [32m0.8235[0m        0.2199       0.9299        0.2126        62.4720
     36   0.3625   [32m0.8237[0m        [35m0.2178[0m       0.9299        [94m0.2121[0m     +  62.5199
     37   0.3670   [32m0.8250[0m        0.2192       0.9299        0.2125        62.4336
     38   0.3579   0.8238        0.2191       0.9299        0.2126        62.5806
     39   0.3601   0.8240        [35m0.2171[0m       0.9299        0.2127        62.5285
     40   0.3569   0.8249        [35m0.2165[0m       0.9311        0.2125        62.2972
     41   0.3581   [32m0.8252[0m        0.2173       0.9287        0.2128        62.6032
     42   0.3532   [32m0.8257[0m        0.2175       0.9311        0.2122        62.4835
     43   0.3505   0.8252        0.2166       0.9287        0.2136        62.7156
     44   0.3516   [32m0.8261[0m        [35m0.2160[0m       0.9299        0.2129        63.3784
     45   0.3484   0.8252        [35m0.2158[0m       0.9274        0.2136        62.2988
Stopping since valid_loss has not improved in the last 10 epochs.
[32m[I 2023-05-04 12:35:50,053][0m Trial 438 finished with value: 0.21214225434190273 and parameters: {'lr': 2.3713912447141494e-06, 'dropout': 0.4576666746285412, 'd_model_multiplier': 32, 'num_layers': 7, 'n_heads': 32, 'dim_feedforward': 335, 'batch_size': 68, 'pos_encoding': 'fixed', 'activation': 'relu', 'norm': 'LayerNorm', 'optimizer_name': 'RAdam', 'weight_decay': 0.1, 'top_n_features': 78}. Best is trial 246 with value: 0.16447311791139763.[0m
[FileBasedDataset] Initializing dataset...
	Examples: 8264
	Features: 68
	Max length: 315
Standard scalar turned ON, loading params from cache
[FileBasedDataset] Dataset initialization complete
  epoch    auprc    auroc    train_loss    valid_acc    valid_loss    cp      dur
-------  -------  -------  ------------  -----------  ------------  ----  -------
      1   [36m0.0494[0m   [32m0.3503[0m        [35m0.5299[0m       [31m0.9347[0m        [94m0.3083[0m     +  19.7231
      2   [36m0.1366[0m   [32m0.6457[0m        [35m0.2999[0m       0.9347        [94m0.2334[0m     +  20.2018
      3   [36m0.2001[0m   [32m0.6949[0m        [35m0.2635[0m       0.9347        [94m0.2203[0m     +  20.4496
      4   [36m0.2429[0m   [32m0.7417[0m        [35m0.2494[0m       0.9335        [94m0.2129[0m     +  20.2500
      5   [36m0.2718[0m   [32m0.7738[0m        [35m0.2423[0m       0.9347        [94m0.2096[0m     +  20.0204
      6   [36m0.2882[0m   [32m0.7852[0m        [35m0.2378[0m       0.9335        [94m0.2079[0m     +  20.0159
      7   [36m0.2970[0m   [32m0.7901[0m        0.2380       0.9323        [94m0.2067[0m     +  20.3170
      8   [36m0.3015[0m   [32m0.7936[0m        [35m0.2351[0m       [31m0.9359[0m        [94m0.2054[0m     +  20.2604
      9   [36m0.3163[0m   [32m0.7979[0m        0.2354       0.9335        [94m0.2029[0m     +  20.1547
     10   [36m0.3228[0m   [32m0.8009[0m        [35m0.2345[0m       0.9335        [94m0.2011[0m     +  20.4041
     11   [36m0.3304[0m   [32m0.8027[0m        [35m0.2345[0m       0.9359        [94m0.1998[0m     +  20.4231
     12   0.3244   [32m0.8042[0m        [35m0.2338[0m       0.9347        [94m0.1993[0m     +  20.1568
     13   [36m0.3316[0m   [32m0.8075[0m        [35m0.2332[0m       0.9359        [94m0.1982[0m     +  20.2972
     14   [36m0.3356[0m   [32m0.8100[0m        [35m0.2325[0m       0.9359        [94m0.1978[0m     +  20.0618
     15   [36m0.3398[0m   [32m0.8131[0m        [35m0.2302[0m       0.9347        [94m0.1973[0m     +  20.3425
     16   0.3326   [32m0.8139[0m        0.2317       0.9347        [94m0.1967[0m     +  20.3917
     17   [36m0.3425[0m   [32m0.8145[0m        0.2303       0.9347        [94m0.1956[0m     +  20.3503
     18   [36m0.3430[0m   [32m0.8163[0m        [35m0.2297[0m       0.9347        0.1958        20.3234
     19   0.3417   0.8151        [35m0.2287[0m       0.9347        [94m0.1952[0m     +  20.4221
     20   [36m0.3460[0m   0.8149        0.2304       0.9347        [94m0.1951[0m     +  20.4128
     21   0.3444   [32m0.8173[0m        0.2296       0.9347        0.1951        20.1997
     22   0.3428   0.8169        [35m0.2279[0m       0.9335        0.1958        20.0389
     23   0.3400   [32m0.8175[0m        [35m0.2276[0m       0.9347        [94m0.1949[0m     +  20.3382
     24   0.3338   [32m0.8196[0m        [35m0.2258[0m       0.9347        0.1950        19.9553
     25   0.3433   [32m0.8221[0m        0.2286       0.9335        [94m0.1931[0m     +  20.0606
     26   0.3339   0.8209        0.2279       0.9335        0.1943        20.3119
     27   [36m0.3561[0m   [32m0.8241[0m        [35m0.2257[0m       0.9347        [94m0.1920[0m     +  20.3062
     28   0.3424   [32m0.8241[0m        0.2275       0.9347        0.1935        20.0752
     29   0.3513   [32m0.8251[0m        0.2258       0.9359        0.1924        20.3375
     30   0.3495   0.8238        [35m0.2250[0m       0.9359        0.1923        20.1506
     31   0.3470   [32m0.8252[0m        [35m0.2228[0m       0.9359        0.1925        20.7090
     32   0.3483   [32m0.8265[0m        0.2239       [31m0.9371[0m        [94m0.1917[0m     +  20.7968
     33   [36m0.3610[0m   0.8255        0.2239       0.9359        [94m0.1913[0m     +  20.3497
     34   0.3551   [32m0.8269[0m        0.2255       0.9371        0.1923        20.2427
     35   0.3542   [32m0.8278[0m        [35m0.2206[0m       0.9359        0.1925        20.7071
     36   0.3555   0.8258        0.2232       0.9371        0.1932        20.2368
     37   0.3540   0.8229        0.2211       0.9371        0.1926        20.1634
     38   0.3417   0.8245        [35m0.2198[0m       0.9371        0.1945        20.1507
     39   0.3188   0.8215        0.2202       0.9371        0.1963        20.3638
     40   0.3410   0.8184        [35m0.2191[0m       [31m0.9395[0m        0.1932        20.1855
     41   0.3365   0.8214        [35m0.2187[0m       0.9359        0.1941        20.2708
     42   [36m0.3612[0m   0.8194        0.2199       0.9359        0.1920        20.2480
Stopping since valid_loss has not improved in the last 10 epochs.
[32m[I 2023-05-04 12:50:23,833][0m Trial 439 finished with value: 0.1912960457326135 and parameters: {'lr': 5.962406085716384e-05, 'dropout': 0.5574665958812296, 'd_model_multiplier': 4, 'num_layers': 4, 'n_heads': 32, 'dim_feedforward': 348, 'batch_size': 63, 'pos_encoding': 'fixed', 'activation': 'relu', 'norm': 'LayerNorm', 'optimizer_name': 'RAdam', 'weight_decay': 0.1, 'top_n_features': 68}. Best is trial 246 with value: 0.16447311791139763.[0m
[FileBasedDataset] Initializing dataset...
	Examples: 8264
	Features: 70
	Max length: 315
Standard scalar turned ON, loading params from cache
[FileBasedDataset] Dataset initialization complete
  epoch    auprc    auroc    train_loss    valid_acc    valid_loss    cp     dur
-------  -------  -------  ------------  -----------  ------------  ----  ------
      1   [36m0.0604[0m   [32m0.3328[0m        [35m0.6391[0m       [31m0.9287[0m        [94m0.5806[0m     +  9.4147
      2   [36m0.0614[0m   0.3298        [35m0.5548[0m       0.9287        [94m0.4791[0m     +  9.2436
      3   0.0574   0.3279        [35m0.4669[0m       0.9287        [94m0.3944[0m     +  10.0588
      4   0.0572   [32m0.3375[0m        [35m0.3994[0m       0.9287        [94m0.3411[0m     +  9.7501
      5   0.0591   [32m0.3777[0m        [35m0.3528[0m       0.9287        [94m0.3088[0m     +  9.7383
      6   [36m0.0650[0m   [32m0.4355[0m        [35m0.3228[0m       0.9287        [94m0.2875[0m     +  9.6294
      7   [36m0.0873[0m   [32m0.4810[0m        [35m0.3025[0m       0.9287        [94m0.2744[0m     +  9.6867
      8   [36m0.1078[0m   [32m0.5156[0m        [35m0.2890[0m       0.9287        [94m0.2666[0m     +  9.5868
      9   [36m0.1290[0m   [32m0.5368[0m        [35m0.2797[0m       0.9287        [94m0.2616[0m     +  9.5838
     10   [36m0.1326[0m   [32m0.5531[0m        [35m0.2730[0m       0.9287        [94m0.2586[0m     +  9.7577
     11   [36m0.1391[0m   [32m0.5697[0m        [35m0.2698[0m       0.9287        [94m0.2557[0m     +  9.7130
     12   [36m0.1551[0m   [32m0.5878[0m        [35m0.2675[0m       0.9287        [94m0.2534[0m     +  10.0515
     13   [36m0.1729[0m   [32m0.6072[0m        [35m0.2604[0m       0.9287        [94m0.2506[0m     +  9.7903
     14   [36m0.1803[0m   [32m0.6324[0m        [35m0.2600[0m       0.9287        [94m0.2468[0m     +  9.5475
     15   [36m0.1946[0m   [32m0.6522[0m        [35m0.2530[0m       [31m0.9299[0m        [94m0.2441[0m     +  9.8343
     16   [36m0.2030[0m   [32m0.6646[0m        [35m0.2486[0m       0.9274        [94m0.2436[0m     +  9.8773
     17   [36m0.2197[0m   0.6621        [35m0.2462[0m       0.9262        [94m0.2436[0m     +  9.8560
     18   [36m0.2368[0m   [32m0.6828[0m        [35m0.2445[0m       0.9238        [94m0.2428[0m     +  10.1141
     19   [36m0.2455[0m   0.6816        [35m0.2439[0m       0.9238        [94m0.2418[0m     +  9.7011
     20   [36m0.2514[0m   [32m0.6921[0m        [35m0.2424[0m       0.9262        [94m0.2407[0m     +  9.5744
     21   [36m0.2545[0m   [32m0.6924[0m        [35m0.2412[0m       0.9287        [94m0.2397[0m     +  9.6985
     22   [36m0.2599[0m   [32m0.6953[0m        0.2422       0.9287        [94m0.2389[0m     +  9.8351
     23   [36m0.2618[0m   [32m0.7026[0m        [35m0.2400[0m       0.9287        [94m0.2373[0m     +  9.9397
     24   [36m0.2685[0m   [32m0.7058[0m        [35m0.2396[0m       0.9287        [94m0.2366[0m     +  10.1935
     25   [36m0.2693[0m   0.7043        [35m0.2388[0m       [31m0.9311[0m        0.2371        9.8725
     26   0.2681   [32m0.7087[0m        [35m0.2360[0m       0.9299        [94m0.2361[0m     +  10.1121
     27   0.2684   [32m0.7093[0m        [35m0.2357[0m       0.9299        0.2362        9.8256
     28   0.2688   [32m0.7095[0m        0.2368       0.9287        0.2371        10.0804
     29   0.2659   0.7091        [35m0.2351[0m       0.9287        0.2367        10.2731
     30   0.2654   [32m0.7138[0m        0.2372       0.9287        [94m0.2358[0m     +  10.3097
     31   0.2651   0.7124        [35m0.2346[0m       0.9287        0.2367        9.5796
     32   0.2690   [32m0.7139[0m        0.2355       0.9287        0.2363        9.5028
     33   0.2673   [32m0.7174[0m        0.2347       0.9287        0.2363        9.4828
     34   0.2684   [32m0.7182[0m        [35m0.2329[0m       0.9287        0.2364        9.7448
     35   0.2692   0.7180        0.2354       0.9287        0.2366        9.9716
     36   0.2686   0.7178        0.2359       0.9274        0.2368        10.0170
     37   0.2689   [32m0.7194[0m        0.2343       0.9274        0.2361        9.8895
     38   0.2660   [32m0.7208[0m        [35m0.2322[0m       0.9287        0.2366        9.8272
     39   [36m0.2704[0m   0.7198        0.2325       0.9274        0.2360        9.8609
Stopping since valid_loss has not improved in the last 10 epochs.
[32m[I 2023-05-04 12:56:58,124][0m Trial 440 finished with value: 0.2357677437247936 and parameters: {'lr': 6.133586047789549e-05, 'dropout': 0.5562370290713359, 'd_model_multiplier': 4, 'num_layers': 5, 'n_heads': 4, 'dim_feedforward': 354, 'batch_size': 73, 'pos_encoding': 'fixed', 'activation': 'relu', 'norm': 'LayerNorm', 'optimizer_name': 'RAdam', 'weight_decay': 0.1, 'top_n_features': 70}. Best is trial 246 with value: 0.16447311791139763.[0m
[FileBasedDataset] Initializing dataset...
	Examples: 8264
	Features: 58
	Max length: 315
Standard scalar turned ON, loading params from cache
[FileBasedDataset] Dataset initialization complete
  epoch    auprc    auroc    train_loss    valid_acc    valid_loss    cp      dur
-------  -------  -------  ------------  -----------  ------------  ----  -------
      1   [36m0.0612[0m   [32m0.3061[0m        [35m0.5092[0m       [31m0.9141[0m        [94m0.3665[0m     +  27.0220
      2   [36m0.2372[0m   [32m0.6680[0m        [35m0.3135[0m       0.9141        [94m0.2737[0m     +  27.4280
      3   [36m0.2977[0m   [32m0.7275[0m        [35m0.2653[0m       0.9141        [94m0.2588[0m     +  27.8957
      4   [36m0.3034[0m   [32m0.7561[0m        [35m0.2519[0m       0.9141        [94m0.2535[0m     +  27.6839
      5   [36m0.3202[0m   [32m0.7843[0m        [35m0.2458[0m       [31m0.9154[0m        [94m0.2448[0m     +  26.9986
      6   [36m0.3374[0m   [32m0.7971[0m        [35m0.2396[0m       0.9093        [94m0.2423[0m     +  27.9063
      7   0.3313   [32m0.8034[0m        [35m0.2352[0m       0.9105        0.2439        27.9120
      8   [36m0.3405[0m   [32m0.8076[0m        [35m0.2322[0m       0.9057        0.2443        27.7073
      9   0.3297   [32m0.8103[0m        [35m0.2321[0m       0.9045        0.2460        27.5441
     10   0.3335   [32m0.8113[0m        [35m0.2320[0m       0.9045        0.2447        27.4302
     11   0.3311   [32m0.8120[0m        [35m0.2289[0m       0.9057        0.2484        27.3421
     12   0.3289   [32m0.8137[0m        0.2302       0.9069        0.2462        27.7551
     13   0.3256   0.8134        [35m0.2287[0m       0.9093        0.2476        27.3092
     14   0.3318   [32m0.8145[0m        0.2299       0.9069        0.2458        27.4881
     15   0.3281   0.8143        0.2292       0.9081        0.2463        27.3499
Stopping since valid_loss has not improved in the last 10 epochs.
