[32m[I 2023-05-05 02:59:32,370][0m Trial 535 finished with value: 100.0 and parameters: {'lr': 0.003992896997390689, 'dropout': 0.12426305328986376, 'd_model_multiplier': 16, 'num_layers': 6, 'n_heads': 32, 'dim_feedforward': 291, 'batch_size': 239, 'pos_encoding': 'fixed', 'activation': 'relu', 'norm': 'LayerNorm', 'optimizer_name': 'RAdam', 'weight_decay': 0.001, 'top_n_features': 87}. Best is trial 246 with value: 0.16447311791139763.[0m
[FileBasedDataset] Initializing dataset...
	Examples: 8264
	Features: 68
	Max length: 315
Standard scalar turned ON, loading params from cache
[FileBasedDataset] Dataset initialization complete
  epoch    auprc    auroc    train_loss    valid_acc    valid_loss    cp      dur
-------  -------  -------  ------------  -----------  ------------  ----  -------
      1   [36m0.1412[0m   [32m0.4428[0m        [35m0.7104[0m       [31m0.2430[0m        [94m0.7177[0m     +  18.5514
      2   0.1202   0.4222        [35m0.7064[0m       [31m0.3144[0m        [94m0.7089[0m     +  19.0596
      3   0.0906   0.3979        [35m0.6960[0m       [31m0.3930[0m        [94m0.6977[0m     +  18.9449
      4   0.0792   0.3706        [35m0.6866[0m       [31m0.4788[0m        [94m0.6850[0m     +  19.2102
      5   0.0692   0.3490        [35m0.6727[0m       [31m0.5889[0m        [94m0.6712[0m     +  18.9117
      6   0.0675   0.3350        [35m0.6618[0m       [31m0.7497[0m        [94m0.6564[0m     +  19.1357
      7   0.0663   0.3225        [35m0.6487[0m       [31m0.8597[0m        [94m0.6412[0m     +  18.9796
      8   0.0662   0.3135        [35m0.6346[0m       [31m0.9057[0m        [94m0.6258[0m     +  18.9111
      9   0.0683   0.3082        [35m0.6214[0m       [31m0.9117[0m        [94m0.6102[0m     +  18.6343
     10   0.0682   0.3042        [35m0.6072[0m       0.9117        [94m0.5948[0m     +  18.8944
     11   0.0682   0.3006        [35m0.5941[0m       0.9117        [94m0.5796[0m     +  19.1551
     12   0.0683   0.2991        [35m0.5811[0m       0.9117        [94m0.5647[0m     +  19.2493
     13   0.0689   0.2989        [35m0.5651[0m       0.9117        [94m0.5501[0m     +  19.0596
     14   0.0692   0.2987        [35m0.5528[0m       0.9117        [94m0.5363[0m     +  19.1258
     15   0.0697   0.2990        [35m0.5407[0m       0.9117        [94m0.5229[0m     +  19.1232
     16   0.0701   0.2986        [35m0.5268[0m       0.9117        [94m0.5102[0m     +  18.9614
     17   0.0705   0.2990        [35m0.5161[0m       0.9117        [94m0.4981[0m     +  18.8724
     18   0.0705   0.2987        [35m0.5039[0m       0.9117        [94m0.4868[0m     +  19.2478
     19   0.0707   0.2993        [35m0.4924[0m       0.9117        [94m0.4761[0m     +  19.0231
     20   0.0711   0.3003        [35m0.4815[0m       0.9117        [94m0.4659[0m     +  18.9928
     21   0.0712   0.3017        [35m0.4698[0m       0.9117        [94m0.4564[0m     +  19.2101
     22   0.0714   0.3039        [35m0.4615[0m       0.9117        [94m0.4474[0m     +  18.9067
     23   0.0716   0.3065        [35m0.4511[0m       0.9117        [94m0.4390[0m     +  18.9038
     24   0.0719   0.3095        [35m0.4424[0m       0.9117        [94m0.4311[0m     +  18.8539
     25   0.0723   0.3124        [35m0.4352[0m       0.9117        [94m0.4236[0m     +  19.0590
     26   0.0729   0.3166        [35m0.4262[0m       0.9117        [94m0.4165[0m     +  18.9024
     27   0.0734   0.3204        [35m0.4203[0m       0.9117        [94m0.4099[0m     +  18.9994
     28   0.0740   0.3248        [35m0.4122[0m       0.9117        [94m0.4035[0m     +  18.9711
     29   0.0743   0.3289        [35m0.4065[0m       0.9117        [94m0.3976[0m     +  18.9548
     30   0.0752   0.3337        [35m0.4016[0m       0.9117        [94m0.3920[0m     +  18.7954
     31   0.0757   0.3388        [35m0.3930[0m       0.9117        [94m0.3866[0m     +  18.9582
     32   0.0764   0.3444        [35m0.3876[0m       0.9117        [94m0.3816[0m     +  18.9055
     33   0.0767   0.3507        [35m0.3839[0m       0.9117        [94m0.3769[0m     +  19.3675
     34   0.0773   0.3570        [35m0.3786[0m       0.9117        [94m0.3724[0m     +  19.0794
     35   0.0778   0.3629        [35m0.3748[0m       0.9117        [94m0.3683[0m     +  18.9613
     36   0.0782   0.3688        [35m0.3701[0m       0.9117        [94m0.3642[0m     +  19.0119
     37   0.0788   0.3755        [35m0.3654[0m       0.9117        [94m0.3605[0m     +  18.9420
     38   0.0789   0.3809        [35m0.3612[0m       0.9117        [94m0.3569[0m     +  18.7958
     39   0.0796   0.3879        [35m0.3572[0m       0.9117        [94m0.3534[0m     +  18.9453
     40   0.0870   0.3940        [35m0.3526[0m       0.9117        [94m0.3503[0m     +  18.9066
     41   0.0877   0.4002        [35m0.3492[0m       0.9117        [94m0.3472[0m     +  19.0074
     42   0.0885   0.4069        [35m0.3455[0m       0.9117        [94m0.3443[0m     +  19.2434
     43   0.0894   0.4139        [35m0.3427[0m       0.9117        [94m0.3415[0m     +  18.9510
     44   0.0902   0.4210        [35m0.3397[0m       0.9117        [94m0.3389[0m     +  19.0001
     45   0.0914   0.4289        [35m0.3373[0m       0.9117        [94m0.3363[0m     +  18.6422
     46   0.0924   0.4363        [35m0.3334[0m       0.9117        [94m0.3339[0m     +  19.3014
     47   0.0934   0.4426        [35m0.3296[0m       0.9117        [94m0.3316[0m     +  18.7743
     48   0.0947   [32m0.4497[0m        [35m0.3285[0m       0.9117        [94m0.3294[0m     +  19.1508
     49   0.0961   [32m0.4573[0m        [35m0.3248[0m       0.9117        [94m0.3272[0m     +  18.8702
     50   0.0976   [32m0.4646[0m        [35m0.3219[0m       0.9117        [94m0.3251[0m     +  19.1141
[32m[I 2023-05-05 03:15:25,352][0m Trial 536 finished with value: 0.32511412765844266 and parameters: {'lr': 1.0232557907072572e-06, 'dropout': 0.5367009299731346, 'd_model_multiplier': 1, 'num_layers': 5, 'n_heads': 32, 'dim_feedforward': 366, 'batch_size': 64, 'pos_encoding': 'fixed', 'activation': 'relu', 'norm': 'LayerNorm', 'optimizer_name': 'PlainRAdam', 'weight_decay': 0.1, 'top_n_features': 68}. Best is trial 246 with value: 0.16447311791139763.[0m
[FileBasedDataset] Initializing dataset...
	Examples: 8264
	Features: 198
	Max length: 315
Standard scalar turned ON, loading params from cache
[FileBasedDataset] Dataset initialization complete
  epoch    auprc    auroc    train_loss    valid_acc    valid_loss    cp     dur
-------  -------  -------  ------------  -----------  ------------  ----  ------
      1   [36m0.0779[0m   [32m0.3931[0m        [35m0.7067[0m       [31m0.7267[0m        [94m0.6697[0m     +  9.8644
      2   0.0602   0.3547        [35m0.6447[0m       [31m0.9250[0m        [94m0.6215[0m     +  9.9041
      3   0.0580   0.3421        [35m0.5627[0m       [31m0.9311[0m        [94m0.5687[0m     +  9.8448
      4   0.0544   0.3400        [35m0.4886[0m       0.9311        [94m0.5181[0m     +  10.4451
      5   0.0533   0.3473        [35m0.4301[0m       0.9311        [94m0.4721[0m     +  10.1926
      6   0.0540   0.3678        [35m0.3856[0m       0.9311        [94m0.4327[0m     +  9.9013
      7   0.0567   [32m0.3963[0m        [35m0.3521[0m       0.9311        [94m0.4006[0m     +  10.2766
      8   0.0682   [32m0.4349[0m        [35m0.3260[0m       0.9311        [94m0.3738[0m     +  10.2012
      9   0.0734   [32m0.4749[0m        [35m0.3082[0m       0.9311        [94m0.3525[0m     +  10.3288
     10   [36m0.0792[0m   [32m0.5158[0m        [35m0.2943[0m       0.9311        [94m0.3359[0m     +  10.0544
     11   [36m0.0933[0m   [32m0.5525[0m        [35m0.2843[0m       0.9311        [94m0.3230[0m     +  9.9736
     12   [36m0.1042[0m   [32m0.5805[0m        [35m0.2780[0m       0.9311        [94m0.3128[0m     +  10.0497
     13   [36m0.1164[0m   [32m0.6018[0m        [35m0.2728[0m       0.9311        [94m0.3042[0m     +  10.3531
     14   [36m0.1262[0m   [32m0.6182[0m        [35m0.2701[0m       0.9311        [94m0.2970[0m     +  10.3297
     15   [36m0.1338[0m   [32m0.6329[0m        [35m0.2638[0m       0.9299        [94m0.2905[0m     +  10.1440
     16   [36m0.1436[0m   [32m0.6470[0m        [35m0.2619[0m       0.9299        [94m0.2862[0m     +  10.1501
     17   [36m0.1529[0m   [32m0.6578[0m        [35m0.2599[0m       0.9299        [94m0.2815[0m     +  10.4312
     18   [36m0.1618[0m   [32m0.6650[0m        [35m0.2584[0m       0.9299        [94m0.2773[0m     +  10.3253
     19   [36m0.1700[0m   [32m0.6723[0m        [35m0.2566[0m       0.9299        [94m0.2742[0m     +  10.2600
     20   [36m0.1808[0m   [32m0.6776[0m        [35m0.2555[0m       0.9299        [94m0.2721[0m     +  10.4139
     21   [36m0.1869[0m   [32m0.6833[0m        [35m0.2533[0m       0.9299        [94m0.2695[0m     +  10.2840
     22   [36m0.1904[0m   [32m0.6877[0m        0.2545       0.9299        [94m0.2674[0m     +  10.0982
     23   [36m0.1978[0m   [32m0.6926[0m        [35m0.2518[0m       0.9299        [94m0.2663[0m     +  9.9060
     24   [36m0.2038[0m   [32m0.6955[0m        [35m0.2500[0m       0.9299        [94m0.2646[0m     +  9.9061
     25   [36m0.2067[0m   [32m0.6979[0m        [35m0.2496[0m       0.9299        [94m0.2624[0m     +  10.1304
     26   [36m0.2082[0m   [32m0.7004[0m        0.2520       0.9299        [94m0.2612[0m     +  10.2162
     27   [36m0.2089[0m   [32m0.7033[0m        [35m0.2491[0m       0.9299        [94m0.2606[0m     +  10.0446
     28   [36m0.2102[0m   [32m0.7057[0m        0.2495       0.9287        [94m0.2594[0m     +  10.1622
     29   [36m0.2112[0m   [32m0.7063[0m        0.2514       0.9287        [94m0.2582[0m     +  10.0959
     30   0.2110   [32m0.7079[0m        [35m0.2478[0m       0.9287        [94m0.2571[0m     +  10.1356
     31   [36m0.2131[0m   [32m0.7100[0m        0.2490       0.9287        [94m0.2568[0m     +  10.2465
     32   [36m0.2140[0m   [32m0.7125[0m        0.2490       0.9287        [94m0.2558[0m     +  10.3097
     33   [36m0.2159[0m   [32m0.7140[0m        0.2481       0.9287        [94m0.2553[0m     +  9.9009
     34   [36m0.2181[0m   [32m0.7155[0m        [35m0.2470[0m       0.9287        [94m0.2544[0m     +  9.9097
     35   [36m0.2188[0m   [32m0.7171[0m        [35m0.2452[0m       0.9299        [94m0.2541[0m     +  10.1276
     36   [36m0.2194[0m   [32m0.7179[0m        0.2459       0.9299        [94m0.2540[0m     +  9.7992
     37   [36m0.2197[0m   [32m0.7190[0m        0.2464       0.9299        [94m0.2533[0m     +  10.3653
     38   [36m0.2205[0m   [32m0.7203[0m        0.2462       0.9299        [94m0.2527[0m     +  9.9814
     39   [36m0.2208[0m   [32m0.7219[0m        0.2466       0.9299        [94m0.2521[0m     +  10.0078
     40   [36m0.2218[0m   [32m0.7233[0m        [35m0.2449[0m       0.9299        0.2525        10.1910
     41   [36m0.2219[0m   [32m0.7239[0m        0.2455       0.9299        [94m0.2516[0m     +  10.0605
     42   [36m0.2228[0m   [32m0.7249[0m        0.2452       0.9299        [94m0.2515[0m     +  10.1499
     43   0.2217   [32m0.7254[0m        [35m0.2436[0m       0.9299        [94m0.2514[0m     +  9.8822
     44   0.2224   [32m0.7271[0m        0.2450       0.9299        [94m0.2507[0m     +  10.0470
     45   [36m0.2240[0m   [32m0.7279[0m        0.2464       0.9299        [94m0.2505[0m     +  10.0535
     46   0.2237   [32m0.7290[0m        0.2450       0.9299        [94m0.2501[0m     +  10.1791
     47   [36m0.2244[0m   [32m0.7298[0m        [35m0.2431[0m       0.9299        [94m0.2500[0m     +  9.9599
     48   [36m0.2250[0m   [32m0.7305[0m        [35m0.2423[0m       0.9299        [94m0.2495[0m     +  10.0629
     49   [36m0.2257[0m   [32m0.7318[0m        0.2434       0.9299        0.2496        10.3027
     50   [36m0.2264[0m   [32m0.7324[0m        [35m0.2423[0m       0.9299        [94m0.2493[0m     +  10.2220
[32m[I 2023-05-05 03:23:55,747][0m Trial 537 finished with value: 0.24931455254915116 and parameters: {'lr': 1.4193791424754464e-06, 'dropout': 0.36820512897256225, 'd_model_multiplier': 8, 'num_layers': 1, 'n_heads': 32, 'dim_feedforward': 331, 'batch_size': 54, 'pos_encoding': 'fixed', 'activation': 'gelu', 'norm': 'BatchNorm', 'optimizer_name': 'RAdam', 'weight_decay': 0.1, 'top_n_features': 198}. Best is trial 246 with value: 0.16447311791139763.[0m
[FileBasedDataset] Initializing dataset...
	Examples: 8264
	Features: 57
	Max length: 315
Standard scalar turned ON, loading params from cache
[FileBasedDataset] Dataset initialization complete
  epoch    auprc    auroc    train_loss    valid_acc    valid_loss    cp      dur
-------  -------  -------  ------------  -----------  ------------  ----  -------
      1   [36m0.2461[0m   [32m0.7496[0m        [35m0.3153[0m       [31m0.9154[0m        [94m0.2660[0m     +  26.7692
      2   0.2044   0.6732        [35m0.2724[0m       0.9141        0.2763        26.7610
      3   0.2056   0.6787        [35m0.2593[0m       0.9129        0.2836        26.9069
      4   0.2061   0.6843        [35m0.2559[0m       0.9154        0.2957        26.7367
      5   0.1924   0.6820        [35m0.2549[0m       0.9154        0.2968        26.8810
      6   0.1991   0.6858        [35m0.2537[0m       0.9154        0.2933        26.9386
      7   0.1966   0.6835        [35m0.2514[0m       0.9154        0.2914        26.9446
      8   0.1983   0.6853        0.2524       0.9141        0.2931        26.9134
      9   0.1951   0.6820        0.2519       0.9141        0.2909        26.8950
     10   0.2026   0.6848        0.2523       [31m0.9166[0m        0.2872        26.9174
Stopping since valid_loss has not improved in the last 10 epochs.
[32m[I 2023-05-05 03:28:51,622][0m Trial 538 finished with value: 0.2659773157037876 and parameters: {'lr': 0.000892063139451751, 'dropout': 0.3240065847407292, 'd_model_multiplier': 4, 'num_layers': 3, 'n_heads': 64, 'dim_feedforward': 404, 'batch_size': 23, 'pos_encoding': 'fixed', 'activation': 'relu', 'norm': 'LayerNorm', 'optimizer_name': 'AdamW', 'weight_decay': 0.1, 'top_n_features': 57}. Best is trial 246 with value: 0.16447311791139763.[0m
[FileBasedDataset] Initializing dataset...
	Examples: 8264
	Features: 60
	Max length: 315
Standard scalar turned ON, loading params from cache
[FileBasedDataset] Dataset initialization complete
  epoch    auprc    auroc    train_loss    valid_acc    valid_loss    cp      dur
-------  -------  -------  ------------  -----------  ------------  ----  -------
      1   [36m0.0571[0m   [32m0.3457[0m        [35m0.6070[0m       [31m0.9287[0m        [94m0.5076[0m     +  20.0109
      2   [36m0.0823[0m   [32m0.3936[0m        [35m0.4442[0m       0.9287        [94m0.3446[0m     +  19.7710
      3   [36m0.1209[0m   [32m0.5945[0m        [35m0.3330[0m       0.9287        [94m0.2687[0m     +  19.8515
      4   [36m0.2203[0m   [32m0.6746[0m        [35m0.2842[0m       0.9287        [94m0.2435[0m     +  19.9667
      5   [36m0.2400[0m   [32m0.7047[0m        [35m0.2647[0m       0.9287        [94m0.2334[0m     +  19.8581
      6   [36m0.2488[0m   [32m0.7218[0m        [35m0.2535[0m       0.9287        [94m0.2286[0m     +  20.0376
      7   [36m0.2646[0m   [32m0.7376[0m        [35m0.2482[0m       [31m0.9299[0m        [94m0.2256[0m     +  19.8054
      8   [36m0.2755[0m   [32m0.7487[0m        [35m0.2430[0m       0.9299        [94m0.2238[0m     +  19.7172
      9   [36m0.2843[0m   [32m0.7586[0m        [35m0.2404[0m       [31m0.9311[0m        [94m0.2224[0m     +  19.8249
     10   [36m0.2968[0m   [32m0.7651[0m        [35m0.2383[0m       [31m0.9335[0m        [94m0.2212[0m     +  20.0155
     11   [36m0.3000[0m   [32m0.7705[0m        [35m0.2359[0m       0.9287        [94m0.2203[0m     +  19.7460
     12   [36m0.3053[0m   [32m0.7744[0m        [35m0.2351[0m       0.9287        [94m0.2195[0m     +  19.9085
     13   [36m0.3112[0m   [32m0.7780[0m        [35m0.2350[0m       0.9299        [94m0.2186[0m     +  19.7876
     14   [36m0.3155[0m   [32m0.7810[0m        [35m0.2338[0m       0.9311        [94m0.2179[0m     +  19.9346
     15   [36m0.3162[0m   [32m0.7829[0m        [35m0.2332[0m       0.9311        [94m0.2172[0m     +  20.0208
     16   0.3153   [32m0.7845[0m        0.2339       0.9311        [94m0.2166[0m     +  19.9340
     17   0.3133   [32m0.7862[0m        [35m0.2318[0m       0.9299        [94m0.2162[0m     +  19.8270
     18   0.3143   [32m0.7884[0m        0.2326       0.9299        [94m0.2159[0m     +  19.9637
     19   0.3152   [32m0.7896[0m        [35m0.2317[0m       0.9299        [94m0.2155[0m     +  20.5855
     20   0.3161   [32m0.7911[0m        [35m0.2310[0m       0.9287        [94m0.2150[0m     +  19.7695
     21   [36m0.3171[0m   [32m0.7922[0m        [35m0.2297[0m       0.9274        [94m0.2146[0m     +  19.8851
     22   0.3136   [32m0.7933[0m        0.2301       0.9274        [94m0.2145[0m     +  19.7840
     23   0.3149   [32m0.7952[0m        [35m0.2293[0m       0.9287        [94m0.2142[0m     +  19.7889
     24   0.3135   [32m0.7959[0m        0.2299       0.9274        [94m0.2139[0m     +  19.8963
     25   0.3140   [32m0.7972[0m        [35m0.2284[0m       0.9274        [94m0.2138[0m     +  19.9059
     26   0.3090   [32m0.7980[0m        [35m0.2282[0m       0.9250        [94m0.2137[0m     +  19.7356
     27   0.3058   [32m0.7988[0m        0.2293       0.9250        0.2137        19.6929
     28   0.3079   [32m0.8009[0m        0.2287       0.9262        [94m0.2133[0m     +  19.6648
     29   0.3072   [32m0.8015[0m        [35m0.2276[0m       0.9238        0.2133        19.7676
     30   0.3089   [32m0.8025[0m        0.2277       0.9250        [94m0.2131[0m     +  19.9009
     31   0.3101   [32m0.8036[0m        [35m0.2269[0m       0.9250        [94m0.2126[0m     +  19.7020
     32   0.2996   [32m0.8040[0m        0.2272       0.9250        0.2130        19.9165
     33   0.3005   [32m0.8052[0m        0.2272       0.9262        0.2130        19.7932
     34   0.3003   [32m0.8059[0m        [35m0.2265[0m       0.9250        0.2129        19.9082
     35   0.2993   [32m0.8061[0m        [35m0.2258[0m       0.9262        0.2132        19.9591
     36   0.3002   [32m0.8073[0m        0.2264       0.9274        0.2132        19.9165
     37   0.3023   [32m0.8082[0m        [35m0.2240[0m       0.9250        0.2133        19.8436
     38   0.3010   [32m0.8085[0m        0.2261       0.9262        0.2130        19.7750
     39   0.3014   [32m0.8093[0m        0.2251       0.9262        0.2127        19.7018
     40   0.3003   [32m0.8100[0m        0.2250       0.9250        0.2134        19.8229
Stopping since valid_loss has not improved in the last 10 epochs.
[32m[I 2023-05-05 03:42:29,041][0m Trial 539 finished with value: 0.21256487669722776 and parameters: {'lr': 7.5541980910898266e-06, 'dropout': 0.34036384744760373, 'd_model_multiplier': 4, 'num_layers': 4, 'n_heads': 32, 'dim_feedforward': 346, 'batch_size': 46, 'pos_encoding': 'fixed', 'activation': 'relu', 'norm': 'LayerNorm', 'optimizer_name': 'RAdam', 'weight_decay': 0, 'top_n_features': 60}. Best is trial 246 with value: 0.16447311791139763.[0m
[FileBasedDataset] Initializing dataset...
	Examples: 8264
	Features: 52
	Max length: 315
Standard scalar turned ON, loading params from cache
[FileBasedDataset] Dataset initialization complete
  epoch    auprc    auroc    train_loss    valid_acc    valid_loss    cp      dur
-------  -------  -------  ------------  -----------  ------------  ----  -------
      1   [36m0.2617[0m   [32m0.6927[0m        [35m0.3827[0m       [31m0.9045[0m        [94m0.2911[0m     +  18.5039
      2   [36m0.3946[0m   [32m0.7604[0m        [35m0.2465[0m       [31m0.9081[0m        [94m0.2672[0m     +  19.0868
      3   0.3940   [32m0.7830[0m        [35m0.2372[0m       [31m0.9166[0m        [94m0.2601[0m     +  19.6071
      4   [36m0.4027[0m   [32m0.7907[0m        [35m0.2333[0m       0.9154        [94m0.2597[0m     +  18.8264
      5   0.3979   0.7898        [35m0.2315[0m       0.9141        0.2608        18.6393
      6   0.3745   0.7864        [35m0.2302[0m       0.9129        0.2669        18.9221
      7   0.3899   [32m0.7933[0m        0.2305       [31m0.9190[0m        0.2638        18.8320
      8   0.3721   0.7916        [35m0.2296[0m       0.9105        0.2680        19.0092
      9   0.3761   0.7925        0.2306       0.9129        0.2684        19.0282
     10   0.3723   [32m0.7947[0m        0.2297       0.9141        0.2683        19.2108
     11   0.3777   0.7934        [35m0.2253[0m       0.9105        0.2712        19.1495
     12   0.3650   0.7900        0.2290       0.9093        0.2752        19.0700
     13   0.3751   0.7923        0.2273       0.9141        0.2814        19.0481
Stopping since valid_loss has not improved in the last 10 epochs.
