[32m[I 2023-05-05 11:55:48,078][0m Trial 611 finished with value: 0.22055425369681875 and parameters: {'lr': 0.0019018458006026312, 'dropout': 0.2502281956183293, 'd_model_multiplier': 4, 'num_layers': 1, 'n_heads': 32, 'dim_feedforward': 164, 'batch_size': 38, 'pos_encoding': 'fixed', 'activation': 'relu', 'norm': 'LayerNorm', 'optimizer_name': 'RAdam', 'weight_decay': 0.1, 'top_n_features': 168}. Best is trial 246 with value: 0.16447311791139763.[0m
[FileBasedDataset] Initializing dataset...
	Examples: 8264
	Features: 148
	Max length: 315
Standard scalar turned ON, loading params from cache
[FileBasedDataset] Dataset initialization complete
  epoch    auprc    auroc    train_loss    valid_acc    valid_loss    cp      dur
-------  -------  -------  ------------  -----------  ------------  ----  -------
      1   [36m0.0768[0m   [32m0.4388[0m        [35m0.6508[0m       [31m0.9262[0m        [94m0.5974[0m     +  10.8173
      2   0.0622   0.3494        [35m0.5462[0m       [31m0.9287[0m        [94m0.4796[0m     +  10.7359
      3   0.0587   0.3342        [35m0.4543[0m       0.9287        [94m0.3962[0m     +  11.1450
      4   0.0630   0.3444        [35m0.3875[0m       0.9287        [94m0.3372[0m     +  11.2436
      5   0.0693   0.3819        [35m0.3464[0m       0.9287        [94m0.3034[0m     +  10.9919
      6   [36m0.0790[0m   [32m0.4692[0m        [35m0.3182[0m       0.9287        [94m0.2829[0m     +  10.7344
      7   [36m0.0974[0m   [32m0.5248[0m        [35m0.2995[0m       0.9287        [94m0.2700[0m     +  11.1753
      8   [36m0.1134[0m   [32m0.5738[0m        [35m0.2883[0m       0.9287        [94m0.2616[0m     +  11.0465
      9   [36m0.1269[0m   [32m0.6080[0m        [35m0.2826[0m       0.9287        [94m0.2555[0m     +  10.9744
     10   [36m0.1376[0m   [32m0.6343[0m        [35m0.2752[0m       0.9287        [94m0.2512[0m     +  10.8754
     11   [36m0.1446[0m   [32m0.6454[0m        [35m0.2703[0m       0.9287        [94m0.2481[0m     +  11.1359
     12   [36m0.1491[0m   [32m0.6526[0m        [35m0.2695[0m       0.9287        [94m0.2460[0m     +  11.0400
     13   [36m0.1649[0m   [32m0.6603[0m        [35m0.2659[0m       0.9287        [94m0.2443[0m     +  11.0603
     14   [36m0.1662[0m   [32m0.6642[0m        [35m0.2635[0m       0.9287        [94m0.2428[0m     +  11.0130
     15   0.1592   [32m0.6680[0m        0.2640       0.9287        [94m0.2418[0m     +  11.1398
     16   [36m0.1702[0m   [32m0.6741[0m        [35m0.2629[0m       0.9287        [94m0.2409[0m     +  10.8603
     17   [36m0.1704[0m   [32m0.6754[0m        [35m0.2619[0m       0.9287        [94m0.2401[0m     +  10.9491
     18   [36m0.1710[0m   [32m0.6783[0m        [35m0.2606[0m       0.9287        [94m0.2396[0m     +  11.0834
     19   [36m0.1750[0m   [32m0.6807[0m        [35m0.2601[0m       0.9287        [94m0.2390[0m     +  10.9140
     20   0.1748   [32m0.6826[0m        [35m0.2582[0m       0.9287        [94m0.2386[0m     +  10.9800
     21   [36m0.1772[0m   [32m0.6879[0m        0.2586       0.9287        [94m0.2382[0m     +  11.0106
     22   0.1640   [32m0.6899[0m        [35m0.2575[0m       0.9287        [94m0.2380[0m     +  10.9080
     23   0.1635   [32m0.6946[0m        [35m0.2573[0m       0.9287        [94m0.2377[0m     +  10.7849
     24   0.1659   [32m0.6968[0m        0.2602       0.9287        [94m0.2374[0m     +  10.7282
     25   0.1661   [32m0.7030[0m        0.2598       0.9287        [94m0.2374[0m     +  10.9837
     26   0.1660   0.7022        [35m0.2563[0m       0.9287        [94m0.2373[0m     +  10.7843
     27   0.1660   [32m0.7048[0m        0.2575       0.9287        [94m0.2370[0m     +  10.8684
     28   0.1699   [32m0.7089[0m        0.2569       0.9287        [94m0.2368[0m     +  10.8155
     29   0.1720   [32m0.7098[0m        0.2589       0.9287        [94m0.2367[0m     +  11.1358
     30   0.1726   [32m0.7111[0m        0.2568       0.9287        [94m0.2364[0m     +  11.0939
     31   0.1687   [32m0.7144[0m        [35m0.2562[0m       0.9287        [94m0.2364[0m     +  10.7362
     32   0.1710   [32m0.7146[0m        0.2572       0.9287        [94m0.2363[0m     +  10.8785
     33   0.1741   [32m0.7151[0m        0.2564       0.9287        [94m0.2362[0m     +  10.9860
     34   0.1762   [32m0.7191[0m        0.2580       0.9287        [94m0.2360[0m     +  11.2679
     35   0.1762   [32m0.7217[0m        0.2581       0.9287        0.2360        10.9676
     36   0.1770   [32m0.7218[0m        0.2574       0.9287        [94m0.2358[0m     +  11.0536
     37   0.1765   [32m0.7251[0m        0.2570       0.9287        [94m0.2356[0m     +  11.0117
     38   [36m0.1810[0m   [32m0.7282[0m        0.2566       0.9287        [94m0.2355[0m     +  11.0523
     39   [36m0.1811[0m   0.7279        0.2573       0.9287        0.2355        10.6730
     40   0.1801   [32m0.7287[0m        [35m0.2550[0m       0.9287        [94m0.2354[0m     +  10.8669
     41   0.1808   [32m0.7310[0m        0.2585       0.9287        [94m0.2353[0m     +  10.8116
     42   0.1788   [32m0.7354[0m        [35m0.2534[0m       0.9287        [94m0.2351[0m     +  10.9253
     43   [36m0.1814[0m   [32m0.7380[0m        0.2564       0.9287        [94m0.2348[0m     +  10.9819
     44   [36m0.1916[0m   [32m0.7422[0m        0.2539       0.9287        [94m0.2343[0m     +  10.9739
     45   0.1808   [32m0.7451[0m        0.2544       0.9287        [94m0.2341[0m     +  10.8600
     46   0.1837   [32m0.7503[0m        0.2560       0.9287        [94m0.2335[0m     +  10.8918
     47   0.1881   [32m0.7514[0m        [35m0.2534[0m       0.9287        [94m0.2331[0m     +  10.9698
     48   [36m0.1969[0m   [32m0.7578[0m        [35m0.2525[0m       0.9287        [94m0.2327[0m     +  11.1893
     49   0.1866   [32m0.7592[0m        0.2533       0.9287        [94m0.2324[0m     +  10.8286
     50   0.1862   [32m0.7617[0m        [35m0.2524[0m       0.9287        [94m0.2319[0m     +  11.0585
[32m[I 2023-05-05 12:05:01,693][0m Trial 612 finished with value: 0.23191094594898362 and parameters: {'lr': 3.1118343044199617e-05, 'dropout': 0.4199130708207631, 'd_model_multiplier': 1, 'num_layers': 5, 'n_heads': 4, 'dim_feedforward': 402, 'batch_size': 20, 'pos_encoding': 'fixed', 'activation': 'relu', 'norm': 'LayerNorm', 'optimizer_name': 'RAdam', 'weight_decay': 0.1, 'top_n_features': 148}. Best is trial 246 with value: 0.16447311791139763.[0m
[FileBasedDataset] Initializing dataset...
	Examples: 8264
	Features: 115
	Max length: 315
Standard scalar turned ON, loading params from cache
[FileBasedDataset] Dataset initialization complete
  epoch    auprc    auroc    train_loss    valid_acc    valid_loss    cp      dur
-------  -------  -------  ------------  -----------  ------------  ----  -------
      1   [36m0.2480[0m   [32m0.8133[0m        [35m0.2756[0m       [31m0.9190[0m        [94m0.2169[0m     +  19.6636
      2   [36m0.2612[0m   [32m0.8380[0m        [35m0.2636[0m       [31m0.9347[0m        [94m0.1975[0m     +  20.3387
      3   0.2421   0.8152        [35m0.2543[0m       [31m0.9359[0m        0.2000        20.0953
      4   0.2300   0.8166        [35m0.2513[0m       [31m0.9395[0m        [94m0.1953[0m     +  20.2626
      5   [36m0.2643[0m   0.8255        [35m0.2465[0m       0.9311        [94m0.1952[0m     +  20.2048
      6   [36m0.2721[0m   [32m0.8429[0m        0.2485       [31m0.9456[0m        [94m0.1739[0m     +  20.0185
      7   0.2269   0.8140        [35m0.2437[0m       0.9407        0.1930        20.1063
      8   0.2514   0.8095        0.2447       0.9444        0.1933        20.1642
      9   0.2410   0.8131        0.2505       0.9395        0.1856        20.1091
     10   0.2357   0.8051        0.2585       0.9407        0.1825        20.2623
     11   0.2272   0.8074        0.2603       0.9407        0.1813        20.3351
     12   0.2401   0.8258        0.2586       0.9407        0.1784        21.2808
     13   0.2531   0.8266        0.2491       0.9395        0.1749        20.4768
     14   0.2475   [32m0.8606[0m        0.2462       0.9250        0.1833        20.2437
     15   0.2207   0.8121        0.2530       0.9444        0.2042        20.1513
Stopping since valid_loss has not improved in the last 10 epochs.
[32m[I 2023-05-05 12:10:26,217][0m Trial 613 finished with value: 0.17388480932349307 and parameters: {'lr': 0.00321880894156341, 'dropout': 0.4572503814253615, 'd_model_multiplier': 4, 'num_layers': 4, 'n_heads': 32, 'dim_feedforward': 183, 'batch_size': 69, 'pos_encoding': 'fixed', 'activation': 'relu', 'norm': 'LayerNorm', 'optimizer_name': 'RAdam', 'weight_decay': 0.1, 'top_n_features': 115}. Best is trial 246 with value: 0.16447311791139763.[0m
[FileBasedDataset] Initializing dataset...
	Examples: 8264
	Features: 98
	Max length: 315
Standard scalar turned ON, loading params from cache
[FileBasedDataset] Dataset initialization complete
  epoch    auprc    auroc    train_loss    valid_acc    valid_loss    cp      dur
-------  -------  -------  ------------  -----------  ------------  ----  -------
      1   [36m0.2385[0m   [32m0.7093[0m        [35m0.2747[0m       [31m0.9347[0m        [94m0.2472[0m     +  20.2390
      2   [36m0.2795[0m   [32m0.7465[0m        [35m0.2615[0m       0.9347        [94m0.2351[0m     +  20.0798
      3   0.2325   [32m0.7755[0m        [35m0.2551[0m       0.9287        [94m0.2120[0m     +  20.7703
      4   0.2264   [32m0.7844[0m        [35m0.2538[0m       0.9238        0.2219        20.2889
      5   0.2525   [32m0.7870[0m        [35m0.2491[0m       0.9323        [94m0.2105[0m     +  20.2549
      6   [36m0.3240[0m   0.7867        [35m0.2437[0m       0.9335        [94m0.2090[0m     +  20.5129
      7   0.2915   0.7849        0.2468       0.9347        0.2111        20.6448
      8   0.2680   0.7829        [35m0.2422[0m       0.9274        0.2251        20.3173
      9   0.3039   0.7836        [35m0.2411[0m       0.9274        0.2189        20.7208
     10   0.2100   0.7435        0.2468       0.9105        0.2390        20.6054
     11   0.2131   0.7425        0.2433       0.9190        0.2328        20.3873
     12   0.1945   0.7179        0.2579       0.9299        0.2279        20.2709
     13   0.1926   0.7162        0.2556       0.9262        0.2348        20.4916
     14   0.1883   0.7196        0.2565       0.9262        0.2326        20.1067
     15   0.1969   0.7180        0.2557       0.9311        0.2371        20.3942
Stopping since valid_loss has not improved in the last 10 epochs.
[32m[I 2023-05-05 12:15:53,420][0m Trial 614 finished with value: 0.20896398230143873 and parameters: {'lr': 0.0041696650700593614, 'dropout': 0.47447014268151705, 'd_model_multiplier': 4, 'num_layers': 4, 'n_heads': 32, 'dim_feedforward': 184, 'batch_size': 79, 'pos_encoding': 'learnable', 'activation': 'relu', 'norm': 'LayerNorm', 'optimizer_name': 'RAdam', 'weight_decay': 0.1, 'top_n_features': 98}. Best is trial 246 with value: 0.16447311791139763.[0m
[FileBasedDataset] Initializing dataset...
	Examples: 8264
	Features: 128
	Max length: 315
Standard scalar turned ON, loading params from cache
[FileBasedDataset] Dataset initialization complete
  epoch    auprc    auroc    train_loss    valid_acc    valid_loss    cp      dur
-------  -------  -------  ------------  -----------  ------------  ----  -------
      1   [36m0.2323[0m   [32m0.7115[0m        [35m0.2832[0m       [31m0.9250[0m        [94m0.2611[0m     +  20.3536
      2   [36m0.2422[0m   [32m0.7144[0m        [35m0.2578[0m       0.9238        0.2621        20.3476
      3   [36m0.2561[0m   0.6922        [35m0.2567[0m       0.9238        0.3082        20.8359
      4   0.1939   0.7093        [35m0.2545[0m       0.9141        0.3782        20.9198
      5   0.2133   0.7081        0.2570       0.9190        0.3470        20.9045
      6   0.2512   [32m0.7393[0m        0.2548       0.9238        [94m0.2435[0m     +  20.7593
      7   [36m0.2609[0m   [32m0.7465[0m        [35m0.2449[0m       0.9238        [94m0.2373[0m     +  21.9314
      8   0.2601   [32m0.7843[0m        [35m0.2387[0m       0.9202        [94m0.2316[0m     +  20.6813
      9   0.1993   0.7115        0.2405       0.8839        0.2918        20.7250
     10   0.2083   0.7252        0.2481       0.9238        0.2475        20.7838
     11   0.2422   0.7376        0.2757       0.9238        0.2468        20.8273
     12   0.2074   0.7415        0.2887       0.9190        0.2616        20.8318
     13   0.1880   0.7238        0.2821       0.9238        0.2539        20.9453
     14   0.1870   0.7236        0.2730       0.9214        0.2615        20.9078
     15   0.1919   0.7203        0.2701       0.9226        0.2520        20.8497
     16   0.1715   0.7193        0.2654       0.9238        0.2827        20.5893
     17   0.1831   0.7158        0.2642       0.9069        0.2807        20.6928
Stopping since valid_loss has not improved in the last 10 epochs.
[32m[I 2023-05-05 12:22:08,500][0m Trial 615 finished with value: 0.23157341403497028 and parameters: {'lr': 0.0030920683930648852, 'dropout': 0.45472985006390104, 'd_model_multiplier': 4, 'num_layers': 4, 'n_heads': 32, 'dim_feedforward': 201, 'batch_size': 70, 'pos_encoding': 'fixed', 'activation': 'gelu', 'norm': 'BatchNorm', 'optimizer_name': 'RAdam', 'weight_decay': 0.1, 'top_n_features': 128}. Best is trial 246 with value: 0.16447311791139763.[0m
[FileBasedDataset] Initializing dataset...
	Examples: 8264
	Features: 112
	Max length: 315
Standard scalar turned ON, loading params from cache
[FileBasedDataset] Dataset initialization complete
  epoch    auprc    auroc    train_loss    valid_acc    valid_loss    cp      dur
-------  -------  -------  ------------  -----------  ------------  ----  -------
      1   [36m0.2193[0m   [32m0.7243[0m        [35m0.2852[0m       [31m0.8912[0m        [94m0.3118[0m     +  34.5035
      2   [36m0.2273[0m   0.7002        [35m0.2728[0m       [31m0.9057[0m        0.3147        34.2884
      3   0.2234   0.6773        [35m0.2713[0m       [31m0.9069[0m        0.3661        35.0334
      4   [36m0.3192[0m   [32m0.7268[0m        [35m0.2566[0m       0.9069        0.3216        34.7948
      5   0.2595   [32m0.7271[0m        [35m0.2548[0m       0.9069        0.3369        34.6087
      6   0.2213   0.6789        [35m0.2513[0m       0.9069        0.3670        34.6107
      7   0.2251   0.6806        0.2521       0.9069        0.3480        34.4902
      8   0.2286   0.6864        0.2517       0.9069        0.3450        34.6775
      9   0.2218   0.6826        [35m0.2487[0m       0.9069        0.3384        34.5978
     10   0.2241   0.6845        0.2494       0.9069        0.3253        34.7782
Stopping since valid_loss has not improved in the last 10 epochs.
[32m[I 2023-05-05 12:28:29,740][0m Trial 616 finished with value: 0.3118120632984618 and parameters: {'lr': 0.005762835256916846, 'dropout': 0.4397951035342859, 'd_model_multiplier': 4, 'num_layers': 4, 'n_heads': 64, 'dim_feedforward': 167, 'batch_size': 83, 'pos_encoding': 'fixed', 'activation': 'relu', 'norm': 'LayerNorm', 'optimizer_name': 'RAdam', 'weight_decay': 0.1, 'top_n_features': 112}. Best is trial 246 with value: 0.16447311791139763.[0m
[FileBasedDataset] Initializing dataset...
	Examples: 8264
	Features: 108
	Max length: 315
Standard scalar turned ON, loading params from cache
[FileBasedDataset] Dataset initialization complete
  epoch    auprc    auroc    train_loss    valid_acc    valid_loss    cp      dur
-------  -------  -------  ------------  -----------  ------------  ----  -------
      1   [36m0.2980[0m   [32m0.7221[0m        [35m0.2660[0m       [31m0.9117[0m        [94m0.2750[0m     +  19.9603
      2   [36m0.3044[0m   [32m0.7304[0m        [35m0.2421[0m       0.9057        0.2840        20.2538
      3   0.2821   [32m0.7348[0m        0.2463       0.8972        0.2795        20.3950
      4   [36m0.3205[0m   [32m0.7390[0m        [35m0.2380[0m       0.8996        0.2771        20.8154
      5   0.2741   [32m0.7404[0m        0.2382       0.9093        [94m0.2706[0m     +  20.2227
      6   0.3176   [32m0.7447[0m        [35m0.2372[0m       0.9021        0.2746        20.2357
      7   0.2987   [32m0.7485[0m        [35m0.2311[0m       0.8984        0.2857        20.4923
      8   0.3190   [32m0.7558[0m        [35m0.2311[0m       0.9069        0.2772        20.5106
      9   0.2969   0.7455        [35m0.2274[0m       0.9021        0.2801        20.5555
     10   0.3064   0.7365        0.2286       0.9069        0.2924        20.4777
     11   [36m0.3213[0m   0.7479        0.2307       0.9033        0.2784        20.4645
     12   0.2795   0.7330        0.2307       0.9057        0.2824        20.4527
     13   0.3016   0.7345        [35m0.2272[0m       0.8960        0.2946        20.3969
     14   0.2976   0.7261        0.2288       0.9057        0.2787        20.4482
Stopping since valid_loss has not improved in the last 10 epochs.
