[32m[I 2023-05-04 14:45:44,354][0m Trial 455 finished with value: 0.36574314295020327 and parameters: {'lr': 1.3376969799048533e-07, 'dropout': 0.37437667769892463, 'd_model_multiplier': 4, 'num_layers': 5, 'n_heads': 32, 'dim_feedforward': 312, 'batch_size': 62, 'pos_encoding': 'fixed', 'activation': 'relu', 'norm': 'LayerNorm', 'optimizer_name': 'RAdam', 'weight_decay': 0.1, 'top_n_features': 71}. Best is trial 246 with value: 0.16447311791139763.[0m
[FileBasedDataset] Initializing dataset...
	Examples: 8264
	Features: 53
	Max length: 315
Standard scalar turned ON, loading params from cache
[FileBasedDataset] Dataset initialization complete
  epoch    auprc    auroc    train_loss    valid_acc    valid_loss    cp      dur
-------  -------  -------  ------------  -----------  ------------  ----  -------
      1   [36m0.0728[0m   [32m0.3458[0m        [35m0.6982[0m       [31m0.8549[0m        [94m0.6675[0m     +  10.4502
      2   0.0677   0.2722        [35m0.6528[0m       [31m0.9129[0m        [94m0.6025[0m     +  10.4382
      3   0.0666   0.2657        [35m0.5958[0m       0.9129        [94m0.5424[0m     +  10.3514
      4   0.0715   0.2703        [35m0.5418[0m       0.9129        [94m0.4937[0m     +  10.6271
      5   0.0709   0.2759        [35m0.4952[0m       0.9129        [94m0.4555[0m     +  10.9302
      6   0.0690   0.2782        [35m0.4596[0m       0.9129        [94m0.4269[0m     +  11.1168
      7   0.0695   0.2817        [35m0.4264[0m       0.9129        [94m0.4032[0m     +  10.5196
      8   0.0695   0.2899        [35m0.3993[0m       0.9129        [94m0.3836[0m     +  10.4622
      9   0.0706   0.2998        [35m0.3765[0m       0.9129        [94m0.3674[0m     +  10.5815
     10   0.0719   0.3192        [35m0.3592[0m       0.9129        [94m0.3521[0m     +  10.5480
     11   [36m0.0740[0m   [32m0.3470[0m        [35m0.3433[0m       0.9129        [94m0.3391[0m     +  10.6149
     12   [36m0.0776[0m   [32m0.3818[0m        [35m0.3310[0m       0.9129        [94m0.3282[0m     +  10.5150
     13   [36m0.0810[0m   [32m0.4156[0m        [35m0.3191[0m       0.9129        [94m0.3194[0m     +  10.7708
     14   [36m0.0878[0m   [32m0.4506[0m        [35m0.3088[0m       0.9129        [94m0.3121[0m     +  10.7227
     15   [36m0.1003[0m   [32m0.4857[0m        [35m0.3000[0m       0.9129        [94m0.3060[0m     +  10.8554
     16   [36m0.1194[0m   [32m0.5171[0m        [35m0.2949[0m       0.9129        [94m0.3008[0m     +  10.1646
     17   [36m0.1836[0m   [32m0.5476[0m        [35m0.2900[0m       0.9129        [94m0.2961[0m     +  10.6424
     18   [36m0.1938[0m   [32m0.5687[0m        [35m0.2869[0m       0.9129        [94m0.2925[0m     +  10.8455
     19   [36m0.1999[0m   [32m0.5873[0m        [35m0.2817[0m       0.9129        [94m0.2895[0m     +  10.9555
     20   [36m0.2109[0m   [32m0.6053[0m        [35m0.2786[0m       0.9129        [94m0.2866[0m     +  10.2105
     21   [36m0.2185[0m   [32m0.6205[0m        [35m0.2737[0m       0.9129        [94m0.2846[0m     +  10.3485
     22   [36m0.2267[0m   [32m0.6352[0m        [35m0.2731[0m       0.9129        [94m0.2826[0m     +  10.7490
     23   [36m0.2295[0m   [32m0.6437[0m        [35m0.2702[0m       0.9129        [94m0.2811[0m     +  11.1244
     24   [36m0.2374[0m   [32m0.6540[0m        [35m0.2673[0m       0.9129        [94m0.2795[0m     +  10.7311
     25   0.2362   [32m0.6600[0m        [35m0.2662[0m       0.9129        [94m0.2784[0m     +  11.1913
     26   [36m0.2494[0m   [32m0.6687[0m        [35m0.2639[0m       0.9129        [94m0.2774[0m     +  10.8576
     27   [36m0.2520[0m   [32m0.6737[0m        0.2654       0.9129        [94m0.2767[0m     +  10.7704
     28   [36m0.2600[0m   [32m0.6793[0m        [35m0.2638[0m       0.9129        [94m0.2759[0m     +  11.0580
     29   [36m0.2620[0m   [32m0.6836[0m        [35m0.2611[0m       0.9129        [94m0.2754[0m     +  10.5998
     30   [36m0.2628[0m   [32m0.6888[0m        0.2611       0.9129        [94m0.2745[0m     +  10.6504
     31   [36m0.2653[0m   [32m0.6936[0m        [35m0.2610[0m       0.9129        [94m0.2738[0m     +  11.0023
     32   [36m0.2667[0m   [32m0.6980[0m        [35m0.2601[0m       0.9129        [94m0.2734[0m     +  10.3441
     33   [36m0.2668[0m   [32m0.7027[0m        [35m0.2593[0m       0.9129        [94m0.2729[0m     +  10.5565
     34   0.2664   [32m0.7046[0m        [35m0.2581[0m       0.9129        [94m0.2727[0m     +  10.4925
     35   0.2662   [32m0.7073[0m        [35m0.2575[0m       0.9129        [94m0.2725[0m     +  10.8962
     36   0.2666   [32m0.7096[0m        0.2592       0.9129        [94m0.2722[0m     +  10.3516
     37   [36m0.2679[0m   [32m0.7129[0m        0.2580       0.9129        [94m0.2717[0m     +  10.9663
     38   [36m0.2679[0m   [32m0.7154[0m        [35m0.2544[0m       0.9129        [94m0.2714[0m     +  10.7542
     39   0.2665   [32m0.7184[0m        0.2575       0.9129        [94m0.2712[0m     +  10.8163
     40   0.2662   [32m0.7223[0m        0.2558       0.9129        [94m0.2707[0m     +  10.8296
     41   0.2647   [32m0.7244[0m        0.2570       0.9129        [94m0.2701[0m     +  10.4975
     42   [36m0.2688[0m   [32m0.7265[0m        0.2559       0.9129        [94m0.2697[0m     +  10.9221
     43   0.2649   [32m0.7283[0m        0.2555       0.9129        [94m0.2697[0m     +  11.0153
     44   0.2643   [32m0.7310[0m        0.2551       0.9129        [94m0.2692[0m     +  10.9234
     45   0.2662   [32m0.7334[0m        0.2544       0.9129        [94m0.2688[0m     +  10.9743
     46   0.2680   [32m0.7362[0m        [35m0.2535[0m       0.9129        [94m0.2684[0m     +  10.3340
     47   0.2675   [32m0.7393[0m        0.2550       0.9129        [94m0.2676[0m     +  10.7243
     48   [36m0.2701[0m   [32m0.7417[0m        [35m0.2531[0m       0.9129        [94m0.2674[0m     +  10.7389
     49   [36m0.2716[0m   [32m0.7442[0m        0.2554       0.9129        [94m0.2668[0m     +  10.6326
     50   [36m0.2746[0m   [32m0.7468[0m        0.2533       0.9129        [94m0.2660[0m     +  10.6063
[32m[I 2023-05-04 14:54:44,081][0m Trial 456 finished with value: 0.26601815866948325 and parameters: {'lr': 7.31388747201416e-06, 'dropout': 0.5648922879374294, 'd_model_multiplier': 4, 'num_layers': 7, 'n_heads': 4, 'dim_feedforward': 331, 'batch_size': 34, 'pos_encoding': 'fixed', 'activation': 'relu', 'norm': 'LayerNorm', 'optimizer_name': 'RAdam', 'weight_decay': 0.1, 'top_n_features': 53}. Best is trial 246 with value: 0.16447311791139763.[0m
[FileBasedDataset] Initializing dataset...
	Examples: 8264
	Features: 67
	Max length: 315
Standard scalar turned ON, loading params from cache
[FileBasedDataset] Dataset initialization complete
Warning, assumed runtime error: CUDA out of memory. Tried to allocate 1.49 GiB (GPU 0; 23.70 GiB total capacity; 14.77 GiB already allocated; 297.25 MiB free; 22.32 GiB reserved in total by PyTorch) If reserved memory is >> allocated memory try setting max_split_size_mb to avoid fragmentation.  See documentation for Memory Management and PYTORCH_CUDA_ALLOC_CONF
[32m[I 2023-05-04 14:54:49,300][0m Trial 457 finished with value: 100.0 and parameters: {'lr': 1.2883384347812732e-06, 'dropout': 0.47017882587215687, 'd_model_multiplier': 4, 'num_layers': 6, 'n_heads': 32, 'dim_feedforward': 438, 'batch_size': 126, 'pos_encoding': 'fixed', 'activation': 'relu', 'norm': 'LayerNorm', 'optimizer_name': 'RAdam', 'weight_decay': 0.001, 'top_n_features': 67}. Best is trial 246 with value: 0.16447311791139763.[0m
[FileBasedDataset] Initializing dataset...
	Examples: 8264
	Features: 58
	Max length: 315
Standard scalar turned ON, loading params from cache
[FileBasedDataset] Dataset initialization complete
  epoch    auprc    auroc    train_loss    valid_acc    valid_loss    cp      dur
-------  -------  -------  ------------  -----------  ------------  ----  -------
      1   [36m0.0664[0m   [32m0.3280[0m        [35m0.6156[0m       [31m0.9226[0m        [94m0.4614[0m     +  27.2240
      2   [36m0.1189[0m   [32m0.6224[0m        [35m0.3777[0m       0.9226        [94m0.2877[0m     +  27.3825
      3   [36m0.3162[0m   [32m0.7785[0m        [35m0.2804[0m       0.9226        [94m0.2396[0m     +  27.6663
      4   [36m0.3351[0m   [32m0.8039[0m        [35m0.2529[0m       0.9214        [94m0.2241[0m     +  27.3655
      5   0.3285   [32m0.8085[0m        [35m0.2424[0m       0.9178        [94m0.2201[0m     +  27.3477
      6   0.3300   [32m0.8126[0m        [35m0.2369[0m       0.9166        [94m0.2185[0m     +  27.4923
      7   0.3338   [32m0.8153[0m        [35m0.2343[0m       0.9202        [94m0.2177[0m     +  27.8663
      8   0.3323   [32m0.8177[0m        [35m0.2322[0m       0.9214        [94m0.2172[0m     +  27.7525
      9   [36m0.3389[0m   [32m0.8202[0m        [35m0.2316[0m       0.9202        [94m0.2170[0m     +  27.6867
     10   [36m0.3401[0m   [32m0.8210[0m        [35m0.2293[0m       0.9190        [94m0.2170[0m     +  27.7640
     11   [36m0.3420[0m   [32m0.8226[0m        0.2296       0.9190        [94m0.2165[0m     +  27.4598
     12   [36m0.3434[0m   [32m0.8241[0m        [35m0.2285[0m       0.9202        [94m0.2164[0m     +  27.5021
     13   0.3425   [32m0.8250[0m        [35m0.2282[0m       0.9214        [94m0.2160[0m     +  27.7876
     14   0.3397   0.8249        [35m0.2263[0m       [31m0.9238[0m        0.2168        27.7119
     15   0.3385   [32m0.8252[0m        0.2270       0.9238        0.2168        27.4783
     16   0.3378   [32m0.8256[0m        [35m0.2256[0m       0.9238        0.2166        27.7079
     17   0.3401   [32m0.8271[0m        [35m0.2253[0m       [31m0.9250[0m        0.2162        27.7429
     18   0.3396   0.8268        [35m0.2240[0m       0.9238        0.2164        27.4570
     19   0.3387   0.8270        [35m0.2240[0m       [31m0.9262[0m        0.2166        27.4759
     20   0.3389   [32m0.8273[0m        [35m0.2228[0m       0.9262        0.2169        27.8410
     21   0.3390   [32m0.8278[0m        [35m0.2221[0m       0.9250        0.2167        28.0046
     22   0.3429   [32m0.8286[0m        0.2222       0.9262        0.2167        27.4673
Stopping since valid_loss has not improved in the last 10 epochs.
[32m[I 2023-05-04 15:05:26,004][0m Trial 458 finished with value: 0.21597131874137518 and parameters: {'lr': 1.3806427475396543e-05, 'dropout': 0.24535575006717888, 'd_model_multiplier': 4, 'num_layers': 6, 'n_heads': 32, 'dim_feedforward': 366, 'batch_size': 54, 'pos_encoding': 'fixed', 'activation': 'relu', 'norm': 'LayerNorm', 'optimizer_name': 'RAdam', 'weight_decay': 0.1, 'top_n_features': 58}. Best is trial 246 with value: 0.16447311791139763.[0m
[FileBasedDataset] Initializing dataset...
	Examples: 8264
	Features: 63
	Max length: 315
Standard scalar turned ON, loading params from cache
[FileBasedDataset] Dataset initialization complete
Warning, assumed runtime error: CUDA out of memory. Tried to allocate 1.59 GiB (GPU 0; 23.70 GiB total capacity; 15.33 GiB already allocated; 293.25 MiB free; 22.32 GiB reserved in total by PyTorch) If reserved memory is >> allocated memory try setting max_split_size_mb to avoid fragmentation.  See documentation for Memory Management and PYTORCH_CUDA_ALLOC_CONF
[32m[I 2023-05-04 15:05:29,615][0m Trial 459 finished with value: 100.0 and parameters: {'lr': 6.099086634313483e-05, 'dropout': 0.47742660951990246, 'd_model_multiplier': 4, 'num_layers': 5, 'n_heads': 64, 'dim_feedforward': 348, 'batch_size': 67, 'pos_encoding': 'fixed', 'activation': 'relu', 'norm': 'LayerNorm', 'optimizer_name': 'RAdam', 'weight_decay': 0.1, 'top_n_features': 63}. Best is trial 246 with value: 0.16447311791139763.[0m
[FileBasedDataset] Initializing dataset...
	Examples: 8264
	Features: 86
	Max length: 315
Standard scalar turned ON, loading params from cache
[FileBasedDataset] Dataset initialization complete
  epoch    auprc    auroc    train_loss    valid_acc    valid_loss    cp      dur
-------  -------  -------  ------------  -----------  ------------  ----  -------
      1   [36m0.0976[0m   [32m0.5663[0m        [35m0.4744[0m       [31m0.9214[0m        [94m0.2863[0m     +  57.6649
      2   [36m0.3638[0m   [32m0.7582[0m        [35m0.2684[0m       [31m0.9250[0m        [94m0.2319[0m     +  57.6008
      3   0.3499   [32m0.7606[0m        [35m0.2444[0m       [31m0.9274[0m        [94m0.2308[0m     +  57.6642
      4   0.3554   [32m0.7691[0m        [35m0.2377[0m       0.9274        0.2315        58.0876
      5   0.3604   [32m0.7719[0m        [35m0.2343[0m       0.9274        0.2320        58.0802
      6   0.3528   [32m0.7757[0m        [35m0.2315[0m       [31m0.9299[0m        0.2310        57.7721
      7   0.3497   0.7751        [35m0.2307[0m       0.9250        0.2318        57.6688
      8   0.3538   [32m0.7777[0m        [35m0.2304[0m       0.9250        0.2313        57.7523
      9   0.3597   [32m0.7842[0m        [35m0.2267[0m       0.9287        0.2335        57.6969
     10   0.3543   0.7792        0.2270       0.9274        0.2336        58.1323
     11   0.3439   0.7747        [35m0.2249[0m       0.9226        0.2359        57.7005
     12   0.3486   0.7712        0.2250       0.9238        0.2368        57.6584
Stopping since valid_loss has not improved in the last 10 epochs.
[32m[I 2023-05-04 15:18:02,450][0m Trial 460 finished with value: 0.23078827742834046 and parameters: {'lr': 2.1552088730571562e-05, 'dropout': 0.4127989717582712, 'd_model_multiplier': 8, 'num_layers': 13, 'n_heads': 32, 'dim_feedforward': 382, 'batch_size': 49, 'pos_encoding': 'fixed', 'activation': 'relu', 'norm': 'LayerNorm', 'optimizer_name': 'RAdam', 'weight_decay': 0.1, 'top_n_features': 86}. Best is trial 246 with value: 0.16447311791139763.[0m
[FileBasedDataset] Initializing dataset...
	Examples: 8264
	Features: 49
	Max length: 315
Standard scalar turned ON, loading params from cache
[FileBasedDataset] Dataset initialization complete
  epoch    auprc    auroc    train_loss    valid_acc    valid_loss    cp      dur
-------  -------  -------  ------------  -----------  ------------  ----  -------
      1   [36m0.3403[0m   [32m0.8030[0m        [35m0.2690[0m       [31m0.9262[0m        [94m0.2155[0m     +  25.6146
      2   [36m0.3533[0m   [32m0.8058[0m        [35m0.2345[0m       0.9214        0.2215        25.6375
      3   [36m0.3600[0m   [32m0.8135[0m        [35m0.2308[0m       0.9190        0.2200        25.4425
      4   [36m0.3654[0m   0.8123        [35m0.2301[0m       0.9214        0.2236        25.0113
      5   0.3548   0.8119        [35m0.2298[0m       0.9202        0.2244        25.4567
      6   0.3520   0.8132        [35m0.2270[0m       0.9166        0.2275        25.6138
      7   0.3542   [32m0.8147[0m        [35m0.2258[0m       0.9190        0.2301        25.3244
      8   0.3495   0.8144        [35m0.2249[0m       0.9202        0.2251        25.3836
      9   0.3440   [32m0.8181[0m        [35m0.2223[0m       0.9238        0.2274        25.6041
     10   0.3334   0.8153        [35m0.2218[0m       0.9214        0.2339        25.6683
Stopping since valid_loss has not improved in the last 10 epochs.
[32m[I 2023-05-04 15:22:43,216][0m Trial 461 finished with value: 0.2155147243511864 and parameters: {'lr': 3.1582145689008604e-05, 'dropout': 0.42258726425454, 'd_model_multiplier': 16, 'num_layers': 4, 'n_heads': 32, 'dim_feedforward': 320, 'batch_size': 60, 'pos_encoding': 'fixed', 'activation': 'relu', 'norm': 'LayerNorm', 'optimizer_name': 'AdamW', 'weight_decay': 0.001, 'top_n_features': 49}. Best is trial 246 with value: 0.16447311791139763.[0m
[FileBasedDataset] Initializing dataset...
	Examples: 8264
	Features: 76
	Max length: 315
Standard scalar turned ON, loading params from cache
[FileBasedDataset] Dataset initialization complete
  epoch    auprc    auroc    train_loss    valid_acc    valid_loss    cp      dur
-------  -------  -------  ------------  -----------  ------------  ----  -------
      1   [36m0.1242[0m   [32m0.6116[0m        [35m0.4428[0m       [31m0.9335[0m        [94m0.2458[0m     +  23.5448
      2   [36m0.2159[0m   [32m0.7391[0m        [35m0.2648[0m       0.9335        [94m0.2208[0m     +  23.7496
      3   [36m0.2424[0m   [32m0.7798[0m        [35m0.2492[0m       0.9323        [94m0.2126[0m     +  23.7078
      4   [36m0.2553[0m   [32m0.7973[0m        [35m0.2408[0m       0.9311        [94m0.2089[0m     +  24.4010
      5   0.2510   [32m0.8063[0m        [35m0.2365[0m       0.9311        [94m0.2078[0m     +  23.5073
      6   0.2478   [32m0.8097[0m        [35m0.2338[0m       0.9311        0.2083        23.4421
      7   0.2515   [32m0.8097[0m        [35m0.2335[0m       0.9335        0.2081        23.8504
      8   0.2491   [32m0.8106[0m        [35m0.2331[0m       0.9323        0.2089        23.8693
      9   0.2513   0.8105        [35m0.2312[0m       0.9335        0.2081        23.8061
     10   0.2548   0.8098        [35m0.2296[0m       0.9323        0.2093        23.8947
     11   0.2495   0.8076        [35m0.2269[0m       0.9323        0.2086        24.0087
     12   [36m0.2607[0m   [32m0.8126[0m        0.2282       0.9299        0.2083        24.0411
     13   0.2593   0.8105        [35m0.2259[0m       0.9323        [94m0.2075[0m     +  23.8124
     14   0.2597   0.8124        [35m0.2243[0m       0.9311        0.2078        23.8378
     15   0.2584   0.8043        0.2248       0.9311        0.2081        23.7888
     16   [36m0.2611[0m   0.8033        [35m0.2222[0m       0.9323        0.2095        23.6682
     17   [36m0.2614[0m   0.8025        [35m0.2214[0m       0.9335        0.2083        23.7005
     18   [36m0.2677[0m   0.8064        0.2226       [31m0.9347[0m        [94m0.2064[0m     +  23.7373
     19   0.2563   0.8038        [35m0.2213[0m       0.9323        0.2094        24.0655
     20   0.2526   0.8093        [35m0.2169[0m       0.9335        0.2104        23.7637
     21   0.2591   0.8122        0.2180       0.9299        0.2099        23.5763
     22   0.2586   0.8118        [35m0.2151[0m       0.9311        0.2123        23.7888
     23   0.2568   0.8113        0.2162       0.9311        0.2115        24.4160
     24   0.2536   [32m0.8133[0m        [35m0.2145[0m       0.9311        0.2109        23.8595
     25   0.2463   0.8098        0.2159       0.9287        0.2157        24.0182
     26   0.2514   0.8129        0.2150       0.9274        0.2143        23.9653
     27   0.2412   0.8021        [35m0.2119[0m       0.9287        0.2134        23.9045
Stopping since valid_loss has not improved in the last 10 epochs.
