[32m[I 2023-05-02 14:41:10,881][0m Trial 151 finished with value: 0.3016959781946554 and parameters: {'lr': 0.0007133914233064297, 'dropout': 0.5164412087064566, 'd_model_multiplier': 8, 'num_layers': 2, 'n_heads': 8, 'dim_feedforward': 447, 'batch_size': 46, 'pos_encoding': 'learnable', 'activation': 'relu', 'norm': 'LayerNorm', 'optimizer_name': 'PlainRAdam', 'weight_decay': 0.1, 'top_n_features': 161}. Best is trial 117 with value: 0.191397856754288.[0m
[FileBasedDataset] Initializing dataset...
	Examples: 8264
	Features: 172
	Max length: 315
Standard scalar turned ON, loading params from cache
[FileBasedDataset] Dataset initialization complete
  epoch    auprc    auroc    train_loss    valid_acc    valid_loss    cp     dur
-------  -------  -------  ------------  -----------  ------------  ----  ------
      1   [36m0.1728[0m   [32m0.6450[0m        [35m0.3291[0m       [31m0.9287[0m        [94m0.2541[0m     +  8.7268
      2   [36m0.1918[0m   [32m0.7146[0m        [35m0.2504[0m       0.9274        [94m0.2445[0m     +  8.2854
      3   [36m0.2247[0m   [32m0.7476[0m        [35m0.2461[0m       0.9238        [94m0.2327[0m     +  8.8041
      4   0.2244   [32m0.7485[0m        0.2467       0.9226        0.2352        9.3521
      5   [36m0.2320[0m   [32m0.7490[0m        [35m0.2443[0m       0.9226        0.2350        9.2160
      6   0.2289   0.7462        [35m0.2408[0m       0.9190        0.2354        9.6567
      7   [36m0.2406[0m   [32m0.7496[0m        0.2410       0.9238        0.2353        9.1172
      8   [36m0.2451[0m   0.7384        [35m0.2407[0m       0.9274        0.2344        9.6153
      9   [36m0.2550[0m   [32m0.7572[0m        [35m0.2406[0m       0.9250        [94m0.2283[0m     +  9.0274
     10   0.2497   0.7451        [35m0.2376[0m       0.9238        0.2355        9.0336
     11   0.2421   0.7449        [35m0.2368[0m       0.9214        0.2349        9.1140
     12   [36m0.2646[0m   0.7448        0.2386       0.9190        0.2415        8.8959
     13   [36m0.2707[0m   0.7407        [35m0.2361[0m       0.9262        0.2373        9.3521
     14   [36m0.2714[0m   0.7398        [35m0.2351[0m       0.9262        0.2340        9.1323
     15   [36m0.2741[0m   0.7493        0.2373       0.9238        0.2292        9.1528
     16   [36m0.2933[0m   0.7467        0.2356       0.9274        0.2353        9.3503
     17   0.2921   0.7491        [35m0.2323[0m       [31m0.9299[0m        0.2334        9.3705
     18   0.2788   0.7496        [35m0.2309[0m       0.9238        0.2352        9.0661
Stopping since valid_loss has not improved in the last 10 epochs.
[32m[I 2023-05-02 14:44:04,831][0m Trial 152 finished with value: 0.228304927454678 and parameters: {'lr': 0.0015240960452724925, 'dropout': 0.4730154447419574, 'd_model_multiplier': 8, 'num_layers': 1, 'n_heads': 4, 'dim_feedforward': 426, 'batch_size': 51, 'pos_encoding': 'learnable', 'activation': 'relu', 'norm': 'LayerNorm', 'optimizer_name': 'PlainRAdam', 'weight_decay': 0.1, 'top_n_features': 172}. Best is trial 117 with value: 0.191397856754288.[0m
[FileBasedDataset] Initializing dataset...
	Examples: 8264
	Features: 154
	Max length: 315
Standard scalar turned ON, loading params from cache
[FileBasedDataset] Dataset initialization complete
  epoch    auprc    auroc    train_loss    valid_acc    valid_loss    cp     dur
-------  -------  -------  ------------  -----------  ------------  ----  ------
      1   [36m0.2111[0m   [32m0.6904[0m        [35m0.3279[0m       [31m0.9166[0m        [94m0.2722[0m     +  8.1560
      2   [36m0.2148[0m   [32m0.6957[0m        [35m0.2528[0m       0.9154        [94m0.2668[0m     +  9.3444
      3   [36m0.2287[0m   [32m0.6979[0m        [35m0.2482[0m       0.9154        0.2708        9.1447
      4   [36m0.2357[0m   [32m0.7053[0m        [35m0.2440[0m       0.9166        0.2700        9.1123
      5   [36m0.2541[0m   [32m0.7173[0m        [35m0.2391[0m       [31m0.9202[0m        0.2675        9.2949
      6   0.2449   [32m0.7181[0m        [35m0.2362[0m       0.9178        0.2693        8.9356
      7   0.2491   [32m0.7186[0m        [35m0.2327[0m       0.9202        0.2733        9.3830
      8   [36m0.2752[0m   [32m0.7370[0m        [35m0.2324[0m       0.9178        [94m0.2639[0m     +  9.0742
      9   0.2685   [32m0.7430[0m        [35m0.2305[0m       0.9178        0.2707        9.3325
     10   0.2552   0.7260        [35m0.2284[0m       0.9166        0.2749        9.2095
     11   [36m0.2787[0m   0.7385        [35m0.2263[0m       0.9166        0.2655        9.2491
     12   [36m0.2870[0m   [32m0.7483[0m        [35m0.2247[0m       0.9166        0.2644        9.3090
     13   0.2859   [32m0.7610[0m        [35m0.2193[0m       0.9178        0.2645        9.1878
     14   [36m0.2932[0m   0.7538        [35m0.2193[0m       0.9190        0.2676        9.1116
     15   0.2731   0.7498        [35m0.2184[0m       0.9178        0.2735        9.2093
     16   0.2710   0.7419        [35m0.2159[0m       0.9190        0.2702        9.2252
     17   0.2777   0.7525        [35m0.2139[0m       0.9178        0.2666        9.5515
Stopping since valid_loss has not improved in the last 10 epochs.
[32m[I 2023-05-02 14:46:50,770][0m Trial 153 finished with value: 0.26394232134576867 and parameters: {'lr': 0.0005552695030581862, 'dropout': 0.3686368281187119, 'd_model_multiplier': 8, 'num_layers': 2, 'n_heads': 4, 'dim_feedforward': 137, 'batch_size': 42, 'pos_encoding': 'learnable', 'activation': 'gelu', 'norm': 'BatchNorm', 'optimizer_name': 'PlainRAdam', 'weight_decay': 0, 'top_n_features': 154}. Best is trial 117 with value: 0.191397856754288.[0m
[FileBasedDataset] Initializing dataset...
	Examples: 8264
	Features: 223
	Max length: 315
Standard scalar turned ON, loading params from cache
[FileBasedDataset] Dataset initialization complete
  epoch    auprc    auroc    train_loss    valid_acc    valid_loss    cp     dur
-------  -------  -------  ------------  -----------  ------------  ----  ------
      1   [36m0.2008[0m   [32m0.7132[0m        [35m0.2743[0m       [31m0.9226[0m        [94m0.2511[0m     +  9.7017
      2   0.1884   [32m0.7225[0m        [35m0.2626[0m       0.9226        0.2570        9.4106
      3   0.1814   0.7209        [35m0.2610[0m       0.9226        0.2686        9.7646
      4   0.1983   [32m0.7298[0m        [35m0.2588[0m       0.9226        0.2657        10.0500
      5   [36m0.2056[0m   0.7196        [35m0.2576[0m       0.9226        0.2654        9.8229
      6   0.1885   0.7190        [35m0.2557[0m       0.9226        0.2666        9.8218
      7   0.1955   0.7273        0.2566       0.9226        0.2614        9.7782
      8   0.1836   0.7211        0.2559       0.9226        0.2596        9.9825
      9   0.1919   0.7273        [35m0.2546[0m       0.9226        0.2520        10.0267
     10   0.1878   0.7238        [35m0.2545[0m       0.9226        0.2556        10.1124
Stopping since valid_loss has not improved in the last 10 epochs.
[32m[I 2023-05-02 14:48:39,334][0m Trial 154 finished with value: 0.25109714257926147 and parameters: {'lr': 0.004186840641730334, 'dropout': 0.45165312560381, 'd_model_multiplier': 4, 'num_layers': 3, 'n_heads': 8, 'dim_feedforward': 487, 'batch_size': 21, 'pos_encoding': 'learnable', 'activation': 'relu', 'norm': 'LayerNorm', 'optimizer_name': 'PlainRAdam', 'weight_decay': 0.1, 'top_n_features': 223}. Best is trial 117 with value: 0.191397856754288.[0m
[FileBasedDataset] Initializing dataset...
	Examples: 8264
	Features: 142
	Max length: 315
Standard scalar turned ON, loading params from cache
[FileBasedDataset] Dataset initialization complete
  epoch    auprc    auroc    train_loss    valid_acc    valid_loss    cp      dur
-------  -------  -------  ------------  -----------  ------------  ----  -------
      1   [36m0.1486[0m   [32m0.6704[0m        [35m0.3259[0m       [31m0.9105[0m        [94m0.2767[0m     +  26.9778
      2   [36m0.1526[0m   [32m0.6717[0m        [35m0.2484[0m       0.9105        [94m0.2706[0m     +  27.1009
      3   0.1479   [32m0.6727[0m        [35m0.2457[0m       [31m0.9190[0m        [94m0.2668[0m     +  26.9574
      4   [36m0.1576[0m   [32m0.6727[0m        [35m0.2368[0m       0.9190        0.2708        27.1373
      5   [36m0.1686[0m   [32m0.6775[0m        [35m0.2341[0m       0.9154        0.2696        27.2277
      6   0.1647   0.6760        [35m0.2308[0m       0.9141        0.2769        27.3650
      7   0.1630   [32m0.6943[0m        [35m0.2275[0m       0.9141        0.2672        27.2752
      8   0.1630   [32m0.6952[0m        [35m0.2250[0m       0.9154        0.2684        27.3919
      9   0.1562   0.6786        [35m0.2234[0m       0.9178        0.2698        27.2465
     10   [36m0.1708[0m   [32m0.6977[0m        [35m0.2214[0m       0.9166        [94m0.2657[0m     +  27.4505
     11   [36m0.1919[0m   [32m0.7079[0m        [35m0.2183[0m       0.9129        0.2665        27.4813
     12   0.1694   0.7037        [35m0.2173[0m       0.9190        [94m0.2586[0m     +  27.3024
     13   [36m0.1982[0m   [32m0.7136[0m        [35m0.2139[0m       0.9117        0.2764        27.3324
     14   0.1759   0.7089        [35m0.2089[0m       0.9141        0.2702        27.2854
     15   0.1783   0.6840        0.2109       0.9166        0.2722        27.2935
     16   0.1800   0.6937        [35m0.2037[0m       0.9154        0.2726        27.1004
     17   [36m0.1994[0m   0.6982        0.2044       0.9117        0.2726        27.2233
     18   0.1716   0.6822        [35m0.2028[0m       0.9117        0.2755        27.0925
     19   0.1888   0.7012        [35m0.2004[0m       0.9129        0.2685        27.1336
     20   0.1645   0.6846        [35m0.1988[0m       0.9141        0.2767        27.3818
     21   0.1816   0.7112        0.1989       0.9093        0.2825        27.0556
Stopping since valid_loss has not improved in the last 10 epochs.
[32m[I 2023-05-02 14:58:39,004][0m Trial 155 finished with value: 0.2585639011614844 and parameters: {'lr': 0.00030989628943015496, 'dropout': 0.3525002694335515, 'd_model_multiplier': 1, 'num_layers': 4, 'n_heads': 64, 'dim_feedforward': 407, 'batch_size': 37, 'pos_encoding': 'learnable', 'activation': 'gelu', 'norm': 'BatchNorm', 'optimizer_name': 'PlainRAdam', 'weight_decay': 0, 'top_n_features': 142}. Best is trial 117 with value: 0.191397856754288.[0m
[FileBasedDataset] Initializing dataset...
	Examples: 8264
	Features: 165
	Max length: 315
Standard scalar turned ON, loading params from cache
[FileBasedDataset] Dataset initialization complete
  epoch    auprc    auroc    train_loss    valid_acc    valid_loss    cp     dur
-------  -------  -------  ------------  -----------  ------------  ----  ------
      1   [36m0.1621[0m   [32m0.6429[0m        [35m0.2788[0m       [31m0.9226[0m        [94m0.2671[0m     +  8.9397
      2   [36m0.1877[0m   [32m0.6570[0m        [35m0.2592[0m       0.9214        [94m0.2603[0m     +  9.3506
      3   [36m0.2231[0m   [32m0.7059[0m        [35m0.2485[0m       0.9214        [94m0.2498[0m     +  9.2862
      4   [36m0.2765[0m   [32m0.7228[0m        [35m0.2375[0m       0.9226        [94m0.2421[0m     +  9.2845
      5   [36m0.2916[0m   [32m0.7232[0m        [35m0.2350[0m       [31m0.9250[0m        [94m0.2419[0m     +  9.5223
      6   0.2802   [32m0.7374[0m        [35m0.2324[0m       0.9238        [94m0.2397[0m     +  9.7010
      7   0.2724   0.7246        [35m0.2314[0m       0.9238        0.2425        9.5225
      8   0.2611   [32m0.7413[0m        [35m0.2305[0m       0.9226        0.2455        9.5821
      9   0.2557   0.7276        0.2311       0.9226        0.2447        9.5353
     10   0.2636   [32m0.7415[0m        0.2316       0.9238        0.2399        9.3305
     11   0.2655   [32m0.7445[0m        [35m0.2280[0m       0.9250        0.2401        9.5636
     12   0.2632   0.7323        0.2298       0.9238        0.2439        9.5064
     13   0.2769   0.7421        [35m0.2269[0m       0.9238        0.2422        9.6008
     14   0.2541   0.7350        [35m0.2242[0m       0.9226        0.2486        9.7228
     15   0.2915   0.7405        0.2290       [31m0.9274[0m        0.2399        9.2980
Stopping since valid_loss has not improved in the last 10 epochs.
[32m[I 2023-05-02 15:01:11,128][0m Trial 156 finished with value: 0.23968510997302586 and parameters: {'lr': 0.0010220627563868759, 'dropout': 0.30870364625507335, 'd_model_multiplier': 16, 'num_layers': 2, 'n_heads': 4, 'dim_feedforward': 150, 'batch_size': 14, 'pos_encoding': 'fixed', 'activation': 'relu', 'norm': 'LayerNorm', 'optimizer_name': 'PlainRAdam', 'weight_decay': 0.1, 'top_n_features': 165}. Best is trial 117 with value: 0.191397856754288.[0m
[FileBasedDataset] Initializing dataset...
	Examples: 8264
	Features: 158
	Max length: 315
Standard scalar turned ON, loading params from cache
[FileBasedDataset] Dataset initialization complete
  epoch    auprc    auroc    train_loss    valid_acc    valid_loss    cp      dur
-------  -------  -------  ------------  -----------  ------------  ----  -------
      1   [36m0.1042[0m   [32m0.4027[0m        [35m0.2962[0m       [31m0.1487[0m        [94m1.3613[0m     +  10.6901
      2   [36m0.2474[0m   [32m0.6684[0m        [35m0.2718[0m       [31m0.5961[0m        [94m0.7068[0m     +  10.8067
      3   0.0915   0.5057        [35m0.2678[0m       0.1245        1.3279        10.6969
      4   [36m0.2571[0m   [32m0.7221[0m        0.2699       [31m0.6759[0m        [94m0.6179[0m     +  10.7350
      5   0.1060   0.5287        [35m0.2660[0m       [31m0.9093[0m        [94m0.3623[0m     +  10.6810
      6   0.1789   0.6380        [35m0.2592[0m       0.9093        [94m0.3199[0m     +  11.2536
      7   0.2237   0.6898        [35m0.2452[0m       0.8888        0.3258        10.7932
      8   0.2419   0.6993        0.2454       0.9081        [94m0.2862[0m     +  11.2835
      9   0.1814   0.6763        [35m0.2445[0m       0.7678        0.4702        10.9041
     10   0.1940   0.6786        [35m0.2368[0m       0.8464        0.3624        11.1160
     11   0.1655   0.6354        0.2372       0.8827        0.3415        11.0718
     12   0.1518   0.6293        [35m0.2346[0m       0.9008        0.3418        11.2003
     13   0.2303   0.6815        0.2425       0.9081        0.2943        10.9178
     14   0.2570   0.7121        [35m0.2311[0m       [31m0.9141[0m        0.2872        10.9600
     15   0.2481   0.6892        0.2333       0.9081        0.2923        11.4067
     16   0.2069   0.6681        0.2332       0.9069        0.3186        11.0630
     17   0.2147   0.6617        0.2318       0.9069        0.3452        11.0549
Stopping since valid_loss has not improved in the last 10 epochs.
[32m[I 2023-05-02 15:04:29,170][0m Trial 157 finished with value: 0.2862013964908155 and parameters: {'lr': 0.0023724681170972433, 'dropout': 0.3407434990638322, 'd_model_multiplier': 8, 'num_layers': 1, 'n_heads': 32, 'dim_feedforward': 466, 'batch_size': 97, 'pos_encoding': 'learnable', 'activation': 'gelu', 'norm': 'BatchNorm', 'optimizer_name': 'AdamW', 'weight_decay': 0.01, 'top_n_features': 158}. Best is trial 117 with value: 0.191397856754288.[0m
[FileBasedDataset] Initializing dataset...
	Examples: 8264
	Features: 182
	Max length: 315
Standard scalar turned ON, loading params from cache
[FileBasedDataset] Dataset initialization complete
  epoch    auprc    auroc    train_loss    valid_acc    valid_loss    cp     dur
-------  -------  -------  ------------  -----------  ------------  ----  ------
      1   [36m0.2242[0m   [32m0.7169[0m        [35m0.2985[0m       [31m0.9166[0m        [94m0.3033[0m     +  8.2281
      2   [36m0.2415[0m   [32m0.7415[0m        [35m0.2562[0m       0.9166        [94m0.2557[0m     +  8.5706
      3   [36m0.2538[0m   0.7398        [35m0.2457[0m       0.9154        0.2574        9.5139
      4   [36m0.2832[0m   [32m0.7568[0m        [35m0.2432[0m       [31m0.9178[0m        [94m0.2534[0m     +  9.4147
      5   0.2513   0.7307        [35m0.2373[0m       0.9166        0.2571        9.2632
      6   0.2818   0.7511        [35m0.2346[0m       0.9166        [94m0.2497[0m     +  9.6691
      7   0.2828   [32m0.7593[0m        [35m0.2318[0m       [31m0.9190[0m        0.2528        9.5415
      8   [36m0.2998[0m   [32m0.7685[0m        [35m0.2304[0m       0.9178        [94m0.2449[0m     +  9.5215
      9   [36m0.3063[0m   0.7674        [35m0.2283[0m       [31m0.9214[0m        0.2500        9.6431
     10   [36m0.3123[0m   [32m0.7728[0m        0.2304       0.9178        0.2482        9.6283
     11   0.3056   0.7630        [35m0.2271[0m       0.9166        0.2471        9.6245
     12   [36m0.3219[0m   0.7531        [35m0.2244[0m       0.9166        0.2530        9.8034
     13   [36m0.3506[0m   0.7657        [35m0.2237[0m       0.9190        0.2477        9.4839
     14   0.3040   0.7513        0.2252       0.9178        0.2518        9.5690
     15   0.3109   0.7501        0.2245       0.9178        0.2626        9.1934
     16   0.3373   0.7524        [35m0.2219[0m       0.9178        0.2479        9.2080
     17   0.3206   0.7452        0.2225       0.9178        0.2531        9.5588
     18   [36m0.3515[0m   0.7638        0.2265       0.9178        [94m0.2449[0m     +  9.6208
     19   0.3413   0.7670        0.2229       [31m0.9226[0m        0.2507        9.3892
     20   0.3466   0.7613        [35m0.2199[0m       0.9202        [94m0.2434[0m     +  9.7020
     21   0.3085   0.7463        0.2214       0.9178        0.2491        9.6249
     22   0.2963   0.7346        0.2217       0.9166        0.2550        9.8920
     23   0.2816   0.7350        0.2214       0.9166        0.2575        9.4717
     24   0.3273   0.7514        [35m0.2147[0m       0.9202        0.2484        9.9006
     25   0.3190   0.7544        0.2180       0.9178        0.2486        9.7304
     26   0.3188   0.7536        [35m0.2144[0m       0.9178        0.2547        9.5858
     27   0.3374   0.7665        0.2182       0.9202        0.2437        9.4052
     28   0.3257   0.7521        0.2183       0.9190        0.2516        9.6840
     29   0.3175   0.7546        0.2170       0.9178        0.2516        9.6159
Stopping since valid_loss has not improved in the last 10 epochs.
