[32m[I 2023-05-05 03:46:55,354][0m Trial 540 finished with value: 0.2596938995489042 and parameters: {'lr': 0.00044365074183126457, 'dropout': 0.5526652998010461, 'd_model_multiplier': 4, 'num_layers': 7, 'n_heads': 16, 'dim_feedforward': 357, 'batch_size': 69, 'pos_encoding': 'learnable', 'activation': 'relu', 'norm': 'LayerNorm', 'optimizer_name': 'PlainRAdam', 'weight_decay': 0.001, 'top_n_features': 52}. Best is trial 246 with value: 0.16447311791139763.[0m
[FileBasedDataset] Initializing dataset...
	Examples: 8264
	Features: 77
	Max length: 315
Standard scalar turned ON, loading params from cache
[FileBasedDataset] Dataset initialization complete
  epoch    auprc    auroc    train_loss    valid_acc    valid_loss    cp      dur
-------  -------  -------  ------------  -----------  ------------  ----  -------
      1   [36m0.0649[0m   [32m0.4398[0m        [35m0.6997[0m       [31m0.7473[0m        [94m0.6538[0m     +  27.4269
      2   0.0523   0.3392        [35m0.6064[0m       [31m0.9323[0m        [94m0.5276[0m     +  27.0138
      3   0.0527   0.3339        [35m0.5055[0m       0.9323        [94m0.4180[0m     +  27.5536
      4   0.0524   0.3496        [35m0.4218[0m       0.9323        [94m0.3421[0m     +  27.1681
      5   0.0549   0.3926        [35m0.3639[0m       0.9323        [94m0.2970[0m     +  27.6170
      6   0.0634   [32m0.4658[0m        [35m0.3278[0m       0.9323        [94m0.2716[0m     +  27.5979
      7   [36m0.0902[0m   [32m0.5300[0m        [35m0.3050[0m       0.9323        [94m0.2569[0m     +  27.1703
      8   [36m0.1105[0m   [32m0.5853[0m        [35m0.2907[0m       0.9323        [94m0.2475[0m     +  27.2061
      9   [36m0.1368[0m   [32m0.6246[0m        [35m0.2811[0m       0.9323        [94m0.2412[0m     +  27.4511
     10   [36m0.1528[0m   [32m0.6528[0m        [35m0.2752[0m       0.9323        [94m0.2368[0m     +  27.3170
     11   [36m0.1674[0m   [32m0.6744[0m        [35m0.2705[0m       0.9323        [94m0.2333[0m     +  27.3447
     12   [36m0.1751[0m   [32m0.6858[0m        [35m0.2665[0m       0.9323        [94m0.2310[0m     +  27.4288
     13   [36m0.1862[0m   [32m0.6958[0m        [35m0.2623[0m       0.9323        [94m0.2290[0m     +  27.5466
     14   [36m0.2009[0m   [32m0.7043[0m        [35m0.2617[0m       0.9323        [94m0.2273[0m     +  27.4010
     15   [36m0.2251[0m   [32m0.7107[0m        [35m0.2596[0m       0.9323        [94m0.2258[0m     +  27.4284
     16   [36m0.2379[0m   [32m0.7156[0m        [35m0.2572[0m       0.9323        [94m0.2247[0m     +  27.2777
     17   [36m0.2492[0m   [32m0.7192[0m        [35m0.2553[0m       0.9323        [94m0.2236[0m     +  27.3945
     18   [36m0.2615[0m   [32m0.7227[0m        [35m0.2537[0m       0.9323        [94m0.2225[0m     +  27.1947
     19   [36m0.2703[0m   [32m0.7263[0m        0.2545       0.9323        [94m0.2215[0m     +  27.5026
     20   [36m0.2748[0m   [32m0.7286[0m        [35m0.2517[0m       0.9323        [94m0.2203[0m     +  27.5131
     21   0.2730   [32m0.7288[0m        [35m0.2488[0m       0.9323        [94m0.2196[0m     +  27.4200
     22   [36m0.2812[0m   [32m0.7302[0m        [35m0.2478[0m       [31m0.9347[0m        [94m0.2186[0m     +  27.3978
     23   [36m0.2873[0m   [32m0.7305[0m        [35m0.2453[0m       0.9323        [94m0.2183[0m     +  27.2824
     24   0.2854   0.7295        0.2461       0.9335        [94m0.2182[0m     +  27.5615
     25   0.2867   0.7292        [35m0.2451[0m       0.9323        0.2187        27.4280
     26   [36m0.2877[0m   0.7276        [35m0.2433[0m       0.9323        0.2193        27.7595
     27   0.2803   0.7274        [35m0.2418[0m       0.9335        0.2193        27.4488
     28   0.2804   0.7260        [35m0.2413[0m       0.9335        0.2202        27.9471
     29   0.2819   0.7250        0.2423       0.9335        0.2205        27.4546
     30   0.2800   0.7243        [35m0.2392[0m       0.9335        0.2211        27.8061
     31   0.2806   0.7247        0.2417       0.9347        0.2210        27.6569
     32   0.2760   0.7243        0.2403       0.9347        0.2215        27.3740
     33   0.2754   0.7245        [35m0.2386[0m       0.9347        0.2219        27.5831
Stopping since valid_loss has not improved in the last 10 epochs.
[32m[I 2023-05-05 04:02:31,619][0m Trial 541 finished with value: 0.21819599484067587 and parameters: {'lr': 4.563666372415372e-06, 'dropout': 0.5771450778643983, 'd_model_multiplier': 4, 'num_layers': 6, 'n_heads': 32, 'dim_feedforward': 380, 'batch_size': 58, 'pos_encoding': 'fixed', 'activation': 'relu', 'norm': 'LayerNorm', 'optimizer_name': 'RAdam', 'weight_decay': 0.01, 'top_n_features': 77}. Best is trial 246 with value: 0.16447311791139763.[0m
[FileBasedDataset] Initializing dataset...
	Examples: 8264
	Features: 65
	Max length: 315
Standard scalar turned ON, loading params from cache
[FileBasedDataset] Dataset initialization complete
  epoch    auprc    auroc    train_loss    valid_acc    valid_loss    cp      dur
-------  -------  -------  ------------  -----------  ------------  ----  -------
      1   [36m0.2297[0m   [32m0.6832[0m        [35m0.3271[0m       [31m0.8875[0m        [94m0.4768[0m     +  10.9335
      2   [36m0.2332[0m   0.6765        [35m0.2944[0m       [31m0.8936[0m        [94m0.3839[0m     +  10.5075
      3   [36m0.2444[0m   0.6693        [35m0.2866[0m       [31m0.9105[0m        [94m0.3437[0m     +  10.5215
      4   0.2399   [32m0.6985[0m        [35m0.2832[0m       [31m0.9214[0m        [94m0.3114[0m     +  11.0971
      5   [36m0.2630[0m   [32m0.7104[0m        [35m0.2751[0m       0.9129        [94m0.2977[0m     +  10.8920
      6   0.2443   0.7049        [35m0.2734[0m       0.9178        [94m0.2638[0m     +  10.7125
      7   0.2571   [32m0.7104[0m        [35m0.2725[0m       0.9178        [94m0.2637[0m     +  11.0353
      8   0.2468   0.7084        [35m0.2662[0m       0.9178        [94m0.2546[0m     +  10.9168
      9   0.2386   [32m0.7139[0m        [35m0.2646[0m       0.9178        [94m0.2532[0m     +  10.9649
     10   0.2448   [32m0.7244[0m        [35m0.2632[0m       0.9166        [94m0.2518[0m     +  10.7887
     11   0.2413   [32m0.7314[0m        [35m0.2597[0m       0.9178        [94m0.2498[0m     +  10.6262
     12   0.2531   [32m0.7391[0m        [35m0.2550[0m       0.9178        [94m0.2472[0m     +  10.8058
     13   0.2587   [32m0.7424[0m        0.2577       0.9178        [94m0.2465[0m     +  10.6421
     14   0.2597   0.7293        0.2552       0.9190        0.2478        10.7449
     15   0.2527   0.7300        [35m0.2511[0m       0.9214        0.2471        10.6743
     16   [36m0.2675[0m   [32m0.7441[0m        0.2521       0.9166        0.2475        10.9354
     17   0.2659   0.7306        [35m0.2457[0m       0.9214        [94m0.2459[0m     +  10.8239
     18   0.2654   0.7345        0.2484       0.9214        [94m0.2452[0m     +  11.1715
     19   0.2669   0.7328        [35m0.2373[0m       [31m0.9238[0m        [94m0.2441[0m     +  10.6431
     20   [36m0.2773[0m   [32m0.7569[0m        0.2405       0.9226        [94m0.2409[0m     +  11.0453
     21   0.2703   0.7428        0.2453       0.9238        0.2420        10.6726
     22   0.2648   0.7474        0.2431       [31m0.9250[0m        [94m0.2401[0m     +  10.9284
     23   [36m0.2818[0m   0.7467        0.2410       [31m0.9262[0m        [94m0.2387[0m     +  10.9951
     24   0.2734   0.7424        [35m0.2332[0m       0.9250        0.2416        10.9783
     25   0.2651   0.7482        [35m0.2314[0m       0.9250        0.2438        11.0096
     26   0.2604   0.7513        0.2330       0.9238        0.2422        10.8045
     27   0.2676   0.7493        [35m0.2300[0m       0.9250        0.2422        11.0251
     28   0.2739   0.7486        0.2335       0.9202        0.2410        10.7118
     29   0.2759   0.7557        0.2316       0.9226        [94m0.2384[0m     +  10.8472
     30   0.2705   0.7453        [35m0.2279[0m       0.9226        0.2436        10.7885
     31   0.2657   0.7432        0.2298       0.9190        0.2472        10.7601
     32   0.2671   0.7503        0.2293       0.9214        0.2438        10.6241
     33   0.2616   0.7422        [35m0.2278[0m       0.9166        0.2514        11.0227
     34   0.2741   0.7493        0.2307       0.9214        0.2466        10.8607
     35   [36m0.2833[0m   0.7515        0.2286       0.9129        0.2507        10.8021
     36   [36m0.2861[0m   0.7537        [35m0.2278[0m       0.9214        0.2423        10.7118
     37   0.2770   [32m0.7592[0m        0.2292       0.9202        0.2417        10.9707
     38   0.2826   [32m0.7649[0m        0.2280       0.9226        0.2417        10.7578
Stopping since valid_loss has not improved in the last 10 epochs.
[32m[I 2023-05-05 04:09:37,323][0m Trial 542 finished with value: 0.23841744792865005 and parameters: {'lr': 0.00017994274499048412, 'dropout': 0.6184543778894086, 'd_model_multiplier': 64, 'num_layers': 4, 'n_heads': 4, 'dim_feedforward': 340, 'batch_size': 65, 'pos_encoding': 'fixed', 'activation': 'gelu', 'norm': 'BatchNorm', 'optimizer_name': 'AdamW', 'weight_decay': 0.1, 'top_n_features': 65}. Best is trial 246 with value: 0.16447311791139763.[0m
[FileBasedDataset] Initializing dataset...
	Examples: 8264
	Features: 72
	Max length: 315
Standard scalar turned ON, loading params from cache
[FileBasedDataset] Dataset initialization complete
  epoch    auprc    auroc    train_loss    valid_acc    valid_loss    cp      dur
-------  -------  -------  ------------  -----------  ------------  ----  -------
      1   [36m0.2700[0m   [32m0.7438[0m        [35m0.3237[0m       [31m0.9335[0m        [94m0.2128[0m     +  26.2039
      2   [36m0.2968[0m   [32m0.7712[0m        [35m0.2470[0m       0.9311        [94m0.2077[0m     +  26.4053
      3   0.2938   [32m0.7803[0m        [35m0.2425[0m       0.9311        [94m0.2072[0m     +  26.3378
      4   0.2839   [32m0.7847[0m        [35m0.2379[0m       0.9335        0.2076        26.2247
      5   0.2768   [32m0.7892[0m        [35m0.2361[0m       [31m0.9347[0m        0.2103        26.3818
      6   0.2852   [32m0.7926[0m        [35m0.2321[0m       0.9335        0.2109        26.4339
      7   0.2728   0.7885        [35m0.2290[0m       0.9287        0.2169        26.2781
      8   0.2753   0.7913        [35m0.2257[0m       0.9250        0.2224        26.3764
      9   0.2605   0.7834        [35m0.2230[0m       0.9250        0.2257        26.7978
     10   0.2706   0.7855        [35m0.2203[0m       0.9287        0.2281        26.3226
     11   0.2670   0.7854        [35m0.2183[0m       0.9262        0.2322        26.3716
     12   0.2619   0.7811        [35m0.2155[0m       0.9262        0.2392        26.4196
Stopping since valid_loss has not improved in the last 10 epochs.
[32m[I 2023-05-05 04:15:21,104][0m Trial 543 finished with value: 0.20719900210145883 and parameters: {'lr': 2.9257653626012884e-05, 'dropout': 0.2962349390751788, 'd_model_multiplier': 8, 'num_layers': 5, 'n_heads': 32, 'dim_feedforward': 327, 'batch_size': 14, 'pos_encoding': 'fixed', 'activation': 'relu', 'norm': 'LayerNorm', 'optimizer_name': 'RAdam', 'weight_decay': 0.1, 'top_n_features': 72}. Best is trial 246 with value: 0.16447311791139763.[0m
[FileBasedDataset] Initializing dataset...
	Examples: 8264
	Features: 58
	Max length: 315
Standard scalar turned ON, loading params from cache
[FileBasedDataset] Dataset initialization complete
  epoch    auprc    auroc    train_loss    valid_acc    valid_loss    cp      dur
-------  -------  -------  ------------  -----------  ------------  ----  -------
      1   [36m0.2026[0m   [32m0.6889[0m        [35m0.2981[0m       [31m0.9226[0m        [94m0.2500[0m     +  21.7255
      2   [36m0.3184[0m   [32m0.8007[0m        [35m0.2510[0m       [31m0.9250[0m        [94m0.2289[0m     +  22.0232
      3   [36m0.3614[0m   [32m0.8223[0m        [35m0.2406[0m       [31m0.9274[0m        [94m0.2197[0m     +  21.9332
      4   0.3602   [32m0.8264[0m        0.2407       0.9262        [94m0.2197[0m     +  21.8657
      5   0.3612   [32m0.8322[0m        [35m0.2366[0m       0.9262        [94m0.2129[0m     +  21.9806
      6   0.3449   0.7986        [35m0.2362[0m       [31m0.9299[0m        0.2275        21.8216
      7   0.3571   0.8227        [35m0.2341[0m       0.9250        0.2188        21.8434
      8   0.3344   0.8094        [35m0.2325[0m       0.9238        0.2242        22.2697
      9   [36m0.3707[0m   0.8222        0.2331       0.9299        0.2181        21.7882
     10   0.2922   0.8047        [35m0.2316[0m       0.9250        0.2278        22.0593
     11   0.2742   0.7788        0.2337       0.9190        0.2372        22.0406
     12   0.3481   0.8203        [35m0.2305[0m       0.9214        0.2245        22.0171
     13   0.3465   0.8032        0.2327       [31m0.9311[0m        0.2265        21.9763
     14   0.3596   0.8014        0.2319       0.9299        0.2280        21.7830
Stopping since valid_loss has not improved in the last 10 epochs.
[32m[I 2023-05-05 04:20:50,689][0m Trial 544 finished with value: 0.21285660761299272 and parameters: {'lr': 0.0023473655618679533, 'dropout': 0.2729839536659405, 'd_model_multiplier': 1, 'num_layers': 6, 'n_heads': 32, 'dim_feedforward': 432, 'batch_size': 74, 'pos_encoding': 'fixed', 'activation': 'relu', 'norm': 'LayerNorm', 'optimizer_name': 'PlainRAdam', 'weight_decay': 0.1, 'top_n_features': 58}. Best is trial 246 with value: 0.16447311791139763.[0m
[FileBasedDataset] Initializing dataset...
	Examples: 8264
	Features: 48
	Max length: 315
Standard scalar turned ON, loading params from cache
[FileBasedDataset] Dataset initialization complete
  epoch    auprc    auroc    train_loss    valid_acc    valid_loss    cp      dur
-------  -------  -------  ------------  -----------  ------------  ----  -------
      1   [36m0.2447[0m   [32m0.7485[0m        [35m0.2992[0m       [31m0.9371[0m        [94m0.2108[0m     +  19.8918
      2   [36m0.2546[0m   0.7429        [35m0.2739[0m       0.9371        [94m0.2054[0m     +  19.7672
      3   0.2288   [32m0.7512[0m        [35m0.2678[0m       0.9371        0.2073        19.9570
      4   [36m0.2650[0m   0.7486        [35m0.2632[0m       0.9371        0.2117        19.9242
      5   [36m0.2847[0m   [32m0.7607[0m        0.2638       0.9371        0.2092        19.7948
      6   0.2475   0.7579        [35m0.2615[0m       0.9371        0.2144        19.8759
      7   0.2752   0.7584        0.2624       0.9371        [94m0.2053[0m     +  20.1654
      8   0.2629   0.7562        [35m0.2607[0m       0.9371        0.2106        19.7937
      9   0.2820   0.7583        0.2627       0.9371        0.2079        19.8907
     10   0.2618   0.7560        [35m0.2601[0m       0.9371        [94m0.2033[0m     +  19.8917
     11   0.2721   0.7553        0.2609       0.9371        [94m0.2011[0m     +  20.0133
     12   [36m0.2899[0m   0.7517        0.2609       0.9371        [94m0.1993[0m     +  20.0224
     13   0.2289   0.7524        [35m0.2598[0m       0.9371        0.2008        20.0366
     14   0.2480   0.7522        0.2607       0.9371        0.2011        19.9623
     15   0.2615   0.7558        [35m0.2582[0m       0.9359        0.2033        19.9650
     16   0.2413   0.7492        0.2583       0.9371        0.2030        19.8634
     17   0.2608   0.7588        0.2604       0.9371        0.2008        20.0460
     18   0.2378   0.7489        0.2614       0.9371        0.2085        19.9613
     19   0.2538   0.7567        0.2597       0.9371        0.2170        19.9533
     20   0.2368   0.7553        [35m0.2569[0m       0.9371        0.2105        20.1128
     21   0.2498   0.7541        0.2590       0.9371        0.2165        19.8125
Stopping since valid_loss has not improved in the last 10 epochs.
[32m[I 2023-05-05 04:28:10,238][0m Trial 545 finished with value: 0.19934087172330794 and parameters: {'lr': 0.001380749531328924, 'dropout': 0.50538458884799, 'd_model_multiplier': 4, 'num_layers': 4, 'n_heads': 32, 'dim_feedforward': 319, 'batch_size': 27, 'pos_encoding': 'fixed', 'activation': 'relu', 'norm': 'LayerNorm', 'optimizer_name': 'AdamW', 'weight_decay': 0.001, 'top_n_features': 48}. Best is trial 246 with value: 0.16447311791139763.[0m
[FileBasedDataset] Initializing dataset...
	Examples: 8264
	Features: 46
	Max length: 315
Standard scalar turned ON, loading params from cache
[FileBasedDataset] Dataset initialization complete
  epoch    auprc    auroc    train_loss    valid_acc    valid_loss    cp      dur
-------  -------  -------  ------------  -----------  ------------  ----  -------
      1   [36m0.1819[0m   [32m0.7114[0m        [35m0.3199[0m       [31m0.9081[0m        [94m0.4105[0m     +  41.5703
      2   [36m0.1853[0m   [32m0.7131[0m        [35m0.2861[0m       0.8863        [94m0.3703[0m     +  41.5288
      3   0.1823   [32m0.7141[0m        [35m0.2706[0m       0.8839        [94m0.3484[0m     +  41.5351
      4   0.1838   [32m0.7184[0m        [35m0.2649[0m       0.8936        [94m0.3240[0m     +  41.6381
      5   0.1822   0.7135        [35m0.2602[0m       0.9081        [94m0.3114[0m     +  41.4571
      6   0.1829   0.7149        0.2612       [31m0.9105[0m        [94m0.3040[0m     +  41.6319
      7   [36m0.1867[0m   0.7159        0.2608       [31m0.9117[0m        [94m0.2774[0m     +  41.5946
      8   0.1829   0.7164        [35m0.2602[0m       0.9105        [94m0.2738[0m     +  41.5361
      9   0.1810   0.7163        [35m0.2600[0m       0.9105        0.2785        41.5616
     10   0.1835   0.7160        0.2611       0.9117        [94m0.2695[0m     +  41.5563
     11   0.1816   0.7172        [35m0.2588[0m       0.9105        [94m0.2667[0m     +  41.7401
     12   0.1816   0.7170        [35m0.2564[0m       0.9093        [94m0.2546[0m     +  41.5444
     13   0.1817   0.7153        [35m0.2552[0m       0.9105        0.2599        41.4908
     14   0.1790   0.7124        0.2559       0.8924        0.2761        41.6149
     15   0.1811   0.7177        0.2558       0.9093        [94m0.2464[0m     +  41.4098
     16   0.1818   [32m0.7196[0m        0.2558       [31m0.9166[0m        [94m0.2389[0m     +  41.5643
     17   0.1815   0.7145        0.2555       0.9105        0.2564        41.4167
     18   0.1856   0.7147        0.2557       0.9117        0.2561        41.5094
     19   0.1851   0.7139        0.2571       0.9081        0.2505        41.6635
     20   0.1818   0.7133        0.2556       0.9129        0.2628        41.6127
     21   0.1823   0.7126        0.2578       0.9093        0.2736        41.4719
     22   0.1811   0.7159        0.2567       0.9093        0.2789        41.5052
     23   0.1841   0.7140        [35m0.2541[0m       [31m0.9178[0m        0.2632        41.6413
     24   0.1853   0.7179        0.2572       0.9117        0.2633        41.6209
     25   [36m0.1876[0m   0.7161        0.2554       0.9178        0.2613        41.6201
Stopping since valid_loss has not improved in the last 10 epochs.
