[32m[I 2023-01-08 21:32:37,030][0m Trial 61 finished with value: 0.3404885988597662 and parameters: {'lr': 2.108069933892189e-10, 'dropout': 0.624334850617578, 'd_model_multiplier': 32, 'num_layers': 1, 'n_heads': 32, 'dim_feedforward': 456, 'batch_size': 65, 'pos_encoding': 'fixed', 'activation': 'relu', 'norm': 'BatchNorm', 'optimizer_name': 'PlainRAdam', 'weight_decay': 0.1}. Best is trial 48 with value: 0.3954917461755389.[0m
[EnsembleDataset] Initializing dataset...
	Examples: 27964
	Features: 621
	Max length: 316
[EnsembleDataset] Dataset initialization complete
  epoch    auprc    auroc    train_loss    valid_loss    cp      dur
-------  -------  -------  ------------  ------------  ----  -------
      1   [36m0.3121[0m   [32m0.8208[0m        [35m0.1605[0m        [31m0.0539[0m     +  40.4897
      2   0.3102   0.8205        [35m0.1508[0m        0.0539        40.0883
      3   [36m0.3122[0m   0.8206        [35m0.1487[0m        0.0540        40.2321
Stopping since valid_loss has not improved in the last 3 epochs.
[32m[I 2023-01-08 21:39:32,497][0m Trial 62 finished with value: 0.3121835920510367 and parameters: {'lr': 4.1003291189914456e-10, 'dropout': 0.5770239605422182, 'd_model_multiplier': 32, 'num_layers': 1, 'n_heads': 32, 'dim_feedforward': 447, 'batch_size': 69, 'pos_encoding': 'fixed', 'activation': 'relu', 'norm': 'BatchNorm', 'optimizer_name': 'PlainRAdam', 'weight_decay': 0.1}. Best is trial 48 with value: 0.3954917461755389.[0m
[EnsembleDataset] Initializing dataset...
	Examples: 27964
	Features: 621
	Max length: 316
[EnsembleDataset] Dataset initialization complete
  epoch    auprc    auroc    train_loss    valid_loss    cp      dur
-------  -------  -------  ------------  ------------  ----  -------
      1   [36m0.2451[0m   [32m0.8091[0m        [35m0.1344[0m        [31m0.0448[0m     +  29.3134
      2   0.2434   0.8085        0.1376        [31m0.0448[0m     +  28.9919
      3   0.2442   0.8086        0.1381        0.0450        29.3073
Stopping since valid_loss has not improved in the last 3 epochs.
[32m[I 2023-01-08 21:45:49,470][0m Trial 63 finished with value: 0.24507861226889713 and parameters: {'lr': 3.53118077252509e-09, 'dropout': 0.6153380703000244, 'd_model_multiplier': 2, 'num_layers': 1, 'n_heads': 32, 'dim_feedforward': 396, 'batch_size': 47, 'pos_encoding': 'fixed', 'activation': 'relu', 'norm': 'BatchNorm', 'optimizer_name': 'PlainRAdam', 'weight_decay': 0.1}. Best is trial 48 with value: 0.3954917461755389.[0m
[EnsembleDataset] Initializing dataset...
	Examples: 27964
	Features: 621
	Max length: 316
[EnsembleDataset] Dataset initialization complete
  epoch    auprc    auroc    train_loss    valid_loss    cp      dur
-------  -------  -------  ------------  ------------  ----  -------
      1   [36m0.2910[0m   [32m0.8219[0m        [35m0.1046[0m        [31m0.0536[0m     +  71.5368
      2   [36m0.2910[0m   0.8216        0.1076        0.0538        71.3499
      3   0.2901   0.8213        0.1073        0.0536        71.6899
Stopping since valid_loss has not improved in the last 3 epochs.
[32m[I 2023-01-08 21:54:53,018][0m Trial 64 finished with value: 0.2909674464305394 and parameters: {'lr': 9.581347271462212e-10, 'dropout': 0.31622299655829156, 'd_model_multiplier': 32, 'num_layers': 2, 'n_heads': 32, 'dim_feedforward': 464, 'batch_size': 63, 'pos_encoding': 'fixed', 'activation': 'relu', 'norm': 'BatchNorm', 'optimizer_name': 'PlainRAdam', 'weight_decay': 0.1}. Best is trial 48 with value: 0.3954917461755389.[0m
[EnsembleDataset] Initializing dataset...
	Examples: 27964
	Features: 621
	Max length: 316
[EnsembleDataset] Dataset initialization complete
Warning, assumed runtime error: CUDA out of memory. Tried to allocate 3.26 GiB (GPU 0; 23.70 GiB total capacity; 18.27 GiB already allocated; 2.39 GiB free; 20.23 GiB reserved in total by PyTorch) If reserved memory is >> allocated memory try setting max_split_size_mb to avoid fragmentation.  See documentation for Memory Management and PYTORCH_CUDA_ALLOC_CONF
[32m[I 2023-01-08 21:54:58,434][0m Trial 65 finished with value: 0.0 and parameters: {'lr': 2.508270981905037e-10, 'dropout': 0.6209129554570388, 'd_model_multiplier': 64, 'num_layers': 3, 'n_heads': 64, 'dim_feedforward': 440, 'batch_size': 137, 'pos_encoding': 'fixed', 'activation': 'relu', 'norm': 'BatchNorm', 'optimizer_name': 'PlainRAdam', 'weight_decay': 0.1}. Best is trial 48 with value: 0.3954917461755389.[0m
[EnsembleDataset] Initializing dataset...
	Examples: 27964
	Features: 621
	Max length: 316
[EnsembleDataset] Dataset initialization complete
  epoch    auprc    auroc    train_loss    valid_loss    cp      dur
-------  -------  -------  ------------  ------------  ----  -------
      1   [36m0.2553[0m   [32m0.8022[0m        [35m0.1631[0m        [31m0.0501[0m     +  31.1128
      2   [36m0.2554[0m   [32m0.8025[0m        [35m0.1464[0m        [31m0.0501[0m     +  31.2113
      3   0.2554   0.8022        [35m0.1393[0m        0.0501        31.1775
      4   [36m0.2555[0m   0.8021        [35m0.1340[0m        0.0501        31.2396
Stopping since valid_loss has not improved in the last 3 epochs.
[32m[I 2023-01-08 22:03:14,044][0m Trial 66 finished with value: 0.25554730313345225 and parameters: {'lr': 6.427644390120783e-09, 'dropout': 0.6586907785288967, 'd_model_multiplier': 32, 'num_layers': 3, 'n_heads': 8, 'dim_feedforward': 493, 'batch_size': 125, 'pos_encoding': 'fixed', 'activation': 'relu', 'norm': 'BatchNorm', 'optimizer_name': 'PlainRAdam', 'weight_decay': 0.1}. Best is trial 48 with value: 0.3954917461755389.[0m
[EnsembleDataset] Initializing dataset...
	Examples: 27964
	Features: 621
	Max length: 316
[EnsembleDataset] Dataset initialization complete
  epoch    auprc    auroc    train_loss    valid_loss    cp      dur
-------  -------  -------  ------------  ------------  ----  -------
      1   [36m0.3072[0m   [32m0.8259[0m        [35m0.1316[0m        [31m0.0621[0m     +  42.1952
      2   0.3067   0.8254        [35m0.1224[0m        0.0623        41.9507
      3   [36m0.3078[0m   [32m0.8260[0m        0.1264        [31m0.0618[0m     +  42.3832
      4   0.3073   0.8256        0.1263        0.0618        42.2308
      5   0.3058   0.8252        0.1251        0.0618        41.9205
Stopping since valid_loss has not improved in the last 3 epochs.
[32m[I 2023-01-08 22:14:35,447][0m Trial 67 finished with value: 0.3077532606056138 and parameters: {'lr': 1.0932050121148373e-10, 'dropout': 0.554207947994051, 'd_model_multiplier': 32, 'num_layers': 1, 'n_heads': 32, 'dim_feedforward': 458, 'batch_size': 101, 'pos_encoding': 'fixed', 'activation': 'relu', 'norm': 'BatchNorm', 'optimizer_name': 'PlainRAdam', 'weight_decay': 0}. Best is trial 48 with value: 0.3954917461755389.[0m
[EnsembleDataset] Initializing dataset...
	Examples: 27964
	Features: 621
	Max length: 316
[EnsembleDataset] Dataset initialization complete
  epoch    auprc    auroc    train_loss    valid_loss    cp      dur
-------  -------  -------  ------------  ------------  ----  -------
      1   [36m0.2912[0m   [32m0.8395[0m        [35m0.1362[0m        [31m0.0511[0m     +  29.2406
      2   [36m0.2912[0m   0.8395        0.1511        [31m0.0511[0m     +  29.2151
      3   [36m0.2913[0m   [32m0.8399[0m        0.1393        [31m0.0511[0m     +  29.1317
      4   [36m0.2913[0m   0.8396        0.1557        [31m0.0511[0m     +  29.1484
      5   [36m0.2914[0m   0.8396        0.1535        0.0512        30.4541
      6   0.2911   0.8397        0.1443        0.0512        29.0700
Stopping since valid_loss has not improved in the last 3 epochs.
[32m[I 2023-01-08 22:26:33,417][0m Trial 68 finished with value: 0.2914103496103686 and parameters: {'lr': 1.6854882270621604e-09, 'dropout': 0.6830240733104603, 'd_model_multiplier': 4, 'num_layers': 2, 'n_heads': 8, 'dim_feedforward': 477, 'batch_size': 111, 'pos_encoding': 'fixed', 'activation': 'relu', 'norm': 'BatchNorm', 'optimizer_name': 'PlainRAdam', 'weight_decay': 0.1}. Best is trial 48 with value: 0.3954917461755389.[0m
[EnsembleDataset] Initializing dataset...
	Examples: 27964
	Features: 621
	Max length: 316
[EnsembleDataset] Dataset initialization complete
  epoch    auprc    auroc    train_loss    valid_loss    cp      dur
-------  -------  -------  ------------  ------------  ----  -------
      1   [36m0.2766[0m   [32m0.7707[0m        [35m0.1010[0m        [31m0.0630[0m     +  32.2911
      2   [36m0.2766[0m   [32m0.7707[0m        [35m0.0999[0m        [31m0.0630[0m     +  32.4831
      3   [36m0.2766[0m   [32m0.7707[0m        0.1004        [31m0.0630[0m     +  31.9775
      4   0.2765   [32m0.7707[0m        0.1003        [31m0.0630[0m     +  32.2970
      5   0.2766   [32m0.7708[0m        [35m0.0995[0m        [31m0.0630[0m     +  31.8213
      6   0.2766   [32m0.7708[0m        [35m0.0993[0m        [31m0.0630[0m     +  31.9392
      7   0.2765   0.7708        0.1003        [31m0.0629[0m     +  32.2489
      8   0.2765   [32m0.7708[0m        0.1011        [31m0.0629[0m     +  31.5326
      9   0.2765   [32m0.7709[0m        0.1005        [31m0.0629[0m     +  31.8585
     10   0.2766   [32m0.7709[0m        0.1001        [31m0.0629[0m     +  31.9643
     11   0.2766   [32m0.7709[0m        0.1004        [31m0.0629[0m     +  32.6692
     12   0.2766   [32m0.7709[0m        [35m0.0989[0m        [31m0.0628[0m     +  31.6295
     13   0.2766   [32m0.7710[0m        0.1009        [31m0.0628[0m     +  31.7250
     14   [36m0.2766[0m   [32m0.7710[0m        0.0991        [31m0.0628[0m     +  32.5069
     15   0.2766   [32m0.7710[0m        0.0990        [31m0.0628[0m     +  31.5058
     16   0.2766   [32m0.7710[0m        0.1019        [31m0.0627[0m     +  32.5074
     17   0.2766   [32m0.7711[0m        0.0998        [31m0.0627[0m     +  32.6422
     18   0.2766   [32m0.7711[0m        0.0997        [31m0.0627[0m     +  32.5237
     19   [36m0.2766[0m   [32m0.7711[0m        0.0993        [31m0.0627[0m     +  32.9078
     20   [36m0.2766[0m   [32m0.7712[0m        0.0996        [31m0.0626[0m     +  32.0894
     21   0.2766   [32m0.7712[0m        0.0994        [31m0.0626[0m     +  32.6940
     22   [36m0.2766[0m   [32m0.7712[0m        0.1002        [31m0.0626[0m     +  32.4257
     23   0.2766   [32m0.7713[0m        0.0996        [31m0.0626[0m     +  31.8901
     24   0.2766   [32m0.7713[0m        0.0999        [31m0.0625[0m     +  31.9484
     25   0.2766   [32m0.7713[0m        [35m0.0984[0m        [31m0.0625[0m     +  31.8882
[32m[I 2023-01-08 23:16:45,792][0m Trial 69 finished with value: 0.2766433021355526 and parameters: {'lr': 5.862639302695728e-10, 'dropout': 0.5973556407289867, 'd_model_multiplier': 32, 'num_layers': 4, 'n_heads': 8, 'dim_feedforward': 421, 'batch_size': 157, 'pos_encoding': 'fixed', 'activation': 'relu', 'norm': 'LayerNorm', 'optimizer_name': 'PlainRAdam', 'weight_decay': 0.1}. Best is trial 48 with value: 0.3954917461755389.[0m
[EnsembleDataset] Initializing dataset...
	Examples: 27964
	Features: 621
	Max length: 316
[EnsembleDataset] Dataset initialization complete
  epoch    auprc    auroc    train_loss    valid_loss    cp      dur
-------  -------  -------  ------------  ------------  ----  -------
      1   [36m0.2570[0m   [32m0.8301[0m        [35m0.1360[0m        [31m0.0505[0m     +  29.7962
      2   [36m0.2575[0m   0.8300        0.1375        0.0506        29.4782
      3   0.2557   0.8299        0.1439        0.0506        29.6953
Stopping since valid_loss has not improved in the last 3 epochs.
[32m[I 2023-01-08 23:23:25,263][0m Trial 70 finished with value: 0.25745066794518945 and parameters: {'lr': 9.903985677869646e-09, 'dropout': 0.6288426997425861, 'd_model_multiplier': 2, 'num_layers': 1, 'n_heads': 32, 'dim_feedforward': 449, 'batch_size': 33, 'pos_encoding': 'fixed', 'activation': 'relu', 'norm': 'BatchNorm', 'optimizer_name': 'PlainRAdam', 'weight_decay': 0.1}. Best is trial 48 with value: 0.3954917461755389.[0m
[EnsembleDataset] Initializing dataset...
	Examples: 27964
	Features: 621
	Max length: 316
[EnsembleDataset] Dataset initialization complete
  epoch    auprc    auroc    train_loss    valid_loss    cp       dur
-------  -------  -------  ------------  ------------  ----  --------
      1   [36m0.2774[0m   [32m0.8209[0m        [35m0.1274[0m        [31m0.0546[0m     +  172.6595
      2   [36m0.2789[0m   [32m0.8212[0m        0.1348        [31m0.0545[0m     +  172.6222
      3   [36m0.2792[0m   [32m0.8216[0m        0.1397        [31m0.0545[0m     +  172.1484
      4   0.2790   0.8212        0.1281        0.0545        172.2952
Stopping since valid_loss has not improved in the last 3 epochs.
[32m[I 2023-01-08 23:44:12,736][0m Trial 71 finished with value: 0.279187078322964 and parameters: {'lr': 2.219706476682822e-10, 'dropout': 0.653725122543445, 'd_model_multiplier': 32, 'num_layers': 5, 'n_heads': 32, 'dim_feedforward': 512, 'batch_size': 79, 'pos_encoding': 'fixed', 'activation': 'gelu', 'norm': 'BatchNorm', 'optimizer_name': 'PlainRAdam', 'weight_decay': 0.1}. Best is trial 48 with value: 0.3954917461755389.[0m
[EnsembleDataset] Initializing dataset...
	Examples: 27964
	Features: 621
	Max length: 316
[EnsembleDataset] Dataset initialization complete
  epoch    auprc    auroc    train_loss    valid_loss    cp       dur
-------  -------  -------  ------------  ------------  ----  --------
      1   [36m0.3342[0m   [32m0.8325[0m        [35m0.1291[0m        [31m0.0491[0m     +  107.4323
      2   [36m0.3357[0m   [32m0.8326[0m        [35m0.1174[0m        [31m0.0491[0m     +  106.9536
      3   0.3347   0.8326        [35m0.1138[0m        0.0491        107.2811
      4   0.3350   [32m0.8327[0m        0.1158        0.0491        106.8626
Stopping since valid_loss has not improved in the last 3 epochs.
[32m[I 2023-01-08 23:59:32,043][0m Trial 72 finished with value: 0.33570338846094855 and parameters: {'lr': 1.704041252619639e-10, 'dropout': 0.646980168986865, 'd_model_multiplier': 32, 'num_layers': 3, 'n_heads': 32, 'dim_feedforward': 484, 'batch_size': 90, 'pos_encoding': 'fixed', 'activation': 'gelu', 'norm': 'BatchNorm', 'optimizer_name': 'PlainRAdam', 'weight_decay': 0.1}. Best is trial 48 with value: 0.3954917461755389.[0m
[EnsembleDataset] Initializing dataset...
	Examples: 27964
	Features: 621
	Max length: 316
[EnsembleDataset] Dataset initialization complete
  epoch    auprc    auroc    train_loss    valid_loss    cp       dur
-------  -------  -------  ------------  ------------  ----  --------
      1   [36m0.2917[0m   [32m0.8367[0m        [35m0.1457[0m        [31m0.0471[0m     +  107.5714
      2   [36m0.2918[0m   [32m0.8368[0m        0.1529        [31m0.0471[0m     +  107.7757
      3   0.2916   0.8368        [35m0.1351[0m        0.0471        107.5271
      4   0.2917   0.8362        0.1549        [31m0.0470[0m     +  107.1477
      5   [36m0.2918[0m   0.8368        0.1362        [31m0.0470[0m     +  107.2896
      6   0.2916   0.8368        0.1423        0.0470        107.3537
      7   0.2918   [32m0.8370[0m        0.1408        0.0471        107.3509
Stopping since valid_loss has not improved in the last 3 epochs.
[32m[I 2023-01-09 00:25:02,697][0m Trial 73 finished with value: 0.2918048469531359 and parameters: {'lr': 9.177728340127737e-10, 'dropout': 0.6798116019551166, 'd_model_multiplier': 32, 'num_layers': 3, 'n_heads': 32, 'dim_feedforward': 495, 'batch_size': 88, 'pos_encoding': 'fixed', 'activation': 'gelu', 'norm': 'BatchNorm', 'optimizer_name': 'PlainRAdam', 'weight_decay': 0.1}. Best is trial 48 with value: 0.3954917461755389.[0m
[EnsembleDataset] Initializing dataset...
	Examples: 27964
	Features: 621
	Max length: 316
[EnsembleDataset] Dataset initialization complete
  epoch    auprc    auroc    train_loss    valid_loss    cp      dur
-------  -------  -------  ------------  ------------  ----  -------
      1   [36m0.3441[0m   [32m0.8426[0m        [35m0.1397[0m        [31m0.0549[0m     +  72.0241
      2   [36m0.3445[0m   0.8425        [35m0.1351[0m        0.0551        71.4672
      3   [36m0.3445[0m   [32m0.8427[0m        0.1382        0.0550        71.3616
Stopping since valid_loss has not improved in the last 3 epochs.
[32m[I 2023-01-09 00:34:38,251][0m Trial 74 finished with value: 0.3444744981488902 and parameters: {'lr': 3.467422169197705e-09, 'dropout': 0.6994593880569433, 'd_model_multiplier': 32, 'num_layers': 2, 'n_heads': 32, 'dim_feedforward': 469, 'batch_size': 66, 'pos_encoding': 'fixed', 'activation': 'gelu', 'norm': 'BatchNorm', 'optimizer_name': 'PlainRAdam', 'weight_decay': 0}. Best is trial 48 with value: 0.3954917461755389.[0m
[EnsembleDataset] Initializing dataset...
	Examples: 27964
	Features: 621
	Max length: 316
[EnsembleDataset] Dataset initialization complete
  epoch    auprc    auroc    train_loss    valid_loss    cp      dur
-------  -------  -------  ------------  ------------  ----  -------
      1   [36m0.3498[0m   [32m0.8440[0m        [35m0.1710[0m        [31m0.0545[0m     +  29.5625
      2   [36m0.3500[0m   [32m0.8440[0m        [35m0.1686[0m        [31m0.0545[0m     +  29.6523
      3   0.3453   0.8436        [35m0.1686[0m        0.0547        29.6458
      4   0.3458   0.8430        0.1813        0.0547        29.3687
Stopping since valid_loss has not improved in the last 3 epochs.
[32m[I 2023-01-09 00:43:24,499][0m Trial 75 finished with value: 0.3500408457998093 and parameters: {'lr': 3.5486916606937804e-09, 'dropout': 0.6867557988785428, 'd_model_multiplier': 4, 'num_layers': 2, 'n_heads': 8, 'dim_feedforward': 470, 'batch_size': 67, 'pos_encoding': 'fixed', 'activation': 'gelu', 'norm': 'BatchNorm', 'optimizer_name': 'PlainRAdam', 'weight_decay': 0}. Best is trial 48 with value: 0.3954917461755389.[0m
[EnsembleDataset] Initializing dataset...
	Examples: 27964
	Features: 621
	Max length: 316
[EnsembleDataset] Dataset initialization complete
  epoch    auprc    auroc    train_loss    valid_loss    cp      dur
-------  -------  -------  ------------  ------------  ----  -------
      1   [36m0.3190[0m   [32m0.8482[0m        [35m0.1344[0m        [31m0.0497[0m     +  28.8588
      2   [36m0.3198[0m   [32m0.8483[0m        0.1440        [31m0.0497[0m     +  29.5300
      3   0.3116   0.8475        0.1455        0.0500        29.5775
      4   0.3173   0.8478        0.1452        0.0498        29.4056
Stopping since valid_loss has not improved in the last 3 epochs.
[32m[I 2023-01-09 00:52:10,418][0m Trial 76 finished with value: 0.31981521928575957 and parameters: {'lr': 4.803948715197641e-08, 'dropout': 0.6995156996512764, 'd_model_multiplier': 4, 'num_layers': 2, 'n_heads': 8, 'dim_feedforward': 434, 'batch_size': 49, 'pos_encoding': 'fixed', 'activation': 'gelu', 'norm': 'BatchNorm', 'optimizer_name': 'PlainRAdam', 'weight_decay': 0}. Best is trial 48 with value: 0.3954917461755389.[0m
[EnsembleDataset] Initializing dataset...
	Examples: 27964
	Features: 621
	Max length: 316
[EnsembleDataset] Dataset initialization complete
  epoch    auprc    auroc    train_loss    valid_loss    cp      dur
-------  -------  -------  ------------  ------------  ----  -------
      1   [36m0.2773[0m   [32m0.7944[0m        [35m0.1295[0m        [31m0.0523[0m     +  29.5013
      2   0.2773   [32m0.7952[0m        0.1345        0.0524        28.6955
      3   [36m0.2774[0m   0.7950        0.1312        [31m0.0522[0m     +  29.1798
      4   0.2762   0.7934        0.1296        0.0531        29.0844
      5   0.2770   0.7939        0.1343        0.0534        29.2156
Stopping since valid_loss has not improved in the last 3 epochs.
