[32m[I 2023-05-02 22:44:59,802][0m Trial 226 finished with value: 0.23406230279006865 and parameters: {'lr': 7.230278331841934e-06, 'dropout': 0.5032461335834945, 'd_model_multiplier': 4, 'num_layers': 3, 'n_heads': 8, 'dim_feedforward': 274, 'batch_size': 58, 'pos_encoding': 'learnable', 'activation': 'relu', 'norm': 'LayerNorm', 'optimizer_name': 'AdamW', 'weight_decay': 0.1, 'top_n_features': 63}. Best is trial 117 with value: 0.191397856754288.[0m
[FileBasedDataset] Initializing dataset...
	Examples: 8264
	Features: 233
	Max length: 315
Standard scalar turned ON, loading params from cache
[FileBasedDataset] Dataset initialization complete
  epoch    auprc    auroc    train_loss    valid_acc    valid_loss    cp      dur
-------  -------  -------  ------------  -----------  ------------  ----  -------
      1   [36m0.0699[0m   [32m0.3962[0m        [35m0.4103[0m       [31m0.9190[0m        [94m0.7312[0m     +  66.7632
      2   [36m0.0923[0m   [32m0.5289[0m        [35m0.3641[0m       0.9190        [94m0.6142[0m     +  67.1201
      3   [36m0.1556[0m   [32m0.6063[0m        [35m0.3089[0m       0.9190        [94m0.4326[0m     +  67.2689
      4   [36m0.1791[0m   [32m0.6352[0m        [35m0.2775[0m       0.9190        [94m0.3770[0m     +  67.1482
      5   0.1690   [32m0.6523[0m        [35m0.2657[0m       0.9190        [94m0.3650[0m     +  67.2472
      6   [36m0.1831[0m   0.6423        [35m0.2616[0m       0.9190        [94m0.3599[0m     +  67.0659
      7   0.1676   0.6338        [35m0.2590[0m       0.9190        [94m0.3482[0m     +  67.4968
      8   0.1745   0.6493        [35m0.2570[0m       0.9190        [94m0.3272[0m     +  67.0632
      9   0.1781   0.6496        0.2571       0.9190        [94m0.3136[0m     +  67.4965
     10   0.1690   0.6380        [35m0.2565[0m       0.9190        [94m0.3054[0m     +  67.5366
     11   [36m0.1848[0m   0.6489        0.2584       0.9190        [94m0.3035[0m     +  67.5070
     12   0.1737   0.6366        [35m0.2553[0m       0.9190        0.3090        67.3322
     13   0.1776   [32m0.6620[0m        0.2555       0.9190        [94m0.2922[0m     +  67.3790
     14   0.1620   0.6396        [35m0.2551[0m       0.9190        0.2936        67.4938
     15   0.1670   0.6510        0.2555       0.9190        [94m0.2910[0m     +  67.4763
     16   0.1602   0.6334        [35m0.2534[0m       0.9190        0.2917        67.2852
     17   0.1729   [32m0.6649[0m        0.2562       0.9190        [94m0.2786[0m     +  67.0809
     18   0.1724   0.6315        0.2541       0.9190        0.2896        67.2932
     19   0.1847   0.6594        0.2537       0.9190        0.2803        67.3030
     20   [36m0.1857[0m   [32m0.6681[0m        0.2538       0.9190        [94m0.2762[0m     +  67.1422
     21   0.1754   0.6468        [35m0.2530[0m       0.9190        [94m0.2736[0m     +  67.2896
     22   [36m0.1867[0m   [32m0.6864[0m        [35m0.2522[0m       0.9190        [94m0.2653[0m     +  66.9564
     23   0.1734   0.6637        0.2532       0.9190        0.2716        67.0587
     24   0.1704   [32m0.6874[0m        0.2524       0.9190        [94m0.2635[0m     +  67.2721
     25   0.1665   0.6829        0.2529       0.9190        0.2681        67.3111
     26   0.1822   [32m0.6889[0m        [35m0.2508[0m       0.9190        0.2653        67.5764
     27   0.1757   0.6816        0.2520       0.9190        0.2665        67.3453
     28   0.1800   [32m0.6924[0m        [35m0.2487[0m       0.9190        [94m0.2615[0m     +  66.9190
     29   0.1807   0.6915        0.2497       0.9190        0.2627        67.2059
     30   0.1787   0.6824        0.2501       0.9190        0.2653        67.0806
     31   0.1806   [32m0.6928[0m        0.2505       0.9190        0.2627        66.9188
     32   0.1841   [32m0.6939[0m        0.2508       0.9190        [94m0.2607[0m     +  66.8615
     33   0.1865   0.6905        0.2487       0.9190        0.2671        67.2694
     34   0.1860   [32m0.6957[0m        0.2516       0.9190        [94m0.2601[0m     +  67.0649
     35   [36m0.1934[0m   [32m0.6989[0m        0.2496       0.9190        [94m0.2589[0m     +  67.3548
     36   0.1867   0.6970        0.2502       0.9190        [94m0.2584[0m     +  67.2164
     37   0.1815   0.6923        0.2504       0.9190        0.2604        67.2114
     38   0.1837   0.6907        0.2495       0.9190        0.2602        67.2079
     39   0.1807   0.6924        0.2503       0.9190        0.2608        67.3639
     40   0.1812   0.6962        0.2493       0.9190        0.2585        67.2140
     41   0.1865   0.6930        0.2496       0.9190        0.2596        67.1549
     42   0.1877   0.6963        0.2494       0.9190        0.2587        66.9514
     43   0.1874   0.6978        [35m0.2483[0m       0.9190        0.2587        66.9730
     44   0.1844   0.6982        0.2493       0.9190        0.2586        67.1889
     45   0.1856   0.6983        0.2484       0.9190        [94m0.2581[0m     +  67.2046
     46   0.1830   0.6978        0.2485       0.9190        [94m0.2580[0m     +  67.2270
     47   0.1802   0.6941        0.2486       0.9190        0.2588        67.2424
     48   0.1848   0.6976        0.2484       0.9190        0.2590        67.0088
     49   0.1848   0.6973        0.2490       0.9190        0.2590        67.1891
     50   0.1847   0.6958        0.2489       0.9190        0.2593        67.1475
[32m[I 2023-05-02 23:41:28,274][0m Trial 227 finished with value: 0.25799551013825595 and parameters: {'lr': 0.0007187496198949496, 'dropout': 0.4708772043719489, 'd_model_multiplier': 32, 'num_layers': 7, 'n_heads': 32, 'dim_feedforward': 199, 'batch_size': 9, 'pos_encoding': 'fixed', 'activation': 'relu', 'norm': 'LayerNorm', 'optimizer_name': 'RAdam', 'weight_decay': 0.1, 'top_n_features': 233}. Best is trial 117 with value: 0.191397856754288.[0m
[FileBasedDataset] Initializing dataset...
	Examples: 8264
	Features: 225
	Max length: 315
Standard scalar turned ON, loading params from cache
[FileBasedDataset] Dataset initialization complete
  epoch    auprc    auroc    train_loss    valid_acc    valid_loss    cp      dur
-------  -------  -------  ------------  -----------  ------------  ----  -------
      1   [36m0.2275[0m   [32m0.7470[0m        [35m0.2853[0m       [31m0.9166[0m        [94m0.2511[0m     +  21.4070
      2   0.2130   0.7351        [35m0.2615[0m       [31m0.9202[0m        0.2565        21.4720
      3   [36m0.2815[0m   [32m0.7544[0m        [35m0.2525[0m       0.9166        [94m0.2385[0m     +  21.2421
      4   [36m0.2830[0m   [32m0.7584[0m        [35m0.2478[0m       [31m0.9262[0m        0.2436        21.4348
      5   [36m0.2941[0m   [32m0.7600[0m        [35m0.2438[0m       0.9250        0.2556        21.6129
      6   [36m0.3180[0m   [32m0.7608[0m        [35m0.2427[0m       0.9262        0.2391        21.7427
      7   [36m0.3252[0m   [32m0.7644[0m        0.2435       [31m0.9274[0m        0.2438        21.7474
      8   0.3166   [32m0.7665[0m        [35m0.2362[0m       0.9250        0.2426        21.4724
      9   0.3211   0.7605        [35m0.2342[0m       0.9262        0.2532        21.3124
     10   0.3046   0.7651        0.2366       0.9238        0.2430        21.6961
     11   0.3183   0.7610        [35m0.2324[0m       [31m0.9287[0m        0.2519        21.4468
     12   [36m0.3364[0m   0.7654        0.2345       0.9262        0.2387        21.3423
Stopping since valid_loss has not improved in the last 10 epochs.
[32m[I 2023-05-02 23:46:08,091][0m Trial 228 finished with value: 0.2384942468377382 and parameters: {'lr': 0.0003268853026616177, 'dropout': 0.4890547637883249, 'd_model_multiplier': 8, 'num_layers': 4, 'n_heads': 32, 'dim_feedforward': 267, 'batch_size': 47, 'pos_encoding': 'fixed', 'activation': 'relu', 'norm': 'LayerNorm', 'optimizer_name': 'AdamW', 'weight_decay': 0.1, 'top_n_features': 225}. Best is trial 117 with value: 0.191397856754288.[0m
[FileBasedDataset] Initializing dataset...
	Examples: 8264
	Features: 40
	Max length: 315
Standard scalar turned ON, loading params from cache
[FileBasedDataset] Dataset initialization complete
Warning, assumed runtime error: CUDA out of memory. Tried to allocate 982.00 MiB (GPU 0; 23.70 GiB total capacity; 20.80 GiB already allocated; 259.25 MiB free; 22.35 GiB reserved in total by PyTorch) If reserved memory is >> allocated memory try setting max_split_size_mb to avoid fragmentation.  See documentation for Memory Management and PYTORCH_CUDA_ALLOC_CONF
[32m[I 2023-05-02 23:46:13,146][0m Trial 229 finished with value: 100.0 and parameters: {'lr': 0.001409447674554667, 'dropout': 0.4560429895093182, 'd_model_multiplier': 64, 'num_layers': 5, 'n_heads': 32, 'dim_feedforward': 331, 'batch_size': 81, 'pos_encoding': 'learnable', 'activation': 'relu', 'norm': 'LayerNorm', 'optimizer_name': 'AdamW', 'weight_decay': 0.1, 'top_n_features': 40}. Best is trial 117 with value: 0.191397856754288.[0m
[FileBasedDataset] Initializing dataset...
	Examples: 8264
	Features: 33
	Max length: 315
Standard scalar turned ON, loading params from cache
[FileBasedDataset] Dataset initialization complete
  epoch    auprc    auroc    train_loss    valid_acc    valid_loss    cp     dur
-------  -------  -------  ------------  -----------  ------------  ----  ------
      1   [36m0.3519[0m   [32m0.7975[0m        [35m0.2580[0m       [31m0.9154[0m        [94m0.2526[0m     +  8.6302
      2   [36m0.3622[0m   [32m0.8089[0m        [35m0.2305[0m       [31m0.9166[0m        0.2566        9.6300
      3   [36m0.3698[0m   [32m0.8185[0m        [35m0.2271[0m       [31m0.9178[0m        [94m0.2501[0m     +  9.4660
      4   [36m0.3780[0m   [32m0.8241[0m        [35m0.2209[0m       [31m0.9190[0m        [94m0.2491[0m     +  9.5630
      5   0.3728   [32m0.8343[0m        [35m0.2206[0m       0.9190        [94m0.2350[0m     +  9.5264
      6   [36m0.3993[0m   [32m0.8409[0m        [35m0.2160[0m       [31m0.9226[0m        0.2394        10.0701
      7   [36m0.4145[0m   0.8404        0.2162       0.9214        [94m0.2322[0m     +  9.5995
      8   0.3744   0.8398        [35m0.2143[0m       0.9226        0.2374        9.7508
      9   0.3792   0.8232        [35m0.2119[0m       0.9226        0.2437        9.5245
     10   0.3806   0.8307        [35m0.2091[0m       0.9202        0.2417        9.6616
     11   0.3481   0.8128        0.2104       0.9202        0.2550        9.5613
     12   0.3748   0.8245        [35m0.2047[0m       0.9202        0.2520        9.7717
     13   0.3746   0.8274        0.2050       0.9226        0.2486        9.4413
     14   0.3498   0.8269        [35m0.2020[0m       0.9190        0.2494        9.9629
     15   0.3574   0.7963        [35m0.2005[0m       0.9202        0.2667        9.7009
     16   0.3453   0.7989        0.2020       0.9178        0.2648        9.8870
Stopping since valid_loss has not improved in the last 10 epochs.
[32m[I 2023-05-02 23:48:57,416][0m Trial 230 finished with value: 0.2321921671226062 and parameters: {'lr': 0.0005983675000352911, 'dropout': 0.2882311397835498, 'd_model_multiplier': 8, 'num_layers': 3, 'n_heads': 8, 'dim_feedforward': 223, 'batch_size': 71, 'pos_encoding': 'fixed', 'activation': 'relu', 'norm': 'LayerNorm', 'optimizer_name': 'AdamW', 'weight_decay': 0.1, 'top_n_features': 33}. Best is trial 117 with value: 0.191397856754288.[0m
[FileBasedDataset] Initializing dataset...
	Examples: 8264
	Features: 38
	Max length: 315
Standard scalar turned ON, loading params from cache
[FileBasedDataset] Dataset initialization complete
  epoch    auprc    auroc    train_loss    valid_acc    valid_loss    cp     dur
-------  -------  -------  ------------  -----------  ------------  ----  ------
      1   [36m0.3799[0m   [32m0.7977[0m        [35m0.2990[0m       [31m0.9154[0m        [94m0.3488[0m     +  8.9350
      2   [36m0.3959[0m   [32m0.8072[0m        [35m0.2627[0m       [31m0.9190[0m        [94m0.2961[0m     +  9.6256
      3   [36m0.4017[0m   [32m0.8163[0m        [35m0.2540[0m       0.9166        [94m0.2746[0m     +  9.9267
      4   [36m0.4079[0m   [32m0.8185[0m        [35m0.2521[0m       [31m0.9202[0m        [94m0.2498[0m     +  9.5718
      5   [36m0.4133[0m   0.8178        [35m0.2494[0m       [31m0.9226[0m        [94m0.2342[0m     +  9.7690
      6   [36m0.4220[0m   0.8173        [35m0.2425[0m       0.9226        [94m0.2282[0m     +  9.9786
      7   [36m0.4233[0m   [32m0.8233[0m        [35m0.2397[0m       0.9226        [94m0.2237[0m     +  9.7707
      8   [36m0.4241[0m   0.8219        [35m0.2389[0m       0.9226        [94m0.2202[0m     +  9.7382
      9   0.4240   [32m0.8264[0m        [35m0.2362[0m       [31m0.9250[0m        [94m0.2190[0m     +  9.6706
     10   [36m0.4308[0m   [32m0.8304[0m        0.2367       0.9202        [94m0.2172[0m     +  9.6340
     11   0.4209   0.8267        [35m0.2334[0m       0.9202        0.2194        9.8627
     12   0.4193   0.8267        [35m0.2324[0m       0.9214        0.2193        10.1422
     13   0.4112   0.8274        [35m0.2314[0m       0.9202        0.2216        9.8347
     14   0.4105   [32m0.8310[0m        [35m0.2312[0m       0.9202        0.2197        9.6272
     15   0.4182   [32m0.8346[0m        [35m0.2276[0m       0.9226        0.2187        9.9703
     16   0.4118   0.8338        0.2285       0.9214        0.2184        9.5499
     17   0.4227   [32m0.8356[0m        [35m0.2266[0m       0.9226        0.2178        9.7935
     18   0.4172   [32m0.8369[0m        [35m0.2252[0m       0.9238        0.2175        9.8565
     19   0.4011   0.8330        [35m0.2241[0m       0.9226        0.2187        9.8997
     20   0.4247   0.8361        0.2260       0.9250        [94m0.2162[0m     +  10.1594
     21   0.4075   0.8315        [35m0.2217[0m       0.9226        0.2182        9.9300
     22   0.3911   0.8335        0.2218       0.9250        0.2179        9.9471
     23   0.3893   0.8316        0.2233       0.9226        0.2193        9.7577
     24   0.3836   0.8266        [35m0.2190[0m       0.9214        0.2206        9.5579
     25   0.3834   0.8298        0.2200       0.9202        0.2200        9.7701
     26   0.3864   0.8270        [35m0.2182[0m       0.9214        0.2199        10.2090
     27   0.3961   0.8289        0.2198       0.9226        0.2191        9.8893
     28   0.3918   0.8270        [35m0.2154[0m       0.9250        0.2201        10.0653
     29   0.4045   0.8295        0.2215       0.9238        0.2188        10.0725
Stopping since valid_loss has not improved in the last 10 epochs.
[32m[I 2023-05-02 23:53:52,416][0m Trial 231 finished with value: 0.2162284619178276 and parameters: {'lr': 0.0007970113606457658, 'dropout': 0.5752214616296705, 'd_model_multiplier': 2, 'num_layers': 2, 'n_heads': 16, 'dim_feedforward': 209, 'batch_size': 63, 'pos_encoding': 'fixed', 'activation': 'gelu', 'norm': 'BatchNorm', 'optimizer_name': 'AdamW', 'weight_decay': 0.1, 'top_n_features': 38}. Best is trial 117 with value: 0.191397856754288.[0m
[FileBasedDataset] Initializing dataset...
	Examples: 8264
	Features: 49
	Max length: 315
Standard scalar turned ON, loading params from cache
[FileBasedDataset] Dataset initialization complete
  epoch    auprc    auroc    train_loss    valid_acc    valid_loss    cp     dur
-------  -------  -------  ------------  -----------  ------------  ----  ------
      1   [36m0.0607[0m   [32m0.3595[0m        [35m0.5665[0m       [31m0.9226[0m        [94m0.3978[0m     +  8.5319
      2   [36m0.0735[0m   [32m0.4813[0m        [35m0.3648[0m       0.9226        [94m0.2961[0m     +  8.5462
      3   [36m0.1202[0m   [32m0.5924[0m        [35m0.2914[0m       0.9226        [94m0.2728[0m     +  8.7795
      4   [36m0.1407[0m   [32m0.6412[0m        [35m0.2716[0m       0.9226        [94m0.2650[0m     +  9.0839
      5   [36m0.2012[0m   [32m0.6996[0m        [35m0.2600[0m       0.9202        [94m0.2525[0m     +  8.9341
      6   [36m0.2229[0m   [32m0.7094[0m        [35m0.2454[0m       0.9226        [94m0.2517[0m     +  9.0098
      7   [36m0.2238[0m   [32m0.7115[0m        [35m0.2437[0m       0.9214        0.2542        8.9081
      8   0.2183   [32m0.7156[0m        [35m0.2416[0m       0.9214        0.2537        9.1681
      9   0.2188   [32m0.7186[0m        0.2430       0.9202        0.2545        9.0958
     10   0.2212   [32m0.7195[0m        [35m0.2398[0m       0.9178        0.2582        8.8270
     11   0.2224   [32m0.7216[0m        0.2403       0.9214        0.2542        9.1550
     12   [36m0.2355[0m   [32m0.7240[0m        [35m0.2367[0m       0.9202        0.2558        9.0473
     13   0.2304   [32m0.7246[0m        [35m0.2360[0m       0.9226        0.2554        9.3710
     14   0.2325   [32m0.7263[0m        [35m0.2356[0m       0.9178        0.2572        8.9934
     15   [36m0.2371[0m   [32m0.7265[0m        0.2363       0.9202        0.2553        9.0448
Stopping since valid_loss has not improved in the last 10 epochs.
[32m[I 2023-05-02 23:56:16,390][0m Trial 232 finished with value: 0.2516780508076265 and parameters: {'lr': 0.0004609944579492345, 'dropout': 0.5445693215484475, 'd_model_multiplier': 2, 'num_layers': 2, 'n_heads': 4, 'dim_feedforward': 230, 'batch_size': 59, 'pos_encoding': 'fixed', 'activation': 'relu', 'norm': 'LayerNorm', 'optimizer_name': 'PlainRAdam', 'weight_decay': 0.01, 'top_n_features': 49}. Best is trial 117 with value: 0.191397856754288.[0m
[FileBasedDataset] Initializing dataset...
	Examples: 8264
	Features: 35
	Max length: 315
Standard scalar turned ON, loading params from cache
[FileBasedDataset] Dataset initialization complete
  epoch    auprc    auroc    train_loss    valid_acc    valid_loss    cp      dur
-------  -------  -------  ------------  -----------  ------------  ----  -------
      1   [36m0.1993[0m   [32m0.6454[0m        [35m0.3044[0m       [31m0.8017[0m        [94m0.5427[0m     +  19.3316
      2   [36m0.2017[0m   [32m0.6678[0m        [35m0.2928[0m       [31m0.9287[0m        [94m0.3101[0m     +  19.2352
      3   [36m0.2173[0m   [32m0.7282[0m        [35m0.2786[0m       0.9238        [94m0.2611[0m     +  19.6172
      4   0.1870   0.7158        [35m0.2734[0m       0.9287        [94m0.2242[0m     +  19.5387
      5   0.2148   [32m0.7289[0m        [35m0.2701[0m       0.9093        0.2545        19.6766
      6   0.2027   [32m0.7341[0m        [35m0.2647[0m       0.9214        0.2395        19.4981
      7   0.2151   0.7341        [35m0.2639[0m       0.9154        0.2544        19.6239
      8   0.1976   [32m0.7421[0m        [35m0.2593[0m       0.9226        0.2331        19.4474
      9   0.1936   [32m0.7496[0m        [35m0.2527[0m       0.9238        0.2297        19.5504
     10   0.1906   [32m0.7502[0m        [35m0.2508[0m       0.9250        0.2352        19.3653
     11   0.2120   0.7487        [35m0.2495[0m       [31m0.9323[0m        0.2293        19.6433
     12   0.2041   [32m0.7545[0m        [35m0.2470[0m       0.9299        [94m0.2237[0m     +  19.4784
     13   0.1937   0.7520        [35m0.2463[0m       0.9226        0.2288        19.6142
     14   0.2040   [32m0.7639[0m        0.2523       0.9323        [94m0.2231[0m     +  19.6511
     15   0.2095   [32m0.7640[0m        0.2504       0.9238        0.2400        19.6385
     16   0.2105   [32m0.7642[0m        0.2479       0.9323        [94m0.2230[0m     +  19.4556
     17   0.2080   0.7566        [35m0.2409[0m       0.9287        0.2283        19.5646
     18   0.2164   0.7588        [35m0.2401[0m       0.9274        [94m0.2230[0m     +  19.5374
     19   [36m0.2220[0m   0.7600        [35m0.2385[0m       0.9323        [94m0.2196[0m     +  19.4983
     20   0.2023   0.7458        0.2387       0.9299        [94m0.2190[0m     +  19.5723
     21   0.2163   0.7621        [35m0.2359[0m       0.9311        0.2210        19.4590
     22   0.2161   [32m0.7672[0m        0.2392       0.9311        0.2260        19.5940
     23   0.1997   0.7450        0.2374       0.9262        0.2280        19.5140
     24   0.2112   0.7590        0.2368       0.9226        0.2340        19.4385
     25   0.2027   0.7574        0.2362       0.9311        0.2223        19.3853
     26   0.2141   0.7492        [35m0.2351[0m       [31m0.9347[0m        0.2192        19.5596
     27   0.2159   0.7604        0.2400       0.9323        0.2250        20.9308
     28   0.2175   0.7625        0.2391       [31m0.9359[0m        0.2272        19.5950
     29   0.2189   0.7556        [35m0.2343[0m       0.9335        0.2231        19.5394
Stopping since valid_loss has not improved in the last 10 epochs.
