[32m[I 2023-05-03 01:49:13,476][0m Trial 248 finished with value: 0.2713102595486477 and parameters: {'lr': 0.0002948605179082168, 'dropout': 0.4721155131035161, 'd_model_multiplier': 8, 'num_layers': 3, 'n_heads': 32, 'dim_feedforward': 489, 'batch_size': 11, 'pos_encoding': 'learnable', 'activation': 'gelu', 'norm': 'BatchNorm', 'optimizer_name': 'PlainRAdam', 'weight_decay': 0.1, 'top_n_features': 99}. Best is trial 246 with value: 0.16447311791139763.[0m
[FileBasedDataset] Initializing dataset...
	Examples: 8264
	Features: 19
	Max length: 315
Standard scalar turned ON, loading params from cache
[FileBasedDataset] Dataset initialization complete
  epoch    auprc    auroc    train_loss    valid_acc    valid_loss    cp      dur
-------  -------  -------  ------------  -----------  ------------  ----  -------
      1   [36m0.2923[0m   [32m0.7786[0m        [35m0.2675[0m       [31m0.8561[0m        [94m0.4011[0m     +  17.4893
      2   0.1727   0.6259        [35m0.2555[0m       0.2624        0.7458        17.4579
      3   0.1886   0.6707        0.2612       0.8102        0.5309        17.4612
      4   0.2374   [32m0.7908[0m        0.2634       [31m0.9274[0m        [94m0.2682[0m     +  17.6301
      5   0.2439   0.7295        0.2616       0.9262        [94m0.2577[0m     +  17.6882
      6   0.2782   0.7397        [35m0.2482[0m       0.9250        0.2597        17.6743
      7   0.2320   0.7118        [35m0.2477[0m       0.9226        0.2598        17.5964
      8   0.2794   0.7297        [35m0.2429[0m       0.9250        [94m0.2455[0m     +  17.7004
      9   0.2791   0.7455        0.2433       0.9250        0.2466        17.6978
     10   0.2786   0.7737        [35m0.2422[0m       0.9274        [94m0.2407[0m     +  18.1271
     11   [36m0.3063[0m   [32m0.8050[0m        0.2429       0.9250        [94m0.2338[0m     +  17.7117
     12   [36m0.3278[0m   0.7979        0.2531       0.9262        [94m0.2338[0m     +  17.7628
     13   0.3123   [32m0.8292[0m        0.2583       0.9250        0.2380        17.7111
     14   0.3117   0.8059        0.2937       0.9238        [94m0.2325[0m     +  17.7327
     15   0.2890   0.8106        0.2670       0.9274        [94m0.2265[0m     +  17.6446
     16   0.3014   0.7906        0.2522       0.9250        0.2360        17.6382
     17   0.2428   0.7699        0.2607       0.9238        0.2390        17.5761
     18   0.3080   0.7954        0.2524       0.9250        0.2383        17.7508
     19   0.3194   0.8035        0.2687       0.9250        0.2351        17.5914
     20   0.2986   0.8045        0.2486       0.9250        0.2322        17.5505
     21   0.3029   0.8260        0.2512       0.9226        0.2274        17.6572
     22   0.3179   0.8010        0.2554       0.9250        0.2339        17.6659
     23   0.3134   0.8038        0.2445       0.9250        0.2296        17.6788
     24   [36m0.3315[0m   0.8137        [35m0.2393[0m       0.9262        0.2300        17.5559
     25   0.3275   0.8177        0.2523       0.9274        [94m0.2214[0m     +  17.6975
     26   0.3086   0.7909        0.2482       [31m0.9287[0m        0.2370        17.7380
     27   [36m0.3388[0m   0.8260        0.2452       0.9287        0.2265        17.6583
     28   0.3308   0.8174        [35m0.2366[0m       0.9274        0.2271        17.4755
     29   0.3220   0.8190        0.2389       0.9274        0.2292        17.5817
     30   0.3194   0.8056        0.2412       0.9274        0.2305        17.5708
     31   0.3246   0.8177        [35m0.2329[0m       0.9274        0.2284        17.5354
     32   0.3250   0.8228        0.2391       0.9262        0.2264        17.8233
     33   0.3172   0.8173        0.2358       0.9274        0.2271        17.5432
     34   0.3069   0.8198        0.2331       0.9262        0.2252        17.7006
Stopping since valid_loss has not improved in the last 10 epochs.
[32m[I 2023-05-03 01:59:32,904][0m Trial 249 finished with value: 0.22144529767145268 and parameters: {'lr': 0.0012795200173388323, 'dropout': 0.45371084080273677, 'd_model_multiplier': 8, 'num_layers': 3, 'n_heads': 32, 'dim_feedforward': 283, 'batch_size': 29, 'pos_encoding': 'fixed', 'activation': 'gelu', 'norm': 'BatchNorm', 'optimizer_name': 'PlainRAdam', 'weight_decay': 0.1, 'top_n_features': 19}. Best is trial 246 with value: 0.16447311791139763.[0m
[FileBasedDataset] Initializing dataset...
	Examples: 8264
	Features: 135
	Max length: 315
Standard scalar turned ON, loading params from cache
[FileBasedDataset] Dataset initialization complete
  epoch    auprc    auroc    train_loss    valid_acc    valid_loss    cp      dur
-------  -------  -------  ------------  -----------  ------------  ----  -------
      1   [36m0.1823[0m   [32m0.6335[0m        [35m0.7129[0m       [31m0.4196[0m        [94m0.6974[0m     +  18.0980
      2   [36m0.1916[0m   [32m0.6439[0m        [35m0.7119[0m       0.4099        0.6978        18.5731
      3   [36m0.1990[0m   [32m0.6564[0m        [35m0.7074[0m       0.4123        0.6981        18.4091
      4   0.1828   0.6260        [35m0.7021[0m       [31m0.4921[0m        [94m0.6941[0m     +  18.2487
      5   0.1930   0.6367        [35m0.6928[0m       0.4837        0.6945        18.3165
      6   0.1865   0.6314        [35m0.6897[0m       [31m0.5707[0m        [94m0.6907[0m     +  18.2768
      7   0.1675   0.5989        [35m0.6835[0m       [31m0.5768[0m        [94m0.6904[0m     +  18.3690
      8   0.1733   0.6118        [35m0.6783[0m       0.5538        0.6913        18.2801
      9   0.1697   0.5966        [35m0.6710[0m       [31m0.6554[0m        [94m0.6873[0m     +  18.3952
     10   0.1749   0.5978        [35m0.6648[0m       [31m0.6566[0m        [94m0.6873[0m     +  18.3150
     11   0.1609   0.5867        [35m0.6598[0m       [31m0.7110[0m        [94m0.6852[0m     +  18.2442
     12   0.1483   0.5625        [35m0.6517[0m       [31m0.7666[0m        [94m0.6821[0m     +  18.3656
     13   0.1614   0.5834        [35m0.6478[0m       0.7582        0.6826        18.3090
     14   0.1422   0.5583        [35m0.6410[0m       [31m0.7884[0m        [94m0.6805[0m     +  18.3306
     15   0.1386   0.5480        [35m0.6351[0m       [31m0.8065[0m        [94m0.6794[0m     +  18.3322
     16   0.1377   0.5445        [35m0.6271[0m       0.7981        0.6797        18.3510
     17   0.1315   0.5337        [35m0.6245[0m       [31m0.8501[0m        [94m0.6765[0m     +  18.2643
     18   0.1358   0.5370        [35m0.6157[0m       0.8476        [94m0.6762[0m     +  18.3152
     19   0.1328   0.5258        [35m0.6111[0m       [31m0.8694[0m        [94m0.6740[0m     +  18.2734
     20   0.1306   0.5224        [35m0.6049[0m       [31m0.8718[0m        0.6744        18.4387
     21   0.1251   0.5104        [35m0.5984[0m       [31m0.8936[0m        [94m0.6710[0m     +  18.3546
     22   0.1158   0.4912        [35m0.5949[0m       [31m0.8948[0m        [94m0.6694[0m     +  18.2793
     23   0.1077   0.4803        [35m0.5895[0m       [31m0.9033[0m        [94m0.6681[0m     +  18.3085
     24   0.1075   0.4872        [35m0.5863[0m       [31m0.9057[0m        [94m0.6658[0m     +  18.4690
     25   0.1011   0.4582        [35m0.5805[0m       0.9045        0.6667        18.3504
     26   0.1136   0.4900        [35m0.5770[0m       0.9045        0.6665        18.4025
     27   0.1010   0.4689        [35m0.5709[0m       0.9057        [94m0.6628[0m     +  18.2388
     28   0.1066   0.4678        [35m0.5659[0m       [31m0.9081[0m        0.6629        18.3736
     29   0.1032   0.4592        [35m0.5611[0m       0.9081        [94m0.6620[0m     +  18.3525
     30   0.1012   0.4554        [35m0.5565[0m       0.9069        [94m0.6603[0m     +  18.4399
     31   0.0948   0.4404        [35m0.5505[0m       0.9081        [94m0.6592[0m     +  18.3265
     32   0.1017   0.4561        [35m0.5462[0m       0.9081        0.6599        18.4711
     33   0.1010   0.4532        [35m0.5414[0m       [31m0.9093[0m        [94m0.6568[0m     +  18.4518
     34   0.0889   0.4192        [35m0.5379[0m       [31m0.9117[0m        0.6573        18.2964
     35   0.0892   0.4277        [35m0.5336[0m       [31m0.9129[0m        [94m0.6532[0m     +  18.4644
     36   0.0814   0.4099        [35m0.5328[0m       0.9129        [94m0.6510[0m     +  18.3582
     37   0.0811   0.4092        [35m0.5253[0m       0.9117        [94m0.6508[0m     +  18.3838
     38   0.0879   0.4252        [35m0.5200[0m       0.9129        [94m0.6482[0m     +  18.4800
     39   0.0826   0.4075        [35m0.5177[0m       0.9129        [94m0.6472[0m     +  18.4822
     40   0.0814   0.4133        [35m0.5141[0m       0.9129        [94m0.6452[0m     +  18.2958
     41   0.0796   0.4055        [35m0.5092[0m       0.9129        0.6463        18.4019
     42   0.0789   0.3977        [35m0.5051[0m       0.9129        [94m0.6445[0m     +  18.3634
     43   0.0783   0.3964        [35m0.5037[0m       0.9129        0.6447        18.5183
     44   0.0760   0.3897        [35m0.4986[0m       0.9129        [94m0.6435[0m     +  18.4549
     45   0.0764   0.3939        [35m0.4961[0m       0.9129        [94m0.6412[0m     +  18.3487
     46   0.0747   0.3839        [35m0.4934[0m       0.9129        [94m0.6385[0m     +  18.2900
     47   0.0745   0.3744        [35m0.4889[0m       0.9129        [94m0.6385[0m     +  18.2065
     48   0.0756   0.3818        [35m0.4839[0m       0.9129        [94m0.6370[0m     +  18.2772
     49   0.0760   0.3843        [35m0.4820[0m       0.9129        [94m0.6325[0m     +  18.5051
     50   0.0758   0.3864        [35m0.4778[0m       0.9129        0.6357        18.2823
[32m[I 2023-05-03 02:14:57,804][0m Trial 250 finished with value: 0.6324968990997074 and parameters: {'lr': 1.497203087526739e-08, 'dropout': 0.5103886506771755, 'd_model_multiplier': 8, 'num_layers': 3, 'n_heads': 32, 'dim_feedforward': 394, 'batch_size': 17, 'pos_encoding': 'fixed', 'activation': 'gelu', 'norm': 'BatchNorm', 'optimizer_name': 'PlainRAdam', 'weight_decay': 0.1, 'top_n_features': 135}. Best is trial 246 with value: 0.16447311791139763.[0m
[FileBasedDataset] Initializing dataset...
	Examples: 8264
	Features: 27
	Max length: 315
Standard scalar turned ON, loading params from cache
[FileBasedDataset] Dataset initialization complete
  epoch    auprc    auroc    train_loss    valid_acc    valid_loss    cp      dur
-------  -------  -------  ------------  -----------  ------------  ----  -------
      1   [36m0.2276[0m   [32m0.7031[0m        [35m0.2812[0m       [31m0.8730[0m        [94m0.4763[0m     +  20.3816
      2   0.2126   [32m0.7259[0m        [35m0.2687[0m       0.8380        0.4987        20.2729
      3   0.2193   [32m0.7308[0m        [35m0.2603[0m       0.7944        0.5339        20.3644
      4   0.1994   0.7304        [35m0.2589[0m       [31m0.8972[0m        [94m0.3393[0m     +  20.4830
      5   0.2009   0.7173        [35m0.2491[0m       0.8585        [94m0.3261[0m     +  20.3791
      6   0.2222   0.7233        0.2554       [31m0.9069[0m        [94m0.2724[0m     +  20.6014
      7   0.2239   0.7299        0.2649       [31m0.9117[0m        [94m0.2699[0m     +  20.3662
      8   0.2194   0.7266        0.2581       0.9045        0.2712        20.1611
      9   0.2268   0.7262        0.2598       0.9081        0.2756        20.3330
     10   [36m0.2346[0m   0.7216        0.2581       0.9117        0.2722        20.3661
     11   0.2166   0.7121        0.2572       0.9033        0.2812        20.4684
     12   [36m0.2385[0m   0.7221        0.2499       [31m0.9154[0m        0.2735        20.4237
     13   [36m0.2446[0m   0.7185        0.2495       0.9057        0.2766        20.2752
     14   0.2402   0.7213        [35m0.2426[0m       0.8682        0.3222        20.1927
     15   0.2365   0.7187        [35m0.2398[0m       0.9045        0.2784        20.2042
     16   0.2350   0.7161        [35m0.2381[0m       0.9069        0.2731        20.1657
     17   0.2436   0.7217        [35m0.2371[0m       [31m0.9166[0m        [94m0.2688[0m     +  20.2829
     18   0.2374   0.7203        [35m0.2363[0m       0.9117        0.2739        20.3704
     19   0.2314   0.7201        0.2373       0.9117        0.2707        20.1529
     20   0.2399   0.7265        [35m0.2340[0m       0.9069        0.2720        20.3600
     21   0.2403   0.7224        0.2344       0.9141        0.2705        20.3524
     22   0.2408   0.7228        [35m0.2332[0m       0.9154        [94m0.2687[0m     +  20.3068
     23   [36m0.2510[0m   0.7303        [35m0.2332[0m       0.9166        [94m0.2664[0m     +  20.3167
     24   0.2315   0.7225        [35m0.2305[0m       0.9141        0.2709        20.4016
     25   0.2405   0.7268        0.2340       0.9141        0.2719        20.3828
     26   0.2465   0.7273        0.2344       0.9105        0.2686        20.3529
     27   0.2424   0.7249        0.2321       0.9141        0.2695        20.4032
     28   0.2422   0.7186        0.2329       0.9093        0.2735        20.3538
     29   0.2419   0.7269        0.2347       0.9129        0.2690        20.4191
     30   [36m0.2695[0m   0.7285        0.2318       0.9129        0.2685        20.4253
     31   0.2376   0.7276        0.2349       0.9141        0.2700        20.4137
     32   [36m0.2739[0m   0.7299        0.2331       [31m0.9178[0m        0.2686        20.3020
     33   0.2554   0.7284        0.2322       0.9141        [94m0.2662[0m     +  20.4130
     34   0.2631   [32m0.7326[0m        0.2313       0.9154        0.2686        20.3984
     35   0.2518   [32m0.7329[0m        0.2311       0.9129        0.2708        20.2938
     36   0.2460   0.7255        [35m0.2300[0m       0.9129        0.2720        20.3191
     37   0.2441   0.7301        0.2312       0.9069        0.2797        20.2042
     38   0.2423   0.7311        [35m0.2294[0m       0.9154        0.2721        20.1844
     39   0.2604   0.7326        0.2304       0.9166        0.2698        20.2685
     40   0.2401   0.7222        0.2328       0.9154        0.2754        20.4671
     41   0.2285   0.7203        0.2308       0.9141        0.2759        20.2322
     42   0.2277   0.7047        0.2313       0.9154        0.2796        20.3745
Stopping since valid_loss has not improved in the last 10 epochs.
[32m[I 2023-05-03 02:29:33,959][0m Trial 251 finished with value: 0.26621051912872795 and parameters: {'lr': 0.0022751821495755778, 'dropout': 0.46282260328953606, 'd_model_multiplier': 4, 'num_layers': 4, 'n_heads': 32, 'dim_feedforward': 136, 'batch_size': 24, 'pos_encoding': 'learnable', 'activation': 'gelu', 'norm': 'BatchNorm', 'optimizer_name': 'PlainRAdam', 'weight_decay': 0.1, 'top_n_features': 27}. Best is trial 246 with value: 0.16447311791139763.[0m
[FileBasedDataset] Initializing dataset...
	Examples: 8264
	Features: 131
	Max length: 315
Standard scalar turned ON, loading params from cache
[FileBasedDataset] Dataset initialization complete
  epoch    auprc    auroc    train_loss    valid_acc    valid_loss    cp      dur
-------  -------  -------  ------------  -----------  ------------  ----  -------
      1   [36m0.1324[0m   [32m0.7170[0m        [35m0.3433[0m       [31m0.7908[0m        [94m0.4351[0m     +  19.8119
      2   [36m0.2430[0m   [32m0.7251[0m        [35m0.3185[0m       [31m0.8549[0m        0.4517        20.3399
      3   0.1933   [32m0.7581[0m        [35m0.3068[0m       [31m0.9262[0m        [94m0.3074[0m     +  20.0919
      4   0.1926   0.6884        0.3945       0.6106        1.1668        20.4909
      5   0.0866   0.3755        0.3467       0.9117        0.3388        20.1251
      6   0.0526   0.2891        0.3357       [31m0.9287[0m        0.3792        20.0781
      7   0.1969   0.7240        0.3288       0.8742        0.5598        20.3505
      8   0.1551   0.6570        0.3218       0.8875        0.4169        20.1881
      9   0.1836   0.7268        [35m0.2939[0m       0.8331        0.3931        20.1186
     10   0.2306   0.7007        [35m0.2912[0m       0.8464        0.3927        20.2232
     11   0.2175   0.7411        0.2919       0.8960        [94m0.2955[0m     +  20.5057
     12   [36m0.2453[0m   0.7533        [35m0.2704[0m       0.9262        [94m0.2801[0m     +  20.0451
     13   0.2245   [32m0.7719[0m        [35m0.2651[0m       0.9274        [94m0.2553[0m     +  20.0266
     14   0.1910   0.7301        [35m0.2598[0m       0.8658        0.3138        20.1455
     15   0.2199   0.7577        [35m0.2589[0m       0.9238        [94m0.2517[0m     +  20.2978
     16   0.2242   0.7470        [35m0.2575[0m       0.9262        0.2775        20.1665
     17   0.2379   0.7529        [35m0.2528[0m       0.9238        0.2796        20.3531
     18   [36m0.2484[0m   [32m0.7842[0m        [35m0.2484[0m       0.8984        0.2990        20.4535
     19   0.2376   0.7839        [35m0.2455[0m       0.9250        [94m0.2494[0m     +  20.1403
     20   [36m0.2697[0m   [32m0.8067[0m        0.2460       0.9250        [94m0.2141[0m     +  20.2820
     21   0.2658   [32m0.8086[0m        [35m0.2447[0m       0.9262        0.2261        20.0989
     22   [36m0.2770[0m   0.8051        [35m0.2422[0m       0.9250        0.2190        20.1375
     23   0.2673   0.7886        [35m0.2399[0m       0.9274        0.2172        20.1686
     24   [36m0.2803[0m   0.8057        [35m0.2386[0m       0.9178        0.2341        20.0370
     25   [36m0.2938[0m   [32m0.8199[0m        [35m0.2374[0m       0.9154        0.2278        20.2054
     26   0.2813   0.8089        0.2380       0.9105        0.2534        20.0004
     27   0.2795   0.8141        [35m0.2352[0m       0.9178        0.2410        20.0085
     28   0.2714   0.7991        [35m0.2350[0m       0.9250        0.2211        20.1712
     29   0.2876   0.8109        0.2362       0.9057        0.2385        20.2743
Stopping since valid_loss has not improved in the last 10 epochs.
[32m[I 2023-05-03 02:39:41,874][0m Trial 252 finished with value: 0.21408839705777427 and parameters: {'lr': 0.0008792039851638957, 'dropout': 0.30905112055560696, 'd_model_multiplier': 8, 'num_layers': 3, 'n_heads': 32, 'dim_feedforward': 422, 'batch_size': 8, 'pos_encoding': 'fixed', 'activation': 'gelu', 'norm': 'BatchNorm', 'optimizer_name': 'PlainRAdam', 'weight_decay': 0.1, 'top_n_features': 131}. Best is trial 246 with value: 0.16447311791139763.[0m
[FileBasedDataset] Initializing dataset...
	Examples: 8264
	Features: 117
	Max length: 315
Standard scalar turned ON, loading params from cache
[FileBasedDataset] Dataset initialization complete
  epoch    auprc    auroc    train_loss    valid_acc    valid_loss    cp      dur
-------  -------  -------  ------------  -----------  ------------  ----  -------
      1   [36m0.2544[0m   [32m0.7636[0m        [35m0.2931[0m       [31m0.9166[0m        [94m0.3037[0m     +  21.7821
      2   0.1983   0.7233        [35m0.2559[0m       [31m0.9238[0m        [94m0.2865[0m     +  21.7563
      3   0.1885   0.6916        [35m0.2548[0m       [31m0.9250[0m        [94m0.2817[0m     +  21.6696
      4   0.1805   0.6689        [35m0.2435[0m       0.9226        [94m0.2772[0m     +  21.8448
      5   0.1926   0.6773        0.2453       0.9214        0.2880        21.7862
      6   0.2468   0.7000        0.2487       0.9178        0.2955        21.8500
      7   0.1551   0.6128        [35m0.2433[0m       0.9069        0.3724        21.8096
      8   0.1524   0.5735        0.2462       0.9081        0.4187        21.8230
      9   0.1733   0.5926        0.2475       0.9129        0.4183        21.8658
     10   0.2138   0.6462        0.2433       [31m0.9287[0m        0.3590        21.8556
     11   0.1688   0.5747        [35m0.2413[0m       0.9202        0.3507        21.7268
     12   0.1674   0.5774        0.2432       0.9262        0.3142        21.9605
     13   0.1067   0.4435        0.2426       0.9287        0.3585        21.6334
Stopping since valid_loss has not improved in the last 10 epochs.
